A1: 股票代码 | B1: 股票简称 | C1: 基本每股收益(元)2021.09.30 | D1: 趋势 | O1: 波动收缩幅度 | AH1: 成交量行为 | AJ1: 价格行为(得分应大于60%) | AM1: 结论 | AN1: 更新时间 | AO1: 是否值得分析
D2: 200日均线 | E2: 150日均线 | F2: 50日均线 | G2: 各均线斜率是否朝上 | H2: 当前股价 | I2: 52周内最低点 | J2: 52周内最高点 | K2: 最高点前8周收盘价 | L2: 当前股价相对于最低点百分比(至少高出25%) | M2: 当前股价相对于最高点百分比(25%内最好) | N2: 最高点前8周股价相对于最高点百分比 | O2: 技术足迹 | AH2: 不同收盘表现时交易量情况(好的收盘时，交易量是否增大，坏的收盘时，交易量是否萎缩) | AI2: 成交量收缩情况(最后的价格收缩期间的成交量应低于50天的平均水平且有一到两天交易量极低) | AJ2: 支撑位和压力位是否同步升高(40%) | AK2: 是否有网球行为出现(40%) | AL2: 上涨天数是否大于下跌天数(20%)
O3: 支撑位1 | P3: 阻力位2 | Q3: 支撑位2 | R3: 阻力位3 | S3: 支撑位3 | T3: 阻力位4 | U3: 支撑位4 | V3: 阻力位5 | W3: 支撑位5 | X3: 阻力位6 | Y3: 支撑位6 | Z3: 时间周期 | AA3: 收缩量1 | AB3: 收缩量2 | AC3: 收缩量3 | AD3: 收缩量4 | AE3: 收缩量5 | AF3: 收缩量6 | AG3: 收缩数量(至少大于3T)
A4: 600519.SH | B4: 贵州茅台 | C4: 29.67 | AO4: 否
A5: 603444.SH | B5: 吉比特 | C5: 16.77 | AO5: 否
A6: 002932.SZ | B6: 明德生物 | C6: 10.68 | D6: 68.959999999999994 | E6: 71.730000000000004 | F6: 80 | H6: 77.5 | AM6: 不宜入场（当前股价小于50日均线,应观察2w） | AN6: 44595 | AO6: 是
A7: 000661.SZ | B7: 长春高新 | C7: 7.78 | AO7: 否
A8: 600309.SH | B8: 万华化学 | C8: 6.22 | AO8: 否
A9: 603185.SH | B9: 上机数控 | C9: 5.25 | AO9: 否
A10: 603260.SH | B10: 合盛硅业 | C10: 5.09 | D10: 122.45999999999999 | E10: 130 | F10: 129 | AM10: 不宜入场（50日均线小于150日均线,应观察4w） | AN10: 44595 | AO10: 是
A11: 002304.SZ | B11: 洋河股份 | C11: 4.82 | AO11: 否
A12: 601318.SH | B12: 中国平安 | C12: 4.63 | AO12: 否
A13: 000858.SZ | B13: 五粮液 | C13: 4.46 | AO13: 否
A14: 601888.SH | B14: 中国中免 | C14: 4.35 | AO14: 否
A15: 600955.SH | B15: 维远股份 | C15: 4.2999999999999998 | D15: 44.520000000000003 | E15: 44.810000000000002 | F15: 45.060000000000002 | H15: 41.460000000000001 | Z15: 14w | AA15: =(J15-O15)/J15 -> #DIV/0! | AB15: =(P15-Q15)/P15 -> #DIV/0! | AC15: =(R15-S15)/R15 -> #DIV/0! | AM15: 不宜入场（当前股价小于200日均线，应持续观察3w） | AN15: 44586 | AO15: 是
A16: 000568.SZ | B16: 泸州老窖 | C16: 4.28 | D16: 227.58000000000001 | E16: 228.38999999999999 | F16: 235.47999999999999 | H16: 216.31 | AM16: 不宜入场(当前股价低于200日均线，应持续观察4w) | AN16: 44595 | AO16: 是
A17: 600941.SH | B17: 中国移动 | C17: 4.25 | D17: 57.87 | E17: 57.86 | AM17: 不宜入场(150日均线低于200日均线，应持续观察8w) | AN17: 44595 | AO17: 是
A18: 600585.SH | B18: 海螺水泥 | C18: 4.23 | AO18: 否
A19: 601919.SH | B19: 中远海控 | C19: 4.23 | D19: 17.28 | E19: 17.61 | F19: 17.69 | H19: 16.12 | AM19: 不宜入场(当前股价低于200日均线，应持续观察4w) | AN19: 44595 | AO19: 是
A20: 603501.SH | B20: 韦尔股份 | C20: 4.06 | AO20: 否
A21: 600809.SH | B21: 山西汾酒 | C21: 4.02 | AO21: 否
A22: 000596.SZ | B22: 古井贡酒 | C22: 3.85 | AO22: 否
A23: 601336.SH | B23: 新华保险 | C23: 3.83 | AO23: 否
A24: 605168.SH | B24: 三人行 | C24: 3.74 | D24: 142.04 | E24: 144.40000000000001 | F24: 167.07 | H24: 188.45 | I24: 104 | J24: 240 | K24: 120.45 | L24: =(H24-I24)/I24 -> 0.81201923076923066 | M24: =(J24-H24)/J24 -> 0.21479166666666671 | N24: =(J24-K24)/K24 -> 0.99252801992528017 | O24: 187 | P24: 218.88 | Q24: 187.80000000000001 | Z24: 2w | AA24: =(J24-O24)/J24 -> 0.22083333333333333 | AB24: =(P24-Q24)/P24 -> 0.14199561403508765 | AM24: 不宜入场(收缩幅度不够，应持续观察1w) | AN24: 44595 | AO24: 是
A25: 603195.SH | B25: 公牛集团 | C25: 3.68 | AO25: 否
A26: 603026.SH | B26: 石大胜华 | C26: 3.66 | AO26: 否
A27: 600036.SH | B27: 招商银行 | C27: 3.62 | AO27: 否
A28: 603489.SH | B28: 八方股份 | C28: 3.61 | AO28: 否
A29: 603882.SH | B29: 金域医学 | C29: 3.6000000000000001 | AO29: 否
A30: 603833.SH | B30: 欧派家居 | C30: 3.48 | AO30: 否
A31: 000333.SZ | B31: 美的集团 | C31: 3.41 | AO31: 否
A32: 002382.SZ | B32: 蓝帆医疗 | C32: 3.41 | AO32: 否
A33: 600436.SH | B33: 片仔癀 | C33: 3.33 | D33: 397.10000000000002 | E33: 404.31999999999999 | F33: 411.70999999999998 | H33: 357.24000000000001 | AM33: 不宜入场(当前股价低于200日均线，应持续观察4w) | AN33: 44595 | AO33: 是
A34: 600486.SH | B34: 扬农化工 | C34: 3.28 | D34: 122.36 | E34: 123.16 | F34: 125.16 | H34: 117.16 | AM34: 不宜入场(当前股价低于200日均线，应持续观察4w) | AN34: 44595 | AO34: 是
A35: 002978.SZ | B35: 安宁股份 | C35: 2.97 | AO35: 否
A36: 601166.SH | B36: 兴业银行 | C36: 2.95 | AO36: 否
A37: 600702.SH | B37: 舍得酒业 | C37: 2.92 | D37: 189.47 | E37: 199.12 | F37: 211.91999999999999 | H37: 185.25 | AM37: 不宜入场(当前股价低于200日均线，应持续观察4w) | AN37: 44595 | AO37: 是
A38: 002821.SZ | B38: 凯莱英 | C38: 2.88 | D38: 383.64999999999998 | E38: 391.41000000000003 | F38: 391.43000000000001 | H38: 325.48000000000002 | AM38: 不宜入场(当前股价低于200日均线，应持续观察4w) | AN38: 44595 | AO38: 是
A39: 600612.SH | B39: 老凤祥 | C39: 2.86 | AO39: 否
A40: 605266.SH | B40: 健之佳 | C40: 2.85 | AO40: 否
A41: 603267.SH | B41: 鸿远电子 | C41: 2.84 | D41: 152.28999999999999 | E41: 156.12 | F41: 164.94999999999999 | H41: 162.71000000000001 | AM41: 不宜入场（当前股价小于50日均线,应观察2w） | AN41: 44595 | AO41: 是
A42: 603208.SH | B42: 江山欧派 | C42: 2.77 | AO42: 否
A43: 000651.SZ | B43: 格力电器 | C43: 2.71 | AO43: 否
A44: 601233.SH | B44: 桐昆股份 | C44: 2.71 | AO44: 否
A45: 603661.SH | B45: 恒林股份 | C45: 2.69 | AO45: 否
A46: 600600.SH | B46: 青岛啤酒 | C46: 2.67 | D46: 93.430000000000007 | E46: 94.180000000000007 | F46: 95.579999999999998 | H46: 92.209999999999994 | AM46: 不宜入场(当前股价小于200日均线，应持续观察4w) | AN46: 44595 | AO46: 是
A47: 600426.SH | B47: 华鲁恒升 | C47: 2.66 | AO47: 是
A48: 601799.SH | B48: 星宇股份 | C48: 2.65 | AO48: 否
A49: 605117.SH | B49: 德业股份 | C49: 2.64 | D49: 199.28999999999999 | E49: 219.56 | F49: 256.51999999999998 | H49: 260.67000000000002 | I49: 38.490000000000002 | J49: 345.99000000000001 | K49: 197.47999999999999 | L49: =(H49-I49)/I49 -> 5.7724084177708495 | M49: =(J49-H49)/J49 -> 0.24659672244862565 | N49: =(J49-K49)/K49 -> 0.75202552157180491 | O49: 222.55000000000001 | P49: 286.98000000000002 | Q49: 254.38999999999999 | Z49: 12w | AA49: =(J49-O49)/J49 -> 0.35677331714789445 | AB49: =(P49-Q49)/P49 -> 0.11356192069133748 | AM49: 暂不宜入场（收缩幅度不够，应继续观察1w） | AN49: 44595 | AO49: 是
A50: 605499.SH | B50: 东鹏饮料 | C50: 2.64 | AO50: 是
A51: 601155.SH | B51: 新城控股 | C51: 2.61 | AO51: 否
A52: 600295.SH | B52: 鄂尔多斯 | C52: 2.6000000000000001 | AO52: 是
A53: 605369.SH | B53: 拱东医疗 | C53: 2.57 | D53: 98.519999999999996 | E53: 104.53 | F53: 120.06999999999999 | H53: 147.87 | I53: 38.579999999999998 | J53: 155.28999999999999 | K53: 93.230000000000004 | L53: =(H53-I53)/I53 -> 2.8328149300155525 | M53: =(J53-H53)/J53 -> 4.7781569965870227e-02 | N53: =(J53-K53)/K53 -> 0.6656655582966855 | O53: 132.16 | Z53: 1w | AA53: =(J53-O53)/J53 -> 0.14894713117393263 | AB53: =(P53-Q53)/P53 -> #DIV/0! | AC53: =(R53-S53)/R53 -> #DIV/0! | AD53: =(T53-U53)/T53 -> #DIV/0! | AE53: =(V53-W53)/V53 -> #DIV/0! | AM53: 暂不宜入场（收缩幅度不够，应继续观察1w） | AN53: 44586 | AO53: 是
A54: 000028.SZ | B54: 国药一致 | C54: 2.51 | AO54: 否
A55: 603986.SH | B55: 兆易创新 | C55: 2.5 | D55: 157.03999999999999 | E55: 159.40000000000001 | F55: 160.36000000000001 | H55: 139.09999999999999 | AM55: 不宜入场(当前股价低于200日均线，应持续观察4w) | AN55: 44595 | AO55: 是
A56: 002648.SZ | B56: 卫星化学 | C56: 2.48 | AO56: 是
A57: 603102.SH | B57: 百合股份 | C57: 2.46 | AO57: 是
A58: 600563.SH | B58: 法拉电子 | C58: 2.45 | D58: 182.12 | E58: 191.81999999999999 | F58: 208.28999999999999 | H58: 196.30000000000001 | AM58: 不宜入场(当前股价小于50日均线，应持续观察2w) | AN58: 44595 | AO58: 是
A59: 002913.SZ | B59: 奥士康 | C59: 2.42 | D59: 76.930000000000007 | E59: 77.819999999999993 | F59: 75.930000000000007 | AM59: 不宜入场(50日均线小于200日均线，应持续观察6w) | AN59: 44595 | AO59: 是
A60: 603129.SH | B60: 春风动力 | C60: 2.42 | D60: 150.36000000000001 | E60: 153.88 | F60: 165.59999999999999 | H60: 149.80000000000001 | I60: 101.8 | J60: 193.58000000000001 | K60: 119.17 | L60: =(H60-I60)/I60 -> 0.47151277013752468 | M60: =(J60-H60)/J60 -> 0.22615972724455005 | N60: =(J60-K60)/K60 -> 0.62440211462616435 | O60: 148.96000000000001 | Z60: 7w | AA60: =(J60-O60)/J60 -> 0.23049901849364604 | AB60: =(P60-Q60)/P60 -> #DIV/0! | AC60: =(R60-S60)/R60 -> #DIV/0! | AD60: =(T60-U60)/T60 -> #DIV/0! | AE60: =(V60-W60)/V60 -> #DIV/0! | AM60: 不宜入场(当前股价低于200日均线，应持续观察3w) | AN60: 44586 | AO60: 是
A61: 603393.SH | B61: 新天然气 | C61: 2.41 | AO61: 是
A62: 000039.SZ | B62: 中集集团 | C62: 2.41 | AO62: 否
A63: 002049.SZ | B63: 紫光国微 | C63: 2.3999999999999999 | D63: 187.83000000000001 | E63: 197.53999999999999 | F63: 215.53 | H63: 214.5 | AM63: 不宜入场(当前股价小于50日均线，应持续观察1w) | AN63: 44595 | AO63: 是
A64: 002142.SZ | B64: 宁波银行 | C64: 2.38 | D64: 36.86 | E64: 36.98 | F64: 38.21 | H64: 39.09 | I64: 30.01 | J64: 41.89 | K64: 33.19 | L64: =(H64-I64)/I64 -> 0.30256581139620131 | M64: =(J64-H64)/J64 -> 6.6841728336118331e-02 | N64: =(J64-K64)/K64 -> 0.26212714673094317 | O64: 30.01 | P64: 40.28 | Q64: 35.87 | Z64: 28w | AA64: =(J64-O64)/J64 -> 0.28359990451181666 | AB64: =(P64-Q64)/P64 -> 0.10948361469712024 | AM64: 暂不宜入场（收缩幅度不够，应继续观察1w） | AN64: 44595 | AO64: 是
A65: 603486.SH | B65: 科沃斯 | C65: 2.38 | AO65: 否
A66: 600188.SH | B66: 兖矿能源 | C66: 2.38 | D66: 21.26 | E66: 22.38 | F66: 24.14 | H66: 23.11 | AM66: 不宜入场(当前股价小于50日均线，应持续观察1w) | AN66: 44595 | AO66: 是
A67: 601601.SH | B67: 中国太保 | C67: 2.36 | AO67: 否
A68: 600694.SH | B68: 大商股份 | C68: 2.25 | AO68: 否
A69: 600141.SH | B69: 兴发集团 | C69: 2.22 | D69: 32.109999999999999 | E69: 34.259999999999998 | F69: 36.159999999999997 | H69: 29.829999999999998 | AM69: 不宜入场（当前股价小于200日均线，应继续观察4w） | AN69: 44595 | AO69: 是
A70: 603599.SH | B70: 广信股份 | C70: 2.22 | D70: 33.659999999999997 | E70: 34.439999999999998 | F70: 37.159999999999997 | H70: 34.5 | AM70: 不宜入场(当前股价小于50日均线，应持续观察1w) | AN70: 44586 | AO70: 是
A71: 000799.SZ | B71: 酒鬼酒 | C71: 2.22 | AO71: 否
A72: 002791.SZ | B72: 坚朗五金 | C72: 2.19 | AO72: 否
A73: 605111.SH | B73: 新洁能 | C73: 2.19 | D73: 159.41 | E73: 163.28 | F73: 171.25999999999999 | H73: 158.72999999999999 | AM73: 不宜入场(当前股价小于200日均线，应持续观察4w) | AN73: 44595 | AO73: 是
A74: 600132.SH | B74: 重庆啤酒 | C74: 2.16 | AO74: 否
A75: 603217.SH | B75: 元利科技 | C75: 2.16 | D75: 38.75 | E75: 40.509999999999998 | F75: 43.670000000000002 | H75: 39 | AM75: 不宜入场(当前股价小于150日均线，应持续观察3w) | AN75: 44595 | AO75: 是
A76: 000581.SZ | B76: 威孚高科 | C76: 2.15 | AO76: 否
A77: 601677.SH | B77: 明泰铝业 | C77: 2.12 | D77: 31.100000000000001 | E77: 32.939999999999998 | F77: 38.399999999999999 | H77: 39.880000000000003 | I77: 13.18 | J77: 45.509999999999998 | K77: 32.5 | L77: =(H77-I77)/I77 -> 2.0257966616084979 | M77: =(J77-H77)/J77 -> 0.12370907492858703 | N77: =(J77-K77)/K77 -> 0.40030769230769225 | O77: 39.149999999999999 | Z77: 3w | AA77: =(J77-O77)/J77 -> 0.13974950560316413 | AB77: =(P77-Q77)/P77 -> #DIV/0! | AC77: =(R77-S77)/R77 -> #DIV/0! | AD77: =(T77-U77)/T77 -> #DIV/0! | AE77: =(V77-W77)/V77 -> #DIV/0! | AH77: 是 | AI77: 是 | AM77: 不宜入场（收缩幅度不够，应继续观察1w） | AN77: 44586 | AO77: 是
A78: 603301.SH | B78: 振德医疗 | C78: 2.12 | AO78: 是
A79: 600729.SH | B79: 重庆百货 | C79: 2.11 | AO79: 否
A80: 002916.SZ | B80: 深南电路 | C80: 2.09 | D80: 100.83 | E80: 102.76000000000001 | F80: 109.81 | H80: 113.84999999999999 | I80: 73.930000000000007 | J80: 126.66 | K80: 82.579999999999998 | L80: =(H80-I80)/I80 -> 0.53997024212092493 | M80: =(J80-H80)/J80 -> 0.10113690194220751 | N80: =(J80-K80)/K80 -> 0.53378542019859532 | O80: 85.5 | P80: 123.73999999999999 | Q80: 108 | R80: 120.36 | S80: 113.15000000000001 | Z80: 18w | AA80: =(J80-O80)/J80 -> 0.32496447181430599 | AB80: =(P80-Q80)/P80 -> 0.12720219815742684 | AC80: =(R80-S80)/R80 -> 5.9903622465935474e-02 | AM80: 不宜入场（成交量行为不太明朗，应继续观察1w） | AN80: 44588 | AO80: 是
A81: 603345.SH | B81: 安井食品 | C81: 2.06 | AO81: 否
A82: 600779.SH | B82: 水井坊 | C82: 2.05 | D82: 116.06 | E82: 119.27 | F82: 117.95 | AM82: 不宜入场（50日均线小于150日均线，应继续观察5w） | AN82: 44595 | AO82: 是
A83: 601088.SH | B83: 中国神华 | C83: 2.05 | D83: 19.82 | E83: 20.25 | F83: 21.52 | H83: 22.780000000000001 | I83: 14.41 | J83: 24.449999999999999 | K83: 18.079999999999998 | L83: =(H83-I83)/I83 -> 0.58084663428174887 | M83: =(J83-H83)/J83 -> 6.8302658486707496e-02 | N83: =(J83-K83)/K83 -> 0.35232300884955758 | O83: 18.57 | P83: 23.260000000000002 | Q83: 21.079999999999998 | R83: 23.359999999999999 | S83: 21.600000000000001 | T83: 23.27 | U83: 21.91 | V83: 23.449999999999999 | W83: 22.18 | X83: 23.510000000000002 | Y83: 22.359999999999999 | Z83: 14w | AA83: =(J83-O83)/J83 -> 0.24049079754601224 | AB83: =(P83-Q83)/P83 -> 9.3723129836629546e-02 | AC83: =(R83-S83)/R83 -> 7.534246575342457e-02 | AD83: =(T83-U83)/T83 -> 5.8444348947142219e-02 | AE83: =(V83-W83)/V83 -> 5.4157782515991452e-02 | AF83: =(X83-Y83)/X83 -> 4.8915355168013701e-02 | AH83: 是 | AI83: 是 | AJ83: 是 | AK83: 是 | AM83: 可以入场 | AN83: 44578 | AO83: 是
A84: 000923.SZ | B84: 河钢资源 | C84: 2.05 | AO84: 否
A85: 603836.SH | B85: 海程邦达 | C85: 2.04 | AO85: 是
A86: 605080.SH | B86: 浙江自然 | C86: 2.04 | D86: 62.350000000000001 | E86: 64.719999999999999 | F86: 69.430000000000007 | H86: 67.349999999999994 | AM86: 不宜入场(当前股价小于50日均线，应持续观察2w) | AN86: 44595 | AO86: 是
A87: 600332.SH | B87: 白云山 | C87: 2.04 | AO87: 是
A88: 000672.SZ | B88: 上峰水泥 | C88: 1.98 | AO88: 否
A89: 603799.SH | B89: 华友钴业 | C89: 1.98 | D89: 107.09999999999999 | E89: 109.89 | F89: 109.68000000000001 | AM89: 不宜入场（50日均线小于150日均线，应继续观察5w） | AN89: 44595 | AO89: 是
A90: 002812.SZ | B90: 恩捷股份 | C90: 1.97 | AO90: 是
A91: 603297.SH | B91: 永新光学 | C91: 1.97 | D91: 78.939999999999998 | E91: 85.430000000000007 | F91: 109.17 | H91: 116.90000000000001 | I91: 34.899999999999999 | J91: 138 | K91: 88.890000000000001 | L91: =(H91-I91)/I91 -> 2.3495702005730661 | M91: =(J91-H91)/J91 -> 0.15289855072463765 | N91: =(J91-K91)/K91 -> 0.5524805939925751 | O91: 116.90000000000001 | Z91: 2w | AA91: =(J91-O91)/J91 -> 0.15289855072463765 | AM91: 暂不宜入场（收缩幅度不够，应继续观察1w） | AN91: 44595 | AO91: 是
A92: 603816.SH | B92: 顾家家居 | C92: 1.97 | AO92: 否
A93: 603392.SH | B93: 万泰生物 | C93: 1.96 | D93: 227.09999999999999 | E93: 228.52000000000001 | F93: 227.50999999999999 | AM93: 不宜入场（50日均线小于150日均线，应继续观察5w） | AN93: 44595 | AO93: 是
A94: 600596.SH | B94: 新安股份 | C94: 1.96 | D94: 24.23 | E94: 25.33 | F94: 25.27 | AM94: 不宜入场（50日均线小于150日均线，应继续观察5w） | AN94: 44595 | AO94: 是
A95: 601699.SH | B95: 潞安环能 | C95: 1.95 | D95: 11.57 | E95: 12 | F95: 12.21 | H95: 12.09 | AM95: 不宜入场(当前股价小于50日均线，应持续观察2w) | AN95: 44595 | AO95: 是
A96: 600763.SH | B96: 通策医疗 | C96: 1.93 | AO96: 否
A97: 000538.SZ | B97: 云南白药 | C97: 1.92 | AO97: 否
A98: 603589.SH | B98: 口子窖 | C98: 1.92 | D98: 63.710000000000001 | E98: 64.780000000000001 | F98: 69.010000000000005 | H98: 69.659999999999997 | I98: 47.899999999999999 | J98: 86.489999999999995 | K98: 53.780000000000001 | L98: =(H98-I98)/I98 -> 0.45427974947807931 | M98: =(J98-H98)/J98 -> 0.19458896982310092 | N98: =(J98-K98)/K98 -> 0.60821866865005569 | O98: 62.549999999999997 | Z98: 6w | AA98: =(J98-O98)/J98 -> 0.27679500520291361 | AM98: 暂不宜入场（收缩幅度不够，应继续观察2w） | AN98: 44595 | AO98: 是
A99: 001218.SZ | B99: 丽臣实业 | C99: 1.91 | AO99: 否
A100: 600746.SH | B100: 江苏索普 | C100: 1.91 | AO100: 否
A101: 000830.SZ | B101: 鲁西化工 | C101: 1.89 | AO101: 否
A102: 002841.SZ | B102: 视源股份 | C102: 1.87 | AO102: 否
A103: 603713.SH | B103: 密尔克卫 | C103: 1.87 | AO103: 是
A104: 603995.SH | B104: 甬金股份 | C104: 1.87 | D104: 42.229999999999997 | E104: 44.049999999999997 | F104: 49.5 | H104: 56.850000000000001 | I104: 27.579999999999998 | J104: 62.869999999999997 | K104: 47.990000000000002 | L104: =(H104-I104)/I104 -> 1.0612762871646122 | M104: =(J104-H104)/J104 -> 9.5753141402894801e-02 | N104: =(J104-K104)/K104 -> 0.31006459679099801 | O104: 55.799999999999997 | Z104: 3w | AA104: =(J104-O104)/J104 -> 0.11245427071735328 | AB104: =(P104-Q104)/P104 -> #DIV/0! | AC104: =(R104-S104)/R104 -> #DIV/0! | AD104: =(T104-U104)/T104 -> #DIV/0! | AE104: =(V104-W104)/V104 -> #DIV/0! | AG104: 3T | AH104: 是 | AI104: 是 | AJ104: 是 | AK104: 是 | AL104: 否 | AM104: 不宜入场(收缩量不够，应持续观察1w) | AN104: 44586 | AO104: 是
A105: 002601.SZ | B105: 龙佰集团 | C105: 1.86 | AO105: 否
A106: 000733.SZ | B106: 振华科技 | C106: 1.86 | D106: 86.159999999999997 | E106: 91.379999999999995 | F106: 108.56 | H106: 118.52 | I106: 45.359999999999999 | J106: 130.46000000000001 | K106: 107.3 | L106: =(J106-I106)/I106 -> 1.8761022927689597 | M106: =(J106-H106)/J106 -> 9.1522305687567154e-02 | N106: =(J106-K106)/K106 -> 0.21584342963653319 | O106: 114.97 | Z106: 1w | AA106: =(J106-O106)/J106 -> 0.11873371148244678 | AB106: =(P106-Q106)/P106 -> #DIV/0! | AC106: =(R106-S106)/R106 -> #DIV/0! | AD106: =(T106-U106)/T106 -> #DIV/0! | AM106: 不宜入场(收缩量不够，应持续观察1w) | AN106: 44586 | AO106: 是
A107: 605305.SH | B107: 中际联合 | C107: 1.85 | AO107: 是
A108: 002768.SZ | B108: 国恩股份 | C108: 1.82 | AO108: 否
A109: 603605.SH | B109: 珀莱雅 | C109: 1.82 | D109: 184.31 | E109: 187.72999999999999 | F109: 198.81999999999999 | H109: 188.75 | AM109: 不宜入场(当前股价小于50日均线，应持续观察2w) | AN109: 44571 | AO109: 是
A110: 600346.SH | B110: 恒力石化 | C110: 1.81 | AO110: 否
A111: 600810.SH | B111: 神马股份 | C111: 1.8 | AO111: 是
A112: 002030.SZ | B112: 达安基因 | C112: 1.8 | AO112: 否
A113: 603565.SH | B113: 中谷物流 | C113: 1.79 | AO113: 否
A114: 605287.SH | B114: 德才股份 | C114: 1.79 | AO114: 否
A115: 000999.SZ | B115: 华润三九 | C115: 1.78 | AO115: 是
A116: 605123.SH | B116: 派克新材 | C116: 1.77 | D116: 99.290000000000006 | E116: 105.43000000000001 | F116: 125.92 | H116: 116 | AM116: 不宜入场(当前股价小于50日均线，应持续观察2w) | AN116: 44571 | AO116: 是
A117: 002460.SZ | B117: 赣锋锂业 | C117: 1.77 | AO117: 是
A118: 603659.SH | B118: 璞泰来 | C118: 1.77 | D118: 142.18000000000001 | E118: 151.41999999999999 | F118: 164.65000000000001 | H118: 138.55000000000001 | AM118: 不宜入场（当前股价小于200日均线，应继续观察3w） | AN118: 44571 | AO118: 是
A119: 605389.SH | B119: 长龄液压 | C119: 1.77 | AO119: 否
A120: 600389.SH | B120: 江山股份 | C120: 1.77 | AO120: 是
A121: 600104.SH | B121: 上汽集团 | C121: 1.76 | AO121: 否
A122: 002900.SZ | B122: 哈三联 | C122: 1.74 | AO122: 否
A123: 600511.SH | B123: 国药股份 | C123: 1.73 | AO123: 否
A124: 600801.SH | B124: 华新水泥 | C124: 1.72 | AO124: 否
A125: 601628.SH | B125: 中国人寿 | C125: 1.72 | AO125: 否
A126: 603678.SH | B126: 火炬电子 | C126: 1.71 | D126: 70.689999999999998 | E126: 72.469999999999999 | F126: 74.840000000000003 | H126: 67.760000000000005 | AM126: 不宜入场（当前股价小于200日均线，应继续观察3w） | AN126: 44571 | AO126: 是
A127: 600884.SH | B127: 杉杉股份 | C127: 1.7 | AO127: 是
A128: 600211.SH | B128: 西藏药业 | C128: 1.69 | AO128: 否
A129: 600976.SH | B129: 健民集团 | C129: 1.69 | D129: 44.140000000000001 | E129: 46.619999999999997 | F129: 53.219999999999999 | H129: 64.799999999999997 | I129: 23.91 | J129: 64.989999999999995 | K129: 40.729999999999997 | L129: =(H129-I129)/I129 -> 1.7101631116687579 | M129: =(J129-H129)/J129 -> 2.9235266964147983e-03 | N129: =(J129-K129)/K129 -> 0.59562975693591946 | O129: 40 | P129: 52.68 | Q129: 41.619999999999997 | R129: 58.100000000000001 | S129: 49.460000000000001 | T129: 64.680000000000007 | U129: 59.289999999999999 | Z129: 20w | AA129: =(J129-O129)/J129 -> 0.38452069549161405 | AB129: =(P129-Q129)/P129 -> 0.20994684889901294 | AC129: =(R129-S129)/R129 -> 0.14870912220309812 | AD129: =(T129-U129)/T129 -> 8.333333333333344e-02 | AE129: =(V129-W129)/V129 -> #DIV/0! | AG129: 4T | AH129: 是 | AI129: 是 | AJ129: 是 | AK129: 是 | AL129: 是 | AM129: 可以入场 | AN129: 44547 | AO129: 是
A130: 605180.SH | B130: 华生科技 | C130: 1.69 | AO130: 否
A131: 603290.SH | B131: 斯达半导 | C131: 1.67 | D131: 346.67000000000002 | E131: 368.38 | F131: 403.49000000000001 | H131: 329.69999999999999 | AM131: 不宜入场（当前股价小于200日均线，应继续观察3w） | AN131: 44571 | AO131: 是
A132: 002709.SZ | B132: 天赐材料 | C132: 1.66 | AO132: 是
A133: 002714.SZ | B133: 牧原股份 | C133: 1.66 | AO133: 否
A134: 000422.SZ | B134: 湖北宜化 | C134: 1.66 | D134: 17.109999999999999 | E134: 19.010000000000002 | F134: 22.289999999999999 | H134: 19.469999999999999 | AM134: 不宜入场（当前股价小于50日均线,应观察2w） | AN134: 44579 | AO134: 是
A135: 002975.SZ | B135: 博杰股份 | C135: 1.65 | AO135: 否
A136: 600745.SH | B136: 闻泰科技 | C136: 1.65 | D136: 110.37 | E136: 113.23999999999999 | F136: 125.09999999999999 | H136: 123.28 | AM136: 不宜入场(当前股价小于50日均线，应持续观察2w) | AN136: 44571 | AO136: 是
A137: 601156.SH | B137: 东航物流 | C137: 1.64 | AO137: 否
A138: 603416.SH | B138: 信捷电气 | C138: 1.64 | AO138: 否
A139: 603897.SH | B139: 长城科技 | C139: 1.64 | D139: 40.100000000000001 | E139: 43.759999999999998 | F139: 51.530000000000001 | H139: 50.200000000000003 | AM139: 不宜入场（当前股价小于50日均线,应观察2w） | AN139: 44579 | AO139: 是
A140: 000049.SZ | B140: 德赛电池 | C140: 1.64 | D140: 45.329999999999998 | E140: 45.57 | F140: 49.93 | H140: 50.899999999999999 | I140: 31.030000000000001 | J140: 65.390000000000001 | K140: 42.479999999999997 | L140: =(H140-I140)/I140 -> 0.64034805027392838 | M140: =(J140-H140)/J140 -> 0.2215935158281083 | N140: =(J140-K140)/K140 -> 0.53931261770244832 | O140: 49.030000000000001 | Z140: 2w | AA140: =(J140-O140)/J140 -> 0.25019116072794007 | AB140: =(P140-Q140)/P140 -> #DIV/0! | AC140: =(R140-S140)/R140 -> #DIV/0! | AD140: =(T140-U140)/T140 -> #DIV/0! | AE140: =(V140-W140)/V140 -> #DIV/0! | AM140: 不宜入场（收缩幅度不够，应持续观察3w） | AN140: 44571 | AO140: 是
A141: 603236.SH | B141: 移远通信 | C141: 1.63 | D141: 172.88999999999999 | E141: 175.71000000000001 | F141: 189.12 | H141: 181.80000000000001 | AM141: 不宜入场(当前股价小于50日均线) | AN141: 44571 | AO141: 是
A142: 605399.SH | B142: 晨光新材 | C142: 1.63 | D142: 34.399999999999999 | E142: 37.090000000000003 | F142: 43.280000000000001 | H142: 44.719999999999999 | I142: 14.58 | J142: 55.899999999999999 | K142: 37.450000000000003 | L142: =(H142-I142)/I142 -> 2.0672153635116599 | M142: =(J142-H142)/J142 -> 0.20000000000000001 | N142: =(J142-K142)/K142 -> 0.49265687583444578 | O142: 38.25 | Z142: 7w | AA142: =(J142-O142)/J142 -> 0.31574239713774593 | AM142: 不宜入场（收缩幅度不够,应观察3w） | AN142: 44580 | AO142: 是
A143: 000786.SZ | B143: 北新建材 | C143: 1.61 | AO143: 否
A144: 002850.SZ | B144: 科达利 | C144: 1.61 | D144: 126.34999999999999 | E144: 135.81999999999999 | F144: 158.59 | H144: 139.99000000000001 | AM144: 不宜入场(当前股价小于50日均线) | AN144: 44571 | AO144: 是
A145: 002876.SZ | B145: 三利谱 | C145: 1.6000000000000001 | D145: 55.140000000000001 | E145: 55.829999999999998 | F145: 57.689999999999998 | H145: 61.899999999999999 | I145: 31.870000000000001 | J145: 68.299999999999997 | K145: 53.810000000000002 | L145: =(H145-I145)/I145 -> 0.94226545340445544 | M145: =(J145-H145)/J145 -> 9.370424597364567e-02 | N145: =(J145-K145)/K145 -> 0.26928080282475364 | O145: 46.799999999999997 | P145: 64.950000000000003 | Q145: 51.07 | Z145: 21w | AA145: =(J145-O145)/J145 -> 0.314787701317716 | AB145: =(#REF!-#REF!)/#REF! -> #REF! | AC145: =(P145-Q145)/P145 -> 0.21370284834488071 | AM145: 不宜入场（收缩幅度不够，应继续持续观察1w） | AN145: 44588 | AO145: 是
A146: 603150.SH | B146: 万朗磁塑 | C146: 1.6000000000000001 | AO146: 否
A147: 603529.SH | B147: 爱玛科技 | C147: 1.6000000000000001 | AO147: 是
A148: 600064.SH | B148: 南京高科 | C148: 1.58 | D148: 9.2100000000000009 | E148: 9.1699999999999999 | L148: =(H148-I148)/I148 -> #DIV/0! | M148: =(J148-H148)/J148 -> #DIV/0! | N148: =(J148-K148)/K148 -> #DIV/0! | AA148: =(J148-O148)/J148 -> #DIV/0! | AB148: =(P148-Q148)/P148 -> #DIV/0! | AD148: =(T148-U148)/T148 -> #DIV/0! | AM148: 不宜入场（150日均线小于200日均线） | AN148: 44547 | AO148: 是
A149: 600985.SH | B149: 淮北矿业 | C149: 1.58 | AO149: 是
A150: 601607.SH | B150: 上海医药 | C150: 1.58 | AO150: 否
A151: 603517.SH | B151: 绝味食品 | C151: 1.58 | AO151: 否
A152: 002080.SZ | B152: 中材科技 | C152: 1.58 | D152: 30.969999999999999 | E152: 32.18 | F152: 34.909999999999997 | H152: 32.590000000000003 | I152: 18.77 | J152: 45.659999999999997 | K152: 27.600000000000001 | L152: =(H152-I152)/I152 -> 0.73628129994672376 | M152: =(J152-H152)/J152 -> 0.28624616732369679 | N152: =(J152-K152)/K152 -> 0.6543478260869563 | AM152: 不宜入场（成交量行为和价格行为不甚明朗） | AN152: 44570 | AO152: 是
A153: 605555.SH | B153: 德昌股份 | C153: 1.57 | AO153: 否
A154: 002541.SZ | B154: 鸿路钢构 | C154: 1.57 | AO154: 否
A155: 000513.SZ | B155: 丽珠集团 | C155: 1.55 | AO155: 否
A156: 601001.SH | B156: 晋控煤业 | C156: 1.55 | AO156: 是
A157: 603087.SH | B157: 甘李药业 | C157: 1.55 | AO157: 否
A158: 600096.SH | B158: 云天化 | C158: 1.55 | D158: 18.84 | E158: 20.23 | F158: 21.510000000000002 | H158: 18.98 | AM158: 不宜入场（当前股价小于150日均线,应观察3w） | AN158: 44579 | AO158: 是
A159: 605259.SH | B159: 绿田机械 | C159: 1.54 | AO159: 否
A160: 603186.SH | B160: 华正新材 | C160: 1.53 | AO160: 否
A161: 605090.SH | B161: 九丰能源 | C161: 1.53 | AO161: 否
A162: 002274.SZ | B162: 华昌化工 | C162: 1.52 | AO162: 是
A163: 601100.SH | B163: 恒立液压 | C163: 1.52 | AO163: 否
A164: 603071.SH | B164: 物产环能 | C164: 1.52 | AO164: 是
A165: 002032.SZ | B165: 苏泊尔 | C165: 1.52 | AO165: 否
A166: 002179.SZ | B166: 中航光电 | C166: 1.52 | D166: 85.760000000000005 | E166: 88.189999999999998 | F166: 95.140000000000001 | H166: 97 | I166: 59.100000000000001 | J166: 105.62 | K166: 79.590000000000003 | L166: =(H166-I166)/I166 -> 0.64128595600676819 | M166: =(J166-H166)/J166 -> 8.1613330808559023e-02 | N166: =(J166-K166)/K166 -> 0.32705113707752231 | O166: 92.739999999999995 | P166: 99.579999999999998 | Q166: 94.549999999999997 | R166: 99.780000000000001 | S166: 95.390000000000001 | Z166: 3w | AA166: =(J166-O166)/J166 -> 0.1219466010225337 | AB166: =(P166-Q166)/P166 -> 5.0512151034344255e-02 | AC166: =(R166-S166)/R166 -> 4.3996792944477857e-02 | AG166: 3T | AH166: 是 | AI166: 是 | AJ166: 是 | AK166: 是 | AL166: 是 | AM166: 不宜入场（成交量行为和价格行为不甚明朗） | AN166: 44557 | AO166: 是
A167: 002048.SZ | B167: 宁波华翔 | C167: 1.51 | D167: 18.559999999999999 | E167: 19.289999999999999 | F167: 21.420000000000002 | H167: 20.940000000000001 | I167: 9.9600000000000009 | J167: 24.260000000000002 | K167: 18.940000000000001 | L167: =(H167-I167)/I167 -> 1.1024096385542168 | M167: =(J167-H167)/J167 -> 0.1368507831821929 | N167: =(J167-K167)/K167 -> 0.28088701161562829 | AM167: 不宜入场(当前股价小于50日均线，应继续观察5w) | AN167: 44570 | AO167: 是
A168: 605189.SH | B168: 富春染织 | C168: 1.51 | AO168: 否
A169: 001201.SZ | B169: 东瑞股份 | C169: 1.5 | AO169: 否
A170: 002128.SZ | B170: 电投能源 | C170: 1.5 | D170: 12.01 | E170: 12.390000000000001 | F170: 13.449999999999999 | H170: 17.25 | I170: 7.9800000000000004 | J170: 18.48 | K170: 10.32 | L170: =(H170-I170)/I170 -> 1.1616541353383458 | M170: =(J170-H170)/J170 -> 6.6558441558441581e-02 | N170: =(J170-K170)/K170 -> 0.79069767441860461 | O170: 11 | Z170: 11w | AA170: =(J170-O170)/J170 -> 0.40476190476190477 | AG170: 1T | AM170: 不宜入场(收缩幅度不够，应该持续观察6个w) | AN170: 44548 | AO170: 是
A171: 603338.SH | B171: 浙江鼎力 | C171: 1.5 | AO171: 是
A172: 600031.SH | B172: 三一重工 | C172: 1.49 | AO172: 否
A173: 600741.SH | B173: 华域汽车 | C173: 1.49 | D173: 25.350000000000001 | E173: 25.550000000000001 | F173: 26.969999999999999 | H173: 27.920000000000002 | I173: 18.850000000000001 | J173: 30.489999999999998 | K173: 23.530000000000001 | L173: =(H173-I173)/I173 -> 0.48116710875331564 | M173: =(J173-H173)/J173 -> 8.4289931124958903e-02 | N173: =(J173-K173)/K173 -> 0.29579260518487027 | O173: 26.300000000000001 | P173: 29.530000000000001 | Q173: 27.120000000000001 | R173: 30.059999999999999 | S173: 27.800000000000001 | Z173: 6w | AA173: =(J173-O173)/J173 -> 0.13742210560839613 | AB173: =(P173-Q173)/P173 -> 8.1611920081273284e-02 | AC173: =(R173-S173)/R173 -> 7.5182967398536193e-02 | AG173: 3T | AH173: 否 | AI173: 是 | AJ173: 是 | AK173: 否 | AM173: 不宜入场(杯型尚未形成，应持续观察1w) | AN173: 44588 | AO173: 是
A174: 601995.SH | B174: 中金公司 | C174: 1.49 | AO174: 否
A175: 000623.SZ | B175: 吉林敖东 | C175: 1.49 | D175: 16.239999999999998 | E175: 16.370000000000001 | F175: 16.829999999999998 | H175: 17.530000000000001 | I175: 14.619999999999999 | J175: 19.899999999999999 | K175: 15.19 | L175: =(H175-I175)/I175 -> 0.19904240766073886 | M175: =(J175-H175)/J175 -> 0.11909547738693456 | N175: =(J175-K175)/K175 -> 0.31007241606319941 | O175: 15.5 | P175: 16.989999999999998 | Q175: 16.16 | R175: 17.73 | S175: 17.079999999999998 | Z175: 12w | AA175: =(J175-O175)/J175 -> 0.22110552763819091 | AB175: =(P175-Q175)/P175 -> 4.8852266038846286e-02 | AC175: =(R175-S175)/R175 -> 3.6661026508742367e-02 | AM175: 不宜入场(收缩幅度差异太大，应持续观察6个w) | AN175: 44548 | AO175: 是
A176: 001212.SZ | B176: 中旗新材 | C176: 1.47 | AO176: 否
A177: 601225.SH | B177: 陕西煤业 | C177: 1.47 | D177: 12.119999999999999 | E177: 12.369999999999999 | F177: 12.82 | H177: 13.06 | I177: 9.7100000000000009 | J177: 16.829999999999998 | K177: 11.140000000000001 | L177: =(H177-I177)/I177 -> 0.34500514933058696 | M177: =(J177-H177)/J177 -> 0.22400475341651802 | N177: =(J177-K177)/K177 -> 0.51077199281867125 | O177: 11.31 | P177: 12.31 | Q177: 11.720000000000001 | R177: 13.68 | S177: 12.380000000000001 | Z177: 12w | AA177: =(J177-O177)/J177 -> 0.32798573975044554 | AB177: =(P177-Q177)/P177 -> 4.7928513403736786e-02 | AC177: =(R177-S177)/R177 -> 9.5029239766081797e-02 | AM177: 不宜入场(收缩幅度间隔太大，应持续观察7个w) | AN177: 44548 | AO177: 是
A178: 603155.SH | B178: 新亚强 | C178: 1.47 | AO178: 是
A179: 603606.SH | B179: 东方电缆 | C179: 1.47 | D179: 35.090000000000003 | E179: 37.969999999999999 | F179: 47.770000000000003 | H179: 45.950000000000003 | I179: 18.510000000000002 | J179: 63.75 | K179: 31.57 | L179: =(H179-I179)/I179 -> 1.4824419232847108 | M179: =(J179-H179)/J179 -> 0.27921568627450977 | N179: =(J179-K179)/K179 -> 1.0193221412733608 | AM179: 不宜入场(当前股价小于50日均线，应该持续观察2个w) | AN179: 44548 | AO179: 是
A180: 605098.SH | B180: 行动教育 | C180: 1.46 | D180: 47.700000000000003 | E180: 48.880000000000003 | F180: 52.789999999999999 | H180: 57.869999999999997 | I180: 32.399999999999999 | J180: 63.780000000000001 | K180: 47.789999999999999 | L180: =(H180-I180)/I180 -> 0.78611111111111109 | M180: =(J180-H180)/J180 -> 9.2662276575729119e-02 | N180: =(J180-K180)/K180 -> 0.33458882611424989 | O180: 40.479999999999997 | P180: 60.5 | Q180: 47.509999999999998 | Z180: 20w | AA180: =(J180-O180)/J180 -> 0.36531828159297591 | AB180: =(P180-Q180)/P180 -> 0.21471074380165292 | AC180: =(R180-S180)/R180 -> #DIV/0! | AD180: =(T180-U180)/T180 -> #DIV/0! | AG180: 6T | AM180: 不宜入场（成交行为和价格行为尚不明朗） | AN180: 44588 | AO180: 是
A181: 600581.SH | B181: 八一钢铁 | C181: 1.45 | AO181: 否
A182: 600449.SH | B182: 宁夏建材 | C182: 1.45 | AO182: 否
A183: 600966.SH | B183: 博汇纸业 | C183: 1.44 | AO183: 否
A184: 003028.SZ | B184: 振邦智能 | C184: 1.44 | AO184: 否
A185: 603806.SH | B185: 福斯特 | C185: 1.44 | D185: 112.09 | E185: 117.70999999999999 | F185: 123.90000000000001 | H185: 108.09999999999999 | I185: 60.920000000000002 | J185: 167.08000000000001 | K185: 105.13 | L185: =(H185-I185)/I185 -> 0.77445830597504906 | M185: =(J185-H185)/J185 -> 0.35300454871917653 | N185: =(J185-K185)/K185 -> 0.58927042709026933 | Z185: 14w | AA185: =(J185-O185)/J185 -> 1 | AB185: =(P185-Q185)/P185 -> #DIV/0! | AC185: =(R185-S185)/R185 -> #DIV/0! | AG185: 3T | AH185: 否 | AI185: 是 | AJ185: 否(仅支撑位升高) | AK185: 是 | AL185: 否 | AM185: 不宜入场(当前股价小于50日均线，应观察5w) | AN185: 44570 | AO185: 是
A186: 000002.SZ | B186: 万科A | C186: 1.44 | AO186: 否
A187: 600566.SH | B187: 济川药业 | C187: 1.43 | D187: 18.02 | E187: 17.940000000000001 | F187: 18.52 | L187: =(H187-I187)/I187 -> #DIV/0! | M187: =(J187-H187)/J187 -> #DIV/0! | N187: =(J187-K187)/K187 -> #DIV/0! | AA187: =(J187-O187)/J187 -> #DIV/0! | AB187: =(P187-Q187)/P187 -> #DIV/0! | AC187: =(R187-S187)/R187 -> #DIV/0! | AD187: =(T187-U187)/T187 -> #DIV/0! | AM187: 不宜入场(各均线不符合要求) | AN187: 44548 | AO187: 是
A188: 002008.SZ | B188: 大族激光 | C188: 1.43 | D188: 42.630000000000003 | E188: 43.140000000000001 | F188: 46.770000000000003 | H188: 53.420000000000002 | I188: 33.689999999999998 | J188: 55.109999999999999 | K188: 39.359999999999999 | L188: =(H188-I188)/I188 -> 0.5856337192045119 | M188: =(J188-H188)/J188 -> 3.0665940845581524e-02 | N188: =(J188-K188)/K188 -> 0.40015243902439024 | O188: 45.509999999999998 | P188: 49.799999999999997 | Q188: 46.460000000000001 | Z188: 2w | AA188: =(J188-O188)/J188 -> 0.17419706042460537 | AB188: =(P188-Q188)/P188 -> 6.7068273092369401e-02 | AC188: =(R188-S188)/R188 -> #DIV/0! | AD188: =(T188-U188)/T188 -> #DIV/0! | AM188: 不宜入场(收缩幅度不够，应持续观察2w) | AN188: 44588 | AO188: 是
A189: 605009.SH | B189: 豪悦护理 | C189: 1.43 | AO189: 否
A190: 002508.SZ | B190: 老板电器 | C190: 1.42 | AO190: 否
A191: 002833.SZ | B191: 弘亚数控 | C191: 1.42 | AO191: 否
A192: 601838.SH | B192: 成都银行 | C192: 1.42 | AO192: 是
A193: 605566.SH | B193: 福莱蒽特 | C193: 1.42 | AO193: 否
A194: 002022.SZ | B194: 科华生物 | C194: 1.42 | AO194: 否
A195: 000789.SZ | B195: 万年青 | C195: 1.42 | AO195: 否
A196: 601012.SH | B196: 隆基股份 | C196: 1.41 | AO196: 是
A197: 000001.SZ | B197: 平安银行 | C197: 1.3999999999999999 | AO197: 否
A198: 600089.SH | B198: 特变电工 | C198: 1.3999999999999999 | D198: 18.870000000000001 | E198: 20.010000000000002 | F198: 22.030000000000001 | H198: 19.68 | I198: 7.5899999999999999 | J198: 29.960000000000001 | K198: 12.859999999999999 | L198: =(H198-I198)/I198 -> 1.5928853754940711 | M198: =(J198-H198)/J198 -> 0.3431241655540721 | N198: =(J198-K198)/K198 -> 1.3297045101088649 | Z198: 13w | AA198: =(J198-O198)/J198 -> 1 | AB198: =(P198-Q198)/P198 -> #DIV/0! | AG198: 2T | AM198: 不宜入场(当前股价小于50日均线，应观察5w) | AN198: 44570 | AO198: 是
A199: 002845.SZ | B199: 同兴达 | C199: 1.39 | AO199: 否
A200: 600196.SH | B200: 复星医药 | C200: 1.39 | AO200: 否
A201: 603579.SH | B201: 荣泰健康 | C201: 1.39 | AO201: 否
A202: 002110.SZ | B202: 三钢闽光 | C202: 1.38 | AO202: 否
A203: 002756.SZ | B203: 永兴材料 | C203: 1.38 | D203: 95.21 | E203: 103.12 | F203: 126.12 | H203: 126 | I203: 37.67 | J203: 153.79 | K203: 95.480000000000004 | L203: =(H203-I203)/I203 -> 2.3448367401114942 | M203: =(J203-H203)/J203 -> 0.18070095584888479 | N203: =(J203-K203)/K203 -> 0.61070381231671544 | Z203: 1w | AA203: =(J203-O203)/J203 -> 1 | AB203: =(P203-Q203)/P203 -> #DIV/0! | AC203: =(R203-S203)/R203 -> #DIV/0! | AG203: 1T | AM203: 不宜入场(当前股价小于50日均线，应持续观察2w) | AN203: 44570 | AO203: 是
A204: 603368.SH | B204: 柳药股份 | C204: 1.38 | AO204: 否
A205: 603886.SH | B205: 元祖股份 | C205: 1.38 | D205: 19.699999999999999 | E205: 20.27 | F205: 22.359999999999999 | H205: 21 | AM205: 不宜入场(当前股价小于50日均线，应该持续观察1个w) | AN205: 44586 | AO205: 是
A206: 603225.SH | B206: 新凤鸣 | C206: 1.37 | AO206: 否
A207: 601636.SH | B207: 旗滨集团 | C207: 1.36 | AO207: 否
A208: 002223.SZ | B208: 鱼跃医疗 | C208: 1.36 | D208: 33.219999999999999 | E208: 33.850000000000001 | F208: 34.979999999999997 | H208: 35.859999999999999 | I208: 25.120000000000001 | J208: 41.770000000000003 | K208: 30.079999999999998 | L208: =(H208-I208)/I208 -> 0.42754777070063688 | M208: =(J208-H208)/J208 -> 0.14148910701460385 | N208: =(J208-K208)/K208 -> 0.38863031914893637 | O208: 29.82 | Z208: 21w | AA208: =(J208-O208)/J208 -> 0.28609049557098398 | AB208: =(P208-Q208)/P208 -> #DIV/0! | AC208: =(R208-S208)/R208 -> #DIV/0! | AD208: =(T208-U208)/T208 -> #DIV/0! | AH208: 否 | AI208: 否 | AJ208: 是 | AK208: 是 | AL208: 否 | AM208: 不宜入场(成交量行为不符合要求，应该持续观察1w) | AN208: 44588 | AO208: 是
A209: 000915.SZ | B209: 华特达因 | C209: 1.36 | AO209: 是
A210: 600030.SH | B210: 中信证券 | C210: 1.36 | AO210: 是
A211: 603160.SH | B211: 汇顶科技 | C211: 1.36 | AO211: 否
A212: 603369.SH | B212: 今世缘 | C212: 1.35 | D212: 50.82 | E212: 51.729999999999997 | F212: 54.93 | H212: 51.5 | I212: 39.380000000000003 | J212: 63.43 | K212: 51.289999999999999 | L212: =(H212-I212)/I212 -> 0.30777044184865404 | M212: =(J212-H212)/J212 -> 0.18808134951915498 | N212: =(J212-K212)/K212 -> 0.23669331253655684 | O212: 39.380000000000003 | P212: 63.380000000000003 | Q212: 51.390000000000001 | Z212: 21w | AA212: =(J212-O212)/J212 -> 0.37915812706921009 | AB212: =(P212-Q212)/P212 -> 0.18917639633953931 | AC212: =(R212-S212)/R212 -> #DIV/0! | AM212: 不宜入场(当前股价小于50日均线，应该持续观察2w) | AN212: 44570 | AO212: 是
A213: 003020.SZ | B213: 立方制药 | C213: 1.35 | AO213: 是
A214: 600000.SH | B214: 浦发银行 | C214: 1.34 | AO214: 否
A215: 002371.SZ | B215: 北方华创 | C215: 1.34 | D215: 308.47000000000003 | E215: 328.16000000000003 | F215: 358.68000000000001 | H215: 293.35000000000002 | I215: 133.41999999999999 | J215: 452.77999999999997 | K215: 342.47000000000003 | L215: =(H215-I215)/I215 -> 1.198695847698996 | M215: =(J215-H215)/J215 -> 0.35211360925835938 | N215: =(J215-K215)/K215 -> 0.3221012059450461 | Z215: 5w | AA215: =(J215-O215)/J215 -> 1 | AB215: =(P215-Q215)/P215 -> #DIV/0! | AM215: 不宜入场(当前股价小于50日均线，应观察5w) | AN215: 44570 | AO215: 是
A216: 603113.SH | B216: 金能科技 | C216: 1.33 | AO216: 否
A217: 600438.SH | B217: 通威股份 | C217: 1.32 | AO217: 否
A218: 002064.SZ | B218: 华峰化学 | C218: 1.32 | AO218: 否
A219: 601577.SH | B219: 长沙银行 | C219: 1.32 | AO219: 否
A220: 002001.SZ | B220: 新和成 | C220: 1.31 | AO220: 否
A221: 600887.SH | B221: 伊利股份 | C221: 1.31 | D221: 39.100000000000001 | E221: 38.969999999999999 | F221: 40.140000000000001 | H221: 40.960000000000001 | I221: 30.899999999999999 | J221: 51.030000000000001 | K221: 38.659999999999997 | L221: =(H221-I221)/I221 -> 0.32556634304207127 | M221: =(J221-H221)/J221 -> 0.19733490103860474 | N221: =(J221-K221)/K221 -> 0.31996896016554593 | O221: 30.899999999999999 | P221: 36.490000000000002 | Q221: 32.600000000000001 | R221: 37.68 | S221: 34.350000000000001 | T221: 40.530000000000001 | U221: 37.380000000000003 | V221: 44.25 | W221: 38.32 | X221: 43.920000000000002 | Y221: 40.590000000000003 | Z221: 45w | AA221: =(J221-O221)/J221 -> 0.39447383891828341 | AB221: =(P221-Q221)/P221 -> 0.10660454919155934 | AC221: =(R221-S221)/R221 -> 8.8375796178343902e-02 | AD221: =(T221-U221)/T221 -> 7.7720207253885967e-02 | AE221: =(V221-W221)/V221 -> 0.13401129943502824 | AF221: =(X221-Y221)/X221 -> 7.58196721311475e-02 | AM221: 不宜入场(150日均线小于200日均线) | AN221: 44548 | AO221: 是
A222: 605336.SH | B222: 帅丰电器 | C222: 1.31 | D222: 29.5 | E222: 30.109999999999999 | F222: 32.119999999999997 | H222: 33.600000000000001 | I222: 24.219999999999999 | J222: 37.5 | K222: 29.329999999999998 | L222: =(H222-I222)/I222 -> 0.38728323699421979 | M222: =(J222-H222)/J222 -> 0.10399999999999997 | N222: =(J222-K222)/K222 -> 0.27855438117967957 | O222: 28.609999999999999 | Z222: 4w | AA222: =(J222-O222)/J222 -> 0.23706666666666668 | AB222: =(P222-Q222)/P222 -> #DIV/0! | AC222: =(R222-S222)/R222 -> #DIV/0! | AD222: =(T222-U222)/T222 -> #DIV/0! | AE222: =(V222-W222)/V222 -> #DIV/0! | AM222: 不宜入场(收缩量不够，应该持续观察1w) | AN222: 44588 | AO222: 是
A223: 001296.SZ | B223: 长江材料 | C223: 1.3 | AO223: 是
A224: 002637.SZ | B224: 赞宇科技 | C224: 1.3 | D224: 15.6 | E224: 15.869999999999999 | F224: 16.460000000000001 | H224: 16.539999999999999 | I224: 11.050000000000001 | J224: 20.440000000000001 | K224: 15.17 | L224: =(H224-I224)/I224 -> 0.49683257918552021 | M224: =(J224-H224)/J224 -> 0.19080234833659501 | N224: =(J224-K224)/K224 -> 0.34739617666446942 | O224: 14.220000000000001 | P224: 18.27 | Q224: 16.489999999999998 | Z224: 11w | AA224: =(J224-O224)/J224 -> 0.30430528375733856 | AB224: =(P224-Q224)/P224 -> 9.7427476737821636e-02 | AC224: =(R224-S224)/R224 -> #DIV/0! | AD224: =(T224-U224)/T224 -> #DIV/0! | AE224: =(V224-W224)/V224 -> #DIV/0! | AM224: 不宜入场(收缩幅度不够，应该持续观察3w) | AN224: 44548 | AO224: 是
A225: 600362.SH | B225: 江西铜业 | C225: 1.3 | AO225: 否
A226: 603883.SH | B226: 老百姓 | C226: 1.3 | AO226: 否
A227: 000011.SZ | B227: 深物业A | C227: 1.3 | AO227: 否
A228: 002727.SZ | B228: 一心堂 | C228: 1.29 | AO228: 否
A229: 601211.SH | B229: 国泰君安 | C229: 1.29 | AO229: 是
A230: 601877.SH | B230: 正泰电器 | C230: 1.29 | D230: 45.710000000000001 | E230: 47.770000000000003 | F230: 53.020000000000003 | H230: 53.689999999999998 | I230: 28.379999999999999 | J230: 64.120000000000005 | K230: 31 | L230: =(H230-I230)/I230 -> 0.89182522903453132 | M230: =(J230-H230)/J230 -> 0.16266375545851539 | N230: =(J230-K230)/K230 -> 1.0683870967741937 | O230: 46.299999999999997 | P230: 62.600000000000001 | Q230: 49.280000000000001 | Z230: 13w | AA230: =(J230-O230)/J230 -> 0.27791640673736751 | AB230: =(P230-Q230)/P230 -> 0.21277955271565496 | AC230: =(R230-S230)/R230 -> #DIV/0! | AD230: =(T230-U230)/T230 -> #DIV/0! | AE230: =(V230-W230)/V230 -> #DIV/0! | AM230: 不宜入场(收缩幅度不够，应该持续观察4w) | AN230: 44548 | AO230: 是
A231: 603010.SH | B231: 万盛股份 | C231: 1.29 | L231: =(H231-I231)/I231 -> #DIV/0! | M231: =(J231-H231)/J231 -> #DIV/0! | N231: =(J231-K231)/K231 -> #DIV/0! | AA231: =(J231-O231)/J231 -> #DIV/0! | AB231: =(P231-Q231)/P231 -> #DIV/0! | AC231: =(R231-S231)/R231 -> #DIV/0! | AD231: =(T231-U231)/T231 -> #DIV/0! | AE231: =(V231-W231)/V231 -> #DIV/0! | AM231: 已分析（见增长幅度结果表） | AN231: 44548 | AO231: 是
A232: 603156.SH | B232: 养元饮品 | C232: 1.29 | AO232: 否
A233: 600755.SH | B233: 厦门国贸 | C233: 1.28 | AO233: 否
A234: 603733.SH | B234: 仙鹤股份 | C234: 1.28 | D234: 33.509999999999998 | E234: 34.710000000000001 | F234: 37.109999999999999 | H234: 38.630000000000003 | I234: 23.09 | J234: 44.579999999999998 | K234: 26.989999999999998 | L234: =(H234-I234)/I234 -> 0.67301862278042457 | M234: =(J234-H234)/J234 -> 0.13346792283535208 | N234: =(J234-K234)/K234 -> 0.65172286031863658 | O234: 30.280000000000001 | P234: 42.390000000000001 | Q234: 34.619999999999997 | Z234: 21w | AA234: =(J234-O234)/J234 -> 0.3207716464782413 | AB234: =(P234-Q234)/P234 -> 0.18329794762915788 | AM234: 不宜入场(成交量行为不符合要求，应该持续观察1w) | AN234: 44588 | AO234: 是
A235: 603985.SH | B235: 恒润股份 | C235: 1.27 | D235: 32.450000000000003 | E235: 35.340000000000003 | F235: 46.530000000000001 | H235: 49.390000000000001 | I235: 15.01 | J235: 57.710000000000001 | K235: 26.449999999999999 | L235: =(H235-I235)/I235 -> 2.2904730179880084 | M235: =(J235-H235)/J235 -> 0.14416912146941605 | N235: =(J235-K235)/K235 -> 1.1818525519848773 | O235: 44 | P235: 55.5 | Q235: 47.5 | Z235: 5w | AA235: =(J235-O235)/J235 -> 0.23756714607520363 | AB235: =(P235-Q235)/P235 -> 0.14414414414414414 | AM235: 不宜入场(有强力拉升形态潜力，但收缩幅度不够，应多观察1w) | AN235: 44556 | AO235: 是
A236: 001206.SZ | B236: 依依股份 | C236: 1.27 | AO236: 否
A237: 002597.SZ | B237: 金禾实业 | C237: 1.27 | D237: 41.600000000000001 | E237: 42.68 | F237: 47.140000000000001 | H237: 43.149999999999999 | I237: 28.079999999999998 | J237: 54.189999999999998 | K237: 38.890000000000001 | L237: =(H237-I237)/I237 -> 0.5366809116809117 | M237: =(J237-H237)/J237 -> 0.20372762502306699 | N237: =(J237-K237)/K237 -> 0.39341733093340181 | AM237: 不宜入场(当前股价小于50日均线，应该持续观察2w) | AN237: 44570 | AO237: 是
A238: 002889.SZ | B238: 东方嘉盛 | C238: 1.27 | D238: 24.600000000000001 | E238: 24.670000000000002 | F238: 25.030000000000001 | H238: 26.09 | I238: 20.91 | J238: 32.460000000000001 | K238: 23.16 | L238: =(H238-I238)/I238 -> 0.24772835963653753 | M238: =(J238-H238)/J238 -> 0.19624152803450404 | N238: =(J238-K238)/K238 -> 0.40155440414507776 | O238: 21.449999999999999 | P238: 26.25 | Q238: 22.190000000000001 | R238: 26.27 | S238: 22.600000000000001 | T238: 28.870000000000001 | U238: 25.629999999999999 | V238: 27.449999999999999 | W238: 25.699999999999999 | Z238: 29w | AA238: =(J238-O238)/J238 -> 0.33918669131238449 | AB238: =(P238-Q238)/P238 -> 0.15466666666666662 | AC238: =(R238-S238)/R238 -> 0.13970308336505513 | AD238: =(T238-U238)/T238 -> 0.11222722549359203 | AE238: =(V238-W238)/V238 -> 6.3752276867030971e-02 | AG238: 5T | AH238: 是 | AI238: 否 | AJ238: 是 | AK238: 否 | AL238: 否 | AM238: 不宜入场(杯型形成不太好，处于杯子的中下部，网球行为也不是很明朗，应该持续观察1w) | AN238: 44572 | AO238: 是
A239: 002985.SZ | B239: 北摩高科 | C239: 1.27 | D239: 105.67 | E239: 107.91 | F239: 113.03 | H239: 110.5 | I239: 76.299999999999997 | J239: 135.30000000000001 | K239: 96.239999999999995 | L239: =(H239-I239)/I239 -> 0.44823066841415471 | M239: =(J239-H239)/J239 -> 0.18329637841832971 | N239: =(J239-K239)/K239 -> 0.40586034912718222 | O239: 98.510000000000005 | P239: 128.5 | Q239: 109.58 | Z239: 12w | AA239: =(J239-O239)/J239 -> 0.27191426459719142 | AB239: =(P239-Q239)/P239 -> 0.14723735408560312 | AC239: =(R239-S239)/R239 -> #DIV/0! | AD239: =(T239-U239)/T239 -> #DIV/0! | AE239: =(V239-W239)/V239 -> #DIV/0! | AG239: 2T | AM239: 不宜入场(股价太高，每股收益太低，风险太大) | AN239: 44557 | AO239: 是
A240: 600998.SH | B240: 九州通 | C240: 1.27 | AO240: 否
A241: 605222.SH | B241: 起帆电缆 | C241: 1.27 | D241: 22.5 | E241: 23.050000000000001 | F241: 25.25 | H241: 25.32 | I241: 18.920000000000002 | J241: 31.440000000000001 | K241: 22.940000000000001 | L241: =(H241-I241)/I241 -> 0.33826638477801257 | M241: =(J241-H241)/J241 -> 0.19465648854961834 | N241: =(J241-K241)/K241 -> 0.37053182214472535 | O241: 24.609999999999999 | Z241: 4w | AA241: =(J241-O241)/J241 -> 0.21723918575063619 | AB241: =(P241-Q241)/P241 -> #DIV/0! | AC241: =(R241-S241)/R241 -> #DIV/0! | AD241: =(T241-U241)/T241 -> #DIV/0! | AE241: =(V241-W241)/V241 -> #DIV/0! | AM241: 不宜入场(收缩幅度不够，应该持续观察3w) | AN241: 44548 | AO241: 是
A242: 001872.SZ | B242: 招商港口 | C242: 1.27 | D242: 16.219999999999999 | E242: 16.43 | F242: 16.98 | H242: 16.219999999999999 | Z242: 15w | AA242: =(J242-O242)/J242 -> #DIV/0! | AB242: =(P242-Q242)/P242 -> #DIV/0! | AC242: =(R242-S242)/R242 -> #DIV/0! | AD242: =(T242-U242)/T242 -> #DIV/0! | AE242: =(V242-W242)/V242 -> #DIV/0! | AG242: 3T | AH242: 是 | AI242: 否 | AJ242: 是 | AK242: 是 | AL242: 是 | AM242: 不宜入场(当前股价小于150日均线，应该持续观察2w) | AN242: 44586 | AO242: 是
A243: 000063.SZ | B243: 中兴通讯 | C243: 1.26 | AO243: 是
A244: 600373.SH | B244: 中文传媒 | C244: 1.26 | D244: 10.51 | E244: 10.66 | F244: 11.15 | H244: 12.26 | I244: 8.5299999999999994 | J244: 12.390000000000001 | K244: 10.32 | L244: =(H244-I244)/I244 -> 0.43728018757327092 | M244: =(J244-H244)/J244 -> 1.0492332526230894e-02 | N244: =(J244-K244)/K244 -> 0.20058139534883723 | O244: 11.69 | P244: 12.56 | Q244: 11.800000000000001 | Z244: 1w | AA244: =(J244-O244)/J244 -> 5.6497175141243021e-02 | AB244: =(P244-Q244)/P244 -> 6.0509554140127368e-02 | AC244: =(R244-S244)/R244 -> #DIV/0! | AD244: =(T244-U244)/T244 -> #DIV/0! | AE244: =(V244-W244)/V244 -> #DIV/0! | AG244: 1T | AH244: 是 | AI244: 是 | AJ244: 是 | AK244: 是 | AL244: 是 | AM244: 可以入场 | AN244: 44553 | AO244: 是
A245: 601997.SH | B245: 贵阳银行 | C245: 1.26 | AO245: 否
A246: 603938.SH | B246: 三孚股份 | C246: 1.26 | AO246: 否
A247: 605288.SH | B247: 凯迪股份 | C247: 1.26 | AO247: 否
A248: 600328.SH | B248: 中盐化工 | C248: 1.26 | L248: =(H248-I248)/I248 -> #DIV/0! | M248: =(J248-H248)/J248 -> #DIV/0! | N248: =(J248-K248)/K248 -> #DIV/0! | AA248: =(J248-O248)/J248 -> #DIV/0! | AB248: =(P248-Q248)/P248 -> #DIV/0! | AC248: =(R248-S248)/R248 -> #DIV/0! | AD248: =(T248-U248)/T248 -> #DIV/0! | AE248: =(V248-W248)/V248 -> #DIV/0! | AM248: 不宜入场(各均线斜率朝下) | AN248: 44548 | AO248: 是
A249: 000877.SZ | B249: 天山股份 | C249: 1.25 | AO249: 否
A250: 001217.SZ | B250: 华尔泰 | C250: 1.25 | L250: =(H250-I250)/I250 -> #DIV/0! | M250: =(J250-H250)/J250 -> #DIV/0! | N250: =(J250-K250)/K250 -> #DIV/0! | AA250: =(J250-O250)/J250 -> #DIV/0! | AB250: =(P250-Q250)/P250 -> #DIV/0! | AC250: =(R250-S250)/R250 -> #DIV/0! | AD250: =(T250-U250)/T250 -> #DIV/0! | AE250: =(V250-W250)/V250 -> #DIV/0! | AM250: 不宜入场(各均线斜率朝下) | AN250: 44548 | AO250: 是
A251: 002977.SZ | B251: 天箭科技 | C251: 1.24 | AO251: 否
A252: 600298.SH | B252: 安琪酵母 | C252: 1.24 | D252: 52.990000000000002 | E252: 52.850000000000001 | L252: =(H252-I252)/I252 -> #DIV/0! | M252: =(J252-H252)/J252 -> #DIV/0! | N252: =(J252-K252)/K252 -> #DIV/0! | AA252: =(J252-O252)/J252 -> #DIV/0! | AB252: =(P252-Q252)/P252 -> #DIV/0! | AC252: =(R252-S252)/R252 -> #DIV/0! | AD252: =(T252-U252)/T252 -> #DIV/0! | AE252: =(V252-W252)/V252 -> #DIV/0! | AM252: 不宜入场(150日均线小于200日均线，应观察6w) | AN252: 44548 | AO252: 是
A253: 600668.SH | B253: 尖峰集团 | C253: 1.23 | AO253: 是
A254: 600123.SH | B254: 兰花科创 | C254: 1.23 | D254: 8.8900000000000006 | E254: 9.3699999999999992 | F254: 10.02 | H254: 9.9600000000000009 | I254: 4.4699999999999998 | J254: 14.67 | K254: 8.9399999999999995 | L254: =(H254-I254)/I254 -> 1.2281879194630876 | M254: =(J254-H254)/J254 -> 0.32106339468302653 | N254: =(J254-K254)/K254 -> 0.64093959731543637 | AA254: =(J254-O254)/J254 -> 1 | AB254: =(P254-Q254)/P254 -> #DIV/0! | AC254: =(R254-S254)/R254 -> #DIV/0! | AD254: =(T254-U254)/T254 -> #DIV/0! | AE254: =(V254-W254)/V254 -> #DIV/0! | AM254: 不宜入场(当前股价距离最高点距离太远，面临巨大抛压,应观察2w) | AN254: 44548 | AO254: 是
A255: 600584.SH | B255: 长电科技 | C255: 1.23 | AO255: 否
A256: 601688.SH | B256: 华泰证券 | C256: 1.23 | AO256: 是
A257: 600720.SH | B257: 祁连山 | C257: 1.23 | AO257: 否
A258: 002287.SZ | B258: 奇正藏药 | C258: 1.22 | AO258: 是
A259: 600739.SH | B259: 辽宁成大 | C259: 1.22 | AO259: 否
A260: 603095.SH | B260: 越剑智能 | C260: 1.22 | D260: 23.609999999999999 | E260: 23.890000000000001 | F260: 24.84 | H260: 24.59 | I260: 20.809999999999999 | J260: 27.07 | K260: 24.77 | L260: =(H260-I260)/I260 -> 0.18164344065353202 | M260: =(J260-H260)/J260 -> 9.1614333210195797e-02 | N260: =(J260-K260)/K260 -> 9.2854259184497412e-02 | O260: 24.5 | AA260: =(J260-O260)/J260 -> 9.4939046915404515e-02 | AB260: =(P260-Q260)/P260 -> #DIV/0! | AC260: =(R260-S260)/R260 -> #DIV/0! | AD260: =(T260-U260)/T260 -> #DIV/0! | AE260: =(V260-W260)/V260 -> #DIV/0! | AM260: 不宜入场(当前股价距离最低点距离太近，涨幅不够,应观察2w) | AN260: 44548 | AO260: 是
A261: 603259.SH | B261: 药明康德 | C261: 1.22 | AO261: 否
A262: 603658.SH | B262: 安图生物 | C262: 1.22 | AO262: 否
A263: 603899.SH | B263: 晨光文具 | C263: 1.21 | AO263: 否
A264: 000401.SZ | B264: 冀东水泥 | C264: 1.21 | AO264: 否
A265: 000932.SZ | B265: 华菱钢铁 | C265: 1.21 | AO265: 否
A266: 601009.SH | B266: 南京银行 | C266: 1.21 | AO266: 否
A267: 002959.SZ | B267: 小熊电器 | C267: 1.21 | AO267: 否
A268: 000708.SZ | B268: 中信特钢 | C268: 1.2 | AO268: 否
A269: 002353.SZ | B269: 杰瑞股份 | C269: 1.2 | AO269: 是
A270: 601963.SH | B270: 重庆银行 | C270: 1.2 | AO270: 否
A271: 603197.SH | B271: 保隆科技 | C271: 1.2 | D271: 35.310000000000002 | E271: 37.299999999999997 | F271: 46.289999999999999 | H271: 66.129999999999995 | I271: 22.620000000000001 | J271: 69.489999999999995 | K271: 26.399999999999999 | L271: =(H271-I271)/I271 -> 1.9235190097259058 | M271: =(J271-H271)/J271 -> 4.8352280903727153e-02 | N271: =(J271-K271)/K271 -> 1.6321969696969696 | O271: 53.149999999999999 | Z271: 2w | AA271: =(J271-O271)/J271 -> 0.23514174701395882 | AB271: =(P271-Q271)/P271 -> #DIV/0! | AM271: 不宜入场(有强力拉升形态潜力，但收缩幅度不够，应多观察1w) | AN271: 44553 | AO271: 是
A272: 603198.SH | B272: 迎驾贡酒 | C272: 1.2 | D272: 50.880000000000003 | E272: 54.590000000000003 | F272: 66.069999999999993 | H272: 62.960000000000001 | I272: 25.829999999999998 | J272: 77.5 | K272: 50.289999999999999 | L272: =(H272-I272)/I272 -> 1.4374758033294621 | M272: =(J272-H272)/J272 -> 0.18761290322580645 | N272: =(J272-K272)/K272 -> 0.54106184132034207 | Z272: 1w | AA272: =(J272-O272)/J272 -> 1 | AB272: =(P272-Q272)/P272 -> #DIV/0! | AM272: 不宜入场(当前股价小于50日均线，应观察5w) | AN272: 44570 | AO272: 是
A273: 000825.SZ | B273: 太钢不锈 | C273: 1.19 | AO273: 否
A274: 600623.SH | B274: 华谊集团 | C274: 1.18 | AO274: 否
A275: 603258.SH | B275: 电魂网络 | C275: 1.18 | D275: 25.699999999999999 | E275: 25.600000000000001 | L275: =(H275-I275)/I275 -> #DIV/0! | M275: =(J275-H275)/J275 -> #DIV/0! | N275: =(J275-K275)/K275 -> #DIV/0! | AA275: =(J275-O275)/J275 -> #DIV/0! | AB275: =(P275-Q275)/P275 -> #DIV/0! | AC275: =(R275-S275)/R275 -> #DIV/0! | AD275: =(T275-U275)/T275 -> #DIV/0! | AE275: =(V275-W275)/V275 -> #DIV/0! | AM275: 不宜入场(150日均线小于200日均线，应观察6w) | AN275: 44548 | AO275: 是
A276: 603877.SH | B276: 太平鸟 | C276: 1.18 | AO276: 否
A277: 605588.SH | B277: 冠石科技 | C277: 1.18 | AO277: 否
A278: 002415.SZ | B278: 海康威视 | C278: 1.18 | AO278: 否
A279: 000885.SZ | B279: 城发环境 | C279: 1.18 | D279: 9.9800000000000004 | E279: 10.08 | F279: 10.42 | H279: 10.460000000000001 | I279: 8.4800000000000004 | J279: 11.57 | K279: 9.0299999999999994 | L279: =(H279-I279)/I279 -> 0.23349056603773588 | M279: =(J279-H279)/J279 -> 9.5937770095073413e-02 | N279: =(J279-K279)/K279 -> 0.28128460686600232 | AA279: =(J279-O279)/J279 -> 1 | AB279: =(P279-Q279)/P279 -> #DIV/0! | AC279: =(R279-S279)/R279 -> #DIV/0! | AD279: =(T279-U279)/T279 -> #DIV/0! | AE279: =(V279-W279)/V279 -> #DIV/0! | AM279: 不宜入场(当前股价距离最低点距离太近，涨幅不够) | AN279: 44548 | AO279: 是
A280: 002557.SZ | B280: 洽洽食品 | C280: 1.18 | D280: 49.920000000000002 | E280: 50.210000000000001 | F280: 54.329999999999998 | H280: 60.509999999999998 | I280: 35.799999999999997 | J280: 69.099999999999994 | K280: 58.630000000000003 | L280: =(H280-I280)/I280 -> 0.69022346368715093 | M280: =(J280-H280)/J280 -> 0.12431259044862514 | N280: =(J280-K280)/K280 -> 0.17857752004093452 | O280: 35.799999999999997 | P280: 46.880000000000003 | Q280: 36.020000000000003 | R280: 59.530000000000001 | S280: 51.979999999999997 | T280: 59.5 | U280: 54.810000000000002 | V280: 61.700000000000003 | Z280: 41w | AA280: =(J280-O280)/J280 -> 0.48191027496382055 | AB280: =(P280-Q280)/P280 -> 0.23165529010238906 | AC280: =(R280-S280)/R280 -> 0.12682681001175886 | AD280: =(T280-U280)/T280 -> 7.8823529411764667e-02 | AG280: 4T | AH280: 是 | AI280: 是 | AJ280: 是 | AK280: 是 | AL280: 否 | AM280: 可以入场（寻找合适身位进场） | AN280: 44553 | AO280: 是
A281: 601229.SH | B281: 上海银行 | C281: 1.17 | AO281: 否
A282: 603203.SH | B282: 快克股份 | C282: 1.17 | L282: =(H282-I282)/I282 -> #DIV/0! | M282: =(J282-H282)/J282 -> #DIV/0! | N282: =(J282-K282)/K282 -> #DIV/0! | AA282: =(J282-O282)/J282 -> #DIV/0! | AB282: =(P282-Q282)/P282 -> #DIV/0! | AC282: =(R282-S282)/R282 -> #DIV/0! | AD282: =(T282-U282)/T282 -> #DIV/0! | AM282: 已分析（见增长幅度最大表） | AN282: 44548 | AO282: 是
A283: 603587.SH | B283: 地素时尚 | C283: 1.17 | AO283: 否
A284: 603681.SH | B284: 永冠新材 | C284: 1.17 | D284: 31.629999999999999 | E284: 33.149999999999999 | F284: 36.07 | H284: 32.979999999999997 | I284: 18.48 | J284: 41.969999999999999 | K284: 26.260000000000002 | L284: =(H284-I284)/I284 -> 0.78463203463203446 | M284: =(J284-H284)/J284 -> 0.21420061949011204 | N284: =(J284-K284)/K284 -> 0.59824828636709815 | O284: 29.77 | P284: 41.18 | Q284: 32.619999999999997 | Z284: 17w | AA284: =(J284-O284)/J284 -> 0.29068382177746011 | AB284: =(P284-Q284)/P284 -> 0.20786789703739686 | AC284: =(R284-S284)/R284 -> #DIV/0! | AD284: =(T284-U284)/T284 -> #DIV/0! | AM284: 不宜入场(收缩幅度不够，应该持续观察2w) | AN284: 44588 | AO284: 是
A285: 605077.SH | B285: 华康股份 | C285: 1.17 | AO285: 否
A286: 002258.SZ | B286: 利尔化学 | C286: 1.17 | D286: 27.469999999999999 | E286: 27.800000000000001 | F286: 28.890000000000001 | H286: 32.439999999999998 | I286: 21.350000000000001 | J286: 35.259999999999998 | K286: 25.82 | L286: =(H286-I286)/I286 -> 0.51943793911007008 | M286: =(J286-H286)/J286 -> 7.9977311401021003e-02 | N286: =(J286-K286)/K286 -> 0.36560805577072025 | O286: 22.309999999999999 | Z286: 12w | AA286: =(J286-O286)/J286 -> 0.3672716959727737 | AB286: =(P286-Q286)/P286 -> #DIV/0! | AC286: =(R286-S286)/R286 -> #DIV/0! | AD286: =(T286-U286)/T286 -> #DIV/0! | AM286: 不宜入场(收缩幅度不够，应该持续观察3w) | AN286: 44548 | AO286: 是
A287: 002929.SZ | B287: 润建股份 | C287: 1.16 | D287: 30.109999999999999 | E287: 31.18 | F287: 34.920000000000002 | H287: 37.5 | I287: 20 | J287: 39.43 | K287: 31.91 | L287: =(H287-I287)/I287 -> 0.875 | M287: =(J287-H287)/J287 -> 4.8947501902104992e-02 | N287: =(J287-K287)/K287 -> 0.2356628016295832 | O287: 33.170000000000002 | P287: 38.380000000000003 | Q287: 33.420000000000002 | Z287: 2w | AA287: =(J287-O287)/J287 -> 0.15876236368247523 | AB287: =(P287-Q287)/P287 -> 0.12923397602918188 | AC287: =(R287-S287)/R287 -> #DIV/0! | AD287: =(T287-U287)/T287 -> #DIV/0! | AM287: 不宜入场(收缩幅度不够，应该持续观察1w) | AN287: 44586 | AO287: 是
A288: 002028.SZ | B288: 思源电气 | C288: 1.16 | D288: 39.850000000000001 | E288: 41.810000000000002 | F288: 47.560000000000002 | H288: 45.899999999999999 | AM288: 不宜入场(当前股价低于50日均线，应该持续观察2w) | AN288: 44586 | AO288: 是
A289: 003017.SZ | B289: 大洋生物 | C289: 1.16 | AO289: 否
A290: 603858.SH | B290: 步长制药 | C290: 1.15 | AO290: 否
A291: 002605.SZ | B291: 姚记科技 | C291: 1.15 | AO291: 是
A292: 600153.SH | B292: 建发股份 | C292: 1.15 | D292: 8.0199999999999996 | E292: 8.0600000000000005 | F292: 8.3200000000000003 | H292: 8.9100000000000001 | I292: 7.0499999999999998 | J292: 9.4600000000000009 | K292: 7.4000000000000004 | L292: =(H292-I292)/I292 -> 0.2638297872340426 | M292: =(J292-H292)/J292 -> 5.8139534883720999e-02 | N292: =(J292-K292)/K292 -> 0.27837837837837842 | O292: 7.5 | P292: 8.4600000000000009 | Q292: 8.0399999999999991 | R292: 9.2200000000000006 | S292: 8.5800000000000001 | T292: 9.0500000000000007 | U292: 8.6600000000000001 | Z292: 14w | AA292: =(J292-O292)/J292 -> 0.20718816067653284 | AB292: =(P292-Q292)/P292 -> 4.9645390070922182e-02 | AC292: =(R292-S292)/R292 -> 6.9414316702820014e-02 | AD292: =(T292-U292)/T292 -> 4.3093922651933764e-02 | AM292: 不宜入场(收缩幅度不够，应该持续观察3w) | AN292: 44548 | AO292: 是
A293: 600323.SH | B293: 瀚蓝环境 | C293: 1.15 | AO293: 否
A294: 600803.SH | B294: 新奥股份 | C294: 1.15 | L294: =(H294-I294)/I294 -> #DIV/0! | M294: =(J294-H294)/J294 -> #DIV/0! | N294: =(J294-K294)/K294 -> #DIV/0! | AA294: =(J294-O294)/J294 -> #DIV/0! | AB294: =(P294-Q294)/P294 -> #DIV/0! | AM294: 已分析（见增长幅度表） | AN294: 44548 | AO294: 是
A295: 601186.SH | B295: 中国铁建 | C295: 1.15 | AO295: 是
A296: 603868.SH | B296: 飞科电器 | C296: 1.15 | AO296: 是
A297: 605089.SH | B297: 味知香 | C297: 1.15 | D297: 74.159999999999997 | E297: 77.120000000000005 | F297: 83.359999999999999 | H297: 85.400000000000006 | I297: 41.079999999999998 | J297: 139.80000000000001 | K297: 41.079999999999998 | L297: =(H297-I297)/I297 -> 1.0788704965920157 | M297: =(J297-H297)/J297 -> 0.38912732474964234 | N297: =(J297-K297)/K297 -> 2.4031158714703023 | O297: 62.020000000000003 | P297: 83.629999999999995 | Q297: 63.609999999999999 | R297: 86.969999999999999 | S297: 64.599999999999994 | T297: 80.840000000000003 | U297: 72 | V297: 89.129999999999995 | W297: 81.099999999999994 | Z297: 3w | AA297: =(J297-O297)/J297 -> 0.55636623748211722 | AB297: =(P297-Q297)/P297 -> 0.23938777950496229 | AC297: =(R297-S297)/R297 -> 0.25721513165459359 | AD297: =(T297-U297)/T297 -> 0.10935180603661557 | AE297: =(V297-W297)/V297 -> 9.0093122405475165e-02 | AM297: 不宜入场(当前股价距离最高点距离过大，面临巨大抛压过大) | AN297: 44570 | AO297: 是
A298: 002925.SZ | B298: 盈趣科技 | C298: 1.14 | AO298: 否
A299: 003026.SZ | B299: 中晶科技 | C299: 1.14 | AO299: 否
A300: 600926.SH | B300: 杭州银行 | C300: 1.14 | AO300: 否
A301: 002901.SZ | B301: 大博医疗 | C301: 1.13 | AO301: 否
A302: 000776.SZ | B302: 广发证券 | C302: 1.13 | D302: 19.75 | E302: 20.609999999999999 | F302: 23.199999999999999 | H302: 22.780000000000001 | I302: 13.98 | J302: 27.219999999999999 | K302: 21.100000000000001 | L302: =(H302-I302)/I302 -> 0.62947067238912735 | M302: =(J302-H302)/J302 -> 0.1631153563556208 | N302: =(J302-K302)/K302 -> 0.2900473933649288 | AM302: 不宜入场(当前股价低于50日均线，应该持续观察2w) | AN302: 44570 | AO302: 是
A303: 002034.SZ | B303: 旺能环境 | C303: 1.13 | AO303: 是
A304: 003043.SZ | B304: 华亚智能 | C304: 1.13 | D304: 63.909999999999997 | E304: 68.200000000000003 | F304: 78.430000000000007 | H304: 74.700000000000003 | AM304: 不宜入场（当前股价小于50日均线,应观察2w） | AN304: 44579 | AO304: 是
A305: 600048.SH | B305: 保利发展 | C305: 1.13 | D305: 13.31 | E305: 13.25 | F305: 13.890000000000001 | L305: =(H305-I305)/I305 -> #DIV/0! | M305: =(J305-H305)/J305 -> #DIV/0! | N305: =(J305-K305)/K305 -> #DIV/0! | AA305: =(J305-O305)/J305 -> #DIV/0! | AB305: =(P305-Q305)/P305 -> #DIV/0! | AM305: 不宜入场(150日均线小于200日均线) | AN305: 44548 | AO305: 是
A306: 601615.SH | B306: 明阳智能 | C306: 1.13 | D306: 23.800000000000001 | E306: 24.850000000000001 | F306: 28.870000000000001 | H306: 27.190000000000001 | L306: =(H306-I306)/I306 -> #DIV/0! | M306: =(J306-H306)/J306 -> #DIV/0! | N306: =(J306-K306)/K306 -> #DIV/0! | AA306: =(J306-O306)/J306 -> #DIV/0! | AB306: =(P306-Q306)/P306 -> #DIV/0! | AM306: 不宜入场(各均线斜率向下) | AN306: 44548 | AO306: 是
A307: 002271.SZ | B307: 东方雨虹 | C307: 1.12 | AO307: 否
A308: 603288.SH | B308: 海天味业 | C308: 1.12 | AO308: 否
A309: 603666.SH | B309: 亿嘉和 | C309: 1.12 | D309: 62.43 | E309: 63.329999999999998 | F309: 69.390000000000001 | H309: 71.840000000000003 | I309: 46.350000000000001 | J309: 84 | K309: 48.219999999999999 | L309: =(H309-I309)/I309 -> 0.54994606256742185 | M309: =(J309-H309)/J309 -> 0.14476190476190473 | N309: =(J309-K309)/K309 -> 0.74201576109498135 | O309: 66.989999999999995 | Z309: 4w | AA309: =(J309-O309)/J309 -> 0.20250000000000007 | AB309: =(P309-Q309)/P309 -> #DIV/0! | AM309: 不宜入场(时间周期太短，应观察2w) | AN309: 44574 | AO309: 是
A310: 605377.SH | B310: 华旺科技 | C310: 1.12 | D310: 16.149999999999999 | E310: 16.420000000000002 | F310: 16.829999999999998 | H310: 17.199999999999999 | I310: 12.49 | J310: 20.579999999999998 | K310: 16.109999999999999 | L310: =(H310-I310)/I310 -> 0.37710168134507599 | M310: =(J310-H310)/J310 -> 0.16423712342079685 | N310: =(J310-K310)/K310 -> 0.27746741154562377 | O310: 15.08 | P310: 17.550000000000001 | Q310: 16 | R310: 17.690000000000001 | S310: 16.399999999999999 | Z310: 15w | AA310: =(J310-O310)/J310 -> 0.26724975704567533 | AB310: =(P310-Q310)/P310 -> 8.8319088319088357e-02 | AM310: 不宜入场(收缩幅度不够，应观察3w) | AN310: 44557 | AO310: 是
A311: 002233.SZ | B311: 塔牌集团 | C311: 1.12 | AO311: 否
A312: 002759.SZ | B312: 天际股份 | C312: 1.11 | AO312: 否
A313: 600885.SH | B313: 宏发股份 | C313: 1.1000000000000001 | D313: 64.670000000000002 | E313: 66.980000000000004 | F313: 71.760000000000005 | H313: 65.099999999999994 | I313: 44.659999999999997 | J313: 81.239999999999995 | K313: 61.130000000000003 | L313: =(H313-I313)/I313 -> 0.45768025078369906 | M313: =(J313-H313)/J313 -> 0.19867060561299854 | N313: =(J313-K313)/K313 -> 0.32897104531326665 | AM313: 不宜入场(当前股价小于50日均线，应持续观察1w) | AN313: 44570 | AO313: 是
A314: 003023.SZ | B314: 彩虹集团 | C314: 1.1000000000000001 | AO314: 否
A315: 600782.SH | B315: 新钢股份 | C315: 1.1000000000000001 | AO315: 否
A316: 603279.SH | B316: 景津装备 | C316: 1.1000000000000001 | D316: 33.939999999999998 | E316: 35.96 | F316: 41.100000000000001 | H316: 38.850000000000001 | AM316: 不宜入场(当前股价小于50日均线，应持续观察1w) | AN316: 44586 | AO316: 是
A317: 002092.SZ | B317: 中泰化学 | C317: 1.1000000000000001 | AO317: 否
A318: 000960.SZ | B318: 锡业股份 | C318: 1.09 | D318: 17.379999999999999 | E318: 17.73 | F318: 18.170000000000002 | H318: 18.34 | I318: 9.5399999999999991 | J318: 26.300000000000001 | K318: 15.6 | L318: =(H318-I318)/I318 -> 0.92243186582809245 | M318: =(J318-H318)/J318 -> 0.30266159695817491 | N318: =(J318-K318)/K318 -> 0.68589743589743601 | AA318: =(J318-O318)/J318 -> 1 | AB318: =(P318-Q318)/P318 -> #DIV/0! | AM318: 已分析（当前股价距离最高点距离过大，面临较大抛压） | AN318: 44570 | AO318: 是
A319: 002430.SZ | B319: 杭氧股份 | C319: 1.09 | AO319: 否
A320: 002626.SZ | B320: 金达威 | C320: 1.09 | AO320: 否
A321: 603662.SH | B321: 柯力传感 | C321: 1.09 | AO321: 是
A322: 000963.SZ | B322: 华东医药 | C322: 1.08 | AO322: 否
A323: 002960.SZ | B323: 青鸟消防 | C323: 1.08 | D323: 33.939999999999998 | E323: 35.390000000000001 | F323: 42.240000000000002 | H323: 49.100000000000001 | I323: 20.260000000000002 | J323: 51.670000000000002 | K323: 36.420000000000002 | L323: =(H323-I323)/I323 -> 1.4234945705824282 | M323: =(J323-H323)/J323 -> 4.9738726533772017e-02 | N323: =(J323-K323)/K323 -> 0.41872597473915429 | O323: 47.140000000000001 | Z323: 1w | AA323: =(J323-O323)/J323 -> 8.7671763112057308e-02 | AB323: =(P323-Q323)/P323 -> #DIV/0! | AM323: 不宜入场(收缩幅度不够，应观察1w) | AN323: 44586 | AO323: 是
A324: 600587.SH | B324: 新华医疗 | C324: 1.08 | D324: 23.059999999999999 | E324: 24.27 | F324: 27.07 | H324: 28.850000000000001 | I324: 12.210000000000001 | J324: 36.890000000000001 | K324: 25.859999999999999 | L324: =(H324-I324)/I324 -> 1.3628173628173628 | M324: =(J324-H324)/J324 -> 0.21794524261317427 | N324: =(J324-K324)/K324 -> 0.42652745552977578 | O324: 19.379999999999999 | P324: 27.850000000000001 | Q324: 23.93 | R324: 29.559999999999999 | S324: 27.050000000000001 | T324: 33.369999999999997 | U324: 28.34 | Z324: 13w | AA324: =(J324-O324)/J324 -> 0.47465437788018439 | AB324: =(P324-Q324)/P324 -> 0.14075403949730705 | AC324: =(R324-S324)/R324 -> 8.4912043301759069e-02 | AD324: =(T324-U324)/T324 -> 0.15073419238837274 | AM324: 不宜入场(收缩幅度不够，应观察5w) | AN324: 44570 | AO324: 是
A325: 603180.SH | B325: 金牌厨柜 | C325: 1.08 | AO325: 否
A326: 603612.SH | B326: 索通发展 | C326: 1.08 | AO326: 否
A327: 600176.SH | B327: 中国巨石 | C327: 1.08 | AO327: 否
A328: 600690.SH | B328: 海尔智家 | C328: 1.07 | AO328: 否
A329: 002254.SZ | B329: 泰和新材 | C329: 1.07 | AO329: 是
A330: 601101.SH | B330: 昊华能源 | C330: 1.07 | AO330: 是
A331: 603908.SH | B331: 牧高笛 | C331: 1.07 | D331: 30.309999999999999 | E331: 31.949999999999999 | F331: 36.299999999999997 | H331: 39.289999999999999 | I331: 18.239999999999998 | J331: 45.799999999999997 | K331: 24.579999999999998 | L331: =(H331-I331)/I331 -> 1.1540570175438598 | M331: =(J331-H331)/J331 -> 0.14213973799126634 | N331: =(J331-K331)/K331 -> 0.86330349877949553 | O331: 28.059999999999999 | P331: 41.75 | Q331: 37.390000000000001 | Z331: 13w | AA331: =(J331-O331)/J331 -> 0.38733624454148469 | AB331: =(P331-Q331)/P331 -> 0.10443113772455088 | AM331: 不宜入场（收缩幅度不够） | AN331: 44548 | AO331: 是
A332: 605100.SH | B332: 华丰股份 | C332: 1.07 | AO332: 否
A333: 002311.SZ | B333: 海大集团 | C333: 1.06 | AO333: 否
A334: 002993.SZ | B334: 奥海科技 | C334: 1.06 | AO334: 否
A335: 603380.SH | B335: 易德龙 | C335: 1.06 | D335: 31.670000000000002 | E335: 33.259999999999998 | F335: 37.859999999999999 | H335: 36.43 | AM335: 不宜入场(当前股价小于50日均线，应观察1w) | AN335: 44586 | AO335: 是
A336: 603535.SH | B336: 嘉诚国际 | C336: 1.06 | AO336: 否
A337: 605507.SH | B337: 国邦医药 | C337: 1.06 | AO337: 否
A338: 002595.SZ | B338: 豪迈科技 | C338: 1.05 | AO338: 否
A339: 600038.SH | B339: 中直股份 | C339: 1.05 | D339: 59.890000000000001 | E339: 61.43 | F339: 68.269999999999996 | H339: 71.590000000000003 | I339: 43.619999999999997 | J339: 78.799999999999997 | K339: 55.259999999999998 | L339: =(H339-I339)/I339 -> 0.64121962402567645 | M339: =(J339-H339)/J339 -> 9.1497461928933932e-02 | N339: =(J339-K339)/K339 -> 0.42598624683315239 | Z339: 1w | AA339: =(J339-O339)/J339 -> 1 | AB339: =(P339-Q339)/P339 -> #DIV/0! | AM339: 不宜入场(时间周期太短，应观察2w) | AN339: 44548 | AO339: 是
A340: 002078.SZ | B340: 太阳纸业 | C340: 1.05 | AO340: 否
A341: 603100.SH | B341: 川仪股份 | C341: 1.05 | D341: 17.550000000000001 | E341: 18.100000000000001 | F341: 19.27 | H341: 19.800000000000001 | I341: 11.6 | J341: 23.550000000000001 | K341: 17.350000000000001 | L341: =(H341-I341)/I341 -> 0.70689655172413801 | M341: =(J341-H341)/J341 -> 0.15923566878980891 | N341: =(J341-K341)/K341 -> 0.35734870317002876 | Z341: 12w | AA341: =(J341-O341)/J341 -> 1 | AB341: =(P341-Q341)/P341 -> #DIV/0! | AC341: 0.1865 | AM341: 不宜入场(收缩幅度不够，应观察3w) | AN341: 44548 | AO341: 是
A342: 605488.SH | B342: 福莱新材 | C342: 1.05 | AO342: 否
A343: 603233.SH | B343: 大参林 | C343: 1.04 | AO343: 否
A344: 603507.SH | B344: 振江股份 | C344: 1.04 | D344: 33.439999999999998 | E344: 35.740000000000002 | F344: 41.859999999999999 | H344: 36.829999999999998 | I344: 18.18 | J344: 56 | K344: 42.799999999999997 | L344: =(H344-I344)/I344 -> 1.0258525852585259 | M344: =(J344-H344)/J344 -> 0.34232142857142861 | N344: =(J344-K344)/K344 -> 0.30841121495327112 | AM344: 不宜入场(当前股价小于50日均线，应观察2w) | AN344: 44570 | AO344: 是
A345: 600248.SH | B345: 陕西建工 | C345: 1.03 | AO345: 是
A346: 000807.SZ | B346: 云铝股份 | C346: 1.03 | AO346: 否
A347: 000933.SZ | B347: 神火股份 | C347: 1.03 | AO347: 否
A348: 002039.SZ | B348: 黔源电力 | C348: 1.03 | D348: 17.149999999999999 | E348: 17.760000000000002 | F348: 19.629999999999999 | H348: 23.18 | I348: 13.039999999999999 | J348: 28.739999999999998 | K348: 13.82 | L348: =(H348-I348)/I348 -> 0.77760736196319025 | M348: =(J348-H348)/J348 -> 0.19345859429366732 | N348: =(J348-K348)/K348 -> 1.0795947901591894 | O348: 17.059999999999999 | P348: 23.5 | Q348: 20.039999999999999 | Z348: 11w | AA348: =(J348-O348)/J348 -> 0.40640222686151706 | AB348: =(P348-Q348)/P348 -> 0.14723404255319153 | AM348: 不宜入场(收缩幅度不够，应观察3w) | AN348: 44548 | AO348: 是
A349: 002444.SZ | B349: 巨星科技 | C349: 1.02 | AO349: 否
A350: 002918.SZ | B350: 蒙娜丽莎 | C350: 1.02 | AO350: 否
A351: 600183.SH | B351: 生益科技 | C351: 1.02 | AO351: 否
A352: 600660.SH | B352: 福耀玻璃 | C352: 1.02 | AO352: 否
A353: 001203.SZ | B353: 大中矿业 | C353: 1.01 | AO353: 否
A354: 001234.SZ | B354: 泰慕士 | C354: 1.01 | AO354: 是
A355: 002407.SZ | B355: 多氟多 | C355: 1.01 | AO355: 是
A356: 600075.SH | B356: 新疆天业 | C356: 1.01 | AO356: 否
A357: 600919.SH | B357: 江苏银行 | C357: 1.01 | AO357: 否
A358: 600997.SH | B358: 开滦股份 | C358: 1.01 | AO358: 否
A359: 603005.SH | B359: 晶方科技 | C359: 1.01 | AO359: 否
A360: 603230.SH | B360: 内蒙新华 | C360: 1.01 | AO360: 是
A361: 605358.SH | B361: 立昂微 | C361: 1.01 | AO361: 是
A362: 600456.SH | B362: 宝钛股份 | C362: 1.01 | AO362: 是
A363: 603109.SH | B363: 神驰机电 | C363: 1.01 | AO363: 是
A364: 000951.SZ | B364: 中国重汽 | C364: 1 | AO364: 否
A365: 002241.SZ | B365: 歌尔股份 | C365: 1 | AO365: 是
A366: 002493.SZ | B366: 荣盛石化 | C366: 1 | AO366: 否
A367: 002732.SZ | B367: 燕塘乳业 | C367: 1 | AO367: 是
A368: 000895.SZ | B368: 双汇发展 | C368: 1 | AO368: 否
A369: 600507.SH | B369: 方大特钢 | C369: 0.99 | AO369: 否
A370: 002919.SZ | B370: 名臣健康 | C370: 0.99 | AO370: 否
A371: 600535.SH | B371: 天士力 | C371: 0.99 | AO371: 是
A372: 603613.SH | B372: 国联股份 | C372: 0.99 | AO372: 是
A373: 603893.SH | B373: 瑞芯微 | C373: 0.99 | AO373: 是
A374: 605003.SH | B374: 众望布艺 | C374: 0.99 | AO374: 是
A375: 605028.SH | B375: 世茂能源 | C375: 0.99 | AO375: 是
A376: 600618.SH | B376: 氯碱化工 | C376: 0.99 | AO376: 是
A377: 603822.SH | B377: 嘉澳环保 | C377: 0.98 | D377: 38.43 | E377: 40.789999999999999 | F377: 44.789999999999999 | H377: 51.369999999999997 | I377: 15.01 | J377: 57 | K377: 41.840000000000003 | L377: =(H377-I377)/I377 -> 2.4223850766155897 | M377: =(J377-H377)/J377 -> 9.8771929824561455e-02 | N377: =(J377-K377)/K377 -> 0.36233269598470352 | O377: 39 | P377: 51.82 | Q377: 40.109999999999999 | Z377: 11w | AA377: =(J377-O377)/J377 -> 0.31578947368421051 | AB377: =(P377-Q377)/P377 -> 0.22597452720957162 | AM377: 不宜入场（收缩幅度不够,应观察3w） | AN377: 44579 | AO377: 是
A378: 000636.SZ | B378: 风华高科 | C378: 0.98 | AO378: 否
A379: 002636.SZ | B379: 金安国纪 | C379: 0.98 | AO379: 否
A380: 002870.SZ | B380: 香山股份 | C380: 0.98 | AO380: 是
A381: 002884.SZ | B381: 凌霄泵业 | C381: 0.98 | AO381: 是
A382: 002980.SZ | B382: 华盛昌 | C382: 0.98 | AO382: 否
A383: 600019.SH | B383: 宝钢股份 | C383: 0.98 | AO383: 否
A384: 603939.SH | B384: 益丰药房 | C384: 0.98 | AO384: 否
A385: 605277.SH | B385: 新亚电子 | C385: 0.98 | AO385: 是
A386: 003005.SZ | B386: 竞业达 | C386: 0.97 | AO386: 否
A387: 000949.SZ | B387: 新乡化纤 | C387: 0.97 | AO387: 否
A388: 603508.SH | B388: 思维列控 | C388: 0.97 | AO388: 是
A389: 603948.SH | B389: 建业股份 | C389: 0.97 | AO389: 是
A390: 600707.SH | B390: 彩虹股份 | C390: 0.97 | AO390: 否
A391: 000959.SZ | B391: 首钢股份 | C391: 0.96 | AO391: 否
A392: 001205.SZ | B392: 盛航股份 | C392: 0.96 | AO392: 是
A393: 001209.SZ | B393: 洪兴股份 | C393: 0.96 | AO393: 否
A394: 003027.SZ | B394: 同兴环保 | C394: 0.96 | AO394: 否
A395: 603008.SH | B395: 喜临门 | C395: 0.96 | AO395: 是
A396: 603738.SH | B396: 泰晶科技 | C396: 0.96 | AO396: 是
A397: 605289.SH | B397: 罗曼股份 | C397: 0.96 | AO397: 是
A398: 600845.SH | B398: 宝信软件 | C398: 0.96 | AO398: 是
A399: 000338.SZ | B399: 潍柴动力 | C399: 0.95 | AO399: 否
A400: 001210.SZ | B400: 金房节能 | C400: 0.95 | AO400: 否
A401: 600348.SH | B401: 华阳股份 | C401: 0.95 | AO401: 是
A402: 601168.SH | B402: 西部矿业 | C402: 0.95 | AO402: 否
A403: 603127.SH | B403: 昭衍新药 | C403: 0.95 | AO403: 否
A404: 603568.SH | B404: 伟明环保 | C404: 0.95 | AO404: 是
A405: 603950.SH | B405: 长源东谷 | C405: 0.95 | AO405: 否
A406: 605208.SH | B406: 永茂泰 | C406: 0.95 | AO406: 否
A407: 605500.SH | B407: 森林包装 | C407: 0.95 | AO407: 否
A408: 002738.SZ | B408: 中矿资源 | C408: 0.95 | AO408: 是
A409: 603801.SH | B409: 志邦家居 | C409: 0.95 | AO409: 否
A410: 000893.SZ | B410: 亚钾国际 | C410: 0.95 | D410: 18.699999999999999 | E410: 19.670000000000002 | F410: 22.460000000000001 | H410: 24.300000000000001 | I410: 7.9000000000000004 | J410: 28.670000000000002 | K410: 17.870000000000001 | L410: =(H410-I410)/I410 -> 2.0759493670886071 | M410: =(J410-H410)/J410 -> 0.15242413672828745 | N410: =(J410-K410)/K410 -> 0.60436485730274203 | O410: 22.350000000000001 | Z410: 2w | AA410: =(J410-O410)/J410 -> 0.22043948378095571 | AM410: 不宜入场（收缩幅度不够,应观察2w） | AN410: 44585 | AO410: 是
A411: 603365.SH | B411: 水星家纺 | C411: 0.94 | AO411: 是
A412: 603926.SH | B412: 铁流股份 | C412: 0.94 | AO412: 是
A413: 002572.SZ | B413: 索菲亚 | C413: 0.93 | AO413: 否
A414: 600352.SH | B414: 浙江龙盛 | C414: 0.93 | AO414: 否
A415: 000818.SZ | B415: 航锦科技 | C415: 0.93 | AO415: 是
A416: 002818.SZ | B416: 富森美 | C416: 0.93 | AO416: 否
A417: 601939.SH | B417: 建设银行 | C417: 0.93 | AO417: 否
A418: 603458.SH | B418: 勘设股份 | C418: 0.93 | AO418: 是
A419: 603466.SH | B419: 风语筑 | C419: 0.93 | AO419: 是
A420: 605337.SH | B420: 李子园 | C420: 0.93 | AO420: 是
A421: 000977.SZ | B421: 浪潮信息 | C421: 0.93 | AO421: 是
A422: 003041.SZ | B422: 真爱美家 | C422: 0.92 | AO422: 否
A423: 000761.SZ | B423: 本钢板材 | C423: 0.92 | AO423: 否
A424: 002867.SZ | B424: 周大生 | C424: 0.92 | AO424: 否
A425: 601668.SH | B425: 中国建筑 | C425: 0.92 | AO425: 是
A426: 603538.SH | B426: 美诺华 | C426: 0.92 | AO426: 否
A427: 603639.SH | B427: 海利尔 | C427: 0.92 | AO427: 是
A428: 002798.SZ | B428: 帝欧家居 | C428: 0.92 | AO428: 否
A429: 002129.SZ | B429: 中环股份 | C429: 0.91 | AO429: 是
A430: 002023.SZ | B430: 海特高新 | C430: 0.91 | AO430: 否
A431: 002025.SZ | B431: 航天电器 | C431: 0.91 | AO431: 是
A432: 002462.SZ | B432: 嘉事堂 | C432: 0.91 | AO432: 是
A433: 002853.SZ | B433: 皮阿诺 | C433: 0.91 | AO433: 否
A434: 600835.SH | B434: 上海机电 | C434: 0.91 | AO434: 否
A435: 600837.SH | B435: 海通证券 | C435: 0.91 | AO435: 是
A436: 600999.SH | B436: 招商证券 | C436: 0.91 | AO436: 否
A437: 605338.SH | B437: 巴比食品 | C437: 0.91 | AO437: 否
A438: 000990.SZ | B438: 诚志股份 | C438: 0.91 | AO438: 是
A439: 601717.SH | B439: 郑煤机 | C439: 0.91 | AO439: 是
A440: 601003.SH | B440: 柳钢股份 | C440: 0.90000000000000002 | AO440: 否
A441: 603520.SH | B441: 司太立 | C441: 0.90000000000000002 | AO441: 否
A442: 603596.SH | B442: 伯特利 | C442: 0.90000000000000002 | AO442: 是
A443: 603610.SH | B443: 麒盛科技 | C443: 0.90000000000000002 | AO443: 是
A444: 605006.SH | B444: 山东玻纤 | C444: 0.90000000000000002 | AO444: 否
A445: 603989.SH | B445: 艾华集团 | C445: 0.90000000000000002 | AO445: 是
A446: 002920.SZ | B446: 德赛西威 | C446: 0.89 | AO446: 是
A447: 601066.SH | B447: 中信建投 | C447: 0.89 | AO447: 否
A448: 601898.SH | B448: 中煤能源 | C448: 0.89 | AO448: 否
A449: 603013.SH | B449: 亚普股份 | C449: 0.89 | AO449: 是
A450: 603855.SH | B450: 华荣股份 | C450: 0.89 | AO450: 是
A451: 000906.SZ | B451: 浙商中拓 | C451: 0.88 | AO451: 是
A452: 000910.SZ | B452: 大亚圣象 | C452: 0.88 | AO452: 否
A453: 002984.SZ | B453: 森麒麟 | C453: 0.88 | AO453: 否
A454: 003019.SZ | B454: 宸展光电 | C454: 0.88 | AO454: 是
A455: 600500.SH | B455: 中化国际 | C455: 0.88 | AO455: 是
A456: 600546.SH | B456: 山煤国际 | C456: 0.88 | AO456: 是
A457: 603611.SH | B457: 诺力股份 | C457: 0.88 | AO457: 是
A458: 600586.SH | B458: 金晶科技 | C458: 0.87 | AO458: 否
A459: 600111.SH | B459: 北方稀土 | C459: 0.87 | D459: 39.880000000000003 | E459: 42.609999999999999 | F459: 46.520000000000003 | H459: 42.329999999999998 | AM459: 不宜入场（当前股价小于150日均线,应观察3w） | AN459: 44579 | AO459: 是
A460: 603590.SH | B460: 康辰药业 | C460: 0.87 | AO460: 否
A461: 002242.SZ | B461: 九阳股份 | C461: 0.87 | AO461: 否
A462: 600015.SH | B462: 华夏银行 | C462: 0.87 | AO462: 否
A463: 600325.SH | B463: 华发股份 | C463: 0.87 | AO463: 是
A464: 600606.SH | B464: 绿地控股 | C464: 0.87 | AO464: 否
A465: 601825.SH | B465: 沪农商行 | C465: 0.87 | AO465: 否
A466: 603916.SH | B466: 苏博特 | C466: 0.87 | AO466: 是
A467: 603871.SH | B467: 嘉友国际 | C467: 0.87 | AO467: 是
A468: 600273.SH | B468: 嘉化能源 | C468: 0.86 | AO468: 是
A469: 600900.SH | B469: 长江电力 | C469: 0.86 | AO469: 是
A470: 001215.SZ | B470: 千味央厨 | C470: 0.86 | D470: 45.079999999999998 | E470: 49.149999999999999 | F470: 59.240000000000002 | H470: 52.75 | AM470: 不宜入场（当前股价小于50日均线,应观察2w） | AN470: 44580 | AO470: 是
A471: 600177.SH | B471: 雅戈尔 | C471: 0.86 | AO471: 否
A472: 600329.SH | B472: 中新药业 | C472: 0.86 | AO472: 是
A473: 600508.SH | B473: 上海能源 | C473: 0.86 | AO473: 否
A474: 601800.SH | B474: 中国交建 | C474: 0.86 | AO474: 是
A475: 603283.SH | B475: 赛腾股份 | C475: 0.86 | AO475: 是
A476: 605068.SH | B476: 明新旭腾 | C476: 0.86 | AO476: 是
A477: 002208.SZ | B477: 合肥城建 | C477: 0.86 | AO477: 是
A478: 002864.SZ | B478: 盘龙药业 | C478: 0.85 | AO478: 是
A479: 600062.SH | B479: 华润双鹤 | C479: 0.85 | AO479: 是
A480: 000935.SZ | B480: 四川双马 | C480: 0.85 | AO480: 是
A481: 002594.SZ | B481: 比亚迪 | C481: 0.85 | AO481: 是
A482: 002832.SZ | B482: 比音勒芬 | C482: 0.85 | AO482: 是
A483: 600993.SH | B483: 马应龙 | C483: 0.85 | AO483: 是
A484: 603192.SH | B484: 汇得科技 | C484: 0.85 | AO484: 是
A485: 603298.SH | B485: 杭叉集团 | C485: 0.85 | AO485: 否
A486: 600808.SH | B486: 马钢股份 | C486: 0.85 | AO486: 否
A487: 002585.SZ | B487: 双星新材 | C487: 0.84 | AO487: 是
A488: 002169.SZ | B488: 智光电气 | C488: 0.84 | AO488: 是
A489: 000703.SZ | B489: 恒逸石化 | C489: 0.84 | AO489: 否
A490: 000902.SZ | B490: 新洋丰 | C490: 0.84 | AO490: 否
A491: 002986.SZ | B491: 宇新股份 | C491: 0.84 | AO491: 是
A492: 601169.SH | B492: 北京银行 | C492: 0.84 | AO492: 是
A493: 603228.SH | B493: 景旺电子 | C493: 0.84 | AO493: 是
A494: 000498.SZ | B494: 山东路桥 | C494: 0.83 | AO494: 是
A495: 002459.SZ | B495: 晶澳科技 | C495: 0.83 | AO495: 是
A496: 002961.SZ | B496: 瑞达期货 | C496: 0.83 | AO496: 是
A497: 002987.SZ | B497: 京北方 | C497: 0.83 | AO497: 是
A498: 002991.SZ | B498: 甘源食品 | C498: 0.83 | AO498: 是
A499: 601998.SH | B499: 中信银行 | C499: 0.83 | AO499: 否
A500: 603187.SH | B500: 海容冷链 | C500: 0.83 | AO500: 是
A501: 603355.SH | B501: 莱克电气 | C501: 0.83 | AO501: 否
A502: 603515.SH | B502: 欧普照明 | C502: 0.83 | AO502: 否
A503: 605058.SH | B503: 澳弘电子 | C503: 0.83 | AO503: 是
A504: 002757.SZ | B504: 南兴股份 | C504: 0.83 | AO504: 是
A505: 002396.SZ | B505: 星网锐捷 | C505: 0.83 | AO505: 是
A506: 001219.SZ | B506: 青岛食品 | C506: 0.82 | AO506: 是
A507: 003013.SZ | B507: 地铁设计 | C507: 0.82 | AO507: 否
A508: 600548.SH | B508: 深高速 | C508: 0.82 | AO508: 是
A509: 603319.SH | B509: 湘油泵 | C509: 0.82 | AO509: 是
A510: 002409.SZ | B510: 雅克科技 | C510: 0.82 | AO510: 否
A511: 002810.SZ | B511: 山东赫达 | C511: 0.82 | AO511: 是
A512: 002236.SZ | B512: 大华股份 | C512: 0.81 | AO512: 否
A513: 002408.SZ | B513: 齐翔腾达 | C513: 0.81 | AO513: 是
A514: 002859.SZ | B514: 洁美科技 | C514: 0.81 | AO514: 是
A515: 003038.SZ | B515: 鑫铂股份 | C515: 0.81 | D515: 52.850000000000001 | E515: 56.710000000000001 | F515: 69.120000000000005 | H515: 64.5 | AM515: 不宜入场（当前股价小于50日均线,应观察2w） | AN515: 44579 | AO515: 是
A516: 600097.SH | B516: 开创国际 | C516: 0.81 | AO516: 是
A517: 603096.SH | B517: 新经典 | C517: 0.81 | AO517: 否
A518: 603359.SH | B518: 东珠生态 | C518: 0.81 | AO518: 是
A519: 603700.SH | B519: 宁水集团 | C519: 0.81 | AO519: 否
A520: 000656.SZ | B520: 金科股份 | C520: 0.80000000000000004 | AO520: 否
A521: 000685.SZ | B521: 中山公用 | C521: 0.80000000000000004 | AO521: 是
A522: 000988.SZ | B522: 华工科技 | C522: 0.80000000000000004 | AO522: 是
A523: 002088.SZ | B523: 鲁阳节能 | C523: 0.80000000000000004 | D523: 19.91 | E523: 21.030000000000001 | F523: 23.489999999999998 | H523: 21.920000000000002 | AM523: 不宜入场（当前股价小于50日均线,应观察2w） | AN523: 44579 | AO523: 是
A524: 002555.SZ | B524: 三七互娱 | C524: 0.80000000000000004 | AO524: 是
A525: 002758.SZ | B525: 浙农股份 | C525: 0.80000000000000004 | AO525: 是
A526: 002761.SZ | B526: 浙江建投 | C526: 0.80000000000000004 | AO526: 否
A527: 601328.SH | B527: 交通银行 | C527: 0.80000000000000004 | AO527: 是
A528: 601865.SH | B528: 福莱特 | C528: 0.80000000000000004 | AO528: 是
A529: 603048.SH | B529: 浙江黎明 | C529: 0.80000000000000004 | AO529: 是
A530: 605099.SH | B530: 共创草坪 | C530: 0.80000000000000004 | AO530: 否
A531: 000026.SZ | B531: 飞亚达 | C531: 0.80000000000000004 | AO531: 否
A532: 000898.SZ | B532: 鞍钢股份 | C532: 0.80000000000000004 | AO532: 否
A533: 003025.SZ | B533: 思进智能 | C533: 0.79 | AO533: 是
A534: 003033.SZ | B534: 征和工业 | C534: 0.79 | AO534: 否
A535: 603035.SH | B535: 常熟汽饰 | C535: 0.79 | AO535: 是
A536: 603386.SH | B536: 广东骏亚 | C536: 0.79 | AO536: 是
A537: 603719.SH | B537: 良品铺子 | C537: 0.79 | AO537: 否
A538: 605007.SH | B538: 五洲特纸 | C538: 0.79 | AO538: 是
A539: 605020.SH | B539: 永和股份 | C539: 0.79 | D539: 27.079999999999998 | E539: 29.140000000000001 | F539: 31.309999999999999 | H539: 27.960000000000001 | AM539: 不宜入场（当前股价小于150日均线,应观察3w） | AN539: 44579 | AO539: 是
A540: 600529.SH | B540: 山东药玻 | C540: 0.79 | AO540: 是
A541: 002774.SZ | B541: 快意电梯 | C541: 0.79 | AO541: 是
A542: 603043.SH | B542: 广州酒家 | C542: 0.78 | AO542: 否
A543: 600056.SH | B543: 中国医药 | C543: 0.78 | AO543: 否
A544: 001207.SZ | B544: 联科科技 | C544: 0.78 | AO544: 否
A545: 002539.SZ | B545: 云图控股 | C545: 0.78 | AO545: 是
A546: 002940.SZ | B546: 昂利康 | C546: 0.78 | AO546: 是
A547: 600216.SH | B547: 浙江医药 | C547: 0.78 | AO547: 是
A548: 601678.SH | B548: 滨化股份 | C548: 0.78 | AO548: 否
A549: 601900.SH | B549: 南方传媒 | C549: 0.78 | AO549: 是
A550: 603277.SH | B550: 银都股份 | C550: 0.78 | AO550: 否
A551: 603324.SH | B551: 盛剑环境 | C551: 0.78 | AO551: 是
A552: 603722.SH | B552: 阿科力 | C552: 0.78 | AO552: 是
A553: 603867.SH | B553: 新化股份 | C553: 0.78 | AO553: 是
A554: 002487.SZ | B554: 大金重工 | C554: 0.78 | D554: 25.059999999999999 | E554: 28.199999999999999 | F554: 37.289999999999999 | H554: 33.369999999999997 | AM554: 不宜入场（当前股价小于50日均线,应观察2w） | AN554: 44579 | AO554: 是
A555: 600742.SH | B555: 一汽富维 | C555: 0.78 | AO555: 是
A556: 000983.SZ | B556: 山西焦煤 | C556: 0.77 | AO556: 是
A557: 002873.SZ | B557: 新天药业 | C557: 0.77 | AO557: 是
A558: 601666.SH | B558: 平煤股份 | C558: 0.77 | AO558: 是
A559: 001317.SZ | B559: 三羊马 | C559: 0.77 | D559: 34.890000000000001 | E559: 38.289999999999999 | F559: 58 | H559: 85.030000000000001 | I559: 19.199999999999999 | J559: 108.63 | K559: 19.199999999999999 | L559: =(H559-I559)/I559 -> 3.4286458333333334 | M559: =(J559-H559)/J559 -> 0.21725121973672093 | N559: =(J559-K559)/K559 -> 4.6578124999999995 | O559: 72.680000000000007 | Z559: 2w | AA559: =(J559-O559)/J559 -> 0.33093988769216598 | AM559: 不宜入场（收缩幅度不够,应观察2w） | AN559: 44579 | AO559: 是
A560: 002989.SZ | B560: 中天精装 | C560: 0.77 | AO560: 否
A561: 003009.SZ | B561: 中天火箭 | C561: 0.77 | AO561: 否
A562: 600007.SH | B562: 中国国贸 | C562: 0.77 | AO562: 否
A563: 600804.SH | B563: 鹏博士 | C563: 0.77 | AO563: 是
A564: 601077.SH | B564: 渝农商行 | C564: 0.77 | AO564: 否
A565: 603585.SH | B565: 苏利股份 | C565: 0.77 | AO565: 是
A566: 603727.SH | B566: 博迈科 | C566: 0.77 | AO566: 否
A567: 000800.SZ | B567: 一汽解放 | C567: 0.77 | AO567: 否
A568: 002760.SZ | B568: 凤形股份 | C568: 0.76 | AO568: 是
A569: 002896.SZ | B569: 中大力德 | C569: 0.76 | AO569: 是
A570: 003021.SZ | B570: 兆威机电 | C570: 0.76 | AO570: 是
A571: 600727.SH | B571: 鲁北化工 | C571: 0.76 | AO571: 是
A572: 603115.SH | B572: 海星股份 | C572: 0.76 | AO572: 是
A573: 603337.SH | B573: 杰克股份 | C573: 0.76 | AO573: 否
A574: 600859.SH | B574: 王府井 | C574: 0.76 | AO574: 否
A575: 000828.SZ | B575: 东莞控股 | C575: 0.76 | AO575: 否
A576: 002995.SZ | B576: 天地在线 | C576: 0.76 | AO576: 否
A577: 002942.SZ | B577: 新农股份 | C577: 0.76 | AO577: 否
A578: 600377.SH | B578: 宁沪高速 | C578: 0.75 | AO578: 否
A579: 002138.SZ | B579: 顺络电子 | C579: 0.75 | AO579: 否
A580: 002568.SZ | B580: 百润股份 | C580: 0.75 | AO580: 否
A581: 002736.SZ | B581: 国信证券 | C581: 0.75 | AO581: 否
A582: 003011.SZ | B582: 海象新材 | C582: 0.75 | AO582: 是
A583: 600016.SH | B583: 民生银行 | C583: 0.75 | AO583: 否
A584: 601869.SH | B584: 长飞光纤 | C584: 0.75 | AO584: 是
A585: 603898.SH | B585: 好莱客 | C585: 0.75 | AO585: 否
A586: 605155.SH | B586: 西大门 | C586: 0.75 | AO586: 否
A587: 605286.SH | B587: 同力日升 | C587: 0.75 | AO587: 是
A588: 605589.SH | B588: 圣泉集团 | C588: 0.75 | AO588: 是
A589: 002801.SZ | B589: 微光股份 | C589: 0.74 | AO589: 否
A590: 002966.SZ | B590: 苏州银行 | C590: 0.74 | AO590: 否
A591: 600760.SH | B591: 中航沈飞 | C591: 0.74 | AO591: 否
A592: 601512.SH | B592: 中新集团 | C592: 0.74 | AO592: 否
A593: 603305.SH | B593: 旭升股份 | C593: 0.74 | AO593: 是
A594: 603686.SH | B594: 福龙马 | C594: 0.74 | AO594: 否
A595: 603915.SH | B595: 国茂股份 | C595: 0.74 | AO595: 否
A596: 605081.SH | B596: 太和水 | C596: 0.74 | AO596: 否
A597: 600409.SH | B597: 三友化工 | C597: 0.74 | AO597: 否
A598: 000090.SZ | B598: 天健集团 | C598: 0.73 | AO598: 是
A599: 002603.SZ | B599: 以岭药业 | C599: 0.73 | AO599: 是
A600: 603626.SH | B600: 科森科技 | C600: 0.73 | AO600: 是
A601: 601390.SH | B601: 中国中铁 | C601: 0.73 | AO601: 是
A602: 002346.SZ | B602: 柘中股份 | C602: 0.73 | AO602: 是
A603: 600383.SH | B603: 金地集团 | C603: 0.73 | AO603: 是
A604: 600989.SH | B604: 宝丰能源 | C604: 0.73 | AO604: 是
A605: 603040.SH | B605: 新坐标 | C605: 0.73 | AO605: 否
A606: 603566.SH | B606: 普莱柯 | C606: 0.73 | AO606: 是
A607: 605069.SH | B607: 正和生态 | C607: 0.73 | AO607: 否
A608: 600039.SH | B608: 四川路桥 | C608: 0.73 | AO608: 是
A609: 002968.SZ | B609: 新大正 | C609: 0.72 | AO609: 否
A610: 000961.SZ | B610: 中南建设 | C610: 0.72 | AO610: 否
A611: 600740.SH | B611: 山西焦化 | C611: 0.72 | AO611: 否
A612: 002043.SZ | B612: 兔宝宝 | C612: 0.72 | AO612: 是
A613: 002433.SZ | B613: 太安堂 | C613: 0.72 | AO613: 是
A614: 002734.SZ | B614: 利民股份 | C614: 0.72 | AO614: 是
A615: 002938.SZ | B615: 鹏鼎控股 | C615: 0.72 | AO615: 是
A616: 600171.SH | B616: 上海贝岭 | C616: 0.72 | AO616: 否
A617: 600750.SH | B617: 江中药业 | C617: 0.72 | AO617: 是
A618: 603396.SH | B618: 金辰股份 | C618: 0.72 | AO618: 是
A619: 603506.SH | B619: 南都物业 | C619: 0.72 | AO619: 是
A620: 603808.SH | B620: 歌力思 | C620: 0.72 | AO620: 否
A621: 002705.SZ | B621: 新宝股份 | C621: 0.72 | AO621: 否
A622: 000048.SZ | B622: 京基智农 | C622: 0.72 | AO622: 否
A623: 002949.SZ | B623: 华阳国际 | C623: 0.72 | AO623: 否
A624: 002753.SZ | B624: 永东股份 | C624: 0.71 | AO624: 否
A625: 600643.SH | B625: 爱建集团 | C625: 0.71 | AO625: 否
A626: 603970.SH | B626: 中农立华 | C626: 0.71 | AO626: 是
A627: 000501.SZ | B627: 鄂武商A | C627: 0.71 | AO627: 否
A628: 002146.SZ | B628: 荣盛发展 | C628: 0.71 | AO628: 否
A629: 002543.SZ | B629: 万和电气 | C629: 0.71 | AO629: 否
A630: 002722.SZ | B630: 金轮股份 | C630: 0.71 | AO630: 是
A631: 002773.SZ | B631: 康弘药业 | C631: 0.71 | AO631: 否
A632: 600057.SH | B632: 厦门象屿 | C632: 0.71 | AO632: 是
A633: 601015.SH | B633: 陕西黑猫 | C633: 0.71 | AO633: 否
A634: 603329.SH | B634: 上海雅仕 | C634: 0.71 | AO634: 是
A635: 603859.SH | B635: 能科科技 | C635: 0.71 | AO635: 否
A636: 603931.SH | B636: 格林达 | C636: 0.71 | AO636: 否
A637: 600549.SH | B637: 厦门钨业 | C637: 0.71 | AO637: 否
A638: 600378.SH | B638: 昊华科技 | C638: 0.71 | AO638: 是
A639: 002831.SZ | B639: 裕同科技 | C639: 0.69999999999999996 | AO639: 是
A640: 000157.SZ | B640: 中联重科 | C640: 0.69999999999999996 | AO640: 否
A641: 002384.SZ | B641: 东山精密 | C641: 0.69999999999999996 | AO641: 是
A642: 002677.SZ | B642: 浙江美大 | C642: 0.69999999999999996 | AO642: 否
A643: 601918.SH | B643: 新集能源 | C643: 0.69999999999999996 | AO643: 否
A644: 603165.SH | B644: 荣晟环保 | C644: 0.69999999999999996 | AO644: 是
A645: 603387.SH | B645: 基蛋生物 | C645: 0.69999999999999996 | AO645: 否
A646: 603823.SH | B646: 百合花 | C646: 0.69999999999999996 | AO646: 否
A647: 605339.SH | B647: 南侨食品 | C647: 0.69999999999999996 | AO647: 是
A648: 600475.SH | B648: 华光环能 | C648: 0.69999999999999996 | AO648: 是
A649: 601928.SH | B649: 凤凰传媒 | C649: 0.69999999999999996 | AO649: 是
A650: 002240.SZ | B650: 盛新锂能 | C650: 0.69999999999999996 | AO650: 是
A651: 605258.SH | B651: 协和电子 | C651: 0.69999999999999996 | AO651: 否
A652: 001979.SZ | B652: 招商蛇口 | C652: 0.69 | AO652: 是
A653: 002532.SZ | B653: 天山铝业 | C653: 0.69 | AO653: 否
A654: 002737.SZ | B654: 葵花药业 | C654: 0.69 | AO654: 是
A655: 002824.SZ | B655: 和胜股份 | C655: 0.69 | D655: 34.899999999999999 | E655: 37 | F655: 41.439999999999998 | H655: 44.350000000000001 | I655: 12.77 | J655: 50.990000000000002 | K655: 32.18 | L655: =(H655-I655)/I655 -> 2.4729835552075179 | M655: =(J655-H655)/J655 -> 0.13022161208080016 | N655: =(J655-K655)/K655 -> 0.58452454940957121 | O655: 37.57 | P655: 47 | Q655: 39.020000000000003 | Z655: 10w | AA655: =(J655-O655)/J655 -> 0.2631888605608943 | AB655: =(P655-Q655)/P655 -> 0.16978723404255314 | AC655: =(R655-S655)/R655 -> #DIV/0! | AM655: 不宜入场（收缩幅度不够,应观察1w） | AN655: 44585 | AO655: 是
A656: 600079.SH | B656: 人福医药 | C656: 0.69 | AO656: 否
A657: 600761.SH | B657: 安徽合力 | C657: 0.69 | AO657: 是
A658: 601006.SH | B658: 大秦铁路 | C658: 0.69 | AO658: 是
A659: 601398.SH | B659: 工商银行 | C659: 0.69 | AO659: 否
A660: 601689.SH | B660: 拓普集团 | C660: 0.69 | AO660: 是
A661: 601881.SH | B661: 中国银河 | C661: 0.69 | AO661: 是
A662: 603076.SH | B662: 乐惠国际 | C662: 0.69 | AO662: 否
A663: 603213.SH | B663: 镇洋发展 | C663: 0.69 | AO663: 是
A664: 603357.SH | B664: 设计总院 | C664: 0.69 | AO664: 是
A665: 603511.SH | B665: 爱慕股份 | C665: 0.69 | AO665: 否
A666: 603707.SH | B666: 健友股份 | C666: 0.69 | AO666: 是
A667: 603757.SH | B667: 大元泵业 | C667: 0.69 | AO667: 否
A668: 002202.SZ | B668: 金风科技 | C668: 0.69 | AO668: 是
A669: 000717.SZ | B669: 韶钢松山 | C669: 0.69 | AO669: 否
A670: 000792.SZ | B670: 盐湖股份 | C670: 0.68 | D670: 23.899999999999999 | E670: 26.170000000000002 | F670: 30.940000000000001 | H670: 26.949999999999999 | I670: 7.6600000000000001 | J670: 45.649999999999999 | K670: 8.7599999999999998 | L670: =(H670-I670)/I670 -> 2.5182767624020888 | M670: =(J670-H670)/J670 -> 0.40963855421686746 | N670: =(J670-K670)/K670 -> 4.2111872146118721 | AM670: 不宜入场（当前股价相对于最高点距离太大,应观察1w） | AN670: 44582 | AO670: 是
A671: 002158.SZ | B671: 汉钟精机 | C671: 0.68 | AO671: 否
A672: 605169.SH | B672: 洪通燃气 | C672: 0.68 | AO672: 否
A673: 000921.SZ | B673: 海信家电 | C673: 0.68 | AO673: 否
A674: 002281.SZ | B674: 光迅科技 | C674: 0.68 | AO674: 否
A675: 600461.SH | B675: 洪城环境 | C675: 0.68 | AO675: 是
A676: 601788.SH | B676: 光大证券 | C676: 0.68 | AO676: 否
A677: 601966.SH | B677: 玲珑轮胎 | C677: 0.68 | AO677: 否
A678: 603786.SH | B678: 科博达 | C678: 0.68 | AO678: 是
A679: 605376.SH | B679: 博迁新材 | C679: 0.68 | AO679: 是
A680: 000062.SZ | B680: 深圳华强 | C680: 0.68 | AO680: 是
A681: 600971.SH | B681: 恒源煤电 | C681: 0.68 | AO681: 否
A682: 600338.SH | B682: 西藏珠峰 | C682: 0.68 | D682: 28.02 | E682: 30.18 | F682: 33.450000000000003 | H682: 31.52 | AM682: 不宜入场（当前股价小于50日均线,应观察2w） | AN682: 44579 | AO682: 是
A683: 000100.SZ | B683: TCL科技 | C683: 0.68 | AO683: 否
A684: 600143.SH | B684: 金发科技 | C684: 0.67 | AO684: 否
A685: 002645.SZ | B685: 华宏科技 | C685: 0.67 | D685: 19.41 | E685: 20.460000000000001 | F685: 23.170000000000002 | H685: 23.510000000000002 | I685: 8.2200000000000006 | J685: 28.600000000000001 | K685: 19.219999999999999 | L685: =(H685-I685)/I685 -> 1.8600973236009732 | M685: =(J685-H685)/J685 -> 0.17797202797202796 | N685: =(J685-K685)/K685 -> 0.4880332986472426 | O685: 21.800000000000001 | Z685: 7w | AA685: =(J685-O685)/J685 -> 0.23776223776223779 | AB685: =(P685-Q685)/P685 -> #DIV/0! | AM685: 不宜入场（收缩幅度不够,应持续观察1w） | AN685: 44585 | AO685: 是
A686: 600085.SH | B686: 同仁堂 | C686: 0.67 | AO686: 是
A687: 000429.SZ | B687: 粤高速A | C687: 0.67 | AO687: 是
A688: 000887.SZ | B688: 中鼎股份 | C688: 0.67 | AO688: 是
A689: 002026.SZ | B689: 山东威达 | C689: 0.67 | AO689: 是
A690: 002262.SZ | B690: 恩华药业 | C690: 0.67 | AO690: 是
A691: 002475.SZ | B691: 立讯精密 | C691: 0.67 | AO691: 是
A692: 002860.SZ | B692: 星帅尔 | C692: 0.67 | AO692: 是
A693: 003031.SZ | B693: 中瓷电子 | C693: 0.67 | AO693: 是
A694: 600452.SH | B694: 涪陵电力 | C694: 0.67 | AO694: 是
A695: 600927.SH | B695: 永安期货 | C695: 0.67 | AO695: 是
A696: 603408.SH | B696: 建霖家居 | C696: 0.67 | AO696: 否
A697: 603657.SH | B697: 春光科技 | C697: 0.67 | AO697: 是
A698: 603726.SH | B698: 朗迪集团 | C698: 0.67 | AO698: 是
A699: 605016.SH | B699: 百龙创园 | C699: 0.67 | AO699: 是
A700: 000671.SZ | B700: 阳光城 | C700: 0.66 | AO700: 否
A701: 000869.SZ | B701: 张裕A | C701: 0.66 | AO701: 否
A702: 002803.SZ | B702: 吉宏股份 | C702: 0.66 | AO702: 否
A703: 600276.SH | B703: 恒瑞医药 | C703: 0.66 | AO703: 否
A704: 600390.SH | B704: 五矿资本 | C704: 0.66 | AO704: 否
A705: 600682.SH | B705: 南京新百 | C705: 0.66 | AO705: 是
A706: 603578.SH | B706: 三星新材 | C706: 0.66 | AO706: 是
A707: 605368.SH | B707: 蓝天燃气 | C707: 0.66 | AO707: 否
A708: 605398.SH | B708: 新炬网络 | C708: 0.66 | AO708: 否
A709: 002915.SZ | B709: 中欣氟材 | C709: 0.66 | AO709: 是
A710: 600012.SH | B710: 皖通高速 | C710: 0.66 | AO710: 是
A711: 605136.SH | B711: 丽人丽妆 | C711: 0.65 | AO711: 否
A712: 600308.SH | B712: 华泰股份 | C712: 0.65 | AO712: 否
A713: 002763.SZ | B713: 汇洁股份 | C713: 0.65 | AO713: 是
A714: 600388.SH | B714: 龙净环保 | C714: 0.65 | AO714: 否
A715: 601658.SH | B715: 邮储银行 | C715: 0.65 | AO715: 是
A716: 601827.SH | B716: 三峰环境 | C716: 0.65 | AO716: 否
A717: 603039.SH | B717: 泛微网络 | C717: 0.65 | AO717: 否
A718: 605122.SH | B718: 四方新材 | C718: 0.65 | AO718: 否
A719: 000739.SZ | B719: 普洛药业 | C719: 0.65 | AO719: 是
A720: 605577.SH | B720: 龙版传媒 | C720: 0.64 | AO720: 是
A721: 600663.SH | B721: 陆家嘴 | C721: 0.64 | AO721: 否
A722: 600817.SH | B722: 宇通重工 | C722: 0.64 | AO722: 否
A723: 002851.SZ | B723: 麦格米特 | C723: 0.64 | AO723: 否
A724: 000065.SZ | B724: 北方国际 | C724: 0.64 | AO724: 否
A725: 002318.SZ | B725: 久立特材 | C725: 0.64 | AO725: 是
A726: 002990.SZ | B726: 盛视科技 | C726: 0.64 | AO726: 否
A727: 600846.SH | B727: 同济科技 | C727: 0.64 | AO727: 否
A728: 600908.SH | B728: 无锡银行 | C728: 0.64 | AO728: 否
A729: 600970.SH | B729: 中材国际 | C729: 0.64 | AO729: 是
A730: 603216.SH | B730: 梦天家居 | C730: 0.64 | AO730: 否
A731: 603351.SH | B731: 威尔药业 | C731: 0.64 | AO731: 是
A732: 002690.SZ | B732: 美亚光电 | C732: 0.63 | AO732: 否
A733: 600764.SH | B733: 中国海防 | C733: 0.63 | AO733: 是
A734: 600674.SH | B734: 川投能源 | C734: 0.63 | AO734: 否
A735: 002315.SZ | B735: 焦点科技 | C735: 0.63 | AO735: 否
A736: 002745.SZ | B736: 木林森 | C736: 0.63 | AO736: 否
A737: 002879.SZ | B737: 长缆科技 | C737: 0.63 | AO737: 是
A738: 002897.SZ | B738: 意华股份 | C738: 0.63 | AO738: 是
A739: 601528.SH | B739: 瑞丰银行 | C739: 0.63 | AO739: 否
A740: 603367.SH | B740: 辰欣药业 | C740: 0.63 | AO740: 否
A741: 603693.SH | B741: 江苏新能 | C741: 0.63 | AO741: 是
A742: 605033.SH | B742: 美邦股份 | C742: 0.63 | AO742: 是
A743: 605166.SH | B743: 聚合顺 | C743: 0.63 | AO743: 是
A744: 605365.SH | B744: 立达信 | C744: 0.63 | AO744: 否
A745: 002068.SZ | B745: 黑猫股份 | C745: 0.63 | AO745: 是
A746: 002180.SZ | B746: 纳思达 | C746: 0.63 | AO746: 是
A747: 002386.SZ | B747: 天原股份 | C747: 0.63 | AO747: 是
A748: 000655.SZ | B748: 金岭矿业 | C748: 0.63 | AO748: 否
A749: 000731.SZ | B749: 四川美丰 | C749: 0.62 | AO749: 是
A750: 001965.SZ | B750: 招商公路 | C750: 0.62 | AO750: 是
A751: 600894.SH | B751: 广日股份 | C751: 0.62 | AO751: 否
A752: 000719.SZ | B752: 中原传媒 | C752: 0.62 | AO752: 是
A753: 002335.SZ | B753: 科华数据 | C753: 0.62 | AO753: 是
A754: 002847.SZ | B754: 盐津铺子 | C754: 0.62 | AO754: 否
A755: 002922.SZ | B755: 伊戈尔 | C755: 0.62 | AO755: 是
A756: 002979.SZ | B756: 雷赛智能 | C756: 0.62 | AO756: 否
A757: 003022.SZ | B757: 联泓新科 | C757: 0.62 | AO757: 否
A758: 600315.SH | B758: 上海家化 | C758: 0.62 | AO758: 否
A759: 600510.SH | B759: 黑牡丹 | C759: 0.62 | AO759: 是
A760: 600765.SH | B760: 中航重机 | C760: 0.62 | AO760: 是
A761: 603037.SH | B761: 凯众股份 | C761: 0.62 | AO761: 是
A762: 603181.SH | B762: 皇马科技 | C762: 0.62 | AO762: 是
A763: 605088.SH | B763: 冠盛股份 | C763: 0.62 | AO763: 否
A764: 600420.SH | B764: 国药现代 | C764: 0.61 | AO764: 否
A765: 000488.SZ | B765: 晨鸣纸业 | C765: 0.61 | AO765: 否
A766: 600850.SH | B766: 电科数字 | C766: 0.61 | AO766: 是
A767: 000913.SZ | B767: 钱江摩托 | C767: 0.61 | AO767: 否
A768: 003008.SZ | B768: 开普检测 | C768: 0.61 | AO768: 否
A769: 600528.SH | B769: 中铁工业 | C769: 0.61 | AO769: 否
A770: 601128.SH | B770: 常熟银行 | C770: 0.61 | AO770: 是
A771: 601163.SH | B771: 三角轮胎 | C771: 0.61 | AO771: 否
A772: 603112.SH | B772: 华翔股份 | C772: 0.61 | AO772: 否
A773: 603360.SH | B773: 百傲化学 | C773: 0.61 | AO773: 否
A774: 603967.SH | B774: 中创物流 | C774: 0.61 | AO774: 是
A775: 605086.SH | B775: 龙高股份 | C775: 0.61 | AO775: 否
A776: 605296.SH | B776: 神农集团 | C776: 0.61 | AO776: 否
A777: 600704.SH | B777: 物产中大 | C777: 0.61 | AO777: 否
A778: 605128.SH | B778: 上海沿浦 | C778: 0.61 | AO778: 是
A779: 002221.SZ | B779: 东华能源 | C779: 0.61 | AO779: 否
A780: 002674.SZ | B780: 兴业科技 | C780: 0.61 | AO780: 否
A781: 002880.SZ | B781: 卫光生物 | C781: 0.61 | AO781: 否
A782: 002507.SZ | B782: 涪陵榨菜 | C782: 0.61 | AO782: 否
A783: 601038.SH | B783: 一拖股份 | C783: 0.59999999999999998 | AO783: 否
A784: 002416.SZ | B784: 爱施德 | C784: 0.59999999999999998 | AO784: 是
A785: 000528.SZ | B785: 柳工 | C785: 0.59999999999999998 | AO785: 否
A786: 002422.SZ | B786: 科伦药业 | C786: 0.59999999999999998 | AO786: 否
A787: 002972.SZ | B787: 科安达 | C787: 0.59999999999999998 | AO787: 是
A788: 600061.SH | B788: 国投资本 | C788: 0.59999999999999998 | AO788: 否
A789: 600459.SH | B789: 贵研铂业 | C789: 0.59999999999999998 | AO789: 是
A790: 600875.SH | B790: 东方电气 | C790: 0.59999999999999998 | AO790: 是
A791: 601311.SH | B791: 骆驼股份 | C791: 0.59999999999999998 | AO791: 是
A792: 603081.SH | B792: 大丰实业 | C792: 0.59999999999999998 | AO792: 是
A793: 603179.SH | B793: 新泉股份 | C793: 0.59999999999999998 | AO793: 是
A794: 603730.SH | B794: 岱美股份 | C794: 0.59999999999999998 | AO794: 是
A795: 605151.SH | B795: 西上海 | C795: 0.59999999999999998 | AO795: 是
A796: 002136.SZ | B796: 安纳达 | C796: 0.59999999999999998 | AO796: 否
A797: 600173.SH | B797: 卧龙地产 | C797: 0.59999999999999998 | AO797: 是
A798: 600571.SH | B798: 信雅达 | C798: 0.59999999999999998 | AO798: 是
A799: 600661.SH | B799: 昂立教育 | C799: 0.59999999999999998 | AO799: 否
A800: 603866.SH | B800: 桃李面包 | C800: 0.59999999999999998 | AO800: 否
A801: 603690.SH | B801: 至纯科技 | C801: 0.59999999999999998 | AO801: 是
A802: 002015.SZ | B802: 协鑫能科 | C802: 0.59999999999999998 | D802: 13.57 | E802: 14.4 | F802: 16.82 | H802: 18.280000000000001 | I802: 5.6299999999999999 | J802: 21.07 | K802: 13 | L802: =(H802-I802)/I802 -> 2.2468916518650093 | M802: =(J802-H802)/J802 -> 0.13241575700047456 | N802: =(J802-K802)/K802 -> 0.62076923076923074 | O802: 15.390000000000001 | Z802: 5w | AA802: =(J802-O802)/J802 -> 0.26957759848125296 | AM802: 不宜入场（收缩幅度不够,应观察2w） | AN802: 44579 | AO802: 是
A803: 603303.SH | B803: 得邦照明 | C803: 0.59999999999999998 | AO803: 是
A804: 600551.SH | B804: 时代出版 | C804: 0.59 | AO804: 是
A805: 002293.SZ | B805: 罗莱生活 | C805: 0.59 | AO805: 是
A806: 002921.SZ | B806: 联诚精密 | C806: 0.59 | AO806: 是
A807: 603385.SH | B807: 惠达卫浴 | C807: 0.59 | AO807: 否
A808: 002440.SZ | B808: 闰土股份 | C808: 0.59 | AO808: 否
A809: 002441.SZ | B809: 众业达 | C809: 0.59 | AO809: 是
A810: 002788.SZ | B810: 鹭燕医药 | C810: 0.59 | AO810: 是
A811: 002955.SZ | B811: 鸿合科技 | C811: 0.59 | AO811: 是
A812: 600958.SH | B812: 东方证券 | C812: 0.59 | AO812: 是
A813: 601828.SH | B813: 美凯龙 | C813: 0.59 | AO813: 否
A814: 603218.SH | B814: 日月股份 | C814: 0.59 | AO814: 否
A815: 603697.SH | B815: 有友食品 | C815: 0.59 | AO815: 否
A816: 603825.SH | B816: 华扬联众 | C816: 0.59 | AO816: 是
A817: 603876.SH | B817: 鼎胜新材 | C817: 0.59 | D817: 32.979999999999997 | E817: 35.530000000000001 | F817: 38.960000000000001 | H817: 36.399999999999999 | I817: 10.720000000000001 | J817: 50.789999999999999 | K817: 27.25 | L817: =(H817-I817)/I817 -> 2.3955223880597014 | M817: =(J817-H817)/J817 -> 0.28332348887576297 | N817: =(J817-K817)/K817 -> 0.86385321100917423 | AM817: 不宜入场（当前股价距离最高价差距过大，面临巨大抛压,应持续观察1w） | AN817: 44580 | AO817: 是
A818: 603979.SH | B818: 金诚信 | C818: 0.59 | AO818: 是
A819: 000779.SZ | B819: 甘咨询 | C819: 0.59 | AO819: 是
A820: 600285.SH | B820: 羚锐制药 | C820: 0.59 | AO820: 是
A821: 600876.SH | B821: 洛阳玻璃 | C821: 0.58 | AO821: 是
A822: 002007.SZ | B822: 华兰生物 | C822: 0.58 | AO822: 否
A823: 002111.SZ | B823: 威海广泰 | C823: 0.58 | AO823: 否
A824: 003001.SZ | B824: 中岩大地 | C824: 0.58 | AO824: 否
A825: 600483.SH | B825: 福能股份 | C825: 0.58 | AO825: 是
A826: 603323.SH | B826: 苏农银行 | C826: 0.58 | AO826: 是
A827: 603583.SH | B827: 捷昌驱动 | C827: 0.58 | AO827: 否
A828: 603788.SH | B828: 宁波高发 | C828: 0.58 | AO828: 是
A829: 603890.SH | B829: 春秋电子 | C829: 0.58 | AO829: 是
A830: 603896.SH | B830: 寿仙谷 | C830: 0.58 | AO830: 是
A831: 605050.SH | B831: 福然德 | C831: 0.58 | AO831: 是
A832: 605580.SH | B832: 恒盛能源 | C832: 0.58 | AO832: 是
A833: 603809.SH | B833: 豪能股份 | C833: 0.58 | AO833: 是
A834: 000425.SZ | B834: 徐工机械 | C834: 0.58 | AO834: 否
A835: 002531.SZ | B835: 天顺风能 | C835: 0.58 | AO835: 是
A836: 003016.SZ | B836: 欣贺股份 | C836: 0.58 | AO836: 否
A837: 000400.SZ | B837: 许继电气 | C837: 0.57 | AO837: 是
A838: 002106.SZ | B838: 莱宝高科 | C838: 0.57 | AO838: 是
A839: 600197.SH | B839: 伊力特 | C839: 0.57 | AO839: 是
A840: 000050.SZ | B840: 深天马A | C840: 0.57 | AO840: 否
A841: 600422.SH | B841: 昆药集团 | C841: 0.57 | AO841: 是
A842: 000683.SZ | B842: 远兴能源 | C842: 0.57 | D842: 6.8600000000000003 | E842: 7.3200000000000003 | F842: 7.8700000000000001 | H842: 9.0399999999999991 | I842: 1.99 | J842: 13.539999999999999 | K842: 6.9000000000000004 | L842: =(H842-I842)/I842 -> 3.5427135678391957 | M842: =(J842-H842)/J842 -> 0.33234859675036932 | N842: =(J842-K842)/K842 -> 0.96231884057970996 | AM842: 不宜入场（当前股价相对于最高点距离太大,应观察1w） | AN842: 44582 | AO842: 是
A843: 600406.SH | B843: 国电南瑞 | C843: 0.57 | AO843: 是
A844: 601187.SH | B844: 厦门银行 | C844: 0.57 | AO844: 否
A845: 601811.SH | B845: 新华文轩 | C845: 0.57 | AO845: 否
A846: 603456.SH | B846: 九洲药业 | C846: 0.57 | AO846: 是
A847: 603755.SH | B847: 日辰股份 | C847: 0.57 | AO847: 否
A848: 603810.SH | B848: 丰山集团 | C848: 0.57 | AO848: 否
A849: 605186.SH | B849: 健麾信息 | C849: 0.57 | AO849: 是
A850: 600282.SH | B850: 南钢股份 | C850: 0.57 | AO850: 否
A851: 000666.SZ | B851: 经纬纺机 | C851: 0.56 | AO851: 是
A852: 000725.SZ | B852: 京东方A | C852: 0.56 | AO852: 否
A853: 000938.SZ | B853: 紫光股份 | C853: 0.56 | AO853: 否
A854: 002191.SZ | B854: 劲嘉股份 | C854: 0.56 | AO854: 是
A855: 002312.SZ | B855: 川发龙蟒 | C855: 0.56 | AO855: 是
A856: 002973.SZ | B856: 侨银股份 | C856: 0.56 | AO856: 否
A857: 600757.SH | B857: 长江传媒 | C857: 0.56 | AO857: 是
A858: 600895.SH | B858: 张江高科 | C858: 0.56 | AO858: 否
A859: 601098.SH | B859: 中南传媒 | C859: 0.56 | AO859: 是
A860: 601818.SH | B860: 光大银行 | C860: 0.56 | AO860: 否
A861: 603080.SH | B861: 新疆火炬 | C861: 0.56 | AO861: 是
A862: 603108.SH | B862: 润达医疗 | C862: 0.56 | AO862: 是
A863: 605060.SH | B863: 联德股份 | C863: 0.56 | AO863: 是
A864: 605298.SH | B864: 必得科技 | C864: 0.56 | AO864: 否
A865: 601200.SH | B865: 上海环境 | C865: 0.56 | AO865: 是
A866: 600487.SH | B866: 亨通光电 | C866: 0.56 | AO866: 是
A867: 002105.SZ | B867: 信隆健康 | C867: 0.56 | AO867: 是
A868: 600711.SH | B868: 盛屯矿业 | C868: 0.56 | AO868: 是
A869: 603982.SH | B869: 泉峰汽车 | C869: 0.55 | AO869: 是
A870: 002649.SZ | B870: 博彦科技 | C870: 0.55 | AO870: 是
A871: 603588.SH | B871: 高能环境 | C871: 0.55 | AO871: 是
A872: 002576.SZ | B872: 通达动力 | C872: 0.55 | AO872: 是
A873: 002497.SZ | B873: 雅化集团 | C873: 0.55 | AO873: 否
A874: 600460.SH | B874: 士兰微 | C874: 0.55 | AO874: 是
A875: 000823.SZ | B875: 超声电子 | C875: 0.55 | AO875: 是
A876: 603327.SH | B876: 福蓉科技 | C876: 0.55 | AO876: 否
A877: 000550.SZ | B877: 江铃汽车 | C877: 0.55 | AO877: 否
A878: 000635.SZ | B878: 英力特 | C878: 0.55 | AO878: 否
A879: 002144.SZ | B879: 宏达高科 | C879: 0.55 | AO879: 是
A880: 002443.SZ | B880: 金洲管道 | C880: 0.55 | AO880: 是
A881: 600363.SH | B881: 联创光电 | C881: 0.55 | AO881: 是
A882: 601117.SH | B882: 中国化学 | C882: 0.55 | AO882: 是
A883: 601138.SH | B883: 工业富联 | C883: 0.55 | AO883: 否
A884: 603219.SH | B884: 富佳股份 | C884: 0.55 | AO884: 是
A885: 603238.SH | B885: 诺邦股份 | C885: 0.55 | AO885: 否
A886: 603505.SH | B886: 金石资源 | C886: 0.55 | AO886: 是
A887: 603856.SH | B887: 东宏股份 | C887: 0.55 | AO887: 是
A888: 605133.SH | B888: 嵘泰股份 | C888: 0.55 | AO888: 是
A889: 605378.SH | B889: 野马电池 | C889: 0.55 | AO889: 否
A890: 600897.SH | B890: 厦门空港 | C890: 0.55 | AO890: 否
A891: 600180.SH | B891: 瑞茂通 | C891: 0.55 | AO891: 是
A892: 000411.SZ | B892: 英特集团 | C892: 0.55 | AO892: 是
A893: 002056.SZ | B893: 横店东磁 | C893: 0.54 | AO893: 是
A894: 000987.SZ | B894: 越秀金控 | C894: 0.54 | AO894: 否
A895: 002020.SZ | B895: 京新药业 | C895: 0.54 | AO895: 是
A896: 002393.SZ | B896: 力生制药 | C896: 0.54 | AO896: 是
A897: 002643.SZ | B897: 万润股份 | C897: 0.54 | AO897: 是
A898: 002802.SZ | B898: 洪汇新材 | C898: 0.54 | AO898: 否
A899: 002829.SZ | B899: 星网宇达 | C899: 0.54 | AO899: 是
A900: 002839.SZ | B900: 张家港行 | C900: 0.54 | AO900: 是
A901: 002926.SZ | B901: 华西证券 | C901: 0.54 | AO901: 否
A902: 600848.SH | B902: 上海临港 | C902: 0.54 | AO902: 否
A903: 601339.SH | B903: 百隆东方 | C903: 0.54 | AO903: 是
A904: 601633.SH | B904: 长城汽车 | C904: 0.54 | AO904: 否
A905: 603358.SH | B905: 华达科技 | C905: 0.54 | AO905: 是
A906: 603848.SH | B906: 好太太 | C906: 0.54 | AO906: 是
A907: 600639.SH | B907: 浦东金桥 | C907: 0.54 | AO907: 是
A908: 002156.SZ | B908: 通富微电 | C908: 0.53 | AO908: 否
A909: 600901.SH | B909: 江苏租赁 | C909: 0.53 | AO909: 否
A910: 601019.SH | B910: 山东出版 | C910: 0.53 | AO910: 是
A911: 601988.SH | B911: 中国银行 | C911: 0.53 | AO911: 否
A912: 603600.SH | B912: 永艺股份 | C912: 0.53 | AO912: 是
A913: 603685.SH | B913: 晨丰科技 | C913: 0.53 | AO913: 否
A914: 002081.SZ | B914: 金螳螂 | C914: 0.53 | AO914: 否
A915: 002581.SZ | B915: 未名医药 | C915: 0.53 | AO915: 是
A916: 002394.SZ | B916: 联发股份 | C916: 0.53 | AO916: 否
A917: 601377.SH | B917: 兴业证券 | C917: 0.53 | AO917: 否
A918: 002815.SZ | B918: 崇达技术 | C918: 0.52 | AO918: 是
A919: 600368.SH | B919: 五洲交通 | C919: 0.52 | AO919: 是
A920: 000686.SZ | B920: 东北证券 | C920: 0.52 | AO920: 是
A921: 002003.SZ | B921: 伟星股份 | C921: 0.52 | AO921: 是
A922: 002996.SZ | B922: 顺博合金 | C922: 0.52 | AO922: 否
A923: 600802.SH | B923: 福建水泥 | C923: 0.52 | AO923: 否
A924: 600867.SH | B924: 通化东宝 | C924: 0.52 | AO924: 否
A925: 603128.SH | B925: 华贸物流 | C925: 0.52 | AO925: 否
A926: 603278.SH | B926: 大业股份 | C926: 0.52 | AO926: 是
A927: 603518.SH | B927: 锦泓集团 | C927: 0.52 | AO927: 否
A928: 603992.SH | B928: 松霖科技 | C928: 0.52 | AO928: 否
A929: 605598.SH | B929: 上海港湾 | C929: 0.52 | AO929: 否
A930: 002950.SZ | B930: 奥美医疗 | C930: 0.52 | AO930: 否
A931: 603966.SH | B931: 法兰泰克 | C931: 0.52 | AO931: 否
A932: 600590.SH | B932: 泰豪科技 | C932: 0.52 | AO932: 是
A933: 600380.SH | B933: 健康元 | C933: 0.52 | AO933: 否
A934: 600580.SH | B934: 卧龙电驱 | C934: 0.51 | AO934: 是
A935: 002135.SZ | B935: 东南网架 | C935: 0.51 | AO935: 是
A936: 002234.SZ | B936: 民和股份 | C936: 0.51 | AO936: 是
A937: 002275.SZ | B937: 桂林三金 | C937: 0.51 | AO937: 是
A938: 002728.SZ | B938: 特一药业 | C938: 0.51 | AO938: 是
A939: 601231.SH | B939: 环旭电子 | C939: 0.51 | AO939: 否
A940: 601238.SH | B940: 广汽集团 | C940: 0.51 | AO940: 是
A941: 601965.SH | B941: 中国汽研 | C941: 0.51 | AO941: 是
A942: 603811.SH | B942: 诚意药业 | C942: 0.51 | AO942: 否
A943: 605011.SH | B943: 杭州热电 | C943: 0.51 | AO943: 是
A944: 605183.SH | B944: 确成股份 | C944: 0.51 | AO944: 是
A945: 600109.SH | B945: 国金证券 | C945: 0.51 | AO945: 否
A946: 000930.SZ | B946: 中粮科技 | C946: 0.51 | AO946: 是
A947: 600018.SH | B947: 上港集团 | C947: 0.51 | AO947: 是
A948: 002270.SZ | B948: 华明装备 | C948: 0.51 | AO948: 是
A949: 601882.SH | B949: 海天精工 | C949: 0.5 | AO949: 是
A950: 603020.SH | B950: 爱普股份 | C950: 0.5 | AO950: 否
A951: 000860.SZ | B951: 顺鑫农业 | C951: 0.5 | AO951: 否
A952: 000042.SZ | B952: 中洲控股 | C952: 0.5 | AO952: 否