A1: 股票代码 | B1: 股票简称 | C1: 现价(元) | D1: 所属同花顺行业
A2: 000006.SZ | B2: 深振业A | C2: 5.42 | D2: 房地产-房地产开发-住宅开发 | E2: 房地产-房地产开发-住宅开发 | F2: =COUNTIF(D:D,E2) -> 37
A3: 000014.SZ | B3: 沙河股份 | C3: 13.44 | D3: 房地产-房地产开发-住宅开发 | E3: 农林牧渔-农产品加工-粮油加工 | F3: =COUNTIF(D:D,E3) -> 2
A4: 000019.SZ | B4: 深粮控股 | C4: 8.18 | D4: 农林牧渔-农产品加工-粮油加工 | E4: 房地产-房地产开发-商业地产 | F4: =COUNTIF(D:D,E4) -> 4
A5: 000029.SZ | B5: 深深房A | C5: 9.49 | D5: 房地产-房地产开发-住宅开发 | E5: 医药生物-医药商业-医药商业Ⅲ | F5: =COUNTIF(D:D,E5) -> 4
A6: 000031.SZ | B6: 大悦城 | C6: 4.91 | D6: 房地产-房地产开发-商业地产 | E6: 家用电器-白色家电-其他白色家电 | F6: =COUNTIF(D:D,E6) -> 1
A7: 000078.SZ | B7: 海王生物 | C7: 3.69 | D7: 医药生物-医药商业-医药商业Ⅲ | E7: 传媒-传媒-出版 | F7: =COUNTIF(D:D,E7) -> 1
A8: 000090.SZ | B8: 天健集团 | C8: 6.81 | D8: 房地产-房地产开发-住宅开发 | E8: 综合-综合-综合Ⅲ | F8: =COUNTIF(D:D,E8) -> 2
A9: 000404.SZ | B9: 长虹华意 | C9: 4.83 | D9: 家用电器-白色家电-其他白色家电 | E9: 非银金融-保险及其他-多元金融 | F9: =COUNTIF(D:D,E9) -> 2
A10: 000505.SZ | B10: 京粮控股 | C10: 11.12 | D10: 农林牧渔-农产品加工-粮油加工 | E10: 农林牧渔-农产品加工-饲料 | F10: =COUNTIF(D:D,E10) -> 4
A11: 000514.SZ | B11: 渝开发 | C11: 6.9000000000000004 | D11: 房地产-房地产开发-住宅开发 | E11: 基础化工-化学原料-纯碱 | F11: =COUNTIF(D:D,E11) -> 1
A12: 000529.SZ | B12: 广弘控股 | C12: 7 | D12: 传媒-传媒-出版 | E12: 商贸零售-零售-百货零售 | F12: =COUNTIF(D:D,E12) -> 2
A13: 000573.SZ | B13: 粤宏远A | C13: 4.26 | D13: 房地产-房地产开发-住宅开发 | E13: 医药生物-化学制药-化学制剂 | F13: =COUNTIF(D:D,E13) -> 5
A14: 000608.SZ | B14: 阳光股份 | C14: 4.57 | D14: 房地产-房地产开发-商业地产 | E14: 医药生物-化学制药-原料药 | F14: =COUNTIF(D:D,E14) -> 2
A15: 000632.SZ | B15: 三木集团 | C15: 4.91 | D15: 综合-综合-综合Ⅲ | E15: 医药生物-中药-中药Ⅲ | F15: =COUNTIF(D:D,E15) -> 7
A16: 000666.SZ | B16: 经纬纺机 | C16: 10.49 | D16: 非银金融-保险及其他-多元金融 | E16: 建筑装饰-建筑装饰-基础建设 | F16: =COUNTIF(D:D,E16) -> 4
A17: 000702.SZ | B17: 正虹科技 | C17: 5.67 | D17: 农林牧渔-农产品加工-饲料 | E17: 农林牧渔-养殖业-水产养殖 | F17: =COUNTIF(D:D,E17) -> 1
A18: 000707.SZ | B18: 双环科技 | C18: 11.49 | D18: 基础化工-化学原料-纯碱 | E18: 医药生物-医疗服务-其他医疗服务 | F18: =COUNTIF(D:D,E18) -> 1
A19: 000715.SZ | B19: 中兴商业 | C19: 5.38 | D19: 商贸零售-零售-百货零售 | E19: 建筑装饰-建筑装饰-装饰园林 | F19: =COUNTIF(D:D,E19) -> 1
A20: 000732.SZ | B20: 泰禾集团 | C20: 3.36 | D20: 房地产-房地产开发-住宅开发 | E20: 环保-环保-综合环境治理 | F20: =COUNTIF(D:D,E20) -> 1
A21: 000736.SZ | B21: 中交地产 | C21: 15.55 | D21: 房地产-房地产开发-住宅开发 | E21: 社会服务-酒店及餐饮-餐饮 | F21: =COUNTIF(D:D,E21) -> 1
A22: 000766.SZ | B22: 通化金马 | C22: 5.7000000000000002 | D22: 医药生物-化学制药-化学制剂 | E22: 建筑材料-建筑材料-其他建材 | F22: =COUNTIF(D:D,E22) -> 1
A23: 000797.SZ | B23: 中国武夷 | C23: 4.28 | D23: 房地产-房地产开发-住宅开发 | E23: 计算机-计算机应用-IT服务 | F23: =COUNTIF(D:D,E23) -> 1
A24: 000863.SZ | B24: 三湘印象 | C24: 4.77 | D24: 房地产-房地产开发-住宅开发 | E24: 银行-银行-农商行 | F24: =COUNTIF(D:D,E24) -> 1
A25: 000897.SZ | B25: 津滨发展 | C25: 3.31 | D25: 房地产-房地产开发-住宅开发 | E25: 传媒-传媒-数字媒体 | F25: =COUNTIF(D:D,E25) -> 1
A26: 000926.SZ | B26: 福星股份 | C26: 5.18 | D26: 房地产-房地产开发-住宅开发 | E26: 传媒-传媒-游戏 | F26: =COUNTIF(D:D,E26) -> 1
A27: 000952.SZ | B27: 广济药业 | C27: 8.32 | D27: 医药生物-化学制药-原料药 | E27: 计算机-计算机设备-计算机设备Ⅲ | F27: =COUNTIF(D:D,E27) -> 1
A28: 000965.SZ | B28: 天保基建 | C28: 8.95 | D28: 房地产-房地产开发-住宅开发 | E28: 计算机-计算机应用-软件开发 | F28: =COUNTIF(D:D,E28) -> 1
A29: 000999.SZ | B29: 华润三九 | C29: 44.48 | D29: 医药生物-中药-中药Ⅲ | E29: 机械设备-专用设备-其他专用设备 | F29: =COUNTIF(D:D,E29) -> 1
A30: 001979.SZ | B30: 招商蛇口 | C30: 15.49 | D30: 房地产-房地产开发-商业地产 | E30: 房地产-房地产服务-房地产服务Ⅲ | F30: =COUNTIF(D:D,E30) -> 1
A31: 002016.SZ | B31: 世荣兆业 | C31: 7.25 | D31: 房地产-房地产开发-住宅开发 | E31: 基础化工-化工合成材料-改性塑料 | F31: =COUNTIF(D:D,E31) -> 1
A32: 002060.SZ | B32: 粤水电 | C32: 9.0999999999999996 | D32: 建筑装饰-建筑装饰-基础建设 | E32: 基础化工-化学制品-农药 | F32: =COUNTIF(D:D,E32) -> 1
A33: 002069.SZ | B33: 獐子岛 | C33: 4.05 | D33: 农林牧渔-养殖业-水产养殖 | E33: 建筑装饰-建筑装饰-工程咨询服务 | F33: =COUNTIF(D:D,E33) -> 1
A34: 002166.SZ | B34: 莱茵生物 | C34: 12.55 | D34: 医药生物-中药-中药Ⅲ | E34: 基础化工-化学制品-聚氨酯 | F34: =COUNTIF(D:D,E34) -> 1
A35: 002173.SZ | B35: 创新医疗 | C35: 8.15 | D35: 医药生物-医疗服务-其他医疗服务 | E35: 房地产-房地产开发-产业地产 | F35: =COUNTIF(D:D,E35) -> 4
A36: 002200.SZ | B36: ST云投 | C36: 9.63 | D36: 建筑装饰-建筑装饰-装饰园林 | E36: 农林牧渔-养殖业-海洋捕捞 | F36: =COUNTIF(D:D,E36) -> 1
A37: 002205.SZ | B37: 国统股份 | C37: 11.5 | D37: 环保-环保-综合环境治理 | E37: 交通运输-物流-物流Ⅲ | F37: =COUNTIF(D:D,E37) -> 1
A38: 002244.SZ | B38: 滨江集团 | C38: 7.07 | D38: 房地产-房地产开发-住宅开发 | E38: 纺织服装-纺织制造-其他纺织 | F38: =COUNTIF(D:D,E38) -> 1
A39: 002305.SZ | B39: 南国置业 | C39: 3.53 | D39: 房地产-房地产开发-商业地产 | E39: 交通运输-港口航运-港口 | F39: =COUNTIF(D:D,E39) -> 2
A40: 002306.SZ | B40: 中科云网 | C40: 4.18 | D40: 社会服务-酒店及餐饮-餐饮 | E40: 商贸零售-贸易-贸易Ⅲ | F40: =COUNTIF(D:D,E40) -> 2
A41: 002307.SZ | B41: 北新路桥 | C41: 5.29 | D41: 建筑装饰-建筑装饰-基础建设 | E41: 农林牧渔-种植业与林业-种子生产 | F41: =COUNTIF(D:D,E41) -> 1
A42: 002398.SZ | B42: 垒知集团 | C42: 8.49 | D42: 建筑材料-建筑材料-其他建材 | E42: 环保-环保-环保设备 | F42: =COUNTIF(D:D,E42) -> 1
A43: 002424.SZ | B43: 贵州百灵 | C43: 8.96 | D43: 医药生物-中药-中药Ⅲ | E43: 煤炭-煤炭开采加工-煤炭开采 | F43: =COUNTIF(D:D,E43) -> 2
A44: 002433.SZ | B44: 太安堂 | C44: 6.9000000000000004 | D44: 医药生物-中药-中药Ⅲ | E44: 商贸零售-互联网电商-互联网电商Ⅲ | F44: =COUNTIF(D:D,E44) -> 1
A45: 002548.SZ | B45: 金新农 | C45: 8.12 | D45: 农林牧渔-农产品加工-饲料 | E45: 电力设备-电力设备-输变电设备 | F45: =COUNTIF(D:D,E45) -> 1
A46: 002586.SZ | B46: *ST围海 | C46: 4.19 | D46: 建筑装饰-建筑装饰-基础建设 | E46: 建筑材料-建筑材料-水泥 | F46: =COUNTIF(D:D,E46) -> 1
A47: 002589.SZ | B47: 瑞康医药 | C47: 5.56 | D47: 医药生物-医药商业-医药商业Ⅲ | E47: 社会服务-景点及旅游-人工景点 | F47: =COUNTIF(D:D,E47) -> 1
A48: 002603.SZ | B48: 以岭药业 | C48: 31.54 | D48: 医药生物-中药-中药Ⅲ | E48: 基础化工-化学制品-食品及饲料添加剂 | F48: =COUNTIF(D:D,E48) -> 1
A49: 002657.SZ | B49: 中科金财 | C49: 22.52 | D49: 计算机-计算机应用-IT服务 | E49: 环保-环保-水务及水治理 | F49: =COUNTIF(D:D,E49) -> 1
A50: 002807.SZ | B50: 江阴银行 | C50: 4.59 | D50: 银行-银行-农商行 | E50: 电子-消费电子-消费电子零部件及组装 | F50: =COUNTIF(D:D,E50) -> 1
A51: 002826.SZ | B51: 易明医药 | C51: 11.37 | D51: 医药生物-化学制药-化学制剂 | E51: 公用事业-电力-电能综合服务 | F51: =COUNTIF(D:D,E51) -> 1
A52: 002864.SZ | B52: 盘龙药业 | C52: 68.24 | D52: 医药生物-中药-中药Ⅲ | E52: 农林牧渔-养殖业-畜禽养殖 | F52: =COUNTIF(D:D,E52) -> 1
A53: 300158.SZ | B53: 振东制药 | C53: 14.26 | D53: 医药生物-化学制药-化学制剂 | E53: 银行-银行-国有大型银行 | F53: =COUNTIF(D:D,E53) -> 2
A54: 300295.SZ | B54: 三六五网 | C54: 13.800000000000001 | D54: 传媒-传媒-数字媒体 | E54: 银行-银行-城商行 | F54: =COUNTIF(D:D,E54) -> 1
A55: 300299.SZ | B55: 富春股份 | C55: 7.44 | D55: 传媒-传媒-游戏 | E55: 基础化工-化学制品-其他化学制品 | F55: =COUNTIF(D:D,E55) -> 1
A56: 300546.SZ | B56: 雄帝科技 | C56: 38.65 | D56: 计算机-计算机设备-计算机设备Ⅲ | E56: 轻工制造-家用轻工-瓷砖地板 | F56: =COUNTIF(D:D,E56) -> 1
A57: 300559.SZ | B57: 佳发教育 | C57: 13.18 | D57: 计算机-计算机应用-软件开发 | E57: 国防军工-国防军工-航空装备 | F57: =COUNTIF(D:D,E57) -> 1
A58: 300823.SZ | B58: 建科机械 | C58: 27.5 | D58: 机械设备-专用设备-其他专用设备 | E58: 有色金属-小金属-其他小金属 | F58: =COUNTIF(D:D,E58) -> 1
A59: 300917.SZ | B59: 特发服务 | C59: 43.600000000000001 | D59: 房地产-房地产服务-房地产服务Ⅲ | E59: 基础化工-非金属材料-非金属材料Ⅲ | F59: =COUNTIF(D:D,E59) -> 1
A60: 301003.SZ | B60: 江苏博云 | C60: 41.05 | D60: 基础化工-化工合成材料-改性塑料 | E60: 家用电器-小家电-小家电Ⅲ | F60: =COUNTIF(D:D,E60) -> 1
A61: 301035.SZ | B61: 润丰股份 | C61: 77.18 | D61: 基础化工-化学制品-农药 | E61: 电子-半导体及元件-分立器件 | F61: =COUNTIF(D:D,E61) -> 1
A62: 301038.SZ | B62: 深水规院 | C62: 26.14 | D62: 建筑装饰-建筑装饰-工程咨询服务 | E62: 医药生物-医疗器械-体外诊断 | F62: =COUNTIF(D:D,E62) -> 1
A63: 301216.SZ | B63: 万凯新材 | C63: 31.59 | D63: 基础化工-化学制品-聚氨酯
A64: 600048.SH | B64: 保利发展 | C64: 18.21 | D64: 房地产-房地产开发-住宅开发
A65: 600056.SH | B65: 中国医药 | C65: 32.72 | D65: 医药生物-医药商业-医药商业Ⅲ
A66: 600062.SH | B66: 华润双鹤 | C66: 16.51 | D66: 医药生物-化学制药-化学制剂
A67: 600064.SH | B67: 南京高科 | C67: 10.48 | D67: 房地产-房地产开发-住宅开发
A68: 600082.SH | B68: 海泰发展 | C68: 6.15 | D68: 房地产-房地产开发-产业地产
A69: 600094.SH | B69: 大名城 | C69: 4.25 | D69: 房地产-房地产开发-住宅开发
A70: 600097.SH | B70: 开创国际 | C70: 12.31 | D70: 农林牧渔-养殖业-海洋捕捞
A71: 600133.SH | B71: 东湖高新 | C71: 6.21 | D71: 建筑装饰-建筑装饰-基础建设
A72: 600153.SH | B72: 建发股份 | C72: 13.300000000000001 | D72: 交通运输-物流-物流Ⅲ
A73: 600156.SH | B73: 华升股份 | C73: 5.08 | D73: 纺织服装-纺织制造-其他纺织
A74: 600162.SH | B74: 香江控股 | C74: 2.6000000000000001 | D74: 房地产-房地产开发-住宅开发
A75: 600173.SH | B75: 卧龙地产 | C75: 7.06 | D75: 房地产-房地产开发-住宅开发
A76: 600266.SH | B76: 城建发展 | C76: 5.26 | D76: 房地产-房地产开发-住宅开发
A77: 600279.SH | B77: 重庆港 | C77: 4.72 | D77: 交通运输-港口航运-港口
A78: 600301.SH | B78: *ST南化 | C78: 19.23 | D78: 商贸零售-贸易-贸易Ⅲ
A79: 600313.SH | B79: 农发种业 | C79: 8 | D79: 农林牧渔-种植业与林业-种子生产
A80: 600322.SH | B80: 天房发展 | C80: 3.11 | D80: 房地产-房地产开发-住宅开发
A81: 600325.SH | B81: 华发股份 | C81: 7.95 | D81: 房地产-房地产开发-住宅开发
A82: 600376.SH | B82: 首开股份 | C82: 6.83 | D82: 房地产-房地产开发-住宅开发
A83: 600383.SH | B83: 金地集团 | C83: 14.699999999999999 | D83: 房地产-房地产开发-住宅开发
A84: 600388.SH | B84: 龙净环保 | C84: 10.52 | D84: 环保-环保-环保设备
A85: 600397.SH | B85: 安源煤业 | C85: 3.88 | D85: 煤炭-煤炭开采加工-煤炭开采
A86: 600463.SH | B86: 空港股份 | C86: 9.21 | D86: 房地产-房地产开发-产业地产
A87: 600533.SH | B87: 栖霞建设 | C87: 4.46 | D87: 房地产-房地产开发-住宅开发
A88: 600539.SH | B88: 狮头股份 | C88: 8.34 | D88: 商贸零售-互联网电商-互联网电商Ⅲ
A89: 600550.SH | B89: 保变电气 | C89: 6.12 | D89: 电力设备-电力设备-输变电设备
A90: 600557.SH | B90: 康缘药业 | C90: 13.86 | D90: 医药生物-中药-中药Ⅲ
A91: 600606.SH | B91: 绿地控股 | C91: 5.62 | D91: 房地产-房地产开发-住宅开发
A92: 600622.SH | B92: 光大嘉宝 | C92: 4.45 | D92: 房地产-房地产开发-住宅开发
A93: 600638.SH | B93: 新黄浦 | C93: 6.45 | D93: 房地产-房地产开发-住宅开发
A94: 600639.SH | B94: 浦东金桥 | C94: 15.33 | D94: 房地产-房地产开发-产业地产
A95: 600647.SH | B95: 同达创业 | C95: 20.78 | D95: 商贸零售-贸易-贸易Ⅲ
A96: 600649.SH | B96: 城投控股 | C96: 5.05 | D96: 房地产-房地产开发-住宅开发
A97: 600657.SH | B97: 信达地产 | C97: 8.43 | D97: 房地产-房地产开发-住宅开发
A98: 600658.SH | B98: 电子城 | C98: 5.08 | D98: 房地产-房地产开发-产业地产
A99: 600665.SH | B99: 天地源 | C99: 4.54 | D99: 房地产-房地产开发-住宅开发
A100: 600675.SH | B100: 中华企业 | C100: 3.46 | D100: 房地产-房地产开发-住宅开发
A101: 600678.SH | B101: 四川金顶 | C101: 6.81 | D101: 建筑材料-建筑材料-水泥
A102: 600705.SH | B102: 中航产融 | C102: 4.22 | D102: 非银金融-保险及其他-多元金融
A103: 600706.SH | B103: 曲江文旅 | C103: 15.58 | D103: 社会服务-景点及旅游-人工景点
A104: 600708.SH | B104: 光明地产 | C104: 3.16 | D104: 房地产-房地产开发-住宅开发
A105: 600716.SH | B105: 凤凰股份 | C105: 5.9000000000000004 | D105: 房地产-房地产开发-住宅开发
A106: 600743.SH | B106: 华远地产 | C106: 2.64 | D106: 房地产-房地产开发-住宅开发
A107: 600784.SH | B107: 鲁银投资 | C107: 7.39 | D107: 综合-综合-综合Ⅲ
A108: 600791.SH | B108: 京能置业 | C108: 5.75 | D108: 房地产-房地产开发-住宅开发
A109: 600829.SH | B109: 人民同泰 | C109: 7.17 | D109: 医药生物-医药商业-医药商业Ⅲ
A110: 600838.SH | B110: 上海九百 | C110: 7.13 | D110: 商贸零售-零售-百货零售
A111: 600873.SH | B111: 梅花生物 | C111: 9.0999999999999996 | D111: 基础化工-化学制品-食品及饲料添加剂
A112: 600874.SH | B112: 创业环保 | C112: 7.64 | D112: 环保-环保-水务及水治理
A113: 600898.SH | B113: ST美讯 | C113: 7.02 | D113: 电子-消费电子-消费电子零部件及组装
A114: 600969.SH | B114: 郴电国际 | C114: 7.95 | D114: 公用事业-电力-电能综合服务
A115: 600975.SH | B115: 新五丰 | C115: 10.99 | D115: 农林牧渔-养殖业-畜禽养殖
A116: 601000.SH | B116: 唐山港 | C116: 3.18 | D116: 交通运输-港口航运-港口
A117: 601328.SH | B117: 交通银行 | C117: 5.12 | D117: 银行-银行-国有大型银行
A118: 601666.SH | B118: 平煤股份 | C118: 16.25 | D118: 煤炭-煤炭开采加工-煤炭开采
A119: 601838.SH | B119: 成都银行 | C119: 15.59 | D119: 银行-银行-城商行
A120: 601988.SH | B120: 中国银行 | C120: 3.29 | D120: 银行-银行-国有大型银行
A121: 603051.SH | B121: 鹿山新材 | C121: 59.81 | D121: 基础化工-化学制品-其他化学制品
A122: 603226.SH | B122: 菲林格尔 | C122: 7.9000000000000004 | D122: 轻工制造-家用轻工-瓷砖地板
A123: 603261.SH | B123: 立航科技 | C123: 64.799999999999997 | D123: 国防军工-国防军工-航空装备
A124: 603363.SH | B124: 傲农生物 | C124: 25.100000000000001 | D124: 农林牧渔-农产品加工-饲料
A125: 603399.SH | B125: 吉翔股份 | C125: 25.600000000000001 | D125: 有色金属-小金属-其他小金属
A126: 603538.SH | B126: 美诺华 | C126: 67.52 | D126: 医药生物-化学制药-原料药
A127: 603668.SH | B127: 天马科技 | C127: 15.01 | D127: 农林牧渔-农产品加工-饲料
A128: 603826.SH | B128: 坤彩科技 | C128: 61.32 | D128: 基础化工-非金属材料-非金属材料Ⅲ
A129: 603868.SH | B129: 飞科电器 | C129: 50.54 | D129: 家用电器-小家电-小家电Ⅲ
A130: 688048.SH | B130: 长光华芯 | C130: 79.599999999999994 | D130: 电子-半导体及元件-分立器件
A131: 688193.SH | B131: 仁度生物 | C131: 59.97 | D131: 医药生物-医疗器械-体外诊断
A132: 688331.SH | B132: 荣昌生物 | C132: 41.24 | D132: 医药生物-化学制药-化学制剂