D1: 基本面 | H1: 技术面 | N1: 结论 | O1: 更新时间
A2: 股票代码 | B2: 股票简称 | C2: 所属同花顺行业 | D2: 本季度利润增长速度 | E2: 本季度销售增长速度 | F2: 本季度利润率 | G2: 市盈率(股票价格/每股收益) | H2: 价格趋势是否已经掉头向上 | I2: 当日收盘价 | J2: 最低点 | K2: 最高点 | L2: 反弹强度(越大越好) | M2: 回调幅度(越小越好)
A3: 600508.SH | B3: 上海能源 | C3: 煤炭-煤炭开采加工-煤炭开采 | D3: 3.6144578313253044 | E3: 10.604856760000001 | F3: 8.6081000000000003 | L3: =(I3-J3)/J3 -> #DIV/0! | N3: 兰花科创为领头羊,山西焦煤为次级领头羊 | O3: 44672
A4: 601699.SH | B4: 潞安环能 | C4: 煤炭-煤炭开采加工-煤炭开采 | D4: 323.91304347826082 | E4: 34.314150300000001 | F4: 20.939599999999999 | L4: =(I4-J4)/J4 -> #DIV/0!
A5: 600395.SH | B5: 盘江股份 | C5: 煤炭-煤炭开采加工-煤炭开采 | D5: 35.195530726256983 | E5: 18.627784550000001 | F5: 14.203799999999999 | L5: =(I5-J5)/J5 -> #DIV/0!
A6: 600348.SH | B6: 华阳股份 | C6: 煤炭-煤炭开采加工-煤炭开采 | D6: 106.52173913043477 | E6: 12.75044353 | F6: 9.4979999999999993 | L6: =(I6-J6)/J6 -> #DIV/0!
A7: 000983.SZ | B7: 山西焦煤 | C7: 煤炭-煤炭开采加工-煤炭开采 | D7: 91.497775580820559 | E7: 23.868849149999999 | F7: 11.8736 | G7: 15.87 | I7: 13.449999999999999 | J7: 7.5499999999999998 | K7: 16.710000000000001 | L7: =(I7-J7)/J7 -> 0.7814569536423841 | M7: =(K7-J7)/K7 -> 0.54817474566128066
A8: 601225.SH | B8: 陕西煤业 | C8: 煤炭-煤炭开采加工-煤炭开采 | D8: 24.576271186440682 | E8: 108.47457437 | F8: 18.832699999999999 | L8: =(I8-J8)/J8 -> #DIV/0!
A9: 601898.SH | B9: 中煤能源 | C9: 煤炭-煤炭开采加工-煤炭开采 | D9: 187.09677419354841 | E9: 58.766827329999998 | F9: 10.078799999999999 | L9: =(I9-J9)/J9 -> #DIV/0!
A10: 600188.SH | B10: 兖矿能源 | C10: 煤炭-煤炭开采加工-煤炭开采 | D10: 66.437828371278471 | E10: -3.2657566899999999 | F10: 12.3657 | L10: =(I10-J10)/J10 -> #DIV/0!
A11: 601666.SH | B11: 平煤股份 | C11: 煤炭-煤炭开采加工-煤炭开采 | D11: 69.347396176664475 | E11: 28.787571849999999 | F11: 10.2806 | L11: =(I11-J11)/J11 -> #DIV/0!
A12: 600758.SH | B12: 辽宁能源 | C12: 煤炭-煤炭开采加工-煤炭开采 | D12: 101.78125 | E12: 0.58120265000000004 | F12: 0.16950000000000001 | L12: =(I12-J12)/J12 -> #DIV/0!
A13: 600546.SH | B13: 山煤国际 | C13: 煤炭-煤炭开采加工-煤炭开采 | D13: 166.66666666666669 | E13: 27.05116203 | F13: 8.7042000000000002 | L13: =(I13-J13)/J13 -> #DIV/0!
A14: 601001.SH | B14: 晋控煤业 | C14: 煤炭-煤炭开采加工-煤炭开采 | D14: 236.95652173913041 | E14: 26.408453269999999 | F14: 30.9116 | L14: =(I14-J14)/J14 -> #DIV/0!
A15: 601918.SH | B15: 新集能源 | C15: 煤炭-煤炭开采加工-煤炭开采 | D15: 366.66666666666663 | E15: 52.835935849999998 | F15: 22.060300000000002 | L15: =(I15-J15)/J15 -> #DIV/0!
A16: 600971.SH | B16: 恒源煤电 | C16: 煤炭-煤炭开采加工-煤炭开采 | D16: 98.796948356807519 | E16: 29.7859987 | F16: 16.9968 | G16: 6.92 | I16: 8 | J16: 6.0800000000000001 | K16: 9.3800000000000008 | L16: =(I16-J16)/J16 -> 0.31578947368421051 | M16: =(K16-J16)/K16 -> 0.35181236673773991
A17: 002128.SZ | B17: 电投能源 | C17: 煤炭-煤炭开采加工-煤炭开采 | D17: 40.186915887850461 | E17: 25.758864750000001 | F17: 22.1388 | G17: 8.02 | I17: 14.859999999999999 | J17: 11 | K17: 18.48 | L17: =(I17-J17)/J17 -> 0.35090909090909084 | M17: =(K17-J17)/K17 -> 0.40476190476190477
A18: 601088.SH | B18: 中国神华 | C18: 煤炭-煤炭开采加工-煤炭开采 | D18: 21.576763485477183 | E18: 46.559351669999998 | F18: 20.5642 | L18: =(I18-J18)/J18 -> #DIV/0!
A19: 000552.SZ | B19: 靖远煤电 | C19: 煤炭-煤炭开采加工-煤炭开采 | D19: 19.552414605418143 | E19: 46.858508200000003 | F19: 13.1974 | L19: =(I19-J19)/J19 -> #DIV/0!
A20: 600121.SH | B20: 郑州煤电 | C20: 煤炭-煤炭开采加工-煤炭开采 | D20: 82.161029631846759 | E20: 0.20903181000000001 | F20: 0.40739999999999998 | L20: =(I20-J20)/J20 -> #DIV/0!
A21: 600985.SH | B21: 淮北矿业 | C21: 煤炭-煤炭开采加工-煤炭开采 | D21: 23.437500000000004 | E21: 55.144533170000003 | F21: 8.1188000000000002 | L21: =(I21-J21)/J21 -> #DIV/0!
A22: 000937.SZ | B22: 冀中能源 | C22: 煤炭-煤炭开采加工-煤炭开采 | D22: 66.29406706792777 | E22: 24.0322748 | F22: 8.4275000000000002 | L22: =(I22-J22)/J22 -> #DIV/0!
A23: 601101.SH | B23: 昊华能源 | C23: 煤炭-煤炭开采加工-煤炭开采 | D23: 1088.8888888888891 | E23: 85.308912829999997 | F23: 32.453600000000002 | G23: 8.99 | I23: 9.1300000000000008 | J23: 7.2199999999999998 | K23: 14.07 | L23: =(I23-J23)/J23 -> 0.26454293628808878 | M23: =(K23-J23)/K23 -> 0.48685145700071075
A24: 600123.SH | B24: 兰花科创 | C24: 煤炭-煤炭开采加工-煤炭开采 | D24: 474.48694029850753 | E24: 95.698882850000004 | F24: 13.4367 | G24: 10.12 | I24: 13.609999999999999 | J24: 8.7400000000000002 | K24: 14.67 | L24: =(I24-J24)/J24 -> 0.55720823798626995 | M24: =(K24-J24)/K24 -> 0.4042263122017723
A25: 600397.SH | B25: 安源煤业 | C25: 煤炭-煤炭开采加工-煤炭开采 | D25: 86.531690140845072 | E25: 78.855582470000002 | F25: -0.44950000000000001