A1: 股票代码 | B1: 股票简称 | C1: 所属同花顺行业 | D1: 基本面 | H1: 技术面 | N1: 结论 | O1: 更新时间
D2: 本季度利润增长速度 | E2: 本季度销售增长速度 | F2: 本季度利润率 | G2: 市盈率(股票价格/每股收益) | H2: 价格趋势是否已经掉头向上 | I2: 当日收盘价 | J2: 最低点 | K2: 最高点 | L2: 反弹强度(越大越好) | M2: 回调幅度(越小越好)
A3: 002545.SZ | B3: 东方铁塔 | C3: 基础化工-化学制品-钾肥 | D3: 51.443850267379688 | E3: -1.32447954 | F3: 17.371500000000001 | G3: 32.799999999999997 | H3: 从2021/11/03日开始向上 | I3: 11.300000000000001 | J3: 7.5800000000000001 | L3: =(I3-J3)/J3 -> 0.49076517150395788 | N3: 亚钾国际是市场领头羊，藏格矿业是次级领头羊 | O3: 44632
A4: 603938.SH | B4: 三孚股份 | C4: 基础化工-化学制品-钾肥 | D4: 270.58823529411762 | E4: 18.70430713 | F4: 21.694500000000001 | G4: 27.510000000000002 | H4: 从2022/01/28日开始向上 | I4: 47.299999999999997 | J4: 31.300000000000001 | L4: =(I4-J4)/J4 -> 0.51118210862619795
A5: 000408.SZ | B5: 藏格矿业 | C5: 基础化工-化学制品-钾肥 | D5: 1730.9734513274336 | E5: 110.63730987 | F5: 39.301499999999997 | G5: 38.469999999999999 | H5: 从2021/09/29日开始向上 | I5: 34.740000000000002 | J5: 24.239999999999998 | L5: =(I5-J5)/J5 -> 0.43316831683168333
A6: 000792.SZ | B6: 盐湖股份 | C6: 基础化工-化学制品-钾肥 | D6: 32.693053938688394 | E6: -21.85003116 | F6: 38.2819 | G6: 44.82 | H6: 从2021/11/15日开始向上 | I6: 30 | J6: 24.440000000000001 | L6: =(I6-J6)/J6 -> 0.22749590834697211
A7: 000893.SZ | B7: 亚钾国际 | C7: 基础化工-化学制品-钾肥 | D7: 15676.666666666664 | E7: 73.816920269999997 | F7: 165.38390000000001 | G7: 27.84 | H7: 从2021/11/08日开始向上 | I7: 28.379999999999999 | J7: 16.460000000000001 | L7: =(I7-J7)/J7 -> 0.72417982989064389