A1: 股票代码 | B1: 股票简称 | C1: 区间涨跌幅:前复权(%)2020.12.29-2021.12.28 | D1: 基本每股收(元)2021.09.30 | E1: 行业 | F1: 当前基底处于上升趋势的位置(即处于第几个基底) | G1: 趋势 | R1: 波动收缩幅度 | AK1: 成交量行为 | AM1: 价格行为(得分应大于60%) | AP1: 结论 | AQ1: 更新时间 | AR1: 标签
G2: 200日均线 | H2: 150日均线 | I2: 50日均线 | J2: 各均线斜率是否朝上 | K2: 当前股价 | L2: 52周内最低点 | M2: 52周内最高点 | N2: 最高点前8周收盘价 | O2: 当前股价相对于最低点百分比(至少高出25%) | P2: 当前股价相对于最高点百分比(25%内最好) | Q2: 最高点前8周股价相对于最高点百分比 | R2: 技术足迹 | AK2: 不同收盘表现时交易量情况(好的收盘时，交易量是否增大，坏的收盘时，交易量是否萎缩) | AL2: 成交量收缩情况(最后的价格收缩期间的成交量应低于50天的平均水平且有一到两天交易量极低) | AM2: 支撑位和压力位是否同步升高(40%) | AN2: 是否有网球行为出现(40%) | AO2: 上涨天数是否大于下跌天数(20%)
R3: 支撑位1 | S3: 阻力位2 | T3: 支撑位2 | U3: 阻力位3 | V3: 支撑位3 | W3: 阻力位4 | X3: 支撑位4 | Y3: 阻力位5 | Z3: 支撑位5 | AA3: 阻力位6 | AB3: 支撑位6 | AC3: 时间周期 | AD3: 收缩量1 | AE3: 收缩量2 | AF3: 收缩量3 | AG3: 收缩量4 | AH3: 收缩量5 | AI3: 收缩量6 | AJ3: 收缩数量(至少大于3T)
A4: 002932.SZ | B4: 明德生物 | C4: 62.72 | D4: 10.68 | AP4: 已分析 | AQ4: 44557
A5: 603260.SH | B5: 合盛硅业 | C5: 250.11 | D5: 5.09 | AP5: 已分析 | AQ5: 44557
A6: 601919.SH | B6: 中远海控 | C6: 104.38 | D6: 4.23 | AP6: 已分析 | AQ6: 44557
A7: 603501.SH | B7: 韦尔股份 | C7: 41.34 | D7: 4.06 | AP7: 已分析 | AQ7: 44557
A8: 603026.SH | B8: 石大胜华 | C8: 266.61 | D8: 3.66 | AP8: 已分析 | AQ8: 44557
A9: 600436.SH | B9: 片仔癀 | C9: 90.29 | D9: 3.33 | AP9: 已分析 | AQ9: 44557
A10: 600702.SH | B10: 舍得酒业 | C10: 169.32 | D10: 2.92 | AP10: 已分析 | AQ10: 44557
A11: 002821.SZ | B11: 凯莱英 | C11: 50.51 | D11: 2.88 | AP11: 已分析 | AQ11: 44557
A12: 605117.SH | B12: 德业股份 | C12: 516.97 | D12: 2.64 | AP12: 已分析 | AQ12: 44557
A13: 605499.SH | B13: 东鹏饮料 | C13: 231.86 | D13: 2.64 | AP13: 已分析 | AQ13: 44557
A14: 600295.SH | B14: 鄂尔多斯 | C14: 121.61 | D14: 2.6000000000000001 | AP14: 已分析 | AQ14: 44557
A15: 605369.SH | B15: 拱东医疗 | C15: 245.32 | D15: 2.57 | AP15: 已分析 | AQ15: 44557
A16: 002648.SZ | B16: 卫星化学 | C16: 102.72 | D16: 2.48 | AP16: 已分析 | AQ16: 44557
A17: 600563.SH | B17: 法拉电子 | C17: 122.97 | D17: 2.45 | AP17: 已分析 | AQ17: 44557
A18: 002913.SZ | B18: 奥士康 | C18: 35.63 | D18: 2.42 | AP18: 已分析 | AQ18: 44557
A19: 002049.SZ | B19: 紫光国微 | C19: 60.51 | D19: 2.3999999999999999 | AP19: 已分析 | AQ19: 44557
A20: 600188.SH | B20: 兖矿能源 | C20: 176.29 | D20: 2.38 | AP20: 已分析 | AQ20: 44557
A21: 603486.SH | B21: 科沃斯 | C21: 67.56 | D21: 2.38 | AP21: 已分析 | AQ21: 44557
A22: 600141.SH | B22: 兴发集团 | C22: 256.04 | D22: 2.22 | AP22: 已分析 | AQ22: 44557
A23: 603599.SH | B23: 广信股份 | C23: 74.65 | D23: 2.22 | AP23: 已分析 | AQ23: 44557
A24: 000799.SZ | B24: 酒鬼酒 | C24: 66.14 | D24: 2.22 | AP24: 已分析 | AQ24: 44557
A25: 605111.SH | B25: 新洁能 | C25: 45.85 | D25: 2.19 | AP25: 已分析 | AQ25: 44557
A26: 002791.SZ | B26: 坚朗五金 | C26: 39.45 | D26: 2.19 | AP26: 已分析 | AQ26: 44557
A27: 603217.SH | B27: 元利科技 | C27: 81.17 | D27: 2.16 | AP27: 已分析 | AQ27: 44557
A28: 600132.SH | B28: 重庆啤酒 | C28: 32.68 | D28: 2.16 | AP28: 已分析 | AQ28: 44557
A29: 601677.SH | B29: 明泰铝业 | C29: 203.41 | D29: 2.12 | AP29: 已分析 | AQ29: 44557
A30: 600779.SH | B30: 水井坊 | C30: 65.55 | D30: 2.05 | AP30: 已分析 | AQ30: 44557
A31: 601088.SH | B31: 中国神华 | C31: 37.87 | D31: 2.05 | AP31: 已分析 | AQ31: 44557
A32: 605080.SH | B32: 浙江自然 | C32: 100.59 | D32: 2.04 | AP32: 已分析 | AQ32: 44557
A33: 603799.SH | B33: 华友钴业 | C33: 41.81 | D33: 1.98 | AP33: 已分析 | AQ33: 44557
A34: 603297.SH | B34: 永新光学 | C34: 201.83 | D34: 1.97 | AP34: 已分析 | AQ34: 44557
A35: 002812.SZ | B35: 恩捷股份 | C35: 74.35 | D35: 1.97 | AP35: 已分析 | AQ35: 44557
A36: 600596.SH | B36: 新安股份 | C36: 131.41 | D36: 1.96 | AP36: 已分析 | AQ36: 44557
A37: 603392.SH | B37: 万泰生物 | C37: 53.44 | D37: 1.96 | AP37: 已分析 | AQ37: 44557
A38: 601699.SH | B38: 潞安环能 | C38: 74.46 | D38: 1.95 | AP38: 已分析 | AQ38: 44557
A39: 600746.SH | B39: 江苏索普 | C39: 119.19 | D39: 1.91 | AP39: 已分析 | AQ39: 44557
A40: 000733.SZ | B40: 振华科技 | C40: 113.95 | D40: 1.86 | AP40: 已分析 | AQ40: 44557
A41: 605305.SH | B41: 中际联合 | C41: 99.84 | D41: 1.85 | AP41: 已分析 | AQ41: 44557
A42: 600810.SH | B42: 神马股份 | C42: 35.51 | D42: 1.8 | AP42: 已分析 | AQ42: 44557
A43: 603565.SH | B43: 中谷物流 | C43: 67.72 | D43: 1.79 | AP43: 已分析 | AQ43: 44557
A44: 000999.SZ | B44: 华润三九 | C44: 34.11 | D44: 1.78 | AP44: 已分析 | AQ44: 44557
A45: 603659.SH | B45: 璞泰来 | C45: 85.22 | D45: 1.77 | AP45: 已分析 | AQ45: 44557
A46: 600389.SH | B46: 江山股份 | C46: 82.68 | D46: 1.77 | AP46: 已分析 | AQ46: 44557
A47: 605123.SH | B47: 派克新材 | C47: 61.78 | D47: 1.77 | AP47: 已分析 | AQ47: 44557
A48: 002900.SZ | B48: 哈三联 | C48: 129.51 | D48: 1.74 | AP48: 已分析 | AQ48: 44557
A49: 600884.SH | B49: 杉杉股份 | C49: 67.13 | D49: 1.7 | AP49: 已分析 | AQ49: 44557
A50: 600976.SH | B50: 健民集团 | C50: 215.03 | D50: 1.69 | AP50: 已分析 | AQ50: 44557
A51: 603290.SH | B51: 斯达半导 | C51: 65.79 | D51: 1.67 | AP51: 已分析 | AQ51: 44557
A52: 000422.SZ | B52: 湖北宜化 | C52: 566.67 | D52: 1.66 | AP52: 已分析 | AQ52: 44557
A53: 002709.SZ | B53: 天赐材料 | C53: 91.12 | D53: 1.66 | AP53: 已分析 | AQ53: 44557
A54: 600745.SH | B54: 闻泰科技 | C54: 47.93 | D54: 1.65 | AP54: 已分析 | AQ54: 44557
A55: 603897.SH | B55: 长城科技 | C55: 256.04 | D55: 1.64 | AP55: 已分析 | AQ55: 44557
A56: 605399.SH | B56: 晨光新材 | C56: 130.46 | D56: 1.63 | AP56: 已分析 | AQ56: 44557
A57: 603236.SH | B57: 移远通信 | C57: 46.399999999999999 | D57: 1.63 | AP57: 已分析 | AQ57: 44557
A58: 002850.SZ | B58: 科达利 | C58: 68.88 | D58: 1.61 | AP58: 已分析 | AQ58: 44557
A59: 002876.SZ | B59: 三利谱 | C59: 99.74 | D59: 1.6000000000000001 | AP59: 已分析 | AQ59: 44557
A60: 002080.SZ | B60: 中材科技 | C60: 49.96 | D60: 1.58 | AP60: 已分析 | AQ60: 44557
A61: 002541.SZ | B61: 鸿路钢构 | C61: 49.96 | D61: 1.57 | AP61: 已分析 | AQ61: 44557
A62: 600096.SH | B62: 云天化 | C62: 224.23 | D62: 1.55 | AP62: 已分析 | AQ62: 44557
A63: 601001.SH | B63: 晋控煤业 | C63: 53.34 | D63: 1.55 | AP63: 已分析 | AQ63: 44557
A64: 603186.SH | B64: 华正新材 | C64: 36.91 | D64: 1.53 | AP64: 已分析 | AQ64: 44557
A65: 002274.SZ | B65: 华昌化工 | C65: 189.42 | D65: 1.52 | AP65: 已分析 | AQ65: 44557
A66: 603071.SH | B66: 物产环能 | C66: 43.78 | D66: 1.52 | AP66: 已分析 | AQ66: 44557
A67: 002179.SZ | B67: 中航光电 | C67: 33.76 | D67: 1.52 | AP67: 已分析 | AQ67: 44557
A68: 002048.SZ | B68: 宁波华翔 | C68: 89.74 | D68: 1.51 | AP68: 已分析 | AQ68: 44557
A69: 002128.SZ | B69: 电投能源 | C69: 49.59 | D69: 1.5 | AP69: 已分析 | AQ69: 44557
A70: 603606.SH | B70: 东方电缆 | C70: 87.88 | D70: 1.47 | AP70: 已分析 | AQ70: 44557
A71: 601225.SH | B71: 陕西煤业 | C71: 42.45 | D71: 1.47 | AP71: 已分析 | AQ71: 44557
A72: 605098.SH | B72: 行动教育 | C72: 63.58 | D72: 1.46 | AP72: 已分析 | AQ72: 44557
A73: 600581.SH | B73: 八一钢铁 | C73: 63.21 | D73: 1.45 | AP73: 已分析 | AQ73: 44557
A74: 603806.SH | B74: 福斯特 | C74: 53.76 | D74: 1.44 | AP74: 已分析 | AQ74: 44557
A75: 003028.SZ | B75: 振邦智能 | C75: 32.17 | D75: 1.44 | AP75: 已分析 | AQ75: 44557
A76: 600566.SH | B76: 济川药业 | C76: 40.75 | D76: 1.43 | AP76: 已分析 | AQ76: 44557
A77: 002008.SZ | B77: 大族激光 | C77: 39.43 | D77: 1.43 | AP77: 已分析 | AQ77: 44557
A78: 600089.SH | B78: 特变电工 | C78: 96.27 | D78: 1.3999999999999999 | AP78: 已分析 | AQ78: 44557
A79: 002756.SZ | B79: 永兴材料 | C79: 154.42 | D79: 1.38 | AP79: 已分析 | AQ79: 44557
A80: 603886.SH | B80: 元祖股份 | C80: 52.61 | D80: 1.38 | AP80: 已分析 | AQ80: 44557
A81: 601636.SH | B81: 旗滨集团 | C81: 38.22 | D81: 1.36 | AP81: 已分析 | AQ81: 44557
A82: 002223.SZ | B82: 鱼跃医疗 | C82: 35.15 | D82: 1.36 | AP82: 已分析 | AQ82: 44557
A83: 000915.SZ | B83: 华特达因 | C83: 32.600000000000001 | D83: 1.36 | AP83: 已分析 | AQ83: 44557
A84: 003020.SZ | B84: 立方制药 | C84: 38.82 | D84: 1.35 | AP84: 已分析 | AQ84: 44557
A85: 002371.SZ | B85: 北方华创 | C85: 88.099999999999994 | D85: 1.34 | AP85: 已分析 | AQ85: 44557
A86: 001296.SZ | B86: 长江材料 | C86: 45.22 | D86: 1.3 | AP86: 已分析 | AQ86: 44557
A87: 002637.SZ | B87: 赞宇科技 | C87: 32.29 | D87: 1.3 | AP87: 已分析 | AQ87: 44557
A88: 603010.SH | B88: 万盛股份 | C88: 56.98 | D88: 1.29 | AP88: 已分析 | AQ88: 44557
A89: 603733.SH | B89: 仙鹤股份 | C89: 58.28 | D89: 1.28 | AP89: 已分析 | AQ89: 44557
A90: 603985.SH | B90: 恒润股份 | C90: 81.5 | D90: 1.27 | AP90: 已分析 | AQ90: 44557
A91: 002597.SZ | B91: 金禾实业 | C91: 53.600000000000001 | D91: 1.27 | AP91: 已分析 | AQ91: 44557
A92: 600328.SH | B92: 中盐化工 | C92: 162.15 | D92: 1.26 | AP92: 已分析 | AQ92: 44557
A93: 603938.SH | B93: 三孚股份 | C93: 120.93 | D93: 1.26 | AP93: 已分析 | AQ93: 44557
A94: 001217.SZ | B94: 华尔泰 | C94: 50.600000000000001 | D94: 1.25 | AP94: 已分析 | AQ94: 44557
A95: 600298.SH | B95: 安琪酵母 | C95: 32.35 | D95: 1.24 | AP95: 已分析 | AQ95: 44557
A96: 600123.SH | B96: 兰花科创 | C96: 65.25 | D96: 1.23 | AP96: 已分析 | AQ96: 44557
A97: 603197.SH | B97: 保隆科技 | C97: 109.17 | D97: 1.2 | AP97: 已分析 | AQ97: 44557
A98: 603198.SH | B98: 迎驾贡酒 | C98: 107.33 | D98: 1.2 | AP98: 已分析 | AQ98: 44557
A99: 000825.SZ | B99: 太钢不锈 | C99: 145.62 | D99: 1.19 | AP99: 已分析 | AQ99: 44557
A100: 600623.SH | B100: 华谊集团 | C100: 56.77 | D100: 1.18 | AP100: 已分析 | AQ100: 44557
A101: 603681.SH | B101: 永冠新材 | C101: 104.26 | D101: 1.17 | AP101: 已分析 | AQ101: 44557
A102: 002258.SZ | B102: 利尔化学 | C102: 59.46 | D102: 1.17 | AP102: 已分析 | AQ102: 44557
A103: 603203.SH | B103: 快克股份 | C103: 55.97 | D103: 1.17 | AP103: 已分析 | AQ103: 44557
A104: 002028.SZ | B104: 思源电气 | C104: 160.54 | D104: 1.16 | AP104: 已分析 | AQ104: 44557
A105: 002929.SZ | B105: 润建股份 | C105: 60.86 | D105: 1.16 | AP105: 已分析 | AQ105: 44557
A106: 605089.SH | B106: 味知香 | C106: 126.39 | D106: 1.15 | AP106: 已分析 | AQ106: 44557
A107: 600803.SH | B107: 新奥股份 | C107: 44.52 | D107: 1.15 | AP107: 已分析 | AQ107: 44557
A108: 003026.SZ | B108: 中晶科技 | C108: 115.8 | D108: 1.14 | AP108: 已分析 | AQ108: 44557
A109: 003043.SZ | B109: 华亚智能 | C109: 231.09 | D109: 1.13 | AP109: 已分析 | AQ109: 44557
A110: 000776.SZ | B110: 广发证券 | C110: 59.56 | D110: 1.13 | AP110: 已分析 | AQ110: 44557
A111: 002271.SZ | B111: 东方雨虹 | C111: 36.04 | D111: 1.12 | AP111: 已分析 | AQ111: 44557
A112: 002759.SZ | B112: 天际股份 | C112: 45.84 | D112: 1.11 | AP112: 已分析 | AQ112: 44557
A113: 603279.SH | B113: 景津环保 | C113: 151.24 | D113: 1.1000000000000001 | AP113: 已分析 | AQ113: 44557
A114: 002092.SZ | B114: 中泰化学 | C114: 58.64 | D114: 1.1000000000000001 | AP114: 已分析 | AQ114: 44557
A115: 600885.SH | B115: 宏发股份 | C115: 37.33 | D115: 1.1000000000000001 | AP115: 已分析 | AQ115: 44557
A116: 000960.SZ | B116: 锡业股份 | C116: 59.57 | D116: 1.09 | AP116: 已分析 | AQ116: 44557
A117: 600587.SH | B117: 新华医疗 | C117: 113.14 | D117: 1.08 | AP117: 已分析 | AQ117: 44557
A118: 002960.SZ | B118: 青鸟消防 | C118: 76.42 | D118: 1.08 | AP118: 已分析 | AQ118: 44557
A119: 000963.SZ | B119: 华东医药 | C119: 46.64 | D119: 1.08 | AP119: 已分析 | AQ119: 44557
A120: 603612.SH | B120: 索通发展 | C120: 43.64 | D120: 1.08 | AP120: 已分析 | AQ120: 44557
A121: 603908.SH | B121: 牧高笛 | C121: 76.18 | D121: 1.07 | AP121: 已分析 | AQ121: 44557
A122: 601101.SH | B122: 昊华能源 | C122: 54.31 | D122: 1.07 | AP122: 已分析 | AQ122: 44557
A123: 002254.SZ | B123: 泰和新材 | C123: 33.56 | D123: 1.07 | AP123: 已分析 | AQ123: 44557
A124: 603380.SH | B124: 易德龙 | C124: 87.099999999999994 | D124: 1.06 | AP124: 已分析 | AQ124: 44557
A125: 603100.SH | B125: 川仪股份 | C125: 78.13 | D125: 1.05 | AP125: 已分析 | AQ125: 44557
A126: 600038.SH | B126: 中直股份 | C126: 31.99 | D126: 1.05 | AP126: 已分析 | AQ126: 44557
A127: 603507.SH | B127: 振江股份 | C127: 66.31 | D127: 1.04 | AP127: 已分析 | AQ127: 44557
A128: 000807.SZ | B128: 云铝股份 | C128: 47.96 | D128: 1.03 | AP128: 已分析 | AQ128: 44557
A129: 002039.SZ | B129: 黔源电力 | C129: 36.5 | D129: 1.03 | AP129: 已分析 | AQ129: 44557
A130: 002407.SZ | B130: 多氟多 | C130: 113.73 | D130: 1.01 | AP130: 已分析 | AQ130: 44557
A131: 600075.SH | B131: 新疆天业 | C131: 46.25 | D131: 1.01 | AP131: 已分析 | AQ131: 44557
A132: 603230.SH | B132: 内蒙新华 | C132: 45.29 | D132: 1.01 | AP132: 已分析 | AQ132: 44557
A133: 001203.SZ | B133: 大中矿业 | C133: 44.12 | D133: 1.01 | AP133: 已分析 | AQ133: 44557
A134: 002241.SZ | B134: 歌尔股份 | C134: 44.5 | D134: 1 | AP134: 已分析 | AQ134: 44557
A135: 603893.SH | B135: 瑞芯微 | C135: 94.86 | D135: 0.99 | E135: 半导体及元件 | F135: 3 | G135: 120 | H135: 125.91 | I135: 136.21000000000001 | K135: 138.06999999999999 | L135: 58.979999999999997 | M135: 185.97999999999999 | N135: 85 | O135: =(K135-L135)/L135 -> 1.340963038318074 | P135: =(M135-K135)/M135 -> 0.25760834498333152 | Q135: =(M135-N135)/N135 -> 1.1879999999999999 | R135: 101 | S135: 159.5 | T135: 129.59999999999999 | AD135: =(M135-R135)/M135 -> 0.45693085277986878 | AE135: =(S135-T135)/S135 -> 0.18746081504702197 | AP135: 不宜入场（收缩幅度不够）
A136: 600618.SH | B136: 氯碱化工 | C136: 72.97 | D136: 0.99 | AP136: 不宜入场（当前股价位于50日均线以下）
A137: 603613.SH | B137: 国联股份 | C137: 43.89 | D137: 0.99 | E137: 互联网电商 | F137: 6 | G137: 106.73999999999999 | H137: 108.3 | I137: 111.18000000000001 | K137: 104.27 | AP137: 不宜入场（当前股价位于50日均线以下,应多观察2w） | AQ137: 44573
A138: 605028.SH | B138: 世茂能源 | C138: 41.95 | D138: 0.99 | AP138: 已分析
A139: 600507.SH | B139: 方大特钢 | C139: 36.11 | D139: 0.99 | AP139: 不宜入场（200日均线上涨不明显）
A140: 603822.SH | B140: 嘉澳环保 | C140: 135.23 | D140: 0.98 | AP140: 不宜入场（当前股价小于50日均线）
A141: 002884.SZ | B141: 凌霄泵业 | C141: 71.68 | D141: 0.98 | E141: 通用设备 | F141: 4 | G141: 22.760000000000002 | H141: 23.02 | I141: 24.620000000000001 | K141: 24.609999999999999 | AP141: 不宜入场（当前股价位于50日均线以下,应多观察2w） | AQ141: 44573
A142: 002636.SZ | B142: 金安国纪 | C142: 69.41 | D142: 0.98 | AP142: 不宜入场（50日均线小于150日均线）
A143: 002870.SZ | B143: 香山股份 | C143: 52.09 | D143: 0.98 | E143: 汽车零部件 | F143: 2 | G143: 31.960000000000001 | H143: 33.520000000000003 | I143: 37.520000000000003 | K143: 38.82 | L143: 19.93 | M143: 49.5 | N143: 29.649999999999999 | O143: =(K143-L143)/L143 -> 0.94781736076266943 | P143: =(M143-K143)/M143 -> 0.21575757575757576 | Q143: =(M143-N143)/N143 -> 0.6694772344013491 | R143: 35 | AD143: =(M143-R143)/M143 -> 0.29292929292929293 | AP143: 不宜入场（收缩幅度不够，应多观察3w） | AQ143: 44573
A144: 600019.SH | B144: 宝钢股份 | C144: 35.02 | D144: 0.98 | AP144: 不宜入场（150日均线小于200日均线）
A145: 000949.SZ | B145: 新乡化纤 | C145: 68.900000000000006 | D145: 0.97 | AP145: 不宜入场（50日均线小于150日均线）
A146: 603948.SH | B146: 建业股份 | C146: 50.42 | D146: 0.97 | AP146: 不宜入场（当前股价小于50日均线）
A147: 603738.SH | B147: 泰晶科技 | C147: 198.19 | D147: 0.96 | E147: 半导体及元件 | F147: 2 | G147: 45.350000000000001 | H147: 48.840000000000003 | I147: 56.770000000000003 | K147: 48.939999999999998 | L147: 16.710000000000001 | M147: 68.140000000000001 | N147: 46.520000000000003 | O147: =(K147-L147)/L147 -> 1.9287851585876719 | P147: =(M147-K147)/M147 -> 0.2817728206633402 | Q147: =(M147-N147)/N147 -> 0.4647463456577815 | AP147: 不宜入场（当前股价小于50日均线,应多观察2w） | AQ147: 44573
A148: 603008.SH | B148: 喜临门 | C148: 111.72 | D148: 0.96 | E148: 家用轻工 | F148: 2 | G148: 28.920000000000002 | H148: 29.539999999999999 | I148: 32.82 | K148: 36.450000000000003 | L148: 16.18 | M148: 40.450000000000003 | N148: 27.010000000000002 | O148: =(K148-L148)/L148 -> 1.2527812113720644 | P148: =(M148-K148)/M148 -> 9.8887515451174288e-02 | Q148: =(M148-N148)/N148 -> 0.49759348389485375 | R148: 34.609999999999999 | AC148: 1w | AD148: =(M148-R148)/M148 -> 0.14437577255871453 | AP148: 不宜入场(收缩幅度不够，应多观察1w) | AQ148: 44573
A149: 000959.SZ | B149: 首钢股份 | C149: 56.84 | D149: 0.96 | AP149: 不宜入场（当前股价小于50日均线）
A150: 000893.SZ | B150: 亚钾国际 | C150: 181.75 | D150: 0.95 | E150: 化学制品 | F150: 4 | G150: 18.309999999999999 | H150: 19.32 | I150: 22.120000000000001 | K150: 23.710000000000001 | L150: 7.9000000000000004 | M150: 28.670000000000002 | N150: 17.870000000000001 | O150: =(K150-L150)/L150 -> 2.0012658227848101 | P150: =(M150-K150)/M150 -> 0.17300313916986398 | Q150: =(M150-N150)/N150 -> 0.60436485730274203 | R150: 23.359999999999999 | AC150: 1w | AD150: =(M150-R150)/M150 -> 0.18521102197418912 | AP150: 不宜入场(收缩幅度不够，应多观察1w) | AQ150: 44573
A151: 600348.SH | B151: 华阳股份 | C151: 126.51 | D151: 0.95 | E151: 煤炭开采加工 | F151: 2 | G151: 9.75 | H151: 10.380000000000001 | I151: 11.52 | K151: 12.199999999999999 | L151: 4.2300000000000004 | M151: 16.300000000000001 | N151: 8.4800000000000004 | O151: =(K151-L151)/L151 -> 1.8841607565011815 | P151: =(M151-K151)/M151 -> 0.25153374233128845 | Q151: =(M151-N151)/N151 -> 0.92216981132075471 | R151: 9.6699999999999999 | S151: 12.300000000000001 | T151: 10.68 | U151: 13.42 | V151: 11.23 | AC151: 13w | AD151: =(M151-R151)/M151 -> 0.40674846625766875 | AE151: =(S151-T151)/S151 -> 0.13170731707317079 | AF151: =(U151-V151)/U151 -> 0.16318926974664677 | AP151: 不宜入场（收缩幅度不够，应多观察5w） | AQ151: 44573
A152: 002738.SZ | B152: 中矿资源 | C152: 108.65 | D152: 0.95 | AP152: 不宜入场（当前股价小于50日均线）
A153: 603568.SH | B153: 伟明环保 | C153: 93.44 | D153: 0.95 | E153: 环保 | F153: 2 | G153: 28.469999999999999 | H153: 29.57 | I153: 33.340000000000003 | K153: 32.280000000000001 | AC153: 2w | AD153: =(M153-R153)/M153 -> #DIV/0! | AP153: 不宜入场（当前股价小于50日均线） | AQ153: 44573
A154: 603127.SH | B154: 昭衍新药 | C154: 51.47 | D154: 0.95 | AP154: 不宜入场（50日均线小于150日均线）
A155: 603801.SH | B155: 志邦家居 | C155: 45.05 | D155: 0.95 | AP155: 不宜入场（各均线斜率向下）
A156: 605337.SH | B156: 李子园 | C156: 198.90000000000001 | D156: 0.93 | E156: 饮料制造 | F156: 2 | G156: 42.5 | H156: 43.880000000000003 | I156: 45.68 | K156: 45.719999999999999 | L156: 16.82 | M156: 69.930000000000007 | N156: 35.859999999999999 | O156: =(K156-L156)/L156 -> 1.7181926278240189 | P156: =(M156-K156)/M156 -> 0.34620334620334631 | Q156: =(M156-N156)/N156 -> 0.9500836586726159 | AD156: =(M156-R156)/M156 -> 1 | AP156: 不宜入场（当前股价距离最高价差距过大，面临巨大抛压，应多观察2w） | AQ156: 44573
A157: 000818.SZ | B157: 航锦科技 | C157: 91.34 | D157: 0.93 | E157: 化学原料 | F157: 2 | G157: 31.199999999999999 | H157: 32.68 | I157: 35.920000000000002 | K157: 33.890000000000001 | L157: 19.399999999999999 | M157: 41.759999999999998 | N157: 28.600000000000001 | O157: =(K157-L157)/L157 -> 0.74690721649484548 | P157: =(M157-K157)/M157 -> 0.18845785440613022 | Q157: =(M157-N157)/N157 -> 0.46013986013986002 | AP157: 不宜入场（当前股价小于50日均线） | AQ157: 44573
A158: 603466.SH | B158: 风语筑 | C158: 72.97 | D158: 0.93 | E158: 其他社会服务 | F158: 2 | G158: 18.719999999999999 | H158: 19.59 | I158: 23.5 | K158: 26.440000000000001 | L158: 12.77 | M158: 30.879999999999999 | N158: 16.420000000000002 | O158: =(K158-L158)/L158 -> 1.0704776820673456 | P158: =(M158-K158)/M158 -> 0.14378238341968905 | Q158: =(M158-N158)/N158 -> 0.88063337393422625 | R158: 25.559999999999999 | AC158: 2w | AD158: =(M158-R158)/M158 -> 0.17227979274611399 | AP158: 不宜入场(收缩幅度不够，应多观察1w) | AQ158: 44573
A159: 000977.SZ | B159: 浪潮信息 | C159: 47.200000000000003 | D159: 0.93 | E159: 计算机设备 | F159: 2 | G159: 30.949999999999999 | H159: 31.530000000000001 | I159: 33.659999999999997 | K159: 33.780000000000001 | L159: 25.27 | M159: 36.979999999999997 | N159: 31.809999999999999 | O159: =(K159-L159)/L159 -> 0.33676296003165818 | P159: =(M159-K159)/M159 -> 8.6533261222282207e-02 | Q159: =(M159-N159)/N159 -> 0.16252750707324737 | R159: 33.159999999999997 | AC159: 1w | AD159: =(M159-R159)/M159 -> 0.10329908058409953 | AP159: 不宜入场(收缩幅度不够，应多观察1w) | AQ159: 44573
A160: 603639.SH | B160: 海利尔 | C160: 87.299999999999997 | D160: 0.92 | E160: 化学制品 | G160: 20.539999999999999 | H160: 21.07 | I160: 23.690000000000001 | K160: 25.670000000000002 | L160: 13.76 | M160: 26.859999999999999 | N160: 19.149999999999999 | O160: =(K160-L160)/L160 -> 0.8655523255813955 | P160: =(M160-K160)/M160 -> 4.4303797468354347e-02 | Q160: =(M160-N160)/N160 -> 0.40261096605744134 | R160: 24.050000000000001 | AC160: 2w | AD160: =(M160-R160)/M160 -> 0.10461653015636629 | AP160: 不宜入场(收缩幅度不够，应多观察1w) | AQ160: 44573
A161: 000761.SZ | B161: 本钢板材 | C161: 55.31 | D161: 0.92 | AP161: 不宜入场（当前股价小于50日均线）
A162: 002129.SZ | B162: 中环股份 | C162: 43.99 | D162: 0.91 | AP162: 不宜入场（当前股价小于50日均线）
A163: 000990.SZ | B163: 诚志股份 | C163: 37.47 | D163: 0.91 | E163: 化学原料 | F163: 2 | AP163: 不宜入场（150日均线小于200日均线）
A164: 002025.SZ | B164: 航天电器 | C164: 32.15 | D164: 0.91 | E164: 国防军工 | F164: 3 | G164: 64.420000000000002 | H164: 67.370000000000005 | I164: 75.090000000000003 | K164: 68.700000000000003 | AP164: 不宜入场（当前股价小于50日均线,应多观察2w） | AQ164: 44573
A165: 603596.SH | B165: 伯特利 | C165: 124.12 | D165: 0.90000000000000002 | E165: 汽车零部件 | F165: 2 | G165: 50.399999999999999 | H165: 54.130000000000003 | I165: 65.370000000000005 | K165: 66.599999999999994 | L165: 26.48 | M165: 77.790000000000006 | N165: 55.609999999999999 | O165: =(K165-L165)/L165 -> 1.5151057401812684 | P165: =(M165-K165)/M165 -> 0.14384882375626701 | Q165: =(M165-N165)/N165 -> 0.3988491278547025 | R165: 61.130000000000003 | AC165: 3w | AD165: =(M165-R165)/M165 -> 0.21416634528859754 | AP165: 不宜入场(收缩幅度不够，应多观察3w) | AQ165: 44573
A166: 605006.SH | B166: 山东玻纤 | C166: 68.21 | D166: 0.90000000000000002 | AP166: 不宜入场（当前股价小于50日均线）
A167: 603989.SH | B167: 艾华集团 | C167: 56.799999999999997 | D167: 0.90000000000000002 | E167: 半导体及元件 | F167: 4 | G167: 34.740000000000002 | H167: 35.909999999999997 | I167: 38.789999999999999 | K167: 36.920000000000002 | AP167: 不宜入场（当前股价小于50日均线，应该多观察2w） | AQ167: 44573
A168: 603610.SH | B168: 麒盛科技 | C168: 55.19 | D168: 0.90000000000000002 | AP168: 不宜入场（当前股价小于50日均线）
A169: 002920.SZ | B169: 德赛西威 | C169: 92.63 | D169: 0.89 | E169: 计算机应用 | F169: 4 | G169: 109.84 | H169: 114.20999999999999 | I169: 131.61000000000001 | K169: 137 | L169: 71.959999999999994 | M169: 165.5 | N169: 97.849999999999994 | O169: =(K169-L169)/L169 -> 0.90383546414674831 | P169: =(M169-K169)/M169 -> 0.17220543806646527 | Q169: =(M169-N169)/N169 -> 0.69136433316300472 | R169: 125.70999999999999 | AC169: 2w | AD169: =(M169-R169)/M169 -> 0.24042296072507557 | AP169: 不宜入场(收缩幅度不够，应多观察3w) | AQ169: 44573
A170: 603855.SH | B170: 华荣股份 | C170: 60.26 | D170: 0.89 | E170: 专用设备 | F170: 3 | G170: 21.989999999999998 | H170: 22.48 | I170: 24.41 | K170: 27.66 | L170: 13.5 | M170: 28.34 | N170: 24.52 | O170: =(K170-L170)/L170 -> 1.048888888888889 | P170: =(M170-K170)/M170 -> 2.3994354269583618e-02 | Q170: =(M170-N170)/N170 -> 0.15579119086460033 | AC170: 0w | AP170: 不宜入场(收缩幅度数量不够，应多观察2w) | AQ170: 44573
A171: 601898.SH | B171: 中煤能源 | C171: 49.68 | D171: 0.89 | AP171: 不宜入场（50日均线小于150日均线）
A172: 000906.SZ | B172: 浙商中拓 | C172: 68.59 | D172: 0.88 | E172: 物流 | F172: 2 | G172: 10.279999999999999 | H172: 10.6 | I172: 11.01 | K172: 11.68 | L172: 5.5999999999999996 | M172: 13.75 | N172: 8.3499999999999996 | O172: =(K172-L172)/L172 -> 1.0857142857142859 | P172: =(M172-K172)/M172 -> 0.15054545454545457 | Q172: =(M172-N172)/N172 -> 0.64670658682634741 | R172: 9.4299999999999997 | S172: 11.35 | T172: 10.18 | U172: 12.220000000000001 | V172: 11.06 | AC172: 28w | AD172: =(M172-R172)/M172 -> 0.31418181818181823 | AE172: =(S172-T172)/S172 -> 0.10308370044052863 | AF172: =(U172-V172)/U172 -> 9.4926350245499183e-02 | AK172: 是 | AL172: 否 | AN172: 是 | AP172: 不宜入场（最后收缩阶段的成交量大于50日平均） | AQ172: 44573
A173: 600500.SH | B173: 中化国际 | C173: 59.09 | D173: 0.88 | AP173: 不宜入场（当前股价小于50日均线）
A174: 002984.SZ | B174: 森麒麟 | C174: 50.29 | D174: 0.88 | E174: 汽车零部件 | F174: 2 | G174: 33.909999999999997 | H174: 33.93 | I174: 34.810000000000002 | K174: 31.390000000000001 | L174: 26.57 | M174: 47.759999999999998 | N174: 24.190000000000001 | O174: =(K174-L174)/L174 -> 0.18140760255927738 | P174: =(M174-K174)/M174 -> 0.34275544388609713 | Q174: =(M174-N174)/N174 -> 0.97436957420421644 | AD174: =(M174-R174)/M174 -> 1 | AP174: 不宜入场（当前股价小于200日均线，应多观察5w） | AQ174: 44573
A175: 603611.SH | B175: 诺力股份 | C175: 37.75 | D175: 0.88 | AP175: 不宜入场（当前股价小于50日均线）
A176: 600111.SH | B176: 北方稀土 | C176: 238.98 | D176: 0.87 | E176: 小金属 | F176: 2 | G176: 39.899999999999999 | H176: 42.68 | I176: 47.210000000000001 | K176: 42.020000000000003 | AP176: 不宜入场（当前股价小于150日均线，应多观察5w） | AQ176: 44573
A177: 603871.SH | B177: 嘉友国际 | C177: 46.89 | D177: 0.87 | E177: 物流 | F177: 1 | G177: 18.350000000000001 | H177: 18.84 | I177: 20.84 | K177: 22.140000000000001 | L177: 13.640000000000001 | M177: 24.079999999999998 | N177: 17.300000000000001 | O177: =(K177-L177)/L177 -> 0.62316715542521994 | P177: =(M177-K177)/M177 -> 8.0564784053156063e-02 | Q177: =(M177-N177)/N177 -> 0.39190751445086691 | R177: 20.780000000000001 | S177: 23 | T177: 21.760000000000002 | AC177: 2w | AD177: =(M177-R177)/M177 -> 0.13704318936877066 | AE177: =(S177-T177)/S177 -> 5.39130434782608e-02 | AK177: 是 | AL177: 是 | AM177: 是 | AN177: 是 | AO177: 否 | AP177: 可以入场 | AQ177: 44573
A178: 600586.SH | B178: 金晶科技 | C178: 46.85 | D178: 0.87 | AP178: 不宜入场（当前股价小于50日均线）
A179: 603916.SH | B179: 苏博特 | C179: 37.5 | D179: 0.87 | AP179: 不宜入场（150日均线小于200日均线）
A180: 001215.SZ | B180: 千味央厨 | C180: 220.95 | D180: 0.86 | AP180: 不宜入场（当前股价小于50日均线）
A181: 600329.SH | B181: 中新药业 | C181: 66 | D181: 0.86 | E181: 中药 | F181: 2 | G181: 25.649999999999999 | H181: 26.309999999999999 | I181: 27.989999999999998 | K181: 31.84 | L181: 16.699999999999999 | M181: 34.149999999999999 | N181: 23.149999999999999 | O181: =(K181-L181)/L181 -> 0.90658682634730547 | P181: =(M181-K181)/M181 -> 6.7642752562225447e-02 | Q181: =(M181-N181)/N181 -> 0.47516198704103674 | R181: 22.760000000000002 | S181: 26.120000000000001 | T181: 24.120000000000001 | U181: 30.93 | V181: 27.600000000000001 | W181: 33.75 | X181: 29.890000000000001 | Y181: 34 | Z181: 30.48 | AC181: 18w | AD181: =(M181-R181)/M181 -> 0.33352855051244501 | AE181: =(S181-T181)/S181 -> 7.6569678407350683e-02 | AF181: =(U181-V181)/U181 -> 0.10766246362754602 | AG181: =(W181-X181)/W181 -> 0.11437037037037036 | AH181: =(Y181-Z181)/Y181 -> 0.10352941176470587 | AP181: 不宜入场（收缩幅度不够，应多观察3w） | AQ181: 44573
A182: 603192.SH | B182: 汇得科技 | C182: 147.86 | D182: 0.85 | E182: 化学制品 | F182: 1 | G182: 30.940000000000001 | H182: 33 | I182: 43.049999999999997 | K182: 59.460000000000001 | L182: 20.969999999999999 | M182: 60.719999999999999 | N182: 26.559999999999999 | O182: =(K182-L182)/L182 -> 1.8354792560801148 | P182: =(M182-K182)/M182 -> 2.0750988142292457e-02 | Q182: =(M182-N182)/N182 -> 1.286144578313253 | R182: 56.780000000000001 | AC182: 1w | AD182: =(M182-R182)/M182 -> 6.4888010540184421e-02 | AP182: 见速度形态表 | AQ182: 44573
A183: 000935.SZ | B183: 四川双马 | C183: 89.63 | D183: 0.85 | E183: 建筑材料 | F183: 2 | G183: 19.579999999999998 | H183: 20.559999999999999 | I183: 23.309999999999999 | K183: 25.449999999999999 | L183: 12.06 | M183: 29.800000000000001 | N183: 14.85 | O183: =(K183-L183)/L183 -> 1.1102819237147594 | P183: =(M183-K183)/M183 -> 0.14597315436241615 | Q183: =(M183-N183)/N183 -> 1.0067340067340069 | R183: 17.350000000000001 | S183: 23.489999999999998 | T183: 19.309999999999999 | U183: 25.66 | V183: 22.5 | W183: 26.59 | X183: 24.5 | AC183: 11w | AD183: =(M183-R183)/M183 -> 0.41778523489932884 | AE183: =(S183-T183)/S183 -> 0.17794806300553426 | AF183: =(U183-V183)/U183 -> 0.12314886983632113 | AG183: =(W183-X183)/W183 -> 7.8600977811207215e-02 | AK183: 是 | AL183: 是 | AM183: 是 | AN183: 是 | AP183: 可以入场 | AQ183: 44573
A184: 002832.SZ | B184: 比音勒芬 | C184: 54.82 | D184: 0.85 | AP184: 不宜入场（当前股价小于50日均线）
A185: 600808.SH | B185: 马钢股份 | C185: 45.88 | D185: 0.85 | AP185: 不宜入场（50日均线小于150日均线）
A186: 600993.SH | B186: 马应龙 | C186: 44.27 | D186: 0.85 | E186: 中药 | G186: 24.66 | H186: 25.32 | I186: 26.390000000000001 | K186: 28.149999999999999 | L186: 17.100000000000001 | M186: 33.340000000000003 | N186: 26.34 | O186: =(K186-L186)/L186 -> 0.64619883040935655 | P186: =(M186-K186)/M186 -> 0.15566886622675477 | Q186: =(M186-N186)/N186 -> 0.26575550493545952 | R186: 23.390000000000001 | S186: 29.73 | T186: 26.609999999999999 | U186: 30.879999999999999 | V186: 26.649999999999999 | AC186: 12w | AD186: =(M186-R186)/M186 -> 0.29844031193761256 | AE186: =(S186-T186)/S186 -> 0.10494450050454091 | AF186: =(U186-V186)/U186 -> 0.13698186528497411 | AP186: 不宜入场（收缩幅度不够，应持续观察2w） | AQ186: 44573
A187: 002594.SZ | B187: 比亚迪 | C187: 42.799999999999997 | D187: 0.85 | AP187: 不宜入场（当前股价小于50日均线）
A188: 002585.SZ | B188: 双星新材 | C188: 172.62 | D188: 0.84 | E188: 化工合成材料 | G188: 22.280000000000001 | H188: 23.699999999999999 | I188: 26.420000000000002 | K188: 24.420000000000002 | AP188: 不宜入场（当前股价小于50日均线，应持续观察2w） | AQ188: 44573
A189: 002169.SZ | B189: 智光电气 | C189: 62.59 | D189: 0.84 | AP189: 不宜入场（当前股价小于50日均线）
A190: 002459.SZ | B190: 晶澳科技 | C190: 109.31 | D190: 0.83 | E190: 电力设备 | G190: 65.709999999999994 | H190: 71.769999999999996 | I190: 86.930000000000007 | K190: 83.299999999999997 | L190: 24.309999999999999 | M190: 103 | N190: 56.799999999999997 | O190: =(K190-L190)/L190 -> 2.4265734265734267 | P190: =(M190-K190)/M190 -> 0.19126213592233013 | Q190: =(M190-N190)/N190 -> 0.81338028169014098 | AP190: 不宜入场（当前股价小于50日均线,应多观察2w） | AQ190: 44573
A191: 603355.SH | B191: 莱克电气 | C191: 49.97 | D191: 0.83 | E191: 小家电 | G191: 28.300000000000001 | H191: 28.75 | I191: 29.48 | K191: 30.309999999999999 | L191: 17.609999999999999 | M191: 44.289999999999999 | N191: 31.34 | O191: =(K191-L191)/L191 -> 0.72118114707552528 | P191: =(M191-K191)/M191 -> 0.31564687288326937 | Q191: =(M191-N191)/N191 -> 0.41320995532865346 | AP191: 不宜入场（当前股价相对于最高点差距太大，面临巨大抛压,应多观察5w） | AQ191: 44573
A192: 000498.SZ | B192: 山东路桥 | C192: 38.49 | D192: 0.83 | AP192: 不宜入场（当前股价小于50日均线）
A193: 002810.SZ | B193: 山东赫达 | C193: 189.26 | D193: 0.82 | E193: 化学制品 | F193: 2 | G193: 48.649999999999999 | H193: 50.530000000000001 | I193: 56.049999999999997 | K193: 54.68 | L193: 21.940000000000001 | M193: 62.469999999999999 | N193: 43.030000000000001 | O193: =(K193-L193)/L193 -> 1.4922515952597992 | P193: =(M193-K193)/M193 -> 0.1246998559308468 | Q193: =(M193-N193)/N193 -> 0.45177782942133388 | AP193: 不宜入场（当前股价小于50日均线,应多观察2w） | AQ193: 44573
A194: 001219.SZ | B194: 青岛食品 | C194: 43.27 | D194: 0.82 | E194: 食品加工制造 | G194: 27.890000000000001 | H194: 28.59 | I194: 31.41 | K194: 35.200000000000003 | L194: 20.640000000000001 | M194: 41.5 | N194: 31.600000000000001 | O194: =(K194-L194)/L194 -> 0.70542635658914743 | P194: =(M194-K194)/M194 -> 0.15180722891566259 | Q194: =(M194-N194)/N194 -> 0.31329113924050628 | R194: 33.640000000000001 | AC194: 0w | AD194: =(M194-R194)/M194 -> 0.18939759036144577 | AP194: 不宜入场（收缩幅度不够，应持续观察2w） | AQ194: 44573
A195: 002409.SZ | B195: 雅克科技 | C195: 37.799999999999997 | D195: 0.82 | AP195: 不宜入场（当前股价小于50日均线）
A196: 003038.SZ | B196: 鑫铂股份 | C196: 291.66 | D196: 0.81 | E196: 工业金属 | G196: 53 | H196: 56.609999999999999 | I196: 69.969999999999999 | K196: 69.290000000000006 | L196: 21.699999999999999 | M196: 94.510000000000005 | N196: 49.68 | O196: =(K196-L196)/L196 -> 2.193087557603687 | P196: =(M196-K196)/M196 -> 0.26685006877579087 | Q196: =(M196-N196)/N196 -> 0.90237520128824489 | AP196: 不宜入场（当前股价小于50日均线） | AQ196: 44573
A197: 002408.SZ | B197: 齐翔腾达 | C197: 73.71 | D197: 0.81 | AP197: 不宜入场（当前股价小于50日均线）
A198: 002859.SZ | B198: 洁美科技 | C198: 49.76 | D198: 0.81 | E198: 其他电子 | G198: 32.049999999999997 | H198: 32.409999999999997 | I198: 34.450000000000003 | K198: 35.450000000000003 | L198: 25.050000000000001 | M198: 38.780000000000001 | N198: 28.390000000000001 | O198: =(K198-L198)/L198 -> 0.4151696606786428 | P198: =(M198-K198)/M198 -> 8.586900464156777e-02 | Q198: =(M198-N198)/N198 -> 0.36597393448397325 | R198: 33.619999999999997 | AC198: 3w | AD198: =(M198-R198)/M198 -> 0.13305827746260968 | AP198: 不宜入场（收缩幅度不够，应持续观察2w） | AQ198: 44573
A199: 002088.SZ | B199: 鲁阳节能 | C199: 250.91 | D199: 0.80000000000000004 | E199: 建筑材料 | G199: 19.93 | H199: 21.02 | I199: 23.710000000000001 | K199: 23.920000000000002 | L199: 6.6200000000000001 | M199: 27.469999999999999 | N199: 19.579999999999998 | O199: =(K199-L199)/L199 -> 2.6132930513595167 | P199: =(M199-K199)/M199 -> 0.1292318893338186 | Q199: =(M199-N199)/N199 -> 0.4029622063329929 | R199: 21.469999999999999 | S199: 26.260000000000002 | T199: 23.829999999999998 | AC199: 10w | AD199: =(M199-R199)/M199 -> 0.21842009464870768 | AE199: =(S199-T199)/S199 -> 9.2536176694592659e-02 | AP199: 不宜入场（收缩幅度不够，应持续观察1w） | AQ199: 44573
A200: 603048.SH | B200: 浙江黎明 | C200: 46.35 | D200: 0.80000000000000004 | E200: 汽车零部件 | G200: 26.739999999999998 | H200: 27.170000000000002 | I200: 28.93 | K200: 28.140000000000001 | AP200: 不宜入场（当前股价小于50日均线，应该多观察2w） | AQ200: 44573
A201: 605020.SH | B201: 永和股份 | C201: 259.13 | D201: 0.79
A202: 603386.SH | B202: 广东骏亚 | C202: 48.04 | D202: 0.79
A203: 003025.SZ | B203: 思进智能 | C203: 40.29 | D203: 0.79
A204: 603035.SH | B204: 常熟汽饰 | C204: 38.54 | D204: 0.79
A205: 002487.SZ | B205: 大金重工 | C205: 277.68 | D205: 0.78 | F205: 1 | G205: 23.5 | H205: 26.75 | I205: 38.579999999999998 | K205: 41.840000000000003 | L205: 6.6500000000000004 | M205: 53.770000000000003 | N205: 21.850000000000001 | O205: =(K205-L205)/L205 -> 5.2917293233082709 | P205: =(M205-K205)/M205 -> 0.22187093174632694 | Q205: =(M205-N205)/N205 -> 1.4608695652173913 | R205: 35.719999999999999 | AD205: =(M205-R205)/M205 -> 0.33568904593639581
A206: 603324.SH | B206: 盛剑环境 | C206: 150.88 | D206: 0.78
A207: 603722.SH | B207: 阿科力 | C207: 92.84 | D207: 0.78
A208: 002539.SZ | B208: 云图控股 | C208: 69.59 | D208: 0.78
A209: 603277.SH | B209: 银都股份 | C209: 64.29 | D209: 0.78
A210: 601678.SH | B210: 滨化股份 | C210: 60.700000000000003 | D210: 0.78
A211: 603867.SH | B211: 新化股份 | C211: 60.02 | D211: 0.78
A212: 002873.SZ | B212: 新天药业 | C212: 77.92 | D212: 0.77
A213: 000983.SZ | B213: 山西焦煤 | C213: 51.59 | D213: 0.77
A214: 601666.SH | B214: 平煤股份 | C214: 51.41 | D214: 0.77
A215: 603727.SH | B215: 博迈科 | C215: 39.26 | D215: 0.77
A216: 003021.SZ | B216: 兆威机电 | C216: 84.84 | D216: 0.76
A217: 603115.SH | B217: 海星股份 | C217: 81.79 | D217: 0.76
A218: 600727.SH | B218: 鲁北化工 | C218: 56.18 | D218: 0.76
A219: 002760.SZ | B219: 凤形股份 | C219: 54.43 | D219: 0.76
A220: 002138.SZ | B220: 顺络电子 | C220: 60.64 | D220: 0.75
A221: 605286.SH | B221: 同力日升 | C221: 38.72 | D221: 0.75
A222: 601869.SH | B222: 长飞光纤 | C222: 34.99 | D222: 0.75
A223: 603305.SH | B223: 旭升股份 | C223: 62.299999999999997 | D223: 0.74
A224: 603915.SH | B224: 国茂股份 | C224: 37.43 | D224: 0.74
A225: 600039.SH | B225: 四川路桥 | C225: 173.43 | D225: 0.73
A226: 002346.SZ | B226: 柘中股份 | C226: 104.52 | D226: 0.73
A227: 600989.SH | B227: 宝丰能源 | C227: 57.89 | D227: 0.73
A228: 603396.SH | B228: 金辰股份 | C228: 162.95 | D228: 0.72
A229: 600171.SH | B229: 上海贝岭 | C229: 85.79 | D229: 0.72
A230: 002433.SZ | B230: 太安堂 | C230: 84.08 | D230: 0.72
A231: 600750.SH | B231: 江中药业 | C231: 42.38 | D231: 0.72
A232: 600740.SH | B232: 山西焦化 | C232: 35.57 | D232: 0.72
A233: 600378.SH | B233: 昊华科技 | C233: 108.06 | D233: 0.71
A234: 601015.SH | B234: 陕西黑猫 | C234: 51.24 | D234: 0.71
A235: 002722.SZ | B235: 金轮股份 | C235: 45.200000000000003 | D235: 0.71
A236: 600057.SH | B236: 厦门象屿 | C236: 43.42 | D236: 0.71
A237: 002240.SZ | B237: 盛新锂能 | C237: 109.44 | D237: 0.69999999999999996
A238: 605339.SH | B238: 南侨食品 | C238: 67.200000000000003 | D238: 0.69999999999999996
A239: 603165.SH | B239: 荣晟环保 | C239: 63.02 | D239: 0.69999999999999996 | G239: 15.130000000000001 | H239: 15.67 | I239: 17.859999999999999 | K239: 17.300000000000001 | AP239: 不宜入场（当前股价小于50日均线，应该多观察2w） | AQ239: 44573
A240: 601918.SH | B240: 新集能源 | C240: 52.79 | D240: 0.69999999999999996
A241: 600475.SH | B241: 华光环能 | C241: 41.299999999999997 | D241: 0.69999999999999996
A242: 603213.SH | B242: 镇洋发展 | C242: 269.96 | D242: 0.69 | G242: 13.16 | H242: 14.33 | I242: 19.91 | K242: 20.390000000000001 | L242: 7.1900000000000004 | M242: 31.48 | N242: 7.1900000000000004 | O242: =(K242-L242)/L242 -> 1.8358831710709316 | P242: =(M242-K242)/M242 -> 0.352287166454892 | Q242: =(M242-N242)/N242 -> 3.3783031988873433 | AP242: 不宜入场（当前股价距离估计最高点距离过大，面临巨大抛压，应该多观察5w） | AQ242: 44573
A243: 002824.SZ | B243: 和胜股份 | C243: 136.47 | D243: 0.69 | G243: 34.640000000000001 | H243: 36.719999999999999 | I243: 41.079999999999998 | K243: 42.68 | L243: 12.84 | M243: 50.990000000000002 | N243: 32.18 | O243: =(K243-L243)/L243 -> 2.32398753894081 | P243: =(M243-K243)/M243 -> 0.16297313198666408 | Q243: =(M243-N243)/N243 -> 0.58452454940957121 | R243: 37.57 | S243: 46.119999999999997 | T243: 40.530000000000001 | AC243: 8w | AD243: =(M243-R243)/M243 -> 0.2631888605608943 | AE243: =(S243-T243)/S243 -> 0.12120555073720721
A244: 603707.SH | B244: 健友股份 | C244: 50.85 | D244: 0.69 | G244: 35.060000000000002 | H244: 36 | I244: 39.020000000000003 | K244: 38.130000000000003 | AP244: 不宜入场（当前股价小于50日均线，应该多观察2w） | AQ244: 44574
A245: 601689.SH | B245: 拓普集团 | C245: 42.04 | D245: 0.69 | G245: 43.689999999999998 | H245: 45.799999999999997 | I245: 51.979999999999997 | K245: 51.270000000000003 | AP245: 不宜入场（当前股价小于50日均线，应该多观察2w） | AQ245: 44574
A246: 000792.SZ | B246: 盐湖股份 | C246: 254.41 | D246: 0.68 | G246: 23.670000000000002 | H246: 25.969999999999999 | I246: 30.969999999999999 | K246: 30 | AP246: 不宜入场（当前股价小于50日均线，应该多观察2w） | AQ246: 44574
A247: 600338.SH | B247: 西藏珠峰 | C247: 202.35 | D247: 0.68 | G247: 27.920000000000002 | H247: 30.129999999999999 | I247: 33.689999999999998 | K247: 31.41 | AP247: 不宜入场（当前股价小于50日均线，应该多观察2w） | AQ247: 44574
A248: 605376.SH | B248: 博迁新材 | C248: 94.12 | D248: 0.68 | G248: 73.459999999999994 | H248: 75.969999999999999 | I248: 79.689999999999998 | K248: 75.209999999999994 | AP248: 不宜入场（当前股价小于150日均线，应该多观察2w） | AQ248: 44574
A249: 002158.SZ | B249: 汉钟精机 | C249: 73.63 | D249: 0.68 | G249: 25.120000000000001 | H249: 25.370000000000001 | I249: 25.890000000000001 | K249: 23.23 | AP249: 不宜入场（当前股价小于50日均线，应该多观察2w） | AQ249: 44574
A250: 000062.SZ | B250: 深圳华强 | C250: 37.05 | D250: 0.68 | G250: 15.44 | H250: 15.77 | I250: 16.609999999999999 | K250: 17.329999999999998 | L250: 10.640000000000001 | M250: 20.460000000000001 | N250: 16.059999999999999 | O250: =(K250-L250)/L250 -> 0.62875939849624041 | P250: =(M250-K250)/M250 -> 0.15298142717497568 | Q250: =(M250-N250)/N250 -> 0.27397260273972618 | R250: 13.73 | S250: 17.649999999999999 | T250: 15.98 | U250: 17.800000000000001 | V250: 15.970000000000001 | W250: 17.780000000000001 | X250: 16.359999999999999 | AC250: 25w | AD250: =(M250-R250)/M250 -> 0.32893450635386118 | AE250: =(S250-T250)/S250 -> 9.4617563739376673e-02 | AF250: =(U250-V250)/U250 -> 0.10280898876404494 | AG250: =(W250-X250)/W250 -> 7.9865016872890979e-02 | AP250: 不宜入场（收缩幅度不够，应持续观察1w） | AQ250: 44573
A251: 003031.SZ | B251: 中瓷电子 | C251: 556.82 | D251: 0.67 | G251: 66.260000000000005 | H251: 70.159999999999997 | I251: 81.109999999999999 | K251: 77.010000000000005 | AP251: 不宜入场（当前股价小于50日均线，应该多观察2w） | AQ251: 44574
A252: 002645.SZ | B252: 华宏科技 | C252: 151.82 | D252: 0.67 | G252: 19.239999999999998 | H252: 20.260000000000002 | I252: 22.93 | K252: 24.050000000000001 | L252: 8.2200000000000006 | M252: 28.600000000000001 | N252: 19.219999999999999 | O252: =(K252-L252)/L252 -> 1.9257907542579074 | P252: =(M252-K252)/M252 -> 0.15909090909090912 | Q252: =(M252-N252)/N252 -> 0.4880332986472426 | R252: 21.949999999999999 | S252: 25.440000000000001 | T252: 22.18 | U252: 25.5 | V252: 23.870000000000001 | AC252: 6w | AD252: =(M252-R252)/M252 -> 0.23251748251748258 | AE252: =(S252-T252)/S252 -> 0.12814465408805037 | AF252: =(U252-V252)/U252 -> 6.3921568627450936e-02 | AP252: 可以入场 | AQ252: 44574
A253: 605016.SH | B253: 百龙创园 | C253: 89.28 | D253: 0.67 | G253: 29.260000000000002 | H253: 29.940000000000001 | I253: 31.34 | K253: 33.32 | L253: 17.539999999999999 | M253: 48.5 | N253: 17.539999999999999 | O253: =(K253-L253)/L253 -> 0.89965792474344364 | P253: =(M253-K253)/M253 -> 0.31298969072164951 | Q253: =(M253-N253)/N253 -> 1.7651083238312431 | AP253: 不宜入场（当前股价距离最高点距离高点太大，面临巨大抛压，应该多观察3w） | AQ253: 44574
A254: 600085.SH | B254: 同仁堂 | C254: 87.95 | D254: 0.67 | G254: 35.159999999999997 | H254: 36.359999999999999 | I254: 41.039999999999999 | K254: 47.899999999999999 | L254: 23.23 | M254: 55.450000000000003 | N254: 32.270000000000003 | O254: =(K254-L254)/L254 -> 1.0619888075764097 | P254: =(M254-K254)/M254 -> 0.1361587015329126 | Q254: =(M254-N254)/N254 -> 0.71831422373721721 | R254: 47.700000000000003 | AC254: 1w | AD254: =(M254-R254)/M254 -> 0.13976555455365194
A255: 600452.SH | B255: 涪陵电力 | C255: 85.96 | D255: 0.67 | G255: 17.079999999999998 | H255: 17.620000000000001 | I255: 19.52 | K255: 17.780000000000001 | AP255: 不宜入场（当前股价小于50日均线，应该多观察2w） | AQ255: 44574
A256: 000887.SZ | B256: 中鼎股份 | C256: 85.53 | D256: 0.67 | G256: 16.34 | H256: 17.329999999999998 | I256: 20.379999999999999 | K256: 22.420000000000002 | L256: 9.2599999999999998 | M256: 25.010000000000002 | N256: 14.640000000000001 | O256: =(K256-L256)/L256 -> 1.4211663066954645 | P256: =(M256-K256)/M256 -> 0.10355857656937224 | Q256: =(M256-N256)/N256 -> 0.70833333333333337 | R256: 19.510000000000002 | AC256: 5w | AD256: =(M256-R256)/M256 -> 0.21991203518592561
A257: 600927.SH | B257: 永安期货 | C257: 59.79 | D257: 0.67
A258: 002860.SZ | B258: 星帅尔 | C258: 59.54 | D258: 0.67
A259: 002026.SZ | B259: 山东威达 | C259: 59.01 | D259: 0.67
A260: 603657.SH | B260: 春光科技 | C260: 48.95 | D260: 0.67
A261: 002915.SZ | B261: 中欣氟材 | C261: 79.17 | D261: 0.66
A262: 002763.SZ | B262: 汇洁股份 | C262: 64.26 | D262: 0.65
A263: 000739.SZ | B263: 普洛药业 | C263: 55.93 | D263: 0.65
A264: 605577.SH | B264: 龙版传媒 | C264: 105.29 | D264: 0.64
A265: 603351.SH | B265: 威尔药业 | C265: 86.96 | D265: 0.64
A266: 600970.SH | B266: 中材国际 | C266: 66.57 | D266: 0.64
A267: 002318.SZ | B267: 久立特材 | C267: 64.47 | D267: 0.64
A268: 603216.SH | B268: 梦天家居 | C268: 38.31 | D268: 0.64
A269: 603693.SH | B269: 江苏新能 | C269: 139.34 | D269: 0.63
A270: 002386.SZ | B270: 天原股份 | C270: 119.89 | D270: 0.63
A271: 002897.SZ | B271: 意华股份 | C271: 99.93 | D271: 0.63
A272: 002180.SZ | B272: 纳思达 | C272: 82.45 | D272: 0.63
A273: 002068.SZ | B273: 黑猫股份 | C273: 74 | D273: 0.63
A274: 605166.SH | B274: 聚合顺 | C274: 68.31 | D274: 0.63
A275: 002879.SZ | B275: 长缆科技 | C275: 62.64 | D275: 0.63
A276: 003022.SZ | B276: 联泓新科 | C276: 183.5 | D276: 0.62
A277: 002922.SZ | B277: 伊戈尔 | C277: 152.62 | D277: 0.62
A278: 600765.SH | B278: 中航重机 | C278: 125.38 | D278: 0.62
A279: 000731.SZ | B279: 四川美丰 | C279: 74.56 | D279: 0.62
A280: 002335.SZ | B280: 科华数据 | C280: 55.99 | D280: 0.62
A281: 603037.SH | B281: 凯众股份 | C281: 47.46 | D281: 0.62
A282: 603181.SH | B282: 皇马科技 | C282: 35.29 | D282: 0.62
A283: 605128.SH | B283: 上海沿浦 | C283: 70.92 | D283: 0.61
A284: 605086.SH | B284: 龙高股份 | C284: 51.13 | D284: 0.61
A285: 600704.SH | B285: 物产中大 | C285: 44.77 | D285: 0.61
A286: 600850.SH | B286: 电科数字 | C286: 38.91 | D286: 0.61
A287: 002221.SZ | B287: 东华能源 | C287: 32.96 | D287: 0.61
A288: 002015.SZ | B288: 协鑫能科 | C288: 169.17 | D288: 0.59999999999999998
A289: 600875.SH | B289: 东方电气 | C289: 109.06 | D289: 0.59999999999999998
A290: 603303.SH | B290: 得邦照明 | C290: 74.99 | D290: 0.59999999999999998
A291: 002136.SZ | B291: 安纳达 | C291: 71.52 | D291: 0.59999999999999998
A292: 601311.SH | B292: 骆驼股份 | C292: 67.200000000000003 | D292: 0.59999999999999998
A293: 600571.SH | B293: 信雅达 | C293: 59.97 | D293: 0.59999999999999998
A294: 002416.SZ | B294: 爱施德 | C294: 59.65 | D294: 0.59999999999999998
A295: 603179.SH | B295: 新泉股份 | C295: 39.26 | D295: 0.59999999999999998
A296: 600173.SH | B296: 卧龙地产 | C296: 34.69 | D296: 0.59999999999999998
A297: 603876.SH | B297: 鼎胜新材 | C297: 165.27 | D297: 0.59
A298: 600285.SH | B298: 羚锐制药 | C298: 94.97 | D298: 0.59
A299: 603979.SH | B299: 金诚信 | C299: 79.14 | D299: 0.59
A300: 600958.SH | B300: 东方证券 | C300: 36.41 | D300: 0.59
A301: 002293.SZ | B301: 罗莱生活 | C301: 32.600000000000001 | D301: 0.59
A302: 600483.SH | B302: 福能股份 | C302: 112.53 | D302: 0.58
A303: 002531.SZ | B303: 天顺风能 | C303: 107.13 | D303: 0.58
A304: 600876.SH | B304: 洛阳玻璃 | C304: 90.91 | D304: 0.58
A305: 605580.SH | B305: 恒盛能源 | C305: 63.12 | D305: 0.58
A306: 603896.SH | B306: 寿仙谷 | C306: 60.44 | D306: 0.58
A307: 605050.SH | B307: 福然德 | C307: 43.74 | D307: 0.58
A308: 000683.SZ | B308: 远兴能源 | C308: 221.36 | D308: 0.57
A309: 600406.SH | B309: 国电南瑞 | C309: 88.92 | D309: 0.57
A310: 000400.SZ | B310: 许继电气 | C310: 77.86 | D310: 0.57
A311: 603456.SH | B311: 九洲药业 | C311: 63.43 | D311: 0.57
A312: 002312.SZ | B312: 川发龙蟒 | C312: 116.90000000000001 | D312: 0.56
A313: 002191.SZ | B313: 劲嘉股份 | C313: 67.96 | D313: 0.56
A314: 603080.SH | B314: 新疆火炬 | C314: 34.299999999999997 | D314: 0.56
A315: 600460.SH | B315: 士兰微 | C315: 132.13 | D315: 0.55
A316: 603982.SH | B316: 泉峰汽车 | C316: 131.19 | D316: 0.55
A317: 601117.SH | B317: 中国化学 | C317: 120.52 | D317: 0.55
A318: 603219.SH | B318: 富佳股份 | C318: 76.02 | D318: 0.55
A319: 603588.SH | B319: 高能环境 | C319: 66.28 | D319: 0.55
A320: 603505.SH | B320: 金石资源 | C320: 61.71 | D320: 0.55
A321: 000635.SZ | B321: 英力特 | C321: 50.26 | D321: 0.55
A322: 002576.SZ | B322: 通达动力 | C322: 48.31 | D322: 0.55
A323: 605378.SH | B323: 野马电池 | C323: 40.07 | D323: 0.55
A324: 600180.SH | B324: 瑞茂通 | C324: 37.24 | D324: 0.55
A325: 002649.SZ | B325: 博彦科技 | C325: 35.51 | D325: 0.55
A326: 002443.SZ | B326: 金洲管道 | C326: 35.200000000000003 | D326: 0.55
A327: 603358.SH | B327: 华达科技 | C327: 60.84 | D327: 0.54
A328: 601339.SH | B328: 百隆东方 | C328: 42.04 | D328: 0.54
A329: 601633.SH | B329: 长城汽车 | C329: 40.51 | D329: 0.54
A330: 603518.SH | B330: 锦泓集团 | C330: 137.19999999999999 | D330: 0.52
A331: 002003.SZ | B331: 伟星股份 | C331: 110.3 | D331: 0.52
A332: 603128.SH | B332: 华贸物流 | C332: 47.54 | D332: 0.52
A333: 600590.SH | B333: 泰豪科技 | C333: 47.08 | D333: 0.52
A334: 603278.SH | B334: 大业股份 | C334: 46.61 | D334: 0.52
A335: 605011.SH | B335: 杭州热电 | C335: 197.92 | D335: 0.51
A336: 002270.SZ | B336: 华明装备 | C336: 89.29 | D336: 0.51
A337: 002728.SZ | B337: 特一药业 | C337: 59.12 | D337: 0.51
A338: 002135.SZ | B338: 东南网架 | C338: 54.02 | D338: 0.51
A339: 601882.SH | B339: 海天精工 | C339: 102.58 | D339: 0.5
A340: 603020.SH | B340: 爱普股份 | C340: 44.15 | D340: 0.5