A1: 股票代码 | B1: 股票简称 | C1: 趋势 | M1: 当前股价位置属于趋势的周期（即数基地，1到2的时候进入，3到5应该考虑卖出） | N1: 最近一年最高点是否新高 | O1: 价格波动收缩幅度 | AH1: 价格行为(得分应大于60%) | AK1: 成交量行为 | AM1: 结论 | AN1: 更新时间
O2: 技术足迹 | AH2: 支撑位和压力位是否同步升高(40%) | AI2: 是否有网球行为出现(40%) | AJ2: 上涨天数是否大于下跌天数(20%) | AK2: 不同收盘表现时交易量情况(好的收盘时，交易量是否增大，坏的收盘时，交易量是否萎缩) | AL2: 成交量收缩情况(最后的价格收缩期间的成交量应低于50天的平均水平且有一到两天交易量极低)
C3: 行情收盘价 [1]2022.03.23 | D3: 50日均线 [2]2022.03.23 | E3: 150日均线 [3]2022.03.23 | F3: 200日均线 [4]2022.03.23 | G3: 52周内最低点 | H3: 52周内最高点 | I3: 最高点前8周收盘价 | J3: 当前股价相对于最低点百分比(至少高出25%) | K3: 当前股价相对于最高点百分比(25%内最好) | L3: 最高点前8周股价相对于最高点百分比 | O3: 支撑位1 | P3: 阻力位2 | Q3: 支撑位2 | R3: 阻力位3 | S3: 支撑位3 | T3: 阻力位4 | U3: 支撑位4 | V3: 阻力位5 | W3: 支撑位5 | X3: 阻力位6 | Y3: 支撑位6 | Z3: 时间周期 | AA3: 收缩量1 | AB3: 收缩量2 | AC3: 收缩量3 | AD3: 收缩量4 | AE3: 收缩量5 | AF3: 收缩量6 | AG3: 收缩数量(至少大于3T)
A4: 605117.SH | B4: 德业股份 | C4: 260.16 | D4: 256.87 | E4: 249.31 | F4: 217.94 | G4: 38.490000000000002 | H4: 345.99000000000001 | I4: 197.47999999999999 | J4: =(C4-G4)/G4 -> 5.7591582229150431 | K4: =(H4-C4)/H4 -> 0.2480707534899852 | L4: =(H4-I4)/I4 -> 0.75202552157180491 | O4: 206 | P4: 298.60000000000002 | Q4: 243.28 | AA4: =(H4-O4)/H4 -> 0.40460706956848463 | AB4: =(P4-Q4)/P4 -> 0.18526456798392504 | AN4: 44644
A5: 605111.SH | B5: 新洁能 | C5: 184.99 | D5: 166.09999999999999 | E5: 163.87 | F5: 161.39 | G5: 108.63 | H5: 243.09999999999999 | I5: 121.05 | J5: =(C5-G5)/G5 -> 0.70293657369050921 | K5: =(H5-C5)/H5 -> 0.23903743315508016 | L5: =(H5-I5)/I5 -> 1.0082610491532424 | O5: 135.77000000000001 | P5: 198.09999999999999 | Q5: 174.5 | AA5: =(H5-O5)/H5 -> 0.44150555327025909 | AB5: =(P5-Q5)/P5 -> 0.11913175164058554 | AN5: 44644
A6: 605123.SH | B6: 派克新材 | C6: 136.98 | D6: 124.99 | E6: 114.87 | F6: 105.45 | G6: 61.549999999999997 | H6: 159 | I6: 83.180000000000007 | J6: =(C6-G6)/G6 -> 1.2255077173030056 | K6: =(H6-C6)/H6 -> 0.13849056603773591 | L6: =(H6-I6)/I6 -> 0.91151719163260381 | O6: 107.40000000000001 | P6: 137.27000000000001 | Q6: 114.5 | R6: 145.91999999999999 | S6: 123.38 | AA6: =(H6-O6)/H6 -> 0.32452830188679244 | AB6: =(P6-Q6)/P6 -> 0.16587746776426027 | AC6: =(R6-S6)/R6 -> 0.15446820175438591 | AN6: 44644
A7: 003031.SZ | B7: 中瓷电子 | C7: 98.26 | D7: 94.99 | E7: 78.89 | F7: 72.17 | G7: 38.340000000000003 | H7: 117.86 | I7: 84.730000000000004 | J7: =(C7-G7)/G7 -> 1.5628586332811685 | K7: =(H7-C7)/H7 -> 0.16629899881214996 | L7: =(H7-I7)/I7 -> 0.39100672725126867 | O7: 90 | P7: 107.53 | Q7: 95.200000000000003 | AA7: =(H7-O7)/H7 -> 0.23638214831155607 | AB7: =(P7-Q7)/P7 -> 0.11466567469543382 | AN7: 44644
A8: 002738.SZ | B8: 中矿资源 | C8: 96.400000000000006 | D8: 79.21 | E8: 67.36 | F8: 63.17 | G8: 21.09 | H8: 111.5 | I8: 65.280000000000001 | J8: =(C8-G8)/G8 -> 3.5708866761498341 | K8: =(H8-C8)/H8 -> 0.13542600896860982 | L8: =(H8-I8)/I8 -> 0.70802696078431371 | O8: 87.900000000000006 | P8: 103.59999999999999 | Q8: 91 | AA8: =(H8-O8)/H8 -> 0.21165919282511206 | AB8: =(P8-Q8)/P8 -> 0.12162162162162157 | AN8: 44644
A9: 002865.SZ | B9: 钧达股份 | C9: 91.06 | D9: 71.13 | E9: 52.86 | F9: 45.18 | G9: 17.649999999999999 | H9: 97
A10: 002932.SZ | B10: 明德生物 | C10: 88.700000000000003 | D10: 84.73 | E10: 74.67 | F10: 72.47 | G10: 41.789999999999999 | H10: 124.01000000000001 | I10: 67.879999999999995 | J10: =(C10-G10)/G10 -> 1.122517348648002 | K10: =(H10-C10)/H10 -> 0.28473510200790259 | L10: =(H10-I10)/I10 -> 0.82690041249263424 | O10: 71 | P10: 104.75 | Q10: 86.849999999999994 | AA10: =(H10-O10)/H10 -> 0.42746552697363116 | AB10: =(P10-Q10)/P10 -> 0.1708830548926015
A11: 603229.SH | B11: 奥翔药业 | C11: 69.59 | D11: 44.29 | E11: 35.43 | F11: 33.97 | G11: 23.98 | H11: 73.980000000000004 | I11: 35.909999999999997 | J11: =(C11-G11)/G11 -> 1.9020016680567138 | K11: =(H11-C11)/H11 -> 5.9340362260070292e-02 | L11: =(H11-I11)/I11 -> 1.0601503759398498
A12: 003038.SZ | B12: 鑫铂股份 | C12: 64.91 | D12: 64.25 | E12: 60.77 | F12: 53.94 | G12: 26.079999999999998 | H12: 94.510000000000005 | I12: 49.68 | J12: =(C12-G12)/G12 -> 1.4888803680981595 | K12: =(H12-C12)/H12 -> 0.31319437096603542 | L12: =(H12-I12)/I12 -> 0.90237520128824489 | O12: 53.100000000000001 | AA12: =(H12-O12)/H12 -> 0.43815469262511902
A13: 603606.SH | B13: 东方电缆 | C13: 57.43 | D13: 53.43 | E13: 44.24 | F13: 38.53 | G13: 18.510000000000002 | H13: 64.150000000000006 | I13: 51.380000000000003 | J13: =(C13-G13)/G13 -> 2.1026472177201514 | K13: =(H13-C13)/H13 -> 0.10475448168355425 | L13: =(H13-I13)/I13 -> 0.24854028804982489 | O13: 51.299999999999997 | P13: 57.789999999999999 | Q13: 53.5 | AA13: =(H13-O13)/H13 -> 0.20031176929072497 | AB13: =(P13-Q13)/P13 -> 7.4234296591105711e-02
A14: 603826.SH | B14: 坤彩科技 | C14: 54.29 | D14: 46.15 | E14: 41.12 | F14: 40.399999999999999 | G14: 32.479999999999997 | H14: 56.950000000000003 | I14: 37.359999999999999 | J14: =(C14-G14)/G14 -> 0.67149014778325133 | K14: =(H14-C14)/H14 -> 4.6707638279192339e-02 | L14: =(H14-I14)/I14 -> 0.52435760171306223 | O14: 47.450000000000003 | AA14: =(H14-O14)/H14 -> 0.1668129938542581
A15: 603665.SH | B15: 康隆达 | C15: 47.899999999999999 | D15: 41.02 | E15: 28.45 | F15: 24.92 | G15: 11 | H15: 51 | I15: 38.219999999999999 | J15: =(C15-G15)/G15 -> 3.3545454545454545 | K15: =(H15-C15)/H15 -> 6.0784313725490223e-02 | L15: =(H15-I15)/I15 -> 0.33437990580847726
A16: 603063.SH | B16: 禾望电气 | C16: 40.96 | D16: 38.97 | E16: 32.87 | F16: 28.74 | G16: 11.35 | H16: 46.880000000000003 | I16: 37.090000000000003 | J16: =(C16-G16)/G16 -> 2.6088105726872248 | K16: =(H16-C16)/H16 -> 0.12627986348122869 | L16: =(H16-I16)/I16 -> 0.26395254785656508 | O16: 38 | AA16: =(H16-O16)/H16 -> 0.18941979522184305
A17: 600188.SH | B17: 兖矿能源 | C17: 35.68 | D17: 28.88 | E17: 26.22 | F17: 23.41 | G17: 10.6 | H17: 37.399999999999999 | I17: 25.219999999999999 | J17: =(C17-G17)/G17 -> 2.3660377358490563 | K17: =(H17-C17)/H17 -> 4.5989304812834197e-02 | L17: =(H17-I17)/I17 -> 0.48295003965107058
A18: 002761.SZ | B18: 浙江建投 | C18: 34.91 | D18: 15.75 | E18: 10.22 | F18: 9.62
A19: 002805.SZ | B19: 丰元股份 | C19: 33.93 | D19: 32.72 | E19: 32.33 | F19: 30.03 | G19: 16 | H19: 51.090000000000003 | I19: 23.699999999999999 | J19: =(C19-G19)/G19 -> 1.120625 | K19: =(H19-C19)/H19 -> 0.33587786259541991 | L19: =(H19-I19)/I19 -> 1.1556962025316457 | O19: 27.5 | AA19: =(H19-O19)/H19 -> 0.46173419455862208
A20: 000893.SZ | B20: 亚钾国际 | C20: 30.32 | D20: 25.75 | E20: 21.86 | F20: 20.95
A21: 600055.SH | B21: 万东医疗 | C21: 29.699999999999999 | D21: 27.44 | E21: 23.24 | F21: 22.16 | G21: 12.279999999999999 | H21: 36.729999999999997 | I21: 24.09 | J21: =(C21-G21)/G21 -> 1.4185667752442999 | K21: =(H21-C21)/H21 -> 0.19139667846447042 | L21: =(H21-I21)/I21 -> 0.52469904524699029 | O21: 25.199999999999999 | AA21: =(H21-O21)/H21 -> 0.31391233324258094
A22: 600199.SH | B22: 金种子酒 | C22: 28.5 | D22: 20.25 | E22: 17.76 | F22: 17.35 | G22: 11.75 | H22: 32.869999999999997 | I22: 15.93 | J22: =(C22-G22)/G22 -> 1.425531914893617 | K22: =(H22-C22)/H22 -> 0.13294797687861265 | L22: =(H22-I22)/I22 -> 1.0634023854362835 | O22: 26.859999999999999
A23: 002779.SZ | B23: 中坚科技 | C23: 27.93 | D23: 22.57 | E23: 17.05 | F23: 15.49
A24: 002735.SZ | B24: 王子新材 | C24: 27.73 | D24: 24.800000000000001 | E24: 20.97 | F24: 20.16 | G24: 14.880000000000001 | H24: 30.989999999999998 | I24: 20.82 | J24: =(C24-G24)/G24 -> 0.86357526881720426 | K24: =(H24-C24)/H24 -> 0.10519522426589216 | L24: =(H24-I24)/I24 -> 0.48847262247838608 | O24: 23.82 | AA24: =(H24-O24)/H24 -> 0.23136495643756044
A25: 601088.SH | B25: 中国神华 | C25: 26.55 | D25: 24.84 | E25: 22.14 | F25: 21.09 | G25: 15.9 | H25: 27.890000000000001 | I25: 22.510000000000002 | J25: =(C25-G25)/G25 -> 0.66981132075471694 | K25: =(H25-C25)/H25 -> 4.8045894585873064e-02 | L25: =(H25-I25)/I25 -> 0.23900488671701459 | O25: 23.329999999999998 | AA25: =(H25-O25)/H25 -> 0.16349946217282188 | AN25: 44644
A26: 603800.SH | B26: 道森股份 | C26: 26.23 | D26: 23.66 | E26: 20.24 | F26: 17.699999999999999
A27: 603477.SH | B27: 巨星农牧 | C27: 25.16 | D27: 20.77 | E27: 15.72 | F27: 14.73
A28: 002393.SZ | B28: 力生制药 | C28: 25.06 | D28: 22.43 | E28: 20.54 | F28: 20.22
A29: 605116.SH | B29: 奥锐特 | C29: 24.600000000000001 | D29: 22.86 | E29: 17.65 | F29: 16.78
A30: 002349.SZ | B30: 精华制药 | C30: 23.800000000000001 | D30: 14.95 | E30: 9.09 | F30: 8.08
A31: 603399.SH | B31: 吉翔股份 | C31: 23.57 | D31: 15.800000000000001 | E31: 9.79 | F31: 8.71 | G31: 3.9500000000000002 | H31: 27.140000000000001 | I31: 8.6799999999999997 | J31: =(C31-G31)/G31 -> 4.9670886075949365 | K31: =(H31-C31)/H31 -> 0.13154016212232866 | L31: =(H31-I31)/I31 -> 2.1267281105990783 | O31: 17.969999999999999 | AA31: =(H31-O31)/H31 -> 0.33787767133382468
A32: 603363.SH | B32: 傲农生物 | C32: 22.74 | D32: 18.24 | E32: 12.89 | F32: 12.04
A33: 603090.SH | B33: 宏盛股份 | C33: 22.53 | D33: 21.54 | E33: 20.22 | F33: 18.65
A34: 600668.SH | B34: 尖峰集团 | C34: 21.15 | D34: 19.100000000000001 | E34: 14.81 | F34: 13.98
A35: 600367.SH | B35: 红星发展 | C35: 20.78 | D35: 20.12 | E35: 18.48 | F35: 16.43
A36: 002800.SZ | B36: 天顺股份 | C36: 19.15 | D36: 17.21 | E36: 14.93 | F36: 14.44
A37: 002317.SZ | B37: 众生药业 | C37: 18.600000000000001 | D37: 12.13 | E37: 10.49 | F37: 10.07
A38: 600522.SH | B38: 中天科技 | C38: 18.25 | D38: 16.82 | E38: 13.97 | F38: 12.86
A39: 603029.SH | B39: 天鹅股份 | C39: 17.79 | D39: 17.23 | E39: 14.83 | F39: 14.45
A40: 002945.SZ | B40: 华林证券 | C40: 16.45 | D40: 14.59 | E40: 12.99 | F40: 12.89
A41: 000815.SZ | B41: 美利云 | C41: 16.199999999999999 | D41: 10.46 | E41: 7.5999999999999996 | F41: 7
A42: 600783.SH | B42: 鲁信创投 | C42: 16.15 | D42: 14.52 | E42: 13.56 | F42: 13
A43: 002053.SZ | B43: 云南能投 | C43: 15.89 | D43: 11.02 | E43: 9.85 | F43: 9.37
A44: 603320.SH | B44: 迪贝电气 | C44: 15.89 | D44: 13.91 | E44: 13.34 | F44: 12.89 | G44: 9.6099999999999994 | H44: 16.670000000000002 | I44: 13.539999999999999 | J44: =(C44-G44)/G44 -> 0.65348595213319471 | K44: =(H44-C44)/H44 -> 4.6790641871625738e-02 | L44: =(H44-I44)/I44 -> 0.23116691285081262 | O44: 14.34 | P44: 16.530000000000001 | Q44: 14.91 | AA44: =(H44-O44)/H44 -> 0.13977204559088191 | AB44: =(P44-Q44)/P44 -> 9.8003629764065389e-02 | AN44: 44644
A45: 600647.SH | B45: 同达创业 | C45: 15.68 | D45: 14.21 | E45: 12.64 | F45: 12.38
A46: 002941.SZ | B46: 新疆交建 | C46: 15.58 | D46: 13.73 | E46: 12.32 | F46: 11.87
A47: 603112.SH | B47: 华翔股份 | C47: 15.35 | D47: 14.52 | E47: 13.07 | F47: 12.64
A48: 601001.SH | B48: 晋控煤业 | C48: 16.17 | D48: 12.54 | E48: 11.300000000000001 | F48: 10.39 | G48: 4.7699999999999996 | H48: 16.640000000000001 | I48: 11.34 | J48: =(C48-G48)/G48 -> 2.3899371069182398 | K48: =(H48-C48)/H48 -> 2.8245192307692239e-02 | L48: =(H48-I48)/I48 -> 0.46737213403880079
A49: 601225.SH | B49: 陕西煤业 | C49: 15.07 | D49: 13.79 | E49: 13.29 | F49: 12.72
A50: 002657.SZ | B50: 中科金财 | C50: 14.89 | D50: 13.82 | E50: 11.91 | F50: 11.67
A51: 002758.SZ | B51: 浙农股份 | C51: 14.66 | D51: 13.64 | E51: 11.28 | F51: 10.83
A52: 603269.SH | B52: 海鸥股份 | C52: 14.65 | D52: 13.800000000000001 | E52: 12.65 | F52: 12.16 | G52: 9.5399999999999991 | H52: 19.93 | I52: 13.300000000000001 | J52: =(C52-G52)/G52 -> 0.53563941299790374 | K52: =(H52-C52)/H52 -> 0.26492724535875561 | L52: =(H52-I52)/I52 -> 0.49849624060150366 | O52: 13.199999999999999 | AA52: =(H52-O52)/H52 -> 0.33768188660311094 | AN52: 44644
A53: 603617.SH | B53: 君禾股份 | C53: 14.63 | D53: 13.21 | E53: 11.92 | F53: 11.46
A54: 600992.SH | B54: 贵绳股份 | C54: 14.61 | D54: 12.65 | E54: 9.89 | F54: 9.47
A55: 000810.SZ | B55: 创维数字 | C55: 14.52 | D55: 12.73 | E55: 9.76 | F55: 9.47
A56: 002731.SZ | B56: 萃华珠宝 | C56: 14.5 | D56: 10.9 | E56: 8.74 | F56: 8.11
A57: 002849.SZ | B57: 威星智能 | C57: 14.17 | D57: 13.69 | E57: 12.85 | F57: 12.69
A58: 601666.SH | B58: 平煤股份 | C58: 14.13 | D58: 11.46 | E58: 9.95 | F58: 9.1999999999999993 | G58: 4.71 | H58: 15.16 | I58: 8.3900000000000006 | J58: =(C58-G58)/G58 -> 2.0000000000000004 | K58: =(H58-C58)/H58 -> 6.7941952506596265e-02 | L58: =(H58-I58)/I58 -> 0.80691299165673414 | O58: 11.18 | AA58: =(H58-O58)/H58 -> 0.26253298153034305 | AN58: 44644
A59: 603668.SH | B59: 天马科技 | C59: 14.04 | D59: 11.16 | E59: 9.28 | F59: 8.78
A60: 600749.SH | B60: 西藏旅游 | C60: 13.99 | D60: 12.12 | E60: 10.86 | F60: 10.73
A61: 600571.SH | B61: 信雅达 | C61: 13.76 | D61: 12.36 | E61: 10.27 | F61: 9.46
A62: 603331.SH | B62: 百达精工 | C62: 13.75 | D62: 12.62 | E62: 12.25 | F62: 11.699999999999999
A63: 002748.SZ | B63: 世龙实业 | C63: 13.64 | D63: 12.61 | E63: 11.54 | F63: 10.32 | G63: 5.21 | H63: 16.350000000000001 | I63: 10.710000000000001 | J63: =(C63-G63)/G63 -> 1.618042226487524 | K63: =(H63-C63)/H63 -> 0.16574923547400616 | L63: =(H63-I63)/I63 -> 0.5266106442577031 | O63: 10.279999999999999 | P63: 14.76 | Q63: 12.289999999999999 | AA63: =(H63-O63)/H63 -> 0.37125382262996953 | AB63: =(P63-Q63)/P63 -> 0.16734417344173447 | AN63: 44644
A64: 002910.SZ | B64: 庄园牧场 | C64: 13.5 | D64: 11.88 | E64: 11.15 | F64: 10.99
A65: 600546.SH | B65: 山煤国际 | C65: 13.42 | D65: 10.699999999999999 | E65: 10.06 | F65: 9.4000000000000004 | G65: 5.9000000000000004 | H65: 15.18 | I65: 7.3300000000000001 | J65: =(C65-G65)/G65 -> 1.2745762711864406 | K65: =(H65-C65)/H65 -> 0.11594202898550723 | L65: =(H65-I65)/I65 -> 1.0709413369713505 | O65: 7.6500000000000004 | P65: 13.789999999999999 | Q65: 10.470000000000001 | AA65: =(H65-O65)/H65 -> 0.49604743083003949 | AB65: =(P65-Q65)/P65 -> 0.24075416968817975 | AN65: 44644
A66: 002246.SZ | B66: 北化股份 | C66: 12.6 | D66: 9.95 | E66: 8.33 | F66: 8.04
A67: 002104.SZ | B67: 恒宝股份 | C67: 12.53 | D67: 10.83 | E67: 7.55 | F67: 7.09
A68: 600510.SH | B68: 黑牡丹 | C68: 12.52 | D68: 10.300000000000001 | E68: 8.8000000000000007 | F68: 8.31
A69: 600706.SH | B69: 曲江文旅 | C69: 12.51 | D69: 10.75 | E69: 8.0999999999999996 | F69: 7.76
A70: 002537.SZ | B70: 海联金汇 | C70: 12.39 | D70: 8.95 | E70: 7.01 | F70: 6.65 | G70: 5.04 | H70: 13.33 | I70: 8.6199999999999992 | J70: =(C70-G70)/G70 -> 1.4583333333333335 | K70: =(H70-C70)/H70 -> 7.0517629407351803e-02 | L70: =(H70-I70)/I70 -> 0.54640371229698392
A71: 600865.SH | B71: 百大集团 | C71: 12.37 | D71: 9.85 | E71: 8.87 | F71: 8.71
A72: 002037.SZ | B72: 保利联合 | C72: 12.33 | D72: 12.18 | E72: 8.67 | F72: 8.02
A73: 000524.SZ | B73: 岭南控股 | C73: 12.25 | D73: 9.24 | E73: 7.7000000000000002 | F73: 7.59
A74: 002830.SZ | B74: 名雕股份 | C74: 12.21 | D74: 11.61 | E74: 10.52 | F74: 10.29
A75: 002197.SZ | B75: 证通电子 | C75: 12.1 | D75: 11.91 | E75: 8.9000000000000004 | F75: 8.53
A76: 000856.SZ | B76: 冀东装备 | C76: 11.65 | D76: 10.07 | E76: 8.1999999999999993 | F76: 7.84
A77: 002545.SZ | B77: 东方铁塔 | C77: 11.32 | D77: 10.28 | E77: 9.29 | F77: 8.92
A78: 600520.SH | B78: 文一科技 | C78: 11.24 | D78: 9.74 | E78: 8.84 | F78: 8.66
A79: 002774.SZ | B79: 快意电梯 | C79: 10.75 | D79: 9.15 | E79: 8.82 | F79: 8.26
A80: 000925.SZ | B80: 众合科技 | C80: 10.699999999999999 | D80: 9.5999999999999996 | E80: 8.99 | F80: 8.75
A81: 002836.SZ | B81: 新宏泽 | C81: 10.49 | D81: 9.82 | E81: 8.99 | F81: 8.86
A82: 600560.SH | B82: 金自天正 | C82: 10.15 | D82: 9.77 | E82: 9.44 | F82: 9.34
A83: 000838.SZ | B83: 财信发展 | C83: 10.12 | D83: 7.83 | E83: 5.2000000000000002 | F83: 4.61
A84: 002584.SZ | B84: 西陇科学 | C84: 10.09 | D84: 10.07 | E84: 8.09 | F84: 7.59
A85: 002567.SZ | B85: 唐人神 | C85: 10.01 | D85: 8.74 | E85: 7.19 | F85: 6.99
A86: 600388.SH | B86: 龙净环保 | C86: 9.82 | D86: 9 | E86: 8.74 | F86: 8.68
A87: 000065.SZ | B87: 北方国际 | C87: 9.76 | D87: 8.93 | E87: 8.34 | F87: 8.1999999999999993
A88: 002116.SZ | B88: 中国海诚 | C88: 9.67 | D88: 8.77 | E88: 7.29 | F88: 7
A89: 603616.SH | B89: 韩建河山 | C89: 9.62 | D89: 8.83 | E89: 6.7999999999999998 | F89: 6.48
A90: 002112.SZ | B90: 三变科技 | C90: 9.59 | D90: 8.31 | E90: 7.9000000000000004 | F90: 7.72
A91: 600975.SH | B91: 新五丰 | C91: 9.43 | D91: 7.74 | E91: 6.95 | F91: 6.79
A92: 002205.SZ | B92: 国统股份 | C92: 9.38 | D92: 8.72 | E92: 7.84 | F92: 7.68
A93: 600551.SH | B93: 时代出版 | C93: 9.38 | D93: 8.41 | E93: 7.75 | F93: 7.63
A94: 600113.SH | B94: 浙江东日 | C94: 9.33 | D94: 7.92 | E94: 6.67 | F94: 6.51
A95: 601789.SH | B95: 宁波建工 | C95: 9.23 | D95: 5.85 | E95: 4.41 | F95: 4.22
A96: 600099.SH | B96: 林海股份 | C96: 9.21 | D96: 8.76 | E96: 7.92 | F96: 7.58
A97: 000875.SZ | B97: 吉电股份 | C97: 9.19 | D97: 8.4000000000000004 | E97: 7.55 | F97: 6.98
A98: 002207.SZ | B98: 准油股份 | C98: 8.96 | D98: 7.44 | E98: 6.43 | F98: 6.31
A99: 000862.SZ | B99: 银星能源 | C99: 8.92 | D99: 8.42 | E99: 7.87 | F99: 7.34
A100: 600602.SH | B100: 云赛智联 | C100: 8.9000000000000004 | D100: 7.39 | E100: 6.44 | F100: 6.24
A101: 600873.SH | B101: 梅花生物 | C101: 8.6999999999999993 | D101: 7.91 | E101: 7.17 | F101: 6.7999999999999998
A102: 600769.SH | B102: 祥龙电业 | C102: 8.11 | D102: 7.35 | E102: 6.2999999999999998 | F102: 6.13
A103: 002051.SZ | B103: 中工国际 | C103: 8.0999999999999996 | D103: 7.71 | E103: 7.18 | F103: 6.98
A104: 600256.SH | B104: 广汇能源 | C104: 8.0999999999999996 | D104: 6.83 | E104: 6.72 | F104: 5.93
A105: 600996.SH | B105: 贵广网络 | C105: 8.03 | D105: 7.73 | E105: 5.71 | F105: 5.48
A106: 601985.SH | B106: 中国核电 | C106: 7.87 | D106: 7.49 | E106: 6.95 | F106: 6.44
A107: 600689.SH | B107: 上海三毛 | C107: 7.79 | D107: 7.55 | E107: 7.04 | F107: 6.95
A108: 002548.SZ | B108: 金新农 | C108: 7.71 | D108: 6.91 | E108: 6.04 | F108: 5.93
A109: 000510.SZ | B109: 新金路 | C109: 7.54 | D109: 6.4000000000000004 | E109: 6.27 | F109: 5.99
A110: 603316.SH | B110: 诚邦股份 | C110: 7.47 | D110: 6.96 | E110: 5.77 | F110: 5.68
A111: 600358.SH | B111: 国旅联合 | C111: 7.45 | D111: 5.95 | E111: 4.68 | F111: 4.39
A112: 000953.SZ | B112: 河化股份 | C112: 7.39 | D112: 6.65 | E112: 5.4000000000000004 | F112: 5.29
A113: 600797.SH | B113: 浙大网新 | C113: 7.14 | D113: 7.06 | E113: 6.66 | F113: 6.65
A114: 002336.SZ | B114: 人人乐 | C114: 7.09 | D114: 6.34 | E114: 5.14 | F114: 4.99
A115: 600804.SH | B115: 鹏博士 | C115: 7.05 | D115: 6.32 | E115: 6.19 | F115: 5.87
A116: 600576.SH | B116: 祥源文化 | C116: 7.04 | D116: 5.84 | E116: 5.2999999999999998 | F116: 5.23
A117: 600830.SH | B117: 香溢融通 | C117: 6.93 | D117: 5.78 | E117: 5.27 | F117: 5.19
A118: 600982.SH | B118: 宁波能源 | C118: 6.92 | D118: 5.07 | E118: 4.44 | F118: 4.18
A119: 002244.SZ | B119: 滨江集团 | C119: 6.9000000000000004 | D119: 6.16 | E119: 4.93 | F119: 4.75
A120: 000937.SZ | B120: 冀中能源 | C120: 6.84 | D120: 6.26 | E120: 6.19 | F120: 5.54
A121: 002178.SZ | B121: 延华智能 | C121: 6.81 | D121: 5.65 | E121: 4.48 | F121: 4.27
A122: 002231.SZ | B122: 奥维通信 | C122: 6.77 | D122: 6.31 | E122: 5.85 | F122: 5.76
A123: 600277.SH | B123: 亿利洁能 | C123: 6.74 | D123: 5.82 | E123: 4.88 | F123: 4.31
A124: 600192.SH | B124: 长城电工 | C124: 6.73 | D124: 5.59 | E124: 5.15 | F124: 4.97
A125: 603335.SH | B125: 迪生力 | C125: 6.64 | D125: 6.2999999999999998 | E125: 5.63 | F125: 5.33
A126: 000597.SZ | B126: 东北制药 | C126: 6.61 | D126: 6.23 | E126: 5.62 | F126: 5.47
A127: 002215.SZ | B127: 诺普信 | C127: 6.48 | D127: 6.21 | E127: 6.03 | F127: 5.88
A128: 000619.SZ | B128: 海螺型材 | C128: 6.29 | D128: 5.72 | E128: 5.2999999999999998 | F128: 5.26
A129: 000605.SZ | B129: 渤海股份 | C129: 6.28 | D129: 5.9000000000000004 | E129: 5.49 | F129: 5.43
A130: 002148.SZ | B130: 北纬科技 | C130: 6.25 | D130: 5.74 | E130: 5.21 | F130: 5.02
A131: 002787.SZ | B131: 华源控股 | C131: 6.22 | D131: 6.12 | E131: 5.84 | F131: 5.77
A132: 002363.SZ | B132: 隆基机械 | C132: 6.0999999999999996 | D132: 5.66 | E132: 5.5 | F132: 5.34
A133: 600249.SH | B133: 两面针 | C133: 6.01 | D133: 5.28 | E133: 5.02 | F133: 4.96
A134: 600232.SH | B134: 金鹰股份 | C134: 5.94 | D134: 5.65 | E134: 5.36 | F134: 5.29
A135: 600561.SH | B135: 江西长运 | C135: 5.92 | D135: 5.64 | E135: 5.07 | F135: 4.84
A136: 002366.SZ | B136: 台海核电 | C136: 5.87 | D136: 5.01 | E136: 4.63 | F136: 4.37
A137: 002103.SZ | B137: 广博股份 | C137: 5.67 | D137: 5.17 | E137: 4.69 | F137: 4.61
A138: 600250.SH | B138: 南纺股份 | C138: 5.58 | D138: 5.52 | E138: 4.98 | F138: 4.93
A139: 600302.SH | B139: 标准股份 | C139: 5.42 | D139: 5.01 | E139: 4.64 | F139: 4.53
A140: 000958.SZ | B140: 东方能源 | C140: 5.36 | D140: 4.96 | E140: 4.84 | F140: 4.67
A141: 603843.SH | B141: 正平股份 | C141: 5.2999999999999998 | D141: 5.21 | E141: 4.56 | F141: 4.39
A142: 603969.SH | B142: 银龙股份 | C142: 5.17 | D142: 4.87 | E142: 4.46 | F142: 4.35
A143: 002693.SZ | B143: 双成药业 | C143: 5.04 | D143: 4.73 | E143: 4.42 | F143: 4.36
A144: 600778.SH | B144: 友好集团 | C144: 4.98 | D144: 4.62 | E144: 4.43 | F144: 4.36
A145: 000692.SZ | B145: 惠天热电 | C145: 4.75 | D145: 4.19 | E145: 3.86 | F145: 3.73
A146: 002546.SZ | B146: 新联电子 | C146: 4.5999999999999996 | D146: 4.39 | E146: 4.16 | F146: 4.05
A147: 000548.SZ | B147: 湖南投资 | C147: 4.5 | D147: 4.2000000000000002 | E147: 3.95 | F147: 3.93
A148: 600156.SH | B148: 华升股份 | C148: 4.48 | D148: 4.23 | E148: 4.03 | F148: 3.97
A149: 601008.SH | B149: 连云港 | C149: 4.16 | D149: 3.96 | E149: 3.79 | F149: 3.74
A150: 600190.SH | B150: 锦州港 | C150: 4.12 | D150: 3.46 | E150: 3 | F150: 2.95
A151: 600220.SH | B151: 江苏阳光 | C151: 4.08 | D151: 2.86 | E151: 2.53 | F151: 2.44
A152: 600396.SH | B152: 金山股份 | C152: 3.96 | D152: 3.25 | E152: 2.88 | F152: 2.75
A153: 600512.SH | B153: 腾达建设 | C153: 3.89 | D153: 3.64 | E153: 3.39 | F153: 3.32
A154: 600790.SH | B154: 轻纺城 | C154: 3.81 | D154: 3.54 | E154: 3.23 | F154: 3.19
A155: 000861.SZ | B155: 海印股份 | C155: 3.73 | D155: 3.07 | E155: 2.65 | F155: 2.5
A156: 600853.SH | B156: 龙建股份 | C156: 3.68 | D156: 3.29 | E156: 2.78 | F156: 2.7000000000000002
A157: 600082.SH | B157: 海泰发展 | C157: 3.57 | D157: 3.15 | E157: 2.95 | F157: 2.92
A158: 600397.SH | B158: 安源煤业 | C158: 3.51 | D158: 3.22 | E158: 3.16 | F158: 3.06
A159: 000595.SZ | B159: 宝塔实业 | C159: 3.3999999999999999 | D159: 3.21 | E159: 2.92 | F159: 2.8999999999999999
A160: 600575.SH | B160: 淮河能源 | C160: 3.24 | D160: 2.84 | E160: 2.49 | F160: 2.42