A1: 分析结果编码 | B1: 股票代码 | C1: 股票简称 | D1: 行业 | E1: 资产负债率 | F1: 每股收益(元)(越高越好) | G1: 利润增长 | AK1: 销售额增长 | BO1: 催化剂（是否是新公司，是否有新产品、新管理层、股价新高） | BS1: 股票的供给与需求 | CI1: 股本回报率(至少大于17%) | CL1: 更新时间
G2: 过去五年的历史记录(最近3个季度增速稳步提高，但不超过25%或没有盈利为净利润的增大阶段;最近连续3个季度净利润增速超过25%且已经开始盈利为净利润明显增大阶段；最近3个季度净利润环比增大为净利润增速加快阶段) | AA2: 3年的平均增速(最近季度增速打破平均增速，则为突破或复苏阶段，其中复苏阶段增速应该是之前最近低迷阶段增速的两到三倍) | AB2: 5年的平均增速(最近季度增速打破平均增速，则为突破或复苏阶段，其中复苏阶段增速应该是之前最近低迷阶段增速的两到三倍,市场领头羊五年平均超过35%) | AC2: 每两个季度的增长平均值(确认趋势) | AJ2: 波动性(越小越好) | AK2: 过去五年的历史记录（最近3个季度加速增长最好） | BE2: 3年的平均增速(最近季度增速打破平均增速，则为突破或复苏阶段，其中复苏阶段增速应该是之前最近低迷阶段增速的两到三倍) | BF2: 5年的平均增速(最近季度增速打破平均增速，则为突破或复苏阶段，其中复苏阶段增速应该是之前最近低迷阶段增速的两到三倍,市场领头羊五年平均超过35%) | BG2: 每两个季度的增长平均值(确认趋势) | BN2: 波动性(越小越好) | BS2: 总股本(以亿为单位，宜小为好) | BT2: 流通股数量 | BU2: 浮动供给量 | BV2: 过去三个月成交量的平均每日成交量及其近期的占比(突破日，其需求量应该大于40%以上，甚至100%) | CB2: 机构认同度 | CK2: 总结
G3: Q1 | H3: Q2 | I3: Q3 | J3: Q4 | K3: Q1 | L3: Q2 | M3: Q3 | N3: Q4 | O3: Q1 | P3: Q2 | Q3: Q3 | R3: Q4 | S3: Q1 | T3: Q2 | U3: Q3 | V3: Q4 | W3: Q1 | X3: Q2 | Y3: Q3 | Z3: Q4 | AC3: AVG7 | AD3: AVG6 | AE3: AVG5 | AF3: AVG4 | AG3: AVG3 | AH3: AVG2 | AI3: AVG1 | BA3: Q1 | BB3: Q2 | BC3: Q3 | BD3: Q4 | BO3: 上市日期(10年以内,即2011年以内) | BP3: 股价新高 | BQ3: 新产品 | BR3: 新管理层 | BV3: 最近三 | BW3: 最近二 | BX3: 最近一 | BY3: 平均单日成交量 | BZ3: 近期最低点成交量 | CA3: 占比 | CB3: 持有的机构投资者数量（大于20，小于1000） | CC3: 持有的机构投资者数量变化(最近3个季度是否持续增加，最近一个季度是否极大增长) | CD3: 持有机构的持有股份变化(最近三个季度) | CE3: 投资机构最近3年业绩评级(基金业绩榜单前10) | CF3: 投资经理最近12个月的业绩评级 | CG3: 投资经理最近3年业绩评级 | CH3: 投资经理最近12个月的业绩评级 | CI3: 净收益 | CJ3: 回报率
B4: 600519.SH | C4: 贵州茅台 | G4: 0.25190000000000001 | H4: 0.2782 | I4: 0.6038 | J4: 0.61980000000000002 | K4: 0.3901 | L4: 0.4007 | M4: 0.23760000000000001 | N4: 0.29960000000000003 | O4: 0.31909999999999999 | P4: 0.26530000000000004 | Q4: 0.2311 | R4: 0.17059999999999997 | S4: 0.16690000000000002 | T4: 0.13289999999999999 | U4: 0.111 | V4: 0.13320000000000001 | W4: 6.6199999999999995e-02 | X4: 9.1199999999999989e-02 | Y4: 0.1017 | AA4: =(N4+O4+P4+Q4+R4+S4+T4+U4+V4+W4+X4+Y4)/12 -> 0.1740666666666667 | AB4: =(G4+H4+I4+J4+K4+L4+M4+N4+O4+P4+Q4+R4+S4+T4+U4+V4+W4+X4+Y4)/19 -> 0.2563631578947369 | AC4: =(R4+S4)/2 -> 0.16875000000000001 | AD4: =(S4+T4)/2 -> 0.14990000000000001 | AE4: =(T4+U4)/2 -> 0.12195 | AF4: =(U4+V4)/2 -> 0.12210000000000001 | AG4: =(V4+W4)/2 -> 9.9700000000000011e-02 | AH4: =(W4+X4)/2 -> 7.8699999999999992e-02 | AI4: =(X4+Y4)/2 -> 9.6449999999999994e-02 | AJ4: =STDEV(G4:Y4) -> 0.15866683196954384
B5: 603444.SH | C5: 吉比特 | G5: 1.2329999999999999 | H5: -0.2404 | I5: -0.28320000000000001 | J5: -0.22239999999999999 | K5: -6.0899999999999996e-02 | L5: 0.12230000000000001 | M5: 0.14349999999999999 | N5: 0.18640000000000001 | O5: 0.38429999999999997 | P5: 0.3846 | Q5: 0.31730000000000003 | R5: 0.11460000000000001 | S5: 0.505 | T5: 0.18359999999999999 | U5: 0.1852 | V5: 0.29260000000000003 | W5: 0.12890000000000001 | X5: 0.63490000000000002 | Y5: 0.51490000000000002 | AA5: =(N5+O5+P5+Q5+R5+S5+T5+U5+V5+W5+X5+Y5)/12 -> 0.31935833333333336 | AB5: =(G5+H5+I5+J5+K5+L5+M5+N5+O5+P5+Q5+R5+S5+T5+U5+V5+W5+X5+Y5)/19 -> 0.2381157894736842 | AC5: =(R5+S5)/2 -> 0.30980000000000002 | AD5: =(S5+T5)/2 -> 0.34429999999999999 | AE5: =(T5+U5)/2 -> 0.18440000000000001 | AF5: =(U5+V5)/2 -> 0.2389 | AG5: =(V5+W5)/2 -> 0.21075000000000002 | AH5: =(W5+X5)/2 -> 0.38190000000000002 | AI5: =(X5+Y5)/2 -> 0.57489999999999997 | AJ5: =STDEV(G5:Y5) -> 0.35018757713729154 | AK5: 2.9874999999999998 | AL5: 1.0740000000000001 | AM5: 0.33520000000000005 | AN5: 0.27329999999999999 | AO5: -0.12920000000000001 | AP5: 5.3e-03 | AQ5: 4.1100000000000005e-02 | AR5: 5.4000000000000006e-02 | AS5: 0.57590000000000008 | AT5: 0.52390000000000003 | AU5: 0.49359999999999998 | AV5: 0.46159999999999995 | AW5: 0.22159999999999999 | AX5: 0.23499999999999999 | AY5: 0.21679999999999999 | AZ5: 0.22519999999999998 | BA5: 0.31359999999999999 | BB5: 0.58020000000000005 | BC5: 0.73939999999999995 | BE5: =(AR5+AS5+AT5+AU5+AV5+AW5+AX5+AY5+AZ5+BA5+BB5+BC5)/12 -> 0.38673333333333337 | BF5: =(AK5+AL5+AM5+AN5+AO5+AP5+AQ5+AR5+AS5+AT5+AU5+AV5+AV5+AW5+AX5+AY5+AZ5+BA5+BB5+BC5)/19 -> 0.50997894736842098 | BG5: =(AV5+AW5)/2 -> 0.34159999999999996 | BH5: =(AW5+AX5)/2 -> 0.2283 | BI5: =(AX5+AY5)/2 -> 0.22589999999999999 | BJ5: =(AY5+AZ5)/2 -> 0.22099999999999997 | BK5: =(AZ5+BA5)/2 -> 0.26939999999999997 | BL5: =(BA5+BB5)/2 -> 0.44690000000000002 | BM5: =(BB5+BC5)/2 -> 0.65979999999999994 | BN5: =STDEV(AK5:BC5) -> 0.66881744583103775
B6: 002932.SZ | C6: 明德生物 | E6: 0.16120000000000001 | F6: 9.5869999999999997 | L6: 0.14710000000000001 | M6: -4.2999999999999997e-02 | N6: -0.17559999999999998 | O6: -0.11109999999999999 | P6: -0.23079999999999998 | Q6: -0.24719999999999998 | R6: -0.42590000000000006 | S6: -0.875 | T6: 2.5832999999999999 | U6: 4.7014999999999993 | V6: 10.258099999999999 | W6: 164 | X6: 1.8697999999999999 | Y6: 1.7958000000000001 | AA6: =(N6+O6+P6+Q6+R6+S6+T6+U6+V6+W6+X6+Y6)/12 -> 15.261908333333333 | AB6: =(L6+M6+N6+O6+P6+Q6+R6+S6+T6+U6+V6+W6+X6+Y6)/14 -> 13.08907142857143 | AC6: =(R6+S6)/2 -> -0.65044999999999997 | AD6: =(S6+T6)/2 -> 0.85414999999999996 | AE6: =(T6+U6)/2 -> 3.6423999999999994 | AF6: =(U6+V6)/2 -> 7.4797999999999991 | AG6: =(V6+W6)/2 -> 87.129050000000007 | AH6: =(W6+X6)/2 -> 82.934899999999999 | AI6: =(X6+Y6)/2 -> 1.8328 | AJ6: =STDEV(G6:Y6) -> 43.535416345270477
B7: 000661.SZ | C7: 长春高新 | G7: -9.6799999999999997e-02 | H7: 0.1208 | I7: 0.1532 | J7: 0.26300000000000001 | K7: 0.47619999999999996 | L7: 0.92810000000000004 | M7: 0.7238 | N7: 0.52190000000000003 | O7: 0.7339 | P7: 0.3261 | Q7: 0.47869999999999996 | R7: 0.73480000000000001 | S7: 0.2465 | T7: -0.2412 | U7: -0.2346 | V7: -0.26679999999999998 | W7: -0.19399999999999998 | X7: 0.46600000000000003 | Y7: 0.39429999999999998 | AA7: =(N7+O7+P7+Q7+R7+S7+T7+U7+V7+W7+X7+Y7)/12 -> 0.24713333333333334 | AB7: =(G7+H7+I7+J7+K7+L7+M7+N7+O7+P7+Q7+R7+S7+T7+U7+V7+W7+X7+Y7)/19 -> 0.2912578947368421 | AC7: =(R7+S7)/2 -> 0.49065000000000003 | AD7: =(S7+T7)/2 -> 2.6499999999999996e-03 | AE7: =(T7+U7)/2 -> -0.2379 | AF7: =(U7+V7)/2 -> -0.25069999999999998 | AG7: =(V7+W7)/2 -> -0.23039999999999999 | AH7: =(W7+X7)/2 -> 0.13600000000000001 | AI7: =(X7+Y7)/2 -> 0.43015000000000003 | AJ7: =STDEV(G7:Y7) -> 0.3695846682663444 | AK7: 0.18079999999999999 | AL7: 0.24059999999999998 | AM7: 0.27479999999999999 | AN7: 0.37890000000000001 | AO7: 0.57499999999999996 | AP7: 0.6492 | AQ7: 0.65689999999999993 | AR7: 0.49079999999999996 | AS7: 0.48979999999999996 | AT7: 0.26960000000000001 | AU7: 0.14910000000000001 | AV7: 0.18969999999999998 | AW7: -1.3899999999999999e-02 | AX7: 9.9499999999999991e-02 | AY7: 0.17749999999999999 | AZ7: 0.17319999999999999 | BA7: 0.51359999999999995 | BB7: 0.41700000000000004 | BC7: 0.3271 | BE7: =(AR7+AS7+AT7+AU7+AV7+AW7+AX7+AY7+AZ7+BA7+BB7+BC7)/12 -> 0.27358333333333335 | BF7: =(AK7+AL7+AM7+AN7+AO7+AP7+AQ7+AR7+AS7+AT7+AU7+AV7+AV7+AW7+AX7+AY7+AZ7+BA7+BB7+BC7)/19 -> 0.33836315789473681 | BG7: =(AV7+AW7)/2 -> 8.7899999999999992e-02 | BH7: =(AW7+AX7)/2 -> 4.2799999999999998e-02 | BI7: =(AX7+AY7)/2 -> 0.13849999999999998 | BJ7: =(AY7+AZ7)/2 -> 0.17535000000000001 | BK7: =(AZ7+BA7)/2 -> 0.34339999999999998 | BL7: =(BA7+BB7)/2 -> 0.46529999999999999 | BM7: =(BB7+BC7)/2 -> 0.37204999999999999 | BN7: =STDEV(AK7:BC7) -> 0.19327508196852877
B8: 600309.SH | C8: 万华化学 | G8: 2.8094999999999999 | H8: 2.3774000000000002 | I8: 1.9896 | J8: 1.8803000000000001 | K8: 1.0625 | L8: 0.87150000000000005 | M8: 0.50519999999999998 | N8: 0.2127 | O8: -0.46060000000000001 | P8: -0.4657 | Q8: -0.41670000000000001 | R8: -0.3488 | S8: -0.50560000000000005 | T8: -0.49719999999999998 | U8: -0.32539999999999997 | V8: -9.300000000000001e-03 | W8: 3.7955000000000001 | X8: 3.7888999999999999 | Y8: 2.6587999999999998 | AA8: =(N8+O8+P8+Q8+R8+S8+T8+U8+V8+W8+X8+Y8)/12 -> 0.61888333333333323 | AB8: =(G8+H8+I8+J8+K8+L8+M8+N8+O8+P8+Q8+R8+S8+T8+U8+V8+W8+X8+Y8)/19 -> 0.99592631578947366 | AC8: =(R8+S8)/2 -> -0.42720000000000002 | AD8: =(S8+T8)/2 -> -0.50140000000000007 | AE8: =(T8+U8)/2 -> -0.4113 | AF8: =(U8+V8)/2 -> -0.16734999999999997 | AG8: =(V8+W8)/2 -> 1.8931 | AH8: =(W8+X8)/2 -> 3.7922000000000002 | AI8: =(X8+Y8)/2 -> 3.2238499999999997 | AJ8: =STDEV(G8:Y8) -> 1.519259134447557
B9: 603185.SH | C9: 上机数控 | M9: 0.36299999999999999 | N9: -0.24260000000000001 | O9: -0.62659999999999993 | P9: -0.56490000000000007 | Q9: -0.49390000000000001 | R9: -0.4677 | S9: 0.14230000000000001 | T9: 0.56969999999999998 | U9: 1.2516 | V9: 1.8638999999999999 | W9: 3.5348000000000002 | X9: 3.9188000000000001 | Y9: 2.5225 | AA9: =(N9+O9+P9+Q9+R9+S9+T9+U9+V9+W9+X9+Y9)/12 -> 0.95065833333333349 | AB9: =(M9+N9+O9+P9+Q9+R9+S9+T9+U9+V9+W9+X9+Y9)/13 -> 0.90545384615384628 | AC9: =(R9+S9)/2 -> -0.16270000000000001 | AD9: =(S9+T9)/2 -> 0.35599999999999998 | AE9: =(T9+U9)/2 -> 0.91064999999999996 | AF9: =(U9+V9)/2 -> 1.55775 | AG9: =(V9+W9)/2 -> 2.6993499999999999 | AH9: =(W9+X9)/2 -> 3.7267999999999999 | AI9: =(X9+Y9)/2 -> 3.22065 | AJ9: =STDEV(G9:Y9) -> 1.5892157665629636
B10: 603260.SH | C10: 合盛硅业 | I10: 1.2676000000000001 | J10: 1.2751999999999999 | K10: 1.0889 | L10: 0.67390000000000005 | M10: 0.48450000000000004 | N10: 0.20559999999999998 | O10: -0.54259999999999997 | P10: -0.54549999999999998 | Q10: -0.61509999999999998 | R10: -0.60870000000000002 | S10: -0.37209999999999999 | T10: -0.31430000000000002 | U10: -0.16300000000000001 | V10: 0.28210000000000002 | W10: 2.5556000000000001 | X10: 4.2707999999999995 | Y10: 5.6103999999999994 | AA10: =(N10+O10+P10+Q10+R10+S10+T10+U10+V10+W10+X10+Y10)/12 -> 0.81359999999999999 | AB10: =(I10+J10+K10+L10+M10+N10+O10+P10+Q10+R10+S10+T10+U10+V10+W10+X10+Y10)/17 -> 0.85607647058823511 | AC10: =(R10+S10)/2 -> -0.4904 | AD10: =(S10+T10)/2 -> -0.34320000000000001 | AE10: =(T10+U10)/2 -> -0.23865000000000003 | AF10: =(U10+V10)/2 -> 5.9550000000000006e-02 | AG10: =(V10+W10)/2 -> 1.4188499999999999 | AH10: =(W10+X10)/2 -> 3.4131999999999998 | AI10: =(X10+Y10)/2 -> 4.9405999999999999 | AJ10: =STDEV(G10:Y10) -> 1.7787410630588603 | AM10: 0.38329999999999997 | AN10: 0.5867 | AO10: 0.53569999999999995 | AP10: 0.56779999999999997 | AQ10: 0.67159999999999997 | AR10: 0.48259999999999997 | AS10: 6.3799999999999996e-02 | AT10: -0.17829999999999999 | AU10: -0.26590000000000003 | AV10: -0.23710000000000001 | AW10: -0.31940000000000002 | AX10: -6.0100000000000001e-02 | AY10: -7.0800000000000002e-02 | AZ10: -1.8600000000000002e-02 | BA10: 0.68480000000000008 | BB10: 1.0295999999999998 | BC10: 1.0615000000000001 | BE10: =(AR10+AS10+AT10+AU10+AV10+AW10+AX10+AY10+AZ10+BA10+BB10+BC10)/12 -> 0.18100833333333333 | BF10: =(AK10+AL10+AM10+AN10+AO10+AP10+AQ10+AR10+AS10+AT10+AU10+AV10+AV10+AW10+AX10+AY10+AZ10+BA10+BB10+BC10)/19 -> 0.24632105263157897 | BG10: =(AV10+AW10)/2 -> -0.27825 | BH10: =(AW10+AX10)/2 -> -0.18975 | BI10: =(AX10+AY10)/2 -> -6.5450000000000008e-02 | BJ10: =(AY10+AZ10)/2 -> -4.4700000000000004e-02 | BK10: =(AZ10+BA10)/2 -> 0.33310000000000006 | BL10: =(BA10+BB10)/2 -> 0.85719999999999996 | BM10: =(BB10+BC10)/2 -> 1.04555 | BN10: =STDEV(AM10:BC10) -> 0.45357935926038212
B11: 002304.SZ | C11: 洋河股份 | G11: 0.1166 | H11: 0.14099999999999999 | I11: 0.15259999999999999 | J11: 0.1363 | K11: 0.26700000000000002 | L11: 0.2823 | M11: 0.26239999999999997 | N11: 0.22450000000000001 | O11: 0.157 | P11: 0.1152 | Q11: 1.5300000000000001e-02 | R11: -9.0200000000000002e-02 | S11: -4.4000000000000003e-03 | T11: -3.04e-02 | U11: 8.5000000000000006e-03 | V11: 1.7399999999999999e-02 | W11: -2.8900000000000002e-02 | X11: 5.2900000000000003e-02 | Y11: 7.1999999999999998e-03 | AA11: =(N11+O11+P11+Q11+R11+S11+T11+U11+V11+W11+X11+Y11)/12 -> 3.7008333333333338e-02 | AB11: =(G11+H11+I11+J11+K11+L11+M11+N11+O11+P11+Q11+R11+S11+T11+U11+V11+W11+X11+Y11)/19 -> 9.4857894736842113e-02 | AC11: =(R11+S11)/2 -> -4.7300000000000002e-02 | AD11: =(S11+T11)/2 -> -1.7399999999999999e-02 | AE11: =(T11+U11)/2 -> -1.095e-02 | AF11: =(U11+V11)/2 -> 1.295e-02 | AG11: =(V11+W11)/2 -> -5.7500000000000016e-03 | AH11: =(W11+X11)/2 -> 1.2e-02 | AI11: =(X11+Y11)/2 -> 3.005e-02 | AJ11: =STDEV(G11:Y11) -> 0.11202903550116657 | AK11: -8.1500000000000003e-02 | AL11: -4.0999999999999995e-02 | AM11: 6.3899999999999998e-02 | AN11: 3.6799999999999999e-02 | AO11: 0.26030000000000003 | AP11: 0.30549999999999999 | AQ11: 0.24909999999999999 | AR11: 0.18530000000000002 | AS11: -3.0899999999999997e-02 | AT11: -6.5299999999999997e-02 | AU11: -0.1429 | AV11: 1.9e-03 | AW11: -0.27210000000000001 | AX11: -0.38880000000000003 | AY11: -0.28249999999999997 | AZ11: -0.23550000000000001 | BA11: 0.57450000000000001 | BB11: 0.84849999999999992 | BC11: 0.66430000000000011 | BE11: =(AR11+AS11+AT11+AU11+AV11+AW11+AX11+AY11+AZ11+BA11+BB11+BC11)/12 -> 7.1375000000000008e-02 | BF11: =(AK11+AL11+AM11+AN11+AO11+AP11+AQ11+AR11+AS11+AT11+AU11+AV11+AV11+AW11+AX11+AY11+AZ11+BA11+BB11+BC11)/19 -> 8.6921052631578941e-02 | BG11: =(AV11+AW11)/2 -> -0.1351 | BH11: =(AW11+AX11)/2 -> -0.33045000000000002 | BI11: =(AX11+AY11)/2 -> -0.33565 | BJ11: =(AY11+AZ11)/2 -> -0.25900000000000001 | BK11: =(AZ11+BA11)/2 -> 0.16949999999999998 | BL11: =(BA11+BB11)/2 -> 0.71150000000000002 | BM11: =(BB11+BC11)/2 -> 0.75639999999999996 | BN11: =STDEV(AK11:BC11) -> 0.33378504323549207
B12: 601318.SH | C12: 中国平安 | G12: 0.11210000000000001 | H12: 6.5799999999999997e-02 | I12: 0.17350000000000002 | J12: 0.42570000000000002 | K12: 0.11630000000000001 | L12: 0.34159999999999996 | M12: 0.19620000000000001 | N12: 0.2064 | O12: 0.77079999999999993 | P12: 0.68099999999999994 | Q12: 0.63819999999999999 | R12: 0.39700000000000002 | S12: -0.42349999999999999 | T12: -0.29199999999999998 | U12: -0.20030000000000001 | V12: -3.6900000000000002e-02 | W12: 4.7599999999999996e-02 | X12: -0.15210000000000001 | Y12: -0.20579999999999998 | AA12: =(N12+O12+P12+Q12+R12+S12+T12+U12+V12+W12+X12+Y12)/12 -> 0.11920000000000001 | AB12: =(G12+H12+I12+J12+K12+L12+M12+N12+O12+P12+Q12+R12+S12+T12+U12+V12+W12+X12+Y12)/19 -> 0.1506105263157895 | AC12: =(R12+S12)/2 -> -1.3249999999999984e-02 | AD12: =(S12+T12)/2 -> -0.35775000000000001 | AE12: =(T12+U12)/2 -> -0.24614999999999998 | AF12: =(U12+V12)/2 -> -0.11860000000000001 | AG12: =(V12+W12)/2 -> 5.3499999999999971e-03 | AH12: =(W12+X12)/2 -> -5.2250000000000005e-02 | AI12: =(X12+Y12)/2 -> -0.17895 | AJ12: =STDEV(G12:Y12) -> 0.33376613551463585
B13: 000858.SZ | C13: 五粮液 | G13: 0.2379 | H13: 0.27929999999999999 | I13: 0.36530000000000001 | J13: 0.42590000000000006 | K13: 0.38329999999999997 | L13: 0.41909999999999997 | M13: 0.34600000000000003 | N13: 0.36340000000000006 | O13: 0.27329999999999999 | P13: 0.29370000000000002 | Q13: 0.3085 | R13: 0.29039999999999999 | S13: 0.19 | T13: 0.16300000000000001 | U13: 0.1593 | V13: 0.14679999999999999 | W13: 0.21010000000000001 | X13: 0.21590000000000001 | Y13: 0.19140000000000001 | AA13: =(N13+O13+P13+Q13+R13+S13+T13+U13+V13+W13+X13+Y13)/12 -> 0.23381666666666664 | AB13: =(G13+H13+I13+J13+K13+L13+M13+N13+O13+P13+Q13+R13+S13+T13+U13+V13+W13+X13+Y13)/19 -> 0.27697894736842105 | AC13: =(R13+S13)/2 -> 0.2402 | AD13: =(S13+T13)/2 -> 0.17649999999999999 | AE13: =(T13+U13)/2 -> 0.16115000000000002 | AF13: =(U13+V13)/2 -> 0.15304999999999999 | AG13: =(V13+W13)/2 -> 0.17845 | AH13: =(W13+X13)/2 -> 0.21300000000000002 | AI13: =(X13+Y13)/2 -> 0.20365 | AJ13: =STDEV(G13:Y13) -> 8.9315654836262651e-02
B14: 601888.SH | C14: 中国中免 | G14: -0.48450000000000004 | H14: -0.41259999999999997 | I14: -0.34689999999999999 | J14: 0.39960000000000001 | K14: 0.61460000000000004 | L14: 0.47600000000000003 | M14: 0.4178 | N14: 0.2228 | O14: 0.98799999999999999 | P14: 0.71499999999999997 | Q14: 0.55810000000000004 | R14: 0.49670000000000003 | S14: -1.0095000000000001 | T14: -0.71730000000000005 | U14: -0.24929999999999999 | V14: 0.3256 | W14: 131.27680000000001 | X14: 4.7588999999999997 | Y14: 1.6835 | AA14: =(N14+O14+P14+Q14+R14+S14+T14+U14+V14+W14+X14+Y14)/12 -> 11.587441666666669 | AB14: =(G14+H14+I14+J14+K14+L14+M14+N14+O14+P14+Q14+R14+S14+T14+U14+V14+W14+X14+Y14)/19 -> 7.3533315789473699 | AC14: =(R14+S14)/2 -> -0.25640000000000002 | AD14: =(S14+T14)/2 -> -0.86340000000000006 | AE14: =(T14+U14)/2 -> -0.48330000000000001 | AF14: =(U14+V14)/2 -> 3.8150000000000003e-02 | AG14: =(V14+W14)/2 -> 65.801200000000009 | AH14: =(W14+X14)/2 -> 68.01785000000001 | AI14: =(X14+Y14)/2 -> 3.2211999999999996 | AJ14: =STDEV(G14:Y14) -> 30.034223196510947
B15: 600955.SH | C15: 维远股份 | W15: 1.9828000000000001 | X15: 5.3829999999999991 | Y15: 3.9424999999999999 | AA15: =(W15+X15+Y15)/3 -> 3.7694333333333332 | AB15: =(W15+X15+Y15)/3 -> 3.7694333333333332 | AC15: =(R15+S15)/2 -> 0 | AD15: =(S15+T15)/2 -> 0 | AE15: =(T15+U15)/2 -> 0 | AF15: =(U15+V15)/2 -> 0 | AG15: =(V15+W15)/2 -> 0.99140000000000006 | AH15: =(W15+X15)/2 -> 3.6828999999999996 | AI15: =(X15+Y15)/2 -> 4.6627499999999991 | AJ15: =STDEV(G15:Y15) -> 1.706693898545762 | BA15: 0.11380000000000001 | BB15: 1.5896999999999999 | BC15: 1.5528999999999999 | BD15: 1.1237000000000001 | BE15: =(AR15+AS15+AT15+AU15+AV15+AW15+AX15+AY15+AZ15+BA15+BB15+BC15)/12 -> 0.2713666666666667 | BF15: =(AK15+AL15+AM15+AN15+AO15+AP15+AQ15+AR15+AS15+AT15+AU15+AV15+AV15+AW15+AX15+AY15+AZ15+BA15+BB15+BC15)/19 -> 0.17138947368421054 | BG15: =(AV15+AW15)/2 -> 0 | BH15: =(AW15+AX15)/2 -> 0 | BI15: =(AX15+AY15)/2 -> 0 | BJ15: =(AY15+AZ15)/2 -> 0 | BK15: =(AZ15+BA15)/2 -> 5.6900000000000006e-02 | BL15: =(BA15+BB15)/2 -> 0.85175000000000001 | BM15: =(BB15+BC15)/2 -> 1.5712999999999999 | BN15: =STDEV(AK15:BC15) -> 0.84168916075552103
B16: 000568.SZ | C16: 泸州老窖 | G16: 0.34520000000000001 | H16: 0.32740000000000002 | I16: 0.31940000000000002 | J16: 0.28800000000000003 | K16: 0.2707 | L16: 0.28389999999999999 | M16: 0.32530000000000003 | N16: 0.32369999999999999 | O16: 0.42460000000000003 | P16: 0.39990000000000003 | Q16: 0.37909999999999999 | R16: 0.33189999999999997 | S16: 0.13589999999999999 | T16: 0.17019999999999999 | U16: 0.27029999999999998 | V16: 0.29339999999999999 | W16: 0.26500000000000001 | X16: 0.31359999999999999 | Y16: 0.3009 | AA16: =(N16+O16+P16+Q16+R16+S16+T16+U16+V16+W16+X16+Y16)/12 -> 0.30070833333333336 | AB16: =(G16+H16+I16+J16+K16+L16+M16+N16+O16+P16+Q16+R16+S16+T16+U16+V16+W16+X16+Y16)/19 -> 0.30360000000000009 | AC16: =(R16+S16)/2 -> 0.2339 | AD16: =(S16+T16)/2 -> 0.15304999999999999 | AE16: =(T16+U16)/2 -> 0.22025 | AF16: =(U16+V16)/2 -> 0.28184999999999999 | AG16: =(V16+W16)/2 -> 0.2792 | AH16: =(W16+X16)/2 -> 0.2893 | AI16: =(X16+Y16)/2 -> 0.30725000000000002 | AJ16: =STDEV(G16:Y16) -> 6.8426870940199128e-02 | AK16: -8.1699999999999995e-02 | AL16: 0.16879999999999998 | AM16: 0.33579999999999999 | AN16: 0.53479999999999994 | AO16: 0.54630000000000001 | AP16: 0.12619999999999998 | AQ16: 0.2303 | AR16: 0.1938 | AS16: 0.16200000000000001 | AT16: 0.32140000000000002 | AU16: 0.13739999999999999 | AV16: 0.2465 | AW16: -0.3483 | AX16: -0.22940000000000002 | AY16: -6.6000000000000003e-02 | AZ16: -7.0400000000000004e-02 | BA16: 1.3793 | BB16: 0.72760000000000002 | BC16: 0.33260000000000001 | BE16: =(AR16+AS16+AT16+AU16+AV16+AW16+AX16+AY16+AZ16+BA16+BB16+BC16)/12 -> 0.23220833333333335 | BF16: =(AK16+AL16+AM16+AN16+AO16+AP16+AQ16+AR16+AS16+AT16+AU16+AV16+AV16+AW16+AX16+AY16+AZ16+BA16+BB16+BC16)/19 -> 0.25755263157894737 | BG16: =(AV16+AW16)/2 -> -5.0900000000000001e-02 | BH16: =(AW16+AX16)/2 -> -0.28885 | BI16: =(AX16+AY16)/2 -> -0.1477 | BJ16: =(AY16+AZ16)/2 -> -6.8200000000000011e-02 | BK16: =(AZ16+BA16)/2 -> 0.65444999999999998 | BL16: =(BA16+BB16)/2 -> 1.05345 | BM16: =(BB16+BC16)/2 -> 0.53010000000000002 | BN16: =STDEV(AK16:BC16) -> 0.38277311901866212
B17: 600941.SH | C17: 中国移动 | Y17: 6.7799999999999999e-02 | AA17: =(Y17)/1 -> 6.7799999999999999e-02 | AB17: =(Y17)/1 -> 6.7799999999999999e-02 | AC17: =(R17+S17)/2 -> 0 | AD17: =(S17+T17)/2 -> 0 | AE17: =(T17+U17)/2 -> 0 | AF17: =(U17+V17)/2 -> 0 | AG17: =(V17+W17)/2 -> 0 | AH17: =(W17+X17)/2 -> 0 | AI17: =(X17+Y17)/2 -> 3.39e-02 | AJ17: =STDEV(G17:Y17) -> #DIV/0!
B18: 600585.SH | C18: 海螺水泥 | G18: 0.8637999999999999 | H18: 1.0159 | I18: 0.64329999999999998 | J18: 0.85709999999999997 | K18: 1.2190000000000001 | L18: 0.92130000000000001 | M18: 1.1120999999999999 | N18: 0.88290000000000002 | O18: 0.27279999999999999 | P18: 0.18030000000000002 | Q18: 0.14960000000000001 | R18: 0.12609999999999999 | S18: -0.19210000000000002 | T18: 5.21e-02 | U18: 3.9100000000000003e-02 | V18: 4.5700000000000005e-02 | W18: 0.18640000000000001 | X18: -6.93e-02 | Y18: -9.4200000000000006e-02 | AA18: =(N18+O18+P18+Q18+R18+S18+T18+U18+V18+W18+X18+Y18)/12 -> 0.13161666666666669 | AB18: =(G18+H18+I18+J18+K18+L18+M18+N18+O18+P18+Q18+R18+S18+T18+U18+V18+W18+X18+Y18)/19 -> 0.43220526315789465 | AC18: =(R18+S18)/2 -> -3.3000000000000015e-02 | AD18: =(S18+T18)/2 -> -7.0000000000000007e-02 | AE18: =(T18+U18)/2 -> 4.5600000000000002e-02 | AF18: =(U18+V18)/2 -> 4.2400000000000007e-02 | AG18: =(V18+W18)/2 -> 0.11605000000000001 | AH18: =(W18+X18)/2 -> 5.8550000000000005e-02 | AI18: =(X18+Y18)/2 -> -8.1750000000000003e-02 | AJ18: =STDEV(G18:Y18) -> 0.46935713537381718
B19: 601919.SH | C19: 中远海控 | G19: 1.0682 | H19: 1.2534999999999998 | I19: 1.3 | J19: 1.268 | K19: -0.33329999999999999 | L19: -0.9778 | M19: -0.70369999999999999 | N19: -0.53849999999999998 | O19: 2 | P19: 24 | Q19: 1.25 | R19: 3.6667000000000001 | S19: -0.66670000000000007 | T19: -0.29999999999999999 | U19: 0.33329999999999999 | V19: 0.44640000000000002 | W19: 62 | X19: 32.285699999999999 | Y19: 16.625 | AA19: =(N19+O19+P19+Q19+R19+S19+T19+U19+V19+W19+X19+Y19)/12 -> 11.758491666666666 | AB19: =(G19+H19+I19+J19+K19+L19+M19+N19+O19+P19+Q19+R19+S19+T19+U19+V19+W19+X19+Y19)/19 -> 7.5777263157894739 | AC19: =(R19+S19)/2 -> 1.5 | AD19: =(S19+T19)/2 -> -0.48335000000000006 | AE19: =(T19+U19)/2 -> 1.6649999999999998e-02 | AF19: =(U19+V19)/2 -> 0.38985000000000003 | AG19: =(V19+W19)/2 -> 31.223199999999999 | AH19: =(W19+X19)/2 -> 47.142849999999996 | AI19: =(X19+Y19)/2 -> 24.455349999999999 | AJ19: =STDEV(G19:Y19) -> 16.116683554036037
B20: 603501.SH | C20: 韦尔股份 | G20: 0.25 | H20: -0.17649999999999999 | I20: -0.1429 | J20: -0.10529999999999999 | K20: -0.10000000000000001 | L20: 1.4286000000000001 | M20: 0.20829999999999999 | N20: -0.14710000000000001 | O20: 0.11109999999999999 | P20: -0.55880000000000007 | Q20: -0.4138 | R20: 1.6207 | S20: 4.2999999999999998 | T20: 7 | U20: 9.823500000000001 | V20: 3.2237 | W20: 1.2642 | X20: 1.1582999999999999 | Y20: 1.2065000000000001 | AA20: =(N20+O20+P20+Q20+R20+S20+T20+U20+V20+W20+X20+Y20)/12 -> 2.3823583333333329 | AB20: =(G20+H20+I20+J20+K20+L20+M20+N20+O20+P20+Q20+R20+S20+T20+U20+V20+W20+X20+Y20)/19 -> 1.5763421052631579 | AC20: =(R20+S20)/2 -> 2.96035 | AD20: =(S20+T20)/2 -> 5.6500000000000004 | AE20: =(T20+U20)/2 -> 8.4117500000000014 | AF20: =(U20+V20)/2 -> 6.5236000000000001 | AG20: =(V20+W20)/2 -> 2.2439499999999999 | AH20: =(W20+X20)/2 -> 1.2112499999999999 | AI20: =(X20+Y20)/2 -> 1.1823999999999999 | AJ20: =STDEV(G20:Y20) -> 2.7581218255898925
B21: 600809.SH | C21: 山西汾酒 | G21: 0.58700000000000008 | H21: 0.6765000000000001 | I21: 0.7853 | J21: 0.57379999999999998 | K21: 0.53039999999999998 | L21: 0.56630000000000003 | M21: 0.58329999999999993 | N21: 0.58240000000000003 | O21: 0.2278 | P21: 0.27539999999999998 | Q21: 0.33889999999999998 | R21: 0.30370000000000003 | S21: 0.38919999999999999 | T21: -3.4700000000000002e-02 | U21: 3.95e-02 | V21: 0.56469999999999998 | W21: 0.77300000000000002 | X21: 1.1791 | Y21: 0.96099999999999997 | AA21: =(N21+O21+P21+Q21+R21+S21+T21+U21+V21+W21+X21+Y21)/12 -> 0.46666666666666662 | AB21: =(G21+H21+I21+J21+K21+L21+M21+N21+O21+P21+Q21+R21+S21+T21+U21+V21+W21+X21+Y21)/19 -> 0.52118947368421065 | AC21: =(R21+S21)/2 -> 0.34645000000000004 | AD21: =(S21+T21)/2 -> 0.17724999999999999 | AE21: =(T21+U21)/2 -> 2.3999999999999994e-03 | AF21: =(U21+V21)/2 -> 0.30209999999999998 | AG21: =(V21+W21)/2 -> 0.66884999999999994 | AH21: =(W21+X21)/2 -> 0.97605000000000008 | AI21: =(X21+Y21)/2 -> 1.0700499999999999 | AJ21: =STDEV(G21:Y21) -> 0.29699982958232451 | AK21: 0.20499999999999999 | AL21: 0.24489999999999998 | AM21: 0.31170000000000003 | AN21: 0.4204 | AO21: 0.68059999999999998 | AP21: 0.49530000000000002 | AQ21: 0.43340000000000001 | AR21: 0.4073 | AS21: 1.6979 | AT21: 0.88769999999999993 | AU21: 0.67310000000000003 | AV21: 0.5141 | AW21: -0.36729999999999996 | AX21: -2.2200000000000001e-02 | AY21: -1.89e-02 | AZ21: 7.3000000000000001e-03 | BA21: 0.35560000000000003 | BB21: 0.54210000000000003 | BC21: 0.82950000000000002 | BE21: =(AR21+AS21+AT21+AU21+AV21+AW21+AX21+AY21+AZ21+BA21+BB21+BC21)/12 -> 0.45884999999999992 | BF21: =(AK21+AL21+AM21+AN21+AO21+AP21+AQ21+AR21+AS21+AT21+AU21+AV21+AV21+AW21+AX21+AY21+AZ21+BA21+BB21+BC21)/19 -> 0.4637684210526315 | BG21: =(AV21+AW21)/2 -> 7.3400000000000021e-02 | BH21: =(AW21+AX21)/2 -> -0.19474999999999998 | BI21: =(AX21+AY21)/2 -> -2.0549999999999999e-02 | BJ21: =(AY21+AZ21)/2 -> -5.7999999999999996e-03 | BK21: =(AZ21+BA21)/2 -> 0.18145 | BL21: =(BA21+BB21)/2 -> 0.44885000000000003 | BM21: =(BB21+BC21)/2 -> 0.68579999999999997 | BN21: =STDEV(AK21:BC21) -> 0.43760716388450599
B22: 000596.SZ | C22: 古井贡酒 | G22: 0.19120000000000001 | H22: 0.26739999999999997 | I22: 0.36210000000000003 | J22: 0.38179999999999997 | K22: 0.41979999999999995 | L22: 0.62390000000000001 | M22: 0.57590000000000008 | N22: 0.47810000000000002 | O22: 0.35649999999999998 | P22: 0.40110000000000001 | Q22: 0.3896 | R22: 0.23739999999999997 | S22: -0.1923 | T22: -0.17739999999999997 | U22: -0.11849999999999999 | V22: -0.11749999999999999 | W22: 0.28570000000000001 | X22: 0.34310000000000002 | Y22: 0.26229999999999998 | AA22: =(N22+O22+P22+Q22+R22+S22+T22+U22+V22+W22+X22+Y22)/12 -> 0.17900833333333335 | AB22: =(G22+H22+I22+J22+K22+L22+M22+N22+O22+P22+Q22+R22+S22+T22+U22+V22+W22+X22+Y22)/19 -> 0.26158947368421054 | AC22: =(R22+S22)/2 -> 2.2549999999999987e-02 | AD22: =(S22+T22)/2 -> -0.18484999999999999 | AE22: =(T22+U22)/2 -> -0.14794999999999997 | AF22: =(U22+V22)/2 -> -0.11799999999999999 | AG22: =(V22+W22)/2 -> 8.4100000000000008e-02 | AH22: =(W22+X22)/2 -> 0.31440000000000001 | AI22: =(X22+Y22)/2 -> 0.30269999999999997 | AJ22: =STDEV(G22:Y22) -> 0.24393553769327586
B23: 601336.SH | C23: 新华保险 | G23: -7.8100000000000003e-02 | H23: -2.7999999999999997e-02 | I23: 5.8799999999999998e-02 | J23: 9.4899999999999998e-02 | K23: 0.42369999999999997 | L23: 0.78849999999999998 | M23: 0.52469999999999994 | N23: 0.46820000000000001 | O23: 0.28570000000000001 | P23: 0.81720000000000004 | Q23: 0.68830000000000002 | R23: 0.83860000000000001 | S23: 0.37959999999999999 | T23: -0.22190000000000001 | U23: -0.14630000000000001 | V23: -1.9299999999999998e-02 | W23: 0.35570000000000002 | X23: 0.28520000000000001 | Y23: 7.5800000000000006e-02 | AA23: =(N23+O23+P23+Q23+R23+S23+T23+U23+V23+W23+X23+Y23)/12 -> 0.31723333333333331 | AB23: =(G23+H23+I23+J23+K23+L23+M23+N23+O23+P23+Q23+R23+S23+T23+U23+V23+W23+X23+Y23)/19 -> 0.29427894736842103 | AC23: =(R23+S23)/2 -> 0.60909999999999997 | AD23: =(S23+T23)/2 -> 7.884999999999999e-02 | AE23: =(T23+U23)/2 -> -0.18410000000000001 | AF23: =(U23+V23)/2 -> -8.2800000000000012e-02 | AG23: =(V23+W23)/2 -> 0.16820000000000002 | AH23: =(W23+X23)/2 -> 0.32045000000000001 | AI23: =(X23+Y23)/2 -> 0.18049999999999999 | AJ23: =STDEV(G23:Y23) -> 0.33540081756169382
B24: 605168.SH | C24: 三人行 | E24: 0.30020000000000002 | F24: 3.742 | R24: 0.56490000000000007 | S24: 1.6897 | T24: 1.1609 | U24: 0.93079999999999996 | V24: 0.56679999999999997 | W24: -2.5600000000000001e-02 | X24: 0.27660000000000001 | Y24: 0.21820000000000001 | AA24: =(R24+S24+T24+U24+V24+W24+X24+Y24)/8 -> 0.67278749999999998 | AC24: =(R24+S24)/2 -> 1.1273 | AD24: =(S24+T24)/2 -> 1.4253 | AE24: =(T24+U24)/2 -> 1.0458499999999999 | AF24: =(U24+V24)/2 -> 0.74879999999999991 | AG24: =(V24+W24)/2 -> 0.27060000000000001 | AH24: =(W24+X24)/2 -> 0.1255 | AI24: =(X24+Y24)/2 -> 0.24740000000000001 | AJ24: =STDEV(G24:Y24) -> 0.56228713924852103
B25: 603195.SH | C25: 公牛集团 | Q25: 0.58540000000000003 | R25: 0.373 | S25: -0.61329999999999996 | T25: -0.30959999999999999 | U25: -0.17230000000000001 | V25: -8.900000000000001e-02 | W25: 2.4828000000000001 | X25: 0.74260000000000004 | Y25: 0.36080000000000001 | AA25: =(N25+O25+P25+Q25+R25+S25+T25+U25+V25+W25+X25+Y25)/12 -> 0.28003333333333336 | AB25: =(G25+H25+I25+J25+K25+L25+M25+N25+O25+P25+Q25+R25+S25+T25+U25+V25+W25+X25+Y25)/19 -> 0.17686315789473686 | AC25: =(R25+S25)/2 -> -0.12014999999999998 | AD25: =(S25+T25)/2 -> -0.46144999999999997 | AE25: =(T25+U25)/2 -> -0.24095 | AF25: =(U25+V25)/2 -> -0.13065000000000002 | AG25: =(V25+W25)/2 -> 1.1969000000000001 | AH25: =(W25+X25)/2 -> 1.6127 | AI25: =(X25+Y25)/2 -> 0.55170000000000008 | AJ25: =STDEV(G25:Y25) -> 0.9071003290399825
B26: 603026.SH | C26: 石大胜华 | G26: 0.10000000000000001 | H26: -0.14000000000000001 | I26: -1.49e-02 | J26: 9.5199999999999993e-02 | K26: 0.5 | L26: 0.51159999999999994 | M26: 0.2727 | N26: 9.7799999999999998e-02 | O26: 1 | P26: 0.7077 | Q26: 0.77379999999999993 | R26: 0.505 | S26: -1.1364000000000001 | T26: -1.1892 | U26: -0.81209999999999993 | V26: -0.15789999999999998 | W26: 13.666700000000001 | X26: 14.9048 | Y26: 12.071400000000001 | AA26: =(N26+O26+P26+Q26+R26+S26+T26+U26+V26+W26+X26+Y26)/12 -> 3.3693000000000004 | AB26: =(G26+H26+I26+J26+K26+L26+M26+N26+O26+P26+Q26+R26+S26+T26+U26+V26+W26+X26+Y26)/19 -> 2.1976947368421058 | AC26: =(R26+S26)/2 -> -0.31570000000000004 | AD26: =(S26+T26)/2 -> -1.1628000000000001 | AE26: =(T26+U26)/2 -> -1.00065 | AF26: =(U26+V26)/2 -> -0.48499999999999999 | AG26: =(V26+W26)/2 -> 6.7544000000000004 | AH26: =(W26+X26)/2 -> 14.28575 | AI26: =(X26+Y26)/2 -> 13.488099999999999 | AJ26: =STDEV(G26:Y26) -> 5.1058914218417755
B27: 600036.SH | C27: 招商银行 | G27: 8.2200000000000009e-02 | H27: 0.1143 | I27: 0.12560000000000002 | J27: 0.13009999999999999 | K27: 0.13919999999999999 | L27: 0.1346 | M27: 0.1416 | N27: 0.12590000000000001 | O27: 0.11109999999999999 | P27: 0.1356 | Q27: 0.14660000000000001 | R27: 0.1565 | S27: 0.10000000000000001 | T27: -1.9900000000000001e-02 | U27: -9.7999999999999997e-03 | V27: 4.7e-02 | W27: 0.1545 | X27: 0.19289999999999999 | Y27: 0.19870000000000002 | AA27: =(N27+O27+P27+Q27+R27+S27+T27+U27+V27+W27+X27+Y27)/12 -> 0.11159166666666666 | AB27: =(G27+H27+I27+J27+K27+L27+M27+N27+O27+P27+Q27+R27+S27+T27+U27+V27+W27+X27+Y27)/19 -> 0.11614210526315789 | AC27: =(R27+S27)/2 -> 0.12825 | AD27: =(S27+T27)/2 -> 4.0050000000000002e-02 | AE27: =(T27+U27)/2 -> -1.485e-02 | AF27: =(U27+V27)/2 -> 1.8599999999999998e-02 | AG27: =(V27+W27)/2 -> 0.10075000000000001 | AH27: =(W27+X27)/2 -> 0.17369999999999999 | AI27: =(X27+Y27)/2 -> 0.1958 | AJ27: =STDEV(G27:Y27) -> 5.7544604108363658e-02 | BA27: -0.37790000000000001 | BB27: -0.40289999999999998 | BC27: -0.46000000000000002
B28: 603489.SH | C28: 八方股份 | P28: 0.4597 | Q28: 0.48599999999999999 | R28: 0.35659999999999997 | S28: -0.36560000000000004 | T28: -0.16570000000000001 | U28: -4.1399999999999999e-02 | V28: -4.2900000000000001e-02 | W28: 1.1186 | X28: 0.70200000000000007 | Y28: 0.41570000000000001 | AA28: =(N28+O28+P28+Q28+R28+S28+T28+U28+V28+W28+X28+Y28)/12 -> 0.24358333333333335 | AB28: =(G28+H28+I28+J28+K28+L28+M28+N28+O28+P28+Q28+R28+S28+T28+U28+V28+W28+X28+Y28)/19 -> 0.15384210526315789 | AC28: =(R28+S28)/2 -> -4.5000000000000318e-03 | AD28: =(S28+T28)/2 -> -0.26565000000000005 | AE28: =(T28+U28)/2 -> -0.10355 | AF28: =(U28+V28)/2 -> -4.215e-02 | AG28: =(V28+W28)/2 -> 0.53785000000000005 | AH28: =(W28+X28)/2 -> 0.91030000000000011 | AI28: =(X28+Y28)/2 -> 0.55885000000000007 | AJ28: =STDEV(G28:Y28) -> 0.44744228926446172
B29: 603882.SH | C29: 金域医学 | I29: 0.22579999999999997 | J29: 4.5499999999999999e-02 | K29: 0 | L29: -4.5499999999999999e-02 | M29: -5.2600000000000001e-02 | N29: 0.10869999999999999 | O29: 3.5 | P29: 0.8095 | Q29: 0.94440000000000002 | R29: 0.72549999999999992 | S29: 0.11109999999999999 | T29: 2.1841999999999997 | U29: 2.2856999999999998 | V29: 2.7385999999999999 | W29: 10.6 | X29: 0.90079999999999993 | Y29: 0.56520000000000004 | AA29: =(N29+O29+P29+Q29+R29+S29+T29+U29+V29+W29+X29+Y29)/12 -> 2.1228083333333334 | AB29: =(G29+H29+I29+J29+K29+L29+M29+N29+O29+P29+Q29+R29+S29+T29+U29+V29+W29+X29+Y29)/19 -> 1.3498368421052633 | AC29: =(R29+S29)/2 -> 0.41829999999999995 | AD29: =(S29+T29)/2 -> 1.1476499999999998 | AE29: =(T29+U29)/2 -> 2.2349499999999995 | AF29: =(U29+V29)/2 -> 2.5121500000000001 | AG29: =(V29+W29)/2 -> 6.6692999999999998 | AH29: =(W29+X29)/2 -> 5.7504 | AI29: =(X29+Y29)/2 -> 0.73299999999999998 | AJ29: =STDEV(G29:Y29) -> 2.5823873407321236
B30: 603833.SH | C30: 欧派家居 | G30: 0.2727 | H30: 0.2651 | I30: 0.22510000000000002 | J30: 0.26379999999999998 | K30: 0.28570000000000001 | L30: 0.24760000000000001 | M30: 0.21789999999999998 | N30: 0.17449999999999999 | O30: 0.22219999999999998 | P30: 0.1527 | Q30: -0.17190000000000003 | R30: -0.16980000000000001 | S30: -1.7727000000000002 | T30: -0.45030000000000003 | U30: 3.8100000000000002e-02 | V30: 0.10859999999999999 | W30: 3.5293999999999999 | X30: 1.012 | Y30: 0.4204 | AA30: =(N30+O30+P30+Q30+R30+S30+T30+U30+V30+W30+X30+Y30)/12 -> 0.25776666666666664 | AB30: =(G30+H30+I30+J30+K30+L30+M30+N30+O30+P30+Q30+R30+S30+T30+U30+V30+W30+X30+Y30)/19 -> 0.25637368421052625 | AC30: =(R30+S30)/2 -> -0.97125000000000006 | AD30: =(S30+T30)/2 -> -1.1115000000000002 | AE30: =(T30+U30)/2 -> -0.20610000000000001 | AF30: =(U30+V30)/2 -> 7.3349999999999999e-02 | AG30: =(V30+W30)/2 -> 1.819 | AH30: =(W30+X30)/2 -> 2.2706999999999997 | AI30: =(X30+Y30)/2 -> 0.71619999999999995 | AJ30: =STDEV(G30:Y30) -> 0.95405683667292018
B31: 000333.SZ | C31: 美的集团 | G31: 9.8400000000000001e-02 | H31: 0.12839999999999999 | I31: 0.155 | J31: 0.16159999999999999 | K31: 0.19399999999999998 | L31: 0.17960000000000001 | M31: 0.17749999999999999 | N31: 0.15789999999999998 | O31: 0.17499999999999999 | P31: 0.1777 | Q31: 0.17649999999999999 | R31: 0.16879999999999998 | S31: -0.25530000000000003 | T31: -0.1336 | U31: -6.3e-03 | V31: 9.1700000000000004e-02 | W31: 0.3286 | X31: 7.9600000000000004e-02 | Y31: 7.2300000000000003e-02 | AA31: =(N31+O31+P31+Q31+R31+S31+T31+U31+V31+W31+X31+Y31)/12 -> 8.6074999999999971e-02 | AB31: =(G31+H31+I31+J31+K31+L31+M31+N31+O31+P31+Q31+R31+S31+T31+U31+V31+W31+X31+Y31)/19 -> 0.11196842105263156 | AC31: =(R31+S31)/2 -> -4.3250000000000025e-02 | AD31: =(S31+T31)/2 -> -0.19445000000000001 | AE31: =(T31+U31)/2 -> -6.9949999999999998e-02 | AF31: =(U31+V31)/2 -> 4.2700000000000002e-02 | AG31: =(V31+W31)/2 -> 0.21015 | AH31: =(W31+X31)/2 -> 0.2041 | AI31: =(X31+Y31)/2 -> 7.5950000000000004e-02 | AJ31: =STDEV(G31:Y31) -> 0.12851781135802659
B32: 002382.SZ | C32: 蓝帆医疗 | G32: 0.22219999999999998 | H32: 5.0000000000000003e-02 | I32: 6.6699999999999995e-02 | J32: 0.1081 | K32: 9.0899999999999995e-02 | L32: 0.28570000000000001 | M32: 0.21879999999999999 | N32: 0.14630000000000001 | O32: -0.16670000000000001 | P32: -0.11109999999999999 | Q32: 0 | R32: 8.5099999999999995e-02 | S32: 0.5 | T32: 1.6666999999999998 | U32: 4.0255999999999998 | V32: 2.5686 | W32: 10.2667 | X32: 4.2812000000000001 | Y32: 0.73980000000000001 | AA32: =(N32+O32+P32+Q32+R32+S32+T32+U32+V32+W32+X32+Y32)/12 -> 2.0001833333333332 | AB32: =(G32+H32+I32+J32+K32+L32+M32+N32+O32+P32+Q32+R32+S32+T32+U32+V32+W32+X32+Y32)/19 -> 1.3181368421052631 | AC32: =(R32+S32)/2 -> 0.29254999999999998 | AD32: =(S32+T32)/2 -> 1.0833499999999998 | AE32: =(T32+U32)/2 -> 2.8461499999999997 | AF32: =(U32+V32)/2 -> 3.2970999999999999 | AG32: =(V32+W32)/2 -> 6.4176500000000001 | AH32: =(W32+X32)/2 -> 7.2739500000000001 | AI32: =(X32+Y32)/2 -> 2.5105 | AJ32: =STDEV(G32:Y32) -> 2.5535867205017353
B33: 600436.SH | C33: 片仔癀 | G33: 0.58329999999999993 | H33: 0.4118 | I33: 0.40000000000000002 | J33: 0.50560000000000005 | K33: 0.42109999999999997 | L33: 0.41670000000000001 | M33: 0.35710000000000003 | N33: 0.41039999999999999 | O33: 0.2407 | P33: 0.2157 | Q33: 0.21050000000000002 | R33: 0.20629999999999998 | S33: 0.16420000000000001 | T33: 0.1532 | U33: 0.19570000000000001 | V33: 0.21489999999999998 | W33: 0.2051 | X33: 0.29370000000000002 | Y33: 0.51359999999999995 | AA33: =(N33+O33+P33+Q33+R33+S33+T33+U33+V33+W33+X33+Y33)/12 -> 0.25199999999999995 | AB33: =(G33+H33+I33+J33+K33+L33+M33+N33+O33+P33+Q33+R33+S33+T33+U33+V33+W33+X33+Y33)/19 -> 0.32208421052631581 | AC33: =(R33+S33)/2 -> 0.18525 | AD33: =(S33+T33)/2 -> 0.15870000000000001 | AE33: =(T33+U33)/2 -> 0.17444999999999999 | AF33: =(U33+V33)/2 -> 0.20529999999999998 | AG33: =(V33+W33)/2 -> 0.20999999999999999 | AH33: =(W33+X33)/2 -> 0.24940000000000001 | AI33: =(X33+Y33)/2 -> 0.40364999999999995 | AJ33: =STDEV(G33:Y33) -> 0.13326906477397893 | BA33: 0.23920000000000002 | BB33: 0.18530000000000002 | BC33: 0.18859999999999999
B34: 600486.SH | C34: 扬农化工 | G34: 0.36479999999999996 | H34: 0.191 | I34: 0.3821 | J34: 0.30909999999999999 | K34: 1.1122000000000001 | L34: 1.2228000000000001 | M34: 1.2916999999999998 | N34: 0.70400000000000007 | O34: 0.62029999999999996 | P34: 0.51100000000000001 | Q34: 0.1469 | R34: 0.19420000000000001 | S34: 4.1999999999999997e-03 | T34: -2.7699999999999999e-02 | U34: -4.3200000000000002e-02 | V34: 3.4200000000000001e-02 | W34: -4.1999999999999997e-03 | X34: -4.2699999999999995e-02 | Y34: -7.6e-03 | AA34: =(N34+O34+P34+Q34+R34+S34+T34+U34+V34+W34+X34+Y34)/12 -> 0.17411666666666667 | AB34: =(G34+H34+I34+J34+K34+L34+M34+N34+O34+P34+Q34+R34+S34+T34+U34+V34+W34+X34+Y34)/19 -> 0.36647894736842107 | AC34: =(R34+S34)/2 -> 9.920000000000001e-02 | AD34: =(S34+T34)/2 -> -1.175e-02 | AE34: =(T34+U34)/2 -> -3.5450000000000002e-02 | AF34: =(U34+V34)/2 -> -4.5000000000000005e-03 | AG34: =(V34+W34)/2 -> 1.5000000000000001e-02 | AH34: =(W34+X34)/2 -> -2.3449999999999999e-02 | AI34: =(X34+Y34)/2 -> -2.5149999999999999e-02 | AJ34: =STDEV(G34:Y34) -> 0.43884400617347613
B35: 002978.SZ | C35: 安宁股份 | R35: 5.91e-02 | S35: 0.33270000000000005 | T35: 0.22839999999999999 | U35: 0.23129999999999998 | V35: 0.25509999999999999 | W35: 0.67989999999999995 | X35: 1.0115000000000001 | Y35: 1.1774 | AA35: =(N35+O35+P35+Q35+R35+S35+T35+U35+V35+W35+X35+Y35)/12 -> 0.33128333333333332 | AB35: =(G35+H35+I35+J35+K35+L35+M35+N35+O35+P35+Q35+R35+S35+T35+U35+V35+W35+X35+Y35)/19 -> 0.20923157894736844 | AC35: =(R35+S35)/2 -> 0.19590000000000002 | AD35: =(S35+T35)/2 -> 0.28055000000000002 | AE35: =(T35+U35)/2 -> 0.22985 | AF35: =(U35+V35)/2 -> 0.24319999999999997 | AG35: =(V35+W35)/2 -> 0.46749999999999997 | AH35: =(W35+X35)/2 -> 0.84570000000000001 | AI35: =(X35+Y35)/2 -> 1.0944500000000001 | AJ35: =STDEV(G35:Y35) -> 0.41076857144347628 | AV35: -5.3899999999999997e-02 | AW35: 1.2297 | AX35: 0.73019999999999996 | AY35: 0.51910000000000001 | AZ35: 0.49369999999999997 | BA35: -0.1779 | BB35: -2.6499999999999999e-02 | BC35: 0.26700000000000002 | BE35: =(AR35+AS35+AT35+AU35+AV35+AW35+AX35+AY35+AZ35+BA35+BB35+BC35)/12 -> 0.24844999999999998 | BF35: =(AK35+AL35+AM35+AN35+AO35+AP35+AQ35+AR35+AS35+AT35+AU35+AV35+AV35+AW35+AX35+AY35+AZ35+BA35+BB35+BC35)/19 -> 0.15407894736842104 | BG35: =(AV35+AW35)/2 -> 0.58789999999999998 | BH35: =(AW35+AX35)/2 -> 0.97994999999999999 | BI35: =(AX35+AY35)/2 -> 0.62464999999999993 | BJ35: =(AY35+AZ35)/2 -> 0.50639999999999996 | BK35: =(AZ35+BA35)/2 -> 0.15789999999999998 | BL35: =(BA35+BB35)/2 -> -0.1022 | BM35: =(BB35+BC35)/2 -> 0.12025000000000001 | BN35: =STDEV(AK35:BC35) -> 0.47117031421769351
B36: 601166.SH | C36: 兴业银行 | G36: 7.3200000000000001e-02 | H36: 1.34e-02 | I36: 4.4000000000000003e-03 | J36: -1.0800000000000001e-02 | K36: -3.4099999999999998e-02 | L36: 2.6499999999999999e-02 | M36: 4.4199999999999996e-02 | N36: 4.0099999999999997e-02 | O36: 0.1176 | P36: 7.0999999999999994e-02 | Q36: 8.900000000000001e-02 | R36: 8.77e-02 | S36: 6.3200000000000006e-02 | T36: -0.1265 | U36: -7.7800000000000008e-02 | V36: -6.5000000000000006e-03 | W36: 0.1386 | X36: 0.23449999999999999 | Y36: 0.2447 | AA36: =(N36+O36+P36+Q36+R36+S36+T36+U36+V36+W36+X36+Y36)/12 -> 7.2966666666666666e-02 | AB36: =(G36+H36+I36+J36+K36+L36+M36+N36+O36+P36+Q36+R36+S36+T36+U36+V36+W36+X36+Y36)/19 -> 5.2231578947368427e-02 | AC36: =(R36+S36)/2 -> 7.5450000000000003e-02 | AD36: =(S36+T36)/2 -> -3.1649999999999998e-02 | AE36: =(T36+U36)/2 -> -0.10215 | AF36: =(U36+V36)/2 -> -4.2150000000000007e-02 | AG36: =(V36+W36)/2 -> 6.6049999999999998e-02 | AH36: =(W36+X36)/2 -> 0.18654999999999999 | AI36: =(X36+Y36)/2 -> 0.23959999999999998 | AJ36: =STDEV(G36:Y36) -> 9.2471863904839108e-02 | AX36: 0.88829999999999998 | AY36: 0.55420000000000003 | AZ36: 0.54339999999999999 | BA36: -0.91220000000000001 | BB36: -0.76590000000000003 | BC36: 4.5899999999999996e-02 | BE36: =(AR36+AS36+AT36+AU36+AV36+AW36+AX36+AY36+AZ36+BA36+BB36+BC36)/12 -> 2.9475000000000005e-02 | BF36: =(AK36+AL36+AM36+AN36+AO36+AP36+AQ36+AR36+AS36+AT36+AU36+AV36+AV36+AW36+AX36+AY36+AZ36+BA36+BB36+BC36)/19 -> 1.8615789473684214e-02 | BG36: =(AV36+AW36)/2 -> 0 | BH36: =(AW36+AX36)/2 -> 0.44414999999999999 | BI36: =(AX36+AY36)/2 -> 0.72124999999999995 | BJ36: =(AY36+AZ36)/2 -> 0.54879999999999995 | BK36: =(AZ36+BA36)/2 -> -0.18440000000000001 | BL36: =(BA36+BB36)/2 -> -0.83905000000000007 | BM36: =(BB36+BC36)/2 -> -0.35999999999999999 | BN36: =STDEV(AK36:BC36) -> 0.74719019466264414
B37: 600702.SH | C37: 舍得酒业 | G37: 2.3546 | H37: 1.6899999999999999 | I37: 0.74219999999999997 | J37: 0.79020000000000001 | K37: 1.0256000000000001 | L37: 1.6606999999999998 | M37: 1.8703999999999998 | N37: 1.4005000000000001 | O37: 0.22829999999999998 | P37: 0.13 | Q37: 0.1168 | R37: 0.48920000000000002 | S37: -0.73419999999999996 | T37: -0.11289999999999999 | U37: 2.9900000000000003e-02 | V37: 0.14679999999999999 | W37: 10.3308 | X37: 3.4882999999999997 | Y37: 2.1223000000000001 | AA37: =(N37+O37+P37+Q37+R37+S37+T37+U37+V37+W37+X37+Y37)/12 -> 1.4696499999999999 | AB37: =(G37+H37+I37+J37+K37+L37+M37+N37+O37+P37+Q37+R37+S37+T37+U37+V37+W37+X37+Y37)/19 -> 1.4615526315789473 | AC37: =(R37+S37)/2 -> -0.12249999999999997 | AD37: =(S37+T37)/2 -> -0.42354999999999998 | AE37: =(T37+U37)/2 -> -4.1499999999999995e-02 | AF37: =(U37+V37)/2 -> 8.8349999999999998e-02 | AG37: =(V37+W37)/2 -> 5.2388000000000003 | AH37: =(W37+X37)/2 -> 6.9095499999999994 | AI37: =(X37+Y37)/2 -> 2.8052999999999999 | AJ37: =STDEV(G37:Y37) -> 2.3869151568425955
B38: 002821.SZ | C38: 凯莱英 | G38: -0.38890000000000002 | H38: 0.10000000000000001 | I38: -0.16190000000000002 | J38: 9.4200000000000006e-02 | K38: 0.31819999999999998 | L38: 0.2545 | M38: 0.30680000000000002 | N38: 0.245 | O38: 0.37929999999999997 | P38: 0.44929999999999998 | Q38: 0.39130000000000004 | R38: 0.28720000000000001 | S38: 0.17499999999999999 | T38: 0.38 | U38: 0.375 | V38: 0.28100000000000003 | W38: 0.36170000000000002 | X38: 0.28989999999999999 | Y38: 0.30909999999999999 | AA38: =(N38+O38+P38+Q38+R38+S38+T38+U38+V38+W38+X38+Y38)/12 -> 0.32698333333333335 | AB38: =(G38+H38+I38+J38+K38+L38+M38+N38+O38+P38+Q38+R38+S38+T38+U38+V38+W38+X38+Y38)/19 -> 0.23403684210526315 | AC38: =(R38+S38)/2 -> 0.2311 | AD38: =(S38+T38)/2 -> 0.27749999999999997 | AE38: =(T38+U38)/2 -> 0.3775 | AF38: =(U38+V38)/2 -> 0.32800000000000001 | AG38: =(V38+W38)/2 -> 0.32135000000000002 | AH38: =(W38+X38)/2 -> 0.32579999999999998 | AI38: =(X38+Y38)/2 -> 0.29949999999999999 | AJ38: =STDEV(G38:Y38) -> 0.20577371393117544
B39: 600612.SH | C39: 老凤祥 | G39: 0.2878 | H39: 0.11410000000000001 | I39: 0.11650000000000001 | J39: 7.4400000000000008e-02 | K39: 7.4200000000000002e-02 | L39: 0.11550000000000001 | M39: 0.1014 | N39: 6.0100000000000001e-02 | O39: 0.1195 | P39: 0.13730000000000001 | Q39: 0.1802 | R39: 0.16889999999999999 | S39: -5.6999999999999993e-03 | T39: 2.3e-03 | U39: 5.7300000000000004e-02 | V39: 0.12640000000000001 | W39: 0.74470000000000003 | X39: 0.40630000000000005 | Y39: 0.2155 | AA39: =(N39+O39+P39+Q39+R39+S39+T39+U39+V39+W39+X39+Y39)/12 -> 0.18439999999999998 | AB39: =(G39+H39+I39+J39+K39+L39+M39+N39+O39+P39+Q39+R39+S39+T39+U39+V39+W39+X39+Y39)/19 -> 0.16298421052631581 | AC39: =(R39+S39)/2 -> 8.1599999999999992e-02 | AD39: =(S39+T39)/2 -> -1.6999999999999997e-03 | AE39: =(T39+U39)/2 -> 2.98e-02 | AF39: =(U39+V39)/2 -> 9.1850000000000015e-02 | AG39: =(V39+W39)/2 -> 0.43554999999999999 | AH39: =(W39+X39)/2 -> 0.57550000000000001 | AI39: =(X39+Y39)/2 -> 0.31090000000000001 | AJ39: =STDEV(G39:Y39) -> 0.1703768315729639
B40: 605266.SH | C40: 健之佳 | U40: 6.0899999999999996e-02 | V40: 0.45390000000000003 | W40: -9.6300000000000011e-02 | X40: -0.1721 | Y40: -0.13900000000000001 | AA40: =(N40+O40+P40+Q40+R40+S40+T40+U40+V40+W40+X40+Y40)/12 -> 8.9500000000000014e-03 | AB40: =(G40+H40+I40+J40+K40+L40+M40+N40+O40+P40+Q40+R40+S40+T40+U40+V40+W40+X40+Y40)/19 -> 5.6526315789473701e-03 | AC40: =(R40+S40)/2 -> 0 | AD40: =(S40+T40)/2 -> 0 | AE40: =(T40+U40)/2 -> 3.0449999999999998e-02 | AF40: =(U40+V40)/2 -> 0.25740000000000002 | AG40: =(V40+W40)/2 -> 0.17880000000000001 | AH40: =(W40+X40)/2 -> -0.13420000000000001 | AI40: =(X40+Y40)/2 -> -0.15555000000000002 | AJ40: =STDEV(G40:Y40) -> 0.25770145905679309
B41: 603267.SH | C41: 鸿远电子 | N41: 0.79590000000000005 | O41: 0.61899999999999999 | P41: -5.8299999999999998e-02 | Q41: -0.24199999999999999 | R41: -0.23860000000000001 | S41: -0.52939999999999998 | T41: -8.2500000000000004e-02 | U41: 0.15970000000000001 | V41: 0.56720000000000004 | W41: 1.9375 | X41: 1.2021999999999999 | Y41: 1.0580000000000001 | AA41: =(N41+O41+P41+Q41+R41+S41+T41+U41+V41+W41+X41+Y41)/12 -> 0.43239166666666667 | AB41: =(G41+H41+I41+J41+K41+L41+M41+N41+O41+P41+Q41+R41+S41+T41+U41+V41+W41+X41+Y41)/19 -> 0.27308947368421049 | AC41: =(R41+S41)/2 -> -0.38400000000000001 | AD41: =(S41+T41)/2 -> -0.30595 | AE41: =(T41+U41)/2 -> 3.8600000000000002e-02 | AF41: =(U41+V41)/2 -> 0.36345000000000005 | AG41: =(V41+W41)/2 -> 1.2523500000000001 | AH41: =(W41+X41)/2 -> 1.56985 | AI41: =(X41+Y41)/2 -> 1.1301000000000001 | AJ41: =STDEV(G41:Y41) -> 0.72893481746042332
B42: 603208.SH | C42: 江山欧派 | G42: 0.61109999999999998 | H42: -0.11109999999999999 | I42: -0.1583 | J42: -1.11e-02 | K42: -0.58619999999999994 | L42: -0.1125 | M42: 0.1368 | N42: 6.1799999999999994e-02 | O42: 8.3299999999999999e-02 | P42: 9.8599999999999993e-02 | Q42: 0.28570000000000001 | R42: 0.3175 | S42: 1.7691999999999999 | T42: 0.6409999999999999 | U42: 0.73680000000000012 | V42: 0.62649999999999995 | W42: -0.1389 | X42: 0.32030000000000003 | Y42: -6.7299999999999999e-02 | AA42: =(N42+O42+P42+Q42+R42+S42+T42+U42+V42+W42+X42+Y42)/12 -> 0.39454166666666662 | AB42: =(G42+H42+I42+J42+K42+L42+M42+N42+O42+P42+Q42+R42+S42+T42+U42+V42+W42+X42+Y42)/19 -> 0.2370105263157895 | AC42: =(R42+S42)/2 -> 1.04335 | AD42: =(S42+T42)/2 -> 1.2050999999999998 | AE42: =(T42+U42)/2 -> 0.68890000000000007 | AF42: =(U42+V42)/2 -> 0.68165000000000009 | AG42: =(V42+W42)/2 -> 0.24379999999999996 | AH42: =(W42+X42)/2 -> 9.0700000000000017e-02 | AI42: =(X42+Y42)/2 -> 0.1265 | AJ42: =STDEV(G42:Y42) -> 0.50134902446049034
B43: 000651.SZ | C43: 格力电器 | G43: 0.26419999999999999 | H43: 0.48109999999999997 | I43: 0.37430000000000002 | J43: 0.44750000000000001 | K43: 0.3881 | L43: 0.35670000000000002 | M43: 0.36579999999999996 | N43: 0.17199999999999999 | O43: 1.0800000000000001e-02 | P43: 7.51e-02 | Q43: 4.8399999999999999e-02 | R43: -5.7300000000000004e-02 | S43: -0.72340000000000004 | T43: -0.53710000000000002 | U43: -0.38040000000000002 | V43: -9.7299999999999998e-02 | W43: 1.2307999999999999 | X43: 0.52829999999999999 | Y43: 0.18859999999999999 | AA43: =(N43+O43+P43+Q43+R43+S43+T43+U43+V43+W43+X43+Y43)/12 -> 3.8208333333333316e-02 | AB43: =(G43+H43+I43+J43+K43+L43+M43+N43+O43+P43+Q43+R43+S43+T43+U43+V43+W43+X43+Y43)/19 -> 0.16506315789473688 | AC43: =(R43+S43)/2 -> -0.39035000000000003 | AD43: =(S43+T43)/2 -> -0.63024999999999998 | AE43: =(T43+U43)/2 -> -0.45874999999999999 | AF43: =(U43+V43)/2 -> -0.23885000000000001 | AG43: =(V43+W43)/2 -> 0.56674999999999998 | AH43: =(W43+X43)/2 -> 0.87954999999999994 | AI43: =(X43+Y43)/2 -> 0.35844999999999999 | AJ43: =STDEV(G43:Y43) -> 0.43282483396933774
B44: 601233.SH | C44: 桐昆股份 | G44: 0.625 | H44: 0.42859999999999998 | I44: 0.28850000000000003 | J44: -9.7000000000000003e-03 | K44: 7.690000000000001e-02 | L44: 0.5 | M44: 1.0448 | N44: 0.13730000000000001 | O44: 3.5699999999999996e-02 | P44: 1.3300000000000001e-02 | Q44: -2.1899999999999999e-02 | R44: 0.35340000000000005 | S44: -0.2069 | T44: -0.27629999999999999 | U44: -0.27610000000000001 | V44: -3.1800000000000002e-02 | W44: 2.3043 | X44: 2.3090999999999999 | Y44: 1.7938000000000001 | AA44: =(N44+O44+P44+Q44+R44+S44+T44+U44+V44+W44+X44+Y44)/12 -> 0.51115833333333327 | AB44: =(G44+H44+I44+J44+K44+L44+M44+N44+O44+P44+Q44+R44+S44+T44+U44+V44+W44+X44+Y44)/19 -> 0.47831578947368419 | AC44: =(R44+S44)/2 -> 7.3250000000000023e-02 | AD44: =(S44+T44)/2 -> -0.24159999999999998 | AE44: =(T44+U44)/2 -> -0.2762 | AF44: =(U44+V44)/2 -> -0.15395 | AG44: =(V44+W44)/2 -> 1.13625 | AH44: =(W44+X44)/2 -> 2.3067000000000002 | AI44: =(X44+Y44)/2 -> 2.05145 | AJ44: =STDEV(G44:Y44) -> 0.81171154514064903
B45: 603661.SH | C45: 恒林股份 | H45: -0.18820000000000001 | I45: -0.15179999999999999 | J45: -0.38919999999999999 | K45: -0.72219999999999995 | L45: -0.58700000000000008 | M45: -0.4128 | N45: -0.20469999999999999 | O45: 1.3500000000000001 | P45: 1.2104999999999999 | Q45: 0.71879999999999999 | R45: 0.42109999999999997 | S45: -0.36170000000000002 | T45: 0.24600000000000002 | U45: 0.38179999999999997 | V45: 0.50619999999999998 | W45: 1.2333000000000001 | X45: 7.6399999999999996e-02 | Y45: -0.11509999999999999 | AA45: =(N45+O45+P45+Q45+R45+S45+T45+U45+V45+W45+X45+Y45)/12 -> 0.45521666666666666 | AB45: =(G45+H45+I45+J45+K45+L45+M45+N45+O45+P45+Q45+R45+S45+T45+U45+V45+W45+X45+Y45)/19 -> 0.15849473684210527 | AC45: =(R45+S45)/2 -> 2.9699999999999976e-02 | AD45: =(S45+T45)/2 -> -5.7849999999999999e-02 | AE45: =(T45+U45)/2 -> 0.31390000000000001 | AF45: =(U45+V45)/2 -> 0.44399999999999995 | AG45: =(V45+W45)/2 -> 0.86975000000000002 | AH45: =(W45+X45)/2 -> 0.65485000000000004 | AI45: =(X45+Y45)/2 -> -1.9349999999999999e-02 | AJ45: =STDEV(G45:Y45) -> 0.63708227375230886
B46: 600600.SH | C46: 青岛啤酒 | G46: 8.6099999999999996e-02 | H46: 7.46e-02 | I46: 1.6200000000000003e-02 | J46: 0.21109999999999998 | K46: 0.155 | L46: 0.1341 | M46: 0.12279999999999999 | N46: 0.12619999999999998 | O46: 0.21050000000000002 | P46: 0.25209999999999999 | Q46: 0.23170000000000002 | R46: 0.30199999999999999 | S46: -0.33439999999999998 | T46: 0.13750000000000001 | U46: 0.1515 | V46: 0.18820000000000001 | W46: 0.89950000000000008 | X46: 0.2964 | Y46: 0.20920000000000002 | AA46: =(N46+O46+P46+Q46+R46+S46+T46+U46+V46+W46+X46+Y46)/12 -> 0.22253333333333333 | AB46: =(G46+H46+I46+J46+K46+L46+M46+N46+O46+P46+Q46+R46+S46+T46+U46+V46+W46+X46+Y46)/19 -> 0.18264736842105264 | AC46: =(R46+S46)/2 -> -1.6199999999999992e-02 | AD46: =(S46+T46)/2 -> -9.8449999999999982e-02 | AE46: =(T46+U46)/2 -> 0.14450000000000002 | AF46: =(U46+V46)/2 -> 0.16985 | AG46: =(V46+W46)/2 -> 0.54385000000000006 | AH46: =(W46+X46)/2 -> 0.59794999999999998 | AI46: =(X46+Y46)/2 -> 0.25280000000000002 | AJ46: =STDEV(G46:Y46) -> 0.22105170930606824
B47: 600426.SH | C47: 华鲁恒升 | G47: 8.9900000000000008e-02 | H47: 0.1159 | I47: 0.31409999999999999 | J47: 0.39630000000000004 | K47: 1.3247 | L47: 2.0771999999999999 | M47: 1.9903999999999999 | N47: 1.4721000000000002 | O47: -0.1242 | P47: -0.22370000000000001 | Q47: -0.24809999999999999 | R47: -0.191 | S47: -0.33159999999999995 | T47: -0.46829999999999999 | U47: -0.48130000000000001 | V47: -0.2666 | W47: 2.6705000000000001 | X47: 3.2008999999999999 | Y47: 3.3557000000000001 | AA47: =(N47+O47+P47+Q47+R47+S47+T47+U47+V47+W47+X47+Y47)/12 -> 0.69703333333333328 | AB47: =(G47+H47+I47+J47+K47+L47+M47+N47+O47+P47+Q47+R47+S47+T47+U47+V47+W47+X47+Y47)/19 -> 0.77225789473684214 | AC47: =(R47+S47)/2 -> -0.26129999999999998 | AD47: =(S47+T47)/2 -> -0.39994999999999997 | AE47: =(T47+U47)/2 -> -0.4748 | AF47: =(U47+V47)/2 -> -0.37395 | AG47: =(V47+W47)/2 -> 1.2019500000000001 | AH47: =(W47+X47)/2 -> 2.9356999999999998 | AI47: =(X47+Y47)/2 -> 3.2782999999999998 | AJ47: =STDEV(G47:Y47) -> 1.3033689071512544 | AK47: 1.26e-02 | AL47: 0.11720000000000001 | AM47: 0.21359999999999998 | AN47: 0.24149999999999999 | AO47: 0.51950000000000007 | AP47: 0.49810000000000004 | AQ47: 0.56710000000000005 | AR47: 0.43709999999999999 | AS47: 0.37530000000000002 | AT47: 0.19829999999999998 | AU47: 0.1096 | AV47: 0.13019999999999998 | AW47: -0.1855 | AX47: -0.12330000000000001 | AY47: -0.1348 | AZ47: -9.35e-02 | BA47: 0.30299999999999999 | BB47: 0.4486 | BC47: 0.63200000000000001 | BE47: =(AR47+AS47+AT47+AU47+AV47+AW47+AX47+AY47+AZ47+BA47+BB47+BC47)/12 -> 0.17474999999999999 | BF47: =(AK47+AL47+AM47+AN47+AO47+AP47+AQ47+AR47+AS47+AT47+AU47+AV47+AV47+AW47+AX47+AY47+AZ47+BA47+BB47+BC47)/19 -> 0.23141052631578946 | BG47: =(AV47+AW47)/2 -> -2.7650000000000008e-02 | BH47: =(AW47+AX47)/2 -> -0.15440000000000001 | BI47: =(AX47+AY47)/2 -> -0.12905 | BJ47: =(AY47+AZ47)/2 -> -0.11415 | BK47: =(AZ47+BA47)/2 -> 0.10475 | BL47: =(BA47+BB47)/2 -> 0.37580000000000002 | BM47: =(BB47+BC47)/2 -> 0.5403 | BN47: =STDEV(AK47:BC47) -> 0.25479014745426498
B48: 601799.SH | C48: 星宇股份 | G48: 0.14429999999999998 | H48: 0.1414 | I48: 0.18739999999999998 | J48: 0.2248 | K48: 0.31989999999999996 | L48: 0.3231 | M48: 0.35759999999999997 | N48: 0.29899999999999999 | O48: 0.30159999999999998 | P48: 0.13100000000000001 | Q48: 0.20960000000000001 | R48: 0.29380000000000001 | S48: -6.3799999999999996e-02 | T48: 0.15210000000000001 | U48: 0.33049999999999996 | V48: 0.46789999999999998 | W48: 0.79020000000000001 | X48: 0.45450000000000002 | Y48: 3.5200000000000002e-02 | AA48: =(N48+O48+P48+Q48+R48+S48+T48+U48+V48+W48+X48+Y48)/12 -> 0.2834666666666667 | AB48: =(G48+H48+I48+J48+K48+L48+M48+N48+O48+P48+Q48+R48+S48+T48+U48+V48+W48+X48+Y48)/19 -> 0.26842631578947362 | AC48: =(R48+S48)/2 -> 0.115 | AD48: =(S48+T48)/2 -> 4.4150000000000009e-02 | AE48: =(T48+U48)/2 -> 0.24129999999999999 | AF48: =(U48+V48)/2 -> 0.3992 | AG48: =(V48+W48)/2 -> 0.62905 | AH48: =(W48+X48)/2 -> 0.62234999999999996 | AI48: =(X48+Y48)/2 -> 0.24485000000000001 | AJ48: =STDEV(G48:Y48) -> 0.18370304794575784
B49: 605117.SH | C49: 德业股份 | E49: 0.30969999999999998 | F49: 2.6400000000000001 | V49: 0.47289999999999999 | W49: 1.1667000000000001 | X49: 7.46e-02 | Y49: 0.21100000000000002 | AA49: =(N49+O49+P49+Q49+R49+S49+T49+U49+V49+W49+X49+Y49)/12 -> 0.16043333333333334 | AB49: =(G49+H49+I49+J49+K49+L49+M49+N49+O49+P49+Q49+R49+S49+T49+U49+V49+W49+X49+Y49)/19 -> 0.10132631578947369 | AC49: =(R49+S49)/2 -> 0 | AD49: =(S49+T49)/2 -> 0 | AE49: =(T49+U49)/2 -> 0 | AF49: =(U49+V49)/2 -> 0.23644999999999999 | AG49: =(V49+W49)/2 -> 0.81980000000000008 | AH49: =(W49+X49)/2 -> 0.62065000000000003 | AI49: =(X49+Y49)/2 -> 0.14280000000000001 | AJ49: =STDEV(G49:Y49) -> 0.48590489467247266
B50: 605499.SH | C50: 东鹏饮料 | U50: 0.38390000000000002 | V50: 1.2093 | W50: 0.50350000000000006 | X50: 0.34689999999999999 | Y50: 0.37959999999999999 | AA50: =(N50+O50+P50+Q50+R50+S50+T50+U50+V50+W50+X50+Y50)/12 -> 0.23526666666666665 | AB50: =(G50+H50+I50+J50+K50+L50+M50+N50+O50+P50+Q50+R50+S50+T50+U50+V50+W50+X50+Y50)/19 -> 0.14858947368421052 | AC50: =(R50+S50)/2 -> 0 | AD50: =(S50+T50)/2 -> 0 | AE50: =(T50+U50)/2 -> 0.19195000000000001 | AF50: =(U50+V50)/2 -> 0.79659999999999997 | AG50: =(V50+W50)/2 -> 0.85640000000000005 | AH50: =(W50+X50)/2 -> 0.42520000000000002 | AI50: =(X50+Y50)/2 -> 0.36324999999999996 | AJ50: =STDEV(G50:Y50) -> 0.3652540458365931
B51: 601155.SH | C51: 新城控股 | G51: 1.1818 | H51: 0.1333 | I51: 1.0454999999999999 | J51: 0.99260000000000004 | K51: 6.5 | L51: 1.2353000000000001 | M51: 0.55559999999999998 | N51: 0.73060000000000003 | O51: -0.40000000000000002 | P51: 1.7500000000000002e-02 | Q51: 0.19289999999999999 | R51: 0.19829999999999998 | S51: 0.33329999999999999 | T51: 0.22409999999999999 | U51: 0.26350000000000001 | V51: 0.2082 | W51: 1 | X51: 0.34509999999999996 | Y51: 0.23699999999999999 | AA51: =(N51+O51+P51+Q51+R51+S51+T51+U51+V51+W51+X51+Y51)/12 -> 0.27920833333333334 | AB51: =(G51+H51+I51+J51+K51+L51+M51+N51+O51+P51+Q51+R51+S51+T51+U51+V51+W51+X51+Y51)/19 -> 0.78918947368421055 | AC51: =(R51+S51)/2 -> 0.26579999999999998 | AD51: =(S51+T51)/2 -> 0.2787 | AE51: =(T51+U51)/2 -> 0.24380000000000002 | AF51: =(U51+V51)/2 -> 0.23585 | AG51: =(V51+W51)/2 -> 0.60409999999999997 | AH51: =(W51+X51)/2 -> 0.67254999999999998 | AI51: =(X51+Y51)/2 -> 0.29104999999999998 | AJ51: =STDEV(G51:Y51) -> 1.4522738917124789
B52: 600295.SH | C52: 鄂尔多斯 | G52: 0.22219999999999998 | H52: 0.45450000000000002 | I52: 0.94440000000000002 | J52: 0.92310000000000003 | K52: 0.81819999999999993 | L52: 0.6875 | M52: 0.45710000000000001 | N52: 0.83999999999999997 | O52: -0.10000000000000001 | P52: 0.85189999999999999 | Q52: 0.56859999999999999 | R52: 0.13039999999999999 | S52: -0.55559999999999998 | T52: -0.40000000000000002 | U52: -0.16250000000000001 | V52: 2.8799999999999999e-02 | W52: 5 | X52: 2.6667000000000001 | Y52: 2.8805999999999998 | AA52: =(N52+O52+P52+Q52+R52+S52+T52+U52+V52+W52+X52+Y52)/12 -> 0.97907499999999992 | AB52: =(G52+H52+I52+J52+K52+L52+M52+N52+O52+P52+Q52+R52+S52+T52+U52+V52+W52+X52+Y52)/19 -> 0.85557368421052638 | AC52: =(R52+S52)/2 -> -0.21260000000000001 | AD52: =(S52+T52)/2 -> -0.4778 | AE52: =(T52+U52)/2 -> -0.28125 | AF52: =(U52+V52)/2 -> -6.6850000000000007e-02 | AG52: =(V52+W52)/2 -> 2.5144000000000002 | AH52: =(W52+X52)/2 -> 3.8333500000000003 | AI52: =(X52+Y52)/2 -> 2.7736499999999999 | AJ52: =STDEV(G52:Y52) -> 1.336030433303617
B53: 605369.SH | C53: 拱东医疗 | E53: 0.35950000000000004 | F53: 2.0529999999999999 | G53: 0.36359999999999998 | H53: 0.32140000000000002 | I53: 0.38100000000000001 | J53: 0.23730000000000001 | K53: 0.5333 | L53: 0.18920000000000001 | M53: 0.1724 | N53: 0.1507 | O53: 4.3499999999999997e-02 | P53: 0.2727 | Q53: 0.72060000000000002 | R53: 0.8095 | S53: -0.16670000000000001 | T53: 1.7899999999999999e-02 | U53: 0 | V53: 0.19739999999999999 | W53: 1.5 | X53: 1.2631999999999999 | Y53: 0.81200000000000006 | AA53: =(N53+O53+P53+Q53+R53+S53+T53+U53+V53+W53+X53+Y53)/12 -> 0.46839999999999998 | AB53: =(G53+H53+I53+J53+K53+L53+M53+N53+O53+P53+Q53+R53+S53+T53+U53+V53+W53+X53+Y53)/19 -> 0.4115263157894738 | AC53: =(R53+S53)/2 -> 0.32140000000000002 | AD53: =(S53+T53)/2 -> -7.4400000000000008e-02 | AE53: =(T53+U53)/2 -> 8.9499999999999996e-03 | AF53: =(U53+V53)/2 -> 9.8699999999999996e-02 | AG53: =(V53+W53)/2 -> 0.84870000000000001 | AH53: =(W53+X53)/2 -> 1.3815999999999999 | AI53: =(X53+Y53)/2 -> 1.0375999999999999 | AJ53: =STDEV(G53:Y53) -> 0.43555808241599048
B54: 000028.SZ | C54: 国药一致 | G54: 6.6699999999999995e-02 | H54: -0.1656 | I54: -0.127 | J54: -0.11789999999999999 | K54: 6.25e-02 | L54: 0.15380000000000002 | M54: 0.15410000000000001 | N54: 0.1457 | O54: 2.9399999999999999e-02 | P54: 1.3300000000000001e-02 | Q54: 3.4599999999999999e-02 | R54: 4.5899999999999996e-02 | S54: -0.1714 | T54: -1.32e-02 | U54: 4.0199999999999993e-02 | V54: 0.1047 | W54: 0.3276 | X54: 0.15329999999999999 | Y54: 7.7300000000000008e-02 | AA54: =(N54+O54+P54+Q54+R54+S54+T54+U54+V54+W54+X54+Y54)/12 -> 6.561666666666667e-02 | AB54: =(G54+H54+I54+J54+K54+L54+M54+N54+O54+P54+Q54+R54+S54+T54+U54+V54+W54+X54+Y54)/19 -> 4.2842105263157897e-02 | AC54: =(R54+S54)/2 -> -6.275e-02 | AD54: =(S54+T54)/2 -> -9.2299999999999993e-02 | AE54: =(T54+U54)/2 -> 1.3499999999999996e-02 | AF54: =(U54+V54)/2 -> 7.2450000000000001e-02 | AG54: =(V54+W54)/2 -> 0.21615000000000001 | AH54: =(W54+X54)/2 -> 0.24045 | AI54: =(X54+Y54)/2 -> 0.1153 | AJ54: =STDEV(G54:Y54) -> 0.12535231822431736
B55: 603986.SH | C55: 兆易创新 | G55: -0.27160000000000001 | H55: 6.7699999999999996e-02 | I55: 0.30409999999999998 | J55: 0.33960000000000001 | K55: -8.199999999999999e-02 | L55: 0.3125 | M55: 8.0600000000000005e-02 | N55: 1.41e-02 | O55: -0.55770000000000008 | P55: -0.44049999999999995 | Q55: -0.16789999999999999 | R55: 0 | S55: 1.6676 | T55: 0.23399999999999999 | U55: -3.6699999999999997e-02 | V55: 0.32640000000000002 | W55: 0.69980000000000009 | X55: 1.0517000000000001 | Y55: 1.381 | AA55: =(N55+O55+P55+Q55+R55+S55+T55+U55+V55+W55+X55+Y55)/12 -> 0.34765000000000001 | AB55: =(G55+H55+I55+J55+K55+L55+M55+N55+O55+P55+Q55+R55+S55+T55+U55+V55+W55+X55+Y55)/19 -> 0.25908947368421059 | AC55: =(R55+S55)/2 -> 0.83379999999999999 | AD55: =(S55+T55)/2 -> 0.95079999999999998 | AE55: =(T55+U55)/2 -> 9.8649999999999988e-02 | AF55: =(U55+V55)/2 -> 0.14485000000000001 | AG55: =(V55+W55)/2 -> 0.51310000000000011 | AH55: =(W55+X55)/2 -> 0.87575000000000003 | AI55: =(X55+Y55)/2 -> 1.21635 | AJ55: =STDEV(G55:Y55) -> 0.58221578559341047 | AK55: 0.29880000000000001 | AL55: 0.40810000000000002 | AM55: 0.41110000000000002 | AN55: 0.32159999999999994 | AO55: 0.19989999999999999 | AP55: 0.15410000000000001 | AQ55: 0.11890000000000001 | AR55: 0.105 | AS55: -9.7899999999999987e-02 | AT55: 9.35e-02 | AU55: 0.28059999999999996 | AV55: 0.39929999999999999 | AW55: 0.84549999999999992 | AX55: 0.42060000000000003 | AY55: 0.37819999999999998 | AZ55: 0.44329999999999997 | BA55: 1.0891 | BB55: 1.1660999999999999 | BC55: 1.095 | BE55: =(AR55+AS55+AT55+AU55+AV55+AW55+AX55+AY55+AZ55+BA55+BB55+BC55)/12 -> 0.51819166666666661 | BF55: =(AK55+AL55+AM55+AN55+AO55+AP55+AQ55+AR55+AS55+AT55+AU55+AV55+AV55+AW55+AX55+AY55+AZ55+BA55+BB55+BC55)/19 -> 0.44895263157894744 | BG55: =(AV55+AW55)/2 -> 0.62239999999999995 | BH55: =(AW55+AX55)/2 -> 0.63305 | BI55: =(AX55+AY55)/2 -> 0.39939999999999998 | BJ55: =(AY55+AZ55)/2 -> 0.41074999999999995 | BK55: =(AZ55+BA55)/2 -> 0.76619999999999999 | BL55: =(BA55+BB55)/2 -> 1.1275999999999999 | BM55: =(BB55+BC55)/2 -> 1.1305499999999999 | BN55: =STDEV(AK55:BC55) -> 0.36289256477262172
B56: 002648.SZ | C56: 卫星化学 | E56: 0.60699999999999998 | F56: 2.4740000000000002 | G56: 102.71430000000001 | H56: 30.883600000000001 | I56: 5.5174000000000003 | J56: 1.6666999999999998 | K56: -0.69700000000000006 | L56: -0.48560000000000003 | M56: -0.26929999999999998 | N56: -0.14419999999999999 | O56: 0.90910000000000002 | P56: 0.6774 | Q56: 0.47460000000000002 | R56: 0.3483 | S56: -0.8095 | T56: -0.3846 | U56: -0.2989 | V56: 0.26669999999999999 | W56: 14.5 | X56: 2.875 | Y56: 3.0655000000000001 | AA56: =(N56+O56+P56+Q56+R56+S56+T56+U56+V56+W56+X56+Y56)/12 -> 1.7899499999999999 | AB56: =(G56+H56+I56+J56+K56+L56+M56+N56+O56+P56+Q56+R56+S56+T56+U56+V56+W56+X56+Y56)/19 -> 8.4636578947368406 | AC56: =(R56+S56)/2 -> -0.2306 | AD56: =(S56+T56)/2 -> -0.59704999999999997 | AE56: =(T56+U56)/2 -> -0.34175 | AF56: =(U56+V56)/2 -> -1.6100000000000003e-02 | AG56: =(V56+W56)/2 -> 7.3833500000000001 | AH56: =(W56+X56)/2 -> 8.6875 | AI56: =(X56+Y56)/2 -> 2.9702500000000001 | AJ56: =STDEV(G56:Y56) -> 24.045709466840115
B57: 603102.SH | C57: 百合股份 | Y57: 0.28120000000000001
B58: 600563.SH | C58: 法拉电子 | E58: 0.23710000000000001 | F58: 2.4500000000000002 | G58: -2.6499999999999999e-02 | H58: 6.3799999999999996e-02 | I58: 8.3100000000000007e-02 | J58: 8.6699999999999999e-02 | K58: 0.16889999999999999 | L58: 0.1353 | M58: 9.5399999999999985e-02 | N58: 6.9099999999999995e-02 | O58: 2.3300000000000001e-02 | P58: -2.7699999999999999e-02 | Q58: -6.5000000000000002e-02 | R58: 1.e-02 | S58: -5.9200000000000003e-02 | T58: 9.6799999999999997e-02 | U58: 0.20739999999999997 | V58: 0.2167 | W58: 0.77969999999999995 | X58: 0.58820000000000006 | Y58: 0.50309999999999999 | AA58: =(N58+O58+P58+Q58+R58+S58+T58+U58+V58+W58+X58+Y58)/12 -> 0.19520000000000001 | AB58: =(G58+H58+I58+J58+K58+L58+M58+N58+O58+P58+Q58+R58+S58+T58+U58+V58+W58+X58+Y58)/19 -> 0.15521578947368422 | AC58: =(R58+S58)/2 -> -2.46e-02 | AD58: =(S58+T58)/2 -> 1.8799999999999997e-02 | AE58: =(T58+U58)/2 -> 0.15209999999999999 | AF58: =(U58+V58)/2 -> 0.21204999999999999 | AG58: =(V58+W58)/2 -> 0.49819999999999998 | AH58: =(W58+X58)/2 -> 0.68395000000000006 | AI58: =(X58+Y58)/2 -> 0.54564999999999997 | AJ58: =STDEV(G58:Y58) -> 0.22823747686993304
B59: 002913.SZ | C59: 奥士康 | I59: -0.18109999999999998 | J59: -0.11359999999999999 | K59: -0.29549999999999998 | L59: 4.3499999999999997e-02 | M59: 0.2306 | N59: 6.4100000000000004e-02 | O59: 6.4500000000000002e-02 | P59: -5.5599999999999997e-02 | Q59: 0.11720000000000001 | R59: 0.1084 | S59: -0.48479999999999995 | T59: 0.19120000000000001 | U59: 8.3900000000000002e-02 | V59: 0.30430000000000001 | W59: 3.2352999999999996 | X59: 1 | Y59: 0.56130000000000002 | AA59: =(N59+O59+P59+Q59+R59+S59+T59+U59+V59+W59+X59+Y59)/12 -> 0.43248333333333333 | AB59: =(G59+H59+I59+J59+K59+L59+M59+N59+O59+P59+Q59+R59+S59+T59+U59+V59+W59+X59+Y59)/19 -> 0.25651052631578947 | AC59: =(R59+S59)/2 -> -0.18819999999999998 | AD59: =(S59+T59)/2 -> -0.14679999999999999 | AE59: =(T59+U59)/2 -> 0.13755000000000001 | AF59: =(U59+V59)/2 -> 0.19409999999999999 | AG59: =(V59+W59)/2 -> 1.7697999999999998 | AH59: =(W59+X59)/2 -> 2.1176499999999998 | AI59: =(X59+Y59)/2 -> 0.78065000000000007 | AJ59: =STDEV(G59:Y59) -> 0.82844565896197497
B60: 603129.SH | C60: 春风动力 | G60: 0.875 | H60: 0.52500000000000002 | I60: 0.2742 | J60: 0 | K60: -0.59999999999999998 | L60: -0.13109999999999999 | M60: -8.8599999999999998e-02 | N60: 2.2700000000000001e-02 | O60: 0.33329999999999999 | P60: 0.45280000000000004 | Q60: 0.45829999999999999 | R60: 0.5222 | S60: 1.75 | T60: 0.72730000000000006 | U60: 1.1523999999999999 | V60: 1.0292000000000001 | W60: 0.63639999999999997 | X60: 0.26319999999999999 | Y60: 7.0800000000000002e-02 | AA60: =(N60+O60+P60+Q60+R60+S60+T60+U60+V60+W60+X60+Y60)/12 -> 0.61821666666666675 | AB60: =(G60+H60+I60+J60+K60+L60+M60+N60+O60+P60+Q60+R60+S60+T60+U60+V60+W60+X60+Y60)/19 -> 0.43542631578947377 | AC60: =(R60+S60)/2 -> 1.1360999999999999 | AD60: =(S60+T60)/2 -> 1.23865 | AE60: =(T60+U60)/2 -> 0.93984999999999996 | AF60: =(U60+V60)/2 -> 1.0908 | AG60: =(V60+W60)/2 -> 0.83279999999999998 | AH60: =(W60+X60)/2 -> 0.44979999999999998 | AI60: =(X60+Y60)/2 -> 0.16699999999999998 | AJ60: =STDEV(G60:Y60) -> 0.53523341932085555
B61: 603393.SH | C61: 新天然气 | G61: -7.8899999999999998e-02 | H61: 4.5499999999999999e-02 | I61: -4.0000000000000001e-02 | J61: 5.7699999999999994e-02 | K61: 0.31430000000000002 | L61: -7.2499999999999995e-02 | M61: -0.1875 | N61: -9.6999999999999989e-02 | O61: 4.3499999999999997e-02 | P61: -0.21879999999999999 | Q61: 0.1026 | R61: -9.4e-02 | S61: -0.22920000000000001 | T61: -8.0000000000000002e-02 | U61: -0.27910000000000001 | V61: -0.15560000000000002 | W61: 4.5945999999999998 | X61: 3.6522000000000001 | Y61: 2.8870999999999998 | AA61: =(N61+O61+P61+Q61+R61+S61+T61+U61+V61+W61+X61+Y61)/12 -> 0.84385833333333338 | AB61: =(G61+H61+I61+J61+K61+L61+M61+N61+O61+P61+Q61+R61+S61+T61+U61+V61+W61+X61+Y61)/19 -> 0.53499473684210519 | AC61: =(R61+S61)/2 -> -0.16160000000000002 | AD61: =(S61+T61)/2 -> -0.15460000000000002 | AE61: =(T61+U61)/2 -> -0.17955000000000002 | AF61: =(U61+V61)/2 -> -0.21735000000000002 | AG61: =(V61+W61)/2 -> 2.2195 | AH61: =(W61+X61)/2 -> 4.1234000000000002 | AI61: =(X61+Y61)/2 -> 3.2696499999999999 | AJ61: =STDEV(G61:Y61) -> 1.4479505134552095
B62: 000039.SZ | C62: 中集集团 | G62: 0.25790000000000002 | H62: 2.7686999999999999 | I62: 5.6626000000000003 | J62: 4.7857000000000003 | K62: -0.13239999999999999 | L62: -1.1999999999999999e-03 | M62: 0.51060000000000005 | N62: 0.1358 | O62: -0.29520000000000002 | P62: -0.36570000000000003 | Q62: -0.78549999999999998 | R62: -0.5978 | S62: -2.9426000000000001 | T62: -1.5197999999999998 | U62: 3.0200000000000001e-02 | V62: 2.8108 | W62: 3.1000999999999999 | X62: 14.879899999999999 | Y62: 16.2074 | AA62: =(N62+O62+P62+Q62+R62+S62+T62+U62+V62+W62+X62+Y62)/12 -> 2.5547999999999997 | AB62: =(G62+H62+I62+J62+K62+L62+M62+N62+O62+P62+Q62+R62+S62+T62+U62+V62+W62+X62+Y62)/19 -> 2.3426052631578944 | AC62: =(R62+S62)/2 -> -1.7702 | AD62: =(S62+T62)/2 -> -2.2311999999999999 | AE62: =(T62+U62)/2 -> -0.74479999999999991 | AF62: =(U62+V62)/2 -> 1.4204999999999999 | AG62: =(V62+W62)/2 -> 2.9554499999999999 | AH62: =(W62+X62)/2 -> 8.9900000000000002 | AI62: =(X62+Y62)/2 -> 15.54365 | AJ62: =STDEV(G62:Y62) -> 5.123453590377153 | AK62: 6.7199999999999996e-02 | AL62: 0.2195 | AM62: 0.30990000000000001 | AN62: 0.53129999999999999 | AO62: 0.41070000000000001 | AP62: 0.35170000000000001 | AQ62: 0.30380000000000001 | AR62: 0.18559999999999999 | AS62: 1.78e-02 | AT62: -3.0699999999999998e-02 | AU62: -6.6299999999999998e-02 | AV62: -4.2900000000000001e-02 | AW62: -0.21109999999999998 | AX62: -9.6600000000000005e-02 | AY62: -1.6399999999999998e-02 | AZ62: 0.10890000000000001 | BA62: 0.70129999999999992 | BB62: 0.60709999999999997 | BC62: 0.71290000000000009 | BE62: =(AR62+AS62+AT62+AU62+AV62+AW62+AX62+AY62+AZ62+BA62+BB62+BC62)/12 -> 0.15579999999999999 | BF62: =(AK62+AL62+AM62+AN62+AO62+AP62+AQ62+AR62+AS62+AT62+AU62+AV62+AV62+AW62+AX62+AY62+AZ62+BA62+BB62+BC62)/19 -> 0.21162105263157893 | BG62: =(AV62+AW62)/2 -> -0.127 | BH62: =(AW62+AX62)/2 -> -0.15384999999999999 | BI62: =(AX62+AY62)/2 -> -5.6500000000000002e-02 | BJ62: =(AY62+AZ62)/2 -> 4.6250000000000006e-02 | BK62: =(AZ62+BA62)/2 -> 0.40509999999999996 | BL62: =(BA62+BB62)/2 -> 0.65419999999999989 | BM62: =(BB62+BC62)/2 -> 0.66000000000000003 | BN62: =STDEV(AK62:BC62) -> 0.28118005022276182
B63: 002049.SZ | C63: 紫光国微 | G63: -0.14880000000000002 | H63: -0.1784 | I63: -0.22899999999999998 | J63: -0.16739999999999999 | K63: -0.11349999999999999 | L63: -3.0499999999999999e-02 | M63: 0.35060000000000002 | N63: 0.24329999999999999 | O63: 0.41490000000000005 | P63: 0.61020000000000008 | Q63: 0.26869999999999999 | R63: 0.16620000000000001 | S63: 1.8344 | T63: 1.085 | U63: 0.87519999999999998 | V63: 0.98730000000000007 | W63: 0.70340000000000003 | X63: 1.1782999999999999 | Y63: 1.129 | AA63: =(N63+O63+P63+Q63+R63+S63+T63+U63+V63+W63+X63+Y63)/12 -> 0.79132499999999995 | AB63: =(G63+H63+I63+J63+K63+L63+M63+N63+O63+P63+Q63+R63+S63+T63+U63+V63+W63+X63+Y63)/19 -> 0.47257368421052637 | AC63: =(R63+S63)/2 -> 1.0003 | AD63: =(S63+T63)/2 -> 1.4597 | AE63: =(T63+U63)/2 -> 0.98009999999999997 | AF63: =(U63+V63)/2 -> 0.93125000000000002 | AG63: =(V63+W63)/2 -> 0.84535000000000005 | AH63: =(W63+X63)/2 -> 0.94084999999999996 | AI63: =(X63+Y63)/2 -> 1.1536499999999998 | AJ63: =STDEV(G63:Y63) -> 0.58557967371571717 | AK63: 0.47820000000000001 | AL63: 0.27060000000000001 | AM63: 0.31170000000000003 | AN63: 0.3306 | AO63: -1.2500000000000001e-02 | AP63: 7.2000000000000008e-02 | AQ63: 0.1353 | AR63: 0.3271 | AS63: 0.24829999999999999 | AT63: 0.37240000000000001 | AU63: 0.32020000000000004 | AV63: 0.2843 | AW63: -0.185 | AX63: -0.2482 | AY63: -0.13849999999999998 | AZ63: -0.14180000000000001 | BA63: 0.83479999999999999 | BB63: 0.88329999999999997 | BC63: 0.66980000000000006 | BE63: =(AR63+AS63+AT63+AU63+AV63+AW63+AX63+AY63+AZ63+BA63+BB63+BC63)/12 -> 0.26889166666666664 | BF63: =(AK63+AL63+AM63+AN63+AO63+AP63+AQ63+AR63+AS63+AT63+AU63+AV63+AV63+AW63+AX63+AY63+AZ63+BA63+BB63+BC63)/19 -> 0.26825789473684214 | BG63: =(AV63+AW63)/2 -> 4.965e-02 | BH63: =(AW63+AX63)/2 -> -0.21660000000000001 | BI63: =(AX63+AY63)/2 -> -0.19334999999999999 | BJ63: =(AY63+AZ63)/2 -> -0.14015 | BK63: =(AZ63+BA63)/2 -> 0.34649999999999997 | BL63: =(BA63+BB63)/2 -> 0.85904999999999998 | BM63: =(BB63+BC63)/2 -> 0.77655000000000007 | BN63: =STDEV(AK63:BC63) -> 0.32184677422940156
A64: JBM_20220223 | B64: 002142.SZ | C64: 宁波银行 | E64: 0.78000000000000003 | F64: 3.1200000000000001 | G64: -0.11539999999999999 | H64: 0.14630000000000001 | I64: 0.16 | J64: 0.20000000000000001 | K64: 0.21739999999999998 | L64: 0.19149999999999998 | M64: 0.21379999999999999 | N64: 0.19440000000000002 | O64: 0.16070000000000001 | P64: 0.1696 | Q64: 0.1477 | R64: 0.12089999999999999 | S64: 9.2300000000000007e-02 | T64: 3.8199999999999998e-02 | U64: -4.4600000000000001e-02 | V64: 8.3000000000000001e-03 | W64: 0.11269999999999999 | X64: 0.1618 | Y64: 0.23319999999999999 | AA64: =(N64+O64+P64+Q64+R64+S64+T64+U64+V64+W64+X64+Y64)/12 -> 0.11626666666666668 | AB64: =(G64+H64+I64+J64+K64+L64+M64+N64+O64+P64+Q64+R64+S64+T64+U64+V64+W64+X64+Y64)/19 -> 0.12677894736842107 | AC64: =(R64+S64)/2 -> 0.1066 | AD64: =(S64+T64)/2 -> 6.5250000000000002e-02 | AE64: =(T64+U64)/2 -> -3.2000000000000015e-03 | AF64: =(U64+V64)/2 -> -1.8149999999999999e-02 | AG64: =(V64+W64)/2 -> 6.0499999999999998e-02 | AH64: =(W64+X64)/2 -> 0.13724999999999998 | AI64: =(X64+Y64)/2 -> 0.19750000000000001 | AJ64: =STDEV(G64:Y64) -> 9.3894926965952322e-02 | AK64: -0.81099999999999994 | AL64: -0.80180000000000007 | AM64: -0.74790000000000001 | AN64: -0.62369999999999992 | AO64: 1.9638 | AP64: 0.99650000000000005 | AQ64: 0.95299999999999996 | AR64: 0.3261 | AS64: 0.93200000000000005 | AT64: 0.88749999999999996 | AU64: 1.2419 | AV64: 0.96709999999999996 | AW64: 0.53439999999999999 | AX64: 0.46750000000000003 | AY64: 0.42579999999999996 | AZ64: 0.59950000000000003 | BA64: -0.56499999999999995 | BB64: -0.44280000000000003 | BC64: -0.39280000000000004 | BE64: =(AR64+AS64+AT64+AU64+AV64+AW64+AX64+AY64+AZ64+BA64+BB64+BC64)/12 -> 0.41510000000000002 | BF64: =(AK64+AL64+AM64+AN64+AO64+AP64+AQ64+AR64+AS64+AT64+AU64+AV64+AV64+AW64+AX64+AY64+AZ64+BA64+BB64+BC64)/19 -> 0.36195789473684215 | BG64: =(AV64+AW64)/2 -> 0.75075000000000003 | BH64: =(AW64+AX64)/2 -> 0.50095000000000001 | BI64: =(AX64+AY64)/2 -> 0.44664999999999999 | BJ64: =(AY64+AZ64)/2 -> 0.51265000000000005 | BK64: =(AZ64+BA64)/2 -> 1.7250000000000043e-02 | BL64: =(BA64+BB64)/2 -> -0.50390000000000001 | BM64: =(BB64+BC64)/2 -> -0.41780000000000006 | BN64: =STDEV(AK64:BC64) -> 0.82066918583135517
B65: 603486.SH | C65: 科沃斯 | L65: -0.11109999999999999 | M65: -0.10000000000000001 | N65: -0.1346 | O65: -0.5 | P65: -0.42499999999999999 | Q65: -0.66670000000000007 | R65: -0.75560000000000005 | S65: -0.46149999999999997 | T65: 4.3499999999999997e-02 | U65: 1.5 | V65: 4.1818 | W65: 7.4286000000000003 | X65: 5.3333000000000004 | Y65: 4.2888999999999999 | AA65: =(N65+O65+P65+Q65+R65+S65+T65+U65+V65+W65+X65+Y65)/12 -> 1.6527250000000002 | AB65: =(G65+H65+I65+J65+K65+L65+M65+N65+O65+P65+Q65+R65+S65+T65+U65+V65+W65+X65+Y65)/19 -> 1.0327157894736843 | AC65: =(R65+S65)/2 -> -0.60855000000000004 | AD65: =(S65+T65)/2 -> -0.20899999999999999 | AE65: =(T65+U65)/2 -> 0.77175000000000005 | AF65: =(U65+V65)/2 -> 2.8409 | AG65: =(V65+W65)/2 -> 5.8052000000000001 | AH65: =(W65+X65)/2 -> 6.3809500000000003 | AI65: =(X65+Y65)/2 -> 4.8110999999999997 | AJ65: =STDEV(G65:Y65) -> 2.716915220419116
B66: 600188.SH | C66: 兖矿能源 | E66: 0.68310000000000004 | F66: 2.3759999999999999 | G66: 6.1848999999999998 | H66: 4.4697000000000005 | I66: 3.7702999999999998 | J66: 2.1319999999999997 | K66: 0.25480000000000003 | L66: 0.34090000000000004 | M66: 0.13369999999999999 | N66: 0.1681 | O66: 3.6200000000000003e-02 | P66: 0.2349 | Q66: 0.26890000000000003 | R66: 0.25409999999999999 | S66: -0.25090000000000001 | T66: -7.4999999999999997e-03 | U66: 4.0000000000000001e-03 | V66: -0.27750000000000002 | W66: 0.31480000000000002 | X66: 0.14829999999999999 | Y66: 0.66439999999999999 | AA66: =(N66+O66+P66+Q66+R66+S66+T66+U66+V66+W66+X66+Y66)/12 -> 0.12981666666666666 | AB66: =(G66+H66+I66+J66+K66+L66+M66+N66+O66+P66+Q66+R66+S66+T66+U66+V66+W66+X66+Y66)/19 -> 0.99179473684210528 | AC66: =(R66+S66)/2 -> 1.5999999999999903e-03 | AD66: =(S66+T66)/2 -> -0.12920000000000001 | AE66: =(T66+U66)/2 -> -1.7499999999999998e-03 | AF66: =(U66+V66)/2 -> -0.13675000000000001 | AG66: =(V66+W66)/2 -> 1.865e-02 | AH66: =(W66+X66)/2 -> 0.23155000000000001 | AI66: =(X66+Y66)/2 -> 0.40634999999999999 | AJ66: =STDEV(G66:Y66) -> 1.8169799914735452 | AK66: 4.5616000000000003 | AL66: 2.4878999999999998 | AM66: 0.80469999999999997 | AN66: 0.50719999999999998 | AO66: -0.13600000000000001 | AP66: -0.11800000000000001 | AQ66: 7.8000000000000005e-03 | AR66: 3.0200000000000001e-02 | AS66: 0.39929999999999999 | AT66: 0.40360000000000001 | AU66: 0.27800000000000002 | AV66: 0.31620000000000004 | AW66: -7.2700000000000001e-02 | AX66: 9.7699999999999995e-02 | AY66: -0.1173 | AZ66: -3.5999999999999999e-03 | BA66: -0.38919999999999999 | BB66: -0.50270000000000004 | BC66: -3.27e-02 | BE66: =(AR66+AS66+AT66+AU66+AV66+AW66+AX66+AY66+AZ66+BA66+BB66+BC66)/12 -> 3.3899999999999993e-02 | BF66: =(AK66+AL66+AM66+AN66+AO66+AP66+AQ66+AR66+AS66+AT66+AU66+AV66+AV66+AW66+AX66+AY66+AZ66+BA66+BB66+BC66)/19 -> 0.46516842105263162 | BG66: =(AV66+AW66)/2 -> 0.12175000000000002 | BH66: =(AW66+AX66)/2 -> 1.2499999999999997e-02 | BI66: =(AX66+AY66)/2 -> -9.8000000000000032e-03 | BJ66: =(AY66+AZ66)/2 -> -6.0450000000000004e-02 | BK66: =(AZ66+BA66)/2 -> -0.19639999999999999 | BL66: =(BA66+BB66)/2 -> -0.44595000000000001 | BM66: =(BB66+BC66)/2 -> -0.26769999999999999 | BN66: =STDEV(AK66:BC66) -> 1.179621937007364
B67: 601601.SH | C67: 中国太保 | G67: -8.3299999999999999e-02 | H67: 5.8799999999999998e-02 | I67: 0.24739999999999998 | J67: 0.218 | K67: 0.86360000000000003 | L67: 0.26390000000000002 | M67: 0.157 | N67: 0.22839999999999999 | O67: 0.46340000000000003 | P67: 0.96700000000000008 | Q67: 0.80709999999999993 | R67: 0.53770000000000007 | S67: 0.55000000000000004 | T67: -0.1229 | U67: -0.16210000000000002 | V67: -0.14050000000000001 | W67: -4.2999999999999997e-02 | X67: 0.14649999999999999 | Y67: 0.11320000000000001 | AA67: =(N67+O67+P67+Q67+R67+S67+T67+U67+V67+W67+X67+Y67)/12 -> 0.27873333333333333 | AB67: =(G67+H67+I67+J67+K67+L67+M67+N67+O67+P67+Q67+R67+S67+T67+U67+V67+W67+X67+Y67)/19 -> 0.26685263157894734 | AC67: =(R67+S67)/2 -> 0.54385000000000006 | AD67: =(S67+T67)/2 -> 0.21355000000000002 | AE67: =(T67+U67)/2 -> -0.14250000000000002 | AF67: =(U67+V67)/2 -> -0.15130000000000002 | AG67: =(V67+W67)/2 -> -9.1749999999999998e-02 | AH67: =(W67+X67)/2 -> 5.1749999999999997e-02 | AI67: =(X67+Y67)/2 -> 0.12984999999999999 | AJ67: =STDEV(G67:Y67) -> 0.34548688891093499
B68: 600694.SH | C68: 大商股份 | G68: 0.12 | H68: 1.72e-02 | I68: -4.5000000000000005e-03 | J68: 0.24690000000000001 | K68: 7.1399999999999991e-02 | L68: 0.18079999999999999 | M68: 0.21359999999999998 | N68: 0.1275 | O68: 0.10000000000000001 | P68: 3.3500000000000002e-02 | Q68: 6.7400000000000002e-02 | R68: -9.5199999999999993e-02 | S68: -0.85609999999999997 | T68: -0.56020000000000003 | U68: -0.47369999999999995 | V68: -0.44079999999999997 | W68: 4.2104999999999997 | X68: 0.80000000000000004 | Y68: 0.5 | AA68: =(N68+O68+P68+Q68+R68+S68+T68+U68+V68+W68+X68+Y68)/12 -> 0.28440833333333332 | AB68: =(G68+H68+I68+J68+K68+L68+M68+N68+O68+P68+Q68+R68+S68+T68+U68+V68+W68+X68+Y68)/19 -> 0.22412105263157897 | AC68: =(R68+S68)/2 -> -0.47564999999999996 | AD68: =(S68+T68)/2 -> -0.70815000000000006 | AE68: =(T68+U68)/2 -> -0.51695000000000002 | AF68: =(U68+V68)/2 -> -0.45724999999999993 | AG68: =(V68+W68)/2 -> 1.8848499999999999 | AH68: =(W68+X68)/2 -> 2.5052499999999998 | AI68: =(X68+Y68)/2 -> 0.65000000000000002 | AJ68: =STDEV(G68:Y68) -> 1.036270951043504
B69: 600141.SH | C69: 兴发集团 | G69: 0.25 | H69: 0.85709999999999997 | I69: 1.1093000000000002 | J69: 1.4000999999999999 | K69: 2.0857000000000001 | L69: 0.74769999999999992 | M69: 0.57240000000000002 | N69: 0.1787 | O69: -0.53700000000000003 | P69: -0.41240000000000004 | Q69: -0.30109999999999998 | R69: -0.32650000000000001 | S69: -0.59999999999999998 | T69: 0 | U69: 3.4999999999999996e-03 | V69: 0.84849999999999992 | W69: 15 | X69: 6.6403999999999996 | Y69: 5.3712 | AA69: =(N69+O69+P69+Q69+R69+S69+T69+U69+V69+W69+X69+Y69)/12 -> 2.1554416666666665 | AB69: =(G69+H69+I69+J69+K69+L69+M69+N69+O69+P69+Q69+R69+S69+T69+U69+V69+W69+X69+Y69)/19 -> 1.7309263157894736 | AC69: =(R69+S69)/2 -> -0.46325 | AD69: =(S69+T69)/2 -> -0.29999999999999999 | AE69: =(T69+U69)/2 -> 1.7499999999999998e-03 | AF69: =(U69+V69)/2 -> 0.42599999999999993 | AG69: =(V69+W69)/2 -> 7.9242499999999998 | AH69: =(W69+X69)/2 -> 10.8202 | AI69: =(X69+Y69)/2 -> 6.0057999999999998 | AJ69: =STDEV(G69:Y69) -> 3.7417396589527865
B70: 603599.SH | C70: 广信股份 | E70: 0.30260000000000004 | F70: 2.2229999999999999 | G70: 0.26669999999999999 | H70: 0.55559999999999998 | I70: 0.9487000000000001 | J70: 0.875 | K70: 0.26319999999999999 | L70: 0.1905 | M70: 6.5799999999999997e-02 | N70: 0.1222 | O70: 0.20829999999999999 | P70: 0.10000000000000001 | Q70: 9.8800000000000013e-02 | R70: 7.9199999999999993e-02 | S70: -0.13789999999999999 | T70: 0.1091 | U70: 5.62e-02 | V70: 0.16510000000000002 | W70: 1.4399999999999999 | X70: 1.2295 | Y70: 1.3616999999999999 | AA70: =(N70+O70+P70+Q70+R70+S70+T70+U70+V70+W70+X70+Y70)/12 -> 0.40268333333333334 | AB70: =(G70+H70+I70+J70+K70+L70+M70+N70+O70+P70+Q70+R70+S70+T70+U70+V70+W70+X70+Y70)/19 -> 0.42093157894736838 | AC70: =(R70+S70)/2 -> -2.9350000000000001e-02 | AD70: =(S70+T70)/2 -> -1.4399999999999996e-02 | AE70: =(T70+U70)/2 -> 8.2650000000000001e-02 | AF70: =(U70+V70)/2 -> 0.11065000000000001 | AG70: =(V70+W70)/2 -> 0.80254999999999999 | AH70: =(W70+X70)/2 -> 1.3347500000000001 | AI70: =(X70+Y70)/2 -> 1.2955999999999999 | AJ70: =STDEV(G70:Y70) -> 0.49295453932006478
B71: 000799.SZ | C71: 酒鬼酒 | G71: 0.31030000000000002 | H71: 1.1367 | I71: 0.77729999999999999 | J71: 0.62180000000000002 | K71: 0.68859999999999999 | L71: 0.38319999999999999 | M71: 0.38319999999999999 | N71: 0.26440000000000002 | O71: 0.16159999999999999 | P71: 0.36130000000000001 | Q71: 0.14269999999999999 | R71: 0.34499999999999997 | S71: 0.32250000000000001 | T71: 0.18410000000000001 | U71: 0.79760000000000009 | V71: 0.64150000000000007 | W71: 1.7883000000000002 | X71: 1.7656000000000001 | Y71: 1.1769000000000001 | AA71: =(N71+O71+P71+Q71+R71+S71+T71+U71+V71+W71+X71+Y71)/12 -> 0.66262500000000002 | AB71: =(G71+H71+I71+J71+K71+L71+M71+N71+O71+P71+Q71+R71+S71+T71+U71+V71+W71+X71+Y71)/19 -> 0.64487368421052615 | AC71: =(R71+S71)/2 -> 0.33374999999999999 | AD71: =(S71+T71)/2 -> 0.25330000000000003 | AE71: =(T71+U71)/2 -> 0.49085000000000006 | AF71: =(U71+V71)/2 -> 0.71955000000000013 | AG71: =(V71+W71)/2 -> 1.2149000000000001 | AH71: =(W71+X71)/2 -> 1.7769500000000003 | AI71: =(X71+Y71)/2 -> 1.4712499999999999 | AJ71: =STDEV(G71:Y71) -> 0.49987039858358989
B72: 002791.SZ | C72: 坚朗五金 | G72: 2 | H72: -0.35999999999999999 | I72: -3.3300000000000003e-02 | J72: -0.28050000000000003 | K72: -10 | L72: -0.6875 | M72: -0.37929999999999997 | N72: -8.4700000000000011e-02 | O72: 1.2222 | P72: 2.7999999999999998 | Q72: 1.3611000000000002 | R72: 1.5741000000000001 | S72: 0.5 | T72: 0.89469999999999994 | U72: 0.83530000000000004 | V72: 0.82730000000000004 | W72: 3.3332999999999999 | X72: 0.63890000000000002 | Y72: 0.40380000000000005 | AA72: =(N72+O72+P72+Q72+R72+S72+T72+U72+V72+W72+X72+Y72)/12 -> 1.1921666666666666 | AB72: =(G72+H72+I72+J72+K72+L72+M72+N72+O72+P72+Q72+R72+S72+T72+U72+V72+W72+X72+Y72)/19 -> 0.24028421052631571 | AC72: =(R72+S72)/2 -> 1.03705 | AD72: =(S72+T72)/2 -> 0.69734999999999991 | AE72: =(T72+U72)/2 -> 0.86499999999999999 | AF72: =(U72+V72)/2 -> 0.83130000000000004 | AG72: =(V72+W72)/2 -> 2.0802999999999998 | AH72: =(W72+X72)/2 -> 1.9861 | AI72: =(X72+Y72)/2 -> 0.52134999999999998 | AJ72: =STDEV(G72:Y72) -> 2.7030335561823784
B73: 605111.SH | C73: 新洁能 | T73: 6.1200000000000004e-02 | U73: 0.14460000000000001 | V73: 0.31010000000000004 | W73: 1.3125 | X73: 1.3653999999999999 | Y73: 1.3052999999999999 | AA73: =(N73+O73+P73+Q73+R73+S73+T73+U73+V73+W73+X73+Y73)/12 -> 0.37492500000000001 | AB73: =(G73+H73+I73+J73+K73+L73+M73+N73+O73+P73+Q73+R73+S73+T73+U73+V73+W73+X73+Y73)/19 -> 0.23679473684210528 | AC73: =(R73+S73)/2 -> 0 | AD73: =(S73+T73)/2 -> 3.0600000000000002e-02 | AE73: =(T73+U73)/2 -> 0.10290000000000001 | AF73: =(U73+V73)/2 -> 0.22735000000000002 | AG73: =(V73+W73)/2 -> 0.81130000000000002 | AH73: =(W73+X73)/2 -> 1.3389500000000001 | AI73: =(X73+Y73)/2 -> 1.33535 | AJ73: =STDEV(G73:Y73) -> 0.63842743910330169
B74: 600132.SH | C74: 重庆啤酒 | G74: 1 | H74: 0.65000000000000002 | I74: 0.20370000000000002 | J74: 0.83779999999999999 | K74: 0.59999999999999998 | L74: 0.30299999999999999 | M74: 0.21539999999999998 | N74: 0.22059999999999999 | O74: 0.125 | P74: 0.13949999999999999 | Q74: 0.55700000000000005 | R74: 1.5903999999999998 | S74: 0.61109999999999998 | T74: 1.7143000000000002 | U74: 0.78859999999999997 | V74: 3.7200000000000004e-02 | W74: 1.1033999999999999 | X74: -3.0099999999999998e-02 | Y74: -1.8200000000000001e-02 | AA74: =(N74+O74+P74+Q74+R74+S74+T74+U74+V74+W74+X74+Y74)/12 -> 0.56989999999999996 | AB74: =(G74+H74+I74+J74+K74+L74+M74+N74+O74+P74+Q74+R74+S74+T74+U74+V74+W74+X74+Y74)/19 -> 0.56045789473684215 | AC74: =(R74+S74)/2 -> 1.1007499999999999 | AD74: =(S74+T74)/2 -> 1.1627000000000001 | AE74: =(T74+U74)/2 -> 1.2514500000000002 | AF74: =(U74+V74)/2 -> 0.41289999999999999 | AG74: =(V74+W74)/2 -> 0.57029999999999992 | AH74: =(W74+X74)/2 -> 0.53664999999999996 | AI74: =(X74+Y74)/2 -> -2.4149999999999998e-02 | AJ74: =STDEV(G74:Y74) -> 0.51497582393716901
B75: 603217.SH | C75: 元利科技 | P75: -0.50080000000000002 | Q75: -0.61039999999999994 | R75: -0.65540000000000009 | S75: -0.65410000000000001 | T75: -0.40759999999999996 | U75: -0.24149999999999999 | V75: 1.6399999999999998e-02 | W75: 1.9227000000000001 | X75: 1.5284 | Y75: 1.4696 | AA75: =(N75+O75+P75+Q75+R75+S75+T75+U75+V75+W75+X75+Y75)/12 -> 0.15560833333333335 | AB75: =(G75+H75+I75+J75+K75+L75+M75+N75+O75+P75+Q75+R75+S75+T75+U75+V75+W75+X75+Y75)/19 -> 9.8278947368421063e-02 | AC75: =(R75+S75)/2 -> -0.65475000000000005 | AD75: =(S75+T75)/2 -> -0.53085000000000004 | AE75: =(T75+U75)/2 -> -0.32455000000000001 | AF75: =(U75+V75)/2 -> -0.11255 | AG75: =(V75+W75)/2 -> 0.96955000000000002 | AH75: =(W75+X75)/2 -> 1.7255500000000001 | AI75: =(X75+Y75)/2 -> 1.4990000000000001 | AJ75: =STDEV(G75:Y75) -> 1.0300668166569475
B76: 000581.SZ | C76: 威孚高科 | G76: 0.59999999999999998 | H76: 0.39360000000000001 | I76: 0.41539999999999999 | J76: 0.53610000000000002 | K76: 0.21879999999999999 | L76: 0.16789999999999999 | M76: 0.10869999999999999 | N76: -7.0599999999999996e-02 | O76: -0.12820000000000001 | P76: -0.183 | Q76: -0.1618 | R76: -5.0599999999999999e-02 | S76: -0.19120000000000001 | T76: 5.5999999999999994e-02 | U76: 0.30990000000000001 | V76: 0.23999999999999999 | W76: 0.58179999999999998 | X76: 0.2576 | Y76: -4.0199999999999993e-02 | AA76: =(N76+O76+P76+Q76+R76+S76+T76+U76+V76+W76+X76+Y76)/12 -> 5.1641666666666662e-02 | AB76: =(G76+H76+I76+J76+K76+L76+M76+N76+O76+P76+Q76+R76+S76+T76+U76+V76+W76+X76+Y76)/19 -> 0.1610631578947368 | AC76: =(R76+S76)/2 -> -0.12090000000000001 | AD76: =(S76+T76)/2 -> -6.7600000000000007e-02 | AE76: =(T76+U76)/2 -> 0.18295 | AF76: =(U76+V76)/2 -> 0.27495000000000003 | AG76: =(V76+W76)/2 -> 0.41089999999999999 | AH76: =(W76+X76)/2 -> 0.41969999999999996 | AI76: =(X76+Y76)/2 -> 0.1087 | AJ76: =STDEV(G76:Y76) -> 0.26387287387537856
B77: 601677.SH | C77: 明泰铝业 | E77: 0.35950000000000004 | F77: 2.0529999999999999 | G77: 0.36359999999999998 | H77: 0.32140000000000002 | I77: 0.38100000000000001 | J77: 0.23730000000000001 | K77: 0.5333 | L77: 0.18920000000000001 | M77: 0.1724 | N77: 0.1507 | O77: 4.3499999999999997e-02 | P77: 0.2727 | Q77: 0.72060000000000002 | R77: 0.8095 | S77: -0.16670000000000001 | T77: 1.7899999999999999e-02 | U77: 0 | V77: 0.19739999999999999 | W77: 1.5 | X77: 1.2631999999999999 | Y77: 0.81200000000000006 | AA77: =(N77+O77+P77+Q77+R77+S77+T77+U77+V77+W77+X77+Y77)/12 -> 0.46839999999999998 | AB77: =(G77+H77+I77+J77+K77+L77+M77+N77+O77+P77+Q77+R77+S77+T77+U77+V77+W77+X77+Y77)/19 -> 0.4115263157894738 | AC77: =(R77+S77)/2 -> 0.32140000000000002 | AD77: =(S77+T77)/2 -> -7.4400000000000008e-02 | AE77: =(T77+U77)/2 -> 8.9499999999999996e-03 | AF77: =(U77+V77)/2 -> 9.8699999999999996e-02 | AG77: =(V77+W77)/2 -> 0.84870000000000001 | AH77: =(W77+X77)/2 -> 1.3815999999999999 | AI77: =(X77+Y77)/2 -> 1.0375999999999999 | AJ77: =STDEV(G77:Y77) -> 0.43555808241599048
B78: 603301.SH | C78: 振德医疗 | J78: 0.45950000000000002 | K78: -0.10339999999999999 | L78: -0.2742 | M78: -0.28120000000000001 | N78: -0.3765 | O78: -0.15380000000000002 | P78: -0.31109999999999999 | Q78: -0.28989999999999999 | R78: -0.2079 | S78: 1 | T78: 15.258099999999999 | U78: 20.489799999999999 | V78: 14.625 | W78: 1.5455000000000001 | X78: -0.67059999999999997 | Y78: -0.79870000000000008 | AA78: =(N78+O78+P78+Q78+R78+S78+T78+U78+V78+W78+X78+Y78)/12 -> 4.1758249999999997 | AB78: =(G78+H78+I78+J78+K78+L78+M78+N78+O78+P78+Q78+R78+S78+T78+U78+V78+W78+X78+Y78)/19 -> 2.6268736842105262 | AC78: =(R78+S78)/2 -> 0.39605000000000001 | AD78: =(S78+T78)/2 -> 8.1290499999999994 | AE78: =(T78+U78)/2 -> 17.873950000000001 | AF78: =(U78+V78)/2 -> 17.557400000000001 | AG78: =(V78+W78)/2 -> 8.0852500000000003 | AH78: =(W78+X78)/2 -> 0.43745000000000006 | AI78: =(X78+Y78)/2 -> -0.73465000000000003 | AJ78: =STDEV(G78:Y78) -> 6.909327688651528
B79: 600729.SH | C79: 重庆百货 | G79: 0.13919999999999999 | H79: 0.28720000000000001 | I79: 0.26800000000000002 | J79: 0.44659999999999994 | K79: 0.43329999999999996 | L79: 0.41320000000000001 | M79: 0.53659999999999997 | N79: 0.36909999999999998 | O79: -0.1008 | P79: -2.92e-02 | Q79: 0.17989999999999998 | R79: 0.18629999999999999 | S79: -0.62929999999999997 | T79: 0.11449999999999999 | U79: 5.8299999999999998e-02 | V79: 4.9599999999999998e-02 | W79: 1.4883999999999999 | X79: -0.16219999999999998 | Y79: -0.10589999999999999 | AA79: =(N79+O79+P79+Q79+R79+S79+T79+U79+V79+W79+X79+Y79)/12 -> 0.11822499999999998 | AB79: =(G79+H79+I79+J79+K79+L79+M79+N79+O79+P79+Q79+R79+S79+T79+U79+V79+W79+X79+Y79)/19 -> 0.20751578947368418 | AC79: =(R79+S79)/2 -> -0.22149999999999997 | AD79: =(S79+T79)/2 -> -0.25739999999999996 | AE79: =(T79+U79)/2 -> 8.6399999999999991e-02 | AF79: =(U79+V79)/2 -> 5.3949999999999998e-02 | AG79: =(V79+W79)/2 -> 0.76900000000000002 | AH79: =(W79+X79)/2 -> 0.66310000000000002 | AI79: =(X79+Y79)/2 -> -0.13405 | AJ79: =STDEV(G79:Y79) -> 0.41389285149011679
B80: 002916.SZ | C80: 深南电路 | E80: 0.50360000000000005 | F80: 2.0979999999999999 | H80: 1.2222 | I80: 0.64290000000000003 | J80: 0.626 | K80: -0.125 | L80: -0.16670000000000001 | M80: -0.1242 | N80: -2.35e-02 | O80: 0.3095 | P80: -1.e-02 | Q80: 0.2979 | R80: 0.2596 | S80: 0.49090000000000006 | T80: 0.53539999999999999 | U80: 0.25679999999999997 | V80: 0.14499999999999999 | W80: -0.39020000000000005 | X80: -0.25 | Y80: -9.1300000000000006e-02 | AA80: =(N80+O80+P80+Q80+R80+S80+T80+U80+V80+W80+X80+Y80)/12 -> 0.12750833333333333 | AB80: =(H80+I80+J80+K80+L80+M80+N80+O80+P80+Q80+R80+S80+T80+U80+V80+W80+X80+Y80)/18 -> 0.20029444444444441 | AC80: =(R80+S80)/2 -> 0.37525000000000003 | AD80: =(S80+T80)/2 -> 0.51315 | AE80: =(T80+U80)/2 -> 0.39610000000000001 | AF80: =(U80+V80)/2 -> 0.20089999999999997 | AG80: =(V80+W80)/2 -> -0.12260000000000003 | AH80: =(W80+X80)/2 -> -0.32010000000000005 | AI80: =(X80+Y80)/2 -> -0.17065 | AJ80: =STDEV(G80:Y80) -> 0.40043837959125894
B81: 603345.SH | C81: 安井食品 | G81: -0.13789999999999999 | H81: -0.17460000000000001 | I81: -0.13919999999999999 | J81: -0.1009 | K81: 0 | L81: 0.26919999999999999 | M81: 0.3382 | N81: 0.27550000000000002 | O81: 0.20000000000000001 | P81: 0.1515 | Q81: 0.17579999999999998 | R81: 0.33600000000000002 | S81: 0.26669999999999999 | T81: 0.47369999999999995 | U81: 0.52340000000000009 | V81: 0.56289999999999996 | W81: 0.94739999999999991 | X81: 0.29460000000000003 | Y81: 0.26379999999999998 | AA81: =(N81+O81+P81+Q81+R81+S81+T81+U81+V81+W81+X81+Y81)/12 -> 0.37260833333333337 | AB81: =(G81+H81+I81+J81+K81+L81+M81+N81+O81+P81+Q81+R81+S81+T81+U81+V81+W81+X81+Y81)/19 -> 0.23821578947368419 | AC81: =(R81+S81)/2 -> 0.30135000000000001 | AD81: =(S81+T81)/2 -> 0.37019999999999997 | AE81: =(T81+U81)/2 -> 0.49855000000000005 | AF81: =(U81+V81)/2 -> 0.54315000000000002 | AG81: =(V81+W81)/2 -> 0.75514999999999999 | AH81: =(W81+X81)/2 -> 0.621 | AI81: =(X81+Y81)/2 -> 0.2792 | AJ81: =STDEV(G81:Y81) -> 0.27994478277601237
B82: 600779.SH | C82: 水井坊 | G82: 0.17649999999999999 | H82: 0.25679999999999997 | I82: 0.63200000000000001 | J82: 0.49249999999999999 | K82: 0.68030000000000002 | L82: 1.3358000000000001 | M82: 0.90159999999999996 | N82: 0.72719999999999996 | O82: 0.4118 | P82: 0.26960000000000001 | Q82: 0.38150000000000001 | R82: 0.42630000000000001 | S82: -0.1258 | T82: -0.69640000000000002 | U82: -0.215 | V82: -0.115 | W82: 1.1959 | X82: 2.6616000000000004 | Y82: 0.99840000000000007 | AA82: =(N82+O82+P82+Q82+R82+S82+T82+U82+V82+W82+X82+Y82)/12 -> 0.49334166666666673 | AB82: =(G82+H82+I82+J82+K82+L82+M82+N82+O82+P82+Q82+R82+S82+T82+U82+V82+W82+X82+Y82)/19 -> 0.54713684210526325 | AC82: =(R82+S82)/2 -> 0.15024999999999999 | AD82: =(S82+T82)/2 -> -0.41110000000000002 | AE82: =(T82+U82)/2 -> -0.45569999999999999 | AF82: =(U82+V82)/2 -> -0.16500000000000001 | AG82: =(V82+W82)/2 -> 0.54044999999999999 | AH82: =(W82+X82)/2 -> 1.9287500000000002 | AI82: =(X82+Y82)/2 -> 1.8300000000000003 | AJ82: =STDEV(G82:Y82) -> 0.71806123942686917
B83: 601088.SH | C83: 中国神华 | E83: 25.600000000000001 | F83: 2.0510000000000002 | G83: 1.6509 | H83: 1.4737 | I83: 1.0598000000000001 | J83: 0.98250000000000004 | K83: -4.8799999999999996e-02 | L83: -5.4800000000000001e-02 | M83: -1.e-02 | N83: -2.6099999999999998e-02 | O83: 8.2100000000000006e-02 | P83: 5.5399999999999998e-02 | Q83: 5.1299999999999998e-02 | R83: -1.41e-02 | S83: -0.22120000000000001 | T83: -0.1477 | U83: -9.5399999999999985e-02 | V83: -9.3800000000000008e-02 | W83: 0.18460000000000001 | X83: 0.26079999999999998 | Y83: 0.21579999999999999 | AA83: =(N83+O83+P83+Q83+R83+S83+T83+U83+V83+W83+X83+Y83)/12 -> 2.0975000000000004e-02 | AB83: =(G83+H83+I83+J83+K83+L83+M83+N83+O83+P83+Q83+R83+S83+T83+U83+V83+W83+X83+Y83)/19 -> 0.27921052631578946 | AC83: =(R83+S83)/2 -> -0.11765 | AD83: =(S83+T83)/2 -> -0.18445 | AE83: =(T83+U83)/2 -> -0.12154999999999999 | AF83: =(U83+V83)/2 -> -9.459999999999999e-02 | AG83: =(V83+W83)/2 -> 4.5400000000000003e-02 | AH83: =(W83+X83)/2 -> 0.22270000000000001 | AI83: =(X83+Y83)/2 -> 0.23829999999999998 | AJ83: =STDEV(G83:Y83) -> 0.56571716912128145 | AK83: 0.30980000000000002 | AL83: 0.24429999999999999 | AM83: 3.3000000000000002e-02 | AN83: 5.9500000000000004e-02 | AO83: 5.7300000000000004e-02 | AP83: 4.2900000000000001e-02 | AQ83: -8.1799999999999998e-02 | AR83: -6.2199999999999998e-02 | AS83: -7.9100000000000004e-02 | AT83: -9.01e-02 | AU83: -0.1618 | AV83: -0.1094 | AW83: -0.1249 | AX83: -8.6300000000000002e-02 | AY83: 0.34259999999999996 | AZ83: 0.312 | BA83: 0.34259999999999996 | BB83: 0.312 | BC83: 0.46560000000000001 | BE83: =(AR83+AS83+AT83+AU83+AV83+AW83+AX83+AY83+AZ83+BA83+BB83+BC83)/12 -> 8.8416666666666657e-02 | BF83: =(AK83+AL83+AM83+AN83+AO83+AP83+AQ83+AR83+AS83+AT83+AU83+AV83+AV83+AW83+AX83+AY83+AZ83+BA83+BB83+BC83)/19 -> 8.508421052631579e-02 | BG83: =(AV83+AW83)/2 -> -0.11715 | BH83: =(AW83+AX83)/2 -> -0.1056 | BI83: =(AX83+AY83)/2 -> 0.12814999999999999 | BJ83: =(AY83+AZ83)/2 -> 0.32729999999999998 | BK83: =(AZ83+BA83)/2 -> 0.32729999999999998 | BL83: =(BA83+BB83)/2 -> 0.32729999999999998 | BM83: =(BB83+BC83)/2 -> 0.38880000000000003 | BN83: =STDEV(AK83:BC83) -> 0.20289147157967502
B84: 000923.SZ | C84: 河钢资源 | G84: 60.904799999999994 | H84: 5.1738999999999997 | I84: 2.379 | J84: -0.1716 | K84: -0.87180000000000002 | L84: -0.54170000000000007 | M84: -0.82169999999999999 | N84: -0.55979999999999996 | O84: 2.2200000000000002 | P84: 2.9318 | Q84: 4.6726999999999999 | R84: 2.9411 | S84: 0.45340000000000003 | T84: 0.2225 | U84: 0.50159999999999993 | V84: 0.83700000000000008 | W84: 1.9213999999999998 | X84: 2.7447000000000004 | Y84: 1.1836 | AA84: =(N84+O84+P84+Q84+R84+S84+T84+U84+V84+W84+X84+Y84)/12 -> 1.6725000000000001 | AB84: =(G84+H84+I84+J84+K84+L84+M84+N84+O84+P84+Q84+R84+S84+T84+U84+V84+W84+X84+Y84)/19 -> 4.5326789473684217 | AC84: =(R84+S84)/2 -> 1.6972499999999999 | AD84: =(S84+T84)/2 -> 0.33795000000000003 | AE84: =(T84+U84)/2 -> 0.36204999999999998 | AF84: =(U84+V84)/2 -> 0.66930000000000001 | AG84: =(V84+W84)/2 -> 1.3792 | AH84: =(W84+X84)/2 -> 2.3330500000000001 | AI84: =(X84+Y84)/2 -> 1.9641500000000001 | AJ84: =STDEV(G84:Y84) -> 13.766662636463449
B85: 603836.SH | C85: 海程邦达 | V85: 0.73909999999999998 | W85: 1.6666999999999998 | X85: 0.629 | Y85: 1.4286000000000001 | AA85: =(N85+O85+P85+Q85+R85+S85+T85+U85+V85+W85+X85+Y85)/12 -> 0.37195 | AB85: =(G85+H85+I85+J85+K85+L85+M85+N85+O85+P85+Q85+R85+S85+T85+U85+V85+W85+X85+Y85)/19 -> 0.23491578947368422 | AC85: =(R85+S85)/2 -> 0 | AD85: =(S85+T85)/2 -> 0 | AE85: =(T85+U85)/2 -> 0 | AF85: =(U85+V85)/2 -> 0.36954999999999999 | AG85: =(V85+W85)/2 -> 1.2028999999999999 | AH85: =(W85+X85)/2 -> 1.14785 | AI85: =(X85+Y85)/2 -> 1.0287999999999999 | AJ85: =STDEV(G85:Y85) -> 0.50997116585156066
B86: 605080.SH | C86: 浙江自然 | E86: 0.1162 | F86: 2.04 | X86: 0.30399999999999999 | Y86: 0.21429999999999999 | AA86: =(N86+O86+P86+Q86+R86+S86+T86+U86+V86+W86+X86+Y86)/12 -> 4.3191666666666663e-02 | AB86: =(G86+H86+I86+J86+K86+L86+M86+N86+O86+P86+Q86+R86+S86+T86+U86+V86+W86+X86+Y86)/19 -> 2.7278947368421052e-02 | AC86: =(R86+S86)/2 -> 0 | AD86: =(S86+T86)/2 -> 0 | AE86: =(T86+U86)/2 -> 0 | AF86: =(U86+V86)/2 -> 0 | AG86: =(V86+W86)/2 -> 0 | AH86: =(W86+X86)/2 -> 0.152 | AI86: =(X86+Y86)/2 -> 0.25914999999999999 | AJ86: =STDEV(G86:Y86) -> 6.3427478272433321e-02
B87: 600332.SH | C87: 白云山 | G87: -5.9900000000000002e-02 | H87: 0.1056 | I87: 0.1497 | J87: 0.17949999999999999 | K87: 0.86909999999999998 | L87: 1.2625999999999999 | M87: 1.3140000000000001 | N87: 0.66879999999999995 | O87: 0.55299999999999994 | P87: -2.7300000000000001e-02 | Q87: -8.1300000000000011e-02 | R87: -7.3300000000000004e-02 | S87: -0.15839999999999999 | T87: -0.30760000000000004 | U87: -0.158 | V87: -8.5699999999999998e-02 | W87: 0.375 | X87: 0.41840000000000005 | Y87: 0.24510000000000001 | AA87: =(N87+O87+P87+Q87+R87+S87+T87+U87+V87+W87+X87+Y87)/12 -> 0.11405833333333336 | AB87: =(G87+H87+I87+J87+K87+L87+M87+N87+O87+P87+Q87+R87+S87+T87+U87+V87+W87+X87+Y87)/19 -> 0.27312105263157893 | AC87: =(R87+S87)/2 -> -0.11584999999999999 | AD87: =(S87+T87)/2 -> -0.23300000000000001 | AE87: =(T87+U87)/2 -> -0.23280000000000001 | AF87: =(U87+V87)/2 -> -0.12185 | AG87: =(V87+W87)/2 -> 0.14465 | AH87: =(W87+X87)/2 -> 0.39670000000000005 | AI87: =(X87+Y87)/2 -> 0.33175000000000004 | AJ87: =STDEV(G87:Y87) -> 0.47268481932578776
B88: 000672.SZ | C88: 上峰水泥 | G88: 3.75 | H88: 5.4000000000000004 | I88: 4.5999999999999996 | J88: 4.3888999999999996 | K88: 0.85450000000000004 | L88: 0.96879999999999999 | M88: 1.0179 | N88: 0.86599999999999999 | O88: 1.2059 | P88: 0.90480000000000005 | Q88: 0.69909999999999994 | R88: 0.61599999999999999 | S88: -6.6699999999999995e-02 | T88: 5.0000000000000003e-02 | U88: -1.5600000000000001e-02 | V88: -0.1303 | W88: 4.7599999999999996e-02 | X88: 0 | Y88: 4.7599999999999996e-02 | AA88: =(N88+O88+P88+Q88+R88+S88+T88+U88+V88+W88+X88+Y88)/12 -> 0.35203333333333336 | AB88: =(G88+H88+I88+J88+K88+L88+M88+N88+O88+P88+Q88+R88+S88+T88+U88+V88+W88+X88+Y88)/19 -> 1.3265526315789478 | AC88: =(R88+S88)/2 -> 0.27465000000000001 | AD88: =(S88+T88)/2 -> -8.3499999999999963e-03 | AE88: =(T88+U88)/2 -> 1.72e-02 | AF88: =(U88+V88)/2 -> -7.2950000000000001e-02 | AG88: =(V88+W88)/2 -> -4.1349999999999998e-02 | AH88: =(W88+X88)/2 -> 2.3799999999999998e-02 | AI88: =(X88+Y88)/2 -> 2.3799999999999998e-02 | AJ88: =STDEV(G88:Y88) -> 1.7769265605309827
B89: 603799.SH | C89: 华友钴业 | G89: 7 | H89: 19.9833 | I89: 65 | J89: 16.538499999999999 | K89: 1.4524000000000001 | L89: 0.2291 | M89: 0.34090000000000004 | N89: -0.37719999999999998 | O89: -0.99029999999999996 | P89: -0.97860000000000003 | Q89: -0.95480000000000009 | R89: -0.92249999999999999 | S89: 16 | T89: 9.3333000000000013 | U89: 6.625 | V89: 8.3635999999999999 | W89: 2.2940999999999998 | X89: 2.9676999999999998 | Y89: 2.2459000000000002 | AA89: =(N89+O89+P89+Q89+R89+S89+T89+U89+V89+W89+X89+Y89)/12 -> 3.6338500000000002 | AB89: =(G89+H89+I89+J89+K89+L89+M89+N89+O89+P89+Q89+R89+S89+T89+U89+V89+W89+X89+Y89)/19 -> 8.1131789473684197 | AC89: =(R89+S89)/2 -> 7.5387500000000003 | AD89: =(S89+T89)/2 -> 12.666650000000001 | AE89: =(T89+U89)/2 -> 7.9791500000000006 | AF89: =(U89+V89)/2 -> 7.4943 | AG89: =(V89+W89)/2 -> 5.3288500000000001 | AH89: =(W89+X89)/2 -> 2.6308999999999996 | AI89: =(X89+Y89)/2 -> 2.6067999999999998 | AJ89: =STDEV(G89:Y89) -> 15.235906149348466
B90: 002812.SZ | C90: 恩捷股份 | G90: -0.38829999999999998 | H90: -0.34670000000000001 | I90: -0.29909999999999998 | J90: -0.38159999999999994 | K90: 0.21440000000000001 | L90: -0.16329999999999997 | M90: -0.38670000000000004 | N90: -0.23399999999999999 | O90: 0.2923 | P90: 0.17069999999999999 | Q90: 0.69569999999999999 | R90: 0.47220000000000001 | S90: -0.3488 | T90: -0.16670000000000001 | U90: 1.2800000000000001e-02 | V90: 0.26419999999999999 | W90: 1.8555000000000001 | X90: 1.95 | Y90: 1.4937 | AA90: =(N90+O90+P90+Q90+R90+S90+T90+U90+V90+W90+X90+Y90)/12 -> 0.53813333333333324 | AB90: =(G90+H90+I90+J90+K90+L90+M90+N90+O90+P90+Q90+R90+S90+T90+U90+V90+W90+X90+Y90)/19 -> 0.24770000000000003 | AC90: =(R90+S90)/2 -> 6.1700000000000005e-02 | AD90: =(S90+T90)/2 -> -0.25775000000000003 | AE90: =(T90+U90)/2 -> -7.6950000000000005e-02 | AF90: =(U90+V90)/2 -> 0.13849999999999998 | AG90: =(V90+W90)/2 -> 1.05985 | AH90: =(W90+X90)/2 -> 1.9027500000000002 | AI90: =(X90+Y90)/2 -> 1.7218499999999999 | AJ90: =STDEV(G90:Y90) -> 0.75035986329523552
B91: 603297.SH | C91: 永新光学 | E91: 0.16839999999999999 | F91: 1.972 | M91: 0.14730000000000001 | N91: -0.23079999999999998 | O91: -0.36840000000000006 | P91: -0.35799999999999998 | Q91: -0.37840000000000001 | R91: -2.3099999999999999e-02 | S91: 0.16670000000000001 | T91: 0.11539999999999999 | U91: -7.6100000000000001e-02 | V91: 0.16539999999999999 | W91: 2.9286000000000003 | X91: 1.5516999999999999 | Y91: 1.3175999999999999 | AA91: =(N91+O91+P91+Q91+R91+S91+T91+U91+V91+W91+X91+Y91)/12 -> 0.40088333333333331 | AB91: =(G91+H91+I91+J91+K91+L91+M91+N91+O91+P91+Q91+R91+S91+T91+U91+V91+W91+X91+Y91)/19 -> 0.26094210526315792 | AC91: =(R91+S91)/2 -> 7.1800000000000003e-02 | AD91: =(S91+T91)/2 -> 0.14105000000000001 | AE91: =(T91+U91)/2 -> 1.9649999999999994e-02 | AF91: =(U91+V91)/2 -> 4.4649999999999995e-02 | AG91: =(V91+W91)/2 -> 1.5470000000000002 | AH91: =(W91+X91)/2 -> 2.2401499999999999 | AI91: =(X91+Y91)/2 -> 1.43465 | AJ91: =STDEV(G91:Y91) -> 0.97410364964741325
B92: 603816.SH | C92: 顾家家居 | G92: 9.5199999999999993e-02 | H92: 0.14630000000000001 | I92: 0.18109999999999998 | J92: 0.19159999999999999 | K92: 0.41299999999999998 | L92: -0.13830000000000001 | M92: -0.1133 | N92: -0.15579999999999999 | O92: -0.21539999999999998 | P92: 0.1605 | Q92: 0.1729 | R92: 0.17859999999999998 | S92: 1.9599999999999999e-02 | T92: 2.1299999999999999e-02 | U92: 8.3299999999999999e-02 | V92: -0.29799999999999999 | W92: 0.1923 | X92: 0.28120000000000001 | Y92: 0.16570000000000001 | AA92: =(N92+O92+P92+Q92+R92+S92+T92+U92+V92+W92+X92+Y92)/12 -> 5.0516666666666675e-02 | AB92: =(G92+H92+I92+J92+K92+L92+M92+N92+O92+P92+Q92+R92+S92+T92+U92+V92+W92+X92+Y92)/19 -> 7.2726315789473681e-02 | AC92: =(R92+S92)/2 -> 9.9099999999999994e-02 | AD92: =(S92+T92)/2 -> 2.0449999999999999e-02 | AE92: =(T92+U92)/2 -> 5.2299999999999999e-02 | AF92: =(U92+V92)/2 -> -0.10735 | AG92: =(V92+W92)/2 -> -5.2849999999999994e-02 | AH92: =(W92+X92)/2 -> 0.23675000000000002 | AI92: =(X92+Y92)/2 -> 0.22345000000000001 | AJ92: =STDEV(G92:Y92) -> 0.18262399696919859
B93: 603392.SH | C93: 万泰生物 | R93: -0.30769999999999997 | S93: 0.80000000000000004 | T93: 1.7272999999999998 | U93: 1.4687999999999999 | V93: 2 | W93: 2.7222000000000004 | X93: 1.45 | Y93: 1.4809999999999999 | AA93: =(N93+O93+P93+Q93+R93+S93+T93+U93+V93+W93+X93+Y93)/12 -> 0.94513333333333327 | AB93: =(G93+H93+I93+J93+K93+L93+M93+N93+O93+P93+Q93+R93+S93+T93+U93+V93+W93+X93+Y93)/19 -> 0.59692631578947364 | AC93: =(R93+S93)/2 -> 0.24615000000000004 | AD93: =(S93+T93)/2 -> 1.2636499999999999 | AE93: =(T93+U93)/2 -> 1.5980499999999997 | AF93: =(U93+V93)/2 -> 1.7343999999999999 | AG93: =(V93+W93)/2 -> 2.3611000000000004 | AH93: =(W93+X93)/2 -> 2.0861000000000001 | AI93: =(X93+Y93)/2 -> 1.4655 | AJ93: =STDEV(G93:Y93) -> 0.88663614215270325
B94: 600596.SH | C94: 新安股份 | G94: 2.3203999999999998 | H94: 13.136700000000001 | I94: 19.107500000000002 | J94: 5.7382000000000009 | K94: 3.0011000000000001 | L94: 2.2448999999999999 | M94: 3.9037999999999999 | N94: 1.3393999999999999 | O94: -0.52710000000000001 | P94: -0.62790000000000001 | Q94: -0.64060000000000006 | R94: -0.67310000000000003 | S94: -0.85569999999999991 | T94: -0.72809999999999997 | U94: -0.53339999999999999 | V94: 0.27460000000000001 | W94: 12.5458 | X94: 9.1528999999999989 | Y94: 6.0625 | AA94: =(N94+O94+P94+Q94+R94+S94+T94+U94+V94+W94+X94+Y94)/12 -> 2.0657749999999999 | AB94: =(G94+H94+I94+J94+K94+L94+M94+N94+O94+P94+Q94+R94+S94+T94+U94+V94+W94+X94+Y94)/19 -> 3.9074684210526316 | AC94: =(R94+S94)/2 -> -0.76439999999999997 | AD94: =(S94+T94)/2 -> -0.79189999999999994 | AE94: =(T94+U94)/2 -> -0.63074999999999992 | AF94: =(U94+V94)/2 -> -0.12939999999999999 | AG94: =(V94+W94)/2 -> 6.4101999999999997 | AH94: =(W94+X94)/2 -> 10.849349999999999 | AI94: =(X94+Y94)/2 -> 7.6076999999999995 | AJ94: =STDEV(G94:Y94) -> 5.7640984777473747
B95: 601699.SH | C95: 潞安环能 | E95: 0.6663 | F95: 1.95 | G95: 16 | H95: 18 | I95: 20.333299999999998 | J95: 2.2069000000000001 | K95: 0.4118 | L95: 0.23680000000000001 | M95: 0.17190000000000003 | N95: -0.1613 | O95: 0.25 | P95: 0.12770000000000001 | Q95: -1.3300000000000001e-02 | R95: 2.5600000000000001e-02 | S95: -0.23329999999999998 | T95: -0.26419999999999999 | U95: -0.37840000000000001 | V95: -0.1875 | W95: 1.3043 | X95: 1.8462000000000001 | Y95: 3.2391000000000001 | AA95: =(N95+O95+P95+Q95+R95+S95+T95+U95+V95+W95+X95+Y95)/12 -> 0.46290833333333331 | AB95: =(G95+H95+I95+J95+K95+L95+M95+N95+O95+P95+Q95+R95+S95+T95+U95+V95+W95+X95+Y95)/19 -> 3.3113473684210519 | AC95: =(R95+S95)/2 -> -0.10384999999999998 | AD95: =(S95+T95)/2 -> -0.24874999999999997 | AE95: =(T95+U95)/2 -> -0.32130000000000003 | AF95: =(U95+V95)/2 -> -0.28295000000000003 | AG95: =(V95+W95)/2 -> 0.55840000000000001 | AH95: =(W95+X95)/2 -> 1.57525 | AI95: =(X95+Y95)/2 -> 2.5426500000000001 | AJ95: =STDEV(G95:Y95) -> 6.6926283883728219 | AK95: 0.59179999999999999 | AL95: 1.5447 | AM95: 1.1425000000000001 | AN95: 1.1787000000000001 | AO95: 6.9699999999999998e-02 | AP95: -0.23039999999999999 | AQ95: -1.9199999999999998e-02 | AR95: 0.55859999999999999 | AS95: 0.4551 | AT95: 0.51739999999999997 | AU95: 0.21479999999999999 | AV95: 1.24e-02 | AW95: -9.1400000000000009e-02 | AX95: -0.3115 | AY95: -0.1923 | AZ95: -4.8300000000000003e-02 | BA95: 0.43700000000000006 | BB95: 0.39429999999999998 | BC95: 0.34310000000000002 | BE95: =(AR95+AS95+AT95+AU95+AV95+AW95+AX95+AY95+AZ95+BA95+BB95+BC95)/12 -> 0.19076666666666667 | BF95: =(AK95+AL95+AM95+AN95+AO95+AP95+AQ95+AR95+AS95+AT95+AU95+AV95+AV95+AW95+AX95+AY95+AZ95+BA95+BB95+BC95)/19 -> 0.34628421052631586 | BG95: =(AV95+AW95)/2 -> -3.9500000000000007e-02 | BH95: =(AW95+AX95)/2 -> -0.20145000000000002 | BI95: =(AX95+AY95)/2 -> -0.25190000000000001 | BJ95: =(AY95+AZ95)/2 -> -0.1203 | BK95: =(AZ95+BA95)/2 -> 0.19435000000000002 | BL95: =(BA95+BB95)/2 -> 0.41565000000000002 | BM95: =(BB95+BC95)/2 -> 0.36870000000000003 | BN95: =STDEV(AK95:BC95) -> 0.50889404054569543
B96: 600763.SH | C96: 通策医疗 | G96: 0.18179999999999999 | H96: 0.2727 | I96: 0.46149999999999997 | J96: 0.61899999999999999 | K96: 0.46149999999999997 | L96: 0.5 | M96: 0.50880000000000003 | N96: 0.52939999999999998 | O96: 0.57889999999999997 | P96: 0.54759999999999998 | Q96: 0.45350000000000001 | R96: 0.39419999999999999 | S96: -1.2 | T96: -0.30769999999999997 | U96: 0 | V96: 6.2100000000000002e-02 | W96: 9.5 | X96: 1.4221999999999999 | Y96: 0.54400000000000004 | AA96: =(N96+O96+P96+Q96+R96+S96+T96+U96+V96+W96+X96+Y96)/12 -> 1.0436833333333333 | AB96: =(G96+H96+I96+J96+K96+L96+M96+N96+O96+P96+Q96+R96+S96+T96+U96+V96+W96+X96+Y96)/19 -> 0.81734210526315787 | AC96: =(R96+S96)/2 -> -0.40289999999999998 | AD96: =(S96+T96)/2 -> -0.75384999999999991 | AE96: =(T96+U96)/2 -> -0.15384999999999999 | AF96: =(U96+V96)/2 -> 3.1050000000000001e-02 | AG96: =(V96+W96)/2 -> 4.7810499999999996 | AH96: =(W96+X96)/2 -> 5.4611000000000001 | AI96: =(X96+Y96)/2 -> 0.98309999999999997 | AJ96: =STDEV(G96:Y96) -> 2.1617372258635439
B97: 000538.SZ | C97: 云南白药 | G97: 0.16670000000000001 | H97: 0.1278 | I97: 0.1013 | J97: 7.8600000000000003e-02 | K97: 0.10000000000000001 | L97: 0.32669999999999999 | M97: 0.26800000000000002 | N97: -9.2699999999999991e-02 | O97: 0.98699999999999999 | P97: -0.11560000000000001 | Q97: -0.12619999999999998 | R97: 0.1971 | S97: -0.34639999999999999 | T97: 9.0899999999999995e-02 | U97: 0.20219999999999999 | V97: 0.31709999999999999 | W97: -0.40000000000000002 | X97: -0.2656 | Y97: -0.42340000000000005 | AA97: =(N97+O97+P97+Q97+R97+S97+T97+U97+V97+W97+X97+Y97)/12 -> 2.0333333333333037e-03 | AB97: =(G97+H97+I97+J97+K97+L97+M97+N97+O97+P97+Q97+R97+S97+T97+U97+V97+W97+X97+Y97)/19 -> 6.28157894736842e-02 | AC97: =(R97+S97)/2 -> -7.4649999999999994e-02 | AD97: =(S97+T97)/2 -> -0.12775 | AE97: =(T97+U97)/2 -> 0.14654999999999999 | AF97: =(U97+V97)/2 -> 0.25964999999999999 | AG97: =(V97+W97)/2 -> -4.1450000000000015e-02 | AH97: =(W97+X97)/2 -> -0.33279999999999998 | AI97: =(X97+Y97)/2 -> -0.34450000000000003 | AJ97: =STDEV(G97:Y97) -> 0.3252821053642137
B98: 603589.SH | C98: 口子窖 | E98: 0.20879999999999999 | F98: 1.9199999999999999 | G98: 0.22219999999999998 | H98: 0.31340000000000001 | I98: 0.26050000000000001 | J98: 0.41979999999999995 | K98: 0.36359999999999998 | L98: 0.38640000000000002 | M98: 0.26669999999999999 | N98: 0.371 | O98: 0.21329999999999999 | P98: 0.2213 | Q98: 0.1368 | R98: 0.1255 | S98: -0.54949999999999999 | T98: -0.45640000000000003 | U98: -0.33329999999999999 | V98: -0.25780000000000003 | W98: 0.70730000000000004 | X98: 0.41979999999999995 | Y98: 0.33329999999999999 | AA98: =(N98+O98+P98+Q98+R98+S98+T98+U98+V98+W98+X98+Y98)/12 -> 7.7608333333333335e-02 | AB98: =(G98+H98+I98+J98+K98+L98+M98+N98+O98+P98+Q98+R98+S98+T98+U98+V98+W98+X98+Y98)/19 -> 0.16652105263157893 | AC98: =(R98+S98)/2 -> -0.21199999999999999 | AD98: =(S98+T98)/2 -> -0.50295000000000001 | AE98: =(T98+U98)/2 -> -0.39485000000000003 | AF98: =(U98+V98)/2 -> -0.29554999999999998 | AG98: =(V98+W98)/2 -> 0.22475000000000001 | AH98: =(W98+X98)/2 -> 0.56355 | AI98: =(X98+Y98)/2 -> 0.37654999999999994 | AJ98: =STDEV(G98:Y98) -> 0.32993591731147387
B99: 001218.SZ | C99: 丽臣实业 | X99: 0.128 | Y99: -0.15490000000000001 | AA99: =(X99+Y99)/2 -> -1.3450000000000004e-02 | AB99: =(X99+Y99)/2 -> -1.3450000000000004e-02 | AC99: =(R99+S99)/2 -> 0 | AD99: =(S99+T99)/2 -> 0 | AE99: =(T99+U99)/2 -> 0 | AF99: =(U99+V99)/2 -> 0 | AG99: =(V99+W99)/2 -> 0 | AH99: =(W99+X99)/2 -> 6.4000000000000001e-02 | AI99: =(X99+Y99)/2 -> -1.3450000000000004e-02 | AJ99: =STDEV(G99:Y99) -> 0.20004050839767432
B100: 600746.SH | C100: 江苏索普 | G100: 36.3902 | H100: 3.4437000000000002 | I100: 1.9601 | J100: 2.4443999999999999 | K100: -1.0737000000000001 | L100: -1.0446 | M100: -1.0184 | N100: -0.95219999999999994 | O100: 1.2301 | P100: 0.57950000000000002 | Q100: -4.5853999999999999 | R100: -2.5726 | S100: 17.538499999999999 | T100: 3.2702999999999998 | U100: 3.2664 | V100: 13.184800000000001 | W100: 9.7966999999999995 | X100: 160.619 | Y100: 35.735999999999997 | AA100: =(N100+O100+P100+Q100+R100+S100+T100+U100+V100+W100+X100+Y100)/12 -> 19.759258333333332 | AB100: =(G100+H100+I100+J100+K100+L100+M100+N100+O100+P100+Q100+R100+S100+T100+U100+V100+W100+X100+Y100)/19 -> 14.642778947368422 | AC100: =(R100+S100)/2 -> 7.4829499999999998 | AD100: =(S100+T100)/2 -> 10.404399999999999 | AE100: =(T100+U100)/2 -> 3.2683499999999999 | AF100: =(U100+V100)/2 -> 8.2256 | AG100: =(V100+W100)/2 -> 11.49075 | AH100: =(W100+X100)/2 -> 85.207849999999993 | AI100: =(X100+Y100)/2 -> 98.177499999999995 | AJ100: =STDEV(G100:Y100) -> 37.252962302071118 | AK100: 0.44159999999999999 | AL100: 0.27529999999999999 | AM100: 0.35109999999999997 | AN100: 0.23420000000000002 | AO100: -0.42219999999999996 | AP100: -0.38400000000000001 | AQ100: -0.42799999999999999 | AR100: -0.42950000000000005 | AS100: -9.74e-02 | AT100: -0.23230000000000001 | AU100: -0.19500000000000001 | AV100: 0.35810000000000003 | AW100: 6.6772999999999998 | AX100: 6.625 | AY100: 7.7427999999999999 | AZ100: 5.5492999999999997 | BA100: 0.70150000000000001 | BB100: 1.3256000000000001 | BC100: 1.1619999999999999 | BE100: =(AR100+AS100+AT100+AU100+AV100+AW100+AX100+AY100+AZ100+BA100+BB100+BC100)/12 -> 2.4322833333333329 | BF100: =(AK100+AL100+AM100+AN100+AO100+AP100+AQ100+AR100+AS100+AT100+AU100+AV100+AV100+AW100+AX100+AY100+AZ100+BA100+BB100+BC100)/19 -> 1.5586052631578946 | BG100: =(AV100+AW100)/2 -> 3.5177 | BH100: =(AW100+AX100)/2 -> 6.6511499999999995 | BI100: =(AX100+AY100)/2 -> 7.1838999999999995 | BJ100: =(AY100+AZ100)/2 -> 6.6460499999999998 | BK100: =(AZ100+BA100)/2 -> 3.1254 | BL100: =(BA100+BB100)/2 -> 1.01355 | BM100: =(BB100+BC100)/2 -> 1.2438 | BN100: =STDEV(AK100:BC100) -> 2.7803673454970714
B101: 000830.SZ | C101: 鲁西化工 | G101: 16.625 | H101: 5.5999999999999996 | I101: 9.6935000000000002 | J101: 12.7667 | K101: 2.7943000000000002 | L101: 2.4182000000000001 | M101: 1.3197999999999999 | N101: 0.62630000000000008 | O101: -0.54579999999999995 | P101: -0.54520000000000002 | Q101: -0.61439999999999995 | R101: -0.4194 | S101: -0.95469999999999999 | T101: -0.69980000000000009 | U101: -0.4587 | V101: -0.51880000000000004 | W101: 46.727299999999993 | X101: 7.9740000000000002 | Y101: 4.8972000000000007 | AA101: =(N101+O101+P101+Q101+R101+S101+T101+U101+V101+W101+X101+Y101)/12 -> 4.6223333333333327 | AB101: =(G101+H101+I101+J101+K101+L101+M101+N101+O101+P101+Q101+R101+S101+T101+U101+V101+W101+X101+Y101)/19 -> 5.6150263157894722 | AC101: =(R101+S101)/2 -> -0.68704999999999994 | AD101: =(S101+T101)/2 -> -0.82725000000000004 | AE101: =(T101+U101)/2 -> -0.57925000000000004 | AF101: =(U101+V101)/2 -> -0.48875000000000002 | AG101: =(V101+W101)/2 -> 23.104249999999997 | AH101: =(W101+X101)/2 -> 27.350649999999995 | AI101: =(X101+Y101)/2 -> 6.4356000000000009 | AJ101: =STDEV(G101:Y101) -> 11.19396736931907
B102: 002841.SZ | C102: 视源股份 | G102: 0.21739999999999998 | H102: -0.44939999999999997 | I102: -9.1499999999999998e-02 | J102: -0.47060000000000002 | K102: -0.28570000000000001 | L102: 0.22450000000000001 | M102: -0.1162 | N102: 0.43520000000000003 | O102: 0.45000000000000001 | P102: 0.45000000000000001 | Q102: 0.66020000000000001 | R102: 0.60650000000000004 | S102: -0.13789999999999999 | T102: -4.5999999999999999e-02 | U102: -9.4999999999999998e-03 | V102: 0.16870000000000002 | W102: 0.23999999999999999 | X102: -0.20480000000000001 | Y102: -0.13650000000000001 | AA102: =(N102+O102+P102+Q102+R102+S102+T102+U102+V102+W102+X102+Y102)/12 -> 0.20632499999999998 | AB102: =(G102+H102+I102+J102+K102+L102+M102+N102+O102+P102+Q102+R102+S102+T102+U102+V102+W102+X102+Y102)/19 -> 7.9178947368421057e-02 | AC102: =(R102+S102)/2 -> 0.23430000000000001 | AD102: =(S102+T102)/2 -> -9.1950000000000004e-02 | AE102: =(T102+U102)/2 -> -2.775e-02 | AF102: =(U102+V102)/2 -> 7.9600000000000004e-02 | AG102: =(V102+W102)/2 -> 0.20435 | AH102: =(W102+X102)/2 -> 1.7599999999999991e-02 | AI102: =(X102+Y102)/2 -> -0.17065000000000002 | AJ102: =STDEV(G102:Y102) -> 0.33923386488928153
B103: 603713.SH | C103: 密尔克卫 | E103: 0.52100000000000002 | F103: 1.833 | J103: 0.45130000000000003 | K103: 1.3065 | L103: 0.78790000000000004 | M103: 0.59619999999999995 | N103: 0.38640000000000002 | O103: -4.3499999999999997e-02 | P103: 5.0799999999999998e-02 | Q103: 0.14460000000000001 | R103: 0.26729999999999998 | S103: 0.23929999999999998 | T103: 0.4677 | U103: 0.44209999999999999 | V103: 0.44990000000000002 | W103: 0.46130000000000004 | X103: 0.26369999999999999 | Y103: 0.36499999999999999 | AA103: =(N103+O103+P103+Q103+R103+S103+T103+U103+V103+W103+X103+Y103)/12 -> 0.29121666666666668 | AB103: =(G103+H103+I103+J103+K103+L103+M103+N103+O103+P103+Q103+R103+S103+T103+U103+V103+W103+X103+Y103)/19 -> 0.34928947368421059 | AC103: =(R103+S103)/2 -> 0.25329999999999997 | AD103: =(S103+T103)/2 -> 0.35349999999999998 | AE103: =(T103+U103)/2 -> 0.45489999999999997 | AF103: =(U103+V103)/2 -> 0.44600000000000001 | AG103: =(V103+W103)/2 -> 0.4556 | AH103: =(W103+X103)/2 -> 0.36250000000000004 | AI103: =(X103+Y103)/2 -> 0.31435000000000002 | AJ103: =STDEV(G103:Y103) -> 0.31302032994413209
A104: JBM_20220223 | B104: 603995.SH | C104: 甬金股份 | P104: 6.25e-02 | Q104: 5.3400000000000003e-02 | R104: 5.1999999999999998e-03 | S104: -0.2069 | T104: -0.20000000000000001 | U104: -0.18840000000000001 | V104: -6.25e-02 | W104: 1.087 | X104: 0.79410000000000003 | Y104: 0.66959999999999997 | AA104: =(N104+O104+P104+Q104+R104+S104+T104+U104+V104+W104+X104+Y104)/12 -> 0.16783333333333336 | AB104: =(G104+H104+I104+J104+K104+L104+M104+N104+O104+P104+Q104+R104+S104+T104+U104+V104+W104+X104+Y104)/19 -> 0.10600000000000001 | AC104: =(R104+S104)/2 -> -0.10085 | AD104: =(S104+T104)/2 -> -0.20345000000000002 | AE104: =(T104+U104)/2 -> -0.19420000000000001 | AF104: =(U104+V104)/2 -> -0.12545000000000001 | AG104: =(V104+W104)/2 -> 0.51224999999999998 | AH104: =(W104+X104)/2 -> 0.94055 | AI104: =(X104+Y104)/2 -> 0.73185 | AJ104: =STDEV(G104:Y104) -> 0.4695034776820674 | BA104: 1.0194000000000001 | BB104: 0.7661 | BC104: 0.62190000000000001 | BO104: 43823 | BS104: 2.331 | BT104: 1.1180000000000001 | CB104: 21 | CC104: 先变多再变少(由80家到21家,再到33家) | CD104: 持续减少(由22.83%减少到19.88%，再减少到12.44%) | CI104: 5.25 | CJ104: =CI104/BS104 -> 2.2522522522522523 | CK104: 不宜进场(利润和销售额下滑减缓，但持有机构数量出现大幅下滑且机构持有股份占比持续下滑，不宜长时间持有) | CL104: 44578
B105: 002601.SZ | C105: 龙佰集团 | G105: 8.6666999999999987 | H105: 5.5 | I105: 4.3332999999999995 | J105: 1.9069999999999998 | K105: 0 | L105: 3.0800000000000001e-02 | M105: 2.0799999999999999e-02 | N105: -8.0000000000000002e-02 | O105: 0.10339999999999999 | P105: -4.4800000000000006e-02 | Q105: 6.1200000000000004e-02 | R105: 0.1217 | S105: 0.375 | T105: 0 | U105: -7.690000000000001e-02 | V105: -0.124 | W105: 0.18179999999999999 | X105: 0.75 | Y105: 0.9375 | AA105: =(N105+O105+P105+Q105+R105+S105+T105+U105+V105+W105+X105+Y105)/12 -> 0.18374166666666666 | AB105: =(G105+H105+I105+J105+K105+L105+M105+N105+O105+P105+Q105+R105+S105+T105+U105+V105+W105+X105+Y105)/19 -> 1.1928157894736846 | AC105: =(R105+S105)/2 -> 0.24835000000000002 | AD105: =(S105+T105)/2 -> 0.1875 | AE105: =(T105+U105)/2 -> -3.8450000000000005e-02 | AF105: =(U105+V105)/2 -> -0.10045000000000001 | AG105: =(V105+W105)/2 -> 2.8899999999999995e-02 | AH105: =(W105+X105)/2 -> 0.46589999999999998 | AI105: =(X105+Y105)/2 -> 0.84375 | AJ105: =STDEV(G105:Y105) -> 2.3853471031517866 | AK105: 8.6666999999999987 | AL105: 5.5 | AM105: 4.3332999999999995 | AN105: 1.9069999999999998 | AO105: 0 | AP105: 3.0800000000000001e-02 | AQ105: 2.0799999999999999e-02 | AR105: -8.0000000000000002e-02 | AS105: 0.10339999999999999 | AT105: -4.4800000000000006e-02 | AU105: 6.1200000000000004e-02 | AV105: 0.1217 | AW105: 0.375 | AX105: 0 | AY105: -7.690000000000001e-02 | AZ105: -0.124 | BA105: 0.18179999999999999 | BB105: 0.75 | BC105: 0.9375 | BE105: =(AR105+AS105+AT105+AU105+AV105+AW105+AX105+AY105+AZ105+BA105+BB105+BC105)/12 -> 0.18374166666666666 | BF105: =(AK105+AL105+AM105+AN105+AO105+AP105+AQ105+AR105+AS105+AT105+AU105+AV105+AV105+AW105+AX105+AY105+AZ105+BA105+BB105+BC105)/19 -> 1.1992210526315794 | BG105: =(AV105+AW105)/2 -> 0.24835000000000002 | BH105: =(AW105+AX105)/2 -> 0.1875 | BI105: =(AX105+AY105)/2 -> -3.8450000000000005e-02 | BJ105: =(AY105+AZ105)/2 -> -0.10045000000000001 | BK105: =(AZ105+BA105)/2 -> 2.8899999999999995e-02 | BL105: =(BA105+BB105)/2 -> 0.46589999999999998 | BM105: =(BB105+BC105)/2 -> 0.84375 | BN105: =STDEV(AK105:BC105) -> 2.3853471031517866
B106: 000733.SZ | C106: 振华科技 | E106: 0.36430000000000001 | F106: 1.845 | G106: 0.28570000000000001 | H106: 0.22489999999999999 | I106: 5.9999999999999998e-02 | J106: 0.12140000000000001 | K106: 0 | L106: 0.14429999999999998 | M106: 0.48249999999999998 | N106: 0.48849999999999999 | O106: 0.16670000000000001 | P106: 0.34960000000000002 | Q106: 5.2699999999999997e-02 | R106: -0.1051 | S106: 2.3799999999999998e-02 | T106: -2.8500000000000001e-02 | U106: 0.2021 | V106: 1.0347999999999999 | W106: 1.2283999999999999 | X106: 1.1877 | Y106: 1.6674 | AA106: =(N106+O106+P106+Q106+R106+S106+T106+U106+V106+W106+X106+Y106)/12 -> 0.52234166666666659 | AB106: =(G106+H106+I106+J106+K106+L106+M106+N106+O106+P106+Q106+R106+S106+T106+U106+V106+W106+X106+Y106)/19 -> 0.39931052631578945 | AC106: =(R106+S106)/2 -> -4.0649999999999999e-02 | AD106: =(S106+T106)/2 -> -2.3500000000000014e-03 | AE106: =(T106+U106)/2 -> 8.6800000000000002e-02 | AF106: =(U106+V106)/2 -> 0.61844999999999994 | AG106: =(V106+W106)/2 -> 1.1315999999999999 | AH106: =(W106+X106)/2 -> 1.2080500000000001 | AI106: =(X106+Y106)/2 -> 1.4275500000000001 | AJ106: =STDEV(G106:Y106) -> 0.50497313008244626 | AK106: 0.49670000000000003 | AL106: 0.41369999999999996 | AM106: 0.12839999999999999 | AN106: 4.8000000000000001e-02 | AO106: -0.29830000000000001 | AP106: -0.2361 | AQ106: -0.25829999999999997 | AR106: -0.24710000000000001 | AS106: -0.4758 | AT106: -0.47420000000000001 | AU106: -0.4708 | AV106: -0.33789999999999998 | AW106: -0.1507 | AX106: -0.16289999999999999 | AY106: -8.5000000000000006e-02 | AZ106: -0.12470000000000001 | BA106: 0.68220000000000003 | BB106: 0.89760000000000006 | BC106: 0.91209999999999991 | BE106: =(AR106+AS106+AT106+AU106+AV106+AW106+AX106+AY106+AZ106+BA106+BB106+BC106)/12 -> -3.0999999999999825e-03 | BF106: =(AK106+AL106+AM106+AN106+AO106+AP106+AQ106+AR106+AS106+AT106+AU106+AV106+AV106+AW106+AX106+AY106+AZ106+BA106+BB106+BC106)/19 -> -4.2631578947368342e-03 | BG106: =(AV106+AW106)/2 -> -0.24429999999999999 | BH106: =(AW106+AX106)/2 -> -0.15679999999999999 | BI106: =(AX106+AY106)/2 -> -0.12395 | BJ106: =(AY106+AZ106)/2 -> -0.10485 | BK106: =(AZ106+BA106)/2 -> 0.27875 | BL106: =(BA106+BB106)/2 -> 0.78990000000000005 | BM106: =(BB106+BC106)/2 -> 0.90484999999999993 | BN106: =STDEV(AK106:BC106) -> 0.45140461719066699
B107: 605305.SH | C107: 中际联合 | J107: 0.17859999999999998 | K107: 0.16670000000000001 | L107: 0.18420000000000003 | M107: 0.12 | N107: 0.1414 | O107: 0.57140000000000002 | P107: 0.37780000000000002 | Q107: 0.33329999999999999 | R107: 0.52210000000000001 | S107: 0.2727 | T107: 0.88709999999999989 | U107: 0.5625 | V107: 0.30230000000000001 | W107: 1.1786000000000001 | X107: 0.14529999999999998 | Y107: 5.7099999999999998e-02 | AA107: =(N107+O107+P107+Q107+R107+S107+T107+U107+V107+W107+X107+Y107)/12 -> 0.44596666666666668 | AB107: =(J107+K107+L107+M107+N107+O107+P107+Q107+R107+S107+T107+U107+V107+W107+X107+Y107)/16 -> 0.37506875000000001 | AC107: =(R107+S107)/2 -> 0.39739999999999998 | AD107: =(S107+T107)/2 -> 0.57989999999999997 | AE107: =(T107+U107)/2 -> 0.72479999999999989 | AF107: =(U107+V107)/2 -> 0.43240000000000001 | AG107: =(V107+W107)/2 -> 0.74045000000000005 | AH107: =(W107+X107)/2 -> 0.66195000000000004 | AI107: =(X107+Y107)/2 -> 0.10119999999999998 | AJ107: =STDEV(G107:Y107) -> 0.30688403611950887
B108: 002768.SZ | C108: 国恩股份 | G108: 0.40000000000000002 | H108: 0.42859999999999998 | I108: 0.6724 | J108: 0.54549999999999998 | K108: 0.57140000000000002 | L108: 0.59999999999999998 | M108: 0.36700000000000005 | N108: 0.36469999999999997 | O108: 0.31819999999999998 | P108: 0.29170000000000001 | Q108: 0.2109 | R108: 0.2586 | S108: 0.31030000000000002 | T108: 2.1774 | U108: 1.6462999999999999 | V108: 0.84250000000000003 | W108: 7.8899999999999998e-02 | X108: -0.34009999999999996 | Y108: -0.25640000000000002 | AA108: =(N108+O108+P108+Q108+R108+S108+T108+U108+V108+W108+X108+Y108)/12 -> 0.49191666666666672 | AB108: =(G108+H108+I108+J108+K108+L108+M108+N108+O108+P108+Q108+R108+S108+T108+U108+V108+W108+X108+Y108)/19 -> 0.4993631578947369 | AC108: =(R108+S108)/2 -> 0.28444999999999998 | AD108: =(S108+T108)/2 -> 1.2438500000000001 | AE108: =(T108+U108)/2 -> 1.9118499999999998 | AF108: =(U108+V108)/2 -> 1.2444 | AG108: =(V108+W108)/2 -> 0.4607 | AH108: =(W108+X108)/2 -> -0.13059999999999999 | AI108: =(X108+Y108)/2 -> -0.29825000000000002 | AJ108: =STDEV(G108:Y108) -> 0.57986919905414525
B109: 603605.SH | C109: 珀莱雅 | I109: 0.68000000000000005 | J109: 0.27449999999999997 | K109: -2.7799999999999998e-02 | L109: 8.4700000000000011e-02 | M109: 8.3299999999999999e-02 | N109: 0.10769999999999999 | O109: 0.31430000000000002 | P109: 0.3594 | Q109: 0.31869999999999998 | R109: 0.36109999999999998 | S109: -0.1522 | T109: 2.3e-02 | U109: 0.18329999999999999 | V109: 0.20920000000000002 | W109: 0.4103 | X109: 0.2697 | Y109: 0.28170000000000001 | AA109: =(N109+O109+P109+Q109+R109+S109+T109+U109+V109+W109+X109+Y109)/12 -> 0.22384999999999999 | AB109: =(I109+J109+K109+L109+M109+N109+O109+P109+Q109+R109+S109+T109+U109+V109+W109+X109+Y109)/17 -> 0.22240588235294115 | AC109: =(R109+S109)/2 -> 0.10444999999999999 | AD109: =(S109+T109)/2 -> -6.4600000000000005e-02 | AE109: =(T109+U109)/2 -> 0.10314999999999999 | AF109: =(U109+V109)/2 -> 0.19625000000000001 | AG109: =(V109+W109)/2 -> 0.30975000000000003 | AH109: =(W109+X109)/2 -> 0.33999999999999997 | AI109: =(X109+Y109)/2 -> 0.2757 | AJ109: =STDEV(G109:Y109) -> 0.19441469038690287
B110: 600346.SH | C110: 恒力石化 | G110: 2.8332999999999999 | H110: -5.2600000000000001e-02 | I110: 0.53849999999999998 | J110: 0.55559999999999998 | K110: 0.21739999999999998 | L110: 0.55559999999999998 | M110: 0.40000000000000002 | N110: -0.31430000000000002 | O110: -0.75 | P110: 1.0356999999999998 | Q110: 0.75 | R110: 2 | S110: 3.4286000000000003 | T110: 0.38600000000000001 | U110: 0.43880000000000002 | V110: 0.33329999999999999 | W110: 0.90319999999999989 | X110: 0.55700000000000005 | Y110: 0.28370000000000001 | AA110: =(N110+O110+P110+Q110+R110+S110+T110+U110+V110+W110+X110+Y110)/12 -> 0.7543333333333333 | AB110: =(G110+H110+I110+J110+K110+L110+M110+N110+O110+P110+Q110+R110+S110+T110+U110+V110+W110+X110+Y110)/19 -> 0.74209473684210525 | AC110: =(R110+S110)/2 -> 2.7143000000000002 | AD110: =(S110+T110)/2 -> 1.9073000000000002 | AE110: =(T110+U110)/2 -> 0.41239999999999999 | AF110: =(U110+V110)/2 -> 0.38605 | AG110: =(V110+W110)/2 -> 0.61824999999999997 | AH110: =(W110+X110)/2 -> 0.73009999999999997 | AI110: =(X110+Y110)/2 -> 0.42035 | AJ110: =STDEV(G110:Y110) -> 1.0108436578058526
B111: 600810.SH | C111: 神马股份 | G111: 3.0323000000000002 | H111: 0.22219999999999998 | I111: -5.8799999999999998e-02 | J111: -0.21050000000000002 | K111: 1.3 | L111: 6.8182000000000009 | M111: 7 | N111: 8.8000000000000007 | O111: 0.82609999999999995 | P111: -0.20929999999999999 | Q111: -0.46090000000000003 | R111: -0.23129999999999998 | S111: -0.78569999999999995 | T111: -0.8234999999999999 | U111: -0.7681 | V111: -0.48670000000000002 | W111: 3.4443999999999999 | X111: 8.0833000000000013 | Y111: 10.25 | AA111: =(N111+O111+P111+Q111+R111+S111+T111+U111+V111+W111+X111+Y111)/12 -> 2.3031916666666667 | AB111: =(G111+H111+I111+J111+K111+L111+M111+N111+O111+P111+Q111+R111+S111+T111+U111+V111+W111+X111+Y111)/19 -> 2.4074578947368424 | AC111: =(R111+S111)/2 -> -0.50849999999999995 | AD111: =(S111+T111)/2 -> -0.80459999999999998 | AE111: =(T111+U111)/2 -> -0.79579999999999995 | AF111: =(U111+V111)/2 -> -0.62739999999999996 | AG111: =(V111+W111)/2 -> 1.47885 | AH111: =(W111+X111)/2 -> 5.7638500000000006 | AI111: =(X111+Y111)/2 -> 9.1666500000000006 | AJ111: =STDEV(G111:Y111) -> 3.7945081365216038 | BA111: 0.43509999999999999 | BB111: -6.6e-03 | BC111: 0.1192
B112: 002030.SZ | C112: 达安基因 | G112: 0 | H112: -0.22219999999999998 | I112: -0.16670000000000001 | J112: -0.26669999999999999 | K112: -0.25 | L112: 7.1399999999999991e-02 | M112: -2.e-02 | N112: 0.15820000000000001 | O112: 0.17999999999999999 | P112: -8.0000000000000002e-02 | Q112: -6.7299999999999999e-02 | R112: -0.17499999999999999 | S112: 5.0027999999999997 | T112: 7.0390999999999995 | U112: 10.983599999999999 | V112: 25.566100000000002 | W112: 5.0550999999999995 | X112: 1.0525 | Y112: 0.64230000000000009 | AA112: =(N112+O112+P112+Q112+R112+S112+T112+U112+V112+W112+X112+Y112)/12 -> 4.6131166666666665 | AB112: =(G112+H112+I112+J112+K112+L112+M112+N112+O112+P112+Q112+R112+S112+T112+U112+V112+W112+X112+Y112)/19 -> 2.8685894736842101 | AC112: =(R112+S112)/2 -> 2.4138999999999999 | AD112: =(S112+T112)/2 -> 6.0209499999999991 | AE112: =(T112+U112)/2 -> 9.0113500000000002 | AF112: =(U112+V112)/2 -> 18.274850000000001 | AG112: =(V112+W112)/2 -> 15.310600000000001 | AH112: =(W112+X112)/2 -> 3.0537999999999998 | AI112: =(X112+Y112)/2 -> 0.84740000000000004 | AJ112: =STDEV(G112:Y112) -> 6.3240466153576369
B113: 603565.SH | C113: 中谷物流 | U113: -0.31519999999999998 | V113: 0.15380000000000002 | W113: 1.9166999999999998 | X113: 2.9687999999999999 | Y113: 1.8412999999999999 | AA113: =(U113+V113+W113+X113+Y113)/5 -> 1.31308 | AB113: =(U113+V113+W113+X113+Y113)/5 -> 1.31308 | AC113: =(R113+S113)/2 -> 0 | AD113: =(S113+T113)/2 -> 0 | AE113: =(T113+U113)/2 -> -0.15759999999999999 | AF113: =(U113+V113)/2 -> -8.069999999999998e-02 | AG113: =(V113+W113)/2 -> 1.03525 | AH113: =(W113+X113)/2 -> 2.4427499999999998 | AI113: =(X113+Y113)/2 -> 2.4050500000000001 | AJ113: =STDEV(G113:Y113) -> 1.3583085131883699
B114: 605287.SH | C114: 德才股份 | X114: 0.32000000000000001 | Y114: 4.07e-02 | AA114: =(X114+Y114)/2 -> 0.18035000000000001 | AB114: =(X114+Y114)/2 -> 0.18035000000000001 | AC114: =(R114+S114)/2 -> 0 | AD114: =(S114+T114)/2 -> 0 | AE114: =(T114+U114)/2 -> 0 | AF114: =(U114+V114)/2 -> 0 | AG114: =(V114+W114)/2 -> 0 | AH114: =(W114+X114)/2 -> 0.16 | AI114: =(X114+Y114)/2 -> 0.18035000000000001 | AJ114: =STDEV(G114:Y114) -> 0.19749492398540272
B115: 000999.SZ | C115: 华润三九 | E115: 0.31969999999999998 | F115: 1.78 | G115: 0.1875 | H115: 0.16920000000000002 | I115: 0.1011 | J115: 9.0200000000000002e-02 | K115: 0.13159999999999999 | L115: 0.10529999999999999 | M115: 0.16329999999999997 | N115: 9.7699999999999995e-02 | O115: 1.7674000000000001 | P115: 1.0952 | Q115: 0.76319999999999988 | R115: 0.46579999999999999 | S115: -0.55459999999999998 | T115: -0.38640000000000002 | U115: -0.19399999999999998 | V115: -0.23829999999999998 | W115: 0.24530000000000002 | X115: 0.28699999999999998 | Y115: 9.8800000000000013e-02 | AA115: =(N115+O115+P115+Q115+R115+S115+T115+U115+V115+W115+X115+Y115)/12 -> 0.28725833333333334 | AB115: =(G115+H115+I115+J115+K115+L115+M115+N115+O115+P115+Q115+R115+S115+T115+U115+V115+W115+X115+Y115)/19 -> 0.23133157894736836 | AC115: =(R115+S115)/2 -> -4.4399999999999995e-02 | AD115: =(S115+T115)/2 -> -0.47050000000000003 | AE115: =(T115+U115)/2 -> -0.29020000000000001 | AF115: =(U115+V115)/2 -> -0.21614999999999998 | AG115: =(V115+W115)/2 -> 3.500000000000017e-03 | AH115: =(W115+X115)/2 -> 0.26615 | AI115: =(X115+Y115)/2 -> 0.19289999999999999 | AJ115: =STDEV(G115:Y115) -> 0.52473329209824038
B116: 605123.SH | C116: 派克新材 | E116: 0.40610000000000002 | F116: 2.8159999999999998 | T116: -0.15380000000000002 | U116: -2.7699999999999999e-02 | V116: -7.4200000000000002e-02 | W116: 0.75529999999999997 | X116: 0.36259999999999998 | Y116: 0.22260000000000002 | AA116: =(T116+U116+V116+W116+X116+Y116)/6 -> 0.18079999999999999 | AB116: =(T116+U116+V116+W116+X116+Y116)/6 -> 0.18079999999999999 | AC116: =(R116+S116)/2 -> 0 | AD116: =(S116+T116)/2 -> -7.690000000000001e-02 | AE116: =(T116+U116)/2 -> -9.0750000000000011e-02 | AF116: =(U116+V116)/2 -> -5.0950000000000002e-02 | AG116: =(V116+W116)/2 -> 0.34054999999999996 | AH116: =(W116+X116)/2 -> 0.55894999999999995 | AI116: =(X116+Y116)/2 -> 0.29259999999999997 | AJ116: =STDEV(G116:Y116) -> 0.34214123984109257
B117: 002460.SZ | C117: 赣锋锂业 | G117: 0.28570000000000001 | H117: 0.45950000000000002 | I117: 0.40619999999999995 | J117: 1.129 | K117: 0.16670000000000001 | L117: 0.22219999999999998 | M117: -4.4400000000000002e-02 | N117: -0.1061 | O117: 4.7599999999999996e-02 | P117: -0.65150000000000008 | Q117: -0.70930000000000004 | R117: -0.76269999999999993 | S117: -0.95450000000000002 | T117: -0.4783 | U117: 0 | V117: 1.8213999999999999 | W117: 35 | X117: 766.67 | Y117: 6.0800000000000001 | AA117: =(T117+U117+V117+W117+X117+Y117)/6 -> 134.84885 | AB117: =(T117+U117+V117+W117+X117+Y117)/6 -> 134.84885 | AC117: =(R117+S117)/2 -> -0.85860000000000003 | AD117: =(S117+T117)/2 -> -0.71640000000000004 | AE117: =(T117+U117)/2 -> -0.23915 | AF117: =(U117+V117)/2 -> 0.91069999999999995 | AG117: =(V117+W117)/2 -> 18.410699999999999 | AH117: =(W117+X117)/2 -> 400.83499999999998 | AI117: =(X117+Y117)/2 -> 386.375 | AJ117: =STDEV(G117:Y117) -> 175.53757241198181
B118: 603659.SH | C118: 璞泰来 | I118: 0.69230000000000003 | J118: 0.23960000000000001 | K118: 0.36359999999999998 | L118: 0.11320000000000001 | M118: 0.125 | N118: 0.15130000000000002 | O118: 0 | P118: 3.39e-02 | Q118: 6.0599999999999994e-02 | R118: 9.4899999999999998e-02 | S118: -0.29999999999999999 | T118: -0.26229999999999998 | U118: -0.35240000000000005 | V118: 1.3300000000000001e-02 | W118: 2.1905000000000001 | X118: 1.4888999999999999 | Y118: 1.6029 | AA118: =(T118+U118+V118+W118+X118+Y118)/6 -> 0.78015000000000001 | AB118: =(T118+U118+V118+W118+X118+Y118)/6 -> 0.78015000000000001 | AC118: =(R118+S118)/2 -> -0.10255 | AD118: =(S118+T118)/2 -> -0.28115000000000001 | AE118: =(T118+U118)/2 -> -0.30735000000000001 | AF118: =(U118+V118)/2 -> -0.16955000000000003 | AG118: =(V118+W118)/2 -> 1.1019000000000001 | AH118: =(W118+X118)/2 -> 1.8397000000000001 | AI118: =(X118+Y118)/2 -> 1.5459000000000001 | AJ118: =STDEV(G118:Y118) -> 0.72023971275092113
B119: 605389.SH | C119: 长龄液压 | V119: 0.38630000000000003 | W119: 0.69489999999999996 | X119: -0.11320000000000001 | Y119: -0.24359999999999998 | AA119: =(T119+U119+V119+W119+X119+Y119)/6 -> 0.12073333333333332 | AB119: =(T119+U119+V119+W119+X119+Y119)/6 -> 0.12073333333333332 | AC119: =(R119+S119)/2 -> 0 | AD119: =(S119+T119)/2 -> 0 | AE119: =(T119+U119)/2 -> 0 | AF119: =(U119+V119)/2 -> 0.19315000000000002 | AG119: =(V119+W119)/2 -> 0.54059999999999997 | AH119: =(W119+X119)/2 -> 0.29085 | AI119: =(X119+Y119)/2 -> -0.1784 | AJ119: =STDEV(G119:Y119) -> 0.43706599806741625
B120: 600389.SH | C120: 江山股份 | G120: 4.4256000000000002 | H120: 14.893599999999999 | I120: 9.8050999999999995 | J120: 3.7523 | K120: 1.1720999999999999 | L120: 1.7527999999999999 | M120: 1.9731000000000001 | N120: 0.57489999999999997 | O120: 7.2900000000000006e-02 | P120: 8.8999999999999999e-03 | Q120: -2.7200000000000002e-02 | R120: -0.23469999999999999 | S120: 7.6499999999999999e-02 | T120: 0.14410000000000001 | U120: 3.3500000000000002e-02 | V120: 0.1162 | W120: 0.19550000000000001 | X120: 0.45150000000000001 | Y120: 1.0109999999999999 | AA120: =(T120+U120+V120+W120+X120+Y120)/6 -> 0.32529999999999998 | AB120: =(T120+U120+V120+W120+X120+Y120)/6 -> 0.32529999999999998 | AC120: =(R120+S120)/2 -> -7.9100000000000004e-02 | AD120: =(S120+T120)/2 -> 0.11030000000000001 | AE120: =(T120+U120)/2 -> 8.8800000000000004e-02 | AF120: =(U120+V120)/2 -> 7.485e-02 | AG120: =(V120+W120)/2 -> 0.15584999999999999 | AH120: =(W120+X120)/2 -> 0.32350000000000001 | AI120: =(X120+Y120)/2 -> 0.73124999999999996 | AJ120: =STDEV(G120:Y120) -> 3.9201502649845543 | AK120: -0.73730000000000007 | AL120: -0.54259999999999997 | AM120: -0.41200000000000003 | AN120: -0.22289999999999999 | AO120: 0.28820000000000001 | AP120: 0.17780000000000001 | AQ120: 0.17280000000000001 | AR120: 1.4499999999999999e-02 | AS120: 4.9699999999999994e-02 | AT120: 0.45289999999999997 | AU120: 0.37759999999999999 | AV120: 0.44950000000000001 | AW120: 0.1923 | AX120: 3.6499999999999998e-02 | AY120: 7.6100000000000001e-02 | AZ120: 3.0200000000000001e-02 | BA120: 0.30499999999999999 | BB120: 0.19789999999999999 | BC120: 0.25069999999999998 | BE120: =(AR120+AS120+AT120+AU120+AV120+AW120+AX120+AY120+AZ120+BA120+BB120+BC120)/12 -> 0.20274166666666668 | BF120: =(AK120+AL120+AM120+AN120+AO120+AP120+AQ120+AR120+AS120+AT120+AU120+AV120+AV120+AW120+AX120+AY120+AZ120+BA120+BB120+BC120)/19 -> 8.4547368421052621e-02 | BG120: =(AV120+AW120)/2 -> 0.32090000000000002 | BH120: =(AW120+AX120)/2 -> 0.1144 | BI120: =(AX120+AY120)/2 -> 5.6300000000000003e-02 | BJ120: =(AY120+AZ120)/2 -> 5.3150000000000003e-02 | BK120: =(AZ120+BA120)/2 -> 0.1676 | BL120: =(BA120+BB120)/2 -> 0.25145000000000001 | BM120: =(BB120+BC120)/2 -> 0.2243 | BN120: =STDEV(AK120:BC120) -> 0.32694110902719131
B121: 600104.SH | C121: 上汽集团 | G121: 1.4000000000000002e-03 | H121: 9.4999999999999998e-03 | I121: 1.34e-02 | J121: 1.9299999999999998e-02 | K121: 0.15259999999999999 | L121: 0.1784 | M121: 0.1164 | N121: 4.1599999999999998e-02 | O121: -0.15039999999999998 | P121: -0.27510000000000001 | Q121: -0.24859999999999999 | R121: -0.28910000000000002 | S121: -0.8640000000000001 | T121: -0.39049999999999996 | U121: -0.19889999999999999 | V121: -0.20039999999999999 | W121: 5.1562000000000001 | X121: 0.60170000000000001 | Y121: 0.23280000000000001 | AA121: =(N121+O121+P121+Q121+R121+S121+T121+U121+V121+W121+X121+Y121)/12 -> 0.28460833333333335 | AB121: =(G121+H121+I121+J121+K121+L121+M121+N121+O121+P121+Q121+R121+S121+T121+U121+V121+W121+X121+Y121)/19 -> 0.20559473684210525 | AC121: =(R121+S121)/2 -> -0.57655000000000012 | AD121: =(S121+T121)/2 -> -0.62725000000000009 | AE121: =(T121+U121)/2 -> -0.29469999999999996 | AF121: =(U121+V121)/2 -> -0.19964999999999999 | AG121: =(V121+W121)/2 -> 2.4779 | AH121: =(W121+X121)/2 -> 2.8789500000000001 | AI121: =(X121+Y121)/2 -> 0.41725000000000001 | AJ121: =STDEV(G121:Y121) -> 1.2358745915673934
B122: 002900.SZ | C122: 哈三联 | I122: -0.27399999999999997 | J122: -0.3604 | K122: 0.8125 | L122: 0.35289999999999999 | M122: 7.5499999999999998e-02 | N122: -8.4499999999999992e-02 | O122: -0.4138 | P122: -0.19570000000000001 | Q122: -0.15789999999999998 | R122: -0.1231 | S122: -0.4118 | T122: -0.75680000000000003 | U122: -0.85420000000000007 | V122: -0.84209999999999996 | W122: 16.800000000000001 | X122: 20 | Y122: 23.857099999999999 | AA122: =(T122+U122+V122+W122+X122+Y122)/6 -> 9.7006666666666685 | AB122: =(T122+U122+V122+W122+X122+Y122)/6 -> 9.7006666666666685 | AC122: =(R122+S122)/2 -> -0.26745000000000002 | AD122: =(S122+T122)/2 -> -0.58430000000000004 | AE122: =(T122+U122)/2 -> -0.8055000000000001 | AF122: =(U122+V122)/2 -> -0.84814999999999996 | AG122: =(V122+W122)/2 -> 7.9789500000000002 | AH122: =(W122+X122)/2 -> 18.399999999999999 | AI122: =(X122+Y122)/2 -> 21.928550000000001 | AJ122: =STDEV(G122:Y122) -> 8.1427305029502524 | BA122: -0.25170000000000003 | BB122: -0.3145 | BC122: -0.28649999999999998
B123: 600511.SH | C123: 国药股份 | G123: 0.23670000000000002 | H123: 8.8900000000000007e-02 | I123: 4.2199999999999994e-02 | J123: 8.5500000000000007e-02 | K123: 4.7899999999999998e-02 | L123: 5.62e-02 | M123: 7.6499999999999999e-02 | N123: 0.1812 | O123: 0.12759999999999999 | P123: 0.1905 | Q123: 0.13089999999999999 | R123: 0.14949999999999999 | S123: -0.17929999999999999 | T123: -0.1678 | U123: -4.9800000000000004e-02 | V123: -0.12939999999999999 | W123: 0.28360000000000002 | X123: 0.23550000000000001 | Y123: 0.2954 | AA123: =(N123+O123+P123+Q123+R123+S123+T123+U123+V123+W123+X123+Y123)/12 -> 8.8991666666666649e-02 | AB123: =(G123+H123+I123+J123+K123+L123+M123+N123+O123+P123+Q123+R123+S123+T123+U123+V123+W123+X123+Y123)/19 -> 8.9568421052631575e-02 | AC123: =(R123+S123)/2 -> -1.4899999999999997e-02 | AD123: =(S123+T123)/2 -> -0.17354999999999998 | AE123: =(T123+U123)/2 -> -0.10880000000000001 | AF123: =(U123+V123)/2 -> -8.9599999999999999e-02 | AG123: =(V123+W123)/2 -> 7.7100000000000016e-02 | AH123: =(W123+X123)/2 -> 0.25955 | AI123: =(X123+Y123)/2 -> 0.26545000000000002 | AJ123: =STDEV(G123:Y123) -> 0.1413170904684905 | AK123: 1.7763 | AL123: 7.1900000000000006e-02 | AM123: 7.8799999999999995e-02 | AN123: 6.6500000000000004e-02 | AO123: 4.3499999999999997e-02 | AP123: 9.2699999999999991e-02 | AQ123: 0.1103 | AR123: 8.7799999999999989e-02 | AS123: 9.1899999999999996e-02 | AT123: 0.11509999999999999 | AU123: 9.8299999999999998e-02 | AV123: 0.11449999999999999 | AW123: -8.9399999999999993e-02 | AX123: -0.1249 | AY123: -0.129 | AZ123: -9.5899999999999999e-02 | BA123: 8.0299999999999996e-02 | BB123: 0.14029999999999998 | BC123: 0.1447 | BE123: =(AR123+AS123+AT123+AU123+AV123+AW123+AX123+AY123+AZ123+BA123+BB123+BC123)/12 -> 3.6141666666666662e-02 | BF123: =(AK123+AL123+AM123+AN123+AO123+AP123+AQ123+AR123+AS123+AT123+AU123+AV123+AV123+AW123+AX123+AY123+AZ123+BA123+BB123+BC123)/19 -> 0.14674736842105263 | BG123: =(AV123+AW123)/2 -> 1.2549999999999999e-02 | BH123: =(AW123+AX123)/2 -> -0.10715 | BI123: =(AX123+AY123)/2 -> -0.12695000000000001 | BJ123: =(AY123+AZ123)/2 -> -0.11244999999999999 | BK123: =(AZ123+BA123)/2 -> -7.8000000000000014e-03 | BL123: =(BA123+BB123)/2 -> 0.11029999999999998 | BM123: =(BB123+BC123)/2 -> 0.14249999999999999 | BN123: =STDEV(AK123:BC123) -> 0.40593683085336668
B124: 600801.SH | C124: 华新水泥 | G124: 1.6666999999999998 | H124: 48 | I124: 5.3635999999999999 | J124: 3.6332999999999998 | K124: 4.8332999999999995 | L124: 1.0204 | M124: 1.3286000000000002 | N124: 0.77700000000000002 | O124: 0.37140000000000001 | P124: 0.52529999999999999 | Q124: 0.41720000000000002 | R124: 0.22670000000000001 | S124: -0.64579999999999993 | T124: -0.2848 | U124: -0.16449999999999998 | V124: -0.11220000000000001 | W124: 1.0588 | X124: 9.2600000000000002e-02 | Y124: -0.10880000000000001 | AA124: =(T124+U124+V124+W124+X124+Y124)/6 -> 8.0183333333333329e-02 | AB124: =(T124+U124+V124+W124+X124+Y124)/6 -> 8.0183333333333329e-02 | AC124: =(R124+S124)/2 -> -0.20954999999999996 | AD124: =(S124+T124)/2 -> -0.46529999999999994 | AE124: =(T124+U124)/2 -> -0.22464999999999999 | AF124: =(U124+V124)/2 -> -0.13835 | AG124: =(V124+W124)/2 -> 0.4733 | AH124: =(W124+X124)/2 -> 0.57569999999999999 | AI124: =(X124+Y124)/2 -> -8.100000000000003e-03 | AJ124: =STDEV(G124:Y124) -> 10.889537938583434
B125: 601628.SH | C125: 中国人寿 | G125: 0.16670000000000001 | H125: 0.19440000000000002 | I125: 1 | J125: 0.71209999999999996 | K125: 1.2856999999999998 | L125: 0.3256 | M125: -0.26600000000000001 | N125: -0.65489999999999993 | O125: 0.91670000000000007 | P125: 1.3158000000000001 | Q125: 1.9419999999999999 | R125: 4.2564000000000002 | S125: -0.3478 | T125: -0.18940000000000001 | U125: -0.18230000000000002 | V125: -0.1366 | W125: 0.68330000000000002 | X125: 0.35509999999999997 | Y125: 3.61e-02 | AA125: =(N125+O125+P125+Q125+R125+S125+T125+U125+V125+W125+X125+Y125)/12 -> 0.66620000000000013 | AB125: =(G125+H125+I125+J125+K125+L125+M125+N125+O125+P125+Q125+R125+S125+T125+U125+V125+W125+X125+Y125)/19 -> 0.6006789473684212 | AC125: =(R125+S125)/2 -> 1.9543000000000001 | AD125: =(S125+T125)/2 -> -0.26860000000000001 | AE125: =(T125+U125)/2 -> -0.18585000000000002 | AF125: =(U125+V125)/2 -> -0.15945000000000001 | AG125: =(V125+W125)/2 -> 0.27334999999999998 | AH125: =(W125+X125)/2 -> 0.51919999999999999 | AI125: =(X125+Y125)/2 -> 0.1956 | AJ125: =STDEV(G125:Y125) -> 1.1115272129317029
B126: 603678.SH | C126: 火炬电子 | G126: -0.57889999999999997 | H126: 0.23809999999999998 | I126: 4.3200000000000002e-02 | J126: 0.15560000000000002 | K126: 0.5 | L126: 0.5 | M126: 0.55559999999999998 | N126: 0.42310000000000003 | O126: 0.33329999999999999 | P126: 0.2051 | Q126: 0.1429 | R126: 0.1351 | S126: -6.25e-02 | T126: 0.2979 | U126: 0.46869999999999995 | V126: 0.60709999999999997 | W126: 2.7332999999999998 | X126: 0.96719999999999995 | Y126: 0.81909999999999994 | AA126: =(T126+U126+V126+W126+X126+Y126)/6 -> 0.98221666666666652 | AB126: =(T126+U126+V126+W126+X126+Y126)/6 -> 0.98221666666666652 | AC126: =(R126+S126)/2 -> 3.6299999999999999e-02 | AD126: =(S126+T126)/2 -> 0.1177 | AE126: =(T126+U126)/2 -> 0.38329999999999997 | AF126: =(U126+V126)/2 -> 0.53789999999999993 | AG126: =(V126+W126)/2 -> 1.6701999999999999 | AH126: =(W126+X126)/2 -> 1.85025 | AI126: =(X126+Y126)/2 -> 0.89314999999999989 | AJ126: =STDEV(G126:Y126) -> 0.64839190187806373
B127: 600884.SH | C127: 杉杉股份 | G127: -0.18679999999999999 | H127: 0.4047 | I127: 0.55020000000000002 | J127: 0.97519999999999996 | K127: 0.79730000000000001 | L127: 0.37420000000000003 | M127: 1.2518 | N127: 0.24440000000000001 | O127: -0.75939999999999996 | P127: -0.53010000000000002 | Q127: -0.72739999999999994 | R127: -0.75829999999999997 | S127: -3.3437000000000001 | T127: -0.5897 | U127: -0.2109 | V127: -0.58329999999999993 | W127: 3.48 | X127: 4.8375000000000004 | Y127: 7.4058999999999999 | AA127: =(T127+U127+V127+W127+X127+Y127)/6 -> 2.3899166666666667 | AB127: =(T127+U127+V127+W127+X127+Y127)/6 -> 2.3899166666666667 | AC127: =(R127+S127)/2 -> -2.0510000000000002 | AD127: =(S127+T127)/2 -> -1.9667000000000001 | AE127: =(T127+U127)/2 -> -0.40029999999999999 | AF127: =(U127+V127)/2 -> -0.39709999999999995 | AG127: =(V127+W127)/2 -> 1.44835 | AH127: =(W127+X127)/2 -> 4.1587500000000004 | AI127: =(X127+Y127)/2 -> 6.1217000000000006 | AJ127: =STDEV(G127:Y127) -> 2.3533768160711221 | AK127: 0.10009999999999999 | AL127: 0.34360000000000002 | AM127: 0.57879999999999998 | AN127: -2.7799999999999998e-02 | AO127: 0.60439999999999994 | AP127: 0.29210000000000003 | AQ127: 0.1075 | AR127: 0.21940000000000001 | AS127: -0.1222 | AT127: -0.2311 | AU127: -0.1462 | AV127: -0.20000000000000001 | AW127: -0.191 | AX127: 7.2999999999999995e-02 | AY127: -8.09e-02 | AZ127: -0.17199999999999999 | BA127: 0.54620000000000002 | BB127: 0.623 | BC127: 1.2546999999999999 | BE127: =(AR127+AS127+AT127+AU127+AV127+AW127+AX127+AY127+AZ127+BA127+BB127+BC127)/12 -> 0.131075 | BF127: =(AK127+AL127+AM127+AN127+AO127+AP127+AQ127+AR127+AS127+AT127+AU127+AV127+AV127+AW127+AX127+AY127+AZ127+BA127+BB127+BC127)/19 -> 0.17745263157894736 | BG127: =(AV127+AW127)/2 -> -0.19550000000000001 | BH127: =(AW127+AX127)/2 -> -5.9000000000000004e-02 | BI127: =(AX127+AY127)/2 -> -3.9500000000000021e-03 | BJ127: =(AY127+AZ127)/2 -> -0.12645000000000001 | BK127: =(AZ127+BA127)/2 -> 0.18710000000000002 | BL127: =(BA127+BB127)/2 -> 0.58460000000000001 | BM127: =(BB127+BC127)/2 -> 0.93884999999999996 | BN127: =STDEV(AK127:BC127) -> 0.39237035024882544
B128: 600211.SH | C128: 西藏药业 | G128: 1.6812 | H128: -0.11900000000000001 | I128: 1.11e-02 | J128: 3.7000000000000002e-03 | K128: 2.7000000000000003e-02 | L128: 0.94590000000000007 | M128: 0.57140000000000002 | N128: -0.12089999999999999 | O128: 2.63e-02 | P128: 0.2361 | Q128: 4.9000000000000002e-02 | R128: 0.45829999999999999 | S128: 0.87180000000000002 | T128: 0.23600000000000002 | U128: 0.11109999999999999 | V128: -3.4300000000000004e-02 | W128: -0.13699999999999998 | X128: 9.0899999999999995e-02 | Y128: 0.12670000000000001 | AA128: =(N128+O128+P128+Q128+R128+S128+T128+U128+V128+W128+X128+Y128)/12 -> 0.1595 | AB128: =(G128+H128+I128+J128+K128+L128+M128+N128+O128+P128+Q128+R128+S128+T128+U128+V128+W128+X128+Y128)/19 -> 0.26501578947368426 | AC128: =(R128+S128)/2 -> 0.66505000000000003 | AD128: =(S128+T128)/2 -> 0.55390000000000006 | AE128: =(T128+U128)/2 -> 0.17355000000000001 | AF128: =(U128+V128)/2 -> 3.839999999999999e-02 | AG128: =(V128+W128)/2 -> -8.564999999999999e-02 | AH128: =(W128+X128)/2 -> -2.3049999999999994e-02 | AI128: =(X128+Y128)/2 -> 0.10880000000000001 | AJ128: =STDEV(G128:Y128) -> 0.46452355192433215
B129: 600976.SH | C129: 健民集团 | E129: 0.44229999999999997 | F129: 1.6899999999999999 | G129: -0.20000000000000001 | H129: 0.14810000000000001 | I129: 0.27029999999999998 | J129: 0.40479999999999999 | K129: 0.58329999999999993 | L129: 0.22579999999999997 | M129: 2.1299999999999999e-02 | N129: -0.1017 | O129: -5.2600000000000001e-02 | P129: -5.2600000000000001e-02 | Q129: 0 | R129: 0.1321 | S129: -0.33329999999999999 | T129: 2.7799999999999998e-02 | U129: 0.70829999999999993 | V129: 0.59999999999999998 | W129: 2.8332999999999999 | X129: 1.9730000000000001 | Y129: 1.0609999999999999 | AA129: =(N129+O129+P129+Q129+R129+S129+T129+U129+V129+W129+X129+Y129)/12 -> 0.56627499999999997 | AB129: =(G129+H129+I129+J129+K129+L129+M129+N129+O129+P129+Q129+R129+S129+T129+U129+V129+W129+X129+Y129)/19 -> 0.43415263157894729 | AC129: =(R129+S129)/2 -> -0.10059999999999999 | AD129: =(S129+T129)/2 -> -0.15275 | AE129: =(T129+U129)/2 -> 0.36804999999999999 | AF129: =(U129+V129)/2 -> 0.65415000000000001 | AG129: =(V129+W129)/2 -> 1.71665 | AH129: =(W129+X129)/2 -> 2.4031500000000001 | AI129: =(X129+Y129)/2 -> 1.5169999999999999 | AJ129: =STDEV(G129:Y129) -> 0.78747739464445798
B130: 605180.SH | C130: 华生科技 | V130: 0.24350000000000002 | W130: 2.8125 | X130: 1.3653999999999999 | Y130: 0.79790000000000005 | AA130: =(N130+O130+P130+Q130+R130+S130+T130+U130+V130+W130+X130+Y130)/12 -> 0.43494166666666673 | AB130: =(G130+H130+I130+J130+K130+L130+M130+N130+O130+P130+Q130+R130+S130+T130+U130+V130+W130+X130+Y130)/19 -> 0.2747 | AC130: =(R130+S130)/2 -> 0 | AD130: =(S130+T130)/2 -> 0 | AE130: =(T130+U130)/2 -> 0 | AF130: =(U130+V130)/2 -> 0.12175000000000001 | AG130: =(V130+W130)/2 -> 1.528 | AH130: =(W130+X130)/2 -> 2.0889500000000001 | AI130: =(X130+Y130)/2 -> 1.08165 | AJ130: =STDEV(G130:Y130) -> 1.1045567659322297
B131: 603290.SH | C131: 斯达半导 | R131: 0.39510000000000001 | S131: 0.125 | T131: -2.5699999999999997e-02 | U131: 0 | V131: 1.77e-02 | W131: 1.6111000000000002 | X131: 0.82930000000000004 | Y131: 0.93700000000000006 | AA131: =(N131+O131+P131+Q131+R131+S131+T131+U131+V131+W131+X131+Y131)/12 -> 0.324125 | AB131: =(G131+H131+I131+J131+K131+L131+M131+N131+O131+P131+Q131+R131+S131+T131+U131+V131+W131+X131+Y131)/19 -> 0.20471052631578948 | AC131: =(R131+S131)/2 -> 0.26005 | AD131: =(S131+T131)/2 -> 4.965e-02 | AE131: =(T131+U131)/2 -> -1.2849999999999999e-02 | AF131: =(U131+V131)/2 -> 8.8500000000000002e-03 | AG131: =(V131+W131)/2 -> 0.81440000000000012 | AH131: =(W131+X131)/2 -> 1.2202000000000002 | AI131: =(X131+Y131)/2 -> 0.8831500000000001 | AJ131: =STDEV(G131:Y131) -> 0.59076550928797944
B132: 002709.SZ | C132: 天赐材料 | G132: -9.0899999999999995e-02 | H132: -8.3299999999999999e-02 | I132: -0.1414 | J132: -0.252 | K132: 5.0499999999999998 | L132: 1.3999999999999999 | M132: 2.35e-02 | N132: -8.6999999999999994e-02 | O132: -0.9587 | P132: -0.93180000000000007 | Q132: -0.80459999999999998 | R132: -0.96430000000000005 | S132: 0.59999999999999998 | T132: 2.7777999999999996 | U132: 2.2940999999999998 | V132: 31.666700000000002 | W132: 5.625 | X132: 1.4706000000000001 | Y132: 1.9643000000000002 | AA132: =(N132+O132+P132+Q132+R132+S132+T132+U132+V132+W132+X132+Y132)/12 -> 3.5543416666666672 | AB132: =(G132+H132+I132+J132+K132+L132+M132+N132+O132+P132+Q132+R132+S132+T132+U132+V132+W132+X132+Y132)/19 -> 2.5556842105263158 | AC132: =(R132+S132)/2 -> -0.18215000000000003 | AD132: =(S132+T132)/2 -> 1.6888999999999998 | AE132: =(T132+U132)/2 -> 2.5359499999999997 | AF132: =(U132+V132)/2 -> 16.980399999999999 | AG132: =(V132+W132)/2 -> 18.645850000000003 | AH132: =(W132+X132)/2 -> 3.5478000000000001 | AI132: =(X132+Y132)/2 -> 1.7174500000000001 | AJ132: =STDEV(G132:Y132) -> 7.3053091043632374
B133: 002714.SZ | C133: 牧原股份 | G133: 0.83329999999999993 | H133: -0.40380000000000005 | I133: -0.4647 | J133: -0.47560000000000002 | K133: -0.89390000000000003 | L133: -1.0645 | M133: -0.81319999999999992 | N133: -0.85589999999999999 | O133: -4.7142999999999997 | P133: 0 | Q133: 1.2941 | R133: 8.7646999999999995 | S133: 5.2308000000000003 | T133: 53.25 | U133: 9.4359000000000002 | V133: 3.4939999999999998 | W133: 0.71819999999999995 | X133: -0.12920000000000001 | Y133: -0.59209999999999996 | AA133: =(N133+O133+P133+Q133+R133+S133+T133+U133+V133+W133+X133+Y133)/12 -> 6.3246833333333328 | AB133: =(G133+H133+I133+J133+K133+L133+M133+N133+O133+P133+Q133+R133+S133+T133+U133+V133+W133+X133+Y133)/19 -> 3.8217789473684207 | AC133: =(R133+S133)/2 -> 6.9977499999999999 | AD133: =(S133+T133)/2 -> 29.240400000000001 | AE133: =(T133+U133)/2 -> 31.342950000000002 | AF133: =(U133+V133)/2 -> 6.46495 | AG133: =(V133+W133)/2 -> 2.1060999999999996 | AH133: =(W133+X133)/2 -> 0.29449999999999998 | AI133: =(X133+Y133)/2 -> -0.36064999999999997 | AJ133: =STDEV(G133:Y133) -> 12.456328499315738
B134: 000422.SZ | C134: 湖北宜化 | G134: 1.8 | H134: 0.27779999999999999 | I134: -73 | J134: -3.0105 | K134: -11.976199999999999 | L134: 7.5216999999999992 | M134: 1.2082999999999999 | N134: 1.0401 | O134: 1.0043 | P134: -1.1786000000000001 | Q134: -0.88329999999999997 | R134: -0.59999999999999998 | S134: -106.5 | T134: -7.6171000000000006 | U134: -1.0856999999999999 | V134: 0.4022 | W134: 2.1185 | X134: 3.6789999999999998 | Y134: 553 | AA134: =(N134+O134+P134+Q134+R134+S134+T134+U134+V134+W134+X134+Y134)/12 -> 36.948283333333329 | AB134: =(G134+H134+I134+J134+K134+L134+M134+N134+O134+P134+Q134+R134+S134+T134+U134+V134+W134+X134+Y134)/19 -> 19.273710526315792 | AC134: =(R134+S134)/2 -> -53.549999999999997 | AD134: =(S134+T134)/2 -> -57.058549999999997 | AE134: =(T134+U134)/2 -> -4.3513999999999999 | AF134: =(U134+V134)/2 -> -0.34174999999999994 | AG134: =(V134+W134)/2 -> 1.2603500000000001 | AH134: =(W134+X134)/2 -> 2.8987499999999997 | AI134: =(X134+Y134)/2 -> 278.33949999999999 | AJ134: =STDEV(G134:Y134) -> 132.43825746489023 | AK134: -0.10830000000000001 | AL134: -0.1333 | AM134: -0.21179999999999999 | AN134: -0.14829999999999999 | AO134: -0.27160000000000001 | AP134: -0.25530000000000003 | AQ134: -9.2899999999999996e-02 | AR134: -5.7999999999999996e-02 | AS134: 0.13009999999999999 | AT134: 0.26979999999999998 | AU134: 7.9600000000000004e-02 | AV134: 5.9500000000000004e-02 | AW134: -0.26239999999999997 | AX134: -0.26079999999999998 | AY134: -0.16269999999999998 | AZ134: -0.32590000000000002 | BA134: 5.0099999999999999e-02 | BB134: 0.31059999999999999 | BC134: 0.54490000000000005 | BE134: =(AR134+AS134+AT134+AU134+AV134+AW134+AX134+AY134+AZ134+BA134+BB134+BC134)/12 -> 3.1233333333333339e-02 | BF134: =(AK134+AL134+AM134+AN134+AO134+AP134+AQ134+AR134+AS134+AT134+AU134+AV134+AV134+AW134+AX134+AY134+AZ134+BA134+BB134+BC134)/19 -> -4.1431578947368423e-02 | BG134: =(AV134+AW134)/2 -> -0.10144999999999998 | BH134: =(AW134+AX134)/2 -> -0.26159999999999994 | BI134: =(AX134+AY134)/2 -> -0.21174999999999999 | BJ134: =(AY134+AZ134)/2 -> -0.24430000000000002 | BK134: =(AZ134+BA134)/2 -> -0.13790000000000002 | BL134: =(BA134+BB134)/2 -> 0.18034999999999998 | BM134: =(BB134+BC134)/2 -> 0.42775000000000002 | BN134: =STDEV(AK134:BC134) -> 0.23268990860639288
B135: 002975.SZ | C135: 博杰股份 | P135: -0.22219999999999998 | Q135: -0.37130000000000002 | R135: -0.42859999999999998 | S135: -0.71299999999999997 | T135: -0.1143 | U135: 0.76379999999999992 | V135: 1 | W135: 0.871 | X135: 0.17739999999999997 | Y135: -0.26340000000000002 | AA135: =(N135+O135+P135+Q135+R135+S135+T135+U135+V135+W135+X135+Y135)/12 -> 5.8283333333333298e-02 | AB135: =(G135+H135+I135+J135+K135+L135+M135+N135+O135+P135+Q135+R135+S135+T135+U135+V135+W135+X135+Y135)/19 -> 3.6810526315789453e-02 | AC135: =(R135+S135)/2 -> -0.57079999999999997 | AD135: =(S135+T135)/2 -> -0.41364999999999996 | AE135: =(T135+U135)/2 -> 0.32474999999999998 | AF135: =(U135+V135)/2 -> 0.88189999999999991 | AG135: =(V135+W135)/2 -> 0.9355 | AH135: =(W135+X135)/2 -> 0.5242 | AI135: =(X135+Y135)/2 -> -4.3000000000000024e-02 | AJ135: =STDEV(G135:Y135) -> 0.60427492859900556
B136: 600745.SH | C136: 闻泰科技 | G136: 21 | H136: 8 | I136: 7.7999999999999998 | J136: 5.5 | K136: -1.4091 | L136: -2.0369999999999999 | M136: -1.6136000000000001 | N136: -0.80769999999999997 | O136: 1.7778 | P136: 2.1071 | Q136: 4.0741000000000005 | R136: 16.600000000000001 | S136: 7.1429 | T136: 3.8710000000000004 | U136: 1.3734999999999999 | V136: 0.17050000000000001 | W136: -7.0199999999999999e-02 | X136: -0.33770000000000006 | Y136: -0.16239999999999999 | AA136: =(N136+O136+P136+Q136+R136+S136+T136+U136+V136+W136+X136+Y136)/12 -> 2.9782416666666669 | AB136: =(G136+H136+I136+J136+K136+L136+M136+N136+O136+P136+Q136+R136+S136+T136+U136+V136+W136+X136+Y136)/19 -> 3.841010526315789 | AC136: =(R136+S136)/2 -> 11.871450000000001 | AD136: =(S136+T136)/2 -> 5.5069499999999998 | AE136: =(T136+U136)/2 -> 2.6222500000000002 | AF136: =(U136+V136)/2 -> 0.77200000000000002 | AG136: =(V136+W136)/2 -> 5.0150000000000007e-02 | AH136: =(W136+X136)/2 -> -0.20395000000000002 | AI136: =(X136+Y136)/2 -> -0.25004999999999999 | AJ136: =STDEV(G136:Y136) -> 6.2048030307975246
B137: 601156.SH | C137: 东航物流 | X137: 0.17780000000000001 | Y137: 0.36670000000000003 | AA137: =(N137+O137+P137+Q137+R137+S137+T137+U137+V137+W137+X137+Y137)/12 -> 4.5374999999999999e-02 | AB137: =(G137+H137+I137+J137+K137+L137+M137+N137+O137+P137+Q137+R137+S137+T137+U137+V137+W137+X137+Y137)/19 -> 2.8657894736842104e-02 | AC137: =(R137+S137)/2 -> 0 | AD137: =(S137+T137)/2 -> 0 | AE137: =(T137+U137)/2 -> 0 | AF137: =(U137+V137)/2 -> 0 | AG137: =(V137+W137)/2 -> 0 | AH137: =(W137+X137)/2 -> 8.8900000000000007e-02 | AI137: =(X137+Y137)/2 -> 0.27224999999999999 | AJ137: =STDEV(G137:Y137) -> 0.13357247096613883
B138: 603416.SH | C138: 信捷电气 | G138: -0.25 | H138: -0.17859999999999998 | I138: -0.17649999999999999 | J138: -7.3700000000000002e-02 | K138: 5.5599999999999997e-02 | L138: 4.3499999999999997e-02 | M138: 7.1399999999999991e-02 | N138: 0.20449999999999999 | O138: 0.15789999999999998 | P138: 6.25e-02 | Q138: 9.3299999999999994e-02 | R138: 9.4299999999999995e-02 | S138: 0.54549999999999998 | T138: 1 | U138: 1.1340999999999999 | V138: 1.0345 | W138: 0.8529000000000001 | X138: 8.8200000000000001e-02 | Y138: -6.2899999999999998e-02 | AA138: =(N138+O138+P138+Q138+R138+S138+T138+U138+V138+W138+X138+Y138)/12 -> 0.43373333333333325 | AB138: =(G138+H138+I138+J138+K138+L138+M138+N138+O138+P138+Q138+R138+S138+T138+U138+V138+W138+X138+Y138)/19 -> 0.24718421052631576 | AC138: =(R138+S138)/2 -> 0.31989999999999996 | AD138: =(S138+T138)/2 -> 0.77275000000000005 | AE138: =(T138+U138)/2 -> 1.0670500000000001 | AF138: =(U138+V138)/2 -> 1.0842999999999998 | AG138: =(V138+W138)/2 -> 0.94369999999999998 | AH138: =(W138+X138)/2 -> 0.47055000000000002 | AI138: =(X138+Y138)/2 -> 1.2650000000000002e-02 | AJ138: =STDEV(G138:Y138) -> 0.43852888447013372
B139: 603897.SH | C139: 长城科技 | I139: 0.49439999999999995 | J139: 0.29170000000000001 | K139: 0 | L139: -3.2300000000000002e-02 | M139: -0.16539999999999999 | N139: -0.35479999999999995 | O139: -0.29309999999999997 | P139: -0.26669999999999999 | Q139: -0.2162 | R139: 0.10000000000000001 | S139: 2.4399999999999998e-02 | T139: 6.0599999999999994e-02 | U139: 0.12640000000000001 | V139: 1 | W139: 1.8094999999999999 | X139: 1.3429 | Y139: 0.92859999999999998 | AA139: =(N139+O139+P139+Q139+R139+S139+T139+U139+V139+W139+X139+Y139)/12 -> 0.35513333333333336 | AB139: =(G139+H139+I139+J139+K139+L139+M139+N139+O139+P139+Q139+R139+S139+T139+U139+V139+W139+X139+Y139)/19 -> 0.25526315789473686 | AC139: =(R139+S139)/2 -> 6.2200000000000005e-02 | AD139: =(S139+T139)/2 -> 4.2499999999999996e-02 | AE139: =(T139+U139)/2 -> 9.35e-02 | AF139: =(U139+V139)/2 -> 0.56320000000000003 | AG139: =(V139+W139)/2 -> 1.4047499999999999 | AH139: =(W139+X139)/2 -> 1.5762 | AI139: =(X139+Y139)/2 -> 1.13575 | AJ139: =STDEV(G139:Y139) -> 0.62620481420876606
B140: 000049.SZ | C140: 德赛电池 | E140: 0.68859999999999999 | F140: 1.637 | G140: 0.77510000000000001 | H140: 0.57750000000000001 | I140: 0.39659999999999995 | J140: 0.1772 | K140: 0.1023 | L140: 0.16489999999999999 | M140: 0.47389999999999999 | N140: 0.33549999999999996 | O140: -0.1074 | P140: 0.27699999999999997 | Q140: 0.23480000000000001 | R140: 0.2482 | S140: -0.3105 | T140: -0.30299999999999999 | U140: -0.2576 | V140: 0.32409999999999994 | W140: 1.8536000000000001 | X140: 0.54749999999999999 | Y140: 0.33409999999999995 | AA140: =(N140+O140+P140+Q140+R140+S140+T140+U140+V140+W140+X140+Y140)/12 -> 0.2646916666666666 | AB140: =(G140+H140+I140+J140+K140+L140+M140+N140+O140+P140+Q140+R140+S140+T140+U140+V140+W140+X140+Y140)/19 -> 0.30756842105263166 | AC140: =(R140+S140)/2 -> -3.1149999999999997e-02 | AD140: =(S140+T140)/2 -> -0.30674999999999997 | AE140: =(T140+U140)/2 -> -0.28029999999999999 | AF140: =(U140+V140)/2 -> 3.3249999999999974e-02 | AG140: =(V140+W140)/2 -> 1.0888500000000001 | AH140: =(W140+X140)/2 -> 1.20055 | AI140: =(X140+Y140)/2 -> 0.44079999999999997 | AJ140: =STDEV(G140:Y140) -> 0.47797233538334927
B141: 603236.SH | C141: 移远通信 | E141: 0.61329999999999996 | F141: 1.6299999999999999 | P141: -0.22339999999999999 | Q141: -0.47270000000000001 | R141: -0.40000000000000002 | S141: -0.52310000000000001 | T141: -0.34250000000000003 | U141: 0 | V141: 9.2600000000000002e-02 | W141: 0.80650000000000011 | X141: 0.9375 | Y141: 0.87360000000000004 | AA141: =(N141+O141+P141+Q141+R141+S141+T141+U141+V141+W141+X141+Y141)/12 -> 6.2375000000000021e-02 | AB141: =(G141+H141+I141+J141+K141+L141+M141+N141+O141+P141+Q141+R141+S141+T141+U141+V141+W141+X141+Y141)/19 -> 3.9394736842105281e-02 | AC141: =(R141+S141)/2 -> -0.46155000000000002 | AD141: =(S141+T141)/2 -> -0.43280000000000002 | AE141: =(T141+U141)/2 -> -0.17125000000000001 | AF141: =(U141+V141)/2 -> 4.6300000000000001e-02 | AG141: =(V141+W141)/2 -> 0.44955000000000006 | AH141: =(W141+X141)/2 -> 0.87200000000000011 | AI141: =(X141+Y141)/2 -> 0.90555000000000008 | AJ141: =STDEV(G141:Y141) -> 0.5839870341977732 | AT141: 0.74390000000000001 | AU141: 0.50560000000000005 | AV141: 0.40079999999999999 | AW141: 0.73840000000000006 | AX141: 0.53049999999999997 | AY141: 0.55359999999999998 | AZ141: 0.39049999999999996 | BA141: 0.58850000000000002 | BB141: 0.43609999999999999 | BC141: 0.50429999999999997 | BE141: =(AR141+AS141+AT141+AU141+AV141+AW141+AX141+AY141+AZ141+BA141+BB141+BC141)/12 -> 0.44934999999999992 | BF141: =(AK141+AL141+AM141+AN141+AO141+AP141+AQ141+AR141+AS141+AT141+AU141+AV141+AV141+AW141+AX141+AY141+AZ141+BA141+BB141+BC141)/19 -> 0.30489473684210522 | BG141: =(AV141+AW141)/2 -> 0.5696 | BH141: =(AW141+AX141)/2 -> 0.63444999999999996 | BI141: =(AX141+AY141)/2 -> 0.54204999999999992 | BJ141: =(AY141+AZ141)/2 -> 0.47204999999999997 | BK141: =(AZ141+BA141)/2 -> 0.48949999999999999 | BL141: =(BA141+BB141)/2 -> 0.51229999999999998 | BM141: =(BB141+BC141)/2 -> 0.47019999999999995 | BN141: =STDEV(AK141:BC141) -> 0.12406946799631606
B142: 605399.SH | C142: 晨光新材 | E142: 0.13009999999999999 | F142: 1.6220000000000001 | T142: 2.0999999999999999e-03 | U142: -5.3600000000000002e-02 | V142: -5.8099999999999999e-02 | W142: 1.2666999999999999 | X142: 1.2564 | Y142: 2.0754999999999999 | AA142: =(N142+O142+P142+Q142+R142+S142+T142+U142+V142+W142+X142+Y142)/12 -> 0.37408333333333332 | AB142: =(G142+H142+I142+J142+K142+L142+M142+N142+O142+P142+Q142+R142+S142+T142+U142+V142+W142+X142+Y142)/19 -> 0.23626315789473684 | AC142: =(R142+S142)/2 -> 0 | AD142: =(S142+T142)/2 -> 1.0499999999999999e-03 | AE142: =(T142+U142)/2 -> -2.5750000000000002e-02 | AF142: =(U142+V142)/2 -> -5.5849999999999997e-02 | AG142: =(V142+W142)/2 -> 0.60429999999999995 | AH142: =(W142+X142)/2 -> 1.2615499999999999 | AI142: =(X142+Y142)/2 -> 1.66595 | AJ142: =STDEV(G142:Y142) -> 0.90978051345732103 | AV142: -5.28e-02 | AW142: -7.5499999999999998e-02 | AX142: 0.17180000000000001 | AY142: 5.3899999999999997e-02 | AZ142: 0.23350000000000001 | BA142: 0.90780000000000005 | BB142: 0.88650000000000007 | BC142: 1.3896999999999999 | BE142: =(AR142+AS142+AT142+AU142+AV142+AW142+AX142+AY142+AZ142+BA142+BB142+BC142)/12 -> 0.29290833333333338 | BF142: =(AK142+AL142+AM142+AN142+AO142+AP142+AQ142+AR142+AS142+AT142+AU142+AV142+AV142+AW142+AX142+AY142+AZ142+BA142+BB142+BC142)/19 -> 0.18221578947368422 | BG142: =(AV142+AW142)/2 -> -6.4149999999999999e-02 | BH142: =(AW142+AX142)/2 -> 4.8150000000000005e-02 | BI142: =(AX142+AY142)/2 -> 0.11285000000000001 | BJ142: =(AY142+AZ142)/2 -> 0.14369999999999999 | BK142: =(AZ142+BA142)/2 -> 0.57064999999999999 | BL142: =(BA142+BB142)/2 -> 0.89715000000000011 | BM142: =(BB142+BC142)/2 -> 1.1381000000000001 | BN142: =STDEV(AK142:BC142) -> 0.54672593274483905
B143: 000786.SZ | C143: 北新建材 | G143: 0.18309999999999998 | H143: 0.17230000000000001 | I143: 0.58229999999999993 | J143: 0.74909999999999999 | K143: 2.2618999999999998 | L143: 0.90549999999999997 | M143: 0.33030000000000004 | N143: 5.2600000000000001e-02 | O143: -0.29199999999999998 | P143: -1.5634000000000001 | Q143: -1.0051999999999999 | R143: -0.82120000000000004 | S143: -0.89690000000000003 | T143: 2.3081 | U143: 199 | V143: 5.4865999999999993 | W143: 14.449999999999999 | X143: 1.0336000000000001 | Y143: 0.3569 | AA143: =(N143+O143+P143+Q143+R143+S143+T143+U143+V143+W143+X143+Y143)/12 -> 18.175758333333334 | AB143: =(G143+H143+I143+J143+K143+L143+M143+N143+O143+P143+Q143+R143+S143+T143+U143+V143+W143+X143+Y143)/19 -> 11.752294736842105 | AC143: =(R143+S143)/2 -> -0.85905000000000009 | AD143: =(S143+T143)/2 -> 0.7056 | AE143: =(T143+U143)/2 -> 100.65405 | AF143: =(U143+V143)/2 -> 102.2433 | AG143: =(V143+W143)/2 -> 9.9682999999999993 | AH143: =(W143+X143)/2 -> 7.7417999999999996 | AI143: =(X143+Y143)/2 -> 0.69525000000000003 | AJ143: =STDEV(G143:Y143) -> 45.481526313835175
B144: 002850.SZ | C144: 科达利 | E144: 0.33340000000000003 | F144: 1.6100000000000001 | G144: -0.2077 | H144: -0.24440000000000001 | I144: -0.23079999999999998 | J144: -0.63060000000000005 | K144: -0.64569999999999994 | L144: -0.83819999999999995 | M144: -0.82499999999999996 | N144: -0.52439999999999998 | O144: 1.6e-02 | P144: 2.4544999999999999 | Q144: 2.3332999999999999 | R144: 1.8974000000000002 | S144: -0.32650000000000001 | T144: -0.42109999999999997 | U144: -0.3286 | V144: -0.25659999999999999 | W144: 4.1749000000000001 | X144: 3.2726999999999999 | Y144: 2.4255 | AA144: =(N144+O144+P144+Q144+R144+S144+T144+U144+V144+W144+X144+Y144)/12 -> 1.2264250000000001 | AB144: =(G144+H144+I144+J144+K144+L144+M144+N144+O144+P144+Q144+R144+S144+T144+U144+V144+W144+X144+Y144)/19 -> 0.58393157894736836 | AC144: =(R144+S144)/2 -> 0.78545000000000009 | AD144: =(S144+T144)/2 -> -0.37380000000000002 | AE144: =(T144+U144)/2 -> -0.37485000000000002 | AF144: =(U144+V144)/2 -> -0.29259999999999997 | AG144: =(V144+W144)/2 -> 1.9591499999999999 | AH144: =(W144+X144)/2 -> 3.7237999999999998 | AI144: =(X144+Y144)/2 -> 2.8491 | AJ144: =STDEV(G144:Y144) -> 1.5934026219427513
B145: 002876.SZ | C145: 三利谱 | H145: 0.33329999999999999 | I145: 0.1096 | J145: -4.9599999999999998e-02 | K145: -0.5 | L145: -0.27079999999999999 | M145: -0.72840000000000005 | N145: -0.76519999999999999 | O145: -1.8234999999999999 | P145: -0.97140000000000004 | Q145: 4.5499999999999999e-02 | R145: 0.81480000000000008 | S145: 1.7856999999999998 | T145: 18 | U145: 0.43479999999999996 | V145: 1.0612000000000001 | W145: 4.5455000000000005 | X145: 4.6316000000000006 | Y145: 3.8485 | AA145: =(N145+O145+P145+Q145+R145+S145+T145+U145+V145+W145+X145+Y145)/12 -> 2.6339583333333336 | AB145: =(G145+H145+I145+J145+K145+L145+M145+N145+O145+P145+Q145+R145+S145+T145+U145+V145+W145+X145+Y145)/19 -> 1.6053473684210529 | AC145: =(R145+S145)/2 -> 1.3002499999999999 | AD145: =(S145+T145)/2 -> 9.8928499999999993 | AE145: =(T145+U145)/2 -> 9.2173999999999996 | AF145: =(U145+V145)/2 -> 0.748 | AG145: =(V145+W145)/2 -> 2.8033500000000005 | AH145: =(W145+X145)/2 -> 4.5885500000000006 | AI145: =(X145+Y145)/2 -> 4.2400500000000001 | AJ145: =STDEV(G145:Y145) -> 4.4737266677398901
B146: 603150.SH | C146: 万朗磁塑 | Y146: -3.61e-02 | AA146: =(N146+O146+P146+Q146+R146+S146+T146+U146+V146+W146+X146+Y146)/12 -> -3.0083333333333333e-03 | AB146: =(G146+H146+I146+J146+K146+L146+M146+N146+O146+P146+Q146+R146+S146+T146+U146+V146+W146+X146+Y146)/19 -> -1.9e-03 | AC146: =(R146+S146)/2 -> 0 | AD146: =(S146+T146)/2 -> 0 | AE146: =(T146+U146)/2 -> 0 | AF146: =(U146+V146)/2 -> 0 | AG146: =(V146+W146)/2 -> 0 | AH146: =(W146+X146)/2 -> 0 | AI146: =(X146+Y146)/2 -> -1.805e-02 | AJ146: =STDEV(G146:Y146) -> #DIV/0!
B147: 603529.SH | C147: 爱玛科技 | V147: 0.14940000000000001 | W147: 0.32350000000000001 | X147: -6.0599999999999994e-02 | Y147: -8.5699999999999998e-02 | AA147: =(N147+O147+P147+Q147+R147+S147+T147+U147+V147+W147+X147+Y147)/12 -> 2.7216666666666667e-02 | AB147: =(G147+H147+I147+J147+K147+L147+M147+N147+O147+P147+Q147+R147+S147+T147+U147+V147+W147+X147+Y147)/19 -> 1.7189473684210525e-02 | AC147: =(R147+S147)/2 -> 0 | AD147: =(S147+T147)/2 -> 0 | AE147: =(T147+U147)/2 -> 0 | AF147: =(U147+V147)/2 -> 7.4700000000000003e-02 | AG147: =(V147+W147)/2 -> 0.23644999999999999 | AH147: =(W147+X147)/2 -> 0.13145000000000001 | AI147: =(X147+Y147)/2 -> -7.3149999999999993e-02 | AJ147: =STDEV(G147:Y147) -> 0.1926331314528561
B148: 600064.SH | C148: 南京高科 | G148: -0.62 | H148: -0.57999999999999996 | I148: -0.62609999999999999 | J148: -0.36200000000000004 | K148: 0.1278 | L148: 0.37109999999999999 | M148: 0.46920000000000001 | N148: 1.3100000000000001e-02 | O148: 3.8733 | P148: 0.69950000000000001 | Q148: 0.83719999999999994 | R148: 0.92260000000000009 | S148: -0.34749999999999998 | T148: 0.1913 | U148: 0.23710000000000001 | V148: 9.4600000000000004e-02 | W148: -6.08e-02 | X148: 6.0999999999999995e-03 | Y148: 7.980000000000001e-02 | AA148: =(N148+O148+P148+Q148+R148+S148+T148+U148+V148+W148+X148+Y148)/12 -> 0.54552499999999993 | AB148: =(G148+H148+I148+J148+K148+L148+M148+N148+O148+P148+Q148+R148+S148+T148+U148+V148+W148+X148+Y148)/19 -> 0.28033157894736838 | AC148: =(R148+S148)/2 -> 0.28755000000000008 | AD148: =(S148+T148)/2 -> -7.8099999999999989e-02 | AE148: =(T148+U148)/2 -> 0.2142 | AF148: =(U148+V148)/2 -> 0.16585 | AG148: =(V148+W148)/2 -> 1.6900000000000002e-02 | AH148: =(W148+X148)/2 -> -2.7349999999999999e-02 | AI148: =(X148+Y148)/2 -> 4.2950000000000002e-02 | AJ148: =STDEV(G148:Y148) -> 0.98323588672676543
B149: 600985.SH | C149: 淮北矿业 | G149: -0.16670000000000001 | H149: -9.5199999999999993e-02 | I149: 2.3029999999999999 | J149: 3.0293999999999999 | K149: 7.4000000000000004 | L149: 3.1052999999999997 | M149: 7.3399999999999993e-02 | N149: 0.2336 | O149: 2.3799999999999998e-02 | P149: 0.14099999999999999 | Q149: 0.14529999999999998 | R149: -5.8999999999999999e-03 | S149: -0.11630000000000001 | T149: -0.1124 | U149: -4.4800000000000006e-02 | V149: -4.7599999999999996e-02 | W149: 0.44740000000000002 | X149: 0.44299999999999995 | Y149: 0.23440000000000003 | AA149: =(N149+O149+P149+Q149+R149+S149+T149+U149+V149+W149+X149+Y149)/12 -> 0.11179166666666666 | AB149: =(G149+H149+I149+J149+K149+L149+M149+N149+O149+P149+Q149+R149+S149+T149+U149+V149+W149+X149+Y149)/19 -> 0.89424736842105268 | AC149: =(R149+S149)/2 -> -6.1100000000000008e-02 | AD149: =(S149+T149)/2 -> -0.11435000000000001 | AE149: =(T149+U149)/2 -> -7.8600000000000003e-02 | AF149: =(U149+V149)/2 -> -4.6200000000000005e-02 | AG149: =(V149+W149)/2 -> 0.19990000000000002 | AH149: =(W149+X149)/2 -> 0.44519999999999998 | AI149: =(X149+Y149)/2 -> 0.3387 | AJ149: =STDEV(G149:Y149) -> 1.8901832193286396
B150: 601607.SH | C150: 上海医药 | G150: 0.12359999999999999 | H150: 0.11109999999999999 | I150: 9.4200000000000006e-02 | J150: 0.10150000000000001 | K150: -1.67e-02 | L150: 8.3999999999999995e-03 | M150: 0.19370000000000001 | N150: 4.6399999999999997e-02 | O150: 9.4399999999999998e-02 | P150: 0.1082 | Q150: 5.4000000000000003e-03 | R150: 5.1100000000000007e-02 | S150: -7.4999999999999997e-02 | T150: 7.4999999999999997e-02 | U150: 5.8299999999999998e-02 | V150: 9.7200000000000009e-02 | W150: 1.0270000000000001 | X150: 0.46509999999999996 | Y150: 0.24410000000000001 | AA150: =(N150+O150+P150+Q150+R150+S150+T150+U150+V150+W150+X150+Y150)/12 -> 0.18310000000000001 | AB150: =(G150+H150+I150+J150+K150+L150+M150+N150+O150+P150+Q150+R150+S150+T150+U150+V150+W150+X150+Y150)/19 -> 0.14805263157894738 | AC150: =(R150+S150)/2 -> -1.1949999999999995e-02 | AD150: =(S150+T150)/2 -> 0 | AE150: =(T150+U150)/2 -> 6.6650000000000001e-02 | AF150: =(U150+V150)/2 -> 7.775e-02 | AG150: =(V150+W150)/2 -> 0.56210000000000004 | AH150: =(W150+X150)/2 -> 0.7460500000000001 | AI150: =(X150+Y150)/2 -> 0.35459999999999997 | AJ150: =STDEV(G150:Y150) -> 0.24133121861048848
B151: 603517.SH | C151: 绝味食品 | G151: 0.39130000000000004 | H151: 0.2157 | I151: 0.26319999999999999 | J151: 0.18870000000000001 | K151: 0.15620000000000001 | L151: 0.2397 | M151: 0.23960000000000001 | N151: -0.11109999999999999 | O151: -0.1351 | P151: -0.1525 | Q151: -0.15130000000000002 | R151: 0.2321 | S151: -0.6875 | T151: -0.30920000000000003 | U151: -0.15839999999999999 | V151: -0.16670000000000001 | W151: 2.8999999999999999 | X151: 0.82220000000000004 | Y151: 0.85880000000000001 | AA151: =(N151+O151+P151+Q151+R151+S151+T151+U151+V151+W151+X151+Y151)/12 -> 0.24510833333333334 | AB151: =(G151+H151+I151+J151+K151+L151+M151+N151+O151+P151+Q151+R151+S151+T151+U151+V151+W151+X151+Y151)/19 -> 0.24398421052631578 | AC151: =(R151+S151)/2 -> -0.22770000000000001 | AD151: =(S151+T151)/2 -> -0.49835000000000002 | AE151: =(T151+U151)/2 -> -0.23380000000000001 | AF151: =(U151+V151)/2 -> -0.16255 | AG151: =(V151+W151)/2 -> 1.3666499999999999 | AH151: =(W151+X151)/2 -> 1.8611 | AI151: =(X151+Y151)/2 -> 0.84050000000000002 | AJ151: =STDEV(G151:Y151) -> 0.74117224663453674
B152: 002080.SZ | C152: 中材科技 | G152: 0.50929999999999997 | H152: 0.21429999999999999 | I152: 0.63700000000000001 | J152: 0.80249999999999999 | K152: 8.1900000000000001e-02 | L152: -0.35680000000000001 | M152: -0.22329999999999997 | N152: -0.24260000000000001 | O152: -8.4900000000000003e-02 | P152: 0.31129999999999997 | Q152: 5.0900000000000001e-02 | R152: 0.1416 | S152: -0.14219999999999999 | T152: 0.38719999999999999 | U152: 0.49950000000000006 | V152: 0.48700000000000004 | W152: 1.3994 | X152: 1.0318000000000001 | Y152: 0.73309999999999997 | AA152: =(N152+O152+P152+Q152+R152+S152+T152+U152+V152+W152+X152+Y152)/12 -> 0.38100833333333334 | AB152: =(G152+H152+I152+J152+K152+L152+M152+N152+O152+P152+Q152+R152+S152+T152+U152+V152+W152+X152+Y152)/19 -> 0.32826315789473687 | AC152: =(R152+S152)/2 -> -2.9999999999999472e-04 | AD152: =(S152+T152)/2 -> 0.1225 | AE152: =(T152+U152)/2 -> 0.44335000000000002 | AF152: =(U152+V152)/2 -> 0.49325000000000008 | AG152: =(V152+W152)/2 -> 0.94320000000000004 | AH152: =(W152+X152)/2 -> 1.2156 | AI152: =(X152+Y152)/2 -> 0.88244999999999996 | AJ152: =STDEV(G152:Y152) -> 0.46513908458835823
B153: 605555.SH | C153: 德昌股份 | W153: 0.83900000000000008 | X153: 0.47369999999999995 | Y153: 0.13769999999999999 | AA153: =(N153+O153+P153+Q153+R153+S153+T153+U153+V153+W153+X153+Y153)/12 -> 0.12086666666666666 | AB153: =(G153+H153+I153+J153+K153+L153+M153+N153+O153+P153+Q153+R153+S153+T153+U153+V153+W153+X153+Y153)/19 -> 7.6336842105263147e-02 | AC153: =(R153+S153)/2 -> 0 | AD153: =(S153+T153)/2 -> 0 | AE153: =(T153+U153)/2 -> 0 | AF153: =(U153+V153)/2 -> 0 | AG153: =(V153+W153)/2 -> 0.41950000000000004 | AH153: =(W153+X153)/2 -> 0.65634999999999999 | AI153: =(X153+Y153)/2 -> 0.30569999999999997 | AJ153: =STDEV(G153:Y153) -> 0.35075199690569597
B154: 002541.SZ | C154: 鸿路钢构 | G154: 9.1400000000000009e-02 | H154: -7.85e-02 | I154: 0.16079999999999997 | J154: -0.1837 | K154: -0.2717 | L154: -2.92e-02 | M154: 0.25900000000000001 | N154: 0.97499999999999998 | O154: 0.29600000000000004 | P154: 4.82e-02 | Q154: 1.5900000000000001e-02 | R154: 0.35439999999999999 | S154: -0.3881 | T154: 0.1149 | U154: 0.48520000000000002 | V154: 0.4299 | W154: 3.3870999999999998 | X154: 1.6499999999999999 | Y154: 0.63590000000000002 | AA154: =(N154+O154+P154+Q154+R154+S154+T154+U154+V154+W154+X154+Y154)/12 -> 0.66703333333333337 | AB154: =(G154+H154+I154+J154+K154+L154+M154+N154+O154+P154+Q154+R154+S154+T154+U154+V154+W154+X154+Y154)/19 -> 0.41855263157894745 | AC154: =(R154+S154)/2 -> -1.6850000000000004e-02 | AD154: =(S154+T154)/2 -> -0.1366 | AE154: =(T154+U154)/2 -> 0.30005000000000004 | AF154: =(U154+V154)/2 -> 0.45755000000000001 | AG154: =(V154+W154)/2 -> 1.9084999999999999 | AH154: =(W154+X154)/2 -> 2.5185499999999998 | AI154: =(X154+Y154)/2 -> 1.1429499999999999 | AJ154: =STDEV(G154:Y154) -> 0.85755212239932044
B155: 000513.SZ | C155: 丽珠集团 | G155: -0.14999999999999999 | H155: -0.32689999999999997 | I155: 3.9339 | J155: 3.0920999999999998 | K155: -5.8799999999999998e-02 | L155: 0.2571 | M155: -0.83079999999999998 | N155: -0.81349999999999989 | O155: 0.125 | P155: -0.1023 | Q155: 9.9000000000000005e-02 | R155: 0.19829999999999998 | S155: 2.3799999999999998e-02 | T155: 0.35439999999999999 | U155: 0.36939999999999995 | V155: 0.3165 | W155: 0.30230000000000001 | X155: 6.54e-02 | Y155: 1.9699999999999999e-02 | AA155: =(N155+O155+P155+Q155+R155+S155+T155+U155+V155+W155+X155+Y155)/12 -> 7.9833333333333339e-02 | AB155: =(G155+H155+I155+J155+K155+L155+M155+N155+O155+P155+Q155+R155+S155+T155+U155+V155+W155+X155+Y155)/19 -> 0.36182105263157893 | AC155: =(R155+S155)/2 -> 0.11104999999999998 | AD155: =(S155+T155)/2 -> 0.18909999999999999 | AE155: =(T155+U155)/2 -> 0.3619 | AF155: =(U155+V155)/2 -> 0.34294999999999998 | AG155: =(V155+W155)/2 -> 0.30940000000000001 | AH155: =(W155+X155)/2 -> 0.18385000000000001 | AI155: =(X155+Y155)/2 -> 4.2549999999999998e-02 | AJ155: =STDEV(G155:Y155) -> 1.1698591579896118
B156: 601001.SH | C156: 晋控煤业 | G156: -0.96150000000000002 | H156: 0.56520000000000004 | I156: 1.6000000000000001 | J156: 2.2726999999999999 | K156: 6 | L156: -0.22219999999999998 | M156: 0 | N156: 8.3299999999999999e-02 | O156: 1 | P156: -3.5699999999999996e-02 | Q156: 2.5600000000000001e-02 | R156: 0.3846 | S156: 0.21429999999999999 | T156: -3.7000000000000005e-02 | U156: 0.14999999999999999 | V156: -3.7000000000000005e-02 | W156: 0.76469999999999994 | X156: 2.1153999999999997 | Y156: 2.3696000000000002 | AA156: =(N156+O156+P156+Q156+R156+S156+T156+U156+V156+W156+X156+Y156)/12 -> 0.58314999999999995 | AB156: =(G156+H156+I156+J156+K156+L156+M156+N156+O156+P156+Q156+R156+S156+T156+U156+V156+W156+X156+Y156)/19 -> 0.85536842105263133 | AC156: =(R156+S156)/2 -> 0.29944999999999999 | AD156: =(S156+T156)/2 -> 8.8649999999999993e-02 | AE156: =(T156+U156)/2 -> 5.6499999999999995e-02 | AF156: =(U156+V156)/2 -> 5.6499999999999995e-02 | AG156: =(V156+W156)/2 -> 0.36384999999999995 | AH156: =(W156+X156)/2 -> 1.4400499999999998 | AI156: =(X156+Y156)/2 -> 2.2424999999999997 | AJ156: =STDEV(G156:Y156) -> 1.5459563678091277 | AK156: 1.7708000000000002 | AL156: 2.3927 | AM156: 1.2043000000000001 | AN156: 0.28809999999999997 | AO156: -6.0100000000000001e-02 | AP156: -0.16070000000000001 | AQ156: -0.11990000000000001 | AR156: 0.13489999999999999 | AS156: -4.82e-02 | AT156: -3.0099999999999998e-02 | AU156: -2.1499999999999998e-02 | AV156: -5.6999999999999993e-03 | AW156: 2.3199999999999998e-02 | AX156: 5.3899999999999997e-02 | AY156: -1.e-02 | AZ156: 2.5999999999999999e-03 | BA156: 0.4632 | BB156: 0.46539999999999998 | BC156: 0.2641 | BE156: =(AR156+AS156+AT156+AU156+AV156+AW156+AX156+AY156+AZ156+BA156+BB156+BC156)/12 -> 0.10765000000000001 | BF156: =(AK156+AL156+AM156+AN156+AO156+AP156+AQ156+AR156+AS156+AT156+AU156+AV156+AV156+AW156+AX156+AY156+AZ156+BA156+BB156+BC156)/19 -> 0.3474368421052631 | BG156: =(AV156+AW156)/2 -> 8.7499999999999991e-03 | BH156: =(AW156+AX156)/2 -> 3.8550000000000001e-02 | BI156: =(AX156+AY156)/2 -> 2.1949999999999997e-02 | BJ156: =(AY156+AZ156)/2 -> -3.7000000000000002e-03 | BK156: =(AZ156+BA156)/2 -> 0.2329 | BL156: =(BA156+BB156)/2 -> 0.46429999999999999 | BM156: =(BB156+BC156)/2 -> 0.36475000000000002 | BN156: =STDEV(AK156:BC156) -> 0.69389294900464471
B157: 603087.SH | C157: 甘李药业 | R157: -0.1081 | S157: 0.25929999999999997 | T157: 0.15689999999999998 | U157: -2.29e-02 | V157: 0 | W157: 0 | X157: 0.1186 | Y157: 0.2109 | AA157: =(N157+O157+P157+Q157+R157+S157+T157+U157+V157+W157+X157+Y157)/12 -> 5.1224999999999993e-02 | AB157: =(G157+H157+I157+J157+K157+L157+M157+N157+O157+P157+Q157+R157+S157+T157+U157+V157+W157+X157+Y157)/19 -> 3.2352631578947362e-02 | AC157: =(R157+S157)/2 -> 7.5599999999999987e-02 | AD157: =(S157+T157)/2 -> 0.20809999999999998 | AE157: =(T157+U157)/2 -> 6.699999999999999e-02 | AF157: =(U157+V157)/2 -> -1.145e-02 | AG157: =(V157+W157)/2 -> 0 | AH157: =(W157+X157)/2 -> 5.9299999999999999e-02 | AI157: =(X157+Y157)/2 -> 0.16475000000000001 | AJ157: =STDEV(G157:Y157) -> 0.12838384341497178 | AV157: 0.54170000000000007 | AW157: -7.5800000000000006e-02 | AX157: 0.1928 | AY157: 0.1323 | AZ157: 0.1298 | BA157: 2.6699999999999998e-02 | BB157: -2.3399999999999997e-02 | BC157: 4.07e-02 | BE157: =(AR157+AS157+AT157+AU157+AV157+AW157+AX157+AY157+AZ157+BA157+BB157+BC157)/12 -> 8.0399999999999999e-02 | BF157: =(AK157+AL157+AM157+AN157+AO157+AP157+AQ157+AR157+AS157+AT157+AU157+AV157+AV157+AW157+AX157+AY157+AZ157+BA157+BB157+BC157)/19 -> 7.9289473684210521e-02 | BG157: =(AV157+AW157)/2 -> 0.23295000000000005 | BH157: =(AW157+AX157)/2 -> 5.8499999999999996e-02 | BI157: =(AX157+AY157)/2 -> 0.16255 | BJ157: =(AY157+AZ157)/2 -> 0.13105 | BK157: =(AZ157+BA157)/2 -> 7.825e-02 | BL157: =(BA157+BB157)/2 -> 1.6500000000000004e-03 | BM157: =(BB157+BC157)/2 -> 8.6500000000000014e-03 | BN157: =STDEV(AK157:BC157) -> 0.19171025756892318
B158: 600096.SH | C158: 云天化 | G158: 1.0770999999999999 | H158: 0.6663 | I158: 1.0143 | J158: 1.0613999999999999 | K158: 0.70180000000000009 | L158: 1.2031000000000001 | M158: 2.9497000000000004 | N158: -0.39200000000000002 | O158: 1.0284 | P158: 0.77760000000000007 | Q158: 0.5 | R158: 0.14529999999999998 | S158: -0.89959999999999996 | T158: -1.1691 | U158: -0.21440000000000001 | V158: 0.78760000000000008 | W158: 38.607600000000005 | X158: 58.026699999999998 | Y158: 19.887799999999999 | AA158: =(N158+O158+P158+Q158+R158+S158+T158+U158+V158+W158+X158+Y158)/12 -> 9.7571583333333347 | AB158: =(G158+H158+I158+J158+K158+L158+M158+N158+O158+P158+Q158+R158+S158+T158+U158+V158+W158+X158+Y158)/19 -> 6.6189263157894738 | AC158: =(R158+S158)/2 -> -0.37714999999999999 | AD158: =(S158+T158)/2 -> -1.0343499999999999 | AE158: =(T158+U158)/2 -> -0.69174999999999998 | AF158: =(U158+V158)/2 -> 0.28660000000000002 | AG158: =(V158+W158)/2 -> 19.697600000000001 | AH158: =(W158+X158)/2 -> 48.317149999999998 | AI158: =(X158+Y158)/2 -> 38.957250000000002 | AJ158: =STDEV(G158:Y158) -> 15.705811612932829
B159: 605259.SH | C159: 绿田机械 | V159: 0.31340000000000001 | W159: 0.51719999999999999 | X159: 0.21109999999999998 | Y159: 7.690000000000001e-02 | AA159: =(N159+O159+P159+Q159+R159+S159+T159+U159+V159+W159+X159+Y159)/12 -> 9.321666666666667e-02 | AB159: =(G159+H159+I159+J159+K159+L159+M159+N159+O159+P159+Q159+R159+S159+T159+U159+V159+W159+X159+Y159)/19 -> 5.8873684210526321e-02 | AC159: =(R159+S159)/2 -> 0 | AD159: =(S159+T159)/2 -> 0 | AE159: =(T159+U159)/2 -> 0 | AF159: =(U159+V159)/2 -> 0.15670000000000001 | AG159: =(V159+W159)/2 -> 0.4153 | AH159: =(W159+X159)/2 -> 0.36414999999999997 | AI159: =(X159+Y159)/2 -> 0.14399999999999999 | AJ159: =STDEV(G159:Y159) -> 0.18563021485379655
B160: 603186.SH | C160: 华正新材 | G160: -0.87879999999999991 | H160: -0.90200000000000002 | I160: -0.73970000000000002 | J160: -0.83819999999999995 | K160: 1 | L160: 1.6000000000000001 | M160: -0.36840000000000006 | N160: -0.36359999999999998 | O160: 1 | P160: 0.76919999999999999 | Q160: 1.6666999999999998 | R160: -0.1429 | S160: -0.3125 | T160: 0.39130000000000004 | U160: 0.5625 | V160: 2 | W160: 0.54549999999999998 | X160: -0.34380000000000005 | Y160: -1.1000000000000001 | AA160: =(N160+O160+P160+Q160+R160+S160+T160+U160+V160+W160+X160+Y160)/12 -> 0.38936666666666664 | AB160: =(G160+H160+I160+J160+K160+L160+M160+N160+O160+P160+Q160+R160+S160+T160+U160+V160+W160+X160+Y160)/19 -> 0.18659473684210526 | AC160: =(R160+S160)/2 -> -0.22770000000000001 | AD160: =(S160+T160)/2 -> 3.9400000000000018e-02 | AE160: =(T160+U160)/2 -> 0.47689999999999999 | AF160: =(U160+V160)/2 -> 1.28125 | AG160: =(V160+W160)/2 -> 1.27275 | AH160: =(W160+X160)/2 -> 0.10084999999999997 | AI160: =(X160+Y160)/2 -> -0.7219000000000001 | AJ160: =STDEV(G160:Y160) -> 0.95988838441056035
B161: 605090.SH | C161: 九丰能源 | V161: 1.0881999999999998 | W161: 1.8888999999999998 | X161: 8.1600000000000006e-02 | Y161: -0.13070000000000001 | AA161: =(N161+O161+P161+Q161+R161+S161+T161+U161+V161+W161+X161+Y161)/12 -> 0.24399999999999997 | AB161: =(G161+H161+I161+J161+K161+L161+M161+N161+O161+P161+Q161+R161+S161+T161+U161+V161+W161+X161+Y161)/19 -> 0.15410526315789472 | AC161: =(R161+S161)/2 -> 0 | AD161: =(S161+T161)/2 -> 0 | AE161: =(T161+U161)/2 -> 0 | AF161: =(U161+V161)/2 -> 0.54409999999999992 | AG161: =(V161+W161)/2 -> 1.4885499999999998 | AH161: =(W161+X161)/2 -> 0.98524999999999996 | AI161: =(X161+Y161)/2 -> -2.4550000000000002e-02 | AJ161: =STDEV(G161:Y161) -> 0.93676170929431135
B162: 002274.SZ | C162: 华昌化工 | G162: 11.3125 | H162: 1.385 | I162: 0.12740000000000001 | J162: 0.87340000000000007 | K162: -0.93779999999999997 | L162: 1.6184000000000001 | M162: 5.5889999999999995 | N162: 0.6512 | O162: 12.3469 | P162: 0.64690000000000003 | Q162: 0.37009999999999998 | R162: 0.41920000000000002 | S162: -0.82420000000000004 | T162: -0.93000000000000005 | U162: -0.89950000000000008 | V162: -9.3599999999999989e-02 | W162: 28.0609 | X162: 63.201400000000007 | Y162: 56.426400000000001 | AA162: =(N162+O162+P162+Q162+R162+S162+T162+U162+V162+W162+X162+Y162)/12 -> 13.281308333333333 | AB162: =(G162+H162+I162+J162+K162+L162+M162+N162+O162+P162+Q162+R162+S162+T162+U162+V162+W162+X162+Y162)/19 -> 9.439136842105265 | AC162: =(R162+S162)/2 -> -0.20250000000000001 | AD162: =(S162+T162)/2 -> -0.87709999999999999 | AE162: =(T162+U162)/2 -> -0.91475000000000006 | AF162: =(U162+V162)/2 -> -0.49655000000000005 | AG162: =(V162+W162)/2 -> 13.983650000000001 | AH162: =(W162+X162)/2 -> 45.631150000000005 | AI162: =(X162+Y162)/2 -> 59.813900000000004 | AJ162: =STDEV(G162:Y162) -> 19.140256737660739 | AK162: 0.50619999999999998 | AL162: 0.48950000000000005 | AM162: 0.44590000000000002 | AN162: -0.3145 | AO162: -0.43189999999999995 | AP162: -0.3533 | AQ162: -0.35189999999999999 | AR162: 0.1341 | AS162: 0.31309999999999999 | AT162: 6.6400000000000001e-02 | AU162: 0.18210000000000001 | AV162: 0.10830000000000001 | AW162: -0.35119999999999996 | AX162: -0.13419999999999999 | AY162: -0.17370000000000002 | AZ162: -2.7000000000000001e-03 | BA162: 1.1449 | BB162: 0.87250000000000005 | BC162: 0.84030000000000005 | BE162: =(AR162+AS162+AT162+AU162+AV162+AW162+AX162+AY162+AZ162+BA162+BB162+BC162)/12 -> 0.2499916666666667 | BF162: =(AK162+AL162+AM162+AN162+AO162+AP162+AQ162+AR162+AS162+AT162+AU162+AV162+AV162+AW162+AX162+AY162+AZ162+BA162+BB162+BC162)/19 -> 0.16306315789473685 | BG162: =(AV162+AW162)/2 -> -0.12144999999999997 | BH162: =(AW162+AX162)/2 -> -0.24269999999999997 | BI162: =(AX162+AY162)/2 -> -0.15395 | BJ162: =(AY162+AZ162)/2 -> -8.8200000000000014e-02 | BK162: =(AZ162+BA162)/2 -> 0.57110000000000005 | BL162: =(BA162+BB162)/2 -> 1.0087000000000002 | BM162: =(BB162+BC162)/2 -> 0.85640000000000005 | BN162: =STDEV(AK162:BC162) -> 0.46387718945921969
B163: 601100.SH | C163: 恒立液压 | G163: 9 | H163: 4.2000000000000002 | I163: 6.3333000000000004 | J163: 2.9091000000000005 | K163: 0.80000000000000004 | L163: 1.0385 | M163: 0.86360000000000003 | N163: 1.2093 | O163: 1.0556000000000001 | P163: -3.7699999999999997e-02 | Q163: -0.14630000000000001 | R163: 4.2099999999999999e-02 | S163: -0.27029999999999998 | T163: 0.49020000000000002 | U163: 0.61429999999999996 | V163: 0.74750000000000005 | W163: 1.2222 | X163: 0.42109999999999997 | Y163: 0.34509999999999996 | AA163: =(N163+O163+P163+Q163+R163+S163+T163+U163+V163+W163+X163+Y163)/12 -> 0.47442499999999993 | AB163: =(G163+H163+I163+J163+K163+L163+M163+N163+O163+P163+Q163+R163+S163+T163+U163+V163+W163+X163+Y163)/19 -> 1.6230315789473684 | AC163: =(R163+S163)/2 -> -0.11409999999999999 | AD163: =(S163+T163)/2 -> 0.10995000000000002 | AE163: =(T163+U163)/2 -> 0.55225000000000002 | AF163: =(U163+V163)/2 -> 0.68090000000000006 | AG163: =(V163+W163)/2 -> 0.98485 | AH163: =(W163+X163)/2 -> 0.82164999999999999 | AI163: =(X163+Y163)/2 -> 0.3831 | AJ163: =STDEV(G163:Y163) -> 2.4183144550268509
B164: 603071.SH | C164: 物产环能 | AA164: =(N164+O164+P164+Q164+R164+S164+T164+U164+V164+W164+X164+Y164)/12 -> 0 | AB164: =(G164+H164+I164+J164+K164+L164+M164+N164+O164+P164+Q164+R164+S164+T164+U164+V164+W164+X164+Y164)/19 -> 0 | AC164: =(R164+S164)/2 -> 0 | AD164: =(S164+T164)/2 -> 0 | AE164: =(T164+U164)/2 -> 0 | AF164: =(U164+V164)/2 -> 0 | AG164: =(V164+W164)/2 -> 0 | AH164: =(W164+X164)/2 -> 0 | AI164: =(X164+Y164)/2 -> 0 | AJ164: =STDEV(G164:Y164) -> #DIV/0!
B165: 002032.SZ | C165: 苏泊尔 | G165: 4.1299999999999996e-02 | H165: 0.28570000000000001 | I165: 0.22539999999999999 | J165: 0.23050000000000001 | K165: 0.22030000000000002 | L165: 0.22489999999999999 | M165: 0.21729999999999999 | N165: 0.25750000000000001 | O165: 0.13539999999999999 | P165: 0.1305 | Q165: 0.12960000000000002 | R165: 0.14849999999999999 | S165: -0.40539999999999998 | T165: -0.19769999999999999 | U165: -0.1338 | V165: -3.8399999999999997e-02 | W165: 0.6470999999999999 | X165: 0.29760000000000003 | Y165: 0.1484 | AA165: =(N165+O165+P165+Q165+R165+S165+T165+U165+V165+W165+X165+Y165)/12 -> 9.3275000000000011e-02 | AB165: =(G165+H165+I165+J165+K165+L165+M165+N165+O165+P165+Q165+R165+S165+T165+U165+V165+W165+X165+Y165)/19 -> 0.13498421052631579 | AC165: =(R165+S165)/2 -> -0.12845000000000001 | AD165: =(S165+T165)/2 -> -0.30154999999999998 | AE165: =(T165+U165)/2 -> -0.16575000000000001 | AF165: =(U165+V165)/2 -> -8.6099999999999996e-02 | AG165: =(V165+W165)/2 -> 0.30434999999999995 | AH165: =(W165+X165)/2 -> 0.47234999999999994 | AI165: =(X165+Y165)/2 -> 0.22300000000000003 | AJ165: =STDEV(G165:Y165) -> 0.22111575968547911
B166: 002179.SZ | C166: 中航光电 | G166: -0.14760000000000001 | H166: 0.11359999999999999 | I166: 0.1183 | J166: 0.1235 | K166: -8.8699999999999987e-02 | L166: -0.19239999999999999 | M166: -0.15079999999999999 | N166: -0.1149 | O166: 6.08e-02 | P166: 0.23300000000000001 | Q166: 0.1789 | R166: 0.11869999999999999 | S166: -0.32020000000000004 | T166: 0.1003 | U166: 0.26669999999999999 | V166: 0.29100000000000004 | W166: 2.7904 | X166: 0.69030000000000002 | Y166: 0.48729999999999996 | AA166: =(N166+O166+P166+Q166+R166+S166+T166+U166+V166+W166+X166+Y166)/12 -> 0.39852500000000002 | AB166: =(G166+H166+I166+J166+K166+L166+M166+N166+O166+P166+Q166+R166+S166+T166+U166+V166+W166+X166+Y166)/19 -> 0.23990526315789476 | AC166: =(R166+S166)/2 -> -0.10075000000000003 | AD166: =(S166+T166)/2 -> -0.10995000000000002 | AE166: =(T166+U166)/2 -> 0.1835 | AF166: =(U166+V166)/2 -> 0.27885000000000004 | AG166: =(V166+W166)/2 -> 1.5407 | AH166: =(W166+X166)/2 -> 1.7403500000000001 | AI166: =(X166+Y166)/2 -> 0.58879999999999999 | AJ166: =STDEV(G166:Y166) -> 0.66349310845762377
B167: 002048.SZ | C167: 宁波华翔 | E167: 0.3871 | F167: 1.1579999999999999 | G167: 0.80000000000000004 | H167: 0.25420000000000004 | I167: 0.37209999999999999 | J167: 0.11849999999999999 | K167: -0.55559999999999998 | L167: -0.3649 | M167: -0.32200000000000001 | N167: -0.22519999999999998 | O167: 0.1875 | P167: 0.40429999999999999 | Q167: 0.33750000000000002 | R167: 0.34189999999999998 | S167: -0.31579999999999997 | T167: -0.21210000000000001 | U167: -9.35e-02 | V167: -0.1338 | W167: 1.9231 | X167: 0.98080000000000001 | Y167: 0.55669999999999997 | AA167: =(N167+O167+P167+Q167+R167+S167+T167+U167+V167+W167+X167+Y167)/12 -> 0.3126166666666666 | AB167: =(G167+H167+I167+J167+K167+L167+M167+N167+O167+P167+Q167+R167+S167+T167+U167+V167+W167+X167+Y167)/19 -> 0.21335263157894738 | AC167: =(R167+S167)/2 -> 1.3050000000000006e-02 | AD167: =(S167+T167)/2 -> -0.26395000000000002 | AE167: =(T167+U167)/2 -> -0.15279999999999999 | AF167: =(U167+V167)/2 -> -0.11365 | AG167: =(V167+W167)/2 -> 0.89465000000000006 | AH167: =(W167+X167)/2 -> 1.4519500000000001 | AI167: =(X167+Y167)/2 -> 0.76875000000000004 | AJ167: =STDEV(G167:Y167) -> 0.58497234632494577
B168: 605189.SH | C168: 富春染织 | U168: 0.24739999999999998 | V168: 2.7273000000000001 | W168: 3 | X168: 1.6033999999999999 | Y168: 0.71900000000000008 | AA168: =(N168+O168+P168+Q168+R168+S168+T168+U168+V168+W168+X168+Y168)/12 -> 0.69142500000000007 | AB168: =(G168+H168+I168+J168+K168+L168+M168+N168+O168+P168+Q168+R168+S168+T168+U168+V168+W168+X168+Y168)/19 -> 0.43668947368421057 | AC168: =(R168+S168)/2 -> 0 | AD168: =(S168+T168)/2 -> 0 | AE168: =(T168+U168)/2 -> 0.12369999999999999 | AF168: =(U168+V168)/2 -> 1.4873499999999999 | AG168: =(V168+W168)/2 -> 2.8636499999999998 | AH168: =(W168+X168)/2 -> 2.3016999999999999 | AI168: =(X168+Y168)/2 -> 1.1612 | AJ168: =STDEV(G168:Y168) -> 1.2061147258863893
B169: 001201.SZ | C169: 东瑞股份 | W169: 1.5978000000000001 | X169: -0.35389999999999999 | Y169: -0.63329999999999997 | AA169: =(N169+O169+P169+Q169+R169+S169+T169+U169+V169+W169+X169+Y169)/12 -> 5.0883333333333336e-02 | AB169: =(G169+H169+I169+J169+K169+L169+M169+N169+O169+P169+Q169+R169+S169+T169+U169+V169+W169+X169+Y169)/19 -> 3.2136842105263158e-02 | AC169: =(R169+S169)/2 -> 0 | AD169: =(S169+T169)/2 -> 0 | AE169: =(T169+U169)/2 -> 0 | AF169: =(U169+V169)/2 -> 0 | AG169: =(V169+W169)/2 -> 0.79890000000000005 | AH169: =(W169+X169)/2 -> 0.62195 | AI169: =(X169+Y169)/2 -> -0.49359999999999998 | AJ169: =STDEV(G169:Y169) -> 1.2155248838807593
B170: 002128.SZ | C170: 电投能源 | G170: 1.8666999999999998 | H170: 2.0476000000000001 | I170: 1.4333 | J170: 1.1399999999999999 | K170: 6.9800000000000001e-02 | L170: 0.17190000000000003 | M170: 0.36990000000000001 | N170: -9.300000000000001e-03 | O170: 4.3499999999999997e-02 | P170: 0.1067 | Q170: 0.13 | R170: 0.20749999999999999 | S170: 6.25e-02 | T170: -0.1084 | U170: -5.3099999999999994e-02 | V170: -0.15620000000000001 | W170: 3.9199999999999999e-02 | X170: 0.2838 | Y170: 0.40189999999999998 | AA170: =(N170+O170+P170+Q170+R170+S170+T170+U170+V170+W170+X170+Y170)/12 -> 7.9008333333333333e-02 | AB170: =(G170+H170+I170+J170+K170+L170+M170+N170+O170+P170+Q170+R170+S170+T170+U170+V170+W170+X170+Y170)/19 -> 0.42354210526315789 | AC170: =(R170+S170)/2 -> 0.13500000000000001 | AD170: =(S170+T170)/2 -> -2.2949999999999998e-02 | AE170: =(T170+U170)/2 -> -8.0749999999999988e-02 | AF170: =(U170+V170)/2 -> -0.10464999999999999 | AG170: =(V170+W170)/2 -> -5.8500000000000003e-02 | AH170: =(W170+X170)/2 -> 0.1615 | AI170: =(X170+Y170)/2 -> 0.34284999999999999 | AJ170: =STDEV(G170:Y170) -> 0.67304689643094084 | AK170: 3.6764999999999999 | AL170: 1.4028 | AM170: 0.71760000000000002 | AN170: 0.44789999999999996 | AO170: -0.45350000000000001 | AP170: 1.3627 | AQ170: 1.6608000000000001 | AR170: 1.5993000000000002 | AS170: 2.0375999999999999 | AT170: -2.07e-02 | AU170: 4.7100000000000003e-02 | AV170: 4.7899999999999998e-02 | AW170: 0.22450000000000001 | AX170: 9.4700000000000006e-02 | AY170: 5.9400000000000001e-02 | AZ170: 0.1565 | BA170: 0.11749999999999999 | BB170: 0.1285 | BC170: 0.2576
B171: 603338.SH | C171: 浙江鼎力 | E171: 0.41689999999999999 | F171: 1.4419999999999999 | G171: 1.2778 | H171: 0.26919999999999999 | I171: 0.2195 | J171: 0.14810000000000001 | K171: -0.31709999999999999 | L171: -0.1061 | M171: 0.14000000000000001 | N171: 0.121 | O171: 3.5699999999999996e-02 | P171: -8.4700000000000011e-02 | Q171: -0.20180000000000001 | R171: 2.8799999999999999e-02 | S171: -0.13789999999999999 | T171: 0.55559999999999998 | U171: 0.40659999999999996 | V171: -4.2000000000000003e-02 | W171: 0.40000000000000002 | X171: 0.23809999999999998 | Y171: 0.17190000000000003 | AA171: =(N171+O171+P171+Q171+R171+S171+T171+U171+V171+W171+X171+Y171)/12 -> 0.12427499999999998 | AB171: =(G171+H171+I171+J171+K171+L171+M171+N171+O171+P171+Q171+R171+S171+T171+U171+V171+W171+X171+Y171)/19 -> 0.16435263157894736 | AC171: =(R171+S171)/2 -> -5.4550000000000001e-02 | AD171: =(S171+T171)/2 -> 0.20884999999999998 | AE171: =(T171+U171)/2 -> 0.48109999999999997 | AF171: =(U171+V171)/2 -> 0.18229999999999999 | AG171: =(V171+W171)/2 -> 0.17900000000000002 | AH171: =(W171+X171)/2 -> 0.31905 | AI171: =(X171+Y171)/2 -> 0.20500000000000002 | AJ171: =STDEV(G171:Y171) -> 0.34954095351923287
B172: 600031.SH | C172: 三一重工 | G172: 7.0833000000000004 | H172: 7.3888999999999996 | I172: 9.2608999999999995 | J172: 9.2360000000000007 | K172: 1.0165 | L172: 1.9205000000000001 | M172: 1.6821999999999999 | N172: 1.8932 | O172: 1.1098999999999999 | P172: 0.89119999999999999 | Q172: 0.78439999999999999 | R172: 0.73769999999999991 | S172: -0.3533 | T172: 0.22270000000000001 | U172: 0.30559999999999998 | V172: 0.33889999999999998 | W172: 1.4650000000000001 | X172: 0.1734 | Y172: 1.1599999999999999e-02 | AA172: =(N172+O172+P172+Q172+R172+S172+T172+U172+V172+W172+X172+Y172)/12 -> 0.63169166666666665 | AB172: =(G172+H172+I172+J172+K172+L172+M172+N172+O172+P172+Q172+R172+S172+T172+U172+V172+W172+X172+Y172)/19 -> 2.3772947368421056 | AC172: =(R172+S172)/2 -> 0.19219999999999995 | AD172: =(S172+T172)/2 -> -6.5299999999999997e-02 | AE172: =(T172+U172)/2 -> 0.26415 | AF172: =(U172+V172)/2 -> 0.32224999999999998 | AG172: =(V172+W172)/2 -> 0.90195000000000003 | AH172: =(W172+X172)/2 -> 0.81920000000000004 | AI172: =(X172+Y172)/2 -> 9.2499999999999999e-02 | AJ172: =STDEV(G172:Y172) -> 3.2088259830372863
B173: 600741.SH | C173: 华域汽车 | E173: 0.6522 | F173: 1.4910000000000001 | G173: 7.0599999999999996e-02 | H173: 5.45e-02 | I173: 7.8299999999999995e-02 | J173: 7.8899999999999998e-02 | K173: 0.90310000000000001 | L173: 0.47710000000000002 | M173: 0.32130000000000003 | N173: 0.22460000000000002 | O173: -0.36619999999999997 | P173: -0.29520000000000002 | Q173: -0.22589999999999999 | R173: -0.1948 | S173: -0.9265000000000001 | T173: -0.61199999999999999 | U173: -0.37040000000000001 | V173: -0.16390000000000002 | W173: 8.5349000000000004 | X173: 1.0918000000000001 | Y173: 0.51519999999999999 | AA173: =(N173+O173+P173+Q173+R173+S173+T173+U173+V173+W173+X173+Y173)/12 -> 0.60096666666666676 | AB173: =(G173+H173+I173+J173+K173+L173+M173+N173+O173+P173+Q173+R173+S173+T173+U173+V173+W173+X173+Y173)/19 -> 0.48396842105263155 | AC173: =(R173+S173)/2 -> -0.56065000000000009 | AD173: =(S173+T173)/2 -> -0.76924999999999999 | AE173: =(T173+U173)/2 -> -0.49119999999999997 | AF173: =(U173+V173)/2 -> -0.26715 | AG173: =(V173+W173)/2 -> 4.1855000000000002 | AH173: =(W173+X173)/2 -> 4.8133499999999998 | AI173: =(X173+Y173)/2 -> 0.8035000000000001 | AJ173: =STDEV(G173:Y173) -> 2.0107506282349803
B174: 601995.SH | C174: 中金公司
B175: 000623.SZ | C175: 吉林敖东
B176: 001212.SZ | C176: 中旗新材 | V176: 0.25619999999999998 | W176: 0.40000000000000002 | X176: 0.21050000000000002 | Y176: 8.09e-02 | AA176: =(N176+O176+P176+Q176+R176+S176+T176+U176+V176+W176+X176+Y176)/12 -> 7.8966666666666671e-02 | AB176: =(G176+H176+I176+J176+K176+L176+M176+N176+O176+P176+Q176+R176+S176+T176+U176+V176+W176+X176+Y176)/19 -> 4.9873684210526313e-02 | AC176: =(R176+S176)/2 -> 0 | AD176: =(S176+T176)/2 -> 0 | AE176: =(T176+U176)/2 -> 0 | AF176: =(U176+V176)/2 -> 0.12809999999999999 | AG176: =(V176+W176)/2 -> 0.3281 | AH176: =(W176+X176)/2 -> 0.30525000000000002 | AI176: =(X176+Y176)/2 -> 0.1457 | AJ176: =STDEV(G176:Y176) -> 0.13166505484245494
B177: 601225.SH | C177: 陕西煤业 | E177: 0.37990000000000002 | F177: 2.1600000000000001 | G177: 70.230800000000002 | H177: 20.912399999999998 | I177: 7.0999999999999996 | J177: 2.7143000000000002 | K177: 5.2199999999999996e-02 | L177: 7.2700000000000001e-02 | M177: 9.8800000000000013e-02 | N177: 5.7699999999999994e-02 | O177: -1.44e-02 | P177: 1.6899999999999998e-02 | Q177: 5.62e-02 | R177: 9.0899999999999995e-02 | S177: -0.1429 | T177: -0.14230000000000001 | U177: 0.25530000000000003 | V177: 0.2833 | W177: 0.45829999999999999 | X177: 0.65180000000000005 | Y177: 0.24579999999999999 | AA177: =(N177+O177+P177+Q177+R177+S177+T177+U177+V177+W177+X177+Y177)/12 -> 0.15138333333333334 | AB177: =(G177+H177+I177+J177+K177+L177+M177+N177+O177+P177+Q177+R177+S177+T177+U177+V177+W177+X177+Y177)/19 -> 5.4209368421052631 | AC177: =(R177+S177)/2 -> -2.6000000000000002e-02 | AD177: =(S177+T177)/2 -> -0.1426 | AE177: =(T177+U177)/2 -> 5.6500000000000009e-02 | AF177: =(U177+V177)/2 -> 0.26929999999999998 | AG177: =(V177+W177)/2 -> 0.37080000000000002 | AH177: =(W177+X177)/2 -> 0.55505000000000004 | AI177: =(X177+Y177)/2 -> 0.44880000000000003 | AJ177: =STDEV(G177:Y177) -> 16.448642327871138
B178: 603155.SH | C178: 新亚强 | T178: -0.27000000000000002 | U178: -0.33110000000000001 | V178: -0.35639999999999999 | W178: 0.28570000000000001 | X178: 0.28770000000000001 | Y178: 0.45539999999999997 | AA178: =(N178+O178+P178+Q178+R178+S178+T178+U178+V178+W178+X178+Y178)/12 -> 5.9416666666666689e-03 | AB178: =(G178+H178+I178+J178+K178+L178+M178+N178+O178+P178+Q178+R178+S178+T178+U178+V178+W178+X178+Y178)/19 -> 3.7526315789473698e-03 | AC178: =(R178+S178)/2 -> 0 | AD178: =(S178+T178)/2 -> -0.13500000000000001 | AE178: =(T178+U178)/2 -> -0.30054999999999998 | AF178: =(U178+V178)/2 -> -0.34375 | AG178: =(V178+W178)/2 -> -3.5349999999999993e-02 | AH178: =(W178+X178)/2 -> 0.28670000000000001 | AI178: =(X178+Y178)/2 -> 0.37154999999999999 | AJ178: =STDEV(G178:Y178) -> 0.36891349347328933 | AX178: -0.29059999999999997 | AY178: -0.24670000000000003 | AZ178: -0.32869999999999999 | BA178: 0.22670000000000001 | BB178: 0.63029999999999997 | BC178: 0.31969999999999998 | BE178: =(AR178+AS178+AT178+AU178+AV178+AW178+AX178+AY178+AZ178+BA178+BB178+BC178)/12 -> 2.5891666666666664e-02 | BF178: =(AK178+AL178+AM178+AN178+AO178+AP178+AQ178+AR178+AS178+AT178+AU178+AV178+AV178+AW178+AX178+AY178+AZ178+BA178+BB178+BC178)/19 -> 1.6352631578947369e-02 | BG178: =(AV178+AW178)/2 -> 0 | BH178: =(AW178+AX178)/2 -> -0.14529999999999998 | BI178: =(AX178+AY178)/2 -> -0.26865 | BJ178: =(AY178+AZ178)/2 -> -0.28770000000000001 | BK178: =(AZ178+BA178)/2 -> -5.099999999999999e-02 | BL178: =(BA178+BB178)/2 -> 0.42849999999999999 | BM178: =(BB178+BC178)/2 -> 0.47499999999999998 | BN178: =STDEV(AK178:BC178) -> 0.39702466632020067
B179: 603606.SH | C179: 东方电缆 | E179: 0.53700000000000003 | F179: 1.3979999999999999 | G179: 0.13639999999999999 | H179: 0 | I179: 0 | J179: -0.29410000000000003 | K179: 0.59999999999999998 | L179: 0.28570000000000001 | M179: 1 | N179: 1.1667000000000001 | O179: 1 | P179: 2.1111 | Q179: 1.5556000000000001 | R179: 1.6537999999999999 | S179: 0.5 | T179: 1 | U179: 1.0434999999999999 | V179: 0.97099999999999997 | W179: 2.5 | X179: 0.73209999999999997 | Y179: 0.56380000000000008 | AA179: =(N179+O179+P179+Q179+R179+S179+T179+U179+V179+W179+X179+Y179)/12 -> 1.2331333333333332 | AB179: =(G179+H179+I179+J179+K179+L179+M179+N179+O179+P179+Q179+R179+S179+T179+U179+V179+W179+X179+Y179)/19 -> 0.86976842105263164 | AC179: =(R179+S179)/2 -> 1.0769 | AD179: =(S179+T179)/2 -> 0.75 | AE179: =(T179+U179)/2 -> 1.0217499999999999 | AF179: =(U179+V179)/2 -> 1.00725 | AG179: =(V179+W179)/2 -> 1.7355 | AH179: =(W179+X179)/2 -> 1.61605 | AI179: =(X179+Y179)/2 -> 0.64795000000000003 | AJ179: =STDEV(G179:Y179) -> 0.7276954201470035
B180: 605098.SH | C180: 行动教育 | E180: 0.44679999999999997 | F180: 1.46 | V180: -9.1400000000000009e-02 | W180: 1.5 | X180: 0.73019999999999996 | Y180: 0.60439999999999994 | AA180: =(N180+O180+P180+Q180+R180+S180+T180+U180+V180+W180+X180+Y180)/12 -> 0.2286 | AB180: =(G180+H180+I180+J180+K180+L180+M180+N180+O180+P180+Q180+R180+S180+T180+U180+V180+W180+X180+Y180)/19 -> 0.14437894736842105 | AC180: =(R180+S180)/2 -> 0 | AD180: =(S180+T180)/2 -> 0 | AE180: =(T180+U180)/2 -> 0 | AF180: =(U180+V180)/2 -> -4.5700000000000005e-02 | AG180: =(V180+W180)/2 -> 0.70430000000000004 | AH180: =(W180+X180)/2 -> 1.1151 | AI180: =(X180+Y180)/2 -> 0.6673 | AJ180: =STDEV(G180:Y180) -> 0.65206308488264131
B181: 600581.SH | C181: 八一钢铁 | G181: 1.5933000000000002 | H181: 1.639 | I181: 1.7833000000000001 | J181: 14.875 | K181: -0.47189999999999999 | L181: -0.46179999999999999 | M181: -0.33159999999999995 | N181: -0.40029999999999999 | O181: -2.3511000000000002 | P181: -0.42549999999999999 | Q181: -0.58360000000000001 | R181: -0.84030000000000005 | S181: 2.3599999999999999e-02 | T181: -0.44439999999999996 | U181: 0.24199999999999999 | V181: 1.8219000000000001 | W181: 2 | X181: 17.399999999999999 | Y181: 6.4462000000000002 | AA181: =(N181+O181+P181+Q181+R181+S181+T181+U181+V181+W181+X181+Y181)/12 -> 1.907375 | AB181: =(G181+H181+I181+J181+K181+L181+M181+N181+O181+P181+Q181+R181+S181+T181+U181+V181+W181+X181+Y181)/19 -> 2.1849368421052624 | AC181: =(R181+S181)/2 -> -0.40835000000000005 | AD181: =(S181+T181)/2 -> -0.21039999999999998 | AE181: =(T181+U181)/2 -> -0.10119999999999998 | AF181: =(U181+V181)/2 -> 1.0319500000000001 | AG181: =(V181+W181)/2 -> 1.9109500000000001 | AH181: =(W181+X181)/2 -> 9.6999999999999993 | AI181: =(X181+Y181)/2 -> 11.9231 | AJ181: =STDEV(G181:Y181) -> 5.2615833436767048 | AK181: 2.0215999999999998 | AL181: 1.7115 | AM181: 1.1573 | AN181: 0.9376000000000001 | AO181: 0.16800000000000001 | AP181: 5.2999999999999999e-02 | AQ181: 7.0599999999999996e-02 | AR181: 0.20039999999999999 | AS181: 0.56669999999999998 | AT181: 0.31969999999999998 | AU181: 0.17989999999999998 | AV181: -0.1772 | AW181: -0.23649999999999999 | AX181: -0.13570000000000002 | AY181: -0.17149999999999999 | AZ181: 3.3399999999999999e-02 | BA181: 0.14480000000000001 | BB181: 0.1981 | BC181: 0.43170000000000003 | BE181: =(AR181+AS181+AT181+AU181+AV181+AW181+AX181+AY181+AZ181+BA181+BB181+BC181)/12 -> 0.11281666666666666 | BF181: =(AK181+AL181+AM181+AN181+AO181+AP181+AQ181+AR181+AS181+AT181+AU181+AV181+AV181+AW181+AX181+AY181+AZ181+BA181+BB181+BC181)/19 -> 0.38401052631578947 | BG181: =(AV181+AW181)/2 -> -0.20684999999999998 | BH181: =(AW181+AX181)/2 -> -0.18609999999999999 | BI181: =(AX181+AY181)/2 -> -0.15360000000000001 | BJ181: =(AY181+AZ181)/2 -> -6.905e-02 | BK181: =(AZ181+BA181)/2 -> 8.9100000000000013e-02 | BL181: =(BA181+BB181)/2 -> 0.17144999999999999 | BM181: =(BB181+BC181)/2 -> 0.31490000000000001 | BN181: =STDEV(AK181:BC181) -> 0.63288232819776946
B182: 600449.SH | C182: 宁夏建材
B183: 600966.SH | C183: 博汇纸业
B184: 003028.SZ | C184: 振邦智能 | U184: 0.56700000000000006 | V184: 0.4965 | W184: 1.2273000000000001 | X184: 0.33329999999999999 | Y184: -5.2600000000000001e-02 | AA184: =(N184+O184+P184+Q184+R184+S184+T184+U184+V184+W184+X184+Y184)/12 -> 0.21429166666666666 | AB184: =(G184+H184+I184+J184+K184+L184+M184+N184+O184+P184+Q184+R184+S184+T184+U184+V184+W184+X184+Y184)/19 -> 0.1353421052631579 | AC184: =(R184+S184)/2 -> 0 | AD184: =(S184+T184)/2 -> 0 | AE184: =(T184+U184)/2 -> 0.28350000000000003 | AF184: =(U184+V184)/2 -> 0.53175000000000006 | AG184: =(V184+W184)/2 -> 0.8619 | AH184: =(W184+X184)/2 -> 0.78029999999999999 | AI184: =(X184+Y184)/2 -> 0.14035 | AJ184: =STDEV(G184:Y184) -> 0.46518806412030828
B185: 603806.SH | C185: 福斯特 | G185: -0.375 | H185: -0.56359999999999999 | I185: -0.53290000000000004 | J185: -0.46920000000000001 | K185: 0 | L185: -0.1042 | M185: -7.0400000000000004e-02 | N185: 0.28570000000000001 | O185: 0.64000000000000001 | P185: 0.25579999999999997 | Q185: 0.2273 | R185: -9.0299999999999991e-02 | S185: -0.48780000000000001 | T185: -3.7000000000000005e-02 | U185: 0.19750000000000001 | V185: 0.59540000000000004 | W185: 2.0476000000000001 | X185: 0.88459999999999994 | Y185: 0.48450000000000004 | AA185: =(N185+O185+P185+Q185+R185+S185+T185+U185+V185+W185+X185+Y185)/12 -> 0.4169416666666666 | AB185: =(G185+H185+I185+J185+K185+L185+M185+N185+O185+P185+Q185+R185+S185+T185+U185+V185+W185+X185+Y185)/19 -> 0.15200000000000002 | AC185: =(R185+S185)/2 -> -0.28905000000000003 | AD185: =(S185+T185)/2 -> -0.26240000000000002 | AE185: =(T185+U185)/2 -> 8.0250000000000002e-02 | AF185: =(U185+V185)/2 -> 0.39645000000000002 | AG185: =(V185+W185)/2 -> 1.3215000000000001 | AH185: =(W185+X185)/2 -> 1.4661 | AI185: =(X185+Y185)/2 -> 0.68454999999999999 | AJ185: =STDEV(G185:Y185) -> 0.62354117479655402
B186: 000002.SZ | C186: 万科A | G186: -0.16 | H186: 0.375 | I186: 0.34360000000000002 | J186: 0.33679999999999999 | K186: 0.28570000000000001 | L186: 0.2576 | M186: 0.26069999999999999 | N186: 0.20469999999999999 | O186: 0.25929999999999997 | P186: 0.27710000000000001 | Q186: 0.2873 | R186: 0.13400000000000001 | S186: 8.3299999999999999e-02 | T186: 4.7199999999999999e-02 | U186: 6.7400000000000002e-02 | V186: 4.3200000000000002e-02 | W186: 6.3e-03 | X186: -0.14410000000000001 | Y186: -0.17519999999999999 | AA186: =(N186+O186+P186+Q186+R186+S186+T186+U186+V186+W186+X186+Y186)/12 -> 9.0874999999999942e-02 | AB186: =(G186+H186+I186+J186+K186+L186+M186+N186+O186+P186+Q186+R186+S186+T186+U186+V186+W186+X186+Y186)/19 -> 0.14683684210526318 | AC186: =(R186+S186)/2 -> 0.10865 | AD186: =(S186+T186)/2 -> 6.5250000000000002e-02 | AE186: =(T186+U186)/2 -> 5.7300000000000004e-02 | AF186: =(U186+V186)/2 -> 5.5300000000000002e-02 | AG186: =(V186+W186)/2 -> 2.4750000000000001e-02 | AH186: =(W186+X186)/2 -> -6.8900000000000003e-02 | AI186: =(X186+Y186)/2 -> -0.15965000000000001 | AJ186: =STDEV(G186:Y186) -> 0.17598964366792316 | BA186: 0.86480000000000001 | BB186: 0.30969999999999998 | BC186: 0.14400000000000002
B187: 600566.SH | C187: 济川药业 | E187: 0.24249999999999999 | F187: 1.8700000000000001 | G187: 0.33960000000000001 | H187: 0.28389999999999999 | I187: 0.31569999999999998 | J187: 0.29059999999999997 | K187: 0.60719999999999996 | L187: 0.44780000000000003 | M187: 0.43890000000000001 | N187: 0.3775 | O187: 8.4900000000000003e-02 | P187: 0.13350000000000001 | Q187: -6.8000000000000005e-03 | R187: -4.3299999999999998e-02 | S187: -8.9499999999999996e-02 | T187: -0.28809999999999997 | U187: -0.26530000000000004 | V187: -0.23120000000000002 | W187: -0.1333 | X187: 0.14400000000000002 | Y187: 0.2167 | AA187: =(N187+O187+P187+Q187+R187+S187+T187+U187+V187+W187+X187+Y187)/12 -> -8.4083333333333319e-03 | AB187: =(G187+H187+I187+J187+K187+L187+M187+N187+O187+P187+Q187+R187+S187+T187+U187+V187+W187+X187+Y187)/19 -> 0.13804210526315791 | AC187: =(R187+S187)/2 -> -6.6400000000000001e-02 | AD187: =(S187+T187)/2 -> -0.18879999999999997 | AE187: =(T187+U187)/2 -> -0.2767 | AF187: =(U187+V187)/2 -> -0.24825000000000003 | AG187: =(V187+W187)/2 -> -0.18225000000000002 | AH187: =(W187+X187)/2 -> 5.3500000000000075e-03 | AI187: =(X187+Y187)/2 -> 0.18035000000000001 | AJ187: =STDEV(G187:Y187) -> 0.2634816129275005 | AK187: 0.17350000000000002 | AL187: 0.16269999999999998 | AM187: 0.17329999999999998 | AN187: 0.2006 | AO187: 0.43630000000000002 | AP187: 0.37709999999999999 | AQ187: 0.32850000000000001 | AR187: 0.25390000000000001 | AS187: 1.e-03 | AT187: 1.4999999999999999e-02 | AU187: 7.9000000000000008e-03 | AV187: -1.06e-02 | AW187: 3.9199999999999999e-02 | AX187: -8.6500000000000007e-02 | AY187: -0.15920000000000001 | AZ187: -0.11269999999999999 | BA187: 1.43e-02 | BB187: 0.1201 | BC187: 0.23139999999999999 | BE187: =(AR187+AS187+AT187+AU187+AV187+AW187+AX187+AY187+AZ187+BA187+BB187+BC187)/12 -> 2.6150000000000003e-02 | BF187: =(AK187+AL187+AM187+AN187+AO187+AP187+AQ187+AR187+AS187+AT187+AU187+AV187+AV187+AW187+AX187+AY187+AZ187+BA187+BB187+BC187)/19 -> 0.11343157894736841 | BG187: =(AV187+AW187)/2 -> 1.43e-02 | BH187: =(AW187+AX187)/2 -> -2.3650000000000004e-02 | BI187: =(AX187+AY187)/2 -> -0.12285000000000001 | BJ187: =(AY187+AZ187)/2 -> -0.13595000000000002 | BK187: =(AZ187+BA187)/2 -> -4.9199999999999994e-02 | BL187: =(BA187+BB187)/2 -> 6.7199999999999996e-02 | BM187: =(BB187+BC187)/2 -> 0.17574999999999999 | BN187: =STDEV(AK187:BC187) -> 0.16675797463768607
B188: 002008.SZ | C188: 大族激光 | E188: 0.5645 | F188: 1.4059999999999999 | G188: 0.2727 | H188: 1.2631999999999999 | I188: 1.3897999999999999 | J188: 1.1972 | K188: 1.4286000000000001 | L188: 0.1047 | M188: 9.9299999999999999e-02 | N188: 3.2099999999999997e-02 | O188: -0.55880000000000007 | P188: -0.62109999999999999 | Q188: -0.63229999999999997 | R188: -0.62109999999999999 | S188: -0.33329999999999999 | T188: 0.63890000000000002 | U188: 0.70180000000000009 | V188: 0.52459999999999996 | W188: 2.1000000000000001 | X188: 0.42369999999999997 | Y188: 0.47420000000000001 | AA188: =(N188+O188+P188+Q188+R188+S188+T188+U188+V188+W188+X188+Y188)/12 -> 0.17739166666666664 | AB188: =(G188+H188+I188+J188+K188+L188+M188+N188+O188+P188+Q188+R188+S188+T188+U188+V188+W188+X188+Y188)/19 -> 0.41495789473684208 | AC188: =(R188+S188)/2 -> -0.47719999999999996 | AD188: =(S188+T188)/2 -> 0.15280000000000002 | AE188: =(T188+U188)/2 -> 0.67035 | AF188: =(U188+V188)/2 -> 0.61319999999999997 | AG188: =(V188+W188)/2 -> 1.3123 | AH188: =(W188+X188)/2 -> 1.2618499999999999 | AI188: =(X188+Y188)/2 -> 0.44894999999999996 | AJ188: =STDEV(G188:Y188) -> 0.79620629328207926
B189: 605009.SH | C189: 豪悦护理
B190: 002508.SZ | C190: 老板电器
B191: 002833.SZ | C191: 弘亚数控 | G191: 0.90480000000000005 | H191: 0.4375 | I191: 0.20829999999999999 | J191: 0.129 | K191: 0.29999999999999999 | L191: 0.31519999999999998 | M191: 0.2621 | N191: 0.1429 | O191: -0.32689999999999997 | P191: -0.36359999999999998 | Q191: -0.36070000000000002 | R191: -0.29499999999999998 | S191: -0.37140000000000001 | T191: -0.37659999999999999 | U191: -0.30769999999999997 | V191: 0.156 | W191: 1.3182 | X191: 0.9375 | Y191: 0.75309999999999999 | AA191: =(N191+O191+P191+Q191+R191+S191+T191+U191+V191+W191+X191+Y191)/12 -> 7.5483333333333361e-02 | AB191: =(G191+H191+I191+J191+K191+L191+M191+N191+O191+P191+Q191+R191+S191+T191+U191+V191+W191+X191+Y191)/19 -> 0.18224736842105263 | AC191: =(R191+S191)/2 -> -0.3332 | AD191: =(S191+T191)/2 -> -0.374 | AE191: =(T191+U191)/2 -> -0.34214999999999995 | AF191: =(U191+V191)/2 -> -7.5849999999999987e-02 | AG191: =(V191+W191)/2 -> 0.73709999999999998 | AH191: =(W191+X191)/2 -> 1.12785 | AI191: =(X191+Y191)/2 -> 0.84529999999999994 | AJ191: =STDEV(G191:Y191) -> 0.51403604755613641
B192: 601838.SH | C192: 成都银行 | E192: 1.06e-02 | F192: 1.4199999999999999 | I192: 0.26469999999999999 | J192: 0.51900000000000002 | K192: 0.15380000000000002 | L192: 0.17649999999999999 | M192: 0.1047 | N192: 8.3299999999999999e-02 | O192: 0.16670000000000001 | P192: 0.14999999999999999 | Q192: 0.16839999999999999 | R192: 0.18460000000000001 | S192: 0.1143 | T192: 0.1014 | U192: 4.4999999999999998e-02 | V192: 8.4399999999999989e-02 | W192: 0.17949999999999999 | X192: 0.23680000000000001 | Y192: 0.22409999999999999 | AA192: =(N192+O192+P192+Q192+R192+S192+T192+U192+V192+W192+X192+Y192)/12 -> 0.144875 | AB192: =(G192+H192+I192+J192+K192+L192+M192+N192+O192+P192+Q192+R192+S192+T192+U192+V192+W192+X192+Y192)/19 -> 0.15564210526315791 | AC192: =(R192+S192)/2 -> 0.14945 | AD192: =(S192+T192)/2 -> 0.10785 | AE192: =(T192+U192)/2 -> 7.3200000000000001e-02 | AF192: =(U192+V192)/2 -> 6.4699999999999994e-02 | AG192: =(V192+W192)/2 -> 0.13194999999999998 | AH192: =(W192+X192)/2 -> 0.20815 | AI192: =(X192+Y192)/2 -> 0.23044999999999999 | AJ192: =STDEV(G192:Y192) -> 0.10649408503320182
B193: 605566.SH | C193: 福莱蒽特 | W193: -0.44219999999999998 | X193: 8.3299999999999999e-02 | Y193: 3.6499999999999998e-02 | AA193: =(N193+O193+P193+Q193+R193+S193+T193+U193+V193+W193+X193+Y193)/12 -> -2.6866666666666667e-02 | AB193: =(G193+H193+I193+J193+K193+L193+M193+N193+O193+P193+Q193+R193+S193+T193+U193+V193+W193+X193+Y193)/19 -> -1.6968421052631581e-02 | AC193: =(R193+S193)/2 -> 0 | AD193: =(S193+T193)/2 -> 0 | AE193: =(T193+U193)/2 -> 0 | AF193: =(U193+V193)/2 -> 0 | AG193: =(V193+W193)/2 -> -0.22109999999999999 | AH193: =(W193+X193)/2 -> -0.17945 | AI193: =(X193+Y193)/2 -> 5.9899999999999995e-02 | AJ193: =STDEV(G193:Y193) -> 0.29083047181018246
B194: 002022.SZ | C194: 科华生物
B195: 000789.SZ | C195: 万年青
B196: 601012.SH | C196: 隆基股份 | G196: 0.4667 | H196: -8.1600000000000006e-02 | I196: 0.30649999999999999 | J196: 0.5 | K196: -0.13639999999999999 | L196: -0.15560000000000002 | M196: -0.39510000000000001 | N196: -0.41859999999999997 | O196: -5.2600000000000001e-02 | P196: 0.5 | Q196: 1 | R196: 0.95999999999999996 | S196: 1.7222 | T196: 0.36840000000000006 | U196: 0.23469999999999999 | V196: 0.54420000000000002 | W196: 0.34689999999999999 | X196: 0.1923 | Y196: 0.1653 | AA196: =(N196+O196+P196+Q196+R196+S196+T196+U196+V196+W196+X196+Y196)/12 -> 0.46356666666666668 | AB196: =(G196+H196+I196+J196+K196+L196+M196+N196+O196+P196+Q196+R196+S196+T196+U196+V196+W196+X196+Y196)/19 -> 0.31933157894736847 | AC196: =(R196+S196)/2 -> 1.3411 | AD196: =(S196+T196)/2 -> 1.0453000000000001 | AE196: =(T196+U196)/2 -> 0.30155000000000004 | AF196: =(U196+V196)/2 -> 0.38945000000000002 | AG196: =(V196+W196)/2 -> 0.44555 | AH196: =(W196+X196)/2 -> 0.26960000000000001 | AI196: =(X196+Y196)/2 -> 0.17880000000000001 | AJ196: =STDEV(G196:Y196) -> 0.5173121978636106
B197: 000001.SZ | C197: 平安银行 | G197: -0.1143 | H197: -5.5599999999999997e-02 | I197: -2.75e-02 | J197: -1.52e-02 | K197: 6.4500000000000002e-02 | L197: 7.3499999999999996e-02 | M197: 7.5499999999999998e-02 | N197: 6.9199999999999998e-02 | O197: 0.1515 | P197: 0.16440000000000002 | Q197: 0.15789999999999998 | R197: 0.1079 | S197: 5.2600000000000001e-02 | T197: -0.2235 | U197: -0.15909999999999999 | V197: -9.0899999999999995e-02 | W197: 5.0000000000000003e-02 | X197: 0.21210000000000001 | Y197: 0.26129999999999998 | AA197: =(N197+O197+P197+Q197+R197+S197+T197+U197+V197+W197+X197+Y197)/12 -> 6.2783333333333316e-02 | AB197: =(G197+H197+I197+J197+K197+L197+M197+N197+O197+P197+Q197+R197+S197+T197+U197+V197+W197+X197+Y197)/19 -> 3.9699999999999999e-02 | AC197: =(R197+S197)/2 -> 8.0250000000000002e-02 | AD197: =(S197+T197)/2 -> -8.5449999999999998e-02 | AE197: =(T197+U197)/2 -> -0.1913 | AF197: =(U197+V197)/2 -> -0.125 | AG197: =(V197+W197)/2 -> -2.0449999999999996e-02 | AH197: =(W197+X197)/2 -> 0.13105 | AI197: =(X197+Y197)/2 -> 0.23669999999999999 | AJ197: =STDEV(G197:Y197) -> 0.12820599309964673 | AQ197: 27.764099999999999 | AR197: -0.2697 | AS197: 0.16519999999999999 | AT197: 0.23139999999999999 | AU197: 0.94590000000000007 | AV197: 2.3801000000000001 | AW197: 1.0123 | AX197: -0.27639999999999998 | AY197: -0.17710000000000001 | AZ197: 0.17430000000000001 | BA197: -0.45630000000000004 | BB197: 0.40950000000000003 | BC197: -0.24679999999999999 | BE197: =(AR197+AS197+AT197+AU197+AV197+AW197+AX197+AY197+AZ197+BA197+BB197+BC197)/12 -> 0.32436666666666664 | BF197: =(AK197+AL197+AM197+AN197+AO197+AP197+AQ197+AR197+AS197+AT197+AU197+AV197+AV197+AW197+AX197+AY197+AZ197+BA197+BB197+BC197)/19 -> 1.7914000000000001 | BG197: =(AV197+AW197)/2 -> 1.6962000000000002 | BH197: =(AW197+AX197)/2 -> 0.36795 | BI197: =(AX197+AY197)/2 -> -0.22675000000000001 | BJ197: =(AY197+AZ197)/2 -> -1.3999999999999985e-03 | BK197: =(AZ197+BA197)/2 -> -0.14100000000000001 | BL197: =(BA197+BB197)/2 -> -2.3400000000000004e-02 | BM197: =(BB197+BC197)/2 -> 8.135000000000002e-02 | BN197: =STDEV(AK197:BC197) -> 7.6489154997997533
B198: 600089.SH | C198: 特变电工 | G198: 0.1108 | H198: 0.1258 | I198: 3.0999999999999999e-03 | J198: -9.8599999999999993e-02 | K198: -0.28809999999999997 | L198: -8.8399999999999992e-02 | M198: -4.4299999999999999e-02 | N198: -0.19800000000000001 | O198: -0.1045 | P198: -0.26419999999999999 | Q198: -0.13949999999999999 | R198: -4.2800000000000005e-02 | S198: -8.199999999999999e-02 | T198: -0.12189999999999999 | U198: -6.7299999999999999e-02 | V198: 0.2581 | W198: 4.1452 | X198: 2.3763000000000001 | Y198: 2.3372000000000002 | AA198: =(N198+O198+P198+Q198+R198+S198+T198+U198+V198+W198+X198+Y198)/12 -> 0.67471666666666674 | AB198: =(G198+H198+I198+J198+K198+L198+M198+N198+O198+P198+Q198+R198+S198+T198+U198+V198+W198+X198+Y198)/19 -> 0.41141578947368423 | AC198: =(R198+S198)/2 -> -6.2399999999999997e-02 | AD198: =(S198+T198)/2 -> -0.10194999999999999 | AE198: =(T198+U198)/2 -> -9.459999999999999e-02 | AF198: =(U198+V198)/2 -> 9.5399999999999999e-02 | AG198: =(V198+W198)/2 -> 2.2016499999999999 | AH198: =(W198+X198)/2 -> 3.2607499999999998 | AI198: =(X198+Y198)/2 -> 2.3567499999999999 | AJ198: =STDEV(G198:Y198) -> 1.188849852337758
B199: 002845.SZ | C199: 同兴达
B200: 600196.SH | C200: 复星医药 | G200: 0.1852 | H200: 7.690000000000001e-02 | I200: 5.3200000000000004e-02 | J200: 4.9599999999999998e-02 | K200: -0.125 | L200: -0.10000000000000001 | M200: -0.16159999999999999 | N200: -0.1575 | O200: 0 | P200: -6.3500000000000001e-02 | Q200: -2.41e-02 | R200: 0.215 | S200: -0.17859999999999998 | T200: 0.1356 | U200: 0.19750000000000001 | V200: 0.10000000000000001 | W200: 0.43479999999999996 | X200: 0.44780000000000003 | Y200: 0.433 | AA200: =(N200+O200+P200+Q200+R200+S200+T200+U200+V200+W200+X200+Y200)/12 -> 0.12833333333333333 | AB200: =(G200+H200+I200+J200+K200+L200+M200+N200+O200+P200+Q200+R200+S200+T200+U200+V200+W200+X200+Y200)/19 -> 7.9910526315789474e-02 | AC200: =(R200+S200)/2 -> 1.8200000000000008e-02 | AD200: =(S200+T200)/2 -> -2.1499999999999991e-02 | AE200: =(T200+U200)/2 -> 0.16655 | AF200: =(U200+V200)/2 -> 0.14874999999999999 | AG200: =(V200+W200)/2 -> 0.26739999999999997 | AH200: =(W200+X200)/2 -> 0.44130000000000003 | AI200: =(X200+Y200)/2 -> 0.44040000000000001 | AJ200: =STDEV(G200:Y200) -> 0.20109633096475274
B201: 603579.SH | C201: 荣泰健康
B202: 002110.SZ | C202: 三钢闽光
B203: 002756.SZ | C203: 永兴材料 | E203: 0.20329999999999998 | F203: 1.3799999999999999 | G203: -0.33329999999999999 | H203: 0.2432 | I203: 0.26319999999999999 | J203: 0.40000000000000002 | K203: 0.38890000000000002 | L203: 0.3478 | M203: 0.27779999999999999 | N203: 0.10199999999999999 | O203: 0.12 | P203: 0.19350000000000001 | Q203: 8.6999999999999994e-02 | R203: -0.12039999999999999 | S203: -0.25 | T203: -0.39189999999999997 | U203: -0.28999999999999998 | V203: -0.24210000000000001 | W203: 0.47619999999999996 | X203: 0.68889999999999996 | Y203: 0.94370000000000009 | AA203: =(N203+O203+P203+Q203+R203+S203+T203+U203+V203+W203+X203+Y203)/12 -> 0.10974166666666667 | AB203: =(G203+H203+I203+J203+K203+L203+M203+N203+O203+P203+Q203+R203+S203+T203+U203+V203+W203+X203+Y203)/19 -> 0.15286842105263157 | AC203: =(R203+S203)/2 -> -0.1852 | AD203: =(S203+T203)/2 -> -0.32094999999999996 | AE203: =(T203+U203)/2 -> -0.34094999999999998 | AF203: =(U203+V203)/2 -> -0.26605000000000001 | AG203: =(V203+W203)/2 -> 0.11704999999999997 | AH203: =(W203+X203)/2 -> 0.5825499999999999 | AI203: =(X203+Y203)/2 -> 0.81630000000000003 | AJ203: =STDEV(G203:Y203) -> 0.36054840182488612 | AK203: 0.17420000000000002 | AL203: 9.0500000000000011e-02 | AM203: 0.17280000000000001 | AN203: 0.1578 | AO203: 0.154 | AP203: 0.26679999999999998 | AQ203: 0.25309999999999999 | AR203: 0.25180000000000002 | AS203: 0.21989999999999998 | AT203: 0.107 | AU203: 6.0999999999999999e-02 | AV203: -4.4999999999999998e-02 | AW203: -0.45369999999999999 | AX203: -0.27029999999999998 | AY203: -0.28800000000000003 | AZ203: -1.5100000000000001e-02 | BA203: 0.29620000000000002 | BB203: 0.20929999999999999 | BC203: 0.58279999999999998 | BE203: =(AR203+AS203+AT203+AU203+AV203+AW203+AX203+AY203+AZ203+BA203+BB203+BC203)/12 -> 5.465833333333333e-02 | BF203: =(AK203+AL203+AM203+AN203+AO203+AP203+AQ203+AR203+AS203+AT203+AU203+AV203+AV203+AW203+AX203+AY203+AZ203+BA203+BB203+BC203)/19 -> 9.8952631578947375e-02 | BG203: =(AV203+AW203)/2 -> -0.24934999999999999 | BH203: =(AW203+AX203)/2 -> -0.36199999999999999 | BI203: =(AX203+AY203)/2 -> -0.27915000000000001 | BJ203: =(AY203+AZ203)/2 -> -0.15155000000000002 | BK203: =(AZ203+BA203)/2 -> 0.14055000000000001 | BL203: =(BA203+BB203)/2 -> 0.25275000000000003 | BM203: =(BB203+BC203)/2 -> 0.39605000000000001 | BN203: =STDEV(AK203:BC203) -> 0.23798110004075573
B204: 603368.SH | C204: 柳药股份
B205: 603886.SH | C205: 元祖股份 | E205: 0.55049999999999999 | F205: 1.3799999999999999 | G205: 0.5 | H205: 1.0588 | I205: 0 | J205: 0.23190000000000002 | K205: -0.375 | L205: 10 | M205: 0.3049 | N205: 0.24710000000000001 | O205: 0.72730000000000006 | P205: 0.36359999999999998 | Q205: 7.4800000000000005e-02 | R205: -2.8300000000000002e-02 | S205: -3.3332999999999999 | T205: -0.26669999999999999 | U205: 6.0899999999999996e-02 | V205: 0.21359999999999998 | W205: 1.0769 | X205: 1.3636000000000001 | Y205: 0.13109999999999999 | AA205: =(N205+O205+P205+Q205+R205+S205+T205+U205+V205+W205+X205+Y205)/12 -> 5.255000000000002e-02 | AB205: =(G205+H205+I205+J205+K205+L205+M205+N205+O205+P205+Q205+R205+S205+T205+U205+V205+W205+X205+Y205)/19 -> 0.65006315789473679 | AC205: =(R205+S205)/2 -> -1.6808000000000001 | AD205: =(S205+T205)/2 -> -1.8 | AE205: =(T205+U205)/2 -> -0.10289999999999999 | AF205: =(U205+V205)/2 -> 0.13724999999999998 | AG205: =(V205+W205)/2 -> 0.64524999999999999 | AH205: =(W205+X205)/2 -> 1.2202500000000001 | AI205: =(X205+Y205)/2 -> 0.74735000000000007 | AJ205: =STDEV(G205:Y205) -> 2.4565744657529667
B206: 603225.SH | C206: 新凤鸣
B207: 601636.SH | C207: 旗滨集团 | G207: 6.1832000000000003 | H207: 2.3794 | I207: 0.84629999999999994 | J207: 0.33579999999999999 | K207: 0.34539999999999998 | L207: 0.18809999999999999 | M207: 0.1406 | N207: 3.5000000000000003e-02 | O207: -0.35229999999999995 | P207: -0.19149999999999998 | Q207: -1.89e-02 | R207: 0.1275 | S207: -0.26340000000000002 | T207: -2.46e-02 | U207: 0.28800000000000003 | V207: 0.33429999999999999 | W207: 4.4238 | X207: 3.2911000000000001 | Y207: 1.9913999999999998 | AA207: =(N207+O207+P207+Q207+R207+S207+T207+U207+V207+W207+X207+Y207)/12 -> 0.80336666666666667 | AB207: =(G207+H207+I207+J207+K207+L207+M207+N207+O207+P207+Q207+R207+S207+T207+U207+V207+W207+X207+Y207)/19 -> 1.0557473684210525 | AC207: =(R207+S207)/2 -> -6.795000000000001e-02 | AD207: =(S207+T207)/2 -> -0.14400000000000002 | AE207: =(T207+U207)/2 -> 0.13170000000000001 | AF207: =(U207+V207)/2 -> 0.31115000000000004 | AG207: =(V207+W207)/2 -> 2.3790499999999999 | AH207: =(W207+X207)/2 -> 3.85745 | AI207: =(X207+Y207)/2 -> 2.6412499999999999 | AJ207: =STDEV(G207:Y207) -> 1.8032351524007626
B208: 002223.SZ | C208: 鱼跃医疗 | E208: 0.32100000000000001 | F208: 1.3480000000000001 | G208: -0.20829999999999999 | H208: 5.2600000000000001e-02 | I208: -0.25890000000000002 | J208: 0.11320000000000001 | K208: 0.10529999999999999 | L208: 0.17499999999999999 | M208: 0.19059999999999999 | N208: 0.23730000000000001 | O208: 0.1714 | P208: 0.13189999999999999 | Q208: 0.1333 | R208: 2.7400000000000001e-02 | S208: 0.55159999999999998 | T208: 1.1052999999999999 | U208: 1.1218000000000001 | V208: 1.3333000000000002 | W208: 0.20039999999999999 | X208: -0.13390000000000002 | Y208: -9.6600000000000005e-02 | AA208: =(N208+O208+P208+Q208+R208+S208+T208+U208+V208+W208+X208+Y208)/12 -> 0.39860000000000012 | AB208: =(G208+H208+I208+J208+K208+L208+M208+N208+O208+P208+Q208+R208+S208+T208+U208+V208+W208+X208+Y208)/19 -> 0.26066842105263166 | AC208: =(R208+S208)/2 -> 0.28949999999999998 | AD208: =(S208+T208)/2 -> 0.82844999999999991 | AE208: =(T208+U208)/2 -> 1.11355 | AF208: =(U208+V208)/2 -> 1.2275500000000001 | AG208: =(V208+W208)/2 -> 0.76685000000000003 | AH208: =(W208+X208)/2 -> 3.3249999999999988e-02 | AI208: =(X208+Y208)/2 -> -0.11525000000000002 | AJ208: =STDEV(G208:Y208) -> 0.45117933617555328
A209: JBM_20220223 | B209: 000915.SZ | C209: 华特达因 | G209: 0.42309999999999998 | H209: 0.40000000000000002 | I209: 0.35289999999999999 | J209: 0.2235 | K209: -0.1351 | L209: -0.44440000000000002 | M209: -0.33700000000000002 | N209: -0.47120000000000001 | O209: -0.6875 | P209: 8.5699999999999998e-02 | Q209: 8.2000000000000003e-02 | R209: 0.58179999999999998 | S209: 1.1000000000000001 | T209: 0.52629999999999999 | U209: 0.46970000000000001 | V209: 0.42530000000000001 | W209: 1.2381 | X209: 0.68969999999999998 | Y209: 0.40210000000000001 | AA209: =(N209+O209+P209+Q209+R209+S209+T209+U209+V209+W209+X209+Y209)/12 -> 0.3701666666666667 | AB209: =(G209+H209+I209+J209+K209+L209+M209+N209+O209+P209+Q209+R209+S209+T209+U209+V209+W209+X209+Y209)/19 -> 0.25921052631578945 | AC209: =(R209+S209)/2 -> 0.84089999999999998 | AD209: =(S209+T209)/2 -> 0.81315000000000004 | AE209: =(T209+U209)/2 -> 0.498 | AF209: =(U209+V209)/2 -> 0.44750000000000001 | AG209: =(V209+W209)/2 -> 0.83169999999999999 | AH209: =(W209+X209)/2 -> 0.96389999999999998 | AI209: =(X209+Y209)/2 -> 0.54590000000000005 | AJ209: =STDEV(G209:Y209) -> 0.50947697570344619 | BA209: 0.32369999999999999 | BB209: 0.24590000000000001 | BC209: 0.20499999999999999 | CJ209: =CI209/BS209 -> #DIV/0! | CL209: 44608
B210: 600030.SH | C210: 中信证券
B211: 603160.SH | C211: 汇顶科技
B212: 603369.SH | C212: 今世缘
B213: 003020.SZ | C213: 立方制药 | E213: 0.29220000000000002 | F213: 1.353 | V213: 0.2848 | W213: 7.1399999999999991e-02 | X213: -5.2600000000000001e-02 | Y213: -5.67e-02 | AA213: =(N213+O213+P213+Q213+R213+S213+T213+U213+V213+W213+X213+Y213)/12 -> 2.0575e-02 | AB213: =(G213+H213+I213+J213+K213+L213+M213+N213+O213+P213+Q213+R213+S213+T213+U213+V213+W213+X213+Y213)/19 -> 1.2994736842105262e-02 | AC213: =(R213+S213)/2 -> 0 | AD213: =(S213+T213)/2 -> 0 | AE213: =(T213+U213)/2 -> 0 | AF213: =(U213+V213)/2 -> 0.1424 | AG213: =(V213+W213)/2 -> 0.17809999999999998 | AH213: =(W213+X213)/2 -> 9.3999999999999952e-03 | AI213: =(X213+Y213)/2 -> -5.4650000000000004e-02 | AJ213: =STDEV(G213:Y213) -> 0.16015695166512961
B214: 600000.SH | C214: 浦发银行
B215: 002371.SZ | C215: 北方华创 | G215: 1.2287999999999999 | H215: 0.12380000000000001 | I215: 0.1444 | J215: 0.2457 | K215: 8.5714000000000006 | L215: 1.2533000000000001 | M215: 1.1015999999999999 | N215: 0.85999999999999999 | O215: 0.29849999999999999 | P215: 8.0399999999999985e-02 | Q215: 0.3009 | R215: 0.31480000000000002 | S215: 0.2414 | T215: 0.3306 | U215: 0.38939999999999997 | V215: 0.63009999999999999 | W215: 1.7203999999999999 | X215: 0.67359999999999998 | Y215: 1.0093000000000001 | AA215: =(N215+O215+P215+Q215+R215+S215+T215+U215+V215+W215+X215+Y215)/12 -> 0.57078333333333331 | AB215: =(G215+H215+I215+J215+K215+L215+M215+N215+O215+P215+Q215+R215+S215+T215+U215+V215+W215+X215+Y215)/19 -> 1.0272842105263158 | AC215: =(R215+S215)/2 -> 0.27810000000000001 | AD215: =(S215+T215)/2 -> 0.28600000000000003 | AE215: =(T215+U215)/2 -> 0.35999999999999999 | AF215: =(U215+V215)/2 -> 0.50974999999999993 | AG215: =(V215+W215)/2 -> 1.1752499999999999 | AH215: =(W215+X215)/2 -> 1.1970000000000001 | AI215: =(X215+Y215)/2 -> 0.84145000000000003 | AJ215: =STDEV(G215:Y215) -> 1.8853524215980764
B216: 603113.SH | C216: 金能科技
B217: 600438.SH | C217: 通威股份 | G217: 9.4443999999999999 | H217: -0.1623 | I217: 0.36130000000000001 | J217: 0.60750000000000004 | K217: 0.20610000000000001 | L217: 0.15990000000000001 | M217: 8.5900000000000004e-02 | N217: 5.1999999999999998e-03 | O217: 0.53210000000000002 | P217: 0.58009999999999995 | Q217: 0.3513 | R217: 0.30499999999999999 | S217: -0.29830000000000001 | T217: -0.3382 | U217: 0.38909999999999995 | V217: 0.26450000000000001 | W217: 1.1218000000000001 | X217: 1.6640000000000001 | Y217: 0.64560000000000006 | AA217: =(N217+O217+P217+Q217+R217+S217+T217+U217+V217+W217+X217+Y217)/12 -> 0.43518333333333331 | AB217: =(G217+H217+I217+J217+K217+L217+M217+N217+O217+P217+Q217+R217+S217+T217+U217+V217+W217+X217+Y217)/19 -> 0.8381578947368421 | AC217: =(R217+S217)/2 -> 3.3499999999999919e-03 | AD217: =(S217+T217)/2 -> -0.31825000000000003 | AE217: =(T217+U217)/2 -> 2.5449999999999973e-02 | AF217: =(U217+V217)/2 -> 0.32679999999999998 | AG217: =(V217+W217)/2 -> 0.69315000000000004 | AH217: =(W217+X217)/2 -> 1.3929 | AI217: =(X217+Y217)/2 -> 1.1548 | AJ217: =STDEV(G217:Y217) -> 2.1363955637464054
B218: 002064.SZ | C218: 华峰化学
B219: 601577.SH | C219: 长沙银行
B220: 002001.SZ | C220: 新和成
B221: 600887.SH | C221: 伊利股份
B222: 605336.SH | C222: 帅丰电器 | E222: 0.16260000000000002 | F222: 1.296 | T222: 5.8799999999999998e-02 | U222: 0.15689999999999998 | V222: 3.0299999999999997e-02 | W222: 0.71430000000000005 | X222: 0.22219999999999998 | Y222: 0.11019999999999999 | AA222: =(N222+O222+P222+Q222+R222+S222+T222+U222+V222+W222+X222+Y222)/12 -> 0.10772500000000002 | AB222: =(G222+H222+I222+J222+K222+L222+M222+N222+O222+P222+Q222+R222+S222+T222+U222+V222+W222+X222+Y222)/19 -> 6.8036842105263173e-02 | AC222: =(R222+S222)/2 -> 0 | AD222: =(S222+T222)/2 -> 2.9399999999999999e-02 | AE222: =(T222+U222)/2 -> 0.10784999999999999 | AF222: =(U222+V222)/2 -> 9.3599999999999989e-02 | AG222: =(V222+W222)/2 -> 0.37230000000000002 | AH222: =(W222+X222)/2 -> 0.46825 | AI222: =(X222+Y222)/2 -> 0.16619999999999999 | AJ222: =STDEV(G222:Y222) -> 0.25385913219736655
B223: 001296.SZ | C223: 长江材料 | Y223: -0.10339999999999999 | AA223: =(N223+O223+P223+Q223+R223+S223+T223+U223+V223+W223+X223+Y223)/12 -> -8.6166666666666666e-03 | AB223: =(G223+H223+I223+J223+K223+L223+M223+N223+O223+P223+Q223+R223+S223+T223+U223+V223+W223+X223+Y223)/19 -> -5.4421052631578939e-03 | AC223: =(R223+S223)/2 -> 0 | AD223: =(S223+T223)/2 -> 0 | AE223: =(T223+U223)/2 -> 0 | AF223: =(U223+V223)/2 -> 0 | AG223: =(V223+W223)/2 -> 0 | AH223: =(W223+X223)/2 -> 0 | AI223: =(X223+Y223)/2 -> -5.1699999999999996e-02 | AJ223: =STDEV(G223:Y223) -> #DIV/0!
A224: JBM_20220223 | B224: 002637.SZ | C224: 赞宇科技 | G224: 0.2019 | H224: -0.10829999999999999 | I224: -0.13039999999999999 | J224: -9.5200000000000007e-02 | K224: 0.92600000000000005 | L224: 0.80559999999999998 | M224: 0.80000000000000004 | N224: 0.13159999999999999 | O224: 7.4800000000000005e-02 | P224: 1.2774000000000001 | Q224: 0.55559999999999998 | R224: 0.95350000000000001 | S224: 1.4155 | T224: 4.5499999999999999e-02 | U224: 0.55359999999999998 | V224: -2.3800000000000002e-02 | W224: 0.59999999999999998 | X224: 1.0651999999999999 | Y224: 0.49430000000000002 | AA224: =(N224+O224+P224+Q224+R224+S224+T224+U224+V224+W224+X224+Y224)/12 -> 0.59526666666666672 | AB224: =(G224+H224+I224+J224+K224+L224+M224+N224+O224+P224+Q224+R224+S224+T224+U224+V224+W224+X224+Y224)/19 -> 0.50225263157894739 | AC224: =(R224+S224)/2 -> 1.1844999999999999 | AD224: =(S224+T224)/2 -> 0.73050000000000004 | AE224: =(T224+U224)/2 -> 0.29954999999999998 | AF224: =(U224+V224)/2 -> 0.26489999999999997 | AG224: =(V224+W224)/2 -> 0.28809999999999997 | AH224: =(W224+X224)/2 -> 0.83260000000000001 | AI224: =(X224+Y224)/2 -> 0.77974999999999994 | AJ224: =STDEV(G224:Y224) -> 0.49195652740237233 | BA224: 0.17799999999999999 | BB224: 0.5323 | BC224: 0.61209999999999998 | BS224: 4.7039999999999997 | BT224: 3.956 | CB224: 4 | CC224: 持续减少(由21家减少到7家，再减少到4家) | CD224: 先变多再变少（由31.76%减少到33.96%，再减少到0.41%） | CI224: 6.04 | CJ224: =CI224/BS224 -> 1.2840136054421769 | CL224: 44608
B225: 600362.SH | C225: 江西铜业
B226: 603883.SH | C226: 老百姓
B227: 000011.SZ | C227: 深物业A
B228: 002727.SZ | C228: 一心堂 | G228: -7.8799999999999995e-02 | H228: 0.1008 | I228: 0.11380000000000001 | J228: 0.19620000000000001 | K228: 0.2369 | L228: 0.2412 | M228: 0.2145 | N228: 0.13019999999999998 | O228: 0.33509999999999995 | P228: 0.1532 | Q228: 0.1565 | R228: 0.15909999999999999 | S228: 0.1681 | T228: 0.23449999999999999 | U228: 0.24809999999999999 | V228: 0.29760000000000003 | W228: 0.2243 | X228: 0.2104 | Y228: 0.21629999999999999 | AA228: =(N228+O228+P228+Q228+R228+S228+T228+U228+V228+W228+X228+Y228)/12 -> 0.21111666666666665 | AB228: =(G228+H228+I228+J228+K228+L228+M228+N228+O228+P228+Q228+R228+S228+T228+U228+V228+W228+X228+Y228)/19 -> 0.18726315789473683 | AC228: =(R228+S228)/2 -> 0.1636 | AD228: =(S228+T228)/2 -> 0.20129999999999998 | AE228: =(T228+U228)/2 -> 0.24129999999999999 | AF228: =(U228+V228)/2 -> 0.27285000000000004 | AG228: =(V228+W228)/2 -> 0.26095000000000002 | AH228: =(W228+X228)/2 -> 0.21734999999999999 | AI228: =(X228+Y228)/2 -> 0.21334999999999998 | AJ228: =STDEV(G228:Y228) -> 8.7905525110935079e-02
B229: 601211.SH | C229: 国泰君安 | F229: 1.6859999999999999 | G229: 0.10339999999999999 | H229: -9.6799999999999997e-02 | I229: -0.1489 | J229: -8.2599999999999993e-02 | K229: -0.1875 | L229: -0.2321 | M229: -0.27500000000000002 | N229: -0.36939999999999995 | O229: 0.26919999999999999 | P229: 0.25579999999999997 | Q229: 0.18969999999999998 | R229: 0.28570000000000001 | S229: -0.42420000000000002 | T229: 7.4099999999999999e-02 | U229: 0.40579999999999999 | V229: 0.33329999999999999 | W229: 1.5789 | X229: 0.53449999999999998 | Y229: 0.32990000000000003 | AA229: =(N229+O229+P229+Q229+R229+S229+T229+U229+V229+W229+X229+Y229)/12 -> 0.2886083333333333 | AB229: =(G229+H229+I229+J229+K229+L229+M229+N229+O229+P229+Q229+R229+S229+T229+U229+V229+W229+X229+Y229)/19 -> 0.1338842105263158 | AC229: =(R229+S229)/2 -> -6.9250000000000006e-02 | AD229: =(S229+T229)/2 -> -0.17505000000000001 | AE229: =(T229+U229)/2 -> 0.23995 | AF229: =(U229+V229)/2 -> 0.36954999999999999 | AG229: =(V229+W229)/2 -> 0.95609999999999995 | AH229: =(W229+X229)/2 -> 1.0567 | AI229: =(X229+Y229)/2 -> 0.43220000000000003 | AJ229: =STDEV(G229:Y229) -> 0.44806686289629921
B230: 601877.SH | C230: 正泰电器 | E230: 0.60350000000000004 | F230: 1.29 | G230: -5.2600000000000001e-02 | H230: -1.6399999999999998e-02 | I230: -2.1099999999999997e-02 | J230: 2.29e-02 | K230: 0.55559999999999998 | L230: 0.38329999999999997 | M230: 0.39779999999999999 | N230: 0.25370000000000004 | O230: -0.10710000000000001 | P230: 0 | Q230: 2.3099999999999999e-02 | R230: 4.1700000000000001e-02 | S230: -0.35999999999999999 | T230: 1.2e-02 | U230: 6.7699999999999996e-02 | V230: 0.70860000000000001 | W230: -0.625 | X230: 2.3799999999999998e-02 | Y230: -9.1499999999999998e-02 | AA230: =(N230+O230+P230+Q230+R230+S230+T230+U230+V230+W230+X230+Y230)/12 -> -4.4166666666666625e-03 | AB230: =(G230+H230+I230+J230+K230+L230+M230+N230+O230+P230+Q230+R230+S230+T230+U230+V230+W230+X230+Y230)/19 -> 6.4026315789473681e-02 | AC230: =(R230+S230)/2 -> -0.15914999999999999 | AD230: =(S230+T230)/2 -> -0.17399999999999999 | AE230: =(T230+U230)/2 -> 3.9849999999999997e-02 | AF230: =(U230+V230)/2 -> 0.38815 | AG230: =(V230+W230)/2 -> 4.1800000000000004e-02 | AH230: =(W230+X230)/2 -> -0.30059999999999998 | AI230: =(X230+Y230)/2 -> -3.3849999999999998e-02 | AJ230: =STDEV(G230:Y230) -> 0.30313949455307659
B231: 603010.SH | C231: 万盛股份 | G231: 0 | H231: 0 | I231: -0.27910000000000001 | J231: -0.38979999999999998 | K231: -0.86670000000000003 | L231: -0.51849999999999996 | M231: 0.2581 | N231: -0.16670000000000001 | O231: 2.5 | P231: 0.61539999999999995 | Q231: 2.5600000000000001e-02 | R231: 0.56669999999999998 | S231: 0.42859999999999998 | T231: 4.7599999999999996e-02 | U231: 0.20000000000000001 | V231: 1.4255000000000002 | W231: 4.9000000000000004 | X231: 3.0455000000000001 | Y231: 1.6875 | AA231: =(N231+O231+P231+Q231+R231+S231+T231+U231+V231+W231+X231+Y231)/12 -> 1.272975 | AB231: =(G231+H231+I231+J231+K231+L231+M231+N231+O231+P231+Q231+R231+S231+T231+U231+V231+W231+X231+Y231)/19 -> 0.70945789473684218 | AC231: =(R231+S231)/2 -> 0.49764999999999998 | AD231: =(S231+T231)/2 -> 0.23809999999999998 | AE231: =(T231+U231)/2 -> 0.12380000000000001 | AF231: =(U231+V231)/2 -> 0.81275000000000008 | AG231: =(V231+W231)/2 -> 3.1627500000000004 | AH231: =(W231+X231)/2 -> 3.9727500000000004 | AI231: =(X231+Y231)/2 -> 2.3665000000000003 | AJ231: =STDEV(G231:Y231) -> 1.4360872533518867
B232: 603156.SH | C232: 养元饮品
B233: 600755.SH | C233: 厦门国贸
B234: 603733.SH | C234: 仙鹤股份 | I234: 0.42859999999999998 | J234: 0.62219999999999998 | K234: 0.28570000000000001 | L234: -6.0599999999999994e-02 | M234: -0.14000000000000001 | N234: -0.32880000000000004 | O234: -0.66670000000000007 | P234: -0.3226 | Q234: 2.3300000000000001e-02 | R234: 0.46939999999999998 | S234: 1.8333000000000002 | T234: 1.1904999999999999 | U234: 0.79549999999999998 | V234: 0.56940000000000002 | W234: 1.3529 | X234: 0.86959999999999993 | Y234: 0.62029999999999996 | AA234: =(N234+O234+P234+Q234+R234+S234+T234+U234+V234+W234+X234+Y234)/12 -> 0.53384166666666666 | AB234: =(G234+H234+I234+J234+K234+L234+M234+N234+O234+P234+Q234+R234+S234+T234+U234+V234+W234+X234+Y234)/19 -> 0.3969473684210526 | AC234: =(R234+S234)/2 -> 1.1513500000000001 | AD234: =(S234+T234)/2 -> 1.5119 | AE234: =(T234+U234)/2 -> 0.99299999999999988 | AF234: =(U234+V234)/2 -> 0.68245 | AG234: =(V234+W234)/2 -> 0.96114999999999995 | AH234: =(W234+X234)/2 -> 1.1112500000000001 | AI234: =(X234+Y234)/2 -> 0.74495 | AJ234: =STDEV(G234:Y234) -> 0.65735836318332397
B235: 603985.SH | C235: 恒润股份 | E235: 0.19359999999999999 | F235: 0.99399999999999999 | G235: 0.25590000000000002 | H235: 0.20069999999999999 | I235: -0.19409999999999999 | J235: -0.19829999999999998 | K235: -0.3367 | L235: -0.47720000000000001 | M235: -0.30530000000000002 | N235: -0.3226 | O235: -0.53200000000000003 | P235: -0.21199999999999999 | Q235: -0.16260000000000002 | R235: -0.52549999999999997 | S235: 0.55969999999999998 | T235: 1.1479999999999999 | U235: 0.69980000000000009 | V235: 4.5853000000000002 | W235: 1.7763999999999998 | X235: 0.36859999999999998 | Y235: 0.39319999999999999 | AA235: =(N235+O235+P235+Q235+R235+S235+T235+U235+V235+W235+X235+Y235)/12 -> 0.64802499999999996 | AB235: =(G235+H235+I235+J235+K235+L235+M235+N235+O235+P235+Q235+R235+S235+T235+U235+V235+W235+X235+Y235)/19 -> 0.35375263157894732 | AC235: =(R235+S235)/2 -> 1.7100000000000004e-02 | AD235: =(S235+T235)/2 -> 0.85385 | AE235: =(T235+U235)/2 -> 0.92389999999999994 | AF235: =(U235+V235)/2 -> 2.64255 | AG235: =(V235+W235)/2 -> 3.18085 | AH235: =(W235+X235)/2 -> 1.0724999999999998 | AI235: =(X235+Y235)/2 -> 0.38090000000000002 | AJ235: =STDEV(G235:Y235) -> 1.1917760184645161
B236: 001206.SZ | C236: 依依股份 | V236: 0.58960000000000001 | W236: 0.17499999999999999 | X236: -0.48409999999999997 | Y236: -0.46639999999999998 | AA236: =(N236+O236+P236+Q236+R236+S236+T236+U236+V236+W236+X236+Y236)/12 -> -1.5491666666666667e-02 | AB236: =(G236+H236+I236+J236+K236+L236+M236+N236+O236+P236+Q236+R236+S236+T236+U236+V236+W236+X236+Y236)/19 -> -9.7842105263157893e-03 | AC236: =(R236+S236)/2 -> 0 | AD236: =(S236+T236)/2 -> 0 | AE236: =(T236+U236)/2 -> 0 | AF236: =(U236+V236)/2 -> 0.29480000000000001 | AG236: =(V236+W236)/2 -> 0.38229999999999997 | AH236: =(W236+X236)/2 -> -0.15454999999999999 | AI236: =(X236+Y236)/2 -> -0.47524999999999995 | AJ236: =STDEV(G236:Y236) -> 0.52328934873547739
B237: 002597.SZ | C237: 金禾实业 | G237: 0.44 | H237: 1.0238 | I237: 1 | J237: 0.85189999999999999 | K237: 0.44439999999999996 | L237: 0.12939999999999999 | M237: 8.0600000000000005e-02 | N237: -0.105 | O237: -0.3846 | P237: -0.25 | Q237: -0.17910000000000001 | R237: -0.10490000000000001 | S237: -0.15620000000000001 | T237: -0.11109999999999999 | U237: -0.13639999999999999 | V237: -0.1103 | W237: 0.37040000000000001 | X237: 0.21879999999999999 | Y237: 0.33679999999999999 | AA237: =(N237+O237+P237+Q237+R237+S237+T237+U237+V237+W237+X237+Y237)/12 -> -5.0966666666666688e-02 | AB237: =(G237+H237+I237+J237+K237+L237+M237+N237+O237+P237+Q237+R237+S237+T237+U237+V237+W237+X237+Y237)/19 -> 0.17676315789473682 | AC237: =(R237+S237)/2 -> -0.13055 | AD237: =(S237+T237)/2 -> -0.13364999999999999 | AE237: =(T237+U237)/2 -> -0.12375 | AF237: =(U237+V237)/2 -> -0.12334999999999999 | AG237: =(V237+W237)/2 -> 0.13005 | AH237: =(W237+X237)/2 -> 0.29459999999999997 | AI237: =(X237+Y237)/2 -> 0.27779999999999999 | AJ237: =STDEV(G237:Y237) -> 0.42328822490713025
B238: 002889.SZ | C238: 东方嘉盛 | H238: 0.42859999999999998 | I238: 0.1807 | J238: 0.14940000000000001 | K238: -0.23079999999999998 | L238: -0.21429999999999999 | M238: -0.1084 | N238: -2.e-02 | O238: -2.5000000000000001e-02 | P238: 7.2700000000000001e-02 | Q238: 0.13650000000000001 | R238: 0.17350000000000002 | S238: -0.35899999999999999 | T238: 0.22030000000000002 | U238: 0.20100000000000001 | V238: 0.24350000000000002 | W238: 0.35999999999999999 | X238: 0.125 | Y238: 0.25739999999999996 | AA238: =(N238+O238+P238+Q238+R238+S238+T238+U238+V238+W238+X238+Y238)/12 -> 0.11549166666666666 | AB238: =(G238+H238+I238+J238+K238+L238+M238+N238+O238+P238+Q238+R238+S238+T238+U238+V238+W238+X238+Y238)/19 -> 8.3742105263157895e-02 | AC238: =(R238+S238)/2 -> -9.2749999999999985e-02 | AD238: =(S238+T238)/2 -> -6.9349999999999981e-02 | AE238: =(T238+U238)/2 -> 0.21065 | AF238: =(U238+V238)/2 -> 0.22225 | AG238: =(V238+W238)/2 -> 0.30175000000000002 | AH238: =(W238+X238)/2 -> 0.24249999999999999 | AI238: =(X238+Y238)/2 -> 0.19119999999999998 | AJ238: =STDEV(G238:Y238) -> 0.2104059087523649
B239: 002985.SZ | C239: 北摩高科
B240: 600998.SH | C240: 九州通
B241: 605222.SH | C241: 起帆电缆 | E241: 0.62209999999999999 | F241: 1.216 | R241: 0.1047 | S241: -0.25 | T241: 2.3799999999999998e-02 | U241: 0.23190000000000002 | V241: 0.15789999999999998 | W241: 0.94440000000000002 | X241: 0.97670000000000001 | Y241: 0.49409999999999998 | AA241: =(N241+O241+P241+Q241+R241+S241+T241+U241+V241+W241+X241+Y241)/12 -> 0.22362499999999999 | AB241: =(G241+H241+I241+J241+K241+L241+M241+N241+O241+P241+Q241+R241+S241+T241+U241+V241+W241+X241+Y241)/19 -> 0.14123684210526316 | AC241: =(R241+S241)/2 -> -7.2649999999999992e-02 | AD241: =(S241+T241)/2 -> -0.11310000000000001 | AE241: =(T241+U241)/2 -> 0.12785000000000002 | AF241: =(U241+V241)/2 -> 0.19490000000000002 | AG241: =(V241+W241)/2 -> 0.55115000000000003 | AH241: =(W241+X241)/2 -> 0.96055000000000001 | AI241: =(X241+Y241)/2 -> 0.73540000000000005 | AJ241: =STDEV(G241:Y241) -> 0.43794342079934095
B242: 001872.SZ | C242: 招商港口
B243: 000063.SZ | C243: 中兴通讯
B244: 600373.SH | C244: 中文传媒 | E244: 0.41049999999999998 | F244: 1.26 | G244: 0.21429999999999999 | H244: 0.26090000000000002 | I244: 0.11109999999999999 | J244: 0.11699999999999999 | K244: -2.9399999999999999e-02 | L244: 6.9000000000000006e-02 | M244: 0.10000000000000001 | N244: 0.12380000000000001 | O244: 9.0899999999999995e-02 | P244: 4.8399999999999999e-02 | Q244: 4.5499999999999999e-02 | R244: 5.9299999999999999e-02 | S244: -0.27779999999999999 | T244: -3.0800000000000001e-02 | U244: 1.09e-02 | V244: 6.4000000000000001e-02 | W244: 7.690000000000001e-02 | X244: 0.38100000000000001 | Y244: 0.35479999999999995 | AA244: =(N244+O244+P244+Q244+R244+S244+T244+U244+V244+W244+X244+Y244)/12 -> 7.8908333333333344e-02 | AB244: =(G244+H244+I244+J244+K244+L244+M244+N244+O244+P244+Q244+R244+S244+T244+U244+V244+W244+X244+Y244)/19 -> 9.4200000000000006e-02 | AC244: =(R244+S244)/2 -> -0.10925 | AD244: =(S244+T244)/2 -> -0.15429999999999999 | AE244: =(T244+U244)/2 -> -9.9500000000000005e-03 | AF244: =(U244+V244)/2 -> 3.7449999999999997e-02 | AG244: =(V244+W244)/2 -> 7.0450000000000013e-02 | AH244: =(W244+X244)/2 -> 0.22895000000000001 | AI244: =(X244+Y244)/2 -> 0.3679 | AJ244: =STDEV(G244:Y244) -> 0.14488773431714486 | AK244: -7.17e-02 | AL244: -0.1013 | AM244: -7.2599999999999998e-02 | AN244: 9.3999999999999986e-03 | AO244: 0.25219999999999998 | AP244: 0.13289999999999999 | AQ244: 0.1411 | AR244: -1.9599999999999999e-02 | AS244: -0.14940000000000001 | AT244: -3.7999999999999999e-02 | AU244: -6.5599999999999992e-02 | AV244: -6.1500000000000006e-02 | AW244: -0.2029 | AX244: -0.2324 | AY244: -0.17230000000000001 | AZ244: -0.12970000000000001 | BA244: 6.7199999999999996e-02 | BB244: 0.1449 | BC244: -2.06e-02 | BE244: =(AR244+AS244+AT244+AU244+AV244+AW244+AX244+AY244+AZ244+BA244+BB244+BC244)/12 -> -7.3325000000000015e-02 | BF244: =(AK244+AL244+AM244+AN244+AO244+AP244+AQ244+AR244+AS244+AT244+AU244+AV244+AV244+AW244+AX244+AY244+AZ244+BA244+BB244+BC244)/19 -> -3.4284210526315785e-02 | BG244: =(AV244+AW244)/2 -> -0.13220000000000001 | BH244: =(AW244+AX244)/2 -> -0.21765000000000001 | BI244: =(AX244+AY244)/2 -> -0.20235 | BJ244: =(AY244+AZ244)/2 -> -0.15100000000000002 | BK244: =(AZ244+BA244)/2 -> -3.1250000000000007e-02 | BL244: =(BA244+BB244)/2 -> 0.10605000000000001 | BM244: =(BB244+BC244)/2 -> 6.2149999999999997e-02 | BN244: =STDEV(AK244:BC244) -> 0.1298463209953343
B245: 601997.SH | C245: 贵阳银行
B246: 603938.SH | C246: 三孚股份 | G246: 0.52380000000000004 | H246: 0.55559999999999998 | I246: 0.5625 | J246: 0.51390000000000002 | K246: -9.3800000000000008e-02 | L246: -0.125 | M246: -0.22670000000000001 | N246: -0.31190000000000001 | O246: -0.3448 | P246: -0.16329999999999997 | Q246: 0 | R246: -4.0000000000000001e-02 | S246: -0.57889999999999997 | T246: -0.53659999999999997 | U246: -0.4138 | V246: -9.7200000000000009e-02 | W246: 3.375 | X246: 3 | Y246: 2.7058999999999997 | AA246: =(N246+O246+P246+Q246+R246+S246+T246+U246+V246+W246+X246+Y246)/12 -> 0.54953333333333332 | AB246: =(G246+H246+I246+J246+K246+L246+M246+N246+O246+P246+Q246+R246+S246+T246+U246+V246+W246+X246+Y246)/19 -> 0.43708947368421053 | AC246: =(R246+S246)/2 -> -0.30945 | AD246: =(S246+T246)/2 -> -0.55774999999999997 | AE246: =(T246+U246)/2 -> -0.47519999999999996 | AF246: =(U246+V246)/2 -> -0.2555 | AG246: =(V246+W246)/2 -> 1.6389 | AH246: =(W246+X246)/2 -> 3.1875 | AI246: =(X246+Y246)/2 -> 2.8529499999999999 | AJ246: =STDEV(G246:Y246) -> 1.2103758607670121
B247: 605288.SH | C247: 凯迪股份
B248: 600328.SH | C248: 中盐化工 | G248: 6.1666999999999996 | H248: 1.732 | I248: 2.1593999999999998 | J248: 1.4896 | K248: 0.34110000000000001 | L248: 0.77359999999999995 | M248: 0.2913 | N248: 1.1688000000000001 | O248: 0.74159999999999993 | P248: 0.2487 | Q248: 0.70050000000000001 | R248: 2.7400000000000001e-02 | S248: -0.75639999999999996 | T248: -0.80779999999999996 | U248: -0.70599999999999996 | V248: -0.43590000000000001 | W248: 2.6294 | X248: 6.1196999999999999 | Y248: 3.4718 | AA248: =(N248+O248+P248+Q248+R248+S248+T248+U248+V248+W248+X248+Y248)/12 -> 1.0334833333333333 | AB248: =(G248+H248+I248+J248+K248+L248+M248+N248+O248+P248+Q248+R248+S248+T248+U248+V248+W248+X248+Y248)/19 -> 1.3345 | AC248: =(R248+S248)/2 -> -0.36449999999999999 | AD248: =(S248+T248)/2 -> -0.78210000000000002 | AE248: =(T248+U248)/2 -> -0.75689999999999991 | AF248: =(U248+V248)/2 -> -0.57094999999999996 | AG248: =(V248+W248)/2 -> 1.0967499999999999 | AH248: =(W248+X248)/2 -> 4.3745500000000002 | AI248: =(X248+Y248)/2 -> 4.79575 | AJ248: =STDEV(G248:Y248) -> 2.0503798769984058 | AK248: 0.161 | AL248: 0.1643 | AM248: 0.27129999999999999 | AN248: 0.21590000000000001 | AO248: 0.18090000000000001 | AP248: 0.1893 | AQ248: 0.35729999999999995 | AR248: 1.4693000000000001 | AS248: 2.1644000000000001 | AT248: 1.6069 | AU248: 1.1609 | AV248: 0.14429999999999998 | AW248: -0.1222 | AX248: -0.1137 | AY248: -8.48e-02 | AZ248: 3.8199999999999998e-02 | BA248: -3.2300000000000002e-02 | BB248: 0.36820000000000003 | BC248: 0.81819999999999993 | BE248: =(AR248+AS248+AT248+AU248+AV248+AW248+AX248+AY248+AZ248+BA248+BB248+BC248)/12 -> 0.61811666666666665 | BF248: =(AK248+AL248+AM248+AN248+AO248+AP248+AQ248+AR248+AS248+AT248+AU248+AV248+AV248+AW248+AX248+AY248+AZ248+BA248+BB248+BC248)/19 -> 0.47903684210526304 | BG248: =(AV248+AW248)/2 -> 1.104999999999999e-02 | BH248: =(AW248+AX248)/2 -> -0.11795 | BI248: =(AX248+AY248)/2 -> -9.9250000000000005e-02 | BJ248: =(AY248+AZ248)/2 -> -2.3300000000000001e-02 | BK248: =(AZ248+BA248)/2 -> 2.9499999999999978e-03 | BL248: =(BA248+BB248)/2 -> 0.16795000000000002 | BM248: =(BB248+BC248)/2 -> 0.59319999999999995 | BN248: =STDEV(AK248:BC248) -> 0.65756894046327052
B249: 000877.SZ | C249: 天山股份
B250: 001217.SZ | C250: 华尔泰 | X250: 2.0417000000000001 | Y250: 2.2894999999999999 | AA250: =(N250+O250+P250+Q250+R250+S250+T250+U250+V250+W250+X250+Y250)/12 -> 0.36093333333333333 | AB250: =(G250+H250+I250+J250+K250+L250+M250+N250+O250+P250+Q250+R250+S250+T250+U250+V250+W250+X250+Y250)/19 -> 0.22795789473684211 | AC250: =(R250+S250)/2 -> 0 | AD250: =(S250+T250)/2 -> 0 | AE250: =(T250+U250)/2 -> 0 | AF250: =(U250+V250)/2 -> 0 | AG250: =(V250+W250)/2 -> 0 | AH250: =(W250+X250)/2 -> 1.02085 | AI250: =(X250+Y250)/2 -> 2.1656 | AJ250: =STDEV(G250:Y250) -> 0.17522106037802634 | BB250: 0.44400000000000001 | BC250: 0.75170000000000003 | BE250: =(AR250+AS250+AT250+AU250+AV250+AW250+AX250+AY250+AZ250+BA250+BB250+BC250)/12 -> 9.964166666666667e-02 | BF250: =(AK250+AL250+AM250+AN250+AO250+AP250+AQ250+AR250+AS250+AT250+AU250+AV250+AV250+AW250+AX250+AY250+AZ250+BA250+BB250+BC250)/19 -> 6.2931578947368422e-02 | BG250: =(AV250+AW250)/2 -> 0 | BH250: =(AW250+AX250)/2 -> 0 | BI250: =(AX250+AY250)/2 -> 0 | BJ250: =(AY250+AZ250)/2 -> 0 | BK250: =(AZ250+BA250)/2 -> 0 | BL250: =(BA250+BB250)/2 -> 0.222 | BM250: =(BB250+BC250)/2 -> 0.59784999999999999 | BN250: =STDEV(AK250:BC250) -> 0.2175767565711007
B251: 002977.SZ | C251: 天箭科技
B252: 600298.SH | C252: 安琪酵母
B253: 600668.SH | C253: 尖峰集团 | G253: 3.3994999999999997 | H253: 1.321 | I253: 0.7248 | J253: 0.22170000000000001 | K253: -7.980000000000001e-02 | L253: 0.25519999999999998 | M253: 0.67530000000000001 | N253: 0.68870000000000009 | O253: 0.1333 | P253: 0.57550000000000001 | Q253: 0.25890000000000002 | R253: 0.23139999999999999 | S253: 4.8499999999999995e-02 | T253: -0.2261 | U253: -0.16020000000000001 | V253: -0.1928 | W253: -0.2707 | X253: -0.1308 | Y253: -0.17999999999999999 | AA253: =(N253+O253+P253+Q253+R253+S253+T253+U253+V253+W253+X253+Y253)/12 -> 6.4641666666666694e-02 | AB253: =(G253+H253+I253+J253+K253+L253+M253+N253+O253+P253+Q253+R253+S253+T253+U253+V253+W253+X253+Y253)/19 -> 0.38386315789473696 | AC253: =(R253+S253)/2 -> 0.13994999999999999 | AD253: =(S253+T253)/2 -> -8.8800000000000004e-02 | AE253: =(T253+U253)/2 -> -0.19314999999999999 | AF253: =(U253+V253)/2 -> -0.17649999999999999 | AG253: =(V253+W253)/2 -> -0.23175000000000001 | AH253: =(W253+X253)/2 -> -0.20074999999999998 | AI253: =(X253+Y253)/2 -> -0.15539999999999998 | AJ253: =STDEV(G253:Y253) -> 0.84284350940434316
B254: 600123.SH | C254: 兰花科创
B255: 600584.SH | C255: 长电科技
B256: 601688.SH | C256: 华泰证券 | F256: 1.23 | U256: 0.30670000000000003 | V256: 0.15380000000000002 | W256: 0.15620000000000001 | X256: 0.21129999999999999 | Y256: 0.25509999999999999 | AA256: =(N256+O256+P256+Q256+R256+S256+T256+U256+V256+W256+X256+Y256)/12 -> 9.0258333333333329e-02 | AB256: =(G256+H256+I256+J256+K256+L256+M256+N256+O256+P256+Q256+R256+S256+T256+U256+V256+W256+X256+Y256)/19 -> 5.7005263157894732e-02 | AC256: =(R256+S256)/2 -> 0 | AD256: =(S256+T256)/2 -> 0 | AE256: =(T256+U256)/2 -> 0.15335000000000001 | AF256: =(U256+V256)/2 -> 0.23025000000000001 | AG256: =(V256+W256)/2 -> 0.15500000000000003 | AH256: =(W256+X256)/2 -> 0.18375 | AI256: =(X256+Y256)/2 -> 0.23319999999999999 | AJ256: =STDEV(G256:Y256) -> 6.5613161789384908e-02 | AK256: 0.18210000000000001 | AL256: 0.43990000000000001 | AM256: 3.4700000000000002e-02 | AN256: 4.53e-02 | AO256: -9.4999999999999998e-03 | AP256: -9.6199999999999994e-02 | AQ256: -0.16320000000000001 | AR256: -1.03e-02 | AS256: -8.3499999999999991e-02 | AT256: 0.1578 | AU256: 0.27179999999999999 | AV256: 7.7899999999999997e-02 | AW256: 0.3196 | AX256: 0.62439999999999996 | AY256: 0.20370000000000002 | AZ256: 0.58379999999999999 | BA256: 5.4199999999999998e-02 | BB256: 0.2366 | BC256: 0.33210000000000001 | BE256: =(AR256+AS256+AT256+AU256+AV256+AW256+AX256+AY256+AZ256+BA256+BB256+BC256)/12 -> 0.23067499999999999 | BF256: =(AK256+AL256+AM256+AN256+AO256+AP256+AQ256+AR256+AS256+AT256+AU256+AV256+AV256+AW256+AX256+AY256+AZ256+BA256+BB256+BC256)/19 -> 0.17258421052631578 | BG256: =(AV256+AW256)/2 -> 0.19874999999999998 | BH256: =(AW256+AX256)/2 -> 0.47199999999999998 | BI256: =(AX256+AY256)/2 -> 0.41404999999999997 | BJ256: =(AY256+AZ256)/2 -> 0.39374999999999999 | BK256: =(AZ256+BA256)/2 -> 0.31900000000000001 | BL256: =(BA256+BB256)/2 -> 0.1454 | BM256: =(BB256+BC256)/2 -> 0.28434999999999999 | BN256: =STDEV(AK256:BC256) -> 0.22136219255418857
B257: 600720.SH | C257: 祁连山
B258: 002287.SZ | C258: 奇正藏药
B259: 600739.SH | C259: 辽宁成大
B260: 603095.SH | C260: 越剑智能
B261: 603259.SH | C261: 药明康德 | J261: 0.21299999999999999 | K261: -0.1389 | L261: 0.1772 | M261: 0.23010000000000003 | N261: 0.2137 | O261: -0.22579999999999997 | P261: -0.50539999999999996 | Q261: -0.44600000000000001 | R261: -0.49060000000000004 | S261: -0.45829999999999999 | T261: 0.36959999999999998 | U261: 0.11689999999999999 | V261: 0.56789999999999996 | W261: 3.7692000000000001 | X261: 0.46029999999999999 | Y261: 0.41859999999999997 | AA261: =(N261+O261+P261+Q261+R261+S261+T261+U261+V261+W261+X261+Y261)/12 -> 0.31584166666666669 | AB261: =(G261+H261+I261+J261+K261+L261+M261+N261+O261+P261+Q261+R261+S261+T261+U261+V261+W261+X261+Y261)/19 -> 0.22481578947368425 | AC261: =(R261+S261)/2 -> -0.47445000000000004 | AD261: =(S261+T261)/2 -> -4.4350000000000001e-02 | AE261: =(T261+U261)/2 -> 0.24324999999999999 | AF261: =(U261+V261)/2 -> 0.34239999999999998 | AG261: =(V261+W261)/2 -> 2.1685500000000002 | AH261: =(W261+X261)/2 -> 2.1147499999999999 | AI261: =(X261+Y261)/2 -> 0.43945000000000001 | AJ261: =STDEV(G261:Y261) -> 1.0025676254622429
B262: 603658.SH | C262: 安图生物
B263: 603899.SH | C263: 晨光文具
B264: 000401.SZ | C264: 冀东水泥
B265: 000932.SZ | C265: 华菱钢铁
B266: 601009.SH | C266: 南京银行 | G266: -0.1714 | H266: 0.17649999999999999 | I266: 0.17329999999999998 | J266: 0.1474 | K266: 0.1724 | L266: 0.16670000000000001 | M266: 0.1477 | N266: 0.156 | O266: 0.14710000000000001 | P266: 0.15710000000000002 | Q266: 0.15839999999999999 | R266: 0.127 | S266: 0.12820000000000001 | T266: -1.23e-02 | U266: -9.4e-02 | V266: -5.6299999999999996e-02 | W266: -6.8199999999999997e-02 | X266: 5.0000000000000003e-02 | Y266: 0.14150000000000001 | AA266: =(N266+O266+P266+Q266+R266+S266+T266+U266+V266+W266+X266+Y266)/12 -> 6.9541666666666668e-02 | AB266: =(G266+H266+I266+J266+K266+L266+M266+N266+O266+P266+Q266+R266+S266+T266+U266+V266+W266+X266+Y266)/19 -> 8.6689473684210525e-02 | AC266: =(R266+S266)/2 -> 0.12759999999999999 | AD266: =(S266+T266)/2 -> 5.7950000000000002e-02 | AE266: =(T266+U266)/2 -> -5.3150000000000003e-02 | AF266: =(U266+V266)/2 -> -7.5149999999999995e-02 | AG266: =(V266+W266)/2 -> -6.225e-02 | AH266: =(W266+X266)/2 -> -9.099999999999997e-03 | AI266: =(X266+Y266)/2 -> 9.5750000000000002e-02 | AJ266: =STDEV(G266:Y266) -> 0.109663540455628
B267: 002959.SZ | C267: 小熊电器
B268: 000708.SZ | C268: 中信特钢
B269: 002353.SZ | C269: 杰瑞股份 | E269: 0.35609999999999997 | F269: 1.2 | G269: -0.66670000000000007 | H269: -0.72730000000000006 | I269: -0.54339999999999999 | J269: -0.46149999999999997 | K269: 1 | L269: 5.3333000000000004 | M269: 6.5999999999999996 | N269: 8.1428999999999991 | O269: 2 | P269: 1.7368000000000001 | Q269: 1.5 | R269: 1.2187000000000001 | S269: 0.91670000000000007 | T269: 0.3846 | U269: 0.2316 | V269: 0.2465 | W269: 0.26090000000000002 | X269: 0.11109999999999999 | Y269: 2.5600000000000001e-02 | AA269: =(N269+O269+P269+Q269+R269+S269+T269+U269+V269+W269+X269+Y269)/12 -> 1.39795 | AB269: =(G269+H269+I269+J269+K269+L269+M269+N269+O269+P269+Q269+R269+S269+T269+U269+V269+W269+X269+Y269)/19 -> 1.4373578947368419 | AC269: =(R269+S269)/2 -> 1.0677000000000001 | AD269: =(S269+T269)/2 -> 0.65065000000000006 | AE269: =(T269+U269)/2 -> 0.30809999999999998 | AF269: =(U269+V269)/2 -> 0.23904999999999998 | AG269: =(V269+W269)/2 -> 0.25370000000000004 | AH269: =(W269+X269)/2 -> 0.186 | AI269: =(X269+Y269)/2 -> 6.8349999999999994e-02 | AJ269: =STDEV(G269:Y269) -> 2.5108000144521863
B270: 601963.SH | C270: 重庆银行
B271: 603197.SH | C271: 保隆科技 | E271: 0.5373 | F271: 1.0780000000000001 | G271: 0.30620000000000003 | H271: -7.4800000000000005e-02 | I271: -0.14069999999999999 | J271: -0.21440000000000001 | K271: -0.18230000000000002 | L271: -0.28460000000000002 | M271: -0.2722 | N271: -0.20610000000000001 | O271: -0.49420000000000003 | P271: -0.34329999999999999 | Q271: -1.54e-02 | R271: 0.11699999999999999 | S271: 3.3799999999999997e-02 | T271: 0.17269999999999999 | U271: 0.17199999999999999 | V271: 6.6699999999999995e-02 | W271: 1.0909 | X271: 0.72499999999999998 | Y271: 0.39529999999999998 | AA271: =(N271+O271+P271+Q271+R271+S271+T271+U271+V271+W271+X271+Y271)/12 -> 0.14286666666666664 | AB271: =(G271+H271+I271+J271+K271+L271+M271+N271+O271+P271+Q271+R271+S271+T271+U271+V271+W271+X271+Y271)/19 -> 4.4821052631578949e-02 | AC271: =(R271+S271)/2 -> 7.5399999999999995e-02 | AD271: =(S271+T271)/2 -> 0.10324999999999999 | AE271: =(T271+U271)/2 -> 0.17235 | AF271: =(U271+V271)/2 -> 0.11934999999999998 | AG271: =(V271+W271)/2 -> 0.57879999999999998 | AH271: =(W271+X271)/2 -> 0.90795000000000003 | AI271: =(X271+Y271)/2 -> 0.56014999999999993 | AJ271: =STDEV(G271:Y271) -> 0.38519211884597615
B272: 603198.SH | C272: 迎驾贡酒 | E272: 0.2676 | F272: 1.2 | G272: 0.125 | H272: 0 | I272: -0.1017 | J272: -2.35e-02 | K272: 0.1389 | L272: 0.17069999999999999 | M272: 0.16980000000000001 | N272: 0.16869999999999999 | O272: 7.3200000000000001e-02 | P272: 0.16669999999999999 | Q272: 0.2097 | R272: 0.19589999999999999 | S272: -0.34089999999999998 | T272: -0.25 | U272: -0.12 | V272: 2.5899999999999999e-02 | W272: 0.58620000000000005 | X272: 0.76190000000000002 | Y272: 0.81820000000000004 | AA272: =(N272+O272+P272+Q272+R272+S272+T272+U272+V272+W272+X272+Y272)/12 -> 0.19129166666666667 | AB272: =(G272+H272+I272+J272+K272+L272+M272+N272+O272+P272+Q272+R272+S272+T272+U272+V272+W272+X272+Y272)/19 -> 0.14603684210526316 | AC272: =(R272+S272)/2 -> -7.2499999999999995e-02 | AD272: =(S272+T272)/2 -> -0.29544999999999999 | AE272: =(T272+U272)/2 -> -0.185 | AF272: =(U272+V272)/2 -> -4.7049999999999995e-02 | AG272: =(V272+W272)/2 -> 0.30605000000000004 | AH272: =(W272+X272)/2 -> 0.67405000000000004 | AI272: =(X272+Y272)/2 -> 0.79005000000000003 | AJ272: =STDEV(G272:Y272) -> 0.30091435512917464 | AK272: 2.8500000000000001e-02 | AL272: 2.8000000000000004e-03 | AM272: 3.2400000000000005e-02 | AN272: 3.5000000000000003e-02 | AO272: 0.18059999999999998 | AP272: 0.15720000000000001 | AQ272: 0.13159999999999999 | AR272: 0.153 | AS272: -2.2200000000000001e-02 | AT272: 2.6699999999999998e-02 | AU272: 2.69e-02 | AV272: 6.7000000000000004e-02 | AW272: -0.4955 | AX272: -0.31319999999999998 | AY272: -0.15279999999999999 | AZ272: -0.1331 | BA272: 1.3196000000000001 | BB272: 0.81469999999999998 | BC272: 0.55659999999999998 | BE272: =(AR272+AS272+AT272+AU272+AV272+AW272+AX272+AY272+AZ272+BA272+BB272+BC272)/12 -> 0.153975 | BF272: =(AK272+AL272+AM272+AN272+AO272+AP272+AQ272+AR272+AS272+AT272+AU272+AV272+AV272+AW272+AX272+AY272+AZ272+BA272+BB272+BC272)/19 -> 0.13067368421052633 | BG272: =(AV272+AW272)/2 -> -0.21425 | BH272: =(AW272+AX272)/2 -> -0.40434999999999999 | BI272: =(AX272+AY272)/2 -> -0.23299999999999998 | BJ272: =(AY272+AZ272)/2 -> -0.14294999999999999 | BK272: =(AZ272+BA272)/2 -> 0.59325000000000006 | BL272: =(BA272+BB272)/2 -> 1.06715 | BM272: =(BB272+BC272)/2 -> 0.68564999999999998 | BN272: =STDEV(AK272:BC272) -> 0.40138427745383165 | BS272: 8 | BT272: 8 | CB272: 60 | CC272: 先减少然后再变多(由131家减少到23家，再减少到60家) | CD272: 先变多再变少（由82.25%减少到83.08%，再减少到1.87%） | CI272: 9.6199999999999992 | CJ272: =CI272/BS272 -> 1.2024999999999999 | CK272: 适量进入(利润增长和销售额增长目前仍比较强劲，但销售额处于持续下滑的趋势；而且虽然持有机构数量在增加，但机构持有份额大幅减少，目前来看不宜长期持有) | CL272: 44608
B273: 000825.SZ | C273: 太钢不锈
B274: 600623.SH | C274: 华谊集团
B275: 603258.SH | C275: 电魂网络
B276: 603877.SH | C276: 太平鸟 | G276: -0.20000000000000001 | H276: -0.4118 | I276: -0.38600000000000001 | J276: -6.8600000000000008e-02 | K276: 1.3333000000000002 | L276: 1.1000000000000001 | M276: 0.68569999999999998 | N276: 0.26319999999999999 | O276: -0.35710000000000003 | P276: -0.33329999999999999 | Q276: -0.25420000000000004 | R276: -2.5000000000000001e-02 | S276: -0.88890000000000002 | T276: -7.1399999999999991e-02 | U276: 0.5 | V276: 0.29059999999999997 | W276: 20.5 | X276: 2.3462000000000001 | Y276: 0.78790000000000004 | AA276: =(N276+O276+P276+Q276+R276+S276+T276+U276+V276+W276+X276+Y276)/12 -> 1.8964999999999999 | AB276: =(G276+H276+I276+J276+K276+L276+M276+N276+O276+P276+Q276+R276+S276+T276+U276+V276+W276+X276+Y276)/19 -> 1.305821052631579 | AC276: =(R276+S276)/2 -> -0.45695000000000002 | AD276: =(S276+T276)/2 -> -0.48015000000000002 | AE276: =(T276+U276)/2 -> 0.21429999999999999 | AF276: =(U276+V276)/2 -> 0.39529999999999998 | AG276: =(V276+W276)/2 -> 10.395300000000001 | AH276: =(W276+X276)/2 -> 11.4231 | AI276: =(X276+Y276)/2 -> 1.5670500000000001 | AJ276: =STDEV(G276:Y276) -> 4.7099257326745549
B277: 605588.SH | C277: 冠石科技 | V277: -0.1217 | W277: 0.20000000000000001 | X277: 0.29999999999999999 | Y277: 4.4199999999999996e-02 | AA277: =(N277+O277+P277+Q277+R277+S277+T277+U277+V277+W277+X277+Y277)/12 -> 3.5208333333333335e-02 | AB277: =(G277+H277+I277+J277+K277+L277+M277+N277+O277+P277+Q277+R277+S277+T277+U277+V277+W277+X277+Y277)/19 -> 2.2236842105263156e-02 | AC277: =(R277+S277)/2 -> 0 | AD277: =(S277+T277)/2 -> 0 | AE277: =(T277+U277)/2 -> 0 | AF277: =(U277+V277)/2 -> -6.0850000000000001e-02 | AG277: =(V277+W277)/2 -> 3.9150000000000004e-02 | AH277: =(W277+X277)/2 -> 0.25 | AI277: =(X277+Y277)/2 -> 0.1721 | AJ277: =STDEV(G277:Y277) -> 0.18451555264168565
B278: 002415.SZ | C278: 海康威视 | G278: -0.1421 | H278: 0.23530000000000001 | I278: 0.24719999999999998 | J278: 0.25920000000000004 | K278: 0.22089999999999999 | L278: 0.25769999999999998 | M278: 0.20120000000000002 | N278: 0.2039 | O278: -0.15579999999999999 | P278: -1.11e-02 | Q278: 6.7000000000000004e-02 | R278: 8.3100000000000007e-02 | S278: -2.98e-02 | T278: 0.1104 | U278: 5.7000000000000002e-02 | V278: 7.5899999999999995e-02 | W278: 0.44170000000000004 | X278: 0.40970000000000001 | Y278: 0.29699999999999999 | AA278: =(N278+O278+P278+Q278+R278+S278+T278+U278+V278+W278+X278+Y278)/12 -> 0.12908333333333333 | AB278: =(G278+H278+I278+J278+K278+L278+M278+N278+O278+P278+Q278+R278+S278+T278+U278+V278+W278+X278+Y278)/19 -> 0.14886315789473686 | AC278: =(R278+S278)/2 -> 2.6650000000000004e-02 | AD278: =(S278+T278)/2 -> 4.0300000000000002e-02 | AE278: =(T278+U278)/2 -> 8.3699999999999997e-02 | AF278: =(U278+V278)/2 -> 6.6449999999999995e-02 | AG278: =(V278+W278)/2 -> 0.25880000000000003 | AH278: =(W278+X278)/2 -> 0.42570000000000002 | AI278: =(X278+Y278)/2 -> 0.35335 | AJ278: =STDEV(G278:Y278) -> 0.16484144304460951
B279: 000885.SZ | C279: 城发环境
B280: 002557.SZ | C280: 洽洽食品 | E280: 0.38290000000000002 | F280: 1.8340000000000001 | G280: -0.16670000000000001 | H280: -0.14080000000000001 | I280: -0.13220000000000001 | J280: -0.10000000000000001 | K280: 0.1027 | L280: 0.157 | M280: 0.28110000000000002 | N280: 0.35560000000000003 | O280: 0.35729999999999995 | P280: 0.28320000000000001 | Q280: 0.32329999999999998 | R280: 0.4239 | S280: 0.31180000000000002 | T280: 0.34279999999999999 | U280: 0.3271 | V280: 0.31329999999999997 | W280: 0.32770000000000005 | X280: 0.10800000000000001 | Y280: 0.12179999999999999 | AA280: =(N280+O280+P280+Q280+R280+S280+T280+U280+V280+W280+X280+Y280)/12 -> 0.29965000000000003 | AB280: =(G280+H280+I280+J280+K280+L280+M280+N280+O280+P280+Q280+R280+S280+T280+U280+V280+W280+X280+Y280)/19 -> 0.18931052631578948 | AC280: =(R280+S280)/2 -> 0.36785000000000001 | AD280: =(S280+T280)/2 -> 0.32730000000000004 | AE280: =(T280+U280)/2 -> 0.33494999999999997 | AF280: =(U280+V280)/2 -> 0.32019999999999998 | AG280: =(V280+W280)/2 -> 0.32050000000000001 | AH280: =(W280+X280)/2 -> 0.21785000000000004 | AI280: =(X280+Y280)/2 -> 0.1149 | AJ280: =STDEV(G280:Y280) -> 0.19446118405806118
B281: 601229.SH | C281: 上海银行
B282: 603203.SH | C282: 快克股份 | E282: 0.19760000000000003 | F282: 1.155 | G282: 3.5699999999999996e-02 | H282: -0.23440000000000003 | I282: -0.22 | J282: -0.24660000000000001 | K282: -0.1724 | L282: -6.1200000000000004e-02 | M282: -7.690000000000001e-02 | N282: -8.1799999999999998e-02 | O282: -8.3299999999999999e-02 | P282: 8.6999999999999994e-02 | Q282: 0.11109999999999999 | R282: 9.9000000000000005e-02 | S282: 0 | T282: 5.9999999999999998e-02 | U282: 3.7499999999999999e-02 | V282: 1.8000000000000002e-02 | W282: 0.81819999999999993 | X282: 0.41509999999999997 | Y282: 0.40960000000000002 | AA282: =(N282+O282+P282+Q282+R282+S282+T282+U282+V282+W282+X282+Y282)/12 -> 0.15753333333333333 | AB282: =(G282+H282+I282+J282+K282+L282+M282+N282+O282+P282+Q282+R282+S282+T282+U282+V282+W282+X282+Y282)/19 -> 4.8136842105263151e-02 | AC282: =(R282+S282)/2 -> 4.9500000000000002e-02 | AD282: =(S282+T282)/2 -> 2.9999999999999999e-02 | AE282: =(T282+U282)/2 -> 4.8750000000000002e-02 | AF282: =(U282+V282)/2 -> 2.775e-02 | AG282: =(V282+W282)/2 -> 0.41809999999999997 | AH282: =(W282+X282)/2 -> 0.61664999999999992 | AI282: =(X282+Y282)/2 -> 0.41234999999999999 | AJ282: =STDEV(G282:Y282) -> 0.26023379063732993
B283: 603587.SH | C283: 地素时尚
B284: 603681.SH | C284: 永冠新材 | E284: 0.47710000000000002 | F284: 1.1699999999999999 | N284: 0.61539999999999995 | O284: 0.16670000000000001 | P284: 0 | Q284: -0.16670000000000001 | R284: -9.5199999999999993e-02 | S284: -0.47619999999999996 | T284: -0.16329999999999997 | U284: 0.1857 | V284: 0.10529999999999999 | W284: 2.2726999999999999 | X284: 0.92680000000000007 | Y284: 0.40960000000000002 | AA284: =(N284+O284+P284+Q284+R284+S284+T284+U284+V284+W284+X284+Y284)/12 -> 0.31506666666666666 | AB284: =(G284+H284+I284+J284+K284+L284+M284+N284+O284+P284+Q284+R284+S284+T284+U284+V284+W284+X284+Y284)/19 -> 0.19898947368421052 | AC284: =(R284+S284)/2 -> -0.28569999999999995 | AD284: =(S284+T284)/2 -> -0.31974999999999998 | AE284: =(T284+U284)/2 -> 1.1200000000000015e-02 | AF284: =(U284+V284)/2 -> 0.14549999999999999 | AG284: =(V284+W284)/2 -> 1.1890000000000001 | AH284: =(W284+X284)/2 -> 1.59975 | AI284: =(X284+Y284)/2 -> 0.66820000000000002 | AJ284: =STDEV(G284:Y284) -> 0.72256207828095775
B285: 605077.SH | C285: 华康股份
B286: 002258.SZ | C286: 利尔化学 | E286: 0.40189999999999998 | F286: 2.036 | P286: -0.3881 | Q286: -0.44020000000000004 | R286: -0.46149999999999997 | S286: 0.15380000000000002 | T286: 0.60119999999999996 | U286: 0.77790000000000004 | V286: 0.96750000000000003 | W286: 1.6477999999999999 | X286: 0.97699999999999998 | Y286: 0.46659999999999996 | AA286: =(N286+O286+P286+Q286+R286+S286+T286+U286+V286+W286+X286+Y286)/12 -> 0.35849999999999999 | AB286: =(G286+H286+I286+J286+K286+L286+M286+N286+O286+P286+Q286+R286+S286+T286+U286+V286+W286+X286+Y286)/19 -> 0.22642105263157894 | AC286: =(R286+S286)/2 -> -0.15384999999999999 | AD286: =(S286+T286)/2 -> 0.3775 | AE286: =(T286+U286)/2 -> 0.68955 | AF286: =(U286+V286)/2 -> 0.87270000000000003 | AG286: =(V286+W286)/2 -> 1.30765 | AH286: =(W286+X286)/2 -> 1.3124 | AI286: =(X286+Y286)/2 -> 0.7218 | AJ286: =STDEV(G286:Y286) -> 0.70871005198019998
B287: 002929.SZ | C287: 润建股份 | E287: 0.58479999999999999 | F287: 1.121 | J287: 0.31819999999999998 | K287: 0.26319999999999999 | L287: -0.16719999999999999 | M287: -0.2404 | N287: -0.33100000000000002 | O287: -8.3299999999999999e-02 | P287: -0.21850000000000003 | Q287: -1.52e-02 | R287: 7.22e-02 | S287: -0.18179999999999999 | T287: 2.7699999999999999e-02 | U287: -3.5999999999999999e-03 | V287: 3.85e-02 | W287: 0.72219999999999995 | X287: 0.83579999999999999 | Y287: 0.7659999999999999 | AA287: =(N287+O287+P287+Q287+R287+S287+T287+U287+V287+W287+X287+Y287)/12 -> 0.13574999999999998 | AB287: =(G287+H287+I287+J287+K287+L287+M287+N287+O287+P287+Q287+R287+S287+T287+U287+V287+W287+X287+Y287)/19 -> 9.4884210526315765e-02 | AC287: =(R287+S287)/2 -> -5.4799999999999995e-02 | AD287: =(S287+T287)/2 -> -7.7049999999999993e-02 | AE287: =(T287+U287)/2 -> 1.205e-02 | AF287: =(U287+V287)/2 -> 1.745e-02 | AG287: =(V287+W287)/2 -> 0.38034999999999997 | AH287: =(W287+X287)/2 -> 0.77899999999999991 | AI287: =(X287+Y287)/2 -> 0.80089999999999995 | AJ287: =STDEV(G287:Y287) -> 0.37103757491661138 | AN287: 0.215 | AO287: 0.81530000000000002 | AP287: 0.53549999999999998 | AQ287: 0.54100000000000004 | AR287: 0.38729999999999998 | AS287: 8.9700000000000002e-02 | AT287: -1.9400000000000001e-02 | AU287: -1.54e-02 | AV287: 0.11960000000000001 | AW287: 2.4e-02 | AX287: 0.36890000000000001 | AY287: 0.29620000000000002 | AZ287: 0.19 | BA287: 0.46829999999999999 | BB287: 0.33509999999999995 | BC287: 0.28620000000000001 | BE287: =(AR287+AS287+AT287+AU287+AV287+AW287+AX287+AY287+AZ287+BA287+BB287+BC287)/12 -> 0.21087500000000001 | BF287: =(AK287+AL287+AM287+AN287+AO287+AP287+AQ287+AR287+AS287+AT287+AU287+AV287+AV287+AW287+AX287+AY287+AZ287+BA287+BB287+BC287)/19 -> 0.25036315789473679 | BG287: =(AV287+AW287)/2 -> 7.1800000000000003e-02 | BH287: =(AW287+AX287)/2 -> 0.19645000000000001 | BI287: =(AX287+AY287)/2 -> 0.33255000000000001 | BJ287: =(AY287+AZ287)/2 -> 0.24310000000000001 | BK287: =(AZ287+BA287)/2 -> 0.32915 | BL287: =(BA287+BB287)/2 -> 0.40169999999999995 | BM287: =(BB287+BC287)/2 -> 0.31064999999999998 | BN287: =STDEV(AK287:BC287) -> 0.22997332227528769
B288: 002028.SZ | C288: 思源电气 | E288: 0.37020000000000003 | F288: 1.5800000000000001 | G288: -0.75 | H288: 0 | I288: -0.25 | J288: -0.32650000000000001 | K288: -1.5 | L288: -5.2600000000000001e-02 | M288: 0.33329999999999999 | N288: 0.18179999999999999 | O288: 4 | P288: 0.38890000000000002 | Q288: 0.6875 | R288: 0.87180000000000002 | S288: 3 | T288: 1.4399999999999999 | U288: 1.0185 | V288: 0.68489999999999995 | W288: 2.0832999999999999 | X288: 0.22949999999999998 | Y288: 6.4199999999999993e-02 | AA288: =(N288+O288+P288+Q288+R288+S288+T288+U288+V288+W288+X288+Y288)/12 -> 1.2208666666666665 | AB288: =(G288+H288+I288+J288+K288+L288+M288+N288+O288+P288+Q288+R288+S288+T288+U288+V288+W288+X288+Y288)/19 -> 0.6370842105263157 | AC288: =(R288+S288)/2 -> 1.9359 | AD288: =(S288+T288)/2 -> 2.2199999999999998 | AE288: =(T288+U288)/2 -> 1.22925 | AF288: =(U288+V288)/2 -> 0.8516999999999999 | AG288: =(V288+W288)/2 -> 1.3840999999999999 | AH288: =(W288+X288)/2 -> 1.1563999999999999 | AI288: =(X288+Y288)/2 -> 0.14684999999999998 | AJ288: =STDEV(G288:Y288) -> 1.2862036158414067
B289: 003017.SZ | C289: 大洋生物
B290: 603858.SH | C290: 步长制药
B291: 002605.SZ | C291: 姚记科技 | E291: 0.3957 | F291: 1.137 | G291: -0.14499999999999999 | H291: -0.30530000000000002 | I291: -0.30719999999999997 | J291: -0.25040000000000001 | K291: -0.43640000000000001 | L291: 0.2447 | M291: 0.49770000000000003 | N291: 0.7854000000000001 | O291: 2.9414999999999996 | P291: 2.3538999999999999 | Q291: 2.5943000000000001 | R291: 1.5166999999999999 | S291: 10.7498 | T291: 4.3689999999999998 | U291: 2.5638000000000001 | V291: 2.1587999999999998 | W291: -0.70169999999999999 | X291: -0.54479999999999995 | Y291: -0.53590000000000004 | AA291: =(N291+O291+P291+Q291+R291+S291+T291+U291+V291+W291+X291+Y291)/12 -> 2.3542333333333336 | AB291: =(G291+H291+I291+J291+K291+L291+M291+N291+O291+P291+Q291+R291+S291+T291+U291+V291+W291+X291+Y291)/19 -> 1.4499421052631578 | AC291: =(R291+S291)/2 -> 6.1332500000000003 | AD291: =(S291+T291)/2 -> 7.5594000000000001 | AE291: =(T291+U291)/2 -> 3.4664000000000001 | AF291: =(U291+V291)/2 -> 2.3613 | AG291: =(V291+W291)/2 -> 0.72854999999999992 | AH291: =(W291+X291)/2 -> -0.62324999999999997 | AI291: =(X291+Y291)/2 -> -0.54035 | AJ291: =STDEV(G291:Y291) -> 2.7041341089597912
B292: 600153.SH | C292: 建发股份 | E292: 0.81989999999999996 | F292: 1.1499999999999999 | G292: 0.36359999999999998 | H292: 0.10000000000000001 | I292: 0.26090000000000002 | J292: 0.15839999999999999 | K292: 0.33329999999999999 | L292: 0.2727 | M292: 5.1699999999999996e-02 | N292: 0.4103 | O292: -0.20000000000000001 | P292: 0.16670000000000001 | Q292: 4.9200000000000001e-02 | R292: 1.8200000000000001e-02 | S292: 2.25 | T292: 0.63270000000000004 | U292: 0.57810000000000006 | V292: -5.3600000000000002e-02 | W292: -0.5 | X292: 0.10000000000000001 | Y292: 0.1386 | AA292: =(N292+O292+P292+Q292+R292+S292+T292+U292+V292+W292+X292+Y292)/12 -> 0.2991833333333333 | AB292: =(G292+H292+I292+J292+K292+L292+M292+N292+O292+P292+Q292+R292+S292+T292+U292+V292+W292+X292+Y292)/19 -> 0.27004210526315786 | AC292: =(R292+S292)/2 -> 1.1341000000000001 | AD292: =(S292+T292)/2 -> 1.4413499999999999 | AE292: =(T292+U292)/2 -> 0.60540000000000005 | AF292: =(U292+V292)/2 -> 0.26225000000000004 | AG292: =(V292+W292)/2 -> -0.27679999999999999 | AH292: =(W292+X292)/2 -> -0.20000000000000001 | AI292: =(X292+Y292)/2 -> 0.1193 | AJ292: =STDEV(G292:Y292) -> 0.54548337617585607 | AK292: 0.61270000000000002 | AL292: 0.54859999999999998 | AM292: 0.50700000000000001 | AN292: 0.45450000000000002 | AO292: 0.28190000000000004 | AP292: 0.29350000000000004 | AQ292: 0.36119999999999997 | AR292: 0.29010000000000002 | AS292: 0.1081 | AT292: 0.18179999999999999 | AU292: 0.20420000000000002 | AV292: 0.28039999999999998 | AW292: 0.16289999999999999 | AX292: 0.21109999999999998 | AY292: 0.2487 | AZ292: 0.25590000000000002 | BA292: 0.85450000000000004 | BB292: 0.9423999999999999 | BC292: 0.80079999999999996 | BE292: =(AR292+AS292+AT292+AU292+AV292+AW292+AX292+AY292+AZ292+BA292+BB292+BC292)/12 -> 0.37840833333333329 | BF292: =(AK292+AL292+AM292+AN292+AO292+AP292+AQ292+AR292+AS292+AT292+AU292+AV292+AV292+AW292+AX292+AY292+AZ292+BA292+BB292+BC292)/19 -> 0.41477368421052629 | BG292: =(AV292+AW292)/2 -> 0.22164999999999999 | BH292: =(AW292+AX292)/2 -> 0.187 | BI292: =(AX292+AY292)/2 -> 0.22989999999999999 | BJ292: =(AY292+AZ292)/2 -> 0.25230000000000002 | BK292: =(AZ292+BA292)/2 -> 0.55520000000000003 | BL292: =(BA292+BB292)/2 -> 0.89844999999999997 | BM292: =(BB292+BC292)/2 -> 0.87159999999999993 | BN292: =STDEV(AK292:BC292) -> 0.24754788821370363
B293: 600323.SH | C293: 瀚蓝环境
B294: 600803.SH | C294: 新奥股份 | G294: 2.7999999999999998 | H294: -0.44439999999999996 | I294: 0.94999999999999996 | J294: 0.20749999999999999 | K294: 0.68420000000000003 | L294: 5.0999999999999996 | M294: 1.2564 | N294: 0.73439999999999994 | O294: -9.3800000000000008e-02 | P294: 0.19670000000000001 | Q294: 0 | R294: 9.0000000000000011e-03 | S294: -0.13789999999999999 | T294: -0.61640000000000006 | U294: -0.45450000000000002 | V294: -0.26789999999999997 | W294: -0.12 | X294: 1.6429 | Y294: 1.3958000000000002 | AA294: =(N294+O294+P294+Q294+R294+S294+T294+U294+V294+W294+X294+Y294)/12 -> 0.19069166666666668 | AB294: =(G294+H294+I294+J294+K294+L294+M294+N294+O294+P294+Q294+R294+S294+T294+U294+V294+W294+X294+Y294)/19 -> 0.67589473684210533 | AC294: =(R294+S294)/2 -> -6.4449999999999993e-02 | AD294: =(S294+T294)/2 -> -0.37715000000000004 | AE294: =(T294+U294)/2 -> -0.53544999999999998 | AF294: =(U294+V294)/2 -> -0.36119999999999997 | AG294: =(V294+W294)/2 -> -0.19394999999999998 | AH294: =(W294+X294)/2 -> 0.76144999999999996 | AI294: =(X294+Y294)/2 -> 1.5193500000000002 | AJ294: =STDEV(G294:Y294) -> 1.3801343688503203
B295: 601186.SH | C295: 中国铁建
B296: 603868.SH | C296: 飞科电器
B297: 605089.SH | C297: 味知香 | V297: 0.45219999999999999 | W297: 0.40740000000000004 | X297: 5.7099999999999998e-02 | Y297: -8.0000000000000002e-02 | AA297: =(N297+O297+P297+Q297+R297+S297+T297+U297+V297+W297+X297+Y297)/12 -> 6.9725000000000009e-02 | AB297: =(G297+H297+I297+J297+K297+L297+M297+N297+O297+P297+Q297+R297+S297+T297+U297+V297+W297+X297+Y297)/19 -> 4.4036842105263166e-02 | AC297: =(R297+S297)/2 -> 0 | AD297: =(S297+T297)/2 -> 0 | AE297: =(T297+U297)/2 -> 0 | AF297: =(U297+V297)/2 -> 0.2261 | AG297: =(V297+W297)/2 -> 0.42980000000000002 | AH297: =(W297+X297)/2 -> 0.23225000000000001 | AI297: =(X297+Y297)/2 -> -1.1450000000000002e-02 | AJ297: =STDEV(G297:Y297) -> 0.26147229776785147
B298: 002925.SZ | C298: 盈趣科技
B299: 003026.SZ | C299: 中晶科技
B300: 600926.SH | C300: 杭州银行 | G300: -0.30769999999999997 | H300: -0.30990000000000001 | I300: -0.3039 | J300: -0.25829999999999997 | K300: -0.16670000000000001 | L300: 0.2041 | M300: 0.21129999999999999 | N300: 6.7400000000000002e-02 | O300: 0.16670000000000001 | P300: 0.2034 | Q300: 0.19769999999999999 | R300: 0.25259999999999999 | S300: 0.20000000000000001 | T300: 5.6299999999999996e-02 | U300: -2.9100000000000001e-02 | V300: -1.6799999999999999e-02 | W300: -9.5199999999999993e-02 | X300: 6.6699999999999995e-02 | Y300: 0.14000000000000001 | AA300: =(N300+O300+P300+Q300+R300+S300+T300+U300+V300+W300+X300+Y300)/12 -> 0.10080833333333335 | AB300: =(G300+H300+I300+J300+K300+L300+M300+N300+O300+P300+Q300+R300+S300+T300+U300+V300+W300+X300+Y300)/19 -> 1.466315789473684e-02 | AC300: =(R300+S300)/2 -> 0.2263 | AD300: =(S300+T300)/2 -> 0.12815000000000001 | AE300: =(T300+U300)/2 -> 1.3599999999999998e-02 | AF300: =(U300+V300)/2 -> -2.2949999999999998e-02 | AG300: =(V300+W300)/2 -> -5.5999999999999994e-02 | AH300: =(W300+X300)/2 -> -1.4249999999999999e-02 | AI300: =(X300+Y300)/2 -> 0.10335 | AJ300: =STDEV(G300:Y300) -> 0.19913780323776442
B301: 002901.SZ | C301: 大博医疗
B302: 000776.SZ | C302: 广发证券
B303: 002034.SZ | C303: 旺能环境 | G303: 31 | H303: 2.125 | I303: 3.25 | J303: -7.690000000000001e-02 | K303: 5.6666999999999996 | L303: 0.20000000000000001 | M303: -0.2059 | N303: 2.7799999999999998e-02 | O303: -0.25 | P303: 0.66670000000000007 | Q303: 0.40740000000000004 | R303: 0.3649 | S303: 0.40000000000000002 | T303: 0.10000000000000001 | U303: 0.18420000000000003 | V303: 0.23760000000000001 | W303: 0.66670000000000007 | X303: 0.43640000000000001 | Y303: 0.25559999999999999 | AA303: =(N303+O303+P303+Q303+R303+S303+T303+U303+V303+W303+X303+Y303)/12 -> 0.29144166666666665 | AB303: =(G303+H303+I303+J303+K303+L303+M303+N303+O303+P303+Q303+R303+S303+T303+U303+V303+W303+X303+Y303)/19 -> 2.392431578947368 | AC303: =(R303+S303)/2 -> 0.38245000000000001 | AD303: =(S303+T303)/2 -> 0.25 | AE303: =(T303+U303)/2 -> 0.1421 | AF303: =(U303+V303)/2 -> 0.21090000000000003 | AG303: =(V303+W303)/2 -> 0.45215000000000005 | AH303: =(W303+X303)/2 -> 0.55154999999999998 | AI303: =(X303+Y303)/2 -> 0.34599999999999997 | AJ303: =STDEV(G303:Y303) -> 7.0761516969208813
B304: 003043.SZ | C304: 华亚智能 | V304: 0.30430000000000001 | W304: 0.28000000000000003 | X304: 7.9399999999999998e-02 | Y304: 0.15310000000000001 | AA304: =(N304+O304+P304+Q304+R304+S304+T304+U304+V304+W304+X304+Y304)/12 -> 6.8066666666666678e-02 | AB304: =(G304+H304+I304+J304+K304+L304+M304+N304+O304+P304+Q304+R304+S304+T304+U304+V304+W304+X304+Y304)/19 -> 4.2989473684210529e-02 | AC304: =(R304+S304)/2 -> 0 | AD304: =(S304+T304)/2 -> 0 | AE304: =(T304+U304)/2 -> 0 | AF304: =(U304+V304)/2 -> 0.15215000000000001 | AG304: =(V304+W304)/2 -> 0.29215000000000002 | AH304: =(W304+X304)/2 -> 0.17970000000000003 | AI304: =(X304+Y304)/2 -> 0.11625000000000001 | AJ304: =STDEV(G304:Y304) -> 0.10638279936155094
B305: 600048.SH | C305: 保利发展 | E305: 0.67700000000000005 | F305: 2.3039999999999998 | G305: 0.23079999999999998 | H305: 4.3499999999999997e-02 | I305: 9.3699999999999992e-02 | J305: 0.20000000000000001 | K305: 0 | L305: 0.14580000000000001 | M305: 0.15710000000000002 | N305: 0.20449999999999999 | O305: 0.25 | P305: 0.52729999999999999 | Q305: 0.33329999999999999 | R305: 0.47799999999999998 | S305: 0 | T305: 1.1899999999999999e-02 | U305: 2.7799999999999998e-02 | V305: 2.98e-02 | W305: 5.0000000000000003e-02 | X305: 1.18e-02 | Y305: 1.8000000000000002e-02 | AA305: =(N305+O305+P305+Q305+R305+S305+T305+U305+V305+W305+X305+Y305)/12 -> 0.16186666666666669 | AB305: =(G305+H305+I305+J305+K305+L305+M305+N305+O305+P305+Q305+R305+S305+T305+U305+V305+W305+X305+Y305)/19 -> 0.14806842105263152 | AC305: =(R305+S305)/2 -> 0.23899999999999999 | AD305: =(S305+T305)/2 -> 5.9499999999999996e-03 | AE305: =(T305+U305)/2 -> 1.985e-02 | AF305: =(U305+V305)/2 -> 2.8799999999999999e-02 | AG305: =(V305+W305)/2 -> 3.9900000000000005e-02 | AH305: =(W305+X305)/2 -> 3.09e-02 | AI305: =(X305+Y305)/2 -> 1.49e-02 | AJ305: =STDEV(G305:Y305) -> 0.1598648563027589
B306: 601615.SH | C306: 明阳智能 | E306: 0.6966 | F306: 1.0269999999999999 | M306: 0.4375 | N306: 0.21879999999999999 | O306: 1.3999999999999999 | P306: 0.92310000000000003 | Q306: 0.6522 | R306: 0.34619999999999995 | S306: 1.75 | T306: 0.56000000000000005 | U306: 0.78949999999999998 | V306: 0.8095 | W306: 0.2727 | X306: 0.4103 | Y306: 0.66180000000000005 | AA306: =(N306+O306+P306+Q306+R306+S306+T306+U306+V306+W306+X306+Y306)/12 -> 0.73284166666666672 | AB306: =(G306+H306+I306+J306+K306+L306+M306+N306+O306+P306+Q306+R306+S306+T306+U306+V306+W306+X306+Y306)/19 -> 0.48587368421052635 | AC306: =(R306+S306)/2 -> 1.0481 | AD306: =(S306+T306)/2 -> 1.155 | AE306: =(T306+U306)/2 -> 0.67474999999999996 | AF306: =(U306+V306)/2 -> 0.79949999999999999 | AG306: =(V306+W306)/2 -> 0.54110000000000003 | AH306: =(W306+X306)/2 -> 0.34150000000000003 | AI306: =(X306+Y306)/2 -> 0.53605000000000003 | AJ306: =STDEV(G306:Y306) -> 0.44501231285183962 | AK306: -2.2799999999999997e-02 | AL306: 0.25900000000000001 | AM306: 0.2487 | AN306: 0.13789999999999999 | AO306: 0.2046 | AP306: -0.13419999999999999 | AQ306: 7.9100000000000004e-02 | AR306: 0.60729999999999995 | AS306: 1.2768999999999999 | AT306: 5.4480999999999993 | AU306: 3.0883999999999996 | AV306: 1.8615999999999999 | AW306: 1.2678 | AX306: -0.43130000000000002 | AY306: -0.26019999999999999 | AZ306: -0.11840000000000001 | BA306: -0.43130000000000002 | BB306: -0.26019999999999999 | BC306: -0.11840000000000001 | BE306: =(AR306+AS306+AT306+AU306+AV306+AW306+AX306+AY306+AZ306+BA306+BB306+BC306)/12 -> 0.99419166666666658 | BF306: =(AK306+AL306+AM306+AN306+AO306+AP306+AQ306+AR306+AS306+AT306+AU306+AV306+AV306+AW306+AX306+AY306+AZ306+BA306+BB306+BC306)/19 -> 0.76653684210526318 | BG306: =(AV306+AW306)/2 -> 1.5647 | BH306: =(AW306+AX306)/2 -> 0.41825000000000001 | BI306: =(AX306+AY306)/2 -> -0.34575 | BJ306: =(AY306+AZ306)/2 -> -0.1893 | BK306: =(AZ306+BA306)/2 -> -0.27485000000000004 | BL306: =(BA306+BB306)/2 -> -0.34575 | BM306: =(BB306+BC306)/2 -> -0.1893 | BN306: =STDEV(AK306:BC306) -> 1.4634400888605623
B307: 002271.SZ | C307: 东方雨虹 | G307: 0.28570000000000001 | H307: -0.25 | I307: -0.33329999999999999 | J307: -0.31969999999999998 | K307: -0.22219999999999998 | L307: 0.24239999999999998 | M307: 0.27589999999999998 | N307: 0.21690000000000001 | O307: 0.28570000000000001 | P307: 0.439 | Q307: 0.35139999999999999 | R307: -7.9199999999999993e-02 | S307: -0.33329999999999999 | T307: -0.1356 | U307: -2.9999999999999999e-02 | V307: 0.62369999999999992 | W307: 1.1667000000000001 | X307: 0.25489999999999996 | Y307: 0.15460000000000002 | AA307: =(N307+O307+P307+Q307+R307+S307+T307+U307+V307+W307+X307+Y307)/12 -> 0.2429 | AB307: =(G307+H307+I307+J307+K307+L307+M307+N307+O307+P307+Q307+R307+S307+T307+U307+V307+W307+X307+Y307)/19 -> 0.13650526315789474 | AC307: =(R307+S307)/2 -> -0.20624999999999999 | AD307: =(S307+T307)/2 -> -0.23444999999999999 | AE307: =(T307+U307)/2 -> -8.2799999999999999e-02 | AF307: =(U307+V307)/2 -> 0.29684999999999995 | AG307: =(V307+W307)/2 -> 0.8952 | AH307: =(W307+X307)/2 -> 0.71079999999999999 | AI307: =(X307+Y307)/2 -> 0.20474999999999999 | AJ307: =STDEV(G307:Y307) -> 0.38065882431163445
B308: 603288.SH | C308: 海天味业
B309: 603666.SH | C309: 亿嘉和 | J309: 0.76450000000000007 | K309: 2.7995999999999999 | L309: 0.54280000000000006 | M309: 0.17399999999999999 | N309: 9.0399999999999994e-02 | O309: 4.0599999999999997e-02 | P309: -0.50990000000000002 | Q309: -0.4133 | R309: -9.4600000000000004e-02 | S309: -0.3095 | T309: -0.23079999999999998 | U309: -7.9000000000000001e-02 | V309: 0.30309999999999998 | W309: 0.66280000000000006 | X309: 5.1299999999999998e-02 | Y309: 0.34939999999999999 | AA309: =(N309+O309+P309+Q309+R309+S309+T309+U309+V309+W309+X309+Y309)/12 -> -1.1624999999999983e-02 | AB309: =(G309+H309+I309+J309+K309+L309+M309+N309+O309+P309+Q309+R309+S309+T309+U309+V309+W309+X309+Y309)/19 -> 0.21796842105263159 | AC309: =(R309+S309)/2 -> -0.20205000000000001 | AD309: =(S309+T309)/2 -> -0.27015 | AE309: =(T309+U309)/2 -> -0.15489999999999998 | AF309: =(U309+V309)/2 -> 0.11204999999999998 | AG309: =(V309+W309)/2 -> 0.48294999999999999 | AH309: =(W309+X309)/2 -> 0.35705000000000003 | AI309: =(X309+Y309)/2 -> 0.20035 | AJ309: =STDEV(G309:Y309) -> 0.77183541412661294
B310: 605377.SH | C310: 华旺科技 | E310: 0.34340000000000004 | F310: 1.115 | T310: 0.22219999999999998 | U310: 0.1096 | V310: 0.51790000000000003 | W310: 1.087 | X310: 0.75 | Y310: 0.38270000000000004 | AA310: =(T310+U310+V310+W310+X310+Y310)/6 -> 0.51156666666666661 | AB310: =(T310+U310+V310+W310+X310+Y310)/6 -> 0.51156666666666661 | AE310: =(T310+U310)/2 -> 0.16589999999999999 | AF310: =(U310+V310)/2 -> 0.31375000000000003 | AG310: =(V310+W310)/2 -> 0.80245 | AH310: =(W310+X310)/2 -> 0.91849999999999998 | AI310: =(X310+Y310)/2 -> 0.56635000000000002 | AJ310: =STDEV(G310:Y310) -> 0.36053598248533619
B311: 002233.SZ | C311: 塔牌集团
B312: 002759.SZ | C312: 天际股份 | G312: 1.6772 | H312: 1.0979000000000001 | I312: -0.83329999999999993 | J312: -0.88859999999999995 | K312: -0.77590000000000003 | L312: -0.6875 | M312: 2.7999999999999998 | N312: 9.5 | O312: 9.0899999999999999 | P312: 6.9263000000000003 | Q312: -0.57889999999999997 | R312: -1.2381 | S312: -1.1189 | T312: -1.1279000000000001 | U312: -1.375 | V312: 3.3999999999999999 | W312: 7.375 | X312: 11.0909 | Y312: 62.666699999999999 | AA312: =(N312+O312+P312+Q312+R312+S312+T312+U312+V312+W312+X312+Y312)/12 -> 8.717508333333333 | AB312: =(G312+H312+I312+J312+K312+L312+M312+N312+O312+P312+Q312+R312+S312+T312+U312+V312+W312+X312+Y312)/19 -> 5.631573684210526 | AC312: =(R312+S312)/2 -> -1.1785000000000001 | AD312: =(S312+T312)/2 -> -1.1234000000000002 | AE312: =(T312+U312)/2 -> -1.2514500000000002 | AF312: =(U312+V312)/2 -> 1.0125 | AG312: =(V312+W312)/2 -> 5.3875000000000002 | AH312: =(W312+X312)/2 -> 9.2329499999999989 | AI312: =(X312+Y312)/2 -> 36.878799999999998 | AJ312: =STDEV(G312:Y312) -> 14.443467737156094 | AK312: 0.94810000000000005 | AL312: 0.80049999999999999 | AM312: 0.80379999999999996 | AN312: 0.24979999999999999 | AO312: 0.55669999999999997 | AP312: 0.35509999999999997 | AQ312: 0.26140000000000002 | AR312: -2.53e-02 | AS312: -0.41409999999999997 | AT312: -0.31079999999999997 | AU312: -0.28920000000000001 | AV312: -0.31690000000000002 | AW312: -0.19 | AX312: -0.1686 | AY312: -0.14599999999999999 | AZ312: 0.7883 | BA312: 0.7117 | BB312: 1.5703 | BC312: 1.6830000000000001 | BE312: =(AR312+AS312+AT312+AU312+AV312+AW312+AX312+AY312+AZ312+BA312+BB312+BC312)/12 -> 0.24103333333333335 | BF312: =(AK312+AL312+AM312+AN312+AO312+AP312+AQ312+AR312+AS312+AT312+AU312+AV312+AV312+AW312+AX312+AY312+AZ312+BA312+BB312+BC312)/19 -> 0.3447842105263158 | BG312: =(AV312+AW312)/2 -> -0.25345000000000001 | BH312: =(AW312+AX312)/2 -> -0.17930000000000001 | BI312: =(AX312+AY312)/2 -> -0.1573 | BJ312: =(AY312+AZ312)/2 -> 0.32114999999999999 | BK312: =(AZ312+BA312)/2 -> 0.75 | BL312: =(BA312+BB312)/2 -> 1.141 | BM312: =(BB312+BC312)/2 -> 1.6266500000000002 | BN312: =STDEV(AK312:BC312) -> 0.6339890090271687
B313: 600885.SH | C313: 宏发股份 | G313: 0.23999999999999999 | H313: -0.1148 | I313: -0.1333 | J313: -0.156 | K313: -0.2903 | L313: -8.6699999999999999e-02 | M313: 1.2800000000000001e-02 | N313: 2.1700000000000001e-02 | O313: -4.5499999999999999e-02 | P313: -3.4300000000000004e-02 | Q313: -5.5300000000000002e-02 | R313: 1.06e-02 | S313: -9.5199999999999993e-02 | T313: 7.3000000000000001e-03 | U313: 7.4499999999999997e-02 | V313: 0.1789 | W313: 0.63159999999999994 | X313: 0.45600000000000002 | Y313: 0.37439999999999996 | AA313: =(N313+O313+P313+Q313+R313+S313+T313+U313+V313+W313+X313+Y313)/12 -> 0.1270583333333333 | AB313: =(G313+H313+I313+J313+K313+L313+M313+N313+O313+P313+Q313+R313+S313+T313+U313+V313+W313+X313+Y313)/19 -> 5.2442105263157901e-02 | AC313: =(R313+S313)/2 -> -4.2299999999999997e-02 | AD313: =(S313+T313)/2 -> -4.3949999999999996e-02 | AE313: =(T313+U313)/2 -> 4.0899999999999999e-02 | AF313: =(U313+V313)/2 -> 0.12670000000000001 | AG313: =(V313+W313)/2 -> 0.40525 | AH313: =(W313+X313)/2 -> 0.54379999999999995 | AI313: =(X313+Y313)/2 -> 0.41520000000000001 | AJ313: =STDEV(G313:Y313) -> 0.2301177508141562
B314: 003023.SZ | C314: 彩虹集团
B315: 600782.SH | C315: 新钢股份 | G315: 3.8571 | H315: 4.125 | I315: 3.3100000000000001 | J315: 5.0388000000000002 | K315: 1.7 | L315: 2.3024 | M315: 1.8724000000000001 | N315: 0.69720000000000004 | O315: -0.11109999999999999 | P315: -0.1477 | Q315: -0.3296 | R315: -0.42159999999999997 | S315: -0.33329999999999999 | T315: -0.41070000000000001 | U315: -0.28920000000000001 | V315: -0.20559999999999998 | W315: 0.875 | X315: 1.2646999999999999 | Y315: 0.86439999999999995 | AA315: =(N315+O315+P315+Q315+R315+S315+T315+U315+V315+W315+X315+Y315)/12 -> 0.12104166666666664 | AB315: =(G315+H315+I315+J315+K315+L315+M315+N315+O315+P315+Q315+R315+S315+T315+U315+V315+W315+X315+Y315)/19 -> 1.2451684210526313 | AC315: =(R315+S315)/2 -> -0.37744999999999995 | AD315: =(S315+T315)/2 -> -0.372 | AE315: =(T315+U315)/2 -> -0.34994999999999998 | AF315: =(U315+V315)/2 -> -0.24740000000000001 | AG315: =(V315+W315)/2 -> 0.3347 | AH315: =(W315+X315)/2 -> 1.06985 | AI315: =(X315+Y315)/2 -> 1.0645499999999999 | AJ315: =STDEV(G315:Y315) -> 1.7448577420691005
B316: 603279.SH | C316: 景津装备 | E316: 0.46860000000000002 | F316: 1.0920000000000001 | J316: 0.29549999999999998 | K316: 0.90910000000000002 | L316: 0.61539999999999995 | M316: 0.79409999999999992 | N316: 0.193 | O316: 0.23809999999999998 | P316: 0.16670000000000001 | Q316: 0.29510000000000003 | R316: 0.61759999999999993 | S316: -0.3846 | T316: -0.16329999999999997 | U316: -1.2699999999999999e-02 | V316: 0.17269999999999999 | W316: 0.5 | X316: 0.60980000000000001 | Y316: 0.4103 | AA316: =(N316+O316+P316+Q316+R316+S316+T316+U316+V316+W316+X316+Y316)/12 -> 0.22022499999999998 | AB316: =(G316+H316+I316+J316+K316+L316+M316+N316+O316+P316+Q316+R316+S316+T316+U316+V316+W316+X316+Y316)/19 -> 0.27667368421052635 | AC316: =(R316+S316)/2 -> 0.11649999999999996 | AD316: =(S316+T316)/2 -> -0.27394999999999997 | AE316: =(T316+U316)/2 -> -8.7999999999999981e-02 | AF316: =(U316+V316)/2 -> 8.0000000000000002e-02 | AG316: =(V316+W316)/2 -> 0.33634999999999998 | AH316: =(W316+X316)/2 -> 0.55489999999999995 | AI316: =(X316+Y316)/2 -> 0.51005 | AJ316: =STDEV(G316:Y316) -> 0.34457601193350645
B317: 002092.SZ | C317: 中泰化学 | G317: 2.3012999999999999 | H317: 1.3384 | I317: 0.1285 | J317: -0.39140000000000003 | K317: -1.e-03 | L317: -1.6899999999999998e-02 | M317: 1.1200000000000002e-02 | N317: -0.55759999999999998 | O317: -0.69950000000000001 | P317: -0.78449999999999998 | Q317: -0.83519999999999994 | R317: -0.85140000000000005 | S317: -1.7379 | T317: -2.0430999999999999 | U317: -0.62280000000000002 | V317: 25.215399999999999 | W317: 7.2882000000000007 | X317: 6.2198000000000002 | Y317: 16.270399999999999 | AA317: =(N317+O317+P317+Q317+R317+S317+T317+U317+V317+W317+X317+Y317)/12 -> 3.9051499999999995 | AB317: =(G317+H317+I317+J317+K317+L317+M317+N317+O317+P317+Q317+R317+S317+T317+U317+V317+W317+X317+Y317)/19 -> 2.6437842105263156 | AC317: =(R317+S317)/2 -> -1.2946500000000001 | AD317: =(S317+T317)/2 -> -1.8904999999999998 | AE317: =(T317+U317)/2 -> -1.3329499999999999 | AF317: =(U317+V317)/2 -> 12.296299999999999 | AG317: =(V317+W317)/2 -> 16.251799999999999 | AH317: =(W317+X317)/2 -> 6.7540000000000004 | AI317: =(X317+Y317)/2 -> 11.245099999999999 | AJ317: =STDEV(G317:Y317) -> 6.9810128529114319
B318: 000960.SZ | C318: 锡业股份 | E318: 0.60870000000000002 | F318: 1.091 | G318: 10.607799999999999 | H318: 70.647099999999995 | I318: 8.7540999999999993 | J318: 3.9643000000000002 | K318: 8.2699999999999996e-02 | L318: 0.1182 | M318: 0.21030000000000001 | N318: 0.16010000000000002 | O318: 9.6099999999999991e-02 | P318: 9.4999999999999998e-03 | Q318: -0.19850000000000001 | R318: -3.7699999999999997e-02 | S318: -0.74980000000000002 | T318: -0.55349999999999999 | U318: -0.20710000000000001 | V318: -0.18160000000000001 | W318: 5.8694000000000006 | X318: 3.7492000000000001 | Y318: 2.9300999999999999 | AA318: =(N318+O318+P318+Q318+R318+S318+T318+U318+V318+W318+X318+Y318)/12 -> 0.90718333333333334 | AB318: =(G318+H318+I318+J318+K318+L318+M318+N318+O318+P318+Q318+R318+S318+T318+U318+V318+W318+X318+Y318)/19 -> 5.540563157894737 | AC318: =(R318+S318)/2 -> -0.39374999999999999 | AD318: =(S318+T318)/2 -> -0.65165000000000006 | AE318: =(T318+U318)/2 -> -0.38029999999999997 | AF318: =(U318+V318)/2 -> -0.19435000000000002 | AG318: =(V318+W318)/2 -> 2.8439000000000001 | AH318: =(W318+X318)/2 -> 4.8093000000000004 | AI318: =(X318+Y318)/2 -> 3.3396499999999998 | AJ318: =STDEV(G318:Y318) -> 16.108669560940385
B319: 002430.SZ | C319: 杭氧股份 | G319: 2.25 | H319: 2.7143000000000002 | I319: 2.5 | J319: 2.2059000000000002 | K319: 2.2000000000000002 | L319: 1.9166999999999998 | M319: 1.3333000000000002 | N319: 0.878 | O319: 0.125 | P319: 0.1714 | Q319: -1.7899999999999999e-02 | R319: -0.1429 | S319: -0.22219999999999998 | T319: 4.8799999999999996e-02 | U319: 0.21820000000000001 | V319: 0.31819999999999998 | W319: 1.2143000000000002 | X319: 0.6512 | Y319: 0.62690000000000001 | AA319: =(N319+O319+P319+Q319+R319+S319+T319+U319+V319+W319+X319+Y319)/12 -> 0.32241666666666674 | AB319: =(G319+H319+I319+J319+K319+L319+M319+N319+O319+P319+Q319+R319+S319+T319+U319+V319+W319+X319+Y319)/19 -> 0.99943157894736823 | AC319: =(R319+S319)/2 -> -0.18254999999999999 | AD319: =(S319+T319)/2 -> -8.6699999999999999e-02 | AE319: =(T319+U319)/2 -> 0.13350000000000001 | AF319: =(U319+V319)/2 -> 0.26819999999999999 | AG319: =(V319+W319)/2 -> 0.7662500000000001 | AH319: =(W319+X319)/2 -> 0.93275000000000008 | AI319: =(X319+Y319)/2 -> 0.63905000000000001 | AJ319: =STDEV(G319:Y319) -> 1.0052024401154402
B320: 002626.SZ | C320: 金达威
B321: 603662.SH | C321: 柯力传感 | E321: 0.22820000000000001 | F321: 1.0900000000000001 | P321: 0.31819999999999998 | Q321: 0.26129999999999998 | R321: 0.17199999999999999 | S321: -0.19350000000000001 | T321: -6.9000000000000006e-02 | U321: -0.10000000000000001 | V321: -0.14130000000000001 | W321: -0.16 | X321: -8.6400000000000005e-02 | Y321: -0.13489999999999999 | AA321: =(N321+O321+P321+Q321+R321+S321+T321+U321+V321+W321+X321+Y321)/12 -> -1.1133333333333351e-02 | AB321: =(G321+H321+I321+J321+K321+L321+M321+N321+O321+P321+Q321+R321+S321+T321+U321+V321+W321+X321+Y321)/19 -> -7.031578947368433e-03 | AC321: =(R321+S321)/2 -> -1.075000000000001e-02 | AD321: =(S321+T321)/2 -> -0.13125000000000001 | AE321: =(T321+U321)/2 -> -8.4500000000000006e-02 | AF321: =(U321+V321)/2 -> -0.12065000000000001 | AG321: =(V321+W321)/2 -> -0.15065000000000001 | AH321: =(W321+X321)/2 -> -0.1232 | AI321: =(X321+Y321)/2 -> -0.11065 | AJ321: =STDEV(G321:Y321) -> 0.18878557619102623
B322: 000963.SZ | C322: 华东医药 | G322: -0.39679999999999999 | H322: -0.58579999999999999 | I322: -0.5897 | J322: -0.1867 | K322: -0.19210000000000002 | L322: 3.5000000000000003e-02 | M322: 1.24e-02 | N322: 5.74e-02 | O322: 0.1469 | P322: 0.23420000000000002 | Q322: 0.22329999999999997 | R322: 0.24629999999999999 | S322: 0.2646 | T322: 8.4499999999999992e-02 | U322: 8.0600000000000005e-02 | V322: 2.3999999999999998e-03 | W322: -0.33899999999999997 | X322: -0.24890000000000001 | Y322: -0.20739999999999997 | AA322: =(N322+O322+P322+Q322+R322+S322+T322+U322+V322+W322+X322+Y322)/12 -> 4.5408333333333328e-02 | AB322: =(G322+H322+I322+J322+K322+L322+M322+N322+O322+P322+Q322+R322+S322+T322+U322+V322+W322+X322+Y322)/19 -> -7.1515789473684227e-02 | AC322: =(R322+S322)/2 -> 0.25545000000000001 | AD322: =(S322+T322)/2 -> 0.17454999999999998 | AE322: =(T322+U322)/2 -> 8.2549999999999998e-02 | AF322: =(U322+V322)/2 -> 4.1500000000000002e-02 | AG322: =(V322+W322)/2 -> -0.16829999999999998 | AH322: =(W322+X322)/2 -> -0.29394999999999999 | AI322: =(X322+Y322)/2 -> -0.22814999999999999 | AJ322: =STDEV(G322:Y322) -> 0.27060769731837486
B323: 002960.SZ | C323: 青鸟消防 | E323: 0.33700000000000002 | F323: 1.075 | P323: 8.3299999999999999e-02 | Q323: -4.7999999999999996e-03 | R323: -5.2400000000000002e-02 | S323: -0.9214 | T323: -0.2253 | U323: -4.1900000000000007e-02 | V323: -1.1000000000000001e-02 | W323: 8.6817999999999991 | X323: -1.9900000000000001e-02 | Y323: -0.18899999999999997 | AA323: =(N323+O323+P323+Q323+R323+S323+T323+U323+V323+W323+X323+Y323)/12 -> 0.60828333333333329 | AB323: =(G323+H323+I323+J323+K323+L323+M323+N323+O323+P323+Q323+R323+S323+T323+U323+V323+W323+X323+Y323)/19 -> 0.38417894736842101 | AC323: =(R323+S323)/2 -> -0.4869 | AD323: =(S323+T323)/2 -> -0.57335000000000003 | AE323: =(T323+U323)/2 -> -0.1336 | AF323: =(U323+V323)/2 -> -2.6450000000000005e-02 | AG323: =(V323+W323)/2 -> 4.3353999999999999 | AH323: =(W323+X323)/2 -> 4.3309499999999996 | AI323: =(X323+Y323)/2 -> -0.10444999999999999 | AJ323: =STDEV(G323:Y323) -> 2.8085774683992604
B324: 600587.SH | C324: 新华医疗 | G324: 0 | H324: -8.6999999999999994e-02 | I324: -0.91670000000000007 | J324: 0.77780000000000005 | K324: -0.36359999999999998 | L324: -0.33329999999999999 | M324: 11.666700000000001 | N324: -0.625 | O324: 18.714300000000001 | P324: 11.214300000000001 | Q324: 4.1842000000000006 | R324: 34.333300000000001 | S324: -0.94200000000000006 | T324: -0.81290000000000007 | U324: -0.73599999999999999 | V324: -0.72640000000000005 | W324: 3.5 | X324: 1.5312999999999999 | Y324: 1.0769 | AA324: =(N324+O324+P324+Q324+R324+S324+T324+U324+V324+W324+X324+Y324)/12 -> 5.8926666666666669 | AB324: =(G324+H324+I324+J324+K324+L324+M324+N324+O324+P324+Q324+R324+S324+T324+U324+V324+W324+X324+Y324)/19 -> 4.2871526315789472 | AC324: =(R324+S324)/2 -> 16.695650000000001 | AD324: =(S324+T324)/2 -> -0.87745000000000006 | AE324: =(T324+U324)/2 -> -0.77445000000000008 | AF324: =(U324+V324)/2 -> -0.73120000000000007 | AG324: =(V324+W324)/2 -> 1.3868 | AH324: =(W324+X324)/2 -> 2.5156499999999999 | AI324: =(X324+Y324)/2 -> 1.3041 | AJ324: =STDEV(G324:Y324) -> 9.0664996816956389
B325: 603180.SH | C325: 金牌厨柜
B326: 603612.SH | C326: 索通发展
B327: 600176.SH | C327: 中国巨石
B328: 600690.SH | C328: 海尔智家
B329: 002254.SZ | C329: 泰和新材 | G329: 0.66670000000000007 | H329: 0.66670000000000007 | I329: 0.375 | J329: 0.59999999999999998 | K329: 0.20000000000000001 | L329: 0.59999999999999998 | M329: 1.0909 | N329: 0.625 | O329: 0.16670000000000001 | P329: -6.25e-02 | Q329: 0.13039999999999999 | R329: 0.46149999999999997 | S329: 0.28570000000000001 | T329: 0.33329999999999999 | U329: 0.11539999999999999 | V329: 7.8899999999999998e-02 | W329: 1.8888999999999998 | X329: 2.2000000000000002 | Y329: 2.6897000000000002 | AA329: =(N329+O329+P329+Q329+R329+S329+T329+U329+V329+W329+X329+Y329)/12 -> 0.74275000000000002 | AB329: =(G329+H329+I329+J329+K329+L329+M329+N329+O329+P329+Q329+R329+S329+T329+U329+V329+W329+X329+Y329)/19 -> 0.69012105263157908 | AC329: =(R329+S329)/2 -> 0.37359999999999999 | AD329: =(S329+T329)/2 -> 0.3095 | AE329: =(T329+U329)/2 -> 0.22434999999999999 | AF329: =(U329+V329)/2 -> 9.7149999999999986e-02 | AG329: =(V329+W329)/2 -> 0.98389999999999989 | AH329: =(W329+X329)/2 -> 2.0444499999999999 | AI329: =(X329+Y329)/2 -> 2.4448500000000002 | AJ329: =STDEV(G329:Y329) -> 0.76148914457787353 | AK329: 4.2199999999999994e-02 | AL329: 4.0999999999999995e-03 | AM329: 6.93e-02 | AN329: 1.06e-02 | AO329: 0.10929999999999999 | AP329: 8.2599999999999993e-02 | AQ329: 0.15109999999999998 | AR329: 0.26910000000000001 | AS329: 0.2024 | AT329: 0.1527 | AU329: 4.8499999999999995e-02 | AV329: 5.0599999999999999e-02 | AW329: -0.17149999999999999 | AX329: -7.8399999999999997e-02 | AY329: -5.57e-02 | AZ329: -1.24e-02 | BA329: 0.53939999999999999 | BB329: 0.54679999999999995 | BC329: 0.68519999999999992 | BE329: =(AR329+AS329+AT329+AU329+AV329+AW329+AX329+AY329+AZ329+BA329+BB329+BC329)/12 -> 0.18139166666666665 | BF329: =(AK329+AL329+AM329+AN329+AO329+AP329+AQ329+AR329+AS329+AT329+AU329+AV329+AV329+AW329+AX329+AY329+AZ329+BA329+BB329+BC329)/19 -> 0.14192105263157895 | BG329: =(AV329+AW329)/2 -> -6.044999999999999e-02 | BH329: =(AW329+AX329)/2 -> -0.12494999999999999 | BI329: =(AX329+AY329)/2 -> -6.7049999999999998e-02 | BJ329: =(AY329+AZ329)/2 -> -3.4049999999999997e-02 | BK329: =(AZ329+BA329)/2 -> 0.26350000000000001 | BL329: =(BA329+BB329)/2 -> 0.54309999999999992 | BM329: =(BB329+BC329)/2 -> 0.61599999999999988 | BN329: =STDEV(AK329:BC329) -> 0.22604297358341566
B330: 601101.SH | C330: 昊华能源
B331: 603908.SH | C331: 牧高笛 | E331: 0.52570000000000006 | F331: 1.0700000000000001 | G331: 0.15789999999999998 | H331: 6.8499999999999991e-02 | I331: -1.1599999999999999e-02 | J331: -0.15789999999999998 | K331: -0.31819999999999998 | L331: -0.25640000000000002 | M331: -0.24710000000000001 | N331: -0.22500000000000001 | O331: -0.36670000000000003 | P331: -3.4500000000000003e-02 | Q331: 0 | R331: -1.61e-02 | S331: 0 | T331: 0 | U331: 0.15620000000000001 | V331: 0.13109999999999999 | W331: 0.68420000000000003 | X331: 0.42859999999999998 | Y331: 0.44590000000000002 | AA331: =(N331+O331+P331+Q331+R331+S331+T331+U331+V331+W331+X331+Y331)/12 -> 0.10030833333333333 | AB331: =(G331+H331+I331+J331+K331+L331+M331+N331+O331+P331+Q331+R331+S331+T331+U331+V331+W331+X331+Y331)/19 -> 2.3099999999999996e-02 | AC331: =(R331+S331)/2 -> -8.0499999999999999e-03 | AD331: =(S331+T331)/2 -> 0 | AE331: =(T331+U331)/2 -> 7.8100000000000003e-02 | AF331: =(U331+V331)/2 -> 0.14365 | AG331: =(V331+W331)/2 -> 0.40765000000000001 | AH331: =(W331+X331)/2 -> 0.55640000000000001 | AI331: =(X331+Y331)/2 -> 0.43725000000000003 | AJ331: =STDEV(G331:Y331) -> 0.274001932272181
B332: 605100.SH | C332: 华丰股份
B333: 002311.SZ | C333: 海大集团
B334: 002993.SZ | C334: 奥海科技
B335: 603380.SH | C335: 易德龙 | E335: 0.36700000000000005 | F335: 1.0600000000000001 | H335: 0.1852 | I335: 6.25e-02 | J335: 0 | K335: 8.3299999999999999e-02 | L335: 0 | M335: -9.8000000000000004e-02 | N335: -7.3499999999999996e-02 | O335: -0.30769999999999997 | P335: -3.1300000000000001e-02 | Q335: 6.5199999999999994e-02 | R335: 0.254 | S335: 0.11109999999999999 | T335: 0.4839 | U335: 0.51019999999999999 | V335: 0.30380000000000001 | W335: 1.7 | X335: 0.45649999999999996 | Y335: 0.43240000000000001 | AA335: =(N335+O335+P335+Q335+R335+S335+T335+U335+V335+W335+X335+Y335)/12 -> 0.3253833333333333 | AB335: =(G335+H335+I335+J335+K335+L335+M335+N335+O335+P335+Q335+R335+S335+T335+U335+V335+W335+X335+Y335)/19 -> 0.21776842105263158 | AC335: =(R335+S335)/2 -> 0.18254999999999999 | AD335: =(S335+T335)/2 -> 0.29749999999999999 | AE335: =(T335+U335)/2 -> 0.49704999999999999 | AF335: =(U335+V335)/2 -> 0.40700000000000003 | AG335: =(V335+W335)/2 -> 1.0019 | AH335: =(W335+X335)/2 -> 1.0782499999999999 | AI335: =(X335+Y335)/2 -> 0.44445000000000001 | AJ335: =STDEV(G335:Y335) -> 0.4310004121739533
B336: 603535.SH | C336: 嘉诚国际
B337: 605507.SH | C337: 国邦医药 | V337: 1.5909 | W337: 0.14710000000000001 | X337: -0.1489 | Y337: -0.20899999999999999 | AA337: =(N337+O337+P337+Q337+R337+S337+T337+U337+V337+W337+X337+Y337)/12 -> 0.11500833333333332 | AB337: =(G337+H337+I337+J337+K337+L337+M337+N337+O337+P337+Q337+R337+S337+T337+U337+V337+W337+X337+Y337)/19 -> 7.2636842105263152e-02 | AC337: =(R337+S337)/2 -> 0 | AD337: =(S337+T337)/2 -> 0 | AE337: =(T337+U337)/2 -> 0 | AF337: =(U337+V337)/2 -> 0.79544999999999999 | AG337: =(V337+W337)/2 -> 0.86899999999999999 | AH337: =(W337+X337)/2 -> -8.9999999999999802e-04 | AI337: =(X337+Y337)/2 -> -0.17895 | AJ337: =STDEV(G337:Y337) -> 0.84504130618962447
B338: 002595.SZ | C338: 豪迈科技
B339: 600038.SH | C339: 中直股份 | G339: 0.27649999999999997 | H339: -0.1229 | I339: -0.10619999999999999 | J339: 3.6900000000000002e-02 | K339: -5.0000000000000001e-03 | L339: 0.1598 | M339: 0.1283 | N339: 0.1206 | O339: 0.11509999999999999 | P339: 0.35499999999999998 | Q339: 0.32119999999999999 | R339: 0.1527 | S339: -0.34110000000000001 | T339: 0.23800000000000002 | U339: 0.21210000000000001 | V339: 0.28800000000000003 | W339: 2.1566000000000001 | X339: 0.28110000000000002 | Y339: 0.2621 | AA339: =(N339+O339+P339+Q339+R339+S339+T339+U339+V339+W339+X339+Y339)/12 -> 0.34678333333333328 | AB339: =(G339+H339+I339+J339+K339+L339+M339+N339+O339+P339+Q339+R339+S339+T339+U339+V339+W339+X339+Y339)/19 -> 0.23835789473684213 | AC339: =(R339+S339)/2 -> -9.4200000000000006e-02 | AD339: =(S339+T339)/2 -> -5.1549999999999999e-02 | AE339: =(T339+U339)/2 -> 0.22505000000000003 | AF339: =(U339+V339)/2 -> 0.25004999999999999 | AG339: =(V339+W339)/2 -> 1.2223000000000002 | AH339: =(W339+X339)/2 -> 1.21885 | AI339: =(X339+Y339)/2 -> 0.27160000000000001 | AJ339: =STDEV(G339:Y339) -> 0.4970249438361436
B340: 002078.SZ | C340: 太阳纸业
B341: 603100.SH | C341: 川仪股份 | G341: 0 | H341: 0.125 | I341: 0.16670000000000001 | J341: 0.21210000000000001 | K341: 0.16670000000000001 | L341: 0.38890000000000002 | M341: 0.42859999999999998 | N341: 1.45 | O341: 0.42859999999999998 | P341: -0.16 | Q341: -5.0000000000000003e-02 | R341: -0.39799999999999996 | S341: -1.8999999999999999 | T341: 0 | U341: 0.31579999999999997 | V341: 0.62709999999999999 | W341: 5.2222 | X341: 2.7143000000000002 | Y341: 1.1000000000000001 | AA341: =(N341+O341+P341+Q341+R341+S341+T341+U341+V341+W341+X341+Y341)/12 -> 0.77916666666666667 | AB341: =(G341+H341+I341+J341+K341+L341+M341+N341+O341+P341+Q341+R341+S341+T341+U341+V341+W341+X341+Y341)/19 -> 0.57042105263157894 | AC341: =(R341+S341)/2 -> -1.149 | AD341: =(S341+T341)/2 -> -0.94999999999999996 | AE341: =(T341+U341)/2 -> 0.15789999999999998 | AF341: =(U341+V341)/2 -> 0.47144999999999998 | AG341: =(V341+W341)/2 -> 2.9246499999999997 | AH341: =(W341+X341)/2 -> 3.9682500000000003 | AI341: =(X341+Y341)/2 -> 1.9071500000000001 | AJ341: =STDEV(G341:Y341) -> 1.4277680781862716
B342: 605488.SH | C342: 福莱新材 | V342: 0.1754 | W342: 3.2726999999999999 | X342: 1.0526 | Y342: 0.56720000000000004 | AA342: =(N342+O342+P342+Q342+R342+S342+T342+U342+V342+W342+X342+Y342)/12 -> 0.42232500000000001 | AB342: =(G342+H342+I342+J342+K342+L342+M342+N342+O342+P342+Q342+R342+S342+T342+U342+V342+W342+X342+Y342)/19 -> 0.26673157894736843 | AC342: =(R342+S342)/2 -> 0 | AD342: =(S342+T342)/2 -> 0 | AE342: =(T342+U342)/2 -> 0 | AF342: =(U342+V342)/2 -> 8.77e-02 | AG342: =(V342+W342)/2 -> 1.7240500000000001 | AH342: =(W342+X342)/2 -> 2.1626500000000002 | AI342: =(X342+Y342)/2 -> 0.80990000000000006 | AJ342: =STDEV(G342:Y342) -> 1.3844506067390052
B343: 603233.SH | C343: 大参林
B344: 603507.SH | C344: 振江股份 | E344: 0.6492 | F344: 1.04 | I344: 1.3600000000000001e-02 | J344: -0.2397 | K344: -0.75 | L344: -0.58450000000000002 | M344: -0.56530000000000002 | N344: -0.5887 | O344: -0.42859999999999998 | P344: -1.5574000000000001 | Q344: -0.97939999999999994 | R344: -0.375 | S344: -0.25 | T344: 2.6471 | U344: 46 | V344: 0.80000000000000004 | W344: 6 | X344: 1.5 | Y344: 1.2128000000000001 | AA344: =(N344+O344+P344+Q344+R344+S344+T344+U344+V344+W344+X344+Y344)/12 -> 4.4984000000000002 | AB344: =(G344+H344+I344+J344+K344+L344+M344+N344+O344+P344+Q344+R344+S344+T344+U344+V344+W344+X344+Y344)/19 -> 2.7292052631578949 | AC344: =(R344+S344)/2 -> -0.3125 | AD344: =(S344+T344)/2 -> 1.19855 | AE344: =(T344+U344)/2 -> 24.323550000000001 | AF344: =(U344+V344)/2 -> 23.399999999999999 | AG344: =(V344+W344)/2 -> 3.3999999999999999 | AH344: =(W344+X344)/2 -> 3.75 | AI344: =(X344+Y344)/2 -> 1.3564000000000001 | AJ344: =STDEV(G344:Y344) -> 11.209914936111376
B345: 600248.SH | C345: 陕西建工 | E345: 0.89500000000000002 | F345: 0.92400000000000004 | G345: -0.22640000000000002 | H345: 0.1313 | I345: 1.8200000000000001e-02 | J345: 0.25079999999999997 | K345: 3.0406999999999997 | L345: 0.54369999999999996 | M345: 0.47460000000000002 | N345: 0.42299999999999999 | O345: -0.47889999999999999 | P345: 9.8299999999999998e-02 | Q345: 0.1469 | R345: 0.37670000000000003 | S345: 5.4100000000000002e-02 | T345: 3.0613999999999999 | U345: 1.1048 | V345: 0.83950000000000002 | W345: 3.2801999999999998 | X345: -0.14230000000000001 | Y345: 1.0745 | AA345: =(N345+O345+P345+Q345+R345+S345+T345+U345+V345+W345+X345+Y345)/12 -> 0.81984999999999986 | AB345: =(G345+H345+I345+J345+K345+L345+M345+N345+O345+P345+Q345+R345+S345+T345+U345+V345+W345+X345+Y345)/19 -> 0.74058421052631573 | AC345: =(R345+S345)/2 -> 0.21540000000000001 | AD345: =(S345+T345)/2 -> 1.55775 | AE345: =(T345+U345)/2 -> 2.0831 | AF345: =(U345+V345)/2 -> 0.97215000000000007 | AG345: =(V345+W345)/2 -> 2.05985 | AH345: =(W345+X345)/2 -> 1.5689499999999998 | AI345: =(X345+Y345)/2 -> 0.46610000000000001 | AJ345: =STDEV(G345:Y345) -> 1.1375894745094206
B346: 000807.SZ | C346: 云铝股份
B347: 000933.SZ | C347: 神火股份
B348: 002039.SZ | C348: 黔源电力 | G348: -1.0665 | H348: -0.54020000000000001 | I348: 0.78569999999999995 | J348: 1.4716999999999998 | K348: 6.1260000000000003 | L348: 1.9715 | M348: -0.15140000000000001 | N348: 0.14800000000000002 | O348: -0.65590000000000004 | P348: -0.3296 | Q348: -2.4e-02 | R348: -0.2109 | S348: 6.5401999999999996 | T348: 0.70489999999999997 | U348: 0.58310000000000006 | V348: 0.52869999999999995 | W348: -0.14679999999999999 | X348: -0.29350000000000004 | Y348: -0.30549999999999999 | AA348: =(N348+O348+P348+Q348+R348+S348+T348+U348+V348+W348+X348+Y348)/12 -> 0.54489166666666666 | AB348: =(G348+H348+I348+J348+K348+L348+M348+N348+O348+P348+Q348+R348+S348+T348+U348+V348+W348+X348+Y348)/19 -> 0.79660526315789471 | AC348: =(R348+S348)/2 -> 3.16465 | AD348: =(S348+T348)/2 -> 3.6225499999999999 | AE348: =(T348+U348)/2 -> 0.64400000000000002 | AF348: =(U348+V348)/2 -> 0.55590000000000006 | AG348: =(V348+W348)/2 -> 0.19094999999999998 | AH348: =(W348+X348)/2 -> -0.22015000000000001 | AI348: =(X348+Y348)/2 -> -0.29949999999999999 | AJ348: =STDEV(G348:Y348) -> 2.0855389230161121
B349: 002444.SZ | C349: 巨星科技
B350: 002918.SZ | C350: 蒙娜丽莎
B351: 600183.SH | C351: 生益科技
B352: 600660.SH | C352: 福耀玻璃
B353: 001203.SZ | C353: 大中矿业 | V353: 0.39390000000000003 | W353: 5.75 | X353: 7.125 | Y353: 3.04 | AA353: =(N353+O353+P353+Q353+R353+S353+T353+U353+V353+W353+X353+Y353)/12 -> 1.359075 | AB353: =(G353+H353+I353+J353+K353+L353+M353+N353+O353+P353+Q353+R353+S353+T353+U353+V353+W353+X353+Y353)/19 -> 0.85836315789473694 | AC353: =(R353+S353)/2 -> 0 | AD353: =(S353+T353)/2 -> 0 | AE353: =(T353+U353)/2 -> 0 | AF353: =(U353+V353)/2 -> 0.19695000000000001 | AG353: =(V353+W353)/2 -> 3.0719500000000002 | AH353: =(W353+X353)/2 -> 6.4375 | AI353: =(X353+Y353)/2 -> 5.0824999999999996 | AJ353: =STDEV(G353:Y353) -> 2.98495267452713
B354: 001234.SZ | C354: 泰慕士 | E354: 0.21390000000000001 | F354: 0.755 | X354: 0.17999999999999999 | Y354: 0.31170000000000003 | AA354: =(N354+O354+P354+Q354+R354+S354+T354+U354+V354+W354+X354+Y354)/12 -> 4.0975000000000004e-02 | AB354: =(G354+H354+I354+J354+K354+L354+M354+N354+O354+P354+Q354+R354+S354+T354+U354+V354+W354+X354+Y354)/19 -> 2.5878947368421053e-02 | AC354: =(R354+S354)/2 -> 0 | AD354: =(S354+T354)/2 -> 0 | AE354: =(T354+U354)/2 -> 0 | AF354: =(U354+V354)/2 -> 0 | AG354: =(V354+W354)/2 -> 0 | AH354: =(W354+X354)/2 -> 8.9999999999999997e-02 | AI354: =(X354+Y354)/2 -> 0.24585000000000001 | AJ354: =STDEV(G354:Y354) -> 9.3125963082268337e-02
B355: 002407.SZ | C355: 多氟多 | G355: -0.38890000000000002 | H355: -0.40000000000000002 | I355: -0.45000000000000001 | J355: -0.46049999999999996 | K355: 9.0899999999999995e-02 | L355: -0.16670000000000001 | M355: -0.21210000000000001 | N355: -0.75609999999999999 | O355: -0.4592 | P355: -0.35899999999999999 | Q355: -0.42310000000000003 | R355: -7 | S355: -0.97230000000000005 | T355: -0.8206 | U355: -0.86670000000000003 | V355: 1.1167 | W355: 73.555599999999998 | X355: 17.6435 | Y355: 49.5 | AA355: =(N355+O355+P355+Q355+R355+S355+T355+U355+V355+W355+X355+Y355)/12 -> 10.846566666666666 | AB355: =(G355+H355+I355+J355+K355+L355+M355+N355+O355+P355+Q355+R355+S355+T355+U355+V355+W355+X355+Y355)/19 -> 6.7458684210526307 | AC355: =(R355+S355)/2 -> -3.9861499999999999 | AD355: =(S355+T355)/2 -> -0.89644999999999997 | AE355: =(T355+U355)/2 -> -0.84365000000000001 | AF355: =(U355+V355)/2 -> 0.125 | AG355: =(V355+W355)/2 -> 37.336149999999996 | AH355: =(W355+X355)/2 -> 45.599550000000001 | AI355: =(X355+Y355)/2 -> 33.571750000000002 | AJ355: =STDEV(G355:Y355) -> 20.223549991616007
B356: 600075.SH | C356: 新疆天业
B357: 600919.SH | C357: 江苏银行
B358: 600997.SH | C358: 开滦股份
B359: 603005.SH | C359: 晶方科技
B360: 603230.SH | C360: 内蒙新华 | Y360: 7.4499999999999997e-02 | AA360: =(N360+O360+P360+Q360+R360+S360+T360+U360+V360+W360+X360+Y360)/12 -> 6.2083333333333331e-03 | AB360: =(G360+H360+I360+J360+K360+L360+M360+N360+O360+P360+Q360+R360+S360+T360+U360+V360+W360+X360+Y360)/19 -> 3.9210526315789475e-03 | AC360: =(R360+S360)/2 -> 0 | AD360: =(S360+T360)/2 -> 0 | AE360: =(T360+U360)/2 -> 0 | AF360: =(U360+V360)/2 -> 0 | AG360: =(V360+W360)/2 -> 0 | AH360: =(W360+X360)/2 -> 0 | AI360: =(X360+Y360)/2 -> 3.7249999999999998e-02 | AJ360: =STDEV(G360:Y360) -> #DIV/0!
B361: 605358.SH | C361: 立昂微 | E361: 0.6522 | F361: 0.88400000000000001 | T361: -4.5499999999999999e-02 | U361: 0.20000000000000001 | V361: 0.52780000000000005 | W361: 1.1111 | X361: 1.4762 | Y361: 1.8056000000000001 | AA361: =(N361+O361+P361+Q361+R361+S361+T361+U361+V361+W361+X361+Y361)/12 -> 0.42293333333333338 | AB361: =(G361+H361+I361+J361+K361+L361+M361+N361+O361+P361+Q361+R361+S361+T361+U361+V361+W361+X361+Y361)/19 -> 0.26711578947368425 | AC361: =(R361+S361)/2 -> 0 | AD361: =(S361+T361)/2 -> -2.2749999999999999e-02 | AE361: =(T361+U361)/2 -> 7.7250000000000013e-02 | AF361: =(U361+V361)/2 -> 0.3639 | AG361: =(V361+W361)/2 -> 0.81945000000000001 | AH361: =(W361+X361)/2 -> 1.29365 | AI361: =(X361+Y361)/2 -> 1.6409 | AJ361: =STDEV(G361:Y361) -> 0.73506483977038839 | AX361: -0.25019999999999998 | AY361: 0.17319999999999999 | AZ361: -0.21739999999999998 | BA361: 0.2291 | BB361: 0.68989999999999996 | BC361: 0.48280000000000001 | BE361: =(AR361+AS361+AT361+AU361+AV361+AW361+AX361+AY361+AZ361+BA361+BB361+BC361)/12 -> 9.2283333333333328e-02 | BF361: =(AK361+AL361+AM361+AN361+AO361+AP361+AQ361+AR361+AS361+AT361+AU361+AV361+AV361+AW361+AX361+AY361+AZ361+BA361+BB361+BC361)/19 -> 5.8284210526315786e-02 | BG361: =(AV361+AW361)/2 -> 0 | BH361: =(AW361+AX361)/2 -> -0.12509999999999999 | BI361: =(AX361+AY361)/2 -> -3.8499999999999993e-02 | BJ361: =(AY361+AZ361)/2 -> -2.2099999999999995e-02 | BK361: =(AZ361+BA361)/2 -> 5.850000000000008e-03 | BL361: =(BA361+BB361)/2 -> 0.45949999999999996 | BM361: =(BB361+BC361)/2 -> 0.58634999999999993 | BN361: =STDEV(AK361:BC361) -> 0.3733675329573618
B362: 600456.SH | C362: 宝钛股份
B363: 603109.SH | C363: 神驰机电 | E363: 0.43829999999999997 | F363: 1.006 | Q363: -0.19010000000000002 | R363: -0.20199999999999999 | S363: 0.2727 | T363: -0.2238 | U363: -0.1537 | V363: -0.28620000000000001 | W363: 1.2143000000000002 | X363: 0.6663 | Y363: 0.52659999999999996 | AA363: =(N363+O363+P363+Q363+R363+S363+T363+U363+V363+W363+X363+Y363)/12 -> 0.13534166666666667 | AB363: =(G363+H363+I363+J363+K363+L363+M363+N363+O363+P363+Q363+R363+S363+T363+U363+V363+W363+X363+Y363)/19 -> 8.5478947368421057e-02 | AC363: =(R363+S363)/2 -> 3.5350000000000006e-02 | AD363: =(S363+T363)/2 -> 2.445e-02 | AE363: =(T363+U363)/2 -> -0.18875 | AF363: =(U363+V363)/2 -> -0.21995000000000001 | AG363: =(V363+W363)/2 -> 0.46405000000000007 | AH363: =(W363+X363)/2 -> 0.94030000000000014 | AI363: =(X363+Y363)/2 -> 0.59644999999999992 | AJ363: =STDEV(G363:Y363) -> 0.52555182216198038
B364: 000951.SZ | C364: 中国重汽
B365: 002241.SZ | C365: 歌尔股份 | E365: 0.53170000000000006 | F365: 1 | G365: -0.23079999999999998 | H365: 0.4375 | I365: 0.29410000000000003 | J365: 0.25929999999999997 | K365: -0.40000000000000002 | L365: -0.39130000000000004 | M365: -0.40909999999999996 | N365: -0.60289999999999999 | O365: 0 | P365: 0.1429 | Q365: 0.1923 | R365: 0.48149999999999998 | S365: 0.5 | T365: 0.5625 | U365: 1.0323 | V365: 1.2250000000000001 | W365: 2.2222 | X365: 1.0800000000000001 | Y365: 0.58729999999999993 | AA365: =(N365+O365+P365+Q365+R365+S365+T365+U365+V365+W365+X365+Y365)/12 -> 0.61859166666666676 | AB365: =(G365+H365+I365+J365+K365+L365+M365+N365+O365+P365+Q365+R365+S365+T365+U365+V365+W365+X365+Y365)/19 -> 0.36751578947368424 | AC365: =(R365+S365)/2 -> 0.49075000000000002 | AD365: =(S365+T365)/2 -> 0.53125 | AE365: =(T365+U365)/2 -> 0.7974 | AF365: =(U365+V365)/2 -> 1.1286499999999999 | AG365: =(V365+W365)/2 -> 1.7236 | AH365: =(W365+X365)/2 -> 1.6511 | AI365: =(X365+Y365)/2 -> 0.83365 | AJ365: =STDEV(G365:Y365) -> 0.68910144654160399
B366: 002493.SZ | C366: 荣盛石化
B367: 002732.SZ | C367: 燕塘乳业
B368: 000895.SZ | C368: 双汇发展
B369: 600507.SH | C369: 方大特钢 | G369: 3.2999999999999998 | H369: 1.6499999999999999 | I369: 2.3266 | J369: 2.8399999999999999 | K369: 0.9534999999999999 | L369: 0.81129999999999991 | M369: 0.42979999999999996 | N369: 8.3299999999999999e-02 | O369: -0.23809999999999998 | P369: -0.23960000000000001 | Q369: -0.46990000000000004 | R369: -0.62020000000000008 | S369: -0.59379999999999999 | T369: -0.47950000000000004 | U369: -7.9500000000000001e-02 | V369: 0.25319999999999998 | W369: 1 | X369: 0.81579999999999997 | Y369: 0.22589999999999999 | AA369: =(N369+O369+P369+Q369+R369+S369+T369+U369+V369+W369+X369+Y369)/12 -> -2.8533333333333345e-02 | AB369: =(G369+H369+I369+J369+K369+L369+M369+N369+O369+P369+Q369+R369+S369+T369+U369+V369+W369+X369+Y369)/19 -> 0.62993684210526302 | AC369: =(R369+S369)/2 -> -0.60699999999999998 | AD369: =(S369+T369)/2 -> -0.53665000000000007 | AE369: =(T369+U369)/2 -> -0.27950000000000003 | AF369: =(U369+V369)/2 -> 8.6849999999999983e-02 | AG369: =(V369+W369)/2 -> 0.62660000000000005 | AH369: =(W369+X369)/2 -> 0.90789999999999993 | AI369: =(X369+Y369)/2 -> 0.52085000000000004 | AJ369: =STDEV(G369:Y369) -> 1.164275640430815
B370: 002919.SZ | C370: 名臣健康
B371: 600535.SH | C371: 天士力
B372: 603613.SH | C372: 国联股份 | E372: 0.47110000000000002 | F372: 1.6699999999999999 | N372: 0.50850000000000006 | O372: 1.1000000000000001 | P372: 0.5897 | Q372: 0.5 | R372: 2.2499999999999999e-02 | S372: 0.38100000000000001 | T372: -9.6799999999999997e-02 | U372: 1.15e-02 | V372: 0.61539999999999995 | W372: 0.13789999999999999 | X372: 0.125 | Y372: 0.125 | AA372: =(N372+O372+P372+Q372+R372+S372+T372+U372+V372+W372+X372+Y372)/12 -> 0.33497500000000002 | AB372: =(G372+H372+I372+J372+K372+L372+M372+N372+O372+P372+Q372+R372+S372+T372+U372+V372+W372+X372+Y372)/19 -> 0.21156315789473687 | AC372: =(R372+S372)/2 -> 0.20175000000000001 | AD372: =(S372+T372)/2 -> 0.1421 | AE372: =(T372+U372)/2 -> -4.265e-02 | AF372: =(U372+V372)/2 -> 0.31344999999999995 | AG372: =(V372+W372)/2 -> 0.37664999999999998 | AH372: =(W372+X372)/2 -> 0.13145000000000001 | AI372: =(X372+Y372)/2 -> 0.125 | AJ372: =STDEV(G372:Y372) -> 0.34430069343525871
B373: 603893.SH | C373: 瑞芯微 | P373: 0.28570000000000001 | Q373: -2.86e-02 | R373: 5.7699999999999994e-02 | S373: 3 | T373: 0.27779999999999999 | U373: 0.38240000000000002 | V373: 0.43640000000000001 | W373: 2.375 | X373: 1.7826 | Y373: 1.1064000000000001 | AA373: =(N373+O373+P373+Q373+R373+S373+T373+U373+V373+W373+X373+Y373)/12 -> 0.80628333333333346 | AB373: =(G373+H373+I373+J373+K373+L373+M373+N373+O373+P373+Q373+R373+S373+T373+U373+V373+W373+X373+Y373)/19 -> 0.50923157894736848 | AC373: =(R373+S373)/2 -> 1.52885 | AD373: =(S373+T373)/2 -> 1.6389 | AE373: =(T373+U373)/2 -> 0.3301 | AF373: =(U373+V373)/2 -> 0.40939999999999999 | AG373: =(V373+W373)/2 -> 1.4056999999999999 | AH373: =(W373+X373)/2 -> 2.0788000000000002 | AI373: =(X373+Y373)/2 -> 1.4445000000000001 | AJ373: =STDEV(G373:Y373) -> 1.0635731967706261
B374: 605003.SH | C374: 众望布艺
B375: 605028.SH | C375: 世茂能源 | V375: 0.42249999999999999 | W375: 1.3077000000000001 | X375: 1.0293999999999999 | Y375: 0.86790000000000012 | AA375: =(N375+O375+P375+Q375+R375+S375+T375+U375+V375+W375+X375+Y375)/12 -> 0.30229166666666668 | AB375: =(G375+H375+I375+J375+K375+L375+M375+N375+O375+P375+Q375+R375+S375+T375+U375+V375+W375+X375+Y375)/19 -> 0.19092105263157894 | AC375: =(R375+S375)/2 -> 0 | AD375: =(S375+T375)/2 -> 0 | AE375: =(T375+U375)/2 -> 0 | AF375: =(U375+V375)/2 -> 0.21124999999999999 | AG375: =(V375+W375)/2 -> 0.86509999999999998 | AH375: =(W375+X375)/2 -> 1.16855 | AI375: =(X375+Y375)/2 -> 0.94864999999999999 | AJ375: =STDEV(G375:Y375) -> 0.37050022379660358
B376: 600618.SH | C376: 氯碱化工 | G376: 5.1707000000000001 | H376: 19.252300000000002 | I376: 13.9825 | J376: 4.0256999999999996 | K376: 1.9012 | L376: 0.47619999999999996 | M376: 0.11560000000000001 | N376: 6.08e-02 | O376: 0.33240000000000003 | P376: 0.23980000000000001 | Q376: -6.3399999999999998e-02 | R376: -0.2298 | S376: -0.61039999999999994 | T376: -0.68049999999999999 | U376: -0.46250000000000002 | V376: -0.252 | W376: 2.9213 | X376: 3.5462000000000002 | Y376: 2.3819999999999997 | AA376: =(N376+O376+P376+Q376+R376+S376+T376+U376+V376+W376+X376+Y376)/12 -> 0.59865833333333329 | AB376: =(G376+H376+I376+J376+K376+L376+M376+N376+O376+P376+Q376+R376+S376+T376+U376+V376+W376+X376+Y376)/19 -> 2.7425315789473688 | AC376: =(R376+S376)/2 -> -0.42009999999999997 | AD376: =(S376+T376)/2 -> -0.64544999999999997 | AE376: =(T376+U376)/2 -> -0.57150000000000001 | AF376: =(U376+V376)/2 -> -0.35725000000000001 | AG376: =(V376+W376)/2 -> 1.3346499999999999 | AH376: =(W376+X376)/2 -> 3.2337500000000001 | AI376: =(X376+Y376)/2 -> 2.9641000000000002 | AJ376: =STDEV(G376:Y376) -> 5.2608374429523668
B377: 603822.SH | C377: 嘉澳环保 | E377: 0.59920000000000007 | F377: 0.97499999999999998 | G377: -0.32850000000000001 | H377: -0.19800000000000001 | I377: -3.4300000000000004e-02 | J377: 8.9700000000000002e-02 | K377: 0.97659999999999991 | L377: 0.76989999999999992 | M377: 0.34759999999999996 | N377: 5.4199999999999998e-02 | O377: -0.40369999999999995 | P377: 0.1085 | Q377: 0.1202 | R377: 0.15679999999999999 | S377: 0.36259999999999998 | T377: -0.29549999999999998 | U377: -0.2782 | V377: -0.40240000000000004 | W377: 1.9750999999999999 | X377: 0.96450000000000002 | Y377: 1.2065999999999999 | AA377: =(N377+O377+P377+Q377+R377+S377+T377+U377+V377+W377+X377+Y377)/12 -> 0.29739166666666667 | AB377: =(G377+H377+I377+J377+K377+L377+M377+N377+O377+P377+Q377+R377+S377+T377+U377+V377+W377+X377+Y377)/19 -> 0.27324736842105257 | AC377: =(R377+S377)/2 -> 0.25969999999999999 | AD377: =(S377+T377)/2 -> 3.3549999999999996e-02 | AE377: =(T377+U377)/2 -> -0.28684999999999999 | AF377: =(U377+V377)/2 -> -0.34030000000000005 | AG377: =(V377+W377)/2 -> 0.78634999999999988 | AH377: =(W377+X377)/2 -> 1.4698 | AI377: =(X377+Y377)/2 -> 1.08555 | AJ377: =STDEV(G377:Y377) -> 0.63975001573394186
B378: 000636.SZ | C378: 风华高科
B379: 002636.SZ | C379: 金安国纪
B380: 002870.SZ | C380: 香山股份 | G380: 0.38890000000000002 | H380: 0.14999999999999999 | I380: -0.18989999999999999 | J380: -0.42399999999999999 | K380: -0.80000000000000004 | L380: -0.73909999999999998 | M380: -0.67189999999999994 | N380: -0.51390000000000002 | O380: 0.40000000000000002 | P380: 0.5 | Q380: 0.42859999999999998 | R380: -2.6856999999999998 | S380: -0.42859999999999998 | T380: 5.5599999999999997e-02 | U380: 0.5 | V380: 2.1524999999999999 | W380: 7.25 | X380: 2.5789 | Y380: 1.1778 | AA380: =(N380+O380+P380+Q380+R380+S380+T380+U380+V380+W380+X380+Y380)/12 -> 0.9512666666666667 | AB380: =(G380+H380+I380+J380+K380+L380+M380+N380+O380+P380+Q380+R380+S380+T380+U380+V380+W380+X380+Y380)/19 -> 0.48048421052631574 | AC380: =(R380+S380)/2 -> -1.5571499999999998 | AD380: =(S380+T380)/2 -> -0.1865 | AE380: =(T380+U380)/2 -> 0.27779999999999999 | AF380: =(U380+V380)/2 -> 1.3262499999999999 | AG380: =(V380+W380)/2 -> 4.7012499999999999 | AH380: =(W380+X380)/2 -> 4.9144500000000004 | AI380: =(X380+Y380)/2 -> 1.87835 | AJ380: =STDEV(G380:Y380) -> 1.9913998770443864
B381: 002884.SZ | C381: 凌霄泵业 | E381: 0.10189999999999999 | F381: 0.97999999999999998 | H381: -0.3543 | I381: -0.32469999999999999 | J381: -0.31010000000000004 | K381: -0.50770000000000004 | L381: -0.41830000000000001 | M381: -0.38929999999999998 | N381: -0.36520000000000002 | O381: 0.5 | P381: 0.15509999999999999 | Q381: 0.13750000000000001 | R381: 0.10619999999999999 | S381: -0.39579999999999999 | T381: -0.12890000000000001 | U381: -0.12089999999999999 | V381: 0.17600000000000002 | W381: 0.2414 | X381: 0.22920000000000001 | Y381: 0.22500000000000001 | AA381: =(N381+O381+P381+Q381+R381+S381+T381+U381+V381+W381+X381+Y381)/12 -> 6.3299999999999995e-02 | AB381: =(G381+H381+I381+J381+K381+L381+M381+N381+O381+P381+Q381+R381+S381+T381+U381+V381+W381+X381+Y381)/19 -> -8.1305263157894728e-02 | AC381: =(R381+S381)/2 -> -0.14479999999999998 | AD381: =(S381+T381)/2 -> -0.26234999999999997 | AE381: =(T381+U381)/2 -> -0.12490000000000001 | AF381: =(U381+V381)/2 -> 2.7550000000000012e-02 | AG381: =(V381+W381)/2 -> 0.2087 | AH381: =(W381+X381)/2 -> 0.23530000000000001 | AI381: =(X381+Y381)/2 -> 0.22710000000000002 | AJ381: =STDEV(G381:Y381) -> 0.3064733066882307
B382: 002980.SZ | C382: 华盛昌
B383: 600019.SH | C383: 宝钢股份
B384: 603939.SH | C384: 益丰药房
B385: 605277.SH | C385: 新亚电子 | T385: 0.10640000000000001 | U385: 0.11269999999999999 | V385: 0.10189999999999999 | W385: 0.5 | X385: 0.28850000000000003 | Y385: 0.24050000000000002 | AA385: =(N385+O385+P385+Q385+R385+S385+T385+U385+V385+W385+X385+Y385)/12 -> 0.11249999999999999 | AB385: =(G385+H385+I385+J385+K385+L385+M385+N385+O385+P385+Q385+R385+S385+T385+U385+V385+W385+X385+Y385)/19 -> 7.1052631578947367e-02 | AC385: =(R385+S385)/2 -> 0 | AD385: =(S385+T385)/2 -> 5.3200000000000004e-02 | AE385: =(T385+U385)/2 -> 0.10955000000000001 | AF385: =(U385+V385)/2 -> 0.10729999999999999 | AG385: =(V385+W385)/2 -> 0.30095 | AH385: =(W385+X385)/2 -> 0.39424999999999999 | AI385: =(X385+Y385)/2 -> 0.26450000000000001 | AJ385: =STDEV(G385:Y385) -> 0.15603099692048372
B386: 003005.SZ | C386: 竞业达
B387: 000949.SZ | C387: 新乡化纤
B388: 603508.SH | C388: 思维列控 | E388: 5.4800000000000001e-02 | F388: 0.96299999999999997 | G388: -0.1333 | H388: 4.4400000000000002e-02 | I388: -5.9699999999999996e-02 | J388: -0.29909999999999998 | K388: 0.3846 | L388: 0.31909999999999999 | M388: 0.33329999999999999 | N388: 0.42680000000000001 | O388: 9.25 | P388: 3.3548 | Q388: 2.3094999999999999 | R388: 1.5213999999999999 | S388: -0.8698999999999999 | T388: -0.81849999999999989 | U388: -0.76260000000000006 | V388: -1.7322 | W388: -0.25 | X388: 0.51019999999999999 | Y388: 0.46970000000000001 | AA388: =(N388+O388+P388+Q388+R388+S388+T388+U388+V388+W388+X388+Y388)/12 -> 1.1174333333333333 | AB388: =(G388+H388+I388+J388+K388+L388+M388+N388+O388+P388+Q388+R388+S388+T388+U388+V388+W388+X388+Y388)/19 -> 0.73676315789473656 | AC388: =(R388+S388)/2 -> 0.32574999999999998 | AD388: =(S388+T388)/2 -> -0.84419999999999984 | AE388: =(T388+U388)/2 -> -0.79054999999999997 | AF388: =(U388+V388)/2 -> -1.2474000000000001 | AG388: =(V388+W388)/2 -> -0.99109999999999998 | AH388: =(W388+X388)/2 -> 0.13009999999999999 | AI388: =(X388+Y388)/2 -> 0.48995 | AJ388: =STDEV(G388:Y388) -> 2.3612611087228901 | AK388: -0.18410000000000001 | AL388: -0.18190000000000001 | AM388: -1.9e-02 | AN388: -0.154 | AO388: -0.12130000000000001 | AP388: -4.7199999999999999e-02 | AQ388: -7.9299999999999995e-02 | AR388: 7.4999999999999997e-03 | AS388: -2.0000000000000001e-04 | AT388: 0.54520000000000002 | AU388: 0.65349999999999997 | AV388: 0.83160000000000001 | AW388: 1.52e-02 | AX388: -0.37939999999999996 | AY388: -0.41729999999999995 | AZ388: -0.35909999999999997 | BA388: -8.6699999999999999e-02 | BB388: -6.4000000000000003e-03 | BC388: 2.1299999999999999e-02 | BE388: =(AR388+AS388+AT388+AU388+AV388+AW388+AX388+AY388+AZ388+BA388+BB388+BC388)/12 -> 6.876666666666667e-02 | BF388: =(AK388+AL388+AM388+AN388+AO388+AP388+AQ388+AR388+AS388+AT388+AU388+AV388+AV388+AW388+AX388+AY388+AZ388+BA388+BB388+BC388)/19 -> 4.5789473684210526e-02 | BG388: =(AV388+AW388)/2 -> 0.4234 | BH388: =(AW388+AX388)/2 -> -0.18209999999999998 | BI388: =(AX388+AY388)/2 -> -0.39834999999999998 | BJ388: =(AY388+AZ388)/2 -> -0.38819999999999999 | BK388: =(AZ388+BA388)/2 -> -0.22289999999999999 | BL388: =(BA388+BB388)/2 -> -4.6550000000000001e-02 | BM388: =(BB388+BC388)/2 -> 7.45e-03 | BN388: =STDEV(AK388:BC388) -> 0.3321151918284902
B389: 603948.SH | C389: 建业股份 | R389: -0.27879999999999999 | S389: -0.36359999999999998 | T389: -0.30299999999999999 | U389: -0.29210000000000003 | V389: -0.31090000000000001 | W389: 0.66670000000000007 | X389: 0.4783 | Y389: 0.53969999999999996 | AA389: =(N389+O389+P389+Q389+R389+S389+T389+U389+V389+W389+X389+Y389)/12 -> 1.1358333333333337e-02 | AB389: =(G389+H389+I389+J389+K389+L389+M389+N389+O389+P389+Q389+R389+S389+T389+U389+V389+W389+X389+Y389)/19 -> 7.1736842105263173e-03 | AC389: =(R389+S389)/2 -> -0.32119999999999999 | AD389: =(S389+T389)/2 -> -0.33329999999999999 | AE389: =(T389+U389)/2 -> -0.29754999999999998 | AF389: =(U389+V389)/2 -> -0.30149999999999999 | AG389: =(V389+W389)/2 -> 0.17790000000000003 | AH389: =(W389+X389)/2 -> 0.57250000000000001 | AI389: =(X389+Y389)/2 -> 0.50900000000000001 | AJ389: =STDEV(G389:Y389) -> 0.45449159645696419
B390: 600707.SH | C390: 彩虹股份
B391: 000959.SZ | C391: 首钢股份 | G391: 1.7464 | H391: 56.871000000000002 | I391: 11.8649 | J391: 4.5132000000000003 | K391: 1.6e-02 | L391: 0.50109999999999999 | M391: 0.21460000000000001 | N391: 8.7300000000000003e-02 | O391: -0.45700000000000002 | P391: -0.34649999999999997 | Q391: -0.46649999999999997 | R391: -0.50680000000000003 | S391: -0.27800000000000002 | T391: -0.43810000000000004 | U391: 1.8500000000000003e-02 | V391: 0.50690000000000002 | W391: 4.2754000000000003 | X391: 5.0606999999999998 | Y391: 3.3793000000000002 | AA391: =(N391+O391+P391+Q391+R391+S391+T391+U391+V391+W391+X391+Y391)/12 -> 0.90293333333333337 | AB391: =(G391+H391+I391+J391+K391+L391+M391+N391+O391+P391+Q391+R391+S391+T391+U391+V391+W391+X391+Y391)/19 -> 4.5559157894736844 | AC391: =(R391+S391)/2 -> -0.39240000000000003 | AD391: =(S391+T391)/2 -> -0.35805000000000003 | AE391: =(T391+U391)/2 -> -0.20980000000000001 | AF391: =(U391+V391)/2 -> 0.26269999999999999 | AG391: =(V391+W391)/2 -> 2.3911500000000001 | AH391: =(W391+X391)/2 -> 4.66805 | AI391: =(X391+Y391)/2 -> 4.2199999999999998 | AJ391: =STDEV(G391:Y391) -> 13.040702712586855
B392: 001205.SZ | C392: 盛航股份 | E392: 0.21590000000000001 | F392: 0.96099999999999997 | V392: 0.72370000000000001 | W392: 0.24359999999999998 | X392: 0.31230000000000002 | Y392: 9.2899999999999996e-02 | AA392: =(N392+O392+P392+Q392+R392+S392+T392+U392+V392+W392+X392+Y392)/12 -> 0.114375 | AB392: =(G392+H392+I392+J392+K392+L392+M392+N392+O392+P392+Q392+R392+S392+T392+U392+V392+W392+X392+Y392)/19 -> 7.2236842105263155e-02 | AC392: =(R392+S392)/2 -> 0 | AD392: =(S392+T392)/2 -> 0 | AE392: =(T392+U392)/2 -> 0 | AF392: =(U392+V392)/2 -> 0.36185 | AG392: =(V392+W392)/2 -> 0.48365000000000002 | AH392: =(W392+X392)/2 -> 0.27795000000000003 | AI392: =(X392+Y392)/2 -> 0.2026 | AJ392: =STDEV(G392:Y392) -> 0.26975624027381956
B393: 001209.SZ | C393: 洪兴股份 | V393: 0.46149999999999997 | W393: 0.30559999999999998 | X393: 0 | Y393: -0.15039999999999998 | AA393: =(N393+O393+P393+Q393+R393+S393+T393+U393+V393+W393+X393+Y393)/12 -> 5.1391666666666662e-02 | AB393: =(G393+H393+I393+J393+K393+L393+M393+N393+O393+P393+Q393+R393+S393+T393+U393+V393+W393+X393+Y393)/19 -> 3.2457894736842102e-02 | AC393: =(R393+S393)/2 -> 0 | AD393: =(S393+T393)/2 -> 0 | AE393: =(T393+U393)/2 -> 0 | AF393: =(U393+V393)/2 -> 0.23074999999999998 | AG393: =(V393+W393)/2 -> 0.38354999999999995 | AH393: =(W393+X393)/2 -> 0.15279999999999999 | AI393: =(X393+Y393)/2 -> -7.5199999999999989e-02 | AJ393: =STDEV(G393:Y393) -> 0.27923350294451893
B394: 003027.SZ | C394: 同兴环保 | T394: -0.27050000000000002 | U394: 7.6499999999999999e-02 | V394: -9.5399999999999985e-02 | W394: 9.0899999999999995e-02 | X394: -0.29210000000000003 | Y394: -0.47539999999999999 | AA394: =(N394+O394+P394+Q394+R394+S394+T394+U394+V394+W394+X394+Y394)/12 -> -8.0500000000000002e-02 | AB394: =(G394+H394+I394+J394+K394+L394+M394+N394+O394+P394+Q394+R394+S394+T394+U394+V394+W394+X394+Y394)/19 -> -5.084210526315789e-02 | AC394: =(R394+S394)/2 -> 0 | AD394: =(S394+T394)/2 -> -0.13525000000000001 | AE394: =(T394+U394)/2 -> -9.7000000000000003e-02 | AF394: =(U394+V394)/2 -> -9.4499999999999931e-03 | AG394: =(V394+W394)/2 -> -2.2499999999999951e-03 | AH394: =(W394+X394)/2 -> -0.10060000000000002 | AI394: =(X394+Y394)/2 -> -0.38375000000000004 | AJ394: =STDEV(G394:Y394) -> 0.22458318726031118
B395: 603008.SH | C395: 喜临门 | E395: 0.56700000000000006 | F395: 0.95999999999999996 | G395: 0.22219999999999998 | H395: 0.20000000000000001 | I395: 0.13039999999999999 | J395: 0.21309999999999998 | K395: 0.2727 | L395: 0.29170000000000001 | M395: -0.23079999999999998 | N395: -2.5269999999999997 | O395: -0.57140000000000002 | P395: 0.2581 | Q395: 0.82499999999999996 | R395: 1.8673 | S395: -3.3332999999999999 | T395: -0.71790000000000009 | U395: -0.36990000000000001 | V395: -0.1837 | W395: 2.5713999999999997 | X395: 4.0908999999999995 | Y395: 1.087 | AA395: =(N395+O395+P395+Q395+R395+S395+T395+U395+V395+W395+X395+Y395)/12 -> 0.2497083333333332 | AB395: =(G395+H395+I395+J395+K395+L395+M395+N395+O395+P395+Q395+R395+S395+T395+U395+V395+W395+X395+Y395)/19 -> 0.21556842105263155 | AC395: =(R395+S395)/2 -> -0.73299999999999998 | AD395: =(S395+T395)/2 -> -2.0255999999999998 | AE395: =(T395+U395)/2 -> -0.54390000000000005 | AF395: =(U395+V395)/2 -> -0.27679999999999999 | AG395: =(V395+W395)/2 -> 1.1938499999999999 | AH395: =(W395+X395)/2 -> 3.3311499999999996 | AI395: =(X395+Y395)/2 -> 2.5889499999999996 | AJ395: =STDEV(G395:Y395) -> 1.6116560482423838
B396: 603738.SH | C396: 泰晶科技 | E396: 0.27360000000000001 | F396: 0.86099999999999999 | G396: 0 | H396: -0.62 | I396: -0.39130000000000004 | J396: -0.3594 | K396: -0.43140000000000001 | L396: -0.10529999999999999 | M396: -7.1399999999999991e-02 | N396: -0.439 | O396: -1.0942000000000001 | P396: -0.8234999999999999 | Q396: -0.84620000000000006 | R396: -0.69569999999999999 | S396: -7 | T396: 0 | U396: 0.75 | V396: 2.2856999999999998 | W396: 4.6667000000000005 | X396: 17.333299999999998 | Y396: 12.714300000000001 | AA396: =(N396+O396+P396+Q396+R396+S396+T396+U396+V396+W396+X396+Y396)/12 -> 2.2376166666666664 | AB396: =(G396+H396+I396+J396+K396+L396+M396+N396+O396+P396+Q396+R396+S396+T396+U396+V396+W396+X396+Y396)/19 -> 1.3090842105263156 | AC396: =(R396+S396)/2 -> -3.8478500000000002 | AD396: =(S396+T396)/2 -> -3.5 | AE396: =(T396+U396)/2 -> 0.375 | AF396: =(U396+V396)/2 -> 1.5178499999999999 | AG396: =(V396+W396)/2 -> 3.4762000000000004 | AH396: =(W396+X396)/2 -> 11 | AI396: =(X396+Y396)/2 -> 15.0238 | AJ396: =STDEV(G396:Y396) -> 5.3241513392864528 | AK396: 0.39329999999999998 | AL396: 6.0700000000000004e-02 | AM396: 0.22270000000000001 | AN396: 0.38109999999999999 | AO396: 0.29239999999999999 | AP396: 0.36130000000000001 | AQ396: 0.29820000000000002 | AR396: 4.6399999999999997e-02 | AS396: 9.5799999999999996e-02 | AT396: -2.0899999999999998e-02 | AU396: -2.0299999999999999e-02 | AV396: -0.1298 | AW396: -0.29189999999999999 | AX396: -5.62e-02 | AY396: 1.24e-02 | AZ396: 4.2900000000000001e-02 | BA396: 0.81659999999999999 | BB396: 0.49409999999999998 | BC396: 0.44829999999999998 | BE396: =(AR396+AS396+AT396+AU396+AV396+AW396+AX396+AY396+AZ396+BA396+BB396+BC396)/12 -> 0.11978333333333334 | BF396: =(AK396+AL396+AM396+AN396+AO396+AP396+AQ396+AR396+AS396+AT396+AU396+AV396+AV396+AW396+AX396+AY396+AZ396+BA396+BB396+BC396)/19 -> 0.17459473684210525 | BG396: =(AV396+AW396)/2 -> -0.21084999999999998 | BH396: =(AW396+AX396)/2 -> -0.17404999999999998 | BI396: =(AX396+AY396)/2 -> -2.1899999999999999e-02 | BJ396: =(AY396+AZ396)/2 -> 2.7650000000000001e-02 | BK396: =(AZ396+BA396)/2 -> 0.42975000000000002 | BL396: =(BA396+BB396)/2 -> 0.65534999999999999 | BM396: =(BB396+BC396)/2 -> 0.47119999999999995 | BN396: =STDEV(AK396:BC396) -> 0.26500471031894524
B397: 605289.SH | C397: 罗曼股份 | E397: 0.28039999999999998 | F397: 0.95999999999999996 | V397: -0.25559999999999999 | W397: 0 | X397: 0.3125 | Y397: 0.1429 | AA397: =(N397+O397+P397+Q397+R397+S397+T397+U397+V397+W397+X397+Y397)/12 -> 1.6650000000000002e-02 | AB397: =(G397+H397+I397+J397+K397+L397+M397+N397+O397+P397+Q397+R397+S397+T397+U397+V397+W397+X397+Y397)/19 -> 1.0515789473684211e-02 | AC397: =(R397+S397)/2 -> 0 | AD397: =(S397+T397)/2 -> 0 | AE397: =(T397+U397)/2 -> 0 | AF397: =(U397+V397)/2 -> -0.1278 | AG397: =(V397+W397)/2 -> -0.1278 | AH397: =(W397+X397)/2 -> 0.15625 | AI397: =(X397+Y397)/2 -> 0.22770000000000001 | AJ397: =STDEV(G397:Y397) -> 0.24043572252613934
B398: 600845.SH | C398: 宝信软件 | G398: 9.2799999999999994e-02 | H398: 4.4000000000000004e-02 | I398: 0.24399999999999999 | J398: 0.26569999999999999 | K398: 0.76419999999999999 | L398: 9.9600000000000008e-02 | M398: 0.1162 | N398: -0.24679999999999999 | O398: -0.11230000000000001 | P398: 0.20910000000000001 | Q398: 0.16489999999999999 | R398: 0.9022 | S398: 0.45779999999999998 | T398: 0.28820000000000001 | U398: 0.23649999999999999 | V398: 0.4743 | W398: 0.44209999999999999 | X398: 0.40039999999999998 | Y398: 0.44280000000000003 | AA398: =(N398+O398+P398+Q398+R398+S398+T398+U398+V398+W398+X398+Y398)/12 -> 0.30493333333333333 | AB398: =(G398+H398+I398+J398+K398+L398+M398+N398+O398+P398+Q398+R398+S398+T398+U398+V398+W398+X398+Y398)/19 -> 0.27819473684210527 | AC398: =(R398+S398)/2 -> 0.67999999999999994 | AD398: =(S398+T398)/2 -> 0.373 | AE398: =(T398+U398)/2 -> 0.26234999999999997 | AF398: =(U398+V398)/2 -> 0.35539999999999999 | AG398: =(V398+W398)/2 -> 0.4582 | AH398: =(W398+X398)/2 -> 0.42125000000000001 | AI398: =(X398+Y398)/2 -> 0.42159999999999997 | AJ398: =STDEV(G398:Y398) -> 0.27501808723081028
B399: 000338.SZ | C399: 潍柴动力
B400: 001210.SZ | C400: 金房节能 | V400: 0.26350000000000001 | W400: 0.125 | X400: 0 | Y400: -8.6500000000000007e-02 | AA400: =(N400+O400+P400+Q400+R400+S400+T400+U400+V400+W400+X400+Y400)/12 -> 2.5166666666666667e-02 | AB400: =(G400+H400+I400+J400+K400+L400+M400+N400+O400+P400+Q400+R400+S400+T400+U400+V400+W400+X400+Y400)/19 -> 1.5894736842105264e-02 | AC400: =(R400+S400)/2 -> 0 | AD400: =(S400+T400)/2 -> 0 | AE400: =(T400+U400)/2 -> 0 | AF400: =(U400+V400)/2 -> 0.13175000000000001 | AG400: =(V400+W400)/2 -> 0.19425000000000001 | AH400: =(W400+X400)/2 -> 6.25e-02 | AI400: =(X400+Y400)/2 -> -4.3250000000000004e-02 | AJ400: =STDEV(G400:Y400) -> 0.15246693630642241
B401: 600348.SH | C401: 华阳股份 | E401: 0.61009999999999998 | F401: 0.94999999999999996 | G401: 35 | H401: 7.75 | I401: 8.5999999999999996 | J401: 2.7777999999999996 | K401: 0.16670000000000001 | L401: 5.7099999999999998e-02 | M401: 0.20829999999999999 | N401: 0.2059 | O401: 4.7599999999999996e-02 | P401: 0.18920000000000001 | Q401: 0.13789999999999999 | R401: -0.1341 | S401: -0.2727 | T401: -0.31819999999999998 | U401: -0.30299999999999999 | V401: -0.11269999999999999 | W401: 0.1875 | X401: 0.59999999999999998 | Y401: 1.0651999999999999 | AA401: =(N401+O401+P401+Q401+R401+S401+T401+U401+V401+W401+X401+Y401)/12 -> 0.10771666666666667 | AB401: =(G401+H401+I401+J401+K401+L401+M401+N401+O401+P401+Q401+R401+S401+T401+U401+V401+W401+X401+Y401)/19 -> 2.9396052631578953 | AC401: =(R401+S401)/2 -> -0.2034 | AD401: =(S401+T401)/2 -> -0.29544999999999999 | AE401: =(T401+U401)/2 -> -0.31059999999999999 | AF401: =(U401+V401)/2 -> -0.20784999999999998 | AG401: =(V401+W401)/2 -> 3.7400000000000003e-02 | AH401: =(W401+X401)/2 -> 0.39374999999999999 | AI401: =(X401+Y401)/2 -> 0.83260000000000001 | AJ401: =STDEV(G401:Y401) -> 8.180451626385759 | AK401: 1.1865000000000001 | AL401: 0.95790000000000008 | AM401: 0.94909999999999994 | AN401: 0.9798 | AO401: 0.20030000000000001 | AP401: 5.9200000000000003e-02 | AQ401: 6.8000000000000005e-03 | AR401: 0.1409 | AS401: -1.0200000000000001e-02 | AT401: -0.13059999999999999 | AU401: -4.6399999999999997e-02 | AV401: 8.1000000000000013e-03 | AW401: 4.6300000000000001e-02 | AX401: 1.6299999999999999e-02 | AY401: -5.8499999999999996e-02 | AZ401: -7.2400000000000006e-02 | BA401: 0.22239999999999999 | BB401: 0.1041 | BC401: 0.1275 | BE401: =(AR401+AS401+AT401+AU401+AV401+AW401+AX401+AY401+AZ401+BA401+BB401+BC401)/12 -> 2.8958333333333332e-02 | BF401: =(AK401+AL401+AM401+AN401+AO401+AP401+AQ401+AR401+AS401+AT401+AU401+AV401+AV401+AW401+AX401+AY401+AZ401+BA401+BB401+BC401)/19 -> 0.24711578947368421 | BG401: =(AV401+AW401)/2 -> 2.7200000000000002e-02 | BH401: =(AW401+AX401)/2 -> 3.1300000000000001e-02 | BI401: =(AX401+AY401)/2 -> -2.1100000000000001e-02 | BJ401: =(AY401+AZ401)/2 -> -6.5450000000000008e-02 | BK401: =(AZ401+BA401)/2 -> 7.4999999999999983e-02 | BL401: =(BA401+BB401)/2 -> 0.16325000000000001 | BM401: =(BB401+BC401)/2 -> 0.1158 | BN401: =STDEV(AK401:BC401) -> 0.4216651013076832
B402: 601168.SH | C402: 西部矿业
B403: 603127.SH | C403: 昭衍新药 | I403: 0.94999999999999996 | J403: -4.7599999999999996e-02 | K403: 1.7272999999999998 | L403: 0 | M403: 0.28210000000000002 | N403: -0.16250000000000001 | O403: 0.25 | P403: 0.28570000000000001 | Q403: -0.32000000000000001 | R403: 0.23879999999999998 | S403: -0.10000000000000001 | T403: 1.2222 | U403: 0.32350000000000001 | V403: 0.68669999999999998 | W403: 3.3332999999999999 | X403: 0.5 | Y403: 1.1111 | AA403: =(N403+O403+P403+Q403+R403+S403+T403+U403+V403+W403+X403+Y403)/12 -> 0.61406666666666665 | AB403: =(G403+H403+I403+J403+K403+L403+M403+N403+O403+P403+Q403+R403+S403+T403+U403+V403+W403+X403+Y403)/19 -> 0.54108421052631572 | AC403: =(R403+S403)/2 -> 6.9399999999999989e-02 | AD403: =(S403+T403)/2 -> 0.56109999999999993 | AE403: =(T403+U403)/2 -> 0.77285000000000004 | AF403: =(U403+V403)/2 -> 0.50509999999999999 | AG403: =(V403+W403)/2 -> 2.0099999999999998 | AH403: =(W403+X403)/2 -> 1.91665 | AI403: =(X403+Y403)/2 -> 0.80554999999999999 | AJ403: =STDEV(G403:Y403) -> 0.89289485597327145
B404: 603568.SH | C404: 伟明环保 | E404: 0.49020000000000002 | F404: 0.91800000000000004 | G404: 0.5 | H404: 0.5 | I404: 0.44740000000000002 | J404: 0.54170000000000007 | K404: 0.44439999999999996 | L404: 0.11109999999999999 | M404: 0.14550000000000002 | N404: 8.1099999999999992e-02 | O404: -3.85e-02 | P404: 2.5000000000000001e-02 | Q404: -1.5900000000000001e-02 | R404: 0 | S404: -0.35999999999999999 | T404: -2.4399999999999998e-02 | U404: 0.1613 | V404: 0.25 | W404: 0.8125 | X404: 0.55000000000000004 | Y404: 0.31940000000000002 | AA404: =(N404+O404+P404+Q404+R404+S404+T404+U404+V404+W404+X404+Y404)/12 -> 0.14670833333333333 | AB404: =(G404+H404+I404+J404+K404+L404+M404+N404+O404+P404+Q404+R404+S404+T404+U404+V404+W404+X404+Y404)/19 -> 0.23424210526315792 | AC404: =(R404+S404)/2 -> -0.17999999999999999 | AD404: =(S404+T404)/2 -> -0.19219999999999998 | AE404: =(T404+U404)/2 -> 6.8449999999999997e-02 | AF404: =(U404+V404)/2 -> 0.20565 | AG404: =(V404+W404)/2 -> 0.53125 | AH404: =(W404+X404)/2 -> 0.68125000000000002 | AI404: =(X404+Y404)/2 -> 0.43470000000000003 | AJ404: =STDEV(G404:Y404) -> 0.28620267549760664
B405: 603950.SH | C405: 长源东谷
B406: 605208.SH | C406: 永茂泰 | U406: 0.64290000000000003 | V406: 0.39770000000000005 | W406: 7 | X406: 0.51019999999999999 | Y406: 3.2599999999999997e-02 | AA406: =(N406+O406+P406+Q406+R406+S406+T406+U406+V406+W406+X406+Y406)/12 -> 0.71528333333333327 | AB406: =(G406+H406+I406+J406+K406+L406+M406+N406+O406+P406+Q406+R406+S406+T406+U406+V406+W406+X406+Y406)/19 -> 0.45175789473684208 | AC406: =(R406+S406)/2 -> 0 | AD406: =(S406+T406)/2 -> 0 | AE406: =(T406+U406)/2 -> 0.32145000000000001 | AF406: =(U406+V406)/2 -> 0.52029999999999998 | AG406: =(V406+W406)/2 -> 3.6988500000000002 | AH406: =(W406+X406)/2 -> 3.7551000000000001 | AI406: =(X406+Y406)/2 -> 0.27139999999999997 | AJ406: =STDEV(G406:Y406) -> 2.9621740912714767
B407: 605500.SH | C407: 森林包装
B408: 002738.SZ | C408: 中矿资源 | E408: 0.33590000000000003 | F408: 0.92900000000000005 | G408: 1.2985 | H408: 9.9600000000000008e-02 | I408: 3.0999999999999999e-03 | J408: -1.4000000000000002e-03 | K408: 0.75 | L408: 0.1139 | M408: 0.96510000000000007 | N408: 0.83739999999999992 | O408: 31.399999999999999 | P408: 2.6839999999999997 | Q408: 0.50670000000000004 | R408: -4.7999999999999996e-03 | S408: -0.27429999999999999 | T408: -0.33090000000000003 | U408: -0.23879999999999998 | V408: 0.2034 | W408: 2.1774 | X408: 1.0278 | Y408: 1.6243000000000001 | AA408: =(N408+O408+P408+Q408+R408+S408+T408+U408+V408+W408+X408+Y408)/12 -> 3.3010166666666669 | AB408: =(G408+H408+I408+J408+K408+L408+M408+N408+O408+P408+Q408+R408+S408+T408+U408+V408+W408+X408+Y408)/19 -> 2.2547894736842107 | AC408: =(R408+S408)/2 -> -0.13955000000000001 | AD408: =(S408+T408)/2 -> -0.30259999999999998 | AE408: =(T408+U408)/2 -> -0.28484999999999999 | AF408: =(U408+V408)/2 -> -1.7699999999999994e-02 | AG408: =(V408+W408)/2 -> 1.1903999999999999 | AH408: =(W408+X408)/2 -> 1.6026 | AI408: =(X408+Y408)/2 -> 1.32605 | AJ408: =STDEV(G408:Y408) -> 7.1080794344569398
B409: 603801.SH | C409: 志邦家居 | G409: 0.51070000000000004 | H409: 0.29380000000000001 | I409: 0.17319999999999999 | J409: 0.12920000000000001 | K409: 0.11210000000000001 | L409: 0.10640000000000001 | M409: 9.5899999999999999e-02 | N409: -0.26960000000000001 | O409: -0.2462 | P409: -0.15960000000000002 | Q409: -0.1661 | R409: 0.22120000000000001 | S409: -2.4300000000000002 | T409: -0.68069999999999997 | U409: -0.39750000000000002 | V409: 0.18969999999999998 | W409: 1.9286000000000001 | X409: 1.9158000000000002 | Y409: 0.48330000000000001 | AA409: =(N409+O409+P409+Q409+R409+S409+T409+U409+V409+W409+X409+Y409)/12 -> 3.2408333333333407e-02 | AB409: =(G409+H409+I409+J409+K409+L409+M409+N409+O409+P409+Q409+R409+S409+T409+U409+V409+W409+X409+Y409)/19 -> 9.527368421052633e-02 | AC409: =(R409+S409)/2 -> -1.1044 | AD409: =(S409+T409)/2 -> -1.55535 | AE409: =(T409+U409)/2 -> -0.53910000000000002 | AF409: =(U409+V409)/2 -> -0.10390000000000002 | AG409: =(V409+W409)/2 -> 1.05915 | AH409: =(W409+X409)/2 -> 1.9222000000000001 | AI409: =(X409+Y409)/2 -> 1.1995500000000001 | AJ409: =STDEV(G409:Y409) -> 0.90293792997089062
B410: 000893.SZ | C410: 亚钾国际 | E410: 0.11710000000000001 | F410: 0.94699999999999995 | G410: -3.3102999999999998 | H410: -2.5486 | I410: -2.9835000000000003 | J410: -31.273299999999999 | K410: -0.59699999999999998 | L410: 0.74540000000000006 | M410: 0.97920000000000007 | N410: 1.0058 | O410: 1.1776 | P410: 4.1593999999999998 | Q410: 46.200000000000003 | R410: 9.3208000000000002 | S410: 1.8421000000000001 | T410: -0.37159999999999999 | U410: -0.86730000000000007 | V410: 0.44060000000000005 | W410: 3.2963 | X410: 47.8613 | Y410: 156.76670000000001 | AA410: =(N410+O410+P410+Q410+R410+S410+T410+U410+V410+W410+X410+Y410)/12 -> 22.569308333333336 | AB410: =(G410+H410+I410+J410+K410+L410+M410+N410+O410+P410+Q410+R410+S410+T410+U410+V410+W410+X410+Y410)/19 -> 12.202294736842104 | AC410: =(R410+S410)/2 -> 5.5814500000000002 | AD410: =(S410+T410)/2 -> 0.73525000000000007 | AE410: =(T410+U410)/2 -> -0.61945000000000006 | AF410: =(U410+V410)/2 -> -0.21335000000000001 | AG410: =(V410+W410)/2 -> 1.8684499999999999 | AH410: =(W410+X410)/2 -> 25.578800000000001 | AI410: =(X410+Y410)/2 -> 102.31400000000001 | AJ410: =STDEV(G410:Y410) -> 38.944463912109995 | AK410: -0.44530000000000003 | AL410: -0.42719999999999997 | AM410: -0.4657 | AN410: -0.44179999999999997 | AO410: -0.77099999999999991 | AP410: -0.80920000000000003 | AQ410: -0.76090000000000002 | AR410: -0.71620000000000006 | AS410: -4.8000000000000001e-02 | AT410: 0.53549999999999998 | AU410: 0.58109999999999995 | AV410: 0.24710000000000001 | AW410: 0.38270000000000004 | AX410: -0.26669999999999999 | AY410: -0.36749999999999999 | AZ410: -0.18469999999999998 | BA410: 1.78e-02 | BB410: 0.2437 | BC410: 0.73819999999999997 | BE410: =(AR410+AS410+AT410+AU410+AV410+AW410+AX410+AY410+AZ410+BA410+BB410+BC410)/12 -> 9.6916666666666651e-02 | BF410: =(AK410+AL410+AM410+AN410+AO410+AP410+AQ410+AR410+AS410+AT410+AU410+AV410+AV410+AW410+AX410+AY410+AZ410+BA410+BB410+BC410)/19 -> -0.1426842105263158 | BG410: =(AV410+AW410)/2 -> 0.31490000000000001 | BH410: =(AW410+AX410)/2 -> 5.8000000000000024e-02 | BI410: =(AX410+AY410)/2 -> -0.31709999999999999 | BJ410: =(AY410+AZ410)/2 -> -0.27610000000000001 | BK410: =(AZ410+BA410)/2 -> -8.3449999999999983e-02 | BL410: =(BA410+BB410)/2 -> 0.13075000000000001 | BM410: =(BB410+BC410)/2 -> 0.49095 | BN410: =STDEV(AK410:BC410) -> 0.49174698089197688
B411: 603365.SH | C411: 水星家纺 | I411: 0.36840000000000006 | J411: 0.2626 | K411: -6.9000000000000006e-02 | L411: -0.10000000000000001 | M411: -0.12820000000000001 | N411: -0.14400000000000002 | O411: 3.7000000000000005e-02 | P411: 0.11109999999999999 | Q411: 0.17649999999999999 | R411: 0.11210000000000001 | S411: -0.46429999999999999 | T411: -0.28000000000000003 | U411: -0.17499999999999999 | V411: -0.12609999999999999 | W411: 1 | X411: 0.72219999999999995 | Y411: 0.42420000000000002 | AA411: =(N411+O411+P411+Q411+R411+S411+T411+U411+V411+W411+X411+Y411)/12 -> 0.11614166666666666 | AB411: =(G411+H411+I411+J411+K411+L411+M411+N411+O411+P411+Q411+R411+S411+T411+U411+V411+W411+X411+Y411)/19 -> 9.0921052631578944e-02 | AC411: =(R411+S411)/2 -> -0.17609999999999998 | AD411: =(S411+T411)/2 -> -0.37214999999999998 | AE411: =(T411+U411)/2 -> -0.22750000000000001 | AF411: =(U411+V411)/2 -> -0.15054999999999999 | AG411: =(V411+W411)/2 -> 0.43695000000000001 | AH411: =(W411+X411)/2 -> 0.86109999999999998 | AI411: =(X411+Y411)/2 -> 0.57319999999999993 | AJ411: =STDEV(G411:Y411) -> 0.36916418473914514
B412: 603926.SH | C412: 铁流股份
B413: 002572.SZ | C413: 索菲亚
B414: 600352.SH | C414: 浙江龙盛
B415: 000818.SZ | C415: 航锦科技 | E415: 0.25009999999999999 | F415: 0.93600000000000005 | G415: 1.9630000000000001 | H415: 4.8441999999999998 | I415: 1.7915000000000001 | J415: 1.3125 | K415: 3.75 | L415: 2.8889 | M415: 1.8234999999999999 | N415: 0.97299999999999998 | O415: -0.15789999999999998 | P415: -0.34289999999999998 | Q415: -0.27079999999999999 | R415: -0.39729999999999999 | S415: -0.125 | T415: -0.43479999999999996 | U415: -0.2571 | V415: -0.2273 | W415: 1.2143000000000002 | X415: 3.6154000000000002 | Y415: 2.5769000000000002 | AA415: =(N415+O415+P415+Q415+R415+S415+T415+U415+V415+W415+X415+Y415)/12 -> 0.51387500000000008 | AB415: =(G415+H415+I415+J415+K415+L415+M415+N415+O415+P415+Q415+R415+S415+T415+U415+V415+W415+X415+Y415)/19 -> 1.2915842105263156 | AC415: =(R415+S415)/2 -> -0.26114999999999999 | AD415: =(S415+T415)/2 -> -0.27989999999999998 | AE415: =(T415+U415)/2 -> -0.34594999999999998 | AF415: =(U415+V415)/2 -> -0.2422 | AG415: =(V415+W415)/2 -> 0.49350000000000005 | AH415: =(W415+X415)/2 -> 2.4148500000000004 | AI415: =(X415+Y415)/2 -> 3.0961500000000002 | AJ415: =STDEV(G415:Y415) -> 1.6519093273687733 | AK415: 0.46970000000000001 | AL415: 0.3715 | AM415: 0.34149999999999997 | AN415: 0.32340000000000002 | AO415: 4.4699999999999997e-02 | AP415: 0.17379999999999998 | AQ415: 0.19320000000000001 | AR415: 0.1447 | AS415: 0.19219999999999998 | AT415: 9.1300000000000006e-02 | AU415: 9.4999999999999998e-03 | AV415: -6.9400000000000003e-02 | AW415: -0.26090000000000002 | AX415: -0.2611 | AY415: -0.2329 | AZ415: -0.1648 | BA415: 0.51159999999999994 | BB415: 0.46259999999999996 | BC415: 0.53029999999999999 | BE415: =(AR415+AS415+AT415+AU415+AV415+AW415+AX415+AY415+AZ415+BA415+BB415+BC415)/12 -> 7.9424999999999982e-02 | BF415: =(AK415+AL415+AM415+AN415+AO415+AP415+AQ415+AR415+AS415+AT415+AU415+AV415+AV415+AW415+AX415+AY415+AZ415+BA415+BB415+BC415)/19 -> 0.14744736842105266 | BG415: =(AV415+AW415)/2 -> -0.16515000000000002 | BH415: =(AW415+AX415)/2 -> -0.26100000000000001 | BI415: =(AX415+AY415)/2 -> -0.247 | BJ415: =(AY415+AZ415)/2 -> -0.19885 | BK415: =(AZ415+BA415)/2 -> 0.17339999999999997 | BL415: =(BA415+BB415)/2 -> 0.48709999999999998 | BM415: =(BB415+BC415)/2 -> 0.49644999999999995 | BN415: =STDEV(AK415:BC415) -> 0.26471095767102487
B416: 002818.SZ | C416: 富森美
B417: 601939.SH | C417: 建设银行
B418: 603458.SH | C418: 勘设股份 | E418: 0.56899999999999995 | F418: 0.92400000000000004 | H418: 1.1506999999999998 | I418: 1.0952 | J418: 0.8488 | K418: -0.14810000000000001 | L418: -0.38850000000000001 | M418: -0.53790000000000004 | N418: -0.1101 | O418: -0.1739 | P418: -0.4375 | Q418: -0.15570000000000001 | R418: -0.35340000000000005 | S418: -0.26319999999999999 | T418: -0.11109999999999999 | U418: -9.7100000000000006e-02 | V418: 0.18030000000000002 | W418: 0.17859999999999998 | X418: 2.0799999999999999e-02 | Y418: 0
B419: 603466.SH | C419: 风语筑 | E419: 0.47729999999999995 | F419: 1.0800000000000001 | I419: -0.3301 | J419: -0.3846 | K419: 0 | L419: 4.7599999999999996e-02 | M419: -0.1449 | N419: 0.125 | O419: 4.0000000000000001e-02 | P419: 0.11359999999999999 | Q419: 0.2034 | R419: 0.26390000000000002 | S419: -0.3846 | T419: 6.1200000000000004e-02 | U419: 0.33799999999999997 | V419: 0.30769999999999997 | W419: 2.375 | X419: 0.26919999999999999 | Y419: -2.1099999999999997e-02 | AA419: =(N419+O419+P419+Q419+R419+S419+T419+U419+V419+W419+X419+Y419)/12 -> 0.30760833333333332 | AB419: =(G419+H419+I419+J419+K419+L419+M419+N419+O419+P419+Q419+R419+S419+T419+U419+V419+W419+X419+Y419)/19 -> 0.15154210526315789 | AC419: =(R419+S419)/2 -> -6.0349999999999987e-02 | AD419: =(S419+T419)/2 -> -0.16170000000000001 | AE419: =(T419+U419)/2 -> 0.1996 | AF419: =(U419+V419)/2 -> 0.32284999999999997 | AG419: =(V419+W419)/2 -> 1.34135 | AH419: =(W419+X419)/2 -> 1.3221000000000001 | AI419: =(X419+Y419)/2 -> 0.12404999999999999 | AJ419: =STDEV(G419:Y419) -> 0.61276757804724169
B420: 605337.SH | C420: 李子园 | T420: -0.1207 | U420: -0.13589999999999999 | V420: 0.18590000000000001 | W420: 2.7273000000000001 | X420: 0.2157 | Y420: 4.4900000000000002e-02 | AA420: =(N420+O420+P420+Q420+R420+S420+T420+U420+V420+W420+X420+Y420)/12 -> 0.24310000000000001 | AB420: =(G420+H420+I420+J420+K420+L420+M420+N420+O420+P420+Q420+R420+S420+T420+U420+V420+W420+X420+Y420)/19 -> 0.15353684210526317 | AC420: =(R420+S420)/2 -> 0 | AD420: =(S420+T420)/2 -> -6.0350000000000001e-02 | AE420: =(T420+U420)/2 -> -0.1283 | AF420: =(U420+V420)/2 -> 2.5000000000000008e-02 | AG420: =(V420+W420)/2 -> 1.4566000000000001 | AH420: =(W420+X420)/2 -> 1.4715 | AI420: =(X420+Y420)/2 -> 0.1303 | AJ420: =STDEV(G420:Y420) -> 1.1077870968737631
B421: 000977.SZ | C421: 浪潮信息
B422: 003041.SZ | C422: 真爱美家 | V422: 0.19120000000000001 | W422: 4.5499999999999999e-02 | X422: -0.1409 | Y422: -0.17699999999999999 | AA422: =(N422+O422+P422+Q422+R422+S422+T422+U422+V422+W422+X422+Y422)/12 -> -6.7666666666666639e-03 | AB422: =(G422+H422+I422+J422+K422+L422+M422+N422+O422+P422+Q422+R422+S422+T422+U422+V422+W422+X422+Y422)/19 -> -4.2736842105263141e-03 | AC422: =(R422+S422)/2 -> 0 | AD422: =(S422+T422)/2 -> 0 | AE422: =(T422+U422)/2 -> 0 | AF422: =(U422+V422)/2 -> 9.5600000000000004e-02 | AG422: =(V422+W422)/2 -> 0.11835000000000001 | AH422: =(W422+X422)/2 -> -4.7699999999999999e-02 | AI422: =(X422+Y422)/2 -> -0.15894999999999998 | AJ422: =STDEV(G422:Y422) -> 0.17142650514627739
B423: 000761.SZ | C423: 本钢板材
B424: 002867.SZ | C424: 周大生
B425: 601668.SH | C425: 中国建筑 | E425: 0.73970000000000002 | F425: 0.90200000000000002 | G425: 0.1429 | H425: -0.1961 | I425: -0.25319999999999998 | J425: -0.20829999999999999 | K425: -0.20829999999999999 | L425: 2.4399999999999998e-02 | M425: 5.0799999999999998e-02 | N425: 0.1447 | O425: 0.10529999999999999 | P425: 7.1399999999999991e-02 | Q425: 9.6799999999999997e-02 | R425: 0.1149 | S425: -0.1429 | T425: 4.4400000000000002e-02 | U425: 8.8200000000000001e-02 | V425: 0.10310000000000001 | W425: 0.5 | X425: 0.31909999999999999 | Y425: 0.2432
B426: 603538.SH | C426: 美诺华
B427: 603639.SH | C427: 海利尔 | E427: 0.37070000000000003 | F427: 0.91500000000000004 | G427: 6.25e-02 | H427: 0.1026 | I427: 5.8400000000000001e-02 | J427: 6.13e-02 | K427: 5.8799999999999998e-02 | L427: 0.1085 | M427: 0.1595 | N427: 0.26590000000000003 | O427: -0.2407 | P427: -0.41259999999999997 | Q427: -0.38619999999999999 | R427: -0.39270000000000005 | S427: -0.14630000000000001 | T427: -0.10710000000000001 | U427: -0.13789999999999999 | V427: 0.28570000000000001 | W427: 0.57140000000000002 | X427: -9.3299999999999994e-02 | Y427: -8.0000000000000002e-02 | AA427: =(N427+O427+P427+Q427+R427+S427+T427+U427+V427+W427+X427+Y427)/12 -> -7.2816666666666668e-02 | AB427: =(G427+H427+I427+J427+K427+L427+M427+N427+O427+P427+Q427+R427+S427+T427+U427+V427+W427+X427+Y427)/19 -> -1.3799999999999993e-02 | AC427: =(R427+S427)/2 -> -0.26950000000000002 | AD427: =(S427+T427)/2 -> -0.12670000000000001 | AE427: =(T427+U427)/2 -> -0.1225 | AF427: =(U427+V427)/2 -> 7.3900000000000007e-02 | AG427: =(V427+W427)/2 -> 0.42854999999999999 | AH427: =(W427+X427)/2 -> 0.23905000000000001 | AI427: =(X427+Y427)/2 -> -8.6650000000000005e-02 | AJ427: =STDEV(G427:Y427) -> 0.25122062901848735
B428: 002798.SZ | C428: 帝欧家居
B429: 002129.SZ | C429: 中环股份 | E429: 0.55220000000000002 | F429: 0.85399999999999998 | G429: 1.0200000000000001e-02 | H429: 9.1700000000000004e-02 | I429: 0.29260000000000003 | J429: 0.4546 | K429: 0.19440000000000002 | L429: 9.5600000000000004e-02 | M429: -7.6999999999999999e-02 | N429: 5.79e-02 | O429: 0.4249 | P429: 0.42999999999999999 | Q429: 0.59289999999999998 | R429: 0.38729999999999998 | S429: 0.34420000000000001 | T429: 0.191 | U429: 0.1825 | V429: 0.1618 | W429: 0.97019999999999995 | X429: 1.5246000000000002 | Y429: 2.0584000000000002 | AA429: =(N429+O429+P429+Q429+R429+S429+T429+U429+V429+W429+X429+Y429)/12 -> 0.6104750000000001 | AB429: =(G429+H429+I429+J429+K429+L429+M429+N429+O429+P429+Q429+R429+S429+T429+U429+V429+W429+X429+Y429)/19 -> 0.44146315789473684 | AC429: =(R429+S429)/2 -> 0.36575000000000002 | AD429: =(S429+T429)/2 -> 0.2676 | AE429: =(T429+U429)/2 -> 0.18675 | AF429: =(U429+V429)/2 -> 0.17215 | AG429: =(V429+W429)/2 -> 0.56599999999999995 | AH429: =(W429+X429)/2 -> 1.2474000000000001 | AI429: =(X429+Y429)/2 -> 1.7915000000000001 | AJ429: =STDEV(G429:Y429) -> 0.53945506991420555 | AK429: 0.38030000000000003 | AL429: 7.2300000000000003e-02 | AM429: 1.1299999999999999e-02 | AN429: 0.15210000000000001 | AO429: 0.82290000000000008 | AP429: 0.58040000000000003 | AQ429: 0.74419999999999997 | AR429: 0.6724 | AS429: -2.6099999999999998e-02 | AT429: 3.8699999999999998e-02 | AU429: 5.6999999999999993e-03 | AV429: 0.10349999999999999 | AW429: 0.82519999999999993 | AX429: 0.47299999999999998 | AY429: 0.34630000000000005 | AZ429: 8.6500000000000007e-02 | BA429: -0.3206 | BB429: -9.64e-02 | BC429: 7.7600000000000002e-02 | BE429: =(AR429+AS429+AT429+AU429+AV429+AW429+AX429+AY429+AZ429+BA429+BB429+BC429)/12 -> 0.18215000000000001 | BF429: =(AK429+AL429+AM429+AN429+AO429+AP429+AQ429+AR429+AS429+AT429+AU429+AV429+AV429+AW429+AX429+AY429+AZ429+BA429+BB429+BC429)/19 -> 0.26593684210526325 | BG429: =(AV429+AW429)/2 -> 0.46434999999999998 | BH429: =(AW429+AX429)/2 -> 0.64910000000000001 | BI429: =(AX429+AY429)/2 -> 0.40965000000000001 | BJ429: =(AY429+AZ429)/2 -> 0.21640000000000004 | BK429: =(AZ429+BA429)/2 -> -0.11704999999999999 | BL429: =(BA429+BB429)/2 -> -0.20849999999999999 | BM429: =(BB429+BC429)/2 -> -9.3999999999999986e-03 | BN429: =STDEV(AK429:BC429) -> 0.33886850923286987
B430: 002023.SZ | C430: 海特高新
B431: 002025.SZ | C431: 航天电器 | G431: 0.1429 | H431: 0.2069 | I431: 0.12770000000000001 | J431: 0.19670000000000001 | K431: -6.25e-02 | L431: 5.7099999999999998e-02 | M431: 0.16980000000000001 | N431: 0.1507 | O431: 0.20000000000000001 | P431: 0.18920000000000001 | Q431: 0.11289999999999999 | R431: 0.11900000000000001 | S431: -5.5599999999999997e-02 | T431: -2.2700000000000001e-02 | U431: 4.3499999999999997e-02 | V431: 7.4499999999999997e-02 | W431: 0.6470999999999999 | X431: 0.37209999999999999 | Y431: 0.26390000000000002 | AA431: =(N431+O431+P431+Q431+R431+S431+T431+U431+V431+W431+X431+Y431)/12 -> 0.17454999999999998 | AB431: =(G431+H431+I431+J431+K431+L431+M431+N431+O431+P431+Q431+R431+S431+T431+U431+V431+W431+X431+Y431)/19 -> 0.15437894736842106 | AC431: =(R431+S431)/2 -> 3.1700000000000006e-02 | AD431: =(S431+T431)/2 -> -3.9149999999999997e-02 | AE431: =(T431+U431)/2 -> 1.0399999999999998e-02 | AF431: =(U431+V431)/2 -> 5.8999999999999997e-02 | AG431: =(V431+W431)/2 -> 0.36079999999999995 | AH431: =(W431+X431)/2 -> 0.50959999999999994 | AI431: =(X431+Y431)/2 -> 0.318 | AJ431: =STDEV(G431:Y431) -> 0.16067639866426958
B432: 002462.SZ | C432: 嘉事堂
B433: 002853.SZ | C433: 皮阿诺
B434: 600835.SH | C434: 上海机电
B435: 600837.SH | C435: 海通证券
B436: 600999.SH | C436: 招商证券
B437: 605338.SH | C437: 巴比食品
B438: 000990.SZ | C438: 诚志股份
B439: 601717.SH | C439: 郑煤机
B440: 601003.SH | C440: 柳钢股份
B441: 603520.SH | C441: 司太立
B442: 603596.SH | C442: 伯特利 | E442: 0.44069999999999998 | F442: 0.90300000000000002 | L442: 0.18179999999999999 | M442: 0.16 | N442: -0.20000000000000001 | O442: 0.20829999999999999 | P442: 0.2051 | Q442: 0.29309999999999997 | R442: 0.63329999999999997 | S442: -0.10339999999999999 | T442: -0.12770000000000001 | U442: -2.6699999999999998e-02 | V442: 0.15310000000000001 | W442: 0.1923 | X442: 0.439 | Y442: 0.2329 | AA442: =(N442+O442+P442+Q442+R442+S442+T442+U442+V442+W442+X442+Y442)/12 -> 0.15827499999999997 | AB442: =(G442+H442+I442+J442+K442+L442+M442+N442+O442+P442+Q442+R442+S442+T442+U442+V442+W442+X442+Y442)/19 -> 0.11795263157894736 | AC442: =(R442+S442)/2 -> 0.26495000000000002 | AD442: =(S442+T442)/2 -> -0.11555 | AE442: =(T442+U442)/2 -> -7.7200000000000005e-02 | AF442: =(U442+V442)/2 -> 6.3200000000000006e-02 | AG442: =(V442+W442)/2 -> 0.17270000000000002 | AH442: =(W442+X442)/2 -> 0.31564999999999999 | AI442: =(X442+Y442)/2 -> 0.33594999999999997 | AJ442: =STDEV(G442:Y442) -> 0.22316337643622794 | AN442: 0.308 | AO442: -0.19289999999999999 | AP442: 0.15909999999999999 | AQ442: 0.1953 | AR442: 0.2273 | AS442: 0.38280000000000003 | AT442: 0.14300000000000002 | AU442: 0.1026 | AV442: 6.7799999999999999e-02 | AW442: 0.10210000000000001 | AX442: 7.7100000000000002e-02 | AY442: -7.6e-03 | AZ442: 6.8600000000000008e-02 | BA442: -0.2016 | BB442: -6.7099999999999993e-02 | BC442: 8.6899999999999991e-02 | BE442: =(AR442+AS442+AT442+AU442+AV442+AW442+AX442+AY442+AZ442+BA442+BB442+BC442)/12 -> 8.1824999999999995e-02 | BF442: =(AK442+AL442+AM442+AN442+AO442+AP442+AQ442+AR442+AS442+AT442+AU442+AV442+AV442+AW442+AX442+AY442+AZ442+BA442+BB442+BC442)/19 -> 7.9957894736842117e-02 | BG442: =(AV442+AW442)/2 -> 8.4949999999999998e-02 | BH442: =(AW442+AX442)/2 -> 8.9600000000000013e-02 | BI442: =(AX442+AY442)/2 -> 3.4750000000000003e-02 | BJ442: =(AY442+AZ442)/2 -> 3.0500000000000003e-02 | BK442: =(AZ442+BA442)/2 -> -6.6500000000000004e-02 | BL442: =(BA442+BB442)/2 -> -0.13435 | BM442: =(BB442+BC442)/2 -> 9.8999999999999991e-03 | BN442: =STDEV(AK442:BC442) -> 0.15736836562664047
B443: 603610.SH | C443: 麒盛科技 | P443: -6.3600000000000004e-02 | Q443: -0.14219999999999999 | R443: -7.690000000000001e-02 | S443: -0.43099999999999999 | T443: -0.5534 | U443: -0.61140000000000005 | V443: -0.45000000000000001 | W443: 6.0599999999999994e-02 | X443: 4.3499999999999997e-02 | Y443: 0.32350000000000001 | AA443: =(N443+O443+P443+Q443+R443+S443+T443+U443+V443+W443+X443+Y443)/12 -> -0.15840833333333337 | AB443: =(G443+H443+I443+J443+K443+L443+M443+N443+O443+P443+Q443+R443+S443+T443+U443+V443+W443+X443+Y443)/19 -> -0.10004736842105266 | AC443: =(R443+S443)/2 -> -0.25395000000000001 | AD443: =(S443+T443)/2 -> -0.49219999999999997 | AE443: =(T443+U443)/2 -> -0.58240000000000003 | AF443: =(U443+V443)/2 -> -0.53070000000000006 | AG443: =(V443+W443)/2 -> -0.19470000000000001 | AH443: =(W443+X443)/2 -> 5.2049999999999999e-02 | AI443: =(X443+Y443)/2 -> 0.1835 | AJ443: =STDEV(G443:Y443) -> 0.30684355568704169 | AT443: 1.72e-02 | AU443: -2.6000000000000002e-02 | AV443: 2.8900000000000002e-02 | AW443: 8.5900000000000004e-02 | AX443: -3.2500000000000001e-02 | AY443: -0.1845 | AZ443: -0.17280000000000001 | BA443: 0.27829999999999999 | BB443: 0.38009999999999999 | BC443: 0.58009999999999995 | BE443: =(AR443+AS443+AT443+AU443+AV443+AW443+AX443+AY443+AZ443+BA443+BB443+BC443)/12 -> 7.9558333333333328e-02 | BF443: =(AK443+AL443+AM443+AN443+AO443+AP443+AQ443+AR443+AS443+AT443+AU443+AV443+AV443+AW443+AX443+AY443+AZ443+BA443+BB443+BC443)/19 -> 5.1768421052631575e-02 | BG443: =(AV443+AW443)/2 -> 5.7400000000000007e-02 | BH443: =(AW443+AX443)/2 -> 2.6700000000000002e-02 | BI443: =(AX443+AY443)/2 -> -0.1085 | BJ443: =(AY443+AZ443)/2 -> -0.17865 | BK443: =(AZ443+BA443)/2 -> 5.2749999999999991e-02 | BL443: =(BA443+BB443)/2 -> 0.32919999999999999 | BM443: =(BB443+BC443)/2 -> 0.48009999999999997 | BN443: =STDEV(AK443:BC443) -> 0.24527533304431573
B444: 605006.SH | C444: 山东玻纤 | T444: -0.28570000000000001 | U444: -0.15380000000000002 | V444: 8.1099999999999992e-02 | W444: 2.875 | X444: 3.3999999999999999 | Y444: 3.0908999999999995 | AA444: =(N444+O444+P444+Q444+R444+S444+T444+U444+V444+W444+X444+Y444)/12 -> 0.75062499999999999 | AB444: =(G444+H444+I444+J444+K444+L444+M444+N444+O444+P444+Q444+R444+S444+T444+U444+V444+W444+X444+Y444)/19 -> 0.47407894736842104 | AC444: =(R444+S444)/2 -> 0 | AD444: =(S444+T444)/2 -> -0.14285 | AE444: =(T444+U444)/2 -> -0.21975 | AF444: =(U444+V444)/2 -> -3.6350000000000014e-02 | AG444: =(V444+W444)/2 -> 1.4780500000000001 | AH444: =(W444+X444)/2 -> 3.1375000000000002 | AI444: =(X444+Y444)/2 -> 3.2454499999999999 | AJ444: =STDEV(G444:Y444) -> 1.7871001412903529 | AX444: 0.22289999999999999 | AY444: -7.0099999999999996e-02 | AZ444: 0.39689999999999998 | BA444: 0.87180000000000002 | BB444: 0.86699999999999999 | BC444: 1.2381 | BE444: =(AR444+AS444+AT444+AU444+AV444+AW444+AX444+AY444+AZ444+BA444+BB444+BC444)/12 -> 0.29388333333333333 | BF444: =(AK444+AL444+AM444+AN444+AO444+AP444+AQ444+AR444+AS444+AT444+AU444+AV444+AV444+AW444+AX444+AY444+AZ444+BA444+BB444+BC444)/19 -> 0.18561052631578948 | BG444: =(AV444+AW444)/2 -> 0 | BH444: =(AW444+AX444)/2 -> 0.11144999999999999 | BI444: =(AX444+AY444)/2 -> 7.6399999999999996e-02 | BJ444: =(AY444+AZ444)/2 -> 0.16339999999999999 | BK444: =(AZ444+BA444)/2 -> 0.63434999999999997 | BL444: =(BA444+BB444)/2 -> 0.86939999999999995 | BM444: =(BB444+BC444)/2 -> 1.0525500000000001 | BN444: =STDEV(AK444:BC444) -> 0.48660578568967572
B445: 603989.SH | C445: 艾华集团
B446: 002920.SZ | C446: 德赛西威 | E446: 0.40529999999999999 | F446: 0.88500000000000001 | I446: 9.7000000000000003e-03 | J446: 4.58e-02 | K446: -0.39579999999999999 | L446: -0.34179999999999999 | M446: -0.41350000000000003 | N446: -0.44530000000000003 | O446: -0.72409999999999997 | P446: -0.63460000000000005 | Q446: -0.57379999999999998 | R446: -0.30260000000000004 | S446: 0.25 | T446: 1.2104999999999999 | U446: 1.2307999999999999 | V446: 0.77359999999999995 | W446: 3.2000000000000002 | X446: 0.59520000000000006 | Y446: 0.53449999999999998 | AA446: =(N446+O446+P446+Q446+R446+S446+T446+U446+V446+W446+X446+Y446)/12 -> 0.42618333333333336 | AB446: =(G446+H446+I446+J446+K446+L446+M446+N446+O446+P446+Q446+R446+S446+T446+U446+V446+W446+X446+Y446)/19 -> 0.21150526315789478 | AC446: =(R446+S446)/2 -> -2.6300000000000018e-02 | AD446: =(S446+T446)/2 -> 0.73024999999999995 | AE446: =(T446+U446)/2 -> 1.22065 | AF446: =(U446+V446)/2 -> 1.0022 | AG446: =(V446+W446)/2 -> 1.9868000000000001 | AH446: =(W446+X446)/2 -> 1.8976000000000002 | AI446: =(X446+Y446)/2 -> 0.56485000000000007 | AJ446: =STDEV(G446:Y446) -> 0.98627903942187745
B447: 601066.SH | C447: 中信建投
B448: 601898.SH | C448: 中煤能源
B449: 603013.SH | C449: 亚普股份
B450: 603855.SH | C450: 华荣股份 | E450: 0.54859999999999998 | F450: 0.88200000000000001 | G450: 1 | H450: 3.4500000000000003e-02 | I450: 8.2699999999999996e-02 | J450: -6.5199999999999994e-02 | K450: 0.5 | L450: 0.41670000000000001 | M450: 0.40909999999999996 | N450: 6.9800000000000001e-02 | O450: 0.66670000000000007 | P450: 0.4118 | Q450: 0.2903 | R450: 0.23910000000000001 | S450: 0.20000000000000001 | T450: 0.54170000000000007 | U450: 0.52500000000000002 | V450: 0.36840000000000006 | W450: 0.5 | X450: 0.37840000000000001 | Y450: 0.45899999999999996 | AA450: =(N450+O450+P450+Q450+R450+S450+T450+U450+V450+W450+X450+Y450)/12 -> 0.38751666666666668 | AB450: =(G450+H450+I450+J450+K450+L450+M450+N450+O450+P450+Q450+R450+S450+T450+U450+V450+W450+X450+Y450)/19 -> 0.36989473684210528 | AC450: =(R450+S450)/2 -> 0.21955000000000002 | AD450: =(S450+T450)/2 -> 0.37085000000000001 | AE450: =(T450+U450)/2 -> 0.53334999999999999 | AF450: =(U450+V450)/2 -> 0.44670000000000004 | AG450: =(V450+W450)/2 -> 0.43420000000000003 | AH450: =(W450+X450)/2 -> 0.43920000000000003 | AI450: =(X450+Y450)/2 -> 0.41869999999999996 | AJ450: =STDEV(G450:Y450) -> 0.24862903529753411
B451: 000906.SZ | C451: 浙商中拓 | E451: 0.83989999999999998 | F451: 1.1699999999999999 | G451: 0.125 | H451: -7.1399999999999991e-02 | I451: 0 | J451: 4.0000000000000001e-02 | K451: -0.22219999999999998 | L451: 0.23079999999999998 | M451: 0.36840000000000006 | N451: 0.5 | O451: 2.8571 | P451: 1.5625 | Q451: 1.0769 | R451: 0.89739999999999998 | S451: -0.48149999999999998 | T451: -0.36590000000000006 | U451: 3.7000000000000005e-02 | V451: 4.0500000000000001e-02 | W451: 0.71430000000000005 | X451: 1.0385 | Y451: 0.57140000000000002 | AA451: =(N451+O451+P451+Q451+R451+S451+T451+U451+V451+W451+X451+Y451)/12 -> 0.70401666666666662 | AB451: =(G451+H451+I451+J451+K451+L451+M451+N451+O451+P451+Q451+R451+S451+T451+U451+V451+W451+X451+Y451)/19 -> 0.4694105263157895 | AC451: =(R451+S451)/2 -> 0.20795 | AD451: =(S451+T451)/2 -> -0.42370000000000002 | AE451: =(T451+U451)/2 -> -0.16445000000000004 | AF451: =(U451+V451)/2 -> 3.8750000000000007e-02 | AG451: =(V451+W451)/2 -> 0.37740000000000001 | AH451: =(W451+X451)/2 -> 0.87640000000000007 | AI451: =(X451+Y451)/2 -> 0.80495000000000005 | AJ451: =STDEV(G451:Y451) -> 0.7880182752355831
B452: 000910.SZ | C452: 大亚圣象
B453: 002984.SZ | C453: 森麒麟
B454: 003019.SZ | C454: 宸展光电
B455: 600500.SH | C455: 中化国际
B456: 600546.SH | C456: 山煤国际
B457: 603611.SH | C457: 诺力股份
B458: 600586.SH | C458: 金晶科技 | G458: 5.46 | H458: 6 | I458: 3 | J458: 2.8194999999999997 | K458: 0.2384 | L458: 1 | M458: 0.42170000000000002 | N458: -0.4587 | O458: 6.7500000000000004e-02 | P458: -0.42859999999999998 | Q458: -0.43380000000000002 | R458: 0.29089999999999999 | S458: -0.51290000000000002 | T458: -0.33500000000000002 | U458: 0.3271 | V458: 2.2393999999999998 | W458: 10.956700000000001 | X458: 9.3008000000000006 | Y458: 5.8120000000000003 | AA458: =(N458+O458+P458+Q458+R458+S458+T458+U458+V458+W458+X458+Y458)/12 -> 2.2354500000000006 | AB458: =(G458+H458+I458+J458+K458+L458+M458+N458+O458+P458+Q458+R458+S458+T458+U458+V458+W458+X458+Y458)/19 -> 2.408684210526316 | AC458: =(R458+S458)/2 -> -0.11100000000000002 | AD458: =(S458+T458)/2 -> -0.42395000000000005 | AE458: =(T458+U458)/2 -> -3.9500000000000091e-03 | AF458: =(U458+V458)/2 -> 1.28325 | AG458: =(V458+W458)/2 -> 6.5980500000000006 | AH458: =(W458+X458)/2 -> 10.12875 | AI458: =(X458+Y458)/2 -> 7.5564 | AJ458: =STDEV(G458:Y458) -> 3.4981310539046988
B459: 600111.SH | C459: 北方稀土 | G459: 9 | H459: 2.4222000000000001 | I459: 9.6666999999999987 | J459: 3.4199999999999999 | K459: 0.5 | L459: 0.94480000000000008 | M459: 8.3299999999999999e-02 | N459: 0.45429999999999998 | O459: 9.6699999999999994e-02 | P459: 0.222 | Q459: 0.22020000000000001 | R459: 5.5999999999999994e-02 | S459: 0.21879999999999999 | T459: 0.28139999999999998 | U459: 0.1537 | V459: 0.35710000000000003 | W459: 4.3466000000000005 | X459: 5.0031999999999996 | Y459: 4.9500999999999999 | AA459: =(N459+O459+P459+Q459+R459+S459+T459+U459+V459+W459+X459+Y459)/12 -> 1.3633416666666667 | AB459: =(G459+H459+I459+J459+K459+L459+M459+N459+O459+P459+Q459+R459+S459+T459+U459+V459+W459+X459+Y459)/19 -> 2.2314263157894736 | AC459: =(R459+S459)/2 -> 0.13739999999999999 | AD459: =(S459+T459)/2 -> 0.25009999999999999 | AE459: =(T459+U459)/2 -> 0.21754999999999999 | AF459: =(U459+V459)/2 -> 0.25540000000000002 | AG459: =(V459+W459)/2 -> 2.3518500000000002 | AH459: =(W459+X459)/2 -> 4.6749000000000001 | AI459: =(X459+Y459)/2 -> 4.9766499999999994 | AJ459: =STDEV(G459:Y459) -> 3.0511874349436305 | AK459: 0.57090000000000007 | AL459: 0.498 | AM459: 0.52079999999999993 | AN459: 0.86470000000000002 | AO459: 0.64180000000000004 | AP459: 0.82579999999999998 | AQ459: 0.60560000000000003 | AR459: 0.49420000000000003 | AS459: 0.4451 | AT459: 0.49130000000000001 | AU459: 0.42520000000000002 | AV459: 0.43430000000000002 | AW459: 9.9199999999999997e-02 | AX459: 3.5400000000000001e-02 | AY459: -5.1999999999999998e-03 | AZ459: 0.15010000000000001 | BA459: 0.39240000000000003 | BB459: 0.60199999999999998 | BC459: 0.72499999999999998 | BE459: =(AR459+AS459+AT459+AU459+AV459+AW459+AX459+AY459+AZ459+BA459+BB459+BC459)/12 -> 0.35741666666666672 | BF459: =(AK459+AL459+AM459+AN459+AO459+AP459+AQ459+AR459+AS459+AT459+AU459+AV459+AV459+AW459+AX459+AY459+AZ459+BA459+BB459+BC459)/19 -> 0.48688947368421059 | BG459: =(AV459+AW459)/2 -> 0.26674999999999999 | BH459: =(AW459+AX459)/2 -> 6.7299999999999999e-02 | BI459: =(AX459+AY459)/2 -> 1.5100000000000001e-02 | BJ459: =(AY459+AZ459)/2 -> 7.2450000000000001e-02 | BK459: =(AZ459+BA459)/2 -> 0.27124999999999999 | BL459: =(BA459+BB459)/2 -> 0.49719999999999998 | BM459: =(BB459+BC459)/2 -> 0.66349999999999998 | BN459: =STDEV(AK459:BC459) -> 0.24620287942316457
B460: 603590.SH | C460: 康辰药业
B461: 002242.SZ | C461: 九阳股份
B462: 600015.SH | C462: 华夏银行
B463: 600325.SH | C463: 华发股份 | E463: 1.1797 | F463: 1.3400000000000001 | G463: 7.6666999999999996 | H463: 0.6875 | I463: 1.2778 | J463: 0.58329999999999993 | K463: 0.40000000000000002 | L463: 1.3703999999999998 | M463: 0.878 | N463: 0.42109999999999997 | O463: -3.5699999999999996e-02 | P463: 3.1300000000000001e-02 | Q463: 6.4899999999999999e-02 | R463: 0.12960000000000002 | S463: 7.4099999999999999e-02 | T463: -3.0299999999999997e-02 | U463: -0.122 | V463: -4.9200000000000001e-02 | W463: -0.13789999999999999 | X463: 0.1406 | Y463: 0.20829999999999999 | AA463: =(N463+O463+P463+Q463+R463+S463+T463+U463+V463+W463+X463+Y463)/12 -> 5.79e-02 | AB463: =(G463+H463+I463+J463+K463+L463+M463+N463+O463+P463+Q463+R463+S463+T463+U463+V463+W463+X463+Y463)/19 -> 0.71360526315789441 | AC463: =(R463+S463)/2 -> 0.10185000000000001 | AD463: =(S463+T463)/2 -> 2.1900000000000003e-02 | AE463: =(T463+U463)/2 -> -7.6149999999999995e-02 | AF463: =(U463+V463)/2 -> -8.5599999999999996e-02 | AG463: =(V463+W463)/2 -> -9.3549999999999994e-02 | AH463: =(W463+X463)/2 -> 1.350000000000004e-03 | AI463: =(X463+Y463)/2 -> 0.17444999999999999 | AJ463: =STDEV(G463:Y463) -> 1.742665500341896 | AK463: -0.15970000000000001 | AL463: -0.34310000000000002 | AM463: -0.34860000000000002 | AN463: -0.17510000000000001 | AO463: 0.31019999999999998 | AP463: 0.57669999999999999 | AQ463: 0.55979999999999996 | AR463: 0.47320000000000001 | AS463: 0.90060000000000007 | AT463: 1.0031000000000001 | AU463: 0.65500000000000003 | AV463: 0.52710000000000001 | AW463: -0.12470000000000001 | AX463: -0.2102 | AY463: -0.1143 | AZ463: 7.6e-03 | BA463: 1.0287999999999999 | BB463: 0.93730000000000002 | BC463: 0.55479999999999996 | BE463: =(AR463+AS463+AT463+AU463+AV463+AW463+AX463+AY463+AZ463+BA463+BB463+BC463)/12 -> 0.46985833333333343 | BF463: =(AK463+AL463+AM463+AN463+AO463+AP463+AQ463+AR463+AS463+AT463+AU463+AV463+AV463+AW463+AX463+AY463+AZ463+BA463+BB463+BC463)/19 -> 0.34661052631578954 | BG463: =(AV463+AW463)/2 -> 0.20119999999999999 | BH463: =(AW463+AX463)/2 -> -0.16744999999999999 | BI463: =(AX463+AY463)/2 -> -0.16225000000000001 | BJ463: =(AY463+AZ463)/2 -> -5.3350000000000002e-02 | BK463: =(AZ463+BA463)/2 -> 0.51819999999999999 | BL463: =(BA463+BB463)/2 -> 0.98304999999999998 | BM463: =(BB463+BC463)/2 -> 0.74604999999999999 | BN463: =STDEV(AK463:BC463) -> 0.48139900758406634
B464: 600606.SH | C464: 绿地控股
B465: 601825.SH | C465: 沪农商行 | V465: -7.8399999999999997e-02 | W465: 0 | X465: 0.17999999999999999 | Y465: 0.1918 | AA465: =(N465+O465+P465+Q465+R465+S465+T465+U465+V465+W465+X465+Y465)/12 -> 2.445e-02 | AB465: =(G465+H465+I465+J465+K465+L465+M465+N465+O465+P465+Q465+R465+S465+T465+U465+V465+W465+X465+Y465)/19 -> 1.5442105263157894e-02 | AC465: =(R465+S465)/2 -> 0 | AD465: =(S465+T465)/2 -> 0 | AE465: =(T465+U465)/2 -> 0 | AF465: =(U465+V465)/2 -> -3.9199999999999999e-02 | AG465: =(V465+W465)/2 -> -3.9199999999999999e-02 | AH465: =(W465+X465)/2 -> 8.9999999999999997e-02 | AI465: =(X465+Y465)/2 -> 0.18590000000000001 | AJ465: =STDEV(G465:Y465) -> 0.13393146257196872 | BA465: 4.53e-02 | BB465: -0.15429999999999999 | BC465: -0.13059999999999999
B466: 603916.SH | C466: 苏博特 | E466: 0.41710000000000003 | F466: 0.873 | I466: 0.2195 | J466: -1.72e-02 | K466: -0.33329999999999999 | L466: 0.90000000000000002 | M466: 0.46000000000000002 | N466: 0.54390000000000005 | O466: 0.59999999999999998 | P466: -0.24559999999999998 | Q466: 0.1096 | R466: 0.29549999999999998 | S466: 0 | T466: 4.6500000000000007e-02 | U466: 0 | V466: 0.21929999999999999 | W466: 0.375 | X466: 0.1333 | Y466: 7.4099999999999999e-02 | AA466: =(N466+O466+P466+Q466+R466+S466+T466+U466+V466+W466+X466+Y466)/12 -> 0.17930000000000001 | AB466: =(I466+J466+K466+L466+M466+N466+O466+P466+Q466+R466+S466+T466+U466+V466+W466+X466+Y466)/17 -> 0.19885882352941178 | AC466: =(R466+S466)/2 -> 0.14774999999999999 | AD466: =(S466+T466)/2 -> 2.3250000000000003e-02 | AE466: =(T466+U466)/2 -> 2.3250000000000003e-02 | AF466: =(U466+V466)/2 -> 0.10965 | AG466: =(V466+W466)/2 -> 0.29715000000000003 | AH466: =(W466+X466)/2 -> 0.25414999999999999 | AI466: =(X466+Y466)/2 -> 0.1037 | AJ466: =STDEV(G466:Y466) -> 0.31009285516362584
B467: 603871.SH | C467: 嘉友国际 | E467: 0.4022 | F467: 0.78300000000000003 | H467: 0.58740000000000003 | I467: 0.15429999999999999 | J467: 0.41479999999999995 | K467: -0.10679999999999999 | L467: -0.29809999999999998 | M467: 1.8799999999999997e-02 | N467: -0.48359999999999997 | O467: -0.42430000000000001 | P467: -0.38319999999999999 | Q467: -0.38850000000000001 | R467: -0.11890000000000001 | S467: -0.50429999999999997 | T467: -0.3397 | U467: -0.22289999999999999 | V467: 4.9100000000000005e-02 | W467: 0.72909999999999997 | X467: 1.8200000000000001e-02 | Y467: -0.12140000000000001 | AA467: =(N467+O467+P467+Q467+R467+S467+T467+U467+V467+W467+X467+Y467)/12 -> -0.18253333333333333 | AB467: =(G467+H467+I467+J467+K467+L467+M467+N467+O467+P467+Q467+R467+S467+T467+U467+V467+W467+X467+Y467)/19 -> -7.4736842105263171e-02 | AC467: =(R467+S467)/2 -> -0.31159999999999999 | AD467: =(S467+T467)/2 -> -0.42199999999999999 | AE467: =(T467+U467)/2 -> -0.28129999999999999 | AF467: =(U467+V467)/2 -> -8.6899999999999991e-02 | AG467: =(V467+W467)/2 -> 0.3891 | AH467: =(W467+X467)/2 -> 0.37364999999999998 | AI467: =(X467+Y467)/2 -> -5.1600000000000007e-02 | AJ467: =STDEV(G467:Y467) -> 0.36167781549636441
B468: 600273.SH | C468: 嘉化能源 | E468: 0.23620000000000002 | F468: 0.85099999999999998 | G468: 0.28570000000000001 | H468: 0.16670000000000001 | I468: 0.24390000000000001 | J468: 0.2281 | K468: 0.11109999999999999 | L468: 0.1143 | M468: 0.13730000000000001 | N468: 7.1399999999999991e-02 | O468: 0.19550000000000001 | P468: 0.18129999999999999 | Q468: 0.15620000000000001 | R468: 0.17329999999999998 | S468: -0.26850000000000002 | T468: -0.13500000000000001 | U468: -8.8100000000000012e-02 | V468: 3.4099999999999998e-02 | W468: 0.35560000000000003 | X468: 0.28160000000000002 | Y468: 0.41359999999999997 | AA468: =(N468+O468+P468+Q468+R468+S468+T468+U468+V468+W468+X468+Y468)/12 -> 0.11425000000000002 | AB468: =(G468+H468+I468+J468+K468+L468+M468+N468+O468+P468+Q468+R468+S468+T468+U468+V468+W468+X468+Y468)/19 -> 0.1399 | AC468: =(R468+S468)/2 -> -4.7600000000000017e-02 | AD468: =(S468+T468)/2 -> -0.20175000000000001 | AE468: =(T468+U468)/2 -> -0.11155000000000001 | AF468: =(U468+V468)/2 -> -2.7000000000000007e-02 | AG468: =(V468+W468)/2 -> 0.19485000000000002 | AH468: =(W468+X468)/2 -> 0.31859999999999999 | AI468: =(X468+Y468)/2 -> 0.34760000000000002 | AJ468: =STDEV(G468:Y468) -> 0.16666612999913596 | AK468: 0.28110000000000002 | AL468: 0.1555 | AM468: 0.2084 | AN468: 0.1305 | AO468: 0.30969999999999998 | AP468: 0.2354 | AQ468: 0.16539999999999999 | AR468: 3.04e-02 | AS468: 0.1381 | AT468: 1.2e-02 | AU468: 3.3599999999999998e-02 | AV468: 3.44e-02 | AW468: -0.22 | AX468: -8.1300000000000011e-02 | AY468: -0.1321 | AZ468: -5.6299999999999996e-02 | BA468: -1.38e-02 | BB468: 0.1704 | BC468: 0.3579 | BE468: =(AR468+AS468+AT468+AU468+AV468+AW468+AX468+AY468+AZ468+BA468+BB468+BC468)/12 -> 2.2775e-02 | BF468: =(AK468+AL468+AM468+AN468+AO468+AP468+AQ468+AR468+AS468+AT468+AU468+AV468+AV468+AW468+AX468+AY468+AZ468+BA468+BB468+BC468)/19 -> 9.4405263157894728e-02 | BG468: =(AV468+AW468)/2 -> -9.2799999999999994e-02 | BH468: =(AW468+AX468)/2 -> -0.15065000000000001 | BI468: =(AX468+AY468)/2 -> -0.1067 | BJ468: =(AY468+AZ468)/2 -> -9.4199999999999992e-02 | BK468: =(AZ468+BA468)/2 -> -3.5049999999999998e-02 | BL468: =(BA468+BB468)/2 -> 7.8299999999999995e-02 | BM468: =(BB468+BC468)/2 -> 0.26415 | BN468: =STDEV(AK468:BC468) -> 0.15542802004530804
B469: 600900.SH | C469: 长江电力 | E469: 0.46789999999999998 | F469: 1.163 | G469: 0.23469999999999999 | H469: 7.3399999999999993e-02 | I469: 9.5600000000000004e-02 | J469: 7.1199999999999999e-02 | K469: 4.5499999999999999e-02 | L469: 5.16e-02 | M469: 9.3999999999999986e-03 | N469: 1.5700000000000002e-02 | O469: 2.9500000000000002e-02 | P469: 5.8999999999999999e-03 | Q469: -5.0000000000000001e-03 | R469: -4.7300000000000002e-02 | S469: -0.21429999999999999 | T469: -7.8299999999999995e-02 | U469: 0.1356 | V469: 0.21050000000000002 | W469: 0.21230000000000002 | X469: 5.0700000000000002e-02 | Y469: -6.5299999999999997e-02 | AA469: =(N469+O469+P469+Q469+R469+S469+T469+U469+V469+W469+X469+Y469)/12 -> 2.0833333333333343e-02 | AB469: =(G469+H469+I469+J469+K469+L469+M469+N469+O469+P469+Q469+R469+S469+T469+U469+V469+W469+X469+Y469)/19 -> 4.37578947368421e-02 | AC469: =(R469+S469)/2 -> -0.1308 | AD469: =(S469+T469)/2 -> -0.14629999999999999 | AE469: =(T469+U469)/2 -> 2.8650000000000002e-02 | AF469: =(U469+V469)/2 -> 0.17305000000000001 | AG469: =(V469+W469)/2 -> 0.21140000000000003 | AH469: =(W469+X469)/2 -> 0.13150000000000001 | AI469: =(X469+Y469)/2 -> -7.2999999999999975e-03 | AJ469: =STDEV(G469:Y469) -> 0.10883065497362546
B470: 001215.SZ | C470: 千味央厨 | E470: 0.2777 | F470: 0.65300000000000002 | W470: -3.8800000000000001e-02 | X470: 0.5 | Y470: 0.13159999999999999 | AA470: =(N470+O470+P470+Q470+R470+S470+T470+U470+V470+W470+X470+Y470)/12 -> 4.9399999999999999e-02 | AB470: =(G470+H470+I470+J470+K470+L470+M470+N470+O470+P470+Q470+R470+S470+T470+U470+V470+W470+X470+Y470)/19 -> 3.1199999999999999e-02 | AC470: =(R470+S470)/2 -> 0 | AD470: =(S470+T470)/2 -> 0 | AE470: =(T470+U470)/2 -> 0 | AF470: =(U470+V470)/2 -> 0 | AG470: =(V470+W470)/2 -> -1.9400000000000001e-02 | AH470: =(W470+X470)/2 -> 0.2306 | AI470: =(X470+Y470)/2 -> 0.31579999999999997 | AJ470: =STDEV(G470:Y470) -> 0.27539673200675419
B471: 600177.SH | C471: 雅戈尔
B472: 600329.SH | C472: 中新药业 | G472: 8.9700000000000002e-02 | H472: 7.1399999999999991e-02 | I472: 2.1700000000000001e-02 | J472: 0.1273 | K472: 0.35289999999999999 | L472: 0.1333 | M472: 0.1085 | N472: 0.17739999999999997 | O472: 7.3899999999999993e-02 | P472: 0.10289999999999999 | Q472: 0.11320000000000001 | R472: 0.1096 | S472: -0.10929999999999999 | T472: -6.6699999999999995e-02 | U472: 6.9000000000000006e-02 | V472: 6.1699999999999998e-02 | W472: 0.2727 | X472: 0.42859999999999998 | Y472: 0.3871 | AA472: =(N472+O472+P472+Q472+R472+S472+T472+U472+V472+W472+X472+Y472)/12 -> 0.13500833333333334 | AB472: =(G472+H472+I472+J472+K472+L472+M472+N472+O472+P472+Q472+R472+S472+T472+U472+V472+W472+X472+Y472)/19 -> 0.1328894736842105 | AC472: =(R472+S472)/2 -> 1.500000000000043e-04 | AD472: =(S472+T472)/2 -> -8.7999999999999995e-02 | AE472: =(T472+U472)/2 -> 1.1500000000000052e-03 | AF472: =(U472+V472)/2 -> 6.5350000000000005e-02 | AG472: =(V472+W472)/2 -> 0.16719999999999999 | AH472: =(W472+X472)/2 -> 0.35065000000000002 | AI472: =(X472+Y472)/2 -> 0.40784999999999999 | AJ472: =STDEV(G472:Y472) -> 0.14015603564415405 | AK472: -0.115 | AL472: -5.0700000000000002e-02 | AM472: -4.0599999999999997e-02 | AN472: -1.5300000000000001e-02 | AO472: 0.18410000000000001 | AP472: 9.8800000000000013e-02 | AQ472: 9.4899999999999998e-02 | AR472: 0.11509999999999999 | AS472: -3.1800000000000002e-02 | AT472: 2.4700000000000003e-02 | AU472: 4.36e-02 | AV472: 8.1900000000000001e-02 | AW472: -0.16879999999999998 | AX472: -8.1300000000000011e-02 | AY472: -4.07e-02 | AZ472: -5.7999999999999996e-02 | BA472: 0.27160000000000001 | BB472: 0.25269999999999998 | BC472: 0.26750000000000002 | BE472: =(AR472+AS472+AT472+AU472+AV472+AW472+AX472+AY472+AZ472+BA472+BB472+BC472)/12 -> 5.6375000000000001e-02 | BF472: =(AK472+AL472+AM472+AN472+AO472+AP472+AQ472+AR472+AS472+AT472+AU472+AV472+AV472+AW472+AX472+AY472+AZ472+BA472+BB472+BC472)/19 -> 4.8136842105263165e-02 | BG472: =(AV472+AW472)/2 -> -4.3449999999999989e-02 | BH472: =(AW472+AX472)/2 -> -0.12504999999999999 | BI472: =(AX472+AY472)/2 -> -6.1000000000000006e-02 | BJ472: =(AY472+AZ472)/2 -> -4.9349999999999998e-02 | BK472: =(AZ472+BA472)/2 -> 0.10680000000000001 | BL472: =(BA472+BB472)/2 -> 0.26214999999999999 | BM472: =(BB472+BC472)/2 -> 0.2601 | BN472: =STDEV(AK472:BC472) -> 0.13051727362096671
B473: 600508.SH | C473: 上海能源
B474: 601800.SH | C474: 中国交建 | E474: 0.74639999999999995 | F474: 0.85999999999999999 | G474: 0.35710000000000003 | H474: 7.8899999999999998e-02 | I474: 4.6900000000000004e-02 | J474: 0.24739999999999998 | K474: 0.10529999999999999 | L474: 9.7599999999999992e-02 | M474: 0.1045 | N474: -4.9599999999999998e-02 | O474: 0.1429 | P474: 4.4400000000000002e-02 | Q474: 2.7000000000000003e-02 | R474: 8.6999999999999994e-03 | S474: -0.45829999999999999 | T474: -0.46810000000000002 | U474: -0.27629999999999999 | V474: -0.22409999999999999 | W474: 0.92310000000000003 | X474: 1.24 | Y474: 0.56359999999999999 | AA474: =(N474+O474+P474+Q474+R474+S474+T474+U474+V474+W474+X474+Y474)/12 -> 0.12277500000000001 | AB474: =(G474+H474+I474+J474+K474+L474+M474+N474+O474+P474+Q474+R474+S474+T474+U474+V474+W474+X474+Y474)/19 -> 0.13215789473684211 | AC474: =(R474+S474)/2 -> -0.2248 | AD474: =(S474+T474)/2 -> -0.4632 | AE474: =(T474+U474)/2 -> -0.37219999999999998 | AF474: =(U474+V474)/2 -> -0.25019999999999998 | AG474: =(V474+W474)/2 -> 0.34950000000000003 | AH474: =(W474+X474)/2 -> 1.08155 | AI474: =(X474+Y474)/2 -> 0.90179999999999993 | AJ474: =STDEV(G474:Y474) -> 0.42068540676138066
B475: 603283.SH | C475: 赛腾股份
B476: 605068.SH | C476: 明新旭腾 | E476: 0.29469999999999996 | F476: 0.85799999999999998 | U476: 0.43819999999999998 | V476: 0.19440000000000002 | W476: 0.51719999999999999 | X476: -0.2051 | Y476: -0.3281 | AA476: =(N476+O476+P476+Q476+R476+S476+T476+U476+V476+W476+X476+Y476)/12 -> 5.1383333333333316e-02 | AB476: =(G476+H476+I476+J476+K476+L476+M476+N476+O476+P476+Q476+R476+S476+T476+U476+V476+W476+X476+Y476)/19 -> 3.2452631578947358e-02 | AC476: =(R476+S476)/2 -> 0 | AD476: =(S476+T476)/2 -> 0 | AE476: =(T476+U476)/2 -> 0.21909999999999999 | AF476: =(U476+V476)/2 -> 0.31630000000000003 | AG476: =(V476+W476)/2 -> 0.35580000000000001 | AH476: =(W476+X476)/2 -> 0.15604999999999999 | AI476: =(X476+Y476)/2 -> -0.2666 | AJ476: =STDEV(G476:Y476) -> 0.37781706816923977
B477: 002208.SZ | C477: 合肥城建 | E477: 0.50919999999999999 | F477: 0.85699999999999998 | G477: -0.39590000000000003 | H477: -0.56030000000000002 | I477: -0.66969999999999996 | J477: 0.22 | K477: -0.93279999999999996 | L477: 2.3841999999999999 | M477: 4.1004000000000005 | N477: 0.16510000000000002 | O477: 20.300000000000001 | P477: 0.3029 | Q477: 0.23999999999999999 | R477: 0.56069999999999998 | S477: 0.93579999999999997 | T477: -5.4000000000000003e-03 | U477: 0.54090000000000005 | V477: 0.37780000000000002 | W477: 0.25900000000000001 | X477: 0.95409999999999995 | Y477: 0.27949999999999997 | AA477: =(N477+O477+P477+Q477+R477+S477+T477+U477+V477+W477+X477+Y477)/12 -> 2.0758666666666667 | AB477: =(G477+H477+I477+J477+K477+L477+M477+N477+O477+P477+Q477+R477+S477+T477+U477+V477+W477+X477+Y477)/19 -> 1.529278947368421 | AC477: =(R477+S477)/2 -> 0.74824999999999997 | AD477: =(S477+T477)/2 -> 0.4652 | AE477: =(T477+U477)/2 -> 0.26775000000000004 | AF477: =(U477+V477)/2 -> 0.45935000000000004 | AG477: =(V477+W477)/2 -> 0.31840000000000002 | AH477: =(W477+X477)/2 -> 0.60654999999999992 | AI477: =(X477+Y477)/2 -> 0.61680000000000001 | AJ477: =STDEV(G477:Y477) -> 4.6835868506210012 | AK477: -8.1500000000000003e-02 | AL477: -6.1399999999999996e-02 | AM477: -0.12909999999999999 | AN477: -0.22899999999999998 | AO477: 0.1726 | AP477: 0.24050000000000002 | AQ477: 0.33360000000000001 | AR477: 0.3306 | AS477: 0.61819999999999997 | AT477: 0.64080000000000004 | AU477: 0.33390000000000003 | AV477: 0.33169999999999999 | AW477: -0.55920000000000003 | AX477: -0.57799999999999996 | AY477: -0.57740000000000002 | AZ477: -0.42950000000000005 | BA477: 3.8901999999999997 | BB477: 1.9737 | BC477: 1.9080000000000001 | BE477: =(AR477+AS477+AT477+AU477+AV477+AW477+AX477+AY477+AZ477+BA477+BB477+BC477)/12 -> 0.6569166666666667 | BF477: =(AK477+AL477+AM477+AN477+AO477+AP477+AQ477+AR477+AS477+AT477+AU477+AV477+AV477+AW477+AX477+AY477+AZ477+BA477+BB477+BC477)/19 -> 0.44528421052631578 | BG477: =(AV477+AW477)/2 -> -0.11375000000000002 | BH477: =(AW477+AX477)/2 -> -0.56859999999999999 | BI477: =(AX477+AY477)/2 -> -0.57769999999999999 | BJ477: =(AY477+AZ477)/2 -> -0.50345000000000006 | BK477: =(AZ477+BA477)/2 -> 1.7303499999999998 | BL477: =(BA477+BB477)/2 -> 2.9319499999999996 | BM477: =(BB477+BC477)/2 -> 1.9408500000000002 | BN477: =STDEV(AK477:BC477) -> 1.0994603710922641
B478: 002864.SZ | C478: 盘龙药业
B479: 600062.SH | C479: 华润双鹤
B480: 000935.SZ | C480: 四川双马 | E480: 7.5399999999999995e-02 | F480: 0.84999999999999998 | G480: 0.5 | H480: 2.5 | I480: 1 | J480: 1.4544999999999999 | K480: 14 | L480: 4.4286000000000003 | M480: 4.4167000000000005 | N480: 2.3704000000000001 | O480: 0.69230000000000003 | P480: 0.3947 | Q480: 0.1231 | R480: 4.4000000000000004e-02 | S480: -0.2273 | T480: -5.6600000000000004e-02 | U480: 0.24660000000000001 | V480: 0.22109999999999999 | W480: 0.58820000000000006 | X480: 0.20000000000000001 | Y480: -6.59e-02 | AA480: =(N480+O480+P480+Q480+R480+S480+T480+U480+V480+W480+X480+Y480)/12 -> 0.37755 | AB480: =(G480+H480+I480+J480+K480+L480+M480+N480+O480+P480+Q480+R480+S480+T480+U480+V480+W480+X480+Y480)/19 -> 1.7279157894736845 | AC480: =(R480+S480)/2 -> -9.1649999999999995e-02 | AD480: =(S480+T480)/2 -> -0.14194999999999999 | AE480: =(T480+U480)/2 -> 9.5000000000000001e-02 | AF480: =(U480+V480)/2 -> 0.23385 | AG480: =(V480+W480)/2 -> 0.40465000000000001 | AH480: =(W480+X480)/2 -> 0.39410000000000001 | AI480: =(X480+Y480)/2 -> 6.7049999999999998e-02 | AJ480: =STDEV(G480:Y480) -> 3.2899930883519364
B481: 002594.SZ | C481: 比亚迪 | G481: -0.375 | H481: -0.32179999999999997 | I481: -0.30430000000000001 | J481: -0.25530000000000003 | K481: -0.90000000000000002 | L481: -0.77969999999999995 | M481: -0.48960000000000004 | N481: -0.3357 | O481: 11.5 | P481: 2.7692000000000001 | Q481: 4.0800000000000003e-02 | R481: -0.46240000000000003 | S481: -0.92000000000000004 | T481: 0.1429 | U481: 1.3137000000000001 | V481: 1.9399999999999999 | W481: 3 | X481: -0.26789999999999997 | Y481: -0.2797 | AA481: =(N481+O481+P481+Q481+R481+S481+T481+U481+V481+W481+X481+Y481)/12 -> 1.5367416666666669 | AB481: =(G481+H481+I481+J481+K481+L481+M481+N481+O481+P481+Q481+R481+S481+T481+U481+V481+W481+X481+Y481)/19 -> 0.79027368421052635 | AC481: =(R481+S481)/2 -> -0.69120000000000004 | AD481: =(S481+T481)/2 -> -0.38855000000000001 | AE481: =(T481+U481)/2 -> 0.72830000000000006 | AF481: =(U481+V481)/2 -> 1.6268500000000001 | AG481: =(V481+W481)/2 -> 2.4699999999999998 | AH481: =(W481+X481)/2 -> 1.36605 | AI481: =(X481+Y481)/2 -> -0.27379999999999999 | AJ481: =STDEV(G481:Y481) -> 2.8474779462304896
B482: 002832.SZ | C482: 比音勒芬 | E482: 0.27550000000000002 | F482: 0.81999999999999995 | G482: -9.6799999999999997e-02 | H482: -0.46509999999999996 | I482: -0.42420000000000002 | J482: -0.40360000000000001 | K482: -0.16070000000000001 | L482: -0.13039999999999999 | M482: -0.11840000000000001 | N482: -4.0399999999999998e-02 | O482: -0.10640000000000001 | P482: -0.17499999999999999 | Q482: -0.11939999999999999 | R482: -0.1789 | S482: -0.54759999999999998 | T482: -6.0599999999999994e-02 | U482: 0.1356 | V482: 0.16670000000000001 | W482: 0.52629999999999999 | X482: 0.4839 | Y482: 0.26869999999999999 | AA482: =(N482+O482+P482+Q482+R482+S482+T482+U482+V482+W482+X482+Y482)/12 -> 2.9408333333333338e-02 | AB482: =(G482+H482+I482+J482+K482+L482+M482+N482+O482+P482+Q482+R482+S482+T482+U482+V482+W482+X482+Y482)/19 -> -7.612105263157895e-02 | AC482: =(R482+S482)/2 -> -0.36324999999999996 | AD482: =(S482+T482)/2 -> -0.30409999999999998 | AE482: =(T482+U482)/2 -> 3.7500000000000006e-02 | AF482: =(U482+V482)/2 -> 0.15115000000000001 | AG482: =(V482+W482)/2 -> 0.34650000000000003 | AH482: =(W482+X482)/2 -> 0.50509999999999999 | AI482: =(X482+Y482)/2 -> 0.37629999999999997 | AJ482: =STDEV(G482:Y482) -> 0.29232638072109923
B483: 600993.SH | C483: 马应龙
B484: 603192.SH | C484: 汇得科技 | E484: 0.46340000000000003 | F484: 0.84999999999999998 | L484: 0.12119999999999999 | M484: 2.7999999999999997e-02 | N484: -5.7999999999999996e-02 | O484: -0.16670000000000001 | P484: -0.16219999999999998 | Q484: -0.13639999999999999 | R484: -4.6199999999999998e-02 | S484: -0.32000000000000001 | T484: -0.371 | U484: -0.30530000000000002 | V484: -6.4500000000000002e-02 | W484: 0.4118 | X484: 0.33329999999999999 | Y484: 0.28789999999999999 | AA484: =(N484+O484+P484+Q484+R484+S484+T484+U484+V484+W484+X484+Y484)/12 -> -4.9774999999999993e-02 | AB484: =(G484+H484+I484+J484+K484+L484+M484+N484+O484+P484+Q484+R484+S484+T484+U484+V484+W484+X484+Y484)/19 -> -2.3584210526315791e-02 | AC484: =(R484+S484)/2 -> -0.18310000000000001 | AD484: =(S484+T484)/2 -> -0.34550000000000003 | AE484: =(T484+U484)/2 -> -0.33815000000000001 | AF484: =(U484+V484)/2 -> -0.18490000000000001 | AG484: =(V484+W484)/2 -> 0.17365 | AH484: =(W484+X484)/2 -> 0.37254999999999999 | AI484: =(X484+Y484)/2 -> 0.31059999999999999 | AJ484: =STDEV(G484:Y484) -> 0.24499545510473866
B485: 603298.SH | C485: 杭叉集团 | G485: -5.0000000000000003e-02 | H485: 4.6500000000000007e-02 | I485: 1.6899999999999998e-02 | J485: 1.32e-02 | K485: 0 | L485: 0.1333 | M485: 0.14999999999999999 | N485: 0.1429 | O485: 0.21050000000000002 | P485: -0.2157 | Q485: -0.2029 | R485: -0.15909999999999999 | S485: -0.21739999999999998 | T485: 0.17499999999999999 | U485: 0.30909999999999999 | V485: 0.31079999999999997 | W485: 0.38890000000000002 | X485: 0.23399999999999999 | Y485: 0.18059999999999998 | AA485: =(N485+O485+P485+Q485+R485+S485+T485+U485+V485+W485+X485+Y485)/12 -> 9.6391666666666653e-02 | AB485: =(G485+H485+I485+J485+K485+L485+M485+N485+O485+P485+Q485+R485+S485+T485+U485+V485+W485+X485+Y485)/19 -> 7.718947368421053e-02 | AC485: =(R485+S485)/2 -> -0.18824999999999997 | AD485: =(S485+T485)/2 -> -2.1199999999999997e-02 | AE485: =(T485+U485)/2 -> 0.24204999999999999 | AF485: =(U485+V485)/2 -> 0.30994999999999995 | AG485: =(V485+W485)/2 -> 0.34984999999999999 | AH485: =(W485+X485)/2 -> 0.31145 | AI485: =(X485+Y485)/2 -> 0.20729999999999998 | AJ485: =STDEV(G485:Y485) -> 0.18537740151958126
B486: 600808.SH | C486: 马钢股份
B487: 002585.SZ | C487: 双星新材 | E487: 0.21010000000000001 | F487: 0.84199999999999997 | G487: -0.14199999999999999 | H487: 9.1999999999999998e-03 | I487: -2.0799999999999999e-02 | J487: -0.52450000000000008 | K487: 0.30769999999999997 | L487: 0.54579999999999995 | M487: 0.92769999999999997 | N487: 3.1298000000000004 | O487: -0.3226 | P487: -0.48930000000000001 | Q487: -0.49229999999999996 | R487: -0.46429999999999999 | S487: 1 | T487: 1.913 | U487: 2.3912999999999998 | V487: 3.1532999999999998 | W487: 2.1446999999999998 | X487: 1.597 | Y487: 1.159 | AA487: =(N487+O487+P487+Q487+R487+S487+T487+U487+V487+W487+X487+Y487)/12 -> 1.2266333333333332 | AB487: =(G487+H487+I487+J487+K487+L487+M487+N487+O487+P487+Q487+R487+S487+T487+U487+V487+W487+X487+Y487)/19 -> 0.83277368421052633 | AC487: =(R487+S487)/2 -> 0.26785000000000003 | AD487: =(S487+T487)/2 -> 1.4565000000000001 | AE487: =(T487+U487)/2 -> 2.1521499999999998 | AF487: =(U487+V487)/2 -> 2.7722999999999995 | AG487: =(V487+W487)/2 -> 2.649 | AH487: =(W487+X487)/2 -> 1.8708499999999999 | AI487: =(X487+Y487)/2 -> 1.3780000000000001 | AJ487: =STDEV(G487:Y487) -> 1.2423977337042476
B488: 002169.SZ | C488: 智光电气
B489: 000703.SZ | C489: 恒逸石化
B490: 000902.SZ | C490: 新洋丰 | G490: 6.25e-02 | H490: -5.7099999999999998e-02 | I490: 9.7599999999999992e-02 | J490: 0.20929999999999999 | K490: 0.26350000000000001 | L490: 0.24239999999999998 | M490: 0.24440000000000001 | N490: 0.21149999999999999 | O490: 0.20899999999999999 | P490: 0.17069999999999999 | Q490: -0.125 | R490: -0.20629999999999998 | S490: -0.4224 | T490: -0.1875 | U490: 0.26530000000000004 | V490: 0.5 | W490: 0.80000000000000004 | X490: 0.43590000000000001 | Y490: 0.35479999999999995 | AA490: =(N490+O490+P490+Q490+R490+S490+T490+U490+V490+W490+X490+Y490)/12 -> 0.16716666666666666 | AB490: =(G490+H490+I490+J490+K490+L490+M490+N490+O490+P490+Q490+R490+S490+T490+U490+V490+W490+X490+Y490)/19 -> 0.16150526315789476 | AC490: =(R490+S490)/2 -> -0.31435000000000002 | AD490: =(S490+T490)/2 -> -0.30495 | AE490: =(T490+U490)/2 -> 3.8900000000000018e-02 | AF490: =(U490+V490)/2 -> 0.38265000000000005 | AG490: =(V490+W490)/2 -> 0.65000000000000002 | AH490: =(W490+X490)/2 -> 0.61795 | AI490: =(X490+Y490)/2 -> 0.39534999999999998 | AJ490: =STDEV(G490:Y490) -> 0.28071492157165862
B491: 002986.SZ | C491: 宇新股份 | E491: 0.17559999999999998 | F491: 0.83999999999999997 | R491: 0.36359999999999998 | S491: -0.2727 | T491: -0.51400000000000001 | U491: -0.88739999999999997 | V491: -0.88769999999999993 | W491: -0.28120000000000001 | X491: 0.32689999999999997 | Y491: 2.3599999999999999 | AA491: =(N491+O491+P491+Q491+R491+S491+T491+U491+V491+W491+X491+Y491)/12 -> 1.7291666666666667e-02 | AB491: =(G491+H491+I491+J491+K491+L491+M491+N491+O491+P491+Q491+R491+S491+T491+U491+V491+W491+X491+Y491)/19 -> 1.0921052631578948e-02 | AC491: =(R491+S491)/2 -> 4.544999999999999e-02 | AD491: =(S491+T491)/2 -> -0.39334999999999998 | AE491: =(T491+U491)/2 -> -0.70069999999999999 | AF491: =(U491+V491)/2 -> -0.88754999999999995 | AG491: =(V491+W491)/2 -> -0.58444999999999991 | AH491: =(W491+X491)/2 -> 2.2849999999999981e-02 | AI491: =(X491+Y491)/2 -> 1.3434499999999998 | AJ491: =STDEV(G491:Y491) -> 1.0553544644031758 | AS491: -5.6399999999999999e-02 | AT491: -0.3049 | AU491: -0.2964 | AV491: -0.28000000000000003 | AW491: -0.20850000000000002 | AX491: -3.7100000000000001e-02 | AY491: 0.21739999999999998 | AZ491: 0.2011 | BA491: -3.7100000000000001e-02 | BB491: 0.21739999999999998 | BC491: 0.2011 | BE491: =(AR491+AS491+AT491+AU491+AV491+AW491+AX491+AY491+AZ491+BA491+BB491+BC491)/12 -> -3.1949999999999985e-02 | BF491: =(AK491+AL491+AM491+AN491+AO491+AP491+AQ491+AR491+AS491+AT491+AU491+AV491+AV491+AW491+AX491+AY491+AZ491+BA491+BB491+BC491)/19 -> -3.4915789473684199e-02 | BG491: =(AV491+AW491)/2 -> -0.24425000000000002 | BH491: =(AW491+AX491)/2 -> -0.12280000000000001 | BI491: =(AX491+AY491)/2 -> 9.0149999999999994e-02 | BJ491: =(AY491+AZ491)/2 -> 0.20924999999999999 | BK491: =(AZ491+BA491)/2 -> 8.2000000000000003e-02 | BL491: =(BA491+BB491)/2 -> 9.0149999999999994e-02 | BM491: =(BB491+BC491)/2 -> 0.20924999999999999 | BN491: =STDEV(AK491:BC491) -> 0.21694877443136831
B492: 601169.SH | C492: 北京银行
B493: 603228.SH | C493: 景旺电子 | E493: 0.47110000000000002 | F493: 0.83299999999999996 | G493: 0.27589999999999998 | H493: 0.13239999999999999 | I493: 0.114 | J493: 8.72e-02 | K493: 2.7000000000000003e-02 | L493: 0.24679999999999999 | M493: 0.21260000000000001 | N493: -0.12960000000000002 | O493: -0.15789999999999998 | P493: -0.45829999999999999 | Q493: -0.5 | R493: -0.27660000000000001 | S493: -0.1875 | T493: 9.6199999999999994e-02 | U493: 6.4899999999999999e-02 | V493: 7.8399999999999997e-02 | W493: 0.15380000000000002 | X493: -3.5099999999999999e-02 | Y493: 2.4399999999999998e-02 | AA493: =(N493+O493+P493+Q493+R493+S493+T493+U493+V493+W493+X493+Y493)/12 -> -0.11060833333333332 | AB493: =(G493+H493+I493+J493+K493+L493+M493+N493+O493+P493+Q493+R493+S493+T493+U493+V493+W493+X493+Y493)/19 -> -1.2178947368421065e-02 | AC493: =(R493+S493)/2 -> -0.23205000000000001 | AD493: =(S493+T493)/2 -> -4.5650000000000003e-02 | AE493: =(T493+U493)/2 -> 8.0549999999999997e-02 | AF493: =(U493+V493)/2 -> 7.1649999999999991e-02 | AG493: =(V493+W493)/2 -> 0.11610000000000001 | AH493: =(W493+X493)/2 -> 5.9350000000000014e-02 | AI493: =(X493+Y493)/2 -> -5.3500000000000006e-03 | AJ493: =STDEV(G493:Y493) -> 0.22070547135882085
B494: 000498.SZ | C494: 山东路桥 | E494: 0.78769999999999996 | F494: 1.3600000000000001 | G494: 13.578900000000001 | H494: 0.95269999999999999 | I494: 0.6581999999999999 | J494: 0.3407 | K494: 0.20499999999999999 | L494: -0.47920000000000001 | M494: -0.1462 | N494: 0.16510000000000002 | O494: 2.5556000000000001 | P494: 0.34470000000000001 | Q494: 0.1075 | R494: -0.106 | S494: 8.199999999999999e-02 | T494: 1.5448 | U494: 0.76329999999999998 | V494: 1.0946 | W494: -7.5800000000000006e-02 | X494: 0.2155 | Y494: 0.36170000000000002 | AA494: =(N494+O494+P494+Q494+R494+S494+T494+U494+V494+W494+X494+Y494)/12 -> 0.58774999999999988 | AB494: =(G494+H494+I494+J494+K494+L494+M494+N494+O494+P494+Q494+R494+S494+T494+U494+V494+W494+X494+Y494)/19 -> 1.1664789473684209 | AC494: =(R494+S494)/2 -> -1.2000000000000004e-02 | AD494: =(S494+T494)/2 -> 0.81340000000000001 | AE494: =(T494+U494)/2 -> 1.15405 | AF494: =(U494+V494)/2 -> 0.92894999999999994 | AG494: =(V494+W494)/2 -> 0.50939999999999996 | AH494: =(W494+X494)/2 -> 6.9849999999999995e-02 | AI494: =(X494+Y494)/2 -> 0.28860000000000002 | AJ494: =STDEV(G494:Y494) -> 3.0852749592178337
B495: 002459.SZ | C495: 晶澳科技 | E495: 0.71019999999999994 | F495: 0.82099999999999995 | W495: -0.53569999999999995 | X495: -0.1346 | Y495: -0.13539999999999999 | AA495: =(N495+O495+P495+Q495+R495+S495+T495+U495+V495+W495+X495+Y495)/12 -> -6.7141666666666655e-02 | AB495: =(G495+H495+I495+J495+K495+L495+M495+N495+O495+P495+Q495+R495+S495+T495+U495+V495+W495+X495+Y495)/19 -> -4.2405263157894731e-02 | AC495: =(R495+S495)/2 -> 0 | AD495: =(S495+T495)/2 -> 0 | AE495: =(T495+U495)/2 -> 0 | AF495: =(U495+V495)/2 -> 0 | AG495: =(V495+W495)/2 -> -0.26784999999999998 | AH495: =(W495+X495)/2 -> -0.33514999999999995 | AI495: =(X495+Y495)/2 -> -0.13500000000000001 | AJ495: =STDEV(G495:Y495) -> 0.23134459866902732
B496: 002961.SZ | C496: 瑞达期货
B497: 002987.SZ | C497: 京北方 | E497: 0.18760000000000002 | F497: 0.82999999999999996 | R497: 1.2307999999999999 | S497: 5.2600000000000001e-02 | T497: 0.11359999999999999 | U497: -6.1200000000000004e-02 | V497: 0.28970000000000001 | W497: 0.65000000000000002 | X497: 0.10199999999999999 | Y497: -9.7799999999999998e-02
B498: 002991.SZ | C498: 甘源食品
B499: 601998.SH | C499: 中信银行
B500: 603187.SH | C500: 海容冷链
B501: 603355.SH | C501: 莱克电气
B502: 603515.SH | C502: 欧普照明
B503: 605058.SH | C503: 澳弘电子
B504: 002757.SZ | C504: 南兴股份
B505: 002396.SZ | C505: 星网锐捷
B506: 001219.SZ | C506: 青岛食品 | V506: 5.3099999999999994e-02 | W506: -0.1429 | X506: -0.14999999999999999 | Y506: -9.8900000000000002e-02 | AA506: =(N506+O506+P506+Q506+R506+S506+T506+U506+V506+W506+X506+Y506)/12 -> -2.8225e-02 | AB506: =(G506+H506+I506+J506+K506+L506+M506+N506+O506+P506+Q506+R506+S506+T506+U506+V506+W506+X506+Y506)/19 -> -1.7826315789473683e-02 | AC506: =(R506+S506)/2 -> 0 | AD506: =(S506+T506)/2 -> 0 | AE506: =(T506+U506)/2 -> 0 | AF506: =(U506+V506)/2 -> 2.6549999999999997e-02 | AG506: =(V506+W506)/2 -> -4.4900000000000002e-02 | AH506: =(W506+X506)/2 -> -0.14645 | AI506: =(X506+Y506)/2 -> -0.12445000000000001 | AJ506: =STDEV(G506:Y506) -> 9.4590005638368932e-02
B507: 003013.SZ | C507: 地铁设计 | T507: 6.8199999999999997e-02 | U507: 0.22640000000000002 | V507: 0.18179999999999999 | W507: 0.13639999999999999 | X507: 0.27660000000000001 | Y507: 0.26150000000000001 | AA507: =(N507+O507+P507+Q507+R507+S507+T507+U507+V507+W507+X507+Y507)/12 -> 9.5908333333333332e-02 | AB507: =(G507+H507+I507+J507+K507+L507+M507+N507+O507+P507+Q507+R507+S507+T507+U507+V507+W507+X507+Y507)/19 -> 6.0573684210526314e-02 | AC507: =(R507+S507)/2 -> 0 | AD507: =(S507+T507)/2 -> 3.4099999999999998e-02 | AE507: =(T507+U507)/2 -> 0.14730000000000001 | AF507: =(U507+V507)/2 -> 0.2041 | AG507: =(V507+W507)/2 -> 0.15909999999999999 | AH507: =(W507+X507)/2 -> 0.20650000000000002 | AI507: =(X507+Y507)/2 -> 0.26905000000000001 | AJ507: =STDEV(G507:Y507) -> 7.9614581997688519e-02 | AX507: 0.45979999999999999 | AY507: 0.47310000000000002 | AZ507: 0.1822 | BA507: 8.0000000000000004e-04 | BB507: -0.18010000000000001 | BC507: -3.9699999999999999e-02
B508: 600548.SH | C508: 深高速 | E508: 0.53080000000000005 | F508: 0.82 | G508: 0.30430000000000001 | H508: 0.1454 | I508: 0.23269999999999999 | J508: 0.1847 | K508: 0.21329999999999999 | L508: 0.37459999999999999 | M508: 0.30280000000000001 | N508: 1.4835 | O508: 0.17580000000000001 | P508: 0.63060000000000005 | Q508: 0.41610000000000003 | R508: -0.25430000000000003 | S508: -1.2849999999999999 | T508: -0.96689999999999998 | U508: -0.69540000000000002 | V508: -0.20069999999999999 | W508: 4.7213000000000003 | X508: 20.541699999999999 | Y508: 1.7152000000000001 | AA508: =(N508+O508+P508+Q508+R508+S508+T508+U508+V508+W508+X508+Y508)/12 -> 2.1901583333333332 | AB508: =(G508+H508+I508+J508+K508+L508+M508+N508+O508+P508+Q508+R508+S508+T508+U508+V508+W508+X508+Y508)/19 -> 1.4757736842105262 | AC508: =(R508+S508)/2 -> -0.76964999999999995 | AD508: =(S508+T508)/2 -> -1.12595 | AE508: =(T508+U508)/2 -> -0.83115000000000006 | AF508: =(U508+V508)/2 -> -0.44805 | AG508: =(V508+W508)/2 -> 2.2603 | AH508: =(W508+X508)/2 -> 12.631499999999999 | AI508: =(X508+Y508)/2 -> 11.128449999999999 | AJ508: =STDEV(G508:Y508) -> 4.785803133440278 | BO508: 37250 | BS508: 21.809999999999999 | BT508: 14.33 | CB508: 1 | CC508: 持续减少(由70家减少到17家，再减少到1家) | CD508: 持续减少（由89.74%减少到88.98%，再减少到0.012%） | CI508: 19.280000000000001 | CJ508: =CI508/BS508 -> 0.8839981659789089 | CK508: 适量进入(利润增长和销售额增长目前仍比较强劲，但处于下滑趋势，持有机构数量和机构持有份额都持续减少，不宜长期持有) | CL508: 44608
B509: 603319.SH | C509: 湘油泵
B510: 002409.SZ | C510: 雅克科技 | G510: 0.3629 | H510: 0.33030000000000004 | I510: 0.2157 | J510: -0.49109999999999998 | K510: -0.27789999999999998 | L510: -0.21840000000000001 | M510: 0.38219999999999998 | N510: 2.1274999999999999 | O510: 0.78760000000000008 | P510: 1.3668 | Q510: 0.98959999999999992 | R510: 1.0137 | S510: 1.8128 | T510: 1.1029 | U510: 0.85159999999999991 | V510: 0.4118 | W510: 9.1999999999999998e-03 | X510: 0.1472 | Y510: 0.1016 | AA510: =(N510+O510+P510+Q510+R510+S510+T510+U510+V510+W510+X510+Y510)/12 -> 0.8935249999999999 | AB510: =(G510+H510+I510+J510+K510+L510+M510+N510+O510+P510+Q510+R510+S510+T510+U510+V510+W510+X510+Y510)/19 -> 0.58031578947368412 | AC510: =(R510+S510)/2 -> 1.4132500000000001 | AD510: =(S510+T510)/2 -> 1.4578500000000001 | AE510: =(T510+U510)/2 -> 0.97724999999999995 | AF510: =(U510+V510)/2 -> 0.63169999999999993 | AG510: =(V510+W510)/2 -> 0.21049999999999999 | AH510: =(W510+X510)/2 -> 7.8199999999999992e-02 | AI510: =(X510+Y510)/2 -> 0.1244 | AJ510: =STDEV(G510:Y510) -> 0.70127104069298329
B511: 002810.SZ | C511: 山东赫达 | G511: 3.7699999999999997e-02 | H511: -0.28029999999999999 | I511: -0.34020000000000006 | J511: -0.33279999999999998 | K511: -0.4279 | L511: -0.2873 | M511: -6.1200000000000004e-02 | N511: -9.7000000000000003e-03 | O511: 0.67459999999999998 | P511: 1.5143 | Q511: 1.1656 | R511: 1.1245000000000001 | S511: 0.33399999999999996 | T511: -0.12359999999999999 | U511: -5.9800000000000006e-02 | V511: 0.58820000000000006 | W511: 0.94310000000000005 | X511: 0.43479999999999996 | Y511: 0.2964 | AA511: =(N511+O511+P511+Q511+R511+S511+T511+U511+V511+W511+X511+Y511)/12 -> 0.57353333333333334 | AB511: =(G511+H511+I511+J511+K511+L511+M511+N511+O511+P511+Q511+R511+S511+T511+U511+V511+W511+X511+Y511)/19 -> 0.27317894736842108 | AC511: =(R511+S511)/2 -> 0.72924999999999995 | AD511: =(S511+T511)/2 -> 0.10519999999999999 | AE511: =(T511+U511)/2 -> -9.1700000000000004e-02 | AF511: =(U511+V511)/2 -> 0.26420000000000005 | AG511: =(V511+W511)/2 -> 0.76565000000000005 | AH511: =(W511+X511)/2 -> 0.68894999999999995 | AI511: =(X511+Y511)/2 -> 0.36559999999999998 | AJ511: =STDEV(G511:Y511) -> 0.58557168607452637
B512: 002236.SZ | C512: 大华股份
B513: 002408.SZ | C513: 齐翔腾达 | G513: 4.5 | H513: 1.25 | I513: 1.2856999999999998 | J513: 0.71430000000000005 | K513: 0.2727 | L513: 0.57779999999999998 | M513: 0.21879999999999999 | N513: -2.0799999999999999e-02 | O513: -0.23569999999999999 | P513: -0.29580000000000001 | Q513: -0.23079999999999998 | R513: -0.25530000000000003 | S513: 5.6100000000000004e-02 | T513: 0.34999999999999998 | U513: 6.6699999999999995e-02 | V513: 0.68569999999999998 | W513: 2.3628 | X513: 1.8888999999999998 | Y513: 1.5312999999999999 | AA513: =(N513+O513+P513+Q513+R513+S513+T513+U513+V513+W513+X513+Y513)/12 -> 0.49192499999999995 | AB513: =(G513+H513+I513+J513+K513+L513+M513+N513+O513+P513+Q513+R513+S513+T513+U513+V513+W513+X513+Y513)/19 -> 0.77486315789473692 | AC513: =(R513+S513)/2 -> -9.9600000000000008e-02 | AD513: =(S513+T513)/2 -> 0.20304999999999998 | AE513: =(T513+U513)/2 -> 0.20834999999999998 | AF513: =(U513+V513)/2 -> 0.37619999999999998 | AG513: =(V513+W513)/2 -> 1.5242499999999999 | AH513: =(W513+X513)/2 -> 2.1258499999999998 | AI513: =(X513+Y513)/2 -> 1.7100999999999997 | AJ513: =STDEV(G513:Y513) -> 1.1874775793020385
B514: 002859.SZ | C514: 洁美科技 | G514: -0.52170000000000005 | H514: -0.51469999999999994 | I514: 0.35850000000000004 | J514: 0.33899999999999997 | K514: 4.6399999999999997e-02 | L514: 0.24909999999999999 | M514: 0.50759999999999994 | N514: 0.36709999999999998 | O514: -0.39179999999999998 | P514: -0.68459999999999999 | Q514: -0.71200000000000008 | R514: -0.73150000000000004 | S514: 0.71430000000000005 | T514: 1.6922999999999999 | U514: 1.2609000000000001 | V514: 1.4483000000000001 | W514: 0.91670000000000007 | X514: 0.57140000000000002 | Y514: 0.55770000000000008 | AA514: =(N514+O514+P514+Q514+R514+S514+T514+U514+V514+W514+X514+Y514)/12 -> 0.41740000000000005 | AB514: =(G514+H514+I514+J514+K514+L514+M514+N514+O514+P514+Q514+R514+S514+T514+U514+V514+W514+X514+Y514)/19 -> 0.28805263157894734 | AC514: =(R514+S514)/2 -> -8.5999999999999965e-03 | AD514: =(S514+T514)/2 -> 1.2033 | AE514: =(T514+U514)/2 -> 1.4765999999999999 | AF514: =(U514+V514)/2 -> 1.3546 | AG514: =(V514+W514)/2 -> 1.1825000000000001 | AH514: =(W514+X514)/2 -> 0.7440500000000001 | AI514: =(X514+Y514)/2 -> 0.56455000000000011 | AJ514: =STDEV(G514:Y514) -> 0.7402805169276645
B515: 003038.SZ | C515: 鑫铂股份 | E515: 0.54849999999999999 | F515: 1.137 | U515: 0.3256 | V515: 0.42859999999999998 | W515: 0.29549999999999998 | X515: 5.1900000000000002e-02 | Y515: 4.3899999999999995e-02 | AA515: =(N515+O515+P515+Q515+R515+S515+T515+U515+V515+W515+X515+Y515)/12 -> 9.5458333333333353e-02 | AB515: =(G515+H515+I515+J515+K515+L515+M515+N515+O515+P515+Q515+R515+S515+T515+U515+V515+W515+X515+Y515)/19 -> 6.0289473684210539e-02 | AC515: =(R515+S515)/2 -> 0 | AD515: =(S515+T515)/2 -> 0 | AE515: =(T515+U515)/2 -> 0.1628 | AF515: =(U515+V515)/2 -> 0.37709999999999999 | AG515: =(V515+W515)/2 -> 0.36204999999999998 | AH515: =(W515+X515)/2 -> 0.17369999999999999 | AI515: =(X515+Y515)/2 -> 4.7899999999999998e-02 | AJ515: =STDEV(G515:Y515) -> 0.17264149269512238
B516: 600097.SH | C516: 开创国际 | E516: 0.34659999999999996 | F516: 0.81000000000000005 | G516: 0.55559999999999998 | H516: 0.77590000000000003 | I516: 1.1818 | J516: 11.75 | K516: 0.5 | L516: 1.5385 | M516: 2.6429 | N516: 0.13730000000000001 | O516: 0 | P516: -0.42859999999999998 | Q516: -0.17649999999999999 | R516: 0.22409999999999999 | S516: 0.20000000000000001 | T516: 0.25 | U516: -9.5199999999999993e-02 | V516: -0.16899999999999998 | W516: 1.375 | X516: 11.4 | Y516: 1.1315999999999999 | AA516: =(N516+O516+P516+Q516+R516+S516+T516+U516+V516+W516+X516+Y516)/12 -> 1.1540583333333334 | AB516: =(G516+H516+I516+J516+K516+L516+M516+N516+O516+P516+Q516+R516+S516+T516+U516+V516+W516+X516+Y516)/19 -> 1.7259684210526316 | AC516: =(R516+S516)/2 -> 0.21205000000000002 | AD516: =(S516+T516)/2 -> 0.22500000000000001 | AE516: =(T516+U516)/2 -> 7.7399999999999997e-02 | AF516: =(U516+V516)/2 -> -0.1321 | AG516: =(V516+W516)/2 -> 0.60299999999999998 | AH516: =(W516+X516)/2 -> 6.3875000000000002 | AI516: =(X516+Y516)/2 -> 6.2658000000000005 | AJ516: =STDEV(G516:Y516) -> 3.5506383085068323
B517: 603096.SH | C517: 新经典
B518: 603359.SH | C518: 东珠生态 | E518: 0.56540000000000001 | F518: 0.81000000000000005 | G518: 2.25 | H518: 0.11320000000000001 | I518: 0.1807 | J518: -0.20180000000000001 | K518: -0.11539999999999999 | L518: -5.0799999999999998e-02 | M518: -0.22450000000000001 | N518: 0.1724 | O518: 0.13039999999999999 | P518: 0.125 | Q518: 2.63e-02 | R518: 0.10779999999999999 | S518: -3.85e-02 | T518: -0.11109999999999999 | U518: 0 | V518: 5.3099999999999994e-02 | W518: 0.23999999999999999 | X518: 0.10710000000000001 | Y518: 3.85e-02 | AA518: =(N518+O518+P518+Q518+R518+S518+T518+U518+V518+W518+X518+Y518)/12 -> 7.091666666666667e-02 | AB518: =(G518+H518+I518+J518+K518+L518+M518+N518+O518+P518+Q518+R518+S518+T518+U518+V518+W518+X518+Y518)/19 -> 0.14749473684210523 | AC518: =(R518+S518)/2 -> 3.465e-02 | AD518: =(S518+T518)/2 -> -7.4799999999999991e-02 | AE518: =(T518+U518)/2 -> -5.5549999999999995e-02 | AF518: =(U518+V518)/2 -> 2.6549999999999997e-02 | AG518: =(V518+W518)/2 -> 0.14654999999999999 | AH518: =(W518+X518)/2 -> 0.17355000000000001 | AI518: =(X518+Y518)/2 -> 7.2800000000000004e-02 | AJ518: =STDEV(G518:Y518) -> 0.5251195604322294
B519: 603700.SH | C519: 宁水集团
B520: 000656.SZ | C520: 金科股份
B521: 000685.SZ | C521: 中山公用
B522: 000988.SZ | C522: 华工科技 | G522: 0.20000000000000001 | H522: 0.53849999999999998 | I522: 0.52629999999999999 | J522: 0.3846 | K522: 0 | L522: -0.10000000000000001 | M522: -0.10339999999999999 | N522: -0.22219999999999998 | O522: 0.66670000000000007 | P522: 0.83329999999999993 | Q522: 0.76919999999999999 | R522: 0.78569999999999995 | S522: -1.1000000000000001 | T522: 3.0299999999999997e-02 | U522: 4.3499999999999997e-02 | V522: 0.10000000000000001 | W522: 12 | X522: 2.9399999999999999e-02 | Y522: 0.66670000000000007 | AA522: =(N522+O522+P522+Q522+R522+S522+T522+U522+V522+W522+X522+Y522)/12 -> 1.2168833333333333 | AB522: =(G522+H522+I522+J522+K522+L522+M522+N522+O522+P522+Q522+R522+S522+T522+U522+V522+W522+X522+Y522)/19 -> 0.84466315789473689 | AC522: =(R522+S522)/2 -> -0.15715000000000007 | AD522: =(S522+T522)/2 -> -0.53485000000000005 | AE522: =(T522+U522)/2 -> 3.6899999999999995e-02 | AF522: =(U522+V522)/2 -> 7.1750000000000008e-02 | AG522: =(V522+W522)/2 -> 6.0499999999999998 | AH522: =(W522+X522)/2 -> 6.0147000000000004 | AI522: =(X522+Y522)/2 -> 0.34805000000000003 | AJ522: =STDEV(G522:Y522) -> 2.7415053533517204
B523: 002088.SZ | C523: 鲁阳节能 | G523: 0.58729999999999993 | H523: 1.5713999999999999 | I523: 1.2222 | J523: 1.0332999999999999 | K523: 2 | L523: 1.3888999999999998 | M523: 0.65000000000000002 | N523: 0.39340000000000003 | O523: 0.33329999999999999 | P523: 0.11630000000000001 | Q523: 1.52e-02 | R523: 0.12939999999999999 | S523: -0.40000000000000002 | T523: -0.3125 | U523: -0.34329999999999999 | V523: 7.2900000000000006e-02 | W523: 1.6666999999999998 | X523: 1.1818 | Y523: 0.81819999999999993 | AA523: =(N523+O523+P523+Q523+R523+S523+T523+U523+V523+W523+X523+Y523)/12 -> 0.30595 | AB523: =(G523+H523+I523+J523+K523+L523+M523+N523+O523+P523+Q523+R523+S523+T523+U523+V523+W523+X523+Y523)/19 -> 0.63813157894736838 | AC523: =(R523+S523)/2 -> -0.13530000000000003 | AD523: =(S523+T523)/2 -> -0.35625000000000001 | AE523: =(T523+U523)/2 -> -0.32789999999999997 | AF523: =(U523+V523)/2 -> -0.13519999999999999 | AG523: =(V523+W523)/2 -> 0.86979999999999991 | AH523: =(W523+X523)/2 -> 1.4242499999999998 | AI523: =(X523+Y523)/2 -> 1 | AJ523: =STDEV(G523:Y523) -> 0.72691847017440803
B524: 002555.SZ | C524: 三七互娱 | E524: 0.30990000000000001 | F524: 0.80000000000000004 | G524: 1.0593999999999999 | H524: 0.75970000000000004 | I524: 0.57889999999999997 | J524: 0.49020000000000002 | K524: -8.6500000000000007e-02 | L524: -9.7599999999999992e-02 | M524: 0 | N524: -0.38159999999999994 | O524: 0.10529999999999999 | P524: 0.32429999999999998 | Q524: 0.29820000000000002 | R524: 1.1276999999999999 | S524: 0.66670000000000007 | T524: 0.63270000000000004 | U524: 0.44590000000000002 | V524: 0.31 | W524: -0.85709999999999997 | X524: -0.51249999999999996 | Y524: -0.25230000000000002 | AA524: =(N524+O524+P524+Q524+R524+S524+T524+U524+V524+W524+X524+Y524)/12 -> 0.15894166666666668 | AB524: =(G524+H524+I524+J524+K524+L524+M524+N524+O524+P524+Q524+R524+S524+T524+U524+V524+W524+X524+Y524)/19 -> 0.24270526315789467 | AC524: =(R524+S524)/2 -> 0.8972 | AD524: =(S524+T524)/2 -> 0.64970000000000006 | AE524: =(T524+U524)/2 -> 0.5393 | AF524: =(U524+V524)/2 -> 0.37795000000000001 | AG524: =(V524+W524)/2 -> -0.27354999999999996 | AH524: =(W524+X524)/2 -> -0.68479999999999996 | AI524: =(X524+Y524)/2 -> -0.38239999999999996 | AJ524: =STDEV(G524:Y524) -> 0.52682778492668769
B525: 002758.SZ | C525: 浙农股份 | E525: 0.61939999999999995 | F525: 0.77900000000000003 | G525: -0.24239999999999998 | H525: 0.13400000000000001 | I525: 0.1429 | J525: 5.2600000000000001e-02 | K525: -0.20000000000000001 | L525: -9.0899999999999995e-02 | M525: -0.1875 | N525: -0.20000000000000001 | O525: -0.25 | P525: -0.10000000000000001 | Q525: 0 | R525: 2 | S525: -0.33329999999999999 | T525: 1.2222 | U525: 2.9230999999999998 | V525: 0.5 | W525: 7 | X525: 1.1499999999999999 | Y525: 0.56859999999999999 | AA525: =(N525+O525+P525+Q525+R525+S525+T525+U525+V525+W525+X525+Y525)/12 -> 1.2067166666666667 | AB525: =(G525+H525+I525+J525+K525+L525+M525+N525+O525+P525+Q525+R525+S525+T525+U525+V525+W525+X525+Y525)/19 -> 0.74154210526315789 | AC525: =(R525+S525)/2 -> 0.83335000000000004 | AD525: =(S525+T525)/2 -> 0.44445000000000001 | AE525: =(T525+U525)/2 -> 2.0726499999999999 | AF525: =(U525+V525)/2 -> 1.7115499999999999 | AG525: =(V525+W525)/2 -> 3.75 | AH525: =(W525+X525)/2 -> 4.0750000000000002 | AI525: =(X525+Y525)/2 -> 0.85929999999999995 | AJ525: =STDEV(G525:Y525) -> 1.7463166332839561
B526: 002761.SZ | C526: 浙江建投
B527: 601328.SH | C527: 交通银行 | E527: 1.6e-02 | F527: 0.80000000000000004 | G527: 0 | H527: -2.e-02 | I527: 0 | J527: 2.2499999999999999e-02 | K527: 3.85e-02 | L527: 4.0800000000000003e-02 | M527: 5.7099999999999998e-02 | N527: 5.4900000000000004e-02 | O527: 3.7000000000000005e-02 | P527: 5.8799999999999998e-02 | Q527: 4.0500000000000001e-02 | R527: 4.1700000000000001e-02 | S527: -0.10710000000000001 | T527: -0.14810000000000001 | U527: -0.15579999999999999 | V527: -1.e-02 | W527: 0.20000000000000001 | X527: 0.1739 | Y527: 0.23079999999999998
B528: 601865.SH | C528: 福莱特 | E528: 0.36709999999999998 | F528: 0.80000000000000004 | N528: -4.1700000000000001e-02 | O528: 0.20000000000000001 | P528: 0.16670000000000001 | Q528: 0.625 | R528: 0.60870000000000002 | S528: 0.83329999999999993 | T528: 0.71430000000000005 | U528: 0.61539999999999995 | V528: 1.2431999999999999 | W528: 2.6364000000000001 | X528: 1.4583000000000002 | Y528: 0.90480000000000005 | AA528: =(N528+O528+P528+Q528+R528+S528+T528+U528+V528+W528+X528+Y528)/12 -> 0.83036666666666659 | AB528: =(G528+H528+I528+J528+K528+L528+M528+N528+O528+P528+Q528+R528+S528+T528+U528+V528+W528+X528+Y528)/19 -> 0.52444210526315782 | AC528: =(R528+S528)/2 -> 0.72099999999999997 | AD528: =(S528+T528)/2 -> 0.77380000000000004 | AE528: =(T528+U528)/2 -> 0.66484999999999994 | AF528: =(U528+V528)/2 -> 0.9292999999999999 | AG528: =(V528+W528)/2 -> 1.9398 | AH528: =(W528+X528)/2 -> 2.0473500000000002 | AI528: =(X528+Y528)/2 -> 1.1815500000000001 | AJ528: =STDEV(G528:Y528) -> 0.71231674049391747
B529: 603048.SH | C529: 浙江黎明 | W529: 0.62690000000000001 | X529: 0.44189999999999996 | Y529: 1.2699999999999999e-02 | AA529: =(N529+O529+P529+Q529+R529+S529+T529+U529+V529+W529+X529+Y529)/12 -> 9.0124999999999997e-02 | AB529: =(G529+H529+I529+J529+K529+L529+M529+N529+O529+P529+Q529+R529+S529+T529+U529+V529+W529+X529+Y529)/19 -> 5.6921052631578942e-02 | AC529: =(R529+S529)/2 -> 0 | AD529: =(S529+T529)/2 -> 0 | AE529: =(T529+U529)/2 -> 0 | AF529: =(U529+V529)/2 -> 0 | AG529: =(V529+W529)/2 -> 0.31345000000000001 | AH529: =(W529+X529)/2 -> 0.53439999999999999 | AI529: =(X529+Y529)/2 -> 0.22729999999999997 | AJ529: =STDEV(G529:Y529) -> 0.31508709906944782
B530: 605099.SH | C530: 共创草坪 | T530: 0.6129 | U530: 0.47460000000000002 | V530: 0.40509999999999996 | W530: 0.31579999999999997 | X530: 8.0000000000000002e-02 | Y530: -8.0500000000000002e-02 | AA530: =(N530+O530+P530+Q530+R530+S530+T530+U530+V530+W530+X530+Y530)/12 -> 0.15065833333333331 | AB530: =(G530+H530+I530+J530+K530+L530+M530+N530+O530+P530+Q530+R530+S530+T530+U530+V530+W530+X530+Y530)/19 -> 9.5152631578947364e-02 | AC530: =(R530+S530)/2 -> 0 | AD530: =(S530+T530)/2 -> 0.30645 | AE530: =(T530+U530)/2 -> 0.54374999999999996 | AF530: =(U530+V530)/2 -> 0.43984999999999996 | AG530: =(V530+W530)/2 -> 0.36044999999999994 | AH530: =(W530+X530)/2 -> 0.19789999999999999 | AI530: =(X530+Y530)/2 -> -2.5000000000000022e-04 | AJ530: =STDEV(G530:Y530) -> 0.25801436717102921
B531: 000026.SZ | C531: 飞亚达
B532: 000898.SZ | C532: 鞍钢股份
B533: 003025.SZ | C533: 思进智能 | E533: 0.17329999999999998 | F533: 0.79500000000000004 | U533: -1.11e-02 | V533: 0.15670000000000001 | W533: 1.8462000000000001 | X533: -6.5599999999999992e-02 | Y533: -0.1124 | AA533: =(N533+O533+P533+Q533+R533+S533+T533+U533+V533+W533+X533+Y533)/12 -> 0.15115000000000001 | AB533: =(G533+H533+I533+J533+K533+L533+M533+N533+O533+P533+Q533+R533+S533+T533+U533+V533+W533+X533+Y533)/19 -> 9.5463157894736847e-02 | AC533: =(R533+S533)/2 -> 0 | AD533: =(S533+T533)/2 -> 0 | AE533: =(T533+U533)/2 -> -5.5500000000000002e-03 | AF533: =(U533+V533)/2 -> 7.2800000000000004e-02 | AG533: =(V533+W533)/2 -> 1.00145 | AH533: =(W533+X533)/2 -> 0.89030000000000009 | AI533: =(X533+Y533)/2 -> -8.8999999999999996e-02 | AJ533: =STDEV(G533:Y533) -> 0.8354782420865311
B534: 003033.SZ | C534: 征和工业 | U534: 0.47960000000000003 | V534: 0.1867 | W534: -0.10710000000000001 | X534: -0.4556 | Y534: -0.45520000000000005 | AA534: =(N534+O534+P534+Q534+R534+S534+T534+U534+V534+W534+X534+Y534)/12 -> -2.9300000000000003e-02 | AB534: =(G534+H534+I534+J534+K534+L534+M534+N534+O534+P534+Q534+R534+S534+T534+U534+V534+W534+X534+Y534)/19 -> -1.8505263157894736e-02 | AC534: =(R534+S534)/2 -> 0 | AD534: =(S534+T534)/2 -> 0 | AE534: =(T534+U534)/2 -> 0.23980000000000001 | AF534: =(U534+V534)/2 -> 0.33315 | AG534: =(V534+W534)/2 -> 3.9799999999999995e-02 | AH534: =(W534+X534)/2 -> -0.28134999999999999 | AI534: =(X534+Y534)/2 -> -0.45540000000000003 | AJ534: =STDEV(G534:Y534) -> 0.40816582047006345
B535: 603035.SH | C535: 常熟汽饰 | E535: 0.44069999999999998 | F535: 0.77000000000000002 | G535: -0.16670000000000001 | H535: -0.20370000000000002 | I535: -0.22370000000000001 | J535: -0.25 | K535: 0.59999999999999998 | L535: 1.2093 | M535: 0.88139999999999996 | N535: 0.49380000000000002 | O535: -0.71879999999999999 | P535: -0.48420000000000002 | Q535: -0.33329999999999999 | R535: -0.22309999999999999 | S535: -0.95779999999999998 | T535: -0.12240000000000001 | U535: 0 | V535: 0.28720000000000001 | W535: 77.947400000000002 | X535: 0.44189999999999996 | Y535: 6.7599999999999993e-02 | AA535: =(N535+O535+P535+Q535+R535+S535+T535+U535+V535+W535+X535+Y535)/12 -> 6.3665250000000002 | AB535: =(G535+H535+I535+J535+K535+L535+M535+N535+O535+P535+Q535+R535+S535+T535+U535+V535+W535+X535+Y535)/19 -> 4.1181526315789476 | AC535: =(R535+S535)/2 -> -0.59045000000000003 | AD535: =(S535+T535)/2 -> -0.54010000000000002 | AE535: =(T535+U535)/2 -> -6.1200000000000004e-02 | AF535: =(U535+V535)/2 -> 0.14360000000000001 | AG535: =(V535+W535)/2 -> 39.1173 | AH535: =(W535+X535)/2 -> 39.194650000000003 | AI535: =(X535+Y535)/2 -> 0.25474999999999998 | AJ535: =STDEV(G535:Y535) -> 17.886562831210856
B536: 603386.SH | C536: 广东骏亚
B537: 603719.SH | C537: 良品铺子
B538: 605007.SH | C538: 五洲特纸
B539: 605020.SH | C539: 永和股份 | V539: -0.28170000000000001 | W539: 0.1905 | X539: 0.6875 | Y539: 1.0789 | AA539: =(N539+O539+P539+Q539+R539+S539+T539+U539+V539+W539+X539+Y539)/12 -> 0.1396 | AB539: =(G539+H539+I539+J539+K539+L539+M539+N539+O539+P539+Q539+R539+S539+T539+U539+V539+W539+X539+Y539)/19 -> 8.8168421052631576e-02 | AC539: =(R539+S539)/2 -> 0 | AD539: =(S539+T539)/2 -> 0 | AE539: =(T539+U539)/2 -> 0 | AF539: =(U539+V539)/2 -> -0.14085 | AG539: =(V539+W539)/2 -> -4.5600000000000002e-02 | AH539: =(W539+X539)/2 -> 0.439 | AI539: =(X539+Y539)/2 -> 0.88319999999999999 | AJ539: =STDEV(G539:Y539) -> 0.5918200289502431 | AW539: -0.1094 | AX539: 0.1321 | AY539: 0.42149999999999999 | AZ539: 0.27929999999999999 | BA539: 0.1321 | BB539: 0.42149999999999999 | BC539: 0.27929999999999999 | BE539: =(AR539+AS539+AT539+AU539+AV539+AW539+AX539+AY539+AZ539+BA539+BB539+BC539)/12 -> 0.12970000000000001 | BF539: =(AK539+AL539+AM539+AN539+AO539+AP539+AQ539+AR539+AS539+AT539+AU539+AV539+AV539+AW539+AX539+AY539+AZ539+BA539+BB539+BC539)/19 -> 8.1915789473684206e-02 | BG539: =(AV539+AW539)/2 -> -5.4699999999999999e-02 | BH539: =(AW539+AX539)/2 -> 1.1349999999999999e-02 | BI539: =(AX539+AY539)/2 -> 0.27679999999999999 | BJ539: =(AY539+AZ539)/2 -> 0.35039999999999999 | BK539: =(AZ539+BA539)/2 -> 0.20569999999999999 | BL539: =(BA539+BB539)/2 -> 0.27679999999999999 | BM539: =(BB539+BC539)/2 -> 0.35039999999999999 | BN539: =STDEV(AK539:BC539) -> 0.18804088081356898
B540: 600529.SH | C540: 山东药玻
B541: 002774.SZ | C541: 快意电梯
B542: 603043.SH | C542: 广州酒家
B543: 600056.SH | C543: 中国医药
B544: 001207.SZ | C544: 联科科技 | V544: 0.75590000000000002 | W544: 4.2925000000000004 | X544: 1.9688999999999999 | Y544: 0.47609999999999997 | AA544: =(N544+O544+P544+Q544+R544+S544+T544+U544+V544+W544+X544+Y544)/12 -> 0.62445000000000006 | AB544: =(G544+H544+I544+J544+K544+L544+M544+N544+O544+P544+Q544+R544+S544+T544+U544+V544+W544+X544+Y544)/19 -> 0.39438947368421057 | AC544: =(R544+S544)/2 -> 0 | AD544: =(S544+T544)/2 -> 0 | AE544: =(T544+U544)/2 -> 0 | AF544: =(U544+V544)/2 -> 0.37795000000000001 | AG544: =(V544+W544)/2 -> 2.5242000000000004 | AH544: =(W544+X544)/2 -> 3.1307 | AI544: =(X544+Y544)/2 -> 1.2224999999999999 | AJ544: =STDEV(G544:Y544) -> 1.7380466612455108
B545: 002539.SZ | C545: 云图控股 | E545: 0.66870000000000007 | F545: 0.78000000000000003 | G545: 0.40000000000000002 | H545: -0.36359999999999998 | I545: -0.50309999999999999 | J545: -0.28570000000000001 | K545: -0.28570000000000001 | L545: 0.28570000000000001 | M545: 0.75 | N545: 0.69999999999999996 | O545: -0.20000000000000001 | P545: 0.33329999999999999 | Q545: 0.28570000000000001 | R545: 0.23530000000000001 | S545: 0.5 | T545: 0.58329999999999993 | U545: 1.0556000000000001 | V545: 1.3333000000000002 | W545: 2 | X545: 1.1052999999999999 | Y545: 1.1081000000000001 | AA545: =(N545+O545+P545+Q545+R545+S545+T545+U545+V545+W545+X545+Y545)/12 -> 0.75332499999999991 | AB545: =(G545+H545+I545+J545+K545+L545+M545+N545+O545+P545+Q545+R545+S545+T545+U545+V545+W545+X545+Y545)/19 -> 0.47565789473684211 | AC545: =(R545+S545)/2 -> 0.36765000000000003 | AD545: =(S545+T545)/2 -> 0.54164999999999996 | AE545: =(T545+U545)/2 -> 0.81945000000000001 | AF545: =(U545+V545)/2 -> 1.1944500000000002 | AG545: =(V545+W545)/2 -> 1.6666500000000002 | AH545: =(W545+X545)/2 -> 1.5526499999999999 | AI545: =(X545+Y545)/2 -> 1.1067 | AJ545: =STDEV(G545:Y545) -> 0.65675135352039982
B546: 002940.SZ | C546: 昂利康 | M546: 0.26719999999999999 | N546: 2.e-02 | O546: -0.26000000000000001 | P546: -0.42399999999999999 | Q546: -0.31969999999999998 | R546: -0.183 | S546: 0.2432 | T546: 0.31940000000000002 | U546: 0.38 | V546: 0.44799999999999995 | W546: -0.26090000000000002 | X546: -0.28420000000000001 | Y546: -0.43479999999999996 | AA546: =(N546+O546+P546+Q546+R546+S546+T546+U546+V546+W546+X546+Y546)/12 -> -6.3000000000000014e-02 | AB546: =(M546+N546+O546+P546+Q546+R546+S546+T546+U546+V546+W546+X546+Y546)/13 -> -3.7600000000000001e-02 | AC546: =(R546+S546)/2 -> 3.0100000000000002e-02 | AD546: =(S546+T546)/2 -> 0.28129999999999999 | AE546: =(T546+U546)/2 -> 0.34970000000000001 | AF546: =(U546+V546)/2 -> 0.41399999999999998 | AG546: =(V546+W546)/2 -> 9.3549999999999967e-02 | AH546: =(W546+X546)/2 -> -0.27255000000000001 | AI546: =(X546+Y546)/2 -> -0.35949999999999999 | AJ546: =STDEV(G546:Y546) -> 0.32668105495523714
B547: 600216.SH | C547: 浙江医药
B548: 601678.SH | C548: 滨化股份 | G548: 2.75 | H548: 4.75 | I548: 2 | J548: 0.76670000000000005 | K548: 0.1333 | L548: 0.30430000000000001 | M548: 0.19440000000000002 | N548: -0.15090000000000001 | O548: -0.47060000000000002 | P548: -0.4667 | Q548: -0.48840000000000006 | R548: -0.37780000000000002 | S548: -0.77780000000000005 | T548: -0.9375 | U548: -0.2727 | V548: 0.17859999999999998 | W548: 14 | X548: 55 | Y548: 3.875 | AA548: =(N548+O548+P548+Q548+R548+S548+T548+U548+V548+W548+X548+Y548)/12 -> 5.7592666666666661 | AB548: =(G548+H548+I548+J548+K548+L548+M548+N548+O548+P548+Q548+R548+S548+T548+U548+V548+W548+X548+Y548)/19 -> 4.2110473684210525 | AC548: =(R548+S548)/2 -> -0.57780000000000009 | AD548: =(S548+T548)/2 -> -0.85765000000000002 | AE548: =(T548+U548)/2 -> -0.60509999999999997 | AF548: =(U548+V548)/2 -> -4.7050000000000008e-02 | AG548: =(V548+W548)/2 -> 7.0892999999999997 | AH548: =(W548+X548)/2 -> 34.5 | AI548: =(X548+Y548)/2 -> 29.4375 | AJ548: =STDEV(G548:Y548) -> 12.772332484248409
B549: 601900.SH | C549: 南方传媒
B550: 603277.SH | C550: 银都股份
B551: 603324.SH | C551: 盛剑环境 | V551: 7.3800000000000004e-02 | W551: 0.85709999999999997 | X551: -0.11109999999999999 | Y551: 0.44439999999999996 | AA551: =(N551+O551+P551+Q551+R551+S551+T551+U551+V551+W551+X551+Y551)/12 -> 0.10535 | AB551: =(G551+H551+I551+J551+K551+L551+M551+N551+O551+P551+Q551+R551+S551+T551+U551+V551+W551+X551+Y551)/19 -> 6.6536842105263158e-02 | AC551: =(R551+S551)/2 -> 0 | AD551: =(S551+T551)/2 -> 0 | AE551: =(T551+U551)/2 -> 0 | AF551: =(U551+V551)/2 -> 3.6900000000000002e-02 | AG551: =(V551+W551)/2 -> 0.46544999999999997 | AH551: =(W551+X551)/2 -> 0.373 | AI551: =(X551+Y551)/2 -> 0.16664999999999999 | AJ551: =STDEV(G551:Y551) -> 0.42831102795359666
B552: 603722.SH | C552: 阿科力 | E552: 0.27729999999999999 | F552: 0.78000000000000003 | H552: -0.28300000000000003 | I552: 1.6399999999999998e-02 | J552: 2.8199999999999999e-02 | K552: -0.23079999999999998 | L552: -0.31579999999999997 | M552: -0.4032 | N552: -0.46579999999999999 | O552: -0.20000000000000001 | P552: -0.1923 | Q552: -5.4100000000000002e-02 | R552: 0.15380000000000002 | S552: 0.5 | T552: 0.38100000000000001 | U552: 0 | V552: 0.31109999999999999 | W552: 1 | X552: 1 | Y552: 1.2285999999999999 | AA552: =(N552+O552+P552+Q552+R552+S552+T552+U552+V552+W552+X552+Y552)/12 -> 0.30519166666666669 | AB552: =(G552+H552+I552+J552+K552+L552+M552+N552+O552+P552+Q552+R552+S552+T552+U552+V552+W552+X552+Y552)/19 -> 0.1302157894736842 | AC552: =(R552+S552)/2 -> 0.32690000000000002 | AD552: =(S552+T552)/2 -> 0.4405 | AE552: =(T552+U552)/2 -> 0.1905 | AF552: =(U552+V552)/2 -> 0.15554999999999999 | AG552: =(V552+W552)/2 -> 0.65554999999999997 | AH552: =(W552+X552)/2 -> 1 | AI552: =(X552+Y552)/2 -> 1.1143000000000001 | AJ552: =STDEV(G552:Y552) -> 0.50750769481271674 | AK552: 0.25629999999999997 | AL552: 0.69569999999999999 | AM552: 0.63580000000000003 | AN552: 0.43780000000000002 | AO552: 0.3357 | AP552: 0.65139999999999998 | AQ552: 0.33880000000000005 | AR552: 0.37 | AS552: 0.24230000000000002 | AT552: -0.1492 | AU552: -0.1371 | AV552: -0.14400000000000002 | AW552: -6.2899999999999998e-02 | AX552: 0.30640000000000001 | AY552: 0.52710000000000001 | AZ552: 0.68310000000000004 | BA552: 0.30640000000000001 | BB552: 0.52710000000000001 | BC552: 0.68310000000000004 | BE552: =(AR552+AS552+AT552+AU552+AV552+AW552+AX552+AY552+AZ552+BA552+BB552+BC552)/12 -> 0.26269166666666671 | BF552: =(AK552+AL552+AM552+AN552+AO552+AP552+AQ552+AR552+AS552+AT552+AU552+AV552+AV552+AW552+AX552+AY552+AZ552+BA552+BB552+BC552)/19 -> 0.33472631578947376 | BG552: =(AV552+AW552)/2 -> -0.10345000000000001 | BH552: =(AW552+AX552)/2 -> 0.12175 | BI552: =(AX552+AY552)/2 -> 0.41675000000000001 | BJ552: =(AY552+AZ552)/2 -> 0.60509999999999997 | BK552: =(AZ552+BA552)/2 -> 0.49475000000000002 | BL552: =(BA552+BB552)/2 -> 0.41675000000000001 | BM552: =(BB552+BC552)/2 -> 0.60509999999999997 | BN552: =STDEV(AK552:BC552) -> 0.2895548585015823
B553: 603867.SH | C553: 新化股份 | E553: 0.3881 | F553: 0.77700000000000002 | P553: -6.9800000000000001e-02 | Q553: -0.2397 | R553: -0.39159999999999995 | S553: -0.61539999999999995 | T553: 0.1125 | U553: 0.21739999999999998 | V553: 0.45539999999999997 | W553: 1.7333000000000001 | X553: -0.22469999999999998 | Y553: -0.30359999999999998 | AA553: =(N553+O553+P553+Q553+R553+S553+T553+U553+V553+W553+X553+Y553)/12 -> 5.6150000000000012e-02 | AB553: =(G553+H553+I553+J553+K553+L553+M553+N553+O553+P553+Q553+R553+S553+T553+U553+V553+W553+X553+Y553)/19 -> 3.5463157894736849e-02 | AC553: =(R553+S553)/2 -> -0.50349999999999995 | AD553: =(S553+T553)/2 -> -0.25144999999999995 | AE553: =(T553+U553)/2 -> 0.16494999999999999 | AF553: =(U553+V553)/2 -> 0.33639999999999998 | AG553: =(V553+W553)/2 -> 1.0943499999999999 | AH553: =(W553+X553)/2 -> 0.75430000000000008 | AI553: =(X553+Y553)/2 -> -0.26415 | AJ553: =STDEV(G553:Y553) -> 0.6636008937774438
B554: 002487.SZ | C554: 大金重工 | E554: 0.5675 | F554: 0.78500000000000003 | G554: -0.80000000000000004 | H554: -0.77780000000000005 | I554: -0.66670000000000007 | J554: -0.3846 | K554: 0.80000000000000004 | L554: 1 | M554: 1.1125 | N554: 0.41249999999999998 | O554: 0.44439999999999996 | P554: 1.75 | Q554: 1.3621000000000001 | R554: 1.8 | S554: 3.3942000000000001 | T554: 1.6281999999999999 | U554: 1.7826 | V554: 1.6549 | W554: 0.5131 | X554: 0.28050000000000003 | Y554: 0.41359999999999997 | AA554: =(N554+O554+P554+Q554+R554+S554+T554+U554+V554+W554+X554+Y554)/12 -> 1.2863416666666667 | AB554: =(G554+H554+I554+J554+K554+L554+M554+N554+O554+P554+Q554+R554+S554+T554+U554+V554+W554+X554+Y554)/19 -> 0.82734210526315788 | AC554: =(R554+S554)/2 -> 2.5971000000000002 | AD554: =(S554+T554)/2 -> 2.5112000000000001 | AE554: =(T554+U554)/2 -> 1.7054 | AF554: =(U554+V554)/2 -> 1.71875 | AG554: =(V554+W554)/2 -> 1.0840000000000001 | AH554: =(W554+X554)/2 -> 0.39680000000000004 | AI554: =(X554+Y554)/2 -> 0.34704999999999997 | AJ554: =STDEV(G554:Y554) -> 1.0759000729703221
B555: 600742.SH | C555: 一汽富维 | E555: 0.56000000000000005 | F555: 0.77600000000000002 | G555: 1.0229000000000001 | H555: 0.39020000000000005 | I555: -2.4700000000000003e-02 | J555: -8.9099999999999999e-02 | K555: -0.3503 | L555: -0.1081 | M555: -3.2799999999999996e-02 | N555: 5.9200000000000003e-02 | O555: -8.6099999999999996e-02 | P555: -0.26769999999999999 | Q555: -0.30299999999999999 | R555: -0.16969999999999999 | S555: -1.3359000000000001 | T555: -0.127 | U555: 0.14360000000000001 | V555: 0.152 | W555: 4.8342999999999998 | X555: 0.66680000000000006 | Y555: 0.2742 | AA555: =(N555+O555+P555+Q555+R555+S555+T555+U555+V555+W555+X555+Y555)/12 -> 0.32005833333333339 | AB555: =(G555+H555+I555+J555+K555+L555+M555+N555+O555+P555+Q555+R555+S555+T555+U555+V555+W555+X555+Y555)/19 -> 0.24467368421052629 | AC555: =(R555+S555)/2 -> -0.75280000000000002 | AD555: =(S555+T555)/2 -> -0.73145000000000004 | AE555: =(T555+U555)/2 -> 8.3000000000000018e-03 | AF555: =(U555+V555)/2 -> 0.14779999999999999 | AG555: =(V555+W555)/2 -> 2.49315 | AH555: =(W555+X555)/2 -> 2.7505500000000001 | AI555: =(X555+Y555)/2 -> 0.47050000000000003 | AJ555: =STDEV(G555:Y555) -> 1.2051532230117765
B556: 000983.SZ | C556: 山西焦煤
B557: 002873.SZ | C557: 新天药业 | E557: 0.42530000000000001 | F557: 0.54200000000000004 | G557: 0.2762 | H557: 0.1323 | I557: 5.16e-02 | J557: -0.4294 | K557: -0.16579999999999998 | L557: -0.1216 | M557: -0.21539999999999998 | N557: -3.8399999999999997e-02 | O557: -0.40429999999999999 | P557: -0.36570000000000003 | Q557: -0.26300000000000001 | R557: 2.0099999999999996e-02 | S557: -0.81700000000000006 | T557: -0.27579999999999999 | U557: -0.1174 | V557: 4.2699999999999995e-02 | W557: 7.1734 | X557: 0.86959999999999993 | Y557: 0.45439999999999997 | AA557: =(N557+O557+P557+Q557+R557+S557+T557+U557+V557+W557+X557+Y557)/12 -> 0.52321666666666666 | AB557: =(G557+H557+I557+J557+K557+L557+M557+N557+O557+P557+Q557+R557+S557+T557+U557+V557+W557+X557+Y557)/19 -> 0.30560526315789471 | AC557: =(R557+S557)/2 -> -0.39845000000000003 | AD557: =(S557+T557)/2 -> -0.5464 | AE557: =(T557+U557)/2 -> -0.1966 | AF557: =(U557+V557)/2 -> -3.7350000000000008e-02 | AG557: =(V557+W557)/2 -> 3.60805 | AH557: =(W557+X557)/2 -> 4.0214999999999996 | AI557: =(X557+Y557)/2 -> 0.66199999999999992 | AJ557: =STDEV(G557:Y557) -> 1.7020048206204366
B558: 601666.SH | C558: 平煤股份 | E558: 0.67469999999999997 | F558: 0.77100000000000002 | G558: 82.352900000000005 | H558: 0.76849999999999996 | I558: 1.7175 | J558: 0.63960000000000006 | K558: -0.80730000000000002 | L558: -0.50429999999999997 | M558: -0.48409999999999997 | N558: -0.48100000000000004 | O558: 4.0110000000000001 | P558: 0.92689999999999995 | Q558: 0.72629999999999995 | R558: 0.63259999999999994 | S558: -3.8699999999999998e-02 | T558: 0.21679999999999999 | U558: 0.1754 | V558: 0.22339999999999999 | W558: 0.78939999999999999 | X558: 0.49659999999999999 | Y558: 0.69349999999999989 | AA558: =(N558+O558+P558+Q558+R558+S558+T558+U558+V558+W558+X558+Y558)/12 -> 0.69768333333333332 | AB558: =(G558+H558+I558+J558+K558+L558+M558+N558+O558+P558+Q558+R558+S558+T558+U558+V558+W558+X558+Y558)/19 -> 4.8450000000000006 | AC558: =(R558+S558)/2 -> 0.29694999999999999 | AD558: =(S558+T558)/2 -> 8.904999999999999e-02 | AE558: =(T558+U558)/2 -> 0.1961 | AF558: =(U558+V558)/2 -> 0.19939999999999999 | AG558: =(V558+W558)/2 -> 0.50639999999999996 | AH558: =(W558+X558)/2 -> 0.64300000000000002 | AI558: =(X558+Y558)/2 -> 0.59504999999999997 | AJ558: =STDEV(G558:Y558) -> 18.798152618364746
B559: 001317.SZ | C559: 三羊马 | E559: 0.49310000000000004 | F559: 0.57599999999999996 | W559: -9.4e-02 | X559: 0.5 | Y559: 0.10000000000000001 | AA559: =(N559+O559+P559+Q559+R559+S559+T559+U559+V559+W559+X559+Y559)/12 -> 4.2166666666666665e-02 | AB559: =(G559+H559+I559+J559+K559+L559+M559+N559+O559+P559+Q559+R559+S559+T559+U559+V559+W559+X559+Y559)/19 -> 2.6631578947368423e-02 | AC559: =(R559+S559)/2 -> 0 | AD559: =(S559+T559)/2 -> 0 | AE559: =(T559+U559)/2 -> 0 | AF559: =(U559+V559)/2 -> 0 | AG559: =(V559+W559)/2 -> -4.7e-02 | AH559: =(W559+X559)/2 -> 0.20300000000000001 | AI559: =(X559+Y559)/2 -> 0.29999999999999999 | AJ559: =STDEV(G559:Y559) -> 0.30289492127358847
B560: 002989.SZ | C560: 中天精装
B561: 003009.SZ | C561: 中天火箭
B562: 600007.SH | C562: 中国国贸 | G562: -0.11109999999999999 | H562: -0.2162 | I562: -0.12960000000000002 | J562: -7.3499999999999996e-02 | K562: 0.25 | L562: 0.37929999999999997 | M562: 0.25530000000000003 | N562: 0.22219999999999998 | O562: 0.20000000000000001 | P562: 0.20000000000000001 | Q562: 0.23730000000000001 | R562: 0.25969999999999999 | S562: -0.16670000000000001 | T562: -0.16670000000000001 | U562: -0.16440000000000002 | V562: -0.15460000000000002 | W562: 0.20000000000000001 | X562: 0.27500000000000002 | Y562: 0.26229999999999998 | AA562: =(N562+O562+P562+Q562+R562+S562+T562+U562+V562+W562+X562+Y562)/12 -> 0.10034166666666666 | AB562: =(G562+H562+I562+J562+K562+L562+M562+N562+O562+P562+Q562+R562+S562+T562+U562+V562+W562+X562+Y562)/19 -> 8.2015789473684195e-02 | AC562: =(R562+S562)/2 -> 4.6499999999999986e-02 | AD562: =(S562+T562)/2 -> -0.16670000000000001 | AE562: =(T562+U562)/2 -> -0.16555000000000003 | AF562: =(U562+V562)/2 -> -0.15950000000000003 | AG562: =(V562+W562)/2 -> 2.2699999999999998e-02 | AH562: =(W562+X562)/2 -> 0.23750000000000002 | AI562: =(X562+Y562)/2 -> 0.26865 | AJ562: =STDEV(G562:Y562) -> 0.20670513691181211 | AK562: 9.9199999999999997e-02 | AL562: 0.14150000000000001 | AM562: 0.192 | AN562: 0.15079999999999999 | AO562: 0.2394 | AP562: 0.2271 | AQ562: 0.2011 | AR562: 0.18870000000000001 | AS562: 2.64e-02 | AT562: 5.6500000000000002e-02 | AU562: 7.0400000000000004e-02 | AV562: 6.9800000000000001e-02 | AW562: -0.13570000000000002 | AX562: -0.15380000000000002 | AY562: -0.13930000000000001 | AZ562: -9.8699999999999996e-02 | BA562: 0.25319999999999998 | BB562: 0.2893 | BC562: 0.26390000000000002 | BE562: =(AR562+AS562+AT562+AU562+AV562+AW562+AX562+AY562+AZ562+BA562+BB562+BC562)/12 -> 5.7558333333333329e-02 | BF562: =(AK562+AL562+AM562+AN562+AO562+AP562+AQ562+AR562+AS562+AT562+AU562+AV562+AV562+AW562+AX562+AY562+AZ562+BA562+BB562+BC562)/19 -> 0.10587368421052634 | BG562: =(AV562+AW562)/2 -> -3.2950000000000007e-02 | BH562: =(AW562+AX562)/2 -> -0.14475000000000002 | BI562: =(AX562+AY562)/2 -> -0.14655000000000001 | BJ562: =(AY562+AZ562)/2 -> -0.11899999999999999 | BK562: =(AZ562+BA562)/2 -> 7.7249999999999985e-02 | BL562: =(BA562+BB562)/2 -> 0.27124999999999999 | BM562: =(BB562+BC562)/2 -> 0.27660000000000001 | BN562: =STDEV(AK562:BC562) -> 0.14497733539342547
B563: 600804.SH | C563: 鹏博士
B564: 601077.SH | C564: 渝农商行
B565: 603585.SH | C565: 苏利股份 | E565: 0.25440000000000002 | F565: 1.26 | G565: -0.42590000000000006 | H565: -0.22219999999999998 | I565: -0.2069 | J565: -0.21879999999999999 | K565: 6.4500000000000002e-02 | L565: 0.34920000000000001 | M565: 0.36959999999999998 | N565: 0.38400000000000001 | O565: 0.33329999999999999 | P565: 0.1176 | Q565: 7.1399999999999991e-02 | R565: -2.8900000000000002e-02 | S565: -0.5 | T565: -0.49469999999999997 | U565: -0.4667 | V565: -0.42259999999999998 | W565: -4.5499999999999999e-02 | X565: 0.125 | Y565: 6.9400000000000003e-02 | AA565: =(N565+O565+P565+Q565+R565+S565+T565+U565+V565+W565+X565+Y565)/12 -> -7.1474999999999983e-02 | AB565: =(G565+H565+I565+J565+K565+L565+M565+N565+O565+P565+Q565+R565+S565+T565+U565+V565+W565+X565+Y565)/19 -> -6.0431578947368426e-02 | AC565: =(R565+S565)/2 -> -0.26445000000000002 | AD565: =(S565+T565)/2 -> -0.49734999999999996 | AE565: =(T565+U565)/2 -> -0.48070000000000002 | AF565: =(U565+V565)/2 -> -0.44464999999999999 | AG565: =(V565+W565)/2 -> -0.23404999999999998 | AH565: =(W565+X565)/2 -> 3.9750000000000001e-02 | AI565: =(X565+Y565)/2 -> 9.7200000000000009e-02 | AJ565: =STDEV(G565:Y565) -> 0.30792399685028987
B566: 603727.SH | C566: 博迈科
B567: 000800.SZ | C567: 一汽解放
B568: 002760.SZ | C568: 凤形股份 | E568: 0.43700000000000006 | F568: 0.76000000000000001 | G568: -1.3636000000000001 | H568: -1.9166999999999998 | I568: -2.3077000000000001 | J568: -9.0833000000000013 | K568: 1.5 | L568: 2.0909 | M568: 2.2353000000000001 | N568: 1.3608000000000002 | O568: 9.5 | P568: 1.6666999999999998 | Q568: 1.1904999999999999 | R568: 1.1429 | S568: -0.23809999999999998 | T568: 3.1300000000000001e-02 | U568: -2.1700000000000001e-02 | V568: -8.0000000000000002e-02 | W568: 0.4375 | X568: 0.42420000000000002 | Y568: 0.68889999999999996 | AA568: =(N568+O568+P568+Q568+R568+S568+T568+U568+V568+W568+X568+Y568)/12 -> 1.3419166666666669 | AB568: =(G568+H568+I568+J568+K568+L568+M568+N568+O568+P568+Q568+R568+S568+T568+U568+V568+W568+X568+Y568)/19 -> 0.38199473684210511 | AC568: =(R568+S568)/2 -> 0.45240000000000002 | AD568: =(S568+T568)/2 -> -0.10339999999999999 | AE568: =(T568+U568)/2 -> 4.8000000000000004e-03 | AF568: =(U568+V568)/2 -> -5.0849999999999999e-02 | AG568: =(V568+W568)/2 -> 0.17874999999999999 | AH568: =(W568+X568)/2 -> 0.43085000000000001 | AI568: =(X568+Y568)/2 -> 0.55654999999999999 | AJ568: =STDEV(G568:Y568) -> 3.3393659146067574 | AK568: 1.2487000000000001 | AL568: 0.53180000000000005 | AM568: 0.57350000000000001 | AN568: 0.34850000000000003 | AO568: 0.37310000000000004 | AP568: 0.2477 | AQ568: 0.16930000000000001 | AR568: 0.33289999999999997 | AS568: -4.0199999999999993e-02 | AT568: -0.18679999999999999 | AU568: 4.2999999999999997e-02 | AV568: -2.8900000000000002e-02 | AW568: 0.19 | AX568: 0.34570000000000001 | AY568: 0.14480000000000001 | AZ568: 0.23980000000000001 | BA568: 0.54770000000000008 | BB568: 0.41220000000000001 | BC568: 0.31950000000000001 | BE568: =(AR568+AS568+AT568+AU568+AV568+AW568+AX568+AY568+AZ568+BA568+BB568+BC568)/12 -> 0.19330833333333333 | BF568: =(AK568+AL568+AM568+AN568+AO568+AP568+AQ568+AR568+AS568+AT568+AU568+AV568+AV568+AW568+AX568+AY568+AZ568+BA568+BB568+BC568)/19 -> 0.30438947368421054 | BG568: =(AV568+AW568)/2 -> 8.0549999999999997e-02 | BH568: =(AW568+AX568)/2 -> 0.26785000000000003 | BI568: =(AX568+AY568)/2 -> 0.24525000000000002 | BJ568: =(AY568+AZ568)/2 -> 0.19230000000000003 | BK568: =(AZ568+BA568)/2 -> 0.39375000000000004 | BL568: =(BA568+BB568)/2 -> 0.47995000000000004 | BM568: =(BB568+BC568)/2 -> 0.36585000000000001 | BN568: =STDEV(AK568:BC568) -> 0.30728704621563502
B569: 002896.SZ | C569: 中大力德 | E569: 0.39429999999999998 | F569: 0.76000000000000001 | I569: 0.60870000000000002 | J569: 0.15380000000000002 | K569: -5.8799999999999998e-02 | L569: -6.25e-02 | M569: 0 | N569: 1.11e-02 | O569: 0.125 | P569: -0.42219999999999996 | Q569: -0.41889999999999999 | R569: -0.2747 | S569: -0.27779999999999999 | T569: 0.84620000000000006 | U569: 0.74419999999999997 | V569: 0.33329999999999999 | W569: 0.76919999999999999 | X569: 8.3299999999999999e-02 | Y569: 1.3300000000000001e-02 | AA569: =(N569+O569+P569+Q569+R569+S569+T569+U569+V569+W569+X569+Y569)/12 -> 0.12766666666666668 | AB569: =(G569+H569+I569+J569+K569+L569+M569+N569+O569+P569+Q569+R569+S569+T569+U569+V569+W569+X569+Y569)/19 -> 0.11437894736842105 | AC569: =(R569+S569)/2 -> -0.27625 | AD569: =(S569+T569)/2 -> 0.28420000000000001 | AE569: =(T569+U569)/2 -> 0.79520000000000002 | AF569: =(U569+V569)/2 -> 0.53874999999999995 | AG569: =(V569+W569)/2 -> 0.55125000000000002 | AH569: =(W569+X569)/2 -> 0.42625000000000002 | AI569: =(X569+Y569)/2 -> 4.8300000000000003e-02 | AJ569: =STDEV(G569:Y569) -> 0.4050921761481831
B570: 003021.SZ | C570: 兆威机电 | T570: -0.41889999999999999 | U570: -0.51890000000000003 | V570: -0.33179999999999998 | W570: -0.2321 | X570: -0.39529999999999998 | Y570: -0.45710000000000001 | AA570: =(N570+O570+P570+Q570+R570+S570+T570+U570+V570+W570+X570+Y570)/12 -> -0.19617499999999999 | AB570: =(G570+H570+I570+J570+K570+L570+M570+N570+O570+P570+Q570+R570+S570+T570+U570+V570+W570+X570+Y570)/19 -> -0.1239 | AC570: =(R570+S570)/2 -> 0 | AD570: =(S570+T570)/2 -> -0.20945 | AE570: =(T570+U570)/2 -> -0.46889999999999998 | AF570: =(U570+V570)/2 -> -0.42535000000000001 | AG570: =(V570+W570)/2 -> -0.28194999999999998 | AH570: =(W570+X570)/2 -> -0.31369999999999998 | AI570: =(X570+Y570)/2 -> -0.42620000000000002 | AJ570: =STDEV(G570:Y570) -> 0.10026707834578606
B571: 600727.SH | C571: 鲁北化工
B572: 603115.SH | C572: 海星股份 | E572: 0.24309999999999998 | F572: 0.66500000000000004 | P572: 4.5499999999999999e-02 | Q572: -0.1449 | R572: -0.28120000000000001 | S572: -0.42859999999999998 | T572: -0.42090000000000005 | U572: -0.25420000000000004 | V572: -0.13039999999999999 | W572: 0.25 | X572: 0.5766 | Y572: 0.72730000000000006 | AA572: =(N572+O572+P572+Q572+R572+S572+T572+U572+V572+W572+X572+Y572)/12 -> -5.0666666666666638e-03 | AB572: =(G572+H572+I572+J572+K572+L572+M572+N572+O572+P572+Q572+R572+S572+T572+U572+V572+W572+X572+Y572)/19 -> -3.199999999999998e-03 | AC572: =(R572+S572)/2 -> -0.35489999999999999 | AD572: =(S572+T572)/2 -> -0.42475000000000002 | AE572: =(T572+U572)/2 -> -0.33755000000000002 | AF572: =(U572+V572)/2 -> -0.19230000000000003 | AG572: =(V572+W572)/2 -> 5.9800000000000006e-02 | AH572: =(W572+X572)/2 -> 0.4133 | AI572: =(X572+Y572)/2 -> 0.65195000000000003 | AJ572: =STDEV(G572:Y572) -> 0.40389485100291472 | AT572: -9.7999999999999997e-03 | AU572: -5.1399999999999994e-02 | AV572: -2.2000000000000001e-03 | AW572: 0.1217 | AX572: 3.95e-02 | AY572: 0.15670000000000001 | AZ572: 4.1700000000000001e-02 | BA572: 0.3029 | BB572: 0.42509999999999998 | BC572: 0.32659999999999995 | BE572: =(AR572+AS572+AT572+AU572+AV572+AW572+AX572+AY572+AZ572+BA572+BB572+BC572)/12 -> 0.11256666666666666 | BF572: =(AK572+AL572+AM572+AN572+AO572+AP572+AQ572+AR572+AS572+AT572+AU572+AV572+AV572+AW572+AX572+AY572+AZ572+BA572+BB572+BC572)/19 -> 7.0978947368421058e-02 | BG572: =(AV572+AW572)/2 -> 5.9750000000000004e-02 | BH572: =(AW572+AX572)/2 -> 8.0600000000000005e-02 | BI572: =(AX572+AY572)/2 -> 9.8100000000000007e-02 | BJ572: =(AY572+AZ572)/2 -> 9.920000000000001e-02 | BK572: =(AZ572+BA572)/2 -> 0.17230000000000001 | BL572: =(BA572+BB572)/2 -> 0.36399999999999999 | BM572: =(BB572+BC572)/2 -> 0.37584999999999996 | BN572: =STDEV(AK572:BC572) -> 0.16400124525272494
B573: 603337.SH | C573: 杰克股份
B574: 600859.SH | C574: 王府井
B575: 000828.SZ | C575: 东莞控股
B576: 002995.SZ | C576: 天地在线
B577: 002942.SZ | C577: 新农股份
B578: 600377.SH | C578: 宁沪高速
B579: 002138.SZ | C579: 顺络电子 | G579: -4.1700000000000001e-02 | H579: -5.5599999999999997e-02 | I579: -8.3299999999999999e-02 | J579: 0.33329999999999999 | K579: 0.21739999999999998 | L579: 0.29410000000000003 | M579: 0.34090000000000004 | N579: -0.16670000000000001 | O579: -0.1429 | P579: -0.15909999999999999 | Q579: -0.1525 | R579: 0.20000000000000001 | S579: 0.25 | T579: 0.37840000000000001 | U579: 0.47999999999999998 | V579: 1 | W579: 0.69999999999999996 | X579: 0.47060000000000002 | Y579: 0.32429999999999998 | AA579: =(N579+O579+P579+Q579+R579+S579+T579+U579+V579+W579+X579+Y579)/12 -> 0.26517499999999999 | AB579: =(G579+H579+I579+J579+K579+L579+M579+N579+O579+P579+Q579+R579+S579+T579+U579+V579+W579+X579+Y579)/19 -> 0.22037894736842109 | AC579: =(R579+S579)/2 -> 0.22500000000000001 | AD579: =(S579+T579)/2 -> 0.31420000000000003 | AE579: =(T579+U579)/2 -> 0.42920000000000003 | AF579: =(U579+V579)/2 -> 0.73999999999999999 | AG579: =(V579+W579)/2 -> 0.84999999999999998 | AH579: =(W579+X579)/2 -> 0.58529999999999993 | AI579: =(X579+Y579)/2 -> 0.39744999999999997 | AJ579: =STDEV(G579:Y579) -> 0.31968365019004397
B580: 002568.SZ | C580: 百润股份
B581: 002736.SZ | C581: 国信证券
B582: 003011.SZ | C582: 海象新材
B583: 600016.SH | C583: 民生银行
B584: 601869.SH | C584: 长飞光纤
B585: 603898.SH | C585: 好莱客
B586: 605155.SH | C586: 西大门
B587: 605286.SH | C587: 同力日升 | V587: 0.28570000000000001 | W587: 0.55559999999999998 | X587: -4.5499999999999999e-02 | Y587: -0.1477 | AA587: =(N587+O587+P587+Q587+R587+S587+T587+U587+V587+W587+X587+Y587)/12 -> 5.4008333333333325e-02 | AB587: =(G587+H587+I587+J587+K587+L587+M587+N587+O587+P587+Q587+R587+S587+T587+U587+V587+W587+X587+Y587)/19 -> 3.4110526315789466e-02 | AC587: =(R587+S587)/2 -> 0 | AD587: =(S587+T587)/2 -> 0 | AE587: =(T587+U587)/2 -> 0 | AF587: =(U587+V587)/2 -> 0.14285 | AG587: =(V587+W587)/2 -> 0.42064999999999997 | AH587: =(W587+X587)/2 -> 0.25505 | AI587: =(X587+Y587)/2 -> -9.6599999999999991e-02 | AJ587: =STDEV(G587:Y587) -> 0.32103633620926258
B588: 605589.SH | C588: 圣泉集团 | J588: 8.8200000000000001e-02 | K588: 0.1333 | L588: 0.17499999999999999 | M588: 0.15689999999999998 | N588: 6.7599999999999993e-02 | O588: -5.8799999999999998e-02 | P588: -0.34039999999999998 | Q588: -6.7799999999999999e-02 | R588: -0.13919999999999999 | S588: 0.25 | T588: 0.90319999999999989 | U588: 0.72730000000000006 | V588: 0.8529000000000001 | W588: 0.14999999999999999 | X588: -8.4700000000000011e-02 | Y588: -0.21050000000000002 | AA588: =(N588+O588+P588+Q588+R588+S588+T588+U588+V588+W588+X588+Y588)/12 -> 0.17079999999999995 | AB588: =(G588+H588+I588+J588+K588+L588+M588+N588+O588+P588+Q588+R588+S588+T588+U588+V588+W588+X588+Y588)/19 -> 0.13699999999999996 | AC588: =(R588+S588)/2 -> 5.5400000000000005e-02 | AD588: =(S588+T588)/2 -> 0.5766 | AE588: =(T588+U588)/2 -> 0.81525000000000003 | AF588: =(U588+V588)/2 -> 0.79010000000000002 | AG588: =(V588+W588)/2 -> 0.50145000000000006 | AH588: =(W588+X588)/2 -> 3.2649999999999992e-02 | AI588: =(X588+Y588)/2 -> -0.14760000000000001 | AJ588: =STDEV(G588:Y588) -> 0.36641017976215307
B589: 002801.SZ | C589: 微光股份
B590: 002966.SZ | C590: 苏州银行
B591: 600760.SH | C591: 中航沈飞 | G591: -0.85709999999999997 | H591: -1.5 | I591: -5.2000000000000002 | J591: 0.27500000000000002 | K591: 0.84620000000000006 | L591: 1.2333000000000001 | M591: 1.7097 | N591: 3.9199999999999999e-02 | O591: 8 | P591: 3.4286000000000003 | Q591: 1 | R591: 0.18870000000000001 | S591: 2.0713999999999997 | T591: 0.9677 | U591: 0.34090000000000004 | V591: 0.6825 | W591: -0.41859999999999997 | X591: -0.19670000000000001 | Y591: 0.25420000000000004 | AA591: =(N591+O591+P591+Q591+R591+S591+T591+U591+V591+W591+X591+Y591)/12 -> 1.3631583333333337 | AB591: =(G591+H591+I591+J591+K591+L591+M591+N591+O591+P591+Q591+R591+S591+T591+U591+V591+W591+X591+Y591)/19 -> 0.67710526315789477 | AC591: =(R591+S591)/2 -> 1.1300499999999998 | AD591: =(S591+T591)/2 -> 1.5195499999999997 | AE591: =(T591+U591)/2 -> 0.65429999999999999 | AF591: =(U591+V591)/2 -> 0.51170000000000004 | AG591: =(V591+W591)/2 -> 0.13195000000000001 | AH591: =(W591+X591)/2 -> -0.30764999999999998 | AI591: =(X591+Y591)/2 -> 2.8750000000000012e-02 | AJ591: =STDEV(G591:Y591) -> 2.4656482211634159
B592: 601512.SH | C592: 中新集团
B593: 603305.SH | C593: 旭升股份 | E593: 0.37229999999999996 | F593: 0.73999999999999999 | H593: 0.40909999999999996 | I593: 0.15789999999999998 | J593: 3.5099999999999999e-02 | K593: -6.6699999999999995e-02 | L593: 6.4500000000000002e-02 | M593: 0.29549999999999998 | N593: 0.23730000000000001 | O593: -0.35710000000000003 | P593: -0.36359999999999998 | Q593: -0.40350000000000003 | R593: -0.28770000000000001 | S593: 0.44439999999999996 | T593: 0.61899999999999999 | U593: 0.61759999999999993 | V593: 0.48080000000000001 | W593: 0.53849999999999998 | X593: 0.38240000000000002 | Y593: 0.34549999999999997 | AA593: =(N593+O593+P593+Q593+R593+S593+T593+U593+V593+W593+X593+Y593)/12 -> 0.18779999999999997 | AB593: =(G593+H593+I593+J593+K593+L593+M593+N593+O593+P593+Q593+R593+S593+T593+U593+V593+W593+X593+Y593)/19 -> 0.16573684210526315 | AC593: =(R593+S593)/2 -> 7.8349999999999975e-02 | AD593: =(S593+T593)/2 -> 0.53169999999999995 | AE593: =(T593+U593)/2 -> 0.61829999999999996 | AF593: =(U593+V593)/2 -> 0.54919999999999991 | AG593: =(V593+W593)/2 -> 0.50964999999999994 | AH593: =(W593+X593)/2 -> 0.46045000000000003 | AI593: =(X593+Y593)/2 -> 0.36395 | AJ593: =STDEV(G593:Y593) -> 0.34717428954382756
B594: 603686.SH | C594: 福龙马
B595: 603915.SH | C595: 国茂股份 | P595: 0.28000000000000003 | Q595: 9.0899999999999995e-02 | R595: 0.1552 | S595: -0.46149999999999997 | T595: 3.1300000000000001e-02 | U595: 6.25e-02 | V595: 0.16420000000000001 | W595: 1.4286000000000001 | X595: 0.36359999999999998 | Y595: 0.45100000000000001 | AA595: =(N595+O595+P595+Q595+R595+S595+T595+U595+V595+W595+X595+Y595)/12 -> 0.21381666666666668 | AB595: =(G595+H595+I595+J595+K595+L595+M595+N595+O595+P595+Q595+R595+S595+T595+U595+V595+W595+X595+Y595)/19 -> 0.13504210526315791 | AC595: =(R595+S595)/2 -> -0.15314999999999998 | AD595: =(S595+T595)/2 -> -0.21509999999999999 | AE595: =(T595+U595)/2 -> 4.6899999999999997e-02 | AF595: =(U595+V595)/2 -> 0.11335000000000001 | AG595: =(V595+W595)/2 -> 0.7964 | AH595: =(W595+X595)/2 -> 0.89610000000000001 | AI595: =(X595+Y595)/2 -> 0.4073 | AJ595: =STDEV(G595:Y595) -> 0.4800174344055988
B596: 605081.SH | C596: 太和水
B597: 600409.SH | C597: 三友化工 | G597: 2.9927999999999999 | H597: 2.2746 | I597: 1.4718 | J597: 1.3408000000000002 | K597: -0.23089999999999999 | L597: 9.8100000000000007e-02 | M597: -1.8200000000000001e-02 | N597: -0.2039 | O597: -0.56130000000000002 | P597: -0.66879999999999995 | Q597: -0.6581999999999999 | R597: -0.56940000000000002 | S597: -2.1074000000000002 | T597: -1.6900999999999999 | U597: -0.93900000000000006 | V597: 5.0199999999999995e-02 | W597: 3.7905000000000002 | X597: 5.3317999999999994 | Y597: 46.269199999999998 | AA597: =(N597+O597+P597+Q597+R597+S597+T597+U597+V597+W597+X597+Y597)/12 -> 4.0036333333333332 | AB597: =(G597+H597+I597+J597+K597+L597+M597+N597+O597+P597+Q597+R597+S597+T597+U597+V597+W597+X597+Y597)/19 -> 2.9459263157894737 | AC597: =(R597+S597)/2 -> -1.3384 | AD597: =(S597+T597)/2 -> -1.8987500000000002 | AE597: =(T597+U597)/2 -> -1.3145500000000001 | AF597: =(U597+V597)/2 -> -0.44440000000000002 | AG597: =(V597+W597)/2 -> 1.92035 | AH597: =(W597+X597)/2 -> 4.5611499999999996 | AI597: =(X597+Y597)/2 -> 25.8005 | AJ597: =STDEV(G597:Y597) -> 10.663136773005613 | AK597: 0.37670000000000003 | AL597: 0.23260000000000003 | AM597: 0.24940000000000001 | AN597: 0.18190000000000001 | AO597: 9.9600000000000008e-02 | AP597: 0.1273 | AQ597: 0.14829999999999999 | AR597: 0.17249999999999999 | AS597: 0.16109999999999999 | AT597: 0.12089999999999999 | AU597: 7.4099999999999999e-02 | AV597: 2.7200000000000002e-02 | AW597: -0.2069 | AX597: -0.15490000000000001 | AY597: -0.12990000000000002 | AZ597: -8.9399999999999993e-02 | BA597: 0.43430000000000002 | BB597: 0.29559999999999997 | BC597: 0.29600000000000004 | BE597: =(AR597+AS597+AT597+AU597+AV597+AW597+AX597+AY597+AZ597+BA597+BB597+BC597)/12 -> 8.3383333333333323e-02 | BF597: =(AK597+AL597+AM597+AN597+AO597+AP597+AQ597+AR597+AS597+AT597+AU597+AV597+AV597+AW597+AX597+AY597+AZ597+BA597+BB597+BC597)/19 -> 0.12861052631578948 | BG597: =(AV597+AW597)/2 -> -8.9849999999999999e-02 | BH597: =(AW597+AX597)/2 -> -0.18090000000000001 | BI597: =(AX597+AY597)/2 -> -0.14240000000000003 | BJ597: =(AY597+AZ597)/2 -> -0.10965 | BK597: =(AZ597+BA597)/2 -> 0.17245000000000002 | BL597: =(BA597+BB597)/2 -> 0.36495 | BM597: =(BB597+BC597)/2 -> 0.29580000000000001 | BN597: =STDEV(AK597:BC597) -> 0.17700180657881359
B598: 000090.SZ | C598: 天健集团 | E598: 0 | F598: 0.73399999999999999 | G598: 5.0113000000000003 | H598: 0.62590000000000001 | I598: 1.0465 | J598: 0.1229 | K598: -0.82189999999999996 | L598: -0.54610000000000003 | M598: -0.75319999999999998 | N598: -7.000000000000001e-04 | O598: -9.7899999999999987e-02 | P598: -9.8800000000000013e-02 | Q598: -5.0300000000000004e-02 | R598: 0.44439999999999996 | S598: 14.4223 | T598: 5.4122000000000003 | U598: 6.7035 | V598: 0.22140000000000001 | W598: -6.0100000000000001e-02 | X598: 7.2499999999999995e-02 | Y598: 7.3499999999999996e-02 | AA598: =(N598+O598+P598+Q598+R598+S598+T598+U598+V598+W598+X598+Y598)/12 -> 2.2534999999999998 | AB598: =(G598+H598+I598+J598+K598+L598+M598+N598+O598+P598+Q598+R598+S598+T598+U598+V598+W598+X598+Y598)/19 -> 1.6698631578947367 | AC598: =(R598+S598)/2 -> 7.4333499999999999 | AD598: =(S598+T598)/2 -> 9.9172499999999992 | AE598: =(T598+U598)/2 -> 6.0578500000000002 | AF598: =(U598+V598)/2 -> 3.46245 | AG598: =(V598+W598)/2 -> 8.0649999999999999e-02 | AH598: =(W598+X598)/2 -> 6.1999999999999972e-03 | AI598: =(X598+Y598)/2 -> 7.2999999999999995e-02 | AJ598: =STDEV(G598:Y598) -> 3.7836637044023478
B599: 002603.SZ | C599: 以岭药业 | E599: 0.3105 | F599: 0.73199999999999998 | G599: 0.1638 | H599: 3.7000000000000005e-02 | I599: -2.63e-02 | J599: -6.25e-02 | K599: 0.34259999999999996 | L599: 0.32140000000000002 | M599: 0.27029999999999998 | N599: 0.11109999999999999 | O599: -4.0000000000000001e-02 | P599: 2.7000000000000003e-02 | Q599: 2.1299999999999999e-02 | R599: 2.e-02 | S599: 0.54170000000000007 | T599: 0.125 | U599: 0.2671 | V599: 1 | W599: 0.54049999999999998 | X599: 0.34990000000000004 | Y599: 0.20420000000000002
B600: 603626.SH | C600: 科森科技
B601: 601390.SH | C601: 中国中铁 | E601: 0.74370000000000003 | F601: 0.73099999999999998 | G601: 7.0000000000000007e-02 | H601: 0.38390000000000002 | I601: 0.159 | J601: 0.29399999999999998 | K601: 0.2243 | L601: 0.27100000000000002 | M601: 0.24340000000000001 | N601: 7.3200000000000001e-02 | O601: 0.14499999999999999 | P601: 1.2699999999999999e-02 | Q601: 9.0700000000000003e-02 | R601: 0.3231 | S601: -0.12 | T601: 6.5199999999999994e-02 | U601: 0.12560000000000002 | V601: 1.37e-02 | W601: 0.80299999999999994 | X601: 6.8199999999999997e-02 | Y601: 5.9400000000000001e-02
B602: 002346.SZ | C602: 柘中股份
B603: 600383.SH | C603: 金地集团 | E603: 0.65670000000000006 | F603: 2.1000000000000001 | G603: 1.7143000000000002 | H603: 0.52939999999999998 | I603: 0.31579999999999997 | J603: 8.5699999999999998e-02 | K603: 0.26319999999999999 | L603: 1.0385 | M603: 1.3200000000000001 | N603: 0.17760000000000001 | O603: 0.375 | P603: 0.50939999999999996 | Q603: 3.4500000000000003e-02 | R603: 0.24579999999999999 | S603: -0.12119999999999999 | T603: -0.17499999999999999 | U603: -7.4999999999999997e-02 | V603: 3.1400000000000004e-02 | W603: -0.55169999999999997 | X603: -0.39390000000000003 | Y603: -0.34229999999999999 | AA603: =(N603+O603+P603+Q603+R603+S603+T603+U603+V603+W603+X603+Y603)/12 -> -2.3783333333333337e-02 | AB603: =(G603+H603+I603+J603+K603+L603+M603+N603+O603+P603+Q603+R603+S603+T603+U603+V603+W603+X603+Y603)/19 -> 0.26218421052631574 | AC603: =(R603+S603)/2 -> 6.2300000000000001e-02 | AD603: =(S603+T603)/2 -> -0.14809999999999998 | AE603: =(T603+U603)/2 -> -0.125 | AF603: =(U603+V603)/2 -> -2.1799999999999996e-02 | AG603: =(V603+W603)/2 -> -0.26014999999999999 | AH603: =(W603+X603)/2 -> -0.4728 | AI603: =(X603+Y603)/2 -> -0.36809999999999998 | AJ603: =STDEV(G603:Y603) -> 0.57889437845215674
B604: 600989.SH | C604: 宝丰能源 | N604: 0.2727 | O604: 0 | P604: 0.33329999999999999 | Q604: 0.1389 | R604: -3.5699999999999996e-02 | S604: -0.26669999999999999 | T604: 3.5699999999999996e-02 | U604: 4.8799999999999996e-02 | V604: 0.16670000000000001 | W604: 1.1818 | X604: 0.75859999999999994 | Y604: 0.69769999999999999 | AA604: =(N604+O604+P604+Q604+R604+S604+T604+U604+V604+W604+X604+Y604)/12 -> 0.27765000000000001 | AB604: =(G604+H604+I604+J604+K604+L604+M604+N604+O604+P604+Q604+R604+S604+T604+U604+V604+W604+X604+Y604)/19 -> 0.17535789473684213 | AC604: =(R604+S604)/2 -> -0.1512 | AD604: =(S604+T604)/2 -> -0.11549999999999999 | AE604: =(T604+U604)/2 -> 4.2249999999999996e-02 | AF604: =(U604+V604)/2 -> 0.10775000000000001 | AG604: =(V604+W604)/2 -> 0.67425000000000002 | AH604: =(W604+X604)/2 -> 0.97019999999999995 | AI604: =(X604+Y604)/2 -> 0.72814999999999996 | AJ604: =STDEV(G604:Y604) -> 0.40926006512863056
B605: 603040.SH | C605: 新坐标
B606: 603566.SH | C606: 普莱柯 | E606: 0.159 | F606: 0.72999999999999998 | G606: -0.28570000000000001 | H606: -0.32140000000000002 | I606: -0.40820000000000001 | J606: -0.38979999999999998 | K606: 0.20000000000000001 | L606: 0.26319999999999999 | M606: 0.27589999999999998 | N606: 0.16670000000000001 | O606: -0.66670000000000007 | P606: -0.16670000000000001 | Q606: -0.18920000000000001 | R606: -0.1905 | S606: 3.5 | T606: 0.90000000000000002 | U606: 0.69999999999999996 | V606: 1.1176000000000001 | W606: 0.55559999999999998 | X606: 0.36840000000000006 | Y606: 0.43140000000000001 | AA606: =(N606+O606+P606+Q606+R606+S606+T606+U606+V606+W606+X606+Y606)/12 -> 0.54388333333333339 | AB606: =(G606+H606+I606+J606+K606+L606+M606+N606+O606+P606+Q606+R606+S606+T606+U606+V606+W606+X606+Y606)/19 -> 0.30845263157894742 | AC606: =(R606+S606)/2 -> 1.6547499999999999 | AD606: =(S606+T606)/2 -> 2.2000000000000002 | AE606: =(T606+U606)/2 -> 0.80000000000000004 | AF606: =(U606+V606)/2 -> 0.90880000000000005 | AG606: =(V606+W606)/2 -> 0.83660000000000001 | AH606: =(W606+X606)/2 -> 0.46200000000000002 | AI606: =(X606+Y606)/2 -> 0.39990000000000003 | AJ606: =STDEV(G606:Y606) -> 0.9092998065473975
B607: 605069.SH | C607: 正和生态 | X607: 3.4443999999999999 | Y607: 0.30359999999999998 | AA607: =(N607+O607+P607+Q607+R607+S607+T607+U607+V607+W607+X607+Y607)/12 -> 0.3123333333333333 | AB607: =(G607+H607+I607+J607+K607+L607+M607+N607+O607+P607+Q607+R607+S607+T607+U607+V607+W607+X607+Y607)/19 -> 0.19726315789473683 | AC607: =(R607+S607)/2 -> 0 | AD607: =(S607+T607)/2 -> 0 | AE607: =(T607+U607)/2 -> 0 | AF607: =(U607+V607)/2 -> 0 | AG607: =(V607+W607)/2 -> 0 | AH607: =(W607+X607)/2 -> 1.7222 | AI607: =(X607+Y607)/2 -> 1.8739999999999999 | AJ607: =STDEV(G607:Y607) -> 2.2208809783507082
B608: 600039.SH | C608: 四川路桥 | E608: 0.77300000000000002 | F608: 0.72699999999999998 | G608: -0.1744 | H608: 4.3700000000000003e-02 | I608: -0.26000000000000001 | J608: -4.3700000000000003e-02 | K608: 4.9500000000000002e-02 | L608: 6.6900000000000001e-02 | M608: 8.4499999999999992e-02 | N608: -1.9e-02 | O608: 2.0346000000000002 | P608: 0.59140000000000004 | Q608: 0.52549999999999997 | R608: 0.45270000000000005 | S608: -0.2145 | T608: 0.26530000000000004 | U608: 1.0017 | V608: 0.65459999999999996 | W608: 2.3047 | X608: 0.97560000000000002 | Y608: 0.55700000000000005 | AA608: =(N608+O608+P608+Q608+R608+S608+T608+U608+V608+W608+X608+Y608)/12 -> 0.76080000000000014 | AB608: =(G608+H608+I608+J608+K608+L608+M608+N608+O608+P608+Q608+R608+S608+T608+U608+V608+W608+X608+Y608)/19 -> 0.46821578947368425 | AC608: =(R608+S608)/2 -> 0.11910000000000003 | AD608: =(S608+T608)/2 -> 2.540000000000002e-02 | AE608: =(T608+U608)/2 -> 0.63350000000000006 | AF608: =(U608+V608)/2 -> 0.82814999999999994 | AG608: =(V608+W608)/2 -> 1.4796499999999999 | AH608: =(W608+X608)/2 -> 1.64015 | AI608: =(X608+Y608)/2 -> 0.76629999999999998 | AJ608: =STDEV(G608:Y608) -> 0.70880928579254032
B609: 002968.SZ | C609: 新大正 | Q609: -0.15789999999999998 | R609: -0.23170000000000002 | S609: -0.2109 | T609: -0.152 | U609: -0.128 | V609: -3.1699999999999999e-02 | W609: -3.39e-02 | X609: -7.9199999999999993e-02 | Y609: -0.13449999999999998 | AA609: =(N609+O609+P609+Q609+R609+S609+T609+U609+V609+W609+X609+Y609)/12 -> -9.6650000000000014e-02 | AB609: =(G609+H609+I609+J609+K609+L609+M609+N609+O609+P609+Q609+R609+S609+T609+U609+V609+W609+X609+Y609)/19 -> -6.1042105263157904e-02 | AC609: =(R609+S609)/2 -> -0.2213 | AD609: =(S609+T609)/2 -> -0.18145 | AE609: =(T609+U609)/2 -> -0.14000000000000001 | AF609: =(U609+V609)/2 -> -7.9850000000000004e-02 | AG609: =(V609+W609)/2 -> -3.2799999999999996e-02 | AH609: =(W609+X609)/2 -> -5.6549999999999996e-02 | AI609: =(X609+Y609)/2 -> -0.10684999999999999 | AJ609: =STDEV(G609:Y609) -> 7.0393128215756967e-02
B610: 000961.SZ | C610: 中南建设
B611: 600740.SH | C611: 山西焦化 | G611: 1.1318000000000001 | H611: 1.2304999999999999 | I611: 2.6849000000000003 | J611: 1.0796999999999999 | K611: 13.117599999999999 | L611: 27.811500000000002 | M611: 14.6701 | N611: 9.0924999999999994 | O611: 0.32500000000000001 | P611: -0.318 | Q611: -0.56840000000000002 | R611: -0.80040000000000011 | S611: -0.79209999999999992 | T611: -0.65689999999999993 | U611: -0.2112 | V611: 1.3037000000000001 | W611: 2.4659999999999997 | X611: 2.0621999999999998 | Y611: 0.98950000000000005 | AA611: =(N611+O611+P611+Q611+R611+S611+T611+U611+V611+W611+X611+Y611)/12 -> 1.074325 | AB611: =(G611+H611+I611+J611+K611+L611+M611+N611+O611+P611+Q611+R611+S611+T611+U611+V611+W611+X611+Y611)/19 -> 3.9272631578947372 | AC611: =(R611+S611)/2 -> -0.79625000000000001 | AD611: =(S611+T611)/2 -> -0.72449999999999992 | AE611: =(T611+U611)/2 -> -0.43404999999999994 | AF611: =(U611+V611)/2 -> 0.54625000000000001 | AG611: =(V611+W611)/2 -> 1.8848499999999999 | AH611: =(W611+X611)/2 -> 2.2641 | AI611: =(X611+Y611)/2 -> 1.5258499999999999 | AJ611: =STDEV(G611:Y611) -> 7.3667720712829112
B612: 002043.SZ | C612: 兔宝宝 | E612: 0.63039999999999996 | F612: 0.67700000000000005 | G612: 1 | H612: 0.58329999999999993 | I612: 0.40909999999999996 | J612: 0.375 | K612: 0.16670000000000001 | L612: 0.21050000000000002 | M612: 3.2300000000000002e-02 | N612: -6.8199999999999997e-02 | O612: 0.71430000000000005 | P612: -0.30430000000000001 | Q612: 0 | R612: 0.24390000000000001 | S612: -1.3333000000000002 | T612: -0.625 | U612: -0.1875 | V612: 5.8799999999999998e-02 | W612: 4.25 | X612: 6 | Y612: 1.7691999999999999 | AA612: =(N612+O612+P612+Q612+R612+S612+T612+U612+V612+W612+X612+Y612)/12 -> 0.87649166666666656 | AB612: =(G612+H612+I612+J612+K612+L612+M612+N612+O612+P612+Q612+R612+S612+T612+U612+V612+W612+X612+Y612)/19 -> 0.69972631578947375 | AC612: =(R612+S612)/2 -> -0.54470000000000007 | AD612: =(S612+T612)/2 -> -0.97915000000000008 | AE612: =(T612+U612)/2 -> -0.40625 | AF612: =(U612+V612)/2 -> -6.4350000000000004e-02 | AG612: =(V612+W612)/2 -> 2.1543999999999999 | AH612: =(W612+X612)/2 -> 5.125 | AI612: =(X612+Y612)/2 -> 3.8845999999999998 | AJ612: =STDEV(G612:Y612) -> 1.7075828490855804
B613: 002433.SZ | C613: 太安堂
B614: 002734.SZ | C614: 利民股份 | E614: 0.55640000000000001 | F614: 0.72499999999999998 | G614: 0.72219999999999995 | H614: -0.19439999999999999 | I614: -6.9800000000000001e-02 | J614: -0.40960000000000002 | K614: -0.3226 | L614: 0.27589999999999998 | M614: 0.29999999999999999 | N614: 0.51019999999999999 | O614: 0.38100000000000001 | P614: 0.48649999999999999 | Q614: 0.5 | R614: 0.20269999999999999 | S614: 0.72409999999999997 | T614: 0.52729999999999999 | U614: 0.30769999999999997 | V614: 0.17979999999999999 | W614: -0.14000000000000001 | X614: -0.21429999999999999 | Y614: -0.29409999999999997 | AA614: =(N614+O614+P614+Q614+R614+S614+T614+U614+V614+W614+X614+Y614)/12 -> 0.26424166666666665 | AB614: =(G614+H614+I614+J614+K614+L614+M614+N614+O614+P614+Q614+R614+S614+T614+U614+V614+W614+X614+Y614)/19 -> 0.18276842105263155 | AC614: =(R614+S614)/2 -> 0.46339999999999998 | AD614: =(S614+T614)/2 -> 0.62569999999999992 | AE614: =(T614+U614)/2 -> 0.41749999999999998 | AF614: =(U614+V614)/2 -> 0.24374999999999997 | AG614: =(V614+W614)/2 -> 1.9899999999999987e-02 | AH614: =(W614+X614)/2 -> -0.17715 | AI614: =(X614+Y614)/2 -> -0.25419999999999998 | AJ614: =STDEV(G614:Y614) -> 0.36378761058347636 | BA614: -0.19220000000000001 | BB614: -0.1946 | BC614: -6.88e-02 | BO614: 42031 | BS614: 3.726 | BT614: 3.2530000000000001 | CB614: 2 | CC614: 先减少然后保持不变(由11家减少到2家，再减少到2家) | CD614: 持续减少（由5.55%减少到5.3%，再减少到4.26%） | CJ614: =CI614/BS614 -> 0 | CK614: 不宜进入(虽然销售额在持续增长，但仍不符合进入标准且利润增长持续下滑，机构持有数量和机构持有份额持续下滑，不宜持有) | CL614: 44608
B615: 002938.SZ | C615: 鹏鼎控股
B616: 600171.SH | C616: 上海贝岭 | G616: 0.375 | H616: 3.8292999999999999 | I616: 2.8966000000000003 | J616: 3.3332999999999999 | K616: 0.18179999999999999 | L616: -0.46970000000000001 | M616: -0.37609999999999999 | N616: -0.1923 | O616: 4.3845999999999998 | P616: 0.94290000000000007 | Q616: 0.78010000000000002 | R616: 0.71430000000000005 | S616: -0.57140000000000002 | T616: -0.3725 | U616: -0.24299999999999999 | V616: 1.0832999999999999 | W616: 2.3332999999999999 | X616: 3.3516000000000004 | Y616: 2.7894999999999999 | AA616: =(N616+O616+P616+Q616+R616+S616+T616+U616+V616+W616+X616+Y616)/12 -> 1.2500333333333333 | AB616: =(G616+H616+I616+J616+K616+L616+M616+N616+O616+P616+Q616+R616+S616+T616+U616+V616+W616+X616+Y616)/19 -> 1.3037157894736844 | AC616: =(R616+S616)/2 -> 7.1450000000000014e-02 | AD616: =(S616+T616)/2 -> -0.47194999999999998 | AE616: =(T616+U616)/2 -> -0.30774999999999997 | AF616: =(U616+V616)/2 -> 0.42014999999999997 | AG616: =(V616+W616)/2 -> 1.7082999999999999 | AH616: =(W616+X616)/2 -> 2.8424500000000004 | AI616: =(X616+Y616)/2 -> 3.0705499999999999 | AJ616: =STDEV(G616:Y616) -> 1.6638783894073634 | AK616: 0.10310000000000001 | AL616: -2.8000000000000004e-03 | AM616: 3.0600000000000002e-02 | AN616: 5.7500000000000002e-02 | AO616: 5.9200000000000003e-02 | AP616: 0.28079999999999999 | AQ616: 0.34860000000000002 | AR616: 0.29559999999999997 | AS616: 0.191 | AT616: 0.1152 | AU616: 0.2482 | AV616: 0.33450000000000002 | AW616: 0.40060000000000001 | AX616: 0.35259999999999997 | AY616: 0.14630000000000001 | AZ616: 0.12050000000000001 | BA616: 0.42219999999999996 | BB616: 0.73329999999999995 | BC616: 0.8125 | BE616: =(AR616+AS616+AT616+AU616+AV616+AW616+AX616+AY616+AZ616+BA616+BB616+BC616)/12 -> 0.34770833333333329 | BF616: =(AK616+AL616+AM616+AN616+AO616+AP616+AQ616+AR616+AS616+AT616+AU616+AV616+AV616+AW616+AX616+AY616+AZ616+BA616+BB616+BC616)/19 -> 0.28336842105263155 | BG616: =(AV616+AW616)/2 -> 0.36755000000000004 | BH616: =(AW616+AX616)/2 -> 0.37659999999999999 | BI616: =(AX616+AY616)/2 -> 0.24945000000000001 | BJ616: =(AY616+AZ616)/2 -> 0.13340000000000002 | BK616: =(AZ616+BA616)/2 -> 0.27134999999999998 | BL616: =(BA616+BB616)/2 -> 0.57774999999999999 | BM616: =(BB616+BC616)/2 -> 0.77289999999999992 | BN616: =STDEV(AK616:BC616) -> 0.22164513231371127
B617: 600750.SH | C617: 江中药业 | E617: 0.13189999999999999 | F617: 0.71699999999999997 | G617: 0 | H617: -0.24239999999999998 | I617: -0.10589999999999999 | J617: -0.2205 | K617: -0.22219999999999998 | L617: -0.14000000000000001 | M617: -0.11840000000000001 | N617: -9.0899999999999995e-02 | O617: -0.1429 | P617: -6.9800000000000001e-02 | Q617: -8.9600000000000013e-02 | R617: -0.17780000000000001 | S617: -0.125 | T617: 7.4999999999999997e-02 | U617: 3.2799999999999996e-02 | V617: 1.3500000000000002e-02 | W617: 0.1905 | X617: 0.13949999999999999 | Y617: 0.1429 | AA617: =(N617+O617+P617+Q617+R617+S617+T617+U617+V617+W617+X617+Y617)/12 -> -8.4833333333333427e-03 | AB617: =(G617+H617+I617+J617+K617+L617+M617+N617+O617+P617+Q617+R617+S617+T617+U617+V617+W617+X617+Y617)/19 -> -6.058947368421054e-02 | AC617: =(R617+S617)/2 -> -0.15140000000000001 | AD617: =(S617+T617)/2 -> -2.5000000000000001e-02 | AE617: =(T617+U617)/2 -> 5.3899999999999997e-02 | AF617: =(U617+V617)/2 -> 2.3149999999999997e-02 | AG617: =(V617+W617)/2 -> 0.10200000000000001 | AH617: =(W617+X617)/2 -> 0.16499999999999998 | AI617: =(X617+Y617)/2 -> 0.14119999999999999 | AJ617: =STDEV(G617:Y617) -> 0.12989501698909195
B618: 603396.SH | C618: 金辰股份 | I618: 0.10339999999999999 | J618: 0.1043 | K618: -0.13489999999999999 | L618: -0.3221 | M618: -0.36759999999999998 | N618: -0.37009999999999998 | O618: -0.12 | P618: -6.2800000000000009e-02 | Q618: -0.2094 | R618: -0.28749999999999998 | S618: -0.36359999999999998 | T618: 0 | U618: 0.27079999999999999 | V618: 0.36840000000000006 | W618: 0.78569999999999995 | X618: 0.27500000000000002 | Y618: 0.18030000000000002 | AA618: =(N618+O618+P618+Q618+R618+S618+T618+U618+V618+W618+X618+Y618)/12 -> 3.8900000000000018e-02 | AB618: =(G618+H618+I618+J618+K618+L618+M618+N618+O618+P618+Q618+R618+S618+T618+U618+V618+W618+X618+Y618)/19 -> -7.9000000000000008e-03 | AC618: =(R618+S618)/2 -> -0.32555000000000001 | AD618: =(S618+T618)/2 -> -0.18179999999999999 | AE618: =(T618+U618)/2 -> 0.13539999999999999 | AF618: =(U618+V618)/2 -> 0.3196 | AG618: =(V618+W618)/2 -> 0.57705000000000006 | AH618: =(W618+X618)/2 -> 0.53034999999999999 | AI618: =(X618+Y618)/2 -> 0.22765000000000002 | AJ618: =STDEV(G618:Y618) -> 0.31877275754976675
B619: 603506.SH | C619: 南都物业
B620: 603808.SH | C620: 歌力思
B621: 002705.SZ | C621: 新宝股份
B622: 000048.SZ | C622: 京基智农
B623: 002949.SZ | C623: 华阳国际
B624: 002753.SZ | C624: 永东股份
B625: 600643.SH | C625: 爱建集团
B626: 603970.SH | C626: 中农立华 | E626: 0.74909999999999999 | F626: 0.71299999999999997 | I626: 0.10640000000000001 | J626: -0.1038 | K626: 5.8799999999999998e-02 | L626: -0.34970000000000001 | M626: -0.35619999999999996 | N626: -0.1789 | O626: -0.18609999999999999 | P626: 7.3300000000000004e-02 | Q626: 6.6400000000000001e-02 | R626: 2.9399999999999999e-02 | S626: 3.0699999999999998e-02 | T626: 7.2900000000000006e-02 | U626: 0.1173 | V626: 0.1142 | W626: 0.20199999999999999 | X626: 0.20579999999999998 | Y626: 0.2732 | AA626: =(N626+O626+P626+Q626+R626+S626+T626+U626+V626+W626+X626+Y626)/12 -> 6.8350000000000008e-02 | AB626: =(G626+H626+I626+J626+K626+L626+M626+N626+O626+P626+Q626+R626+S626+T626+U626+V626+W626+X626+Y626)/19 -> 9.2473684210526291e-03 | AC626: =(R626+S626)/2 -> 3.005e-02 | AD626: =(S626+T626)/2 -> 5.1799999999999999e-02 | AE626: =(T626+U626)/2 -> 9.5100000000000004e-02 | AF626: =(U626+V626)/2 -> 0.11574999999999999 | AG626: =(V626+W626)/2 -> 0.15809999999999999 | AH626: =(W626+X626)/2 -> 0.20389999999999997 | AI626: =(X626+Y626)/2 -> 0.23949999999999999 | AJ626: =STDEV(G626:Y626) -> 0.18388919877597648 | AM626: 0.10249999999999999 | AN626: 8.900000000000001e-02 | AO626: 6.1500000000000006e-02 | AP626: 6.6699999999999995e-02 | AQ626: -2.2599999999999999e-02 | AR626: 6.0000000000000001e-03 | AS626: 3.7100000000000001e-02 | AT626: 0.19350000000000001 | AU626: 0.16370000000000001 | AV626: 0.20050000000000001 | AW626: 0.38009999999999999 | AX626: 0.217 | AY626: 0.29330000000000001 | AZ626: 0.30510000000000004 | BA626: 0.38689999999999997 | BB626: 0.45119999999999999 | BC626: 0.45530000000000004 | BE626: =(AR626+AS626+AT626+AU626+AV626+AW626+AX626+AY626+AZ626+BA626+BB626+BC626)/12 -> 0.25747499999999995 | BF626: =(AK626+AL626+AM626+AN626+AO626+AP626+AQ626+AR626+AS626+AT626+AU626+AV626+AV626+AW626+AX626+AY626+AZ626+BA626+BB626+BC626)/19 -> 0.18880526315789473 | BG626: =(AV626+AW626)/2 -> 0.2903 | BH626: =(AW626+AX626)/2 -> 0.29854999999999998 | BI626: =(AX626+AY626)/2 -> 0.25514999999999999 | BJ626: =(AY626+AZ626)/2 -> 0.29920000000000002 | BK626: =(AZ626+BA626)/2 -> 0.34599999999999997 | BL626: =(BA626+BB626)/2 -> 0.41904999999999998 | BM626: =(BB626+BC626)/2 -> 0.45325000000000004 | BN626: =STDEV(AK626:BC626) -> 0.15603255881951278
B627: 000501.SZ | C627: 鄂武商A
B628: 002146.SZ | C628: 荣盛发展
B629: 002543.SZ | C629: 万和电气
B630: 002722.SZ | C630: 金轮股份 | E630: 0.33689999999999998 | F630: 0.70999999999999996 | G630: 0 | H630: -7.8899999999999998e-02 | I630: -8.4700000000000011e-02 | J630: -0.32880000000000004 | K630: -0.1429 | L630: -2.86e-02 | M630: 3.7000000000000005e-02 | N630: 0.40820000000000001 | O630: -8.3299999999999999e-02 | P630: -8.8200000000000001e-02 | Q630: -8.929999999999999e-02 | R630: -0.50719999999999998 | S630: -0.90910000000000002 | T630: -0.3871 | U630: -0.76469999999999994 | V630: -0.44119999999999998 | W630: 21 | X630: 1.4211 | Y630: 4.9167000000000005 | AA630: =(N630+O630+P630+Q630+R630+S630+T630+U630+V630+W630+X630+Y630)/12 -> 2.0396583333333336 | AB630: =(G630+H630+I630+J630+K630+L630+M630+N630+O630+P630+Q630+R630+S630+T630+U630+V630+W630+X630+Y630)/19 -> 1.2552105263157898 | AC630: =(R630+S630)/2 -> -0.70815000000000006 | AD630: =(S630+T630)/2 -> -0.64810000000000001 | AE630: =(T630+U630)/2 -> -0.57589999999999997 | AF630: =(U630+V630)/2 -> -0.60294999999999999 | AG630: =(V630+W630)/2 -> 10.279400000000001 | AH630: =(W630+X630)/2 -> 11.21055 | AI630: =(X630+Y630)/2 -> 3.1689000000000003 | AJ630: =STDEV(G630:Y630) -> 4.9419090374396299
B631: 002773.SZ | C631: 康弘药业
B632: 600057.SH | C632: 厦门象屿 | G632: 0.57140000000000002 | H632: 0.15380000000000002 | I632: -0.25 | J632: -2.86e-02 | K632: -0.18179999999999999 | L632: 0.4667 | M632: 0.29170000000000001 | N632: 0.17649999999999999 | O632: 0.11109999999999999 | P632: 4.5499999999999999e-02 | Q632: 6.4500000000000002e-02 | R632: 0.125 | S632: 0.10000000000000001 | T632: 0.21739999999999998 | U632: 0.18179999999999999 | V632: 0.1956 | W632: 0.2727 | X632: 0.75 | Y632: 0.82050000000000001 | AA632: =(N632+O632+P632+Q632+R632+S632+T632+U632+V632+W632+X632+Y632)/12 -> 0.25505 | AB632: =(G632+H632+I632+J632+K632+L632+M632+N632+O632+P632+Q632+R632+S632+T632+U632+V632+W632+X632+Y632)/19 -> 0.21493684210526318 | AC632: =(R632+S632)/2 -> 0.1125 | AD632: =(S632+T632)/2 -> 0.15870000000000001 | AE632: =(T632+U632)/2 -> 0.1996 | AF632: =(U632+V632)/2 -> 0.18869999999999998 | AG632: =(V632+W632)/2 -> 0.23415 | AH632: =(W632+X632)/2 -> 0.51134999999999997 | AI632: =(X632+Y632)/2 -> 0.78525 | AJ632: =STDEV(G632:Y632) -> 0.27645274502872658 | AK632: 1.2263999999999999 | AL632: 0.94980000000000009 | AM632: 0.92760000000000009 | AN632: 0.75760000000000005 | AO632: 0.1439 | AP632: 0.14779999999999999 | AQ632: 0.13159999999999999 | AR632: 0.1043 | AS632: 0.1109 | AT632: 0.12560000000000002 | AU632: 0.13390000000000002 | AV632: 0.1358 | AW632: 0.24129999999999999 | AX632: 0.29120000000000001 | AY632: 0.35020000000000001 | AZ632: 0.33310000000000001 | BA632: 0.35909999999999997 | BB632: 0.33600000000000002 | BC632: 0.25929999999999997 | BE632: =(AR632+AS632+AT632+AU632+AV632+AW632+AX632+AY632+AZ632+BA632+BB632+BC632)/12 -> 0.23172499999999999 | BF632: =(AK632+AL632+AM632+AN632+AO632+AP632+AQ632+AR632+AS632+AT632+AU632+AV632+AV632+AW632+AX632+AY632+AZ632+BA632+BB632+BC632)/19 -> 0.37901052631578941 | BG632: =(AV632+AW632)/2 -> 0.18855 | BH632: =(AW632+AX632)/2 -> 0.26624999999999999 | BI632: =(AX632+AY632)/2 -> 0.32069999999999999 | BJ632: =(AY632+AZ632)/2 -> 0.34165000000000001 | BK632: =(AZ632+BA632)/2 -> 0.34609999999999996 | BL632: =(BA632+BB632)/2 -> 0.34755000000000003 | BM632: =(BB632+BC632)/2 -> 0.29764999999999997 | BN632: =STDEV(AK632:BC632) -> 0.33616404429736768
B633: 601015.SH | C633: 陕西黑猫
B634: 603329.SH | C634: 上海雅仕 | J634: 0.18179999999999999 | K634: -0.28689999999999999 | L634: -0.19440000000000002 | M634: -0.30769999999999997 | N634: -0.56409999999999993 | O634: -0.53339999999999999 | P634: -0.55169999999999997 | Q634: -1.3611000000000002 | R634: -3.2058999999999997 | S634: 0.29909999999999998 | T634: 0.53849999999999998 | U634: 4.4615 | V634: 1.6533000000000002 | W634: 1.5946 | X634: 1.45 | Y634: 0.57779999999999998 | AA634: =(N634+O634+P634+Q634+R634+S634+T634+U634+V634+W634+X634+Y634)/12 -> 0.36321666666666674 | AB634: =(G634+H634+I634+J634+K634+L634+M634+N634+O634+P634+Q634+R634+S634+T634+U634+V634+W634+X634+Y634)/19 -> 0.19744210526315795 | AC634: =(R634+S634)/2 -> -1.4533999999999998 | AD634: =(S634+T634)/2 -> 0.41879999999999995 | AE634: =(T634+U634)/2 -> 2.5 | AF634: =(U634+V634)/2 -> 3.0574000000000003 | AG634: =(V634+W634)/2 -> 1.6239500000000002 | AH634: =(W634+X634)/2 -> 1.5223 | AI634: =(X634+Y634)/2 -> 1.0139 | AJ634: =STDEV(G634:Y634) -> 1.6411923380579134
B635: 603859.SH | C635: 能科科技
B636: 603931.SH | C636: 格林达
B637: 600549.SH | C637: 厦门钨业
B638: 600378.SH | C638: 昊华科技 | E638: 0.37619999999999998 | F638: 0.70799999999999996 | G638: 3.3332999999999999 | H638: 1 | I638: 0.80000000000000004 | J638: 3.3332999999999999 | K638: 7.7691999999999997 | L638: 2.6261999999999999 | M638: 3.4622000000000002 | N638: 0.62029999999999996 | O638: -2.1099999999999997e-02 | P638: 6.2699999999999992e-02 | Q638: -1.15e-02 | R638: 1.1699999999999999e-02 | S638: -2.2400000000000003e-02 | T638: 0.13140000000000002 | U638: 0.25540000000000002 | V638: 0.124 | W638: 0.60680000000000001 | X638: 0.2959 | Y638: 0.41950000000000004 | AA638: =(N638+O638+P638+Q638+R638+S638+T638+U638+V638+W638+X638+Y638)/12 -> 0.20605833333333334 | AB638: =(G638+H638+I638+J638+K638+L638+M638+N638+O638+P638+Q638+R638+S638+T638+U638+V638+W638+X638+Y638)/19 -> 1.3050999999999997 | AC638: =(R638+S638)/2 -> -5.3500000000000023e-03 | AD638: =(S638+T638)/2 -> 5.4500000000000007e-02 | AE638: =(T638+U638)/2 -> 0.19340000000000002 | AF638: =(U638+V638)/2 -> 0.18970000000000001 | AG638: =(V638+W638)/2 -> 0.3654 | AH638: =(W638+X638)/2 -> 0.45135000000000003 | AI638: =(X638+Y638)/2 -> 0.35770000000000002 | AJ638: =STDEV(G638:Y638) -> 1.9980977261719037
B639: 002831.SZ | C639: 裕同科技 | E639: 0.4617 | F639: 0.70199999999999996 | G639: 0.16589999999999999 | H639: 0.10460000000000001 | I639: -1.9e-03 | J639: -4.1299999999999996e-02 | K639: -0.14130000000000001 | L639: -0.60999999999999999 | M639: -0.59650000000000003 | N639: -0.53720000000000001 | O639: -0.49380000000000002 | P639: 0.1153 | Q639: 0.128 | R639: 0.1082 | S639: -7.5399999999999995e-02 | T639: 0.11109999999999999 | U639: 8.4100000000000008e-02 | V639: 7.6499999999999999e-02 | W639: 8.9600000000000013e-02 | X639: -5.2400000000000002e-02 | Y639: -6.9500000000000006e-02 | AA639: =(N639+O639+P639+Q639+R639+S639+T639+U639+V639+W639+X639+Y639)/12 -> -4.2958333333333355e-02 | AB639: =(G639+H639+I639+J639+K639+L639+M639+N639+O639+P639+Q639+R639+S639+T639+U639+V639+W639+X639+Y639)/19 -> -8.610526315789474e-02 | AC639: =(R639+S639)/2 -> 1.6400000000000005e-02 | AD639: =(S639+T639)/2 -> 1.7849999999999998e-02 | AE639: =(T639+U639)/2 -> 9.7599999999999992e-02 | AF639: =(U639+V639)/2 -> 8.030000000000001e-02 | AG639: =(V639+W639)/2 -> 8.3050000000000013e-02 | AH639: =(W639+X639)/2 -> 1.8600000000000005e-02 | AI639: =(X639+Y639)/2 -> -6.0950000000000004e-02 | AJ639: =STDEV(G639:Y639) -> 0.26536643527537584
B640: 000157.SZ | C640: 中联重科
B641: 002384.SZ | C641: 东山精密 | E641: 0.63019999999999998 | F641: 0.69999999999999996 | G641: 0.5 | H641: -0.21429999999999999 | I641: 0.64290000000000003 | J641: 1.1176000000000001 | K641: 2 | L641: 0.45450000000000002 | M641: 0.82609999999999995 | N641: 0.38890000000000002 | O641: 0.33329999999999999 | P641: 0.5625 | Q641: 0.23809999999999998 | R641: -0.12 | S641: 8.3299999999999999e-02 | T641: 0.28000000000000003 | U641: 7.690000000000001e-02 | V641: 1.1135999999999999 | W641: 7.690000000000001e-02 | X641: 9.3699999999999992e-02 | Y641: 0.25 | AA641: =(N641+O641+P641+Q641+R641+S641+T641+U641+V641+W641+X641+Y641)/12 -> 0.28143333333333337 | AB641: =(G641+H641+I641+J641+K641+L641+M641+N641+O641+P641+Q641+R641+S641+T641+U641+V641+W641+X641+Y641)/19 -> 0.45810526315789496 | AC641: =(R641+S641)/2 -> -1.8349999999999998e-02 | AD641: =(S641+T641)/2 -> 0.18165000000000001 | AE641: =(T641+U641)/2 -> 0.17845000000000003 | AF641: =(U641+V641)/2 -> 0.59524999999999995 | AG641: =(V641+W641)/2 -> 0.59524999999999995 | AH641: =(W641+X641)/2 -> 8.5300000000000001e-02 | AI641: =(X641+Y641)/2 -> 0.17185 | AJ641: =STDEV(G641:Y641) -> 0.52272356352057558
B642: 002677.SZ | C642: 浙江美大
B643: 601918.SH | C643: 新集能源
B644: 603165.SH | C644: 荣晟环保 | E644: 0.23960000000000001 | F644: 0.68100000000000005 | G644: 1.7666999999999999 | H644: 0.96360000000000001 | I644: 1.1447000000000001 | J644: 0.70369999999999999 | K644: -0.59040000000000004 | L644: -0.37040000000000001 | M644: -0.52149999999999996 | N644: -0.49130000000000001 | O644: 0.14710000000000001 | P644: -0.26469999999999999 | Q644: -3.85e-02 | R644: -0.14529999999999998 | S644: -0.25640000000000002 | T644: -8.0000000000000002e-02 | U644: -8.0000000000000002e-02 | V644: -7.0000000000000007e-02 | W644: 0 | X644: 0.19570000000000001 | Y644: 1.4499999999999999e-02 | AA644: =(N644+O644+P644+Q644+R644+S644+T644+U644+V644+W644+X644+Y644)/12 -> -8.9075000000000015e-02 | AB644: =(G644+H644+I644+J644+K644+L644+M644+N644+O644+P644+Q644+R644+S644+T644+U644+V644+W644+X644+Y644)/19 -> 0.10671052631578946 | AC644: =(R644+S644)/2 -> -0.20085 | AD644: =(S644+T644)/2 -> -0.16820000000000002 | AE644: =(T644+U644)/2 -> -8.0000000000000002e-02 | AF644: =(U644+V644)/2 -> -7.5000000000000011e-02 | AG644: =(V644+W644)/2 -> -3.5000000000000003e-02 | AH644: =(W644+X644)/2 -> 9.7850000000000006e-02 | AI644: =(X644+Y644)/2 -> 0.1051 | AJ644: =STDEV(G644:Y644) -> 0.61798439560912399
B645: 603387.SH | C645: 基蛋生物
B646: 603823.SH | C646: 百合花
B647: 605339.SH | C647: 南侨食品 | V647: 8.43e-02 | W647: 1.25 | X647: 0.57579999999999998 | Y647: 0.2281 | AA647: =(N647+O647+P647+Q647+R647+S647+T647+U647+V647+W647+X647+Y647)/12 -> 0.17818333333333333 | AB647: =(G647+H647+I647+J647+K647+L647+M647+N647+O647+P647+Q647+R647+S647+T647+U647+V647+W647+X647+Y647)/19 -> 0.11253684210526316 | AC647: =(R647+S647)/2 -> 0 | AD647: =(S647+T647)/2 -> 0 | AE647: =(T647+U647)/2 -> 0 | AF647: =(U647+V647)/2 -> 4.215e-02 | AG647: =(V647+W647)/2 -> 0.66715000000000002 | AH647: =(W647+X647)/2 -> 0.91290000000000004 | AI647: =(X647+Y647)/2 -> 0.40194999999999997 | AJ647: =STDEV(G647:Y647) -> 0.51968161086059861
B648: 600475.SH | C648: 华光环能
B649: 601928.SH | C649: 凤凰传媒 | E649: 7.980000000000001e-02 | F649: 4.0800000000000001 | G649: 0.1714 | H649: 4.9200000000000001e-02 | I649: 2.63e-02 | J649: -3.4999999999999996e-03 | K649: -8.8000000000000009e-02 | L649: -5.8999999999999999e-03 | M649: 0.26379999999999998 | N649: 0.13639999999999999 | O649: 0.20920000000000002 | P649: 0.1411 | Q649: 3.1400000000000004e-02 | R649: 1.4199999999999999e-02 | S649: -0.188 | T649: -5.91e-02 | U649: -4.4500000000000005e-02 | V649: 0.18729999999999999 | W649: 1.6566000000000001 | X649: 0.69409999999999994 | Y649: 0.63369999999999993 | AA649: =(N649+O649+P649+Q649+R649+S649+T649+U649+V649+W649+X649+Y649)/12 -> 0.28436666666666666 | AB649: =(G649+H649+I649+J649+K649+L649+M649+N649+O649+P649+Q649+R649+S649+T649+U649+V649+W649+X649+Y649)/19 -> 0.20135263157894739 | AC649: =(R649+S649)/2 -> -8.6900000000000005e-02 | AD649: =(S649+T649)/2 -> -0.12354999999999999 | AE649: =(T649+U649)/2 -> -5.1799999999999999e-02 | AF649: =(U649+V649)/2 -> 7.1399999999999991e-02 | AG649: =(V649+W649)/2 -> 0.92195000000000005 | AH649: =(W649+X649)/2 -> 1.1753499999999999 | AI649: =(X649+Y649)/2 -> 0.66389999999999993 | AJ649: =STDEV(G649:Y649) -> 0.41677304291214134
B650: 002240.SZ | C650: 盛新锂能 | G650: 1.0508 | H650: 1.1223000000000001 | I650: 1.3184 | J650: 0 | K650: 1.1389 | L650: 5.7547000000000006 | M650: 5.1962999999999999 | N650: 3 | O650: 3.5713999999999997 | P650: 2.1400000000000002e-02 | Q650: -0.38179999999999997 | R650: -1.55 | S650: -3.5568 | T650: -3.1877999999999997 | U650: -0.51039999999999996 | V650: 1.3636000000000001 | W650: 2.5556000000000001 | X650: 2.625 | Y650: 8.8543000000000003 | AA650: =(N650+O650+P650+Q650+R650+S650+T650+U650+V650+W650+X650+Y650)/12 -> 1.0670416666666667 | AB650: =(G650+H650+I650+J650+K650+L650+M650+N650+O650+P650+Q650+R650+S650+T650+U650+V650+W650+X650+Y650)/19 -> 1.4939947368421056 | AC650: =(R650+S650)/2 -> -2.5533999999999999 | AD650: =(S650+T650)/2 -> -3.3723000000000001 | AE650: =(T650+U650)/2 -> -1.8491 | AF650: =(U650+V650)/2 -> 0.42660000000000009 | AG650: =(V650+W650)/2 -> 1.9596 | AH650: =(W650+X650)/2 -> 2.5903 | AI650: =(X650+Y650)/2 -> 5.7396500000000001 | AJ650: =STDEV(G650:Y650) -> 3.0199844599441392 | BA650: -0.11869999999999999 | BB650: -0.1069 | BC650: -0.16
B651: 605258.SH | C651: 协和电子
B652: 001979.SZ | C652: 招商蛇口 | E652: 0.34050000000000002 | F652: 0.69 | G652: 1.7 | H652: -4.1700000000000001e-02 | I652: -0.30990000000000001 | J652: 0.32229999999999998 | K652: 1.7037 | L652: 0.91300000000000003 | M652: 1.0815999999999999 | N652: 0.1812 | O652: -0.56159999999999999 | P652: -0.31819999999999998 | Q652: -0.4118 | R652: 5.2900000000000003e-02 | S652: -0.90629999999999999 | T652: -0.91669999999999996 | U652: -0.68330000000000002 | V652: -0.26629999999999998 | W652: 0.66669999999999996 | X652: 8.4000000000000004 | Y652: 2.6316000000000002 | AA652: =(N652+O652+P652+Q652+R652+S652+T652+U652+V652+W652+X652+Y652)/12 -> 0.65568333333333351 | AB652: =(G652+H652+I652+J652+K652+L652+M652+N652+O652+P652+Q652+R652+S652+T652+U652+V652+W652+X652+Y652)/19 -> 0.69669473684210526 | AC652: =(R652+S652)/2 -> -0.42669999999999997 | AD652: =(S652+T652)/2 -> -0.91149999999999998 | AE652: =(T652+U652)/2 -> -0.80000000000000004 | AF652: =(U652+V652)/2 -> -0.4748 | AG652: =(V652+W652)/2 -> 0.20019999999999999 | AH652: =(W652+X652)/2 -> 4.5333500000000004 | AI652: =(X652+Y652)/2 -> 5.5158000000000005 | AJ652: =STDEV(G652:Y652) -> 2.101938065604557 | AK652: 6.9699999999999998e-02 | AL652: 0.1507 | AM652: 0.2089 | AN652: 0.27760000000000001 | AO652: 3.5799999999999998e-02 | AP652: 0.14510000000000001 | AQ652: 0.18420000000000003 | AR652: 0.24390000000000001 | AS652: 3.6799999999999999e-02 | AT652: 0.27860000000000001 | AU652: 0.25650000000000001 | AV652: 0.2432 | AW652: 0.35220000000000001 | AX652: 0.29449999999999998 | AY652: 0.38979999999999998 | AZ652: 0.40999999999999998 | BA652: 0.73350000000000004 | BB652: 0.40010000000000001 | BC652: 0.1638 | BE652: =(AR652+AS652+AT652+AU652+AV652+AW652+AX652+AY652+AZ652+BA652+BB652+BC652)/12 -> 0.3169083333333334 | BF652: =(AK652+AL652+AM652+AN652+AO652+AP652+AQ652+AR652+AS652+AT652+AU652+AV652+AV652+AW652+AX652+AY652+AZ652+BA652+BB652+BC652)/19 -> 0.26937368421052632 | BG652: =(AV652+AW652)/2 -> 0.29770000000000002 | BH652: =(AW652+AX652)/2 -> 0.32335000000000003 | BI652: =(AX652+AY652)/2 -> 0.34214999999999995 | BJ652: =(AY652+AZ652)/2 -> 0.39989999999999998 | BK652: =(AZ652+BA652)/2 -> 0.57174999999999998 | BL652: =(BA652+BB652)/2 -> 0.56679999999999997 | BM652: =(BB652+BC652)/2 -> 0.28195000000000003 | BN652: =STDEV(AK652:BC652) -> 0.16208939865979743 | BO652: 42368 | BS652: 79.230000000000004 | BT652: 79.219999999999999 | CB652: 123 | CC652: 先减少后增加(由273家减少到93家，再增加到123家) | CD652: 持续减少（由82.85%减少到81.85%，再减少到4.82%） | CI652: 63.509999999999998 | CJ652: =CI652/BS652 -> 0.80159030670200671 | CK652: 适量进入(利润增长依然强劲，但销售额持续下滑跌破进入标准，持有机构数量增加，但机构持有份额减少，表明公司业绩有下滑的风险，不宜长期持有) | CL652: 44601
B653: 002532.SZ | C653: 天山铝业
B654: 002737.SZ | C654: 葵花药业
B655: 002824.SZ | C655: 和胜股份 | E655: 0.42340000000000005 | F655: 0.68200000000000005 | G655: -0.35289999999999999 | H655: -0.3095 | I655: -0.54239999999999999 | J655: -0.3342 | K655: -0.63639999999999997 | L655: -0.6552 | M655: -0.48149999999999998 | N655: -0.72970000000000002 | O655: -1.5 | P655: -0.69999999999999996 | Q655: -0.64290000000000003 | R655: -0.40000000000000002 | S655: 0.5 | T655: 0.66670000000000007 | U655: 2 | V655: 5.8333000000000004 | W655: 21 | X655: 7.2000000000000002 | Y655: 3.6000000000000001 | AA655: =(N655+O655+P655+Q655+R655+S655+T655+U655+V655+W655+X655+Y655)/12 -> 3.0689500000000005 | AB655: =(G655+H655+I655+J655+K655+L655+M655+N655+O655+P655+Q655+R655+S655+T655+U655+V655+W655+X655+Y655)/19 -> 1.7639631578947366 | AC655: =(R655+S655)/2 -> 4.9999999999999989e-02 | AD655: =(S655+T655)/2 -> 0.58335000000000004 | AE655: =(T655+U655)/2 -> 1.33335 | AF655: =(U655+V655)/2 -> 3.9166500000000002 | AG655: =(V655+W655)/2 -> 13.416650000000001 | AH655: =(W655+X655)/2 -> 14.1 | AI655: =(X655+Y655)/2 -> 5.4000000000000004 | AJ655: =STDEV(G655:Y655) -> 5.2224954452626839
B656: 600079.SH | C656: 人福医药
B657: 600761.SH | C657: 安徽合力 | E657: 0.43450000000000005 | F657: 0.68999999999999995 | G657: -7.0999999999999994e-02 | H657: -3.2300000000000002e-02 | I657: 0.14630000000000001 | J657: 9.4299999999999995e-02 | K657: 0.3543 | L657: 0.59999999999999998 | M657: 0.34039999999999998 | N657: 0.36210000000000003 | O657: 9.0000000000000011e-03 | P657: -2.0799999999999999e-02 | Q657: 3.1699999999999999e-02 | R657: 0.1139 | S657: -0.47670000000000001 | T657: 0.1489 | U657: 0.23079999999999998 | V657: 0.125 | W657: 1.4116 | X657: -5.5599999999999997e-02 | Y657: -0.13750000000000001 | AA657: =(N657+O657+P657+Q657+R657+S657+T657+U657+V657+W657+X657+Y657)/12 -> 0.1452 | AB657: =(G657+H657+I657+J657+K657+L657+M657+N657+O657+P657+Q657+R657+S657+T657+U657+V657+W657+X657+Y657)/19 -> 0.16707368421052629 | AC657: =(R657+S657)/2 -> -0.18140000000000001 | AD657: =(S657+T657)/2 -> -0.16389999999999999 | AE657: =(T657+U657)/2 -> 0.18984999999999999 | AF657: =(U657+V657)/2 -> 0.1779 | AG657: =(V657+W657)/2 -> 0.76829999999999998 | AH657: =(W657+X657)/2 -> 0.67799999999999994 | AI657: =(X657+Y657)/2 -> -9.6549999999999997e-02
B658: 601006.SH | C658: 大秦铁路
B659: 601398.SH | C659: 工商银行
B660: 601689.SH | C660: 拓普集团 | E660: 0.3674 | F660: 0.68999999999999995 | G660: 0.42109999999999997 | H660: 0.41460000000000002 | I660: 0.2462 | J660: 0.1158 | K660: 0 | L660: -0.29309999999999997 | M660: -0.28399999999999997 | N660: -0.33020000000000005 | O660: -0.40740000000000004 | P660: -0.51219999999999999 | Q660: -0.44829999999999998 | R660: -0.39439999999999997 | S660: -0.3125 | T660: 0 | U660: 0.15620000000000001 | V660: 0.39529999999999998 | W660: 1 | X660: 1.1000000000000001 | Y660: 0.8649 | AA660: =(N660+O660+P660+Q660+R660+S660+T660+U660+V660+W660+X660+Y660)/12 -> 9.2616666666666694e-02 | AB660: =(G660+H660+I660+J660+K660+L660+M660+N660+O660+P660+Q660+R660+S660+T660+U660+V660+W660+X660+Y660)/19 -> 9.1157894736842132e-02 | AC660: =(R660+S660)/2 -> -0.35344999999999999 | AD660: =(S660+T660)/2 -> -0.15625 | AE660: =(T660+U660)/2 -> 7.8100000000000003e-02 | AF660: =(U660+V660)/2 -> 0.27575 | AG660: =(V660+W660)/2 -> 0.69764999999999999 | AH660: =(W660+X660)/2 -> 1.05 | AI660: =(X660+Y660)/2 -> 0.98245000000000005 | AJ660: =STDEV(G660:Y660) -> 0.50344200075942713
B661: 601881.SH | C661: 中国银河
B662: 603076.SH | C662: 乐惠国际 | I662: 0 | J662: -0.16789999999999999 | K662: 9.0899999999999995e-02 | L662: -0.16670000000000001 | M662: -0.21050000000000002 | N662: -0.54390000000000005 | O662: 0.16670000000000001 | P662: -0.1273 | Q662: -9.3299999999999994e-02 | R662: -1.6346000000000001 | S662: 0.57140000000000002 | T662: 0.5625 | U662: 0.52939999999999998 | V662: 5.3029999999999999 | W662: -2.2700000000000001e-02 | X662: -0.17329999999999998 | Y662: -0.33649999999999997 | AA662: =(N662+O662+P662+Q662+R662+S662+T662+U662+V662+W662+X662+Y662)/12 -> 0.35011666666666663 | AB662: =(G662+H662+I662+J662+K662+L662+M662+N662+O662+P662+Q662+R662+S662+T662+U662+V662+W662+X662+Y662)/19 -> 0.19722105263157891 | AC662: =(R662+S662)/2 -> -0.53160000000000007 | AD662: =(S662+T662)/2 -> 0.56695000000000007 | AE662: =(T662+U662)/2 -> 0.54594999999999994 | AF662: =(U662+V662)/2 -> 2.9161999999999999 | AG662: =(V662+W662)/2 -> 2.6401499999999998 | AH662: =(W662+X662)/2 -> -9.799999999999999e-02 | AI662: =(X662+Y662)/2 -> -0.25489999999999996 | AJ662: =STDEV(G662:Y662) -> 1.402938495413026
B663: 603213.SH | C663: 镇洋发展 | E663: 0.32530000000000003 | F663: 0.58699999999999997 | Y663: 3.0587999999999997 | AA663: =(N663+O663+P663+Q663+R663+S663+T663+U663+V663+W663+X663+Y663)/12 -> 0.25489999999999996 | AB663: =(G663+H663+I663+J663+K663+L663+M663+N663+O663+P663+Q663+R663+S663+T663+U663+V663+W663+X663+Y663)/19 -> 0.16098947368421052 | AC663: =(R663+S663)/2 -> 0 | AD663: =(S663+T663)/2 -> 0 | AE663: =(T663+U663)/2 -> 0 | AF663: =(U663+V663)/2 -> 0 | AG663: =(V663+W663)/2 -> 0 | AH663: =(W663+X663)/2 -> 0 | AI663: =(X663+Y663)/2 -> 1.5293999999999999 | AJ663: =STDEV(G663:Y663) -> #DIV/0!
B664: 603357.SH | C664: 设计总院 | E664: 0.32789999999999997 | F664: 0.68999999999999995 | G664: 0.2727 | H664: 2.0799999999999999e-02 | I664: 0 | J664: 0.29999999999999999 | K664: 0.25 | L664: 0.10199999999999999 | M664: 0.1515 | N664: -7.690000000000001e-02 | O664: -0.2571 | P664: -0.11109999999999999 | Q664: -0.18420000000000003 | R664: -0.26039999999999996 | S664: -0.1923 | T664: -8.3299999999999999e-02 | U664: 1.61e-02 | V664: 0.1268 | W664: 4.7599999999999996e-02 | X664: 6.8199999999999997e-02 | Y664: 9.5199999999999993e-02 | AA664: =(N664+O664+P664+Q664+R664+S664+T664+U664+V664+W664+X664+Y664)/12 -> -6.7616666666666644e-02 | AB664: =(G664+H664+I664+J664+K664+L664+M664+N664+O664+P664+Q664+R664+S664+T664+U664+V664+W664+X664+Y664)/19 -> 1.5031578947368422e-02 | AC664: =(R664+S664)/2 -> -0.22635 | AD664: =(S664+T664)/2 -> -0.13780000000000001 | AE664: =(T664+U664)/2 -> -3.3599999999999998e-02 | AF664: =(U664+V664)/2 -> 7.145e-02 | AG664: =(V664+W664)/2 -> 8.72e-02 | AH664: =(W664+X664)/2 -> 5.7899999999999993e-02 | AI664: =(X664+Y664)/2 -> 8.1699999999999995e-02 | AJ664: =STDEV(G664:Y664) -> 0.16975339320002997 | BA664: 0.39340000000000003 | BB664: 0.33750000000000002 | BC664: 0.10970000000000001
B665: 603511.SH | C665: 爱慕股份 | V665: 0.3226 | W665: 0.63639999999999997 | X665: 0.55559999999999998 | Y665: -0.18820000000000001 | AA665: =(N665+O665+P665+Q665+R665+S665+T665+U665+V665+W665+X665+Y665)/12 -> 0.11053333333333333 | AB665: =(G665+H665+I665+J665+K665+L665+M665+N665+O665+P665+Q665+R665+S665+T665+U665+V665+W665+X665+Y665)/19 -> 6.9810526315789476e-02 | AC665: =(R665+S665)/2 -> 0 | AD665: =(S665+T665)/2 -> 0 | AE665: =(T665+U665)/2 -> 0 | AF665: =(U665+V665)/2 -> 0.1613 | AG665: =(V665+W665)/2 -> 0.47949999999999998 | AH665: =(W665+X665)/2 -> 0.59599999999999997 | AI665: =(X665+Y665)/2 -> 0.18369999999999997 | AJ665: =STDEV(G665:Y665) -> 0.37119270826171502
B666: 603707.SH | C666: 健友股份 | E666: 0.46539999999999998 | F666: 0.67900000000000005 | G666: 0.4839 | H666: -0.49340000000000006 | I666: -0.19190000000000002 | J666: -0.14369999999999999 | K666: 0.84319999999999995 | L666: 0.20269999999999999 | M666: 1.3500000000000002e-02 | N666: -3.5799999999999998e-02 | O666: -4.9800000000000004e-02 | P666: 0.2626 | Q666: 2.98e-02 | R666: 0.1017 | S666: 4.7599999999999996e-02 | T666: 0.10000000000000001 | U666: 6.25e-02 | V666: 0.3231 | W666: 0.31819999999999998 | X666: 0.34090000000000004 | Y666: 0.35289999999999999 | AA666: =(N666+O666+P666+Q666+R666+S666+T666+U666+V666+W666+X666+Y666)/12 -> 0.154475 | AB666: =(G666+H666+I666+J666+K666+L666+M666+N666+O666+P666+Q666+R666+S666+T666+U666+V666+W666+X666+Y666)/19 -> 0.13515789473684212 | AC666: =(R666+S666)/2 -> 7.4649999999999994e-02 | AD666: =(S666+T666)/2 -> 7.3800000000000004e-02 | AE666: =(T666+U666)/2 -> 8.1250000000000003e-02 | AF666: =(U666+V666)/2 -> 0.1928 | AG666: =(V666+W666)/2 -> 0.32064999999999999 | AH666: =(W666+X666)/2 -> 0.32955000000000001 | AI666: =(X666+Y666)/2 -> 0.34689999999999999 | AJ666: =STDEV(G666:Y666) -> 0.28739904762037644 | AL666: 0.26469999999999999 | AM666: 0.45710000000000001 | AN666: 0.75170000000000003 | AO666: 1.1115000000000002 | AP666: 1.4040999999999999 | AQ666: 1.0956999999999999 | AR666: 0.6351 | AS666: 0.29999999999999999 | AT666: 0.19320000000000001 | AU666: 0.18030000000000002 | AV666: 0.44750000000000001 | AW666: 0.53029999999999999 | AX666: 0.29249999999999998 | AY666: 0.222 | AZ666: 0.1535 | BA666: 0.17579999999999998 | BB666: 0.25209999999999999 | BC666: 0.22339999999999999 | BE666: =(AR666+AS666+AT666+AU666+AV666+AW666+AX666+AY666+AZ666+BA666+BB666+BC666)/12 -> 0.30047500000000005 | BF666: =(AK666+AL666+AM666+AN666+AO666+AP666+AQ666+AR666+AS666+AT666+AU666+AV666+AV666+AW666+AX666+AY666+AZ666+BA666+BB666+BC666)/19 -> 0.48094736842105251 | BG666: =(AV666+AW666)/2 -> 0.4889 | BH666: =(AW666+AX666)/2 -> 0.41139999999999999 | BI666: =(AX666+AY666)/2 -> 0.25724999999999998 | BJ666: =(AY666+AZ666)/2 -> 0.18775 | BK666: =(AZ666+BA666)/2 -> 0.16464999999999999 | BL666: =(BA666+BB666)/2 -> 0.21394999999999997 | BM666: =(BB666+BC666)/2 -> 0.23774999999999999 | BN666: =STDEV(AK666:BC666) -> 0.3759815428389478
B667: 603757.SH | C667: 大元泵业
B668: 002202.SZ | C668: 金风科技
B669: 000717.SZ | C669: 韶钢松山
B670: 000792.SZ | C670: 盐湖股份 | G670: -2.8411 | H670: -2.0575000000000001 | I670: -3.2012999999999998 | J670: -13.186900000000001 | K670: 0.31090000000000001 | L670: -1.2570999999999999 | M670: -0.41210000000000002 | N670: 0.17129999999999998 | O670: 3.1600000000000003e-02 | P670: 0.64060000000000006 | Q670: 0.58479999999999999 | R670: -12.3056 | S670: 2.5058000000000002 | T670: 3.2117 | U670: 3.8506999999999998 | V670: 1.0297000000000001 | W670: 1.9599999999999999e-02 | X670: 0.14980000000000002 | Y670: 0.32689999999999997 | AA670: =(N670+O670+P670+Q670+R670+S670+T670+U670+V670+W670+X670+Y670)/12 -> 1.8075000000000084e-02 | AB670: =(G670+H670+I670+J670+K670+L670+M670+N670+O670+P670+Q670+R670+S670+T670+U670+V670+W670+X670+Y670)/19 -> -1.1804315789473683 | AC670: =(R670+S670)/2 -> -4.8998999999999997 | AD670: =(S670+T670)/2 -> 2.8587500000000001 | AE670: =(T670+U670)/2 -> 3.5312000000000001 | AF670: =(U670+V670)/2 -> 2.4401999999999999 | AG670: =(V670+W670)/2 -> 0.52465000000000006 | AH670: =(W670+X670)/2 -> 8.4700000000000011e-02 | AI670: =(X670+Y670)/2 -> 0.23835000000000001 | AJ670: =STDEV(G670:Y670) -> 4.451229809970453
B671: 002158.SZ | C671: 汉钟精机 | G671: 0.16739999999999999 | H671: 0.27489999999999998 | I671: 0.37159999999999999 | J671: 9.6300000000000011e-02 | K671: 3.4000000000000002e-02 | L671: 1.44e-02 | M671: -9.7799999999999998e-02 | N671: -0.107 | O671: -7.6600000000000001e-02 | P671: -9.5399999999999985e-02 | Q671: 6.4199999999999993e-02 | R671: 0.21149999999999999 | S671: 7.9100000000000004e-02 | T671: 0.22989999999999999 | U671: 0.41409999999999997 | V671: 0.46789999999999998 | W671: 1.5458000000000001 | X671: 0.69269999999999998 | Y671: 0.50629999999999997 | AA671: =(N671+O671+P671+Q671+R671+S671+T671+U671+V671+W671+X671+Y671)/12 -> 0.32770833333333332 | AB671: =(G671+H671+I671+J671+K671+L671+M671+N671+O671+P671+Q671+R671+S671+T671+U671+V671+W671+X671+Y671)/19 -> 0.25227894736842105 | AC671: =(R671+S671)/2 -> 0.14529999999999998 | AD671: =(S671+T671)/2 -> 0.1545 | AE671: =(T671+U671)/2 -> 0.32199999999999995 | AF671: =(U671+V671)/2 -> 0.44099999999999995 | AG671: =(V671+W671)/2 -> 1.00685 | AH671: =(W671+X671)/2 -> 1.1192500000000001 | AI671: =(X671+Y671)/2 -> 0.59949999999999992 | AJ671: =STDEV(G671:Y671) -> 0.38752023686074538
B672: 605169.SH | C672: 洪通燃气 | U672: -0.24969999999999998 | V672: -0.26729999999999998 | W672: 1.5636000000000001 | X672: -0.22339999999999999 | Y672: -4.3799999999999999e-02 | AA672: =(N672+O672+P672+Q672+R672+S672+T672+U672+V672+W672+X672+Y672)/12 -> 6.4950000000000022e-02 | AB672: =(G672+H672+I672+J672+K672+L672+M672+N672+O672+P672+Q672+R672+S672+T672+U672+V672+W672+X672+Y672)/19 -> 4.1021052631578958e-02 | AC672: =(R672+S672)/2 -> 0 | AD672: =(S672+T672)/2 -> 0 | AE672: =(T672+U672)/2 -> -0.12484999999999999 | AF672: =(U672+V672)/2 -> -0.25849999999999995 | AG672: =(V672+W672)/2 -> 0.64815 | AH672: =(W672+X672)/2 -> 0.67010000000000003 | AI672: =(X672+Y672)/2 -> -0.1336 | AJ672: =STDEV(G672:Y672) -> 0.79198760533230572
B673: 000921.SZ | C673: 海信家电
B674: 002281.SZ | C674: 光迅科技
B675: 600461.SH | C675: 洪城环境 | E675: 0.64400000000000002 | F675: 0.66900000000000004 | G675: 0 | H675: -0.52939999999999998 | I675: -0.10339999999999999 | J675: 0.16670000000000001 | K675: 0.71430000000000005 | L675: 0.3125 | M675: 0.15380000000000002 | N675: 0.2286 | O675: 0.41670000000000001 | P675: 0.47619999999999996 | Q675: 0.4667 | R675: 0.41859999999999997 | S675: 0 | T675: 9.6799999999999997e-02 | U675: 0.25 | V675: 0.14749999999999999 | W675: 0.35289999999999999 | X675: 0.26469999999999999 | Y675: 0.2364 | AA675: =(N675+O675+P675+Q675+R675+S675+T675+U675+V675+W675+X675+Y675)/12 -> 0.27959166666666668 | AB675: =(G675+H675+I675+J675+K675+L675+M675+N675+O675+P675+Q675+R675+S675+T675+U675+V675+W675+X675+Y675)/19 -> 0.21418947368421054 | AC675: =(R675+S675)/2 -> 0.20929999999999999 | AD675: =(S675+T675)/2 -> 4.8399999999999999e-02 | AE675: =(T675+U675)/2 -> 0.1734 | AF675: =(U675+V675)/2 -> 0.19874999999999998 | AG675: =(V675+W675)/2 -> 0.25019999999999998 | AH675: =(W675+X675)/2 -> 0.30879999999999996 | AI675: =(X675+Y675)/2 -> 0.25054999999999999 | AJ675: =STDEV(G675:Y675) -> 0.26545857574882842
B676: 601788.SH | C676: 光大证券
B677: 601966.SH | C677: 玲珑轮胎 | G677: -0.22219999999999998 | H677: -0.35710000000000003 | I677: -0.17809999999999998 | J677: -5.4299999999999994e-02 | K677: -9.5199999999999993e-02 | L677: 0.22219999999999998 | M677: 0.23329999999999998 | N677: 0.12640000000000001 | O677: 0.26319999999999999 | P677: 0.36359999999999998 | Q677: 0.37840000000000001 | R677: 0.43880000000000002 | S677: 0.29170000000000001 | T677: 0.26669999999999999 | U677: 0.31370000000000003 | V677: 0.2908 | W677: 0.19350000000000001 | X677: -0.25 | Y677: -0.49249999999999999 | AA677: =(N677+O677+P677+Q677+R677+S677+T677+U677+V677+W677+X677+Y677)/12 -> 0.18202499999999999 | AB677: =(G677+H677+I677+J677+K677+L677+M677+N677+O677+P677+Q677+R677+S677+T677+U677+V677+W677+X677+Y677)/19 -> 9.1205263157894761e-02 | AC677: =(R677+S677)/2 -> 0.36525000000000002 | AD677: =(S677+T677)/2 -> 0.2792 | AE677: =(T677+U677)/2 -> 0.29020000000000001 | AF677: =(U677+V677)/2 -> 0.30225000000000002 | AG677: =(V677+W677)/2 -> 0.24215 | AH677: =(W677+X677)/2 -> -2.8249999999999997e-02 | AI677: =(X677+Y677)/2 -> -0.37124999999999997 | AJ677: =STDEV(G677:Y677) -> 0.27901147820611294
B678: 603786.SH | C678: 科博达 | Q678: -1.11e-02 | R678: -3.5200000000000002e-02 | S678: 0.11070000000000001 | T678: -0.10890000000000001 | U678: -0.1011 | V678: -6.6e-03 | W678: 0.26229999999999998 | X678: 0.1047 | Y678: -0.14999999999999999 | AA678: =(N678+O678+P678+Q678+R678+S678+T678+U678+V678+W678+X678+Y678)/12 -> 5.3999999999999994e-03 | AB678: =(G678+H678+I678+J678+K678+L678+M678+N678+O678+P678+Q678+R678+S678+T678+U678+V678+W678+X678+Y678)/19 -> 3.4105263157894737e-03 | AC678: =(R678+S678)/2 -> 3.7750000000000006e-02 | AD678: =(S678+T678)/2 -> 8.9999999999999802e-04 | AE678: =(T678+U678)/2 -> -0.10500000000000001 | AF678: =(U678+V678)/2 -> -5.3849999999999995e-02 | AG678: =(V678+W678)/2 -> 0.12784999999999999 | AH678: =(W678+X678)/2 -> 0.1835 | AI678: =(X678+Y678)/2 -> -2.2649999999999997e-02 | AJ678: =STDEV(G678:Y678) -> 0.13111900129271883
B679: 605376.SH | C679: 博迁新材 | T679: 0.1613 | U679: 0.15689999999999998 | V679: 0.19120000000000001 | W679: 0.33329999999999999 | X679: 0.19440000000000002 | Y679: 0.1525 | AA679: =(N679+O679+P679+Q679+R679+S679+T679+U679+V679+W679+X679+Y679)/12 -> 9.9133333333333351e-02 | AB679: =(G679+H679+I679+J679+K679+L679+M679+N679+O679+P679+Q679+R679+S679+T679+U679+V679+W679+X679+Y679)/19 -> 6.2610526315789491e-02 | AC679: =(R679+S679)/2 -> 0 | AD679: =(S679+T679)/2 -> 8.0649999999999999e-02 | AE679: =(T679+U679)/2 -> 0.15909999999999999 | AF679: =(U679+V679)/2 -> 0.17404999999999998 | AG679: =(V679+W679)/2 -> 0.26224999999999998 | AH679: =(W679+X679)/2 -> 0.26385000000000003 | AI679: =(X679+Y679)/2 -> 0.17344999999999999 | AJ679: =STDEV(G679:Y679) -> 6.8514543468278816e-02
B680: 000062.SZ | C680: 深圳华强
B681: 600971.SH | C681: 恒源煤电
B682: 600338.SH | C682: 西藏珠峰 | G682: 1.4737 | H682: 1.1618000000000002 | I682: 0.82609999999999995 | J682: 0.71260000000000001 | K682: -0.27660000000000001 | L682: -0.3357 | M682: -0.33329999999999999 | N682: -0.42229999999999995 | O682: -0.58820000000000006 | P682: -0.34450000000000003 | Q682: -0.32140000000000002 | R682: -0.33360000000000001 | S682: -0.1386 | T682: -0.65469999999999995 | U682: -0.85959999999999992 | V682: -0.95430000000000004 | W682: 0.8506999999999999 | X682: 2.4809000000000001 | Y682: 7.4638 | AA682: =(N682+O682+P682+Q682+R682+S682+T682+U682+V682+W682+X682+Y682)/12 -> 0.51484999999999992 | AB682: =(G682+H682+I682+J682+K682+L682+M682+N682+O682+P682+Q682+R682+S682+T682+U682+V682+W682+X682+Y682)/19 -> 0.49509473684210531 | AC682: =(R682+S682)/2 -> -0.2361 | AD682: =(S682+T682)/2 -> -0.39664999999999995 | AE682: =(T682+U682)/2 -> -0.75714999999999999 | AF682: =(U682+V682)/2 -> -0.90694999999999992 | AG682: =(V682+W682)/2 -> -5.1800000000000068e-02 | AH682: =(W682+X682)/2 -> 1.6657999999999999 | AI682: =(X682+Y682)/2 -> 4.9723500000000005 | AJ682: =STDEV(G682:Y682) -> 1.9133556446067568 | AK682: 0.58160000000000001 | AL682: -0.16109999999999999 | AM682: -2.7000000000000003e-02 | AN682: -0.13140000000000002 | AO682: -0.21600000000000003 | AP682: -0.22500000000000001 | AQ682: -0.20730000000000001 | AR682: -9.01e-02 | AS682: 0.30159999999999998 | AT682: 0.12429999999999999 | AU682: -0.29930000000000001 | AV682: -0.3987 | AW682: -0.48109999999999997 | AX682: 0.1057 | AY682: 0.57229999999999992 | AZ682: 0.76939999999999997 | BA682: 0.1057 | BB682: 0.57229999999999992 | BC682: 0.76939999999999997 | BE682: =(AR682+AS682+AT682+AU682+AV682+AW682+AX682+AY682+AZ682+BA682+BB682+BC682)/12 -> 0.17095833333333332 | BF682: =(AK682+AL682+AM682+AN682+AO682+AP682+AQ682+AR682+AS682+AT682+AU682+AV682+AV682+AW682+AX682+AY682+AZ682+BA682+BB682+BC682)/19 -> 6.6663157894736813e-02 | BG682: =(AV682+AW682)/2 -> -0.43989999999999996 | BH682: =(AW682+AX682)/2 -> -0.18769999999999998 | BI682: =(AX682+AY682)/2 -> 0.33899999999999997 | BJ682: =(AY682+AZ682)/2 -> 0.67084999999999995 | BK682: =(AZ682+BA682)/2 -> 0.43754999999999999 | BL682: =(BA682+BB682)/2 -> 0.33899999999999997 | BM682: =(BB682+BC682)/2 -> 0.67084999999999995 | BN682: =STDEV(AK682:BC682) -> 0.39667959274236131
B683: 000100.SZ | C683: TCL科技 | G683: 0.72299999999999998 | H683: 0.7056 | I683: 0.23989999999999997 | J683: 0.66010000000000002 | K683: 0.47139999999999999 | L683: 0.38650000000000001 | M683: 0.17999999999999999 | N683: 0.17809999999999998 | O683: 7.0400000000000004e-02 | P683: 0.33759999999999996 | Q683: 5.6500000000000002e-02 | R683: -0.22600000000000001 | S683: -0.45329999999999998 | T683: -0.40600000000000003 | U683: -0.1968 | V683: 0.69489999999999996 | W683: 4.6360999999999999 | X683: 4.3926999999999996 | Y683: 3.3224999999999998 | AA683: =(N683+O683+P683+Q683+R683+S683+T683+U683+V683+W683+X683+Y683)/12 -> 1.0338916666666667 | AB683: =(G683+H683+I683+J683+K683+L683+M683+N683+O683+P683+Q683+R683+S683+T683+U683+V683+W683+X683+Y683)/19 -> 0.83016842105263156 | AC683: =(R683+S683)/2 -> -0.33965000000000001 | AD683: =(S683+T683)/2 -> -0.42964999999999998 | AE683: =(T683+U683)/2 -> -0.3014 | AF683: =(U683+V683)/2 -> 0.24904999999999999 | AG683: =(V683+W683)/2 -> 2.6654999999999998 | AH683: =(W683+X683)/2 -> 4.5144000000000002 | AI683: =(X683+Y683)/2 -> 3.8575999999999997 | AJ683: =STDEV(G683:Y683) -> 1.5229460798993184
B684: 600143.SH | C684: 金发科技
B685: 002645.SZ | C685: 华宏科技 | E685: 0.26150000000000001 | F685: 0.67100000000000004 | G685: -0.1686 | H685: -0.29149999999999998 | I685: 5.1299999999999998e-02 | J685: 0.15609999999999999 | K685: 0.42249999999999999 | L685: 0.5635 | M685: 7.2400000000000006e-02 | N685: -2.5000000000000001e-02 | O685: -0.14369999999999999 | P685: 0.31489999999999996 | Q685: 0.2253 | R685: 0.13970000000000002 | S685: -0.58879999999999999 | T685: -0.33759999999999996 | U685: -1.15e-02 | V685: 8.2200000000000009e-02 | W685: 6.9353999999999996 | X685: 1.9240000000000002 | Y685: 1.1052 | AA685: =(N685+O685+P685+Q685+R685+S685+T685+U685+V685+W685+X685+Y685)/12 -> 0.80167499999999992 | AB685: =(G685+H685+I685+J685+K685+L685+M685+N685+O685+P685+Q685+R685+S685+T685+U685+V685+W685+X685+Y685)/19 -> 0.54872631578947362 | AC685: =(R685+S685)/2 -> -0.22454999999999997 | AD685: =(S685+T685)/2 -> -0.46319999999999995 | AE685: =(T685+U685)/2 -> -0.17454999999999998 | AF685: =(U685+V685)/2 -> 3.5350000000000006e-02 | AG685: =(V685+W685)/2 -> 3.5087999999999999 | AH685: =(W685+X685)/2 -> 4.4296999999999995 | AI685: =(X685+Y685)/2 -> 1.5146000000000002 | AJ685: =STDEV(G685:Y685) -> 1.6432022246016076
B686: 600085.SH | C686: 同仁堂 | E686: 0.33000000000000002 | F686: 0.67100000000000004 | G686: 0.12039999999999999 | H686: 6.3299999999999995e-02 | I686: 7.9600000000000004e-02 | J686: 9.1199999999999989e-02 | K686: 7.9399999999999998e-02 | L686: 6.6400000000000001e-02 | M686: 3.85e-02 | N686: 0.11460000000000001 | O686: 0.10390000000000001 | P686: 3.4300000000000004e-02 | Q686: 0 | R686: -0.13059999999999999 | S686: -0.31759999999999999 | T686: -0.27390000000000003 | U686: -0.15970000000000001 | V686: 4.5899999999999996e-02 | W686: 0.33329999999999999 | X686: 0.29999999999999999 | Y686: 0.28789999999999999 | AA686: =(N686+O686+P686+Q686+R686+S686+T686+U686+V686+W686+X686+Y686)/12 -> 2.8175000000000002e-02 | AB686: =(G686+H686+I686+J686+K686+L686+M686+N686+O686+P686+Q686+R686+S686+T686+U686+V686+W686+X686+Y686)/19 -> 4.6152631578947369e-02 | AC686: =(R686+S686)/2 -> -0.22409999999999999 | AD686: =(S686+T686)/2 -> -0.29575000000000001 | AE686: =(T686+U686)/2 -> -0.21680000000000002 | AF686: =(U686+V686)/2 -> -5.6900000000000006e-02 | AG686: =(V686+W686)/2 -> 0.18959999999999999 | AH686: =(W686+X686)/2 -> 0.31664999999999999 | AI686: =(X686+Y686)/2 -> 0.29394999999999999 | AJ686: =STDEV(G686:Y686) -> 0.17232388229539378
B687: 000429.SZ | C687: 粤高速A | E687: 0.49280000000000002 | F687: 0.81299999999999994 | G687: 0.2727 | H687: 0.48280000000000001 | I687: 0.41859999999999997 | J687: 0.3846 | K687: 0.1429 | L687: -0.13949999999999999 | M687: -4.9200000000000001e-02 | N687: 0.11109999999999999 | O687: 6.25e-02 | P687: -5.4100000000000002e-02 | Q687: -8.6199999999999999e-02 | R687: -0.125 | S687: -1.1765000000000001 | T687: -0.97140000000000004 | U687: -0.6038 | V687: -0.40000000000000002 | W687: 7.3333000000000004 | X687: 40 | Y687: 2.1905000000000001 | AA687: =(N687+O687+P687+Q687+R687+S687+T687+U687+V687+W687+X687+Y687)/12 -> 3.8567 | AB687: =(G687+H687+I687+J687+K687+L687+M687+N687+O687+P687+Q687+R687+S687+T687+U687+V687+W687+X687+Y687)/19 -> 2.5154368421052631 | AC687: =(R687+S687)/2 -> -0.65075000000000005 | AD687: =(S687+T687)/2 -> -1.07395 | AE687: =(T687+U687)/2 -> -0.78760000000000008 | AF687: =(U687+V687)/2 -> -0.50190000000000001 | AG687: =(V687+W687)/2 -> 3.46665 | AH687: =(W687+X687)/2 -> 23.666650000000001 | AI687: =(X687+Y687)/2 -> 21.09525 | AJ687: =STDEV(G687:Y687) -> 9.2553949235153627
B688: 000887.SZ | C688: 中鼎股份 | E688: 0.49409999999999998 | F688: 0.67600000000000005 | G688: 0.23809999999999998 | H688: 0.24390000000000001 | I688: 0.14710000000000001 | J688: 0.22370000000000001 | K688: 0.1923 | L688: 0.1176 | M688: 0.1026 | N688: -1.0800000000000001e-02 | O688: -0.18350000000000002 | P688: -0.35090000000000005 | Q688: -0.43020000000000003 | R688: -0.46740000000000004 | S688: -0.4864 | T688: -0.72970000000000002 | U688: -0.48979999999999996 | V688: -0.1837 | W688: 0.46149999999999997 | X688: 3.7999999999999998 | Y688: 1.6799999999999999 | AA688: =(N688+O688+P688+Q688+R688+S688+T688+U688+V688+W688+X688+Y688)/12 -> 0.21742499999999998 | AB688: =(G688+H688+I688+J688+K688+L688+M688+N688+O688+P688+Q688+R688+S688+T688+U688+V688+W688+X688+Y688)/19 -> 0.20391578947368419 | AC688: =(R688+S688)/2 -> -0.47689999999999999 | AD688: =(S688+T688)/2 -> -0.60804999999999998 | AE688: =(T688+U688)/2 -> -0.60975000000000001 | AF688: =(U688+V688)/2 -> -0.33674999999999999 | AG688: =(V688+W688)/2 -> 0.13889999999999997 | AH688: =(W688+X688)/2 -> 2.1307499999999999 | AI688: =(X688+Y688)/2 -> 2.7399999999999998 | AJ688: =STDEV(G688:Y688) -> 1.0148255713630778 | AK688: 0.4168 | AL688: 0.53880000000000006 | AM688: 0.4274 | AN688: 0.24729999999999999 | AO688: 0.28050000000000003 | AP688: 0.19320000000000001 | AQ688: 0.1081 | AR688: 8.539999999999999e-02 | AS688: -6.5000000000000002e-02 | AT688: -7.5899999999999995e-02 | AU688: -4.4199999999999996e-02 | AV688: 6.0299999999999999e-02 | AW688: -4.0399999999999998e-02 | AX688: -0.1099 | AY688: -2.9399999999999999e-02 | AZ688: -5.0000000000000003e-02 | BA688: 0.24129999999999999 | BB688: 0.25309999999999999 | BC688: 0.12970000000000001 | BE688: =(AR688+AS688+AT688+AU688+AV688+AW688+AX688+AY688+AZ688+BA688+BB688+BC688)/12 -> 2.9583333333333333e-02 | BF688: =(AK688+AL688+AM688+AN688+AO688+AP688+AQ688+AR688+AS688+AT688+AU688+AV688+AV688+AW688+AX688+AY688+AZ688+BA688+BB688+BC688)/19 -> 0.13828421052631579 | BG688: =(AV688+AW688)/2 -> 9.9500000000000005e-03 | BH688: =(AW688+AX688)/2 -> -7.5149999999999995e-02 | BI688: =(AX688+AY688)/2 -> -6.9650000000000004e-02 | BJ688: =(AY688+AZ688)/2 -> -3.9699999999999999e-02 | BK688: =(AZ688+BA688)/2 -> 9.5649999999999985e-02 | BL688: =(BA688+BB688)/2 -> 0.24719999999999998 | BM688: =(BB688+BC688)/2 -> 0.19140000000000001 | BN688: =STDEV(AK688:BC688) -> 0.19260728870117744
B689: 002026.SZ | C689: 山东威达 | E689: 0.34939999999999999 | F689: 0.64400000000000002 | G689: 0.59999999999999998 | H689: 0.58329999999999993 | I689: 0.18179999999999999 | J689: 0.15380000000000002 | K689: -0.25 | L689: 0 | M689: 0.34619999999999995 | N689: 0.23329999999999998 | O689: 0.16670000000000001 | P689: -0.10529999999999999 | Q689: -0.31430000000000002 | R689: -1.7568000000000001 | S689: 0 | T689: 0.17649999999999999 | U689: 0.66670000000000007 | V689: 3.1429 | W689: 2.1429 | X689: 1.1000000000000001 | Y689: 0.67500000000000004 | AA689: =(N689+O689+P689+Q689+R689+S689+T689+U689+V689+W689+X689+Y689)/12 -> 0.51063333333333338 | AB689: =(G689+H689+I689+J689+K689+L689+M689+N689+O689+P689+Q689+R689+S689+T689+U689+V689+W689+X689+Y689)/19 -> 0.40751052631578949 | AC689: =(R689+S689)/2 -> -0.87840000000000007 | AD689: =(S689+T689)/2 -> 8.8249999999999995e-02 | AE689: =(T689+U689)/2 -> 0.42160000000000003 | AF689: =(U689+V689)/2 -> 1.9048 | AG689: =(V689+W689)/2 -> 2.6429 | AH689: =(W689+X689)/2 -> 1.6214500000000001 | AI689: =(X689+Y689)/2 -> 0.88750000000000007 | AJ689: =STDEV(G689:Y689) -> 0.9908921574322902
B690: 002262.SZ | C690: 恩华药业
B691: 002475.SZ | C691: 立讯精密 | E691: 0.59719999999999995 | F691: 0.66300000000000003 | G691: 0.11109999999999999 | H691: 0.15789999999999998 | I691: 0.18179999999999999 | J691: 2.5000000000000001e-02 | K691: -0.20000000000000001 | L691: -9.0899999999999995e-02 | M691: 0.1923 | N691: 0.24390000000000001 | O691: 0.5 | P691: 0.10000000000000001 | Q691: 0.3226 | R691: 0.33329999999999999 | S691: 0.5 | T691: 0.63639999999999997 | U691: 0.6341 | V691: 0.51469999999999994 | W691: 5.5599999999999997e-02 | X691: 0.22219999999999998 | Y691: 0 | AA691: =(N691+O691+P691+Q691+R691+S691+T691+U691+V691+W691+X691+Y691)/12 -> 0.33856666666666668 | AB691: =(G691+H691+I691+J691+K691+L691+M691+N691+O691+P691+Q691+R691+S691+T691+U691+V691+W691+X691+Y691)/19 -> 0.2336842105263158 | AC691: =(R691+S691)/2 -> 0.41664999999999996 | AD691: =(S691+T691)/2 -> 0.56820000000000004 | AE691: =(T691+U691)/2 -> 0.63524999999999998 | AF691: =(U691+V691)/2 -> 0.57440000000000002 | AG691: =(V691+W691)/2 -> 0.28514999999999996 | AH691: =(W691+X691)/2 -> 0.1389 | AI691: =(X691+Y691)/2 -> 0.11109999999999999 | AJ691: =STDEV(G691:Y691) -> 0.23895036505321418
B692: 002860.SZ | C692: 星帅尔 | G692: -2.9399999999999999e-02 | H692: -1.54e-02 | I692: -6.93e-02 | J692: -0.35170000000000001 | K692: -0.35700000000000004 | L692: -0.3281 | M692: -0.28720000000000001 | N692: 7.0900000000000005e-02 | O692: 1.18e-02 | P692: 0 | Q692: 0.49249999999999999 | R692: 0.36899999999999999 | S692: 6.9400000000000003e-02 | T692: -0.37209999999999999 | U692: -0.55000000000000004 | V692: -0.52170000000000005 | W692: 0.152 | X692: 0.59260000000000002 | Y692: 0.4889 | AA692: =(N692+O692+P692+Q692+R692+S692+T692+U692+V692+W692+X692+Y692)/12 -> 6.6941666666666663e-02 | AB692: =(G692+H692+I692+J692+K692+L692+M692+N692+O692+P692+Q692+R692+S692+T692+U692+V692+W692+X692+Y692)/19 -> -3.3410526315789481e-02 | AC692: =(R692+S692)/2 -> 0.21920000000000001 | AD692: =(S692+T692)/2 -> -0.15134999999999998 | AE692: =(T692+U692)/2 -> -0.46105000000000002 | AF692: =(U692+V692)/2 -> -0.53585000000000005 | AG692: =(V692+W692)/2 -> -0.18485000000000001 | AH692: =(W692+X692)/2 -> 0.37230000000000002 | AI692: =(X692+Y692)/2 -> 0.54075000000000006 | AJ692: =STDEV(G692:Y692) -> 0.34489139014210263 | AK692: 0.11130000000000001 | AL692: 5.28e-02 | AM692: -3.6200000000000003e-02 | AN692: -5.2499999999999998e-02 | AO692: 0.44579999999999997 | AP692: 0.26289999999999997 | AQ692: 0.39899999999999997 | AR692: 0.25 | AS692: 0.314 | AT692: 0.57079999999999997 | AU692: 0.82650000000000001 | AV692: 0.26940000000000003 | AW692: 0.70550000000000002 | AX692: -0.13419999999999999 | AY692: -0.14599999999999999 | AZ692: 0.28350000000000003 | BA692: 1.5300000000000001e-02 | BB692: 1.1379000000000001 | BC692: 1.4068000000000001 | BE692: =(AR692+AS692+AT692+AU692+AV692+AW692+AX692+AY692+AZ692+BA692+BB692+BC692)/12 -> 0.45829166666666676 | BF692: =(AK692+AL692+AM692+AN692+AO692+AP692+AQ692+AR692+AS692+AT692+AU692+AV692+AV692+AW692+AX692+AY692+AZ692+BA692+BB692+BC692)/19 -> 0.36589473684210527 | BG692: =(AV692+AW692)/2 -> 0.48745000000000005 | BH692: =(AW692+AX692)/2 -> 0.28565000000000002 | BI692: =(AX692+AY692)/2 -> -0.1401 | BJ692: =(AY692+AZ692)/2 -> 6.8750000000000019e-02 | BK692: =(AZ692+BA692)/2 -> 0.14940000000000001 | BL692: =(BA692+BB692)/2 -> 0.57660000000000011 | BM692: =(BB692+BC692)/2 -> 1.2723500000000001 | BN692: =STDEV(AK692:BC692) -> 0.42361365163076753
B693: 003031.SZ | C693: 中瓷电子 | E693: 0.29430000000000001 | F693: 0.66900000000000004 | V693: 0.28120000000000001 | W693: 0.2273 | X693: 2.7000000000000003e-02 | Y693: -0.33000000000000002 | AA693: =(N693+O693+P693+Q693+R693+S693+T693+U693+V693+W693+X693+Y693)/12 -> 1.7124999999999998e-02 | AB693: =(G693+H693+I693+J693+K693+L693+M693+N693+O693+P693+Q693+R693+S693+T693+U693+V693+W693+X693+Y693)/19 -> 1.0815789473684209e-02 | AC693: =(R693+S693)/2 -> 0 | AD693: =(S693+T693)/2 -> 0 | AE693: =(T693+U693)/2 -> 0 | AF693: =(U693+V693)/2 -> 0.1406 | AG693: =(V693+W693)/2 -> 0.25424999999999998 | AH693: =(W693+X693)/2 -> 0.12715000000000001 | AI693: =(X693+Y693)/2 -> -0.1515 | AJ693: =STDEV(G693:Y693) -> 0.27677317277269969
B694: 600452.SH | C694: 涪陵电力 | G694: 1.3333000000000002 | H694: 6.5199999999999994e-02 | I694: -1.23e-02 | J694: -3.8100000000000002e-02 | K694: -0.20000000000000001 | L694: -0.2041 | M694: -0.16250000000000001 | N694: 9.9000000000000005e-02 | O694: 0.10710000000000001 | P694: 0.15380000000000002 | Q694: 5.9699999999999996e-02 | R694: -0.18920000000000001 | S694: -0.22579999999999997 | T694: -0.42219999999999996 | U694: -0.38030000000000003 | V694: 1.11e-02 | W694: 0.45829999999999999 | X694: 0.5 | Y694: 0.52270000000000005 | AA694: =(N694+O694+P694+Q694+R694+S694+T694+U694+V694+W694+X694+Y694)/12 -> 5.7849999999999992e-02 | AB694: =(G694+H694+I694+J694+K694+L694+M694+N694+O694+P694+Q694+R694+S694+T694+U694+V694+W694+X694+Y694)/19 -> 7.7668421052631595e-02 | AC694: =(R694+S694)/2 -> -0.20749999999999999 | AD694: =(S694+T694)/2 -> -0.32399999999999995 | AE694: =(T694+U694)/2 -> -0.40125 | AF694: =(U694+V694)/2 -> -0.18460000000000001 | AG694: =(V694+W694)/2 -> 0.23469999999999999 | AH694: =(W694+X694)/2 -> 0.47914999999999996 | AI694: =(X694+Y694)/2 -> 0.51134999999999997 | AJ694: =STDEV(G694:Y694) -> 0.4061007771103014 | BA694: 0.8418000000000001 | BB694: 0.37840000000000001 | BC694: 0.15130000000000002
B695: 600927.SH | C695: 永安期货 | L695: 0.52170000000000005 | M695: 0.1905 | N695: 0.16670000000000001 | O695: 5.3600000000000002e-02 | P695: -4.2900000000000001e-02 | Q695: 4.0000000000000001e-02 | R695: 0.21429999999999999 | S695: 6.7799999999999999e-02 | T695: 0.1343 | U695: -0.39219999999999999 | V695: -6.3500000000000001e-02 | W695: 0.1447 | X695: 0.80650000000000011 | Y695: 0.1356 | AA695: =(N695+O695+P695+Q695+R695+S695+T695+U695+V695+W695+X695+Y695)/12 -> 0.10540833333333334 | AB695: =(G695+H695+I695+J695+K695+L695+M695+N695+O695+P695+Q695+R695+S695+T695+U695+V695+W695+X695+Y695)/19 -> 0.10405789473684213 | AC695: =(R695+S695)/2 -> 0.14105000000000001 | AD695: =(S695+T695)/2 -> 0.10105 | AE695: =(T695+U695)/2 -> -0.12895000000000001 | AF695: =(U695+V695)/2 -> -0.22785 | AG695: =(V695+W695)/2 -> 4.0599999999999997e-02 | AH695: =(W695+X695)/2 -> 0.47560000000000002 | AI695: =(X695+Y695)/2 -> 0.47105000000000008 | AJ695: =STDEV(G695:Y695) -> 0.27449717997310435
B696: 603408.SH | C696: 建霖家居
B697: 603657.SH | C697: 春光科技 | E697: 0.35520000000000002 | F697: 0.67000000000000004 | L697: 0.1273 | M697: 6.59e-02 | N697: 8.199999999999999e-03 | O697: 6.6699999999999995e-02 | P697: -0.45159999999999995 | Q697: -0.41240000000000004 | R697: -0.35770000000000002 | S697: -0.3125 | T697: 5.8799999999999998e-02 | U697: 0.2281 | V697: 0.34179999999999999 | W697: 1.1818 | X697: 0.36109999999999998 | Y697: -4.2900000000000001e-02 | AA697: =(N697+O697+P697+Q697+R697+S697+T697+U697+V697+W697+X697+Y697)/12 -> 5.5783333333333331e-02 | AB697: =(G697+H697+I697+J697+K697+L697+M697+N697+O697+P697+Q697+R697+S697+T697+U697+V697+W697+X697+Y697)/19 -> 4.5399999999999975e-02 | AC697: =(R697+S697)/2 -> -0.33510000000000001 | AD697: =(S697+T697)/2 -> -0.12684999999999999 | AE697: =(T697+U697)/2 -> 0.14344999999999999 | AF697: =(U697+V697)/2 -> 0.28494999999999998 | AG697: =(V697+W697)/2 -> 0.76180000000000003 | AH697: =(W697+X697)/2 -> 0.77144999999999997 | AI697: =(X697+Y697)/2 -> 0.15909999999999999 | AJ697: =STDEV(G697:Y697) -> 0.41812187744197793
B698: 603726.SH | C698: 朗迪集团
B699: 605016.SH | C699: 百龙创园 | V699: 0.16089999999999999 | W699: 0.125 | X699: 7.5499999999999998e-02 | Y699: -0.11840000000000001 | AA699: =(N699+O699+P699+Q699+R699+S699+T699+U699+V699+W699+X699+Y699)/12 -> 2.0250000000000001e-02 | AB699: =(G699+H699+I699+J699+K699+L699+M699+N699+O699+P699+Q699+R699+S699+T699+U699+V699+W699+X699+Y699)/19 -> 1.2789473684210526e-02 | AC699: =(R699+S699)/2 -> 0 | AD699: =(S699+T699)/2 -> 0 | AE699: =(T699+U699)/2 -> 0 | AF699: =(U699+V699)/2 -> 8.0449999999999994e-02 | AG699: =(V699+W699)/2 -> 0.14294999999999999 | AH699: =(W699+X699)/2 -> 0.10025000000000001 | AI699: =(X699+Y699)/2 -> -2.1450000000000004e-02 | AJ699: =STDEV(G699:Y699) -> 0.12445932401123402
B700: 000671.SZ | C700: 阳光城
B701: 000869.SZ | C701: 张裕A
B702: 002803.SZ | C702: 吉宏股份
B703: 600276.SH | C703: 恒瑞医药
B704: 600390.SH | C704: 五矿资本
B705: 600682.SH | C705: 南京新百 | E705: 0.28089999999999998 | F705: 0.66000000000000003 | G705: 0.66670000000000007 | H705: 1.2963 | I705: 1.7955000000000001 | J705: 0.53849999999999998 | K705: 4 | L705: -13.625 | M705: -2.7713999999999999 | N705: -1.8625 | O705: 0.38890000000000002 | P705: 1.7524999999999999 | Q705: 2.7581000000000002 | R705: 2.8550999999999997 | S705: -0.35999999999999999 | T705: -0.57889999999999997 | U705: -0.58719999999999994 | V705: -0.5625 | W705: 0.3125 | X705: 0.4375 | Y705: 0.4667 | AA705: =(N705+O705+P705+Q705+R705+S705+T705+U705+V705+W705+X705+Y705)/12 -> 0.41834999999999994 | AB705: =(G705+H705+I705+J705+K705+L705+M705+N705+O705+P705+Q705+R705+S705+T705+U705+V705+W705+X705+Y705)/19 -> -0.16206315789473688 | AC705: =(R705+S705)/2 -> 1.2475499999999999 | AD705: =(S705+T705)/2 -> -0.46944999999999998 | AE705: =(T705+U705)/2 -> -0.58304999999999996 | AF705: =(U705+V705)/2 -> -0.57484999999999997 | AG705: =(V705+W705)/2 -> -0.125 | AH705: =(W705+X705)/2 -> 0.375 | AI705: =(X705+Y705)/2 -> 0.4521 | AJ705: =STDEV(G705:Y705) -> 3.6403896859799878 | AK705: -8.7899999999999992e-02 | AL705: -0.20300000000000001 | AM705: -0.17920000000000003 | AN705: -8.14e-02 | AO705: 0.1133 | AP705: 2.9100000000000001e-02 | AQ705: -1.5700000000000002e-02 | AR705: -0.25900000000000001 | AS705: -0.51600000000000001 | AT705: -0.48659999999999998 | AU705: -0.47159999999999996 | AV705: -0.40100000000000002 | AW705: -9.0800000000000006e-02 | AX705: -0.12529999999999999 | AY705: -9.4899999999999998e-02 | AZ705: -8.7100000000000011e-02 | BA705: 0.13019999999999998 | BB705: 0.13200000000000001 | BC705: 7.2599999999999998e-02 | BE705: =(AR705+AS705+AT705+AU705+AV705+AW705+AX705+AY705+AZ705+BA705+BB705+BC705)/12 -> -0.18312500000000001 | BF705: =(AK705+AL705+AM705+AN705+AO705+AP705+AQ705+AR705+AS705+AT705+AU705+AV705+AV705+AW705+AX705+AY705+AZ705+BA705+BB705+BC705)/19 -> -0.15912105263157897 | BG705: =(AV705+AW705)/2 -> -0.24590000000000001 | BH705: =(AW705+AX705)/2 -> -0.10805000000000001 | BI705: =(AX705+AY705)/2 -> -0.1101 | BJ705: =(AY705+AZ705)/2 -> -9.0999999999999998e-02 | BK705: =(AZ705+BA705)/2 -> 2.1549999999999986e-02 | BL705: =(BA705+BB705)/2 -> 0.13109999999999999 | BM705: =(BB705+BC705)/2 -> 0.1023 | BN705: =STDEV(AK705:BC705) -> 0.20725634493211512
B706: 603578.SH | C706: 三星新材
B707: 605368.SH | C707: 蓝天燃气
B708: 605398.SH | C708: 新炬网络
B709: 002915.SZ | C709: 中欣氟材 | I709: 1.5969 | J709: 0.3972 | K709: 9.8100000000000007e-02 | L709: -0.48119999999999996 | M709: -0.44719999999999999 | N709: -0.40759999999999996 | O709: 0.3921 | P709: 0.58479999999999999 | Q709: 0.51070000000000004 | R709: -1.9681 | S709: 1.78e-02 | T709: -0.1832 | U709: 1.01e-02 | V709: 2.823 | W709: 2.2732000000000001 | X709: 1.1164000000000001 | Y709: 0.87760000000000005 | AA709: =(N709+O709+P709+Q709+R709+S709+T709+U709+V709+W709+X709+Y709)/12 -> 0.50390000000000001 | AB709: =(G709+H709+I709+J709+K709+L709+M709+N709+O709+P709+Q709+R709+S709+T709+U709+V709+W709+X709+Y709)/19 -> 0.37950526315789473 | AC709: =(R709+S709)/2 -> -0.97514999999999996 | AD709: =(S709+T709)/2 -> -8.2699999999999996e-02 | AE709: =(T709+U709)/2 -> -8.6550000000000002e-02 | AF709: =(U709+V709)/2 -> 1.41655 | AG709: =(V709+W709)/2 -> 2.5480999999999998 | AH709: =(W709+X709)/2 -> 1.6948000000000001 | AI709: =(X709+Y709)/2 -> 0.99700000000000011 | AJ709: =STDEV(G709:Y709) -> 1.1201006512349945
B710: 600012.SH | C710: 皖通高速 | E710: 0.28859999999999997 | F710: 0.65700000000000003 | G710: 0.15460000000000002 | H710: 8.8499999999999995e-02 | I710: 0.1787 | J710: 0.16940000000000002 | K710: -8.6999999999999994e-02 | L710: 5.9800000000000006e-02 | M710: 3.1099999999999999e-02 | N710: 2.8999999999999998e-02 | O710: 7.8600000000000003e-02 | P710: -1.3999999999999999e-02 | Q710: -7.1999999999999998e-03 | R710: -2.2700000000000001e-02 | S710: -1.0906 | T710: -0.79989999999999994 | U710: -0.43079999999999996 | V710: -0.16309999999999999 | W710: 14.4367 | X710: 5.4780999999999995 | Y710: 1.2622 | AA710: =(N710+O710+P710+Q710+R710+S710+T710+U710+V710+W710+X710+Y710)/12 -> 1.5630249999999999 | AB710: =(G710+H710+I710+J710+K710+L710+M710+N710+O710+P710+Q710+R710+S710+T710+U710+V710+W710+X710+Y710)/19 -> 1.0184947368421051 | AC710: =(R710+S710)/2 -> -0.55664999999999998 | AD710: =(S710+T710)/2 -> -0.94524999999999992 | AE710: =(T710+U710)/2 -> -0.61534999999999995 | AF710: =(U710+V710)/2 -> -0.29694999999999999 | AG710: =(V710+W710)/2 -> 7.1368 | AH710: =(W710+X710)/2 -> 9.9573999999999998 | AI710: =(X710+Y710)/2 -> 3.3701499999999998 | AJ710: =STDEV(G710:Y710) -> 3.5155640665591443
B711: 605136.SH | C711: 丽人丽妆
B712: 600308.SH | C712: 华泰股份
B713: 002763.SZ | C713: 汇洁股份 | E713: 0.25329999999999997 | F713: 0.65000000000000002 | G713: -0.23530000000000001 | H713: -0.17859999999999998 | I713: 0.38100000000000001 | J713: 0.21280000000000002 | K713: 3.85e-02 | L713: 0 | M713: -0.19670000000000001 | N713: -0.2525 | O713: 8.6999999999999994e-02 | P713: 6.5199999999999994e-02 | Q713: 0.20199999999999999 | R713: 0.10300000000000001 | S713: -0.82959999999999989 | T713: -0.46939999999999998 | U713: -0.2321 | V713: 0.12770000000000001 | W713: 4.5999999999999996 | X713: 1.1154000000000002 | Y713: 0.51159999999999994 | AA713: =(N713+O713+P713+Q713+R713+S713+T713+U713+V713+W713+X713+Y713)/12 -> 0.41902499999999998 | AB713: =(G713+H713+I713+J713+K713+L713+M713+N713+O713+P713+Q713+R713+S713+T713+U713+V713+W713+X713+Y713)/19 -> 0.26578947368421046 | AC713: =(R713+S713)/2 -> -0.36329999999999996 | AD713: =(S713+T713)/2 -> -0.64949999999999997 | AE713: =(T713+U713)/2 -> -0.35075000000000001 | AF713: =(U713+V713)/2 -> -5.2199999999999996e-02 | AG713: =(V713+W713)/2 -> 2.3638499999999998 | AH713: =(W713+X713)/2 -> 2.8576999999999999 | AI713: =(X713+Y713)/2 -> 0.81350000000000011 | AJ713: =STDEV(G713:Y713) -> 1.1241598447506063
B714: 600388.SH | C714: 龙净环保
B715: 601658.SH | C715: 邮储银行 | E715: 8.199999999999999e-03 | F715: 0.65000000000000002 | Q715: 0.1636 | R715: 0.1613 | S715: 0 | T715: -0.1628 | U715: -9.3800000000000008e-02 | V715: -1.3899999999999999e-02 | W715: 4.3499999999999997e-02 | X715: 0.11109999999999999 | Y715: 0.1207 | AA715: =(N715+O715+P715+Q715+R715+S715+T715+U715+V715+W715+X715+Y715)/12 -> 2.7474999999999999e-02 | AB715: =(G715+H715+I715+J715+K715+L715+M715+N715+O715+P715+Q715+R715+S715+T715+U715+V715+W715+X715+Y715)/19 -> 1.735263157894737e-02 | AC715: =(R715+S715)/2 -> 8.0649999999999999e-02 | AD715: =(S715+T715)/2 -> -8.14e-02 | AE715: =(T715+U715)/2 -> -0.1283 | AF715: =(U715+V715)/2 -> -5.3850000000000002e-02 | AG715: =(V715+W715)/2 -> 1.4799999999999999e-02 | AH715: =(W715+X715)/2 -> 7.7299999999999994e-02 | AI715: =(X715+Y715)/2 -> 0.1159 | AJ715: =STDEV(G715:Y715) -> 0.11456661817475455 | AU715: 0.6714 | AV715: 0.2853 | AW715: -0.1103 | AX715: 0.2122 | AY715: 0.44929999999999998 | AZ715: 0.64780000000000004 | BA715: 1.43e-02 | BB715: 0.15279999999999999 | BC715: -9.1499999999999998e-02 | BE715: =(AR715+AS715+AT715+AU715+AV715+AW715+AX715+AY715+AZ715+BA715+BB715+BC715)/12 -> 0.18594166666666667 | BF715: =(AK715+AL715+AM715+AN715+AO715+AP715+AQ715+AR715+AS715+AT715+AU715+AV715+AV715+AW715+AX715+AY715+AZ715+BA715+BB715+BC715)/19 -> 0.13245263157894738 | BG715: =(AV715+AW715)/2 -> 8.7499999999999994e-02 | BH715: =(AW715+AX715)/2 -> 5.0950000000000002e-02 | BI715: =(AX715+AY715)/2 -> 0.33074999999999999 | BJ715: =(AY715+AZ715)/2 -> 0.54854999999999998 | BK715: =(AZ715+BA715)/2 -> 0.33105000000000001 | BL715: =(BA715+BB715)/2 -> 8.3549999999999999e-02 | BM715: =(BB715+BC715)/2 -> 3.0649999999999997e-02 | BN715: =STDEV(AK715:BC715) -> 0.29360263017289956
B716: 601827.SH | C716: 三峰环境
B717: 603039.SH | C717: 泛微网络
B718: 605122.SH | C718: 四方新材 | V718: 4.3499999999999997e-02 | W718: 0.76000000000000001 | X718: -0.60360000000000003 | Y718: -0.66839999999999999 | AA718: =(N718+O718+P718+Q718+R718+S718+T718+U718+V718+W718+X718+Y718)/12 -> -3.9041666666666669e-02 | AB718: =(G718+H718+I718+J718+K718+L718+M718+N718+O718+P718+Q718+R718+S718+T718+U718+V718+W718+X718+Y718)/19 -> -2.4657894736842108e-02 | AC718: =(R718+S718)/2 -> 0 | AD718: =(S718+T718)/2 -> 0 | AE718: =(T718+U718)/2 -> 0 | AF718: =(U718+V718)/2 -> 2.1749999999999999e-02 | AG718: =(V718+W718)/2 -> 0.40175 | AH718: =(W718+X718)/2 -> 7.8199999999999992e-02 | AI718: =(X718+Y718)/2 -> -0.63600000000000001 | AJ718: =STDEV(G718:Y718) -> 0.66726074551107828
B719: 000739.SZ | C719: 普洛药业 | G719: 0.28179999999999999 | H719: 0.13300000000000001 | I719: -6.6699999999999995e-02 | J719: -2.9600000000000001e-02 | K719: 0.34749999999999998 | L719: 0.39630000000000004 | M719: 0.64290000000000003 | N719: 0.40860000000000002 | O719: 0.64560000000000006 | P719: 0.50629999999999997 | Q719: 0.59219999999999995 | R719: 0.49359999999999998 | S719: 0.39979999999999999 | T719: 0.5292 | U719: 0.46009999999999995 | V719: 0.47570000000000001 | W719: 0.40369999999999995 | X719: 0.28870000000000001 | Y719: 0.20949999999999999 | AA719: =(N719+O719+P719+Q719+R719+S719+T719+U719+V719+W719+X719+Y719)/12 -> 0.45108333333333328 | AB719: =(G719+H719+I719+J719+K719+L719+M719+N719+O719+P719+Q719+R719+S719+T719+U719+V719+W719+X719+Y719)/19 -> 0.37464210526315789 | AC719: =(R719+S719)/2 -> 0.44669999999999999 | AD719: =(S719+T719)/2 -> 0.46450000000000002 | AE719: =(T719+U719)/2 -> 0.49464999999999998 | AF719: =(U719+V719)/2 -> 0.46789999999999998 | AG719: =(V719+W719)/2 -> 0.43969999999999998 | AH719: =(W719+X719)/2 -> 0.34619999999999995 | AI719: =(X719+Y719)/2 -> 0.24909999999999999 | AJ719: =STDEV(G719:Y719) -> 0.20128749841344806
B720: 605577.SH | C720: 龙版传媒 | E720: 0.40619999999999995 | F720: 0.64300000000000002 | V720: 0.3861 | W720: 0.3236 | X720: 0.30149999999999999 | Y720: 0.12920000000000001 | AA720: =(N720+O720+P720+Q720+R720+S720+T720+U720+V720+W720+X720+Y720)/12 -> 9.5033333333333345e-02 | AB720: =(G720+H720+I720+J720+K720+L720+M720+N720+O720+P720+Q720+R720+S720+T720+U720+V720+W720+X720+Y720)/19 -> 6.0021052631578954e-02 | AC720: =(R720+S720)/2 -> 0 | AD720: =(S720+T720)/2 -> 0 | AE720: =(T720+U720)/2 -> 0 | AF720: =(U720+V720)/2 -> 0.19305 | AG720: =(V720+W720)/2 -> 0.35485 | AH720: =(W720+X720)/2 -> 0.31254999999999999 | AI720: =(X720+Y720)/2 -> 0.21534999999999999 | AJ720: =STDEV(G720:Y720) -> 0.10993485950022101
B721: 600663.SH | C721: 陆家嘴
B722: 600817.SH | C722: 宇通重工
B723: 002851.SZ | C723: 麦格米特
B724: 000065.SZ | C724: 北方国际
B725: 002318.SZ | C725: 久立特材 | E725: 0.2989 | F725: 0.64000000000000001 | G725: 0 | H725: 0.1429 | I725: 0 | J725: -0.20000000000000001 | K725: 0.91000000000000003 | L725: 1 | M725: 1 | N725: 1.25 | O725: 0.48869999999999997 | P725: 0.5625 | Q725: 0.76919999999999999 | R725: 0.63890000000000002 | S725: 0.1079 | T725: 0.20000000000000001 | U725: 0.41299999999999998 | V725: 0.54239999999999999 | W725: 0.58729999999999993 | X725: 0.29999999999999999 | Y725: -1.54e-02 | AA725: =(N725+O725+P725+Q725+R725+S725+T725+U725+V725+W725+X725+Y725)/12 -> 0.48704166666666665 | AB725: =(G725+H725+I725+J725+K725+L725+M725+N725+O725+P725+Q725+R725+S725+T725+U725+V725+W725+X725+Y725)/19 -> 0.45775789473684209 | AC725: =(R725+S725)/2 -> 0.37340000000000001 | AD725: =(S725+T725)/2 -> 0.15395 | AE725: =(T725+U725)/2 -> 0.30649999999999999 | AF725: =(U725+V725)/2 -> 0.47770000000000001 | AG725: =(V725+W725)/2 -> 0.56484999999999996 | AH725: =(W725+X725)/2 -> 0.44364999999999999 | AI725: =(X725+Y725)/2 -> 0.14229999999999998 | AJ725: =STDEV(G725:Y725) -> 0.40663799805476653
B726: 002990.SZ | C726: 盛视科技
B727: 600846.SH | C727: 同济科技
B728: 600908.SH | C728: 无锡银行
B729: 600970.SH | C729: 中材国际
B730: 603216.SH | C730: 梦天家居 | W730: -8.8499999999999995e-02 | X730: 1.9091 | Y730: 0.6409999999999999 | AA730: =(N730+O730+P730+Q730+R730+S730+T730+U730+V730+W730+X730+Y730)/12 -> 0.20513333333333331 | AB730: =(G730+H730+I730+J730+K730+L730+M730+N730+O730+P730+Q730+R730+S730+T730+U730+V730+W730+X730+Y730)/19 -> 0.12955789473684209 | AC730: =(R730+S730)/2 -> 0 | AD730: =(S730+T730)/2 -> 0 | AE730: =(T730+U730)/2 -> 0 | AF730: =(U730+V730)/2 -> 0 | AG730: =(V730+W730)/2 -> -4.4249999999999998e-02 | AH730: =(W730+X730)/2 -> 0.9103 | AI730: =(X730+Y730)/2 -> 1.27505 | AJ730: =STDEV(G730:Y730) -> 1.0108291662458764 | BA730: -4.2599999999999999e-02 | BB730: 0.29530000000000001 | BC730: 0.20519999999999999
B731: 603351.SH | C731: 威尔药业 | E731: 0.25340000000000001 | F731: 0.61899999999999999 | L731: -0.28100000000000003 | M731: -0.2727 | N731: -0.25579999999999997 | O731: -0.1852 | P731: -0.31030000000000002 | Q731: -0.2833 | R731: -0.375 | S731: -0.45450000000000002 | T731: -0.26669999999999999 | U731: -0.3256 | V731: -0.23000000000000001 | W731: -0.16670000000000001 | X731: -2.2700000000000001e-02 | Y731: 0.10339999999999999 | AA731: =(N731+O731+P731+Q731+R731+S731+T731+U731+V731+W731+X731+Y731)/12 -> -0.23103333333333334 | AB731: =(G731+H731+I731+J731+K731+L731+M731+N731+O731+P731+Q731+R731+S731+T731+U731+V731+W731+X731+Y731)/19 -> -0.17505789473684211 | AC731: =(R731+S731)/2 -> -0.41475000000000001 | AD731: =(S731+T731)/2 -> -0.36060000000000003 | AE731: =(T731+U731)/2 -> -0.29615000000000002 | AF731: =(U731+V731)/2 -> -0.27779999999999999 | AG731: =(V731+W731)/2 -> -0.19835000000000003 | AH731: =(W731+X731)/2 -> -9.4700000000000006e-02 | AI731: =(X731+Y731)/2 -> 4.0349999999999997e-02 | AJ731: =STDEV(G731:Y731) -> 0.14022759071524477 | AP731: 0.43840000000000001 | AQ731: 0.33710000000000001 | AR731: 0.31559999999999999 | AS731: 0.26019999999999999 | AT731: 6.6100000000000006e-02 | AU731: 9.6099999999999991e-02 | AV731: 0.1368 | AW731: -0.19820000000000002 | AX731: -0.18600000000000003 | AY731: -0.2382 | AZ731: -0.2218 | BA731: 5.1200000000000002e-02 | BB731: 0.115 | BC731: 0.27399999999999997 | BE731: =(AR731+AS731+AT731+AU731+AV731+AW731+AX731+AY731+AZ731+BA731+BB731+BC731)/12 -> 3.9233333333333328e-02 | BF731: =(AK731+AL731+AM731+AN731+AO731+AP731+AQ731+AR731+AS731+AT731+AU731+AV731+AV731+AW731+AX731+AY731+AZ731+BA731+BB731+BC731)/19 -> 7.2794736842105287e-02 | BG731: =(AV731+AW731)/2 -> -3.0700000000000005e-02 | BH731: =(AW731+AX731)/2 -> -0.19210000000000002 | BI731: =(AX731+AY731)/2 -> -0.21210000000000001 | BJ731: =(AY731+AZ731)/2 -> -0.22999999999999998 | BK731: =(AZ731+BA731)/2 -> -8.5300000000000001e-02 | BL731: =(BA731+BB731)/2 -> 8.3100000000000007e-02 | BM731: =(BB731+BC731)/2 -> 0.19449999999999998 | BN731: =STDEV(AK731:BC731) -> 0.22621395311168935
B732: 002690.SZ | C732: 美亚光电
B733: 600764.SH | C733: 中国海防 | E733: 0.2923 | F733: 0.63200000000000001 | G733: 1.7187999999999999 | H733: 28.971 | I733: 148.11670000000001 | J733: 2.9900000000000003e-02 | K733: -0.78549999999999998 | L733: -0.95400000000000007 | M733: -0.92790000000000006 | N733: 0.1522 | O733: 4.2431999999999999 | P733: 12.9223 | Q733: 6.5392999999999999 | R733: 0.35619999999999996 | S733: -2.2164999999999999 | T733: -0.4103 | U733: 7.9500000000000001e-02 | V733: 1.72e-02 | W733: 2.8452999999999999 | X733: 0.19350000000000001 | Y733: 0.221 | AA733: =(N733+O733+P733+Q733+R733+S733+T733+U733+V733+W733+X733+Y733)/12 -> 2.0785749999999998 | AB733: =(G733+H733+I733+J733+K733+L733+M733+N733+O733+P733+Q733+R733+S733+T733+U733+V733+W733+X733+Y733)/19 -> 10.584836842105263 | AC733: =(R733+S733)/2 -> -0.93015000000000003 | AD733: =(S733+T733)/2 -> -1.3133999999999999 | AE733: =(T733+U733)/2 -> -0.16539999999999999 | AF733: =(U733+V733)/2 -> 4.8350000000000004e-02 | AG733: =(V733+W733)/2 -> 1.4312499999999999 | AH733: =(W733+X733)/2 -> 1.5194000000000001 | AI733: =(X733+Y733)/2 -> 0.20724999999999999 | AJ733: =STDEV(G733:Y733) -> 34.071538484459609
B734: 600674.SH | C734: 川投能源 | G734: -0.13919999999999999 | H734: -0.1198 | I734: 2.0099999999999996e-02 | J734: -7.1599999999999997e-02 | K734: 5.5599999999999997e-02 | L734: -5.4100000000000002e-02 | M734: -3.0200000000000001e-02 | N734: 9.3599999999999989e-02 | O734: -0.10529999999999999 | P734: -7.9000000000000008e-03 | Q734: -5.0700000000000002e-02 | R734: -0.17449999999999999 | S734: -0.29820000000000002 | T734: 7.7100000000000002e-02 | U734: 2.98e-02 | V734: 7.2700000000000001e-02 | W734: 0.2288 | X734: 5.4600000000000003e-02 | Y734: 2.5499999999999998e-02 | AA734: =(N734+O734+P734+Q734+R734+S734+T734+U734+V734+W734+X734+Y734)/12 -> -4.5416666666666704e-03 | AB734: =(G734+H734+I734+J734+K734+L734+M734+N734+O734+P734+Q734+R734+S734+T734+U734+V734+W734+X734+Y734)/19 -> -2.0721052631578953e-02 | AC734: =(R734+S734)/2 -> -0.23635 | AD734: =(S734+T734)/2 -> -0.11055000000000001 | AE734: =(T734+U734)/2 -> 5.3449999999999998e-02 | AF734: =(U734+V734)/2 -> 5.1250000000000004e-02 | AG734: =(V734+W734)/2 -> 0.15075 | AH734: =(W734+X734)/2 -> 0.14169999999999999 | AI734: =(X734+Y734)/2 -> 4.0050000000000002e-02 | AJ734: =STDEV(G734:Y734) -> 0.11737537399749844
B735: 002315.SZ | C735: 焦点科技
B736: 002745.SZ | C736: 木林森
B737: 002879.SZ | C737: 长缆科技 | E737: 0.1898 | F737: 0.63 | G737: -8.0000000000000002e-02 | H737: -0.30649999999999999 | I737: -0.34520000000000001 | J737: -0.375 | K737: -0.44780000000000003 | L737: -0.11630000000000001 | M737: -0.1091 | N737: -5.7099999999999998e-02 | O737: 4.7199999999999999e-02 | P737: 0 | Q737: 0.10199999999999999 | R737: 0.16670000000000001 | S737: 0.20300000000000001 | T737: 0.15789999999999998 | U737: 9.2600000000000002e-02 | V737: 0.16879999999999998 | W737: 0 | X737: 0.13639999999999999 | Y737: 6.7799999999999999e-02 | AA737: =(N737+O737+P737+Q737+R737+S737+T737+U737+V737+W737+X737+Y737)/12 -> 9.0441666666666684e-02 | AB737: =(G737+H737+I737+J737+K737+L737+M737+N737+O737+P737+Q737+R737+S737+T737+U737+V737+W737+X737+Y737)/19 -> -3.6557894736842102e-02 | AC737: =(R737+S737)/2 -> 0.18485000000000001 | AD737: =(S737+T737)/2 -> 0.18045 | AE737: =(T737+U737)/2 -> 0.12525 | AF737: =(U737+V737)/2 -> 0.13069999999999998 | AG737: =(V737+W737)/2 -> 8.4399999999999989e-02 | AH737: =(W737+X737)/2 -> 6.8199999999999997e-02 | AI737: =(X737+Y737)/2 -> 0.1021 | AJ737: =STDEV(G737:Y737) -> 0.20149208232525187
B738: 002897.SZ | C738: 意华股份 | I738: -0.2069 | J738: -0.45159999999999995 | K738: -0.64290000000000003 | L738: -0.6613 | M738: -0.46380000000000005 | N738: -0.32350000000000001 | O738: -0.59999999999999998 | P738: -0.28570000000000001 | Q738: -0.2432 | R738: -0.43479999999999996 | S738: 3.75 | T738: 4 | U738: 2.5356999999999998 | V738: 3.0769000000000002 | W738: -0.10529999999999999 | X738: -0.47999999999999998 | Y738: -0.36359999999999998 | AA738: =(N738+O738+P738+Q738+R738+S738+T738+U738+V738+W738+X738+Y738)/12 -> 0.87720833333333337 | AB738: =(G738+H738+I738+J738+K738+L738+M738+N738+O738+P738+Q738+R738+S738+T738+U738+V738+W738+X738+Y738)/19 -> 0.4263157894736842 | AC738: =(R738+S738)/2 -> 1.6576 | AD738: =(S738+T738)/2 -> 3.875 | AE738: =(T738+U738)/2 -> 3.2678500000000001 | AF738: =(U738+V738)/2 -> 2.8063000000000002 | AG738: =(V738+W738)/2 -> 1.4858 | AH738: =(W738+X738)/2 -> -0.29264999999999997 | AI738: =(X738+Y738)/2 -> -0.42179999999999995 | AJ738: =STDEV(G738:Y738) -> 1.6692221638253797
B739: 601528.SH | C739: 瑞丰银行 | V739: 6.5799999999999997e-02 | W739: 5.8799999999999998e-02 | X739: 0.1176 | Y739: 8.6199999999999999e-02 | AA739: =(N739+O739+P739+Q739+R739+S739+T739+U739+V739+W739+X739+Y739)/12 -> 2.7366666666666664e-02 | AB739: =(G739+H739+I739+J739+K739+L739+M739+N739+O739+P739+Q739+R739+S739+T739+U739+V739+W739+X739+Y739)/19 -> 1.7284210526315787e-02 | AC739: =(R739+S739)/2 -> 0 | AD739: =(S739+T739)/2 -> 0 | AE739: =(T739+U739)/2 -> 0 | AF739: =(U739+V739)/2 -> 3.2899999999999999e-02 | AG739: =(V739+W739)/2 -> 6.2299999999999994e-02 | AH739: =(W739+X739)/2 -> 8.8200000000000001e-02 | AI739: =(X739+Y739)/2 -> 0.10189999999999999 | AJ739: =STDEV(G739:Y739) -> 2.6366898439773558e-02 | AZ739: 1.0392000000000001 | BA739: 1.6665000000000001 | BB739: 1.5208000000000002 | BC739: 0.50380000000000003 | BE739: =(AR739+AS739+AT739+AU739+AV739+AW739+AX739+AY739+AZ739+BA739+BB739+BC739)/12 -> 0.39419166666666672 | BF739: =(AK739+AL739+AM739+AN739+AO739+AP739+AQ739+AR739+AS739+AT739+AU739+AV739+AV739+AW739+AX739+AY739+AZ739+BA739+BB739+BC739)/19 -> 0.24896315789473689 | BG739: =(AV739+AW739)/2 -> 0 | BH739: =(AW739+AX739)/2 -> 0 | BI739: =(AX739+AY739)/2 -> 0 | BJ739: =(AY739+AZ739)/2 -> 0.51960000000000006 | BK739: =(AZ739+BA739)/2 -> 1.3528500000000001 | BL739: =(BA739+BB739)/2 -> 1.5936500000000002 | BM739: =(BB739+BC739)/2 -> 1.0123000000000002 | BN739: =STDEV(AK739:BC739) -> 0.5259503929396131
B740: 603367.SH | C740: 辰欣药业
B741: 603693.SH | C741: 江苏新能 | J741: 6.9000000000000006e-02 | K741: 5.0000000000000003e-02 | L741: -7.8899999999999998e-02 | M741: 0.17780000000000001 | N741: -9.6799999999999997e-02 | O741: -0.57140000000000002 | P741: -0.34289999999999998 | Q741: -0.41509999999999997 | R741: -0.26789999999999997 | S741: 2.3332999999999999 | T741: 1.1304000000000001 | U741: 0.8387 | V741: -0.39020000000000005 | W741: 6.6699999999999995e-02 | X741: 0 | Y741: 0.10529999999999999 | AA741: =(N741+O741+P741+Q741+R741+S741+T741+U741+V741+W741+X741+Y741)/12 -> 0.19917499999999999 | AB741: =(G741+H741+I741+J741+K741+L741+M741+N741+O741+P741+Q741+R741+S741+T741+U741+V741+W741+X741+Y741)/19 -> 0.13726315789473684 | AC741: =(R741+S741)/2 -> 1.0327 | AD741: =(S741+T741)/2 -> 1.7318500000000001 | AE741: =(T741+U741)/2 -> 0.98455000000000004 | AF741: =(U741+V741)/2 -> 0.22424999999999998 | AG741: =(V741+W741)/2 -> -0.16175000000000003 | AH741: =(W741+X741)/2 -> 3.3349999999999998e-02 | AI741: =(X741+Y741)/2 -> 5.2649999999999995e-02 | AJ741: =STDEV(G741:Y741) -> 0.72621511230029723 | BA741: 0.12839999999999999 | BB741: 9.6699999999999994e-02 | BC741: -0.1067
B742: 605033.SH | C742: 美邦股份 | E742: 0.39880000000000004 | F742: 0.63 | V742: 1.3000000000000001e-02 | W742: 6.9800000000000001e-02 | X742: 7.9399999999999998e-02 | Y742: 0.23530000000000001 | AA742: =(N742+O742+P742+Q742+R742+S742+T742+U742+V742+W742+X742+Y742)/12 -> 3.3125000000000002e-02 | AB742: =(G742+H742+I742+J742+K742+L742+M742+N742+O742+P742+Q742+R742+S742+T742+U742+V742+W742+X742+Y742)/19 -> 2.0921052631578948e-02 | AC742: =(R742+S742)/2 -> 0 | AD742: =(S742+T742)/2 -> 0 | AE742: =(T742+U742)/2 -> 0 | AF742: =(U742+V742)/2 -> 6.5000000000000006e-03 | AG742: =(V742+W742)/2 -> 4.1399999999999999e-02 | AH742: =(W742+X742)/2 -> 7.46e-02 | AI742: =(X742+Y742)/2 -> 0.15734999999999999 | AJ742: =STDEV(G742:Y742) -> 9.523642072932674e-02 | AZ742: 0.17499999999999999 | BA742: 4.3299999999999998e-02 | BB742: 0.11720000000000001 | BC742: 0.51390000000000002 | BE742: =(AR742+AS742+AT742+AU742+AV742+AW742+AX742+AY742+AZ742+BA742+BB742+BC742)/12 -> 7.0783333333333337e-02 | BF742: =(AK742+AL742+AM742+AN742+AO742+AP742+AQ742+AR742+AS742+AT742+AU742+AV742+AV742+AW742+AX742+AY742+AZ742+BA742+BB742+BC742)/19 -> 4.4705263157894741e-02 | BG742: =(AV742+AW742)/2 -> 0 | BH742: =(AW742+AX742)/2 -> 0 | BI742: =(AX742+AY742)/2 -> 0 | BJ742: =(AY742+AZ742)/2 -> 8.7499999999999994e-02 | BK742: =(AZ742+BA742)/2 -> 0.10915 | BL742: =(BA742+BB742)/2 -> 8.0250000000000002e-02 | BM742: =(BB742+BC742)/2 -> 0.31555 | BN742: =STDEV(AK742:BC742) -> 0.20813365097135703
B743: 605166.SH | C743: 聚合顺 | E743: 0.54679999999999995 | F743: 0.78000000000000003 | R743: -2.3300000000000001e-02 | S743: -0.2727 | T743: -0.1429 | U743: -0.29410000000000003 | V743: 0 | W743: 1.5 | X743: 1.5556000000000001 | Y743: 1.625 | AA743: =(N743+O743+P743+Q743+R743+S743+T743+U743+V743+W743+X743+Y743)/12 -> 0.32896666666666668 | AB743: =(G743+H743+I743+J743+K743+L743+M743+N743+O743+P743+Q743+R743+S743+T743+U743+V743+W743+X743+Y743)/19 -> 0.20776842105263157 | AC743: =(R743+S743)/2 -> -0.14799999999999999 | AD743: =(S743+T743)/2 -> -0.20779999999999998 | AE743: =(T743+U743)/2 -> -0.21850000000000003 | AF743: =(U743+V743)/2 -> -0.14705000000000001 | AG743: =(V743+W743)/2 -> 0.75 | AH743: =(W743+X743)/2 -> 1.5278 | AI743: =(X743+Y743)/2 -> 1.5903 | AJ743: =STDEV(G743:Y743) -> 0.88997564493160641 | AV743: 0.69590000000000007 | AW743: 0.73290000000000011 | AX743: 0.39659999999999995 | AY743: 0.24179999999999999 | AZ743: 0.21329999999999999 | BA743: 0.55799999999999994 | BB743: 1.0139 | BC743: 1.0363 | BE743: =(AR743+AS743+AT743+AU743+AV743+AW743+AX743+AY743+AZ743+BA743+BB743+BC743)/12 -> 0.40739166666666665 | BF743: =(AK743+AL743+AM743+AN743+AO743+AP743+AQ743+AR743+AS743+AT743+AU743+AV743+AV743+AW743+AX743+AY743+AZ743+BA743+BB743+BC743)/19 -> 0.29392631578947365 | BG743: =(AV743+AW743)/2 -> 0.71440000000000015 | BH743: =(AW743+AX743)/2 -> 0.56475000000000009 | BI743: =(AX743+AY743)/2 -> 0.31919999999999998 | BJ743: =(AY743+AZ743)/2 -> 0.22754999999999997 | BK743: =(AZ743+BA743)/2 -> 0.38564999999999994 | BL743: =(BA743+BB743)/2 -> 0.78594999999999993 | BM743: =(BB743+BC743)/2 -> 1.0251000000000001 | BN743: =STDEV(AK743:BC743) -> 0.31814784271063123
B744: 605365.SH | C744: 立达信 | V744: 0.20730000000000001 | W744: 2.1667000000000001 | X744: 8.1099999999999992e-02 | Y744: -0.26739999999999997 | AA744: =(N744+O744+P744+Q744+R744+S744+T744+U744+V744+W744+X744+Y744)/12 -> 0.18230833333333338 | AB744: =(G744+H744+I744+J744+K744+L744+M744+N744+O744+P744+Q744+R744+S744+T744+U744+V744+W744+X744+Y744)/19 -> 0.11514210526315792 | AC744: =(R744+S744)/2 -> 0 | AD744: =(S744+T744)/2 -> 0 | AE744: =(T744+U744)/2 -> 0 | AF744: =(U744+V744)/2 -> 0.10365000000000001 | AG744: =(V744+W744)/2 -> 1.1870000000000001 | AH744: =(W744+X744)/2 -> 1.1239000000000001 | AI744: =(X744+Y744)/2 -> -9.3149999999999983e-02 | AJ744: =STDEV(G744:Y744) -> 1.0983524521603558
B745: 002068.SZ | C745: 黑猫股份 | E745: 0.50549999999999995 | F745: 0.628 | G745: 1.8182 | H745: 4.9411000000000005 | I745: 64.550699999999992 | J745: 3.5731000000000002 | K745: 1.0578000000000001 | L745: 0.18719999999999998 | M745: 0.3795 | N745: -0.24590000000000001 | O745: -1.5512999999999999 | P745: -1.3799999999999999 | Q745: -1.2885 | R745: -1.6887999999999999 | S745: 0.94609999999999994 | T745: 0.40619999999999995 | U745: 1.0315000000000001 | V745: 1.351 | W745: 68.163600000000002 | X745: 7.5021000000000004 | Y745: 113.23639999999999 | AA745: =(N745+O745+P745+Q745+R745+S745+T745+U745+V745+W745+X745+Y745)/12 -> 15.540199999999999 | AB745: =(G745+H745+I745+J745+K745+L745+M745+N745+O745+P745+Q745+R745+S745+T745+U745+V745+W745+X745+Y745)/19 -> 13.841578947368419 | AC745: =(R745+S745)/2 -> -0.37134999999999996 | AD745: =(S745+T745)/2 -> 0.67614999999999992 | AE745: =(T745+U745)/2 -> 0.71884999999999999 | AF745: =(U745+V745)/2 -> 1.1912500000000001 | AG745: =(V745+W745)/2 -> 34.757300000000001 | AH745: =(W745+X745)/2 -> 37.832850000000001 | AI745: =(X745+Y745)/2 -> 60.369249999999994 | AJ745: =STDEV(G745:Y745) -> 31.715974348313271 | AK745: -0.38829999999999998 | AL745: -8.43e-02 | AM745: -0.49609999999999999 | AN745: 9.9900000000000003e-02 | AO745: 0.92390000000000005 | AP745: 0.47649999999999998 | AQ745: 0.47479999999999994 | AR745: 0.2447 | AS745: -0.14510000000000001 | AT745: -0.1215 | AU745: -0.12970000000000001 | AV745: -4.4699999999999997e-02 | AW745: -0.11869999999999999 | AX745: -9.9299999999999999e-02 | AY745: -0.19879999999999998 | AZ745: -4.87e-02 | BA745: 0.22010000000000002 | BB745: 0.43469999999999998 | BC745: 0.65079999999999993 | BE745: =(AR745+AS745+AT745+AU745+AV745+AW745+AX745+AY745+AZ745+BA745+BB745+BC745)/12 -> 5.3649999999999996e-02 | BF745: =(AK745+AL745+AM745+AN745+AO745+AP745+AQ745+AR745+AS745+AT745+AU745+AV745+AV745+AW745+AX745+AY745+AZ745+BA745+BB745+BC745)/19 -> 8.4499999999999978e-02 | BG745: =(AV745+AW745)/2 -> -8.1699999999999995e-02 | BH745: =(AW745+AX745)/2 -> -0.10899999999999999 | BI745: =(AX745+AY745)/2 -> -0.14904999999999999 | BJ745: =(AY745+AZ745)/2 -> -0.12374999999999999 | BK745: =(AZ745+BA745)/2 -> 8.5700000000000012e-02 | BL745: =(BA745+BB745)/2 -> 0.32740000000000002 | BM745: =(BB745+BC745)/2 -> 0.54274999999999995 | BN745: =STDEV(AK745:BC745) -> 0.36651811137365681
B746: 002180.SZ | C746: 纳思达 | E746: 0.64489999999999992 | F746: 0.47799999999999998 | G746: -8.0023999999999997 | H746: -5.3678999999999997 | I746: -2.9733000000000001 | J746: 14.4046 | K746: 1.0939000000000001 | L746: 1.2899 | M746: 1.9225000000000001 | N746: -4.8399999999999999e-02 | O746: 6.3e-02 | P746: 0.19070000000000001 | Q746: 0.41509999999999997 | R746: -0.221 | S746: -0.66859999999999997 | T746: -4.1500000000000002e-02 | U746: -0.41320000000000001 | V746: -0.88300000000000001 | W746: 6.0316000000000001 | X746: 0.17420000000000002 | Y746: 0.60650000000000004 | AA746: =(N746+O746+P746+Q746+R746+S746+T746+U746+V746+W746+X746+Y746)/12 -> 0.43378333333333324 | AB746: =(G746+H746+I746+J746+K746+L746+M746+N746+O746+P746+Q746+R746+S746+T746+U746+V746+W746+X746+Y746)/19 -> 0.39856315789473673 | AC746: =(R746+S746)/2 -> -0.44479999999999997 | AD746: =(S746+T746)/2 -> -0.35504999999999998 | AE746: =(T746+U746)/2 -> -0.22735 | AF746: =(U746+V746)/2 -> -0.64810000000000001 | AG746: =(V746+W746)/2 -> 2.5743 | AH746: =(W746+X746)/2 -> 3.1029 | AI746: =(X746+Y746)/2 -> 0.39035000000000003 | AJ746: =STDEV(G746:Y746) -> 4.416920882144348 | AK746: 6.7592999999999996 | AL746: 6.8491999999999997 | AM746: 5.8814000000000002 | AN746: 3.1035000000000004 | AO746: -0.15579999999999999 | AP746: -0.15679999999999999 | AQ746: -3.73e-02 | AR746: -8.6599999999999996e-02 | AS746: 6.4000000000000003e-03 | AT746: 4.2699999999999995e-02 | AU746: 4.5700000000000005e-02 | AV746: 7.1099999999999997e-02 | AW746: 6.8400000000000002e-02 | AX746: -1.e-04 | AY746: -8.5500000000000007e-02 | AZ746: -0.13650000000000001 | BA746: -0.1416 | BB746: -0.11130000000000001 | BC746: -6.7500000000000004e-02 | BE746: =(AR746+AS746+AT746+AU746+AV746+AW746+AX746+AY746+AZ746+BA746+BB746+BC746)/12 -> -3.2900000000000006e-02 | BF746: =(AK746+AL746+AM746+AN746+AO746+AP746+AQ746+AR746+AS746+AT746+AU746+AV746+AV746+AW746+AX746+AY746+AZ746+BA746+BB746+BC746)/19 -> 1.1536736842105264 | BG746: =(AV746+AW746)/2 -> 6.9750000000000006e-02 | BH746: =(AW746+AX746)/2 -> 3.415e-02 | BI746: =(AX746+AY746)/2 -> -4.2800000000000005e-02 | BJ746: =(AY746+AZ746)/2 -> -0.11100000000000002 | BK746: =(AZ746+BA746)/2 -> -0.13905000000000001 | BL746: =(BA746+BB746)/2 -> -0.12645000000000001 | BM746: =(BB746+BC746)/2 -> -8.9400000000000007e-02 | BN746: =STDEV(AK746:BC746) -> 2.4925680588173029
B747: 002386.SZ | C747: 天原股份 | G747: 1.25 | H747: 1.3899999999999999 | I747: 2.7475999999999998 | J747: 0.86109999999999998 | K747: 2.5 | L747: 3.0282 | M747: 0.50119999999999998 | N747: 0.41619999999999996 | O747: -0.1429 | P747: -0.30620000000000003 | Q747: -0.46999999999999997 | R747: -0.53369999999999995 | S747: -1.3333000000000002 | T747: -1.5064 | U747: -0.80559999999999998 | V747: 0.4708 | W747: 9 | X747: 8.2156000000000002 | Y747: 30.984699999999997 | AA747: =(N747+O747+P747+Q747+R747+S747+T747+U747+V747+W747+X747+Y747)/12 -> 3.6657666666666664 | AB747: =(G747+H747+I747+J747+K747+L747+M747+N747+O747+P747+Q747+R747+S747+T747+U747+V747+W747+X747+Y747)/19 -> 2.9614368421052633 | AC747: =(R747+S747)/2 -> -0.9335 | AD747: =(S747+T747)/2 -> -1.4198500000000001 | AE747: =(T747+U747)/2 -> -1.1559999999999999 | AF747: =(U747+V747)/2 -> -0.16739999999999999 | AG747: =(V747+W747)/2 -> 4.7354000000000003 | AH747: =(W747+X747)/2 -> 8.607800000000001 | AI747: =(X747+Y747)/2 -> 19.600149999999999 | AJ747: =STDEV(G747:Y747) -> 7.3601138604727305 | BA747: 0.49299999999999999 | BB747: -0.10980000000000001 | BC747: -0.36849999999999999
B748: 000655.SZ | C748: 金岭矿业
B749: 000731.SZ | C749: 四川美丰
B750: 001965.SZ | C750: 招商公路 | E750: 0.68220000000000003 | F750: 0.84099999999999997 | G750: 1.3333000000000002 | H750: 0.96299999999999997 | I750: 1.1281999999999999 | J750: 0.13109999999999999 | K750: 0.10710000000000001 | L750: 3.7699999999999997e-02 | M750: 0.28920000000000001 | N750: 0.1014 | O750: -0.4839 | P750: -0.36359999999999998 | Q750: -0.43930000000000002 | R750: 0.48680000000000001 | S750: 0.8125 | T750: 0.48570000000000002 | U750: 0.38329999999999997 | V750: -4.4199999999999996e-02 | W750: 0.13789999999999999 | X750: 0.17309999999999998 | Y750: 1.2e-02 | AA750: =(N750+O750+P750+Q750+R750+S750+T750+U750+V750+W750+X750+Y750)/12 -> 0.10514166666666667 | AB750: =(G750+H750+I750+J750+K750+L750+M750+N750+O750+P750+Q750+R750+S750+T750+U750+V750+W750+X750+Y750)/19 -> 0.27638421052631579 | AC750: =(R750+S750)/2 -> 0.64965000000000006 | AD750: =(S750+T750)/2 -> 0.64910000000000001 | AE750: =(T750+U750)/2 -> 0.4345 | AF750: =(U750+V750)/2 -> 0.16954999999999998 | AG750: =(V750+W750)/2 -> 4.6850000000000003e-02 | AH750: =(W750+X750)/2 -> 0.15549999999999997 | AI750: =(X750+Y750)/2 -> 9.2549999999999993e-02 | AJ750: =STDEV(G750:Y750) -> 0.50226677424912347
B751: 600894.SH | C751: 广日股份
B752: 000719.SZ | C752: 中原传媒 | E752: 0.35039999999999999 | F752: 0.93999999999999995 | G752: 0 | H752: 3.2300000000000002e-02 | I752: 2.2200000000000001e-02 | J752: 3.0299999999999997e-02 | K752: -0.11109999999999999 | L752: 6.25e-02 | M752: 4.3499999999999997e-02 | N752: 5.8799999999999998e-02 | O752: 0.125 | P752: 5.8799999999999998e-02 | Q752: 8.3299999999999999e-02 | R752: 0.125 | S752: -0.11109999999999999 | T752: 0.11109999999999999 | U752: 9.6199999999999994e-02 | V752: 0.1235 | W752: 0.125 | X752: 7.4999999999999997e-02 | Y752: 8.77e-02 | AA752: =(N752+O752+P752+Q752+R752+S752+T752+U752+V752+W752+X752+Y752)/12 -> 7.9858333333333323e-02 | AB752: =(G752+H752+I752+J752+K752+L752+M752+N752+O752+P752+Q752+R752+S752+T752+U752+V752+W752+X752+Y752)/19 -> 5.4631578947368413e-02 | AC752: =(R752+S752)/2 -> 6.9500000000000048e-03 | AD752: =(S752+T752)/2 -> 0 | AE752: =(T752+U752)/2 -> 0.10364999999999999 | AF752: =(U752+V752)/2 -> 0.10985 | AG752: =(V752+W752)/2 -> 0.12425 | AH752: =(W752+X752)/2 -> 0.10000000000000001 | AI752: =(X752+Y752)/2 -> 8.1350000000000006e-02 | AJ752: =STDEV(G752:Y752) -> 6.9572712184460317e-02
B753: 002335.SZ | C753: 科华数据 | G753: 0 | H753: 5.0587999999999997 | I753: 2.25 | J753: 1.3134000000000001 | K753: 0.10000000000000001 | L753: -0.71840000000000004 | M753: -0.69230000000000003 | N753: -0.82579999999999998 | O753: 9.0899999999999995e-02 | P753: 0.13789999999999999 | Q753: -0.27500000000000002 | R753: 0.66670000000000007 | S753: -0.5 | T753: -0.30299999999999999 | U753: 0.93099999999999994 | V753: 0.84439999999999993 | W753: 2.5 | X753: 0.73909999999999998 | Y753: 0.10710000000000001 | AA753: =(N753+O753+P753+Q753+R753+S753+T753+U753+V753+W753+X753+Y753)/12 -> 0.342775 | AB753: =(G753+H753+I753+J753+K753+L753+M753+N753+O753+P753+Q753+R753+S753+T753+U753+V753+W753+X753+Y753)/19 -> 0.60130526315789468 | AC753: =(R753+S753)/2 -> 8.3350000000000035e-02 | AD753: =(S753+T753)/2 -> -0.40149999999999997 | AE753: =(T753+U753)/2 -> 0.31399999999999995 | AF753: =(U753+V753)/2 -> 0.88769999999999993 | AG753: =(V753+W753)/2 -> 1.6721999999999999 | AH753: =(W753+X753)/2 -> 1.61955 | AI753: =(X753+Y753)/2 -> 0.42309999999999998 | AJ753: =STDEV(G753:Y753) -> 1.4234781700209933
B754: 002847.SZ | C754: 盐津铺子
B755: 002922.SZ | C755: 伊戈尔 | J755: 9.7200000000000009e-02 | K755: -0.94389999999999996 | L755: -0.66670000000000007 | M755: -0.54849999999999999 | N755: -0.59489999999999998 | O755: 0.45539999999999997 | P755: 7.690000000000001e-02 | Q755: 1.9099999999999999e-02 | R755: 0.34369999999999995 | S755: -2.6258999999999997 | T755: -0.21429999999999999 | U755: -0.1198 | V755: -0.1628 | W755: 29.0335 | X755: 3.3635999999999999 | Y755: 1.6957 | AA755: =(N755+O755+P755+Q755+R755+S755+T755+U755+V755+W755+X755+Y755)/12 -> 2.6058499999999998 | AB755: =(G755+H755+I755+J755+K755+L755+M755+N755+O755+P755+Q755+R755+S755+T755+U755+V755+W755+X755+Y755)/19 -> 1.537278947368421 | AC755: =(R755+S755)/2 -> -1.1410999999999998 | AD755: =(S755+T755)/2 -> -1.4200999999999999 | AE755: =(T755+U755)/2 -> -0.16705 | AF755: =(U755+V755)/2 -> -0.14130000000000001 | AG755: =(V755+W755)/2 -> 14.43535 | AH755: =(W755+X755)/2 -> 16.198550000000001 | AI755: =(X755+Y755)/2 -> 2.5296500000000002 | AJ755: =STDEV(G755:Y755) -> 7.3626381007732773
B756: 002979.SZ | C756: 雷赛智能 | R756: 0.14999999999999999 | S756: 1.069 | T756: 0.23329999999999998 | U756: 0.20000000000000001 | V756: 0.30430000000000001 | W756: 0.66670000000000007 | X756: 0.18920000000000001 | Y756: 0.14810000000000001 | AA756: =(N756+O756+P756+Q756+R756+S756+T756+U756+V756+W756+X756+Y756)/12 -> 0.24671666666666667 | AB756: =(G756+H756+I756+J756+K756+L756+M756+N756+O756+P756+Q756+R756+S756+T756+U756+V756+W756+X756+Y756)/19 -> 0.15582105263157894 | AC756: =(R756+S756)/2 -> 0.60949999999999993 | AD756: =(S756+T756)/2 -> 0.65115000000000001 | AE756: =(T756+U756)/2 -> 0.21665000000000001 | AF756: =(U756+V756)/2 -> 0.25214999999999999 | AG756: =(V756+W756)/2 -> 0.48550000000000004 | AH756: =(W756+X756)/2 -> 0.42795000000000005 | AI756: =(X756+Y756)/2 -> 0.16865000000000002 | AJ756: =STDEV(G756:Y756) -> 0.32925532320243944
B757: 003022.SZ | C757: 联泓新科 | T757: -0.25929999999999997 | U757: -0.22920000000000001 | V757: 0.2167 | W757: 1.3636000000000001 | X757: 1.05 | Y757: 0.67569999999999997 | AA757: =(N757+O757+P757+Q757+R757+S757+T757+U757+V757+W757+X757+Y757)/12 -> 0.23479166666666665 | AB757: =(G757+H757+I757+J757+K757+L757+M757+N757+O757+P757+Q757+R757+S757+T757+U757+V757+W757+X757+Y757)/19 -> 0.14828947368421053 | AC757: =(R757+S757)/2 -> 0 | AD757: =(S757+T757)/2 -> -0.12964999999999999 | AE757: =(T757+U757)/2 -> -0.24424999999999999 | AF757: =(U757+V757)/2 -> -6.2500000000000056e-03 | AG757: =(V757+W757)/2 -> 0.79015000000000013 | AH757: =(W757+X757)/2 -> 1.2068000000000001 | AI757: =(X757+Y757)/2 -> 0.86285000000000001 | AJ757: =STDEV(G757:Y757) -> 0.67262953077207865
B758: 600315.SH | C758: 上海家化 | G758: -0.10529999999999999 | H758: -0.38179999999999997 | I758: -0.23440000000000003 | J758: 0.93330000000000002 | K758: 0.29410000000000003 | L758: 0.38240000000000002 | M758: 0.38780000000000003 | N758: 0.39659999999999995 | O758: 0.59089999999999998 | P758: 0.40429999999999999 | Q758: 0.19120000000000001 | R758: 2.4700000000000003e-02 | S758: -0.48570000000000002 | T758: -0.59089999999999998 | U758: -0.43209999999999998 | V758: -0.22889999999999999 | W758: 0.38890000000000002 | X758: 0.55559999999999998 | Y758: 0.3478 | AA758: =(N758+O758+P758+Q758+R758+S758+T758+U758+V758+W758+X758+Y758)/12 -> 9.6866666666666656e-02 | AB758: =(G758+H758+I758+J758+K758+L758+M758+N758+O758+P758+Q758+R758+S758+T758+U758+V758+W758+X758+Y758)/19 -> 0.1283421052631579 | AC758: =(R758+S758)/2 -> -0.23050000000000001 | AD758: =(S758+T758)/2 -> -0.5383 | AE758: =(T758+U758)/2 -> -0.51149999999999995 | AF758: =(U758+V758)/2 -> -0.33050000000000002 | AG758: =(V758+W758)/2 -> 8.0000000000000016e-02 | AH758: =(W758+X758)/2 -> 0.47225 | AI758: =(X758+Y758)/2 -> 0.45169999999999999 | AJ758: =STDEV(G758:Y758) -> 0.425907885601504
B759: 600510.SH | C759: 黑牡丹 | E759: 0.38650000000000001 | F759: 0.62 | G759: -0.16 | H759: 0.34289999999999998 | I759: -0.28570000000000001 | J759: -0.30769999999999997 | K759: -0.47619999999999996 | L759: 0.34039999999999998 | M759: -0.47619999999999996 | N759: 0.34039999999999998 | O759: 0 | P759: 2 | Q759: 4.5455000000000005 | R759: 0.20629999999999998 | S759: 3.2000000000000002 | T759: 0.29630000000000001 | U759: 0.14749999999999999 | V759: 3.95e-02 | W759: 0 | X759: 0.42859999999999998 | Y759: -0.1143 | AA759: =(N759+O759+P759+Q759+R759+S759+T759+U759+V759+W759+X759+Y759)/12 -> 0.92415000000000014 | AB759: =(G759+H759+I759+J759+K759+L759+M759+N759+O759+P759+Q759+R759+S759+T759+U759+V759+W759+X759+Y759)/19 -> 0.52985789473684219 | AC759: =(R759+S759)/2 -> 1.7031500000000002 | AD759: =(S759+T759)/2 -> 1.7481500000000001 | AE759: =(T759+U759)/2 -> 0.22189999999999999 | AF759: =(U759+V759)/2 -> 9.35e-02 | AG759: =(V759+W759)/2 -> 1.975e-02 | AH759: =(W759+X759)/2 -> 0.21429999999999999 | AI759: =(X759+Y759)/2 -> 0.15714999999999998 | AJ759: =STDEV(G759:Y759) -> 1.3106937430722154
B760: 600765.SH | C760: 中航重机 | E760: 0.505 | F760: 0.57899999999999996 | G760: 0 | H760: 0.55559999999999998 | I760: 0.5 | J760: -0.3226 | K760: -0.33329999999999999 | L760: -0.35710000000000003 | M760: 0.28570000000000001 | N760: 1.0476000000000001 | O760: 0 | P760: 0.44439999999999996 | Q760: -3.7000000000000005e-02 | R760: -0.18600000000000003 | S760: 0 | T760: 0 | U760: 0.11539999999999999 | V760: 5.7099999999999998e-02 | W760: 1 | X760: 1.2307999999999999 | Y760: 1.1379000000000001 | AA760: =(N760+O760+P760+Q760+R760+S760+T760+U760+V760+W760+X760+Y760)/12 -> 0.40084999999999998 | AB760: =(G760+H760+I760+J760+K760+L760+M760+N760+O760+P760+Q760+R760+S760+T760+U760+V760+W760+X760+Y760)/19 -> 0.27044736842105266 | AC760: =(R760+S760)/2 -> -9.3000000000000013e-02 | AD760: =(S760+T760)/2 -> 0 | AE760: =(T760+U760)/2 -> 5.7699999999999994e-02 | AF760: =(U760+V760)/2 -> 8.6249999999999993e-02 | AG760: =(V760+W760)/2 -> 0.52854999999999996 | AH760: =(W760+X760)/2 -> 1.1153999999999999 | AI760: =(X760+Y760)/2 -> 1.18435 | AJ760: =STDEV(G760:Y760) -> 0.51372749193021805 | AK760: -0.16639999999999999 | AL760: -4.87e-02 | AM760: -3.56e-02 | AN760: 7.8e-02 | AO760: 5.1299999999999998e-02 | AP760: -0.1202 | AQ760: -5.1500000000000004e-02 | AR760: -0.1699 | AS760: 0.20499999999999999 | AT760: -5.4000000000000003e-03 | AU760: 1.18e-02 | AV760: 0.21820000000000001 | AW760: 3.6499999999999998e-02 | AX760: 0.19579999999999997 | AY760: 0.14130000000000001 | AZ760: 0.14429999999999998 | BA760: 0.4778 | BB760: 0.66189999999999993 | BC760: 0.63290000000000002 | BE760: =(AR760+AS760+AT760+AU760+AV760+AW760+AX760+AY760+AZ760+BA760+BB760+BC760)/12 -> 0.21251666666666666 | BF760: =(AK760+AL760+AM760+AN760+AO760+AP760+AQ760+AR760+AS760+AT760+AU760+AV760+AV760+AW760+AX760+AY760+AZ760+BA760+BB760+BC760)/19 -> 0.13027894736842105 | BG760: =(AV760+AW760)/2 -> 0.12734999999999999 | BH760: =(AW760+AX760)/2 -> 0.11614999999999999 | BI760: =(AX760+AY760)/2 -> 0.16854999999999998 | BJ760: =(AY760+AZ760)/2 -> 0.14279999999999998 | BK760: =(AZ760+BA760)/2 -> 0.31104999999999999 | BL760: =(BA760+BB760)/2 -> 0.56984999999999997 | BM760: =(BB760+BC760)/2 -> 0.64739999999999998 | BN760: =STDEV(AK760:BC760) -> 0.24210970533046516
B761: 603037.SH | C761: 凯众股份
B762: 603181.SH | C762: 皇马科技 | E762: 0.27339999999999998 | F762: 0.62 | J762: 0.48330000000000001 | K762: -0.1429 | L762: -0.3095 | M762: -0.22219999999999998 | N762: -0.21350000000000002 | O762: 0.11109999999999999 | P762: 0.44829999999999998 | Q762: -8.1600000000000006e-02 | R762: -0.10000000000000001 | S762: -0.25 | T762: -0.1429 | U762: -8.8900000000000007e-02 | V762: 0.254 | W762: 0.33329999999999999 | X762: 0.41670000000000001 | Y762: 0.51219999999999999 | AA762: =(N762+O762+P762+Q762+R762+S762+T762+U762+V762+W762+X762+Y762)/12 -> 9.9891666666666656e-02 | AB762: =(G762+H762+I762+J762+K762+L762+M762+N762+O762+P762+Q762+R762+S762+T762+U762+V762+W762+X762+Y762)/19 -> 5.3021052631578948e-02 | AC762: =(R762+S762)/2 -> -0.17499999999999999 | AD762: =(S762+T762)/2 -> -0.19645000000000001 | AE762: =(T762+U762)/2 -> -0.1159 | AF762: =(U762+V762)/2 -> 8.2549999999999998e-02 | AG762: =(V762+W762)/2 -> 0.29364999999999997 | AH762: =(W762+X762)/2 -> 0.375 | AI762: =(X762+Y762)/2 -> 0.46445000000000003 | AJ762: =STDEV(G762:Y762) -> 0.29593998462526144 | AL762: 0.22940000000000002 | AM762: 0.16750000000000001 | AN762: -0.23180000000000001 | AO762: -0.34439999999999998 | AP762: -0.19789999999999999 | AQ762: -0.17989999999999998 | AR762: 0.1578 | AS762: 0.12960000000000002 | AT762: -2.6699999999999998e-02 | AU762: -1.4499999999999999e-02 | AV762: -3.2000000000000001e-02 | AW762: -0.21840000000000001 | AX762: -9.01e-02 | AY762: -9.1600000000000001e-02 | AZ762: -1.72e-02 | BA762: 0.46479999999999999 | BB762: 0.43590000000000001 | BC762: 0.20629999999999998 | BE762: =(AR762+AS762+AT762+AU762+AV762+AW762+AX762+AY762+AZ762+BA762+BB762+BC762)/12 -> 7.5324999999999989e-02 | BF762: =(AK762+AL762+AM762+AN762+AO762+AP762+AQ762+AR762+AS762+AT762+AU762+AV762+AV762+AW762+AX762+AY762+AZ762+BA762+BB762+BC762)/19 -> 1.6568421052631576e-02 | BG762: =(AV762+AW762)/2 -> -0.12520000000000001 | BH762: =(AW762+AX762)/2 -> -0.15425 | BI762: =(AX762+AY762)/2 -> -9.085e-02 | BJ762: =(AY762+AZ762)/2 -> -5.4400000000000004e-02 | BK762: =(AZ762+BA762)/2 -> 0.2238 | BL762: =(BA762+BB762)/2 -> 0.45035000000000003 | BM762: =(BB762+BC762)/2 -> 0.3211 | BN762: =STDEV(AK762:BC762) -> 0.22682263088667531
B763: 605088.SH | C763: 冠盛股份
B764: 600420.SH | C764: 国药现代
B765: 000488.SZ | C765: 晨鸣纸业
B766: 600850.SH | C766: 电科数字
B767: 000913.SZ | C767: 钱江摩托
B768: 003008.SZ | C768: 开普检测
B769: 600528.SH | C769: 中铁工业
B770: 601128.SH | C770: 常熟银行 | F770: 0.80000000000000004 | G770: 0 | H770: 0 | I770: 2.5600000000000001e-02 | J770: 0.1176 | K770: 0.21429999999999999 | L770: 0.23079999999999998 | M770: 0.25 | N770: 0.1754 | O770: 0.17649999999999999 | P770: 9.3699999999999992e-02 | Q770: 8.0000000000000002e-02 | R770: 2.9900000000000003e-02 | S770: -5.0000000000000003e-02 | T770: -8.5699999999999998e-02 | U770: -5.5599999999999997e-02 | V770: -4.3499999999999997e-02 | W770: 0 | X770: 0.15620000000000001 | Y770: 0.1961 | AA770: =(N770+O770+P770+Q770+R770+S770+T770+U770+V770+W770+X770+Y770)/12 -> 5.6083333333333339e-02 | AB770: =(G770+H770+I770+J770+K770+L770+M770+N770+O770+P770+Q770+R770+S770+T770+U770+V770+W770+X770+Y770)/19 -> 7.9542105263157858e-02 | AC770: =(R770+S770)/2 -> -1.005e-02 | AD770: =(S770+T770)/2 -> -6.7849999999999994e-02 | AE770: =(T770+U770)/2 -> -7.0649999999999991e-02 | AF770: =(U770+V770)/2 -> -4.9549999999999997e-02 | AG770: =(V770+W770)/2 -> -2.1749999999999999e-02 | AH770: =(W770+X770)/2 -> 7.8100000000000003e-02 | AI770: =(X770+Y770)/2 -> 0.17615 | AJ770: =STDEV(G770:Y770) -> 0.10843306340672149 | AK770: 0.16690000000000002 | AL770: -0.29020000000000001 | AM770: -0.58950000000000002 | AN770: -0.57940000000000003 | AO770: 1.3028 | AP770: 1.9765999999999999 | AQ770: 4.2549000000000001 | AR770: 2.5427 | AS770: -0.17600000000000002 | AT770: -0.3256 | AU770: -5.0300000000000004e-02 | AV770: 0.46600000000000003 | AW770: -3.56e-02 | AX770: 0.56310000000000004 | AY770: 0.21420000000000003 | AZ770: 4.7599999999999996e-02 | BA770: 1.0232999999999999 | BB770: 0.15390000000000001 | BC770: 0.1164 | BE770: =(AR770+AS770+AT770+AU770+AV770+AW770+AX770+AY770+AZ770+BA770+BB770+BC770)/12 -> 0.37830833333333325 | BF770: =(AK770+AL770+AM770+AN770+AO770+AP770+AQ770+AR770+AS770+AT770+AU770+AV770+AV770+AW770+AX770+AY770+AZ770+BA770+BB770+BC770)/19 -> 0.59198947368421051 | BG770: =(AV770+AW770)/2 -> 0.2152 | BH770: =(AW770+AX770)/2 -> 0.26375000000000004 | BI770: =(AX770+AY770)/2 -> 0.38865000000000005 | BJ770: =(AY770+AZ770)/2 -> 0.13090000000000002 | BK770: =(AZ770+BA770)/2 -> 0.53544999999999998 | BL770: =(BA770+BB770)/2 -> 0.5885999999999999 | BM770: =(BB770+BC770)/2 -> 0.13514999999999999 | BN770: =STDEV(AK770:BC770) -> 1.2169701805031699
B771: 601163.SH | C771: 三角轮胎
B772: 603112.SH | C772: 华翔股份 | T772: 0.20000000000000001 | U772: 0.37929999999999997 | V772: 0.36170000000000002 | W772: 0.41670000000000001 | X772: 0.54170000000000007 | Y772: 0.52500000000000002 | AA772: =(T772+U772+V772+W772+X772+Y772)/6 -> 0.40406666666666663 | AB772: =(T772+U772+V772+W772+X772+Y772)/6 -> 0.40406666666666663 | AC772: =(R772+S772)/2 -> 0 | AD772: =(S772+T772)/2 -> 0.10000000000000001 | AE772: =(T772+U772)/2 -> 0.28964999999999996 | AF772: =(U772+V772)/2 -> 0.3705 | AG772: =(V772+W772)/2 -> 0.38919999999999999 | AH772: =(W772+X772)/2 -> 0.47920000000000007 | AI772: =(X772+Y772)/2 -> 0.53334999999999999 | AJ772: =STDEV(G772:Y772) -> 0.12472283939466208 | AX772: 0.1009 | AY772: 0.16639999999999999 | AZ772: 9.0999999999999998e-02 | BA772: 0.28939999999999999 | BB772: 0.14810000000000001 | BC772: 0.27729999999999999 | BE772: =(AR772+AS772+AT772+AU772+AV772+AW772+AX772+AY772+AZ772+BA772+BB772+BC772)/12 -> 8.9424999999999991e-02 | BF772: =(AK772+AL772+AM772+AN772+AO772+AP772+AQ772+AR772+AS772+AT772+AU772+AV772+AV772+AW772+AX772+AY772+AZ772+BA772+BB772+BC772)/19 -> 5.6478947368421052e-02 | BI772: =(AX772+AY772)/2 -> 0.13364999999999999 | BJ772: =(AY772+AZ772)/2 -> 0.12869999999999998 | BK772: =(AZ772+BA772)/2 -> 0.19019999999999998 | BL772: =(BA772+BB772)/2 -> 0.21875 | BM772: =(BB772+BC772)/2 -> 0.2127 | BN772: =STDEV(AX772:BC772) -> 8.5799877622290341e-02
B773: 603360.SH | C773: 百傲化学
B774: 603967.SH | C774: 中创物流
B775: 605086.SH | C775: 龙高股份 | V775: -8.14e-02 | W775: 1.2726999999999999 | X775: 0.43329999999999996 | Y775: 0.24489999999999998 | AA775: =(N775+O775+P775+Q775+R775+S775+T775+U775+V775+W775+X775+Y775)/12 -> 0.15579166666666666 | AB775: =(G775+H775+I775+J775+K775+L775+M775+N775+O775+P775+Q775+R775+S775+T775+U775+V775+W775+X775+Y775)/19 -> 9.8394736842105257e-02 | AC775: =(R775+S775)/2 -> 0 | AD775: =(S775+T775)/2 -> 0 | AE775: =(T775+U775)/2 -> 0 | AF775: =(U775+V775)/2 -> -4.07e-02 | AG775: =(V775+W775)/2 -> 0.59565000000000001 | AH775: =(W775+X775)/2 -> 0.85299999999999998 | AI775: =(X775+Y775)/2 -> 0.33909999999999996 | AJ775: =STDEV(G775:Y775) -> 0.57745377520629304
B776: 605296.SH | C776: 神农集团 | V776: 1.3938999999999999 | W776: -8.4199999999999997e-02 | X776: -0.43430000000000002 | Y776: -0.76540000000000008 | AA776: =(N776+O776+P776+Q776+R776+S776+T776+U776+V776+W776+X776+Y776)/12 -> 9.1666666666666476e-03 | AB776: =(G776+H776+I776+J776+K776+L776+M776+N776+O776+P776+Q776+R776+S776+T776+U776+V776+W776+X776+Y776)/19 -> 5.7894736842105136e-03 | AC776: =(R776+S776)/2 -> 0 | AD776: =(S776+T776)/2 -> 0 | AE776: =(T776+U776)/2 -> 0 | AF776: =(U776+V776)/2 -> 0.69694999999999996 | AG776: =(V776+W776)/2 -> 0.65484999999999993 | AH776: =(W776+X776)/2 -> -0.25924999999999998 | AI776: =(X776+Y776)/2 -> -0.59984999999999999 | AJ776: =STDEV(G776:Y776) -> 0.95244868628183854
B777: 600704.SH | C777: 物产中大
B778: 605128.SH | C778: 上海沿浦 | T778: -9.2600000000000002e-02 | U778: -0.15689999999999998 | V778: -0.1497 | W778: 0.52349999999999997 | X778: -2.2400000000000003e-02 | Y778: -0.29189999999999999 | AA778: =(N778+O778+P778+Q778+R778+S778+T778+U778+V778+W778+X778+Y778)/12 -> -1.5833333333333335e-02 | AB778: =(G778+H778+I778+J778+K778+L778+M778+N778+O778+P778+Q778+R778+S778+T778+U778+V778+W778+X778+Y778)/19 -> -1.0000000000000002e-02 | AC778: =(R778+S778)/2 -> 0 | AD778: =(S778+T778)/2 -> -4.6300000000000001e-02 | AE778: =(T778+U778)/2 -> -0.12475 | AF778: =(U778+V778)/2 -> -0.15329999999999999 | AG778: =(V778+W778)/2 -> 0.18689999999999998 | AH778: =(W778+X778)/2 -> 0.25054999999999999 | AI778: =(X778+Y778)/2 -> -0.15715000000000001 | AJ778: =STDEV(G778:Y778) -> 0.28612773837338218
B779: 002221.SZ | C779: 东华能源
B780: 002674.SZ | C780: 兴业科技
B781: 002880.SZ | C781: 卫光生物
B782: 002507.SZ | C782: 涪陵榨菜
B783: 601038.SH | C783: 一拖股份
B784: 002416.SZ | C784: 爱施德
B785: 000528.SZ | C785: 柳工
B786: 002422.SZ | C786: 科伦药业
B787: 002972.SZ | C787: 科安达 | E787: 0.11699999999999999 | F787: 0.59999999999999998 | J787: 0.40479999999999999 | K787: 1.2 | L787: 0.2727 | M787: 0.2581 | N787: 0.22030000000000002 | O787: 9.0899999999999995e-02 | P787: 0.35710000000000003 | Q787: 0.69230000000000003 | R787: 0.30559999999999998 | S787: -8.3299999999999999e-02 | T787: -2.63e-02 | U787: -0.2273 | V787: -0.17019999999999999 | W787: 0.36359999999999998 | X787: 0.11890000000000001 | Y787: 0.17649999999999999 | AA787: =(N787+O787+P787+Q787+R787+S787+T787+U787+V787+W787+X787+Y787)/12 -> 0.15150833333333336 | AB787: =(G787+H787+I787+J787+K787+L787+M787+N787+O787+P787+Q787+R787+S787+T787+U787+V787+W787+X787+Y787)/19 -> 0.20808947368421052 | AC787: =(R787+S787)/2 -> 0.11115 | AD787: =(S787+T787)/2 -> -5.4800000000000001e-02 | AE787: =(T787+U787)/2 -> -0.1268 | AF787: =(U787+V787)/2 -> -0.19874999999999998 | AG787: =(V787+W787)/2 -> 9.6699999999999994e-02 | AH787: =(W787+X787)/2 -> 0.24124999999999999 | AI787: =(X787+Y787)/2 -> 0.1477 | AJ787: =STDEV(G787:Y787) -> 0.34550487207129221
B788: 600061.SH | C788: 国投资本
B789: 600459.SH | C789: 贵研铂业 | E789: 0.65959999999999996 | F789: 0.57699999999999996 | G789: 0.83330000000000004 | H789: 0.4375 | I789: 0.54549999999999998 | J789: 9.3700000000000006e-02 | K789: -0.45450000000000002 | L789: -4.3499999999999997e-02 | M789: 2.9399999999999999e-02 | N789: 0.31430000000000002 | O789: 0.66669999999999996 | P789: 0.31819999999999998 | Q789: 0.1143 | R789: 0.21740000000000001 | S789: 2.1000000000000001 | T789: 0.72409999999999997 | U789: 0.69230000000000003 | V789: 0.33929999999999999 | W789: 0.2581 | X789: 8.0000000000000002e-02 | Y789: -9.0899999999999995e-02 | AA789: =(N789+O789+P789+Q789+R789+S789+T789+U789+V789+W789+X789+Y789)/12 -> 0.47781666666666661 | AB789: =(G789+H789+I789+J789+K789+L789+M789+N789+O789+P789+Q789+R789+S789+T789+U789+V789+W789+X789+Y789)/19 -> 0.37764210526315783 | AC789: =(R789+S789)/2 -> 1.1587000000000001 | AD789: =(S789+T789)/2 -> 1.41205 | AE789: =(T789+U789)/2 -> 0.70819999999999994 | AF789: =(U789+V789)/2 -> 0.51580000000000004 | AG789: =(V789+W789)/2 -> 0.29869999999999997 | AH789: =(W789+X789)/2 -> 0.16905000000000001 | AI789: =(X789+Y789)/2 -> -5.4499999999999965e-03 | AJ789: =STDEV(G789:Y789) -> 0.52739765654452342 | BA789: 0.26850000000000002 | BB789: 0.42270000000000002 | BC789: 0.34570000000000001 | BO789: 37757 | BS789: 5.9119999999999999 | BT789: 5.6900000000000004 | CB789: 11 | CC789: 持续减少(由53家减少到12家，再减少到11家) | CD789: 持续减少（由53.98%减少到48.64%，再减少到3.7%） | CI789: 3.4100000000000001 | CJ789: =CI789/BS789 -> 0.57679296346414077 | CK789: 不宜进入(虽然销售仍比较强劲，但利润持续下滑，机构数量和持有份额都同时减少，可能表明公司未来业绩有下滑下滑趋势,不宜持有) | CL789: 44601
B790: 600875.SH | C790: 东方电气 | E790: 0.6581999999999999 | F790: 0.59799999999999998 | G790: 34 | H790: 2.0667 | I790: 1.4347999999999999 | J790: 1.4474 | K790: 0.1429 | L790: 6.25e-02 | M790: 0.5 | N790: 8.8200000000000001e-02 | O790: 0.42499999999999999 | P790: 0.4118 | Q790: 0.1333 | R790: 0.1081 | S790: 0.114 | T790: 0.29170000000000001 | U790: 0.26469999999999999 | V790: 0.46340000000000003 | W790: 0.59840000000000004 | X790: 0.3871 | Y790: 0.39529999999999998 | AA790: =(N790+O790+P790+Q790+R790+S790+T790+U790+V790+W790+X790+Y790)/12 -> 0.30675000000000002 | AB790: =(G790+H790+I790+J790+K790+L790+M790+N790+O790+P790+Q790+R790+S790+T790+U790+V790+W790+X790+Y790)/19 -> 2.2808052631578937 | AC790: =(R790+S790)/2 -> 0.11105000000000001 | AD790: =(S790+T790)/2 -> 0.20285 | AE790: =(T790+U790)/2 -> 0.2782 | AF790: =(U790+V790)/2 -> 0.36404999999999998 | AG790: =(V790+W790)/2 -> 0.53090000000000004 | AH790: =(W790+X790)/2 -> 0.49275000000000002 | AI790: =(X790+Y790)/2 -> 0.39119999999999999 | AJ790: =STDEV(G790:Y790) -> 7.7002681504876964
B791: 601311.SH | C791: 骆驼股份 | E791: 0.32500000000000001 | F791: 0.59999999999999998 | G791: 0 | H791: 8.6999999999999994e-02 | I791: 5.2600000000000001e-02 | J791: -6.5599999999999992e-02 | K791: 0.25 | L791: 0.32000000000000001 | M791: 0.125 | N791: 0.1404 | O791: 0.26669999999999999 | P791: 9.0899999999999995e-02 | Q791: -0.15560000000000002 | R791: -0.18460000000000001 | S791: -0.68420000000000003 | T791: -0.38890000000000002 | U791: 5.2600000000000001e-02 | V791: 0.22640000000000002 | W791: 3.1667000000000001 | X791: 1.0454999999999999 | Y791: 0.5 | AA791: =(N791+O791+P791+Q791+R791+S791+T791+U791+V791+W791+X791+Y791)/12 -> 0.33965833333333334 | AB791: =(G791+H791+I791+J791+K791+L791+M791+N791+O791+P791+Q791+R791+S791+T791+U791+V791+W791+X791+Y791)/19 -> 0.25499473684210527 | AC791: =(R791+S791)/2 -> -0.43440000000000001 | AD791: =(S791+T791)/2 -> -0.53655000000000008 | AE791: =(T791+U791)/2 -> -0.16815000000000002 | AF791: =(U791+V791)/2 -> 0.13950000000000001 | AG791: =(V791+W791)/2 -> 1.69655 | AH791: =(W791+X791)/2 -> 2.1061000000000001 | AI791: =(X791+Y791)/2 -> 0.77274999999999994 | AJ791: =STDEV(G791:Y791) -> 0.78745681396483524
B792: 603081.SH | C792: 大丰实业
B793: 603179.SH | C793: 新泉股份 | G793: 1 | H793: 0.90000000000000002 | I793: 0.24210000000000001 | J793: 2.1700000000000001e-02 | K793: -0.11840000000000001 | L793: -0.114 | M793: 0.161 | N793: -0.4894 | O793: -0.3881 | P793: -0.43560000000000004 | Q793: -0.41609999999999997 | R793: -0.375 | S793: -4.8799999999999996e-02 | T793: 8.77e-02 | U793: -6.25e-02 | V793: 0.73329999999999995 | W793: 0.15380000000000002 | X793: -3.2300000000000002e-02 | Y793: 0 | AA793: =(N793+O793+P793+Q793+R793+S793+T793+U793+V793+W793+X793+Y793)/12 -> -0.10608333333333332 | AB793: =(G793+H793+I793+J793+K793+L793+M793+N793+O793+P793+Q793+R793+S793+T793+U793+V793+W793+X793+Y793)/19 -> 4.3126315789473693e-02 | AC793: =(R793+S793)/2 -> -0.21190000000000001 | AD793: =(S793+T793)/2 -> 1.9450000000000002e-02 | AE793: =(T793+U793)/2 -> 1.26e-02 | AF793: =(U793+V793)/2 -> 0.33539999999999998 | AG793: =(V793+W793)/2 -> 0.44355 | AH793: =(W793+X793)/2 -> 6.0750000000000012e-02 | AI793: =(X793+Y793)/2 -> -1.6150000000000001e-02 | AJ793: =STDEV(G793:Y793) -> 0.43183923814579334
B794: 603730.SH | C794: 岱美股份
B795: 605151.SH | C795: 西上海 | U795: 0.13159999999999999 | V795: 0.1158 | W795: 0.20000000000000001 | X795: -0.16329999999999997 | Y795: -0.30230000000000001 | AA795: =(N795+O795+P795+Q795+R795+S795+T795+U795+V795+W795+X795+Y795)/12 -> -1.5166666666666662e-03 | AB795: =(G795+H795+I795+J795+K795+L795+M795+N795+O795+P795+Q795+R795+S795+T795+U795+V795+W795+X795+Y795)/19 -> -9.5789473684210495e-04 | AC795: =(R795+S795)/2 -> 0 | AD795: =(S795+T795)/2 -> 0 | AE795: =(T795+U795)/2 -> 6.5799999999999997e-02 | AF795: =(U795+V795)/2 -> 0.1237 | AG795: =(V795+W795)/2 -> 0.15790000000000001 | AH795: =(W795+X795)/2 -> 1.8350000000000019e-02 | AI795: =(X795+Y795)/2 -> -0.23280000000000001 | AJ795: =STDEV(G795:Y795) -> 0.21720619926696386
B796: 002136.SZ | C796: 安纳达 | G796: 3.1077999999999997 | H796: 18.973499999999998 | I796: 5.5450999999999997 | J796: 2.8523000000000001 | K796: -9.8900000000000002e-02 | L796: -0.37270000000000003 | M796: -0.4647 | N796: -0.71849999999999992 | O796: -0.73109999999999997 | P796: -0.49700000000000005 | Q796: -0.40880000000000005 | R796: -0.29760000000000003 | S796: 2.0693999999999999 | T796: 0.4425 | U796: 0.29370000000000002 | V796: 1.0105999999999999 | W796: 0.28600000000000003 | X796: 1.3294999999999999 | Y796: 1.5256999999999998 | AA796: =(N796+O796+P796+Q796+R796+S796+T796+U796+V796+W796+X796+Y796)/12 -> 0.35869999999999996 | AB796: =(G796+H796+I796+J796+K796+L796+M796+N796+O796+P796+Q796+R796+S796+T796+U796+V796+W796+X796+Y796)/19 -> 1.7814105263157896 | AC796: =(R796+S796)/2 -> 0.88589999999999991 | AD796: =(S796+T796)/2 -> 1.2559499999999999 | AE796: =(T796+U796)/2 -> 0.36809999999999998 | AF796: =(U796+V796)/2 -> 0.65215000000000001 | AG796: =(V796+W796)/2 -> 0.64829999999999999 | AH796: =(W796+X796)/2 -> 0.80774999999999997 | AI796: =(X796+Y796)/2 -> 1.4276 | AJ796: =STDEV(G796:Y796) -> 4.4716503431053454 | AK796: 0.56179999999999997 | AL796: 0.5696 | AM796: 0.73060000000000003 | AN796: 0.4738 | AO796: 0.49310000000000004 | AP796: 9.01e-02 | AQ796: -7.3599999999999999e-02 | AR796: -0.17649999999999999 | AS796: -0.47520000000000001 | AT796: -0.2989 | AU796: -0.11720000000000001 | AV796: 2.9399999999999999e-02 | AW796: 0.1338 | AX796: 0.17559999999999998 | AY796: 7.22e-02 | AZ796: 0.12970000000000001 | BA796: 0.79459999999999997 | BB796: 0.57710000000000006 | BC796: 0.60929999999999995 | BE796: =(AR796+AS796+AT796+AU796+AV796+AW796+AX796+AY796+AZ796+BA796+BB796+BC796)/12 -> 0.12115833333333337 | BF796: =(AK796+AL796+AM796+AN796+AO796+AP796+AQ796+AR796+AS796+AT796+AU796+AV796+AV796+AW796+AX796+AY796+AZ796+BA796+BB796+BC796)/19 -> 0.22782631578947371 | BG796: =(AV796+AW796)/2 -> 8.1600000000000006e-02 | BH796: =(AW796+AX796)/2 -> 0.1547 | BI796: =(AX796+AY796)/2 -> 0.12389999999999998 | BJ796: =(AY796+AZ796)/2 -> 0.10095000000000001 | BK796: =(AZ796+BA796)/2 -> 0.46215000000000001 | BL796: =(BA796+BB796)/2 -> 0.68585000000000007 | BM796: =(BB796+BC796)/2 -> 0.59319999999999995 | BN796: =STDEV(AK796:BC796) -> 0.36889694372238879
B797: 600173.SH | C797: 卧龙地产 | F797: 0.59799999999999998 | G797: 0.63749999999999996 | H797: 0.80879999999999996 | I797: 2.6818 | J797: 2.9544999999999999 | K797: 3.0510999999999999 | L797: 1.0488 | M797: 0.40869999999999995 | N797: 0.84660000000000002 | O797: 0.29309999999999997 | P797: 0.25 | Q797: 6.2e-02 | R797: -8.9900000000000008e-02 | S797: -0.41149999999999998 | T797: -0.40509999999999996 | U797: -0.3644 | V797: -5.4400000000000004e-02 | W797: 0.40020000000000006 | X797: 1.6499000000000001 | Y797: 1.0434000000000001 | AA797: =(N797+O797+P797+Q797+R797+S797+T797+U797+V797+W797+X797+Y797)/12 -> 0.26832499999999998 | AB797: =(G797+H797+I797+J797+K797+L797+M797+N797+O797+P797+Q797+R797+S797+T797+U797+V797+W797+X797+Y797)/19 -> 0.77953157894736846 | AC797: =(R797+S797)/2 -> -0.25069999999999998 | AD797: =(S797+T797)/2 -> -0.4083 | AE797: =(T797+U797)/2 -> -0.38474999999999998 | AF797: =(U797+V797)/2 -> -0.2094 | AG797: =(V797+W797)/2 -> 0.17290000000000003 | AH797: =(W797+X797)/2 -> 1.02505 | AI797: =(X797+Y797)/2 -> 1.3466500000000001 | AJ797: =STDEV(G797:Y797) -> 1.0885631998457779 | AK797: -8.1699999999999995e-02 | AL797: 9.06e-02 | AM797: 0.31069999999999998 | AN797: 0.3306 | AO797: 0.32700000000000001 | AP797: 0.22519999999999998 | AQ797: 7.3499999999999996e-02 | AR797: 3.5000000000000003e-02 | AS797: 0.48530000000000001 | AT797: 0.43659999999999999 | AU797: 0.32819999999999999 | AV797: 0.1668 | AW797: -0.58189999999999997 | AX797: -0.61030000000000006 | AY797: -0.45679999999999998 | AZ797: -0.37430000000000002 | BA797: 0.54600000000000004 | BB797: 0.59530000000000005 | BC797: 4.9500000000000002e-02 | BE797: =(AR797+AS797+AT797+AU797+AV797+AW797+AX797+AY797+AZ797+BA797+BB797+BC797)/12 -> 5.1616666666666665e-02 | BF797: =(AK797+AL797+AM797+AN797+AO797+AP797+AQ797+AR797+AS797+AT797+AU797+AV797+AV797+AW797+AX797+AY797+AZ797+BA797+BB797+BC797)/19 -> 0.1085315789473684 | BG797: =(AV797+AW797)/2 -> -0.20754999999999998 | BH797: =(AW797+AX797)/2 -> -0.59610000000000007 | BI797: =(AX797+AY797)/2 -> -0.53354999999999997 | BJ797: =(AY797+AZ797)/2 -> -0.41554999999999997 | BK797: =(AZ797+BA797)/2 -> 8.585000000000001e-02 | BL797: =(BA797+BB797)/2 -> 0.5706500000000001 | BM797: =(BB797+BC797)/2 -> 0.32240000000000002 | BN797: =STDEV(AK797:BC797) -> 0.37061406456555473
B798: 600571.SH | C798: 信雅达 | E798: 0.20010000000000003 | F798: 0.59799999999999998 | G798: 3.0299999999999997e-02 | H798: -0.28570000000000001 | I798: -0.67689999999999995 | J798: -2.7143000000000002 | K798: -0.70590000000000008 | L798: -0.80000000000000004 | M798: -0.66670000000000007 | N798: 1.125 | O798: 0.10000000000000001 | P798: 0 | Q798: 9.5199999999999993e-02 | R798: 1.3333000000000002 | S798: -6.9090999999999996 | T798: -0.84999999999999998 | U798: 3.9564999999999997 | V798: 0.85709999999999997 | W798: 0.2462 | X798: 182.33330000000001 | Y798: 4.2455999999999996 | AA798: =(N798+O798+P798+Q798+R798+S798+T798+U798+V798+W798+X798+Y798)/12 -> 15.544425000000002 | AB798: =(G798+H798+I798+J798+K798+L798+M798+N798+O798+P798+Q798+R798+S798+T798+U798+V798+W798+X798+Y798)/19 -> 9.5112578947368416 | AC798: =(R798+S798)/2 -> -2.7878999999999996 | AD798: =(S798+T798)/2 -> -3.8795499999999996 | AE798: =(T798+U798)/2 -> 1.5532499999999998 | AF798: =(U798+V798)/2 -> 2.4067999999999996 | AG798: =(V798+W798)/2 -> 0.55164999999999997 | AH798: =(W798+X798)/2 -> 91.289749999999998 | AI798: =(X798+Y798)/2 -> 93.289450000000002 | AJ798: =STDEV(G798:Y798) -> 41.914000254095896 | AK798: -0.12369999999999999 | AL798: 9.9600000000000008e-02 | AM798: 7.6799999999999993e-02 | AN798: -8.3999999999999995e-03 | AO798: 7.3800000000000004e-02 | AP798: -1.23e-02 | AQ798: 0.1133 | AR798: 1.95e-02 | AS798: 8.1500000000000003e-02 | AT798: -0.1351 | AU798: -6.9699999999999998e-02 | AV798: -7.7699999999999991e-02 | AW798: -0.34840000000000004 | AX798: -0.14610000000000001 | AY798: -7.4900000000000008e-02 | AZ798: -5.9500000000000004e-02 | BA798: 0.65650000000000008 | BB798: 0.3458 | BC798: 0.22839999999999999 | BE798: =(AR798+AS798+AT798+AU798+AV798+AW798+AX798+AY798+AZ798+BA798+BB798+BC798)/12 -> 3.5025000000000008e-02 | BF798: =(AK798+AL798+AM798+AN798+AO798+AP798+AQ798+AR798+AS798+AT798+AU798+AV798+AV798+AW798+AX798+AY798+AZ798+BA798+BB798+BC798)/19 -> 2.9563157894736847e-02 | BG798: =(AV798+AW798)/2 -> -0.21305000000000002 | BH798: =(AW798+AX798)/2 -> -0.24725000000000003 | BI798: =(AX798+AY798)/2 -> -0.11050000000000001 | BJ798: =(AY798+AZ798)/2 -> -6.720000000000001e-02 | BK798: =(AZ798+BA798)/2 -> 0.29850000000000004 | BL798: =(BA798+BB798)/2 -> 0.50114999999999998 | BM798: =(BB798+BC798)/2 -> 0.28710000000000002 | BN798: =STDEV(AK798:BC798) -> 0.2132932445886051
B799: 600661.SH | C799: 昂立教育
B800: 603866.SH | C800: 桃李面包
B801: 603690.SH | C801: 至纯科技 | G801: -0.43840000000000001 | H801: -0.2157 | I801: -0.23910000000000001 | J801: -0.17929999999999999 | K801: -0.73170000000000002 | L801: -0.24170000000000003 | M801: -0.25140000000000001 | N801: -0.34869999999999995 | O801: 3.9091000000000005 | P801: 1.0548999999999999 | Q801: 1.3663999999999998 | R801: 1.9355000000000002 | S801: -2.0741000000000001 | T801: -0.36359999999999998 | U801: 3.8699999999999998e-02 | V801: 1.2263999999999999 | W801: 5.1207000000000003 | X801: 3.0167999999999999 | Y801: 0.85089999999999999 | AA801: =(N801+O801+P801+Q801+R801+S801+T801+U801+V801+W801+X801+Y801)/12 -> 1.3110833333333334 | AB801: =(G801+H801+I801+J801+K801+L801+M801+N801+O801+P801+Q801+R801+S801+T801+U801+V801+W801+X801+Y801)/19 -> 0.70714210526315791 | AC801: =(R801+S801)/2 -> -6.9299999999999917e-02 | AD801: =(S801+T801)/2 -> -1.21885 | AE801: =(T801+U801)/2 -> -0.16244999999999998 | AF801: =(U801+V801)/2 -> 0.63254999999999995 | AG801: =(V801+W801)/2 -> 3.1735500000000001 | AH801: =(W801+X801)/2 -> 4.0687499999999996 | AI801: =(X801+Y801)/2 -> 1.9338500000000001 | AJ801: =STDEV(G801:Y801) -> 1.7575093580644772
B802: 002015.SZ | C802: 协鑫能科 | E802: 7.5999999999999998e-02 | F802: 0.59499999999999997 | G802: -1.1429 | H802: 0.39020000000000005 | I802: 0.88569999999999993 | J802: 1.1845000000000001 | K802: 0.4667 | L802: 8.8559999999999999 | M802: 29.600000000000001 | N802: 12.7158 | O802: 4.0125000000000002 | P802: 9.7000000000000003e-03 | Q802: 0.39159999999999995 | R802: 0.5706 | S802: 1.7593000000000001 | T802: 0.30760000000000004 | U802: 0.48430000000000001 | V802: 0.44829999999999998 | W802: 0.72180000000000011 | X802: 0.42109999999999997 | Y802: 0.25920000000000004 | AA802: =(N802+O802+P802+Q802+R802+S802+T802+U802+V802+W802+X802+Y802)/12 -> 1.8418166666666667 | AB802: =(G802+H802+I802+J802+K802+L802+M802+N802+O802+P802+Q802+R802+S802+T802+U802+V802+W802+X802+Y802)/19 -> 3.2811578947368427 | AC802: =(R802+S802)/2 -> 1.1649500000000002 | AD802: =(S802+T802)/2 -> 1.03345 | AE802: =(T802+U802)/2 -> 0.39595000000000002 | AF802: =(U802+V802)/2 -> 0.46629999999999999 | AG802: =(V802+W802)/2 -> 0.58505000000000007 | AH802: =(W802+X802)/2 -> 0.57145000000000001 | AI802: =(X802+Y802)/2 -> 0.34015000000000001 | AJ802: =STDEV(G802:Y802) -> 7.2132598356788407 | BA802: 4.4900000000000002e-02 | BB802: 9.6300000000000011e-02 | BC802: -4.82e-02
B803: 603303.SH | C803: 得邦照明
B804: 600551.SH | C804: 时代出版
B805: 002293.SZ | C805: 罗莱生活 | E805: 0.32069999999999999 | F805: 0.58499999999999996 | G805: 7.4200000000000002e-02 | H805: 7.17e-02 | I805: 0.19409999999999999 | J805: 0.34549999999999997 | K805: 0.2853 | L805: 0.2853 | M805: 0.15659999999999999 | N805: 0.18969999999999998 | O805: -8.9700000000000002e-02 | P805: -0.15810000000000002 | Q805: -0.1517 | R805: -8.8200000000000001e-02 | S805: -0.55899999999999994 | T805: -0.19739999999999999 | U805: 8.5000000000000006e-03 | V805: 7.0599999999999996e-02 | W805: 1.5611000000000002 | X805: 0.70400000000000007 | Y805: 0.35639999999999999 | AA805: =(N805+O805+P805+Q805+R805+S805+T805+U805+V805+W805+X805+Y805)/12 -> 0.13718333333333335 | AB805: =(G805+H805+I805+J805+K805+L805+M805+N805+O805+P805+Q805+R805+S805+T805+U805+V805+W805+X805+Y805)/19 -> 0.16099473684210527 | AC805: =(R805+S805)/2 -> -0.3236 | AD805: =(S805+T805)/2 -> -0.37819999999999998 | AE805: =(T805+U805)/2 -> -9.4449999999999992e-02 | AF805: =(U805+V805)/2 -> 3.9550000000000002e-02 | AG805: =(V805+W805)/2 -> 0.81585000000000008 | AH805: =(W805+X805)/2 -> 1.1325500000000002 | AI805: =(X805+Y805)/2 -> 0.5302 | AJ805: =STDEV(G805:Y805) -> 0.43323941222388068
B806: 002921.SZ | C806: 联诚精密 | E806: 0.46990000000000004 | F806: 0.58599999999999997 | I806: -4.0500000000000001e-02 | J806: 0 | K806: -0.21739999999999998 | L806: -0.12820000000000001 | M806: -0.19699999999999998 | N806: -0.29109999999999997 | O806: 5.5599999999999997e-02 | P806: -8.8200000000000001e-02 | Q806: -0.14400000000000002 | R806: 3.5699999999999996e-02 | S806: 0 | T806: 3.61e-02 | U806: 0.2293 | V806: 0.55169999999999997 | W806: 0.84209999999999996 | X806: 0.42810000000000004 | Y806: 0.14199999999999999 | AA806: =(N806+O806+P806+Q806+R806+S806+T806+U806+V806+W806+X806+Y806)/12 -> 0.14977499999999999 | AB806: =(G806+H806+I806+J806+K806+L806+M806+N806+O806+P806+Q806+R806+S806+T806+U806+V806+W806+X806+Y806)/19 -> 6.3905263157894757e-02 | AC806: =(R806+S806)/2 -> 1.7849999999999998e-02 | AD806: =(S806+T806)/2 -> 1.805e-02 | AE806: =(T806+U806)/2 -> 0.13270000000000001 | AF806: =(U806+V806)/2 -> 0.39049999999999996 | AG806: =(V806+W806)/2 -> 0.69689999999999996 | AH806: =(W806+X806)/2 -> 0.6351 | AI806: =(X806+Y806)/2 -> 0.28505000000000003 | AJ806: =STDEV(G806:Y806) -> 0.29642302021227146
B807: 603385.SH | C807: 惠达卫浴
B808: 002440.SZ | C808: 闰土股份
B809: 002441.SZ | C809: 众业达 | E809: 0.36159999999999998 | F809: 0.58999999999999997 | G809: 1.2057 | H809: 0.4118 | I809: 0.59089999999999998 | J809: 0.37040000000000001 | K809: -0.28760000000000002 | L809: -4.1700000000000001e-02 | M809: -2.86e-02 | N809: 2.7000000000000003e-02 | O809: 0.54549999999999998 | P809: 0.21739999999999998 | Q809: 0.17649999999999999 | R809: 7.8899999999999998e-02 | S809: -5.8799999999999998e-02 | T809: 0.1429 | U809: 0.20000000000000001 | V809: 0.17069999999999999 | W809: 0.4375 | X809: 0.21879999999999999 | Y809: 0.22920000000000001 | AA809: =(N809+O809+P809+Q809+R809+S809+T809+U809+V809+W809+X809+Y809)/12 -> 0.1988 | AB809: =(G809+H809+I809+J809+K809+L809+M809+N809+O809+P809+Q809+R809+S809+T809+U809+V809+W809+X809+Y809)/19 -> 0.24244736842105261 | AC809: =(R809+S809)/2 -> 1.005e-02 | AD809: =(S809+T809)/2 -> 4.2050000000000004e-02 | AE809: =(T809+U809)/2 -> 0.17144999999999999 | AF809: =(U809+V809)/2 -> 0.18535000000000001 | AG809: =(V809+W809)/2 -> 0.30409999999999998 | AH809: =(W809+X809)/2 -> 0.32815 | AI809: =(X809+Y809)/2 -> 0.224 | AJ809: =STDEV(G809:Y809) -> 0.32023044197095357
B810: 002788.SZ | C810: 鹭燕医药
B811: 002955.SZ | C811: 鸿合科技 | E811: 0.3417 | F811: 0.58999999999999997 | N811: 0.56459999999999999 | O811: -0.10529999999999999 | P811: 9.7000000000000003e-03 | Q811: -0.56740000000000002 | R811: -0.5413 | S811: -2.2353000000000001 | T811: -1.1345999999999998 | U811: -0.80330000000000001 | V811: -0.76670000000000005 | W811: 1.1429 | X811: 1.7856999999999998 | Y811: 1.4583000000000002 | AA811: =(N811+O811+P811+Q811+R811+S811+T811+U811+V811+W811+X811+Y811)/12 -> -9.939166666666667e-02 | AB811: =(G811+H811+I811+J811+K811+L811+M811+N811+O811+P811+Q811+R811+S811+T811+U811+V811+W811+X811+Y811)/19 -> -6.2773684210526315e-02 | AC811: =(R811+S811)/2 -> -1.3883000000000001 | AD811: =(S811+T811)/2 -> -1.6849499999999999 | AE811: =(T811+U811)/2 -> -0.96894999999999998 | AF811: =(U811+V811)/2 -> -0.78500000000000003 | AG811: =(V811+W811)/2 -> 0.18809999999999999 | AH811: =(W811+X811)/2 -> 1.4642999999999999 | AI811: =(X811+Y811)/2 -> 1.6219999999999999 | AJ811: =STDEV(G811:Y811) -> 1.1663831496306967 | AR811: 0.19339999999999999 | AS811: 7.8e-02 | AT811: -7.4700000000000003e-02 | AU811: -4.99e-02 | AV811: -2.0299999999999999e-02 | AW811: -0.52410000000000001 | AX811: -0.35999999999999999 | AY811: -0.1333 | AZ811: -2.7799999999999998e-02 | BA811: 1.7138999999999998 | BB811: 1.0298 | BC811: 0.41649999999999998 | BE811: =(AR811+AS811+AT811+AU811+AV811+AW811+AX811+AY811+AZ811+BA811+BB811+BC811)/12 -> 0.18679166666666666 | BF811: =(AK811+AL811+AM811+AN811+AO811+AP811+AQ811+AR811+AS811+AT811+AU811+AV811+AV811+AW811+AX811+AY811+AZ811+BA811+BB811+BC811)/19 -> 0.11690526315789472 | BG811: =(AV811+AW811)/2 -> -0.2722 | BH811: =(AW811+AX811)/2 -> -0.44205 | BI811: =(AX811+AY811)/2 -> -0.24664999999999998 | BJ811: =(AY811+AZ811)/2 -> -8.0549999999999997e-02 | BK811: =(AZ811+BA811)/2 -> 0.84304999999999986 | BL811: =(BA811+BB811)/2 -> 1.3718499999999998 | BM811: =(BB811+BC811)/2 -> 0.72314999999999996 | BN811: =STDEV(AK811:BC811) -> 0.61993491367801634
B812: 600958.SH | C812: 东方证券
B813: 601828.SH | C813: 美凯龙
B814: 603218.SH | C814: 日月股份
B815: 603697.SH | C815: 有友食品
B816: 603825.SH | C816: 华扬联众 | E816: 0.72459999999999991 | F816: 0.58999999999999997 | H816: 15 | I816: 4 | J816: -0.23260000000000003 | K816: -0.33329999999999999 | L816: 6.25e-02 | M816: 0.55000000000000004 | N816: -0.13639999999999999 | O816: -1.5 | P816: 0.4118 | Q816: 0.19350000000000001 | R816: 0.49119999999999997 | S816: 7 | T816: 0.20829999999999999 | U816: 0.37840000000000001 | V816: 9.4100000000000003e-02 | W816: 0.33329999999999999 | X816: 0.2069 | Y816: 0.15689999999999998 | AA816: =(N816+O816+P816+Q816+R816+S816+T816+U816+V816+W816+X816+Y816)/12 -> 0.65316666666666678 | AB816: =(G816+H816+I816+J816+K816+L816+M816+N816+O816+P816+Q816+R816+S816+T816+U816+V816+W816+X816+Y816)/19 -> 1.4149789473684211 | AC816: =(R816+S816)/2 -> 3.7456 | AD816: =(S816+T816)/2 -> 3.6041500000000002 | AE816: =(T816+U816)/2 -> 0.29335 | AF816: =(U816+V816)/2 -> 0.23625000000000002 | AG816: =(V816+W816)/2 -> 0.2137 | AH816: =(W816+X816)/2 -> 0.27010000000000001 | AI816: =(X816+Y816)/2 -> 0.18190000000000001 | AJ816: =STDEV(G816:Y816) -> 3.8608739205596336
B817: 603876.SH | C817: 鼎胜新材 | E817: 0.70050000000000001 | F817: 0.54100000000000004 | J817: -0.17579999999999998 | K817: 0.77780000000000005 | L817: 3.85e-02 | M817: 0 | N817: -9.3299999999999994e-02 | O817: -0.125 | P817: -3.7000000000000005e-02 | Q817: 0 | R817: 5.8799999999999998e-02 | S817: -0.35710000000000003 | T817: -1.1154000000000002 | U817: -1.0667 | V817: -1.0417000000000001 | W817: 0.11109999999999999 | X817: 21 | Y817: 20.666700000000002 | AA817: =(N817+O817+P817+Q817+R817+S817+T817+U817+V817+W817+X817+Y817)/12 -> 3.1667000000000001 | AB817: =(G817+H817+I817+J817+K817+L817+M817+N817+O817+P817+Q817+R817+S817+T817+U817+V817+W817+X817+Y817)/19 -> 2.0337315789473687 | AC817: =(R817+S817)/2 -> -0.14915 | AD817: =(S817+T817)/2 -> -0.73625000000000007 | AE817: =(T817+U817)/2 -> -1.0910500000000001 | AF817: =(U817+V817)/2 -> -1.0542 | AG817: =(V817+W817)/2 -> -0.46530000000000005 | AH817: =(W817+X817)/2 -> 10.55555 | AI817: =(X817+Y817)/2 -> 20.833350000000003 | AJ817: =STDEV(G817:Y817) -> 7.2067839681759809 | AN817: 0.5081 | AO817: 0.1265 | AP817: 0.81430000000000002 | AQ817: 0.43030000000000002 | AR817: 0.26280000000000003 | AS817: 0.19260000000000002 | AT817: 0.2646 | AU817: 0.16089999999999999 | AV817: 2.1700000000000001e-02 | AW817: 0.21719999999999998 | AX817: 0.21249999999999999 | AY817: 8.5000000000000006e-03 | AZ817: 0.22570000000000001 | BA817: 0.1278 | BB817: 0.36759999999999998 | BC817: 0.312 | BE817: =(AR817+AS817+AT817+AU817+AV817+AW817+AX817+AY817+AZ817+BA817+BB817+BC817)/12 -> 0.197825 | BF817: =(AK817+AL817+AM817+AN817+AO817+AP817+AQ817+AR817+AS817+AT817+AU817+AV817+AV817+AW817+AX817+AY817+AZ817+BA817+BB817+BC817)/19 -> 0.22498947368421057 | BG817: =(AV817+AW817)/2 -> 0.11944999999999999 | BH817: =(AW817+AX817)/2 -> 0.21484999999999999 | BI817: =(AX817+AY817)/2 -> 0.1105 | BJ817: =(AY817+AZ817)/2 -> 0.11710000000000001 | BK817: =(AZ817+BA817)/2 -> 0.17675000000000002 | BL817: =(BA817+BB817)/2 -> 0.24769999999999998 | BM817: =(BB817+BC817)/2 -> 0.33979999999999999 | BN817: =STDEV(AK817:BC817) -> 0.19774387548459413
B818: 603979.SH | C818: 金诚信 | E818: 0.3594 | F818: 0.59299999999999997 | G818: -0.25 | H818: 5.5599999999999997e-02 | I818: 0 | J818: 0.2069 | K818: 0.44439999999999996 | L818: 0.47369999999999995 | M818: 0.35710000000000003 | N818: 0.42859999999999998 | O818: 7.690000000000001e-02 | P818: 3.5699999999999996e-02 | Q818: 5.2600000000000001e-02 | R818: 5.9999999999999998e-02 | S818: 0.1429 | T818: 0.1724 | U818: 0.17499999999999999 | V818: 0.18870000000000001 | W818: 0.3125 | X818: 0.2059 | Y818: 0.25530000000000003 | AA818: =(N818+O818+P818+Q818+R818+S818+T818+U818+V818+W818+X818+Y818)/12 -> 0.17554166666666668 | AB818: =(G818+H818+I818+J818+K818+L818+M818+N818+O818+P818+Q818+R818+S818+T818+U818+V818+W818+X818+Y818)/19 -> 0.17864210526315791 | AC818: =(R818+S818)/2 -> 0.10145 | AD818: =(S818+T818)/2 -> 0.15765000000000001 | AE818: =(T818+U818)/2 -> 0.17369999999999999 | AF818: =(U818+V818)/2 -> 0.18185000000000001 | AG818: =(V818+W818)/2 -> 0.25059999999999999 | AH818: =(W818+X818)/2 -> 0.25919999999999999 | AI818: =(X818+Y818)/2 -> 0.23060000000000003 | AJ818: =STDEV(G818:Y818) -> 0.17800003531769149
B819: 000779.SZ | C819: 甘咨询 | E819: 0.37310000000000004 | F819: 0.56999999999999995 | G819: 0.13750000000000001 | H819: 2.0556000000000001 | I819: 2.8308 | J819: 9.2884000000000011 | K819: 2.4463999999999997 | L819: 0.73680000000000012 | M819: 9.2399999999999996e-02 | N819: -0.13849999999999998 | O819: 0.45590000000000003 | P819: 0.45450000000000002 | Q819: 0.22309999999999999 | R819: 0.313 | S819: 5.2300000000000006e-02 | T819: -0.30309999999999998 | U819: -8.8800000000000004e-02 | V819: 1.67e-02 | W819: 7.000000000000001e-04 | X819: 6.4299999999999996e-02 | Y819: 1.2800000000000001e-02 | AA819: =(N819+O819+P819+Q819+R819+S819+T819+U819+V819+W819+X819+Y819)/12 -> 8.8575000000000015e-02 | AB819: =(G819+H819+I819+J819+K819+L819+M819+N819+O819+P819+Q819+R819+S819+T819+U819+V819+W819+X819+Y819)/19 -> 0.98162105263157862 | AC819: =(R819+S819)/2 -> 0.18265000000000001 | AD819: =(S819+T819)/2 -> -0.12539999999999998 | AE819: =(T819+U819)/2 -> -0.19594999999999999 | AF819: =(U819+V819)/2 -> -3.6049999999999999e-02 | AG819: =(V819+W819)/2 -> 8.6999999999999994e-03 | AH819: =(W819+X819)/2 -> 3.2500000000000001e-02 | AI819: =(X819+Y819)/2 -> 3.8550000000000001e-02 | AJ819: =STDEV(G819:Y819) -> 2.2041485608781124
B820: 600285.SH | C820: 羚锐制药 | E820: 0.39429999999999998 | F820: 0.57499999999999996 | G820: 0.24729999999999999 | H820: 0.2697 | I820: -0.44939999999999997 | J820: -0.39140000000000003 | K820: 7.7600000000000002e-02 | L820: 9.7299999999999998e-02 | M820: 0.11840000000000001 | N820: 0.1226 | O820: 0.38400000000000001 | P820: 0.2661 | Q820: 0.25069999999999998 | R820: 0.2427 | S820: -0.21969999999999998 | T820: -6.4000000000000003e-03 | U820: 5.79e-02 | V820: 0.1191 | W820: 0.25929999999999997 | X820: 0.25 | Y820: 0.2316 | AA820: =(N820+O820+P820+Q820+R820+S820+T820+U820+V820+W820+X820+Y820)/12 -> 0.16315833333333335 | AB820: =(G820+H820+I820+J820+K820+L820+M820+N820+O820+P820+Q820+R820+S820+T820+U820+V820+W820+X820+Y820)/19 -> 0.10144210526315789 | AC820: =(R820+S820)/2 -> 1.150000000000001e-02 | AD820: =(S820+T820)/2 -> -0.11304999999999998 | AE820: =(T820+U820)/2 -> 2.5749999999999999e-02 | AF820: =(U820+V820)/2 -> 8.8499999999999995e-02 | AG820: =(V820+W820)/2 -> 0.18919999999999998 | AH820: =(W820+X820)/2 -> 0.25464999999999999 | AI820: =(X820+Y820)/2 -> 0.24080000000000001 | AJ820: =STDEV(G820:Y820) -> 0.22697391753187432
B821: 600876.SH | C821: 洛阳玻璃 | E821: 0.54979999999999996 | F821: 0.50600000000000001 | G821: 27.125 | H821: 1.7250999999999999 | I821: 1.5287999999999999 | J821: 6.2283000000000008 | K821: -0.42670000000000002 | L821: 0.1096 | M821: -0.93849999999999989 | N821: -0.82310000000000005 | O821: -0.72870000000000001 | P821: -0.29370000000000002 | Q821: 17.840899999999998 | R821: 2.4463999999999997 | S821: 0.59999999999999998 | T821: 4.6600000000000003e-02 | U821: 0.97589999999999999 | V821: 5.1451000000000002 | W821: 44.803599999999996 | X821: 11.366400000000001 | Y821: 2.5683999999999996 | AA821: =(N821+O821+P821+Q821+R821+S821+T821+U821+V821+W821+X821+Y821)/12 -> 6.9956499999999986 | AB821: =(G821+H821+I821+J821+K821+L821+M821+N821+O821+P821+Q821+R821+S821+T821+U821+V821+W821+X821+Y821)/19 -> 6.2789157894736833 | AC821: =(R821+S821)/2 -> 1.5231999999999999 | AD821: =(S821+T821)/2 -> 0.32329999999999998 | AE821: =(T821+U821)/2 -> 0.51124999999999998 | AF821: =(U821+V821)/2 -> 3.0605000000000002 | AG821: =(V821+W821)/2 -> 24.974349999999998 | AH821: =(W821+X821)/2 -> 28.084999999999997 | AI821: =(X821+Y821)/2 -> 6.9673999999999996 | AJ821: =STDEV(G821:Y821) -> 11.851846494499551
B822: 002007.SZ | C822: 华兰生物
B823: 002111.SZ | C823: 威海广泰
B824: 003001.SZ | C824: 中岩大地 | T824: -0.17859999999999998 | U824: -0.20000000000000001 | V824: -0.2727 | W824: -5.8799999999999998e-02 | X824: -0.21739999999999998 | Y824: -0.36959999999999998 | AA824: =(N824+O824+P824+Q824+R824+S824+T824+U824+V824+W824+X824+Y824)/12 -> -0.10809166666666666 | AB824: =(G824+H824+I824+J824+K824+L824+M824+N824+O824+P824+Q824+R824+S824+T824+U824+V824+W824+X824+Y824)/19 -> -6.8268421052631575e-02 | AC824: =(R824+S824)/2 -> 0 | AD824: =(S824+T824)/2 -> -8.929999999999999e-02 | AE824: =(T824+U824)/2 -> -0.1893 | AF824: =(U824+V824)/2 -> -0.23635 | AG824: =(V824+W824)/2 -> -0.16575000000000001 | AH824: =(W824+X824)/2 -> -0.1381 | AI824: =(X824+Y824)/2 -> -0.29349999999999998 | AJ824: =STDEV(G824:Y824) -> 0.10312730805497963
B825: 600483.SH | C825: 福能股份
B826: 603323.SH | C826: 苏农银行 | E826: 1.06e-02 | F826: 0.64000000000000001 | G826: -0.20000000000000001 | H826: 0 | I826: 2.3300000000000001e-02 | J826: 2.0400000000000001e-02 | K826: 8.3299999999999999e-02 | L826: 6.6699999999999995e-02 | M826: 2.2700000000000001e-02 | N826: 0 | O826: -7.690000000000001e-02 | P826: 3.1300000000000001e-02 | Q826: 4.4400000000000002e-02 | R826: 2.e-02 | S826: 8.3299999999999999e-02 | T826: 0 | U826: 4.2599999999999999e-02 | V826: 3.9199999999999999e-02 | W826: 7.690000000000001e-02 | X826: 0.18179999999999999 | Y826: 0.1837 | AA826: =(N826+O826+P826+Q826+R826+S826+T826+U826+V826+W826+X826+Y826)/12 -> 5.2191666666666664e-02 | AB826: =(G826+H826+I826+J826+K826+L826+M826+N826+O826+P826+Q826+R826+S826+T826+U826+V826+W826+X826+Y826)/19 -> 3.3826315789473684e-02 | AC826: =(R826+S826)/2 -> 5.1650000000000001e-02 | AD826: =(S826+T826)/2 -> 4.165e-02 | AE826: =(T826+U826)/2 -> 2.1299999999999999e-02 | AF826: =(U826+V826)/2 -> 4.0899999999999999e-02 | AG826: =(V826+W826)/2 -> 5.8050000000000004e-02 | AH826: =(W826+X826)/2 -> 0.12934999999999999 | AI826: =(X826+Y826)/2 -> 0.18275 | AJ826: =STDEV(G826:Y826) -> 8.2794067434443522e-02 | AK826: -1.1259000000000001 | AL826: -0.44920000000000004 | AM826: -0.65680000000000005 | AN826: -0.3589 | AO826: 3.2075999999999998 | AP826: 0.64800000000000002 | AQ826: 2.7664999999999997 | AR826: 1.3191999999999999 | AS826: 4.3199000000000005 | AT826: -0.33509999999999995 | AU826: -0.18760000000000002 | AV826: -0.14730000000000001 | AW826: -0.63470000000000004 | AX826: 1.4136000000000002 | AY826: 0.26319999999999999 | AZ826: -7.7899999999999997e-02 | BA826: 10.188499999999999 | BB826: 0.2132 | BC826: 0.2145 | BE826: =(AR826+AS826+AT826+AU826+AV826+AW826+AX826+AY826+AZ826+BA826+BB826+BC826)/12 -> 1.3791250000000002 | BF826: =(AK826+AL826+AM826+AN826+AO826+AP826+AQ826+AR826+AS826+AT826+AU826+AV826+AV826+AW826+AX826+AY826+AZ826+BA826+BB826+BC826)/19 -> 1.0754473684210528 | BG826: =(AV826+AW826)/2 -> -0.39100000000000001 | BH826: =(AW826+AX826)/2 -> 0.38945000000000007 | BI826: =(AX826+AY826)/2 -> 0.83840000000000003 | BJ826: =(AY826+AZ826)/2 -> 9.2649999999999996e-02 | BK826: =(AZ826+BA826)/2 -> 5.0552999999999999 | BL826: =(BA826+BB826)/2 -> 5.20085 | BM826: =(BB826+BC826)/2 -> 0.21384999999999998 | BN826: =STDEV(AK826:BC826) -> 2.6356854948528623
B827: 603583.SH | C827: 捷昌驱动
B828: 603788.SH | C828: 宁波高发
B829: 603890.SH | C829: 春秋电子
B830: 603896.SH | C830: 寿仙谷 | E830: 0.17519999999999999 | F830: 1.3300000000000001 | G830: 0.1429 | H830: 5.7099999999999998e-02 | I830: 2.4399999999999998e-02 | J830: -7.7899999999999997e-02 | K830: 8.3299999999999999e-02 | L830: 2.7000000000000003e-02 | M830: 0 | N830: 7.0400000000000004e-02 | O830: 0.1923 | P830: -0.13159999999999999 | Q830: -4.7599999999999996e-02 | R830: 0.15789999999999998 | S830: -0.2581 | T830: -0.12119999999999999 | U830: 0.17499999999999999 | V830: 0.21590000000000001 | W830: 0.21739999999999998 | X830: 0.27589999999999998 | Y830: 0.23399999999999999 | AA830: =(N830+O830+P830+Q830+R830+S830+T830+U830+V830+W830+X830+Y830)/12 -> 8.1691666666666662e-02 | AB830: =(G830+H830+I830+J830+K830+L830+M830+N830+O830+P830+Q830+R830+S830+T830+U830+V830+W830+X830+Y830)/19 -> 6.511052631578948e-02 | AC830: =(R830+S830)/2 -> -5.0100000000000006e-02 | AD830: =(S830+T830)/2 -> -0.18964999999999999 | AE830: =(T830+U830)/2 -> 2.69e-02 | AF830: =(U830+V830)/2 -> 0.19545000000000001 | AG830: =(V830+W830)/2 -> 0.21665000000000001 | AH830: =(W830+X830)/2 -> 0.24664999999999998 | AI830: =(X830+Y830)/2 -> 0.25495000000000001 | AJ830: =STDEV(G830:Y830) -> 0.14541107589916266
B831: 605050.SH | C831: 福然德 | E831: 0.48680000000000001 | F831: 0.57999999999999996 | T831: -0.1389 | U831: 0 | V831: 3.85e-02 | W831: 0.53849999999999998 | X831: 0.3871 | Y831: 5.45e-02 | AA831: =(N831+O831+P831+Q831+R831+S831+T831+U831+V831+W831+X831+Y831)/12 -> 7.3308333333333323e-02 | AB831: =(G831+H831+I831+J831+K831+L831+M831+N831+O831+P831+Q831+R831+S831+T831+U831+V831+W831+X831+Y831)/19 -> 4.6299999999999994e-02 | AC831: =(R831+S831)/2 -> 0 | AD831: =(S831+T831)/2 -> -6.9449999999999998e-02 | AE831: =(T831+U831)/2 -> -6.9449999999999998e-02 | AF831: =(U831+V831)/2 -> 1.925e-02 | AG831: =(V831+W831)/2 -> 0.28849999999999998 | AH831: =(W831+X831)/2 -> 0.46279999999999999 | AI831: =(X831+Y831)/2 -> 0.2208 | AJ831: =STDEV(G831:Y831) -> 0.25868733572919
B832: 605580.SH | C832: 恒盛能源 | V832: 0.15869999999999998 | W832: 1.1000000000000001 | X832: 0.3871 | Y832: 0.11539999999999999 | AA832: =(N832+O832+P832+Q832+R832+S832+T832+U832+V832+W832+X832+Y832)/12 -> 0.14676666666666668 | AB832: =(G832+H832+I832+J832+K832+L832+M832+N832+O832+P832+Q832+R832+S832+T832+U832+V832+W832+X832+Y832)/19 -> 9.2694736842105274e-02 | AC832: =(R832+S832)/2 -> 0 | AD832: =(S832+T832)/2 -> 0 | AE832: =(T832+U832)/2 -> 0 | AF832: =(U832+V832)/2 -> 7.934999999999999e-02 | AG832: =(V832+W832)/2 -> 0.62935000000000008 | AH832: =(W832+X832)/2 -> 0.74355000000000004 | AI832: =(X832+Y832)/2 -> 0.25124999999999997 | AJ832: =STDEV(G832:Y832) -> 0.45566541087366585
B833: 603809.SH | C833: 豪能股份 | E833: 0.48880000000000001 | F833: 0.57999999999999996 | I833: 0.19699999999999998 | J833: 0.15490000000000001 | K833: -1.66e-02 | L833: -0.59740000000000004 | M833: -0.59650000000000003 | N833: -0.5776 | O833: -0.58109999999999995 | P833: -0.24539999999999998 | Q833: -0.27629999999999999 | R833: -0.24230000000000002 | S833: 3.8100000000000002e-02 | T833: 0.30570000000000003 | U833: 0.6109 | V833: 0.44939999999999997 | W833: 0.60719999999999996 | X833: 9.7200000000000009e-02 | Y833: -0.1241 | AA833: =(N833+O833+P833+Q833+R833+S833+T833+U833+V833+W833+X833+Y833)/12 -> 5.1416666666666685e-03 | AB833: =(I833+J833+K833+L833+M833+N833+O833+P833+Q833+R833+S833+T833+U833+V833+W833+X833+Y833)/17 -> -4.6876470588235297e-02 | AC833: =(R833+S833)/2 -> -0.10210000000000001 | AD833: =(S833+T833)/2 -> 0.17190000000000003 | AE833: =(T833+U833)/2 -> 0.45830000000000004 | AF833: =(U833+V833)/2 -> 0.53015000000000001 | AG833: =(V833+W833)/2 -> 0.52829999999999999 | AH833: =(W833+X833)/2 -> 0.35219999999999996 | AI833: =(X833+Y833)/2 -> -1.3449999999999997e-02 | AJ833: =STDEV(G833:Y833) -> 0.4083959927714334
B834: 000425.SZ | C834: 徐工机械
B835: 002531.SZ | C835: 天顺风能 | E835: 0.50450000000000006 | F835: 0.57799999999999996 | G835: -0.10000000000000001 | H835: 0 | I835: -0.13039999999999999 | J835: -3.7000000000000005e-02 | K835: 0.11109999999999999 | L835: 0 | M835: 0 | N835: 0 | O835: 0 | P835: 0.35710000000000003 | Q835: 0.55000000000000004 | R835: 0.61539999999999995 | S835: 0.51000000000000001 | T835: 0.63159999999999994 | U835: 0.48100000000000004 | V835: 0.42859999999999998 | W835: 2.7272000000000003 | X835: 0.45159999999999995 | Y835: 0.25879999999999997 | AA835: =(N835+O835+P835+Q835+R835+S835+T835+U835+V835+W835+X835+Y835)/12 -> 0.58427499999999999 | AB835: =(G835+H835+I835+J835+K835+L835+M835+N835+O835+P835+Q835+R835+S835+T835+U835+V835+W835+X835+Y835)/19 -> 0.36078947368421055 | AC835: =(R835+S835)/2 -> 0.56269999999999998 | AD835: =(S835+T835)/2 -> 0.57079999999999997 | AE835: =(T835+U835)/2 -> 0.55630000000000002 | AF835: =(U835+V835)/2 -> 0.45479999999999998 | AG835: =(V835+W835)/2 -> 1.5779000000000001 | AH835: =(W835+X835)/2 -> 1.5894000000000001 | AI835: =(X835+Y835)/2 -> 0.35519999999999996 | AJ835: =STDEV(G835:Y835) -> 0.63064602934410485
B836: 003016.SZ | C836: 欣贺股份 | T836: -0.3382 | U836: -0.31329999999999997 | V836: -0.30280000000000001 | W836: 0.79659999999999997 | X836: 0.94689999999999996 | Y836: 0.54159999999999997 | AA836: =(N836+O836+P836+Q836+R836+S836+T836+U836+V836+W836+X836+Y836)/12 -> 0.1109 | AB836: =(G836+H836+I836+J836+K836+L836+M836+N836+O836+P836+Q836+R836+S836+T836+U836+V836+W836+X836+Y836)/19 -> 7.0042105263157892e-02 | AC836: =(R836+S836)/2 -> 0 | AD836: =(S836+T836)/2 -> -0.1691 | AE836: =(T836+U836)/2 -> -0.32574999999999998 | AF836: =(U836+V836)/2 -> -0.30804999999999999 | AG836: =(V836+W836)/2 -> 0.24689999999999998 | AH836: =(W836+X836)/2 -> 0.87175000000000002 | AI836: =(X836+Y836)/2 -> 0.74424999999999997 | AJ836: =STDEV(G836:Y836) -> 0.60556985724192047
B837: 000400.SZ | C837: 许继电气 | E837: 0.40340000000000004 | F837: 0.57399999999999995 | G837: 0.38479999999999998 | H837: 0.4637 | I837: 0.23170000000000002 | J837: -0.29359999999999997 | K837: -0.44219999999999998 | L837: -0.1772 | M837: -0.48430000000000001 | N837: -0.67469999999999997 | O837: -9.0899999999999995e-02 | P837: 0.48590000000000005 | Q837: 0.95979999999999999 | R837: 1.3566 | S837: 1.496 | T837: 0.80669999999999997 | U837: 0.68079999999999996 | V837: 0.52190000000000003 | W837: 0.31409999999999999 | X837: 0.21199999999999999 | Y837: 0.13119999999999998 | AA837: =(N837+O837+P837+Q837+R837+S837+T837+U837+V837+W837+X837+Y837)/12 -> 0.51661666666666661 | AB837: =(G837+H837+I837+J837+K837+L837+M837+N837+O837+P837+Q837+R837+S837+T837+U837+V837+W837+X837+Y837)/19 -> 0.3095947368421052 | AC837: =(R837+S837)/2 -> 1.4262999999999999 | AD837: =(S837+T837)/2 -> 1.1513499999999999 | AE837: =(T837+U837)/2 -> 0.74374999999999991 | AF837: =(U837+V837)/2 -> 0.60135000000000005 | AG837: =(V837+W837)/2 -> 0.41800000000000004 | AH837: =(W837+X837)/2 -> 0.26305000000000001 | AI837: =(X837+Y837)/2 -> 0.17159999999999997 | AJ837: =STDEV(G837:Y837) -> 0.59581686827943681
B838: 002106.SZ | C838: 莱宝高科
B839: 600197.SH | C839: 伊力特 | G839: 0.26780000000000004 | H839: 0.17379999999999998 | I839: 0.10880000000000001 | J839: 0.27639999999999998 | K839: 8.4000000000000005e-02 | L839: 0.33270000000000005 | M839: 0.12909999999999999 | N839: 0.21109999999999998 | O839: 0.2384 | P839: -6.2400000000000004e-02 | Q839: 4.3799999999999999e-02 | R839: 5.1900000000000002e-02 | S839: -0.94330000000000003 | T839: -0.27110000000000001 | U839: -0.32140000000000002 | V839: -0.22969999999999999 | W839: 13.640599999999999 | X839: 0.34520000000000001 | Y839: 0.23319999999999999 | AA839: =(N839+O839+P839+Q839+R839+S839+T839+U839+V839+W839+X839+Y839)/12 -> 1.078025 | AB839: =(G839+H839+I839+J839+K839+L839+M839+N839+O839+P839+Q839+R839+S839+T839+U839+V839+W839+X839+Y839)/19 -> 0.75309999999999999 | AC839: =(R839+S839)/2 -> -0.44569999999999999 | AD839: =(S839+T839)/2 -> -0.60719999999999996 | AE839: =(T839+U839)/2 -> -0.29625000000000001 | AF839: =(U839+V839)/2 -> -0.27555000000000002 | AG839: =(V839+W839)/2 -> 6.7054499999999999 | AH839: =(W839+X839)/2 -> 6.9928999999999997 | AI839: =(X839+Y839)/2 -> 0.28920000000000001 | AJ839: =STDEV(G839:Y839) -> 3.1359680816119431
B840: 000050.SZ | C840: 深天马A
B841: 600422.SH | C841: 昆药集团 | E841: 0.41609999999999997 | F841: 0.57199999999999995 | G841: 0.10529999999999999 | H841: -0.1321 | I841: -0.15179999999999999 | J841: -0.1865 | K841: -0.1195 | L841: -0.161 | M841: -4.7800000000000002e-02 | N841: 3.8800000000000001e-02 | O841: 0.2903 | P841: 0.34670000000000001 | Q841: 0.39520000000000005 | R841: 0.36729999999999996 | S841: -0.1125 | T841: -4.4000000000000004e-02 | U841: -1.9699999999999999e-02 | V841: 8.5000000000000006e-03 | W841: 1.1292 | X841: 0.48340000000000005 | Y841: 0.23670000000000002 | AA841: =(N841+O841+P841+Q841+R841+S841+T841+U841+V841+W841+X841+Y841)/12 -> 0.25999166666666668 | AB841: =(G841+H841+I841+J841+K841+L841+M841+N841+O841+P841+Q841+R841+S841+T841+U841+V841+W841+X841+Y841)/19 -> 0.12771052631578947 | AC841: =(R841+S841)/2 -> 0.12739999999999999 | AD841: =(S841+T841)/2 -> -7.825e-02 | AE841: =(T841+U841)/2 -> -3.1850000000000003e-02 | AF841: =(U841+V841)/2 -> -5.5999999999999991e-03 | AG841: =(V841+W841)/2 -> 0.56884999999999997 | AH841: =(W841+X841)/2 -> 0.80630000000000002 | AI841: =(X841+Y841)/2 -> 0.36005000000000004 | AJ841: =STDEV(G841:Y841) -> 0.32454077965768607
B842: 000683.SZ | C842: 远兴能源 | E842: 0.45229999999999998 | F842: 0.56999999999999995 | G842: 1 | H842: 7 | I842: 5.5 | J842: 2.125 | K842: 1 | L842: 1 | M842: 0.76919999999999999 | N842: 0.83329999999999993 | O842: -0.25 | P842: -0.25 | Q842: -0.30430000000000001 | R842: -0.45450000000000002 | S842: -1.1667000000000001 | T842: -1.1667000000000001 | U842: -1.0625 | V842: -0.88890000000000002 | W842: 10 | X842: 18 | Y842: 58 | AA842: =(N842+O842+P842+Q842+R842+S842+T842+U842+V842+W842+X842+Y842)/12 -> 6.7741416666666661 | AB842: =(G842+H842+I842+J842+K842+L842+M842+N842+O842+P842+Q842+R842+S842+T842+U842+V842+W842+X842+Y842)/19 -> 5.2465210526315786 | AC842: =(R842+S842)/2 -> -0.81059999999999999 | AD842: =(S842+T842)/2 -> -1.1667000000000001 | AE842: =(T842+U842)/2 -> -1.1146 | AF842: =(U842+V842)/2 -> -0.97570000000000001 | AG842: =(V842+W842)/2 -> 4.5555500000000002 | AH842: =(W842+X842)/2 -> 14 | AI842: =(X842+Y842)/2 -> 38 | AJ842: =STDEV(G842:Y842) -> 13.658785529532059 | AK842: 0.43729999999999997 | AL842: 0.60850000000000004 | AM842: 0.65029999999999999 | AN842: 0.1656 | AO842: -7.4099999999999999e-02 | AP842: -0.14119999999999999 | AQ842: -0.1757 | AR842: -0.2571 | AS842: -5.2900000000000003e-02 | AT842: -4.1200000000000001e-02 | AU842: -2.8900000000000002e-02 | AV842: -1.1200000000000002e-02 | AW842: 8.5500000000000007e-02 | AX842: 8.6300000000000002e-02 | AY842: 2.3e-02 | AZ842: 0.17129999999999998 | BA842: 0.29909999999999998 | BB842: 0.55069999999999997 | BC842: 0.78220000000000001 | BE842: =(AR842+AS842+AT842+AU842+AV842+AW842+AX842+AY842+AZ842+BA842+BB842+BC842)/12 -> 0.13389999999999999 | BF842: =(AK842+AL842+AM842+AN842+AO842+AP842+AQ842+AR842+AS842+AT842+AU842+AV842+AV842+AW842+AX842+AY842+AZ842+BA842+BB842+BC842)/19 -> 0.16138421052631577 | BG842: =(AV842+AW842)/2 -> 3.7150000000000002e-02 | BH842: =(AW842+AX842)/2 -> 8.5900000000000004e-02 | BI842: =(AX842+AY842)/2 -> 5.4650000000000004e-02 | BJ842: =(AY842+AZ842)/2 -> 9.7149999999999986e-02 | BK842: =(AZ842+BA842)/2 -> 0.23519999999999996 | BL842: =(BA842+BB842)/2 -> 0.42489999999999994 | BM842: =(BB842+BC842)/2 -> 0.66644999999999999 | BN842: =STDEV(AK842:BC842) -> 0.30644896229425878
B843: 600406.SH | C843: 国电南瑞 | G843: 1 | H843: 0.83329999999999993 | I843: 0.3125 | J843: 1.2800000000000001e-02 | K843: 0 | L843: 0.40909999999999996 | M843: 0.23809999999999998 | N843: 0.1772 | O843: 0 | P843: -0.1613 | Q843: -9.6199999999999994e-02 | R843: 1.0800000000000001e-02 | S843: 0 | T843: -3.85e-02 | U843: -2.1299999999999999e-02 | V843: 0.12770000000000001 | W843: 1 | X843: 0.32000000000000001 | Y843: 0.23910000000000001 | AA843: =(N843+O843+P843+Q843+R843+S843+T843+U843+V843+W843+X843+Y843)/12 -> 0.12979166666666667 | AB843: =(G843+H843+I843+J843+K843+L843+M843+N843+O843+P843+Q843+R843+S843+T843+U843+V843+W843+X843+Y843)/19 -> 0.22964736842105263 | AC843: =(R843+S843)/2 -> 5.4000000000000003e-03 | AD843: =(S843+T843)/2 -> -1.925e-02 | AE843: =(T843+U843)/2 -> -2.9899999999999999e-02 | AF843: =(U843+V843)/2 -> 5.3200000000000004e-02 | AG843: =(V843+W843)/2 -> 0.56384999999999996 | AH843: =(W843+X843)/2 -> 0.66000000000000003 | AI843: =(X843+Y843)/2 -> 0.27955000000000002 | AJ843: =STDEV(G843:Y843) -> 0.35424753487485594
B844: 601187.SH | C844: 厦门银行
B845: 601811.SH | C845: 新华文轩
B846: 603456.SH | C846: 九洲药业 | G846: 0.11109999999999999 | H846: 0 | I846: -0.26319999999999999 | J846: -0.23999999999999999 | K846: -0.40000000000000002 | L846: 0.22219999999999998 | M846: -0.1429 | N846: 5.2600000000000001e-02 | O846: -0.16670000000000001 | P846: 0.18179999999999999 | Q846: 0.41670000000000001 | R846: 0.5 | S846: -0.20000000000000001 | T846: 0.23079999999999998 | U846: 0.76469999999999994 | V846: 0.56669999999999998 | W846: 1.75 | X846: 1.0625 | Y846: 0.90000000000000002 | AA846: =(N846+O846+P846+Q846+R846+S846+T846+U846+V846+W846+X846+Y846)/12 -> 0.50492499999999996 | AB846: =(G846+H846+I846+J846+K846+L846+M846+N846+O846+P846+Q846+R846+S846+T846+U846+V846+W846+X846+Y846)/19 -> 0.28138421052631579 | AC846: =(R846+S846)/2 -> 0.14999999999999999 | AD846: =(S846+T846)/2 -> 1.5399999999999983e-02 | AE846: =(T846+U846)/2 -> 0.49774999999999997 | AF846: =(U846+V846)/2 -> 0.66569999999999996 | AG846: =(V846+W846)/2 -> 1.15835 | AH846: =(W846+X846)/2 -> 1.40625 | AI846: =(X846+Y846)/2 -> 0.98124999999999996 | AJ846: =STDEV(G846:Y846) -> 0.54530735193116142
B847: 603755.SH | C847: 日辰股份
B848: 603810.SH | C848: 丰山集团
B849: 605186.SH | C849: 健麾信息 | T849: 0.16670000000000001 | U849: 0.48719999999999997 | V849: 4.4400000000000002e-02 | W849: -0.16670000000000001 | X849: -9.5199999999999993e-02 | Y849: -1.72e-02 | AA849: =(N849+O849+P849+Q849+R849+S849+T849+U849+V849+W849+X849+Y849)/12 -> 3.4933333333333323e-02 | AB849: =(G849+H849+I849+J849+K849+L849+M849+N849+O849+P849+Q849+R849+S849+T849+U849+V849+W849+X849+Y849)/19 -> 2.2063157894736833e-02 | AC849: =(R849+S849)/2 -> 0 | AD849: =(S849+T849)/2 -> 8.3350000000000007e-02 | AE849: =(T849+U849)/2 -> 0.32694999999999996 | AF849: =(U849+V849)/2 -> 0.26579999999999998 | AG849: =(V849+W849)/2 -> -6.115000000000001e-02 | AH849: =(W849+X849)/2 -> -0.13095000000000001 | AI849: =(X849+Y849)/2 -> -5.62e-02 | AJ849: =STDEV(G849:Y849) -> 0.23451386028690641
B850: 600282.SH | C850: 南钢股份
B851: 000666.SZ | C851: 经纬纺机 | E851: 0 | F851: 0.56100000000000005 | G851: 4.0076999999999998 | H851: 0.86840000000000006 | I851: 0.9667 | J851: 1.2078 | K851: -0.50840000000000007 | L851: -0.39829999999999999 | M851: -0.38979999999999998 | N851: -0.36469999999999997 | O851: 0.35479999999999995 | P851: 0.1777 | Q851: -0.26500000000000001 | R851: -0.35520000000000002 | S851: -0.71799999999999997 | T851: -0.51659999999999995 | U851: -0.35299999999999998 | V851: -0.1628 | W851: 1.4828999999999999 | X851: 0.50039999999999996 | Y851: 0.63790000000000002 | AA851: =(N851+O851+P851+Q851+R851+S851+T851+U851+V851+W851+X851+Y851)/12 -> 3.4866666666666664e-02 | AB851: =(G851+H851+I851+J851+K851+L851+M851+N851+O851+P851+Q851+R851+S851+T851+U851+V851+W851+X851+Y851)/19 -> 0.32486842105263158 | AC851: =(R851+S851)/2 -> -0.53659999999999997 | AD851: =(S851+T851)/2 -> -0.61729999999999996 | AE851: =(T851+U851)/2 -> -0.43479999999999996 | AF851: =(U851+V851)/2 -> -0.25790000000000002 | AG851: =(V851+W851)/2 -> 0.66004999999999991 | AH851: =(W851+X851)/2 -> 0.99164999999999992 | AI851: =(X851+Y851)/2 -> 0.56915000000000004 | AJ851: =STDEV(G851:Y851) -> 1.1067860021263929
B852: 000725.SZ | C852: 京东方A
B853: 000938.SZ | C853: 紫光股份
B854: 002191.SZ | C854: 劲嘉股份 | E854: 0.27110000000000001 | F854: 0.55500000000000005 | G854: -0.27779999999999999 | H854: -0.14810000000000001 | I854: -2.9399999999999999e-02 | J854: -2.2700000000000001e-02 | K854: 7.690000000000001e-02 | L854: 8.6999999999999994e-02 | M854: 9.0899999999999995e-02 | N854: 0.13949999999999999 | O854: 0.21429999999999999 | P854: 0.23999999999999999 | Q854: 0.27779999999999999 | R854: 0.22450000000000001 | S854: -0.1176 | T854: -9.6799999999999997e-02 | U854: -2.1700000000000001e-02 | V854: -6.6699999999999995e-02 | W854: 0.1333 | X854: 0.25 | Y854: 0.24440000000000001 | AA854: =(N854+O854+P854+Q854+R854+S854+T854+U854+V854+W854+X854+Y854)/12 -> 0.11841666666666663 | AB854: =(G854+H854+I854+J854+K854+L854+M854+N854+O854+P854+Q854+R854+S854+T854+U854+V854+W854+X854+Y854)/19 -> 6.3042105263157899e-02 | AC854: =(R854+S854)/2 -> 5.3450000000000004e-02 | AD854: =(S854+T854)/2 -> -0.10719999999999999 | AE854: =(T854+U854)/2 -> -5.9249999999999997e-02 | AF854: =(U854+V854)/2 -> -4.4199999999999996e-02 | AG854: =(V854+W854)/2 -> 3.3300000000000003e-02 | AH854: =(W854+X854)/2 -> 0.19164999999999999 | AI854: =(X854+Y854)/2 -> 0.2472 | AJ854: =STDEV(G854:Y854) -> 0.16079620405894562 | AK854: -8.6899999999999991e-02 | AL854: -8.6099999999999996e-02 | AM854: 3.9000000000000003e-03 | AN854: -6.1200000000000004e-02 | AO854: 0.11470000000000001 | AP854: 0.21690000000000001 | AQ854: 0.1416 | AR854: 0.10929999999999999 | AS854: 0.19750000000000001 | AT854: 0.22800000000000001 | AU854: 0.1434 | AV854: 0.2407 | AW854: -0.19420000000000001 | AX854: -6.2199999999999998e-02 | AY854: 0.1103 | AZ854: 4.1700000000000001e-02 | BA854: 0.54430000000000001 | BB854: 0.5756 | BC854: 0.35139999999999999 | BE854: =(AR854+AS854+AT854+AU854+AV854+AW854+AX854+AY854+AZ854+BA854+BB854+BC854)/12 -> 0.19048333333333334 | BF854: =(AK854+AL854+AM854+AN854+AO854+AP854+AQ854+AR854+AS854+AT854+AU854+AV854+AV854+AW854+AX854+AY854+AZ854+BA854+BB854+BC854)/19 -> 0.14575789473684211 | BG854: =(AV854+AW854)/2 -> 2.3249999999999993e-02 | BH854: =(AW854+AX854)/2 -> -0.12820000000000001 | BI854: =(AX854+AY854)/2 -> 2.4049999999999998e-02 | BJ854: =(AY854+AZ854)/2 -> 7.5999999999999998e-02 | BK854: =(AZ854+BA854)/2 -> 0.29299999999999998 | BL854: =(BA854+BB854)/2 -> 0.55994999999999995 | BM854: =(BB854+BC854)/2 -> 0.46350000000000002 | BN854: =STDEV(AK854:BC854) -> 0.20418107947695413
B855: 002312.SZ | C855: 川发龙蟒
B856: 002973.SZ | C856: 侨银股份
B857: 600757.SH | C857: 长江传媒 | E857: 0.30780000000000002 | F857: 0.56000000000000005 | G857: 9.0899999999999995e-02 | H857: 0.23999999999999999 | I857: 0.26469999999999999 | J857: 4.0800000000000003e-02 | K857: 0.25 | L857: 0.2903 | M857: 0.20929999999999999 | N857: 0.17649999999999999 | O857: 0.33329999999999999 | P857: 0 | Q857: 1.9199999999999998e-02 | R857: 6.6699999999999995e-02 | S857: -0.5 | T857: -2.5000000000000001e-02 | U857: 3.7699999999999997e-02 | V857: 4.6900000000000004e-02 | W857: 1.1000000000000001 | X857: 2.5600000000000001e-02 | Y857: 1.8200000000000001e-02 | AA857: =(N857+O857+P857+Q857+R857+S857+T857+U857+V857+W857+X857+Y857)/12 -> 0.10825833333333335 | AB857: =(G857+H857+I857+J857+K857+L857+M857+N857+O857+P857+Q857+R857+S857+T857+U857+V857+W857+X857+Y857)/19 -> 0.14132105263157896 | AC857: =(R857+S857)/2 -> -0.21665000000000001 | AD857: =(S857+T857)/2 -> -0.26250000000000001 | AE857: =(T857+U857)/2 -> 6.349999999999998e-03 | AF857: =(U857+V857)/2 -> 4.2300000000000004e-02 | AG857: =(V857+W857)/2 -> 0.57345000000000002 | AH857: =(W857+X857)/2 -> 0.56280000000000008 | AI857: =(X857+Y857)/2 -> 2.1900000000000003e-02 | AJ857: =STDEV(G857:Y857) -> 0.29448675989658002
B858: 600895.SH | C858: 张江高科
B859: 601098.SH | C859: 中南传媒
B860: 601818.SH | C860: 光大银行
B861: 603080.SH | C861: 新疆火炬 | E861: 0.38950000000000001 | F861: 0.56000000000000005 | H861: -0.38600000000000001 | I861: -0.37329999999999997 | J861: -0.28570000000000001 | K861: -0.31819999999999998 | L861: -0.20000000000000001 | M861: -0.12770000000000001 | N861: -0.1875 | O861: 0.40000000000000002 | P861: 0.17859999999999998 | Q861: -0.439 | R861: -4.6199999999999998e-02 | S861: -0.52380000000000004 | T861: -0.36359999999999998 | U861: -4.3499999999999997e-02 | V861: -0.1613 | W861: 1.3999999999999999 | X861: 1 | Y861: 1.5455000000000001 | AA861: =(N861+O861+P861+Q861+R861+S861+T861+U861+V861+W861+X861+Y861)/12 -> 0.22993333333333332 | AB861: =(G861+H861+I861+J861+K861+L861+M861+N861+O861+P861+Q861+R861+S861+T861+U861+V861+W861+X861+Y861)/19 -> 5.6226315789473721e-02 | AC861: =(R861+S861)/2 -> -0.28500000000000003 | AD861: =(S861+T861)/2 -> -0.44369999999999998 | AE861: =(T861+U861)/2 -> -0.20354999999999998 | AF861: =(U861+V861)/2 -> -0.10239999999999999 | AG861: =(V861+W861)/2 -> 0.61934999999999996 | AH861: =(W861+X861)/2 -> 1.2 | AI861: =(X861+Y861)/2 -> 1.27275 | AJ861: =STDEV(G861:Y861) -> 0.62633807564285915 | AL861: 7.9600000000000004e-02 | AM861: 0.1333 | AN861: 0.1047 | AO861: 0.10300000000000001 | AP861: 0.16350000000000001 | AQ861: 0.32350000000000001 | AR861: 0.14400000000000002 | AS861: 5.33e-02 | AT861: 8.900000000000001e-02 | AU861: 5.45e-02 | AV861: 0.50280000000000002 | AW861: 0.39899999999999997 | AX861: 0.47639999999999999 | AY861: 0.27589999999999998 | AZ861: 0.21100000000000002 | BA861: 0.23800000000000002 | BB861: 0.19519999999999998 | BC861: 0.25719999999999998 | BE861: =(AR861+AS861+AT861+AU861+AV861+AW861+AX861+AY861+AZ861+BA861+BB861+BC861)/12 -> 0.24135833333333334 | BF861: =(AK861+AL861+AM861+AN861+AO861+AP861+AQ861+AR861+AS861+AT861+AU861+AV861+AV861+AW861+AX861+AY861+AZ861+BA861+BB861+BC861)/19 -> 0.2266684210526316 | BG861: =(AV861+AW861)/2 -> 0.45089999999999997 | BH861: =(AW861+AX861)/2 -> 0.43769999999999998 | BI861: =(AX861+AY861)/2 -> 0.37614999999999998 | BJ861: =(AY861+AZ861)/2 -> 0.24345 | BK861: =(AZ861+BA861)/2 -> 0.22450000000000003 | BL861: =(BA861+BB861)/2 -> 0.21660000000000001 | BM861: =(BB861+BC861)/2 -> 0.22619999999999998 | BN861: =STDEV(AK861:BC861) -> 0.13893831388554947
B862: 603108.SH | C862: 润达医疗
B863: 605060.SH | C863: 联德股份 | E863: 8.8800000000000004e-02 | F863: 0.56000000000000005 | V863: -1.06e-02 | W863: 0 | X863: -0.11900000000000001 | Y863: -0.13849999999999998 | AA863: =(N863+O863+P863+Q863+R863+S863+T863+U863+V863+W863+X863+Y863)/12 -> -2.2341666666666666e-02 | AB863: =(G863+H863+I863+J863+K863+L863+M863+N863+O863+P863+Q863+R863+S863+T863+U863+V863+W863+X863+Y863)/19 -> -1.4110526315789474e-02 | AC863: =(R863+S863)/2 -> 0 | AD863: =(S863+T863)/2 -> 0 | AE863: =(T863+U863)/2 -> 0 | AF863: =(U863+V863)/2 -> -5.3e-03 | AG863: =(V863+W863)/2 -> -5.3e-03 | AH863: =(W863+X863)/2 -> -5.9500000000000004e-02 | AI863: =(X863+Y863)/2 -> -0.12875 | AJ863: =STDEV(G863:Y863) -> 7.1847541131667594e-02
B864: 605298.SH | C864: 必得科技 | V864: -5.1500000000000004e-02 | W864: 1 | X864: -4.0800000000000003e-02 | Y864: -0.29109999999999997 | AA864: =(N864+O864+P864+Q864+R864+S864+T864+U864+V864+W864+X864+Y864)/12 -> 5.1383333333333336e-02 | AB864: =(G864+H864+I864+J864+K864+L864+M864+N864+O864+P864+Q864+R864+S864+T864+U864+V864+W864+X864+Y864)/19 -> 3.2452631578947372e-02 | AC864: =(R864+S864)/2 -> 0 | AD864: =(S864+T864)/2 -> 0 | AE864: =(T864+U864)/2 -> 0 | AF864: =(U864+V864)/2 -> -2.5750000000000002e-02 | AG864: =(V864+W864)/2 -> 0.47425 | AH864: =(W864+X864)/2 -> 0.47960000000000003 | AI864: =(X864+Y864)/2 -> -0.16594999999999999 | AJ864: =STDEV(G864:Y864) -> 0.57561770009848257
B865: 601200.SH | C865: 上海环境 | E865: 0.60360000000000003 | F865: 0.55900000000000005 | G865: 0.46399999999999997 | H865: 0.33260000000000001 | I865: 0.2253 | J865: 8.7899999999999992e-02 | K865: -4.7400000000000005e-02 | L865: -0.28220000000000001 | M865: -0.19109999999999999 | N865: -0.1215 | O865: -0.27200000000000002 | P865: 5.7800000000000004e-02 | Q865: -0.1229 | R865: 6.6500000000000004e-02 | S865: 1.44e-02 | T865: 0.1158 | U865: 0.21760000000000002 | V865: -4.58e-02 | W865: 0.16829999999999998 | X865: 2.3300000000000001e-02 | Y865: -4.1500000000000002e-02 | AA865: =(N865+O865+P865+Q865+R865+S865+T865+U865+V865+W865+X865+Y865)/12 -> 5.0000000000000018e-03 | AB865: =(G865+H865+I865+J865+K865+L865+M865+N865+O865+P865+Q865+R865+S865+T865+U865+V865+W865+X865+Y865)/19 -> 3.416315789473684e-02 | AC865: =(R865+S865)/2 -> 4.045e-02 | AD865: =(S865+T865)/2 -> 6.5100000000000005e-02 | AE865: =(T865+U865)/2 -> 0.16670000000000001 | AF865: =(U865+V865)/2 -> 8.5900000000000004e-02 | AG865: =(V865+W865)/2 -> 6.1249999999999985e-02 | AH865: =(W865+X865)/2 -> 9.5799999999999996e-02 | AI865: =(X865+Y865)/2 -> -9.1000000000000004e-03 | AJ865: =STDEV(G865:Y865) -> 0.19520657778798309
B866: 600487.SH | C866: 亨通光电
B867: 002105.SZ | C867: 信隆健康 | E867: 0.60130000000000006 | F867: 0.55600000000000005 | G867: -0.71430000000000005 | H867: 0.68000000000000005 | I867: 0.98329999999999995 | J867: 0.61039999999999994 | K867: -4.75 | L867: -0.88099999999999989 | M867: -0.88239999999999996 | N867: -0.7581 | O867: -0.33329999999999999 | P867: 3.8999999999999999 | Q867: 8.6428999999999991 | R867: 2.7999999999999998 | S867: 0.10000000000000001 | T867: 1.5102000000000002 | U867: 1.2741 | V867: 2.9561000000000002 | W867: 10.0556 | X867: 1.7886000000000002 | Y867: 0.81110000000000004 | AA867: =(N867+O867+P867+Q867+R867+S867+T867+U867+V867+W867+X867+Y867)/12 -> 2.7289333333333334 | AB867: =(G867+H867+I867+J867+K867+L867+M867+N867+O867+P867+Q867+R867+S867+T867+U867+V867+W867+X867+Y867)/19 -> 1.4627999999999999 | AC867: =(R867+S867)/2 -> 1.45 | AD867: =(S867+T867)/2 -> 0.80510000000000015 | AE867: =(T867+U867)/2 -> 1.39215 | AF867: =(U867+V867)/2 -> 2.1151 | AG867: =(V867+W867)/2 -> 6.5058500000000006 | AH867: =(W867+X867)/2 -> 5.9221000000000004 | AI867: =(X867+Y867)/2 -> 1.2998500000000002 | AJ867: =STDEV(G867:Y867) -> 3.3485788099829255
B868: 600711.SH | C868: 盛屯矿业
B869: 603982.SH | C869: 泉峰汽车 | N869: 0.17480000000000001 | O869: 0.2198 | P869: -0.30280000000000001 | Q869: -0.36149999999999999 | R869: -0.2243 | S869: -0.51770000000000005 | T869: -0.41229999999999994 | U869: 0.32000000000000001 | V869: 0.27600000000000002 | W869: 2.8531999999999997 | X869: 2.6642000000000001 | Y869: 0.77010000000000001 | AA869: =(N869+O869+P869+Q869+R869+S869+T869+U869+V869+W869+X869+Y869)/12 -> 0.45495833333333335 | AB869: =(G869+H869+I869+J869+K869+L869+M869+N869+O869+P869+Q869+R869+S869+T869+U869+V869+W869+X869+Y869)/19 -> 0.2873421052631579 | AC869: =(R869+S869)/2 -> -0.371 | AD869: =(S869+T869)/2 -> -0.46499999999999997 | AE869: =(T869+U869)/2 -> -4.6149999999999969e-02 | AF869: =(U869+V869)/2 -> 0.29800000000000004 | AG869: =(V869+W869)/2 -> 1.5646 | AH869: =(W869+X869)/2 -> 2.7587000000000002 | AI869: =(X869+Y869)/2 -> 1.7171500000000002 | AJ869: =STDEV(G869:Y869) -> 1.1408150638575221
B870: 002649.SZ | C870: 博彦科技 | E870: 0.30510000000000004 | F870: 0.498 | G870: -0.59999999999999998 | H870: -3.9e-02 | I870: 0.1222 | J870: 0.82830000000000004 | K870: 3.3300000000000003e-02 | L870: 1.3500000000000002e-02 | M870: 0.31209999999999999 | N870: -9.3999999999999986e-03 | O870: 9.6799999999999997e-02 | P870: 0.38670000000000004 | Q870: 0.18559999999999999 | R870: 0.1114 | S870: -0.8234999999999999 | T870: 4.3299999999999998e-02 | U870: 9.820000000000001e-02 | V870: 0.33479999999999999 | W870: 7.8333000000000004 | X870: 0.52070000000000005 | Y870: 0.30590000000000001 | AA870: =(N870+O870+P870+Q870+R870+S870+T870+U870+V870+W870+X870+Y870)/12 -> 0.75698333333333334 | AB870: =(G870+H870+I870+J870+K870+L870+M870+N870+O870+P870+Q870+R870+S870+T870+U870+V870+W870+X870+Y870)/19 -> 0.51337894736842105 | AC870: =(R870+S870)/2 -> -0.35604999999999998 | AD870: =(S870+T870)/2 -> -0.39009999999999995 | AE870: =(T870+U870)/2 -> 7.0750000000000007e-02 | AF870: =(U870+V870)/2 -> 0.2165 | AG870: =(V870+W870)/2 -> 4.0840500000000004 | AH870: =(W870+X870)/2 -> 4.1770000000000005 | AI870: =(X870+Y870)/2 -> 0.4133 | AJ870: =STDEV(G870:Y870) -> 1.8087217366536166
B871: 603588.SH | C871: 高能环境 | E871: 0.65169999999999995 | F871: 0.54900000000000004 | G871: 1.2703 | H871: 0.72409999999999997 | I871: 0.68100000000000005 | J871: 0.22309999999999999 | K871: 3.7000000000000002 | L871: 1.29 | M871: 0.87180000000000002 | N871: 0.68240000000000001 | O871: 0.76600000000000001 | P871: 0.35370000000000001 | Q871: 0.29859999999999998 | R871: 0.24099999999999999 | S871: 0.27710000000000001 | T871: -7.4200000000000002e-02 | U871: -0.1055 | V871: 0.21360000000000001 | W871: 0.37740000000000001 | X871: 0.28920000000000001 | Y871: 0.3019 | AA871: =(N871+O871+P871+Q871+R871+S871+T871+U871+V871+W871+X871+Y871)/12 -> 0.30176666666666668 | AB871: =(G871+H871+I871+J871+K871+L871+M871+N871+O871+P871+Q871+R871+S871+T871+U871+V871+W871+X871+Y871)/19 -> 0.6516578947368421 | AC871: =(R871+S871)/2 -> 0.25905 | AD871: =(S871+T871)/2 -> 0.10145000000000001 | AE871: =(T871+U871)/2 -> -8.9849999999999999e-02 | AF871: =(U871+V871)/2 -> 5.4050000000000008e-02 | AG871: =(V871+W871)/2 -> 0.29549999999999998 | AH871: =(W871+X871)/2 -> 0.33330000000000004 | AI871: =(X871+Y871)/2 -> 0.29554999999999998 | AJ871: =STDEV(G871:Y871) -> 0.83260565583513468 | BS871: 10.640000000000001 | BT871: 10.220000000000001 | CB871: 37 | CC871: 先减少后增加（108家减少到29家，然后再增加到37家） | CD871: 持续减少（18.26%先增加到14.11%，然后减少到6.29%） | CI871: 5.8399999999999999 | CJ871: =CI871/BS871 -> 0.54887218045112773 | CL871: 44585
B872: 002576.SZ | C872: 通达动力
B873: 002497.SZ | C873: 雅化集团 | G873: 0.48619999999999997 | H873: 0.58799999999999997 | I873: 0.68700000000000006 | J873: 0.78569999999999995 | K873: 0.72219999999999995 | L873: 0.21170000000000003 | M873: 7.4099999999999999e-02 | N873: -0.23999999999999999 | O873: -0.4194 | P873: -0.23920000000000002 | Q873: -0.40409999999999996 | R873: -0.63159999999999994 | S873: -0.80859999999999999 | T873: 0.12920000000000001 | U873: 0.84499999999999997 | V873: 3.8571 | W873: 10.064500000000001 | X873: 1.1020000000000001 | Y873: 1.7233000000000001 | AA873: =(N873+O873+P873+Q873+R873+S873+T873+U873+V873+W873+X873+Y873)/12 -> 1.2481833333333334 | AB873: =(G873+H873+I873+J873+K873+L873+M873+N873+O873+P873+Q873+R873+S873+T873+U873+V873+W873+X873+Y873)/19 -> 0.97542631578947359 | AC873: =(R873+S873)/2 -> -0.72009999999999996 | AD873: =(S873+T873)/2 -> -0.3397 | AE873: =(T873+U873)/2 -> 0.48709999999999998 | AF873: =(U873+V873)/2 -> 2.3510499999999999 | AG873: =(V873+W873)/2 -> 6.9608000000000008 | AH873: =(W873+X873)/2 -> 5.5832500000000005 | AI873: =(X873+Y873)/2 -> 1.4126500000000002 | AJ873: =STDEV(G873:Y873) -> 2.4353720059987429
B874: 600460.SH | C874: 士兰微 | G874: 12 | H874: 2.3999999999999999 | I874: 1.2 | J874: 0.75 | K874: -0.23079999999999998 | L874: 7.3499999999999996e-02 | M874: 9.0899999999999995e-02 | N874: -7.1399999999999991e-02 | O874: -0.10000000000000001 | P874: -0.39729999999999999 | Q874: -0.66670000000000007 | R874: -0.92310000000000003 | S874: -0.88890000000000002 | T874: -0.47729999999999995 | U874: -0.14999999999999999 | V874: 4 | W874: 65 | X874: 13.260899999999999 | Y874: 15.2059 | AA874: =(N874+O874+P874+Q874+R874+S874+T874+U874+V874+W874+X874+Y874)/12 -> 7.8160083333333326 | AB874: =(G874+H874+I874+J874+K874+L874+M874+N874+O874+P874+Q874+R874+S874+T874+U874+V874+W874+X874+Y874)/19 -> 5.793457894736842 | AC874: =(R874+S874)/2 -> -0.90600000000000003 | AD874: =(S874+T874)/2 -> -0.68310000000000004 | AE874: =(T874+U874)/2 -> -0.31364999999999998 | AF874: =(U874+V874)/2 -> 1.925 | AG874: =(V874+W874)/2 -> 34.5 | AH874: =(W874+X874)/2 -> 39.130449999999996 | AI874: =(X874+Y874)/2 -> 14.2334 | AJ874: =STDEV(G874:Y874) -> 15.21090867763132
B875: 000823.SZ | C875: 超声电子
B876: 603327.SH | C876: 福蓉科技
B877: 000550.SZ | C877: 江铃汽车
B878: 000635.SZ | C878: 英力特
B879: 002144.SZ | C879: 宏达高科
B880: 002443.SZ | C880: 金洲管道 | E880: 0.33130000000000004 | F880: 0.55000000000000004 | G880: -0.5 | H880: -0.29999999999999999 | I880: 1.625 | J880: 1.5833000000000002 | K880: 1 | L880: 0.85709999999999997 | M880: 0 | N880: 0.19350000000000001 | O880: 3 | P880: 0.3846 | Q880: 0.47619999999999996 | R880: 0.43240000000000001 | S880: 0 | T880: 2.8332999999999999 | U880: 1.9032 | V880: 1.1132 | W880: 0.875 | X880: -0.46380000000000005 | Y880: -0.38890000000000002 | AA880: =(N880+O880+P880+Q880+R880+S880+T880+U880+V880+W880+X880+Y880)/12 -> 0.86322500000000002 | AB880: =(G880+H880+I880+J880+K880+L880+M880+N880+O880+P880+Q880+R880+S880+T880+U880+V880+W880+X880+Y880)/19 -> 0.76968947368421037 | AC880: =(R880+S880)/2 -> 0.2162 | AD880: =(S880+T880)/2 -> 1.41665 | AE880: =(T880+U880)/2 -> 2.3682499999999997 | AF880: =(U880+V880)/2 -> 1.5082 | AG880: =(V880+W880)/2 -> 0.99409999999999998 | AH880: =(W880+X880)/2 -> 0.20559999999999998 | AI880: =(X880+Y880)/2 -> -0.42635000000000001 | AJ880: =STDEV(G880:Y880) -> 1.0431287365393362
B881: 600363.SH | C881: 联创光电 | G881: 0.53869999999999996 | H881: 0.16539999999999999 | I881: 0.10339999999999999 | J881: 0.28570000000000001 | K881: -0.18559999999999999 | L881: -1.11e-02 | M881: 1.46e-02 | N881: 0.1333 | O881: -0.26150000000000001 | P881: -0.14660000000000001 | Q881: -0.11410000000000001 | R881: -0.13730000000000001 | S881: -0.29330000000000001 | T881: 0.2727 | U881: 0.37140000000000001 | V881: 0.38640000000000002 | W881: 1.8968 | X881: 0.17859999999999998 | Y881: 0.14580000000000001 | AA881: =(N881+O881+P881+Q881+R881+S881+T881+U881+V881+W881+X881+Y881)/12 -> 0.20268333333333333 | AB881: =(G881+H881+I881+J881+K881+L881+M881+N881+O881+P881+Q881+R881+S881+T881+U881+V881+W881+X881+Y881)/19 -> 0.17596315789473682 | AC881: =(R881+S881)/2 -> -0.21529999999999999 | AD881: =(S881+T881)/2 -> -1.0300000000000004e-02 | AE881: =(T881+U881)/2 -> 0.32205 | AF881: =(U881+V881)/2 -> 0.37890000000000001 | AG881: =(V881+W881)/2 -> 1.1415999999999999 | AH881: =(W881+X881)/2 -> 1.0377000000000001 | AI881: =(X881+Y881)/2 -> 0.16220000000000001 | AJ881: =STDEV(G881:Y881) -> 0.47694099007287671
B882: 601117.SH | C882: 中国化学 | E882: 0.67299999999999993 | F882: 0.55000000000000004 | G882: -0.25 | H882: 0 | I882: -0.10339999999999999 | J882: -0.11109999999999999 | K882: 0.33329999999999999 | L882: 0.29410000000000003 | M882: 0.26919999999999999 | N882: 0.21879999999999999 | O882: 0.625 | P882: 0.45450000000000002 | Q882: 0.51519999999999999 | R882: 0.5897 | S882: -0.15380000000000002 | T882: -9.3800000000000008e-02 | U882: 0.12 | V882: 0.1452 | W882: 0.45450000000000002 | X882: 0.27589999999999998 | Y882: -1.7899999999999999e-02 | AA882: =(N882+O882+P882+Q882+R882+S882+T882+U882+V882+W882+X882+Y882)/12 -> 0.26110833333333333 | AB882: =(G882+H882+I882+J882+K882+L882+M882+N882+O882+P882+Q882+R882+S882+T882+U882+V882+W882+X882+Y882)/19 -> 0.18765263157894738 | AC882: =(R882+S882)/2 -> 0.21794999999999998 | AD882: =(S882+T882)/2 -> -0.12380000000000002 | AE882: =(T882+U882)/2 -> 1.3099999999999994e-02 | AF882: =(U882+V882)/2 -> 0.1326 | AG882: =(V882+W882)/2 -> 0.29985000000000001 | AH882: =(W882+X882)/2 -> 0.36519999999999997 | AI882: =(X882+Y882)/2 -> 0.129 | AJ882: =STDEV(G882:Y882) -> 0.26829954521935417
B883: 601138.SH | C883: 工业富联
B884: 603219.SH | C884: 富佳股份 | E884: 0.50990000000000002 | F884: 0.49199999999999999 | W884: 0.84620000000000006 | X884: 0.31819999999999998 | Y884: 0.7742 | AA884: =(N884+O884+P884+Q884+R884+S884+T884+U884+V884+W884+X884+Y884)/12 -> 0.16155 | AB884: =(G884+H884+I884+J884+K884+L884+M884+N884+O884+P884+Q884+R884+S884+T884+U884+V884+W884+X884+Y884)/19 -> 0.10203157894736843 | AC884: =(R884+S884)/2 -> 0 | AD884: =(S884+T884)/2 -> 0 | AE884: =(T884+U884)/2 -> 0 | AF884: =(U884+V884)/2 -> 0 | AG884: =(V884+W884)/2 -> 0.42310000000000003 | AH884: =(W884+X884)/2 -> 0.58220000000000005 | AI884: =(X884+Y884)/2 -> 0.54620000000000002 | AJ884: =STDEV(G884:Y884) -> 0.28632848269077255
B885: 603238.SH | C885: 诺邦股份
B886: 603505.SH | C886: 金石资源 | G886: 0.33329999999999999 | H886: 6.25e-02 | I886: 0.35289999999999999 | J886: 0.25 | K886: 1.25 | L886: 5.8799999999999998e-02 | M886: 0.30430000000000001 | N886: 0.62860000000000005 | O886: 0.88890000000000002 | P886: 1.5556000000000001 | Q886: 1.3 | R886: 0.63159999999999994 | S886: -0.17649999999999999 | T886: -0.36959999999999998 | U886: -0.2029 | V886: 7.5300000000000006e-02 | W886: 0.28570000000000001 | X886: 0.13789999999999999 | Y886: 0 | AA886: =(N886+O886+P886+Q886+R886+S886+T886+U886+V886+W886+X886+Y886)/12 -> 0.39621666666666672 | AB886: =(G886+H886+I886+J886+K886+L886+M886+N886+O886+P886+Q886+R886+S886+T886+U886+V886+W886+X886+Y886)/19 -> 0.38770526315789483 | AC886: =(R886+S886)/2 -> 0.22754999999999997 | AD886: =(S886+T886)/2 -> -0.27305000000000001 | AE886: =(T886+U886)/2 -> -0.28625 | AF886: =(U886+V886)/2 -> -6.3799999999999996e-02 | AG886: =(V886+W886)/2 -> 0.18049999999999999 | AH886: =(W886+X886)/2 -> 0.21179999999999999 | AI886: =(X886+Y886)/2 -> 6.8949999999999997e-02 | AJ886: =STDEV(G886:Y886) -> 0.53301679822776926
B887: 603856.SH | C887: 东宏股份 | E887: 0.34789999999999999 | F887: 0.48999999999999999 | I887: 0.2321 | J887: 0.18179999999999999 | K887: 0.72730000000000006 | L887: -0.39219999999999999 | M887: -0.28989999999999999 | N887: -0.23079999999999998 | O887: -0.15789999999999998 | P887: 0.22579999999999997 | Q887: 0.1429 | R887: 0.31670000000000004 | S887: -0.125 | T887: 0.3947 | U887: 0.46429999999999999 | V887: 0.5696 | W887: 0.1429 | X887: -9.4299999999999995e-02 | Y887: -0.32929999999999998 | AA887: =(N887+O887+P887+Q887+R887+S887+T887+U887+V887+W887+X887+Y887)/12 -> 0.10996666666666666 | AB887: =(G887+H887+I887+J887+K887+L887+M887+N887+O887+P887+Q887+R887+S887+T887+U887+V887+W887+X887+Y887)/19 -> 9.3615789473684222e-02 | AC887: =(R887+S887)/2 -> 9.5850000000000019e-02 | AD887: =(S887+T887)/2 -> 0.13485 | AE887: =(T887+U887)/2 -> 0.42949999999999999 | AF887: =(U887+V887)/2 -> 0.51695000000000002 | AG887: =(V887+W887)/2 -> 0.35625000000000001 | AH887: =(W887+X887)/2 -> 2.4300000000000002e-02 | AI887: =(X887+Y887)/2 -> -0.21179999999999999 | AJ887: =STDEV(G887:Y887) -> 0.33229642031758688
B888: 605133.SH | C888: 嵘泰股份
B889: 605378.SH | C889: 野马电池 | V889: -4.07e-02 | W889: 0.5 | X889: -0.125 | Y889: -0.38890000000000002 | AA889: =(N889+O889+P889+Q889+R889+S889+T889+U889+V889+W889+X889+Y889)/12 -> -4.5500000000000028e-03 | AB889: =(G889+H889+I889+J889+K889+L889+M889+N889+O889+P889+Q889+R889+S889+T889+U889+V889+W889+X889+Y889)/19 -> -2.8736842105263178e-03 | AC889: =(R889+S889)/2 -> 0 | AD889: =(S889+T889)/2 -> 0 | AE889: =(T889+U889)/2 -> 0 | AF889: =(U889+V889)/2 -> -2.035e-02 | AG889: =(V889+W889)/2 -> 0.22964999999999999 | AH889: =(W889+X889)/2 -> 0.1875 | AI889: =(X889+Y889)/2 -> -0.25695000000000001 | AJ889: =STDEV(G889:Y889) -> 0.37317529839652214
B890: 600897.SH | C890: 厦门空港
B891: 600180.SH | C891: 瑞茂通 | E891: 0.78689999999999993 | F891: 0.54700000000000004 | G891: 0.87980000000000003 | H891: 0.70099999999999996 | I891: 0.20620000000000002 | J891: 0.3458 | K891: -3.1400000000000004e-02 | L891: 0.1201 | M891: 6.7799999999999999e-02 | N891: -0.33450000000000002 | O891: -8.6699999999999999e-02 | P891: -8.1099999999999992e-02 | Q891: -4.1200000000000001e-02 | R891: -0.13059999999999999 | S891: -0.47729999999999995 | T891: -0.54210000000000003 | U891: -0.58219999999999994 | V891: -0.62060000000000004 | W891: 0.64810000000000001 | X891: 1.0318000000000001 | Y891: 2.6743000000000001 | AA891: =(N891+O891+P891+Q891+R891+S891+T891+U891+V891+W891+X891+Y891)/12 -> 0.12149166666666671 | AB891: =(G891+H891+I891+J891+K891+L891+M891+N891+O891+P891+Q891+R891+S891+T891+U891+V891+W891+X891+Y891)/19 -> 0.19722105263157896 | AC891: =(R891+S891)/2 -> -0.30394999999999994 | AD891: =(S891+T891)/2 -> -0.50970000000000004 | AE891: =(T891+U891)/2 -> -0.56214999999999993 | AF891: =(U891+V891)/2 -> -0.60139999999999993 | AG891: =(V891+W891)/2 -> 1.3749999999999984e-02 | AH891: =(W891+X891)/2 -> 0.83994999999999997 | AI891: =(X891+Y891)/2 -> 1.8530500000000001 | AJ891: =STDEV(G891:Y891) -> 0.77228296453433543 | AK891: 1.7021999999999999 | AL891: 1.0996999999999999 | AM891: 0.97970000000000002 | AN891: 0.63200000000000001 | AO891: 0.8751000000000001 | AP891: 0.38789999999999997 | AQ891: 0.13019999999999998 | AR891: 2.69e-02 | AS891: -0.29969999999999997 | AT891: -0.20469999999999999 | AU891: -9.1300000000000006e-02 | AV891: 4.4600000000000001e-02 | AW891: -5.6000000000000008e-03 | AX891: -0.191 | AY891: -9.3999999999999986e-03 | AZ891: -0.19109999999999999 | BA891: 0.25619999999999998 | BB891: 0.41889999999999999 | BC891: 0.19149999999999998 | BE891: =(AR891+AS891+AT891+AU891+AV891+AW891+AX891+AY891+AZ891+BA891+BB891+BC891)/12 -> -4.5583333333333378e-03 | BF891: =(AK891+AL891+AM891+AN891+AO891+AP891+AQ891+AR891+AS891+AT891+AU891+AV891+AV891+AW891+AX891+AY891+AZ891+BA891+BB891+BC891)/19 -> 0.30508947368421052 | BG891: =(AV891+AW891)/2 -> 1.95e-02 | BH891: =(AW891+AX891)/2 -> -9.8299999999999998e-02 | BI891: =(AX891+AY891)/2 -> -0.1002 | BJ891: =(AY891+AZ891)/2 -> -0.10024999999999999 | BK891: =(AZ891+BA891)/2 -> 3.2549999999999996e-02 | BL891: =(BA891+BB891)/2 -> 0.33755000000000002 | BM891: =(BB891+BC891)/2 -> 0.30519999999999997 | BN891: =STDEV(AK891:BC891) -> 0.53497430292989001
B892: 000411.SZ | C892: 英特集团
B893: 002056.SZ | C893: 横店东磁 | E893: 0.47320000000000001 | F893: 0.68500000000000005 | G893: -0.66670000000000007 | H893: 7.1399999999999991e-02 | I893: 0.26319999999999999 | J893: 0.37040000000000001 | K893: 0.75 | L893: 0.48149999999999998 | M893: 0.33329999999999999 | N893: 0.1351 | O893: -1.43e-02 | P893: 0 | Q893: -6.25e-02 | R893: 0 | S893: -0.22320000000000001 | T893: 5.6500000000000002e-02 | U893: 0.35200000000000004 | V893: 0.47619999999999996 | W893: 1.9627000000000001 | X893: 0.58920000000000006 | Y893: 0.34200000000000003 | AA893: =(N893+O893+P893+Q893+R893+S893+T893+U893+V893+W893+X893+Y893)/12 -> 0.3011416666666667 | AB893: =(G893+H893+I893+J893+K893+L893+M893+N893+O893+P893+Q893+R893+S893+T893+U893+V893+W893+X893+Y893)/19 -> 0.27456842105263152 | AC893: =(R893+S893)/2 -> -0.1116 | AD893: =(S893+T893)/2 -> -8.3350000000000007e-02 | AE893: =(T893+U893)/2 -> 0.20425000000000001 | AF893: =(U893+V893)/2 -> 0.41410000000000002 | AG893: =(V893+W893)/2 -> 1.2194500000000001 | AH893: =(W893+X893)/2 -> 1.2759500000000001 | AI893: =(X893+Y893)/2 -> 0.46560000000000001 | AJ893: =STDEV(G893:Y893) -> 0.52022833987974459
B894: 000987.SZ | C894: 越秀金控
B895: 002020.SZ | C895: 京新药业
B896: 002393.SZ | C896: 力生制药 | E896: 0.13780000000000001 | F896: 0.54000000000000004 | H896: 0.13159999999999999 | I896: 0.27910000000000001 | J896: 1.5900000000000001e-02 | K896: 0 | L896: -0.11630000000000001 | M896: 5.45e-02 | N896: 0.57810000000000006 | O896: 9.0899999999999995e-02 | P896: 0.28949999999999998 | Q896: 0.27589999999999998 | R896: 1.9799999999999998e-02 | S896: -0.20829999999999999 | T896: -0.36729999999999996 | U896: -0.41889999999999999 | V896: -0.95150000000000001 | W896: 5.2600000000000001e-02 | X896: 9.6799999999999997e-02 | Y896: 0.25579999999999997 | AA896: =(N896+O896+P896+Q896+R896+S896+T896+U896+V896+W896+X896+Y896)/12 -> -2.3883333333333336e-02 | AB896: =(H896+I896+J896+K896+L896+M896+N896+O896+P896+Q896+R896+S896+T896+U896+V896+W896+X896+Y896)/18 -> 4.3444444444444563e-03 | AC896: =(R896+S896)/2 -> -9.425e-02 | AD896: =(S896+T896)/2 -> -0.28779999999999994 | AE896: =(T896+U896)/2 -> -0.3931 | AF896: =(U896+V896)/2 -> -0.68520000000000003 | AG896: =(V896+W896)/2 -> -0.44945000000000002 | AH896: =(W896+X896)/2 -> 7.4700000000000003e-02 | AI896: =(X896+Y896)/2 -> 0.17629999999999998 | AJ896: =STDEV(G896:Y896) -> 0.33877879165201974 | AK896: 3.6900000000000002e-02 | AL896: 0.28920000000000001 | AM896: 0.26890000000000003 | AN896: 0.21299999999999999 | AO896: 0.52469999999999994 | AP896: 0.37659999999999999 | AQ896: 0.32179999999999997 | AR896: 0.47310000000000002 | AS896: 0.30359999999999998 | AT896: 0.20629999999999998 | AU896: 0.23260000000000003 | AV896: 0.16250000000000001 | AW896: -0.13949999999999999 | AX896: -0.2263 | AY896: -0.32000000000000001 | AZ896: -0.33159999999999995 | BA896: -0.2419 | BB896: -0.1648 | BC896: -9.4200000000000006e-02 | BE896: =(AR896+AS896+AT896+AU896+AV896+AW896+AX896+AY896+AZ896+BA896+BB896+BC896)/12 -> -1.1683333333333337e-02 | BF896: =(AK896+AL896+AM896+AN896+AO896+AP896+AQ896+AR896+AS896+AT896+AU896+AV896+AV896+AW896+AX896+AY896+AZ896+BA896+BB896+BC896)/19 -> 0.10807368421052634 | BG896: =(AV896+AW896)/2 -> 1.150000000000001e-02 | BH896: =(AW896+AX896)/2 -> -0.18290000000000001 | BI896: =(AX896+AY896)/2 -> -0.27315 | BJ896: =(AY896+AZ896)/2 -> -0.32579999999999998 | BK896: =(AZ896+BA896)/2 -> -0.28674999999999995 | BL896: =(BA896+BB896)/2 -> -0.20335 | BM896: =(BB896+BC896)/2 -> -0.1295 | BN896: =STDEV(AK896:BC896) -> 0.27404653412421959
B897: 002643.SZ | C897: 万润股份 | G897: -0.57689999999999997 | H897: 9.0899999999999995e-02 | I897: 0.13789999999999999 | J897: 0.1351 | K897: -0.36359999999999998 | L897: -0.125 | M897: 3.0299999999999997e-02 | N897: 0.16670000000000001 | O897: 0.57140000000000002 | P897: 0.1905 | Q897: 0.17649999999999999 | R897: 0.1429 | S897: 0.2727 | T897: -4.0000000000000001e-02 | U897: -5.0000000000000003e-02 | V897: 0 | W897: 0 | X897: 0.375 | Y897: 0.42109999999999997 | AA897: =(N897+O897+P897+Q897+R897+S897+T897+U897+V897+W897+X897+Y897)/12 -> 0.18556666666666666 | AB897: =(G897+H897+I897+J897+K897+L897+M897+N897+O897+P897+Q897+R897+S897+T897+U897+V897+W897+X897+Y897)/19 -> 8.186842105263159e-02 | AC897: =(R897+S897)/2 -> 0.20779999999999998 | AD897: =(S897+T897)/2 -> 0.11635 | AE897: =(T897+U897)/2 -> -4.4999999999999998e-02 | AF897: =(U897+V897)/2 -> -2.5000000000000001e-02 | AG897: =(V897+W897)/2 -> 0 | AH897: =(W897+X897)/2 -> 0.1875 | AI897: =(X897+Y897)/2 -> 0.39805000000000001 | AJ897: =STDEV(G897:Y897) -> 0.2622882024979214 | AK897: 0.39079999999999998 | AL897: 0.33990000000000004 | AM897: 0.29189999999999999 | AN897: 0.31540000000000001 | AO897: -1.49e-02 | AP897: 2.69e-02 | AQ897: 1.7600000000000001e-02 | AR897: 5.0099999999999999e-02 | AS897: 0.22989999999999999 | AT897: 0.1429 | AU897: 0.2041 | AV897: 0.19039999999999999 | AW897: 5.8400000000000001e-02 | AX897: 5.2699999999999997e-02 | AY897: -6.1200000000000004e-02 | AZ897: -9.4700000000000006e-02 | BA897: 0.27390000000000003 | BB897: 0.32069999999999999 | BC897: 0.69689999999999996 | BE897: =(AR897+AS897+AT897+AU897+AV897+AW897+AX897+AY897+AZ897+BA897+BB897+BC897)/12 -> 0.17200833333333332 | BF897: =(AK897+AL897+AM897+AN897+AO897+AP897+AQ897+AR897+AS897+AT897+AU897+AV897+AV897+AW897+AX897+AY897+AZ897+BA897+BB897+BC897)/19 -> 0.19063684210526313 | BG897: =(AV897+AW897)/2 -> 0.1244 | BH897: =(AW897+AX897)/2 -> 5.5550000000000002e-02 | BI897: =(AX897+AY897)/2 -> -4.2500000000000038e-03 | BJ897: =(AY897+AZ897)/2 -> -7.7950000000000005e-02 | BK897: =(AZ897+BA897)/2 -> 8.9600000000000013e-02 | BL897: =(BA897+BB897)/2 -> 0.29730000000000001 | BM897: =(BB897+BC897)/2 -> 0.50879999999999992 | BN897: =STDEV(AK897:BC897) -> 0.19300398459662804
B898: 002802.SZ | C898: 洪汇新材
B899: 002829.SZ | C899: 星网宇达 | E899: 0.40159999999999996 | F899: 0.54000000000000004 | G899: -0.16670000000000001 | H899: -0.6129 | I899: -0.67569999999999997 | J899: -0.3594 | K899: -0.59999999999999998 | L899: -0.33329999999999999 | M899: -0.45829999999999999 | N899: -0.70730000000000004 | O899: 0.5 | P899: -0.875 | Q899: -0.76919999999999999 | R899: -0.33329999999999999 | S899: 1.3333000000000002 | T899: 19 | U899: 16.333299999999998 | V899: 7.75 | W899: 0.71430000000000005 | X899: 5.0000000000000003e-02 | Y899: 3.85e-02 | AA899: =(N899+O899+P899+Q899+R899+S899+T899+U899+V899+W899+X899+Y899)/12 -> 3.5862166666666657 | AB899: =(G899+H899+I899+J899+K899+L899+M899+N899+O899+P899+Q899+R899+S899+T899+U899+V899+W899+X899+Y899)/19 -> 2.0962263157894734 | AC899: =(R899+S899)/2 -> 0.50000000000000011 | AD899: =(S899+T899)/2 -> 10.166650000000001 | AE899: =(T899+U899)/2 -> 17.666649999999997 | AF899: =(U899+V899)/2 -> 12.041649999999999 | AG899: =(V899+W899)/2 -> 4.2321499999999999 | AH899: =(W899+X899)/2 -> 0.38215000000000005 | AI899: =(X899+Y899)/2 -> 4.4249999999999998e-02 | AJ899: =STDEV(G899:Y899) -> 5.8239491741564757
B900: 002839.SZ | C900: 张家港行 | E900: 9.3999999999999986e-03 | F900: 0.71799999999999997 | G900: 0 | H900: 0 | I900: -3.1300000000000001e-02 | J900: 2.3799999999999998e-02 | K900: 8.3299999999999999e-02 | L900: 0.14999999999999999 | M900: 0.1613 | N900: 6.9800000000000001e-02 | O900: 7.690000000000001e-02 | P900: 0.13039999999999999 | Q900: 0.1389 | R900: 0.1522 | S900: 0.1429 | T900: 3.85e-02 | U900: 2.4399999999999998e-02 | V900: 3.7699999999999997e-02 | W900: 0.125 | X900: 0.22219999999999998 | Y900: 0.28570000000000001 | AA900: =(N900+O900+P900+Q900+R900+S900+T900+U900+V900+W900+X900+Y900)/12 -> 0.12038333333333334 | AB900: =(G900+H900+I900+J900+K900+L900+M900+N900+O900+P900+Q900+R900+S900+T900+U900+V900+W900+X900+Y900)/19 -> 9.640526315789473e-02 | AC900: =(R900+S900)/2 -> 0.14755000000000001 | AD900: =(S900+T900)/2 -> 9.0700000000000003e-02 | AE900: =(T900+U900)/2 -> 3.1449999999999999e-02 | AF900: =(U900+V900)/2 -> 3.1049999999999998e-02 | AG900: =(V900+W900)/2 -> 8.1350000000000006e-02 | AH900: =(W900+X900)/2 -> 0.17359999999999998 | AI900: =(X900+Y900)/2 -> 0.25395000000000001 | AJ900: =STDEV(G900:Y900) -> 8.2059155313470272e-02 | AT900: 1.9674 | AU900: -7.1300000000000002e-02 | AV900: 0.16109999999999999 | AW900: -0.29160000000000003 | AX900: 0.74580000000000002 | AY900: 0.43200000000000005 | AZ900: 0.51619999999999999 | BA900: 0.28839999999999999 | BB900: -0.2477 | BC900: -3.4599999999999999e-02 | BE900: =(AR900+AS900+AT900+AU900+AV900+AW900+AX900+AY900+AZ900+BA900+BB900+BC900)/12 -> 0.28880833333333333 | BF900: =(AK900+AL900+AM900+AN900+AO900+AP900+AQ900+AR900+AS900+AT900+AU900+AV900+AV900+AW900+AX900+AY900+AZ900+BA900+BB900+BC900)/19 -> 0.19088421052631577 | BG900: =(AV900+AW900)/2 -> -6.5250000000000016e-02 | BH900: =(AW900+AX900)/2 -> 0.2271 | BI900: =(AX900+AY900)/2 -> 0.58889999999999998 | BJ900: =(AY900+AZ900)/2 -> 0.47410000000000002 | BK900: =(AZ900+BA900)/2 -> 0.40229999999999999 | BL900: =(BA900+BB900)/2 -> 2.0349999999999993e-02 | BM900: =(BB900+BC900)/2 -> -0.14115 | BN900: =STDEV(AK900:BC900) -> 0.6617026573754845
B901: 002926.SZ | C901: 华西证券
B902: 600848.SH | C902: 上海临港
B903: 601339.SH | C903: 百隆东方 | E903: 0.35749999999999998 | F903: 0.54000000000000004 | G903: 0.1429 | H903: 5.0000000000000003e-02 | I903: -3.7000000000000005e-02 | J903: -0.17499999999999999 | K903: -0.25 | L903: 4.7599999999999996e-02 | M903: 0.1923 | N903: -0.12119999999999999 | O903: 0.33329999999999999 | P903: -0.31819999999999998 | Q903: -0.35479999999999995 | R903: -0.31030000000000002 | S903: -0.375 | T903: -0.40000000000000002 | U903: -0.40000000000000002 | V903: 0.25 | W903: 2 | X903: 3.1099999999999999 | Y903: 3.5 | AA903: =(N903+O903+P903+Q903+R903+S903+T903+U903+V903+W903+X903+Y903)/12 -> 0.57615000000000005 | AB903: =(G903+H903+I903+J903+K903+L903+M903+N903+O903+P903+Q903+R903+S903+T903+U903+V903+W903+X903+Y903)/19 -> 0.36234736842105264 | AC903: =(R903+S903)/2 -> -0.34265000000000001 | AD903: =(S903+T903)/2 -> -0.38750000000000001 | AE903: =(T903+U903)/2 -> -0.40000000000000002 | AF903: =(U903+V903)/2 -> -7.5000000000000011e-02 | AG903: =(V903+W903)/2 -> 1.125 | AH903: =(W903+X903)/2 -> 2.5549999999999997 | AI903: =(X903+Y903)/2 -> 3.3049999999999997 | AJ903: =STDEV(G903:Y903) -> 1.1680103326067042 | AK903: 0.1671 | AL903: 0.18679999999999999 | AM903: 0.121 | AN903: 0.2112 | AO903: 0.12640000000000001 | AP903: -4.99e-02 | AQ903: -2.9100000000000001e-02 | AR903: -6.1799999999999994e-02 | AS903: -4.0000000000000001e-02 | AT903: -2.5000000000000001e-03 | AU903: 1.1599999999999999e-02 | AV903: 5.9000000000000004e-02 | AW903: -2.2799999999999997e-02 | AX903: -2.4e-02 | AY903: -7.51e-02 | AZ903: -4.1200000000000001e-02 | BA903: 0.46310000000000001 | BB903: 0.39789999999999998 | BC903: 0.33950000000000002 | BE903: =(AR903+AS903+AT903+AU903+AV903+AW903+AX903+AY903+AZ903+BA903+BB903+BC903)/12 -> 8.364166666666667e-02 | BF903: =(AK903+AL903+AM903+AN903+AO903+AP903+AQ903+AR903+AS903+AT903+AU903+AV903+AV903+AW903+AX903+AY903+AZ903+BA903+BB903+BC903)/19 -> 9.4536842105263141e-02 | BG903: =(AV903+AW903)/2 -> 1.8100000000000005e-02 | BH903: =(AW903+AX903)/2 -> -2.3399999999999997e-02 | BI903: =(AX903+AY903)/2 -> -4.9549999999999997e-02 | BJ903: =(AY903+AZ903)/2 -> -5.815e-02 | BK903: =(AZ903+BA903)/2 -> 0.21095 | BL903: =(BA903+BB903)/2 -> 0.43049999999999999 | BM903: =(BB903+BC903)/2 -> 0.36870000000000003 | BN903: =STDEV(AK903:BC903) -> 0.16466507102004083
B904: 601633.SH | C904: 长城汽车 | G904: -0.184 | H904: -0.50880000000000003 | I904: -0.60049999999999992 | J904: -0.52349999999999997 | K904: 6.4399999999999999e-02 | L904: 0.52729999999999999 | M904: 0.36349999999999999 | N904: 3.5799999999999998e-02 | O904: -0.62850000000000006 | P904: -0.58950000000000002 | Q904: -0.2571 | R904: -0.1411 | S904: -1.8263999999999998 | T904: -0.27800000000000002 | U904: -0.12390000000000001 | V904: 0.2041 | W904: 3.5713999999999997 | X904: 2.25 | Y904: 0.92859999999999998 | AA904: =(N904+O904+P904+Q904+R904+S904+T904+U904+V904+W904+X904+Y904)/12 -> 0.26211666666666666 | AB904: =(G904+H904+I904+J904+K904+L904+M904+N904+O904+P904+Q904+R904+S904+T904+U904+V904+W904+X904+Y904)/19 -> 0.12019999999999999 | AC904: =(R904+S904)/2 -> -0.9837499999999999 | AD904: =(S904+T904)/2 -> -1.0522 | AE904: =(T904+U904)/2 -> -0.20095000000000002 | AF904: =(U904+V904)/2 -> 4.0099999999999997e-02 | AG904: =(V904+W904)/2 -> 1.8877499999999998 | AH904: =(W904+X904)/2 -> 2.9106999999999998 | AI904: =(X904+Y904)/2 -> 1.5892999999999999 | AJ904: =STDEV(G904:Y904) -> 1.155824302776546
B905: 603358.SH | C905: 华达科技 | E905: 0.4153 | F905: 0.54000000000000004 | G905: 0.11359999999999999 | H905: -0.17309999999999998 | I905: -0.31739999999999996 | J905: -0.41739999999999999 | K905: 4.0800000000000003e-02 | L905: -0.25579999999999997 | M905: -0.49119999999999997 | N905: -0.53189999999999993 | O905: -0.76469999999999994 | P905: -0.65629999999999999 | Q905: -0.3276 | R905: -0.24239999999999998 | S905: -0.16670000000000001 | T905: 0.13639999999999999 | U905: 0 | V905: 0.46000000000000002 | W905: 2 | X905: 0.56000000000000005 | Y905: 0.3846 | AA905: =(N905+O905+P905+Q905+R905+S905+T905+U905+V905+W905+X905+Y905)/12 -> 7.0950000000000055e-02 | AB905: =(G905+H905+I905+J905+K905+L905+M905+N905+O905+P905+Q905+R905+S905+T905+U905+V905+W905+X905+Y905)/19 -> -3.4163157894736798e-02 | AC905: =(R905+S905)/2 -> -0.20455000000000001 | AD905: =(S905+T905)/2 -> -1.5150000000000011e-02 | AE905: =(T905+U905)/2 -> 6.8199999999999997e-02 | AF905: =(U905+V905)/2 -> 0.23000000000000001 | AG905: =(V905+W905)/2 -> 1.23 | AH905: =(W905+X905)/2 -> 1.28 | AI905: =(X905+Y905)/2 -> 0.47230000000000005 | AJ905: =STDEV(G905:Y905) -> 0.61409546960507178
B906: 603848.SH | C906: 好太太 | E906: 0.19519999999999998 | F906: 0.54000000000000004 | J906: 0.35710000000000003 | K906: 0.33329999999999999 | L906: 0.40000000000000002 | M906: 0.21050000000000002 | N906: 0.1404 | O906: 8.3299999999999999e-02 | P906: 0 | Q906: -4.3499999999999997e-02 | R906: 7.690000000000001e-02 | S906: -0.61539999999999995 | T906: -0.28570000000000001 | U906: -0.13639999999999999 | V906: -5.7099999999999998e-02 | W906: 1.2 | X906: 0.59999999999999998 | Y906: 0.42109999999999997 | AA906: =(N906+O906+P906+Q906+R906+S906+T906+U906+V906+W906+X906+Y906)/12 -> 0.1153 | AB906: =(J906+K906+L906+M906+N906+O906+P906+Q906+R906+S906+T906+U906+V906+W906+X906+Y906)/16 -> 0.16778124999999999 | AC906: =(R906+S906)/2 -> -0.26924999999999999 | AD906: =(S906+T906)/2 -> -0.45055000000000001 | AE906: =(T906+U906)/2 -> -0.21105000000000002 | AF906: =(U906+V906)/2 -> -9.6750000000000003e-02 | AG906: =(V906+W906)/2 -> 0.57145000000000001 | AH906: =(W906+X906)/2 -> 0.89999999999999991 | AI906: =(X906+Y906)/2 -> 0.51054999999999995 | AJ906: =STDEV(G906:Y906) -> 0.40714452179170973
B907: 600639.SH | C907: 浦东金桥 | G907: 1.0283 | H907: 6.7199999999999996e-02 | I907: 0.1565 | J907: 0.1956 | K907: 2.7900000000000001e-02 | L907: 7.8700000000000006e-02 | M907: 3.9399999999999998e-02 | N907: 0.32500000000000001 | O907: 9.7200000000000009e-02 | P907: 0.1114 | Q907: 4.3299999999999998e-02 | R907: 0.1104 | S907: 0.95400000000000007 | T907: 0.22800000000000001 | U907: 0.15810000000000002 | V907: 2.1000000000000001e-02 | W907: -0.7127 | X907: -0.18809999999999999 | Y907: -0.124 | AC907: =(R907+S907)/2 -> 0.53220000000000001 | AD907: =(S907+T907)/2 -> 0.59100000000000008 | AE907: =(T907+U907)/2 -> 0.19305 | AF907: =(U907+V907)/2 -> 8.9550000000000005e-02 | AG907: =(V907+W907)/2 -> -0.34584999999999999 | AH907: =(W907+X907)/2 -> -0.45040000000000002 | AI907: =(X907+Y907)/2 -> -0.15604999999999999 | AJ907: =STDEV(G907:Y907) -> 0.36971924388412025
B908: 002156.SZ | C908: 通富微电
B909: 600901.SH | C909: 江苏租赁
B910: 601019.SH | C910: 山东出版 | E910: 0.36909999999999998 | F910: 0.53000000000000003 | I910: 0.1522 | J910: 0.27589999999999998 | K910: -9.0899999999999995e-02 | L910: -2.7000000000000003e-02 | M910: 1.89e-02 | N910: -4.0500000000000001e-02 | O910: 0 | P910: 2.7799999999999998e-02 | Q910: -3.7000000000000005e-02 | R910: 4.2300000000000004e-02 | S910: -0.29999999999999999 | T910: -0.40539999999999998 | U910: -0.30769999999999997 | V910: -9.4600000000000004e-02 | W910: 0.1429 | X910: 0.77269999999999994 | Y910: 0.47220000000000001 | AA910: =(N910+O910+P910+Q910+R910+S910+T910+U910+V910+W910+X910+Y910)/12 -> 2.2724999999999999e-02 | AB910: =(I910+J910+K910+L910+M910+N910+O910+P910+Q910+R910+S910+T910+U910+V910+W910+X910+Y910)/17 -> 3.5399999999999994e-02 | AC910: =(R910+S910)/2 -> -0.12884999999999999 | AD910: =(S910+T910)/2 -> -0.35270000000000001 | AE910: =(T910+U910)/2 -> -0.35654999999999998 | AF910: =(U910+V910)/2 -> -0.20115 | AG910: =(V910+W910)/2 -> 2.4149999999999998e-02 | AH910: =(W910+X910)/2 -> 0.45779999999999998 | AI910: =(X910+Y910)/2 -> 0.62244999999999995 | AJ910: =STDEV(G910:Y910) -> 0.28409268733988913 | AM910: 1.7000000000000001e-03 | AN910: 0.1246 | AO910: 0.23749999999999999 | AP910: 0.2457 | AQ910: 0.20999999999999999 | AR910: 0.14249999999999999 | AS910: -0.2311 | AT910: -0.16010000000000002 | AU910: -0.10210000000000001 | AV910: -1.1999999999999999e-03 | AW910: -0.36180000000000001 | AX910: -0.18440000000000001 | AY910: 6.6199999999999995e-02 | AZ910: 1.61e-02 | BA910: 0.88529999999999998 | BB910: 0.65980000000000005 | BC910: 0.23999999999999999 | BE910: =(AR910+AS910+AT910+AU910+AV910+AW910+AX910+AY910+AZ910+BA910+BB910+BC910)/12 -> 8.0766666666666667e-02 | BF910: =(AK910+AL910+AM910+AN910+AO910+AP910+AQ910+AR910+AS910+AT910+AU910+AV910+AV910+AW910+AX910+AY910+AZ910+BA910+BB910+BC910)/19 -> 9.407894736842104e-02 | BG910: =(AV910+AW910)/2 -> -0.18149999999999999 | BH910: =(AW910+AX910)/2 -> -0.27310000000000001 | BI910: =(AX910+AY910)/2 -> -5.9100000000000007e-02 | BJ910: =(AY910+AZ910)/2 -> 4.1149999999999999e-02 | BK910: =(AZ910+BA910)/2 -> 0.45069999999999999 | BL910: =(BA910+BB910)/2 -> 0.77255000000000007 | BM910: =(BB910+BC910)/2 -> 0.44990000000000002 | BN910: =STDEV(AK910:BC910) -> 0.31066538316027048
B911: 601988.SH | C911: 中国银行
B912: 603600.SH | C912: 永艺股份
B913: 603685.SH | C913: 晨丰科技
B914: 002081.SZ | C914: 金螳螂
B915: 002581.SZ | C915: 未名医药
B916: 002394.SZ | C916: 联发股份
B917: 601377.SH | C917: 兴业证券
B918: 002815.SZ | C918: 崇达技术 | E918: 0.45520000000000005 | F918: 0.52300000000000002 | G918: -2.87e-02 | H918: -0.50979999999999992 | I918: -0.50340000000000007 | J918: 7.3399999999999993e-02 | K918: -0.33030000000000004 | L918: 0.35999999999999999 | M918: 0.33169999999999999 | N918: -0.37189999999999995 | O918: -4.7400000000000005e-02 | P918: -5.8799999999999998e-02 | Q918: -0.1152 | R918: -7.3499999999999996e-02 | S918: -4.4400000000000002e-02 | T918: -3.1300000000000001e-02 | U918: -9.1400000000000009e-02 | V918: -0.20629999999999998 | W918: -2.1099999999999997e-02 | X918: -9.6799999999999997e-02 | Y918: 0.22989999999999999 | AA918: =(N918+O918+P918+Q918+R918+S918+T918+U918+V918+W918+X918+Y918)/12 -> -7.7349999999999988e-02 | AB918: =(G918+H918+I918+J918+K918+L918+M918+N918+O918+P918+Q918+R918+S918+T918+U918+V918+W918+X918+Y918)/19 -> -8.0805263157894713e-02 | AC918: =(R918+S918)/2 -> -5.8950000000000002e-02 | AD918: =(S918+T918)/2 -> -3.7850000000000002e-02 | AE918: =(T918+U918)/2 -> -6.1350000000000002e-02 | AF918: =(U918+V918)/2 -> -0.14884999999999998 | AG918: =(V918+W918)/2 -> -0.1137 | AH918: =(W918+X918)/2 -> -5.8949999999999995e-02 | AI918: =(X918+Y918)/2 -> 6.6549999999999998e-02 | AJ918: =STDEV(G918:Y918) -> 0.23844435286918556 | AK918: 0.41739999999999999 | AL918: 0.45280000000000004 | AM918: 0.4042 | AN918: 0.43759999999999999 | AO918: 0.31090000000000001 | AP918: 0.23629999999999998 | AQ918: 0.21149999999999999 | AR918: 0.22489999999999999 | AS918: 0.20079999999999998 | AT918: 0.10550000000000001 | AU918: 4.0899999999999999e-02 | AV918: -8.0500000000000002e-02 | AW918: -0.17249999999999999 | AX918: -7.4000000000000003e-03 | AY918: -4.0300000000000002e-02 | AZ918: 9.5199999999999993e-02 | BA918: 0.32479999999999998 | BB918: 0.1605 | BC918: 0.33110000000000001 | BE918: =(AR918+AS918+AT918+AU918+AV918+AW918+AX918+AY918+AZ918+BA918+BB918+BC918)/12 -> 9.8583333333333342e-02 | BF918: =(AK918+AL918+AM918+AN918+AO918+AP918+AQ918+AR918+AS918+AT918+AU918+AV918+AV918+AW918+AX918+AY918+AZ918+BA918+BB918+BC918)/19 -> 0.18806315789473688 | BG918: =(AV918+AW918)/2 -> -0.1265 | BH918: =(AW918+AX918)/2 -> -8.9949999999999988e-02 | BI918: =(AX918+AY918)/2 -> -2.3850000000000003e-02 | BJ918: =(AY918+AZ918)/2 -> 2.7449999999999995e-02 | BK918: =(AZ918+BA918)/2 -> 0.20999999999999999 | BL918: =(BA918+BB918)/2 -> 0.24264999999999998 | BM918: =(BB918+BC918)/2 -> 0.24580000000000002 | BN918: =STDEV(AK918:BC918) -> 0.18563836409056783
B919: 600368.SH | C919: 五洲交通 | E919: 0.47560000000000002 | F919: 0.52100000000000002 | G919: 0.36359999999999998 | H919: 0.5907 | I919: 0.49469999999999997 | J919: 0.65170000000000006 | K919: 0.26669999999999999 | L919: -0.22769999999999999 | M919: -0.26100000000000001 | N919: -0.13639999999999999 | O919: 2.0526 | P919: 2.1166999999999998 | Q919: 1.9140999999999999 | R919: 1.0518000000000001 | S919: -1.0517000000000001 | T919: -0.95250000000000001 | U919: -0.43420000000000003 | V919: -0.35869999999999996 | W919: 6.6666999999999996 | X919: 10.3133 | Y919: 0.20929999999999999 | AA919: =(N919+O919+P919+Q919+R919+S919+T919+U919+V919+W919+X919+Y919)/12 -> 1.7825833333333332 | AB919: =(G919+H919+I919+J919+K919+L919+M919+N919+O919+P919+Q919+R919+S919+T919+U919+V919+W919+X919+Y919)/19 -> 1.224721052631579 | AC919: =(R919+S919)/2 -> 4.9999999999994493e-05 | AD919: =(S919+T919)/2 -> -1.0021 | AE919: =(T919+U919)/2 -> -0.69335000000000002 | AF919: =(U919+V919)/2 -> -0.39644999999999997 | AG919: =(V919+W919)/2 -> 3.1539999999999999 | AH919: =(W919+X919)/2 -> 8.4900000000000002 | AI919: =(X919+Y919)/2 -> 5.2613000000000003 | AJ919: =STDEV(G919:Y919) -> 2.7839660711092939
B920: 000686.SZ | C920: 东北证券 | F920: 0.69999999999999996 | G920: -0.57889999999999997 | H920: -0.51849999999999996 | I920: -0.48080000000000001 | J920: -0.51719999999999999 | K920: -0.25 | L920: -0.15380000000000002 | M920: -0.55559999999999998 | N920: -0.53569999999999995 | O920: 3 | P920: 1.2726999999999999 | Q920: 2.0832999999999999 | R920: 2.3077000000000001 | S920: -0.41670000000000001 | T920: 0.12 | U920: 0.1351 | V920: 0.3256 | W920: 0 | X920: 7.1399999999999991e-02 | Y920: 0.23809999999999998 | AA920: =(N920+O920+P920+Q920+R920+S920+T920+U920+V920+W920+X920+Y920)/12 -> 0.7167916666666666 | AB920: =(G920+H920+I920+J920+K920+L920+M920+N920+O920+P920+Q920+R920+S920+T920+U920+V920+W920+X920+Y920)/19 -> 0.29193157894736838 | AC920: =(R920+S920)/2 -> 0.94550000000000001 | AD920: =(S920+T920)/2 -> -0.14835000000000001 | AE920: =(T920+U920)/2 -> 0.12755 | AF920: =(U920+V920)/2 -> 0.23035 | AG920: =(V920+W920)/2 -> 0.1628 | AH920: =(W920+X920)/2 -> 3.5699999999999996e-02 | AI920: =(X920+Y920)/2 -> 0.15475 | AJ920: =STDEV(G920:Y920) -> 1.0756051175721359
B921: 002003.SZ | C921: 伟星股份 | E921: 0.31989999999999996 | F921: 0.5 | G921: 0 | H921: -0.16 | I921: -0.13949999999999999 | J921: -9.2600000000000002e-02 | K921: 0 | L921: 0.1429 | M921: 8.1099999999999992e-02 | N921: -0.16329999999999997 | O921: 0.5 | P921: -8.3299999999999999e-02 | Q921: -7.4999999999999997e-02 | R921: -4.8799999999999996e-02 | S921: 0 | T921: 0.5 | U921: 0.2432 | V921: 0.33329999999999999 | W921: 1 | X921: -9.0899999999999995e-02 | Y921: 0.13039999999999999 | AA921: =(N921+O921+P921+Q921+R921+S921+T921+U921+V921+W921+X921+Y921)/12 -> 0.18713333333333335 | AB921: =(G921+H921+I921+J921+K921+L921+M921+N921+O921+P921+Q921+R921+S921+T921+U921+V921+W921+X921+Y921)/19 -> 0.10934210526315791 | AC921: =(R921+S921)/2 -> -2.4399999999999998e-02 | AD921: =(S921+T921)/2 -> 0.25 | AE921: =(T921+U921)/2 -> 0.37159999999999999 | AF921: =(U921+V921)/2 -> 0.28825000000000001 | AG921: =(V921+W921)/2 -> 0.66664999999999996 | AH921: =(W921+X921)/2 -> 0.45455000000000001 | AI921: =(X921+Y921)/2 -> 1.9749999999999997e-02 | AJ921: =STDEV(G921:Y921) -> 0.29726426013040519
B922: 002996.SZ | C922: 顺博合金 | T922: 5.5599999999999997e-02 | U922: 7.690000000000001e-02 | V922: 0.11359999999999999 | W922: 1 | X922: 0.84209999999999996 | Y922: 0.85709999999999997 | AA922: =(N922+O922+P922+Q922+R922+S922+T922+U922+V922+W922+X922+Y922)/12 -> 0.24544166666666667 | AB922: =(G922+H922+I922+J922+K922+L922+M922+N922+O922+P922+Q922+R922+S922+T922+U922+V922+W922+X922+Y922)/19 -> 0.15501578947368422 | AC922: =(R922+S922)/2 -> 0 | AD922: =(S922+T922)/2 -> 2.7799999999999998e-02 | AE922: =(T922+U922)/2 -> 6.6250000000000003e-02 | AF922: =(U922+V922)/2 -> 9.5250000000000001e-02 | AG922: =(V922+W922)/2 -> 0.55679999999999996 | AH922: =(W922+X922)/2 -> 0.92104999999999992 | AI922: =(X922+Y922)/2 -> 0.84959999999999991 | AJ922: =STDEV(G922:Y922) -> 0.4516334948458392
B923: 600802.SH | C923: 福建水泥
B924: 600867.SH | C924: 通化东宝
B925: 603128.SH | C925: 华贸物流 | G925: 0.5 | H925: -6.25e-02 | I925: -0.16 | J925: 0.12 | K925: 0.33329999999999999 | L925: 0.20000000000000001 | M925: 0.1905 | N925: 0.1429 | O925: -0.125 | P925: 0 | Q925: -0.20000000000000001 | R925: -0.15620000000000001 | S925: -0.42859999999999998 | T925: 0.16670000000000001 | U925: 0.55000000000000004 | V925: 0.51849999999999996 | W925: 2.5 | X925: 0.76190000000000002 | Y925: 0.6774 | AA925: =(N925+O925+P925+Q925+R925+S925+T925+U925+V925+W925+X925+Y925)/12 -> 0.36730000000000002 | AB925: =(G925+H925+I925+J925+K925+L925+M925+N925+O925+P925+Q925+R925+S925+T925+U925+V925+W925+X925+Y925)/19 -> 0.29099473684210525 | AC925: =(R925+S925)/2 -> -0.29239999999999999 | AD925: =(S925+T925)/2 -> -0.13094999999999998 | AE925: =(T925+U925)/2 -> 0.35835000000000006 | AF925: =(U925+V925)/2 -> 0.53425 | AG925: =(V925+W925)/2 -> 1.50925 | AH925: =(W925+X925)/2 -> 1.6309499999999999 | AI925: =(X925+Y925)/2 -> 0.71965000000000001 | AJ925: =STDEV(G925:Y925) -> 0.625612584657527
B926: 603278.SH | C926: 大业股份 | E926: 0.71479999999999999 | F926: 0.51900000000000002 | H926: 4.7599999999999996e-02 | I926: -4.1700000000000001e-02 | J926: -0.10869999999999999 | K926: -0.1429 | L926: 0.11359999999999999 | M926: 0.18840000000000001 | N926: -0.1341 | O926: 0.11109999999999999 | P926: -0.1429 | Q926: -0.41460000000000002 | R926: -0.2535 | S926: -1.1499999999999999 | T926: -0.66670000000000007 | U926: -0.4375 | V926: -0.33960000000000001 | W926: 7 | X926: 2.1429 | Y926: 0.92590000000000006 | AA926: =(N926+O926+P926+Q926+R926+S926+T926+U926+V926+W926+X926+Y926)/12 -> 0.55341666666666667 | AB926: =(G926+H926+I926+J926+K926+L926+M926+N926+O926+P926+Q926+R926+S926+T926+U926+V926+W926+X926+Y926)/19 -> 0.35248947368421052 | AC926: =(R926+S926)/2 -> -0.70174999999999998 | AD926: =(S926+T926)/2 -> -0.90834999999999999 | AE926: =(T926+U926)/2 -> -0.55210000000000004 | AF926: =(U926+V926)/2 -> -0.38855000000000001 | AG926: =(V926+W926)/2 -> 3.3302 | AH926: =(W926+X926)/2 -> 4.5714500000000005 | AI926: =(X926+Y926)/2 -> 1.5344 | AJ926: =STDEV(G926:Y926) -> 1.7888987301773305
B927: 603518.SH | C927: 锦泓集团
B928: 603992.SH | C928: 松霖科技
B929: 605598.SH | C929: 上海港湾 | W929: -0.25 | X929: 0.18179999999999999 | Y929: 0.20929999999999999 | AA929: =(N929+O929+P929+Q929+R929+S929+T929+U929+V929+W929+X929+Y929)/12 -> 1.1758333333333331e-02 | AB929: =(G929+H929+I929+J929+K929+L929+M929+N929+O929+P929+Q929+R929+S929+T929+U929+V929+W929+X929+Y929)/19 -> 7.4263157894736828e-03 | AC929: =(R929+S929)/2 -> 0 | AD929: =(S929+T929)/2 -> 0 | AE929: =(T929+U929)/2 -> 0 | AF929: =(U929+V929)/2 -> 0 | AG929: =(V929+W929)/2 -> -0.125 | AH929: =(W929+X929)/2 -> -3.4100000000000005e-02 | AI929: =(X929+Y929)/2 -> 0.19555 | AJ929: =STDEV(G929:Y929) -> 0.25760563529032771 | BA929: -0.128 | BB929: 4.3899999999999995e-02 | BC929: 0.19089999999999999 | BE929: =(AR929+AS929+AT929+AU929+AV929+AW929+AX929+AY929+AZ929+BA929+BB929+BC929)/12 -> 8.8999999999999982e-03 | BF929: =(AK929+AL929+AM929+AN929+AO929+AP929+AQ929+AR929+AS929+AT929+AU929+AV929+AV929+AW929+AX929+AY929+AZ929+BA929+BB929+BC929)/19 -> 5.6210526315789459e-03 | BG929: =(AV929+AW929)/2 -> 0 | BH929: =(AW929+AX929)/2 -> 0 | BI929: =(AX929+AY929)/2 -> 0 | BJ929: =(AY929+AZ929)/2 -> 0 | BK929: =(AZ929+BA929)/2 -> -6.4000000000000001e-02 | BL929: =(BA929+BB929)/2 -> -4.2050000000000004e-02 | BM929: =(BB929+BC929)/2 -> 0.11739999999999999 | BN929: =STDEV(AK929:BC929) -> 0.15961193564392356
B930: 002950.SZ | C930: 奥美医疗
B931: 603966.SH | C931: 法兰泰克
B932: 600590.SH | C932: 泰豪科技
B933: 600380.SH | C933: 健康元
B934: 600580.SH | C934: 卧龙电驱
B935: 002135.SZ | C935: 东南网架 | E935: 0.6573 | F935: 0.44900000000000001 | G935: 1 | H935: 1 | I935: 1 | J935: 1 | K935: 0.25 | L935: 0.5 | M935: 0.40000000000000002 | N935: 0.41670000000000001 | O935: 0.59999999999999998 | P935: 0.58329999999999993 | Q935: 0.64290000000000003 | R935: 0.52939999999999998 | S935: 0.25 | T935: 0.21050000000000002 | U935: 0.30430000000000001 | V935: 0 | W935: 0.5 | X935: 0.52170000000000005 | Y935: 0.69999999999999996 | AA935: =(N935+O935+P935+Q935+R935+S935+T935+U935+V935+W935+X935+Y935)/12 -> 0.43823333333333331 | AB935: =(G935+H935+I935+J935+K935+L935+M935+N935+O935+P935+Q935+R935+S935+T935+U935+V935+W935+X935+Y935)/19 -> 0.54783157894736834 | AC935: =(R935+S935)/2 -> 0.38969999999999999 | AD935: =(S935+T935)/2 -> 0.23025000000000001 | AE935: =(T935+U935)/2 -> 0.25740000000000002 | AF935: =(U935+V935)/2 -> 0.15215000000000001 | AG935: =(V935+W935)/2 -> 0.25 | AH935: =(W935+X935)/2 -> 0.51085000000000003 | AI935: =(X935+Y935)/2 -> 0.61085 | AJ935: =STDEV(G935:Y935) -> 0.29337810653116719 | AK935: 0.42009999999999997 | AL935: 0.14550000000000002 | AM935: 0.37939999999999996 | AN935: 0.3271 | AO935: 8.6899999999999991e-02 | AP935: 0.23350000000000001 | AQ935: 0.25540000000000002 | AR935: 0.17670000000000002 | AS935: 0.27079999999999999 | AT935: -4.1999999999999997e-03 | AU935: 3.9800000000000002e-02 | AV935: 6.6799999999999998e-02 | AW935: -6.1799999999999994e-02 | AX935: -0.16519999999999999 | AY935: -3.4300000000000004e-02 | AZ935: -1.06e-02 | BA935: 2.2099999999999998e-02 | BB935: 0.23000000000000001 | BC935: 6.9599999999999995e-02 | BE935: =(AR935+AS935+AT935+AU935+AV935+AW935+AX935+AY935+AZ935+BA935+BB935+BC935)/12 -> 4.9975000000000012e-02 | BF935: =(AK935+AL935+AM935+AN935+AO935+AP935+AQ935+AR935+AS935+AT935+AU935+AV935+AV935+AW935+AX935+AY935+AZ935+BA935+BB935+BC935)/19 -> 0.13233684210526317 | BG935: =(AV935+AW935)/2 -> 2.5000000000000022e-03 | BH935: =(AW935+AX935)/2 -> -0.11349999999999999 | BI935: =(AX935+AY935)/2 -> -9.9749999999999991e-02 | BJ935: =(AY935+AZ935)/2 -> -2.2450000000000001e-02 | BK935: =(AZ935+BA935)/2 -> 5.749999999999999e-03 | BL935: =(BA935+BB935)/2 -> 0.12605 | BM935: =(BB935+BC935)/2 -> 0.14979999999999999 | BN935: =STDEV(AK935:BC935) -> 0.16018128472642548
B936: 002234.SZ | C936: 民和股份 | E936: 0.1429 | F936: 0.47699999999999998 | G936: -2.0869999999999997 | H936: -2.1764999999999999 | I936: -2.1566000000000001 | J936: -2.8824000000000001 | K936: 0.80000000000000004 | L936: 1.1000000000000001 | M936: 1.4791999999999998 | N936: 2.3125 | O936: 26.600000000000001 | P936: 47 | Q936: 8.0216999999999992 | R936: 3.2302 | S936: -0.61719999999999997 | T936: -0.73260000000000003 | U936: -0.93730000000000002 | V936: -0.9587 | W936: -0.10199999999999999 | X936: -0.29870000000000002 | Y936: 0.96150000000000002 | AA936: =(N936+O936+P936+Q936+R936+S936+T936+U936+V936+W936+X936+Y936)/12 -> 7.0399500000000002 | AB936: =(G936+H936+I936+J936+K936+L936+M936+N936+O936+P936+Q936+R936+S936+T936+U936+V936+W936+X936+Y936)/19 -> 4.1345315789473682 | AC936: =(R936+S936)/2 -> 1.3065 | AD936: =(S936+T936)/2 -> -0.67490000000000006 | AE936: =(T936+U936)/2 -> -0.83495000000000008 | AF936: =(U936+V936)/2 -> -0.94799999999999995 | AG936: =(V936+W936)/2 -> -0.53034999999999999 | AH936: =(W936+X936)/2 -> -0.20035 | AI936: =(X936+Y936)/2 -> 0.33140000000000003 | AJ936: =STDEV(G936:Y936) -> 12.251363039227407 | AK936: -0.21899999999999997 | AL936: -0.21989999999999998 | AM936: -0.28949999999999998 | AN936: -0.21879999999999999 | AO936: 0.36599999999999999 | AP936: 0.36609999999999998 | AQ936: 0.58950000000000002 | AR936: 0.67909999999999993 | AS936: 1.3100000000000001 | AT936: 1.2886000000000002 | AU936: 0.98209999999999997 | AV936: 0.7551000000000001 | AW936: -0.38880000000000003 | AX936: -0.42729999999999996 | AY936: -0.44950000000000001 | AZ936: -0.47270000000000001 | BA936: 0.13830000000000001 | BB936: 0.1424 | BC936: 0.10830000000000001 | BE936: =(AR936+AS936+AT936+AU936+AV936+AW936+AX936+AY936+AZ936+BA936+BB936+BC936)/12 -> 0.30546666666666672 | BF936: =(AK936+AL936+AM936+AN936+AO936+AP936+AQ936+AR936+AS936+AT936+AU936+AV936+AV936+AW936+AX936+AY936+AZ936+BA936+BB936+BC936)/19 -> 0.25237368421052642 | BG936: =(AV936+AW936)/2 -> 0.18315000000000003 | BH936: =(AW936+AX936)/2 -> -0.40805000000000002 | BI936: =(AX936+AY936)/2 -> -0.43840000000000001 | BJ936: =(AY936+AZ936)/2 -> -0.46110000000000001 | BK936: =(AZ936+BA936)/2 -> -0.16720000000000002 | BL936: =(BA936+BB936)/2 -> 0.14035 | BM936: =(BB936+BC936)/2 -> 0.12535000000000002 | BN936: =STDEV(AK936:BC936) -> 0.58534451304113921
B937: 002275.SZ | C937: 桂林三金 | E937: 0.2487 | F937: 0.60999999999999999 | G937: 6.8199999999999997e-02 | H937: 0.10769999999999999 | I937: 0.10189999999999999 | J937: 0.17910000000000001 | K937: 8.8499999999999995e-02 | L937: 7.5300000000000006e-02 | M937: 5.0300000000000004e-02 | N937: -0.1139 | O937: 5.0900000000000001e-02 | P937: 2.1700000000000001e-02 | Q937: -8.0600000000000005e-02 | R937: -4.2900000000000001e-02 | S937: -0.1258 | T937: -0.10640000000000001 | U937: -7.0199999999999999e-02 | V937: -0.28360000000000002 | W937: 0.30769999999999997 | X937: 2.3799999999999998e-02 | Y937: -3.7699999999999997e-02 | AA937: =(N937+O937+P937+Q937+R937+S937+T937+U937+V937+W937+X937+Y937)/12 -> -3.808333333333333e-02 | AB937: =(G937+H937+I937+J937+K937+L937+M937+N937+O937+P937+Q937+R937+S937+T937+U937+V937+W937+X937+Y937)/19 -> 1.1263157894736843e-02 | AC937: =(R937+S937)/2 -> -8.4349999999999994e-02 | AD937: =(S937+T937)/2 -> -0.11610000000000001 | AE937: =(T937+U937)/2 -> -8.8300000000000003e-02 | AF937: =(U937+V937)/2 -> -0.1769 | AG937: =(V937+W937)/2 -> 1.2049999999999977e-02 | AH937: =(W937+X937)/2 -> 0.16574999999999998 | AI937: =(X937+Y937)/2 -> -6.9499999999999996e-03 | AJ937: =STDEV(G937:Y937) -> 0.13035749226444057
B938: 002728.SZ | C938: 特一药业 | E938: 0.45289999999999997 | F938: 0.46400000000000002 | G938: -0.10000000000000001 | H938: 0.2273 | I938: 0.24239999999999998 | J938: 0.12770000000000001 | K938: 0.33329999999999999 | L938: 0.40740000000000004 | M938: 0.46340000000000003 | N938: 0.47170000000000001 | O938: 0.66670000000000007 | P938: 0.18420000000000003 | Q938: 0.1167 | R938: 8.9700000000000002e-02 | S938: -0.45000000000000001 | T938: -0.71109999999999995 | U938: -0.79099999999999993 | V938: -0.74120000000000008 | W938: 0.81819999999999993 | X938: 1.8462000000000001 | Y938: 2.6429 | AA938: =(N938+O938+P938+Q938+R938+S938+T938+U938+V938+W938+X938+Y938)/12 -> 0.34525000000000006 | AB938: =(G938+H938+I938+J938+K938+L938+M938+N938+O938+P938+Q938+R938+S938+T938+U938+V938+W938+X938+Y938)/19 -> 0.30760526315789471 | AC938: =(R938+S938)/2 -> -0.18015 | AD938: =(S938+T938)/2 -> -0.58055000000000001 | AE938: =(T938+U938)/2 -> -0.75105 | AF938: =(U938+V938)/2 -> -0.7661 | AG938: =(V938+W938)/2 -> 3.8499999999999923e-02 | AH938: =(W938+X938)/2 -> 1.3322000000000001 | AI938: =(X938+Y938)/2 -> 2.2445500000000003 | AJ938: =STDEV(G938:Y938) -> 0.83331222404842842 | AK938: 0.31790000000000002 | AL938: 6.8000000000000005e-03 | AM938: 3.0699999999999998e-02 | AN938: 4.07e-02 | AO938: 0.2329 | AP938: 9.849999999999999e-02 | AQ938: 0.158 | AR938: 0.29920000000000002 | AS938: 0.2616 | AT938: 0.14779999999999999 | AU938: 7.9600000000000004e-02 | AV938: 2.8900000000000002e-02 | AW938: -0.27229999999999999 | AX938: -0.32069999999999999 | AY938: -0.33140000000000003 | AZ938: -0.33049999999999996 | BA938: 0.2581 | BB938: 0.27529999999999999 | BC938: 0.24559999999999998 | BE938: =(AR938+AS938+AT938+AU938+AV938+AW938+AX938+AY938+AZ938+BA938+BB938+BC938)/12 -> 2.8433333333333328e-02 | BF938: =(AK938+AL938+AM938+AN938+AO938+AP938+AQ938+AR938+AS938+AT938+AU938+AV938+AV938+AW938+AX938+AY938+AZ938+BA938+BB938+BC938)/19 -> 6.6084210526315801e-02 | BG938: =(AV938+AW938)/2 -> -0.12169999999999999 | BH938: =(AW938+AX938)/2 -> -0.29649999999999999 | BI938: =(AX938+AY938)/2 -> -0.32605000000000001 | BJ938: =(AY938+AZ938)/2 -> -0.33094999999999997 | BK938: =(AZ938+BA938)/2 -> -3.6199999999999982e-02 | BL938: =(BA938+BB938)/2 -> 0.26669999999999999 | BM938: =(BB938+BC938)/2 -> 0.26044999999999996 | BN938: =STDEV(AK938:BC938) -> 0.22350281184044374
B939: 601231.SH | C939: 环旭电子
B940: 601238.SH | C940: 广汽集团 | G940: 0.9667 | H940: 0.11289999999999999 | I940: 0.13789999999999999 | J940: 0.2041 | K940: -0.35590000000000005 | L940: -1.4499999999999999e-02 | M940: -2.0199999999999999e-02 | N940: -9.3200000000000005e-02 | O940: -0.28949999999999998 | P940: -0.29410000000000003 | Q940: =--36.08 -> 36.079999999999998 | R940: -0.39250000000000002 | S940: -0.96299999999999997 | T940: -0.52079999999999993 | U940: -0.2097 | V940: -0.10769999999999999 | W940: 22 | X940: 0.82609999999999995 | Y940: 4.0800000000000003e-02 | AA940: =(N940+O940+P940+Q940+R940+S940+T940+U940+V940+W940+X940+Y940)/12 -> 4.6730333333333327 | AB940: =(G940+H940+I940+J940+K940+L940+M940+N940+O940+P940+Q940+R940+S940+T940+U940+V940+W940+X940+Y940)/19 -> 3.0056526315789469 | AC940: =(R940+S940)/2 -> -0.67774999999999996 | AD940: =(S940+T940)/2 -> -0.7419 | AE940: =(T940+U940)/2 -> -0.36524999999999996 | AF940: =(U940+V940)/2 -> -0.15870000000000001 | AG940: =(V940+W940)/2 -> 10.946149999999999 | AH940: =(W940+X940)/2 -> 11.41305 | AI940: =(X940+Y940)/2 -> 0.43345 | AJ940: =STDEV(G940:Y940) -> 9.4795919185121278
B941: 601965.SH | C941: 中国汽研 | G941: 0.33329999999999999 | H941: 0.16670000000000001 | I941: 9.5199999999999993e-02 | J941: 0.1143 | K941: 0.125 | L941: 0.28570000000000001 | M941: 0.1739 | N941: 7.690000000000001e-02 | O941: 0.11109999999999999 | P941: 0.11109999999999999 | Q941: 0.11109999999999999 | R941: 0.1429 | S941: -0.40000000000000002 | T941: 0 | U941: 0.16670000000000001 | V941: 0.1875 | W941: 1 | X941: 0.34999999999999998 | Y941: 0.45710000000000001 | AA941: =(N941+O941+P941+Q941+R941+S941+T941+U941+V941+W941+X941+Y941)/12 -> 0.19286666666666666 | AB941: =(G941+H941+I941+J941+K941+L941+M941+N941+O941+P941+Q941+R941+S941+T941+U941+V941+W941+X941+Y941)/19 -> 0.18992105263157893 | AC941: =(R941+S941)/2 -> -0.12855 | AD941: =(S941+T941)/2 -> -0.20000000000000001 | AE941: =(T941+U941)/2 -> 8.3350000000000007e-02 | AF941: =(U941+V941)/2 -> 0.17710000000000001 | AG941: =(V941+W941)/2 -> 0.59375 | AH941: =(W941+X941)/2 -> 0.67500000000000004 | AI941: =(X941+Y941)/2 -> 0.40354999999999996 | AJ941: =STDEV(G941:Y941) -> 0.2604392754536658
B942: 603811.SH | C942: 诚意药业
B943: 605011.SH | C943: 杭州热电 | V943: 0.1404 | W943: 2 | X943: 0.60870000000000002 | Y943: 0.18600000000000003 | AA943: =(N943+O943+P943+Q943+R943+S943+T943+U943+V943+W943+X943+Y943)/12 -> 0.24459166666666668 | AB943: =(G943+H943+I943+J943+K943+L943+M943+N943+O943+P943+Q943+R943+S943+T943+U943+V943+W943+X943+Y943)/19 -> 0.15447894736842108 | AC943: =(R943+S943)/2 -> 0 | AD943: =(S943+T943)/2 -> 0 | AE943: =(T943+U943)/2 -> 0 | AF943: =(U943+V943)/2 -> 7.0199999999999999e-02 | AG943: =(V943+W943)/2 -> 1.0702 | AH943: =(W943+X943)/2 -> 1.3043499999999999 | AI943: =(X943+Y943)/2 -> 0.39735000000000004 | AJ943: =STDEV(G943:Y943) -> 0.87008061839119244
B944: 605183.SH | C944: 确成股份
B945: 600109.SH | C945: 国金证券
B946: 000930.SZ | C946: 中粮科技
B947: 600018.SH | C947: 上港集团 | E947: 0.37659999999999999 | F947: 0.626 | G947: -6.2699999999999992e-02 | H947: 0.15570000000000001 | I947: 0.20319999999999999 | J947: 0.66269999999999996 | K947: 0.44420000000000004 | L947: 4.0999999999999995e-03 | M947: 7.2999999999999995e-02 | N947: -0.10929999999999999 | O947: 0.1643 | P947: 0.29160000000000003 | Q947: 0.32429999999999998 | R947: -0.11800000000000001 | S947: -0.13269999999999998 | T947: -0.12240000000000001 | U947: -0.11199999999999999 | V947: -8.3400000000000002e-02 | W947: 0.77190000000000003 | X947: 1.2717000000000001 | Y947: 0.95409999999999995 | AA947: =(N947+O947+P947+Q947+R947+S947+T947+U947+V947+W947+X947+Y947)/12 -> 0.25834166666666664 | AB947: =(G947+H947+I947+J947+K947+L947+M947+N947+O947+P947+Q947+R947+S947+T947+U947+V947+W947+X947+Y947)/19 -> 0.24106842105263154 | AC947: =(R947+S947)/2 -> -0.12534999999999999 | AD947: =(S947+T947)/2 -> -0.12755 | AE947: =(T947+U947)/2 -> -0.1172 | AF947: =(U947+V947)/2 -> -9.7699999999999995e-02 | AG947: =(V947+W947)/2 -> 0.34425 | AH947: =(W947+X947)/2 -> 1.0218 | AI947: =(X947+Y947)/2 -> 1.1129 | AJ947: =STDEV(G947:Y947) -> 0.409989364432016 | AK947: 0.16789999999999999 | AL947: 0.15010000000000001 | AM947: 0.34520000000000001 | AN947: 0.2833 | AO947: -4.0500000000000001e-02 | AP947: -2.8500000000000001e-02 | AQ947: -9.7699999999999995e-02 | AR947: -4.7300000000000002e-02 | AS947: 7.4999999999999997e-03 | AT947: 4.1599999999999998e-02 | AU947: -1.9299999999999998e-02 | AV947: -2.1400000000000002e-02 | AW947: -0.2162 | AX947: -0.15090000000000001 | AY947: -8.9800000000000005e-02 | AZ947: 0.1143 | BA947: 0.72739999999999994 | BB947: 0.42729999999999996 | BC947: 0.37729999999999997 | BE947: =(AR947+AS947+AT947+AU947+AV947+AW947+AX947+AY947+AZ947+BA947+BB947+BC947)/12 -> 9.5874999999999988e-02 | BF947: =(AK947+AL947+AM947+AN947+AO947+AP947+AQ947+AR947+AS947+AT947+AU947+AV947+AV947+AW947+AX947+AY947+AZ947+BA947+BB947+BC947)/19 -> 0.10046842105263158 | BG947: =(AV947+AW947)/2 -> -0.1188 | BH947: =(AW947+AX947)/2 -> -0.18354999999999999 | BI947: =(AX947+AY947)/2 -> -0.12035000000000001 | BJ947: =(AY947+AZ947)/2 -> 1.2249999999999997e-02 | BK947: =(AZ947+BA947)/2 -> 0.42084999999999995 | BL947: =(BA947+BB947)/2 -> 0.57734999999999992 | BM947: =(BB947+BC947)/2 -> 0.40229999999999999 | BN947: =STDEV(AK947:BC947) -> 0.23753122478642255
B948: 002270.SZ | C948: 华明装备 | E948: 0.32909999999999995 | F948: 0.50600000000000001 | G948: 0 | H948: -0.27779999999999999 | I948: -0.318 | J948: -0.1489 | K948: -0.33329999999999999 | L948: -0.58379999999999999 | M948: -0.50029999999999997 | N948: -0.45000000000000001 | O948: 0.25 | P948: 0.66359999999999997 | Q948: 0.36670000000000003 | R948: -9.0899999999999995e-02 | S948: 3.6000000000000001 | T948: 2.1111 | U948: 1.5872999999999999 | V948: 0.90000000000000002 | W948: -0.73909999999999998 | X948: 0.42859999999999998 | Y948: 0.4788 | AA948: =(N948+O948+P948+Q948+R948+S948+T948+U948+V948+W948+X948+Y948)/12 -> 0.75884166666666664 | AB948: =(G948+H948+I948+J948+K948+L948+M948+N948+O948+P948+Q948+R948+S948+T948+U948+V948+W948+X948+Y948)/19 -> 0.36547368421052634 | AC948: =(R948+S948)/2 -> 1.7545500000000001 | AD948: =(S948+T948)/2 -> 2.85555 | AE948: =(T948+U948)/2 -> 1.8492 | AF948: =(U948+V948)/2 -> 1.2436499999999999 | AG948: =(V948+W948)/2 -> 8.0450000000000021e-02 | AH948: =(W948+X948)/2 -> -0.15525 | AI948: =(X948+Y948)/2 -> 0.45369999999999999 | AJ948: =STDEV(G948:Y948) -> 1.0780230768722003
B949: 601882.SH | C949: 海天精工 | G949: 2.8999999999999998e-02 | H949: 0.1288 | I949: 0.33119999999999999 | J949: 0.53849999999999998 | K949: 0.24410000000000001 | L949: 8.2899999999999988e-02 | M949: 8.8000000000000009e-02 | N949: -5.0000000000000003e-02 | O949: -0.21890000000000001 | P949: -0.32899999999999996 | Q949: -0.37070000000000003 | R949: -0.21050000000000002 | S949: 6.7599999999999993e-02 | T949: 0.52000000000000002 | U949: 0.73680000000000012 | V949: 0.73329999999999995 | W949: 4.3845999999999998 | X949: 1.9649000000000001 | Y949: 1.9340999999999999 | AA949: =(N949+O949+P949+Q949+R949+S949+T949+U949+V949+W949+X949+Y949)/12 -> 0.76351666666666673 | AB949: =(G949+H949+I949+J949+K949+L949+M949+N949+O949+P949+Q949+R949+S949+T949+U949+V949+W949+X949+Y949)/19 -> 0.55814210526315799 | AC949: =(R949+S949)/2 -> -7.1450000000000014e-02 | AD949: =(S949+T949)/2 -> 0.29380000000000001 | AE949: =(T949+U949)/2 -> 0.62840000000000007 | AF949: =(U949+V949)/2 -> 0.73504999999999998 | AG949: =(V949+W949)/2 -> 2.5589499999999998 | AH949: =(W949+X949)/2 -> 3.17475 | AI949: =(X949+Y949)/2 -> 1.9495 | AJ949: =STDEV(G949:Y949) -> 1.1327113387873999
B950: 603020.SH | C950: 爱普股份
B951: 000860.SZ | C951: 顺鑫农业
B952: 000042.SZ | C952: 中洲控股
AA953: =(N953+O953+P953+Q953+R953+S953+T953+U953+V953+W953+X953+Y953)/12 -> 0 | AB953: =(G953+H953+I953+J953+K953+L953+M953+N953+O953+P953+Q953+R953+S953+T953+U953+V953+W953+X953+Y953)/19 -> 0 | AC953: =(R953+S953)/2 -> 0 | AD953: =(S953+T953)/2 -> 0 | AE953: =(T953+U953)/2 -> 0 | AF953: =(U953+V953)/2 -> 0 | AG953: =(V953+W953)/2 -> 0 | AH953: =(W953+X953)/2 -> 0 | AI953: =(X953+Y953)/2 -> 0 | AJ953: =STDEV(G953:Y953) -> #DIV/0!