A1: 所属行业 | B1: 行业分类
A2: 国防军工 | B2: 电力设备 | C2: =COUNTIF(A:A,B2) -> 10
A3: 饮料制造 | B3: 饮料制造 | C3: =COUNTIF(A:A,B3) -> 7
A4: 化学制品 | B4: 化学制品 | C4: =COUNTIF(A:A,B4) -> 7
A5: 钢铁 | B5: 国防军工 | C5: =COUNTIF(A:A,B5) -> 6
A6: 国防军工 | B6: 医疗器械 | C6: =COUNTIF(A:A,B6) -> 4
A7: 美容护理 | B7: 半导体及元件 | C7: =COUNTIF(A:A,B7) -> 4
A8: 中药 | B8: 自动化设备 | C8: =COUNTIF(A:A,B8) -> 3
A9: 通信设备 | B9: 汽车零部件 | C9: =COUNTIF(A:A,B9) -> 3
A10: 电力设备 | B10: 煤炭开采加工 | C10: =COUNTIF(A:A,B10) -> 3
A11: 建筑材料 | B11: 中药 | C11: =COUNTIF(A:A,B11) -> 2
A12: 汽车零部件 | B12: 造纸 | C12: =COUNTIF(A:A,B12) -> 2
A13: 汽车零部件 | B13: 消费电子 | C13: =COUNTIF(A:A,B13) -> 2
A14: 教育 | B14: 食品加工制造 | C14: =COUNTIF(A:A,B14) -> 2
A15: 饮料制造 | B15: 光学光电子 | C15: =COUNTIF(A:A,B15) -> 2
A16: 物流 | B16: 钢铁 | C16: =COUNTIF(A:A,B16) -> 2
A17: 传媒 | B17: 服装家纺 | C17: =COUNTIF(A:A,B17) -> 2
A18: 食品加工制造 | B18: 专用设备 | C18: =COUNTIF(A:A,B18) -> 1
A19: 通信服务 | B19: 证券 | C19: =COUNTIF(A:A,B19) -> 1
A20: 证券 | B20: 仪器仪表 | C20: =COUNTIF(A:A,B20) -> 1
A21: 医疗器械 | B21: 医疗服务 | C21: =COUNTIF(A:A,B21) -> 1
A22: 化学原料 | B22: 物流 | C22: =COUNTIF(A:A,B22) -> 1
A23: 饮料制造 | B23: 通信设备 | C23: =COUNTIF(A:A,B23) -> 1
A24: 中药 | B24: 通信服务 | C24: =COUNTIF(A:A,B24) -> 1
A25: 饮料制造 | B25: 燃气 | C25: =COUNTIF(A:A,B25) -> 1
A26: 医疗服务 | B26: 美容护理 | C26: =COUNTIF(A:A,B26) -> 1
A27: 白色家电 | B27: 教育 | C27: =COUNTIF(A:A,B27) -> 1
A28: 医疗器械 | B28: 建筑材料 | C28: =COUNTIF(A:A,B28) -> 1
A29: 半导体及元件 | B29: 环保 | C29: =COUNTIF(A:A,B29) -> 1
A30: 工业金属 | B30: 化学原料 | C30: =COUNTIF(A:A,B30) -> 1
A31: 饮料制造 | B31: 化工合成材料 | C31: =COUNTIF(A:A,B31) -> 1
A32: 煤炭开采加工 | B32: 工业金属 | C32: =COUNTIF(A:A,B32) -> 1
A33: 饮料制造 | B33: 传媒 | C33: =COUNTIF(A:A,B33) -> 1
A34: 国防军工 | B34: 厨卫电器 | C34: =COUNTIF(A:A,B34) -> 1
A35: 消费电子 | B35: 白色家电 | C35: =COUNTIF(A:A,B35) -> 1
A36: 电力设备
A37: 化学制品
A38: 光学光电子
A39: 国防军工
A40: 煤炭开采加工
A41: 煤炭开采加工
A42: 电力设备
A43: 自动化设备
A44: 电力设备
A45: 钢铁
A46: 化学制品
A47: 电力设备
A48: 化工合成材料
A49: 电力设备
A50: 电力设备
A51: 汽车零部件
A52: 饮料制造
A53: 自动化设备
A54: 化学制品
A55: 化学制品
A56: 电力设备
A57: 燃气
A58: 半导体及元件
A59: 自动化设备
A60: 造纸
A61: 环保
A62: 医疗器械
A63: 服装家纺
A64: 国防军工
A65: 仪器仪表
A66: 电力设备
A67: 电力设备
A68: 半导体及元件
A69: 化学制品
A70: 服装家纺
A71: 光学光电子
A72: 国防军工
A73: 半导体及元件
A74: 食品加工制造
A75: 医疗器械
A76: 厨卫电器
A77: 造纸
A78: 化学制品
A79: 专用设备
A80: 消费电子