A1: 趋势 | N1: 当前股价位置属于趋势的周期（即数基地，1到2的时候进入，3到5应该考虑卖出） | O1: 最近一年最高点是否新高 | P1: 价格波动收缩幅度 | AI1: 价格行为(得分应大于60%) | AL1: 成交量行为 | AN1: 结论 | AO1: 更新时间
A2: 股票代码 | B2: 股票简称 | C2: 技术形态2022.03.10 | D2: 行情收盘价 [1]2022.03.10 | E2: 50日均线 [2]2022.03.10 | F2: 150日均线 [3]2022.03.10 | G2: 200日均线 [4]2022.03.10 | H2: 52周内最低点 | I2: 52周内最高点 | J2: 最高点前8周收盘价 | K2: 当前股价相对于最低点百分比(至少高出25%) | L2: 当前股价相对于最高点百分比(25%内最好) | M2: 最高点前8周股价相对于最高点百分比 | P2: 技术足迹 | AI2: 支撑位和压力位是否同步升高(40%) | AJ2: 是否有网球行为出现(40%) | AK2: 上涨天数是否大于下跌天数(20%) | AL2: 不同收盘表现时交易量情况(好的收盘时，交易量是否增大，坏的收盘时，交易量是否萎缩) | AM2: 成交量收缩情况(最后的价格收缩期间的成交量应低于50天的平均水平且有一到两天交易量极低)
P3: 支撑位1 | Q3: 阻力位2 | R3: 支撑位2 | S3: 阻力位3 | T3: 支撑位3 | U3: 阻力位4 | V3: 支撑位4 | W3: 阻力位5 | X3: 支撑位5 | Y3: 阻力位6 | Z3: 支撑位6 | AA3: 时间周期 | AB3: 收缩量1 | AC3: 收缩量2 | AD3: 收缩量3 | AE3: 收缩量4 | AF3: 收缩量5 | AG3: 收缩量6 | AH3: 收缩数量(至少大于3T)
A4: 605399.SH | B4: 晨光新材 | C4: 缩量||价升量缩||阴线 | D4: 47.17 | E4: 44.46 | F4: 41.03 | G4: 35.79 | H4: 14.74 | I4: 55.899999999999999 | J4: 36.399999999999999 | K4: =(D4-H4)/H4 -> 2.200135685210312 | L4: =(I4-D4)/I4 -> 0.15617173524150263 | M4: =(I4-J4)/J4 -> 0.5357142857142857 | N4: 4 | P4: 38.25 | Q4: 51.509999999999998 | R4: 40.5 | S4: 52.020000000000003 | T4: 41 | AB4: =(I4-P4)/I4 -> 0.31574239713774593 | AC4: =(Q4-R4)/Q4 -> 0.21374490390215489 | AD4: =(S4-T4)/S4 -> 0.21184159938485203 | AE4: =(U4-V4)/U4 -> #DIV/0! | AF4: =(W4-X4)/W4 -> #DIV/0! | AO4: 44636
A5: 002881.SZ | B5: 美格智能 | C5: 缩量||价跌量缩||回调缩量 | D5: 43.48 | E5: 42 | F5: 38.76 | G5: 35.63 | H5: 17.359999999999999 | I5: 55.490000000000002 | J5: 26.539999999999999 | K5: =(D5-H5)/H5 -> 1.5046082949308754 | L5: =(I5-D5)/I5 -> 0.21643539376464235 | M5: =(I5-J5)/J5 -> 1.0908063300678223 | N5: 3 | P5: 36.299999999999997 | Q5: 48.390000000000001 | R5: 35.350000000000001 | AB5: =(I5-P5)/I5 -> 0.34582807713101466 | AC5: =(Q5-R5)/Q5 -> 0.26947716470345112 | AD5: =(S5-T5)/S5 -> #DIV/0! | AE5: =(U5-V5)/U5 -> #DIV/0! | AF5: =(W5-X5)/W5 -> #DIV/0! | AO5: 44636
A6: 002779.SZ | B6: 中坚科技 | C6: 放量||阴线||旗形 | D6: 32.95 | E6: 20.53 | F6: 16.03 | G6: 14.73 | K6: =(D6-H8)/H8 -> #DIV/0! | L6: =(I8-D6)/I8 -> #DIV/0! | M6: =(I8-J8)/J8 -> #DIV/0! | N6: 1 | AB6: =(I6-P6)/I6 -> #DIV/0! | AC6: =(Q6-R6)/Q6 -> #DIV/0! | AD6: =(S6-T6)/S6 -> #DIV/0! | AE6: =(U6-V6)/U6 -> #DIV/0! | AF6: =(W6-X6)/W6 -> #DIV/0!
A7: 000893.SZ | B7: 亚钾国际 | C7: 阳线||缩量||价升量缩 | D7: 27.95 | E7: 24.97 | F7: 21.5 | G7: 20.33 | H7: 9.2200000000000006 | I7: 31.5 | J7: 23.079999999999998 | K7: =(D7-H7)/H7 -> 2.0314533622559647 | L7: =(I7-D7)/I7 -> 0.11269841269841271 | M7: =(I7-J7)/J7 -> 0.36481802426343163 | N7: 4 | P7: 24.600000000000001 | AB7: =(I7-P7)/I7 -> 0.21904761904761899 | AC7: =(Q7-R7)/Q7 -> #DIV/0! | AD7: =(S7-T7)/S7 -> #DIV/0! | AE7: =(U7-V7)/U7 -> #DIV/0! | AF7: =(W7-X7)/W7 -> #DIV/0! | AO7: 44636
A8: 002393.SZ | B8: 力生制药 | C8: 价升量涨||强中选强||阳线 | D8: 26.86 | E8: 21.63 | F8: 20.21 | G8: 19.94 | K8: =(D8-H8)/H8 -> #DIV/0! | L8: =(I8-D8)/I8 -> #DIV/0! | M8: =(I8-J8)/J8 -> #DIV/0! | N8: 2 | AB8: =(I8-P8)/I8 -> #DIV/0! | AC8: =(Q8-R8)/Q8 -> #DIV/0! | AD8: =(S8-T8)/S8 -> #DIV/0! | AE8: =(U8-V8)/U8 -> #DIV/0! | AF8: =(W8-X8)/W8 -> #DIV/0!
A9: 600367.SH | B9: 红星发展 | C9: 阳线||缩量||价升量缩 | D9: 21.28 | E9: 19.66 | F9: 17.98 | G9: 15.88 | H9: 6.96 | I9: 28.48 | J9: 18 | K9: =(D9-H9)/H9 -> 2.0574712643678161 | L9: =(I9-D9)/I9 -> 0.2528089887640449 | M9: =(I9-J9)/J9 -> 0.5822222222222222 | N9: 3 | AB9: =(I9-P9)/I9 -> 1 | AC9: =(Q9-R9)/Q9 -> #DIV/0! | AD9: =(S9-T9)/S9 -> #DIV/0! | AE9: =(U9-V9)/U9 -> #DIV/0! | AF9: =(W9-X9)/W9 -> #DIV/0!
A10: 601808.SH | B10: 中海油服 | C10: 缩量||价跌量缩||回调缩量 | D10: 15.57 | E10: 15.45 | F10: 14.66 | G10: 14.59 | H10: 11.86 | I10: 18.11 | J10: 14.72 | K10: =(D10-H10)/H10 -> 0.31281618887015183 | L10: =(I10-D10)/I10 -> 0.14025400331308666 | M10: =(I10-J10)/J10 -> 0.23029891304347816 | N10: 3 | P10: 12.300000000000001 | AB10: =(I10-P10)/I10 -> 0.3208172280508006 | AO10: 44636
A11: 603602.SH | B11: 纵横通信 | C11: 放量||价升量缩||阴线 | D11: 14.23 | E11: 11.97 | F11: 10.72 | G11: 10.67 | H11: 8.4900000000000002 | I11: 13.65 | J11: 10.5 | K11: =(D11-H11)/H11 -> 0.6760895170789164 | L11: =(I11-D11)/I11 -> -4.2490842490842493e-02 | M11: =(I11-J11)/J11 -> 0.30000000000000004 | N11: 3 | AB11: =(I11-P11)/I11 -> 1 | AC11: =(Q11-R11)/Q11 -> #DIV/0! | AD11: =(S11-T11)/S11 -> #DIV/0! | AE11: =(U11-V11)/U11 -> #DIV/0! | AF11: =(W11-X11)/W11 -> #DIV/0!
A12: 600714.SH | B12: 金瑞矿业 | C12: 缩量||价升量缩||阴线 | D12: 14 | E12: 13.93 | F12: 12.300000000000001 | G12: 11.19 | H12: 5.8099999999999996 | I12: 16.780000000000001 | J12: 9.8100000000000005 | K12: =(D12-H12)/H12 -> 1.4096385542168677 | L12: =(I12-D12)/I12 -> 0.16567342073897504 | M12: =(I12-J12)/J12 -> 0.71049949031600412 | N12: 4 | P12: 12.52 | Q12: 16.289999999999999 | R12: 12.800000000000001 | AB12: =(I12-P12)/I12 -> 0.2538736591179977 | AC12: =(Q12-R12)/Q12 -> 0.21424186617556776 | AD12: =(S12-T12)/S12 -> #DIV/0! | AE12: =(U12-V12)/U12 -> #DIV/0! | AF12: =(W12-X12)/W12 -> #DIV/0! | AO12: 44636
A13: 600123.SH | B13: 兰花科创 | C13: 阳线||缩量||价跌量缩 | D13: 12.66 | E13: 10.76 | F13: 10.53 | G13: 9.88 | H13: 5.0099999999999998 | I13: 14.67 | J13: 8.9399999999999995 | K13: =(D13-H13)/H13 -> 1.5269461077844313 | L13: =(I13-D13)/I13 -> 0.13701431492842533 | M13: =(I13-J13)/J13 -> 0.64093959731543637 | N13: 3 | P13: 8.7400000000000002 | Q13: 13.82 | R13: 10.119999999999999 | AB13: =(I13-P13)/I13 -> 0.4042263122017723 | AC13: =(Q13-R13)/Q13 -> 0.26772793053545596 | AD13: =(S13-T13)/S13 -> #DIV/0! | AE13: =(U13-V13)/U13 -> #DIV/0! | AF13: =(W13-X13)/W13 -> #DIV/0! | AO13: 44636
A14: 603929.SH | B14: 亚翔集成 | C14: 缩量||价升量缩||阴线 | D14: 12.63 | E14: 12.44 | F14: 11.65 | G14: 11.41 | H14: 9.26 | I14: 14.09 | J14: 11.83 | K14: =(D14-H14)/H14 -> 0.36393088552915781 | L14: =(I14-D14)/I14 -> 0.10361958836053932 | M14: =(I14-J14)/J14 -> 0.19103972950126794 | N14: 1 | P14: 11.32 | AB14: =(I14-P14)/I14 -> 0.19659332860184525 | AO14: 44636
A15: 002545.SZ | B15: 东方铁塔 | C15: 缩量||价跌量缩||回调缩量 | D15: 11.11 | E15: 9.88 | F15: 9.15 | G15: 8.75 | H15: 6.46 | I15: 12.65 | J15: 9.3000000000000007 | K15: =(D15-H15)/H15 -> 0.71981424148606798 | L15: =(I15-D15)/I15 -> 0.12173913043478268 | M15: =(I15-J15)/J15 -> 0.36021505376344082 | N15: 4 | P15: 10.59 | AB15: =(I15-P15)/I15 -> 0.16284584980237157 | AC15: =(Q15-R15)/Q15 -> #DIV/0! | AD15: =(S15-T15)/S15 -> #DIV/0! | AE15: =(U15-V15)/U15 -> #DIV/0! | AF15: =(W15-X15)/W15 -> #DIV/0! | AO15: 44631
A16: 000524.SZ | B16: 岭南控股 | C16: 放量||价跌量缩||阴线 | D16: 9.9000000000000004 | E16: 8.5 | F16: 7.41 | G16: 7.4000000000000004 | H16: 6.2 | I16: 10.99 | J16: 6.93 | K16: =(D16-H16)/H16 -> 0.59677419354838712 | L16: =(I16-D16)/I16 -> 9.9181073703366679e-02 | M16: =(I16-J16)/J16 -> 0.58585858585858597 | N16: 3 | P16: 8.4700000000000006 | Q16: 10.91 | R16: 9.8800000000000008 | AB16: =(I16-P16)/I16 -> 0.22929936305732479 | AC16: =(Q16-R16)/Q16 -> 9.4408799266727711e-02
A17: 603676.SH | B17: 卫信康 | C17: 阳线||放量||价升量缩 | D17: 9.78 | E17: 9.65 | F17: 8.8000000000000007 | G17: 8.62 | H17: 7.44 | I17: 12.21 | J17: 8.44 | K17: =(D17-H17)/H17 -> 0.3145161290322579 | L17: =(I17-D17)/I17 -> 0.19901719901719914 | M17: =(I17-J17)/J17 -> 0.4466824644549765 | N17: 2 | P17: 8.6999999999999993 | AB17: =(I17-P17)/I17 -> 0.28746928746928757
A18: 600099.SH | B18: 林海股份 | C18: 阳线||放量||价升量缩 | D18: 9.61 | E18: 8.63 | F18: 7.77 | G18: 7.45 | H18: 5.8499999999999996 | I18: 9.7799999999999994 | J18: 8.2599999999999998 | K18: =(D18-H18)/H18 -> 0.64273504273504278 | L18: =(I18-D18)/I18 -> 1.7382413087934555e-02 | M18: =(I18-J18)/J18 -> 0.18401937046004838 | N18: 3 | AB18: =(I18-P18)/I18 -> 1 | AC18: =(Q18-R18)/Q18 -> #DIV/0! | AD18: =(S18-T18)/S18 -> #DIV/0! | AE18: =(U18-V18)/U18 -> #DIV/0! | AF18: =(W18-X18)/W18 -> #DIV/0!
A19: 603616.SH | B19: 韩建河山 | C19: 价升量涨||阳线||放量 | D19: 9.32 | E19: 8.24 | F19: 6.58 | G19: 6.2999999999999998 | H19: 5.04 | I19: 11.74 | J19: 6.3499999999999996 | K19: =(D19-H19)/H19 -> 0.8492063492063493 | L19: =(I19-D19)/I19 -> 0.20613287904599659 | M19: =(I19-J19)/J19 -> 0.84881889763779539 | N19: 3 | P19: 8.0099999999999998 | AB19: =(I19-P19)/I19 -> 0.31771720613287907 | AC19: =(Q19-R19)/Q19 -> #DIV/0! | AD19: =(S19-T19)/S19 -> #DIV/0! | AE19: =(U19-V19)/U19 -> #DIV/0! | AF19: =(W19-X19)/W19 -> #DIV/0!
A20: 000683.SZ | B20: 远兴能源 | C20: 缩量||价升量缩||阴线 | D20: 9.3000000000000007 | E20: 8.77 | F20: 8.69 | G20: 7.77 | H20: 2.0099999999999998 | I20: 13.539999999999999 | J20: 6.9000000000000004 | K20: =(D20-H20)/H20 -> 3.626865671641792 | L20: =(I20-D20)/I20 -> 0.31314623338257008 | M20: =(I20-J20)/J20 -> 0.96231884057970996 | N20: 2 | P20: 6.4100000000000001 | Q20: 8.2899999999999991 | R20: 6.7400000000000002 | S20: 9.5700000000000003 | T20: 8.1999999999999993 | U20: 10.390000000000001 | V20: 8.5099999999999998 | AB20: =(I20-P20)/I20 -> 0.52658788774002951 | AC20: =(Q20-R20)/Q20 -> 0.18697225572979481 | AD20: =(S20-T20)/S20 -> 0.1431556948798329 | AE20: =(U20-V20)/U20 -> 0.18094321462945145 | AF20: =(W20-X20)/W20 -> #DIV/0!
A21: 002116.SZ | B21: 中国海诚 | C21: 缩量||回调缩量||阴线 | D21: 9.13 | E21: 8.39 | F21: 7.08 | G21: 6.86 | H21: 5.6500000000000004 | I21: 12.66 | J21: 7.2000000000000002 | K21: =(D21-H21)/H21 -> 0.61592920353982306 | L21: =(I21-D21)/I21 -> 0.27883096366508686 | M21: =(I21-J21)/J21 -> 0.7583333333333333 | N21: 3 | P21: 8.5999999999999996 | AB21: =(I21-P21)/I21 -> 0.32069510268562407 | AC21: =(Q21-R21)/Q21 -> #DIV/0! | AD21: =(S21-T21)/S21 -> #DIV/0! | AE21: =(U21-V21)/U21 -> #DIV/0! | AF21: =(W21-X21)/W21 -> #DIV/0!
A22: 603169.SH | B22: 兰石重装 | C22: 缩量||价跌量缩||回调缩量 | D22: 8.81 | E22: 8.53 | F22: 6.89 | G22: 6.29 | H22: 3.9900000000000002 | I22: 13.050000000000001 | J22: 5.1900000000000004 | K22: =(D22-H22)/H22 -> 1.2080200501253133 | L22: =(I22-D22)/I22 -> 0.32490421455938695 | M22: =(I22-J22)/J22 -> 1.5144508670520231 | N22: 3 | P22: 7.1299999999999999 | AB22: =(I22-P22)/I22 -> 0.45363984674329505 | AC22: =(Q22-R22)/Q22 -> #DIV/0! | AD22: =(S22-T22)/S22 -> #DIV/0! | AE22: =(U22-V22)/U22 -> #DIV/0! | AF22: =(W22-X22)/W22 -> #DIV/0!
A23: 000722.SZ | B23: 湖南发展 | C23: 价升量涨||阳线||放量 | D23: 8.66 | E23: 8.3000000000000007 | F23: 7.68 | G23: 7.61 | H23: 5.92 | I23: 9.9 | J23: 6.88 | K23: =(D23-H23)/H23 -> 0.46283783783783788 | L23: =(I23-D23)/I23 -> 0.12525252525252528 | M23: =(I23-J23)/J23 -> 0.43895348837209308 | N23: 3 | P23: 7.0999999999999996 | Q23: 8.9900000000000002 | R23: 7.8799999999999999 | AB23: =(I23-P23)/I23 -> 0.28282828282828287 | AC23: =(Q23-R23)/Q23 -> 0.1234705228031146
A24: 600735.SH | B24: 新华锦 | C24: 阳线||缩量||价升量缩 | D24: 8.39 | E24: 7.73 | F24: 6.84 | G24: 6.79 | H24: 4.4100000000000001 | I24: 9.2300000000000004 | J24: 4.9299999999999997 | K24: =(D24-H24)/H24 -> 0.90249433106575971 | L24: =(I24-D24)/I24 -> 9.100758396533043e-02 | M24: =(I24-J24)/J24 -> 0.87221095334685617 | N24: 4 | P24: 5.0999999999999996 | Q24: 8.4800000000000004 | R24: 7.0199999999999996 | S24: 8.9800000000000004 | T24: 7.4000000000000004 | AB24: =(I24-P24)/I24 -> 0.44745395449620806 | AC24: =(Q24-R24)/Q24 -> 0.17216981132075482 | AD24: =(S24-T24)/S24 -> 0.17594654788418709 | AE24: =(U24-V24)/U24 -> #DIV/0! | AF24: =(W24-X24)/W24 -> #DIV/0!
A25: 600873.SH | B25: 梅花生物 | C25: 价升量涨||阳线||放量 | D25: 8.35 | E25: 7.76 | F25: 7.03 | G25: 6.7000000000000002 | H25: 5.1100000000000003 | I25: 8.5999999999999996 | J25: 7.7800000000000002 | K25: =(D25-H25)/H25 -> 0.63405088062622295 | L25: =(I25-D25)/I25 -> 2.9069767441860465e-02 | M25: =(I25-J25)/J25 -> 0.10539845758354748 | N25: 5 | AB25: =(I25-P25)/I25 -> 1 | AC25: =(Q25-R25)/Q25 -> #DIV/0! | AD25: =(S25-T25)/S25 -> #DIV/0! | AE25: =(U25-V25)/U25 -> #DIV/0! | AF25: =(W25-X25)/W25 -> #DIV/0!
A26: 601789.SH | B26: 宁波建工 | C26: 放量||价跌量缩||阴线 | D26: 6.91 | E26: 5.21 | F26: 4.18 | G26: 4.06 | H26: 3.3500000000000001 | I26: 9.2400000000000002 | J26: 3.73 | K26: =(D26-H26)/H26 -> 1.0626865671641792 | L26: =(I26-D26)/I26 -> 0.25216450216450215 | M26: =(I26-J26)/J26 -> 1.4772117962466487 | N26: 2 | P26: 6.5199999999999996 | AB26: =(I26-P26)/I26 -> 0.29437229437229445 | AC26: =(Q26-R26)/Q26 -> #DIV/0! | AD26: =(S26-T26)/S26 -> #DIV/0! | AE26: =(U26-V26)/U26 -> #DIV/0! | AF26: =(W26-X26)/W26 -> #DIV/0!
A27: 600829.SH | B27: 人民同泰 | C27: 价升量涨||阳线||放量 | D27: 6.89 | E27: 6.45 | F27: 6.12 | G27: 6.08 | H27: 5.0999999999999996 | I27: 7.2699999999999996 | J27: 5.7800000000000002 | K27: =(D27-H27)/H27 -> 0.35098039215686277 | L27: =(I27-D27)/I27 -> 5.2269601100412642e-02 | M27: =(I27-J27)/J27 -> 0.25778546712802758 | N27: 1 | P27: 5.7800000000000002 | AB27: =(I27-P27)/I27 -> 0.20495185694635482 | AC27: =(Q27-R27)/Q27 -> #DIV/0! | AD27: =(S27-T27)/S27 -> #DIV/0! | AE27: =(U27-V27)/U27 -> #DIV/0! | AF27: =(W27-X27)/W27 -> #DIV/0!
A28: 002148.SZ | B28: 北纬科技 | C28: 价升量涨||阳线||放量 | D28: 6.07 | E28: 5.56 | F28: 5.11 | G28: 4.92 | H28: 3.9199999999999999 | I28: 6.29 | J28: 5.3399999999999999 | K28: =(D28-H28)/H28 -> 0.54846938775510212 | L28: =(I28-D28)/I28 -> 3.4976152623211409e-02 | M28: =(I28-J28)/J28 -> 0.17790262172284649 | N28: 3 | AB28: =(I28-P28)/I28 -> 1 | AC28: =(Q28-R28)/Q28 -> #DIV/0! | AD28: =(S28-T28)/S28 -> #DIV/0! | AE28: =(U28-V28)/U28 -> #DIV/0! | AF28: =(W28-X28)/W28 -> #DIV/0!
A29: 000607.SZ | B29: 华媒控股 | C29: 缩量||价升量缩||阴线 | D29: 5.73 | E29: 5.52 | F29: 4.33 | G29: 4.17 | H29: 3.28 | I29: 7.4 | J29: 4.16 | K29: =(D29-H29)/H29 -> 0.74695121951219534 | L29: =(I29-D29)/I29 -> 0.22567567567567565 | M29: =(I29-J29)/J29 -> 0.77884615384615385 | N29: 3 | P29: 5.25 | Q29: 6.4000000000000004 | R29: 5.4900000000000002 | AB29: =(I29-P29)/I29 -> 0.29054054054054057 | AC29: =(Q29-R29)/Q29 -> 0.14218750000000002
A30: 002671.SZ | B30: 龙泉股份 | C30: 价升量涨||阳线||缩量 | D30: 5.2000000000000002 | E30: 5.05 | F30: 4.32 | G30: 4.22 | H30: 3.55 | I30: 6.71 | J30: 3.78 | K30: =(D30-H30)/H30 -> 0.4647887323943663 | L30: =(I30-D30)/I30 -> 0.22503725782414305 | M30: =(I30-J30)/J30 -> 0.77513227513227523 | N30: 3 | P30: 4.4800000000000004 | Q30: 6 | R30: 4.6399999999999997 | AB30: =(I30-P30)/I30 -> 0.33233979135618474 | AC30: =(Q30-R30)/Q30 -> 0.22666666666666671
A31: 000404.SZ | B31: 长虹华意 | C31: 阳线||放量||价升量缩 | D31: 4.58 | E31: 4.56 | F31: 4.28 | G31: 4.18 | H31: 3.47 | I31: 4.89 | J31: 4.37 | K31: =(D31-H31)/H31 -> 0.31988472622478381 | L31: =(I31-D31)/I31 -> 6.3394683026584797e-02 | M31: =(I31-J31)/J31 -> 0.11899313501144154 | N31: 5 | P31: 4.0599999999999996 | Q31: 4.7999999999999998 | R31: 4.25 | AB31: =(I31-P31)/I31 -> 0.16973415132924338 | AC31: =(Q31-R31)/Q31 -> 0.1145833333333333
A32: 002629.SZ | B32: 仁智股份 | C32: 价升量涨||阳线||放量 | D32: 4.35 | E32: 4.21 | F32: 3.11 | G32: 2.96 | H32: 1.77 | I32: 6.2400000000000002 | J32: 2.1899999999999999 | K32: =(D32-H32)/H32 -> 1.4576271186440675 | L32: =(I32-D32)/I32 -> 0.30288461538461547 | M32: =(I32-J32)/J32 -> 1.849315068493151 | N32: 3 | P32: 3.3799999999999999 | Q32: 5.7000000000000002 | R32: 4.2800000000000002 | AB32: =(I32-P32)/I32 -> 0.45833333333333337 | AC32: =(Q32-R32)/Q32 -> 0.24912280701754383 | AD32: =(S32-T32)/S32 -> #DIV/0! | AE32: =(U32-V32)/U32 -> #DIV/0! | AF32: =(W32-X32)/W32 -> #DIV/0!
A33: 601008.SH | B33: 连云港 | C33: 缩量||价跌量缩||回调缩量 | D33: 4.13 | E33: 3.91 | F33: 3.75 | G33: 3.72 | H33: 3.4100000000000001 | I33: 5.2000000000000002 | J33: 3.9399999999999999 | K33: =(D33-H33)/H33 -> 0.21114369501466268 | L33: =(I33-D33)/I33 -> 0.20576923076923082 | M33: =(I33-J33)/J33 -> 0.31979695431472088 | N33: 7 | AB33: =(I33-P33)/I33 -> 1 | AC33: =(Q33-R33)/Q33 -> #DIV/0! | AD33: =(S33-T33)/S33 -> #DIV/0! | AE33: =(U33-V33)/U33 -> #DIV/0! | AF33: =(W33-X33)/W33 -> #DIV/0!
A34: 000520.SZ | B34: 长航凤凰 | C34: 缩量||价升量缩||阴线 | D34: 3.84 | E34: 3.77 | F34: 3.55 | G34: 3.47 | H34: 3 | I34: 4.5499999999999998 | J34: 3.54 | K34: =(D34-H34)/H34 -> 0.27999999999999997 | L34: =(I34-D34)/I34 -> 0.15604395604395604 | M34: =(I34-J34)/J34 -> 0.28531073446327676 | N34: 3 | AB34: =(I34-P34)/I34 -> 1 | AC34: =(Q34-R34)/Q34 -> #DIV/0! | AD34: =(S34-T34)/S34 -> #DIV/0! | AE34: =(U34-V34)/U34 -> #DIV/0! | AF34: =(W34-X34)/W34 -> #DIV/0!
A35: 603077.SH | B35: 和邦生物 | C35: 价升量涨||阳线||缩量 | D35: 3.7999999999999998 | E35: 3.67 | F35: 3.48 | G35: 3.13 | H35: 1.45 | I35: 5.11 | J35: 2.38 | K35: =(D35-H35)/H35 -> 1.6206896551724137 | L35: =(I35-D35)/I35 -> 0.25636007827788659 | M35: =(I35-J35)/J35 -> 1.1470588235294119 | N35: 2 | P35: 3.1099999999999999 | Q35: 4.2300000000000004 | R35: 3.2400000000000002 | AB35: =(I35-P35)/I35 -> 0.39138943248532299 | AC35: =(Q35-R35)/Q35 -> 0.23404255319148939 | AD35: =(S35-T35)/S35 -> #DIV/0! | AE35: =(U35-V35)/U35 -> #DIV/0!