A1: 股票代码 | B1: 股票简称 | C1: 所属同花顺行业
A2: 600328.SH | B2: 中盐化工 | C2: 基础化工-化学原料-无机盐 | D2: 10.818775000000002 | E2: 11.65109 | F2: 15.151
A3: 600714.SH | B3: 金瑞矿业 | C3: 基础化工-化学原料-无机盐 | D3: 3.6327166666666657 | E3: 14.84872 | F3: 18.041599999999999
A4: 600367.SH | B4: 红星发展 | C4: 基础化工-化学原料-无机盐 | D4: 4.1924833333333344 | E4: 5.4706250000000001 | F4: 10.091899999999999
A5: 002053.SZ | B5: 云南能投 | C5: 基础化工-化学原料-无机盐 | D5: 16.819691666666667 | E5: 14.891935 | F5: 10.62125
A6: 603067.SH | B6: 振华股份 | C6: 基础化工-化学原料-无机盐 | D6: 11.098741666666669 | E6: 10.916790000000001 | F6: 10.385300000000001
A7: 003017.SZ | B7: 大洋生物 | C7: 基础化工-化学原料-无机盐 | F7: 12.9259
A8: 002125.SZ | B8: 湘潭电化 | C8: 基础化工-化学原料-无机盐 | D8: 5.4576583333333337 | E8: 5.8956900000000001 | F8: 6.9581499999999998
A9: 600929.SH | B9: 雪天盐业 | C9: 基础化工-化学原料-无机盐 | D9: 7.6348833333333337 | E9: 7.9072949999999995 | F9: 5.9760499999999999
A10: 603299.SH | B10: 苏盐井神 | C10: 基础化工-化学原料-无机盐 | D10: 7.1439083333333349 | E10: 6.401465 | F10: 6.3756000000000004
D11: =MAX(D2:D10) -> 16.819691666666667 | E11: =MAX(E2:E10) -> 14.891935 | F11: =MAX(F2:F10) -> 18.041599999999999
D12: =MIN(D2:D10) -> 3.6327166666666657 | E12: =MIN(E2:E10) -> 5.4706250000000001 | F12: =MIN(F2:F10) -> 5.9760499999999999