A1: 股票代码 | B1: 股票简称 | C1: 所属同花顺行业
A2: 605266.SH | B2: 健之佳 | C2: 医药生物-医药商业-医药商业Ⅲ | F2: 5.1939500000000001
A3: 002589.SZ | B3: 瑞康医药 | C3: 医药生物-医药商业-医药商业Ⅲ | D3: 2.6366166666666668 | E3: 3.84476 | F3: 2.2858000000000001
A4: 600829.SH | B4: 人民同泰 | C4: 医药生物-医药商业-医药商业Ⅲ | D4: 2.8922416666666666 | E4: 3.1050050000000002 | F4: 3.07605
A5: 600056.SH | B5: 中国医药 | C5: 医药生物-医药商业-医药商业Ⅲ | D5: 4.4576416666666674 | E5: 5.0180999999999996 | F5: 4.0167999999999999
A6: 000705.SZ | B6: 浙江震元 | C6: 医药生物-医药商业-医药商业Ⅲ | D6: 2.9090166666666661 | E6: 2.7544599999999995 | F6: 2.4420500000000001
A7: 000028.SZ | B7: 国药一致 | C7: 医药生物-医药商业-医药商业Ⅲ | D7: 2.793625 | E7: 2.87798 | F7: 2.6350499999999997
A8: 000411.SZ | B8: 英特集团 | C8: 医药生物-医药商业-医药商业Ⅲ | D8: 1.4412 | E8: 1.2947549999999999 | F8: 1.6191500000000001
A9: 603368.SH | B9: 柳药股份 | C9: 医药生物-医药商业-医药商业Ⅲ | D9: 5.1381583333333332 | E9: 4.8913400000000005 | F9: 4.3132000000000001
A10: 600998.SH | B10: 九州通 | C10: 医药生物-医药商业-医药商业Ⅲ | D10: 2.3467916666666668 | E10: 2.0079099999999999 | F10: 3.2300500000000003
A11: 002462.SZ | B11: 嘉事堂 | C11: 医药生物-医药商业-医药商业Ⅲ | D11: 2.762775 | E11: 3.1098400000000002 | F11: 2.4455
A12: 600833.SH | B12: 第一医药 | C12: 医药生物-医药商业-医药商业Ⅲ | D12: 4.1169416666666665 | E12: 3.7627200000000007 | F12: 3.85785
A13: 603939.SH | B13: 益丰药房 | C13: 医药生物-医药商业-医药商业Ⅲ | D13: 6.8493166666666667 | E13: 6.8382750000000003 | F13: 7.2893499999999998
A14: 600713.SH | B14: 南京医药 | C14: 医药生物-医药商业-医药商业Ⅲ | D14: 1.1498083333333335 | E14: 1.1236200000000003 | F14: 1.24655
A15: 603883.SH | B15: 老百姓 | C15: 医药生物-医药商业-医药商业Ⅲ | D15: 5.9927833333333345 | E15: 5.9804050000000011 | F15: 5.8304500000000008
A16: 600272.SH | B16: 开开实业 | C16: 医药生物-医药商业-医药商业Ⅲ | D16: 1.6647083333333332 | E16: 2.3372300000000004 | F16: 0.92490000000000006
A17: 601607.SH | B17: 上海医药 | C17: 医药生物-医药商业-医药商业Ⅲ | D17: 3.2077666666666667 | E17: 3.2300150000000003 | F17: 3.6448499999999999
A18: 600511.SH | B18: 国药股份 | C18: 医药生物-医药商业-医药商业Ⅲ | D18: 3.7377000000000002 | E18: 3.7499950000000006 | F18: 3.9573
A19: 603716.SH | B19: 塞力医疗 | C19: 医药生物-医药商业-医药商业Ⅲ | D19: 3.8736083333333333 | E19: 6.4605800000000002 | F19: 1.39005
A20: 002727.SZ | B20: 一心堂 | C20: 医药生物-医药商业-医药商业Ⅲ | D20: 6.6782499999999994 | E20: 6.3654650000000004 | F20: 7.5286499999999998
A21: 603233.SH | B21: 大参林 | C21: 医药生物-医药商业-医药商业Ⅲ | D21: 7.4840666666666662 | E21: 7.2200100000000003 | F21: 7.4293499999999995
A22: 002788.SZ | B22: 鹭燕医药 | C22: 医药生物-医药商业-医药商业Ⅲ | D22: 1.6593416666666669 | E22: 1.650555 | F22: 1.7498499999999999
A23: 000078.SZ | B23: 海王生物 | C23: 医药生物-医药商业-医药商业Ⅲ | D23: 1.4614416666666667 | E23: 2.0780250000000007 | F23: 1.2195499999999999
A24: 000950.SZ | B24: 重药控股 | C24: 医药生物-医药商业-医药商业Ⅲ | D24: 2.2496333333333332 | E24: 0.50398499999999991 | F24: 1.9123999999999999
A25: 603122.SH | B25: 合富中国 | C25: 医药生物-医药商业-医药商业Ⅲ | F25: 5.9281500000000005
D26: =MAX(D2:D25) -> 7.4840666666666662 | E26: =MAX(E2:E25) -> 7.2200100000000003 | F26: =MAX(F2:F25) -> 7.5286499999999998
D27: =MIN(D2:D25) -> 1.1498083333333335 | E27: =MIN(E2:E25) -> 0.50398499999999991 | F27: =MIN(F2:F25) -> 0.92490000000000006