A1: 股票代码 | B1: 股票简称 | C1: 区间涨跌幅:前复权(%)2020.12.29-2021.12.28 | D1: 基本每股收(元)2021.09.30 | E1: 行业 | F1: 当前基底处于上升趋势的位置(即处于第几个基底) | G1: 趋势 | R1: 波动收缩幅度 | AK1: 成交量行为 | AM1: 价格行为(得分应大于60%) | AP1: 结论 | AQ1: 更新时间 | AR1: 标签
G2: 200日均线 | H2: 150日均线 | I2: 50日均线 | J2: 各均线斜率是否朝上 | K2: 当前股价 | L2: 52周内最低点 | M2: 52周内最高点 | N2: 最高点前8周收盘价 | O2: 当前股价相对于最低点百分比(至少高出25%) | P2: 当前股价相对于最高点百分比(25%内最好) | Q2: 最高点前8周股价相对于最高点百分比 | R2: 技术足迹 | AK2: 不同收盘表现时交易量情况(好的收盘时，交易量是否增大，坏的收盘时，交易量是否萎缩) | AL2: 成交量收缩情况(最后的价格收缩期间的成交量应低于50天的平均水平且有一到两天交易量极低) | AM2: 支撑位和压力位是否同步升高(40%) | AN2: 是否有网球行为出现(40%) | AO2: 上涨天数是否大于下跌天数(20%)
R3: 支撑位1 | S3: 阻力位2 | T3: 支撑位2 | U3: 阻力位3 | V3: 支撑位3 | W3: 阻力位4 | X3: 支撑位4 | Y3: 阻力位5 | Z3: 支撑位5 | AA3: 阻力位6 | AB3: 支撑位6 | AC3: 时间周期 | AD3: 收缩量1 | AE3: 收缩量2 | AF3: 收缩量3 | AG3: 收缩量4 | AH3: 收缩量5 | AI3: 收缩量6 | AJ3: 收缩数量(至少大于3T)
A4: 600071 | B4: 凤凰光学 | D4: 3.6700000000000003e-02 | E4: 光学光电子 | G4: 30 | H4: 33.530000000000001 | I4: 47.619999999999997 | K4: 55.5 | L4: 12.41 | M4: 61.579999999999998 | N4: 16.940000000000001 | O4: =(K4-L4)/L4 -> 3.4721998388396456 | P4: =(M4-K4)/M4 -> 9.8733354985384839e-02 | Q4: =(M4-N4)/N4 -> 2.6351829988193622 | R4: 42.5 | AC4: 5w | AD4: =(M4-R4)/M4 -> 0.30984085742124062 | AP4: 暂不宜入场（收缩幅度不够，应继续观察5w） | AQ4: 44571
A5: 603297 | B5: 永新光学 | C5: 201.83 | D5: 1.97 | E5: 光学光电子 | G5: 65.859999999999999 | H5: 70.349999999999994 | I5: 88.370000000000005 | K5: 105.72 | L5: 36.710000000000001 | M5: 129.19999999999999 | N5: 62 | O5: =(K5-L5)/L5 -> 1.8798692454372103 | P5: =(M5-K5)/M5 -> 0.1817337461300309 | Q5: =(M5-N5)/N5 -> 1.0838709677419354 | R5: 99.549999999999997 | AC5: 1w | AD5: =(M5-R5)/M5 -> 0.22948916408668726 | AE5: =(S5-T5)/S5 -> #DIV/0! | AF5: =(U5-V5)/U5 -> #DIV/0! | AG5: =(W5-X5)/W5 -> #DIV/0! | AH5: =(Y5-Z5)/Y5 -> #DIV/0! | AP5: 暂不宜入场（收缩幅度不够，应继续观察2w） | AQ5: 44571
A6: 603985 | B6: 恒润股份 | C6: 81.5 | D6: 1.27 | E6: 电力设备 | G6: 32.450000000000003 | H6: 35.340000000000003 | I6: 46.530000000000001 | K6: 49.390000000000001 | L6: 15.01 | M6: 57.710000000000001 | N6: 26.449999999999999 | O6: =(K6-L6)/L6 -> 2.2904730179880084 | P6: =(M6-K6)/M6 -> 0.14416912146941605 | Q6: =(M6-N6)/N6 -> 1.1818525519848773 | R6: 39.310000000000002 | AC6: 5w | AD6: =(M6-R6)/M6 -> 0.3188355570958239 | AE6: =(S6-T6)/S6 -> #DIV/0! | AF6: =(U6-V6)/U6 -> #DIV/0! | AP6: 暂不宜入场（收缩幅度不够，应继续观察5w） | AQ6: 44578
A7: 603197.SH | B7: 保隆科技 | C7: 109.17 | D7: 1.2 | E7: 汽车零部件 | G7: 35.310000000000002 | H7: 37.299999999999997 | I7: 46.289999999999999 | K7: 57.600000000000001 | L7: 22.620000000000001 | M7: 69.489999999999995 | N7: 31.420000000000002 | O7: =(K7-L7)/L7 -> 1.5464190981432362 | P7: =(M7-K7)/M7 -> 0.17110375593610583 | Q7: =(M7-N7)/N7 -> 1.2116486314449393 | R7: 53.149999999999999 | AC7: 2w | AD7: =(M7-R7)/M7 -> 0.23514174701395882 | AE7: =(S7-T7)/S7 -> #DIV/0! | AP7: 暂不宜入场（收缩幅度不够，应继续观察2w） | AQ7: 44571
A8: 603192.SH | B8: 汇得科技 | C8: 147.86 | D8: 0.85 | E8: 化学制品 | F8: 1 | G8: 30.940000000000001 | H8: 33 | I8: 43.049999999999997 | K8: 59.460000000000001 | L8: 20.969999999999999 | M8: 60.719999999999999 | N8: 25.530000000000001 | O8: =(K8-L8)/L8 -> 1.8354792560801148 | P8: =(M8-K8)/M8 -> 2.0750988142292457e-02 | Q8: =(M8-N8)/N8 -> 1.3783783783783783 | R8: 45.520000000000003 | AC8: 1w | AD8: =(M8-R8)/M8 -> 0.25032938076416333 | AP8: 暂不宜入场（收缩幅度不够，应继续观察2w） | AQ8: 44578
A9: 603606.SH | B9: 东方电缆 | C9: 87.88 | D9: 1.47 | E9: 电力设备 | G9: 33.259999999999998 | H9: 35.909999999999997 | I9: 47.210000000000001 | K9: 50.340000000000003 | L9: 18.510000000000002 | M9: 63.75 | N9: 31.57 | O9: =(K9-L9)/L9 -> 1.719611021069692 | P9: =(M9-K9)/M9 -> 0.21035294117647055 | Q9: =(M9-N9)/N9 -> 1.0193221412733608 | R9: 43.600000000000001 | AC9: 4w | AD9: =(M9-R9)/M9 -> 0.31607843137254898 | AE9: =(S9-T9)/S9 -> #DIV/0! | AF9: =(U9-V9)/U9 -> #DIV/0! | AJ9: 1T | AP9: 不宜入场(有强力拉升的潜力，但收缩幅度不够，应该持续观察2个w) | AQ9: 44571
A10: 002118 | B10: 紫鑫药业 | G10: 2.8599999999999999 | H10: 2.8399999999999999 | I10: 2.96 | AP10: 不宜入场(150日均线小于200日均线，应该持续观察8个w) | AQ10: 44570
A11: 600262 | B11: 北方股份 | G11: 16.129999999999999 | H11: 16.530000000000001 | I11: 19.329999999999998 | K11: 25.539999999999999 | L11: 12.42 | M11: 28.379999999999999 | N11: 13.880000000000001 | O11: =(K11-L11)/L11 -> 1.0563607085346216 | P11: =(M11-K11)/M11 -> 0.10007047216349542 | Q11: =(M11-N11)/N11 -> 1.0446685878962534 | R11: 20.690000000000001 | AC11: 1w | AD11: =(M11-R11)/M11 -> 0.27096546863988719 | AP11: 暂不宜入场（收缩幅度不够，应继续观察3w） | AQ11: 44570
A12: 600479 | B12: 千金药业 | G12: 9.1799999999999997 | H12: 9.4600000000000009 | I12: 10.82 | K12: 13.859999999999999 | L12: 7.3899999999999997 | M12: 16 | N12: 8.3399999999999999 | O12: =(K12-L12)/L12 -> 0.87550744248985113 | P12: =(M12-K12)/M12 -> 0.13375000000000004 | Q12: =(M12-N12)/N12 -> 0.91846522781774587 | AD12: =(M12-R12)/M12 -> 1 | AQ12: 44570
A13: 002354 | B13: 天神娱乐 | G13: 3.5699999999999998 | H13: 3.7200000000000002 | I13: 4.4299999999999997 | K13: 6.0700000000000003 | L13: 2.3300000000000001 | M13: 7.1699999999999999 | N13: 3.5299999999999998 | O13: =(K13-L13)/L13 -> 1.6051502145922747 | P13: =(M13-K13)/M13 -> 0.15341701534170149 | Q13: =(M13-N13)/N13 -> 1.0311614730878187 | R13: 5.7199999999999998 | AC13: 1w | AD13: =(M13-R13)/M13 -> 0.20223152022315205 | AP13: 暂不宜入场（收缩幅度不够，应继续观察1w） | AQ13: 44578
A14: 603311 | B14: 金海高科 | G14: 10.93 | H14: 10.93 | I14: 11.550000000000001 | K14: 14.34 | L14: 9.2200000000000006 | M14: 16.670000000000002 | N14: 9.6600000000000001 | O14: =(K14-L14)/L14 -> 0.55531453362255956 | P14: =(M14-K14)/M14 -> 0.13977204559088191 | Q14: =(M14-N14)/N14 -> 0.72567287784679102 | AQ14: 44570
A15: 002486 | B15: 嘉麟杰 | G15: 2.7799999999999998 | H15: 2.7599999999999998 | AQ15: 44570
A16: 603363 | B16: 傲农生物 | G16: 11.07 | H16: 10.949999999999999 | AQ16: 44570
A17: 600986 | B17: 浙文互联 | G17: 4.7999999999999998 | H17: 4.9800000000000004 | I17: 5.9199999999999999 | K17: 8.3699999999999992 | L17: 3.6699999999999999 | M17: 9.7200000000000006 | N17: 4.6600000000000001 | O17: =(K17-L17)/L17 -> 1.2806539509536783 | P17: =(M17-K17)/M17 -> 0.13888888888888903 | Q17: =(M17-N17)/N17 -> 1.0858369098712448 | R17: 7.8399999999999999 | S17: 9.2699999999999996 | T17: 7.9500000000000002 | AC17: 1w | AD17: =(M17-R17)/M17 -> 0.19341563786008237 | AE17: =(S17-T17)/S17 -> 0.14239482200647244 | AP17: 暂不宜入场（收缩幅度不够，应继续观察1w） | AQ17: 44578
A18: 000607 | B18: 华媒控股 | G18: 3.9300000000000002 | H18: 3.9900000000000002 | I18: 4.3899999999999997 | K18: 5.7800000000000002 | L18: 3.2799999999999998 | M18: 6.5999999999999996 | N18: 3.96 | O18: =(K18-L18)/L18 -> 0.76219512195121975 | P18: =(M18-K18)/M18 -> 0.12424242424242415 | Q18: =(M18-N18)/N18 -> 0.66666666666666663 | AQ18: 44570
A19: 002059 | B19: 云南旅游 | G19: 5.2999999999999998 | H19: 5.2599999999999998 | AQ19: 44570
A20: 002840 | B20: 华统股份 | G20: 11.1 | H20: 11.43 | I20: 13.52 | K20: 18.07 | L20: 8.1199999999999992 | M20: 20.149999999999999 | N20: 10.130000000000001 | O20: =(K20-L20)/L20 -> 1.225369458128079 | P20: =(M20-K20)/M20 -> 0.10322580645161282 | Q20: =(M20-N20)/N20 -> 0.98914116485686054 | R20: 17 | S20: 19.100000000000001 | T20: 17.329999999999998 | AC20: 1w | AD20: =(M20-R20)/M20 -> 0.15632754342431757 | AE20: =(S20-T20)/S20 -> 9.2670157068062989e-02 | AL20: 否 | AP20: 暂不宜入场（成交量行为不符合，应继续观察1w） | AQ20: 44578
A21: 002873 | B21: 新天药业 | G21: 13.56 | H21: 13.98 | I21: 16.02 | K21: 22.18 | L21: 10.59 | M21: 24.199999999999999 | N21: 13.390000000000001 | O21: =(K21-L21)/L21 -> 1.0944287063267233 | P21: =(M21-K21)/M21 -> 8.347107438016528e-02 | Q21: =(M21-N21)/N21 -> 0.80731889469753537 | AQ21: 44570
A22: 600129 | B22: 太极集团 | G22: 16.460000000000001 | H22: 16.780000000000001 | I22: 18.210000000000001 | K22: 24.289999999999999 | L22: 12.98 | M22: 27.18 | N22: 15.390000000000001 | O22: =(K22-L22)/L22 -> 0.87134052388289662 | P22: =(M22-K22)/M22 -> 0.1063281824871229 | Q22: =(M22-N22)/N22 -> 0.76608187134502914 | AQ22: 44570
A23: 000819 | B23: 岳阳兴长 | G23: 8.6300000000000008 | H23: 9.2300000000000004 | I23: 12.470000000000001 | K23: 18.800000000000001 | L23: 5.8700000000000001 | M23: 24.530000000000001 | N23: 7.1200000000000001 | O23: =(K23-L23)/L23 -> 2.2027257240204428 | P23: =(M23-K23)/M23 -> 0.23359152058703628 | Q23: =(M23-N23)/N23 -> 2.4452247191011236 | R23: 18.800000000000001 | AC23: 1w | AD23: =(M23-R23)/M23 -> 0.23359152058703628 | AP23: 暂不宜入场（收缩幅度不够，应继续观察2w） | AQ23: 44570
A24: 000558 | B24: 莱茵体育 | G24: 3.3100000000000001 | H24: 3.3500000000000001 | I24: 3.6299999999999999 | K24: 4.7599999999999998 | L24: 2.48 | M24: 5.6399999999999997 | N24: 3.5099999999999998 | O24: =(K24-L24)/L24 -> 0.91935483870967738 | P24: =(M24-K24)/M24 -> 0.15602836879432624 | Q24: =(M24-N24)/N24 -> 0.60683760683760679 | AQ24: 44570
A25: 000999 | B25: 华润三九 | G25: 26.48 | H25: 26.82 | I25: 28.77 | K25: 37.950000000000003 | L25: 23.23 | M25: 41.18 | N25: 23.91 | O25: =(K25-L25)/L25 -> 0.63366336633663378 | P25: =(M25-K25)/M25 -> 7.8436134045653153e-02 | Q25: =(M25-N25)/N25 -> 0.72229192806357168 | AQ25: 44570
A26: 601107 | B26: 四川成渝 | G26: 3.5299999999999998 | H26: 3.6299999999999999 | I26: 4.1699999999999999 | K26: 5.4800000000000004 | L26: 2.7000000000000002 | M26: 5.96 | N26: 3.6099999999999999 | O26: =(K26-L26)/L26 -> 1.0296296296296297 | P26: =(M26-K26)/M26 -> 8.0536912751677778e-02 | Q26: =(M26-N26)/N26 -> 0.65096952908587258 | AQ26: 44570
A27: 000719 | B27: 中原传媒 | G27: 7.0499999999999998 | H27: 7.1100000000000003 | I27: 7.4900000000000002 | K27: 10.140000000000001 | L27: 6.1699999999999999 | M27: 10.199999999999999 | N27: 6.9699999999999998 | O27: =(K27-L27)/L27 -> 0.64343598055105355 | P27: =(M27-K27)/M27 -> 5.8823529411763456e-03 | Q27: =(M27-N27)/N27 -> 0.46341463414634143 | AQ27: 44570
A28: 000503 | B28: 国新健康 | G28: 8.5800000000000001 | H28: 8.9900000000000002 | I28: 11.73 | K28: 19.34 | L28: 5.9000000000000004 | M28: 21.559999999999999 | N28: 5.9900000000000002 | O28: =(K28-L28)/L28 -> 2.2779661016949149 | P28: =(M28-K28)/M28 -> 0.1029684601113172 | Q28: =(M28-N28)/N28 -> 2.5993322203672786 | R28: 14.59 | AC28: 1w | AD28: =(M28-R28)/M28 -> 0.32328385899814466 | AP28: 暂不宜入场（收缩幅度不够，应继续观察3w） | AQ28: 44570
A29: 002432 | B29: 九安医疗 | G29: 14.220000000000001 | H29: 16.059999999999999 | I29: 27.48 | K29: 50.5 | L29: 5.7999999999999998 | M29: 59 | N29: 6.0300000000000002 | O29: =(K29-L29)/L29 -> 7.7068965517241388 | P29: =(M29-K29)/M29 -> 0.1440677966101695 | Q29: =(M29-N29)/N29 -> 8.7844112769485907 | R29: 44.82 | AC29: 1w | AD29: =(M29-R29)/M29 -> 0.24033898305084744 | AP29: 暂不宜入场（收缩幅度不够，应继续观察3w） | AQ29: 44570
A30: 603123 | B30: 翠微股份 | G30: 7.1799999999999997 | H30: 7.25 | I30: 7.8200000000000003 | K30: 11.949999999999999 | L30: 5.9199999999999999 | M30: 11.949999999999999 | N30: 6.7999999999999998 | O30: =(K30-L30)/L30 -> 1.0185810810810809 | P30: =(M30-K30)/M30 -> 0 | Q30: =(M30-N30)/N30 -> 0.75735294117647056 | AQ30: 44570
B31: 博瑞传播 | G31: 4.1100000000000003 | H31: 4.1900000000000004 | I31: 4.9400000000000004 | K31: 7.1699999999999999 | L31: 3.21 | M31: 9.0899999999999999 | N31: 3.6899999999999999 | O31: =(K31-L31)/L31 -> 1.233644859813084 | P31: =(M31-K31)/M31 -> 0.21122112211221122 | Q31: =(M31-N31)/N31 -> 1.4634146341463417 | R31: 7.1699999999999999 | AC31: 1w | AD31: =(M31-R31)/M31 -> 0.21122112211221122 | AP31: 暂不宜入场（收缩幅度不够，应继续观察3w） | AQ31: 44570
B32: 西陇科学 | G32: 6.8099999999999996 | H32: 7.04 | I32: 8.0899999999999999 | K32: 9.6199999999999992 | L32: 4.9500000000000002 | M32: 12.449999999999999 | N32: 5.7999999999999998 | O32: =(K32-L32)/L32 -> 0.94343434343434318 | P32: =(M32-K32)/M32 -> 0.22730923694779118 | Q32: =(M32-N32)/N32 -> 1.146551724137931 | R32: 9.5099999999999998 | AC32: 1w | AD32: =(M32-R32)/M32 -> 0.23614457831325297 | AP32: 暂不宜入场（收缩幅度不够，应继续观察3w） | AQ32: 44570
B33: 雪人股份 | G33: 8.2400000000000002 | H33: 8.6099999999999994 | I33: 10.390000000000001 | K33: 16.27 | L33: 5.3200000000000003 | M33: 18.449999999999999 | N33: 7.8799999999999999 | O33: =(K33-L33)/L33 -> 2.0582706766917291 | P33: =(M33-K33)/M33 -> 0.11815718157181571 | Q33: =(M33-N33)/N33 -> 1.3413705583756346 | AQ33: 44570
B34: 冰山冷热 | G34: 4.0499999999999998 | H34: 4.0999999999999996 | I34: 4.5300000000000002 | K34: 7.2400000000000002 | L34: 3.3500000000000001 | M34: 8.3100000000000005 | N34: 3.5600000000000001 | O34: =(K34-L34)/L34 -> 1.1611940298507464 | P34: =(M34-K34)/M34 -> 0.12876052948255118 | Q34: =(M34-N34)/N34 -> 1.3342696629213482 | AQ34: 44570
B35: 精华制药 | G35: 5.8600000000000003 | H35: 6.1299999999999999 | I35: 7.3799999999999999 | K35: 11.220000000000001 | L35: 3.9199999999999999 | M35: 13.65 | N35: 5.6100000000000003 | O35: =(K35-L35)/L35 -> 1.8622448979591839 | P35: =(M35-K35)/M35 -> 0.178021978021978 | Q35: =(M35-N35)/N35 -> 1.4331550802139035 | R35: 10.31 | AC35: 1w | AD35: =(M35-R35)/M35 -> 0.24468864468864468 | AP35: 暂不宜入场（收缩幅度不够，应继续观察3w） | AQ35: 44570
B36: 皇庭国际 | G36: 3.7400000000000002 | H36: 3.9199999999999999 | I36: 4.6799999999999997 | K36: 7.5800000000000001 | L36: 2.5800000000000001 | M36: 7.7999999999999998 | N36: 4.3300000000000001 | O36: =(K36-L36)/L36 -> 1.9379844961240309 | P36: =(M36-K36)/M36 -> 2.8205128205128174e-02 | Q36: =(M36-N36)/N36 -> 0.80138568129330245 | AQ36: 44570
B37: 龙津药业 | G37: 8.2200000000000006 | H37: 8.4000000000000004 | I37: 10.06 | K37: 22.370000000000001 | L37: 6.79 | M37: 24.329999999999998 | N37: 7.1399999999999997 | O37: =(K37-L37)/L37 -> 2.2945508100147278 | P37: =(M37-K37)/M37 -> 8.0558980682285133e-02 | Q37: =(M37-N37)/N37 -> 2.4075630252100839 | R37: 20.329999999999998 | AC37: 0w | AD37: =(M37-R37)/M37 -> 0.16440608302507195 | AP37: 暂不宜入场（收缩幅度不够，应继续观察1w） | AQ37: 44578
B38: 顾地科技 | G38: 3.0600000000000001 | H38: 3.1899999999999999 | I38: 3.7400000000000002 | K38: 6.5599999999999996 | L38: 1.9299999999999999 | M38: 6.5599999999999996 | N38: 2.8999999999999999 | O38: =(K38-L38)/L38 -> 2.3989637305699483 | P38: =(M38-K38)/M38 -> 0 | Q38: =(M38-N38)/N38 -> 1.2620689655172412 | AP38: 暂不宜入场（收缩幅度不够，应继续观察1w） | AQ38: 44570
B39: 新力金融 | G39: 8.9199999999999999 | H39: 9.2599999999999998 | I39: 11.359999999999999 | K39: 11.5 | L39: 6.4000000000000004 | M39: 17.460000000000001 | N39: 6.6500000000000004 | O39: =(K39-L39)/L39 -> 0.79687499999999989 | P39: =(M39-K39)/M39 -> 0.34135166093928981 | Q39: =(M39-N39)/N39 -> 1.6255639097744361 | R39: 11.17 | AC39: 3w | AD39: =(M39-R39)/M39 -> 0.36025200458190154 | AP39: 暂不宜入场（收缩幅度不够，应继续观察3w） | AQ39: 44570
B40: 盛洋科技 | D40: 0.05 | E40: 光学光电子 | G40: 16.100000000000001 | H40: 16.940000000000001 | I40: 20.879999999999999 | K40: 22.899999999999999 | L40: 11 | M40: 25.66 | N40: 13.630000000000001 | O40: =(K40-L40)/L40 -> 1.0818181818181818 | P40: =(M40-K40)/M40 -> 0.107560405300078 | Q40: =(M40-N40)/N40 -> 0.88261188554658832 | R40: 20.399999999999999 | S40: 24.48 | T40: 21.350000000000001 | U40: 23.5 | V40: 22.030000000000001 | AC40: 6w | AD40: =(M40-R40)/M40 -> 0.20498830865159787 | AE40: =(S40-T40)/S40 -> 0.12785947712418297 | AF40: =(U40-V40)/U40 -> 6.2553191489361656e-02 | AP40: 已错过最佳入场点 | AQ40: 44578