A1: 股票代码 | B1: 股票简称 | C1: 所属同花顺行业
A2: 601399.SH | B2: 国机重装 | C2: 机械设备-专用设备-能源及重型设备 | D2: 3.6487250000000002 | F2: 3.8479000000000001
A3: 002483.SZ | B3: 润邦股份 | C3: 机械设备-专用设备-能源及重型设备 | D3: 5.7425416666666678 | E3: 6.137995000000001 | F3: 10.473800000000001
A4: 600262.SH | B4: 北方股份 | C4: 机械设备-专用设备-能源及重型设备 | D4: 6.5159916666666673 | E4: 7.3973300000000011 | F4: 5.6100500000000002
A5: 002526.SZ | B5: 山东矿机 | C5: 机械设备-专用设备-能源及重型设备 | D5: 9.3885000000000023 | E5: 7.4521200000000025 | F5: 7.3248999999999995
A6: 601717.SH | B6: 郑煤机 | C6: 机械设备-专用设备-能源及重型设备 | D6: 6.6393916666666684 | E6: 6.0487300000000008 | F6: 8.1118000000000006
A7: 002523.SZ | B7: 天桥起重 | C7: 机械设备-专用设备-能源及重型设备 | D7: 4.1927500000000002 | E7: 6.1687350000000007 | F7: 4.1637000000000004
A8: 600560.SH | B8: 金自天正 | C8: 机械设备-专用设备-能源及重型设备 | D8: 6.3314500000000002 | E8: 5.5508849999999992 | F8: 7.8592500000000003
A9: 603036.SH | B9: 如通股份 | C9: 机械设备-专用设备-能源及重型设备 | D9: 20.025425000000002 | E9: 19.058445000000003 | F9: 20.964950000000002
A10: 603966.SH | B10: 法兰泰克 | C10: 机械设备-专用设备-能源及重型设备 | D10: 9.3271083333333333 | E10: 8.643180000000001 | F10: 12.83905
A11: 002204.SZ | B11: 大连重工 | C11: 机械设备-专用设备-能源及重型设备 | D11: 0.61479166666666663 | E11: -0.52692500000000009 | F11: 1.2686500000000001
A12: 600320.SH | B12: 振华重工 | C12: 机械设备-专用设备-能源及重型设备 | D12: 0.8695666666666666 | E12: 1.0045249999999997 | F12: 0.99144999999999994
A13: 600980.SH | B13: 北矿科技 | C13: 机械设备-专用设备-能源及重型设备 | D13: 8.560316666666667 | E13: 8.27271 | F13: 10.483049999999999
A14: 002353.SZ | B14: 杰瑞股份 | C14: 机械设备-专用设备-能源及重型设备 | D14: 19.005674999999997 | E14: 13.62594 | F14: 21.060299999999998
A15: 600582.SH | B15: 天地科技 | C15: 机械设备-专用设备-能源及重型设备 | D15: 7.1052666666666662 | E15: 6.625869999999999 | F15: 9.2913500000000013
A16: 603012.SH | B16: 创力集团 | C16: 机械设备-专用设备-能源及重型设备 | D16: 15.484283333333336 | E16: 14.473255000000004 | F16: 15.26055
A17: 002651.SZ | B17: 利君股份 | C17: 机械设备-专用设备-能源及重型设备 | D17: 26.544866666666664 | E17: 25.493914999999994 | F17: 25.50525
A18: 002730.SZ | B18: 电光科技 | C18: 机械设备-专用设备-能源及重型设备 | D18: 7.363666666666667 | E18: 7.2049849999999989 | F18: 7.9959000000000007
A19: 603698.SH | B19: 航天工程 | C19: 机械设备-专用设备-能源及重型设备 | D19: 3.0298500000000002 | E19: 10.143475 | F19: 9.2120999999999995
A20: 002691.SZ | B20: 冀凯股份 | C20: 机械设备-专用设备-能源及重型设备 | D20: 1.1377666666666666 | E20: 1.9678799999999999 | F20: 5.9445000000000006
A21: 603169.SH | B21: 兰石重装 | C21: 机械设备-专用设备-能源及重型设备 | D21: -5.1928333333333336 | E21: -5.4787650000000001 | F21: 4.0621
A22: 002490.SZ | B22: 山东墨龙 | C22: 机械设备-专用设备-能源及重型设备 | D22: -5.4545083333333331 | E22: -5.6403949999999998 | F22: -2.6333000000000002
A23: 601106.SH | B23: 中国一重 | C23: 机械设备-专用设备-能源及重型设备 | D23: 0.73261666666666658 | E23: -8.4037249999999997 | F23: 0.48049999999999998
A24: 603800.SH | B24: 道森股份 | C24: 机械设备-专用设备-能源及重型设备 | D24: 1.0354999999999999 | E24: 1.1766099999999997 | F24: -7.6379000000000001
A25: 601798.SH | B25: 蓝科高新 | C25: 机械设备-专用设备-能源及重型设备 | D25: -6.4463166666666654 | E25: -10.587225 | F25: -24.553550000000001
A26: 002667.SZ | B26: 鞍重股份 | C26: 机械设备-专用设备-能源及重型设备 | D26: 5.3586583333333335 | E26: 8.4864850000000001 | F26: -4.7567500000000003
A27: 002278.SZ | B27: 神开股份 | C27: 机械设备-专用设备-能源及重型设备 | D27: 3.6599666666666661 | E27: 0.55206499999999947 | F27: 3.3300000000000001
A28: 601608.SH | B28: 中信重工 | C28: 机械设备-专用设备-能源及重型设备 | D28: 3.628833333333334 | E28: 0.72917999999999983 | F28: 4.5267999999999997
A29: 600169.SH | B29: 太原重工 | C29: 机械设备-专用设备-能源及重型设备 | D29: -1.6526416666666666 | E29: -3.1395499999999998 | F29: 3.7048500000000004
A30: 000852.SZ | B30: 石化机械 | C30: 机械设备-专用设备-能源及重型设备 | D30: 0.62907499999999994 | E30: -3.5489100000000002 | F30: 0.80630000000000002
A31: 001288.SZ | B31: 运机集团 | C31: 机械设备-专用设备-能源及重型设备 | F31: 12.428850000000001
D32: =MAX(D2:D31) -> 26.544866666666664 | E32: =MAX(E2:E31) -> 25.493914999999994 | F32: =MAX(F2:F31) -> 25.50525
D33: =MIN(D2:D31) -> -6.4463166666666654 | E33: =MIN(E2:E31) -> -10.587225 | F33: =MIN(F2:F31) -> -24.553550000000001