A1: 股票代码 | B1: 股票简称 | C1: 所属同花顺行业 | D1: 基本面 | H1: 技术面 | L1: 得分 | M1: 结论 | N1: 更新时间
D2: 本季度利润增长速度 | E2: 本季度销售增长速度 | F2: 本季度利润率 | G2: 市盈率(股票价格/每股收益) | H2: 价格趋势是否已经掉头向上 | I2: 当日收盘价 | J2: 最低点价格 | K2: 相对价格强度
A3: 000766.SZ | B3: 通化金马 | C3: 医药生物-化学制药-化学制剂 | D3: 109.9450884685784 | E3: 21.569831189999999 | F3: 1.3617999999999999 | G3: -26.899999999999999 | H3: 从2021/10/27开始向上 | I3: 5.1699999999999999 | J3: 3.6299999999999999 | K3: =(I3-J3)/J3 -> 0.42424242424242425 | L3: 3 | M3: 力生制药为领头羊,卫信康为次级领头羊 | N3: 44672
A4: 600789.SH | B4: 鲁抗医药 | C4: 医药生物-化学制药-化学制剂 | D4: -61.53846153846154 | E4: 11.038423760000001 | F4: 2.4283000000000001 | G4: 73.719999999999999 | H4: 从2022/03/09开始向上 | I4: 6.8099999999999996 | J4: 6.0599999999999996 | K4: =(I4-J4)/J4 -> 0.12376237623762378 | L4: 1
A5: 603707.SH | B5: 健友股份 | C5: 医药生物-化学制药-化学制剂 | D5: 35.294117647058812 | E5: 22.33786413 | F5: 30.4099 | G5: 38.490000000000002 | H5: 从2021/09/06开始向上 | I5: 32.119999999999997 | J5: 27.059999999999999 | K5: =(I5-J5)/J5 -> 0.18699186991869915 | L5: 4
A6: 002435.SZ | B6: 长江健康 | C6: 医药生物-化学制药-化学制剂 | D6: 16.765106769650167 | E6: 40.824292749999998 | F6: 9.3668999999999993 | G6: 37.899999999999999 | H6: 从2022/02/07开始向上 | I6: 8.9900000000000002 | J6: 4.0999999999999996 | K6: =(I6-J6)/J6 -> 1.1926829268292685 | L6: 2
A7: 002370.SZ | B7: 亚太药业 | C7: 医药生物-化学制药-化学制剂 | D7: 10.000000000000009 | E7: -28.033564999999999 | F7: -43.582999999999998 | G7: 80.420000000000002 | H7: 从2021/08/31开始向上 | I7: 5.8600000000000003 | J7: 3.9199999999999999 | K7: =(I7-J7)/J7 -> 0.49489795918367357 | L7: 2
A8: 000597.SZ | B8: 东北制药 | C8: 医药生物-化学制药-化学制剂 | D8: 3050.0000000000005 | E8: 4.14169959 | F8: 0.47289999999999999 | G8: 237.52000000000001 | H8: 从2021/10/28开始向上 | I8: 6.5099999999999998 | J8: 4.8700000000000001 | K8: =(I8-J8)/J8 -> 0.3367556468172484 | L8: 2
A9: 002019.SZ | B9: 亿帆医药 | C9: 医药生物-化学制药-化学制剂 | D9: -67.567567567567565 | E9: -15.199111090000001 | F9: 7.1326999999999998 | G9: 57.859999999999999 | H9: 从2021/08/26开始向上 | I9: 16.309999999999999 | J9: 14.6 | K9: =(I9-J9)/J9 -> 0.11712328767123281 | L9: 1
A10: 603168.SH | B10: 莎普爱思 | C10: 医药生物-化学制药-化学制剂 | D10: 222.22222222222223 | E10: 83.645107210000006 | F10: 7.6402999999999999 | G10: -28.489999999999998 | H10: 从2021/12/07开始向上 | I10: 10.17 | J10: 8.4399999999999995 | K10: =(I10-J10)/J10 -> 0.20497630331753561 | L10: 2
A11: 600664.SH | B11: 哈药股份 | C11: 医药生物-化学制药-化学制剂 | D11: 900 | E11: 5.9191918899999996 | F11: 5.4337999999999997 | G11: -38.399999999999999 | H11: 从2022/03/09开始向上 | I11: 3.3300000000000001 | J11: 2.9300000000000002 | K11: =(I11-J11)/J11 -> 0.13651877133105797 | L11: 1
A12: 002675.SZ | B12: 东诚药业 | C12: 医药生物-化学制药-化学制剂 | D12: -22.604364326375713 | E12: 17.745300820000001 | F12: 12.430099999999999 | G12: 30.969999999999999 | H12: 从2022/03/09开始向上 | I12: 13.18 | J12: 12.220000000000001 | K12: =(I12-J12)/J12 -> 7.8559738134206136e-02 | L12: 1
A13: 600200.SH | B13: 江苏吴中 | C13: 医药生物-化学制药-化学制剂 | D13: 206.15384615384619 | E13: 49.627381040000003 | F13: 3.2642000000000002 | G13: -12.029999999999999 | H13: 从2022/03/09开始向上 | I13: 6.9400000000000004 | J13: 6.3099999999999996 | K13: =(I13-J13)/J13 -> 9.984152139461186e-02 | L13: 2
A14: 000153.SZ | B14: 丰原药业 | C14: 医药生物-化学制药-化学制剂 | D14: 27.706584180291639 | E14: 8.4850078799999995 | F14: 3.3723999999999998 | G14: 22.940000000000001 | H14: 从2022/03/09开始向上 | I14: 9.0600000000000005 | J14: 8.2300000000000004 | K14: =(I14-J14)/J14 -> 0.10085054678007291 | L14: 1
A15: 000915.SZ | B15: 华特达因 | C15: 医药生物-化学制药-化学制剂 | D15: 40.206185567010323 | E15: 20.50494252 | F15: 37.624099999999999 | G15: 21.09 | H15: 从2021/10/28开始向上 | I15: 34.229999999999997 | J15: 23.859999999999999 | K15: =(I15-J15)/J15 -> 0.43461860854987416 | L15: 5
A16: 002940.SZ | B16: 昂利康 | C16: 医药生物-化学制药-化学制剂 | D16: -43.478260869565212 | E16: 10.57073885 | F16: 9.3033000000000001 | G16: 30.399999999999999 | H16: 从2021/09/29开始向上 | I16: 36.340000000000003 | J16: 28.559999999999999 | K16: =(I16-J16)/J16 -> 0.27240896358543437 | L16: 1
A17: 600513.SH | B17: 联环药业 | C17: 医药生物-化学制药-化学制剂 | D17: 7.1428571428571281 | E17: 20.529039489999999 | F17: 8.5932999999999993 | G17: 24.539999999999999 | H17: 从2021/10/27开始向上 | I17: 9.3300000000000001 | J17: 8.0899999999999999 | K17: =(I17-J17)/J17 -> 0.15327564894932016 | L17: 1
A18: 002923.SZ | B18: 润都股份 | C18: 医药生物-化学制药-化学制剂 | D18: -21.666666666666668 | E18: -9.8176801400000002 | F18: 10.271800000000001 | G18: 34.57 | H18: 从2022/03/09开始向上 | I18: 21.149999999999999 | J18: 19 | K18: =(I18-J18)/J18 -> 0.11315789473684203 | L18: 2
A19: 000513.SZ | B19: 丽珠集团 | C19: 医药生物-化学制药-化学制剂 | D19: 1.9736842105263175 | E19: 21.203244049999999 | F19: 17.210799999999999 | G19: 19.75 | H19: 从2022/03/09开始向上 | I19: 36.759999999999998 | J19: 33.539999999999999 | K19: =(I19-J19)/J19 -> 9.6004770423375047e-02 | L19: 3
A20: 600079.SH | B20: 人福医药 | C20: 医药生物-化学制药-化学制剂 | D20: 53.333333333333321 | E20: -4.4306940299999997 | F20: 9.4011999999999993 | G20: 17.5 | H20: 从2022/03/09开始向上 | I20: 17.460000000000001 | J20: 15.65 | K20: =(I20-J20)/J20 -> 0.11565495207667735 | L20: 1
A21: 002653.SZ | B21: 海思科 | C21: 医药生物-化学制药-化学制剂 | D21: -31.578947368421051 | E21: -18.196807920000001 | F21: 23.135000000000002 | G21: 0.25600000000000001 | H21: 从2022/03/09开始向上 | I21: 16.059999999999999 | J21: 15.199999999999999 | K21: =(I21-J21)/J21 -> 5.657894736842102e-02 | L21: 1
A22: 002332.SZ | B22: 仙琚制药 | C22: 医药生物-化学制药-化学制剂 | D22: 19.025641025641022 | E22: 14.288380070000001 | F22: 13.8987 | G22: 17.489999999999998 | H22: 从2022/03/09开始向上 | I22: 10.699999999999999 | J22: 9.7699999999999996 | K22: =(I22-J22)/J22 -> 9.5189355168884313e-02 | L22: 1
A23: 002262.SZ | B23: 恩华药业 | C23: 医药生物-化学制药-化学制剂 | D23: 19.642857142857139 | E23: 21.78326199 | F23: 23.190799999999999 | G23: 15.4 | H23: 从2022/03/09开始向上 | I23: 12.69 | J23: 11.93 | K23: =(I23-J23)/J23 -> 6.3704945515507108e-02 | L23: 2
A24: 002773.SZ | B24: 康弘药业 | C24: 医药生物-化学制药-化学制剂 | D24: 7.5757575757575646 | E24: 15.56823997 | F24: 22.959299999999999 | G24: -75.150000000000006 | H24: 从2022/03/09开始向上 | I24: 16 | J24: 15 | K24: =(I24-J24)/J24 -> 6.6666666666666666e-02 | L24: 1
A25: 600276.SH | B25: 恒瑞医药 | C25: 医药生物-化学制药-化学制剂 | D25: -1.492537313432837 | E25: 6.7118075900000003 | F25: 20.753 | G25: 38.009999999999998 | H25: 从2022/03/09开始向上 | I25: 37.399999999999999 | J25: 34.700000000000003 | K25: =(I25-J25)/J25 -> 7.7809798270893238e-02 | L25: 2
A26: 603811.SH | B26: 诚意药业 | C26: 医药生物-化学制药-化学制剂 | D26: 15.909090909090912 | E26: 3.54950776 | F26: 22.617999999999999 | G26: 22.370000000000001 | H26: 从2021/08/31开始向上 | I26: 17.27 | J26: 11.82 | K26: =(I26-J26)/J26 -> 0.4610829103214889 | L26: 2
A27: 000963.SZ | B27: 华东医药 | C27: 医药生物-化学制药-化学制剂 | D27: -20.743396502524334 | E27: 4.9930375700000003 | F27: 7.4908000000000001 | G27: 25.75 | H27: 从2021/09/29开始向上 | I27: 34.200000000000003 | J27: 29.170000000000002 | K27: =(I27-J27)/J27 -> 0.17243743572163184 | L27: 1
A28: 000813.SZ | B28: 德展健康 | C28: 医药生物-化学制药-化学制剂 | D28: -48.470806302131599 | E28: -54.012672760000001 | F28: 20.445699999999999 | G28: 46.990000000000002 | H28: 从2022/03/09开始向上 | I28: 3.5699999999999998 | J28: 3.2400000000000002 | K28: =(I28-J28)/J28 -> 0.10185185185185174 | L28: 2
A29: 002020.SZ | B29: 京新药业 | C29: 医药生物-化学制药-化学制剂 | D29: 14.89361702127661 | E29: -18.907091009999998 | F29: 17.4359 | G29: 10.880000000000001 | H29: 从2022/10/27开始向上 | I29: 8.5299999999999994 | J29: 7.71 | K29: =(I29-J29)/J29 -> 0.10635538261997399 | L29: 1
A30: 600774.SH | B30: 汉商集团 | C30: 医药生物-化学制药-化学制剂 | D30: 182.87471673680801 | E30: 271.20950596 | F30: 5.1474000000000002 | G30: 22.199999999999999 | H30: 从2022/03/09开始向上 | I30: 13.07 | J30: 12.710000000000001 | K30: =(I30-J30)/J30 -> 2.8324154209283983e-02 | L30: 2
A31: 600521.SH | B31: 华海药业 | C31: 医药生物-化学制药-化学制剂 | D31: -29.310344827586203 | E31: 7.7956526799999999 | F31: 12.921200000000001 | G31: 59.109999999999999 | H31: 从2021/10/21开始向上 | I31: 26.899999999999999 | J31: 16.98 | K31: =(I31-J31)/J31 -> 0.58421672555948156 | L31: 4
A32: 600196.SH | B32: 复星医药 | C32: 医药生物-化学制药-化学制剂 | D32: 43.298969072164944 | E32: 21.127261969999999 | F32: 14.547800000000001 | G32: 25.199999999999999 | H32: 从2022/03/09开始向上 | I32: 46.700000000000003 | J32: 37.18 | K32: =(I32-J32)/J32 -> 0.25605164066702535 | L32: 4
A33: 600673.SH | B33: 东阳光 | C33: 医药生物-化学制药-化学制剂 | D33: 84.482758620689651 | E33: -9.5879556600000004 | F33: 0.54620000000000002 | G33: 42.439999999999998 | H33: 从2022/03/09开始向上 | I33: 7.79 | J33: 7.04 | K33: =(I33-J33)/J33 -> 0.10653409090909091 | L33: 2
A34: 002294.SZ | B34: 信立泰 | C34: 医药生物-化学制药-化学制剂 | D34: 46.153846153846153 | E34: -20.097460040000001 | F34: 17.721599999999999 | G34: 141 | H34: 从2022/03/09开始向上 | I34: 23.640000000000001 | J34: 21.899999999999999 | K34: =(I34-J34)/J34 -> 7.9452054794520638e-02 | L34: 4
A35: 600380.SH | B35: 健康元 | C35: 医药生物-化学制药-化学制剂 | D35: 7.6441102756892159 | E35: 23.035427689999999 | F35: 17.392700000000001 | G35: 18.559999999999999 | H35: 从2021/10/26开始向上 | I35: 11.720000000000001 | J35: 10.75 | K35: =(I35-J35)/J35 -> 9.0232558139534944e-02 | L35: 2
A36: 600062.SH | B36: 华润双鹤 | C36: 医药生物-化学制药-化学制剂 | D36: 1.8038466133078488 | E36: 11.95269892 | F36: 13.442600000000001 | G36: 12.69 | H36: 从2021/10/28开始向上 | I36: 12.42 | J36: 11.25 | K36: =(I36-J36)/J36 -> 0.104 | L36: 1
A37: 002437.SZ | B37: 誉衡药业 | C37: 医药生物-化学制药-化学制剂 | D37: -83.188502673796791 | E37: 5.2880502800000002 | F37: 5.1433999999999997 | G37: -46.159999999999997 | H37: 从2021/11/02开始向上 | I37: 3.0899999999999999 | J37: 2.2599999999999998 | K37: =(I37-J37)/J37 -> 0.36725663716814166
A38: 002900.SZ | B38: 哈三联 | C38: 医药生物-化学制药-化学制剂 | D38: 2385.7142857142853 | E38: -28.649757470000001 | F38: 76.171599999999998 | G38: 9.6600000000000001 | H38: 从2022/03/09开始向上 | I38: 16.690000000000001 | J38: 14.75 | K38: =(I38-J38)/J38 -> 0.13152542372881365 | L38: 2
A39: 000908.SZ | B39: 景峰医药 | C39: 医药生物-化学制药-化学制剂 | D39: -80.626450116009281 | E39: -7.5107939200000002 | F39: 3.4077000000000002 | G39: -3.3999999999999999 | H39: 从2021/10/29开始向上 | I39: 4.3600000000000003 | J39: 3.5600000000000001 | K39: =(I39-J39)/J39 -> 0.22471910112359558
A40: 002411.SZ | B40: 延安必康 | C40: 医药生物-化学制药-化学制剂 | D40: 4691.5662650602417 | E40: 14.461619900000001 | F40: 12.575900000000001 | G40: -31.02 | H40: 从2022/01/22开始向上 | I40: 9.5999999999999996 | J40: 7.6799999999999997 | K40: =(I40-J40)/J40 -> 0.25 | L40: 2
A41: 002826.SZ | B41: 易明医药 | C41: 医药生物-化学制药-化学制剂 | D41: 0 | E41: 22.185708689999998 | F41: 3.3142 | G41: 50.759999999999998 | H41: 从2021/09/29开始向上 | I41: 10.92 | J41: 8.3200000000000003 | K41: =(I41-J41)/J41 -> 0.31249999999999994 | L41: 2
A42: 002393.SZ | B42: 力生制药 | C42: 医药生物-化学制药-化学制剂 | D42: 25.581395348837223 | E42: -9.4193828400000008 | F42: 11.6934 | G42: 172.28999999999999 | H42: 从2021/11/02开始向上 | I42: 25.649999999999999 | J42: 17.989999999999998 | K42: =(I42-J42)/J42 -> 0.42579210672595891 | L42: 5
A43: 002793.SZ | B43: 罗欣药业 | C43: 医药生物-化学制药-化学制剂 | D43: 25 | E43: 22.948059499999999 | F43: 8.9300999999999995 | G43: 31.390000000000001 | H43: 从2022/03/09开始向上 | I43: 8.7100000000000009 | J43: 7.7999999999999998 | K43: =(I43-J43)/J43 -> 0.11666666666666681 | L43: 2
A44: 603367.SH | B44: 辰欣药业 | C44: 医药生物-化学制药-化学制剂 | D44: -12.499999999999996 | E44: 2.5758377399999999 | F44: 10.349600000000001 | G44: 14.25 | H44: 从2022/03/09开始向上 | I44: 12.529999999999999 | J44: 11.640000000000001 | K44: =(I44-J44)/J44 -> 7.6460481099656252e-02 | L44: 1
A45: 002898.SZ | B45: 赛隆药业 | C45: 医药生物-化学制药-化学制剂 | D45: 154.77551020408163 | E45: 31.650129400000001 | F45: 6.3643000000000001 | G45: -65.040000000000006 | H45: 从2021/10/28开始向上 | I45: 12.51 | J45: 8.8599999999999994 | K45: =(I45-J45)/J45 -> 0.41196388261851025 | L45: 3
A46: 603669.SH | B46: 灵康药业 | C46: 医药生物-化学制药-化学制剂 | D46: -47.619047619047613 | E46: -18.501502200000001 | F46: 12.0623 | G46: 66.379999999999995 | H46: 从2022/03/09开始向上 | I46: 7.9699999999999998 | J46: 7.2000000000000002 | K46: =(I46-J46)/J46 -> 0.10694444444444438 | L46: 2
A47: 002422.SZ | B47: 科伦药业 | C47: 医药生物-化学制药-化学制剂 | D47: 71.428571428571431 | E47: 13.37080289 | F47: 5.8811999999999998 | G47: 20.18 | H47: 从2022/03/09开始向上 | I47: 16.649999999999999 | J47: 15.359999999999999 | K47: =(I47-J47)/J47 -> 8.3984374999999944e-02 | L47: 1
A48: 600420.SH | B48: 国药现代 | C48: 医药生物-化学制药-化学制剂 | D48: 9.7672147159375722e-02 | E48: 23.42277249 | F48: 7.4668000000000001 | G48: 15.529999999999999 | H48: 从2022/01/28开始向上 | I48: 9.8200000000000003 | J48: 8.6799999999999997 | K48: =(I48-J48)/J48 -> 0.13133640552995399 | L48: 1
A49: 000919.SZ | B49: 金陵药业 | C49: 医药生物-化学制药-化学制剂 | D49: 25.649350649350655 | E49: 14.25832512 | F49: 5.8151000000000002 | G49: 44.649999999999999 | H49: 从2022/11/02开始向上 | I49: 7.4400000000000004 | J49: 6.3300000000000001 | K49: =(I49-J49)/J49 -> 0.17535545023696689 | L49: 2
A50: 002550.SZ | B50: 千红制药 | C50: 医药生物-化学制药-化学制剂 | D50: 27.04507512520868 | E50: 12.29717773 | F50: 13.445600000000001 | G50: -92.75 | H50: 从2022/11/02开始向上 | I50: 6.4000000000000004 | J50: 4.0499999999999998 | K50: =(I50-J50)/J50 -> 0.58024691358024705 | L50: 3
A51: 600812.SH | B51: 华北制药 | C51: 医药生物-化学制药-化学制剂 | D51: -87.5 | E51: -13.892948179999999 | F51: 0.29730000000000001 | G51: -486.11000000000001 | H51: 从2022/03/09开始向上 | I51: 7.96 | J51: 7.4900000000000002 | K51: =(I51-J51)/J51 -> 6.2750333778371123e-02
A52: 002004.SZ | B52: 华邦健康 | C52: 医药生物-化学制药-化学制剂 | D52: 0 | E52: 3.4065505100000002 | F52: 8.2972999999999999 | G52: 17.920000000000002 | H52: 从2022/03/09开始向上 | I52: 5.96 | J52: 5.4000000000000004 | K52: =(I52-J52)/J52 -> 0.10370370370370363
A53: 600488.SH | B53: 天药股份 | C53: 医药生物-化学制药-化学制剂 | D53: -46.067415730337075 | E53: 10.97851419 | F53: 4.1421000000000001 | G53: -524.63999999999999 | H53: 从2021/10/28开始向上 | I53: 4.6600000000000001 | J53: 4.0199999999999996 | K53: =(I53-J53)/J53 -> 0.15920398009950265
A54: 000566.SZ | B54: 海南海药 | C54: 医药生物-化学制药-化学制剂 | D54: -2761.1111111111109 | E54: 4.1349179400000002 | F54: -34.906799999999997 | G54: -6.0199999999999996 | H54: 从2021/10/27开始向上 | I54: 5.0899999999999999 | J54: 3.8599999999999999 | K54: =(I54-J54)/J54 -> 0.31865284974093266
A55: 600613.SH | B55: 神奇制药 | C55: 医药生物-化学制药-化学制剂 | D55: 137.03703703703701 | E55: 19.081541919999999 | F55: 3.1652999999999998 | G55: -23.710000000000001 | H55: 从2021/10/28开始向上 | I55: 6.2699999999999996 | J55: 4.7999999999999998 | K55: =(I55-J55)/J55 -> 0.30624999999999997 | L55: 1
A56: 600624.SH | B56: 复旦复华 | C56: 医药生物-化学制药-化学制剂 | D56: -32.132963988919663 | E56: 18.230273019999998 | F56: 2.6408 | G56: -69.939999999999998 | H56: 从2022/03/09开始向上 | I56: 6.5099999999999998 | J56: 5.8799999999999999 | K56: =(I56-J56)/J56 -> 0.10714285714285712
A57: 000623.SZ | B57: 吉林敖东 | C57: 医药生物-化学制药-化学制剂 | D57: 14.644125366682104 | E57: -9.3905876799999994 | F57: 105.4205 | G57: 9.4399999999999995 | H57: 从2022/03/09开始向上 | I57: 15.41 | J57: 14.779999999999999 | K57: =(I57-J57)/J57 -> 4.2625169147496672e-02 | L57: 1
A58: 600851.SH | B58: 海欣股份 | C58: 医药生物-化学制药-化学制剂 | D58: 23.676323676323676 | E58: 34.876549490000002 | F58: 14.029299999999999 | G58: 61.509999999999998 | H58: 从2022/03/09开始向上 | I58: 7.54 | J58: 7 | K58: =(I58-J58)/J58 -> 7.7142857142857152e-02 | L58: 3
A59: 603676.SH | B59: 卫信康 | C59: 医药生物-化学制药-化学制剂 | D59: 72.727272727272734 | E59: 42.979127830000003 | F59: 10.955500000000001 | G59: 45.280000000000001 | H59: 从2021/11/08开始向上 | I59: 9.9299999999999997 | J59: 7.7599999999999998 | K59: =(I59-J59)/J59 -> 0.27963917525773196 | L59: 4
A60: 000788.SZ | B60: 北大医药 | C60: 医药生物-化学制药-化学制剂 | D60: 44.790046656298607 | E60: 20.394639999999999 | F60: 3.2774999999999999 | G60: 104.87 | H60: 从2022/01/28开始向上 | I60: 10.91 | J60: 6.0599999999999996 | K60: =(I60-J60)/J60 -> 0.80033003300330052 | L60: 4
A61: 002755.SZ | B61: 奥赛康 | C61: 医药生物-化学制药-化学制剂 | D61: -19.230769230769237 | E61: -7.1166131100000003 | F61: 15.8004 | G61: 16.84 | H61: 从2021/11/03开始向上 | I61: 11.51 | J61: 10.550000000000001 | K61: =(I61-J61)/J61 -> 9.0995260663507022e-02 | L61: 1
A62: 000931.SZ | B62: 中关村 | C62: 医药生物-化学制药-化学制剂 | D62: -322.48322147651004 | E62: 16.805933769999999 | F62: -2.2410000000000001 | G62: -115.06 | H62: 从2021/10/29开始向上 | I62: 7.04 | J62: 6.3799999999999999 | K62: =(I62-J62)/J62 -> 0.10344827586206899
A63: 600227.SH | B63: 圣济堂 | C63: 医药生物-化学制药-化学制剂 | D63: 183.80566801619432 | E63: 30.25273352 | F63: 6.9474 | G63: 43.689999999999998 | H63: 从2022/02/07开始向上 | I63: 3.4199999999999999 | J63: 3.04 | K63: =(I63-J63)/J63 -> 0.12499999999999996 | L63: 3
A64: 003020.SZ | B64: 立方制药 | C64: 医药生物-化学制药-化学制剂 | D64: -5.6748466257668655 | E64: 14.99599437 | F64: 7.5285000000000002 | G64: 25.059999999999999 | H64: 从2021/11/04开始向上 | I64: 43.5 | J64: 39.280000000000001 | K64: =(I64-J64)/J64 -> 0.10743380855397146 | L64: 1