A1: 股票代码 | B1: 股票简称 | C1: 所属同花顺行业 | D1: 基本面 | H1: 技术面 | N1: 得分 | O1: 结论 | P1: 更新时间
D2: 本季度利润增长速度 | E2: 本季度销售增长速度 | F2: 本季度利润率 | G2: 市盈率(股票价格/每股收益) | H2: 价格趋势是否已经掉头向上 | I2: 当日收盘价 | J2: 最低点 | K2: 最高点 | L2: 反弹强度(越大越好) | M2: 回调幅度(越小越好)
A3: 600328.SH | B3: 中盐化工 | C3: 基础化工-化学原料-无机盐 | D3: 347.17584369449378 | E3: 81.818674860000002 | F3: 15.3428 | G3: 10.1 | H3: 从2022/03/09开始向上 | I3: 15.71 | J3: 14.08 | K3: 31 | L3: =(I3-J3)/J3 -> 0.11576704545454551 | M3: =(K3-J3)/K3 -> 0.54580645161290331 | N3: 2 | O3: 金瑞矿业是领头羊，红星发展是次领头羊 | P3: 44673
A4: 600714.SH | B4: 金瑞矿业 | C4: 基础化工-化学原料-无机盐 | D4: 17700 | E4: 166.18276682000001 | F4: 21.2074 | G4: 73.659999999999997 | H4: 从2021/11/08开始向上 | I4: 13.92 | J4: 8.98 | K4: 16.780000000000001 | L4: =(I4-J4)/J4 -> 0.55011135857461013 | M4: =(K4-J4)/K4 -> 0.46483909415971397 | N4: 5
A5: 600367.SH | B5: 红星发展 | C5: 基础化工-化学原料-无机盐 | D5: 1040 | E5: 84.897060789999998 | F5: 11.3041 | G5: 29.84 | H5: 从2021/11/17开始向上 | I5: 20.91 | J5: 13.92 | K5: 28.48 | L5: =(I5-J5)/J5 -> 0.50215517241379315 | M5: =(K5-J5)/K5 -> 0.5112359550561798 | N5: 4
A6: 002053.SZ | B6: 云南能投 | C6: 基础化工-化学原料-无机盐 | D6: -32.364597093791289 | E6: 9.3801292200000006 | F6: 8.2434999999999992 | G6: 66.819999999999993 | H6: 从2021/11/02开始向上 | I6: 15.42 | J6: 8.03 | K6: 20.949999999999999 | L6: =(I6-J6)/J6 -> 0.92029887920298892 | M6: =(K6-J6)/K6 -> 0.61670644391408114 | N6: 3
A7: 603067.SH | B7: 振华股份 | C7: 基础化工-化学原料-无机盐 | D7: 72.413793103448285 | E7: 259.26322807999998 | F7: 10.6623 | G7: 22.699999999999999 | H7: 从2022/01/05开始向上 | I7: 12.08 | J7: 10.1 | L7: =(I7-J7)/J7 -> 0.19603960396039607 | M7: =(K7-J7)/K7 -> #DIV/0! | N7: 1
A8: 003017.SZ | B8: 大洋生物 | C8: 基础化工-化学原料-无机盐 | D8: -32.558139534883722 | E8: 27.419672590000001 | F8: 12.239100000000001 | G8: 33.409999999999997 | H8: 从2021/11/02开始向上 | I8: 46.51 | J8: 31.81 | K8: 51.5 | L8: =(I8-J8)/J8 -> 0.46211883055642877 | M8: =(K8-J8)/K8 -> 0.38233009708737864 | N8: 3
A9: 002125.SZ | B9: 湘潭电化 | C9: 基础化工-化学原料-无机盐 | D9: 441.9354838709678 | E9: -26.35594656 | F9: 8.3154000000000003 | G9: 69.209999999999994 | H9: 从2022/01/21开始向上 | I9: 12.36 | J9: 10.04 | L9: =(I9-J9)/J9 -> 0.23107569721115542 | M9: =(K9-J9)/K9 -> #DIV/0! | N9: 2
A10: 600929.SH | B10: 雪天盐业 | C10: 基础化工-化学原料-无机盐 | D10: -3.271537622682664 | E10: 17.961461870000001 | F10: 5.3285999999999998 | G10: 66.299999999999997 | H10: 从2021/11/01开始向上 | I10: 7.02 | J10: 6.01 | L10: =(I10-J10)/J10 -> 0.16805324459234605 | M10: =(K10-J10)/K10 -> #DIV/0! | N10: 1
A11: 603299.SH | B11: 苏盐井神 | C11: 基础化工-化学原料-无机盐 | D11: 40.932889100428348 | E11: 38.838409210000002 | F11: 6.7906000000000004 | G11: 30.559999999999999 | H11: 从2021/10/29开始向上 | I11: 8.5 | J11: 7.7 | K11: 12.25 | L11: =(I11-J11)/J11 -> 0.10389610389610388 | M11: =(K11-J11)/K11 -> 0.37142857142857144 | N11: 1