A1: 股票代码 | B1: 股票简称 | C1: 所属同花顺行业 | D1: 基本面 | H1: 技术面 | N1: 结论 | O1: 更新时间
D2: 本季度利润增长速度 | E2: 本季度销售增长速度 | F2: 本季度利润率 | G2: 市盈率(股票价格/每股收益) | H2: 价格趋势是否已经掉头向上 | I2: 当日收盘价 | J2: 最低点 | K2: 最高点 | L2: 反弹强度(越大越好) | M2: 回调幅度(越小越好)
A3: 600409.SH | B3: 三友化工 | C3: 基础化工-化学原料-纯碱 | D3: 4626.923076923078 | E3: 29.596561260000001 | F3: 9.4777000000000005 | G3: 8.52 | H3: 从2022年01月28日开始向上 | I3: 9.11 | J3: 7.53 | K3: 16.670000000000002 | L3: =(I3-J3)/J3 -> 0.2098273572377157 | M3: =(K3-J3)/K3 -> 0.54829034193161363 | N3: 远兴能源是领头羊，和邦生物是次级领头羊 | O3: 44631
A4: 603077.SH | B4: 和邦生物 | C4: 基础化工-化学原料-纯碱 | D4: 1129.3103448275863 | E4: 149.94309501000001 | F4: 28.628699999999998 | G4: 14.93 | H4: 从2021年11月10日开始向上 | I4: 3.81 | J4: 3.11 | K4: 5.1100000000000003 | L4: =(I4-J4)/J4 -> 0.22508038585209009 | M4: =(K4-J4)/K4 -> 0.39138943248532299
A5: 000822.SZ | B5: 山东海化 | C5: 基础化工-化学原料-纯碱 | D5: 491.66666666666669 | E5: 42.11613431 | F5: 10.7408 | G5: 21.91 | H5: 从2022年03月09日开始向上 | I5: 6.79 | J5: 6.18 | K5: 16 | L5: =(I5-J5)/J5 -> 9.870550161812304e-02 | M5: =(K5-J5)/K5 -> 0.61375000000000002
A6: 000683.SZ | B6: 远兴能源 | C6: 基础化工-化学原料-纯碱 | D6: 5799.9999999999991 | E6: 78.222571490000007 | F6: 28.4024 | G6: 15.54 | H6: 从2021年11月17日开始向上 | I6: 9.31 | J6: 6.41 | K6: 13.539999999999999 | L6: =(I6-J6)/J6 -> 0.45241809672386901 | M6: =(K6-J6)/K6 -> 0.52658788774002951