A1: 股票代码 | B1: 股票简称 | C1: 所属同花顺行业 | D1: 基本面 | H1: 技术面 | L1: 得分 | M1: 结论 | N1: 更新时间
D2: 本季度利润增长速度 | E2: 本季度销售增长速度 | F2: 本季度利润率 | G2: 市盈率(股票价格/每股收益) | H2: 价格趋势是否已经掉头向上 | I2: 当日收盘价 | J2: 最低点价格 | K2: 相对价格强度
A3: 600491.SH | B3: 龙元建设 | C3: 建筑装饰-建筑装饰-房屋建设 | D3: 8.1081081081081159 | E3: 14.63846792 | F3: 3.9944000000000002 | G3: 11.210000000000001 | H3: 从2022/01/26开始向上 | I3: 6.2000000000000002 | J3: 5.3700000000000001 | K3: =(I3-J3)/J3 -> 0.15456238361266295 | L3: 2 | M3: 宁波建工为领头羊，浙江建投为次级领头羊 | N3: 44634
A4: 601668.SH | B4: 中国建筑 | C4: 建筑装饰-建筑装饰-房屋建设 | D4: 24.32432432432433 | E4: 21.204843010000001 | F4: 4.1651999999999996 | G4: 4.2199999999999998 | H4: 从2021/11/10开始向上 | I4: 5.21 | J4: 4.5199999999999996 | K4: =(I4-J4)/J4 -> 0.15265486725663727 | L4: 2
A5: 600170.SH | B5: 上海建工 | C5: 建筑装饰-建筑装饰-房屋建设 | D5: 26.086956521739118 | E5: 33.57716027 | F5: 1.4823 | G5: 6.9000000000000004 | H5: 从2021/11/29开始向上 | I5: 3.1699999999999999 | J5: 3.0499999999999998 | K5: =(I5-J5)/J5 -> 3.9344262295082005e-02 | L5: 2
A6: 601789.SH | B6: 宁波建工 | C6: 建筑装饰-建筑装饰-房屋建设 | D6: 69.301470588235276 | E6: 21.632825480000001 | F6: 2.0314000000000001 | G6: 15.720000000000001 | H6: 从2021/11/29开始向上 | I6: 6.4199999999999999 | J6: 3.3999999999999999 | K6: =(I6-J6)/J6 -> 0.88823529411764712 | L6: 6
A7: 600248.SH | B7: 陕西建工 | C7: 建筑装饰-建筑装饰-房屋建设 | D7: 107.44979919678713 | E7: 6.4649903399999999 | F7: 2.9775999999999998 | G7: 4.4500000000000002 | H7: 从2021/10/28开始向上 | I7: 5.6100000000000003 | J7: 3.9300000000000002 | K7: =(I7-J7)/J7 -> 0.4274809160305344 | L7: 4
A8: 000628.SZ | B8: 高新发展 | C8: 建筑装饰-建筑装饰-房屋建设 | D8: 6.0509554140127442 | E8: 24.332694499999999 | F8: 2.7785000000000002 | G8: 14.5 | H8: 从2021/10/29开始向上 | I8: 10.710000000000001 | J8: 7.6500000000000004 | K8: =(I8-J8)/J8 -> 0.40000000000000002 | L8: 5
A9: 002761.SZ | B9: 浙江建投 | C9: 建筑装饰-建筑装饰-房屋建设 | D9: 19.402985074626866 | E9: 6.6793877500000001 | F9: 1.5790999999999999 | G9: 23.649999999999999 | H9: 从2021/11/03开始向上 | I9: 26.149999999999999 | J9: 7.0999999999999996 | K9: =(I9-J9)/J9 -> 2.6830985915492955 | L9: 4
A10: 600939.SH | B10: 重庆建工 | C10: 建筑装饰-建筑装饰-房屋建设 | D10: 170.78891257995738 | E10: 5.76859609 | F10: 0.83430000000000004 | G10: 19.41 | H10: 从2021/10/28开始向上 | I10: 4.9100000000000001 | J10: 3.25 | K10: =(I10-J10)/J10 -> 0.51076923076923086 | L10: 4