A1: 股票代码 | B1: 股票简称 | C1: 基本每股收益(元)2021.09.30 | D1: 行业 | E1: 不重复行业名
A2: 688301.SH | B2: 奕瑞科技 | C2: 4.49 | D2: 医疗器械 | E2: 电力设备 | F2: =COUNTIF(D:D,E2) -> 39
A3: 688200.SH | B3: 华峰测控 | C3: 5.08 | D3: 半导体及元件 | E3: 半导体及元件 | F3: =COUNTIF(D:D,E3) -> 18
A4: 600809.SH | B4: 山西汾酒 | C4: 4.02 | D4: 饮料制造 | E4: 化学制品 | F4: =COUNTIF(D:D,E4) -> 16
A5: 603489.SH | B5: 八方股份 | C5: 3.61 | D5: 电力设备 | E5: 国防军工 | F5: =COUNTIF(D:D,E5) -> 12
A6: 600955.SH | B6: 维远股份 | C6: 4.2999999999999998 | D6: 化学原料 | E6: 饮料制造 | F6: =COUNTIF(D:D,E6) -> 10
A7: 002932.SZ | B7: 明德生物 | C7: 10.68 | D7: 医疗器械 | E7: 医疗器械 | F7: =COUNTIF(D:D,E7) -> 8
A8: 688536.SH | B8: 思瑞浦 | C8: 3.8999999999999999 | D8: 半导体及元件 | E8: 通用设备 | F8: =COUNTIF(D:D,E8) -> 8
A9: 300750.SZ | B9: 宁德时代 | C9: 3.35 | D9: 电力设备 | E9: 汽车零部件 | F9: =COUNTIF(D:D,E9) -> 8
A10: 688357.SH | B10: 建龙微纳 | C10: 3.47 | D10: 非金属材料 | E10: 专用设备 | F10: =COUNTIF(D:D,E10) -> 7
A11: 835185.BJ | B11: 贝特瑞 | C11: 2.25 | D11: 电力设备 | E11: 食品加工制造 | F11: =COUNTIF(D:D,E11) -> 7
A12: 688188.SH | B12: 柏楚电子 | C12: 4.61 | D12: 自动化设备 | E12: 自动化设备 | F12: =COUNTIF(D:D,E12) -> 6
A13: 688059.SH | B13: 华锐精密 | C13: 2.93 | D13: 通用设备 | E13: 传媒 | F13: =COUNTIF(D:D,E13) -> 5
A14: 600702.SH | B14: 舍得酒业 | C14: 2.92 | D14: 饮料制造 | E14: 化学制药 | F14: =COUNTIF(D:D,E14) -> 4
A15: 603267.SH | B15: 鸿远电子 | C15: 2.84 | D15: 国防军工 | E15: 煤炭开采加工 | F15: =COUNTIF(D:D,E15) -> 4
A16: 688390.SH | B16: 固德威 | C16: 2.44 | D16: 电力设备 | E16: 消费电子 | F16: =COUNTIF(D:D,E16) -> 4
A17: 300751.SZ | B17: 迈为股份 | C17: 4.45 | D17: 电力设备 | E17: 化学原料 | F17: =COUNTIF(D:D,E17) -> 3
A18: 688598.SH | B18: 金博股份 | C18: 4.18 | D18: 电力设备 | E18: 中药 | F18: =COUNTIF(D:D,E18) -> 3
A19: 688789.SH | B19: 宏华数科 | C19: 2.66 | D19: 专用设备 | E19: 钢铁 | F19: =COUNTIF(D:D,E19) -> 3
A20: 605117.SH | B20: 德业股份 | C20: 2.64 | D20: 白色家电 | E20: 物流 | F20: =COUNTIF(D:D,E20) -> 3
A21: 605369.SH | B21: 拱东医疗 | C21: 2.57 | D21: 医疗器械 | E21: 化工合成材料 | F21: =COUNTIF(D:D,E21) -> 3
A22: 603129.SH | B22: 春风动力 | C22: 2.42 | D22: 非汽车交运 | E22: 金属新材料 | F22: =COUNTIF(D:D,E22) -> 3
A23: 000568.SZ | B23: 泸州老窖 | C23: 4.28 | D23: 饮料制造 | E23: 非金属材料 | F23: =COUNTIF(D:D,E23) -> 2
A24: 000596.SZ | B24: 古井贡酒 | C24: 3.85 | D24: 饮料制造 | E24: 医疗服务 | F24: =COUNTIF(D:D,E24) -> 2
A25: 002821.SZ | B25: 凯莱英 | C25: 2.88 | D25: 医疗服务 | E25: 工业金属 | F25: =COUNTIF(D:D,E25) -> 2
A26: 300769.SZ | B26: 德方纳米 | C26: 2.75 | D26: 电力设备 | E26: 服装家纺 | F26: =COUNTIF(D:D,E26) -> 2
A27: 600600.SH | B27: 青岛啤酒 | C27: 2.67 | D27: 饮料制造 | E27: 小金属 | F27: =COUNTIF(D:D,E27) -> 2
A28: 300776.SZ | B28: 帝尔激光 | C28: 2.66 | D28: 电力设备 | E28: 光学光电子 | F28: =COUNTIF(D:D,E28) -> 2
A29: 601799.SH | B29: 星宇股份 | C29: 2.65 | D29: 汽车零部件 | E29: 仪器仪表 | F29: =COUNTIF(D:D,E29) -> 2
A30: 603986.SH | B30: 兆易创新 | C30: 2.5 | D30: 半导体及元件 | E30: 通信设备 | F30: =COUNTIF(D:D,E30) -> 2
A31: 002049.SZ | B31: 紫光国微 | C31: 2.3999999999999999 | D31: 半导体及元件 | E31: 房地产开发 | F31: =COUNTIF(D:D,E31) -> 2
A32: 300770.SZ | B32: 新媒股份 | C32: 2.37 | D32: 传媒 | E32: 厨卫电器 | F32: =COUNTIF(D:D,E32) -> 2
A33: 600141.SH | B33: 兴发集团 | C33: 2.22 | D33: 化学制品 | E33: 造纸 | F33: =COUNTIF(D:D,E33) -> 2
A34: 600436.SH | B34: 片仔癀 | C34: 3.33 | D34: 中药 | E34: 白色家电 | F34: =COUNTIF(D:D,E34) -> 1
A35: 688330.SH | B35: 宏力达 | C35: 3.28 | D35: 电力设备 | E35: 非汽车交运 | F35: =COUNTIF(D:D,E35) -> 1
A36: 600486.SH | B36: 扬农化工 | C36: 3.28 | D36: 化学制品 | E36: 电子化学品 | F36: =COUNTIF(D:D,E36) -> 1
A37: 836239.BJ | B37: 长虹能源 | C37: 2.59 | D37: 电力设备 | E37: 美容护理 | F37: =COUNTIF(D:D,E37) -> 1
A38: 688667.SH | B38: 菱电电控 | C38: 2.56 | D38: 汽车零部件 | E38: 汽车整车 | F38: =COUNTIF(D:D,E38) -> 1
A39: 600563.SH | B39: 法拉电子 | C39: 2.45 | D39: 半导体及元件 | E39: 斯达半导 | F39: =COUNTIF(D:D,E39) -> 1
A40: 002913.SZ | B40: 奥士康 | C40: 2.42 | D40: 半导体及元件 | E40: 建筑装饰 | F40: =COUNTIF(D:D,E40) -> 1
A41: 688550.SH | B41: 瑞联新材 | C41: 2.3999999999999999 | D41: 电子化学品 | E41: 建筑材料 | F41: =COUNTIF(D:D,E41) -> 1
A42: 688356.SH | B42: 键凯科技 | C42: 2.37 | D42: 化学制药 | E42: 教育 | F42: =COUNTIF(D:D,E42) -> 1
A43: 688516.SH | B43: 奥特维 | C43: 2.31 | D43: 电力设备 | E43: 零售 | F43: =COUNTIF(D:D,E43) -> 1
A44: 603599.SH | B44: 广信股份 | C44: 2.22 | D44: 化学制品 | E44: 港口航运 | F44: =COUNTIF(D:D,E44) -> 1
A45: 000799.SZ | B45: 酒鬼酒 | C45: 2.22 | D45: 饮料制造 | E45: 公路铁路运输 | F45: =COUNTIF(D:D,E45) -> 1
A46: 300850.SZ | B46: 新强联 | C46: 2.2000000000000002 | D46: 电力设备 | E46: 通信服务 | F46: =COUNTIF(D:D,E46) -> 1
A47: 605111.SH | B47: 新洁能 | C47: 2.19 | D47: 半导体及元件 | E47: 燃气 | F47: =COUNTIF(D:D,E47) -> 1
A48: 603217.SH | B48: 元利科技 | C48: 2.16 | D48: 化学制品 | E48: 证券 | F48: =COUNTIF(D:D,E48) -> 1
A49: 688499.SH | B49: 利元亨 | C49: 2.13 | D49: 电力设备 | E49: 环保 | F49: =COUNTIF(D:D,E49) -> 1
A50: 601677.SH | B50: 明泰铝业 | C50: 2.12 | D50: 工业金属 | E50: 计算机应用 | F50: =COUNTIF(D:D,E50) -> 1
A51: 300037.SZ | B51: 新宙邦 | C51: 2.11 | D51: 电力设备 | E51: 其他电子 | F51: =COUNTIF(D:D,E51) -> 1
A52: 002916.SZ | B52: 深南电路 | C52: 2.09 | D52: 半导体及元件 | F52: =COUNTIF(D:D,E52) -> 0
A53: 600779.SH | B53: 水井坊 | C53: 2.05 | D53: 饮料制造 | F53: =COUNTIF(D:D,E53) -> 0
A54: 601088.SH | B54: 中国神华 | C54: 2.05 | D54: 煤炭开采加工 | F54: =COUNTIF(D:D,E54) -> 0
A55: 300990.SZ | B55: 同飞股份 | C55: 2.04 | D55: 通用设备 | F55: =COUNTIF(D:D,E55) -> 0
A56: 605080.SH | B56: 浙江自然 | C56: 2.04 | D56: 服装家纺 | F56: =COUNTIF(D:D,E56) -> 0
A57: 301080.SZ | B57: 百普赛斯 | C57: 2.02 | D57: 医疗服务 | F57: =COUNTIF(D:D,E57) -> 0
A58: 301035.SZ | B58: 润丰股份 | C58: 2.02 | D58: 化学制品 | F58: =COUNTIF(D:D,E58) -> 0
A59: 688378.SH | B59: 奥来德 | C59: 2.01 | D59: 专用设备 | F59: =COUNTIF(D:D,E59) -> 0
A60: 603799.SH | B60: 华友钴业 | C60: 1.98 | D60: 小金属 | F60: =COUNTIF(D:D,E60) -> 0
A61: 603297.SH | B61: 永新光学 | C61: 1.97 | D61: 光学光电子 | F61: =COUNTIF(D:D,E61) -> 0
A62: 300571.SZ | B62: 平治信息 | C62: 1.96 | D62: 传媒 | F62: =COUNTIF(D:D,E62) -> 0
A63: 603392.SH | B63: 万泰生物 | C63: 1.96 | D63: 医疗器械 | F63: =COUNTIF(D:D,E63) -> 0
A64: 300661.SZ | B64: 圣邦股份 | C64: 1.93 | D64: 半导体及元件 | F64: =COUNTIF(D:D,E64) -> 0
A65: 603589.SH | B65: 口子窖 | C65: 1.92 | D65: 饮料制造 | F65: =COUNTIF(D:D,E65) -> 0
A66: 300418.SZ | B66: 昆仑万维 | C66: 1.91 | D66: 传媒 | F66: =COUNTIF(D:D,E66) -> 0
A67: 300573.SZ | B67: 兴齐眼药 | C67: 1.8999999999999999 | D67: 化学制药 | F67: =COUNTIF(D:D,E67) -> 0
A68: 603995.SH | B68: 甬金股份 | C68: 1.87 | D68: 钢铁 | F68: =COUNTIF(D:D,E68) -> 0
A69: 688665.SH | B69: 四方光电 | C69: 1.86 | D69: 仪器仪表 | F69: =COUNTIF(D:D,E69) -> 0
A70: 000733.SZ | B70: 振华科技 | C70: 1.86 | D70: 国防军工 | F70: =COUNTIF(D:D,E70) -> 0
A71: 300873.SZ | B71: 海晨股份 | C71: 1.85 | D71: 物流
A72: 688776.SH | B72: 国光电气 | C72: 1.83 | D72: 国防军工
A73: 603605.SH | B73: 珀莱雅 | C73: 1.82 | D73: 美容护理
A74: 688087.SH | B74: 英科再生 | C74: 1.82 | D74: 化工合成材料
A75: 605123.SH | B75: 派克新材 | C75: 1.77 | D75: 国防军工
A76: 603659.SH | B76: 璞泰来 | C76: 1.77 | D76: 电力设备
A77: 600104.SH | B77: 上汽集团 | C77: 1.76 | D77: 汽车整车
A78: 688080.SH | B78: 映翰通 | C78: 1.75 | D78: 通信设备
A79: 603678.SH | B79: 火炬电子 | C79: 1.71 | D79: 国防军工
A80: 688388.SH | B80: 嘉元科技 | C80: 1.71 | D80: 工业金属
A81: 600976.SH | B81: 健民集团 | C81: 1.69 | D81: 中药
A82: 603290.SH | B82: 斯达半导 | C82: 1.67 | D82: 斯达半导
A83: 600745.SH | B83: 闻泰科技 | C83: 1.65 | D83: 消费电子
A84: 300982.SZ | B84: 苏文电能 | C84: 1.64 | D84: 建筑装饰
A85: 603897.SH | B85: 长城科技 | C85: 1.64 | D85: 电力设备
A86: 000049.SZ | B86: 德赛电池 | C86: 1.64 | D86: 电力设备
A87: 603236.SH | B87: 移远通信 | C87: 1.63 | D87: 通信设备
A88: 605399.SH | B88: 晨光新材 | C88: 1.63 | D88: 化学制品
A89: 688269.SH | B89: 凯立新材 | C89: 1.62 | D89: 金属新材料
A90: 002850.SZ | B90: 科达利 | C90: 1.61 | D90: 电力设备
A91: 300073.SZ | B91: 当升科技 | C91: 1.6000000000000001 | D91: 电力设备
A92: 002876.SZ | B92: 三利谱 | C92: 1.6000000000000001 | D92: 光学光电子
A93: 300916.SZ | B93: 朗特智能 | C93: 1.6000000000000001 | D93: 消费电子
A94: 300726.SZ | B94: 宏达电子 | C94: 1.6000000000000001 | D94: 国防军工
A95: 600064.SH | B95: 南京高科 | C95: 1.58 | D95: 房地产开发
A96: 002080.SZ | B96: 中材科技 | C96: 1.58 | D96: 建筑材料
A97: 300443.SZ | B97: 金雷股份 | C97: 1.56 | D97: 电力设备
A98: 688513.SH | B98: 苑东生物 | C98: 1.55 | D98: 化学制药
A99: 688636.SH | B99: 智明达 | C99: 1.54 | D99: 国防军工
A100: 603186.SH | B100: 华正新材 | C100: 1.53 | D100: 半导体及元件
A101: 688105.SH | B101: 诺唯赞 | C101: 1.53 | D101: 医疗器械
A102: 002179.SZ | B102: 中航光电 | C102: 1.52 | D102: 国防军工
A103: 002048.SZ | B103: 宁波华翔 | C103: 1.51 | D103: 汽车零部件
A104: 002128.SZ | B104: 电投能源 | C104: 1.5 | D104: 煤炭开采加工
A105: 688300.SH | B105: 联瑞新材 | C105: 1.5 | D105: 非金属材料
A106: 600741.SH | B106: 华域汽车 | C106: 1.49 | D106: 汽车零部件
A107: 000623.SZ | B107: 吉林敖东 | C107: 1.49 | D107: 化学制药
A108: 300835.SZ | B108: 龙磁科技 | C108: 1.47 | D108: 金属新材料
A109: 601225.SH | B109: 陕西煤业 | C109: 1.47 | D109: 煤炭开采加工
A110: 603606.SH | B110: 东方电缆 | C110: 1.47 | D110: 电力设备
A111: 688680.SH | B111: 海优新材 | C111: 1.47 | D111: 电力设备
A112: 300596.SZ | B112: 利安隆 | C112: 1.46 | D112: 化学制品
A113: 300763.SZ | B113: 锦浪科技 | C113: 1.46 | D113: 电力设备
A114: 300911.SZ | B114: 亿田智能 | C114: 1.46 | D114: 厨卫电器
A115: 605098.SH | B115: 行动教育 | C115: 1.46 | D115: 教育
A116: 688257.SH | B116: 新锐股份 | C116: 1.46 | D116: 通用设备
A117: 603806.SH | B117: 福斯特 | C117: 1.44 | D117: 电力设备
A118: 600566.SH | B118: 济川药业 | C118: 1.43 | D118: 中药
A119: 002008.SZ | B119: 大族激光 | C119: 1.43 | D119: 自动化设备
A120: 300946.SZ | B120: 恒而达 | C120: 1.3999999999999999 | D120: 通用设备
A121: 600089.SH | B121: 特变电工 | C121: 1.3999999999999999 | D121: 电力设备
A122: 300755.SZ | B122: 华致酒行 | C122: 1.39 | D122: 零售
A123: 300852.SZ | B123: 四会富仕 | C123: 1.38 | D123: 半导体及元件
A124: 002756.SZ | B124: 永兴材料 | C124: 1.38 | D124: 钢铁
A125: 300953.SZ | B125: 震裕科技 | C125: 1.38 | D125: 通用设备
A126: 603886.SH | B126: 元祖股份 | C126: 1.38 | D126: 食品加工制造
A127: 300818.SZ | B127: 耐普矿机 | C127: 1.37 | D127: 通用设备
A128: 688519.SH | B128: 南亚新材 | C128: 1.37 | D128: 半导体及元件
A129: 002223.SZ | B129: 鱼跃医疗 | C129: 1.36 | D129: 医疗器械
A130: 688162.SH | B130: 巨一科技 | C130: 1.36 | D130: 专用设备
A131: 688633.SH | B131: 星球石墨 | C131: 1.36 | D131: 专用设备
A132: 603369.SH | B132: 今世缘 | C132: 1.35 | D132: 饮料制造
A133: 300695.SZ | B133: 兆丰股份 | C133: 1.35 | D133: 汽车零部件
A134: 002371.SZ | B134: 北方华创 | C134: 1.34 | D134: 半导体及元件
A135: 300973.SZ | B135: 立高食品 | C135: 1.31 | D135: 食品加工制造
A136: 600887.SH | B136: 伊利股份 | C136: 1.31 | D136: 食品加工制造
A137: 605336.SH | B137: 帅丰电器 | C137: 1.31 | D137: 厨卫电器
A138: 688077.SH | B138: 大地熊 | C138: 1.31 | D138: 金属新材料
A139: 002637.SZ | B139: 赞宇科技 | C139: 1.3 | D139: 化学制品
A140: 300863.SZ | B140: 卡倍亿 | C140: 1.3 | D140: 汽车零部件
A141: 601877.SH | B141: 正泰电器 | C141: 1.29 | D141: 电力设备
A142: 603010.SH | B142: 万盛股份 | C142: 1.29 | D142: 化工合成材料
A143: 300820.SZ | B143: 英杰电气 | C143: 1.28 | D143: 电力设备
A144: 603733.SH | B144: 仙鹤股份 | C144: 1.28 | D144: 造纸
A145: 603985.SH | B145: 恒润股份 | C145: 1.27 | D145: 电力设备
A146: 002597.SZ | B146: 金禾实业 | C146: 1.27 | D146: 化学制品
A147: 002889.SZ | B147: 东方嘉盛 | C147: 1.27 | D147: 物流
A148: 002985.SZ | B148: 北摩高科 | C148: 1.27 | D148: 国防军工
A149: 300969.SZ | B149: 恒帅股份 | C149: 1.27 | D149: 汽车零部件
A150: 605222.SH | B150: 起帆电缆 | C150: 1.27 | D150: 电力设备
A151: 001872.SZ | B151: 招商港口 | C151: 1.27 | D151: 港口航运
A152: 600373.SH | B152: 中文传媒 | C152: 1.26 | D152: 传媒
A153: 600328.SH | B153: 中盐化工 | C153: 1.26 | D153: 化学原料
A154: 001217.SZ | B154: 华尔泰 | C154: 1.25 | D154: 化学原料
A155: 688398.SH | B155: 赛特新材 | C155: 1.24 | D155: 化学制品
A156: 600298.SH | B156: 安琪酵母 | C156: 1.24 | D156: 食品加工制造
A157: 600123.SH | B157: 兰花科创 | C157: 1.23 | D157: 煤炭开采加工
A158: 688005.SH | B158: 容百科技 | C158: 1.23 | D158: 电力设备
A159: 300741.SZ | B159: 华宝股份 | C159: 1.22 | D159: 化学制品
A160: 603095.SH | B160: 越剑智能 | C160: 1.22 | D160: 专用设备
A161: 688099.SH | B161: 晶晨股份 | C161: 1.22 | D161: 半导体及元件
A162: 688122.SH | B162: 西部超导 | C162: 1.22 | D162: 国防军工
A163: 831305.BJ | B163: 海希通讯 | C163: 1.22 | D163: 自动化设备
A164: 603197.SH | B164: 保隆科技 | C164: 1.2 | D164: 汽车零部件
A165: 603198.SH | B165: 迎驾贡酒 | C165: 1.2 | D165: 饮料制造
A166: 300699.SZ | B166: 光威复材 | C166: 1.19 | D166: 国防军工
A167: 603258.SH | B167: 电魂网络 | C167: 1.18 | D167: 传媒
A168: 688065.SH | B168: 凯赛生物 | C168: 1.18 | D168: 化学制品
A169: 688017.SH | B169: 绿的谐波 | C169: 1.18 | D169: 自动化设备
A170: 000885.SZ | B170: 城发环境 | C170: 1.18 | D170: 公路铁路运输
A171: 002557.SZ | B171: 洽洽食品 | C171: 1.18 | D171: 食品加工制造
A172: 300014.SZ | B172: 亿纬锂能 | C172: 1.17 | D172: 电力设备
A173: 603203.SH | B173: 快克股份 | C173: 1.17 | D173: 自动化设备
A174: 603681.SH | B174: 永冠新材 | C174: 1.17 | D174: 化学制品
A175: 002258.SZ | B175: 利尔化学 | C175: 1.17 | D175: 化学制品
A176: 002929.SZ | B176: 润建股份 | C176: 1.16 | D176: 通信服务
A177: 002028.SZ | B177: 思源电气 | C177: 1.16 | D177: 电力设备
A178: 600153.SH | B178: 建发股份 | C178: 1.15 | D178: 物流
A179: 600803.SH | B179: 新奥股份 | C179: 1.15 | D179: 燃气
A180: 605089.SH | B180: 味知香 | C180: 1.15 | D180: 食品加工制造
A181: 688558.SH | B181: 国盛智科 | C181: 1.15 | D181: 通用设备
A182: 003026.SZ | B182: 中晶科技 | C182: 1.14 | D182: 半导体及元件
A183: 688661.SH | B183: 和林微纳 | C183: 1.14 | D183: 消费电子
A184: 000776.SZ | B184: 广发证券 | C184: 1.13 | D184: 证券
A185: 003043.SZ | B185: 华亚智能 | C185: 1.13 | D185: 半导体及元件
A186: 600048.SH | B186: 保利发展 | C186: 1.13 | D186: 房地产开发
A187: 601615.SH | B187: 明阳智能 | C187: 1.13 | D187: 电力设备
A188: 300617.SZ | B188: 安靠智电 | C188: 1.12 | D188: 电力设备
A189: 603666.SH | B189: 亿嘉和 | C189: 1.12 | D189: 自动化设备
A190: 605377.SH | B190: 华旺科技 | C190: 1.12 | D190: 造纸
A191: 300373.SZ | B191: 扬杰科技 | C191: 1.11 | D191: 半导体及元件
A192: 600885.SH | B192: 宏发股份 | C192: 1.1000000000000001 | D192: 电力设备
A193: 603279.SH | B193: 景津环保 | C193: 1.1000000000000001 | D193: 环保
A194: 300833.SZ | B194: 浩洋股份 | C194: 1.1000000000000001 | D194: 专用设备
A195: 000960.SZ | B195: 锡业股份 | C195: 1.09 | D195: 小金属
A196: 002960.SZ | B196: 青鸟消防 | C196: 1.08 | D196: 专用设备
A197: 300487.SZ | B197: 蓝晓科技 | C197: 1.08 | D197: 化工合成材料
A198: 600587.SH | B198: 新华医疗 | C198: 1.08 | D198: 医疗器械
A199: 688186.SH | B199: 广大特材 | C199: 1.08 | D199: 钢铁
A200: 603908.SH | B200: 牧高笛 | C200: 1.07 | D200: 服装家纺
A201: 300496.SZ | B201: 中科创达 | C201: 1.06 | D201: 计算机应用
A202: 603380.SH | B202: 易德龙 | C202: 1.06 | D202: 消费电子
A203: 688233.SH | B203: 神工股份 | C203: 1.06 | D203: 半导体及元件
A204: 688577.SH | B204: 浙海德曼 | C204: 1.06 | D204: 通用设备
A205: 688639.SH | B205: 华恒生物 | C205: 1.06 | D205: 化学制品
A206: 301031.SZ | B206: 中熔电气 | C206: 1.05 | D206: 其他电子
A207: 600038.SH | B207: 中直股份 | C207: 1.05 | D207: 国防军工
A208: 300653.SZ | B208: 正海生物 | C208: 1.05 | D208: 医疗器械
A209: 603100.SH | B209: 川仪股份 | C209: 1.05 | D209: 仪器仪表
A210: 688625.SH | B210: 呈和科技 | C210: 1.05 | D210: 化学制品
A211: 300915.SZ | B211: 海融科技 | C211: 1.04 | D211: 食品加工制造
A212: 603507.SH | B212: 振江股份 | C212: 1.04 | D212: 电力设备
A213: 300870.SZ | B213: 欧陆通 | C213: 1.03 | D213: 电力设备
A214: 300274.SZ | B214: 阳光电源 | C214: 1.03 | D214: 电力设备
A215: 002039.SZ | B215: 黔源电力 | C215: 1.03 | D215: 电力设备