A1: 股票代码 | B1: 股票简称 | C1: 行情收盘价 [1]2022.03.23 | D1: 50日均线 [2]2022.03.23 | E1: 150日均线 [3]2022.03.23 | F1: 200日均线 [4]2022.03.23 | M1: 当前股价位置属于趋势的周期（即数基地，1到2的时候进入，3到5应该考虑卖出） | N1: 最近一年最高点是否新高 | O1: 价格波动收缩幅度 | AH1: 价格行为(得分应大于60%) | AK1: 成交量行为 | AM1: 结论 | AN1: 更新时间
G2: 52周内最低点 | H2: 52周内最高点 | I2: 最高点前8周收盘价 | J2: 当前股价相对于最低点百分比(至少高出25%) | K2: 当前股价相对于最高点百分比(25%内最好) | L2: 最高点前8周股价相对于最高点百分比 | O2: 技术足迹 | AH2: 支撑位和压力位是否同步升高(40%) | AI2: 是否有网球行为出现(40%) | AJ2: 上涨天数是否大于下跌天数(20%) | AK2: 不同收盘表现时交易量情况(好的收盘时，交易量是否增大，坏的收盘时，交易量是否萎缩) | AL2: 成交量收缩情况(最后的价格收缩期间的成交量应低于50天的平均水平且有一到两天交易量极低)
O3: 支撑位1 | P3: 阻力位2 | Q3: 支撑位2 | R3: 阻力位3 | S3: 支撑位3 | T3: 阻力位4 | U3: 支撑位4 | V3: 阻力位5 | W3: 支撑位5 | X3: 阻力位6 | Y3: 支撑位6 | Z3: 时间周期 | AA3: 收缩量1 | AB3: 收缩量2 | AC3: 收缩量3 | AD3: 收缩量4 | AE3: 收缩量5 | AF3: 收缩量6 | AG3: 收缩数量(至少大于3T)
A4: 000733.SZ | B4: 振华科技 | C4: 115 | D4: 112.5 | E4: 108.22 | F4: 97.700000000000003 | G4: 45.359999999999999 | H4: 130.46000000000001 | I4: 112.52 | J4: =(C4-G4)/G4 -> 1.5352733686067019 | K4: =(H4-C4)/H4 -> 0.11850375594051822 | L4: =(H4-I4)/I4 -> 0.15943832207607547 | M4: 4 | N4: 是 | O4: 97.519999999999996 | AA4: =(H4-O4)/H4 -> 0.25249118503755946 | AN4: 44643
A5: 605399.SH | B5: 晨光新材 | C5: 48.06 | D5: 45.38 | E5: 42.31 | F5: 37.07 | AA5: =(H5-O5)/H5 -> #DIV/0!
A6: 600765.SH | B6: 中航重机 | C6: 45.700000000000003 | D6: 44.600000000000001 | E6: 40.97 | F6: 36.52 | G6: 16.27 | H6: 53.990000000000002 | I6: 30.41 | J6: =(C6-G6)/G6 -> 1.8088506453595576 | K6: =(H6-C6)/H6 -> 0.15354695313947025 | L6: =(H6-I6)/I6 -> 0.7754028280170997 | M6: 4 | N6: 是 | O6: 38 | AA6: =(H6-O6)/H6 -> 0.29616595665864054 | AN6: 44643
A7: 000893.SZ | B7: 亚钾国际 | C7: 30.32 | D7: 25.75 | E7: 21.86 | F7: 20.95
A8: 002779.SZ | B8: 中坚科技 | C8: 27.93 | D8: 22.57 | E8: 17.05 | F8: 15.49
A9: 600566.SH | B9: 济川药业 | C9: 25.07 | D9: 25.05 | E9: 20.699999999999999 | F9: 19.800000000000001 | G9: 14.369999999999999 | H9: 31.170000000000002 | I9: 18.370000000000001 | J9: =(C9-G9)/G9 -> 0.74460681976339604 | K9: =(H9-C9)/H9 -> 0.1957009945460379 | L9: =(H9-I9)/I9 -> 0.69678824169842135 | M9: 1 | N9: 否 | O9: 20.600000000000001 | AA9: =(H9-O9)/H9 -> 0.33910811677895414 | AN9: 44643
A10: 002393.SZ | B10: 力生制药 | C10: 25.06 | D10: 22.43 | E10: 20.54 | F10: 20.22
A11: 600367.SH | B11: 红星发展 | C11: 20.78 | D11: 20.12 | E11: 18.48 | F11: 16.43
A12: 603506.SH | B12: 南都物业 | C12: 15.84 | D12: 15.699999999999999 | E12: 14.99 | F12: 14.83 | G12: 12.49 | H12: 17.84 | I12: 14.9 | J12: =(C12-G12)/G12 -> 0.26821457165732582 | K12: =(H12-C12)/H12 -> 0.11210762331838565 | L12: =(H12-I12)/I12 -> 0.19731543624161069 | M12: 1 | N12: 否 | O12: 13 | AA12: =(H12-O12)/H12 -> 0.27130044843049328 | AN12: 44643
A13: 600714.SH | B13: 金瑞矿业 | C13: 14.19 | D13: 14.06 | E13: 12.58 | F13: 11.54
A14: 600123.SH | B14: 兰花科创 | C14: 12.77 | D14: 11.15 | E14: 10.73 | F14: 10.11
A15: 000983.SZ | B15: 山西焦煤 | C15: 12.51 | D15: 9.92 | E15: 9.91 | F15: 9.34 | G15: 4.6699999999999999 | H15: 16.710000000000001 | I15: 7.3899999999999997 | J15: =(C15-G15)/G15 -> 1.6788008565310493 | K15: =(H15-C15)/H15 -> 0.25134649910233398 | L15: =(H15-I15)/I15 -> 1.2611637347767255 | M15: 3 | N15: 否 | O15: 7.5499999999999998 | P15: 12.619999999999999 | Q15: 9.5399999999999991 | AA15: =(H15-O15)/H15 -> 0.54817474566128066 | AB15: =(P15-Q15)/P15 -> 0.24405705229793981 | AN15: 44643
A16: 603929.SH | B16: 亚翔集成 | C16: 12.5 | D16: 12.5 | E16: 11.71 | F16: 11.51
A17: 000524.SZ | B17: 岭南控股 | C17: 12.25 | D17: 9.24 | E17: 7.7000000000000002 | F17: 7.59
A18: 600138.SH | B18: 中青旅 | C18: 12.17 | D18: 11.65 | E18: 10.65 | F18: 10.6 | G18: 8.9100000000000001 | H18: 13.44 | I18: 9.9600000000000009 | J18: =(C18-G18)/G18 -> 0.36588103254769916 | K18: =(H18-C18)/H18 -> 9.4494047619047589e-02 | L18: =(H18-I18)/I18 -> 0.34939759036144563 | M18: 1 | N18: 否 | O18: 10.859999999999999 | AA18: =(H18-O18)/H18 -> 0.19196428571428573 | AN18: 44643
A19: 601899.SH | B19: 紫金矿业 | C19: 11.34 | D19: 10.61 | E19: 10.58 | F19: 10.49 | G19: 9.1799999999999997 | H19: 12.68 | I19: 10.15 | J19: =(C19-G19)/G19 -> 0.23529411764705885 | K19: =(H19-C19)/H19 -> 0.1056782334384858 | L19: =(H19-I19)/I19 -> 0.24926108374384229 | M19: 2 | N19: 否 | O19: 9.3000000000000007 | P19: 12.17 | Q19: 9.3200000000000003 | AA19: =(H19-O19)/H19 -> 0.26656151419558355 | AB19: =(P19-Q19)/P19 -> 0.23418241577649956 | AN19: 44643
A20: 002545.SZ | B20: 东方铁塔 | C20: 11.32 | D20: 10.28 | E20: 9.29 | F20: 8.92
A21: 603676.SH | B21: 卫信康 | C21: 10.44 | D21: 9.79 | E21: 8.93 | F21: 8.69
A22: 002116.SZ | B22: 中国海诚 | C22: 9.67 | D22: 8.77 | E22: 7.29 | F22: 7
A23: 603616.SH | B23: 韩建河山 | C23: 9.62 | D23: 8.83 | E23: 6.7999999999999998 | F23: 6.48
A24: 601789.SH | B24: 宁波建工 | C24: 9.23 | D24: 5.85 | E24: 4.41 | F24: 4.22
A25: 600099.SH | B25: 林海股份 | C25: 9.21 | D25: 8.76 | E25: 7.92 | F25: 7.58
A26: 000683.SZ | B26: 远兴能源 | C26: 9.09 | D26: 9.07 | E26: 8.77 | F26: 8
A27: 603169.SH | B27: 兰石重装 | C27: 9.08 | D27: 8.26 | E27: 7.08 | F27: 6.44
A28: 000722.SZ | C28: 9.01 | D28: 8.22 | E28: 7.81 | F28: 7.62
A29: 600873.SH | B29: 梅花生物 | C29: 8.6999999999999993 | D29: 7.91 | E29: 7.17 | F29: 6.7999999999999998
A30: 002707.SZ | B30: 众信旅游 | C30: 7.51 | D30: 6.73 | E30: 5.68 | F30: 5.5999999999999996 | G30: 4.0800000000000001 | H30: 8.7300000000000004 | I30: 5.1500000000000004 | J30: =(C30-G30)/G30 -> 0.84068627450980382 | K30: =(H30-C30)/H30 -> 0.13974799541809857 | L30: =(H30-I30)/I30 -> 0.69514563106796112 | M30: 1 | N30: 否 | O30: 5.8099999999999996 | AA30: =(H30-O30)/H30 -> 0.33447880870561292 | AN30: 44643
A31: 000852.SZ | B31: 石化机械 | C31: 7.04 | D31: 6.5999999999999996 | E31: 6.46 | F31: 6.01 | G31: 4.2300000000000004 | H31: 9.1999999999999993 | I31: 4.3700000000000001 | J31: =(C31-G31)/G31 -> 0.66430260047281309 | K31: =(H31-C31)/H31 -> 0.23478260869565212 | L31: =(H31-I31)/I31 -> 1.1052631578947367 | M31: 1 | N31: 否 | O31: 5.6200000000000001 | AA31: =(H31-O31)/H31 -> 0.38913043478260861 | AN31: 44643
A32: 600838.SH | B32: 上海九百 | C32: 6.95 | D32: 6.54 | E32: 6.14 | F32: 6.14 | G32: 5.4900000000000002 | H32: 7.25 | AN32: 44643
A33: 600829.SH | B33: 人民同泰 | C33: 6.89 | D33: 6.48 | E33: 6.2000000000000002 | F33: 6.0999999999999996
A34: 002148.SZ | B34: 北纬科技 | C34: 6.25 | D34: 5.74 | E34: 5.21 | F34: 5.02
A35: 000607.SZ | B35: 华媒控股 | C35: 5.62 | D35: 5.61 | E35: 4.45 | F35: 4.24
A36: 002671.SZ | B36: 龙泉股份 | C36: 5.4000000000000004 | D36: 5.13 | E36: 4.4000000000000004 | F36: 4.27
A37: 002476.SZ | B37: 宝莫股份 | C37: 5.31 | D37: 4.88 | E37: 4.62 | F37: 4.46 | G37: 3.3599999999999999 | H37: 5.3300000000000001 | I37: 4.7999999999999998 | J37: =(C37-G37)/G37 -> 0.58035714285714279 | K37: =(H37-C37)/H37 -> 3.7523452157599366e-03 | L37: =(H37-I37)/I37 -> 0.11041666666666672 | M37: 1 | N37: 否 | O37: 4.29 | P37: 5.2400000000000002 | Q37: 4.4000000000000004 | AA37: =(H37-O37)/H37 -> 0.1951219512195122 | AB37: =(P37-Q37)/P37 -> 0.16030534351145034 | AN37: 44643
A38: 000404.SZ | B38: 长虹华意 | C38: 4.58 | D38: 4.53 | E38: 4.33 | F38: 4.2000000000000002
A39: 002629.SZ | B39: 仁智股份 | D39: 4.04 | E39: 3.19 | F39: 3.05
A40: 601008.SH | B40: 连云港 | C40: 4.16 | D40: 3.96 | E40: 3.79 | F40: 3.74
A41: 600705.SH | B41: 中航产融 | C41: 4.11 | D41: 3.93 | E41: 3.92 | F41: 3.88 | G41: 3.5899999999999999 | H41: 4.2400000000000002 | I41: 3.73 | J41: =(C41-G41)/G41 -> 0.14484679665738176 | K41: =(H41-C41)/H41 -> 3.0660377358490538e-02 | L41: =(H41-I41)/I41 -> 0.1367292225201073 | AN41: 44643
A42: 600355.SH | B42: 精伦电子 | C42: 3.95 | D42: 3.44 | E42: 3.19 | F42: 3.09 | G42: 2.1400000000000001 | H42: 4.8200000000000003 | I42: 3.3999999999999999 | J42: =(C42-G42)/G42 -> 0.84579439252336441 | K42: =(H42-C42)/H42 -> 0.18049792531120334 | L42: =(H42-I42)/I42 -> 0.41764705882352954 | M42: 1 | N42: 否 | AN42: 44643
A43: 600664.SH | B43: 哈药股份 | C43: 3.34 | D43: 3.26 | E43: 3.26 | F43: 3.18 | G43: 2.6299999999999999 | H43: 3.73 | I43: 3.1600000000000001 | J43: =(C43-G43)/G43 -> 0.26996197718631176 | K43: =(H43-C43)/H43 -> 0.10455764075067027 | L43: =(H43-I43)/I43 -> 0.18037974683544297 | M43: 1 | N43: 否 | O43: 2.9300000000000002 | AA43: =(H43-O43)/H43 -> 0.2144772117962466 | AN43: 44643
A44: 000732.SZ | B44: 泰禾集团 | C44: 3.02 | D44: 2.72 | E44: 2.31 | F44: 2.2999999999999998 | G44: 1.8100000000000001 | H44: 3.5899999999999999 | I44: 2.0600000000000001 | J44: =(C44-G44)/G44 -> 0.66850828729281764 | K44: =(H44-C44)/H44 -> 0.15877437325905289 | L44: =(H44-I44)/I44 -> 0.74271844660194164 | M44: 1 | N44: 否 | O44: 2.4900000000000002 | AA44: =(H44-O44)/H44 -> 0.30640668523676873 | AN44: 44643