A1: 股票代码 | B1: 股票简称 | C1: 基本每股收益(元)2021.09.30 | D1: 趋势 | O1: 当前股价位置属于趋势的周期（即数基地，1到2的时候进入，3到5应该考虑卖出） | P1: 最近一年最高点是否新高 | Q1: 波动收缩幅度 | AJ1: 成交量行为 | AL1: 价格行为(得分应大于60%) | AO1: 结论 | AP1: 更新时间 | AQ1: 是否值得分析
D2: 200日均线 | E2: 150日均线 | F2: 50日均线 | G2: 各均线斜率是否朝上 | H2: 当前股价 | I2: 52周内最低点 | J2: 52周内最高点 | K2: 最高点前8周收盘价 | L2: 当前股价相对于最低点百分比(至少高出25%) | M2: 当前股价相对于最高点百分比(25%内最好) | N2: 最高点前8周股价相对于最高点百分比 | Q2: 技术足迹 | AJ2: 不同收盘表现时交易量情况(好的收盘时，交易量是否增大，坏的收盘时，交易量是否萎缩) | AK2: 成交量收缩情况(最后的价格收缩期间的成交量应低于50天的平均水平且有一到两天交易量极低) | AL2: 支撑位和压力位是否同步升高(40%) | AM2: 是否有网球行为出现(40%) | AN2: 上涨天数是否大于下跌天数(20%)
Q3: 支撑位1 | R3: 阻力位2 | S3: 支撑位2 | T3: 阻力位3 | U3: 支撑位3 | V3: 阻力位4 | W3: 支撑位4 | X3: 阻力位5 | Y3: 支撑位5 | Z3: 阻力位6 | AA3: 支撑位6 | AB3: 时间周期 | AC3: 收缩量1 | AD3: 收缩量2 | AE3: 收缩量3 | AF3: 收缩量4 | AG3: 收缩量5 | AH3: 收缩量6 | AI3: 收缩数量(至少大于3T)
A4: 600519.SH | B4: 贵州茅台 | C4: 29.670000000000002 | AQ4: 否
A5: 603444.SH | B5: 吉比特 | C5: 16.77 | AO5: 不宜入场（150日均线小于200日均线,应观察6w） | AP5: 44626 | AQ5: 否
A6: 002932.SZ | B6: 明德生物 | C6: 10.68 | D6: 68.959999999999994 | E6: 71.730000000000004 | F6: 80 | H6: 77.5 | AO6: 不宜入场（当前股价小于50日均线,应观察1w） | AP6: 44608 | AQ6: 是
A7: 000661.SZ | B7: 长春高新 | C7: 7.7800000000000002 | AQ7: 否
A8: 600309.SH | B8: 万华化学 | C8: 6.2199999999999998 | AQ8: 否
A9: 603185.SH | B9: 上机数控 | C9: 5.25 | AQ9: 否
A10: 603260.SH | B10: 合盛硅业 | C10: 5.0899999999999999 | D10: 124.55 | E10: 129.75 | F10: 128.33000000000001 | O10: 2 | P10: 是 | AO10: 不宜入场（50日均线小于150日均线,应观察4w） | AP10: 44626 | AQ10: 是
A11: 002304.SZ | B11: 洋河股份 | C11: 4.8200000000000003 | AO11: 不宜入场（50日均线小于150日均线,应观察4w） | AP11: 44626 | AQ11: 否
A12: 601318.SH | B12: 中国平安 | C12: 4.6299999999999999 | AQ12: 否
A13: 000858.SZ | B13: 五粮液 | C13: 4.46 | AQ13: 否
A14: 601888.SH | B14: 中国中免 | C14: 4.3499999999999996 | AQ14: 否
A15: 600955.SH | B15: 维远股份 | C15: 4.2999999999999998 | D15: 44.520000000000003 | E15: 44.810000000000002 | F15: 45.060000000000002 | H15: 41.460000000000001 | P15: 是 | AB15: 14w | AC15: =(J15-Q15)/J15 -> #DIV/0! | AD15: =(R15-S15)/R15 -> #DIV/0! | AE15: =(T15-U15)/T15 -> #DIV/0! | AO15: 不宜入场（50日均线小于200日均线，应持续观察5w） | AP15: 44626 | AQ15: 是
A16: 000568.SZ | B16: 泸州老窖 | C16: 4.2800000000000002 | D16: 227.58000000000001 | E16: 228.38999999999999 | F16: 235.47999999999999 | H16: 216.31 | AO16: 不宜入场(当前股价低于200日均线，应持续观察4w) | AP16: 44595 | AQ16: 是
A17: 600941.SH | B17: 中国移动 | C17: 4.25 | D17: 57.87 | E17: 57.86 | AO17: 不宜入场(150日均线低于200日均线，应持续观察8w) | AP17: 44595 | AQ17: 是
A18: 600585.SH | B18: 海螺水泥 | C18: 4.2300000000000004 | AQ18: 否
A19: 601919.SH | B19: 中远海控 | C19: 4.2300000000000004 | D19: 17.28 | E19: 17.61 | F19: 17.69 | H19: 16.12 | AO19: 不宜入场(当前股价低于200日均线，应持续观察4w) | AP19: 44595 | AQ19: 是
A20: 603501.SH | B20: 韦尔股份 | C20: 4.0599999999999996 | AQ20: 否
A21: 600809.SH | B21: 山西汾酒 | C21: 4.0199999999999996 | AO21: 不宜入场(150日均线低于200日均线，应持续观察6w) | AP21: 44621 | AQ21: 否
A22: 000596.SZ | B22: 古井贡酒 | C22: 3.8500000000000001 | AQ22: 否
A23: 601336.SH | B23: 新华保险 | C23: 3.8300000000000001 | AQ23: 否
A24: 605168.SH | B24: 三人行 | C24: 3.7400000000000002 | D24: 142.04 | E24: 144.40000000000001 | F24: 167.07 | H24: 188.45 | I24: 104 | J24: 240 | K24: 120.45 | L24: =(H24-I24)/I24 -> 0.81201923076923066 | M24: =(J24-H24)/J24 -> 0.21479166666666671 | N24: =(J24-K24)/K24 -> 0.99252801992528017 | Q24: 169.61 | AB24: 2w | AC24: =(J24-Q24)/J24 -> 0.29329166666666662 | AD24: =(R24-S24)/R24 -> #DIV/0! | AO24: 不宜入场(收缩幅度不够，应持续观察2w) | AP24: 44599 | AQ24: 是
A25: 603195.SH | B25: 公牛集团 | C25: 3.6800000000000002 | AQ25: 否
A26: 603026.SH | B26: 石大胜华 | C26: 3.6600000000000001 | AQ26: 否
A27: 600036.SH | B27: 招商银行 | C27: 3.6200000000000001 | AQ27: 否
A28: 603489.SH | B28: 八方股份 | C28: 3.6099999999999999 | AQ28: 否
A29: 603882.SH | B29: 金域医学 | C29: 3.6000000000000001 | AQ29: 否
A30: 603833.SH | B30: 欧派家居 | C30: 3.48 | AQ30: 否
A31: 000333.SZ | B31: 美的集团 | C31: 3.4100000000000001 | AQ31: 否
A32: 002382.SZ | B32: 蓝帆医疗 | C32: 3.4100000000000001 | AQ32: 否
A33: 600436.SH | B33: 片仔癀 | C33: 3.3300000000000001 | D33: 397.10000000000002 | E33: 404.31999999999999 | F33: 411.70999999999998 | H33: 357.24000000000001 | AO33: 不宜入场(当前股价低于200日均线，应持续观察4w) | AP33: 44595 | AQ33: 是
A34: 600486.SH | B34: 扬农化工 | C34: 3.2799999999999998 | D34: 122.36 | E34: 123.16 | F34: 125.16 | H34: 117.16 | AO34: 不宜入场(当前股价低于200日均线，应持续观察4w) | AP34: 44595 | AQ34: 是
A35: 002978.SZ | B35: 安宁股份 | C35: 2.9700000000000002 | O35: 5 | P35: 是 | AO35: 不宜入场（150日均线小于200日均线,应观察6w） | AP35: 44621 | AQ35: 否
A36: 601166.SH | B36: 兴业银行 | C36: 2.9500000000000002 | AQ36: 否
A37: 600702.SH | B37: 舍得酒业 | C37: 2.9199999999999999 | D37: 189.47 | E37: 199.12 | F37: 211.91999999999999 | H37: 185.25 | AO37: 不宜入场(当前股价低于200日均线，应持续观察4w) | AP37: 44595 | AQ37: 是
A38: 002821.SZ | B38: 凯莱英 | C38: 2.8799999999999999 | D38: 383.64999999999998 | E38: 391.41000000000003 | F38: 391.43000000000001 | H38: 325.48000000000002 | AO38: 不宜入场(当前股价低于200日均线，应持续观察4w) | AP38: 44595 | AQ38: 是
A39: 600612.SH | B39: 老凤祥 | C39: 2.8599999999999999 | AQ39: 否
A40: 605266.SH | B40: 健之佳 | C40: 2.8500000000000001 | AQ40: 否
A41: 603267.SH | B41: 鸿远电子 | C41: 2.8399999999999999 | D41: 152.28999999999999 | E41: 156.12 | F41: 164.94999999999999 | H41: 162.71000000000001 | AO41: 不宜入场（当前股价小于200日均线,应观察3w） | AP41: 44608 | AQ41: 是
A42: 603208.SH | B42: 江山欧派 | C42: 2.77 | AQ42: 否
A43: 000651.SZ | B43: 格力电器 | C43: 2.71 | AQ43: 否
A44: 601233.SH | B44: 桐昆股份 | C44: 2.71 | AQ44: 否
A45: 603661.SH | B45: 恒林股份 | C45: 2.6899999999999999 | AQ45: 否
A46: 600600.SH | B46: 青岛啤酒 | C46: 2.6699999999999999 | D46: 93.430000000000007 | E46: 94.180000000000007 | F46: 95.579999999999998 | H46: 92.209999999999994 | AO46: 不宜入场(当前股价小于200日均线，应持续观察4w) | AP46: 44595 | AQ46: 是
A47: 600426.SH | B47: 华鲁恒升 | C47: 2.6600000000000001 | D47: 32.37 | E47: 32.43 | F47: 33.04 | H47: 35.49 | I47: 24.48 | J47: 41.28 | K47: 36.61 | L47: =(H47-I47)/I47 -> 0.44975490196078438 | M47: =(J47-H47)/J47 -> 0.14026162790697672 | N47: =(J47-K47)/K47 -> 0.12756077574433219 | O47: 3 | P47: 是 | Q47: 26.63 | R47: 34.299999999999997 | S47: 29.16 | T47: 36.26 | U47: 33.48 | V47: 36.88 | W47: 32.31 | AB47: 20w | AC47: =(J47-Q47)/J47 -> 0.3548934108527132 | AD47: =(R47-S47)/R47 -> 0.14985422740524773 | AE47: =(T47-U47)/T47 -> 7.6668505239933848e-02 | AF47: =(V47-W47)/V47 -> 0.12391540130151844 | AO47: 不宜入场（成交量,应观察6w） | AP47: 44626 | AQ47: 是
A48: 601799.SH | B48: 星宇股份 | C48: 2.6499999999999999 | AQ48: 否
A49: 605117.SH | B49: 德业股份 | C49: 2.6400000000000001 | D49: 201.49000000000001 | E49: 220.40000000000001 | F49: 248.56999999999999 | H49: 233.12 | I49: 38.490000000000002 | J49: 345.99000000000001 | K49: 197.47999999999999 | L49: =(H49-I49)/I49 -> 5.0566380878150161 | M49: =(J49-H49)/J49 -> 0.32622330125148125 | N49: =(J49-K49)/K49 -> 0.75202552157180491 | Q49: 222.55000000000001 | R49: 286.98000000000002 | S49: 254.38999999999999 | AB49: 12w | AC49: =(J49-Q49)/J49 -> 0.35677331714789445 | AD49: =(R49-S49)/R49 -> 0.11356192069133748 | AO49: 不宜入场（当前股价小于50日均线,应观察1w） | AP49: 44608 | AQ49: 是
A50: 605499.SH | B50: 东鹏饮料 | C50: 2.6400000000000001 | AQ50: 是
A51: 601155.SH | B51: 新城控股 | C51: 2.6099999999999999 | AQ51: 否
A52: 600295.SH | B52: 鄂尔多斯 | C52: 2.6000000000000001 | AQ52: 是
A53: 605369.SH | B53: 拱东医疗 | C53: 2.5699999999999998 | D53: 98.519999999999996 | E53: 104.53 | F53: 120.06999999999999 | H53: 147.87 | I53: 38.579999999999998 | J53: 155.28999999999999 | K53: 93.230000000000004 | L53: =(H53-I53)/I53 -> 2.8328149300155525 | M53: =(J53-H53)/J53 -> 4.7781569965870227e-02 | N53: =(J53-K53)/K53 -> 0.6656655582966855 | Q53: 130.66 | AB53: 1w | AC53: =(J53-Q53)/J53 -> 0.15860647820207352 | AD53: =(R53-S53)/R53 -> #DIV/0! | AE53: =(T53-U53)/T53 -> #DIV/0! | AF53: =(V53-W53)/V53 -> #DIV/0! | AG53: =(X53-Y53)/X53 -> #DIV/0! | AO53: 暂不宜入场（收缩幅度不够，应继续观察1w） | AP53: 44608 | AQ53: 是
A54: 000028.SZ | B54: 国药一致 | C54: 2.5099999999999998 | AQ54: 否
A55: 603986.SH | B55: 兆易创新 | C55: 2.5 | D55: 157.03999999999999 | E55: 159.40000000000001 | F55: 160.36000000000001 | H55: 139.09999999999999 | O55: 2 | P55: 是 | AO55: 不宜入场(50日均线小于200日均线，应持续观察5w) | AP55: 44626 | AQ55: 是
A56: 002648.SZ | B56: 卫星化学 | C56: 2.48 | D56: 39.05 | E56: 40.200000000000003 | F56: 43.02 | H56: 45.299999999999997 | I56: 23.52 | J56: 48.68 | K56: 38.45 | L56: =(H56-I56)/I56 -> 0.92602040816326525 | M56: =(J56-H56)/J56 -> 6.943303204601485e-02 | N56: =(J56-K56)/K56 -> 0.26605981794538353 | O56: 3 | Q56: 34.79 | R56: 43.99 | S56: 36.51 | T56: 45.58 | U56: 41 | V56: 47.39 | W56: 43.200000000000003 | AB56: 7w | AC56: =(J56-Q56)/J56 -> 0.28533278553820873 | AD56: =(R56-S56)/R56 -> 0.17003864514662431 | AE56: =(T56-U56)/T56 -> 0.10048266783677048 | AF56: =(V56-W56)/V56 -> 8.8415277484701363e-02 | AG56: =(X56-Y56)/X56 -> #DIV/0! | AO56: 暂不宜入场（成交量行为符合，应继续观察1w） | AP56: 44617 | AQ56: 是
A57: 603102.SH | B57: 百合股份 | C57: 2.46 | AQ57: 是
A58: 600563.SH | B58: 法拉电子 | C58: 2.4500000000000002 | D58: 182.12 | E58: 191.81999999999999 | F58: 208.28999999999999 | H58: 196.30000000000001 | AO58: 不宜入场(当前股价小于50日均线，应持续观察1w) | AP58: 44608 | AQ58: 是
A59: 002913.SZ | B59: 奥士康 | C59: 2.4199999999999999 | D59: 76.930000000000007 | E59: 77.819999999999993 | F59: 75.930000000000007 | AO59: 不宜入场(50日均线小于200日均线，应持续观察6w) | AP59: 44595 | AQ59: 是
A60: 603129.SH | B60: 春风动力 | C60: 2.4199999999999999 | D60: 150.36000000000001 | E60: 153.88 | F60: 165.59999999999999 | H60: 149.80000000000001 | I60: 101.8 | J60: 193.58000000000001 | K60: 119.17 | L60: =(H60-I60)/I60 -> 0.47151277013752468 | M60: =(J60-H60)/J60 -> 0.22615972724455005 | N60: =(J60-K60)/K60 -> 0.62440211462616435 | Q60: 148.96000000000001 | AB60: 7w | AC60: =(J60-Q60)/J60 -> 0.23049901849364604 | AD60: =(R60-S60)/R60 -> #DIV/0! | AE60: =(T60-U60)/T60 -> #DIV/0! | AF60: =(V60-W60)/V60 -> #DIV/0! | AG60: =(X60-Y60)/X60 -> #DIV/0! | AO60: 不宜入场(当前股价低于200日均线，应持续观察3w) | AP60: 44586 | AQ60: 是
A61: 603393.SH | B61: 新天然气 | C61: 2.4100000000000001 | AQ61: 是
A62: 000039.SZ | B62: 中集集团 | C62: 2.4100000000000001 | P62: 否 | AO62: 不宜入场(150日均线小于200日均线，应持续观察6w) | AP62: 44626 | AQ62: 否
A63: 002049.SZ | B63: 紫光国微 | C63: 2.3999999999999999 | D63: 187.83000000000001 | E63: 197.53999999999999 | F63: 215.53 | H63: 214.5 | AO63: 不宜入场(当前股价小于150日均线，应持续观察2w) | AP63: 44608 | AQ63: 是
A64: 002142.SZ | B64: 宁波银行 | C64: 2.3799999999999999 | D64: 37.46 | E64: 37.57 | F64: 38.82 | H64: 37.78 | I64: 30.01 | J64: 41.89 | K64: 33.19 | L64: =(H64-I64)/I64 -> 0.25891369543485504 | M64: =(J64-H64)/J64 -> 9.8114108379088072e-02 | N64: =(J64-K64)/K64 -> 0.26212714673094317 | O64: 2 | P64: 是 | Q64: 30.01 | R64: 40.28 | S64: 35.87 | T64: 41.700000000000003 | U64: 37.29 | AB64: 28w | AC64: =(J64-Q64)/J64 -> 0.28359990451181666 | AD64: =(R64-S64)/R64 -> 0.10948361469712024 | AE64: =(T64-U64)/T64 -> 0.10575539568345332 | AK64: 否 | AO64: 暂不宜入场（当前股价小于50日均线，应继续观察1w） | AP64: 44621 | AQ64: 是
A65: 603486.SH | B65: 科沃斯 | C65: 2.3799999999999999 | AQ65: 否
A66: 600188.SH | B66: 兖矿能源 | C66: 2.3799999999999999 | D66: 22.36 | E66: 23.58 | F66: 26.38 | H66: 31.199999999999999 | I66: 7.43 | J66: 36.95 | K66: 17.32 | L66: =(H66-I66)/I66 -> 3.1991924629878872 | M66: =(J66-H66)/J66 -> 0.15561569688768614 | N66: =(J66-K66)/K66 -> 1.1333718244803697 | O66: 2 | P66: 是 | Q66: 21.5 | R66: 28.88 | S66: 22.12 | T66: 37.289999999999999 | U66: 31.260000000000002 | AB66: 21w | AC66: =(J66-Q66)/J66 -> 0.41813261163734783 | AD66: =(R66-S66)/R66 -> 0.23407202216066475 | AE66: =(T66-U66)/T66 -> 0.16170555108608201 | AF66: =(V66-W66)/V66 -> #DIV/0! | AG66: =(X66-Y66)/X66 -> #DIV/0! | AH66: =(Z66-AA66)/Z66 -> #DIV/0! | AO66: 暂不宜入场（成交量行为暂不符合，应继续观察1w） | AP66: 44617 | AQ66: 是
A67: 601601.SH | B67: 中国太保 | C67: 2.3599999999999999 | AQ67: 否
A68: 600694.SH | B68: 大商股份 | C68: 2.25 | AQ68: 否
A69: 600141.SH | B69: 兴发集团 | C69: 2.2200000000000002 | D69: 32.109999999999999 | E69: 34.259999999999998 | F69: 36.159999999999997 | H69: 29.829999999999998 | AO69: 不宜入场（当前股价小于200日均线，应继续观察4w） | AP69: 44595 | AQ69: 是
A70: 603599.SH | B70: 广信股份 | C70: 2.2200000000000002 | D70: 33.659999999999997 | E70: 34.439999999999998 | F70: 37.159999999999997 | H70: 34.5 | AO70: 不宜入场(当前股价小于50日均线，应持续观察1w) | AP70: 44586 | AQ70: 是
A71: 000799.SZ | B71: 酒鬼酒 | C71: 2.2200000000000002 | AQ71: 否
A72: 002791.SZ | B72: 坚朗五金 | C72: 2.1899999999999999 | AQ72: 否
A73: 605111.SH | B73: 新洁能 | C73: 2.1899999999999999 | D73: 159.41 | E73: 163.28 | F73: 171.25999999999999 | H73: 158.72999999999999 | AO73: 不宜入场(当前股价小于200日均线，应持续观察4w) | AP73: 44595 | AQ73: 是
A74: 600132.SH | B74: 重庆啤酒 | C74: 2.1600000000000001 | AQ74: 否
A75: 603217.SH | B75: 元利科技 | C75: 2.1600000000000001 | D75: 38.75 | E75: 40.509999999999998 | F75: 43.670000000000002 | H75: 39 | AO75: 不宜入场(当前股价小于150日均线，应持续观察3w) | AP75: 44595 | AQ75: 是
A76: 000581.SZ | B76: 威孚高科 | C76: 2.1499999999999999 | AQ76: 否
A77: 601677.SH | B77: 明泰铝业 | C77: 2.1200000000000001 | D77: 31.100000000000001 | E77: 32.939999999999998 | F77: 38.399999999999999 | H77: 39.880000000000003 | I77: 13.18 | J77: 47.170000000000002 | K77: 38.689999999999998 | L77: =(H77-I77)/I77 -> 2.0257966616084979 | M77: =(J77-H77)/J77 -> 0.15454738181047273 | N77: =(J77-K77)/K77 -> 0.21917808219178095 | Q77: 43.100000000000001 | AB77: 3w | AC77: =(J77-Q77)/J77 -> 8.6283654865380546e-02 | AD77: =(R77-S77)/R77 -> #DIV/0! | AE77: =(T77-U77)/T77 -> #DIV/0! | AF77: =(V77-W77)/V77 -> #DIV/0! | AG77: =(X77-Y77)/X77 -> #DIV/0! | AJ77: 是 | AK77: 是 | AO77: 不宜入场（收缩幅度不够，应继续观察2w） | AP77: 44608 | AQ77: 是
A78: 603301.SH | B78: 振德医疗 | C78: 2.1200000000000001 | AQ78: 是
A79: 600729.SH | B79: 重庆百货 | C79: 2.1099999999999999 | AQ79: 否
A80: 002916.SZ | B80: 深南电路 | C80: 2.0899999999999999 | D80: 100.83 | E80: 102.76000000000001 | F80: 109.81 | H80: 113.84999999999999 | I80: 73.930000000000007 | J80: 126.66 | K80: 82.579999999999998 | L80: =(H80-I80)/I80 -> 0.53997024212092493 | M80: =(J80-H80)/J80 -> 0.10113690194220751 | N80: =(J80-K80)/K80 -> 0.53378542019859532 | Q80: 85.5 | R80: 123.73999999999999 | S80: 107.59 | AB80: 18w | AC80: =(J80-Q80)/J80 -> 0.32496447181430599 | AD80: =(R80-S80)/R80 -> 0.1305155972199773 | AO80: 不宜入场(收缩幅度不够，应持续观察1w) | AP80: 44608 | AQ80: 是
A81: 603345.SH | B81: 安井食品 | C81: 2.0600000000000001 | AQ81: 否
A82: 600779.SH | B82: 水井坊 | C82: 2.0499999999999998 | D82: 116.06 | E82: 119.27 | F82: 117.95 | AO82: 不宜入场（50日均线小于150日均线，应继续观察5w） | AP82: 44595 | AQ82: 是
A83: 601088.SH | B83: 中国神华 | C83: 2.0499999999999998 | D83: 19.82 | E83: 20.25 | F83: 21.52 | H83: 22.780000000000001 | I83: 14.41 | J83: 24.449999999999999 | K83: 18.079999999999998 | L83: =(H83-I83)/I83 -> 0.58084663428174887 | M83: =(J83-H83)/J83 -> 6.8302658486707496e-02 | N83: =(J83-K83)/K83 -> 0.35232300884955758 | Q83: 18.57 | R83: 23.260000000000002 | S83: 21.079999999999998 | T83: 23.359999999999999 | U83: 21.600000000000001 | V83: 23.27 | W83: 21.91 | X83: 23.449999999999999 | Y83: 22.18 | Z83: 23.510000000000002 | AA83: 22.359999999999999 | AB83: 14w | AC83: =(J83-Q83)/J83 -> 0.24049079754601224 | AD83: =(R83-S83)/R83 -> 9.3723129836629546e-02 | AE83: =(T83-U83)/T83 -> 7.534246575342457e-02 | AF83: =(V83-W83)/V83 -> 5.8444348947142219e-02 | AG83: =(X83-Y83)/X83 -> 5.4157782515991452e-02 | AH83: =(Z83-AA83)/Z83 -> 4.8915355168013701e-02 | AJ83: 是 | AK83: 是 | AL83: 是 | AM83: 是 | AO83: 可以入场 | AP83: 44578 | AQ83: 是
A84: 000923.SZ | B84: 河钢资源 | C84: 2.0499999999999998 | AQ84: 否
A85: 603836.SH | B85: 海程邦达 | C85: 2.04 | AQ85: 是
A86: 605080.SH | B86: 浙江自然 | C86: 2.04 | D86: 62.350000000000001 | E86: 64.719999999999999 | F86: 69.430000000000007 | H86: 67.349999999999994 | AO86: 不宜入场(当前股价小于50日均线，应持续观察2w) | AP86: 44595 | AQ86: 是
A87: 600332.SH | B87: 白云山 | C87: 2.04 | AQ87: 是
A88: 000672.SZ | B88: 上峰水泥 | C88: 1.98 | AQ88: 否
A89: 603799.SH | B89: 华友钴业 | C89: 1.98 | D89: 107.09999999999999 | E89: 109.89 | F89: 109.68000000000001 | AO89: 不宜入场（50日均线小于150日均线，应继续观察5w） | AP89: 44595 | AQ89: 是
A90: 002812.SZ | B90: 恩捷股份 | C90: 1.97 | AQ90: 是
A91: 603297.SH | B91: 永新光学 | C91: 1.97 | D91: 78.939999999999998 | E91: 85.430000000000007 | F91: 109.17 | H91: 116.90000000000001 | I91: 34.899999999999999 | J91: 138 | K91: 88.890000000000001 | L91: =(H91-I91)/I91 -> 2.3495702005730661 | M91: =(J91-H91)/J91 -> 0.15289855072463765 | N91: =(J91-K91)/K91 -> 0.5524805939925751 | Q91: 116.90000000000001 | AB91: 2w | AC91: =(J91-Q91)/J91 -> 0.15289855072463765 | AO91: 不宜入场(当前股价小于50日均线，应持续观察1w) | AP91: 44608 | AQ91: 是
A92: 603816.SH | B92: 顾家家居 | C92: 1.97 | AQ92: 否
A93: 603392.SH | B93: 万泰生物 | C93: 1.96 | D93: 227.09999999999999 | E93: 228.52000000000001 | F93: 227.50999999999999 | AO93: 不宜入场（50日均线小于150日均线，应继续观察5w） | AP93: 44595 | AQ93: 是
A94: 600596.SH | B94: 新安股份 | C94: 1.96 | D94: 24.23 | E94: 25.33 | F94: 25.27 | AO94: 不宜入场（50日均线小于150日均线，应继续观察5w） | AP94: 44595 | AQ94: 是
A95: 601699.SH | B95: 潞安环能 | C95: 1.95 | D95: 12.19 | E95: 12.42 | F95: 12.699999999999999 | H95: 14.23 | I95: 5.09 | J95: 19.67 | K95: 12.12 | L95: =(H95-I95)/I95 -> 1.7956777996070727 | M95: =(J95-H95)/J95 -> 0.2765632943568887 | N95: =(J95-K95)/K95 -> 0.62293729372937323 | AO95: 不宜入场(当前股价距离最高点距离过大，应持续观察2w) | AP95: 44595 | AQ95: 是
A96: 600763.SH | B96: 通策医疗 | C96: 1.9299999999999999 | AQ96: 否
A97: 000538.SZ | B97: 云南白药 | C97: 1.9199999999999999 | AQ97: 否
A98: 603589.SH | B98: 口子窖 | C98: 1.9199999999999999 | D98: 63.710000000000001 | E98: 64.780000000000001 | F98: 69.010000000000005 | H98: 69.659999999999997 | I98: 47.899999999999999 | J98: 86.489999999999995 | K98: 53.780000000000001 | L98: =(H98-I98)/I98 -> 0.45427974947807931 | M98: =(J98-H98)/J98 -> 0.19458896982310092 | N98: =(J98-K98)/K98 -> 0.60821866865005569 | Q98: 62.549999999999997 | AB98: 6w | AC98: =(J98-Q98)/J98 -> 0.27679500520291361 | AO98: 暂不宜入场（收缩幅度不够，应继续观察2w） | AP98: 44595 | AQ98: 是
A99: 001218.SZ | B99: 丽臣实业 | C99: 1.9099999999999999 | AQ99: 否
A100: 600746.SH | B100: 江苏索普 | C100: 1.9099999999999999 | AQ100: 否
A101: 000830.SZ | B101: 鲁西化工 | C101: 1.8899999999999999 | AQ101: 否
A102: 002841.SZ | B102: 视源股份 | C102: 1.8700000000000001 | AQ102: 否
A103: 603713.SH | B103: 密尔克卫 | C103: 1.8700000000000001 | D103: 117.01 | E103: 118.02 | F103: 126.46 | H103: 126.01 | I103: 86.48 | J103: 147.57 | K103: 133.24 | L103: =(H103-I103)/I103 -> 0.45709990749306195 | M103: =(J103-H103)/J103 -> 0.14610015585823669 | N103: =(J103-K103)/K103 -> 0.10755028519963962 | Q103: 86.48 | R103: 111 | S103: 94.69 | T103: 145.22 | U103: 118.18 | V103: 139.42 | W103: 126.5 | AB103: 48w | AC103: =(J103-Q103)/J103 -> 0.41397302974859385 | AD103: =(R103-S103)/R103 -> 0.14693693693693696 | AE103: =(T103-U103)/T103 -> 0.18620024789973827 | AF103: =(V103-W103)/V103 -> 9.2669631329794777e-02 | AO103: 不宜入场(当前股价小于50日均线，应持续观察1w) | AP103: 44608 | AQ103: 是
A104: 603995.SH | B104: 甬金股份 | C104: 1.8700000000000001 | D104: 42.229999999999997 | E104: 44.049999999999997 | F104: 49.5 | G104: 3 | H104: 58.560000000000002 | I104: 27.579999999999998 | J104: 62.869999999999997 | K104: 47.990000000000002 | L104: =(H104-I104)/I104 -> 1.1232777374909357 | M104: =(J104-H104)/J104 -> 6.8554159376491092e-02 | N104: =(J104-K104)/K104 -> 0.31006459679099801 | Q104: 54.539999999999999 | R104: 61.799999999999997 | S104: 57.520000000000003 | T104: 63.5 | U104: 59.990000000000002 | AB104: 4w | AC104: =(J104-Q104)/J104 -> 0.13249562589470334 | AD104: =(R104-S104)/R104 -> 6.9255663430420625e-02 | AE104: =(T104-U104)/T104 -> 5.5275590551181072e-02 | AF104: =(V104-W104)/V104 -> #DIV/0! | AG104: =(X104-Y104)/X104 -> #DIV/0! | AI104: 3T | AJ104: 是 | AK104: 是 | AL104: 是 | AM104: 是 | AN104: 否 | AO104: 不宜入场(杯型尚未形成，应持续观察1w等待两个好的高成交量收盘) | AP104: 44608 | AQ104: 是
A105: 002601.SZ | B105: 龙佰集团 | C105: 1.8600000000000001 | AO105: 不宜入场（150日均线小于200日均线,应观察6w） | AP105: 44626 | AQ105: 否
A106: 000733.SZ | B106: 振华科技 | C106: 1.8600000000000001 | D106: 96.719999999999999 | E106: 102.75 | F106: 113.48999999999999 | H106: 114.5 | I106: 45.359999999999999 | J106: 130.46000000000001 | K106: 107.3 | L106: =(J106-I106)/I106 -> 1.8761022927689597 | M106: =(J106-H106)/J106 -> 0.12233634830599423 | N106: =(J106-K106)/K106 -> 0.21584342963653319 | O106: 2 | P106: 是 | Q106: 103.2 | AB106: 1w | AC106: =(J106-Q106)/J106 -> 0.20895293576575197 | AD106: =(R106-S106)/R106 -> #DIV/0! | AE106: =(T106-U106)/T106 -> #DIV/0! | AF106: =(V106-W106)/V106 -> #DIV/0! | AO106: 不宜入场(当前收缩幅度不够，应持续观察2w) | AP106: 44626 | AQ106: 是
A107: 605305.SH | B107: 中际联合 | C107: 1.8500000000000001 | D107: 80.34 | E107: 84.75 | F107: 93.13 | H107: 95 | I107: 38.47 | J107: 129.92 | K107: 72.54 | L107: =(J107-I107)/I107 -> 2.3771770210553678 | M107: =(J107-H107)/J107 -> 0.26878078817733986 | N107: =(J107-K107)/K107 -> 0.79101185552798425 | Q107: 79.18 | AO107: 不宜入场(当前股价距离最高点距离过大，应持续观察1w) | AP107: 44595 | AQ107: 是
A108: 002768.SZ | B108: 国恩股份 | C108: 1.8200000000000001 | AQ108: 否
A109: 603605.SH | B109: 珀莱雅 | C109: 1.8200000000000001 | D109: 183.88999999999999 | E109: 186.41 | F109: 190.11000000000001 | H109: 169.05000000000001 | AO109: 不宜入场(当前股价小于200日均线，应持续观察4w) | AP109: 44595 | AQ109: 是
A110: 600346.SH | B110: 恒力石化 | C110: 1.8100000000000001 | AQ110: 否
A111: 600810.SH | B111: 神马股份 | C111: 1.8 | D111: 12.03 | E111: 12.13 | F111: 12.14 | H111: 11.29 | AO111: 不宜入场(当前股价小于200日均线，应持续观察4w) | AP111: 44595 | AQ111: 是
A112: 002030.SZ | B112: 达安基因 | C112: 1.8 | AQ112: 否
A113: 603565.SH | B113: 中谷物流 | C113: 1.79 | AQ113: 否
A114: 605287.SH | B114: 德才股份 | C114: 1.79 | AQ114: 否
A115: 000999.SZ | B115: 华润三九 | C115: 1.78 | D115: 27.72 | E115: 28.52 | F115: 32.28 | H115: 33.97 | I115: 23.23 | J115: 41.45 | K115: 25.63 | L115: =(J115-I115)/I115 -> 0.78433060697374091 | M115: =(J115-H115)/J115 -> 0.18045838359469249 | N115: =(J115-K115)/K115 -> 0.61724541552867751 | Q115: 32.93 | AB115: 4w | AC115: =(J115-Q115)/J115 -> 0.20554885404101333 | AO115: 不宜入场(收缩量不够，应持续观察2w) | AP115: 44608 | AQ115: 是
A116: 605123.SH | B116: 派克新材 | C116: 1.77 | D116: 101.84999999999999 | E116: 107.79000000000001 | F116: 123.31999999999999 | H116: 123.02 | I116: 61.549999999999997 | J116: 159 | K116: 83.180000000000007 | L116: =(J116-I116)/I116 -> 1.5832656376929326 | M116: =(J116-H116)/J116 -> 0.22628930817610066 | N116: =(J116-K116)/K116 -> 0.91151719163260381 | Q116: 109.2 | R116: 134 | S116: 121.53 | AB116: 8w | AC116: =(J116-Q116)/J116 -> 0.31320754716981131 | AO116: 不宜入场(当前股价小于50日均线，应持续观察1w) | AP116: 44595 | AQ116: 是
A117: 002460.SZ | B117: 赣锋锂业 | C117: 1.77 | AQ117: 否
A118: 603659.SH | B118: 璞泰来 | C118: 1.77 | D118: 143.47 | E118: 150.84 | F118: 156.38 | H118: 142.30000000000001 | AO118: 不宜入场（当前股价小于200日均线，应继续观察4w） | AP118: 44595 | AQ118: 是
A119: 605389.SH | B119: 长龄液压 | C119: 1.77 | AQ119: 否
A120: 600389.SH | B120: 江山股份 | C120: 1.77 | D120: 38.64 | E120: 40 | F120: 41.99 | H120: 45.63 | I120: 17.600000000000001 | J120: 65.79 | K120: 40.799999999999997 | L120: =(J120-I120)/I120 -> 2.738068181818182 | M120: =(J120-H120)/J120 -> 0.30642954856361154 | N120: =(J120-K120)/K120 -> 0.61250000000000027 | AO120: 不宜入场（当前股价与最高价距离过大，应继续观察1w） | AP120: 44619 | AQ120: 是
A121: 600104.SH | B121: 上汽集团 | C121: 1.76 | AQ121: 否
A122: 002900.SZ | B122: 哈三联 | C122: 1.74 | AQ122: 否
A123: 600511.SH | B123: 国药股份 | C123: 1.73 | AO123: 不宜入场（150日均线小于200日均线,应观察6w） | AP123: 44626 | AQ123: 否
A124: 600801.SH | B124: 华新水泥 | C124: 1.72 | AQ124: 否
A125: 601628.SH | B125: 中国人寿 | C125: 1.72 | AQ125: 否
A126: 603678.SH | B126: 火炬电子 | C126: 1.71 | D126: 70.25 | E126: 71.340000000000003 | F126: 70.540000000000006 | AO126: 不宜入场（50日均线小于150日均线，应继续观察5w） | AP126: 44595 | AQ126: 是
A127: 600884.SH | B127: 杉杉股份 | C127: 1.7 | D127: 29.06 | E127: 30.58 | F127: 31.34 | H127: 26.71 | O127: 2 | P127: 是 | AO127: 不宜入场（50日均线小于150日均线，应继续观察4w） | AP127: 44621 | AQ127: 是
A128: 600211.SH | B128: 西藏药业 | C128: 1.6899999999999999 | AQ128: 否
A129: 600976.SH | B129: 健民集团 | C129: 1.6899999999999999 | D129: 51.75 | E129: 55.259999999999998 | F129: 66.459999999999994 | H129: 65.370000000000005 | AO129: 不宜入场(当前股价小于50日均线，应持续观察1w) | AP129: 44595 | AQ129: 是
A130: 605180.SH | B130: 华生科技 | C130: 1.6899999999999999 | AQ130: 否
A131: 603290.SH | B131: 斯达半导 | C131: 1.6699999999999999 | D131: 346.67000000000002 | E131: 368.38 | F131: 403.49000000000001 | H131: 329.69999999999999 | AO131: 不宜入场（当前股价小于200日均线，应继续观察4w） | AP131: 44595 | AQ131: 是
A132: 002709.SZ | B132: 天赐材料 | C132: 1.6599999999999999 | D132: 109.61 | E132: 114.76 | F132: 113.55 | AO132: 不宜入场（50日均线小于150日均线，应继续观察5w） | AP132: 44595 | AQ132: 是
A133: 002714.SZ | B133: 牧原股份 | C133: 1.6599999999999999 | AQ133: 否
A134: 000422.SZ | B134: 湖北宜化 | C134: 1.6599999999999999 | D134: 17.690000000000001 | E134: 19.100000000000001 | F134: 20.399999999999999 | H134: 20.93 | I134: 2.7999999999999998 | J134: 35 | K134: 18.710000000000001 | L134: =(J134-I134)/I134 -> 11.500000000000002 | M134: =(J134-H134)/J134 -> 0.40200000000000002 | N134: =(J134-K134)/K134 -> 0.87065740245857826 | O134: 2 | P134: 是 | AO134: 不宜入场（当前股价距离最高点距离太大,应观察2w） | AP134: 44626 | AQ134: 是
A135: 002975.SZ | B135: 博杰股份 | C135: 1.6499999999999999 | AQ135: 否
A136: 600745.SH | B136: 闻泰科技 | C136: 1.6499999999999999 | D136: 111.22 | E136: 113.86 | F136: 121.44 | H136: 107 | AO136: 不宜入场（当前股价小于200日均线,应观察4w） | AP136: 44595 | AQ136: 是
A137: 601156.SH | B137: 东航物流 | C137: 1.6399999999999999 | AQ137: 否
A138: 603416.SH | B138: 信捷电气 | C138: 1.6399999999999999 | AQ138: 否
A139: 603897.SH | B139: 长城科技 | C139: 1.6399999999999999 | D139: 40.299999999999997 | E139: 43.700000000000003 | F139: 49.340000000000003 | H139: 40.600000000000001 | AO139: 不宜入场（当前股价小于150日均线,应观察2w） | AP139: 44595 | AQ139: 是
A140: 000049.SZ | B140: 德赛电池 | C140: 1.6399999999999999 | D140: 46.100000000000001 | E140: 46.649999999999999 | F140: 50.969999999999999 | H140: 48.210000000000001 | AO140: 不宜入场(当前股价小于50日均线) | AP140: 44595 | AQ140: 是
A141: 603236.SH | B141: 移远通信 | C141: 1.6299999999999999 | D141: 172.88999999999999 | E141: 175.71000000000001 | F141: 189.12 | H141: 181.80000000000001 | AO141: 不宜入场(当前股价小于50日均线,应观察1w) | AP141: 44595 | AQ141: 是
A142: 605399.SH | B142: 晨光新材 | C142: 1.6299999999999999 | D142: 36.399999999999999 | E142: 38.899999999999999 | F142: 43.939999999999998 | H142: 47.700000000000003 | I142: 14.74 | J142: 55.899999999999999 | K142: 36.399999999999999 | L142: =(H142-I142)/I142 -> 2.2360922659430122 | M142: =(J142-H142)/J142 -> 0.14669051878354197 | N142: =(J142-K142)/K142 -> 0.5357142857142857 | O142: 4 | P142: 是 | Q142: 38.25 | R142: 51.509999999999998 | S142: 40.5 | AB142: 6w | AC142: =(J142-Q142)/J142 -> 0.31574239713774593 | AD142: =(R142-S142)/R142 -> 0.21374490390215489 | AO142: 不宜入场(当前收缩幅度不够,应观察2w) | AP142: 44626 | AQ142: 是
A143: 000786.SZ | B143: 北新建材 | C143: 1.6100000000000001 | AQ143: 否
A144: 002850.SZ | B144: 科达利 | C144: 1.6100000000000001 | D144: 130.24000000000001 | E144: 139.53 | F144: 158.55000000000001 | H144: 153.75 | AO144: 不宜入场(当前股价小于50日均线,应观察1w) | AP144: 44595 | AQ144: 是
A145: 002876.SZ | B145: 三利谱 | C145: 1.6000000000000001 | D145: 55.140000000000001 | E145: 55.829999999999998 | F145: 57.689999999999998 | H145: 61.899999999999999 | I145: 31.870000000000001 | J145: 68.299999999999997 | K145: 53.810000000000002 | L145: =(H145-I145)/I145 -> 0.94226545340445544 | M145: =(J145-H145)/J145 -> 9.370424597364567e-02 | N145: =(J145-K145)/K145 -> 0.26928080282475364 | Q145: 46.799999999999997 | R145: 64.950000000000003 | S145: 51.07 | AB145: 21w | AC145: =(J145-Q145)/J145 -> 0.314787701317716 | AD145: =(#REF!-#REF!)/#REF! -> #REF! | AE145: =(R145-S145)/R145 -> 0.21370284834488071 | AO145: 不宜入场(当前股价小于200日均线，应持续观察3w) | AP145: 44608 | AQ145: 是
A146: 603150.SH | B146: 万朗磁塑 | C146: 1.6000000000000001 | AQ146: 否
A147: 603529.SH | B147: 爱玛科技 | C147: 1.6000000000000001 | D147: 43.32 | E147: 43.55 | F147: 44.18 | H147: 39.36 | AO147: 不宜入场（当前股价小于200日均线,应观察4w） | AP147: 44595 | AQ147: 是
A148: 600064.SH | B148: 南京高科 | C148: 1.5800000000000001 | D148: 9.25 | E148: 9.25 | F148: 9.4100000000000001 | H148: 9.1500000000000004 | AO148: 不宜入场（当前股价小于200日均线,应观察4w） | AP148: 44595 | AQ148: 是
A149: 600985.SH | B149: 淮北矿业 | C149: 1.5800000000000001 | D149: 11.92 | E149: 11.99 | F149: 11.699999999999999 | AO149: 不宜入场（50日均线小于200日均线,应观察5w） | AP149: 44595 | AQ149: 是
A150: 601607.SH | B150: 上海医药 | C150: 1.5800000000000001 | AQ150: 否
A151: 603517.SH | B151: 绝味食品 | C151: 1.5800000000000001 | AQ151: 否
A152: 002080.SZ | B152: 中材科技 | C152: 1.5800000000000001 | D152: 30.68 | E152: 31.739999999999998 | F152: 32.789999999999999 | H152: 29.32 | AO152: 不宜入场（当前股价小于200日均线,应观察4w） | AP152: 44595 | AQ152: 是
A153: 605555.SH | B153: 德昌股份 | C153: 1.5700000000000001 | AQ153: 否
A154: 002541.SZ | B154: 鸿路钢构 | C154: 1.5700000000000001 | AQ154: 否
A155: 000513.SZ | B155: 丽珠集团 | C155: 1.55 | AQ155: 否
A156: 601001.SH | B156: 晋控煤业 | C156: 1.55 | D156: 9.22 | E156: 9.65 | F156: 10.27 | H156: 10.52 | I156: 4.2999999999999998 | J156: 15.800000000000001 | K156: 7.88 | L156: =(H156-I156)/I156 -> 1.4465116279069767 | M156: =(J156-H156)/J156 -> 0.33417721518987348 | N156: =(J156-K156)/K156 -> 1.0050761421319798 | O156: 2 | Q156: 8.52 | AB156: 18w | AC156: =(J156-Q156)/J156 -> 0.46075949367088614 | AO156: 不宜入场（当前股价距离最高点距离过大，应持续观察2w） | AP156: 44595 | AQ156: 是
A157: 603087.SH | B157: 甘李药业 | C157: 1.55 | AQ157: 否
A158: 600096.SH | B158: 云天化 | C158: 1.55 | D158: 19.010000000000002 | E158: 20.120000000000001 | F158: 20.489999999999998 | H158: 16.82 | AO158: 不宜入场（当前股价小于200日均线,应观察4w） | AP158: 44595 | AQ158: 是
A159: 605259.SH | B159: 绿田机械 | C159: 1.54 | AQ159: 否
A160: 603186.SH | B160: 华正新材 | C160: 1.53 | AQ160: 否
A161: 605090.SH | B161: 九丰能源 | C161: 1.53 | AQ161: 否
A162: 002274.SZ | B162: 华昌化工 | C162: 1.52 | D162: 11.21 | E162: 11.63 | F162: 12.09 | H162: 11.21 | AO162: 不宜入场（当前股价小于200日均线，应持续观察4w） | AP162: 44595 | AQ162: 是
A163: 601100.SH | B163: 恒立液压 | C163: 1.52 | AQ163: 否
A164: 603071.SH | B164: 物产环能 | C164: 1.52 | D164: 22.82 | E164: 22.96 | F164: 23.399999999999999 | H164: 20.65 | AO164: 不宜入场（当前股价小于200日均线，应持续观察4w） | AP164: 44595 | AQ164: 是
A165: 002032.SZ | B165: 苏泊尔 | C165: 1.52 | AQ165: 否
A166: 002179.SZ | B166: 中航光电 | C166: 1.52 | D166: 86.640000000000001 | E166: 88.829999999999998 | F166: 91.930000000000007 | H166: 88.579999999999998 | AO166: 不宜入场（当前股价小于150日均线，应持续观察3w） | AP166: 44595 | AQ166: 是
A167: 002048.SZ | B167: 宁波华翔 | C167: 1.51 | D167: 18.82 | E167: 19.609999999999999 | F167: 21.41 | H167: 19.68 | AO167: 不宜入场(当前股价小于50日均线，应继续观察1w) | AP167: 44595 | AQ167: 是
A168: 605189.SH | B168: 富春染织 | C168: 1.51 | AQ168: 否
A169: 001201.SZ | B169: 东瑞股份 | C169: 1.5 | AQ169: 否
A170: 002128.SZ | B170: 电投能源 | C170: 1.5 | D170: 12.9 | E170: 13.390000000000001 | F170: 14.789999999999999 | H170: 14.640000000000001 | I170: 7.9800000000000004 | J170: 18.48 | K170: 10.32 | L170: =(H170-I170)/I170 -> 0.83458646616541354 | M170: =(J170-H170)/J170 -> 0.20779220779220778 | N170: =(J170-K170)/K170 -> 0.79069767441860461 | O170: 3 | AO170: 不宜入场(收缩幅度不够，应该持续观察6个w) | AP170: 44595 | AQ170: 是
A171: 603338.SH | B171: 浙江鼎力 | C171: 1.5 | AO171: 不宜入场(当前股价小于50日均线，应继续观察1w) | AP171: 44595 | AQ171: 是
A172: 600031.SH | B172: 三一重工 | C172: 1.49 | AQ172: 否
A173: 600741.SH | B173: 华域汽车 | C173: 1.49 | D173: 25.350000000000001 | E173: 25.550000000000001 | F173: 26.969999999999999 | H173: 27.920000000000002 | I173: 18.850000000000001 | J173: 30.489999999999998 | K173: 23.530000000000001 | L173: =(H173-I173)/I173 -> 0.48116710875331564 | M173: =(J173-H173)/J173 -> 8.4289931124958903e-02 | N173: =(J173-K173)/K173 -> 0.29579260518487027 | Q173: 26.300000000000001 | R173: 29.530000000000001 | S173: 26.460000000000001 | AB173: 6w | AC173: =(J173-Q173)/J173 -> 0.13742210560839613 | AD173: =(R173-S173)/R173 -> 0.10396207246867593 | AE173: =(T173-U173)/T173 -> #DIV/0! | AI173: 3T | AJ173: 否 | AK173: 是 | AL173: 是 | AM173: 否 | AO173: 不宜入场(当前股价小于50日均线，应持续观察1w) | AP173: 44608 | AQ173: 是
A174: 601995.SH | B174: 中金公司 | C174: 1.49 | AQ174: 否
A175: 000623.SZ | B175: 吉林敖东 | C175: 1.49 | D175: 16.620000000000001 | E175: 16.82 | F175: 17.399999999999999 | H175: 16.600000000000001 | AO175: 不宜入场（当前股价小于200日均线，应持续观察4w） | AP175: 44595 | AQ175: 是
A176: 001212.SZ | B176: 中旗新材 | C176: 1.47 | AQ176: 否
A177: 601225.SH | B177: 陕西煤业 | C177: 1.47 | D177: 12.23 | E177: 12.43 | F177: 12.69 | H177: 12.539999999999999 | AO177: 不宜入场(当前股价小于50日均线，应继续观察1w) | AP177: 44595 | AQ177: 是
A178: 603155.SH | B178: 新亚强 | C178: 1.47 | D178: 54.49 | E178: 56.08 | F178: 57.91 | H178: 56.44 | P178: 是 | AO178: 不宜入场（当前股价距小于50日均线，应持续观察1w） | AP178: 44626 | AQ178: 是
A179: 603606.SH | B179: 东方电缆 | C179: 1.47 | D179: 36.979999999999997 | E179: 39.880000000000003 | F179: 48.240000000000002 | H179: 59.200000000000003 | I179: 18.510000000000002 | J179: 63.75 | K179: 31.57 | L179: =(H179-I179)/I179 -> 2.1982712047541866 | M179: =(J179-H179)/J179 -> 7.1372549019607795e-02 | N179: =(J179-K179)/K179 -> 1.0193221412733608 | O179: 2 | Q179: 42.100000000000001 | AB179: 2w | AC179: =(J179-Q179)/J179 -> 0.33960784313725489 | AO179: 不宜入场（收缩幅度不够，应继续持续观察2w） | AP179: 44595 | AQ179: 是
A180: 605098.SH | B180: 行动教育 | C180: 1.46 | D180: 47.700000000000003 | E180: 48.880000000000003 | F180: 52.789999999999999 | H180: 57.869999999999997 | I180: 32.399999999999999 | J180: 63.780000000000001 | K180: 47.789999999999999 | L180: =(H180-I180)/I180 -> 0.78611111111111109 | M180: =(J180-H180)/J180 -> 9.2662276575729119e-02 | N180: =(J180-K180)/K180 -> 0.33458882611424989 | Q180: 40.479999999999997 | R180: 60.5 | S180: 47.509999999999998 | AB180: 20w | AC180: =(J180-Q180)/J180 -> 0.36531828159297591 | AD180: =(R180-S180)/R180 -> 0.21471074380165292 | AE180: =(T180-U180)/T180 -> #DIV/0! | AF180: =(V180-W180)/V180 -> #DIV/0! | AI180: 6T | AO180: 不宜入场(当前股价小于50日均线，应持续观察1w) | AP180: 44608 | AQ180: 是
A181: 600581.SH | B181: 八一钢铁 | C181: 1.45 | P181: 是 | AO181: 不宜入场(150日均线小于200日均线，应继续观察6w) | AP181: 44626 | AQ181: 否
A182: 600449.SH | B182: 宁夏建材 | C182: 1.45 | AQ182: 否
A183: 600966.SH | B183: 博汇纸业 | C183: 1.4399999999999999 | AQ183: 否
A184: 003028.SZ | B184: 振邦智能 | C184: 1.4399999999999999 | AQ184: 否
A185: 603806.SH | B185: 福斯特 | C185: 1.4399999999999999 | D185: 113.16 | E185: 117.53 | F185: 119.98999999999999 | H185: 114 | AO185: 不宜入场(当前股价小于150日均线，应观察2w) | AP185: 44595 | AQ185: 是
A186: 000002.SZ | B186: 万科A | C186: 1.4399999999999999 | AQ186: 否
A187: 600566.SH | B187: 济川药业 | C187: 1.4299999999999999 | D187: 21.059999999999999 | E187: 21.629999999999999 | F187: 24.25 | H187: 24.829999999999998 | I187: 14.369999999999999 | J187: 31.170000000000002 | K187: 18.370000000000001 | L187: =(H187-I187)/I187 -> 0.72790535838552539 | M187: =(J187-H187)/J187 -> 0.20340070580686567 | N187: =(J187-K187)/K187 -> 0.69678824169842135 | O187: 3 | P187: 否 | Q187: 22.600000000000001 | AB187: 4w | AC187: =(J187-Q187)/J187 -> 0.27494385627205647 | AO187: 不宜入场(收缩幅度不够，应继续观察2w) | AP187: 44626 | AQ187: 是
A188: 002008.SZ | B188: 大族激光 | C188: 1.4299999999999999 | D188: 42.630000000000003 | E188: 43.140000000000001 | F188: 46.770000000000003 | H188: 53.420000000000002 | I188: 33.689999999999998 | J188: 55.109999999999999 | K188: 39.359999999999999 | L188: =(H188-I188)/I188 -> 0.5856337192045119 | M188: =(J188-H188)/J188 -> 3.0665940845581524e-02 | N188: =(J188-K188)/K188 -> 0.40015243902439024 | Q188: 45.509999999999998 | R188: 49.799999999999997 | S188: 46.460000000000001 | AB188: 2w | AC188: =(J188-Q188)/J188 -> 0.17419706042460537 | AD188: =(R188-S188)/R188 -> 6.7068273092369401e-02 | AE188: =(T188-U188)/T188 -> #DIV/0! | AF188: =(V188-W188)/V188 -> #DIV/0! | AO188: 不宜入场(当前股价小于50日均线，应持续观察1w) | AP188: 44608 | AQ188: 是
A189: 605009.SH | B189: 豪悦护理 | C189: 1.4299999999999999 | AQ189: 否
A190: 002508.SZ | B190: 老板电器 | C190: 1.4199999999999999 | AQ190: 否
A191: 002833.SZ | B191: 弘亚数控 | C191: 1.4199999999999999 | AQ191: 否
A192: 601838.SH | B192: 成都银行 | C192: 1.4199999999999999 | D192: 12.08 | E192: 12.26 | F192: 12.94 | H192: 14.38 | I192: 8.51 | J192: 15.34 | K192: 11.66 | L192: =(H192-I192)/I192 -> 0.68977673325499422 | M192: =(J192-H192)/J192 -> 6.2581486310299805e-02 | N192: =(J192-K192)/K192 -> 0.31560891938250424 | O192: 3 | Q192: 13.93 | AB192: 2w | AC192: =(J192-Q192)/J192 -> 9.191655801825295e-02 | AO192: 不宜入场(收缩量不够，应持续观察2w) | AP192: 44608 | AQ192: 是
A193: 605566.SH | B193: 福莱蒽特 | C193: 1.4199999999999999 | AQ193: 否
A194: 002022.SZ | B194: 科华生物 | C194: 1.4199999999999999 | AQ194: 否
A195: 000789.SZ | B195: 万年青 | C195: 1.4199999999999999 | AQ195: 否
A196: 601012.SH | B196: 隆基股份 | C196: 1.4099999999999999 | D196: 80.13 | E196: 81.599999999999994 | F196: 81.19 | AO196: 不宜入场(50日均线小于150日均线，应继续观察4w) | AP196: 44595 | AQ196: 是
A197: 000001.SZ | B197: 平安银行 | C197: 1.3999999999999999 | AO197: 不宜入场(当前股价小于200日均线，应继续观察4w) | AP197: 44623 | AQ197: 否
A198: 600089.SH | B198: 特变电工 | C198: 1.3999999999999999 | D198: 18.940000000000001 | E198: 19.899999999999999 | F198: 20.859999999999999 | H198: 18.649999999999999 | AO198: 不宜入场(当前股价小于200日均线，应观察4w) | AP198: 44595 | AQ198: 是
A199: 002845.SZ | B199: 同兴达 | C199: 1.3899999999999999 | AQ199: 否
A200: 600196.SH | B200: 复星医药 | C200: 1.3899999999999999 | AQ200: 否
A201: 603579.SH | B201: 荣泰健康 | C201: 1.3899999999999999 | AQ201: 否
A202: 002110.SZ | B202: 三钢闽光 | C202: 1.3799999999999999 | AQ202: 否
A203: 002756.SZ | B203: 永兴材料 | C203: 1.3799999999999999 | D203: 104.66 | E203: 111.53 | F203: 127.83 | H203: 129.5 | I203: 37.67 | J203: 158.97 | K203: 125.51000000000001 | L203: =(H203-I203)/I203 -> 2.4377488717812583 | M203: =(J203-H203)/J203 -> 0.18538088947600176 | N203: =(J203-K203)/K203 -> 0.26659230340211931 | O203: 3 | Q203: 128.90000000000001 | AB203: 21w | AC203: =(J203-Q203)/J203 -> 0.18915518651317856 | AO203: 不宜入场(收缩幅度不够，应持续观察2w) | AP203: 44626 | AQ203: 是
A204: 603368.SH | B204: 柳药股份 | C204: 1.3799999999999999 | AQ204: 否
A205: 603886.SH | B205: 元祖股份 | C205: 1.3799999999999999 | D205: 19.699999999999999 | E205: 20.27 | F205: 22.359999999999999 | H205: 21 | AO205: 不宜入场(当前股价小于50日均线，应该持续观察1个w) | AP205: 44586 | AQ205: 是
A206: 603225.SH | B206: 新凤鸣 | C206: 1.3700000000000001 | AQ206: 否
A207: 601636.SH | B207: 旗滨集团 | C207: 1.3600000000000001 | AQ207: 否
A208: 002223.SZ | B208: 鱼跃医疗 | C208: 1.3600000000000001 | D208: 33.219999999999999 | E208: 33.850000000000001 | F208: 34.979999999999997 | H208: 35.859999999999999 | I208: 25.120000000000001 | J208: 41.770000000000003 | K208: 30.079999999999998 | L208: =(H208-I208)/I208 -> 0.42754777070063688 | M208: =(J208-H208)/J208 -> 0.14148910701460385 | N208: =(J208-K208)/K208 -> 0.38863031914893637 | Q208: 29.82 | AB208: 21w | AC208: =(J208-Q208)/J208 -> 0.28609049557098398 | AD208: =(R208-S208)/R208 -> #DIV/0! | AE208: =(T208-U208)/T208 -> #DIV/0! | AF208: =(V208-W208)/V208 -> #DIV/0! | AJ208: 否 | AK208: 否 | AL208: 是 | AM208: 是 | AN208: 否 | AO208: 不宜入场(成交量行为不符合要求，应该持续观察1w) | AP208: 44588 | AQ208: 是
A209: 000915.SZ | B209: 华特达因 | C209: 1.3600000000000001 | D209: 28.72 | E209: 29.09 | F209: 30.35 | G209: 2 | H209: 31.01 | I209: 19.65 | J209: 35.98 | K209: 27.41 | L209: =(H209-I209)/I209 -> 0.57811704834605615 | M209: =(J209-H209)/J209 -> 0.13813229571984423 | N209: =(J209-K209)/K209 -> 0.31265961327982478 | O209: 3 | Q209: 23.86 | R209: 35.63 | S209: 29.24 | T209: 34.43 | U209: 31.93 | V209: 36.94 | W209: 34.51 | AB209: 24w | AC209: =(J209-Q209)/J209 -> 0.33685380767092826 | AD209: =(R209-S209)/R209 -> 0.17934325007016569 | AE209: =(T209-U209)/T209 -> 7.2611094975312235e-02 | AF209: =(V209-W209)/V209 -> 6.5782349756361658e-02 | AO209: 不宜入场(错过最佳入场点，应持续观察1w寻找新的入ch) | AP209: 44608 | AQ209: 是
A210: 600030.SH | B210: 中信证券 | C210: 1.3600000000000001 | AQ210: 是
A211: 603160.SH | B211: 汇顶科技 | C211: 1.3600000000000001 | AQ211: 否
A212: 603369.SH | B212: 今世缘 | C212: 1.3500000000000001 | D212: 51.439999999999998 | E212: 51.960000000000001 | F212: 53.460000000000001 | H212: 50.920000000000002 | AO212: 不宜入场(当前股价小于200日均线，应观察4w) | AP212: 44595 | AQ212: 是
A213: 003020.SZ | B213: 立方制药 | C213: 1.3500000000000001 | D213: 44.24 | E213: 44.95 | F213: 46.74 | H213: 46.51 | AO213: 不宜入场(当前股价小于50日均线，应继续观察1w) | AP213: 44595 | AQ213: 是
A214: 600000.SH | B214: 浦发银行 | C214: 1.3400000000000001 | AQ214: 否
A215: 002371.SZ | B215: 北方华创 | C215: 1.3400000000000001 | D215: 309.10000000000002 | E215: 323.57999999999998 | F215: 327.93000000000001 | H215: 283 | AO215: 不宜入场(当前股价小于200日均线，应观察4w) | AP215: 44595 | AQ215: 是
A216: 603113.SH | B216: 金能科技 | C216: 1.3300000000000001 | AQ216: 否
A217: 600438.SH | B217: 通威股份 | C217: 1.3200000000000001 | AQ217: 否
A218: 002064.SZ | B218: 华峰化学 | C218: 1.3200000000000001 | AQ218: 否
A219: 601577.SH | B219: 长沙银行 | C219: 1.3200000000000001 | AQ219: 否
A220: 002001.SZ | B220: 新和成 | C220: 1.3100000000000001 | AQ220: 否
A221: 600887.SH | B221: 伊利股份 | C221: 1.3100000000000001 | D221: 39.079999999999998 | E221: 39.219999999999999 | F221: 39.990000000000002 | H221: 38.07 | AO221: 不宜入场(当前股价小于200日均线，应观察4w) | AP221: 44595 | AQ221: 是
A222: 605336.SH | B222: 帅丰电器 | C222: 1.3100000000000001 | D222: 29.5 | E222: 30.109999999999999 | F222: 32.119999999999997 | H222: 33.600000000000001 | I222: 24.219999999999999 | J222: 37.5 | K222: 29.329999999999998 | L222: =(H222-I222)/I222 -> 0.38728323699421979 | M222: =(J222-H222)/J222 -> 0.10399999999999997 | N222: =(J222-K222)/K222 -> 0.27855438117967957 | Q222: 28.609999999999999 | AB222: 4w | AC222: =(J222-Q222)/J222 -> 0.23706666666666668 | AD222: =(R222-S222)/R222 -> #DIV/0! | AE222: =(T222-U222)/T222 -> #DIV/0! | AF222: =(V222-W222)/V222 -> #DIV/0! | AG222: =(X222-Y222)/X222 -> #DIV/0! | AO222: 不宜入场(收缩量不够，应该持续观察1w) | AP222: 44588 | AQ222: 是
A223: 001296.SZ | B223: 长江材料 | C223: 1.3 | AQ223: 是
A224: 002637.SZ | B224: 赞宇科技 | C224: 1.3 | D224: 16.43 | E224: 16.66 | F224: 17.57 | G224: 5 | H224: 18 | I224: 11.050000000000001 | J224: 20.440000000000001 | K224: 15.17 | L224: =(H224-I224)/I224 -> 0.62895927601809942 | M224: =(J224-H224)/J224 -> 0.11937377690802353 | N224: =(J224-K224)/K224 -> 0.34739617666446942 | Q224: 14.220000000000001 | R224: 22.379999999999999 | S224: 18.280000000000001 | AB224: 17w | AC224: =(J224-Q224)/J224 -> 0.30430528375733856 | AD224: =(R224-S224)/R224 -> 0.18319928507596059 | AE224: =(T224-U224)/T224 -> #DIV/0! | AF224: =(V224-W224)/V224 -> #DIV/0! | AO224: 可以入场 | AP224: 44608 | AQ224: 是
A225: 600362.SH | B225: 江西铜业 | C225: 1.3 | AQ225: 否
A226: 603883.SH | B226: 老百姓 | C226: 1.3 | AQ226: 否
A227: 000011.SZ | B227: 深物业A | C227: 1.3 | AQ227: 否
A228: 002727.SZ | B228: 一心堂 | C228: 1.29 | AQ228: 否
A229: 601211.SH | B229: 国泰君安 | C229: 1.29 | D229: 17.14 | E229: 17.31 | F229: 17.68 | H229: 17.63 | AO229: 不宜入场(当前股价小于50日均线，应继续观察2w) | AP229: 44595 | AQ229: 是
A230: 601877.SH | B230: 正泰电器 | C230: 1.29 | D230: 46.649999999999999 | E230: 48.340000000000003 | F230: 50.549999999999997 | H230: 47.5 | AO230: 不宜入场(当前股价小于50日均线，应观察2w) | AP230: 44595 | AQ230: 是
A231: 603010.SH | B231: 万盛股份 | C231: 1.29 | D231: 23.149999999999999 | E231: 23.710000000000001 | F231: 24.649999999999999 | H231: 21.800000000000001 | AO231: 不宜入场(当前股价小于200日均线，应观察4w) | AP231: 44595 | AQ231: 是
A232: 603156.SH | B232: 养元饮品 | C232: 1.29 | AQ232: 否
A233: 600755.SH | B233: 厦门国贸 | C233: 1.28 | AQ233: 否
A234: 603733.SH | B234: 仙鹤股份 | C234: 1.28 | D234: 33.509999999999998 | E234: 34.710000000000001 | F234: 37.109999999999999 | H234: 38.630000000000003 | I234: 23.09 | J234: 44.579999999999998 | K234: 26.989999999999998 | L234: =(H234-I234)/I234 -> 0.67301862278042457 | M234: =(J234-H234)/J234 -> 0.13346792283535208 | N234: =(J234-K234)/K234 -> 0.65172286031863658 | Q234: 30.280000000000001 | R234: 42.390000000000001 | S234: 34.619999999999997 | AB234: 21w | AC234: =(J234-Q234)/J234 -> 0.3207716464782413 | AD234: =(R234-S234)/R234 -> 0.18329794762915788 | AO234: 不宜入场(当前股价小于200日均线，应持续观察3w) | AP234: 44608 | AQ234: 是
A235: 603985.SH | B235: 恒润股份 | C235: 1.27 | D235: 35.310000000000002 | E235: 38.270000000000003 | F235: 45.649999999999999 | H235: 45.509999999999998 | AO235: 不宜入场(当前股价小于50日均线，应观察2w) | AP235: 44595 | AQ235: 是
A236: 001206.SZ | B236: 依依股份 | C236: 1.27 | AQ236: 否
A237: 002597.SZ | B237: 金禾实业 | C237: 1.27 | D237: 41.43 | E237: 42.490000000000002 | F237: 44.969999999999999 | H237: 40.950000000000003 | AO237: 不宜入场(当前股价小于200日均线，应该持续观察4w) | AP237: 44595 | AQ237: 是
A238: 002889.SZ | B238: 东方嘉盛 | C238: 1.27 | D238: 25.190000000000001 | E238: 25.289999999999999 | F238: 25.899999999999999 | H238: 24.940000000000001 | AO238: 不宜入场(当前股价小于200日均线，应该持续观察4w) | AP238: 44595 | AQ238: 是
A239: 002985.SZ | B239: 北摩高科 | C239: 1.27 | D239: 105.55 | E239: 107.25 | F239: 106.90000000000001 | AO239: 不宜入场(50日均线小于150日均线，应该持续观察5w) | AP239: 44595 | AQ239: 是
A240: 600998.SH | B240: 九州通 | C240: 1.27 | AQ240: 否
A241: 605222.SH | B241: 起帆电缆 | C241: 1.27 | D241: 23.32 | E241: 23.77 | F241: 25.030000000000001 | H241: 24.399999999999999 | AO241: 不宜入场(当前股价小于50日均线，应观察2w) | AP241: 44595 | AQ241: 是
A242: 001872.SZ | B242: 招商港口 | C242: 1.27 | D242: 16.219999999999999 | E242: 16.43 | F242: 16.98 | H242: 16.219999999999999 | AB242: 15w | AC242: =(J242-Q242)/J242 -> #DIV/0! | AD242: =(R242-S242)/R242 -> #DIV/0! | AE242: =(T242-U242)/T242 -> #DIV/0! | AF242: =(V242-W242)/V242 -> #DIV/0! | AG242: =(X242-Y242)/X242 -> #DIV/0! | AI242: 3T | AJ242: 是 | AK242: 否 | AL242: 是 | AM242: 是 | AN242: 是 | AO242: 不宜入场(当前股价小于150日均线，应该持续观察2w) | AP242: 44586 | AQ242: 是
A243: 000063.SZ | B243: 中兴通讯 | C243: 1.26 | AQ243: 是
A244: 600373.SH | B244: 中文传媒 | C244: 1.26 | D244: 11.01 | E244: 11.19 | F244: 11.91 | H244: 11.33 | AO244: 不宜入场(当前股价小于50日均线，应观察2w) | AP244: 44595 | AQ244: 是
A245: 601997.SH | B245: 贵阳银行 | C245: 1.26 | AQ245: 否
A246: 603938.SH | B246: 三孚股份 | C246: 1.26 | AQ246: 否
A247: 605288.SH | B247: 凯迪股份 | C247: 1.26 | AQ247: 否
A248: 600328.SH | B248: 中盐化工 | C248: 1.26 | D248: 16.350000000000001 | E248: 16.879999999999999 | F248: 16.93 | H248: 17.120000000000001 | I248: 6 | J248: 31 | K248: 17.18 | L248: =(H248-I248)/I248 -> 1.8533333333333335 | M248: =(J248-H248)/J248 -> 0.44774193548387092 | N248: =(J248-K248)/K248 -> 0.80442374854481957 | P248: 是 | AO248: 不宜入场(当前股价距离最高价距离过大，应该持续观察2w) | AP248: 44626 | AQ248: 是
A249: 000877.SZ | B249: 天山股份 | C249: 1.25 | AQ249: 否
A250: 001217.SZ | B250: 华尔泰 | C250: 1.25 | D250: 17.690000000000001 | E250: 18.190000000000001 | F250: 19.329999999999998 | H250: 17.370000000000001 | P250: 是 | AO250: 不宜入场(当前股价小于200日均线，应该持续观察3w) | AP250: 44626 | AQ250: 是
A251: 002977.SZ | B251: 天箭科技 | C251: 1.24 | AQ251: 否
A252: 600298.SH | B252: 安琪酵母 | C252: 1.24 | D252: 54.5 | E252: 54.479999999999997 | AO252: 不宜入场(150日均线小于200日均线，应观察8w) | AP252: 44595 | AQ252: 是
A253: 600668.SH | B253: 尖峰集团 | C253: 1.23 | AQ253: 是
A254: 600123.SH | B254: 兰花科创 | C254: 1.23 | D254: 9.1699999999999999 | E254: 9.5500000000000007 | F254: 9.9299999999999997 | H254: 9.4600000000000009 | AO254: 不宜入场(当前股价小于150日均线，应该持续观察2w) | AP254: 44595 | AQ254: 是
A255: 600584.SH | B255: 长电科技 | C255: 1.23 | AQ255: 否
A256: 601688.SH | B256: 华泰证券 | C256: 1.23 | D256: 16.42 | E256: 16.61 | F256: 17.07 | H256: 15.95 | AO256: 不宜入场(当前股价小于200日均线，应该持续观察3w) | AP256: 44616 | AQ256: 是
A257: 600720.SH | B257: 祁连山 | C257: 1.23 | AQ257: 否
A258: 002287.SZ | B258: 奇正藏药 | C258: 1.22 | D258: 27.23 | E258: 27.55 | F258: 27.79 | H258: 25.26 | AO258: 不宜入场(当前股价小于200日均线，应该持续观察3w) | AP258: 44595 | AQ258: 是
A259: 600739.SH | B259: 辽宁成大 | C259: 1.22 | AQ259: 否
A260: 603095.SH | B260: 越剑智能 | C260: 1.22 | D260: 24.359999999999999 | E260: 24.489999999999998 | F260: 25.129999999999999 | H260: 26.850000000000001 | I260: 20.030000000000001 | J260: 27.379999999999999 | K260: 25.809999999999999 | L260: =(H260-I260)/I260 -> 0.34048926610084873 | M260: =(J260-H260)/J260 -> 1.935719503287062e-02 | N260: =(J260-K260)/K260 -> 6.0829135993800867e-02 | AO260: 不宜入场(时间周期太短，应观察2w) | AP260: 44595 | AQ260: 是
A261: 603259.SH | B261: 药明康德 | C261: 1.22 | AQ261: 否
A262: 603658.SH | B262: 安图生物 | C262: 1.22 | AQ262: 否
A263: 603899.SH | B263: 晨光文具 | C263: 1.21 | AQ263: 否
A264: 000401.SZ | B264: 冀东水泥 | C264: 1.21 | AQ264: 否
A265: 000932.SZ | B265: 华菱钢铁 | C265: 1.21 | AQ265: 否
A266: 601009.SH | B266: 南京银行 | C266: 1.21 | AQ266: 否
A267: 002959.SZ | B267: 小熊电器 | C267: 1.21 | AQ267: 否
A268: 000708.SZ | B268: 中信特钢 | C268: 1.2 | AQ268: 否
A269: 002353.SZ | B269: 杰瑞股份 | C269: 1.2 | D269: 40.62 | E269: 41.28 | F269: 42.19 | H269: 41.42 | AO269: 不宜入场(当前股价小于50日均线，应该持续观察1w) | AP269: 44595 | AQ269: 是
A270: 601963.SH | B270: 重庆银行 | C270: 1.2 | AQ270: 否
A271: 603197.SH | B271: 保隆科技 | C271: 1.2 | D271: 40.939999999999998 | E271: 43.960000000000001 | F271: 55.469999999999999 | H271: 55.75 | I271: 22.050000000000001 | J271: 74.450000000000003 | K271: 38.299999999999997 | L271: =(H271-I271)/I271 -> 1.5283446712018141 | M271: =(J271-H271)/J271 -> 0.25117528542646073 | N271: =(J271-K271)/K271 -> 0.94386422976501327 | Q271: 54.539999999999999 | AB271: 1w | AC271: =(J271-Q271)/J271 -> 0.26742780389523174 | AO271: 不宜入场(收缩幅度不够，应该持续观察2w) | AP271: 44595 | AQ271: 是
A272: 603198.SH | B272: 迎驾贡酒 | C272: 1.2 | D272: 54.020000000000003 | E272: 57.140000000000001 | F272: 66.090000000000003 | G272: 4 | H272: 67.609999999999999 | I272: 25.829999999999998 | J272: 77.920000000000002 | K272: 51.5 | L272: =(H272-I272)/I272 -> 1.6174990321331786 | M272: =(J272-H272)/J272 -> 0.13231519507186862 | N272: =(J272-K272)/K272 -> 0.51300970873786411 | Q272: 59.509999999999998 | R272: 74.5 | S272: 62.060000000000002 | T272: 75.790000000000006 | U272: 66.609999999999999 | AB272: 5w | AC272: =(J272-Q272)/J272 -> 0.2362679671457906 | AD272: =(R272-S272)/R272 -> 0.16697986577181206 | AE272: =(T272-U272)/T272 -> 0.12112415886000799 | AJ272: 是 | AK272: 是 | AO272: 可以入场 | AP272: 44623 | AQ272: 是
A273: 000825.SZ | B273: 太钢不锈 | C273: 1.1899999999999999 | AQ273: 否
A274: 600623.SH | B274: 华谊集团 | C274: 1.1799999999999999 | AQ274: 否
A275: 603258.SH | B275: 电魂网络 | C275: 1.1799999999999999 | D275: 26.41 | E275: 26.609999999999999 | F275: 28.109999999999999 | H275: 25.16 | AO275: 不宜入场(当前股价小于200日均线，应该持续观察3w) | AP275: 44595 | AQ275: 是
A276: 603877.SH | B276: 太平鸟 | C276: 1.1799999999999999 | AQ276: 否
A277: 605588.SH | B277: 冠石科技 | C277: 1.1799999999999999 | AQ277: 否
A278: 002415.SZ | B278: 海康威视 | C278: 1.1799999999999999 | AQ278: 否
A279: 000885.SZ | B279: 城发环境 | C279: 1.1799999999999999 | D279: 10.210000000000001 | E279: 10.32 | F279: 10.66 | H279: 10.27 | AO279: 不宜入场(当前股价小于150日均线，应该持续观察2w) | AP279: 44595 | AQ279: 是
A280: 002557.SZ | B280: 洽洽食品 | C280: 1.1799999999999999 | D280: 51.380000000000003 | E280: 52.289999999999999 | F280: 56.479999999999997 | H280: 54.729999999999997 | AO280: 不宜入场(当前股价小于50日均线，应该持续观察1w) | AP280: 44595 | AQ280: 是
A281: 601229.SH | B281: 上海银行 | C281: 1.1699999999999999 | AQ281: 否
A282: 603203.SH | B282: 快克股份 | C282: 1.1699999999999999 | D282: 32.43 | E282: 33.810000000000002 | F282: 36.170000000000002 | H282: 34.509999999999998 | AO282: 不宜入场(当前股价小于50日均线，应该持续观察1w) | AP282: 44595 | AQ282: 是
A283: 603587.SH | B283: 地素时尚 | C283: 1.1699999999999999 | AQ283: 否
A284: 603681.SH | B284: 永冠新材 | C284: 1.1699999999999999 | D284: 31.629999999999999 | E284: 33.149999999999999 | F284: 36.07 | H284: 32.979999999999997 | I284: 18.48 | J284: 41.969999999999999 | K284: 26.260000000000002 | L284: =(H284-I284)/I284 -> 0.78463203463203446 | M284: =(J284-H284)/J284 -> 0.21420061949011204 | N284: =(J284-K284)/K284 -> 0.59824828636709815 | Q284: 29.77 | R284: 41.18 | S284: 32.619999999999997 | AB284: 17w | AC284: =(J284-Q284)/J284 -> 0.29068382177746011 | AD284: =(R284-S284)/R284 -> 0.20786789703739686 | AE284: =(T284-U284)/T284 -> #DIV/0! | AF284: =(V284-W284)/V284 -> #DIV/0! | AO284: 不宜入场(收缩幅度不够，应该持续观察2w) | AP284: 44588 | AQ284: 是
A285: 605077.SH | B285: 华康股份 | C285: 1.1699999999999999 | AQ285: 否
A286: 002258.SZ | B286: 利尔化学 | C286: 1.1699999999999999 | D286: 28.32 | E286: 28.989999999999998 | F286: 30.75 | H286: 28.760000000000002 | AO286: 不宜入场(当前股价小于50日均线，应该持续观察1w) | AP286: 44595 | AQ286: 是
A287: 002929.SZ | B287: 润建股份 | C287: 1.1599999999999999 | D287: 30.109999999999999 | E287: 31.18 | F287: 34.920000000000002 | H287: 37.5 | I287: 20 | J287: 39.43 | K287: 31.91 | L287: =(H287-I287)/I287 -> 0.875 | M287: =(J287-H287)/J287 -> 4.8947501902104992e-02 | N287: =(J287-K287)/K287 -> 0.2356628016295832 | Q287: 33.170000000000002 | R287: 38.380000000000003 | S287: 33.420000000000002 | AB287: 2w | AC287: =(J287-Q287)/J287 -> 0.15876236368247523 | AD287: =(R287-S287)/R287 -> 0.12923397602918188 | AE287: =(T287-U287)/T287 -> #DIV/0! | AF287: =(V287-W287)/V287 -> #DIV/0! | AO287: 不宜入场(当前股价小于50日均线，应持续观察1w) | AP287: 44608 | AQ287: 是
A288: 002028.SZ | B288: 思源电气 | C288: 1.1599999999999999 | D288: 39.850000000000001 | E288: 41.810000000000002 | F288: 47.560000000000002 | H288: 45.899999999999999 | AO288: 不宜入场(当前股价小于50日均线，应该持续观察1w) | AP288: 44586 | AQ288: 是
A289: 003017.SZ | B289: 大洋生物 | C289: 1.1599999999999999 | AQ289: 否
A290: 603858.SH | B290: 步长制药 | C290: 1.1499999999999999 | AQ290: 否
A291: 002605.SZ | B291: 姚记科技 | C291: 1.1499999999999999 | D291: 20.87 | E291: 20.99 | F291: 23.399999999999999 | H291: 22.899999999999999 | AO291: 不宜入场(当前股价小于50日均线，应该持续观察1w) | AP291: 44595 | AQ291: 是
A292: 600153.SH | B292: 建发股份 | C292: 1.1499999999999999 | D292: 8.3300000000000001 | E292: 8.4499999999999993 | F292: 9.0099999999999998 | H292: 9.75 | I292: 7.0499999999999998 | J292: 10.56 | K292: 9.0999999999999996 | L292: =(H292-I292)/I292 -> 0.38297872340425537 | M292: =(J292-H292)/J292 -> 7.6704545454545497e-02 | N292: =(J292-K292)/K292 -> 0.16043956043956054 | P292: 否 | Q292: 10.279999999999999 | AB292: 2w | AC292: =(J292-Q292)/J292 -> 2.651515151515162e-02 | AD292: =(R292-S292)/R292 -> #DIV/0! | AO292: 不宜入场(收缩量不够，应持续观察2w) | AP292: 44626 | AQ292: 是
A293: 600323.SH | B293: 瀚蓝环境 | C293: 1.1499999999999999 | AQ293: 否
A294: 600803.SH | B294: 新奥股份 | C294: 1.1499999999999999 | D294: 18.5 | E294: 18.579999999999998 | F294: 18.699999999999999 | H294: 17.260000000000002 | AO294: 不宜入场(当前股价小于200日均线，应该持续观察3w) | AP294: 44595 | AQ294: 是
A295: 601186.SH | B295: 中国铁建 | C295: 1.1499999999999999 | D295: 7.75 | E295: 7.77 | F295: 7.96 | H295: 8.06 | I295: 6.94 | J295: 9.52 | K295: 7.09 | L295: =(H295-I295)/I295 -> 0.16138328530259366 | M295: =(J295-H295)/J295 -> 0.15336134453781503 | N295: =(J295-K295)/K295 -> 0.34273624823695342 | AO295: 不宜入场(当前股价超出最低点的幅度不够，应该持续观察2w) | AP295: 44595 | AQ295: 是
A296: 603868.SH | B296: 飞科电器 | C296: 1.1499999999999999 | D296: 42.28 | E296: 42.23 | AO296: 不宜入场(150日均线小于200日均线，应该持续观察5w) | AP296: 44595 | AQ296: 是
A297: 605089.SH | B297: 味知香 | C297: 1.1499999999999999 | D297: 75.180000000000007 | E297: 77.900000000000006 | F297: 82.030000000000001 | H297: 69.390000000000001 | AO297: 不宜入场(当前股价小于200日均线，应该持续观察3w) | AP297: 44595 | AQ297: 是
A298: 002925.SZ | B298: 盈趣科技 | C298: 1.1399999999999999 | AQ298: 否
A299: 003026.SZ | B299: 中晶科技 | C299: 1.1399999999999999 | AQ299: 否
A300: 600926.SH | B300: 杭州银行 | C300: 1.1399999999999999 | AQ300: 否
A301: 002901.SZ | B301: 大博医疗 | C301: 1.1299999999999999 | AQ301: 否
A302: 000776.SZ | B302: 广发证券 | C302: 1.1299999999999999 | D302: 20.079999999999998 | E302: 20.870000000000001 | F302: 22.629999999999999 | H302: 20.800000000000001 | AO302: 不宜入场(当前股价小于150日均线，应该持续观察2w) | AP302: 44595 | AQ302: 是
A303: 002034.SZ | B303: 旺能环境 | C303: 1.1299999999999999 | D303: 17.64 | E303: 17.699999999999999 | F303: 18.22 | H303: 18.55 | I303: 13.59 | J303: 23.399999999999999 | K303: 16.07 | L303: =(H303-I303)/I303 -> 0.36497424576894782 | M303: =(J303-H303)/J303 -> 0.20726495726495719 | N303: =(J303-K303)/K303 -> 0.4561294337274423 | Q303: 15.58 | R303: 21.56 | S303: 17.76 | T303: 21.21 | U303: 19.31 | V303: 22.04 | AB303: 16w | AC303: =(J303-Q303)/J303 -> 0.33418803418803417 | AD303: =(R303-S303)/R303 -> 0.17625231910946185 | AE303: =(T303-U303)/T303 -> 8.9580386610089671e-02 | AO303: 不宜入场(收缩幅度不够，应该持续观察1w) | AP303: 44608 | AQ303: 是
A304: 003043.SZ | B304: 华亚智能 | C304: 1.1299999999999999 | D304: 65.159999999999997 | E304: 68.769999999999996 | F304: 76.040000000000006 | H304: 68.579999999999998 | AO304: 不宜入场(当前股价小于150日均线，应该持续观察2w) | AP304: 44595 | AQ304: 是
A305: 600048.SH | B305: 保利发展 | C305: 1.1299999999999999 | D305: 13.67 | E305: 13.91 | F305: 15.1 | H305: 15.699999999999999 | I305: 9.0299999999999994 | J305: 17.079999999999998 | K305: 14.85 | L305: =(H305-I305)/I305 -> 0.73864894795127356 | M305: =(J305-H305)/J305 -> 8.0796252927400419e-02 | N305: =(J305-K305)/K305 -> 0.15016835016835009 | Q305: 14.880000000000001 | R305: 16.800000000000001 | S305: 15.109999999999999 | AB305: 2w | AC305: =(J305-Q305)/J305 -> 0.12880562060889916 | AD305: =(R305-S305)/R305 -> 0.10059523809523817 | AO305: 不宜入场（收缩幅度不够,应观察1w） | AP305: 44608 | AQ305: 是
A306: 601615.SH | B306: 明阳智能 | C306: 1.1299999999999999 | D306: 23.620000000000001 | E306: 24.780000000000001 | F306: 27.640000000000001 | H306: 24.550000000000001 | AO306: 不宜入场(当前股价小于150日均线，应该持续观察2w) | AP306: 44616 | AQ306: 是
A307: 002271.SZ | B307: 东方雨虹 | C307: 1.1200000000000001 | AQ307: 否
A308: 603288.SH | B308: 海天味业 | C308: 1.1200000000000001 | AQ308: 否
A309: 603666.SH | B309: 亿嘉和 | C309: 1.1200000000000001 | D309: 65.180000000000007 | E309: 66.150000000000006 | F309: 70.400000000000006 | H309: 63.539999999999999 | AO309: 不宜入场(当前股价小于200日均线，应该持续观察3w) | AP309: 44595 | AQ309: 是
A310: 605377.SH | B310: 华旺科技 | C310: 1.1200000000000001 | D310: 17.010000000000002 | E310: 17.300000000000001 | F310: 18.359999999999999 | H310: 18.989999999999998 | I310: 12.49 | J310: 21.98 | K310: 16.48 | L310: =(H310-I310)/I310 -> 0.52041633306645296 | M310: =(J310-H310)/J310 -> 0.13603275705186543 | N310: =(J310-K310)/K310 -> 0.33373786407766992 | Q310: 18.239999999999998 | AB310: 2w | AC310: =(J310-Q310)/J310 -> 0.17015468607825304 | AO310: 不宜入场(收缩幅度不够，应观察1w) | AP310: 44608 | AQ310: 是
A311: 002233.SZ | B311: 塔牌集团 | C311: 1.1200000000000001 | AQ311: 否
A312: 002759.SZ | B312: 天际股份 | C312: 1.1100000000000001 | P312: 是 | AO312: 不宜入场(50日均线小于200日均线，应持续观察5w) | AP312: 44626 | AQ312: 否
A313: 600885.SH | B313: 宏发股份 | C313: 1.1000000000000001 | D313: 65.060000000000002 | E313: 66.920000000000002 | F313: 69.180000000000007 | H313: 63.880000000000003 | AO313: 不宜入场(当前股价小于200日均线，应持续观察3w) | AP313: 44595 | AQ313: 是
A314: 003023.SZ | B314: 彩虹集团 | C314: 1.1000000000000001 | AQ314: 否
A315: 600782.SH | B315: 新钢股份 | C315: 1.1000000000000001 | AQ315: 否
A316: 603279.SH | B316: 景津装备 | C316: 1.1000000000000001 | D316: 33.939999999999998 | E316: 35.96 | F316: 41.100000000000001 | H316: 38.850000000000001 | AO316: 不宜入场(当前股价小于50日均线，应持续观察1w) | AP316: 44586 | AQ316: 是
A317: 002092.SZ | B317: 中泰化学 | C317: 1.1000000000000001 | AQ317: 否
A318: 000960.SZ | B318: 锡业股份 | C318: 1.0900000000000001 | D318: 18.960000000000001 | E318: 19.859999999999999 | F318: 22.399999999999999 | H318: 22.82 | I318: 11.92 | J318: 26.300000000000001 | K318: 15.6 | L318: =(H318-I318)/I318 -> 0.91442953020134232 | M318: =(J318-H318)/J318 -> 0.13231939163498099 | N318: =(J318-K318)/K318 -> 0.68589743589743601 | Q318: 15.539999999999999 | R318: 24.640000000000001 | S318: 19.530000000000001 | T318: 26.2 | U318: 22.26 | AB318: 13w | AC318: =(J318-Q318)/J318 -> 0.40912547528517113 | AD318: =(R318-S318)/R318 -> 0.20738636363636362 | AO318: 不宜入场(收缩幅度不够，应观察2w) | AP318: 44595 | AQ318: 是
A319: 002430.SZ | B319: 杭氧股份 | C319: 1.0900000000000001 | AQ319: 否
A320: 002626.SZ | B320: 金达威 | C320: 1.0900000000000001 | AQ320: 否
A321: 603662.SH | B321: 柯力传感 | C321: 1.0900000000000001 | D321: 22.15 | E321: 22.59 | F321: 23.23 | H321: 22.68 | AO321: 不宜入场(当前股价小于50日均线，应持续观察1w) | AP321: 44598 | AQ321: 是
A322: 000963.SZ | B322: 华东医药 | C322: 1.0800000000000001 | AQ322: 否
A323: 002960.SZ | B323: 青鸟消防 | C323: 1.0800000000000001 | D323: 33.939999999999998 | E323: 35.390000000000001 | F323: 42.240000000000002 | H323: 49.100000000000001 | I323: 20.260000000000002 | J323: 51.670000000000002 | K323: 36.420000000000002 | L323: =(H323-I323)/I323 -> 1.4234945705824282 | M323: =(J323-H323)/J323 -> 4.9738726533772017e-02 | N323: =(J323-K323)/K323 -> 0.41872597473915429 | Q323: 47.140000000000001 | AB323: 1w | AC323: =(J323-Q323)/J323 -> 8.7671763112057308e-02 | AD323: =(R323-S323)/R323 -> #DIV/0! | AO323: 不宜入场(当前股价小于50日均线，应持续观察1w) | AP323: 44608 | AQ323: 是
A324: 600587.SH | B324: 新华医疗 | C324: 1.0800000000000001 | D324: 23.359999999999999 | E324: 24.440000000000001 | F324: 26.109999999999999 | H324: 21.690000000000001 | AO324: 不宜入场(当前股价小于200日均线，应持续观察3w) | AP324: 44598 | AQ324: 是
A325: 603180.SH | B325: 金牌厨柜 | C325: 1.0800000000000001 | AQ325: 否
A326: 603612.SH | B326: 索通发展 | C326: 1.0800000000000001 | AQ326: 否
A327: 600176.SH | B327: 中国巨石 | C327: 1.0800000000000001 | AQ327: 否
A328: 600690.SH | B328: 海尔智家 | C328: 1.0700000000000001 | AQ328: 否
A329: 002254.SZ | B329: 泰和新材 | C329: 1.0700000000000001 | D329: 19.63 | E329: 19.74 | F329: 19.48 | P329: 是 | AO329: 不宜入场(50日均线小于200日均线，应持续观察3w) | AP329: 44626 | AQ329: 是
A330: 601101.SH | B330: 昊华能源 | C330: 1.0700000000000001 | D330: 7.54 | E330: 7.93 | F330: 8.16 | H330: 7.37 | AO330: 不宜入场(当前股价小于200日均线，应持续观察3w) | AP330: 44598 | AQ330: 是
A331: 603908.SH | B331: 牧高笛 | C331: 1.0700000000000001 | D331: 33.450000000000003 | E331: 35.409999999999997 | F331: 40.869999999999997 | H331: 41 | I331: 18.239999999999998 | J331: 49.5 | K331: 30.699999999999999 | L331: =(H331-I331)/I331 -> 1.2478070175438598 | M331: =(J331-H331)/J331 -> 0.17171717171717171 | N331: =(J331-K331)/K331 -> 0.6123778501628665 | Q331: 39.68 | AB331: 2w | AC331: =(J331-Q331)/J331 -> 0.19838383838383838 | AO331: 不宜入场(当前股价小于50日均线，应持续观察1w) | AP331: 44608 | AQ331: 是
A332: 605100.SH | B332: 华丰股份 | C332: 1.0700000000000001 | AQ332: 否
A333: 002311.SZ | B333: 海大集团 | C333: 1.0600000000000001 | AQ333: 否
A334: 002993.SZ | B334: 奥海科技 | C334: 1.0600000000000001 | AQ334: 否
A335: 603380.SH | B335: 易德龙 | C335: 1.0600000000000001 | D335: 31.670000000000002 | E335: 33.259999999999998 | F335: 37.859999999999999 | H335: 36.43 | AO335: 不宜入场(当前股价小于50日均线，应观察1w) | AP335: 44586 | AQ335: 是
A336: 603535.SH | B336: 嘉诚国际 | C336: 1.0600000000000001 | AQ336: 否
A337: 605507.SH | B337: 国邦医药 | C337: 1.0600000000000001 | AQ337: 否
A338: 002595.SZ | B338: 豪迈科技 | C338: 1.05 | AQ338: 否
A339: 600038.SH | B339: 中直股份 | C339: 1.05 | D339: 61.719999999999999 | E339: 63.530000000000001 | F339: 67.329999999999998 | H339: 55.270000000000003 | AO339: 不宜入场(当前股价小于200日均线，应持续观察3w) | AP339: 44598 | AQ339: 是
A340: 002078.SZ | B340: 太阳纸业 | C340: 1.05 | AQ340: 否
A341: 603100.SH | B341: 川仪股份 | C341: 1.05 | D341: 18.210000000000001 | E341: 18.77 | F341: 19.850000000000001 | H341: 16.989999999999998 | AO341: 不宜入场(当前股价小于200日均线，应持续观察3w) | AP341: 44598 | AQ341: 是
A342: 605488.SH | B342: 福莱新材 | C342: 1.05 | AQ342: 否
A343: 603233.SH | B343: 大参林 | C343: 1.04 | AQ343: 否
A344: 603507.SH | B344: 振江股份 | C344: 1.04 | D344: 33.729999999999997 | E344: 35.789999999999999 | F344: 39.359999999999999 | H344: 39.020000000000003 | AO344: 不宜入场(当前股价小于50日均线，应观察1w) | AP344: 44598 | AQ344: 是
A345: 600248.SH | B345: 陕西建工 | C345: 1.03 | D345: 4.74 | E345: 4.78 | F345: 4.88 | H345: 5.24 | I345: 3.55 | J345: 6.56 | K345: 4.64 | L345: =(H345-I345)/I345 -> 0.47605633802816916 | M345: =(J345-H345)/J345 -> 0.20121951219512188 | N345: =(J345-K345)/K345 -> 0.41379310344827586 | Q345: 3.93 | R345: 5.23 | S345: 4.69 | T345: 5.32 | U345: 4.85 | V345: 5.45 | W345: 4.86 | AB345: 11w | AC345: =(J345-Q345)/J345 -> 0.40091463414634143 | AD345: =(R345-S345)/R345 -> 0.10325047801147227 | AE345: =(T345-U345)/T345 -> 8.8345864661654255e-02 | AF345: =(V345-W345)/V345 -> 0.10825688073394492 | AO345: 不宜入场(收缩幅度不够，应观察2w) | AP345: 44598 | AQ345: 是
A346: 000807.SZ | B346: 云铝股份 | C346: 1.03 | AQ346: 否
A347: 000933.SZ | B347: 神火股份 | C347: 1.03 | AQ347: 否
A348: 002039.SZ | B348: 黔源电力 | C348: 1.03 | D348: 17.84 | E348: 18.27 | F348: 19.050000000000001 | H348: 17.760000000000002 | AO348: 不宜入场(当前股价小于200日均线，应观察3w) | AP348: 44598 | AQ348: 是
A349: 002444.SZ | B349: 巨星科技 | C349: 1.02 | AQ349: 否
A350: 002918.SZ | B350: 蒙娜丽莎 | C350: 1.02 | AQ350: 否
A351: 600183.SH | B351: 生益科技 | C351: 1.02 | AQ351: 否
A352: 600660.SH | B352: 福耀玻璃 | C352: 1.02 | AQ352: 否
A353: 001203.SZ | B353: 大中矿业 | C353: 1.01 | AQ353: 否
A354: 001234.SZ | B354: 泰慕士 | C354: 1.01 | D354: 25.25 | E354: 25.68 | F354: 28.52 | H354: 28.100000000000001 | AO354: 不宜入场(当前股价小于50日均线，应观察1w) | AP354: 44598 | AQ354: 是
A355: 002407.SZ | B355: 多氟多 | C355: 1.01 | D355: 42.61 | E355: 44.67 | F355: 44.77 | H355: 42.21 | AO355: 不宜入场(当前股价小于200日均线，应观察3w) | AP355: 44598 | AQ355: 是
A356: 600075.SH | B356: 新疆天业 | C356: 1.01 | AQ356: 否
A357: 600919.SH | B357: 江苏银行 | C357: 1.01 | AQ357: 否
A358: 600997.SH | B358: 开滦股份 | C358: 1.01 | AQ358: 否
A359: 603005.SH | B359: 晶方科技 | C359: 1.01 | AQ359: 否
A360: 603230.SH | B360: 内蒙新华 | C360: 1.01 | D360: 16.78 | E360: 16.96 | F360: 17.77 | H360: 15.1 | AO360: 不宜入场(当前股价小于200日均线，应观察3w) | AP360: 44598 | AQ360: 是
A361: 605358.SH | B361: 立昂微 | C361: 1.01 | D361: 116.04 | E361: 119.29 | F361: 121.15 | H361: 120.21 | O361: 2 | P361: 是 | AO361: 不宜入场(当前股价小于150日均线，应观察2w) | AP361: 44626 | AQ361: 是
A362: 600456.SH | B362: 宝钛股份 | C362: 1.01 | D362: 52.85 | E362: 54.96 | F362: 58.93 | H362: 48.15 | AO362: 不宜入场(当前股价小于200日均线，应观察3w) | AP362: 44598 | AQ362: 是
A363: 603109.SH | B363: 神驰机电 | C363: 1.01 | D363: 26.67 | E363: 27.5 | F363: 29.37 | H363: 31.71 | I363: 18.199999999999999 | J363: 35.68 | K363: 28.17 | L363: =(H363-I363)/I363 -> 0.74230769230769245 | M363: =(J363-H363)/J363 -> 0.11126681614349773 | N363: =(J363-K363)/K363 -> 0.26659566915157962 | O363: 3 | Q363: 26.33 | R363: 30.79 | S363: 28.61 | T363: 32.600000000000001 | U363: 28.78 | AB363: 9w | AC363: =(J363-Q363)/J363 -> 0.26205156950672648 | AD363: =(R363-S363)/R363 -> 7.080220850925624e-02 | AE363: =(T363-U363)/T363 -> 0.11717791411042945 | AO363: 不宜入场(当前股价小于50日均线，应持续观察1w) | AP363: 44608 | AQ363: 是
A364: 000951.SZ | B364: 中国重汽 | C364: 1 | AQ364: 否
A365: 002241.SZ | B365: 歌尔股份 | C365: 1 | D365: 44.33 | E365: 46.34 | F365: 50.42 | H365: 45.65 | AO365: 不宜入场(当前股价小于50日均线，应观察1w) | AP365: 44598 | AQ365: 是
A366: 002493.SZ | B366: 荣盛石化 | C366: 1 | AQ366: 否
A367: 002732.SZ | B367: 燕塘乳业 | C367: 1 | D367: 25.75 | E367: 26.16 | F367: 26.05 | AO367: 不宜入场(50日均线小于150日均线，应观察4w) | AP367: 44598 | AQ367: 是
A368: 000895.SZ | B368: 双汇发展 | C368: 1 | AQ368: 否
A369: 600507.SH | B369: 方大特钢 | C369: 0.98999999999999999 | D369: 7.86 | E369: 7.87 | F369: 8.06 | H369: 8.17 | I369: 5.2000000000000002 | J369: 10.27 | K369: 6.83 | L369: =(H369-I369)/I369 -> 0.57115384615384612 | M369: =(J369-H369)/J369 -> 0.20447906523855888 | N369: =(J369-K369)/K369 -> 0.50366032210834544 | O369: 4 | Q369: 6.5999999999999996 | R369: 8.55 | S369: 7.45 | AB369: 10w | AC369: =(J369-Q369)/J369 -> 0.35735150925024345 | AD369: =(R369-S369)/R369 -> 0.12865497076023397 | AQ369: 否
A370: 002919.SZ | B370: 名臣健康 | C370: 0.98999999999999999 | AQ370: 否
A371: 600535.SH | B371: 天士力 | C371: 0.98999999999999999 | D371: 13.800000000000001 | E371: 13.92 | F371: 14.43 | H371: 13.83 | AO371: 不宜入场(当前股价小于150日均线，应观察2w) | AP371: 44598 | AQ371: 是
A372: 603613.SH | B372: 国联股份 | C372: 0.98999999999999999 | D372: 108.42 | E372: 109.85 | F372: 113.39 | H372: 116.5 | I372: 82.67 | J372: 127.8 | K372: 113.25 | L372: =(H372-I372)/I372 -> 0.40921737026732791 | M372: =(J372-H372)/J372 -> 8.8419405320813757e-02 | N372: =(J372-K372)/K372 -> 0.12847682119205295 | Q372: 98.51 | R372: 122.09999999999999 | S372: 113.81 | AB372: 10w | AC372: =(J372-Q372)/J372 -> 0.22918622848200307 | AD372: =(R372-S372)/R372 -> 6.7895167895167835e-02 | AO372: 不宜入场(收缩幅度不够，应观察2w) | AP372: 44598 | AQ372: 是
A373: 603893.SH | B373: 瑞芯微 | C373: 0.98999999999999999 | D373: 120.40000000000001 | E373: 123.96 | F373: 123.56 | AO373: 不宜入场(50日均线小于150日均线，应观察4w) | AP373: 44598 | AQ373: 是
A374: 605003.SH | B374: 众望布艺 | C374: 0.98999999999999999 | D374: 24.12 | E374: 24.38 | F374: 25.75 | H374: 24.81 | I374: 20.14 | J374: 30 | K374: 22.16 | L374: =(H374-I374)/I374 -> 0.23187686196623625 | M374: =(J374-H374)/J374 -> 0.17300000000000004 | N374: =(J374-K374)/K374 -> 0.35379061371841153 | AO374: 不宜入场(当前股价距离最低点距离过小，应观察1w) | AP374: 44598 | AQ374: 是
A375: 605028.SH | B375: 世茂能源 | C375: 0.98999999999999999 | D375: 23.03 | E375: 23.37 | F375: 23.27 | AO375: 不宜入场(50日均线小于150日均线，应观察4w) | AP375: 44598 | AQ375: 是
A376: 600618.SH | B376: 氯碱化工 | C376: 0.98999999999999999 | D376: 11.59 | E376: 12 | F376: 12.39 | H376: 11.48 | AO376: 不宜入场(当前股价小于200日均线，应观察3w) | AP376: 44598 | AQ376: 是
A377: 603822.SH | B377: 嘉澳环保 | C377: 0.97999999999999998 | D377: 39.469999999999999 | E377: 41.920000000000002 | F377: 46.649999999999999 | H377: 52.960000000000001 | I377: 15.01 | J377: 57 | K377: 41.840000000000003 | L377: =(H377-I377)/I377 -> 2.5283144570286478 | M377: =(J377-H377)/J377 -> 7.0877192982456122e-02 | N377: =(J377-K377)/K377 -> 0.36233269598470352 | O377: 1 | Q377: 39 | R377: 51.82 | S377: 40.109999999999999 | T377: 53.600000000000001 | U377: 46.799999999999997 | AB377: 17w | AC377: =(J377-Q377)/J377 -> 0.31578947368421051 | AD377: =(R377-S377)/R377 -> 0.22597452720957162 | AE377: =(T377-U377)/T377 -> 0.12686567164179113 | AO377: 不宜入场(当前股价小于50日均线，应持续观察1w) | AP377: 44608 | AQ377: 是
A378: 000636.SZ | B378: 风华高科 | C378: 0.97999999999999998 | AQ378: 否
A379: 002636.SZ | B379: 金安国纪 | C379: 0.97999999999999998 | AQ379: 否
A380: 002870.SZ | B380: 香山股份 | C380: 0.97999999999999998 | D380: 32.98 | E380: 34.43 | F380: 37.09 | H380: 33.76 | AO380: 不宜入场(当前股价小于150日均线，应观察2w) | AP380: 44598 | AQ380: 是
A381: 002884.SZ | B381: 凌霄泵业 | C381: 0.97999999999999998 | D381: 22.66 | E381: 23.05 | F381: 24.34 | H381: 24.15 | AO381: 不宜入场(当前股价小于50日均线，应观察1w) | AP381: 44598 | AQ381: 是
A382: 002980.SZ | B382: 华盛昌 | C382: 0.97999999999999998 | AQ382: 否
A383: 600019.SH | B383: 宝钢股份 | C383: 0.97999999999999998 | AQ383: 否
A384: 603939.SH | B384: 益丰药房 | C384: 0.97999999999999998 | AQ384: 否
A385: 605277.SH | B385: 新亚电子 | C385: 0.97999999999999998 | D385: 27.399999999999999 | E385: 28.28 | F385: 30.199999999999999 | H385: 27.21 | AO385: 不宜入场(当前股价小于200日均线，应观察3w) | AP385: 44598 | AQ385: 是
A386: 003005.SZ | B386: 竞业达 | C386: 0.96999999999999997 | AQ386: 否
A387: 000949.SZ | B387: 新乡化纤 | C387: 0.96999999999999997 | AQ387: 否
A388: 603508.SH | B388: 思维列控 | C388: 0.96999999999999997 | D388: 21.71 | E388: 22.09 | F388: 23.04 | H388: 23.76 | I388: 17.82 | J388: 25.66 | K388: 19.39 | L388: =(H388-I388)/I388 -> 0.33333333333333343 | M388: =(J388-H388)/J388 -> 7.4045206547155046e-02 | N388: =(J388-K388)/K388 -> 0.32336255801959768 | O388: 2 | P388: 否 | Q388: 19.88 | R388: 25.45 | S388: 21.52 | T388: 23.54 | U388: 22.100000000000001 | V388: 24.17 | W388: 22.61 | X388: 24.83 | Y388: 23.51 | AB388: 17w | AC388: =(J388-Q388)/J388 -> 0.225253312548714 | AD388: =(R388-S388)/R388 -> 0.15442043222003929 | AE388: =(T388-U388)/T388 -> 6.1172472387425562e-02 | AF388: =(V388-W388)/V388 -> 6.4542821679768395e-02 | AG388: =(X388-Y388)/X388 -> 5.3161498187676071e-02 | AO388: 不宜入场(成交量不符合，应观察1w) | AP388: 44626 | AQ388: 是
A389: 603948.SH | B389: 建业股份 | C389: 0.96999999999999997 | D389: 25.55 | E389: 26.61 | F389: 28.08 | H389: 26.53 | AO389: 不宜入场(当前股价小于150日均线，应观察2w) | AP389: 44598 | AQ389: 是
A390: 600707.SH | B390: 彩虹股份 | C390: 0.96999999999999997 | AQ390: 否
A391: 000959.SZ | B391: 首钢股份 | C391: 0.95999999999999996 | AQ391: 否
A392: 001205.SZ | B392: 盛航股份 | C392: 0.95999999999999996 | D392: 24.91 | E392: 25.03 | F392: 26.58 | H392: 29.45 | I392: 19.82 | J392: 38.32 | K392: 19.82 | L392: =(H392-I392)/I392 -> 0.48587285570131172 | M392: =(J392-H392)/J392 -> 0.23147181628392488 | N392: =(J392-K392)/K392 -> 0.93340060544904135 | O392: 2 | Q392: 19.51 | R392: 33.899999999999999 | S392: 25.74 | AB392: 33w | AC392: =(J392-Q392)/J392 -> 0.490866388308977 | AD392: =(R392-S392)/R392 -> 0.24070796460176994 | AO392: 不宜入场(收缩幅度不够，应观察2w) | AP392: 44598 | AQ392: 是
A393: 001209.SZ | B393: 洪兴股份 | C393: 0.95999999999999996 | AQ393: 否
A394: 003027.SZ | B394: 同兴环保 | C394: 0.95999999999999996 | AQ394: 否
A395: 603008.SH | B395: 喜临门 | C395: 0.95999999999999996 | D395: 29.399999999999999 | E395: 30.050000000000001 | F395: 33.450000000000003 | H395: 37.200000000000003 | I395: 6.1799999999999997 | J395: 40.450000000000003 | K395: 27.010000000000002 | L395: =(H395-I395)/I395 -> 5.0194174757281562 | M395: =(J395-H395)/J395 -> 8.034610630407911e-02 | N395: =(J395-K395)/K395 -> 0.49759348389485375 | Q395: 33.770000000000003 | R395: 37.810000000000002 | S395: 33.609999999999999 | AB395: 2w | AC395: =(J395-Q395)/J395 -> 0.16514215080346104 | AD395: =(R395-S395)/R395 -> 0.11108172441153141 | AJ395: 否 | AK395: 否 | AL395: 否 | AM395: 否 | AO395: 不宜入场(当前股价小于50日均线，应持续观察1w) | AP395: 44608 | AQ395: 是
A396: 603738.SH | B396: 泰晶科技 | C396: 0.95999999999999996 | D396: 46.17 | E396: 49.23 | F396: 54.33 | H396: 51.52 | AO396: 不宜入场(当前股价小于50日均线，应观察1w) | AP396: 44598 | AQ396: 是
A397: 605289.SH | B397: 罗曼股份 | C397: 0.95999999999999996 | D397: 31.98 | E397: 31.899999999999999 | F397: 34.56 | H397: 32.51 | AO397: 不宜入场(当前股价小于50日均线，应观察1w) | AP397: 44599 | AQ397: 是
A398: 600845.SH | B398: 宝信软件 | C398: 0.95999999999999996 | D398: 60.79 | E398: 62.22 | F398: 62.07 | AO398: 不宜入场(50日均线小于150日均线，应观察4w) | AP398: 44598 | AQ398: 是
A399: 000338.SZ | B399: 潍柴动力 | C399: 0.94999999999999996 | AQ399: 否
A400: 001210.SZ | B400: 金房节能 | C400: 0.94999999999999996 | AQ400: 否
A401: 600348.SH | B401: 华阳股份 | C401: 0.94999999999999996 | D401: 9.94 | E401: 10.51 | F401: 11.34 | H401: 10.68 | AO401: 不宜入场(当前股价小于50日均线，应观察1w) | AP401: 44599 | AQ401: 是
A402: 601168.SH | B402: 西部矿业 | C402: 0.94999999999999996 | AQ402: 否
A403: 603127.SH | B403: 昭衍新药 | C403: 0.94999999999999996 | AQ403: 否
A404: 603568.SH | B404: 伟明环保 | C404: 0.94999999999999996 | D404: 28.69 | E404: 29.85 | F404: 32.76 | H404: 31.64 | AO404: 不宜入场(当前股价小于50日均线，应观察1w) | AP404: 44599 | AQ404: 是
A405: 603950.SH | B405: 长源东谷 | C405: 0.94999999999999996 | AQ405: 否
A406: 605208.SH | B406: 永茂泰 | C406: 0.94999999999999996 | AQ406: 否
A407: 605500.SH | B407: 森林包装 | C407: 0.94999999999999996 | AQ407: 否
A408: 002738.SZ | B408: 中矿资源 | C408: 0.94999999999999996 | D408: 53.58 | E408: 56.899999999999999 | F408: 61.75 | H408: 59.71 | AO408: 不宜入场(当前股价小于50日均线，应观察1w) | AP408: 44599 | AQ408: 是
A409: 603801.SH | B409: 志邦家居 | C409: 0.94999999999999996 | AQ409: 否
A410: 000893.SZ | B410: 亚钾国际 | C410: 0.94999999999999996 | D410: 18.699999999999999 | E410: 19.670000000000002 | F410: 22.460000000000001 | H410: 27.449999999999999 | I410: 7.5599999999999996 | J410: 31.5 | K410: 23.079999999999998 | L410: =(H410-I410)/I410 -> 2.6309523809523814 | M410: =(J410-H410)/J410 -> 0.12857142857142859 | N410: =(J410-K410)/K410 -> 0.36481802426343163 | P410: 是 | Q410: 27.100000000000001 | AO410: 不宜入场（收缩幅度不够,应观察2w） | AP410: 44626 | AQ410: 是
A411: 603365.SH | B411: 水星家纺 | C411: 0.93999999999999995 | D411: 15.75 | E411: 15.91 | F411: 16.55 | H411: 16.61 | I411: 11.93 | J411: 18.26 | K411: 15.93 | L411: =(H411-I411)/I411 -> 0.39228834870075441 | M411: =(J411-H411)/J411 -> 9.0361445783132641e-02 | N411: =(J411-K411)/K411 -> 0.14626490897677349 | Q411: 15.98 | R411: 17.38 | S411: 16.48 | AB411: 2w | AC411: =(J411-Q411)/J411 -> 0.12486308871851046 | AD411: =(R411-S411)/R411 -> 5.1783659378596011e-02 | AO411: 不宜入场（收缩幅度不够,应观察1w） | AP411: 44608 | AQ411: 是
A412: 603926.SH | B412: 铁流股份 | C412: 0.93999999999999995 | D412: 15.29 | E412: 15.64 | F412: 16.17 | H412: 15.32 | AO412: 不宜入场(当前股价小于150日均线，应观察2w) | AP412: 44599 | AQ412: 是
A413: 002572.SZ | B413: 索菲亚 | C413: 0.93000000000000005 | AQ413: 否
A414: 600352.SH | B414: 浙江龙盛 | C414: 0.93000000000000005 | AQ414: 否
A415: 000818.SZ | B415: 航锦科技 | C415: 0.93000000000000005 | D415: 32.399999999999999 | E415: 33.54 | F415: 35.33 | H415: 35.74 | I415: 18.15 | J415: 41.76 | K415: 28.600000000000001 | L415: =(H415-I415)/I415 -> 0.96914600550964214 | M415: =(J415-H415)/J415 -> 0.14415708812260528 | N415: =(J415-K415)/K415 -> 0.46013986013986002 | O415: 4 | P415: 是 | AO415: 不宜入场(当前股价小于50日均线，应观察1w) | AP415: 44626 | AQ415: 是
A416: 002818.SZ | B416: 富森美 | C416: 0.93000000000000005 | AQ416: 否
A417: 601939.SH | B417: 建设银行 | C417: 0.93000000000000005 | AQ417: 否
A418: 603458.SH | B418: 勘设股份 | C418: 0.93000000000000005 | D418: 12.09 | E418: 12.18 | F418: 12.93 | H418: 15.92 | I418: 9.78 | J418: 15.97 | K418: 12.08 | L418: =(H418-I418)/I418 -> 0.62781186094069541 | M418: =(J418-H418)/J418 -> 3.1308703819662308e-03 | N418: =(J418-K418)/K418 -> 0.32201986754966894 | Q418: 15 | AB418: 2w | AC418: =(J418-Q418)/J418 -> 6.0738885410144057e-02 | AO418: 不宜入场（收缩幅度不够,应观察1w） | AP418: 44608 | AQ418: 是
A419: 603466.SH | B419: 风语筑 | C419: 0.93000000000000005 | D419: 20.15 | E419: 21.32 | F419: 26.27 | H419: 26.97 | I419: 12.77 | J419: 35.03 | K419: 19.54 | L419: =(H419-I419)/I419 -> 1.1119812059514487 | M419: =(J419-H419)/J419 -> 0.23008849557522129 | N419: =(J419-K419)/K419 -> 0.79273285568065521 | Q419: 26.5 | AB419: 2w | AC419: =(J419-Q419)/J419 -> 0.24350556665715103 | AO419: 不宜入场（收缩幅度不够,应观察2w） | AP419: 44599 | AQ419: 是
A420: 605337.SH | B420: 李子园 | C420: 0.93000000000000005 | D420: 42.97 | E420: 43.79 | F420: 43.84 | H420: 38.200000000000003 | AO420: 不宜入场(当前股价小于200日均线，应观察3w) | AP420: 44599 | AQ420: 是
A421: 000977.SZ | B421: 浪潮信息 | C421: 0.93000000000000005 | D421: 31.16 | E421: 31.93 | F421: 34.12 | H421: 30.82 | AO421: 不宜入场(当前股价小于200日均线，应观察3w) | AP421: 44599 | AQ421: 是
A422: 003041.SZ | B422: 真爱美家 | C422: 0.92000000000000004 | AQ422: 否
A423: 000761.SZ | B423: 本钢板材 | C423: 0.92000000000000004 | AQ423: 否
A424: 002867.SZ | B424: 周大生 | C424: 0.92000000000000004 | AQ424: 否
A425: 601668.SH | B425: 中国建筑 | C425: 0.92000000000000004 | D425: 4.89 | E425: 4.91 | F425: 5.08 | H425: 5.48 | I425: 4.38 | J425: 5.52 | K425: 4.7000000000000002 | L425: =(H425-I425)/I425 -> 0.25114155251141568 | M425: =(J425-H425)/J425 -> 7.2463768115940486e-03 | N425: =(J425-K425)/K425 -> 0.17446808510638284 | Q425: 5.2000000000000002 | AB425: 1w | AC425: =(J425-Q425)/J425 -> 5.797101449275352e-02 | AO425: 不宜入场（收缩幅度不够,应观察2w） | AP425: 44608 | AQ425: 是
A426: 603538.SH | B426: 美诺华 | C426: 0.92000000000000004 | AQ426: 否
A427: 603639.SH | B427: 海利尔 | C427: 0.92000000000000004 | D427: 20.79 | E427: 21.43 | F427: 23.73 | H427: 23.600000000000001 | AO427: 不宜入场(当前股价小于50日均线，应观察1w) | AP427: 44599 | AQ427: 是
A428: 002798.SZ | B428: 帝欧家居 | C428: 0.92000000000000004 | AQ428: 否
A429: 002129.SZ | B429: 中环股份 | C429: 0.91000000000000003 | D429: 40.78 | E429: 41.92 | F429: 42.12 | H429: 43.68 | I429: 22.42 | J429: 56.24 | K429: 36.91 | L429: =(H429-I429)/I429 -> 0.94826048171275634 | M429: =(J429-H429)/J429 -> 0.22332859174964442 | N429: =(J429-K429)/K429 -> 0.52370631265239787 | Q429: 37.48 | AB429: 20w | AC429: =(J429-Q429)/J429 -> 0.33357041251778102 | AO429: 不宜入场（收缩幅度不够,应观察2w） | AP429: 44616 | AQ429: 是
A430: 002023.SZ | B430: 海特高新 | C430: 0.91000000000000003 | AQ430: 否
A431: 002025.SZ | B431: 航天电器 | C431: 0.91000000000000003 | D431: 65.28 | E431: 67.71 | F431: 72.23 | H431: 65.5 | AO431: 不宜入场(当前股价小于150日均线，应观察2w) | AP431: 44599 | AQ431: 是
A432: 002462.SZ | B432: 嘉事堂 | C432: 0.91000000000000003 | D432: 13.1 | E432: 13.09 | AO432: 不宜入场(150日均线小于200日均线，应观察6w) | AP432: 44599 | AQ432: 是
A433: 002853.SZ | B433: 皮阿诺 | C433: 0.91000000000000003 | AQ433: 否
A434: 600835.SH | B434: 上海机电 | C434: 0.91000000000000003 | AQ434: 否
A435: 600837.SH | B435: 海通证券 | C435: 0.91000000000000003 | D435: 11.86 | E435: 11.98 | F435: 12.11 | H435: 11.6 | AO435: 不宜入场(当前股价小于200日均线，应观察3w) | AP435: 44599 | AQ435: 是
A436: 600999.SH | B436: 招商证券 | C436: 0.91000000000000003 | AQ436: 否
A437: 605338.SH | B437: 巴比食品 | C437: 0.91000000000000003 | AQ437: 否
A438: 000990.SZ | B438: 诚志股份 | C438: 0.91000000000000003 | D438: 14.84 | E438: 14.96 | F438: 14.85 | AO438: 不宜入场(50日均线小于150日均线，应观察4w) | AP438: 44599 | AQ438: 是
A439: 601717.SH | B439: 郑煤机 | C439: 0.91000000000000003 | D439: 11.65 | E439: 11.699999999999999 | F439: 11.89 | H439: 12.02 | I439: 9.17 | J439: 16.33 | K439: 10.11 | L439: =(H439-I439)/I439 -> 0.31079607415485272 | M439: =(J439-H439)/J439 -> 0.26393141457440289 | N439: =(J439-K439)/K439 -> 0.61523244312561809 | AO439: 不宜入场(当前股价距离最高点距离过大，应观察1w) | AP439: 44599 | AQ439: 是
A440: 601003.SH | B440: 柳钢股份 | C440: 0.90000000000000002 | AQ440: 否
A441: 603520.SH | B441: 司太立 | C441: 0.90000000000000002 | AQ441: 否
A442: 603596.SH | B442: 伯特利 | C442: 0.90000000000000002 | D442: 53.87 | E442: 58.07 | F442: 70.74 | H442: 72.89 | I442: 26.48 | J442: 89.63 | K442: 63.69 | L442: =(H442-I442)/I442 -> 1.7526435045317219 | M442: =(J442-H442)/J442 -> 0.18676782327345751 | N442: =(J442-K442)/K442 -> 0.40728528811430365 | O442: 2 | P442: 是 | Q442: 64.74 | R442: 81.900000000000006 | S442: 72.099999999999994 | T442: 82.58 | U442: 74.81 | AB442: 1w | AC442: =(J442-Q442)/J442 -> 0.27769719959834877 | AD442: =(R442-S442)/R442 -> 0.11965811965811979 | AE442: =(T442-U442)/T442 -> 9.4090578832647084e-02 | AO442: 不宜入场（收缩幅度不够,应观察2w） | AP442: 44608 | AQ442: 是
A443: 603610.SH | B443: 麒盛科技 | C443: 0.90000000000000002 | D443: 23.12 | E443: 23.66 | F443: 23.600000000000001 | P443: 是 | AO443: 不宜入场(50日均线小于150日均线，应观察3w) | AP443: 44626 | AQ443: 是
A444: 605006.SH | B444: 山东玻纤 | C444: 0.90000000000000002 | P444: 是 | AO444: 不宜入场(150日均线小于200日均线，应观察6w) | AP444: 44626 | AQ444: 否
A445: 603989.SH | B445: 艾华集团 | C445: 0.90000000000000002 | D445: 35.25 | E445: 36.03 | F445: 37.32 | H445: 34.35 | AO445: 不宜入场(当前股价小于200日均线，应观察3w) | AP445: 44599 | AQ445: 是
A446: 002920.SZ | B446: 德赛西威 | C446: 0.89000000000000001 | D446: 114.88 | E446: 119.51 | F446: 136.99 | H446: 137.74 | I446: 69.900000000000006 | J446: 165.5 | K446: 97.85 | L446: =(H446-I446)/I446 -> 0.97052932761087263 | M446: =(J446-H446)/J446 -> 0.16773413897280962 | N446: =(J446-K446)/K446 -> 0.69136433316300472 | Q446: 125.71 | R446: 158.99 | S446: 136 | AB446: 1w | AC446: =(J446-Q446)/J446 -> 0.24042296072507557 | AD446: =(R446-S446)/R446 -> 0.14460028932637278 | AO446: 不宜入场(当前股价小于50日均线，应持续观察1w) | AP446: 44608 | AQ446: 是
A447: 601066.SH | B447: 中信建投 | C447: 0.89000000000000001 | AQ447: 否
A448: 601898.SH | B448: 中煤能源 | C448: 0.89000000000000001 | AQ448: 否
A449: 603013.SH | B449: 亚普股份 | C449: 0.89000000000000001 | D449: 15.43 | E449: 15.72 | F449: 16.26 | H449: 14.91 | AO449: 不宜入场(当前股价小于200日均线，应观察3w) | AP449: 44599 | AQ449: 是
A450: 603855.SH | B450: 华荣股份 | C450: 0.89000000000000001 | D450: 22.29 | E450: 22.99 | F450: 25.25 | H450: 26.12 | I450: 13.5 | J450: 28.34 | K450: 24.52 | L450: =(H450-I450)/I450 -> 0.93481481481481488 | M450: =(J450-H450)/J450 -> 7.833450952717004e-02 | N450: =(J450-K450)/K450 -> 0.15579119086460033 | O450: 3 | Q450: 22.93 | AB450: 2w | AC450: =(J450-Q450)/J450 -> 0.19089625970359916 | AD450: =(R450-S450)/R450 -> #DIV/0! | AJ450: 否 | AK450: 是 | AM450: 否 | AO450: 不宜入场(当前股价小于50日均线，应持续观察1w) | AP450: 44608 | AQ450: 是
A451: 000906.SZ | B451: 浙商中拓 | C451: 0.88 | D451: 10.58 | E451: 10.84 | F451: 11.28 | H451: 11.62 | I451: 5.5999999999999996 | J451: 13.75 | K451: 8.35 | L451: =(H451-I451)/I451 -> 1.075 | M451: =(J451-H451)/J451 -> 0.15490909090909097 | N451: =(J451-K451)/K451 -> 0.64670658682634741 | Q451: 9.43 | R451: 11.35 | S451: 10.18 | T451: 12.47 | U451: 11.1 | AB451: 1w | AC451: =(J451-Q451)/J451 -> 0.31418181818181823 | AD451: =(R451-S451)/R451 -> 0.10308370044052863 | AE451: =(T451-U451)/T451 -> 0.10986367281475548 | AO451: 不宜入场（收缩幅度不够,应观察2w） | AP451: 44599 | AQ451: 是
A452: 000910.SZ | B452: 大亚圣象 | C452: 0.88 | AQ452: 否
A453: 002984.SZ | B453: 森麒麟 | C453: 0.88 | AQ453: 否
A454: 003019.SZ | B454: 宸展光电 | C454: 0.88 | D454: 28.01 | E454: 28.08 | F454: 28.73 | H454: 27.84 | AO454: 不宜入场(当前股价小于200日均线，应观察3w) | AP454: 44599 | AQ454: 是
A455: 600500.SH | B455: 中化国际 | C455: 0.88 | D455: 7.98 | E455: 8.21 | F455: 8.23 | H455: 7.81 | AO455: 不宜入场(当前股价小于200日均线，应观察3w) | AP455: 44599 | AQ455: 是
A456: 600546.SH | B456: 山煤国际 | C456: 0.88 | D456: 8.5999999999999996 | E456: 8.81 | F456: 8.95 | H456: 9.61 | I456: 5.65 | J456: 15.18 | K456: 7.33 | L456: =(H456-I456)/I456 -> 0.70088495575221221 | M456: =(J456-H456)/J456 -> 0.36693017127799737 | N456: =(J456-K456)/K456 -> 1.0709413369713505 | AO456: 不宜入场(当前股价距离最高点距离过大，应观察2w) | AP456: 44599 | AQ456: 是
A457: 603611.SH | B457: 诺力股份 | C457: 0.88 | D457: 17.38 | E457: 18.02 | F457: 19.02 | H457: 17.81 | AO457: 不宜入场(当前股价小于150日均线，应观察2w) | AP457: 44599 | AQ457: 是
A458: 600586.SH | B458: 金晶科技 | C458: 0.87 | AQ458: 否
A459: 600111.SH | B459: 北方稀土 | C459: 0.87 | D459: 41.32 | E459: 43.310000000000002 | F459: 45.380000000000003 | H459: 45.950000000000003 | I459: 12.210000000000001 | J459: 62.100000000000001 | K459: 33.07 | L459: =(H459-I459)/I459 -> 2.7633087633087632 | M459: =(J459-H459)/J459 -> 0.26006441223832527 | N459: =(J459-K459)/K459 -> 0.87783489567583917 | O459: 2 | P459: 是 | Q459: 37.07 | AB459: 19w | AC459: =(J459-Q459)/J459 -> 0.40305958132045089 | AO459: 不宜入场（当前股价小于50日均线,应观察2w） | AP459: 44626 | AQ459: 是
A460: 603590.SH | B460: 康辰药业 | C460: 0.87 | AQ460: 否
A461: 002242.SZ | B461: 九阳股份 | C461: 0.87 | AQ461: 否
A462: 600015.SH | B462: 华夏银行 | C462: 0.87 | AQ462: 否
A463: 600325.SH | B463: 华发股份 | C463: 0.87 | D463: 5.92 | E463: 5.93 | F463: 6.0999999999999996 | H463: 6.58 | I463: 5.13 | J463: 7.24 | K463: 6.2999999999999998 | L463: =(H463-I463)/I463 -> 0.28265107212475638 | M463: =(J463-H463)/J463 -> 9.1160220994475155e-02 | N463: =(J463-K463)/K463 -> 0.14920634920634926 | Q463: 5.13 | AB463: 19w | AC463: =(J463-Q463)/J463 -> 0.29143646408839785 | AO463: 不宜入场（收缩幅度不够,应观察2w） | AP463: 44599 | AQ463: 是
A464: 600606.SH | B464: 绿地控股 | C464: 0.87 | AQ464: 否
A465: 601825.SH | B465: 沪农商行 | C465: 0.87 | AQ465: 否
A466: 603916.SH | B466: 苏博特 | C466: 0.87 | D466: 22.36 | E466: 22.45 | F466: 24.31 | H466: 25.81 | I466: 16.18 | J466: 29.31 | K466: 21.95 | L466: =(H466-I466)/I466 -> 0.59517923362175518 | M466: =(J466-H466)/J466 -> 0.11941316956670078 | N466: =(J466-K466)/K466 -> 0.33530751708428247 | Q466: 23.47 | AB466: 1w | AC466: =(J466-Q466)/J466 -> 0.19924940293415216 | AO466: 不宜入场（收缩幅度不够,应观察1w） | AP466: 44608 | AQ466: 是
A467: 603871.SH | B467: 嘉友国际 | C467: 0.87 | D467: 18.600000000000001 | E467: 19.12 | F467: 20.75 | H467: 20.46 | AO467: 不宜入场（当前股价小于50日均线,应观察1w） | AP467: 44599 | AQ467: 是
A468: 600273.SH | B468: 嘉化能源 | C468: 0.85999999999999999 | D468: 10.19 | E468: 10.34 | F468: 10.69 | H468: 10.68 | AO468: 不宜入场（当前股价小于50日均线,应观察1w） | AP468: 44599 | AQ468: 是
A469: 600900.SH | B469: 长江电力 | C469: 0.85999999999999999 | D469: 20.79 | E469: 20.99 | F469: 21.92 | H469: 22.39 | I469: 17.800000000000001 | J469: 23.52 | K469: 19.99 | L469: =(H469-I469)/I469 -> 0.25786516853932584 | M469: =(J469-H469)/J469 -> 4.8044217687074786e-02 | N469: =(J469-K469)/K469 -> 0.17658829414707361 | Q469: 21.899999999999999 | AB469: 1w | AC469: =(J469-Q469)/J469 -> 6.8877551020408212e-02 | AO469: 不宜入场（收缩幅度不够,应观察2w） | AP469: 44608 | AQ469: 是
A470: 001215.SZ | B470: 千味央厨 | C470: 0.85999999999999999 | D470: 45.420000000000002 | E470: 49.18 | F470: 56.549999999999997 | H470: 49.920000000000002 | AO470: 不宜入场（当前股价小于50日均线,应观察1w） | AP470: 44599 | AQ470: 是
A471: 600177.SH | B471: 雅戈尔 | C471: 0.85999999999999999 | AQ471: 否
A472: 600329.SH | B472: 中新药业 | C472: 0.85999999999999999 | D472: 25.84 | E472: 26.49 | F472: 27.800000000000001 | H472: 25.71 | AO472: 不宜入场(当前股价小于200日均线，应观察3w) | AP472: 44599 | AQ472: 是
A473: 600508.SH | B473: 上海能源 | C473: 0.85999999999999999 | AQ473: 否
A474: 601800.SH | B474: 中国交建 | C474: 0.85999999999999999 | D474: 7.69 | E474: 7.87 | F474: 8.59 | H474: 10.84 | I474: 6.11 | J474: 11.300000000000001 | K474: 8.04 | L474: =(H474-I474)/I474 -> 0.77414075286415696 | M474: =(J474-H474)/J474 -> 4.0707964601769987e-02 | N474: =(J474-K474)/K474 -> 0.40547263681592066 | Q474: 10.08 | AB474: 18w | AC474: =(J474-Q474)/J474 -> 0.10796460176991156 | AD474: =(R474-S474)/R474 -> #DIV/0! | AE474: =(T474-U474)/T474 -> #DIV/0! | AO474: 不宜入场（收缩幅度不够,应观察2w） | AP474: 44608 | AQ474: 是
A475: 603283.SH | B475: 赛腾股份 | C475: 0.85999999999999999 | D475: 26.42 | E475: 26.74 | F475: 27.100000000000001 | H475: 24.24 | AO475: 不宜入场(当前股价小于200日均线，应观察3w) | AP475: 44599 | AQ475: 是
A476: 605068.SH | B476: 明新旭腾 | C476: 0.85999999999999999 | D476: 33.96 | E476: 34.21 | F476: 35.37 | H476: 34.24 | AO476: 不宜入场(当前股价小于50日均线，应观察1w) | AP476: 44599 | AQ476: 是
A477: 002208.SZ | B477: 合肥城建 | C477: 0.85999999999999999 | D477: 7.78 | E477: 7.85 | F477: 8.12 | H477: 8.99 | I477: 6.94 | J477: 10.39 | K477: 8.03 | L477: =(H477-I477)/I477 -> 0.29538904899135443 | M477: =(J477-H477)/J477 -> 0.13474494706448512 | N477: =(J477-K477)/K477 -> 0.293897882938979 | Q477: 6.94 | R477: 10.01 | S477: 7.85 | AB477: 19w | AC477: =(J477-Q477)/J477 -> 0.33205004812319538 | AD477: =(R477-S477)/R477 -> 0.2157842157842158 | AO477: 不宜入场（收缩幅度不够,应观察2w） | AP477: 44599 | AQ477: 是
A478: 002864.SZ | B478: 盘龙药业 | C478: 0.84999999999999998 | D478: 25.12 | E478: 25.58 | F478: 27.62 | H478: 25.35 | AO478: 不宜入场(当前股价小于150日均线，应观察2w) | AP478: 44599 | AQ478: 是
A479: 600062.SH | B479: 华润双鹤 | C479: 0.84999999999999998 | D479: 11.95 | E479: 12.08 | F479: 12.54 | H479: 12.05 | AO479: 不宜入场(当前股价小于150日均线，应观察2w) | AP479: 44599 | AQ479: 是
A480: 000935.SZ | B480: 四川双马 | C480: 0.84999999999999998 | D480: 20.07 | E480: 21.03 | F480: 23.37 | H480: 23.45 | I480: 12.199999999999999 | J480: 29.800000000000001 | K480: 16.34 | L480: =(H480-I480)/I480 -> 0.92213114754098369 | M480: =(J480-H480)/J480 -> 0.2130872483221477 | N480: =(J480-K480)/K480 -> 0.82374541003671975 | Q480: 17.35 | R480: 23.49 | S480: 19.31 | T480: 26.59 | U480: 21.699999999999999 | AB480: 19w | AC480: =(J480-Q480)/J480 -> 0.41778523489932884 | AD480: =(R480-S480)/R480 -> 0.17794806300553426 | AE480: =(T480-U480)/T480 -> 0.18390372320421214 | AO480: 不宜入场(当前股价小于50日均线，应持续观察1w) | AP480: 44608 | AQ480: 是
A481: 002594.SZ | B481: 比亚迪 | C481: 0.84999999999999998 | D481: 252.55 | E481: 261.45 | F481: 266.19999999999999 | H481: 244.40000000000001 | AO481: 不宜入场(当前股价小于200日均线，应观察3w) | AP481: 44599 | AQ481: 是
A482: 002832.SZ | B482: 比音勒芬 | C482: 0.84999999999999998 | D482: 23.88 | E482: 24.300000000000001 | F482: 24.58 | H482: 24.46 | AO482: 不宜入场(当前股价小于50日均线，应观察1w) | AP482: 44599 | AQ482: 是
A483: 600993.SH | B483: 马应龙 | C483: 0.84999999999999998 | D483: 24.5 | E483: 25.07 | F483: 25.35 | H483: 22.25 | AO483: 不宜入场(当前股价小于200日均线，应观察3w) | AP483: 44599 | AQ483: 是
A484: 603192.SH | B484: 汇得科技 | C484: 0.84999999999999998 | D484: 34.34 | E484: 36.74 | F484: 44.91 | H484: 39.600000000000001 | AO484: 不宜入场(当前股价小于50日均线，应观察1w) | AP484: 44599 | AQ484: 是
A485: 603298.SH | B485: 杭叉集团 | C485: 0.84999999999999998 | AQ485: 否
A486: 600808.SH | B486: 马钢股份 | C486: 0.84999999999999998 | AQ486: 否
A487: 002585.SZ | B487: 双星新材 | C487: 0.83999999999999997 | D487: 22.69 | E487: 23.97 | F487: 25.97 | H487: 24.5 | I487: 8.43 | J487: 30.37 | K487: 25.04 | L487: =(H487-I487)/I487 -> 1.9062870699881378 | M487: =(J487-H487)/J487 -> 0.19328284491274286 | N487: =(J487-K487)/K487 -> 0.21285942492012788 | Q487: 23.21 | AB487: 1w | AC487: =(J487-Q487)/J487 -> 0.23575897267039841 | AO487: 不宜入场（收缩幅度不够,应观察1w） | AP487: 44599 | AQ487: 是
A488: 002169.SZ | B488: 智光电气 | C488: 0.83999999999999997 | D488: 11.02 | E488: 11.31 | F488: 11.32 | H488: 9.93 | AO488: 不宜入场(当前股价小于200日均线，应观察3w) | AP488: 44599 | AQ488: 是
A489: 000703.SZ | B489: 恒逸石化 | C489: 0.83999999999999997 | AQ489: 否
A490: 000902.SZ | B490: 新洋丰 | C490: 0.83999999999999997 | AQ490: 否
A491: 002986.SZ | B491: 宇新股份 | C491: 0.83999999999999997 | D491: 35.42 | E491: 36.31 | F491: 37.100000000000001 | H491: 38.12 | I491: 21.36 | J491: 49.100000000000001 | K491: 26.03 | L491: =(H491-I491)/I491 -> 0.78464419475655423 | M491: =(J491-H491)/J491 -> 0.22362525458248481 | N491: =(J491-K491)/K491 -> 0.88628505570495575 | O491: 4 | P491: 是 | Q491: 33.25 | R491: 47.799999999999997 | S491: 33.299999999999997 | T491: 41.399999999999999 | U491: 37.600000000000001 | AB491: 19w | AC491: =(J491-Q491)/J491 -> 0.32281059063136458 | AD491: =(R491-S491)/R491 -> 0.30334728033472808 | AE491: =(T491-U491)/T491 -> 9.1787439613526506e-02 | AO491: 不宜入场(当前股价小于50日均线，应观察1w) | AP491: 44626 | AQ491: 是
A492: 601169.SH | B492: 北京银行 | C492: 0.83999999999999997 | D492: 4.46 | E492: 4.46 | F492: 4.49 | H492: 4.57 | I492: 4.25 | J492: 4.69 | K492: 4.47 | L492: =(H492-I492)/I492 -> 7.5294117647058886e-02 | M492: =(J492-H492)/J492 -> 2.558635394456292e-02 | N492: =(J492-K492)/K492 -> 4.9217002237136612e-02 | Q492: 4.25 | AO492: 不宜入场(当前股价距离最低点距离太小，应观察4w) | AP492: 44599 | AQ492: 是
A493: 603228.SH | B493: 景旺电子 | C493: 0.83999999999999997 | D493: 28.76 | E493: 29.27 | F493: 31.800000000000001 | H493: 34.32 | I493: 23.11 | J493: 35.63 | K493: 29.300000000000001 | L493: =(H493-I493)/I493 -> 0.48507139766334922 | M493: =(J493-H493)/J493 -> 3.6766769576199891e-02 | N493: =(J493-K493)/K493 -> 0.21604095563139938 | Q493: 32.899999999999999 | AB493: 1w | AC493: =(J493-Q493)/J493 -> 7.6620825147347846e-02 | AO493: 不宜入场(当前股价小于50日均线，应持续观察1w) | AP493: 44608 | AQ493: 是
A494: 000498.SZ | B494: 山东路桥 | C494: 0.82999999999999996 | D494: 6.41 | E494: 6.52 | F494: 7.03 | H494: 9.22 | I494: 4.48 | J494: 9.22 | K494: 6.19 | L494: =(H494-I494)/I494 -> 1.0580357142857142 | M494: =(J494-H494)/J494 -> 0 | N494: =(J494-K494)/K494 -> 0.48949919224555738 | AO494: 不宜入场（收缩幅度不够,应观察2w） | AP494: 44599 | AQ494: 是
A495: 002459.SZ | B495: 晶澳科技 | C495: 0.82999999999999996 | D495: 68.900000000000006 | E495: 74.799999999999997 | F495: 88.299999999999997 | H495: 89.47 | I495: 24.31 | J495: 103 | K495: 56.799999999999997 | L495: =(H495-I495)/I495 -> 2.6803784450843273 | M495: =(J495-H495)/J495 -> 0.13135922330097088 | N495: =(J495-K495)/K495 -> 0.81338028169014098 | Q495: 79.299999999999997 | R495: 98.700000000000003 | S495: 85.75 | AB495: 9w | AC495: =(J495-Q495)/J495 -> 0.23009708737864079 | AD495: =(R495-S495)/R495 -> 0.13120567375886527 | AO495: 不宜入场(当前股价小于50日均线，应持续观察1w) | AP495: 44608 | AQ495: 是
A496: 002961.SZ | B496: 瑞达期货 | C496: 0.82999999999999996 | D496: 23.16 | E496: 23.38 | F496: 23.32 | AO496: 不宜入场(50日均线小于150日均线，应观察4w) | AP496: 44599 | AQ496: 是
A497: 002987.SZ | B497: 京北方 | C497: 0.82999999999999996 | D497: 32.37 | E497: 32.37 | F497: 35.71 | H497: 39.25 | I497: 23.899999999999999 | J497: 48.69 | K497: 28.89 | L497: =(H497-I497)/I497 -> 0.64225941422594157 | M497: =(J497-H497)/J497 -> 0.19387964674471139 | N497: =(J497-K497)/K497 -> 0.68535825545171325 | Q497: 38 | AB497: 1w | AC497: =(J497-Q497)/J497 -> 0.21955226945984799 | AO497: 不宜入场（收缩幅度不够,应观察2w） | AP497: 44599 | AQ497: 是
A498: 002991.SZ | B498: 甘源食品 | C498: 0.82999999999999996 | D498: 64.75 | E498: 63.55 | AO498: 不宜入场(150日均线小于200日均线，应观察6w) | AP498: 44599 | AQ498: 是
A499: 601998.SH | B499: 中信银行 | C499: 0.82999999999999996 | AQ499: 否
A500: 603187.SH | B500: 海容冷链 | C500: 0.82999999999999996 | D500: 40.95 | E500: 41.45 | F500: 41.700000000000003 | H500: 37.92 | AO500: 不宜入场(当前股价小于200日均线，应观察3w) | AP500: 44599 | AQ500: 是
A501: 603355.SH | B501: 莱克电气 | C501: 0.82999999999999996 | D501: 28.55 | E501: 28.67 | F501: 28.38 | AO501: 不宜入场(50日均线小于200日均线，应观察5w) | AP501: 44600 | AQ501: 否
A502: 603515.SH | B502: 欧普照明 | C502: 0.82999999999999996 | D502: 22.74 | E502: 22 | AO502: 不宜入场(150日均线小于200日均线，应观察6w) | AP502: 44600 | AQ502: 否
A503: 605058.SH | B503: 澳弘电子 | C503: 0.82999999999999996 | D503: 24.34 | E503: 24.41 | F503: 24.68 | H503: 23.68 | AO503: 不宜入场(当前股价小于200日均线，应观察3w) | AP503: 44600 | AQ503: 是
A504: 002757.SZ | B504: 南兴股份 | C504: 0.82999999999999996 | D504: 14.56 | E504: 14.63 | F504: 14.77 | H504: 14.48 | AO504: 不宜入场(当前股价小于200日均线，应观察3w) | AP504: 44600 | AQ504: 是
A505: 002396.SZ | B505: 星网锐捷 | C505: 0.82999999999999996 | D505: 23.49 | E505: 23.84 | F505: 24.06 | H505: 23.23 | AO505: 不宜入场(当前股价小于200日均线，应观察3w) | AP505: 44600 | AQ505: 是
A506: 001219.SZ | B506: 青岛食品 | C506: 0.81999999999999995 | D506: 28.21 | E506: 28.88 | F506: 30.800000000000001 | H506: 27.38 | AO506: 不宜入场(当前股价小于200日均线，应观察3w) | AP506: 44600 | AQ506: 是
A507: 003013.SZ | B507: 地铁设计 | C507: 0.81999999999999995 | AQ507: 否
A508: 600548.SH | B508: 深高速 | C508: 0.81999999999999995 | D508: 9.73 | E508: 9.78 | F508: 10.06 | G508: 3 | H508: 10.48 | I508: 7.55 | J508: 11.98 | K508: 8.5999999999999996 | L508: =(H508-I508)/I508 -> 0.38807947019867561 | M508: =(J508-H508)/J508 -> 0.12520868113522537 | N508: =(J508-K508)/K508 -> 0.39302325581395359 | Q508: 9.35 | R508: 10.9 | S508: 9.38 | T508: 10.25 | U508: 9.56 | V508: 10.79 | W508: 10.01 | AB508: 17w | AC508: =(J508-Q508)/J508 -> 0.21953255425709522 | AD508: =(R508-S508)/R508 -> 0.13944954128440362 | AE508: =(T508-U508)/T508 -> 6.7317073170731656e-02 | AF508: =(V508-W508)/V508 -> 7.2289156626505965e-02 | AJ508: 是 | AK508: 是 | AL508: 是 | AM508: 是 | AO508: 可以入场 | AP508: 44617 | AQ508: 是
A509: 603319.SH | B509: 湘油泵 | C509: 0.81999999999999995 | D509: 23.41 | E509: 23.72 | F509: 24.73 | H509: 21.899999999999999 | AO509: 不宜入场(当前股价小于200日均线，应观察3w) | AP509: 44600 | AQ509: 是
A510: 002409.SZ | B510: 雅克科技 | C510: 0.81999999999999995 | AQ510: 否
A511: 002810.SZ | B511: 山东赫达 | C511: 0.81999999999999995 | D511: 49.51 | E511: 51.05 | F511: 54.5 | H511: 48.46 | AO511: 不宜入场(当前股价小于200日均线，应观察3w) | AP511: 44600 | AQ511: 是
A512: 002236.SZ | B512: 大华股份 | C512: 0.81000000000000005 | AQ512: 否
A513: 002408.SZ | B513: 齐翔腾达 | C513: 0.81000000000000005 | D513: 9.47 | E513: 9.8000000000000007 | F513: 10.16 | H513: 9.61 | AO513: 不宜入场(当前股价小于150日均线，应观察2w) | AP513: 44600 | AQ513: 是
A514: 002859.SZ | B514: 洁美科技 | C514: 0.81000000000000005 | D514: 32.11 | E514: 32.55 | F514: 34.09 | H514: 31.94 | AO514: 不宜入场(当前股价小于200日均线，应观察3w) | AP514: 44600 | AQ514: 是
A515: 003038.SZ | B515: 鑫铂股份 | C515: 0.81000000000000005 | D515: 52.850000000000001 | E515: 56.710000000000001 | F515: 69.120000000000005 | H515: 64.5 | AO515: 不宜入场（当前股价小于50日均线,应观察2w） | AP515: 44579 | AQ515: 是
A516: 600097.SH | B516: 开创国际 | C516: 0.81000000000000005 | D516: 10.26 | E516: 10.44 | F516: 10.97 | H516: 11.34 | I516: 8.22 | J516: 12.73 | K516: 10.46 | L516: =(H516-I516)/I516 -> 0.37956204379562031 | M516: =(J516-H516)/J516 -> 0.10919088766692855 | N516: =(J516-K516)/K516 -> 0.21701720841300184 | Q516: 10.199999999999999 | AB516: 2w | AC516: =(J516-Q516)/J516 -> 0.19874312647289874 | AO516: 不宜入场（收缩幅度不够,应观察2w） | AP516: 44600 | AQ516: 是
A517: 603096.SH | B517: 新经典 | C517: 0.81000000000000005 | AQ517: 否
A518: 603359.SH | B518: 东珠生态 | C518: 0.81000000000000005 | D518: 12.65 | E518: 12.93 | F518: 13.92 | H518: 13.42 | AO518: 不宜入场（当前股价小于50日均线,应观察1w） | AP518: 44600 | AQ518: 是
A519: 603700.SH | B519: 宁水集团 | C519: 0.81000000000000005 | AQ519: 否
A520: 000656.SZ | B520: 金科股份 | C520: 0.80000000000000004 | AQ520: 否
A521: 000685.SZ | B521: 中山公用 | C521: 0.80000000000000004 | D521: 8.52 | E521: 8.59 | F521: 8.67 | H521: 8.49 | AO521: 不宜入场（当前股价小于200日均线,应观察3w） | AP521: 44600 | AQ521: 是
A522: 000988.SZ | B522: 华工科技 | C522: 0.80000000000000004 | D522: 26.06 | E522: 26.63 | F522: 26.75 | H522: 24.18 | AO522: 不宜入场（当前股价小于200日均线,应观察3w） | AP522: 44600 | AQ522: 是
A523: 002088.SZ | B523: 鲁阳节能 | C523: 0.80000000000000004 | D523: 19.940000000000001 | E523: 20.960000000000001 | F523: 22.559999999999999 | H523: 20.739999999999998 | AO523: 不宜入场（当前股价小于150日均线,应观察2w） | AP523: 44600 | AQ523: 是
A524: 002555.SZ | B524: 三七互娱 | C524: 0.80000000000000004 | D524: 23.55 | E524: 24.03 | F524: 25.85 | H524: 24.57 | AO524: 不宜入场（当前股价小于50日均线,应观察1w） | AP524: 44600 | AQ524: 是
A525: 002758.SZ | B525: 浙农股份 | C525: 0.80000000000000004 | D525: 10.37 | E525: 10.48 | F525: 11.08 | H525: 11.58 | I525: 8.76 | J525: 12.9 | K525: 10.17 | L525: =(H525-I525)/I525 -> 0.32191780821917815 | M525: =(J525-H525)/J525 -> 0.10232558139534885 | N525: =(J525-K525)/K525 -> 0.26843657817109151 | Q525: 10.5 | AB525: 3w | AC525: =(J525-Q525)/J525 -> 0.186046511627907 | AO525: 不宜入场（收缩幅度不够,应观察1w） | AP525: 44608 | AQ525: 是
A526: 002761.SZ | B526: 浙江建投 | C526: 0.80000000000000004 | AQ526: 否
A527: 601328.SH | B527: 交通银行 | C527: 0.80000000000000004 | D527: 4.59 | E527: 4.5999999999999996 | F527: 4.69 | H527: 4.94 | I527: 4.11 | J527: 4.95 | K527: 4.61 | L527: =(H527-I527)/I527 -> 0.20194647201946472 | M527: =(J527-H527)/J527 -> 2.0202020202019773e-03 | N527: =(J527-K527)/K527 -> 7.3752711496746171e-02 | AO527: 不宜入场（收缩幅度不够,应观察2w） | AP527: 44608 | AQ527: 是
A528: 601865.SH | B528: 福莱特 | C528: 0.80000000000000004 | D528: 43.43 | E528: 43.53 | F528: 49.15 | H528: 46.95 | AO528: 不宜入场（当前股价小于50日均线,应观察1w） | AP528: 44600 | AQ528: 是
A529: 603048.SH | B529: 浙江黎明 | C529: 0.80000000000000004 | D529: 26.38 | E529: 26.62 | F529: 26.73 | H529: 23.27 | AO529: 不宜入场（当前股价小于200日均线,应观察3w） | AP529: 44600 | AQ529: 是
A530: 605099.SH | B530: 共创草坪 | C530: 0.80000000000000004 | AQ530: 否
A531: 000026.SZ | B531: 飞亚达 | C531: 0.80000000000000004 | AQ531: 否
A532: 000898.SZ | B532: 鞍钢股份 | C532: 0.80000000000000004 | AQ532: 否
A533: 003025.SZ | B533: 思进智能 | C533: 0.79000000000000004 | D533: 30.52 | E533: 30.89 | F533: 32.15 | H533: 31.78 | AO533: 不宜入场（当前股价小于50日均线,应观察1w） | AP533: 44600 | AQ533: 是
A534: 003033.SZ | B534: 征和工业 | C534: 0.79000000000000004 | AQ534: 否
A535: 603035.SH | B535: 常熟汽饰 | C535: 0.79000000000000004 | D535: 15 | E535: 15.55 | F535: 17.78 | H535: 17.67 | AO535: 不宜入场（当前股价小于50日均线,应观察1w） | AP535: 44600 | AQ535: 是
A536: 603386.SH | B536: 广东骏亚 | C536: 0.79000000000000004 | D536: 19.84 | E536: 20.22 | F536: 20.600000000000001 | AO536: 不宜入场（50日均线小于150日均线,应观察4w） | AP536: 44600 | AQ536: 是
A537: 603719.SH | B537: 良品铺子 | C537: 0.79000000000000004 | AQ537: 否
A538: 605007.SH | B538: 五洲特纸 | C538: 0.79000000000000004 | D538: 20.28 | E538: 20.13 | AO538: 不宜入场（当前股价小于150日均线,应观察5w） | AP538: 44623 | AQ538: 是
A539: 605020.SH | B539: 永和股份 | C539: 0.79000000000000004 | D539: 27.010000000000002 | E539: 28.789999999999999 | F539: 29.66 | H539: 26.489999999999998 | P539: 是 | AO539: 不宜入场（当前股价小于200日均线,应观察3w） | AP539: 44626 | AQ539: 是
A540: 600529.SH | B540: 山东药玻 | C540: 0.79000000000000004 | D540: 37.21 | E540: 37.34 | F540: 38.02 | H540: 33.52 | AO540: 不宜入场（当前股价小于200日均线,应观察3w） | AP540: 44600 | AQ540: 是
A541: 002774.SZ | B541: 快意电梯 | C541: 0.79000000000000004 | D541: 7.98 | E541: 8.13 | F541: 8.34 | H541: 8.55 | I541: 5.36 | J541: 12.98 | K541: 6.28 | L541: =(H541-I541)/I541 -> 0.59514925373134331 | M541: =(J541-H541)/J541 -> 0.34129429892141755 | N541: =(J541-K541)/K541 -> 1.0668789808917198 | AO541: 不宜入场（当前股价距离最高点距离过大,应观察2w） | AP541: 44600 | AQ541: 是
A542: 603043.SH | B542: 广州酒家 | C542: 0.78000000000000003 | AQ542: 否
A543: 600056.SH | B543: 中国医药 | C543: 0.78000000000000003 | AQ543: 否
A544: 001207.SZ | B544: 联科科技 | C544: 0.78000000000000003 | AQ544: 否
A545: 002539.SZ | B545: 云图控股 | C545: 0.78000000000000003 | D545: 12.44 | E545: 12.88 | F545: 13.31 | H545: 12.93 | AO545: 不宜入场（当前股价小于50日均线,应观察1w） | AP545: 44600 | AQ545: 是
A546: 002940.SZ | B546: 昂利康 | C546: 0.78000000000000003 | D546: 34.07 | E546: 34.27 | F546: 36.35 | H546: 37.65 | I546: 28.52 | J546: 43.25 | K546: 37.15 | L546: =(H546-I546)/I546 -> 0.3201262272089761 | M546: =(J546-H546)/J546 -> 0.12947976878612721 | N546: =(J546-K546)/K546 -> 0.16419919246298792 | Q546: 28.56 | R546: 42.49 | S546: 35.33 | AB546: 30w | AC546: =(J546-Q546)/J546 -> 0.3396531791907515 | AD546: =(R546-S546)/R546 -> 0.16851023770298901 | AO546: 不宜入场（收缩幅度不够,应观察1w） | AP546: 44608 | AQ546: 是
A547: 600216.SH | B547: 浙江医药 | C547: 0.78000000000000003 | D547: 15.96 | E547: 16.16 | F547: 16.23 | H547: 15.35 | AO547: 不宜入场（当前股价小于200日均线,应观察3w） | AP547: 44600 | AQ547: 是
A548: 601678.SH | B548: 滨化股份 | C548: 0.78000000000000003 | D548: 8.05 | E548: 8.19 | F548: 7.82 | AO548: 不宜入场（50日均线小于200日均线,应观察4w） | AP548: 44600 | AQ548: 否
A549: 601900.SH | B549: 南方传媒 | C549: 0.78000000000000003 | D549: 7.69 | E549: 7.76 | F549: 8.12 | H549: 8.35 | I549: 6.7999999999999998 | J549: 9.17 | K549: 7.39 | L549: =(H549-I549)/I549 -> 0.2279411764705882 | M549: =(J549-H549)/J549 -> 8.9422028353326091e-02 | N549: =(J549-K549)/K549 -> 0.24086603518267935 | AO549: 不宜入场（当前股价距离最低点距离过小,应观察1w） | AP549: 44600 | AQ549: 是
A550: 603277.SH | B550: 银都股份 | C550: 0.78000000000000003 | AQ550: 否
A551: 603324.SH | B551: 盛剑环境 | C551: 0.78000000000000003 | D551: 54.51 | E551: 55.78 | F551: 54.35 | AO551: 不宜入场（50日均线小于200日均线,应观察5w） | AP551: 44600 | AQ551: 是
A552: 603722.SH | B552: 阿科力 | C552: 0.78000000000000003 | D552: 47.97 | E552: 49.62 | F552: 52.94 | H552: 53.01 | I552: 23.84 | J552: 60.100000000000001 | K552: 49.63 | L552: =(H552-I552)/I552 -> 1.2235738255033557 | M552: =(J552-H552)/J552 -> 0.11797004991680538 | N552: =(J552-K552)/K552 -> 0.2109611122305057 | Q552: 49.35 | AB552: 2w | AC552: =(J552-Q552)/J552 -> 0.1788685524126456 | AO552: 不宜入场(当前股价小于50日均线，应持续观察1w) | AP552: 44617 | AQ552: 是
A553: 603867.SH | B553: 新化股份 | C553: 0.78000000000000003 | D553: 31.04 | E553: 32 | F553: 33.96 | H553: 33.84 | AO553: 不宜入场（当前股价小于50日均线,应观察1w） | AP553: 44600 | AQ553: 是
A554: 002487.SZ | B554: 大金重工 | C554: 0.78000000000000003 | D554: 26.07 | E554: 29.260000000000002 | F554: 37.229999999999997 | H554: 44.289999999999999 | I554: 6.6500000000000004 | J554: 53.770000000000003 | K554: 21.850000000000001 | L554: =(H554-I554)/I554 -> 5.6601503759398497 | M554: =(J554-H554)/J554 -> 0.17630649060814588 | N554: =(J554-K554)/K554 -> 1.4608695652173913 | Q554: 31.16 | AB554: 12w | AC554: =(J554-Q554)/J554 -> 0.42049469964664316 | AO554: 不宜入场（收缩幅度不够,应观察2w） | AP554: 44600 | AQ554: 是
A555: 600742.SH | B555: 一汽富维 | C555: 0.78000000000000003 | D555: 10.98 | E555: 11.28 | F555: 11.89 | H555: 11.43 | AO555: 不宜入场（当前股价小于50日均线,应观察2w） | AP555: 44600 | AQ555: 是
A556: 000983.SZ | B556: 山西焦煤 | C556: 0.77000000000000002 | D556: 8.4000000000000004 | E556: 8.6999999999999993 | F556: 8.78 | H556: 8.9000000000000004 | I556: 4.42 | J556: 16.71 | K556: 7.39 | L556: =(H556-I556)/I556 -> 1.0135746606334843 | M556: =(J556-H556)/J556 -> 0.46738479952124479 | N556: =(J556-K556)/K556 -> 1.2611637347767255 | AO556: 不宜入场（当前股价距离最高点距离过大,应观察3w） | AP556: 44600 | AQ556: 是
A557: 002873.SZ | B557: 新天药业 | C557: 0.77000000000000002 | D557: 14.87 | E557: 15.61 | F557: 18.78 | H557: 20.65 | I557: 9.74 | J557: 28.17 | K557: 13.05 | L557: =(H557-I557)/I557 -> 1.1201232032854207 | M557: =(J557-H557)/J557 -> 0.26695065672701462 | N557: =(J557-K557)/K557 -> 1.1586206896551725 | Q557: 18.12 | AB557: 4w | AC557: =(J557-Q557)/J557 -> 0.35676251331203407 | AO557: 不宜入场（收缩幅度不够,应观察2w） | AP557: 44608 | AQ557: 是
A558: 601666.SH | B558: 平煤股份 | C558: 0.77000000000000002 | D558: 8.25 | E558: 8.59 | F558: 9.21 | H558: 10.19 | I558: 4.12 | J558: 13.65 | K558: 7.26 | L558: =(H558-I558)/I558 -> 1.4733009708737863 | M558: =(J558-H558)/J558 -> 0.25347985347985352 | N558: =(J558-K558)/K558 -> 0.88016528925619841 | Q558: 7.27 | R558: 10.800000000000001 | S558: 8.81 | T558: 11.8 | U558: 10.54 | AB558: 15w | AC558: =(J558-Q558)/J558 -> 0.46739926739926746 | AD558: =(R558-S558)/R558 -> 0.18425925925925926 | AE558: =(T558-U558)/T558 -> 0.10677966101694927 | AO558: 不宜入场（收缩幅度不够,应观察1w） | AP558: 44608 | AQ558: 是
A559: 001317.SZ | B559: 三羊马 | C559: 0.77000000000000002 | D559: 34.890000000000001 | E559: 38.289999999999999 | F559: 58 | H559: 85.030000000000001 | I559: 19.199999999999999 | J559: 108.63 | K559: 19.199999999999999 | L559: =(H559-I559)/I559 -> 3.4286458333333334 | M559: =(J559-H559)/J559 -> 0.21725121973672093 | N559: =(J559-K559)/K559 -> 4.6578124999999995 | Q559: 72.680000000000007 | AB559: 2w | AC559: =(J559-Q559)/J559 -> 0.33093988769216598 | AO559: 不宜入场（收缩幅度不够,应观察2w） | AP559: 44579 | AQ559: 是
A560: 002989.SZ | B560: 中天精装 | C560: 0.77000000000000002 | AQ560: 否
A561: 003009.SZ | B561: 中天火箭 | C561: 0.77000000000000002 | AQ561: 否
A562: 600007.SH | B562: 中国国贸 | C562: 0.77000000000000002 | P562: 是 | AO562: 不宜入场（150日均线小于200日均线,应观察6w） | AP562: 44626 | AQ562: 否
A563: 600804.SH | B563: 鹏博士 | C563: 0.77000000000000002 | D563: 5.95 | E563: 6.01 | F563: 6.17 | H563: 5.44 | AO563: 不宜入场（当前股价小于200日均线,应观察3w） | AP563: 44600 | AQ563: 是
A564: 601077.SH | B564: 渝农商行 | C564: 0.77000000000000002 | AQ564: 否
A565: 603585.SH | B565: 苏利股份 | C565: 0.77000000000000002 | D565: 16.98 | E565: 17.28 | F565: 18.67 | H565: 20 | I565: 13.72 | J565: 21.36 | K565: 16.899999999999999 | L565: =(H565-I565)/I565 -> 0.45772594752186579 | M565: =(J565-H565)/J565 -> 6.3670411985018702e-02 | N565: =(J565-K565)/K565 -> 0.26390532544378703 | Q565: 18.100000000000001 | AB565: 2w | AC565: =(J565-Q565)/J565 -> 0.15262172284644185 | AO565: 不宜入场(当前股价小于50日均线，应持续观察1w) | AP565: 44608 | AQ565: 是
A566: 603727.SH | B566: 博迈科 | C566: 0.77000000000000002 | AQ566: 否
A567: 000800.SZ | B567: 一汽解放 | C567: 0.77000000000000002 | AQ567: 否
A568: 002760.SZ | B568: 凤形股份 | C568: 0.76000000000000001 | D568: 23.85 | E568: 24.43 | F568: 24.83 | H568: 24.56 | AO568: 不宜入场（当前股价小于50日均线,应观察1w） | AP568: 44600 | AQ568: 是
A569: 002896.SZ | B569: 中大力德 | C569: 0.76000000000000001 | D569: 21.78 | E569: 22.22 | F569: 22.98 | H569: 22.23 | AO569: 不宜入场（当前股价小于50日均线,应观察1w） | AP569: 44600 | AQ569: 是
A570: 003021.SZ | B570: 兆威机电 | C570: 0.76000000000000001 | D570: 65.21 | E570: 67.21 | F570: 69.200000000000003 | H570: 60.600000000000001 | AO570: 不宜入场（当前股价小于200日均线,应观察3w） | AP570: 44600 | AQ570: 是
A571: 600727.SH | B571: 鲁北化工 | C571: 0.76000000000000001 | D571: 9.86 | E571: 10.17 | F571: 10.25 | H571: 10 | AO571: 不宜入场（当前股价小于150日均线,应观察2w） | AP571: 44600 | AQ571: 是
A572: 603115.SH | B572: 海星股份 | C572: 0.76000000000000001 | D572: 21.300000000000001 | E572: 22.41 | F572: 24.41 | H572: 22.65 | P572: 是 | AO572: 不宜入场（当前股价小于50日均线,应观察1w） | AP572: 44623 | AQ572: 是
A573: 603337.SH | B573: 杰克股份 | C573: 0.76000000000000001 | AQ573: 否
A574: 600859.SH | B574: 王府井 | C574: 0.76000000000000001 | AQ574: 否
A575: 000828.SZ | B575: 东莞控股 | C575: 0.76000000000000001 | AQ575: 否
A576: 002995.SZ | B576: 天地在线 | C576: 0.76000000000000001 | AQ576: 否
A577: 002942.SZ | B577: 新农股份 | C577: 0.76000000000000001 | AQ577: 否
A578: 600377.SH | B578: 宁沪高速 | C578: 0.75 | AQ578: 否
A579: 002138.SZ | B579: 顺络电子 | C579: 0.75 | AQ579: 否
A580: 002568.SZ | B580: 百润股份 | C580: 0.75 | AQ580: 否
A581: 002736.SZ | B581: 国信证券 | C581: 0.75 | AQ581: 否
A582: 003011.SZ | B582: 海象新材 | C582: 0.75 | D582: 33.55 | E582: 33.27 | AO582: 不宜入场（150日均线小于200日均线,应观察5w） | AP582: 44600 | AQ582: 是
A583: 600016.SH | B583: 民生银行 | C583: 0.75 | AQ583: 否
A584: 601869.SH | B584: 长飞光纤 | C584: 0.75 | D584: 29.07 | E584: 29.89 | F584: 31.42 | H584: 29.41 | AO584: 不宜入场（当前股价小于150日均线,应观察2w） | AP584: 44600 | AQ584: 是
A585: 603898.SH | B585: 好莱客 | C585: 0.75 | AQ585: 否
A586: 605155.SH | B586: 西大门 | C586: 0.75 | AQ586: 否
A587: 605286.SH | B587: 同力日升 | C587: 0.75 | D587: 28.22 | E587: 28.14 | AO587: 不宜入场（150日均线小于200日均线,应观察5w） | AP587: 44600 | AQ587: 是
A588: 605589.SH | B588: 圣泉集团 | C588: 0.75 | D588: 35.01 | E588: 35.13 | F588: 35.31 | H588: 33.12 | AO588: 不宜入场（当前股价小于200日均线,应观察3w） | AP588: 44600 | AQ588: 是
A589: 002801.SZ | B589: 微光股份 | C589: 0.73999999999999999 | AQ589: 否
A590: 002966.SZ | B590: 苏州银行 | C590: 0.73999999999999999 | AQ590: 否
A591: 600760.SH | B591: 中航沈飞 | C591: 0.73999999999999999 | AQ591: 否
A592: 601512.SH | B592: 中新集团 | C592: 0.73999999999999999 | AQ592: 否
A593: 603305.SH | B593: 旭升股份 | C593: 0.73999999999999999 | D593: 40.27 | E593: 41.83 | F593: 45.75 | H593: 44.02 | AO593: 不宜入场（当前股价小于50日均线,应观察1w） | AP593: 44600 | AQ593: 是
A594: 603686.SH | B594: 福龙马 | C594: 0.73999999999999999 | AQ594: 否
A595: 603915.SH | B595: 国茂股份 | C595: 0.73999999999999999 | AQ595: 否
A596: 605081.SH | B596: 太和水 | C596: 0.73999999999999999 | AQ596: 否
A597: 600409.SH | B597: 三友化工 | C597: 0.73999999999999999 | AQ597: 否
A598: 000090.SZ | B598: 天健集团 | C598: 0.72999999999999998 | D598: 5.63 | E598: 5.64 | F598: 5.9000000000000004 | H598: 6.5 | I598: 4.73 | J598: 6.58 | K598: 5.43 | L598: =(H598-I598)/I598 -> 0.37420718816067639 | M598: =(J598-H598)/J598 -> 1.2158054711246211e-02 | N598: =(J598-K598)/K598 -> 0.21178637200736655 | Q598: 6.46 | AO598: 不宜入场（收缩幅度不够,应观察2w） | AP598: 44608 | AQ598: 是
A599: 002603.SZ | B599: 以岭药业 | C599: 0.72999999999999998 | D599: 18.57 | E599: 18.78 | F599: 20.36 | H599: 23.05 | I599: 14.18 | J599: 27.92 | K599: 16.44 | L599: =(H599-I599)/I599 -> 0.62552891396332877 | M599: =(J599-H599)/J599 -> 0.17442693409742122 | N599: =(J599-K599)/K599 -> 0.69829683698296829 | Q599: 20.17 | AB599: 2w | AC599: =(J599-Q599)/J599 -> 0.27757879656160456 | AO599: 不宜入场（收缩幅度不够,应观察2w） | AP599: 44600 | AQ599: 是
A600: 603626.SH | B600: 科森科技 | C600: 0.72999999999999998 | D600: 10.99 | E600: 11.27 | F600: 11.89 | H600: 10.64 | AO600: 不宜入场（当前股价小于200日均线,应观察3w） | AP600: 44600 | AQ600: 是
A601: 601390.SH | B601: 中国中铁 | C601: 0.72999999999999998 | D601: 5.62 | E601: 5.69 | F601: 6.01 | H601: 6.57 | I601: 4.92 | J601: 6.82 | K601: 5.06 | L601: =(H601-I601)/I601 -> 0.33536585365853666 | M601: =(J601-H601)/J601 -> 3.6656891495601168e-02 | N601: =(J601-K601)/K601 -> 0.3478260869565219 | Q601: 5.0999999999999996 | R601: 6.41 | S601: 5.85 | T601: 6.62 | U601: 6.07 | AB601: 15w | AC601: =(J601-Q601)/J601 -> 0.25219941348973618 | AD601: =(R601-S601)/R601 -> 8.7363494539781664e-02 | AE601: =(T601-U601)/T601 -> 8.3081570996978826e-02 | AO601: 不宜入场（收缩幅度不够,应观察2w） | AP601: 44600 | AQ601: 是
A602: 002346.SZ | B602: 柘中股份 | C602: 0.72999999999999998 | D602: 17.71 | E602: 18.42 | F602: 19.09 | H602: 18.399999999999999 | AO602: 不宜入场（当前股价小于150日均线,应观察2w） | AP602: 44601 | AQ602: 是
A603: 600383.SH | B603: 金地集团 | C603: 0.72999999999999998 | D603: 11.19 | E603: 11.35 | F603: 12.25 | H603: 12.78 | I603: 8.17 | J603: 14.22 | K603: 9.69 | L603: =(H603-I603)/I603 -> 0.56425948592411257 | M603: =(J603-H603)/J603 -> 0.10126582278481021 | N603: =(J603-K603)/K603 -> 0.46749226006191963 | Q603: 12.24 | R603: 14.07 | S603: 12.4 | AB603: 3w | AC603: =(J603-Q603)/J603 -> 0.13924050632911394 | AD603: =(R603-S603)/R603 -> 0.11869225302061122 | AO603: 不宜入场(当前股价小于50日均线，应持续观察1w) | AP603: 44608 | AQ603: 是
A604: 600989.SH | B604: 宝丰能源 | C604: 0.72999999999999998 | D604: 16.04 | E604: 16.17 | F604: 16.62 | H604: 17.01 | I604: 13.05 | J604: 19.69 | K604: 14.699999999999999 | L604: =(H604-I604)/I604 -> 0.30344827586206902 | M604: =(J604-H604)/J604 -> 0.1361097003555104 | N604: =(J604-K604)/K604 -> 0.33945578231292534 | Q604: 13.72 | R604: 18.82 | S604: 15.62 | T604: 18 | U604: 16.699999999999999 | AB604: 3w | AC604: =(J604-Q604)/J604 -> 0.30319959370238703 | AD604: =(R604-S604)/R604 -> 0.17003188097768338 | AE604: =(T604-U604)/T604 -> 7.2222222222222257e-02 | AO604: 不宜入场（收缩幅度不够,应观察1w） | AP604: 44617 | AQ604: 是
A605: 603040.SH | B605: 新坐标 | C605: 0.72999999999999998 | AQ605: 否
A606: 603566.SH | B606: 普莱柯 | C606: 0.72999999999999998 | D606: 20.899999999999999 | E606: 21.15 | F606: 22.73 | H606: 25.51 | I606: 17.16 | J606: 27.99 | K606: 18.699999999999999 | L606: =(H606-I606)/I606 -> 0.48659673659673669 | M606: =(J606-H606)/J606 -> 8.8603072525902007e-02 | N606: =(J606-K606)/K606 -> 0.49679144385026736 | Q606: 22.87 | R606: 27.66 | S606: 24.31 | AB606: 2w | AC606: =(J606-Q606)/J606 -> 0.18292247231153974 | AD606: =(R606-S606)/R606 -> 0.12111352133044112 | AO606: 不宜入场（收缩幅度不够,应观察1w） | AP606: 44608 | AQ606: 是
A607: 605069.SH | B607: 正和生态 | C607: 0.72999999999999998 | AQ607: 否
A608: 600039.SH | B608: 四川路桥 | C608: 0.72999999999999998 | D608: 9.14 | E608: 9.68 | F608: 11.09 | H608: 11.16 | I608: 4.15 | J608: 13.42 | K608: 9.28 | L608: =(H608-I608)/I608 -> 1.6891566265060238 | M608: =(J608-H608)/J608 -> 0.16840536512667659 | N608: =(J608-K608)/K608 -> 0.44612068965517249 | Q608: 10.41 | AB608: 4w | AC608: =(J608-Q608)/J608 -> 0.22429210134128166 | AO608: 不宜入场（收缩幅度不够,应观察2w） | AP608: 44601 | AQ608: 是
A609: 002968.SZ | B609: 新大正 | C609: 0.71999999999999997 | AQ609: 否
A610: 000961.SZ | B610: 中南建设 | C610: 0.71999999999999997 | AQ610: 否
A611: 600740.SH | B611: 山西焦化 | C611: 0.71999999999999997 | AQ611: 否
A612: 002043.SZ | B612: 兔宝宝 | C612: 0.71999999999999997 | D612: 10.54 | E612: 10.6 | F612: 11.300000000000001 | H612: 12.47 | I612: 8.37 | J612: 13.31 | K612: 8.47 | L612: =(H612-I612)/I612 -> 0.48984468339307069 | M612: =(J612-H612)/J612 -> 6.3110443275732522e-02 | N612: =(J612-K612)/K612 -> 0.5714285714285714 | Q612: 11.12 | AB612: 3w | AC612: =(J612-Q612)/J612 -> 0.16453794139744563 | AO612: 不宜入场（收缩幅度不够,应观察1w） | AP612: 44608 | AQ612: 是
A613: 002433.SZ | B613: 太安堂 | C613: 0.71999999999999997 | D613: 5.59 | E613: 5.84 | F613: 6.32 | H613: 5.2000000000000002 | AO613: 不宜入场（当前股价小于200日均线,应观察3w） | AP613: 44601 | AQ613: 是
A614: 002734.SZ | B614: 利民股份 | C614: 0.71999999999999997 | D614: 12.27 | E614: 12.34 | F614: 12.85 | H614: 11.91 | AO614: 不宜入场（当前股价小于200日均线,应观察3w） | AP614: 44617 | AQ614: 是
A615: 002938.SZ | B615: 鹏鼎控股 | C615: 0.71999999999999997 | D615: 36.29 | E615: 37.100000000000001 | F615: 39.14 | H615: 35.77 | AO615: 不宜入场（当前股价小于200日均线,应观察3w） | AP615: 44601 | AQ615: 是
A616: 600171.SH | B616: 上海贝岭 | C616: 0.71999999999999997 | O616: 2 | P616: 是 | AO616: 不宜入场（当前股价小于200日均线,应观察2w） | AP616: 44623 | AQ616: 否
A617: 600750.SH | B617: 江中药业 | C617: 0.71999999999999997 | D617: 12 | E617: 12.25 | F617: 12.87 | H617: 12.74 | AO617: 不宜入场（当前股价小于50日均线,应观察1w） | AP617: 44601 | AQ617: 是
A618: 603396.SH | B618: 金辰股份 | C618: 0.71999999999999997 | D618: 99.08 | E618: 106.03 | F618: 104.78 | AO618: 不宜入场（50日均线小于150日均线,应观察4w） | AP618: 44601 | AQ618: 是
A619: 603506.SH | B619: 南都物业 | C619: 0.71999999999999997 | D619: 12.31 | E619: 12.52 | F619: 12.67 | H619: 11.54 | AO619: 不宜入场（当前股价小于200日均线,应观察3w） | AP619: 44601 | AQ619: 是
A620: 603808.SH | B620: 歌力思 | C620: 0.71999999999999997 | AQ620: 否
A621: 002705.SZ | B621: 新宝股份 | C621: 0.71999999999999997 | AQ621: 否
A622: 000048.SZ | B622: 京基智农 | C622: 0.71999999999999997 | AQ622: 否
A623: 002949.SZ | B623: 华阳国际 | C623: 0.71999999999999997 | AQ623: 否
A624: 002753.SZ | B624: 永东股份 | C624: 0.70999999999999996 | AQ624: 否
A625: 600643.SH | B625: 爱建集团 | C625: 0.70999999999999996 | AQ625: 否
A626: 603970.SH | B626: 中农立华 | C626: 0.70999999999999996 | D626: 22.77 | E626: 23.24 | F626: 25.15 | H626: 27.76 | I626: 15.67 | J626: 29.01 | K626: 21.11 | L626: =(H626-I626)/I626 -> 0.77153797064454377 | M626: =(J626-H626)/J626 -> 4.3088590141330575e-02 | N626: =(J626-K626)/K626 -> 0.37423022264329714 | O626: 4 | P626: 是 | Q626: 23.35 | R626: 28.48 | S626: 23.47 | AB626: 8w | AC626: =(J626-Q626)/J626 -> 0.19510513615994485 | AD626: =(R626-S626)/R626 -> 0.17591292134831465 | AO626: 不宜入场（收缩幅度不够,应观察1w） | AP626: 44629 | AQ626: 是
A627: 000501.SZ | B627: 鄂武商A | C627: 0.70999999999999996 | AQ627: 否
A628: 002146.SZ | B628: 荣盛发展 | C628: 0.70999999999999996 | AQ628: 否
A629: 002543.SZ | B629: 万和电气 | C629: 0.70999999999999996 | AQ629: 否
A630: 002722.SZ | B630: 金轮股份 | C630: 0.70999999999999996 | D630: 14.1 | E630: 14.64 | F630: 15.85 | H630: 15.94 | I630: 8.6999999999999993 | J630: 18.26 | K630: 14.99 | L630: =(H630-I630)/I630 -> 0.83218390804597708 | M630: =(J630-H630)/J630 -> 0.12705366922234401 | N630: =(J630-K630)/K630 -> 0.21814543028685798 | Q630: 14.51 | AB630: 6w | AC630: =(J630-Q630)/J630 -> 0.20536692223439221 | AO630: 不宜入场（收缩幅度不够,应观察2w） | AP630: 44601 | AQ630: 是
A631: 002773.SZ | B631: 康弘药业 | C631: 0.70999999999999996 | AQ631: 否
A632: 600057.SH | B632: 厦门象屿 | C632: 0.70999999999999996 | D632: 7.56 | E632: 7.75 | F632: 8.21 | H632: 8.32 | I632: 4.7000000000000002 | J632: 9.66 | K632: 6.64 | L632: =(H632-I632)/I632 -> 0.77021276595744681 | M632: =(J632-H632)/J632 -> 0.13871635610766045 | N632: =(J632-K632)/K632 -> 0.45481927710843384 | Q632: 7.11 | R632: 9.01 | S632: 7.77 | AB632: 15w | AC632: =(J632-Q632)/J632 -> 0.2639751552795031 | AD632: =(R632-S632)/R632 -> 0.13762486126526086 | AE632: =(T632-U632)/T632 -> #DIV/0! | AO632: 不宜入场（收缩幅度不够,应观察1w） | AP632: 44616 | AQ632: 是
A633: 601015.SH | B633: 陕西黑猫 | C633: 0.70999999999999996 | AQ633: 否
A634: 603329.SH | B634: 上海雅仕 | C634: 0.70999999999999996 | D634: 13.34 | E634: 13.59 | F634: 14.38 | H634: 15.29 | I634: 11.03 | J634: 16 | K634: 12.84 | L634: =(H634-I634)/I634 -> 0.38621940163191298 | M634: =(J634-H634)/J634 -> 4.4375000000000053e-02 | N634: =(J634-K634)/K634 -> 0.24610591900311529 | Q634: 13.61 | R634: 15.39 | S634: 14.81 | AB634: 3w | AC634: =(J634-Q634)/J634 -> 0.14937500000000004 | AD634: =(R634-S634)/R634 -> 3.7686809616634183e-02 | AK634: 否 | AO634: 不宜入场（成交量行为不符合,应观察1w） | AP634: 44608 | AQ634: 是
A635: 603859.SH | B635: 能科科技 | C635: 0.70999999999999996 | AQ635: 否
A636: 603931.SH | B636: 格林达 | C636: 0.70999999999999996 | AQ636: 否
A637: 600549.SH | B637: 厦门钨业 | C637: 0.70999999999999996 | AQ637: 否
A638: 600378.SH | B638: 昊华科技 | C638: 0.70999999999999996 | D638: 32.14 | E638: 33.92 | F638: 38.200000000000003 | H638: 37.68 | AO638: 不宜入场（当前股价小于50日均线,应观察1w） | AP638: 44601 | AQ638: 是
A639: 002831.SZ | B639: 裕同科技 | C639: 0.69999999999999996 | D639: 30.600000000000001 | E639: 31.01 | F639: 32.28 | H639: 31.51 | AO639: 不宜入场（当前股价小于50日均线,应观察1w） | AP639: 44601 | AQ639: 是
A640: 000157.SZ | B640: 中联重科 | C640: 0.69999999999999996 | AQ640: 否
A641: 002384.SZ | B641: 东山精密 | C641: 0.69999999999999996 | D641: 22.17 | E641: 22.88 | F641: 24.78 | H641: 24.33 | AO641: 不宜入场（当前股价小于50日均线,应观察1w） | AP641: 44601 | AQ641: 是
A642: 002677.SZ | B642: 浙江美大 | C642: 0.69999999999999996 | AQ642: 否
A643: 601918.SH | B643: 新集能源 | C643: 0.69999999999999996 | AQ643: 否
A644: 603165.SH | B644: 荣晟环保 | C644: 0.69999999999999996 | D644: 15.31 | E644: 15.85 | F644: 17.34 | H644: 16.17 | AO644: 不宜入场（当前股价小于50日均线,应观察1w） | AP644: 44601 | AQ644: 是
A645: 603387.SH | B645: 基蛋生物 | C645: 0.69999999999999996 | AQ645: 否
A646: 603823.SH | B646: 百合花 | C646: 0.69999999999999996 | AQ646: 否
A647: 605339.SH | B647: 南侨食品 | C647: 0.69999999999999996 | D647: 32.79 | E647: 33.23 | F647: 33.27 | H647: 31.38 | AO647: 不宜入场（当前股价小于200日均线,应观察3w） | AP647: 44601 | AQ647: 是
A648: 600475.SH | B648: 华光环能 | C648: 0.69999999999999996 | D648: 10.88 | E648: 11.03 | F648: 11.199999999999999 | H648: 10.86 | AO648: 不宜入场（当前股价小于200日均线,应观察3w） | AP648: 44601 | AQ648: 是
A649: 601928.SH | B649: 凤凰传媒 | C649: 0.69999999999999996 | D649: 7.07 | E649: 7.2000000000000002 | F649: 7.58 | H649: 8.09 | I649: 5.58 | J649: 8.5999999999999996 | K649: 6.68 | L649: =(H649-I649)/I649 -> 0.44982078853046592 | M649: =(J649-H649)/J649 -> 5.9302325581395324e-02 | N649: =(J649-K649)/K649 -> 0.28742514970059879 | Q649: 7.29 | R649: 8.27 | S649: 7.76 | AB649: 3w | AC649: =(J649-Q649)/J649 -> 0.1523255813953488 | AD649: =(R649-S649)/R649 -> 6.1668681983071322e-02 | AO649: 不宜入场（杯型尚未形成,应观察1w） | AP649: 44608 | AQ649: 是
A650: 002240.SZ | B650: 盛新锂能 | C650: 0.69999999999999996 | D650: 46.84 | E650: 49.64 | F650: 51.600000000000001 | H650: 46.98 | AO650: 不宜入场（当前股价小于150日均线,应观察3w） | AP650: 44601 | AQ650: 是
A651: 605258.SH | B651: 协和电子 | C651: 0.69999999999999996 | AQ651: 否
A652: 001979.SZ | B652: 招商蛇口 | C652: 0.68999999999999995 | D652: 11.79 | E652: 12 | F652: 13.05 | G652: 1 | H652: 14.18 | I652: 9.02 | J652: 15.03 | K652: 10.87 | L652: =(H652-I652)/I652 -> 0.57206208425720628 | M652: =(J652-H652)/J652 -> 5.6553559547571505e-02 | N652: =(J652-K652)/K652 -> 0.38270469181232752 | Q652: 12.63 | R652: 14.42 | S652: 13.17 | T652: 14.52 | U652: 13.27 | V652: 14.28 | W652: 13.77 | AB652: 3w | AC652: =(J652-Q652)/J652 -> 0.15968063872255481 | AD652: =(R652-S652)/R652 -> 8.6685159500693484e-02 | AE652: =(T652-U652)/T652 -> 8.6088154269972461e-02 | AF652: =(V652-W652)/V652 -> 3.5714285714285698e-02 | AJ652: 是 | AK652: 是 | AL652: 是 | AM652: 是 | AN652: 是 | AO652: 可以入场 | AP652: 44602 | AQ652: 是
A653: 002532.SZ | B653: 天山铝业 | C653: 0.68999999999999995 | AQ653: 否
A654: 002737.SZ | B654: 葵花药业 | C654: 0.68999999999999995 | D654: 14.69 | E654: 14.87 | F654: 15.22 | H654: 14.61 | AO654: 不宜入场（当前股价小于200日均线,应观察3w） | AP654: 44601 | AQ654: 是
A655: 002824.SZ | B655: 和胜股份 | C655: 0.68999999999999995 | D655: 34.899999999999999 | E655: 37 | F655: 41.439999999999998 | H655: 44.350000000000001 | I655: 12.77 | J655: 50.990000000000002 | K655: 32.18 | L655: =(H655-I655)/I655 -> 2.4729835552075179 | M655: =(J655-H655)/J655 -> 0.13022161208080016 | N655: =(J655-K655)/K655 -> 0.58452454940957121 | Q655: 37.57 | R655: 47 | S655: 39.020000000000003 | AB655: 10w | AC655: =(J655-Q655)/J655 -> 0.2631888605608943 | AD655: =(R655-S655)/R655 -> 0.16978723404255314 | AE655: =(T655-U655)/T655 -> #DIV/0! | AO655: 不宜入场(当前股价小于50日均线，应持续观察1w) | AP655: 44608 | AQ655: 是
A656: 600079.SH | B656: 人福医药 | C656: 0.68999999999999995 | AQ656: 否
A657: 600761.SH | B657: 安徽合力 | C657: 0.68999999999999995 | D657: 11.699999999999999 | E657: 11.74 | F657: 12.06 | H657: 11.56 | AO657: 不宜入场（当前股价小于50日均线,应观察1w） | AP657: 44601 | AQ657: 是
A658: 601006.SH | B658: 大秦铁路 | C658: 0.68999999999999995 | D658: 6.33 | E658: 6.34 | F658: 6.48 | H658: 6.98 | I658: 5.7999999999999998 | J658: 7.13 | K658: 6.35 | L658: =(H658-I658)/I658 -> 0.20344827586206907 | M658: =(J658-H658)/J658 -> 2.1037868162692774e-02 | N658: =(J658-K658)/K658 -> 0.12283464566929138 | AO658: 不宜入场（当前股价距离最低点距离过小,应观察1w） | AP658: 44601 | AQ658: 是
A659: 601398.SH | B659: 工商银行 | C659: 0.68999999999999995 | AQ659: 否
A660: 601689.SH | B660: 拓普集团 | C660: 0.68999999999999995 | D660: 45.21 | E660: 47.5 | F660: 53.73 | H660: 55.37 | I660: 26.71 | J660: 68.06 | K660: 36.44 | L660: =(H660-I660)/I660 -> 1.0730063646574315 | M660: =(J660-H660)/J660 -> 0.18645312959153695 | N660: =(J660-K660)/K660 -> 0.86772777167947324 | Q660: 46.74 | R660: 60.74 | S660: 49.65 | AB660: 8w | AC660: =(J660-Q660)/J660 -> 0.31325301204819278 | AD660: =(R660-S660)/R660 -> 0.18258149489627928 | AO660: 不宜入场（收缩幅度不够,应观察1w） | AP660: 44608 | AQ660: 是
A661: 601881.SH | B661: 中国银河 | C661: 0.68999999999999995 | D661: 10.48 | E661: 10.58 | F661: 10.800000000000001 | H661: 11 | I661: 9.14 | J661: 11.76 | K661: 9.92 | L661: =(H661-I661)/I661 -> 0.20350109409190364 | M661: =(J661-H661)/J661 -> 6.4625850340136043e-02 | N661: =(J661-K661)/K661 -> 0.18548387096774191 | AO661: 不宜入场（当前股价距离最低点距离过小,应观察1w） | AP661: 44601 | AQ661: 是
A662: 603076.SH | B662: 乐惠国际 | C662: 0.68999999999999995 | AQ662: 否
A663: 603213.SH | B663: 镇洋发展 | C663: 0.68999999999999995 | D663: 13.86 | E663: 15.04 | F663: 19.09 | H663: 17.99 | AO663: 不宜入场（当前股价小于50日均线,应观察1w） | AP663: 44601 | AQ663: 是
A664: 603357.SH | B664: 设计总院 | C664: 0.68999999999999995 | D664: 9.19 | E664: 9.32 | F664: 10.09 | H664: 11.56 | I664: 7.98 | J664: 12.84 | K664: 8.8000000000000007 | L664: =(H664-I664)/I664 -> 0.44862155388471175 | M664: =(J664-H664)/J664 -> 9.9688473520249177e-02 | N664: =(J664-K664)/K664 -> 0.45909090909090894 | Q664: 11.23 | AB664: 2w | AC664: =(J664-Q664)/J664 -> 0.12538940809968843 | AO664: 不宜入场（收缩幅度不够,应观察1w） | AP664: 44608 | AQ664: 是
A665: 603511.SH | B665: 爱慕股份 | C665: 0.68999999999999995 | AQ665: 否
A666: 603707.SH | B666: 健友股份 | C666: 0.68999999999999995 | D666: 35.11 | E666: 36.07 | F666: 38.09 | H666: 36.22 | AO666: 不宜入场（当前股价小于50日均线,应观察1w） | AP666: 44601 | AQ666: 是
A667: 603757.SH | B667: 大元泵业 | C667: 0.68999999999999995 | AQ667: 否
A668: 002202.SZ | B668: 金风科技 | C668: 0.68999999999999995 | D668: 15.35 | E668: 15.72 | F668: 15.99 | H668: 15.24 | AO668: 不宜入场（当前股价小于200日均线,应观察3w） | AP668: 44601 | AQ668: 是
A669: 000717.SZ | B669: 韶钢松山 | C669: 0.68999999999999995 | AQ669: 否
A670: 000792.SZ | B670: 盐湖股份 | C670: 0.68000000000000005 | D670: 23.899999999999999 | E670: 26.170000000000002 | F670: 30.940000000000001 | H670: 26.949999999999999 | I670: 7.6600000000000001 | J670: 45.649999999999999 | K670: 8.7599999999999998 | L670: =(H670-I670)/I670 -> 2.5182767624020888 | M670: =(J670-H670)/J670 -> 0.40963855421686746 | N670: =(J670-K670)/K670 -> 4.2111872146118721 | AO670: 不宜入场（当前股价相对于最高点距离太大,应观察3w） | AP670: 44582 | AQ670: 是
A671: 002158.SZ | B671: 汉钟精机 | C671: 0.68000000000000005 | AQ671: 否
A672: 605169.SH | B672: 洪通燃气 | C672: 0.68000000000000005 | AQ672: 否
A673: 000921.SZ | B673: 海信家电 | C673: 0.68000000000000005 | AQ673: 否
A674: 002281.SZ | B674: 光迅科技 | C674: 0.68000000000000005 | AQ674: 否
A675: 600461.SH | B675: 洪城环境 | C675: 0.68000000000000005 | D675: 7.74 | E675: 7.9000000000000004 | F675: 8.13 | H675: 8.1999999999999993 | I675: 5.35 | J675: 9.52 | K675: 7.35 | L675: =(H675-I675)/I675 -> 0.53271028037383172 | M675: =(J675-H675)/J675 -> 0.13865546218487398 | N675: =(J675-K675)/K675 -> 0.29523809523809524 | Q675: 7.52 | AB675: 17w | AC675: =(J675-Q675)/J675 -> 0.21008403361344538 | AO675: 不宜入场（收缩幅度不够,应观察1w） | AP675: 44601 | AQ675: 是
A676: 601788.SH | B676: 光大证券 | C676: 0.68000000000000005 | AQ676: 否
A677: 601966.SH | B677: 玲珑轮胎 | C677: 0.68000000000000005 | AQ677: 否
A678: 603786.SH | B678: 科博达 | C678: 0.68000000000000005 | D678: 72.82 | E678: 74.37 | F678: 80.18 | H678: 73.24 | AO678: 不宜入场（当前股价小于150日均线,应观察2w） | AP678: 44601 | AQ678: 是
A679: 605376.SH | B679: 博迁新材 | C679: 0.68000000000000005 | D679: 73.03 | E679: 75.24 | F679: 76.58 | H679: 70 | AO679: 不宜入场（当前股价小于200日均线,应观察3w） | AP679: 44601 | AQ679: 是
A680: 000062.SZ | B680: 深圳华强 | C680: 0.68000000000000005 | D680: 15.56 | E680: 15.87 | F680: 16.45 | H680: 15.45 | AO680: 不宜入场（当前股价小于200日均线,应观察3w） | AP680: 44601 | AQ680: 是
A681: 600971.SH | B681: 恒源煤电 | C681: 0.68000000000000005 | AQ681: 否
A682: 600338.SH | B682: 西藏珠峰 | C682: 0.68000000000000005 | D682: 29.52 | E682: 30.879999999999999 | F682: 32.200000000000003 | H682: 32.18 | I682: 8.1899999999999995 | J682: 50.890000000000001 | K682: 13.539999999999999 | L682: =(H682-I682)/I682 -> 2.9291819291819294 | M682: =(J682-H682)/J682 -> 0.36765572804087249 | N682: =(J682-K682)/K682 -> 2.7584933530280651 | O682: 2 | P682: 是 | Q682: 26.280000000000001 | R682: 40.299999999999997 | S682: 27.010000000000002 | AO682: 不宜入场（当前股价小于150日均线,应观察2w） | AP682: 44623 | AQ682: 是
A683: 000100.SZ | B683: TCL科技 | C683: 0.68000000000000005 | AQ683: 否
A684: 600143.SH | B684: 金发科技 | C684: 0.67000000000000004 | AQ684: 否
A685: 002645.SZ | B685: 华宏科技 | C685: 0.67000000000000004 | D685: 19.41 | E685: 20.460000000000001 | F685: 23.170000000000002 | H685: 23.510000000000002 | I685: 8.2200000000000006 | J685: 28.600000000000001 | K685: 19.219999999999999 | L685: =(H685-I685)/I685 -> 1.8600973236009732 | M685: =(J685-H685)/J685 -> 0.17797202797202796 | N685: =(J685-K685)/K685 -> 0.4880332986472426 | Q685: 21.800000000000001 | AB685: 7w | AC685: =(J685-Q685)/J685 -> 0.23776223776223779 | AD685: =(R685-S685)/R685 -> #DIV/0! | AO685: 不宜入场（收缩幅度不够,应持续观察1w） | AP685: 44585 | AQ685: 是
A686: 600085.SH | B686: 同仁堂 | C686: 0.67000000000000004 | D686: 36.82 | E686: 38.08 | F686: 42.91 | H686: 45.43 | I686: 23.23 | J686: 55.45 | K686: 32.27 | L686: =(H686-I686)/I686 -> 0.95566078346965122 | M686: =(J686-H686)/J686 -> 0.18070333633904423 | N686: =(J686-K686)/K686 -> 0.71831422373721721 | Q686: 41.15 | AB686: 3w | AC686: =(J686-Q686)/J686 -> 0.25788999098286752 | AO686: 不宜入场（收缩幅度不够,应持续观察2w） | AP686: 44601 | AQ686: 是
A687: 000429.SZ | B687: 粤高速A | C687: 0.67000000000000004 | D687: 7.12 | E687: 7.17 | F687: 7.35 | H687: 7.85 | I687: 5.48 | J687: 7.95 | K687: 7.18 | L687: =(H687-I687)/I687 -> 0.43248175182481735 | M687: =(J687-H687)/J687 -> 1.2578616352201324e-02 | N687: =(J687-K687)/K687 -> 0.10724233983286915 | AO687: 不宜入场（收缩幅度不够,应观察2w） | AP687: 44601 | AQ687: 是
A688: 000887.SZ | B688: 中鼎股份 | C688: 0.67000000000000004 | D688: 16.94 | E688: 18.07 | F688: 21.04 | H688: 19.22 | AO688: 不宜入场（当前股价小于50日均线,应观察1w） | AP688: 44601 | AQ688: 是
A689: 002026.SZ | B689: 山东威达 | C689: 0.67000000000000004 | D689: 15.67 | E689: 16.38 | F689: 18.18 | H689: 17.07 | AO689: 不宜入场（当前股价小于50日均线,应观察1w） | AP689: 44601 | AQ689: 是
A690: 002262.SZ | B690: 恩华药业 | C690: 0.67000000000000004 | D690: 14.82 | E690: 14.87 | F690: 15 | H690: 14.37 | AO690: 不宜入场（当前股价小于200日均线,应观察3w） | AP690: 44601 | AQ690: 是
A691: 002475.SZ | B691: 立讯精密 | C691: 0.67000000000000004 | D691: 40.95 | E691: 41.98 | F691: 45.5 | H691: 43.83 | AO691: 不宜入场（当前股价小于50日均线,应观察1w） | AP691: 44601 | AQ691: 是
A692: 002860.SZ | B692: 星帅尔 | C692: 0.67000000000000004 | D692: 20.18 | E692: 20.699999999999999 | F692: 21.06 | H692: 19.03 | O692: 2 | P692: 是 | AO692: 不宜入场（当前股价小于200日均线,应观察3w） | AP692: 44626 | AQ692: 是
A693: 003031.SZ | B693: 中瓷电子 | C693: 0.67000000000000004 | D693: 67.69 | E693: 71.5 | F693: 82.71 | H693: 104.97 | I693: 35.53 | J693: 104.97 | K693: 95.63 | L693: =(H693-I693)/I693 -> 1.9544047283985364 | M693: =(J693-H693)/J693 -> 0 | N693: =(J693-K693)/K693 -> 9.7668095785841305e-02 | AO693: 不宜入场（收缩幅度不够,应持续观察2w） | AP693: 44601 | AQ693: 是
A694: 600452.SH | B694: 涪陵电力 | C694: 0.67000000000000004 | D694: 16.89 | E694: 17.43 | F694: 18.43 | H694: 16.56 | AO694: 不宜入场（当前股价小于200日均线,应观察3w） | AP694: 44601 | AQ694: 是
A695: 600927.SH | B695: 永安期货 | C695: 0.67000000000000004 | D695: 27.06 | E695: 27.37 | F695: 28.67 | H695: 26.899999999999999 | AO695: 不宜入场（当前股价小于200日均线,应观察3w） | AP695: 44601 | AQ695: 是
A696: 603408.SH | B696: 建霖家居 | C696: 0.67000000000000004 | AQ696: 否
A697: 603657.SH | B697: 春光科技 | C697: 0.67000000000000004 | D697: 23.09 | E697: 23.44 | F697: 24.21 | H697: 23.83 | AO697: 不宜入场（当前股价小于50日均线,应观察1w） | AP697: 44601 | AQ697: 是
A698: 603726.SH | B698: 朗迪集团 | C698: 0.67000000000000004 | D698: 13.84 | E698: 14.03 | F698: 14.21 | H698: 13.85 | AO698: 不宜入场（当前股价小于150日均线,应观察2w） | AP698: 44601 | AQ698: 是
A699: 605016.SH | B699: 百龙创园 | C699: 0.67000000000000004 | D699: 29.11 | E699: 29.62 | F699: 29.87 | H699: 27.81 | AO699: 不宜入场（当前股价小于200日均线,应观察3w） | AP699: 44601 | AQ699: 是
A700: 000671.SZ | B700: 阳光城 | C700: 0.66000000000000003 | AQ700: 否
A701: 000869.SZ | B701: 张裕A | C701: 0.66000000000000003 | AQ701: 否
A702: 002803.SZ | B702: 吉宏股份 | C702: 0.66000000000000003 | AQ702: 否
A703: 600276.SH | B703: 恒瑞医药 | C703: 0.66000000000000003 | AQ703: 否
A704: 600390.SH | B704: 五矿资本 | C704: 0.66000000000000003 | AQ704: 否
A705: 600682.SH | B705: 南京新百 | C705: 0.66000000000000003 | D705: 10.56 | E705: 10.74 | F705: 11.08 | H705: 10.96 | AO705: 不宜入场（当前股价小于50日均线,应观察1w） | AP705: 44601 | AQ705: 是
A706: 603578.SH | B706: 三星新材 | C706: 0.66000000000000003 | D706: 15.96 | E706: 16.26 | F706: 16.72 | H706: 15.57 | AO706: 不宜入场（当前股价小于200日均线,应观察3w） | AP706: 44601 | AQ706: 是
A707: 605368.SH | B707: 蓝天燃气 | C707: 0.66000000000000003 | AQ707: 否
A708: 605398.SH | B708: 新炬网络 | C708: 0.66000000000000003 | AQ708: 否
A709: 002915.SZ | B709: 中欣氟材 | C709: 0.66000000000000003 | D709: 24.899999999999999 | E709: 25.87 | F709: 27.42 | H709: 24.54 | AO709: 不宜入场（当前股价小于200日均线,应观察3w） | AP709: 44601 | AQ709: 是
A710: 600012.SH | B710: 皖通高速 | C710: 0.66000000000000003 | D710: 6.74 | E710: 6.76 | F710: 7.13 | H710: 8.47 | I710: 5.52 | J710: 8.6999999999999993 | K710: 6.87 | L710: =(H710-I710)/I710 -> 0.53442028985507273 | M710: =(J710-H710)/J710 -> 2.6436781609195249e-02 | N710: =(J710-K710)/K710 -> 0.26637554585152828 | AO710: 不宜入场（收缩幅度不够,应持续观察2w） | AP710: 44601 | AQ710: 是
A711: 605136.SH | B711: 丽人丽妆 | C711: 0.65000000000000002 | AQ711: 否
A712: 600308.SH | B712: 华泰股份 | C712: 0.65000000000000002 | AQ712: 否
A713: 002763.SZ | B713: 汇洁股份 | C713: 0.65000000000000002 | D713: 9.03 | E713: 9.28 | F713: 9.58 | H713: 9.47 | AO713: 不宜入场（当前股价小于50日均线,应观察1w） | AP713: 44601 | AQ713: 是
A714: 600388.SH | B714: 龙净环保 | C714: 0.65000000000000002 | AQ714: 否
A715: 601658.SH | B715: 邮储银行 | C715: 0.65000000000000002 | D715: 5.2999999999999998 | E715: 5.32 | F715: 5.48 | H715: 5.88 | I715: 4.49 | J715: 5.99 | K715: 5.35 | L715: =(H715-I715)/I715 -> 0.30957683741648101 | M715: =(J715-H715)/J715 -> 1.8363939899833107e-02 | N715: =(J715-K715)/K715 -> 0.11962616822429918 | AO715: 不宜入场（收缩幅度不够,应持续观察2w） | AP715: 44601 | AQ715: 是
A716: 601827.SH | B716: 三峰环境 | C716: 0.65000000000000002 | AQ716: 否
A717: 603039.SH | B717: 泛微网络 | C717: 0.65000000000000002 | AQ717: 否
A718: 605122.SH | B718: 四方新材 | C718: 0.65000000000000002 | AQ718: 否
A719: 000739.SZ | B719: 普洛药业 | C719: 0.65000000000000002 | D719: 32.52 | E719: 33.16 | F719: 32.85 | AO719: 不宜入场（50日均线小于150日均线,应观察4w） | AP719: 44601 | AQ719: 是
A720: 605577.SH | B720: 龙版传媒 | C720: 0.64000000000000001 | D720: 11.800000000000001 | E720: 12.33 | F720: 13.62 | H720: 14.01 | I720: 7.19 | J720: 18.32 | K720: 12.36 | L720: =(H720-I720)/I720 -> 0.94853963838664801 | M720: =(J720-H720)/J720 -> 0.23526200873362449 | N720: =(J720-K720)/K720 -> 0.48220064724919104 | Q720: 12.06 | AB720: 5w | AC720: =(J720-Q720)/J720 -> 0.34170305676855894 | AO720: 不宜入场（收缩幅度不够,应持续观察2w） | AP720: 44601 | AQ720: 是
A721: 600663.SH | B721: 陆家嘴 | C721: 0.64000000000000001 | AQ721: 否
A722: 600817.SH | B722: 宇通重工 | C722: 0.64000000000000001 | AQ722: 否
A723: 002851.SZ | B723: 麦格米特 | C723: 0.64000000000000001 | AQ723: 否
A724: 000065.SZ | B724: 北方国际 | C724: 0.64000000000000001 | AQ724: 否
A725: 002318.SZ | B725: 久立特材 | C725: 0.64000000000000001 | D725: 14.77 | E725: 15.16 | F725: 16.67 | H725: 16.699999999999999 | I725: 10.18 | J725: 19.100000000000001 | K725: 14.87 | L725: =(H725-I725)/I725 -> 0.64047151277013747 | M725: =(J725-H725)/J725 -> 0.12565445026178021 | N725: =(J725-K725)/K725 -> 0.28446536650975135 | Q725: 16.24 | AB725: 2w | AC725: =(J725-Q725)/J725 -> 0.1497382198952881 | AO725: 不宜入场（收缩幅度不够,应持续观察1w） | AP725: 44608 | AQ725: 是
A726: 002990.SZ | B726: 盛视科技 | C726: 0.64000000000000001 | AQ726: 否
A727: 600846.SH | B727: 同济科技 | C727: 0.64000000000000001 | AQ727: 否
A728: 600908.SH | B728: 无锡银行 | C728: 0.64000000000000001 | AQ728: 否
A729: 600970.SH | B729: 中材国际 | C729: 0.64000000000000001 | D729: 10.63 | E729: 10.83 | F729: 10.92 | H729: 10.58 | AO729: 不宜入场（当前股价小于200日均线,应观察3w） | AP729: 44601 | AQ729: 是
A730: 603216.SH | B730: 梦天家居 | C730: 0.64000000000000001 | AQ730: 否
A731: 603351.SH | B731: 威尔药业 | C731: 0.64000000000000001 | D731: 27.100000000000001 | E731: 28.32 | F731: 31.27 | H731: 32.79 | I731: 17.08 | J731: 42.62 | K731: 23.300000000000001 | L731: =(H731-I731)/I731 -> 0.91978922716627654 | M731: =(J731-H731)/J731 -> 0.23064289066166116 | N731: =(J731-K731)/K731 -> 0.82918454935622299 | O731: 4 | P731: 是 | Q731: 26.01 | R731: 33.5 | S731: 31.199999999999999 | AB731: 8w | AC731: =(J731-Q731)/J731 -> 0.38972313467855457 | AD731: =(R731-S731)/R731 -> 6.8656716417910463e-02 | AO731: 不宜入场（当前收缩幅度不够,应观察2w） | AP731: 44626 | AQ731: 是
A732: 002690.SZ | B732: 美亚光电 | C732: 0.63 | AQ732: 否
A733: 600764.SH | B733: 中国海防 | C733: 0.63 | D733: 31.08 | E733: 31.91 | F733: 34.32 | H733: 32.99 | AO733: 不宜入场（当前股价小于50日均线,应观察1w） | AP733: 44601 | AQ733: 是
A734: 600674.SH | B734: 川投能源 | C734: 0.63 | AQ734: 否
A735: 002315.SZ | B735: 焦点科技 | C735: 0.63 | AQ735: 否
A736: 002745.SZ | B736: 木林森 | C736: 0.63 | AQ736: 否
A737: 002879.SZ | B737: 长缆科技 | C737: 0.63 | D737: 20.21 | E737: 21.11 | F737: 23.67 | H737: 22 | AO737: 不宜入场（当前股价小于50日均线,应观察1w） | AP737: 44601 | AQ737: 是
A738: 002897.SZ | B738: 意华股份 | C738: 0.63 | D738: 37.16 | E738: 39.56 | F738: 44.32 | H738: 36.71 | AO738: 不宜入场（当前股价小于200日均线,应观察3w） | AP738: 44601 | AQ738: 是
A739: 601528.SH | B739: 瑞丰银行 | C739: 0.63 | AO739: 不宜入场（当前股价小于200日均线,应观察3w） | AP739: 44623 | AQ739: 否
A740: 603367.SH | B740: 辰欣药业 | C740: 0.63 | AQ740: 否
A741: 603693.SH | B741: 江苏新能 | C741: 0.63 | D741: 21.74 | E741: 22.94 | F741: 25.07 | H741: 25.100000000000001 | I741: 9.71 | J741: 34.5 | K741: 26.72 | L741: =(H741-I741)/I741 -> 1.5849639546858907 | M741: =(J741-H741)/J741 -> 0.27246376811594197 | N741: =(J741-K741)/K741 -> 0.29116766467065874 | AO741: 不宜入场（当前股价距离最高点距离过大,应观察1w） | AP741: 44601 | AQ741: 是
A742: 605033.SH | B742: 美邦股份 | C742: 0.63 | D742: 17.87 | E742: 17.87 | F742: 18.18 | H742: 18.43 | I742: 14.34 | J742: 26.71 | K742: 14.78 | L742: =(H742-I742)/I742 -> 0.28521617852161785 | M742: =(J742-H742)/J742 -> 0.30999625608386377 | N742: =(J742-K742)/K742 -> 0.80717185385656309 | O742: 2 | P742: 是 | AO742: 不宜入场（当前股价距离最高点距离过大,应观察2w） | AP742: 44626 | AQ742: 是
A743: 605166.SH | B743: 聚合顺 | C743: 0.63 | D743: 12.44 | E743: 12.94 | F743: 14.16 | H743: 14.18 | I743: 8.39 | J743: 17.77 | K743: 10.13 | L743: =(H743-I743)/I743 -> 0.6901072705601905 | M743: =(J743-H743)/J743 -> 0.2020258863252673 | N743: =(J743-K743)/K743 -> 0.75419545903257634 | O743: 3 | Q743: 12.94 | AB743: 2w | AC743: =(J743-Q743)/J743 -> 0.27180641530669669 | AO743: 不宜入场（收缩幅度不够,应持续观察2w） | AP743: 44626 | AQ743: 是
A744: 605365.SH | B744: 立达信 | C744: 0.63 | AQ744: 否
A745: 002068.SZ | B745: 黑猫股份 | C745: 0.63 | D745: 8.34 | E745: 8.6999999999999993 | F745: 9.89 | H745: 11.29 | I745: 5.74 | J745: 12 | K745: 9.91 | L745: =(H745-I745)/I745 -> 0.96689895470383258 | M745: =(J745-H745)/J745 -> 5.9166666666666735e-02 | N745: =(J745-K745)/K745 -> 0.21089808274470231 | O745: 4 | P745: 是 | Q745: 10.92 | AB745: 2w | AC745: =(J745-Q745)/J745 -> 9.0000000000000011e-02 | AO745: 不宜入场（收缩幅度不够,应持续观察2w） | AP745: 44621 | AQ745: 是
A746: 002180.SZ | B746: 纳思达 | C746: 0.63 | D746: 38.51 | E746: 40.74 | F746: 47.29 | H746: 50.07 | I746: 22.96 | J746: 54.45 | K746: 38.19 | L746: =(H746-I746)/I746 -> 1.1807491289198606 | M746: =(J746-H746)/J746 -> 8.04407713498623e-02 | N746: =(J746-K746)/K746 -> 0.42576590730557756 | Q746: 46.200000000000003 | AB746: 2w | AC746: =(J746-Q746)/J746 -> 0.15151515151515152 | AO746: 不宜入场（收缩幅度不够,应持续观察1w） | AP746: 44608 | AQ746: 是
A747: 002386.SZ | B747: 天原股份 | C747: 0.63 | D747: 11.03 | E747: 11.48 | F747: 11.72 | H747: 11.22 | AO747: 不宜入场（当前股价小于150日均线,应观察2w） | AP747: 44601 | AQ747: 是
A748: 000655.SZ | B748: 金岭矿业 | C748: 0.63 | AQ748: 否
A749: 000731.SZ | B749: 四川美丰 | C749: 0.62 | D749: 8.01 | E749: 8.42 | F749: 9.15 | H749: 9.52 | I749: 4.12 | J749: 14.68 | K749: 6.65 | L749: =(H749-I749)/I749 -> 1.3106796116504853 | M749: =(J749-H749)/J749 -> 0.35149863760217986 | N749: =(J749-K749)/K749 -> 1.207518796992481 | AO749: 不宜入场（当前股价距离最高点距离过大,应观察2w） | AP749: 44601 | AQ749: 是
A750: 001965.SZ | B750: 招商公路 | C750: 0.62 | D750: 7.53 | E750: 7.57 | F750: 7.87 | H750: 8.93 | I750: 6.63 | J750: 9.32 | K750: 7.7000000000000002 | L750: =(H750-I750)/I750 -> 0.34690799396681749 | M750: =(J750-H750)/J750 -> 4.1845493562231821e-02 | N750: =(J750-K750)/K750 -> 0.2103896103896104 | AO750: 不宜入场（收缩幅度不够,应持续观察2w） | AP750: 44601 | AQ750: 是
A751: 600894.SH | B751: 广日股份 | C751: 0.62 | AQ751: 否
A752: 000719.SZ | B752: 中原传媒 | C752: 0.62 | D752: 7.2999999999999998 | E752: 7.42 | F752: 8 | H752: 8.27 | I752: 6.32 | J752: 10.199999999999999 | K752: 6.97 | L752: =(H752-I752)/I752 -> 0.30854430379746822 | M752: =(J752-H752)/J752 -> 0.1892156862745098 | N752: =(J752-K752)/K752 -> 0.46341463414634143 | Q752: 7.59 | AB752: 4w | AC752: =(J752-Q752)/J752 -> 0.25588235294117645 | AO752: 不宜入场（收缩幅度不够,应持续观察2w） | AP752: 44601 | AQ752: 是
A753: 002335.SZ | B753: 科华数据 | C753: 0.62 | D753: 31.81 | E753: 33.52 | F753: 34.97 | H753: 29.95 | AO753: 不宜入场（当前股价小于200日均线,应观察3w） | AP753: 44601 | AQ753: 是
A754: 002847.SZ | B754: 盐津铺子 | C754: 0.62 | AQ754: 否
A755: 002922.SZ | B755: 伊戈尔 | C755: 0.62 | D755: 16.89 | E755: 17.99 | F755: 19.36 | H755: 16.399999999999999 | AO755: 不宜入场（当前股价小于200日均线,应观察3w） | AP755: 44601 | AQ755: 是
A756: 002979.SZ | B756: 雷赛智能 | C756: 0.62 | AQ756: 否
A757: 003022.SZ | B757: 联泓新科 | C757: 0.62 | AQ757: 否
A758: 600315.SH | B758: 上海家化 | C758: 0.62 | AQ758: 否
A759: 600510.SH | B759: 黑牡丹 | C759: 0.62 | D759: 7.48 | E759: 7.59 | F759: 7.68 | H759: 7.96 | I759: 5.95 | J759: 10.19 | K759: 6.7999999999999998 | L759: =(H759-I759)/I759 -> 0.33781512605042013 | M759: =(J759-H759)/J759 -> 0.2188420019627085 | N759: =(J759-K759)/K759 -> 0.49852941176470583 | Q759: 6.77 | AB759: 22w | AC759: =(J759-Q759)/J759 -> 0.33562315996074582 | AO759: 不宜入场（收缩幅度不够,应持续观察2w） | AP759: 44601 | AQ759: 是
A760: 600765.SH | B760: 中航重机 | C760: 0.62 | D760: 36.78 | E760: 39.45 | F760: 44.83 | H760: 45.25 | I760: 15.05 | J760: 53.99 | K760: 30.41 | L760: =(H760-I760)/I760 -> 2.0066445182724251 | M760: =(J760-H760)/J760 -> 0.16188182996851272 | N760: =(J760-K760)/K760 -> 0.7754028280170997 | O760: 4 | P760: 是 | AO760: 不宜入场（当前股价小于50日均线,应观察1w） | AP760: 44625 | AQ760: 是
A761: 603037.SH | B761: 凯众股份 | C761: 0.62 | D761: 18.34 | E761: 18.800000000000001 | F761: 19.72 | H761: 18.37 | AO761: 不宜入场（当前股价小于150日均线,应观察2w） | AP761: 44601 | AQ761: 是
A762: 603181.SH | B762: 皇马科技 | C762: 0.62 | D762: 15.13 | E762: 15.64 | F762: 17.13 | H762: 16.26 | AO762: 不宜入场（当前股价小于50日均线,应观察1w） | AP762: 44601 | AQ762: 是
A763: 605088.SH | B763: 冠盛股份 | C763: 0.62 | AQ763: 否
A764: 600420.SH | B764: 国药现代 | C764: 0.60999999999999999 | AQ764: 否
A765: 000488.SZ | B765: 晨鸣纸业 | C765: 0.60999999999999999 | AQ765: 否
A766: 600850.SH | B766: 电科数字 | C766: 0.60999999999999999 | D766: 31.55 | E766: 32.27 | F766: 34.01 | H766: 31.03 | AO766: 不宜入场（当前股价小于200日均线,应观察3w） | AP766: 44601 | AQ766: 是
A767: 000913.SZ | B767: 钱江摩托 | C767: 0.60999999999999999 | AQ767: 否
A768: 003008.SZ | B768: 开普检测 | C768: 0.60999999999999999 | AQ768: 否
A769: 600528.SH | B769: 中铁工业 | C769: 0.60999999999999999 | AQ769: 否
A770: 601128.SH | B770: 常熟银行 | C770: 0.60999999999999999 | D770: 6.84 | E770: 6.87 | F770: 7.12 | H770: 7.66 | I770: 5.68 | J770: 8.3000000000000007 | K770: 7.18 | L770: =(H770-I770)/I770 -> 0.34859154929577474 | M770: =(J770-H770)/J770 -> 7.7108433734939821e-02 | N770: =(J770-K770)/K770 -> 0.15598885793871881 | Q770: 5.68 | R770: 7.89 | S770: 6.52 | T770: 7.84 | U770: 7.36 | V770: 7.87 | W770: 7.2999999999999998 | AB770: 13w | AC770: =(J770-Q770)/J770 -> 0.31566265060240972 | AD770: =(R770-S770)/R770 -> 0.17363751584283907 | AE770: =(T770-U770)/T770 -> 6.122448979591831e-02 | AF770: =(V770-W770)/V770 -> 7.2426937738246544e-02 | AJ770: 是 | AK770: 是 | AL770: 是 | AM770: 是 | AO770: 不宜入场（等待两个反弹,应持续观察1w） | AP770: 44614 | AQ770: 是
A771: 601163.SH | B771: 三角轮胎 | C771: 0.60999999999999999 | AQ771: 否
A772: 603112.SH | B772: 华翔股份 | C772: 0.60999999999999999 | D772: 12.82 | E772: 13.09 | F772: 14.19 | H772: 15.52 | I772: 9.37 | J772: 18.58 | K772: 10.45 | L772: =(H772-I772)/I772 -> 0.65635005336179308 | M772: =(J772-H772)/J772 -> 0.1646932185145317 | N772: =(J772-K772)/K772 -> 0.77799043062200957 | Q772: 10.43 | R772: 13.97 | S772: 10.51 | T772: 13.62 | U772: 11.91 | V772: 14.1 | W772: 12.47 | X772: 15.83 | Y772: 14.18 | Z772: 16.32 | AA772: 14.9 | AB772: 44w | AC772: =(J772-Q772)/J772 -> 0.43864370290635085 | AD772: =(R772-S772)/R772 -> 0.24767358625626348 | AE772: =(T772-U772)/T772 -> 0.12555066079295149 | AF772: =(V772-W772)/V772 -> 0.11560283687943256 | AG772: =(X772-Y772)/X772 -> 0.10423246999368291 | AH772: =(Z772-AA772)/Z772 -> 8.7009803921568624e-02 | AQ772: 否
A773: 603360.SH | B773: 百傲化学 | C773: 0.60999999999999999 | AQ773: 否
A774: 603967.SH | B774: 中创物流 | C774: 0.60999999999999999 | D774: 12.68 | E774: 12.79 | F774: 13.199999999999999 | H774: 12.699999999999999 | AO774: 不宜入场（当前股价小于150日均线,应观察2w） | AP774: 44601 | AQ774: 是
A775: 605086.SH | B775: 龙高股份 | C775: 0.60999999999999999 | AQ775: 否
A776: 605296.SH | B776: 神农集团 | C776: 0.60999999999999999 | AQ776: 否
A777: 600704.SH | B777: 物产中大 | C777: 0.60999999999999999 | AQ777: 否
A778: 605128.SH | B778: 上海沿浦 | C778: 0.60999999999999999 | D778: 35.39 | E778: 35.99 | F778: 37.86 | H778: 35.78 | AO778: 不宜入场（当前股价小于150日均线,应观察2w） | AP778: 44601 | AQ778: 是
A779: 002221.SZ | B779: 东华能源 | C779: 0.60999999999999999 | AQ779: 否
A780: 002674.SZ | B780: 兴业科技 | C780: 0.60999999999999999 | AQ780: 否
A781: 002880.SZ | B781: 卫光生物 | C781: 0.60999999999999999 | AQ781: 否
A782: 002507.SZ | B782: 涪陵榨菜 | C782: 0.60999999999999999 | AQ782: 否
A783: 601038.SH | B783: 一拖股份 | C783: 0.59999999999999998 | AQ783: 否
A784: 002416.SZ | B784: 爱施德 | C784: 0.59999999999999998 | D784: 10.42 | E784: 10.68 | F784: 10.95 | H784: 10.53 | AO784: 不宜入场（当前股价小于150日均线,应观察2w） | AP784: 44601 | AQ784: 是
A785: 000528.SZ | B785: 柳工 | C785: 0.59999999999999998 | AQ785: 否
A786: 002422.SZ | B786: 科伦药业 | C786: 0.59999999999999998 | AQ786: 否
A787: 002972.SZ | B787: 科安达 | C787: 0.59999999999999998 | D787: 18.08 | E787: 18.24 | F787: 18.72 | H787: 18.300000000000001 | AO787: 不宜入场（当前股价小于50日均线,应观察1w） | AP787: 44601 | AQ787: 是
A788: 600061.SH | B788: 国投资本 | C788: 0.59999999999999998 | AQ788: 否
A789: 600459.SH | B789: 贵研铂业 | C789: 0.59999999999999998 | D789: 23.76 | E789: 24.35 | F789: 24.699999999999999 | H789: 24.91 | I789: 15.88 | J789: 31.800000000000001 | K789: 21.74 | L789: =(H789-I789)/I789 -> 0.56863979848866497 | M789: =(J789-H789)/J789 -> 0.21666666666666667 | N789: =(J789-K789)/K789 -> 0.46274149034038653 | Q789: 21.199999999999999 | R789: 28.300000000000001 | S789: 22.600000000000001 | AB789: 13w | AC789: =(J789-Q789)/J789 -> 0.33333333333333337 | AD789: =(R789-S789)/R789 -> 0.20141342756183742 | AE789: =(T789-S789)/T789 -> #DIV/0! | AJ789: 是 | AK789: 是 | AO789: 不宜入场（收缩幅度不够,应观察2w） | AP789: 44602 | AQ789: 是
A790: 600875.SH | B790: 东方电气 | C790: 0.59999999999999998 | D790: 16.5 | E790: 17.29 | F790: 19.05 | H790: 17.58 | AO790: 不宜入场（当前股价小于50日均线,应观察1w） | AP790: 44601 | AQ790: 是
A791: 601311.SH | B791: 骆驼股份 | C791: 0.59999999999999998 | D791: 13.69 | E791: 14.07 | F791: 14.75 | H791: 14.22 | AO791: 不宜入场（当前股价小于50日均线,应观察1w） | AP791: 44601 | AQ791: 是
A792: 603081.SH | B792: 大丰实业 | C792: 0.59999999999999998 | D792: 11.97 | E792: 12.09 | F792: 12.63 | H792: 12.67 | I792: 10.16 | J792: 15.01 | K792: 10.41 | L792: =(H792-I792)/I792 -> 0.24704724409448817 | M792: =(J792-H792)/J792 -> 0.15589606928714189 | N792: =(J792-K792)/K792 -> 0.44188280499519689 | AO792: 不宜入场（当前股价距离最低点距离过小,应观察1w） | AP792: 44601 | AQ792: 是
A793: 603179.SH | B793: 新泉股份 | C793: 0.59999999999999998 | D793: 36.79 | E793: 37.99 | F793: 41.299999999999997 | H793: 37.62 | AO793: 不宜入场（当前股价小于150日均线,应观察2w） | AP793: 44601 | AQ793: 是
A794: 603730.SH | B794: 岱美股份 | C794: 0.59999999999999998 | D794: 19.64 | E794: 20.09 | F794: 21.22 | H794: 18.41 | AO794: 不宜入场（当前股价小于200日均线,应观察3w） | AP794: 44601 | AQ794: 是
A795: 605151.SH | B795: 西上海 | C795: 0.59999999999999998 | D795: 18.95 | E795: 18.89 | AO795: 不宜入场（150日均线小于200日均线,应观察6w） | AP795: 44601 | AQ795: 是
A796: 002136.SZ | B796: 安纳达 | C796: 0.59999999999999998 | D796: 16.13 | E796: 16.57 | F796: 16.43 | O796: 2 | P796: 是 | AO796: 不宜入场（50日均线小于150日均线,应观察4w） | AP796: 44625 | AQ796: 否
A797: 600173.SH | B797: 卧龙地产 | C797: 0.59999999999999998 | D797: 5.68 | E797: 5.79 | F797: 6.0999999999999996 | H797: 6.03 | AO797: 不宜入场（当前股价小于50日均线,应观察1w） | AP797: 44601 | AQ797: 是
A798: 600571.SH | B798: 信雅达 | C798: 0.59999999999999998 | D798: 9.16 | E798: 9.56 | F798: 10.89 | H798: 12.73 | I798: 6.34 | J798: 12.88 | K798: 8.97 | L798: =(H798-I798)/I798 -> 1.0078864353312305 | M798: =(J798-H798)/J798 -> 1.1645962732919282e-02 | N798: =(J798-K798)/K798 -> 0.4358974358974359 | Q798: 9.61 | AB798: 4w | AC798: =(J798-Q798)/J798 -> 0.25388198757763986 | AO798: 不宜入场（收缩幅度不够,应观察2w） | AP798: 44601 | AQ798: 是
A799: 600661.SH | B799: 昂立教育 | C799: 0.59999999999999998 | AQ799: 否
A800: 603866.SH | B800: 桃李面包 | C800: 0.59999999999999998 | AQ800: 否
A801: 603690.SH | B801: 至纯科技 | C801: 0.59999999999999998 | D801: 46.100000000000001 | E801: 47.36 | F801: 47.03 | AO801: 不宜入场（50日均线小于150日均线,应观察4w） | AP801: 44602 | AQ801: 是
A802: 002015.SZ | B802: 协鑫能科 | C802: 0.59999999999999998 | D802: 13.83 | E802: 14.710000000000001 | F802: 16.82 | H802: 16.890000000000001 | I802: 6.5599999999999996 | J802: 21.07 | K802: 13 | L802: =(H802-I802)/I802 -> 1.57469512195122 | M802: =(J802-H802)/J802 -> 0.19838633127669672 | N802: =(J802-K802)/K802 -> 0.62076923076923074 | Q802: 15.390000000000001 | R802: 19.489999999999998 | S802: 15.69 | T802: 18.32 | U802: 16.010000000000002 | AB802: 8w | AC802: =(J802-Q802)/J802 -> 0.26957759848125296 | AD802: =(R802-S802)/R802 -> 0.19497178040020519 | AE802: =(T802-U802)/T802 -> 0.12609170305676848 | AJ802: 是 | AK802: 是 | AM802: 否 | AO802: 不宜入场（收缩幅度不够,应观察1w） | AP802: 44610 | AQ802: 是
A803: 603303.SH | B803: 得邦照明 | C803: 0.59999999999999998 | D803: 15.87 | E803: 16.300000000000001 | F803: 16.899999999999999 | H803: 16.19 | AO803: 不宜入场（当前股价小于150日均线,应观察2w） | AP803: 44602 | AQ803: 是
A804: 600551.SH | B804: 时代出版 | C804: 0.58999999999999997 | D804: 7.44 | E804: 7.52 | F804: 7.7999999999999998 | H804: 8.21 | I804: 6.58 | J804: 8.58 | K804: 6.87 | L804: =(H804-I804)/I804 -> 0.24772036474164144 | M804: =(J804-H804)/J804 -> 4.312354312354303e-02 | N804: =(J804-K804)/K804 -> 0.24890829694323144 | AO804: 不宜入场（当前股价距离最低点的距离过小,应观察1w） | AP804: 44602 | AQ804: 是
A805: 002293.SZ | B805: 罗莱生活 | C805: 0.58999999999999997 | D805: 13.05 | E805: 13.199999999999999 | F805: 14.07 | H805: 15 | I805: 10.25 | J805: 16.15 | K805: 13.07 | L805: =(H805-I805)/I805 -> 0.46341463414634149 | M805: =(J805-H805)/J805 -> 7.1207430340557196e-02 | N805: =(J805-K805)/K805 -> 0.23565416985462878 | Q805: 13.84 | R805: 15.21 | S805: 14.64 | AB805: 2w | AC805: =(J805-Q805)/J805 -> 0.14303405572755412 | AD805: =(R805-S805)/R805 -> 3.7475345167652878e-02 | AJ805: 是 | AK805: 是 | AL805: 是 | AM805: 是 | AO805: 可以入场 | AP805: 44608 | AQ805: 是
A806: 002921.SZ | B806: 联诚精密 | C806: 0.58999999999999997 | D806: 16.27 | E806: 16.52 | F806: 17.67 | H806: 19.31 | I806: 13.54 | J806: 21.64 | K806: 14.53 | L806: =(H806-I806)/I806 -> 0.42614475627769571 | M806: =(J806-H806)/J806 -> 0.1076709796672829 | N806: =(J806-K806)/K806 -> 0.48933241569167252 | Q806: 19.19 | AB806: 3w | AC806: =(J806-Q806)/J806 -> 0.11321626617375227 | AO806: 不宜入场（收缩幅度不够,应观察2w） | AP806: 44608 | AQ806: 是
A807: 603385.SH | B807: 惠达卫浴 | C807: 0.58999999999999997 | AQ807: 否
A808: 002440.SZ | B808: 闰土股份 | C808: 0.58999999999999997 | AQ808: 否
A809: 002441.SZ | B809: 众业达 | C809: 0.58999999999999997 | D809: 8.65 | E809: 8.86 | F809: 9.4000000000000004 | H809: 9.39 | AO809: 不宜入场（当前股价小于50日均线,应观察1w） | AP809: 44602 | AQ809: 是
A810: 002788.SZ | B810: 鹭燕医药 | C810: 0.58999999999999997 | D810: 7.55 | E810: 7.57 | F810: 7.73 | H810: 7.74 | I810: 6.57 | J810: 9.18 | K810: 7.04 | L810: =(H810-I810)/I810 -> 0.17808219178082191 | M810: =(J810-H810)/J810 -> 0.15686274509803916 | N810: =(J810-K810)/K810 -> 0.30397727272727271 | AO810: 不宜入场（当前股价距离最低点距离过小,应观察2w） | AP810: 44602 | AQ810: 是
A811: 002955.SZ | B811: 鸿合科技 | C811: 0.58999999999999997 | D811: 20.02 | E811: 20.09 | F811: 21.02 | H811: 22.22 | I811: 16.18 | J811: 24.11 | K811: 18.77 | L811: =(H811-I811)/I811 -> 0.3733003708281829 | M811: =(J811-H811)/J811 -> 7.8390709249274187e-02 | N811: =(J811-K811)/K811 -> 0.28449653702717104 | Q811: 19 | AB811: 4w | AC811: =(J811-Q811)/J811 -> 0.21194525093322272 | AO811: 不宜入场（收缩幅度不够,应观察2w） | AP811: 44602 | AQ811: 是
A812: 600958.SH | B812: 东方证券 | C812: 0.58999999999999997 | D812: 12.98 | E812: 13.47 | F812: 13.87 | H812: 13.05 | AO812: 不宜入场（当前股价小于150日均线,应观察2w） | AP812: 44602 | AQ812: 是
A813: 601828.SH | B813: 美凯龙 | C813: 0.58999999999999997 | AQ813: 否
A814: 603218.SH | B814: 日月股份 | C814: 0.58999999999999997 | AQ814: 否
A815: 603697.SH | B815: 有友食品 | C815: 0.58999999999999997 | AQ815: 否
A816: 603825.SH | B816: 华扬联众 | C816: 0.58999999999999997 | D816: 19.36 | E816: 20.03 | F816: 22.93 | H816: 26.76 | I816: 13.47 | J816: 31.65 | K816: 16.72 | L816: =(H816-I816)/I816 -> 0.98663697104677062 | M816: =(J816-H816)/J816 -> 0.15450236966824635 | N816: =(J816-K816)/K816 -> 0.89294258373205748 | Q816: 19.899999999999999 | AB816: 3w | AC816: =(J816-Q816)/J816 -> 0.37124802527646134 | AO816: 不宜入场（收缩幅度不够,应观察2w） | AP816: 44602 | AQ816: 是
A817: 603876.SH | B817: 鼎胜新材 | C817: 0.58999999999999997 | D817: 33.289999999999999 | E817: 35.590000000000003 | F817: 37.869999999999997 | H817: 34.5 | O817: 2 | P817: 是 | AO817: 不宜入场（当前股价小于50日均线,应观察1w） | AP817: 44626 | AQ817: 是
A818: 603979.SH | B818: 金诚信 | C818: 0.58999999999999997 | D818: 19.83 | E818: 20.38 | F818: 21.26 | H818: 23.399999999999999 | I818: 11.51 | J818: 29.66 | K818: 20.22 | L818: =(H818-I818)/I818 -> 1.0330147697654213 | M818: =(J818-H818)/J818 -> 0.21105866486850983 | N818: =(J818-K818)/K818 -> 0.4668644906033631 | Q818: 17.68 | R818: 23.09 | S818: 19.33 | AB818: 19w | AC818: =(J818-Q818)/J818 -> 0.40391099123398516 | AO818: 不宜入场（收缩幅度不够,应观察2w） | AP818: 44602 | AQ818: 是
A819: 000779.SZ | B819: 甘咨询 | C819: 0.58999999999999997 | D819: 9 | E819: 9.02 | F819: 9.39 | H819: 10.54 | I819: 7.87 | J819: 11.58 | K819: 8.45 | L819: =(H819-I819)/I819 -> 0.33926302414231246 | M819: =(J819-H819)/J819 -> 8.9810017271157241e-02 | N819: =(J819-K819)/K819 -> 0.3704142011834321 | Q819: 9.02 | AB819: 2w | AC819: =(J819-Q819)/J819 -> 0.22107081174438692 | AO819: 不宜入场（收缩幅度不够,应观察2w） | AP819: 44602 | AQ819: 是
A820: 600285.SH | B820: 羚锐制药 | C820: 0.58999999999999997 | D820: 11.699999999999999 | E820: 12.21 | F820: 13.84 | H820: 14.48 | I820: 7.84 | J820: 17.97 | K820: 10.74 | L820: =(H820-I820)/I820 -> 0.84693877551020413 | M820: =(J820-H820)/J820 -> 0.19421257651641619 | N820: =(J820-K820)/K820 -> 0.67318435754189931 | Q820: 12.66 | AB820: 2w | AC820: =(J820-Q820)/J820 -> 0.29549248747913182 | AO820: 不宜入场（收缩幅度不够,应观察2w） | AP820: 44602 | AQ820: 是
A821: 600876.SH | B821: 洛阳玻璃 | C821: 0.57999999999999996 | D821: 24.77 | E821: 26.01 | F821: 29.22 | H821: 26.36 | AO821: 不宜入场（当前股价小于50日均线,应观察1w） | AP821: 44602 | AQ821: 是
A822: 002007.SZ | B822: 华兰生物 | C822: 0.57999999999999996 | AQ822: 否
A823: 002111.SZ | B823: 威海广泰 | C823: 0.57999999999999996 | AQ823: 否
A824: 003001.SZ | B824: 中岩大地 | C824: 0.57999999999999996 | AQ824: 否
A825: 600483.SH | B825: 福能股份 | C825: 0.57999999999999996 | D825: 13.58 | E825: 14.1 | F825: 14.6 | H825: 13.92 | AO825: 不宜入场（当前股价小于150日均线,应观察2w） | AP825: 44602 | AQ825: 是
A826: 603323.SH | B826: 苏农银行 | C826: 0.57999999999999996 | D826: 4.93 | E826: 5 | F826: 5.19 | H826: 5.69 | I826: 4.28 | J826: 5.84 | K826: 4.95 | L826: =(H826-I826)/I826 -> 0.32943925233644861 | M826: =(J826-H826)/J826 -> 2.5684931506849223e-02 | N826: =(J826-K826)/K826 -> 0.17979797979797973 | AO826: 不宜入场（收缩幅度不够,应观察2w） | AP826: 44602 | AQ826: 是
A827: 603583.SH | B827: 捷昌驱动 | C827: 0.57999999999999996 | AQ827: 否
A828: 603788.SH | B828: 宁波高发 | C828: 0.57999999999999996 | D828: 13.43 | E828: 13.53 | F828: 13.73 | H828: 12.95 | AO828: 不宜入场（当前股价小于200日均线,应观察3w） | AP828: 44602 | AQ828: 是
A829: 603890.SH | B829: 春秋电子 | C829: 0.57999999999999996 | D829: 12.81 | E829: 12.77 | AO829: 不宜入场（150日均线小于200日均线,应观察6w） | AP829: 44602 | AQ829: 是
A830: 603896.SH | B830: 寿仙谷 | C830: 0.57999999999999996 | D830: 44.67 | E830: 46.29 | F830: 51.97 | H830: 55.61 | I830: 33.24 | J830: 63.33 | K830: 43.46 | L830: =(H830-I830)/I830 -> 0.67298435619735242 | M830: =(J830-H830)/J830 -> 0.12190115269224694 | N830: =(J830-K830)/K830 -> 0.45720202485043709 | Q830: 50 | AB830: 3w | AC830: =(J830-Q830)/J830 -> 0.21048476235591346 | AO830: 不宜入场（收缩幅度不够,应观察2w） | AP830: 44602 | AQ830: 是
A831: 605050.SH | B831: 福然德 | C831: 0.57999999999999996 | D831: 12.31 | E831: 12.45 | F831: 13.28 | H831: 13.01 | AO831: 不宜入场（当前股价小于50日均线,应观察1w） | AP831: 44602 | AQ831: 是
A832: 605580.SH | B832: 恒盛能源 | C832: 0.57999999999999996 | D832: 15.28 | E832: 15.67 | F832: 15.77 | H832: 14.37 | AO832: 不宜入场（当前股价小于200日均线,应观察3w） | AP832: 44602 | AQ832: 是
A833: 603809.SH | B833: 豪能股份 | C833: 0.57999999999999996 | D833: 17.81 | E833: 18.5 | F833: 20.15 | H833: 21.98 | I833: 11.99 | J833: 24.600000000000001 | K833: 16.02 | L833: =(H833-I833)/I833 -> 0.83319432860717269 | M833: =(J833-H833)/J833 -> 0.10650406504065044 | N833: =(J833-K833)/K833 -> 0.53558052434456938 | Q833: 18.68 | R833: 22 | S833: 18.88 | T833: 22.15 | U833: 20.300000000000001 | AB833: 8w | AC833: =(J833-Q833)/J833 -> 0.24065040650406511 | AD833: =(R833-S833)/R833 -> 0.14181818181818187 | AE833: =(T833-U833)/T833 -> 8.3521444695259503e-02 | AO833: 不宜入场（收缩幅度不够,应观察1w） | AP833: 44608 | AQ833: 是
A834: 000425.SZ | B834: 徐工机械 | C834: 0.57999999999999996 | AQ834: 否
A835: 002531.SZ | B835: 天顺风能 | C835: 0.57999999999999996 | D835: 15.21 | E835: 16.28 | F835: 18.47 | H835: 19.42 | I835: 7.05 | J835: 23.67 | K835: 14.43 | L835: =(H835-I835)/I835 -> 1.7546099290780144 | M835: =(J835-H835)/J835 -> 0.17955217574989438 | N835: =(J835-K835)/K835 -> 0.64033264033264048 | Q835: 16.05 | AB835: 12w | AC835: =(J835-Q835)/J835 -> 0.32192648922686945 | AO835: 不宜入场（收缩幅度不够,应观察2w） | AP835: 44602 | AQ835: 是
A836: 003016.SZ | B836: 欣贺股份 | C836: 0.57999999999999996 | AQ836: 否
A837: 000400.SZ | B837: 许继电气 | C837: 0.56999999999999995 | D837: 20.600000000000001 | E837: 21.74 | F837: 25 | H837: 23.21 | AO837: 不宜入场（当前股价小于50日均线,应观察1w） | AP837: 44602 | AQ837: 是
A838: 002106.SZ | B838: 莱宝高科 | C838: 0.56999999999999995 | D838: 11.08 | E838: 11.03 | AO838: 不宜入场（150日均线小于200日均线,应观察6w） | AP838: 44602 | AQ838: 是
A839: 600197.SH | B839: 伊力特 | C839: 0.56999999999999995 | D839: 25.63 | E839: 25.84 | F839: 25.36 | AO839: 不宜入场（50日均线小于200日均线,应观察5w） | AP839: 44602 | AQ839: 是
A840: 000050.SZ | B840: 深天马A | C840: 0.56999999999999995 | AQ840: 否
A841: 600422.SH | B841: 昆药集团 | C841: 0.56999999999999995 | D841: 9.37 | E841: 9.49 | F841: 10.05 | H841: 10.52 | I841: 7.41 | J841: 13.199999999999999 | K841: 8.39 | L841: =(H841-I841)/I841 -> 0.41970310391363014 | M841: =(J841-H841)/J841 -> 0.20303030303030303 | N841: =(J841-K841)/K841 -> 0.57330154946364698 | Q841: 9.41 | AB841: 3w | AC841: =(J841-Q841)/J841 -> 0.28712121212121205 | AO841: 不宜入场（收缩幅度不够,应观察2w） | AP841: 44602 | AQ841: 是
A842: 000683.SZ | B842: 远兴能源 | C842: 0.56999999999999995 | D842: 7.1299999999999999 | E842: 7.5899999999999999 | F842: 8.3699999999999992 | H842: 10.24 | I842: 2.0099999999999998 | J842: 13.539999999999999 | K842: 6.9000000000000004 | L842: =(H842-I842)/I842 -> 4.0945273631840804 | M842: =(J842-H842)/J842 -> 0.24372230428360409 | N842: =(J842-K842)/K842 -> 0.96231884057970996 | O842: 2 | P842: 是 | Q842: 6.4100000000000001 | R842: 8.2899999999999991 | S842: 6.7400000000000002 | T842: 9.5700000000000003 | U842: 8.1999999999999993 | V842: 10.390000000000001 | W842: 8.5099999999999998 | AB842: 13w | AC842: =(J842-Q842)/J842 -> 0.52658788774002951 | AD842: =(R842-S842)/R842 -> 0.18697225572979481 | AE842: =(T842-U842)/T842 -> 0.1431556948798329 | AF842: =(V842-W842)/V842 -> 0.18094321462945145 | AO842: 不宜入场（收缩幅度不够,应观察1w） | AP842: 44625 | AQ842: 是
A843: 600406.SH | B843: 国电南瑞 | C843: 0.56999999999999995 | D843: 34.32 | E843: 35.71 | F843: 38.43 | H843: 33.600000000000001 | AO843: 不宜入场（当前股价小于200日均线,应观察3w） | AP843: 44602 | AQ843: 是
A844: 601187.SH | B844: 厦门银行 | C844: 0.56999999999999995 | AQ844: 否
A845: 601811.SH | B845: 新华文轩 | C845: 0.56999999999999995 | AQ845: 否
A846: 603456.SH | B846: 九洲药业 | C846: 0.56999999999999995 | D846: 48.299999999999997 | E846: 49.299999999999997 | F846: 49.73 | H846: 40.200000000000003 | AO846: 不宜入场（当前股价小于200日均线,应观察3w） | AP846: 44602 | AQ846: 是
A847: 603755.SH | B847: 日辰股份 | C847: 0.56999999999999995 | AQ847: 否
A848: 603810.SH | B848: 丰山集团 | C848: 0.56999999999999995 | AQ848: 否
A849: 605186.SH | B849: 健麾信息 | C849: 0.56999999999999995 | D849: 34.83 | E849: 35.97 | F849: 36.92 | H849: 32.88 | AO849: 不宜入场（当前股价小于200日均线,应观察3w） | AP849: 44602 | AQ849: 是
A850: 600282.SH | B850: 南钢股份 | C850: 0.56999999999999995 | AQ850: 否
A851: 000666.SZ | B851: 经纬纺机 | C851: 0.56000000000000005 | D851: 8.37 | E851: 8.42 | F851: 8.57 | H851: 8.92 | I851: 6.64 | J851: 9.65 | K851: 7.82 | L851: =(H851-I851)/I851 -> 0.34337349397590367 | M851: =(J851-H851)/J851 -> 7.5647668393782425e-02 | N851: =(J851-K851)/K851 -> 0.2340153452685422 | Q851: 7.67 | R851: 9.12 | S851: 8.01 | T851: 9.13 | U851: 8.59 | AB851: 13w | AC851: =(J851-Q851)/J851 -> 0.2051813471502591 | AD851: =(R851-S851)/R851 -> 0.12171052631578942 | AE851: =(T851-U851)/T851 -> 5.9145673603505027e-02 | AJ851: 是 | AK851: 否 | AL851: 是 | AM851: 是 | AO851: 不宜入场（成交量行为不符合,应观察1w） | AP851: 44606 | AQ851: 是
A852: 000725.SZ | B852: 京东方A | C852: 0.56000000000000005 | AQ852: 否
A853: 000938.SZ | B853: 紫光股份 | C853: 0.56000000000000005 | AQ853: 否
A854: 002191.SZ | B854: 劲嘉股份 | C854: 0.56000000000000005 | D854: 12.78 | E854: 13.42 | F854: 15.77 | H854: 17.71 | I854: 8.95 | J854: 18.87 | K854: 13.75 | L854: =(H854-I854)/I854 -> 0.97877094972067069 | M854: =(J854-H854)/J854 -> 6.1473237943826184e-02 | N854: =(J854-K854)/K854 -> 0.37236363636363645 | Q854: 15.56 | AB854: 2w | AC854: =(J854-Q854)/J854 -> 0.17541070482246954 | AJ854: 是 | AK854: 是 | AL854: 是 | AM854: 否 | AO854: 不宜入场（收缩幅度不够,应观察1w） | AP854: 44608 | AQ854: 是
A855: 002312.SZ | B855: 川发龙蟒 | C855: 0.56000000000000005 | D855: 12.25 | E855: 12.72 | F855: 12.79 | H855: 11.39 | AO855: 不宜入场（当前股价小于200日均线,应观察3w） | AP855: 44602 | AQ855: 是
A856: 002973.SZ | B856: 侨银股份 | C856: 0.56000000000000005 | AQ856: 否
A857: 600757.SH | B857: 长江传媒 | C857: 0.56000000000000005 | D857: 5.31 | E857: 5.34 | F857: 5.45 | H857: 5.77 | I857: 4.56 | J857: 6.06 | K857: 5.28 | L857: =(H857-I857)/I857 -> 0.26535087719298245 | M857: =(J857-H857)/J857 -> 4.7854785478547865e-02 | N857: =(J857-K857)/K857 -> 0.1477272727272726 | Q857: 5.08 | R857: 5.82 | S857: 5.51 | AB857: 2w | AC857: =(J857-Q857)/J857 -> 0.16171617161716165 | AD857: =(R857-S857)/R857 -> 5.3264604810996645e-02 | AK857: 否 | AO857: 不宜入场（收缩幅度不够,应观察1w） | AP857: 44608 | AQ857: 是
A858: 600895.SH | B858: 张江高科 | C858: 0.56000000000000005 | AQ858: 否
A859: 601098.SH | B859: 中南传媒 | C859: 0.56000000000000005 | D859: 9.26 | E859: 9.24 | AO859: 不宜入场（150日均线小于200日均线,应观察5w） | AP859: 44602 | AQ859: 是
A860: 601818.SH | B860: 光大银行 | C860: 0.56000000000000005 | AQ860: 否
A861: 603080.SH | B861: 新疆火炬 | C861: 0.56000000000000005 | D861: 15.32 | E861: 15.64 | F861: 16.33 | H861: 16.5 | I861: 9.41 | J861: 20.82 | K861: 13.23 | L861: =(H861-I861)/I861 -> 0.75345377258235913 | M861: =(J861-H861)/J861 -> 0.207492795389049 | N861: =(J861-K861)/K861 -> 0.57369614512471656 | Q861: 14.35 | R861: 18.37 | S861: 14.63 | AB861: 2w | AC861: =(J861-Q861)/J861 -> 0.31075888568683963 | AD861: =(R861-S861)/R861 -> 0.20359281437125748 | AO861: 不宜入场（收缩幅度不够,应观察2w） | AP861: 44602 | AQ861: 是
A862: 603108.SH | B862: 润达医疗 | C862: 0.56000000000000005 | D862: 11.73 | E862: 11.84 | F862: 12.49 | H862: 11.41 | AO862: 不宜入场（当前股价小于200日均线,应观察3w） | AP862: 44602 | AQ862: 是
A863: 605060.SH | B863: 联德股份 | C863: 0.56000000000000005 | D863: 17.22 | E863: 17.29 | F863: 18.27 | H863: 20.44 | I863: 13.78 | J863: 22.12 | K863: 22.12 | L863: =(H863-I863)/I863 -> 0.48330914368650235 | M863: =(J863-H863)/J863 -> 7.5949367088607583e-02 | N863: =(J863-K863)/K863 -> 0 | Q863: 13.78 | R863: 18.25 | S863: 15.83 | T863: 18.600000000000001 | U863: 16.16 | V863: 20.82 | W863: 18.57 | AB863: 2w | AC863: =(J863-Q863)/J863 -> 0.37703435804701635 | AD863: =(R863-S863)/R863 -> 0.1326027397260274 | AE863: =(T863-U863)/T863 -> 0.1311827956989248 | AF863: =(V863-W863)/V863 -> 0.10806916426512968 | AO863: 不宜入场（收缩幅度不够,应观察2w） | AP863: 44602 | AQ863: 是
A864: 605298.SH | B864: 必得科技 | C864: 0.56000000000000005 | AQ864: 否
A865: 601200.SH | B865: 上海环境 | C865: 0.56000000000000005 | D865: 11.91 | E865: 12.01 | F865: 12.19 | H865: 12.12 | AO865: 不宜入场（当前股价小于50日均线,应观察1w） | AP865: 44602 | AQ865: 是
A866: 600487.SH | B866: 亨通光电 | C866: 0.56000000000000005 | D866: 13.92 | E866: 14.23 | F866: 14.78 | H866: 14.18 | AO866: 不宜入场（当前股价小于150日均线,应观察2w） | AP866: 44602 | AQ866: 是
A867: 002105.SZ | B867: 信隆健康 | C867: 0.56000000000000005 | D867: 9.09 | E867: 9.24 | F867: 9.71 | H867: 10.13 | I867: 6.41 | J867: 11.28 | K867: 9.14 | L867: =(H867-I867)/I867 -> 0.58034321372854925 | M867: =(J867-H867)/J867 -> 0.10195035460992896 | N867: =(J867-K867)/K867 -> 0.23413566739606112 | Q867: 8.89 | AB867: 3w | AC867: =(J867-Q867)/J867 -> 0.21187943262411338 | AO867: 不宜入场（收缩幅度不够,应观察2w） | AP867: 44602 | AQ867: 是
A868: 600711.SH | B868: 盛屯矿业 | C868: 0.56000000000000005 | D868: 9.71 | E868: 10.05 | F868: 10.36 | H868: 9.88 | AO868: 不宜入场（当前股价小于150日均线,应观察2w） | AP868: 44602 | AQ868: 是
A869: 603982.SH | B869: 泉峰汽车 | C869: 0.55000000000000004 | D869: 28.81 | E869: 31.09 | F869: 37.200000000000003 | H869: 30.600000000000001 | AO869: 不宜入场（当前股价小于150日均线,应观察2w） | AP869: 44602 | AQ869: 是
A870: 002649.SZ | B870: 博彦科技 | C870: 0.55000000000000004 | D870: 11.37 | E870: 11.61 | F870: 12.51 | H870: 13.84 | I870: 8.22 | J870: 14.9 | K870: 11.99 | L870: =(H870-I870)/I870 -> 0.6836982968369828 | M870: =(J870-H870)/J870 -> 7.1140939597315461e-02 | N870: =(J870-K870)/K870 -> 0.2427022518765638 | Q870: 11.55 | AB870: 3w | AC870: =(J870-Q870)/J870 -> 0.22483221476510065 | AO870: 不宜入场（收缩幅度不够,应观察2w） | AP870: 44602 | AQ870: 是
A871: 603588.SH | B871: 高能环境 | C871: 0.55000000000000004 | D871: 16.09 | E871: 16.23 | F871: 16.58 | H871: 17.14 | I871: 9.45 | J871: 20 | K871: 15.25 | L871: =(H871-I871)/I871 -> 0.8137566137566139 | M871: =(J871-H871)/J871 -> 0.14299999999999996 | N871: =(J871-K871)/K871 -> 0.31147540983606559 | Q871: 14.33 | R871: 18.03 | S871: 15.61 | T871: 17.52 | U871: 16.31 | AB871: 2w | AC871: =(J871-Q871)/J871 -> 0.28349999999999997 | AD871: =(R871-S871)/R871 -> 0.13422074320576824 | AE871: =(T871-U871)/T871 -> 6.9063926940639314e-02 | AJ871: 是 | AK871: 是 | AM871: 是 | AO871: 不宜入场（错过最佳入场点,应观察1w寻找新的入场点） | AP871: 44608 | AQ871: 是
A872: 002576.SZ | B872: 通达动力 | C872: 0.55000000000000004 | D872: 14.76 | E872: 15.29 | F872: 15.99 | H872: 14.53 | AO872: 不宜入场（当前股价小于200日均线,应观察3w） | AP872: 44602 | AQ872: 是
A873: 002497.SZ | B873: 雅化集团 | C873: 0.55000000000000004 | AQ873: 否
A874: 600460.SH | B874: 士兰微 | C874: 0.55000000000000004 | D874: 51.88 | E874: 53.97 | F874: 54.28 | H874: 52.94 | AO874: 不宜入场（当前股价小于150日均线,应观察2w） | AP874: 44602 | AQ874: 是
A875: 000823.SZ | B875: 超声电子 | C875: 0.55000000000000004 | D875: 11.95 | E875: 12.19 | F875: 12.72 | H875: 12.13 | AO875: 不宜入场（当前股价小于150日均线,应观察2w） | AP875: 44602 | AQ875: 是
A876: 603327.SH | B876: 福蓉科技 | C876: 0.55000000000000004 | AQ876: 否
A877: 000550.SZ | B877: 江铃汽车 | C877: 0.55000000000000004 | AQ877: 否
A878: 000635.SZ | B878: 英力特 | C878: 0.55000000000000004 | AQ878: 否
A879: 002144.SZ | B879: 宏达高科 | C879: 0.55000000000000004 | D879: 9.59 | E879: 9.68 | F879: 9.89 | H879: 9.9000000000000004 | I879: 8.4000000000000004 | J879: 10.93 | K879: 9.54 | L879: =(H879-I879)/I879 -> 0.17857142857142858 | M879: =(J879-H879)/J879 -> 9.4236047575480278e-02 | N879: =(J879-K879)/K879 -> 0.14570230607966464 | AO879: 不宜入场（当前股价距离最低点距离过小,应观察2w） | AP879: 44602 | AQ879: 是
A880: 002443.SZ | B880: 金洲管道 | C880: 0.55000000000000004 | D880: 6.79 | E880: 6.92 | F880: 7.76 | H880: 8.58 | I880: 5.42 | J880: 10.14 | K880: 5.73 | L880: =(H880-I880)/I880 -> 0.58302583025830257 | M880: =(J880-H880)/J880 -> 0.15384615384615388 | N880: =(J880-K880)/K880 -> 0.76963350785340312 | Q880: 7.38 | AB880: 3w | AC880: =(J880-Q880)/J880 -> 0.27218934911242609 | AO880: 不宜入场（收缩幅度不够,应观察2w） | AP880: 44602 | AQ880: 是
A881: 600363.SH | B881: 联创光电 | C881: 0.55000000000000004 | D881: 28.87 | E881: 29.37 | F881: 29.03 | AO881: 不宜入场（50日均线小于150日均线,应观察4w） | AP881: 44602 | AQ881: 是
A882: 601117.SH | B882: 中国化学 | C882: 0.55000000000000004 | D882: 10.06 | E882: 10.51 | F882: 11.16 | H882: 10.85 | AO882: 不宜入场（当前股价小于50日均线,应观察1w） | AP882: 44602 | AQ882: 是
A883: 601138.SH | B883: 工业富联 | C883: 0.55000000000000004 | AQ883: 否
A884: 603219.SH | B884: 富佳股份 | C884: 0.55000000000000004 | D884: 16.31 | E884: 16.86 | F884: 18.51 | H884: 17.27 | AO884: 不宜入场（当前股价小于50日均线,应观察1w） | AP884: 44602 | AQ884: 是
A885: 603238.SH | B885: 诺邦股份 | C885: 0.55000000000000004 | AQ885: 否
A886: 603505.SH | B886: 金石资源 | C886: 0.55000000000000004 | D886: 33.68 | E886: 35.33 | F886: 36.14 | H886: 35.100000000000001 | AO886: 不宜入场（当前股价小于150日均线,应观察2w） | AP886: 44602 | AQ886: 是
A887: 603856.SH | B887: 东宏股份 | C887: 0.55000000000000004 | D887: 12.89 | E887: 13.04 | F887: 14.16 | H887: 15.95 | I887: 10.72 | J887: 17.5 | K887: 12.22 | L887: =(H887-I887)/I887 -> 0.48787313432835805 | M887: =(J887-H887)/J887 -> 8.8571428571428606e-02 | N887: =(J887-K887)/K887 -> 0.43207855973813414 | AO887: 不宜入场（收缩幅度不够,应观察2w） | AP887: 44602 | AQ887: 是
A888: 605133.SH | B888: 嵘泰股份 | C888: 0.55000000000000004 | D888: 24.19 | E888: 24.47 | F888: 26.54 | H888: 23.98 | AO888: 不宜入场（当前股价小于200日均线,应观察3w） | AP888: 44602 | AQ888: 是
A889: 605378.SH | B889: 野马电池 | C889: 0.55000000000000004 | AQ889: 否
A890: 600897.SH | B890: 厦门空港 | C890: 0.55000000000000004 | AQ890: 否
A891: 600180.SH | B891: 瑞茂通 | C891: 0.55000000000000004 | D891: 6.24 | E891: 6.41 | F891: 6.95 | H891: 7.72 | I891: 4.72 | J891: 8.27 | K891: 6.28 | L891: =(H891-I891)/I891 -> 0.63559322033898313 | M891: =(J891-H891)/J891 -> 6.6505441354292608e-02 | N891: =(J891-K891)/K891 -> 0.31687898089171962 | Q891: 6.39 | AB891: 1w | AC891: =(J891-Q891)/J891 -> 0.22732769044740023 | AO891: 不宜入场（收缩幅度不够,应观察2w） | AP891: 44602 | AQ891: 是
A892: 000411.SZ | B892: 英特集团 | C892: 0.55000000000000004 | D892: 13.31 | E892: 13.37 | F892: 13.76 | H892: 13.21 | AO892: 不宜入场（当前股价小于200日均线,应观察3w） | AP892: 44602 | AQ892: 是
A893: 002056.SZ | B893: 横店东磁 | C893: 0.54000000000000004 | D893: 15.91 | E893: 16.27 | F893: 17.21 | H893: 16.61 | AO893: 不宜入场（当前股价小于50日均线,应观察1w） | AP893: 44602 | AQ893: 是
A894: 000987.SZ | B894: 越秀金控 | C894: 0.54000000000000004 | AQ894: 否
A895: 002020.SZ | B895: 京新药业 | C895: 0.54000000000000004 | D895: 8.78 | E895: 8.75 | AO895: 不宜入场（150日均线小于200日均线,应观察6w） | AP895: 44602 | AQ895: 是
A896: 002393.SZ | B896: 力生制药 | C896: 0.54000000000000004 | D896: 19.82 | E896: 19.94 | F896: 20.55 | H896: 21.75 | I896: 16.36 | J896: 22.38 | K896: 18.27 | L896: =(H896-I896)/I896 -> 0.32946210268948661 | M896: =(J896-H896)/J896 -> 2.8150134048257329e-02 | N896: =(J896-K896)/K896 -> 0.22495894909688011 | O896: 1 | P896: 否 | Q896: 19.62 | R896: 22.25 | S896: 20.58 | T896: 24.76 | U896: 23.12 | AB896: 6w | AC896: =(J896-Q896)/J896 -> 0.12332439678284174 | AD896: =(R896-S896)/R896 -> 7.5056179775280979e-02 | AE896: =(T896-U896)/T896 -> 6.6235864297253658e-02 | AJ896: 是 | AK896: 是 | AL896: 是 | AM896: 是 | AO896: 可以入场 | AP896: 44623 | AQ896: 是
A897: 002643.SZ | B897: 万润股份 | C897: 0.54000000000000004 | D897: 20.39 | E897: 20.99 | F897: 22.26 | H897: 21.19 | P897: 是 | AO897: 不宜入场（当前股价小于200日均线,应观察3w） | AP897: 44626 | AQ897: 是
A898: 002802.SZ | B898: 洪汇新材 | C898: 0.54000000000000004 | AQ898: 否
A899: 002829.SZ | B899: 星网宇达 | C899: 0.54000000000000004 | D899: 35.59 | E899: 36.16 | F899: 38.53 | H899: 40.71 | I899: 28.81 | J899: 42.799999999999997 | K899: 36.24 | L899: =(H899-I899)/I899 -> 0.41305102395001747 | M899: =(J899-H899)/J899 -> 4.8831775700934499e-02 | N899: =(J899-K899)/K899 -> 0.18101545253863122 | Q899: 37.98 | R899: 41.96 | S899: 38.88 | AB899: 2w | AC899: =(J899-Q899)/J899 -> 0.11261682242990656 | AD899: =(R899-S899)/R899 -> 7.3403241182078124e-02 | AK899: 否 | AO899: 不宜入场（收缩幅度不够,应观察1w） | AP899: 44608 | AQ899: 是
A900: 002839.SZ | B900: 张家港行 | C900: 0.54000000000000004 | D900: 5.78 | E900: 5.85 | F900: 6.0999999999999996 | H900: 6.57 | I900: 5.19 | J900: 6.75 | K900: 5.77 | L900: =(H900-I900)/I900 -> 0.26589595375722541 | M900: =(J900-H900)/J900 -> 2.6666666666666623e-02 | N900: =(J900-K900)/K900 -> 0.16984402079722713 | Q900: 6.17 | AB900: 2w | AC900: =(J900-Q900)/J900 -> 8.5925925925925933e-02 | AO900: 不宜入场（收缩幅度不够,应观察1w） | AP900: 44602 | AQ900: 是
A901: 002926.SZ | B901: 华西证券 | C901: 0.54000000000000004 | D901: 9.54 | E901: 9.52 | AQ901: 否
A902: 600848.SH | B902: 上海临港 | C902: 0.54000000000000004 | AQ902: 否
A903: 601339.SH | B903: 百隆东方 | C903: 0.54000000000000004 | D903: 5.65 | E903: 5.76 | F903: 6.18 | H903: 7.32 | I903: 3.96 | J903: 7.58 | K903: 5.16 | L903: =(H903-I903)/I903 -> 0.84848484848484862 | M903: =(J903-H903)/J903 -> 3.4300791556728202e-02 | N903: =(J903-K903)/K903 -> 0.4689922480620155 | O903: 2 | Q903: 6.42 | R903: 7.57 | S903: 6.63 | AB903: 4w | AC903: =(J903-Q903)/J903 -> 0.15303430079155675 | AD903: =(R903-S903)/R903 -> 0.12417437252311761 | AJ903: 是 | AK903: 是 | AL903: 是 | AM903: 是 | AO903: 不宜入场（等待两个交易的反弹,应观察1w） | AP903: 44621 | AQ903: 是
A904: 601633.SH | B904: 长城汽车 | C904: 0.54000000000000004 | AQ904: 否
A905: 603358.SH | B905: 华达科技 | C905: 0.54000000000000004 | D905: 18.76 | E905: 19.21 | F905: 20.12 | H905: 19.63 | AO905: 不宜入场（当前股价小于50日均线,应观察1w） | AP905: 44602 | AQ905: 是
A906: 603848.SH | B906: 好太太 | C906: 0.54000000000000004 | D906: 13.21 | E906: 13.38 | F906: 14.1 | H906: 14.5 | I906: 11.35 | J906: 16.14 | K906: 14.94 | L906: =(H906-I906)/I906 -> 0.27753303964757714 | M906: =(J906-H906)/J906 -> 0.10161090458488231 | N906: =(J906-K906)/K906 -> 8.0321285140562318e-02 | Q906: 13.95 | AB906: 2w | AC906: =(J906-Q906)/J906 -> 0.13568773234200751 | AO906: 不宜入场（收缩幅度不够,应观察1w） | AP906: 44608 | AQ906: 是
A907: 600639.SH | B907: 浦东金桥 | C907: 0.54000000000000004 | D907: 12.07 | E907: 12.09 | F907: 12.2 | H907: 12.24 | I907: 10.63 | J907: 15.27 | K907: 11.82 | L907: =(H907-I907)/I907 -> 0.15145813734713071 | M907: =(J907-H907)/J907 -> 0.19842829076620822 | N907: =(J907-K907)/K907 -> 0.29187817258883242 | AO907: 不宜入场（当前股价距离最低点距离过小,应观察1w） | AP907: 44602 | AQ907: 是
A908: 002156.SZ | B908: 通富微电 | C908: 0.53000000000000003 | AQ908: 否
A909: 600901.SH | B909: 江苏租赁 | C909: 0.53000000000000003 | AQ909: 否
A910: 601019.SH | B910: 山东出版 | C910: 0.53000000000000003 | D910: 5.93 | E910: 5.96 | F910: 6.09 | H910: 6.45 | I910: 5.04 | J910: 6.67 | K910: 5.5999999999999996 | L910: =(H910-I910)/I910 -> 0.27976190476190477 | M910: =(J910-H910)/J910 -> 3.2983508245877022e-02 | N910: =(J910-K910)/K910 -> 0.19107142857142864 | Q910: 5.45 | R910: 6.54 | S910: 5.82 | T910: 6.51 | U910: 6.27 | AB910: 2w | AC910: =(J910-Q910)/J910 -> 0.18290854572713638 | AD910: =(R910-S910)/R910 -> 0.11009174311926602 | AE910: =(T910-U910)/T910 -> 3.6866359447004643e-02 | AK910: 否 | AO910: 不宜入场（成交量不符合标准,应观察1w） | AP910: 44617 | AQ910: 是
A911: 601988.SH | B911: 中国银行 | C911: 0.53000000000000003 | AQ911: 否
A912: 603600.SH | B912: 永艺股份 | C912: 0.53000000000000003 | D912: 11.22 | E912: 11.27 | F912: 11.55 | H912: 10.74 | AO912: 不宜入场（当前股价小于200日均线,应观察3w） | AP912: 44602 | AQ912: 是
A913: 603685.SH | B913: 晨丰科技 | C913: 0.53000000000000003 | AQ913: 否
A914: 002081.SZ | B914: 金螳螂 | C914: 0.53000000000000003 | AQ914: 否
A915: 002581.SZ | B915: 未名医药 | C915: 0.53000000000000003 | D915: 16.79 | E915: 17.5 | F915: 18.92 | H915: 16.58 | AO915: 不宜入场（当前股价小于200日均线,应观察3w） | AP915: 44602 | AQ915: 是
A916: 002394.SZ | B916: 联发股份 | C916: 0.53000000000000003 | AQ916: 否
A917: 601377.SH | B917: 兴业证券 | C917: 0.53000000000000003 | AQ917: 否
A918: 002815.SZ | B918: 崇达技术 | C918: 0.52000000000000002 | D918: 14.11 | E918: 14.52 | F918: 15.57 | H918: 14.93 | AO918: 不宜入场（当前股价小于50日均线,应观察1w） | AP918: 44602 | AQ918: 是
A919: 600368.SH | B919: 五洲交通 | C919: 0.52000000000000002 | D919: 3.79 | E919: 3.83 | F919: 3.95 | H919: 4.13 | I919: 2.97 | J919: 4.45 | K919: 3.59 | L919: =(H919-I919)/I919 -> 0.39057239057239046 | M919: =(J919-H919)/J919 -> 7.1910112359550624e-02 | N919: =(J919-K919)/K919 -> 0.23955431754874662 | Q919: 3.54 | R919: 4.22 | S919: 3.74 | T919: 4.22 | U919: 3.8999999999999999 | AB919: 17w | AC919: =(J919-Q919)/J919 -> 0.20449438202247194 | AD919: =(R919-S919)/R919 -> 0.11374407582938378 | AE919: =(T919-U919)/T919 -> 7.5829383886255888e-02 | AK919: 否 | AO919: 不宜入场（成交量不符合标准,应观察1w） | AP919: 44617 | AQ919: 是
A920: 000686.SZ | B920: 东北证券 | C920: 0.52000000000000002 | D920: 8.67 | E920: 8.72 | F920: 8.81 | H920: 8.77 | AO920: 不宜入场（当前股价小于50日均线,应观察1w） | AP920: 44602 | AQ920: 是
A921: 002003.SZ | B921: 伟星股份 | C921: 0.52000000000000002 | D921: 9.95 | E921: 10.61 | F921: 12.74 | H921: 13.05 | I921: 5.62 | J921: 14.79 | K921: 10.09 | L921: =(H921-I921)/I921 -> 1.3220640569395019 | M921: =(J921-H921)/J921 -> 0.11764705882352931 | N921: =(J921-K921)/K921 -> 0.46580773042616447 | Q921: 12.4 | AB921: 2w | AC921: =(J921-Q921)/J921 -> 0.16159567275185929 | AO921: 不宜入场（收缩幅度不够,应观察1w） | AP921: 44608 | AQ921: 是
A922: 002996.SZ | B922: 顺博合金 | C922: 0.52000000000000002 | AQ922: 否
A923: 600802.SH | B923: 福建水泥 | C923: 0.52000000000000002 | AQ923: 否
A924: 600867.SH | B924: 通化东宝 | C924: 0.52000000000000002 | AQ924: 否
A925: 603128.SH | B925: 华贸物流 | C925: 0.52000000000000002 | AQ925: 否
A926: 603278.SH | B926: 大业股份 | C926: 0.52000000000000002 | D926: 9.98 | E926: 10.24 | F926: 11.05 | H926: 10.300000000000001 | AO926: 不宜入场（当前股价小于50日均线,应观察1w） | AP926: 44602 | AQ926: 是
A927: 603518.SH | B927: 锦泓集团 | C927: 0.52000000000000002 | AQ927: 否
A928: 603992.SH | B928: 松霖科技 | C928: 0.52000000000000002 | AQ928: 否
A929: 605598.SH | B929: 上海港湾 | C929: 0.52000000000000002 | O929: 2 | P929: 是 | AO929: 不宜入场（150日小于200日均线,应观察6w） | AP929: 44625 | AQ929: 否
A930: 002950.SZ | B930: 奥美医疗 | C930: 0.52000000000000002 | AQ930: 否
A931: 603966.SH | B931: 法兰泰克 | C931: 0.52000000000000002 | AQ931: 否
A932: 600590.SH | B932: 泰豪科技 | C932: 0.52000000000000002 | D932: 7.35 | E932: 7.54 | F932: 7.7000000000000002 | H932: 7.15 | AO932: 不宜入场（当前股价小于200日均线,应观察3w） | AP932: 44602 | AQ932: 是
A933: 600380.SH | B933: 健康元 | C933: 0.52000000000000002 | AQ933: 否
A934: 600580.SH | B934: 卧龙电驱 | C934: 0.51000000000000001 | D934: 14.83 | E934: 15.45 | F934: 16.61 | H934: 14.94 | AO934: 不宜入场（当前股价小于150日均线,应观察2w） | AP934: 44602 | AQ934: 是
A935: 002135.SZ | B935: 东南网架 | C935: 0.51000000000000001 | D935: 9.45 | E935: 9.82 | F935: 10.68 | H935: 11.07 | I935: 6.13 | J935: 13.91 | K935: 7.61 | L935: =(H935-I935)/I935 -> 0.80587275693311589 | M935: =(J935-H935)/J935 -> 0.20416966211358734 | N935: =(J935-K935)/K935 -> 0.82785808147174766 | Q935: 8.78 | R935: 12.68 | S935: 8.82 | T935: 12.92 | U935: 9.75 | AB935: 2w | AC935: =(J935-Q935)/J935 -> 0.36879942487419126 | AD935: =(R935-S935)/R935 -> 0.3044164037854889 | AE935: =(T935-U935)/T935 -> 0.24535603715170279 | AO935: 不宜入场（收缩幅度不够,应观察2w） | AP935: 44602 | AQ935: 是
A936: 002234.SZ | B936: 民和股份 | C936: 0.51000000000000001 | D936: 15.52 | E936: 15.66 | F936: 16.13 | H936: 17.100000000000001 | I936: 12.05 | J936: 18.15 | K936: 13.86 | L936: =(H936-I936)/I936 -> 0.41908713692946059 | M936: =(J936-H936)/J936 -> 5.7851239669421337e-02 | N936: =(J936-K936)/K936 -> 0.30952380952380948 | Q936: 14.68 | R936: 17.62 | S936: 15.84 | AB936: 8w | AC936: =(J936-Q936)/J936 -> 0.19118457300275477 | AD936: =(R936-S936)/R936 -> 0.10102156640181617 | AO936: 不宜入场（收缩幅度不够,应观察1w） | AP936: 44608 | AQ936: 是
A937: 002275.SZ | B937: 桂林三金 | C937: 0.51000000000000001 | D937: 13.84 | E937: 14.12 | F937: 15.16 | H937: 14.41 | AO937: 不宜入场（当前股价小于50日均线,应观察1w） | AP937: 44602 | AQ937: 是
A938: 002728.SZ | B938: 特一药业 | C938: 0.51000000000000001 | D938: 13.82 | E938: 14.25 | F938: 15.57 | H938: 15.61 | I938: 9.17 | J938: 19.58 | K938: 13.73 | L938: =(H938-I938)/I938 -> 0.70229007633587781 | M938: =(J938-H938)/J938 -> 0.20275791624106226 | N938: =(J938-K938)/K938 -> 0.4260742898761834 | Q938: 14.199999999999999 | AB938: 2w | AC938: =(J938-Q938)/J938 -> 0.27477017364657813 | AO938: 不宜入场（收缩幅度不够,应观察2w） | AP938: 44602 | AQ938: 是
A939: 601231.SH | B939: 环旭电子 | C939: 0.51000000000000001 | AQ939: 否
A940: 601238.SH | B940: 广汽集团 | C940: 0.51000000000000001 | D940: 14.68 | E940: 15.07 | F940: 15.02 | AO940: 不宜入场（50日均线小于150日均线,应观察4w） | AP940: 44602 | AQ940: 是
A941: 601965.SH | B941: 中国汽研 | C941: 0.51000000000000001 | D941: 17.22 | E941: 17.399999999999999 | F941: 17.34 | AO941: 不宜入场（50日均线小于150日均线,应观察4w） | AP941: 44602 | AQ941: 是
A942: 603811.SH | B942: 诚意药业 | C942: 0.51000000000000001 | AQ942: 否
A943: 605011.SH | B943: 杭州热电 | C943: 0.51000000000000001 | D943: 18.96 | E943: 20.08 | F943: 20.64 | H943: 18.46 | AO943: 不宜入场（当前股价小于200日均线,应观察3w） | AP943: 44602 | AQ943: 是
A944: 605183.SH | B944: 确成股份 | C944: 0.51000000000000001 | D944: 18.25 | E944: 18.42 | F944: 18.62 | H944: 18.19 | AO944: 不宜入场（当前股价小于200日均线,应观察3w） | AP944: 44602 | AQ944: 是
A945: 600109.SH | B945: 国金证券 | C945: 0.51000000000000001 | AQ945: 否
A946: 000930.SZ | B946: 中粮科技 | C946: 0.51000000000000001 | D946: 10.14 | E946: 10.29 | F946: 10.55 | H946: 10.38 | AO946: 不宜入场（当前股价小于150日均线,应观察2w） | AP946: 44602 | AQ946: 是
A947: 600018.SH | B947: 上港集团 | C947: 0.51000000000000001 | D947: 5.29 | E947: 5.4000000000000004 | F947: 5.69 | H947: 6.12 | I947: 4.12 | J947: 6.39 | K947: 5.2000000000000002 | L947: =(H947-I947)/I947 -> 0.4854368932038835 | M947: =(J947-H947)/J947 -> 4.22535211267605e-02 | N947: =(J947-K947)/K947 -> 0.22884615384615375 | Q947: 4.57 | R947: 5.96 | S947: 5.36 | T947: 6.22 | U947: 5.64 | AB947: 17w | AC947: =(J947-Q947)/J947 -> 0.28482003129890449 | AD947: =(R947-S947)/R947 -> 0.10067114093959725 | AE947: =(T947-U947)/T947 -> 9.3247588424437311e-02 | AO947: 不宜入场（收缩幅度不够,应观察2w） | AP947: 44602 | AQ947: 是
A948: 002270.SZ | B948: 华明装备 | C948: 0.51000000000000001 | D948: 7.66 | E948: 8.15 | F948: 9.06 | H948: 8.26 | AO948: 不宜入场（当前股价小于50日均线,应观察1w） | AP948: 44602 | AQ948: 是
A949: 601882.SH | B949: 海天精工 | C949: 0.5 | D949: 22.04 | E949: 22.99 | F949: 23.73 | H949: 21.88 | AO949: 不宜入场（当前股价小于200日均线,应观察3w） | AP949: 44602 | AQ949: 是
A950: 603020.SH | B950: 爱普股份 | C950: 0.5 | AQ950: 否
A951: 000860.SZ | B951: 顺鑫农业 | C951: 0.5 | AQ951: 否
A952: 000042.SZ | B952: 中洲控股 | C952: 0.5 | AQ952: 否