A1: 股票代码 | B1: 股票简称 | C1: 所属同花顺行业 | D1: 基本面 | H1: 技术面 | L1: 得分 | M1: 结论 | N1: 更新时间
D2: 本季度利润增长速度 | E2: 本季度销售增长速度 | F2: 本季度利润率 | G2: 市盈率(股票价格/每股收益) | H2: 价格趋势是否已经掉头向上 | I2: 当日收盘价 | J2: 最低点价格 | K2: 相对价格强度
A3: 600328.SH | B3: 中盐化工 | C3: 基础化工-化学原料-无机盐 | D3: 347.17584369449378 | E3: 81.818674860000002 | F3: 15.3428 | G3: 10.1 | H3: 从2022/03/09开始向上 | I3: 15.710000000000001 | J3: 14.08 | K3: =(I3-J3)/J3 -> 0.11576704545454551 | L3: 2 | M3: 金瑞矿业是领头羊，红星发展是次领头羊
A4: 600714.SH | B4: 金瑞矿业 | C4: 基础化工-化学原料-无机盐 | D4: 17700 | E4: 166.18276682000001 | F4: 21.2074 | G4: 73.659999999999997 | H4: 从2021/11/08开始向上 | I4: 13.92 | J4: 8.9800000000000004 | K4: =(I4-J4)/J4 -> 0.55011135857461013 | L4: 5
A5: 600367.SH | B5: 红星发展 | C5: 基础化工-化学原料-无机盐 | D5: 1040 | E5: 84.897060789999998 | F5: 11.3041 | G5: 29.84 | H5: 从2021/11/17开始向上 | I5: 20.91 | J5: 13.92 | K5: =(I5-J5)/J5 -> 0.50215517241379315 | L5: 4
A6: 002053.SZ | B6: 云南能投 | C6: 基础化工-化学原料-无机盐 | D6: -32.364597093791289 | E6: 9.3801292200000006 | F6: 8.2434999999999992 | G6: 66.819999999999993 | H6: 从2021/11/02开始向上 | I6: 15.42 | J6: 8.0299999999999994 | K6: =(I6-J6)/J6 -> 0.92029887920298892 | L6: 3
A7: 603067.SH | B7: 振华股份 | C7: 基础化工-化学原料-无机盐 | D7: 72.413793103448285 | E7: 259.26322807999998 | F7: 10.6623 | G7: 22.699999999999999 | H7: 从2022/01/05开始向上 | I7: 12.08 | J7: 10.1 | K7: =(I7-J7)/J7 -> 0.19603960396039607 | L7: 1
A8: 003017.SZ | B8: 大洋生物 | C8: 基础化工-化学原料-无机盐 | D8: -32.558139534883722 | E8: 27.419672590000001 | F8: 12.239100000000001 | G8: 33.409999999999997 | H8: 从2021/11/02开始向上 | I8: 46.509999999999998 | J8: 31.809999999999999 | K8: =(I8-J8)/J8 -> 0.46211883055642877 | L8: 3
A9: 002125.SZ | B9: 湘潭电化 | C9: 基础化工-化学原料-无机盐 | D9: 441.9354838709678 | E9: -26.35594656 | F9: 8.3154000000000003 | G9: 69.209999999999994 | H9: 从2022/01/21开始向上 | I9: 12.359999999999999 | J9: 10.039999999999999 | K9: =(I9-J9)/J9 -> 0.23107569721115542 | L9: 2
A10: 600929.SH | B10: 雪天盐业 | C10: 基础化工-化学原料-无机盐 | D10: -3.271537622682664 | E10: 17.961461870000001 | F10: 5.3285999999999998 | G10: 66.299999999999997 | H10: 从2021/11/01开始向上 | I10: 7.0199999999999996 | J10: 6.0099999999999998 | K10: =(I10-J10)/J10 -> 0.16805324459234605 | L10: 1
A11: 603299.SH | B11: 苏盐井神 | C11: 基础化工-化学原料-无机盐 | D11: 40.932889100428348 | E11: 38.838409210000002 | F11: 6.7906000000000004 | G11: 30.559999999999999 | H11: 从2021/10/29开始向上 | I11: 8.5 | J11: 7.7000000000000002 | K11: =(I11-J11)/J11 -> 0.10389610389610388 | L11: 1