A1: 股票代码 | B1: 股票简称 | C1: 所属同花顺行业 | D1: 基本面 | H1: 技术面 | L1: 得分 | M1: 结论 | N1: 更新时间
D2: 本季度利润增长速度 | E2: 本季度销售增长速度 | F2: 本季度利润率 | G2: 市盈率(股票价格/每股收益) | H2: 价格趋势是否已经掉头向上 | I2: 当日收盘价 | J2: 最低点价格 | K2: 相对价格强度
A3: 002629.SZ | B3: 仁智股份 | C3: 石油石化-油气开采及服务-油服工程 | D3: 60 | E3: 75.159682399999994 | F3: -9.2756000000000007 | G3: -3534.6999999999998 | H3: 从2021/10/28开始向上 | I3: 4.11 | J3: 2.11 | K3: =(I3-J3)/J3 -> 0.94786729857819929 | L3: 4 | M3: 惠博普是市场领头羊,仁智股份次领头羊 | N3: 44631
A4: 603619.SH | B4: 中曼石油 | C4: 石油石化-油气开采及服务-油服工程 | D4: 114.28571428571428 | E4: -34.306781780000001 | F4: 3.3706 | G4: -36.640000000000001 | H4: 从2021/11/29开始向上 | I4: 15.390000000000001 | J4: 11.449999999999999 | K4: =(I4-J4)/J4 -> 0.34410480349344991 | L4: 2
A5: 002207.SZ | B5: 准油股份 | C5: 石油石化-油气开采及服务-油服工程 | D5: -2338.4615384615386 | E5: -6.7463097300000001 | F5: -17.678799999999999 | G5: -78.870000000000005 | H5: 从2021/11/05开始向上 | I5: 9.67 | J5: 5.24 | K5: =(I5-J5)/J5 -> 0.84541984732824416 | L5: 2
A6: 600339.SH | B6: 中油工程 | C6: 石油石化-油气开采及服务-油服工程 | D6: 29.884032114183768 | E6: 27.944931499999999 | F6: 1.5711999999999999 | G6: 17.350000000000001 | H6: 从2021/11/29开始向上 | I6: 3.24 | J6: 2.73 | K6: =(I6-J6)/J6 -> 0.1868131868131869
A7: 603727.SH | B7: 博迈科 | C7: 石油石化-油气开采及服务-油服工程 | D7: 120.00000000000001 | E7: 35.429669250000003 | F7: 6.3525999999999998 | G7: 20.02 | H7: 从2022/01/28开始向上 | I7: 16.52 | J7: 15.42 | K7: =(I7-J7)/J7 -> 7.1335927367055754e-02 | L7: 4
A8: 002828.SZ | B8: 贝肯能源 | C8: 石油石化-油气开采及服务-油服工程 | D8: -9.5477386934673447 | E8: 0.36081442000000002 | F8: 2.9889999999999999 | G8: 83.349999999999994 | H8: 从2021/11/09开始向上 | I8: 9.75 | J8: 7.52 | K8: =(I8-J8)/J8 -> 0.29654255319148942 | L8: 2
A9: 002554.SZ | B9: 惠博普 | C9: 石油石化-油气开采及服务-油服工程 | D9: 142.10526315789474 | E9: 43.71241903 | F9: 11.3406 | G9: 37.490000000000002 | H9: 从2021/11/29开始向上 | I9: 3.59 | J9: 2.86 | K9: =(I9-J9)/J9 -> 0.25524475524475526 | L9: 5
A10: 600583.SH | B10: 海油工程 | C10: 石油石化-油气开采及服务-油服工程 | D10: 499.99999999999989 | E10: 15.67661331 | F10: 4.6383000000000001 | G10: 24.050000000000001 | H10: 从2021/11/29开始向上 | I10: 4.53 | J10: 4.24 | K10: =(I10-J10)/J10 -> 6.8396226415094338e-02
A11: 600968.SH | B11: 海油发展 | C11: 石油石化-油气开采及服务-油服工程 | D11: 24.740321057601513 | E11: 31.383740679999999 | F11: 5.5673000000000004 | G11: 16.039999999999999 | H11: 从2021/11/11开始向上 | I11: 2.82 | J11: 2.63 | K11: =(I11-J11)/J11 -> 7.2243346007604542e-02 | L11: 0
A12: 601808.SH | B12: 中海油服 | C12: 石油石化-油气开采及服务-油服工程 | D12: -33.333333333333336 | E12: 4.0661746599999997 | F12: 7.3575999999999997 | G12: 35.719999999999999 | H12: 从2021/11/29开始向上 | I12: 14.98 | J12: 13.109999999999999 | K12: =(I12-J12)/J12 -> 0.14263920671243335 | L12: 3
A13: 600871.SH | B13: 石化油服 | C13: 石油石化-油气开采及服务-油服工程 | D13: 41.666666666666671 | E13: 10.11325151 | F13: 0.68579999999999997 | G13: 237.84999999999999 | H13: 从2021/11/29开始向上 | I13: 2.03 | J13: 1.99 | K13: =(I13-J13)/J13 -> 2.0100502512562721e-02 | L13: 1