A1: 股票代码 | B1: 股票简称 | C1: 所属同花顺行业 | D1: 行业重复出现的频率
A2: 002148.SZ | B2: 北纬科技 | C2: 通信-通信服务-通信服务Ⅲ | D2: =COUNTIF(C:C,C2) -> 2 | E2: 石油石化-油气开采及服务-油服工程
A3: 600714.SH | B3: 金瑞矿业 | C3: 基础化工-化学原料-无机盐 | D3: =COUNTIF(C:C,C3) -> 2 | E3: 基础化工-化学原料-无机盐
A4: 600873.SH | B4: 梅花生物 | C4: 基础化工-化学制品-食品及饲料添加剂 | D4: =COUNTIF(C:C,C4) -> 1 | E4: 基础化工-化学制品-钾肥
A5: 002629.SZ | B5: 仁智股份 | C5: 石油石化-油气开采及服务-油服工程 | D5: =COUNTIF(C:C,C5) -> 2 | E5: 基础化工-化学原料-纯碱
A6: 600367.SH | B6: 红星发展 | C6: 基础化工-化学原料-无机盐 | D6: =COUNTIF(C:C,C6) -> 2 | E6: 建筑材料-建筑材料-水泥
A7: 603929.SH | B7: 亚翔集成 | C7: 建筑装饰-建筑装饰-专业工程 | D7: =COUNTIF(C:C,C7) -> 1 | E7: 医药生物-化学制药-化学制剂
A8: 002545.SZ | B8: 东方铁塔 | C8: 基础化工-化学制品-钾肥 | D8: =COUNTIF(C:C,C8) -> 2 | E8: 通信-通信服务-通信服务Ⅲ
A9: 600829.SH | B9: 人民同泰 | C9: 医药生物-医药商业-医药商业Ⅲ | D9: =COUNTIF(C:C,C9) -> 1
A10: 002881.SZ | B10: 美格智能 | C10: 电子-消费电子-消费电子零部件及组装 | D10: =COUNTIF(C:C,C10) -> 1
A11: 600735.SH | B11: 新华锦 | C11: 轻工制造-家用轻工-饰品 | D11: =COUNTIF(C:C,C11) -> 1
A12: 603077.SH | B12: 和邦生物 | C12: 基础化工-化学原料-纯碱 | D12: =COUNTIF(C:C,C12) -> 2
A13: 002671.SZ | B13: 龙泉股份 | C13: 建筑材料-建筑材料-水泥 | D13: =COUNTIF(C:C,C13) -> 2
A14: 000404.SZ | B14: 长虹华意 | C14: 家用电器-白色家电-其他白色家电 | D14: =COUNTIF(C:C,C14) -> 1
A15: 603602.SH | B15: 纵横通信 | C15: 通信-通信服务-通信服务Ⅲ | D15: =COUNTIF(C:C,C15) -> 2
A16: 000722.SZ | B16: 湖南发展 | C16: 公用事业-电力-水电 | D16: =COUNTIF(C:C,C16) -> 1
A17: 601789.SH | B17: 宁波建工 | C17: 建筑装饰-建筑装饰-房屋建设 | D17: =COUNTIF(C:C,C17) -> 1
A18: 002393.SZ | B18: 力生制药 | C18: 医药生物-化学制药-化学制剂 | D18: =COUNTIF(C:C,C18) -> 2
A19: 600099.SH | B19: 林海股份 | C19: 交运设备-非汽车交运-其他交运设备 | D19: =COUNTIF(C:C,C19) -> 1
A20: 000607.SZ | B20: 华媒控股 | C20: 传媒-传媒-广告营销 | D20: =COUNTIF(C:C,C20) -> 1
A21: 000524.SZ | B21: 岭南控股 | C21: 社会服务-景点及旅游-旅游综合 | D21: =COUNTIF(C:C,C21) -> 1
A22: 002116.SZ | B22: 中国海诚 | C22: 建筑装饰-建筑装饰-工程咨询服务 | D22: =COUNTIF(C:C,C22) -> 1
A23: 002779.SZ | B23: 中坚科技 | C23: 机械设备-专用设备-其他专用设备 | D23: =COUNTIF(C:C,C23) -> 1
A24: 603676.SH | B24: 卫信康 | C24: 医药生物-化学制药-化学制剂 | D24: =COUNTIF(C:C,C24) -> 2
A25: 000893.SZ | B25: 亚钾国际 | C25: 基础化工-化学制品-钾肥 | D25: =COUNTIF(C:C,C25) -> 2
A26: 603616.SH | B26: 韩建河山 | C26: 建筑材料-建筑材料-水泥 | D26: =COUNTIF(C:C,C26) -> 2
A27: 601008.SH | B27: 连云港 | C27: 交通运输-港口航运-港口 | D27: =COUNTIF(C:C,C27) -> 1
A28: 000520.SZ | B28: 长航凤凰 | C28: 交通运输-港口航运-航运 | D28: =COUNTIF(C:C,C28) -> 1
A29: 603169.SH | B29: 兰石重装 | C29: 机械设备-专用设备-能源及重型设备 | D29: =COUNTIF(C:C,C29) -> 1
A30: 000683.SZ | B30: 远兴能源 | C30: 基础化工-化学原料-纯碱 | D30: =COUNTIF(C:C,C30) -> 2
A31: 601808.SH | B31: 中海油服 | C31: 石油石化-油气开采及服务-油服工程 | D31: =COUNTIF(C:C,C31) -> 2
A32: 600123.SH | B32: 兰花科创 | C32: 煤炭-煤炭开采加工-煤炭开采 | D32: =COUNTIF(C:C,C32) -> 1
A33: 605399.SH | B33: 晨光新材 | C33: 基础化工-化学制品-有机硅 | D33: =COUNTIF(C:C,C33) -> 1