A1: 股票代码 | B1: 股票简称 | C1: 所属同花顺行业 | D1: 基本面 | H1: 技术面 | L1: 得分 | M1: 结论 | N1: 更新时间
D2: 本季度利润增长速度 | E2: 本季度销售增长速度 | F2: 本季度利润率 | G2: 市盈率(股票价格/每股收益) | H2: 价格趋势是否已经掉头向上 | I2: 当日收盘价 | J2: 最低点价格 | K2: 相对价格强度
A3: 603260.SH | B3: 合盛硅业 | C3: 基础化工-化学制品-有机硅 | D3: 561.03896103896102 | E3: 106.14976655 | F3: 35.574599999999997 | G3: 25.350000000000001 | H3: 从2022年2月8日开始有向上的趋势 | I3: 134.22 | J3: 101.44 | K3: =(I3-J3)/J3 -> 0.32314668769716093 | L3: 6 | M3: 晨光新材为领头羊，合盛硅业为次级领头羊 | N3: 44631
A4: 600596.SH | B4: 新安股份 | C4: 基础化工-化学制品-有机硅 | D4: 606.245487364621 | E4: 47.561453550000003 | F4: 12.3665 | G4: 11.1 | H4: 从2022年1月28日开始有向上的趋势 | I4: 26.989999999999998 | J4: 21.300000000000001 | K4: =(I4-J4)/J4 -> 0.26713615023474169 | L4: 4
A5: 603155.SH | B5: 新亚强 | C5: 基础化工-化学制品-有机硅 | D5: 45.544554455445542 | E5: 31.974448949999999 | F5: 36.211500000000001 | G5: 30.870000000000001 | H5: 从2022年3月9日开始有向上的趋势 | I5: 52.490000000000002 | J5: 49.619999999999997 | K5: =(I5-J5)/J5 -> 5.783958081418792e-02 | L5: 3
A6: 002909.SZ | B6: 集泰股份 | C6: 基础化工-化学制品-有机硅 | D6: -76.206896551724128 | E6: 46.081339290000003 | F6: 2.0689 | G6: 57.390000000000001 | H6: 从2022年3月9日开始有向上的趋势 | I6: 6.6600000000000001 | J6: 5.8300000000000001 | K6: =(I6-J6)/J6 -> 0.14236706689536879 | L6: 1
A7: 605366.SH | B7: 宏柏新材 | C7: 基础化工-化学制品-有机硅 | D7: -31.578947368421051 | E7: 19.034836949999999 | F7: 10.5411 | G7: 36.049999999999997 | H7: 从2022年3月9日开始有向上的趋势 | I7: 12.210000000000001 | J7: 11.59 | K7: =(I7-J7)/J7 -> 5.3494391716997498e-02 | L7: 1
A8: 605399.SH | B8: 晨光新材 | C8: 基础化工-化学制品-有机硅 | D8: 207.547169811321 | E8: 138.96954615000001 | F8: 27.497800000000002 | G8: 24.600000000000001 | H8: 从2022年1月14日开始有向上的趋势 | I8: 46.780000000000001 | J8: 14.58 | K8: =(I8-J8)/J8 -> 2.2085048010973938 | L8: 6