A1: 股票代码 | B1: 股票简称 | C1: 基本每(元)2021.09.30 | D1: 均线斜率是否朝上 | E1: 行业 | F1: 不重复行业分类
A2: 002932.SZ | B2: 明德生物 | C2: 10.68 | E2: 医疗器械 | F2: 电力设备 | G2: =COUNTIF(E:E,F2) -> 16
A3: 600955.SH | B3: 维远股份 | C3: 4.2999999999999998 | E3: 化学原料 | F3: 饮料制造 | G3: =COUNTIF(E:E,F3) -> 10
A4: 000568.SZ | B4: 泸州老窖 | C4: 4.28 | E4: 饮料制造 | F4: 半导体及元件 | G4: =COUNTIF(E:E,F4) -> 10
A5: 600809.SH | B5: 山西汾酒 | C5: 4.02 | E5: 饮料制造 | F5: 化学制品 | G5: =COUNTIF(E:E,F5) -> 9
A6: 000596.SZ | B6: 古井贡酒 | C6: 3.85 | E6: 饮料制造 | F6: 国防军工 | G6: =COUNTIF(E:E,F6) -> 7
A7: 603489.SH | B7: 八方股份 | C7: 3.61 | E7: 电力设备 | F7: 医疗器械 | G7: =COUNTIF(E:E,F7) -> 5
A8: 600436.SH | B8: 片仔癀 | C8: 3.33 | E8: 中药 | F8: 食品加工制造 | G8: =COUNTIF(E:E,F8) -> 5
A9: 600486.SH | B9: 扬农化工 | C9: 3.28 | E9: 化学制品 | F9: 汽车零部件 | G9: =COUNTIF(E:E,F9) -> 4
A10: 600702.SH | B10: 舍得酒业 | C10: 2.92 | E10: 饮料制造 | F10: 煤炭开采加工 | G10: =COUNTIF(E:E,F10) -> 4
A11: 002821.SZ | B11: 凯莱英 | C11: 2.88 | E11: 医疗服务 | F11: 化学原料 | G11: =COUNTIF(E:E,F11) -> 3
A12: 603267.SH | B12: 鸿远电子 | C12: 2.84 | E12: 国防军工 | F12: 中药 | G12: =COUNTIF(E:E,F12) -> 3
A13: 600600.SH | B13: 青岛啤酒 | C13: 2.67 | E13: 饮料制造 | F13: 自动化设备 | G13: =COUNTIF(E:E,F13) -> 3
A14: 601799.SH | B14: 星宇股份 | C14: 2.65 | E14: 汽车零部件 | F14: 服装家纺 | G14: =COUNTIF(E:E,F14) -> 2
A15: 605117.SH | B15: 德业股份 | C15: 2.64 | E15: 白色家电 | F15: 小金属 | G15: =COUNTIF(E:E,F15) -> 2
A16: 605369.SH | B16: 拱东医疗 | C16: 2.57 | E16: 医疗器械 | F16: 光学光电子 | G16: =COUNTIF(E:E,F16) -> 2
A17: 603986.SH | B17: 兆易创新 | C17: 2.5 | E17: 半导体及元件 | F17: 钢铁 | G17: =COUNTIF(E:E,F17) -> 2
A18: 600563.SH | B18: 法拉电子 | C18: 2.45 | E18: 半导体及元件 | F18: 消费电子 | G18: =COUNTIF(E:E,F18) -> 2
A19: 002913.SZ | B19: 奥士康 | C19: 2.42 | E19: 半导体及元件 | F19: 房地产开发 | G19: =COUNTIF(E:E,F19) -> 2
A20: 603129.SH | B20: 春风动力 | C20: 2.42 | E20: 非汽车交运 | F20: 造纸 | G20: =COUNTIF(E:E,F20) -> 2
A21: 002049.SZ | B21: 紫光国微 | C21: 2.3999999999999999 | E21: 半导体及元件 | F21: 物流 | G21: =COUNTIF(E:E,F21) -> 2
A22: 600141.SH | B22: 兴发集团 | C22: 2.22 | E22: 化学制品 | F22: 传媒 | G22: =COUNTIF(E:E,F22) -> 2
A23: 603599.SH | B23: 广信股份 | C23: 2.22 | E23: 化学制品 | F23: 专用设备 | G23: =COUNTIF(E:E,F23) -> 2
A24: 000799.SZ | B24: 酒鬼酒 | C24: 2.22 | E24: 饮料制造 | F24: 医疗服务 | G24: =COUNTIF(E:E,F24) -> 1
A25: 605111.SH | B25: 新洁能 | C25: 2.19 | E25: 半导体及元件 | F25: 白色家电 | G25: =COUNTIF(E:E,F25) -> 1
A26: 603217.SH | B26: 元利科技 | C26: 2.16 | E26: 化学制品 | F26: 非汽车交运 | G26: =COUNTIF(E:E,F26) -> 1
A27: 601677.SH | B27: 明泰铝业 | C27: 2.12 | E27: 工业金属 | F27: 工业金属 | G27: =COUNTIF(E:E,F27) -> 1
A28: 002916.SZ | B28: 深南电路 | C28: 2.09 | E28: 半导体及元件 | F28: 美容护理 | G28: =COUNTIF(E:E,F28) -> 1
A29: 600779.SH | B29: 水井坊 | C29: 2.05 | E29: 饮料制造 | F29: 汽车整车 | G29: =COUNTIF(E:E,F29) -> 1
A30: 601088.SH | B30: 中国神华 | C30: 2.05 | E30: 煤炭开采加工 | F30: 斯达半导 | G30: =COUNTIF(E:E,F30) -> 1
A31: 605080.SH | B31: 浙江自然 | C31: 2.04 | E31: 服装家纺 | F31: 通信设备 | G31: =COUNTIF(E:E,F31) -> 1
A32: 603799.SH | B32: 华友钴业 | C32: 1.98 | E32: 小金属 | F32: 建筑材料 | G32: =COUNTIF(E:E,F32) -> 1
A33: 603297.SH | B33: 永新光学 | C33: 1.97 | E33: 光学光电子 | F33: 化学制药 | G33: =COUNTIF(E:E,F33) -> 1
A34: 603392.SH | B34: 万泰生物 | C34: 1.96 | E34: 医疗器械 | F34: 教育 | G34: =COUNTIF(E:E,F34) -> 1
A35: 603589.SH | B35: 口子窖 | C35: 1.92 | E35: 饮料制造 | F35: 厨卫电器 | G35: =COUNTIF(E:E,F35) -> 1
A36: 603995.SH | B36: 甬金股份 | C36: 1.87 | E36: 钢铁 | F36: 化工合成材料 | G36: =COUNTIF(E:E,F36) -> 1
A37: 000733.SZ | B37: 振华科技 | C37: 1.86 | E37: 国防军工 | F37: 港口航运 | G37: =COUNTIF(E:E,F37) -> 1
A38: 603605.SH | B38: 珀莱雅 | C38: 1.82 | E38: 美容护理 | F38: 公路铁路运输 | G38: =COUNTIF(E:E,F38) -> 1
A39: 605123.SH | B39: 派克新材 | C39: 1.77 | E39: 国防军工 | F39: 通信服务 | G39: =COUNTIF(E:E,F39) -> 1
A40: 603659.SH | B40: 璞泰来 | C40: 1.77 | E40: 电力设备 | F40: 燃气 | G40: =COUNTIF(E:E,F40) -> 1
A41: 600104.SH | B41: 上汽集团 | C41: 1.76 | E41: 汽车整车 | F41: 证券 | G41: =COUNTIF(E:E,F41) -> 1
A42: 603678.SH | B42: 火炬电子 | C42: 1.71 | E42: 国防军工 | F42: 环保 | G42: =COUNTIF(E:E,F42) -> 1
A43: 600976.SH | B43: 健民集团 | C43: 1.69 | E43: 中药 | F43: 仪器仪表 | G43: =COUNTIF(E:E,F43) -> 1
A44: 603290.SH | B44: 斯达半导 | C44: 1.67 | E44: 斯达半导
A45: 600745.SH | B45: 闻泰科技 | C45: 1.65 | E45: 消费电子
A46: 603897.SH | B46: 长城科技 | C46: 1.64 | E46: 电力设备
A47: 000049.SZ | B47: 德赛电池 | C47: 1.64 | E47: 电力设备
A48: 603236.SH | B48: 移远通信 | C48: 1.63 | E48: 通信设备
A49: 605399.SH | B49: 晨光新材 | C49: 1.63 | E49: 化学制品
A50: 002850.SZ | B50: 科达利 | C50: 1.61 | E50: 电力设备
A51: 002876.SZ | B51: 三利谱 | C51: 1.6000000000000001 | E51: 光学光电子
A52: 600064.SH | B52: 南京高科 | C52: 1.58 | E52: 房地产开发
A53: 002080.SZ | B53: 中材科技 | C53: 1.58 | E53: 建筑材料
A54: 603186.SH | B54: 华正新材 | C54: 1.53 | E54: 半导体及元件
A55: 002179.SZ | B55: 中航光电 | C55: 1.52 | E55: 国防军工
A56: 002048.SZ | B56: 宁波华翔 | C56: 1.51 | E56: 汽车零部件
A57: 002128.SZ | B57: 电投能源 | C57: 1.5 | E57: 煤炭开采加工
A58: 600741.SH | B58: 华域汽车 | C58: 1.49 | E58: 汽车零部件
A59: 000623.SZ | B59: 吉林敖东 | C59: 1.49 | E59: 化学制药
A60: 601225.SH | B60: 陕西煤业 | C60: 1.47 | E60: 煤炭开采加工
A61: 603606.SH | B61: 东方电缆 | C61: 1.47 | E61: 电力设备
A62: 605098.SH | B62: 行动教育 | C62: 1.46 | E62: 教育
A63: 603806.SH | B63: 福斯特 | C63: 1.44 | E63: 电力设备
A64: 600566.SH | B64: 济川药业 | C64: 1.43 | E64: 中药
A65: 002008.SZ | B65: 大族激光 | C65: 1.43 | E65: 自动化设备
A66: 600089.SH | B66: 特变电工 | C66: 1.3999999999999999 | E66: 电力设备
A67: 002756.SZ | B67: 永兴材料 | C67: 1.38 | E67: 钢铁
A68: 603886.SH | B68: 元祖股份 | C68: 1.38 | E68: 食品加工制造
A69: 002223.SZ | B69: 鱼跃医疗 | C69: 1.36 | E69: 医疗器械
A70: 603369.SH | B70: 今世缘 | C70: 1.35 | E70: 饮料制造
A71: 002371.SZ | B71: 北方华创 | C71: 1.34 | E71: 半导体及元件
A72: 600887.SH | B72: 伊利股份 | C72: 1.31 | E72: 食品加工制造
A73: 605336.SH | B73: 帅丰电器 | C73: 1.31 | E73: 厨卫电器
A74: 002637.SZ | B74: 赞宇科技 | C74: 1.3 | E74: 化学制品
A75: 601877.SH | B75: 正泰电器 | C75: 1.29 | E75: 电力设备
A76: 603010.SH | B76: 万盛股份 | C76: 1.29 | E76: 化工合成材料
A77: 603733.SH | B77: 仙鹤股份 | C77: 1.28 | E77: 造纸
A78: 603985.SH | B78: 恒润股份 | C78: 1.27 | E78: 电力设备
A79: 002597.SZ | B79: 金禾实业 | C79: 1.27 | E79: 化学制品
A80: 002889.SZ | B80: 东方嘉盛 | C80: 1.27 | E80: 物流
A81: 002985.SZ | B81: 北摩高科 | C81: 1.27 | E81: 国防军工
A82: 605222.SH | B82: 起帆电缆 | C82: 1.27 | E82: 电力设备
A83: 001872.SZ | B83: 招商港口 | C83: 1.27 | E83: 港口航运
A84: 600373.SH | B84: 中文传媒 | C84: 1.26 | E84: 传媒
A85: 600328.SH | B85: 中盐化工 | C85: 1.26 | E85: 化学原料
A86: 001217.SZ | B86: 华尔泰 | C86: 1.25 | E86: 化学原料
A87: 600298.SH | B87: 安琪酵母 | C87: 1.24 | E87: 食品加工制造
A88: 600123.SH | B88: 兰花科创 | C88: 1.23 | E88: 煤炭开采加工
A89: 603095.SH | B89: 越剑智能 | C89: 1.22 | E89: 专用设备
A90: 603197.SH | B90: 保隆科技 | C90: 1.2 | E90: 汽车零部件
A91: 603198.SH | B91: 迎驾贡酒 | C91: 1.2 | E91: 饮料制造
A92: 603258.SH | B92: 电魂网络 | C92: 1.18 | E92: 传媒
A93: 000885.SZ | B93: 城发环境 | C93: 1.18 | E93: 公路铁路运输
A94: 002557.SZ | B94: 洽洽食品 | C94: 1.18 | E94: 食品加工制造
A95: 603203.SH | B95: 快克股份 | C95: 1.17 | E95: 自动化设备
A96: 603681.SH | B96: 永冠新材 | C96: 1.17 | E96: 化学制品
A97: 002258.SZ | B97: 利尔化学 | C97: 1.17 | E97: 化学制品
A98: 002929.SZ | B98: 润建股份 | C98: 1.16 | E98: 通信服务
A99: 002028.SZ | B99: 思源电气 | C99: 1.16 | E99: 电力设备
A100: 600153.SH | B100: 建发股份 | C100: 1.15 | E100: 物流
A101: 600803.SH | B101: 新奥股份 | C101: 1.15 | E101: 燃气
A102: 605089.SH | B102: 味知香 | C102: 1.15 | E102: 食品加工制造
A103: 003026.SZ | B103: 中晶科技 | C103: 1.14 | E103: 半导体及元件
A104: 000776.SZ | B104: 广发证券 | C104: 1.13 | E104: 证券
A105: 003043.SZ | B105: 华亚智能 | C105: 1.13 | E105: 半导体及元件
A106: 600048.SH | B106: 保利发展 | C106: 1.13 | E106: 房地产开发
A107: 601615.SH | B107: 明阳智能 | C107: 1.13 | E107: 电力设备
A108: 603666.SH | B108: 亿嘉和 | C108: 1.12 | E108: 自动化设备
A109: 605377.SH | B109: 华旺科技 | C109: 1.12 | E109: 造纸
A110: 600885.SH | B110: 宏发股份 | C110: 1.1000000000000001 | E110: 电力设备
A111: 603279.SH | B111: 景津环保 | C111: 1.1000000000000001 | E111: 环保
A112: 000960.SZ | B112: 锡业股份 | C112: 1.09 | E112: 小金属
A113: 002960.SZ | B113: 青鸟消防 | C113: 1.08 | E113: 专用设备
A114: 600587.SH | B114: 新华医疗 | C114: 1.08 | E114: 医疗器械
A115: 603908.SH | B115: 牧高笛 | C115: 1.07 | E115: 服装家纺
A116: 603380.SH | B116: 易德龙 | C116: 1.06 | E116: 消费电子
A117: 600038.SH | B117: 中直股份 | C117: 1.05 | E117: 国防军工
A118: 603100.SH | B118: 川仪股份 | C118: 1.05 | E118: 仪器仪表
A119: 603507.SH | B119: 振江股份 | C119: 1.04 | E119: 电力设备
A120: 002039.SZ | B120: 黔源电力 | C120: 1.03 | E120: 电力设备