A1: 股票代码 | B1: 股票简称 | C1: 基本每股收益(元)2021.09.30 | D1: 均线斜率是否朝上 | E1: 行业 | F1: 不重复行业分类 | G1: 行业中企业数 | H1: 趋势 | S1: 波动收缩幅度
H2: 200日均线 | I2: 150日均线 | J2: 50日均线 | K2: 各均线斜率是否朝上 | L2: 当前股价 | M2: 52周内最低点 | N2: 52周内最高点 | O2: 最高点前8周收盘价 | P2: 当前股价相对于最低点百分比(至少高出25%) | Q2: 当前股价相对于最高点百分比(25%内最好) | R2: 最高点前8周股价相对于最高点百分比 | S2: 技术足迹
S3: 支撑位1 | T3: 阻力位2 | U3: 支撑位2 | V3: 阻力位3 | W3: 支撑位3 | X3: 阻力位4 | Y3: 支撑位4 | Z3: 阻力位5 | AA3: 支撑位5 | AB3: 阻力位6 | AC3: 支撑位6 | AD3: 时间周期 | AE3: 收缩量1 | AF3: 收缩量2 | AG3: 收缩量3 | AH3: 收缩量4 | AI3: 收缩量5 | AJ3: 收缩量6 | AK3: 收缩数量(至少大于3T)
A4: 688301.SH | B4: 奕瑞科技 | C4: 4.49 | D4: 是 | E4: 医疗器械 | F4: 电力设备 | G4: =COUNTIF(E:E,F4) -> 4 | H4: 369.73000000000002 | I4: 400.06999999999999 | J4: 488.5 | L4: 528.65999999999997 | M4: 151 | N4: 565.54999999999995 | O4: 420.41000000000003 | P4: =(L4-M4)/M4 -> 2.5010596026490064 | Q4: =(N4-L4)/N4 -> 6.5228538590752352e-02 | R4: =(N4-O4)/O4 -> 0.34523441402440458 | S4: 499.01999999999998 | AD4: 1w | AE4: =(N4-S4)/N4 -> 0.117637697816285
A5: 688598.SH | B5: 金博股份 | C5: 4.18 | D5: 是 | E5: 电力设备 | F5: 半导体及元件 | G5: =COUNTIF(E:E,F5) -> 4 | H5: 293.91000000000003 | I5: 311.93000000000001 | J5: 354.13 | L5: 353 | M5: 146 | N5: 423.5 | O5: 268.5 | P5: =(L5-M5)/M5 -> 1.4178082191780821 | Q5: =(N5-L5)/N5 -> 0.16646989374262103 | R5: =(N5-O5)/O5 -> 0.57728119180633142 | S5: 313.76999999999998 | T5: 383.63999999999999 | U5: 337.25 | V5: 406 | W5: 342.38999999999999 | AD5: 14w | AE5: =(N5-S5)/N5 -> 0.25910271546635188 | AF5: =(T5-U5)/T5 -> 0.12092065478052337 | AG5: =(V5-W5)/V5 -> 0.15667487684729067
A6: 688536.SH | B6: 思瑞浦 | C6: 3.8999999999999999 | D6: 是 | E6: 半导体及元件 | F6: 化学制品 | G6: =COUNTIF(E:E,F6) -> 4 | H6: 635.32000000000005 | I6: 668.80999999999995 | J6: 790.86000000000001 | L6: 801.91999999999996 | M6: 325.79000000000002 | N6: 926.99000000000001 | O6: 640.5 | P6: =(L6-M6)/M6 -> 1.4614629055526562 | Q6: =(N6-L6)/N6 -> 0.13492054930473904 | R6: =(N6-O6)/O6 -> 0.44729117876658864 | S6: 790 | AD6: 1w | AE6: =(N6-S6)/N6 -> 0.14777937194575994 | AF6: =(T6-U6)/T6 -> #DIV/0!
A7: 688330.SH | B7: 宏力达 | C7: 3.28 | D7: 是 | E7: 电力设备 | F7: 国防军工 | G7: =COUNTIF(E:E,F7) -> 3 | H7: 96.189999999999998 | I7: 101.16 | J7: 123.03 | L7: 136.41999999999999 | M7: 68.269999999999996 | N7: 149.90000000000001 | O7: 85.459999999999994 | P7: =(L7-M7)/M7 -> 0.99824227332649762 | Q7: =(N7-L7)/N7 -> 8.9926617745163556e-02 | R7: =(N7-O7)/O7 -> 0.7540369763632111 | S7: 126.54000000000001 | T7: 147.33000000000001 | U7: 135.5 | AD7: 3w | AE7: =(N7-S7)/N7 -> 0.15583722481654436 | AF7: =(T7-U7)/T7 -> 8.0295934297156119e-02
A8: 688789.SH | B8: 宏华数科 | C8: 2.66 | D8: 是 | E8: 专用设备 | F8: 医疗器械 | G8: =COUNTIF(E:E,F8) -> 2 | H8: 234.31 | I8: 245.90000000000001 | J8: 277.89999999999998 | L8: 280.52999999999997 | M8: 150 | N8: 331.87 | O8: 239.5 | P8: =(L8-M8)/M8 -> 0.87019999999999986 | Q8: =(N8-L8)/N8 -> 0.1546991291770875 | R8: =(N8-O8)/O8 -> 0.385678496868476 | S8: 270.55000000000001 | AD8: 2w | AE8: =(N8-S8)/N8 -> 0.18477114532798986
A9: 688667.SH | B9: 菱电电控 | C9: 2.56 | D9: 是 | E9: 汽车零部件 | F9: 专用设备 | G9: =COUNTIF(E:E,F9) -> 2 | H9: 133.41999999999999 | I9: 137.44 | J9: 160.68000000000001 | L9: 193 | M9: 83.739999999999995 | N9: 198.88 | O9: 113.08 | P9: =(L9-M9)/M9 -> 1.3047528063052307 | Q9: =(N9-L9)/N9 -> 2.9565567176186622e-02 | R9: =(N9-O9)/O9 -> 0.75875486381322954 | AD9: 0w
A10: 688390.SH | B10: 固德威 | C10: 2.44 | D10: 是 | E10: 电力设备 | F10: 汽车零部件 | G10: =COUNTIF(E:E,F10) -> 1 | H10: 365.50999999999999 | I10: 385.38 | J10: 433.07999999999998 | L10: 409 | P10: =(L10-M10)/M10 -> #DIV/0! | Q10: =(N10-L10)/N10 -> #DIV/0! | R10: =(N10-O10)/O10 -> #DIV/0!
A11: 688516.SH | B11: 奥特维 | C11: 2.31 | D11: 是 | E11: 电力设备 | F11: 化工合成材料 | G11: =COUNTIF(E:E,F11) -> 1 | H11: 170.83000000000001 | I11: 187.52000000000001 | J11: 231.24000000000001 | L11: 237.22 | M11: 57.399999999999999 | N11: 269.88 | O11: 198.27000000000001 | P11: =(L11-M11)/M11 -> 3.132752613240418 | Q11: =(N11-L11)/N11 -> 0.12101674818437823 | R11: =(N11-O11)/O11 -> 0.36117415645332113 | S11: 227
A12: 688378.SH | B12: 奥来德 | C12: 2.01 | D12: 是 | E12: 专用设备 | F12: 通信设备 | G12: =COUNTIF(E:E,F12) -> 1
A13: 688776.SH | B13: 国光电气 | C13: 1.83 | D13: 是 | E13: 国防军工 | F13: 非金属材料 | G13: =COUNTIF(E:E,F13) -> 1
A14: 688087.SH | B14: 英科再生 | C14: 1.82 | D14: 是 | E14: 化工合成材料 | F14: 通用设备 | G14: =COUNTIF(E:E,F14) -> 1
A15: 688080.SH | B15: 映翰通 | C15: 1.75 | D15: 是 | E15: 通信设备 | F15: 自动化设备 | G15: =COUNTIF(E:E,F15) -> 1
A16: 688636.SH | B16: 智明达 | C16: 1.54 | D16: 是 | E16: 国防军工
A17: 688105.SH | B17: 诺唯赞 | C17: 1.53 | D17: 是 | E17: 医疗器械
A18: 688300.SH | B18: 联瑞新材 | C18: 1.5 | D18: 是 | E18: 非金属材料
A19: 688257.SH | B19: 新锐股份 | C19: 1.46 | D19: 是 | E19: 通用设备
A20: 688519.SH | B20: 南亚新材 | C20: 1.37 | D20: 是 | E20: 半导体及元件
A21: 688398.SH | B21: 赛特新材 | C21: 1.24 | D21: 是 | E21: 化学制品
A22: 688099.SH | B22: 晶晨股份 | C22: 1.22 | D22: 是 | E22: 半导体及元件
A23: 688122.SH | B23: 西部超导 | C23: 1.22 | D23: 是 | E23: 国防军工
A24: 688065.SH | B24: 凯赛生物 | C24: 1.18 | D24: 是 | E24: 化学制品
A25: 688017.SH | B25: 绿的谐波 | C25: 1.18 | D25: 是 | E25: 自动化设备
A26: 688233.SH | B26: 神工股份 | C26: 1.06 | D26: 是 | E26: 半导体及元件
A27: 688639.SH | B27: 华恒生物 | C27: 1.06 | D27: 是 | E27: 化学制品
A28: 688625.SH | B28: 呈和科技 | C28: 1.05 | D28: 是 | E28: 化学制品