A1: 所属行业 | B1: 行业分类
A2: 电力设备 | B2: 电力设备 | C2: =COUNTIF(A:A,B2) -> 3
A3: 通用设备 | B3: 化学制品 | C3: =COUNTIF(A:A,B3) -> 2
A4: 医疗服务 | B4: 半导体及元件 | C4: =COUNTIF(A:A,B4) -> 2
A5: 化学制品 | B5: 专用设备 | C5: =COUNTIF(A:A,B5) -> 1
A6: 传媒 | B6: 医疗服务 | C6: =COUNTIF(A:A,B6) -> 1
A7: 物流 | B7: 物流 | C7: =COUNTIF(A:A,B7) -> 1
A8: 建筑装饰 | B8: 通用设备 | C8: =COUNTIF(A:A,B8) -> 1
A9: 金属新材料 | B9: 食品加工制造 | C9: =COUNTIF(A:A,B9) -> 1
A10: 化学制品 | B10: 汽车零部件 | C10: =COUNTIF(A:A,B10) -> 1
A11: 厨卫电器 | B11: 零售 | C11: =COUNTIF(A:A,B11) -> 1
A12: 零售 | B12: 金属新材料 | C12: =COUNTIF(A:A,B12) -> 1
A13: 半导体及元件 | B13: 建筑装饰 | C13: =COUNTIF(A:A,B13) -> 1
A14: 汽车零部件 | B14: 计算机应用 | C14: =COUNTIF(A:A,B14) -> 1
A15: 食品加工制造 | B15: 国防军工 | C15: =COUNTIF(A:A,B15) -> 1
A16: 国防军工 | B16: 传媒 | C16: =COUNTIF(A:A,B16) -> 1
A17: 电力设备 | B17: 厨卫电器 | C17: =COUNTIF(A:A,B17) -> 1
A18: 半导体及元件
A19: 专用设备
A20: 计算机应用
A21: 电力设备