A1: 股票代码 | B1: 股票简称 | C1: 基本每股收益(元)2021.09.30 | D1: 行业 | E1: 趋势 | P1: 波动收缩幅度 | AI1: 成交量行为 | AK1: 价格行为(得分应大于60%) | AM1: 总结
E2: 200日均线 | F2: 150日均线 | G2: 50日均线 | H2: 各均线斜率是否朝上 | I2: 当前股价 | J2: 52周内最低点 | K2: 52周内最高点 | L2: 最高点前8周收盘价 | M2: 当前股价相对于最低点百分比(至少高出25%) | N2: 当前股价相对于最高点百分比(25%内最好) | O2: 最高点前8周股价相对于最高点百分比 | P2: 技术足迹 | AI2: 不同收盘表现时交易量情况(好的收盘时，交易量是否增大，坏的收盘时，交易量是否萎缩) | AJ2: 成交量收缩情况(最后的价格收缩期间的成交量应低于50天的平均水平且有一到两天交易量极低) | AK2: 支撑位和压力位是否同步升高(40%) | AL2: 是否有网球行为出现(40%)
P3: 支撑位1 | Q3: 阻力位2 | R3: 支撑位2 | S3: 阻力位3 | T3: 支撑位3 | U3: 阻力位4 | V3: 支撑位4 | W3: 阻力位5 | X3: 支撑位5 | Y3: 阻力位6 | Z3: 支撑位6 | AA3: 时间周期 | AB3: 收缩量1 | AC3: 收缩量2 | AD3: 收缩量3 | AE3: 收缩量4 | AF3: 收缩量5 | AG3: 收缩量6 | AH3: 收缩数量(至少大于3T)
A4: 688200.SH | B4: 华峰测控 | C4: 5.08 | D4: 半导体及元件 | E4: 490.10000000000002 | F4: 503.69999999999999 | G4: 529.38 | I4: 474.19999999999999 | AM4: 不宜入场（当前股价小于50日均线）
A5: 688188.SH | B5: 柏楚电子 | C5: 4.61 | D5: 自动化设备 | E5: 395.49000000000001 | F5: 404.63999999999999 | G5: 403.77999999999997 | I5: 375.05000000000001 | AM5: 不宜入场（50日均线小于150日均线）
A6: 688301.SH | B6: 奕瑞科技 | C6: 4.49 | D6: 医疗器械 | E6: 369.73000000000002 | F6: 400.06999999999999 | G6: 488.5 | I6: 528.65999999999997 | J6: 151 | K6: 565.54999999999995 | L6: 420.41000000000003 | M6: =(I6-J6)/J6 -> 2.5010596026490064 | N6: =(K6-I6)/K6 -> 6.5228538590752352e-02 | O6: =(K6-L6)/L6 -> 0.34523441402440458 | P6: 499.01999999999998 | AA6: 1w | AB6: =(K6-P6)/K6 -> 0.117637697816285 | AM6: 不宜入场（收缩量不够）
A7: 688598.SH | B7: 金博股份 | C7: 4.18 | D7: 电力设备 | E7: 293.91000000000003 | F7: 311.93000000000001 | G7: 354.13 | I7: 353 | J7: 146 | K7: 423.5 | L7: 268.5 | M7: =(I7-J7)/J7 -> 1.4178082191780821 | N7: =(K7-I7)/K7 -> 0.16646989374262103 | O7: =(K7-L7)/L7 -> 0.57728119180633142 | P7: 313.76999999999998 | Q7: 383.63999999999999 | R7: 337.25 | S7: 406 | T7: 342.38999999999999 | AA7: 14w | AB7: =(K7-P7)/K7 -> 0.25910271546635188 | AC7: =(Q7-R7)/Q7 -> 0.12092065478052337 | AD7: =(S7-T7)/S7 -> 0.15667487684729067 | AM7: 不宜入场（当前股价小于50日均线）
A8: 688536.SH | B8: 思瑞浦 | C8: 3.8999999999999999 | D8: 半导体及元件 | E8: 635.32000000000005 | F8: 668.80999999999995 | G8: 790.86000000000001 | I8: 801.91999999999996 | J8: 325.79000000000002 | K8: 926.99000000000001 | L8: 640.5 | M8: =(I8-J8)/J8 -> 1.4614629055526562 | N8: =(K8-I8)/K8 -> 0.13492054930473904 | O8: =(K8-L8)/L8 -> 0.44729117876658864 | P8: 790 | AA8: 1w | AB8: =(K8-P8)/K8 -> 0.14777937194575994 | AC8: =(Q8-R8)/Q8 -> #DIV/0! | AM8: 不宜入场（收缩量不够）
A9: 688357.SH | B9: 建龙微纳 | C9: 3.47 | D9: 非金属材料 | E9: 149.71000000000001 | F9: 163.78999999999999 | G9: 204.00999999999999 | I9: 206.16999999999999 | J9: 53.5 | K9: 240.80000000000001 | L9: 126 | M9: =(I9-J9)/J9 -> 2.8536448598130839 | N9: =(K9-I9)/K9 -> 0.14381229235880408 | O9: =(K9-L9)/L9 -> 0.9111111111111112 | P9: 202 | AA9: 2w | AB9: =(K9-P9)/K9 -> 0.16112956810631232 | AC9: =(Q9-R9)/Q9 -> #DIV/0! | AM9: 不宜入场（收缩量不够）
A10: 688330.SH | B10: 宏力达 | C10: 3.28 | D10: 电力设备 | E10: 96.189999999999998 | F10: 101.16 | G10: 123.03 | I10: 136.41999999999999 | J10: 68.269999999999996 | K10: 149.90000000000001 | L10: 85.459999999999994 | M10: =(I10-J10)/J10 -> 0.99824227332649762 | N10: =(K10-I10)/K10 -> 8.9926617745163556e-02 | O10: =(K10-L10)/L10 -> 0.7540369763632111 | P10: 126.54000000000001 | Q10: 147.33000000000001 | R10: 135.5 | AA10: 3w | AB10: =(K10-P10)/K10 -> 0.15583722481654436 | AC10: =(Q10-R10)/Q10 -> 8.0295934297156119e-02 | AI10: 否 | AJ10: 是 | AK10: 否 | AL10: 是 | AM10: 不宜入场
A11: 688059.SH | B11: 华锐精密 | C11: 2.93 | D11: 通用设备 | E11: 152.06999999999999 | F11: 157.41 | G11: 166.43000000000001 | I11: 163.78 | AC11: =(Q11-R11)/Q11 -> #DIV/0! | AM11: 不宜入场（当前股价小于50日均线）
A12: 688789.SH | B12: 宏华数科 | C12: 2.66 | D12: 专用设备 | E12: 234.31 | F12: 245.90000000000001 | G12: 277.89999999999998 | I12: 280.52999999999997 | J12: 150 | K12: 331.87 | L12: 239.5 | M12: =(I12-J12)/J12 -> 0.87019999999999986 | N12: =(K12-I12)/K12 -> 0.1546991291770875 | O12: =(K12-L12)/L12 -> 0.385678496868476 | P12: 270.55000000000001 | AA12: 2w | AB12: =(K12-P12)/K12 -> 0.18477114532798986 | AC12: =(Q12-R12)/Q12 -> #DIV/0! | AM12: 不宜入场（收缩量不够）
A13: 688667.SH | B13: 菱电电控 | C13: 2.56 | D13: 汽车零部件 | E13: 133.41999999999999 | F13: 137.44 | G13: 160.68000000000001 | I13: 193 | J13: 83.739999999999995 | K13: 198.88 | L13: 113.08 | M13: =(I13-J13)/J13 -> 1.3047528063052307 | N13: =(K13-I13)/K13 -> 2.9565567176186622e-02 | O13: =(K13-L13)/L13 -> 0.75875486381322954 | AA13: 0w | AB13: =(K13-P13)/K13 -> 1 | AC13: =(Q13-R13)/Q13 -> #DIV/0! | AM13: 不宜入场（收缩量不够）
A14: 688390.SH | B14: 固德威 | C14: 2.44 | D14: 电力设备 | E14: 365.50999999999999 | F14: 385.38 | G14: 433.07999999999998 | I14: 409 | M14: =(I14-J14)/J14 -> #DIV/0! | N14: =(K14-I14)/K14 -> #DIV/0! | O14: =(K14-L14)/L14 -> #DIV/0! | AB14: =(K14-P14)/K14 -> #DIV/0! | AC14: =(Q14-R14)/Q14 -> #DIV/0! | AM14: 不宜入场（当前股价小于50日均线）
A15: 688550.SH | B15: 瑞联新材 | C15: 2.3999999999999999 | D15: 电子化学品 | E15: 91.599999999999994 | F15: 93.140000000000001 | G15: 97.049999999999997 | I15: 96.900000000000006 | M15: =(I15-J15)/J15 -> #DIV/0! | N15: =(K15-I15)/K15 -> #DIV/0! | O15: =(K15-L15)/L15 -> #DIV/0! | AB15: =(K15-P15)/K15 -> #DIV/0! | AC15: =(Q15-R15)/Q15 -> #DIV/0! | AM15: 不宜入场（当前股价小于50日均线）
A16: 688356.SH | B16: 键凯科技 | C16: 2.37 | D16: 化学制药 | E16: 243.53 | F16: 265.37 | G16: 331.43000000000001 | I16: 353.19999999999999 | J16: 82.75 | K16: 403.06999999999999 | L16: 242.86000000000001 | M16: =(I16-J16)/J16 -> 3.2682779456193352 | N16: =(K16-I16)/K16 -> 0.12372540749745703 | O16: =(K16-L16)/L16 -> 0.65968047434736055 | P16: 338.5 | AA16: 1w | AB16: =(K16-P16)/K16 -> 0.16019549954102263 | AC16: =(Q16-R16)/Q16 -> #DIV/0! | AM16: 不宜入场（收缩量不够）
A17: 688516.SH | B17: 奥特维 | C17: 2.31 | D17: 电力设备 | E17: 170.83000000000001 | F17: 187.52000000000001 | G17: 231.24000000000001 | I17: 237.22 | J17: 57.399999999999999 | K17: 269.88 | L17: 198.27000000000001 | M17: =(I17-J17)/J17 -> 3.132752613240418 | N17: =(K17-I17)/K17 -> 0.12101674818437823 | O17: =(K17-L17)/L17 -> 0.36117415645332113 | P17: 227 | AA17: 1w | AB17: =(K17-P17)/K17 -> 0.15888543056173113 | AC17: =(Q17-R17)/Q17 -> #DIV/0! | AM17: 不宜入场（收缩量不够）
A18: 688499.SH | B18: 利元亨 | C18: 2.13 | D18: 电力设备 | E18: 251.50999999999999 | F18: 262.97000000000003 | G18: 289.97000000000003 | I18: 277.60000000000002 | M18: =(I18-J18)/J18 -> #DIV/0! | N18: =(K18-I18)/K18 -> #DIV/0! | O18: =(K18-L18)/L18 -> #DIV/0! | AB18: =(K18-P18)/K18 -> #DIV/0! | AC18: =(Q18-R18)/Q18 -> #DIV/0! | AM18: 不宜入场（当前股价小于50日均线）
A19: 688378.SH | B19: 奥来德 | C19: 2.01 | D19: 专用设备 | E19: 67.709999999999994 | F19: 70.450000000000003 | G19: 78.090000000000003 | I19: 83.159999999999997 | J19: 45.009999999999998 | K19: 92.879999999999995 | L19: 74.879999999999995 | M19: =(I19-J19)/J19 -> 0.84758942457231723 | N19: =(K19-I19)/K19 -> 0.10465116279069767 | O19: =(K19-L19)/L19 -> 0.24038461538461539 | P19: 81.400000000000006 | AA19: 1w | AB19: =(K19-P19)/K19 -> 0.12360034453057699 | AC19: =(Q19-R19)/Q19 -> #DIV/0! | AM19: 不宜入场（收缩量不够）
A20: 688665.SH | B20: 四方光电 | C20: 1.86 | D20: 仪器仪表 | E20: 130.18000000000001 | F20: 139.44 | G20: 163.59 | I20: 168.88999999999999 | J20: 46.07 | K20: 195 | L20: 139.12 | M20: =(I20-J20)/J20 -> 2.6659431300195355 | N20: =(K20-I20)/K20 -> 0.13389743589743597 | O20: =(K20-L20)/L20 -> 0.40166762507188036 | P20: 153.66 | AA20: 1w | AB20: =(K20-P20)/K20 -> 0.21200000000000002 | AC20: =(Q20-R20)/Q20 -> #DIV/0! | AM20: 不宜入场（收缩量不够）
A21: 688776.SH | B21: 国光电气 | C21: 1.83 | D21: 国防军工 | E21: 160.03 | F21: 165.19 | G21: 185.80000000000001 | I21: 192.61000000000001 | J21: 127.77 | K21: 225.69999999999999 | L21: 159.61000000000001 | M21: =(I21-J21)/J21 -> 0.50747436800500911 | N21: =(K21-I21)/K21 -> 0.1466105449712006 | O21: =(K21-L21)/L21 -> 0.41407180001253036 | P21: 183.21000000000001 | AA21: 2w | AB21: =(K21-P21)/K21 -> 0.18825875055383245 | AC21: =(Q21-R21)/Q21 -> #DIV/0! | AM21: 不宜入场（收缩量不够）
A22: 688087.SH | B22: 英科再生 | C22: 1.82 | D22: 化工合成材料 | E22: 86.599999999999994 | F22: 87.890000000000001 | G22: 92.239999999999995 | I22: 98.400000000000006 | J22: 70 | K22: 123.90000000000001 | L22: 70 | M22: =(I22-J22)/J22 -> 0.40571428571428581 | N22: =(K22-I22)/K22 -> 0.20581113801452783 | O22: =(K22-L22)/L22 -> 0.77000000000000013 | P22: 71.810000000000002 | Q22: 105.68000000000001 | R22: 91.099999999999994 | AA22: 20w | AB22: =(K22-P22)/K22 -> 0.42041969330104922 | AC22: =(Q22-R22)/Q22 -> 0.13796366389099179 | AM22: 不宜入场（收缩量不够）
A23: 688080.SH | B23: 映翰通 | C23: 1.75 | D23: 通信设备 | E23: 54.609999999999999 | F23: 57.18 | G23: 67.349999999999994 | I23: 85 | J23: 35.439999999999998 | K23: 85.180000000000007 | L23: 47.640000000000001 | M23: =(I23-J23)/J23 -> 1.3984198645598196 | N23: =(K23-I23)/K23 -> 2.1131721061282789e-03 | O23: =(K23-L23)/L23 -> 0.78799328295549975 | AA23: 1w | AB23: =(K23-P23)/K23 -> 1 | AC23: =(Q23-R23)/Q23 -> #DIV/0! | AM23: 不宜入场（时间周期太短）
A24: 688388.SH | B24: 嘉元科技 | C24: 1.71 | D24: 工业金属 | E24: 116.69 | F24: 123.89 | G24: 144.16 | I24: 130.75 | M24: =(I24-J24)/J24 -> #DIV/0! | N24: =(K24-I24)/K24 -> #DIV/0! | O24: =(K24-L24)/L24 -> #DIV/0! | AB24: =(K24-P24)/K24 -> #DIV/0! | AC24: =(Q24-R24)/Q24 -> #DIV/0! | AM24: 不宜入场（当前股价小于50日均线）
A25: 688269.SH | B25: 凯立新材 | C25: 1.62 | D25: 金属新材料 | E25: 103.39 | F25: 106.36 | G25: 111.22 | I25: 118.08 | J25: 61.399999999999999 | K25: 149.06999999999999 | L25: 61.399999999999999 | M25: =(I25-J25)/J25 -> 0.92312703583061895 | N25: =(K25-I25)/K25 -> 0.20788891124974843 | O25: =(K25-L25)/L25 -> 1.4278501628664493 | P25: 87.980000000000004 | Q25: 141.30000000000001 | R25: 97.859999999999999 | S25: 114.89 | T25: 98.370000000000005 | U25: 126 | V25: 105.23 | AA25: 15w | AB25: =(K25-P25)/K25 -> 0.40980747299926201 | AC25: =(Q25-R25)/Q25 -> 0.30743099787685779 | AD25: =(S25-T25)/S25 -> 0.1437897118983375 | AE25: =(U25-V25)/U25 -> 0.16484126984126982 | AM25: 不宜入场（收缩量不够）
A26: 688513.SH | B26: 苑东生物 | C26: 1.55 | D26: 化学制药 | E26: 45.68 | F26: 45.700000000000003 | G26: 45.630000000000003 | M26: =(I26-J26)/J26 -> #DIV/0! | N26: =(K26-I26)/K26 -> #DIV/0! | O26: =(K26-L26)/L26 -> #DIV/0! | AB26: =(K26-P26)/K26 -> #DIV/0! | AC26: =(Q26-R26)/Q26 -> #DIV/0! | AD26: =(S26-T26)/S26 -> #DIV/0! | AM26: 不宜入场（50日均线小于150日均线）
A27: 688636.SH | B27: 智明达 | C27: 1.54 | D27: 国防军工 | E27: 131.94999999999999 | F27: 136.52000000000001 | G27: 147.58000000000001 | I27: 144.19999999999999 | M27: =(I27-J27)/J27 -> #DIV/0! | N27: =(K27-I27)/K27 -> #DIV/0! | O27: =(K27-L27)/L27 -> #DIV/0! | AA27: 0w | AB27: =(K27-P27)/K27 -> #DIV/0! | AC27: =(Q27-R27)/Q27 -> #DIV/0! | AD27: =(S27-T27)/S27 -> #DIV/0! | AM27: 不宜入场（当前股价小于50日均线）
A28: 688105.SH | B28: 诺唯赞 | C28: 1.53 | D28: 医疗器械 | E28: 91.799999999999997 | F28: 92.840000000000003 | G28: 102.48999999999999 | I28: 125.13 | J28: 74 | K28: 130.5 | L28: 74 | M28: =(I28-J28)/J28 -> 0.69094594594594594 | N28: =(K28-I28)/K28 -> 4.1149425287356357e-02 | O28: =(K28-L28)/L28 -> 0.76351351351351349 | AA28: 0w | AB28: =(K28-P28)/K28 -> 1 | AC28: =(Q28-R28)/Q28 -> #DIV/0! | AD28: =(S28-T28)/S28 -> #DIV/0! | AM28: 不宜入场（时间周期太短）
A29: 688300.SH | B29: 联瑞新材 | C29: 1.5 | D29: 非金属材料 | E29: 71.819999999999993 | F29: 75.420000000000002 | G29: 89.099999999999994 | I29: 112 | J29: 39.299999999999997 | K29: 114.2 | L29: 64.909999999999997 | M29: =(I29-J29)/J29 -> 1.8498727735368958 | N29: =(K29-I29)/K29 -> 1.9264448336252214e-02 | O29: =(K29-L29)/L29 -> 0.75935911261747047 | AA29: 0w | AB29: =(K29-P29)/K29 -> 1 | AC29: =(Q29-R29)/Q29 -> #DIV/0! | AD29: =(S29-T29)/S29 -> #DIV/0! | AM29: 不宜入场（时间周期太短）
A30: 688680.SH | B30: 海优新材 | C30: 1.47 | D30: 电力设备 | E30: 237.40000000000001 | F30: 251.63999999999999 | G30: 287.26999999999998 | I30: 261.42000000000002 | J30: 102.81 | K30: 362.20999999999998 | L30: 252.34999999999999 | M30: =(I30-J30)/J30 -> 1.5427487598482639 | N30: =(K30-I30)/K30 -> 0.27826399050274692 | O30: =(K30-L30)/L30 -> 0.43534773132553989 | AB30: =(K30-P30)/K30 -> 1 | AC30: =(Q30-R30)/Q30 -> #DIV/0! | AD30: =(S30-T30)/S30 -> #DIV/0! | AM30: 不宜入场（当前股价小于50日均线）
A31: 688257.SH | B31: 新锐股份 | C31: 1.46 | D31: 通用设备 | E31: 55.240000000000002 | F31: 55.689999999999998 | G31: 57.850000000000001 | I31: 60.880000000000003 | J31: 48.880000000000003 | K31: 64.379999999999995 | L31: 48.880000000000003 | M31: =(I31-J31)/J31 -> 0.24549918166939441 | N31: =(K31-I31)/K31 -> 5.4364709537123225e-02 | O31: =(K31-L31)/L31 -> 0.31710310965630101 | P31: 54.399999999999999 | Q31: 62.200000000000003 | R31: 57.280000000000001 | AA31: 4w | AB31: =(K31-P31)/K31 -> 0.15501708605156878 | AC31: =(Q31-R31)/Q31 -> 7.909967845659166e-02 | AD31: =(S31-T31)/S31 -> #DIV/0! | AM31: 不宜入场（当前股价距离最低点的距离过近）
A32: 688519.SH | B32: 南亚新材 | C32: 1.37 | D32: 半导体及元件 | E32: 39.390000000000001 | F32: 40.82 | G32: 44.310000000000002 | I32: 49.859999999999999 | J32: 23.18 | K32: 53.270000000000003 | L32: 39.520000000000003 | M32: =(I32-J32)/J32 -> 1.1509922346850734 | N32: =(K32-I32)/K32 -> 6.4013516050309804e-02 | O32: =(K32-L32)/L32 -> 0.34792510121457487 | P32: 34.799999999999997 | Q32: 50.950000000000003 | R32: 43.700000000000003 | S32: 49.380000000000003 | T32: 45.049999999999997 | AA32: 12w | AB32: =(K32-P32)/K32 -> 0.34672423502909716 | AC32: =(Q32-R32)/Q32 -> 0.14229636898920509 | AD32: =(S32-T32)/S32 -> 8.768732280275425e-02 | AM32: 可以入场
A33: 688162.SH | B33: 巨一科技 | C33: 1.36 | D33: 专用设备 | E33: 94.060000000000002 | F33: 95.319999999999993 | G33: 102.08 | I33: 108.90000000000001 | J33: 70.120000000000005 | K33: 133.55000000000001 | L33: 70.120000000000005 | M33: =(I33-J33)/J33 -> 0.55305191100969764 | N33: =(K33-I33)/K33 -> 0.18457506551853242 | O33: =(K33-L33)/L33 -> 0.904592127780947 | P33: 96.319999999999993 | AA33: 2w | AB33: =(K33-P33)/K33 -> 0.27877199550730075 | AC33: =(Q33-R33)/Q33 -> #DIV/0! | AD33: =(S33-T33)/S33 -> #DIV/0! | AM33: 不宜入场（收缩量不够）
A34: 688633.SH | B34: 星球石墨 | C34: 1.36 | D34: 专用设备 | E34: 63.810000000000002 | F34: 64.819999999999993 | G34: 67.75 | I34: 64.5 | M34: =(I34-J34)/J34 -> #DIV/0! | N34: =(K34-I34)/K34 -> #DIV/0! | O34: =(K34-L34)/L34 -> #DIV/0! | AB34: =(K34-P34)/K34 -> #DIV/0! | AC34: =(Q34-R34)/Q34 -> #DIV/0! | AD34: =(S34-T34)/S34 -> #DIV/0! | AM34: 不宜入场（当前股价小于50日均线）
A35: 688077.SH | B35: 大地熊 | C35: 1.31 | D35: 金属新材料 | E35: 56.219999999999999 | F35: 59.18 | G35: 72.870000000000005 | I35: 81.890000000000001 | J35: 34.590000000000003 | K35: 100.88 | L35: 44.100000000000001 | M35: =(I35-J35)/J35 -> 1.3674472390864409 | N35: =(K35-I35)/K35 -> 0.18824345757335445 | O35: =(K35-L35)/L35 -> 1.2875283446712016 | P35: 78.310000000000002 | AA35: 2w | AB35: =(K35-P35)/K35 -> 0.22373116574147497 | AC35: =(Q35-R35)/Q35 -> #DIV/0! | AD35: =(S35-T35)/S35 -> #DIV/0! | AM35: 不宜入场（收缩量不够）
A36: 688398.SH | B36: 赛特新材 | C36: 1.24 | D36: 化学制品 | E36: 44.57 | F36: 44.969999999999999 | G36: 47.090000000000003 | I36: 52.25 | J36: 35.240000000000002 | K36: 56.560000000000002 | L36: 40.810000000000002 | M36: =(I36-J36)/J36 -> 0.48269012485811569 | N36: =(K36-I36)/K36 -> 7.6202263083451238e-02 | O36: =(K36-L36)/L36 -> 0.385934819897084 | P36: 37.560000000000002 | Q36: 50.969999999999999 | R36: 44.600000000000001 | S36: 52.350000000000001 | T36: 48 | AA36: 17w | AB36: =(K36-P36)/K36 -> 0.33592644978783592 | AC36: =(Q36-R36)/Q36 -> 0.12497547577006077 | AD36: =(S36-T36)/S36 -> 8.309455587392553e-02 | AM36: 可以入场
A37: 688005.SH | B37: 容百科技 | C37: 1.23 | D37: 电力设备 | E37: 106.59 | F37: 112.3 | G37: 122.11 | I37: 115.16 | J37: 43.039999999999999 | K37: 161.31999999999999 | L37: 64.810000000000002 | M37: =(I37-J37)/J37 -> 1.675650557620818 | N37: =(K37-I37)/K37 -> 0.28613935035953386 | O37: =(K37-L37)/L37 -> 1.4891220490665018 | P37: 99.5 | AB37: =(K37-P37)/K37 -> 0.38321348871807587 | AC37: =(Q37-R37)/Q37 -> #DIV/0! | AD37: =(S37-T37)/S37 -> #DIV/0! | AM37: 不宜入场（当前股价与最高点的距离太远，抛压太大)
A38: 688099.SH | B38: 晶晨股份 | C38: 1.22 | D38: 半导体及元件 | E38: 106.13 | F38: 108.98999999999999 | G38: 117.06 | I38: 121.11 | J38: 78.609999999999999 | K38: 140.5 | L38: 85.670000000000002 | M38: =(I38-J38)/J38 -> 0.540643684009668 | N38: =(K38-I38)/K38 -> 0.13800711743772243 | O38: =(K38-L38)/L38 -> 0.64001400723707247 | P38: 94.870000000000005 | Q38: 117.3 | R38: 105.02 | S38: 128.36000000000001 | T38: 114 | AA38: 19w | AB38: =(K38-P38)/K38 -> 0.32476868327402131 | AC38: =(Q38-R38)/Q38 -> 0.10468883205456096 | AD38: =(S38-T38)/S38 -> 0.11187285758803375 | AM38: 不宜入场（收缩量不够）
A39: 688122.SH | B39: 西部超导 | C39: 1.22 | D39: 国防军工 | E39: 74.719999999999999 | F39: 77.689999999999998 | G39: 86.670000000000002 | I39: 87.530000000000001 | J39: 43.609999999999999 | K39: 99.920000000000002 | L39: 71.799999999999997 | M39: =(I39-J39)/J39 -> 1.0071084613620729 | N39: =(K39-I39)/K39 -> 0.1239991993594876 | O39: =(K39-L39)/L39 -> 0.39164345403899731 | P39: 86.200000000000003 | Q39: 93.989999999999995 | R39: 86.5 | AA39: 2w | AB39: =(K39-P39)/K39 -> 0.13730984787830264 | AC39: =(Q39-R39)/Q39 -> 7.9689328651984206e-02 | AD39: =(S39-T39)/S39 -> #DIV/0! | AM39: 可以入场
A40: 688065.SH | B40: 凯赛生物 | C40: 1.18 | D40: 化学制品 | E40: 127.48999999999999 | F40: 135.34 | G40: 158.30000000000001 | I40: 178.30000000000001 | J40: 76.299999999999997 | K40: 189.80000000000001 | L40: 155.19 | M40: =(I40-J40)/J40 -> 1.3368283093053737 | N40: =(K40-I40)/K40 -> 6.0590094836670175e-02 | O40: =(K40-L40)/L40 -> 0.22301694696823257 | AA40: 1w | AB40: =(K40-P40)/K40 -> 1 | AC40: =(Q40-R40)/Q40 -> #DIV/0! | AD40: =(S40-T40)/S40 -> #DIV/0! | AM40: 不宜入场（时间周期太短）
A41: 688017.SH | B41: 绿的谐波 | C41: 1.18 | D41: 自动化设备 | E41: 141.22999999999999 | F41: 146.59 | G41: 161.88 | I41: 175.11000000000001 | J41: 85.75 | K41: 191.59999999999999 | L41: 137.65000000000001 | M41: =(I41-J41)/J41 -> 1.0420991253644316 | N41: =(K41-I41)/K41 -> 8.6064718162839143e-02 | O41: =(K41-L41)/L41 -> 0.39193606974209944 | P41: 122.87 | Q41: 175.58000000000001 | R41: 152.11000000000001 | AA41: 20w | AB41: =(K41-P41)/K41 -> 0.35871607515657616 | AC41: =(Q41-R41)/Q41 -> 0.13367126096366327 | AD41: =(S41-T41)/S41 -> #DIV/0! | AM41: 不宜入场（收缩量不够）
A42: 688558.SH | B42: 国盛智科 | C42: 1.15 | D42: 通用设备 | E42: 43.869999999999997 | F42: 45.340000000000003 | G42: 47.640000000000001 | I42: 44.710000000000001 | M42: =(I42-J42)/J42 -> #DIV/0! | N42: =(K42-I42)/K42 -> #DIV/0! | O42: =(K42-L42)/L42 -> #DIV/0! | AB42: =(K42-P42)/K42 -> #DIV/0! | AC42: =(Q42-R42)/Q42 -> #DIV/0! | AD42: =(S42-T42)/S42 -> #DIV/0! | AM42: 不宜入场（当前股价小于150日均线）
A43: 688661.SH | B43: 和林微纳 | C43: 1.14 | D43: 消费电子 | E43: 84.879999999999995 | F43: 91.269999999999996 | G43: 106.12 | I43: 105.05 | J43: 32.119999999999997 | K43: 129.56 | L43: 89.849999999999994 | M43: =(I43-J43)/J43 -> 2.2705479452054798 | N43: =(K43-I43)/K43 -> 0.1891787588761964 | O43: =(K43-L43)/L43 -> 0.44195882025598232 | P43: 100.18000000000001 | AB43: =(K43-P43)/K43 -> 0.22676752083976531 | AC43: =(Q43-R43)/Q43 -> #DIV/0! | AD43: =(S43-T43)/S43 -> #DIV/0! | AM43: 不宜入场（当前股价小于50日均线）
A44: 688186.SH | B44: 广大特材 | C44: 1.08 | D44: 钢铁 | E44: 44.68 | F44: 47.060000000000002 | G44: 51.780000000000001 | I44: 43.969999999999999 | M44: =(I44-J44)/J44 -> #DIV/0! | N44: =(K44-I44)/K44 -> #DIV/0! | O44: =(K44-L44)/L44 -> #DIV/0! | AB44: =(K44-P44)/K44 -> #DIV/0! | AC44: =(Q44-R44)/Q44 -> #DIV/0! | AD44: =(S44-T44)/S44 -> #DIV/0! | AM44: 不宜入场（当前股价小于150日均线）
A45: 688233.SH | B45: 神工股份 | C45: 1.06 | D45: 半导体及元件 | E45: 66.569999999999993 | F45: 71.25 | G45: 84.590000000000003 | I45: 88.329999999999998 | J45: 32.609999999999999 | K45: 104.98999999999999 | L45: 48.18 | M45: =(I45-J45)/J45 -> 1.7086783195338853 | N45: =(K45-I45)/K45 -> 0.15868177921706828 | O45: =(K45-L45)/L45 -> 1.1791199667911996 | P45: 64.280000000000001 | Q45: 86.799999999999997 | R45: 65.700000000000003 | S45: 92.939999999999998 | T45: 77.950000000000003 | U45: 104.8 | V45: 83.879999999999995 | W45: 97.549999999999997 | X45: 85.519999999999996 | AA45: 20w | AB45: =(K45-P45)/K45 -> 0.3877512144013715 | AC45: =(Q45-R45)/Q45 -> 0.24308755760368658 | AD45: =(S45-T45)/S45 -> 0.16128685173230037 | AE45: =(U45-V45)/U45 -> 0.19961832061068704 | AF45: =(W45-X45)/W45 -> 0.12332137365453615 | AM45: 不宜入场（收缩量不够）
A46: 688577.SH | B46: 浙海德曼 | C46: 1.06 | D46: 通用设备 | E46: 53.640000000000001 | F46: 55.380000000000003 | G46: 59.270000000000003 | I46: 57.659999999999997 | J46: 37.710000000000001 | K46: 84.5 | L46: 51.68 | M46: =(I46-J46)/J46 -> 0.52903739061256949 | N46: =(K46-I46)/K46 -> 0.31763313609467458 | O46: =(K46-L46)/L46 -> 0.63506191950464397 | AB46: =(K46-P46)/K46 -> 1 | AC46: =(Q46-R46)/Q46 -> #DIV/0! | AD46: =(S46-T46)/S46 -> #DIV/0! | AE46: =(U46-V46)/U46 -> #DIV/0! | AM46: 不宜入场（当前股价距离最高点距离太远，面临较大抛压）
A47: 688639.SH | B47: 华恒生物 | C47: 1.06 | D47: 化学制品 | E47: 64.299999999999997 | F47: 69.510000000000005 | G47: 89 | I47: 109.90000000000001 | J47: 33.740000000000002 | K47: 117 | L47: 58.009999999999998 | M47: =(I47-J47)/J47 -> 2.2572614107883817 | N47: =(K47-I47)/K47 -> 6.0683760683760635e-02 | O47: =(K47-L47)/L47 -> 1.0168936390277539 | P47: 90.579999999999998 | AA47: 1w | AB47: =(K47-P47)/K47 -> 0.22581196581196583 | AC47: =(Q47-R47)/Q47 -> #DIV/0! | AD47: =(S47-T47)/S47 -> #DIV/0! | AE47: =(U47-V47)/U47 -> #DIV/0! | AM47: 不宜入场（收缩量不够）
A48: 688625.SH | B48: 呈和科技 | C48: 1.05 | D48: 化学制品 | E48: 51.460000000000001 | F48: 53.020000000000003 | G48: 56.469999999999999 | I48: 57.240000000000002 | J48: 35.399999999999999 | K48: 67.120000000000005 | L48: 52.810000000000002 | M48: =(I48-J48)/J48 -> 0.61694915254237304 | N48: =(K48-I48)/K48 -> 0.14719904648390944 | O48: =(K48-L48)/L48 -> 0.27097140693050564 | P48: 46.020000000000003 | Q48: 57.380000000000003 | R48: 49.759999999999998 | S48: 62.689999999999998 | T48: 52.990000000000002 | U48: 60.859999999999999 | V48: 55.600000000000001 | AA48: 12w | AB48: =(K48-P48)/K48 -> 0.31436233611442194 | AC48: =(Q48-R48)/Q48 -> 0.13279888462879058 | AD48: =(S48-T48)/S48 -> 0.15472962194927414 | AE48: =(U48-V48)/U48 -> 8.6427867236279959e-02