A1: 股票代码 | B1: 股票简称 | C1: 基本每(元)2021.09.30 | D1: 行业 | E1: 当前基底处于上升趋势的位置(即处于第几个基底) | F1: 趋势 | Q1: 波动收缩幅度 | AJ1: 成交量行为 | AL1: 价格行为(得分应大于60%) | AO1: 结论 | AP1: 更新时间 | AQ1: 标签
F2: 200日均线 | G2: 150日均线 | H2: 50日均线 | I2: 各均线斜率是否朝上 | J2: 当前股价 | K2: 52周内最低点 | L2: 52周内最高点 | M2: 最高点前8周收盘价 | N2: 当前股价相对于最低点百分比(至少高出25%) | O2: 当前股价相对于最高点百分比(25%内最好) | P2: 最高点前8周股价相对于最高点百分比 | Q2: 技术足迹 | AJ2: 不同收盘表现时交易量情况(好的收盘时，交易量是否增大，坏的收盘时，交易量是否萎缩) | AK2: 成交量收缩情况(最后的价格收缩期间的成交量应低于50天的平均水平且有一到两天交易量极低) | AL2: 支撑位和压力位是否同步升高(40%) | AM2: 是否有网球行为出现(40%) | AN2: 上涨天数是否大于下跌天数(20%)
Q3: 支撑位1 | R3: 阻力位2 | S3: 支撑位2 | T3: 阻力位3 | U3: 支撑位3 | V3: 阻力位4 | W3: 支撑位4 | X3: 阻力位5 | Y3: 支撑位5 | Z3: 阻力位6 | AA3: 支撑位6 | AB3: 时间周期 | AC3: 收缩量1 | AD3: 收缩量2 | AE3: 收缩量3 | AF3: 收缩量4 | AG3: 收缩量5 | AH3: 收缩量6 | AI3: 收缩数量(至少大于3T)
A4: 002932.SZ | B4: 明德生物 | C4: 10.68 | D4: 医疗器械 | F4: 64.599999999999994 | G4: 66.590000000000003 | H4: 70.609999999999999 | J4: 71.650000000000006 | K4: 41.789999999999999 | L4: 90.290000000000006 | M4: 64.659999999999997 | N4: =(J4-K4)/K4 -> 0.71452500598229263 | O4: =(L4-J4)/L4 -> 0.20644589655554324 | P4: =(L4-M4)/M4 -> 0.39638107021342422 | Q4: 60.049999999999997 | R4: 74.75 | S4: 65.5 | T4: 77.980000000000004 | U4: 70.400000000000006 | AB4: 18w | AC4: =(L4-Q4)/L4 -> 0.33492081072101015 | AD4: =(R4-S4)/R4 -> 0.12374581939799331 | AE4: =(T4-U4)/T4 -> 9.7204411387535244e-02 | AI4: 3T | AJ4: 是 | AK4: 是 | AL4: 是 | AM4: 是 | AN4: 是 | AO4: 可以入场 | AP4: 44553
A5: 600955.SH | B5: 维远股份 | C5: 4.2999999999999998 | D5: 化学原料 | N5: =(J5-K5)/K5 -> #DIV/0! | O5: =(L5-J5)/L5 -> #DIV/0! | P5: =(L5-M5)/M5 -> #DIV/0! | AC5: =(L5-Q5)/L5 -> #DIV/0! | AD5: =(R5-S5)/R5 -> #DIV/0! | AE5: =(T5-U5)/T5 -> #DIV/0! | AO5: 已分析 | AP5: 44549
A6: 000568.SZ | B6: 泸州老窖 | C6: 4.28 | D6: 饮料制造 | F6: 224.34 | G6: 223.59 | J6: 248.50999999999999 | K6: 160.53 | L6: 325.61000000000001 | M6: 202.58000000000001 | N6: =(J6-K6)/K6 -> 0.54805955273157658 | O6: =(L6-J6)/L6 -> 0.23678633948588809 | P6: =(L6-M6)/M6 -> 0.607315628393721 | AC6: =(L6-Q6)/L6 -> 1 | AD6: =(R6-S6)/R6 -> #DIV/0! | AE6: =(T6-U6)/T6 -> #DIV/0! | AO6: 不宜入场(150日均线小于200日均线) | AP6: 44549
A7: 600809.SH | B7: 山西汾酒 | C7: 4.02 | D7: 饮料制造 | F7: 298.79000000000002 | G7: 304.83999999999997 | H7: 315.10000000000002 | J7: 304.30000000000001 | K7: 183.43000000000001 | L7: 380.76999999999998 | M7: 319.30000000000001 | N7: =(J7-K7)/K7 -> 0.65894346617238186 | O7: =(L7-J7)/L7 -> 0.2008298973133387 | P7: =(L7-M7)/M7 -> 0.1925148762918884 | Q7: 256.60000000000002 | R7: 352.06 | S7: 279.00999999999999 | T7: 344.48000000000002 | U7: 301.80000000000001 | AB7: 19w | AC7: =(L7-Q7)/L7 -> 0.32610237151036048 | AD7: =(R7-S7)/R7 -> 0.20749304095892748 | AE7: =(T7-U7)/T7 -> 0.12389688806316769 | AO7: 不宜入场(收缩幅度不够，应观察2w) | AP7: 44549
A8: 000596.SZ | B8: 古井贡酒 | C8: 3.85 | D8: 饮料制造 | F8: 232.64 | G8: 235.81 | H8: 251.78999999999999 | J8: 264.16 | K8: 177.01 | L8: 293.5 | M8: 223.48 | N8: =(J8-K8)/K8 -> 0.49234506525055105 | O8: =(L8-J8)/L8 -> 9.9965928449744376e-02 | P8: =(L8-M8)/M8 -> 0.31331662788616438 | Q8: 177.00999999999999 | R8: 234.78 | S8: 200.97999999999999 | T8: 253.33000000000001 | U8: 217.59 | V8: 273.25 | W8: 249.5 | X8: 278 | Y8: 252.05000000000001 | AB8: 45w | AC8: =(L8-Q8)/L8 -> 0.3968994889267462 | AD8: =(R8-S8)/R8 -> 0.14396456256921378 | AE8: =(T8-U8)/T8 -> 0.14108080369478548 | AF8: =(V8-W8)/V8 -> 8.6916742909423611e-02 | AG8: =(X8-Y8)/X8 -> 9.3345323741007152e-02 | AI8: 5T | AJ8: 否 | AK8: 否 | AL8: 是 | AM8: 是 | AN8: 是 | AO8: 不宜入场(成交量行为和价格行为不明朗) | AP8: 44553
A9: 603489.SH | B9: 八方股份 | C9: 3.61 | D9: 电力设备 | F9: 229.47 | G9: 234.24000000000001 | H9: 244.53 | J9: 240.5 | K9: 168.31999999999999 | L9: 305.88999999999999 | M9: 213.38 | N9: =(J9-K9)/K9 -> 0.42882604562737647 | O9: =(L9-J9)/L9 -> 0.21376965575860599 | P9: =(L9-M9)/M9 -> 0.43354578685912454 | Q9: 215.06 | R9: 268.99000000000001 | S9: 224.02000000000001 | AB9: 7w | AC9: =(L9-Q9)/L9 -> 0.29693680734904698 | AD9: =(R9-S9)/R9 -> 0.16718093609427859 | AE9: =(T9-U9)/T9 -> #DIV/0! | AO9: 不宜入场(收缩幅度不够，应观察2w) | AP9: 44549
A10: 600436.SH | B10: 片仔癀 | C10: 3.33 | D10: 中药 | F10: 389.06 | G10: 401.67000000000002 | H10: 438.81999999999999 | J10: 475.85 | K10: 239.25 | L10: 491.88 | M10: 368.8 | N10: =(J10-K10)/K10 -> 0.98892371995820283 | O10: =(L10-J10)/L10 -> 3.258924941042525e-02 | P10: =(L10-M10)/M10 -> 0.33373101952277651 | Q10: 318.56 | R10: 445.80000000000001 | S10: 395 | T10: 468.88 | U10: 430 | V10: 466.48000000000002 | W10: 449.02999999999997 | X10: 472 | Y10: 451.06999999999999 | AB10: 19w | AC10: =(L10-Q10)/L10 -> 0.35236236480442384 | AD10: =(R10-S10)/R10 -> 0.11395244504262003 | AE10: =(T10-U10)/T10 -> 8.2921003241767613e-02 | AF10: =(V10-W10)/V10 -> 3.7407820270965626e-02 | AG10: =(X10-Y10)/X10 -> 4.4343220338983066e-02 | AI10: 4T | AJ10: 否 | AK10: 是 | AL10: 是 | AM10: 是 | AN10: 否 | AO10: 不宜进场(满足普通收缩幅度收窄形态，但成交量行为和价格行为仍不明朗) | AP10: 44553
A11: 600486.SH | B11: 扬农化工 | C11: 3.28 | D11: 化学制品 | N11: =(J11-K11)/K11 -> #DIV/0! | O11: =(L11-J11)/L11 -> #DIV/0! | P11: =(L11-M11)/M11 -> #DIV/0! | AC11: =(L11-Q11)/L11 -> #DIV/0! | AD11: =(R11-S11)/R11 -> #DIV/0! | AE11: =(T11-U11)/T11 -> #DIV/0! | AO11: 不宜入场(150日均线小于200日均线) | AP11: 44549
A12: 600702.SH | B12: 舍得酒业 | C12: 2.92 | D12: 饮料制造 | N12: =(J12-K12)/K12 -> #DIV/0! | O12: =(L12-J12)/L12 -> #DIV/0! | P12: =(L12-M12)/M12 -> #DIV/0! | AC12: =(L12-Q12)/L12 -> #DIV/0! | AD12: =(R12-S12)/R12 -> #DIV/0! | AE12: =(T12-U12)/T12 -> #DIV/0! | AO12: 已分析 | AP12: 44549
A13: 002821.SZ | B13: 凯莱英 | C13: 2.88 | D13: 医疗服务 | F13: 378.00999999999999 | G13: 393.39999999999998 | H13: 435.64999999999998 | J13: 436 | K13: 226.90000000000001 | L13: 532.49000000000001 | M13: 445.89999999999998 | N13: =(J13-K13)/K13 -> 0.92155134420449536 | O13: =(L13-J13)/L13 -> 0.18120528085034462 | P13: =(L13-M13)/M13 -> 0.1941915227629514 | Q13: 414.80000000000001 | AB13: 2w | AC13: =(L13-Q13)/L13 -> 0.22101823508422694 | AD13: =(R13-S13)/R13 -> #DIV/0! | AE13: =(T13-U13)/T13 -> #DIV/0! | AO13: 不宜入场(收缩幅度不够，应观察3w) | AP13: 44549
A14: 603267.SH | B14: 鸿远电子 | C14: 2.84 | D14: 国防军工 | F14: 148.74000000000001 | G14: 152.27000000000001 | H14: 166.41999999999999 | J14: 173.97 | K14: 103.56999999999999 | L14: 191.09 | M14: 151 | N14: =(J14-K14)/K14 -> 0.67973351356570444 | O14: =(L14-J14)/L14 -> 8.9591292061332373e-02 | P14: =(L14-M14)/M14 -> 0.26549668874172189 | Q14: 166 | AB14: 2w | AC14: =(L14-Q14)/L14 -> 0.13129938772306246 | AD14: =(R14-S14)/R14 -> #DIV/0! | AE14: =(T14-U14)/T14 -> #DIV/0! | AJ14: 是 | AK14: 是 | AL14: 是 | AM14: 是 | AN14: 是 | AO14: 不宜入场（收缩量不够） | AP14: 44553
A15: 600600.SH | B15: 青岛啤酒 | C15: 2.67 | D15: 饮料制造 | F15: 91.870000000000005 | G15: 93.030000000000001 | H15: 97.189999999999998 | J15: 99.700000000000003 | K15: 71.709999999999994 | L15: 117.36 | M15: 90.260000000000005 | N15: =(J15-K15)/K15 -> 0.39032213080462991 | O15: =(L15-J15)/L15 -> 0.15047716428084523 | P15: =(L15-M15)/M15 -> 0.30024374030578321 | Q15: 76.560000000000002 | R15: 96.5 | S15: 77.519999999999996 | T15: 104.28 | U15: 91.099999999999994 | V15: 104.94 | W15: 96.230000000000004 | X15: 108.5 | Y15: 98 | AB15: 22w | AC15: =(L15-Q15)/L15 -> 0.34764826175869118 | AD15: =(R15-S15)/R15 -> 0.19668393782383423 | AE15: =(T15-U15)/T15 -> 0.12639048714998088 | AF15: =(V15-W15)/V15 -> 8.2999809414903702e-02 | AG15: =(X15-Y15)/X15 -> 9.6774193548387094e-02 | AO15: 不宜入场(成交量行为和价格行为不是很明朗，应多观察几天) | AP15: 44553
A16: 601799.SH | B16: 星宇股份 | C16: 2.65 | D16: 汽车零部件 | F16: 204.69999999999999 | G16: 206.75 | H16: 213.44 | J16: 204.83000000000001 | K16: 162.00999999999999 | L16: 235.52000000000001 | M16: 201.19999999999999 | N16: =(J16-K16)/K16 -> 0.26430467255107726 | O16: =(L16-J16)/L16 -> 0.13030740489130432 | P16: =(L16-M16)/M16 -> 0.17057654075546733 | Q16: 175.38999999999999 | R16: 200.5 | S16: 177.19999999999999 | T16: 233.16 | U16: 202.56 | AB16: 22w | AC16: =(L16-Q16)/L16 -> 0.25530740489130443 | AD16: =(R16-S16)/R16 -> 0.11620947630922698 | AE16: =(T16-U16)/T16 -> 0.13124034997426656 | AF16: =(V16-W16)/V16 -> #DIV/0! | AG16: =(X16-Y16)/X16 -> #DIV/0! | AO16: 不宜入场(当前股价小于150日均线) | AP16: 44549
A17: 605117.SH | B17: 德业股份 | C17: 2.64 | D17: 白色家电 | F17: 175.79 | G17: 198.7 | H17: 267.26 | J17: 287.9 | K17: 38.49 | L17: 345.99 | M17: 197.47999999999999 | N17: =(J17-K17)/K17 -> 6.479864899974018 | O17: =(L17-J17)/L17 -> 0.16789502586779972 | P17: =(L17-M17)/M17 -> 0.75202552157180491 | Q17: 242 | AB17: 5w | AC17: =(L17-Q17)/L17 -> 0.30055781959016159 | AJ17: 否（大部分情况收盘好时交易量放大，收盘坏时交易量萎缩；但近期仍有收盘好时交易量萎缩，收盘坏时交易量放大的情况出现） | AK17: 是 | AL17: 仅支撑位出现略微抬升 | AM17: 是（是有但不明显，应谨慎） | AN17: 否 | AO17: 暂不宜入场（成交量行为和价格行为仍不明朗，应继续观察1w） | AP17: 44545
A18: 605369.SH | B18: 拱东医疗 | C18: 2.57 | D18: 医疗器械 | F18: 92.450000000000003 | G18: 97.870000000000005 | H18: 109.2 | J18: 137.30000000000001 | K18: 42.140000000000001 | L18: 138.83000000000001 | M18: 93 | N18: =(J18-K18)/K18 -> 2.2581869957285243 | O18: =(L18-J18)/L18 -> 1.1020672765252475e-02 | P18: =(L18-M18)/M18 -> 0.4927956989247313 | AB18: 0w | AC18: =(L18-Q18)/L18 -> 1 | AD18: =(R18-S18)/R18 -> #DIV/0! | AE18: =(T18-U18)/T18 -> #DIV/0! | AF18: =(V18-W18)/V18 -> #DIV/0! | AG18: =(X18-Y18)/X18 -> #DIV/0! | AO18: 暂不宜入场（时间周期太短，应继续观察2w） | AP18: 44549
A19: 603986.SH | B19: 兆易创新 | C19: 2.5 | D19: 半导体及元件 | F19: 157.16999999999999 | G19: 159.68000000000001 | H19: 164.87 | J19: 167.13999999999999 | K19: 104.62 | L19: 235.13 | M19: 135.27000000000001 | N19: =(J19-K19)/K19 -> 0.59759128273752604 | O19: =(L19-J19)/L19 -> 0.28915918853400252 | P19: =(L19-M19)/M19 -> 0.73822724920529292 | Q19: 140.74000000000001 | R19: 176.94999999999999 | S19: 149.22 | T19: 185.66999999999999 | U19: 167 | AC19: =(L19-Q19)/L19 -> 0.40143750265810396 | AD19: =(R19-S19)/R19 -> 0.15671093529245544 | AE19: =(T19-U19)/T19 -> 0.10055474767059831 | AF19: =(V19-W19)/V19 -> #DIV/0! | AG19: =(X19-Y19)/X19 -> #DIV/0! | AO19: 暂不宜入场（当前股价距离最高点距离过大，面临抛压相对较大，应继续观察2w） | AP19: 44549
A20: 600563.SH | B20: 法拉电子 | C20: 2.45 | D20: 半导体及元件 | F20: 171.06999999999999 | G20: 183.50999999999999 | H20: 218.34999999999999 | J20: 222.03999999999999 | K20: 87.280000000000001 | L20: 261.19999999999999 | M20: 178.75999999999999 | N20: =(J20-K20)/K20 -> 1.5439963336388633 | O20: =(L20-J20)/L20 -> 0.14992343032159264 | P20: =(L20-M20)/M20 -> 0.46117699709107185 | Q20: 213.46000000000001 | R20: 233 | S20: 215.19999999999999 | AB20: 2w | AC20: =(L20-Q20)/L20 -> 0.18277182235834602 | AD20: =(R20-S20)/R20 -> 7.6394849785407767e-02 | AE20: =(T20-U20)/T20 -> #DIV/0! | AF20: =(V20-W20)/V20 -> #DIV/0! | AG20: =(X20-Y20)/X20 -> #DIV/0! | AO20: 暂不宜入场（股价太高，承受不起） | AP20: 44553
A21: 002913.SZ | B21: 奥士康 | C21: 2.42 | D21: 半导体及元件 | F21: 76.189999999999998 | G21: 78.569999999999993 | H21: 80.799999999999997 | J21: 78.280000000000001 | K21: 50.25 | L21: 114.45 | M21: 75.25 | N21: =(J21-K21)/K21 -> 0.55781094527363184 | O21: =(L21-J21)/L21 -> 0.31603320227173437 | P21: =(L21-M21)/M21 -> 0.52093023255813953 | AC21: =(L21-Q21)/L21 -> 1 | AD21: =(R21-S21)/R21 -> #DIV/0! | AE21: =(T21-U21)/T21 -> #DIV/0! | AF21: =(V21-W21)/V21 -> #DIV/0! | AG21: =(X21-Y21)/X21 -> #DIV/0! | AO21: 暂不宜入场（当前股价距离最高点距离过大，面临抛压相对较大，应继续观察5w） | AP21: 44549
A22: 603129.SH | B22: 春风动力 | C22: 2.42 | D22: 非汽车交运 | F22: 146.62 | G22: 148.99000000000001 | H22: 162.72999999999999 | J22: 155.81999999999999 | K22: 101.8 | L22: 193.58000000000001 | M22: 119.17 | N22: =(J22-K22)/K22 -> 0.53064833005893908 | O22: =(L22-J22)/L22 -> 0.1950614732926956 | P22: =(L22-M22)/M22 -> 0.62440211462616435 | Q22: 154.71000000000001 | AB22: 4w | AC22: =(L22-Q22)/L22 -> 0.20079553672900094 | AD22: =(R22-S22)/R22 -> #DIV/0! | AE22: =(T22-U22)/T22 -> #DIV/0! | AF22: =(V22-W22)/V22 -> #DIV/0! | AG22: =(X22-Y22)/X22 -> #DIV/0! | AO22: 暂不宜入场（收缩幅度不够，应继续观察5w） | AP22: 44549
A23: 002049.SZ | B23: 紫光国微 | C23: 2.3999999999999999 | D23: 半导体及元件 | F23: 179.22999999999999 | G23: 189.44 | H23: 214.03999999999999 | J23: 208.97 | K23: 95.069999999999993 | L23: 248.84999999999999 | M23: 146.91999999999999 | N23: =(J23-K23)/K23 -> 1.1980645839907438 | O23: =(L23-J23)/L23 -> 0.16025718304199316 | P23: =(L23-M23)/M23 -> 0.69377892730737822 | Q23: 181.77000000000001 | R23: 238.78999999999999 | S23: 206.59 | AB23: 15w | AC23: =(L23-Q23)/L23 -> 0.26955997588908975 | AD23: =(R23-S23)/R23 -> 0.13484651786088189 | AE23: =(T23-U23)/T23 -> #DIV/0! | AG23: =(X23-Y23)/X23 -> #DIV/0! | AO23: 暂不宜入场（收缩幅度不够，应继续观察2w） | AP23: 44549
A24: 600141.SH | B24: 兴发集团 | C24: 2.22 | D24: 化学制品 | F24: 31.100000000000001 | G24: 34.020000000000003 | H24: 40.850000000000001 | J24: 41.289999999999999 | K24: 11.48 | L24: 58.380000000000003 | M24: 27.530000000000001 | N24: =(J24-K24)/K24 -> 2.5966898954703832 | O24: =(L24-J24)/L24 -> 0.29273723878040431 | P24: =(L24-M24)/M24 -> 1.1205957137667999 | Q24: 36.030000000000001 | R24: 53.469999999999999 | S24: 37.200000000000003 | T24: 43.399999999999999 | U24: 40.009999999999998 | AB24: 11w | AC24: =(L24-Q24)/L24 -> 0.38283658787255909 | AD24: =(R24-S24)/R24 -> 0.30428277538806803 | AE24: =(T24-U24)/T24 -> 7.8110599078341031e-02 | AF24: =(V24-W24)/V24 -> #DIV/0! | AG24: =(X24-Y24)/X24 -> #DIV/0! | AO24: 暂不宜入场（收缩幅度不够，应继续观察2w） | AP24: 44549
A25: 603599.SH | B25: 广信股份 | C25: 2.22 | D25: 化学制品 | F25: 33.189999999999998 | G25: 33.740000000000002 | H25: 36.380000000000003 | J25: 37.600000000000001 | K25: 25.829999999999998 | L25: 41.299999999999997 | M25: 32.619999999999997 | N25: =(J25-K25)/K25 -> 0.45567169957413872 | O25: =(L25-J25)/L25 -> 8.9588377723970852e-02 | P25: =(L25-M25)/M25 -> 0.26609442060085836 | Q25: 36.799999999999997 | R25: 40.399999999999999 | S25: 38.409999999999997 | AB25: 2w | AC25: =(L25-Q25)/L25 -> 0.10895883777239711 | AD25: =(R25-S25)/R25 -> 4.9257425742574308e-02 | AE25: =(T25-U25)/T25 -> #DIV/0! | AF25: =(V25-W25)/V25 -> #DIV/0! | AG25: =(X25-Y25)/X25 -> #DIV/0! | AO25: 暂不宜入场（收缩幅度不够，应继续观察1w） | AP25: 44553
A26: 000799.SZ | B26: 酒鬼酒 | C26: 2.22 | D26: 饮料制造 | F26: 211.21000000000001 | G26: 218.52000000000001 | H26: 228.30000000000001 | J26: 227.38 | K26: 120.3 | L26: 276.88999999999999 | M26: 211.5 | N26: =(J26-K26)/K26 -> 0.89010806317539481 | O26: =(L26-J26)/L26 -> 0.17880746866986888 | P26: =(L26-M26)/M26 -> 0.30917257683215121 | Q26: 201.00999999999999 | R26: 250.66 | S26: 226 | AB26: 10w | AC26: =(L26-Q26)/L26 -> 0.27404384412582616 | AD26: =(R26-S26)/R26 -> 9.8380276071172099e-02 | AE26: =(T26-U26)/T26 -> #DIV/0! | AF26: =(V26-W26)/V26 -> #DIV/0! | AG26: =(X26-Y26)/X26 -> #DIV/0! | AO26: 暂不宜入场（收缩幅度不够，应继续观察2w） | AP26: 44549
A27: 605111.SH | B27: 新洁能 | C27: 2.19 | D27: 半导体及元件 | F27: 155.59 | G27: 160.69 | H27: 183.81 | J27: 183.88999999999999 | K27: 108.63 | L27: 243.09999999999999 | M27: 121.05 | N27: =(J27-K27)/K27 -> 0.69281045751633985 | O27: =(L27-J27)/L27 -> 0.24356232003290831 | P27: =(L27-M27)/M27 -> 1.0082610491532424 | Q27: 183.00999999999999 | AB27: 3w | AC27: =(L27-Q27)/L27 -> 0.24718222953517074 | AD27: =(R27-S27)/R27 -> #DIV/0! | AE27: =(T27-U27)/T27 -> #DIV/0! | AF27: =(V27-W27)/V27 -> #DIV/0! | AG27: =(X27-Y27)/X27 -> #DIV/0! | AO27: 暂不宜入场（收缩幅度不够，应继续观察2w） | AP27: 44549
A28: 603217.SH | B28: 元利科技 | C28: 2.16 | D28: 化学制品 | F28: 36.560000000000002 | G28: 38.359999999999999 | H28: 42.240000000000002 | J28: 45.710000000000001 | K28: 21.370000000000001 | L28: 53.979999999999997 | M28: 28.41 | N28: =(J28-K28)/K28 -> 1.1389798783341132 | O28: =(L28-J28)/L28 -> 0.15320489070025928 | P28: =(L28-M28)/M28 -> 0.90003519887363592 | Q28: 37.43 | R28: 48.299999999999997 | S28: 38.18 | T28: 47.850000000000001 | U28: 40.700000000000003 | V28: 48.960000000000001 | W28: 45 | AB28: 15w | AC28: =(L28-Q28)/L28 -> 0.30659503519822151 | AD28: =(R28-S28)/R28 -> 0.20952380952380947 | AE28: =(T28-U28)/T28 -> 0.1494252873563218 | AF28: =(V28-W28)/V28 -> 8.0882352941176489e-02 | AG28: =(X28-Y28)/X28 -> #DIV/0! | AO28: 可以入场 | AP28: 44553
A29: 601677.SH | B29: 明泰铝业 | C29: 2.12 | D29: 工业金属 | N29: =(J29-K29)/K29 -> #DIV/0! | O29: =(L29-J29)/L29 -> #DIV/0! | P29: =(L29-M29)/M29 -> #DIV/0! | AC29: =(L29-Q29)/L29 -> #DIV/0! | AD29: =(R29-S29)/R29 -> #DIV/0! | AE29: =(T29-U29)/T29 -> #DIV/0! | AF29: =(V29-W29)/V29 -> #DIV/0! | AG29: =(X29-Y29)/X29 -> #DIV/0! | AO29: 已分析(见分析结果汇总) | AP29: 44549
A30: 002916.SZ | B30: 深南电路 | C30: 2.09 | D30: 半导体及元件 | F30: 101.94 | G30: 101.78 | H30: 104.73999999999999 | N30: =(J30-K30)/K30 -> #DIV/0! | O30: =(L30-J30)/L30 -> #DIV/0! | P30: =(L30-M30)/M30 -> #DIV/0! | AC30: =(L30-Q30)/L30 -> #DIV/0! | AD30: =(R30-S30)/R30 -> #DIV/0! | AE30: =(T30-U30)/T30 -> #DIV/0! | AF30: =(V30-W30)/V30 -> #DIV/0! | AG30: =(X30-Y30)/X30 -> #DIV/0! | AO30: 暂不宜入场（150日均线小于200日均线，应观察3w） | AP30: 44549
A31: 600779.SH | B31: 水井坊 | C31: 2.05 | D31: 饮料制造 | N31: =(J31-K31)/K31 -> #DIV/0! | O31: =(L31-J31)/L31 -> #DIV/0! | P31: =(L31-M31)/M31 -> #DIV/0! | AC31: =(L31-Q31)/L31 -> #DIV/0! | AD31: =(R31-S31)/R31 -> #DIV/0! | AE31: =(T31-U31)/T31 -> #DIV/0! | AF31: =(V31-W31)/V31 -> #DIV/0! | AG31: =(X31-Y31)/X31 -> #DIV/0! | AO31: 已分析(见分析结果汇总) | AP31: 44549
A32: 601088.SH | B32: 中国神华 | C32: 2.05 | D32: 煤炭开采加工 | F32: 19.329999999999998 | G32: 19.739999999999998 | H32: 20.800000000000001 | J32: 22.030000000000001 | K32: 14.41 | L32: 24.449999999999999 | M32: 18.079999999999998 | N32: =(J32-K32)/K32 -> 0.5287994448299792 | O32: =(L32-J32)/L32 -> 9.897750511247437e-02 | P32: =(L32-M32)/M32 -> 0.35232300884955758 | Q32: 18.57 | AB32: 12w | AC32: =(L32-Q32)/L32 -> 0.24049079754601224 | AD32: =(R32-S32)/R32 -> #DIV/0! | AE32: =(T32-U32)/T32 -> #DIV/0! | AF32: =(V32-W32)/V32 -> #DIV/0! | AG32: =(X32-Y32)/X32 -> #DIV/0! | AO32: 暂不宜入场（收缩幅度不够，应继续观察2w） | AP32: 44549
A33: 605080.SH | B33: 浙江自然 | C33: 2.04 | D33: 服装家纺 | F33: 59.700000000000003 | G33: 62.159999999999997 | H33: 68.959999999999994 | J33: 70.849999999999994 | K33: 36.109999999999999 | L33: 80.890000000000001 | M33: 58.5 | N33: =(J33-K33)/K33 -> 0.96206037108834108 | O33: =(L33-J33)/L33 -> 0.12411917418716784 | P33: =(L33-M33)/M33 -> 0.38273504273504272 | Q33: 66.409999999999997 | R33: 76.079999999999998 | AB33: 3w | AC33: =(L33-Q33)/L33 -> 0.17900853010260853 | AD33: =(R33-S33)/R33 -> 1 | AE33: =(T33-U33)/T33 -> #DIV/0! | AF33: =(V33-W33)/V33 -> #DIV/0! | AG33: =(X33-Y33)/X33 -> #DIV/0! | AO33: 暂不宜入场（收缩幅度不够，应继续观察2w） | AP33: 44553
A34: 603799.SH | B34: 华友钴业 | C34: 1.98 | D34: 小金属 | F34: 110.13 | G34: 113.31999999999999 | H34: 120.56 | J34: 116.14 | K34: 60.799999999999997 | L34: 151 | M34: 73.689999999999998 | N34: =(J34-K34)/K34 -> 0.9101973684210527 | O34: =(L34-J34)/L34 -> 0.23086092715231787 | P34: =(L34-M34)/M34 -> 1.0491247116298006 | Q34: 97.799999999999997 | R34: 142.30000000000001 | S34: 115.45 | AB34: 20w | AC34: =(L34-Q34)/L34 -> 0.352317880794702 | AD34: =(R34-S34)/R34 -> 0.18868587491215746 | AE34: =(T34-U34)/T34 -> #DIV/0! | AF34: =(V34-W34)/V34 -> #DIV/0! | AG34: =(X34-Y34)/X34 -> #DIV/0! | AO34: 暂不宜入场（当前股价小于50日均线） | AP34: 44549
A35: 603297.SH | B35: 永新光学 | C35: 1.97 | D35: 光学光电子 | F35: 65.859999999999999 | G35: 70.349999999999994 | H35: 88.370000000000005 | J35: 97.200000000000003 | K35: 36.710000000000001 | L35: 116.84 | M35: 56.649999999999999 | N35: =(J35-K35)/K35 -> 1.6477798964859711 | O35: =(L35-J35)/L35 -> 0.16809311879493324 | P35: =(L35-M35)/M35 -> 1.0624889673433364 | Q35: 92.5 | AB35: 2w | AC35: =(L35-Q35)/L35 -> 0.2083190688120507 | AD35: =(R35-S35)/R35 -> #DIV/0! | AE35: =(T35-U35)/T35 -> #DIV/0! | AF35: =(V35-W35)/V35 -> #DIV/0! | AG35: =(X35-Y35)/X35 -> #DIV/0! | AO35: 暂不宜入场（收缩幅度不够，应继续观察2w） | AP35: 44549
A36: 603392.SH | B36: 万泰生物 | C36: 1.96 | D36: 医疗器械 | F36: 224.58000000000001 | G36: 228.78999999999999 | H36: 235.66999999999999 | J36: 231.19999999999999 | K36: 144.61000000000001 | L36: 299.76999999999998 | M36: 223.50999999999999 | N36: =(J36-K36)/K36 -> 0.59878293340709476 | O36: =(L36-J36)/L36 -> 0.22874203556059644 | P36: =(L36-M36)/M36 -> 0.3411927877947295 | Q36: 171.88999999999999 | R36: 251.59999999999999 | S36: 203.81 | T36: 263 | U36: 231 | AB36: 18w | AC36: =(L36-Q36)/L36 -> 0.42659372185342098 | AD36: =(R36-S36)/R36 -> 0.18994435612082669 | AE36: =(T36-U36)/T36 -> 0.12167300380228137 | AF36: =(V36-W36)/V36 -> #DIV/0! | AG36: =(X36-Y36)/X36 -> #DIV/0! | AO36: 暂不宜入场（当前股价小于50日均线） | AP36: 44549
A37: 603589.SH | B37: 口子窖 | C37: 1.92 | D37: 饮料制造 | F37: 61.130000000000003 | G37: 61.869999999999997 | H37: 66.950000000000003 | J37: 82.299999999999997 | K37: 47.899999999999999 | L37: 86.489999999999995 | M37: 53.780000000000001 | N37: =(J37-K37)/K37 -> 0.71816283924843427 | O37: =(L37-J37)/L37 -> 4.8444906925656124e-02 | P37: =(L37-M37)/M37 -> 0.60821866865005569 | Q37: 78.200000000000003 | AB37: 0w | AC37: =(L37-Q37)/L37 -> 9.5849231124985459e-02 | AD37: =(R37-S37)/R37 -> #DIV/0! | AE37: =(T37-U37)/T37 -> #DIV/0! | AF37: =(V37-W37)/V37 -> #DIV/0! | AG37: =(X37-Y37)/X37 -> #DIV/0! | AO37: 暂不宜入场（杯型和成交量不明朗，应继续观察1w） | AP37: 44553
A38: 603995.SH | B38: 甬金股份 | C38: 1.87 | D38: 钢铁 | F38: 42.229999999999997 | G38: 44.049999999999997 | H38: 49.5 | J38: 52.700000000000003 | K38: 27.579999999999998 | L38: 57.200000000000003 | M38: 42.200000000000003 | N38: =(J38-K38)/K38 -> 0.91080493110949989 | O38: =(L38-J38)/L38 -> 7.8671328671328672e-02 | P38: =(L38-M38)/M38 -> 0.3554502369668246 | Q38: 50.32 | R38: 54.57 | S38: 51.219999999999999 | T38: 55.990000000000002 | U38: 52 | AB38: 3w | AC38: =(L38-Q38)/L38 -> 0.12027972027972032 | AD38: =(R38-S38)/R38 -> 6.1389041597947613e-02 | AE38: =(T38-U38)/T38 -> 7.1262725486694087e-02 | AF38: =(V38-W38)/V38 -> #DIV/0! | AG38: =(X38-Y38)/X38 -> #DIV/0! | AI38: 3T | AJ38: 是 | AK38: 是 | AL38: 是 | AM38: 是 | AN38: 否 | AO38: 可以入场 | AP38: 44553
A39: 000733.SZ | B39: 振华科技 | C39: 1.86 | D39: 国防军工 | F39: 86.159999999999997 | G39: 91.379999999999995 | H39: 108.56 | J39: 117.87 | K39: 45.359999999999999 | L39: 125.2 | M39: 91.379999999999995 | N39: =(J39-K39)/K39 -> 1.5985449735449737 | O39: =(L39-J39)/L39 -> 5.8546325878594235e-02 | P39: =(L39-M39)/M39 -> 0.37010286714817259 | Q39: 104 | AB39: 4w | AC39: =(L39-Q39)/L39 -> 0.16932907348242812 | AD39: =(R39-S39)/R39 -> #DIV/0! | AE39: =(T39-U39)/T39 -> #DIV/0! | AF39: =(V39-W39)/V39 -> #DIV/0! | AI39: 2T | AJ39: 否（好的收盘时，成交量减少；坏的收盘时，成交量增大） | AK39: 是 | AL39: 数据量太少不足以判断 | AM39: 否 | AN39: 否 | AO39: 不宜入场(满足普通收缩幅度收窄形态，但成交量和价格行为不满足，应继续观察1w) | AP39: 44553
A40: 603605.SH | B40: 珀莱雅 | C40: 1.82 | D40: 美容护理 | F40: 182.71000000000001 | G40: 184.90000000000001 | H40: 194.65000000000001 | J40: 203.90000000000001 | K40: 145.88 | L40: 224.43000000000001 | M40: 156.68000000000001 | N40: =(J40-K40)/K40 -> 0.39772415684123946 | O40: =(L40-J40)/L40 -> 9.1476184110858616e-02 | P40: =(L40-M40)/M40 -> 0.43241000765892262 | Q40: 184.16 | R40: 203.66 | S40: 187.80000000000001 | T40: 215.09999999999999 | U40: 198 | AB40: 6w | AC40: =(L40-Q40)/L40 -> 0.17943233970503056 | AD40: =(R40-S40)/R40 -> 7.7874889521751867e-02 | AE40: =(T40-U40)/T40 -> 7.9497907949790766e-02 | AF40: =(V40-W40)/V40 -> #DIV/0! | AG40: =(X40-Y40)/X40 -> #DIV/0! | AI40: 3T | AJ40: 是 | AK40: 是 | AL40: 是 | AM40: 是 | AN40: 否 | AO40: 可以入场(杯型尚未形成，谨慎期间，应多观察几日) | AP40: 44547
A41: 605123.SH | B41: 派克新材 | C41: 1.77 | D41: 国防军工 | F41: 94.790000000000006 | G41: 100.09999999999999 | H41: 122.19 | J41: 142.47 | K41: 61.549999999999997 | L41: 159 | M41: 83.180000000000007 | N41: =(J41-K41)/K41 -> 1.3147034930950448 | O41: =(L41-J41)/L41 -> 0.10396226415094341 | P41: =(L41-M41)/M41 -> 0.91151719163260381 | Q41: 128.47 | AB41: 2w | AC41: =(L41-Q41)/L41 -> 0.19201257861635221 | AD41: =(R41-S41)/R41 -> #DIV/0! | AF41: =(V41-W41)/V41 -> #DIV/0! | AG41: =(X41-Y41)/X41 -> #DIV/0! | AO41: 不宜入场（收缩量不够，应再观察1w） | AP41: 44556
A42: 603659.SH | B42: 璞泰来 | C42: 1.77 | D42: 电力设备 | F42: 140.66 | G42: 151.08000000000001 | H42: 171.63999999999999 | J42: 154.52000000000001 | N42: =(J42-K42)/K42 -> #DIV/0! | O42: =(L42-J42)/L42 -> #DIV/0! | P42: =(L42-M42)/M42 -> #DIV/0! | AC42: =(L42-Q42)/L42 -> #DIV/0! | AD42: =(R42-S42)/R42 -> #DIV/0! | AF42: =(V42-W42)/V42 -> #DIV/0! | AG42: =(X42-Y42)/X42 -> #DIV/0! | AO42: 不宜入场（当前股价小于50日均线） | AP42: 44547
A43: 600104.SH | B43: 上汽集团 | C43: 1.76 | D43: 汽车整车 | F43: 20.300000000000001 | G43: 20.359999999999999 | H43: 20.739999999999998 | J43: 20.760000000000002 | K43: 18.030000000000001 | L43: 23.449999999999999 | M43: 20.850000000000001 | N43: =(J43-K43)/K43 -> 0.15141430948419302 | O43: =(L43-J43)/L43 -> 0.11471215351812357 | P43: =(L43-M43)/M43 -> 0.12470023980815337 | AC43: =(L43-Q43)/L43 -> 1 | AD43: =(R43-S43)/R43 -> #DIV/0! | AF43: =(V43-W43)/V43 -> #DIV/0! | AG43: =(X43-Y43)/X43 -> #DIV/0! | AO43: 不宜入场（收缩量不够，应再观察3w） | AP43: 44547
A44: 603678.SH | B44: 火炬电子 | C44: 1.71 | D44: 国防军工 | F44: 71.590000000000003 | G44: 73.060000000000002 | H44: 76.359999999999999 | J44: 75 | N44: =(J44-K44)/K44 -> #DIV/0! | O44: =(L44-J44)/L44 -> #DIV/0! | P44: =(L44-M44)/M44 -> #DIV/0! | AC44: =(L44-Q44)/L44 -> #DIV/0! | AD44: =(R44-S44)/R44 -> #DIV/0! | AF44: =(V44-W44)/V44 -> #DIV/0! | AG44: =(X44-Y44)/X44 -> #DIV/0! | AO44: 不宜入场（当前股价小于50日均线） | AP44: 44547
A45: 600976.SH | B45: 健民集团 | C45: 1.69 | D45: 中药 | F45: 44.140000000000001 | G45: 46.619999999999997 | H45: 53.219999999999999 | J45: 64.799999999999997 | K45: 23.91 | L45: 64.989999999999995 | M45: 40.729999999999997 | N45: =(J45-K45)/K45 -> 1.7101631116687579 | O45: =(L45-J45)/L45 -> 2.9235266964147983e-03 | P45: =(L45-M45)/M45 -> 0.59562975693591946 | Q45: 40 | R45: 52.68 | S45: 41.619999999999997 | T45: 58.100000000000001 | U45: 49.460000000000001 | V45: 64.680000000000007 | W45: 59.289999999999999 | AB45: 20w | AC45: =(L45-Q45)/L45 -> 0.38452069549161405 | AD45: =(R45-S45)/R45 -> 0.20994684889901294 | AE45: =(T45-U45)/T45 -> 0.14870912220309812 | AF45: =(V45-W45)/V45 -> 8.333333333333344e-02 | AG45: =(X45-Y45)/X45 -> #DIV/0! | AI45: 4T | AJ45: 是 | AK45: 是 | AL45: 是 | AM45: 是 | AN45: 是 | AO45: 可以入场 | AP45: 44547
A46: 603290.SH | B46: 斯达半导 | C46: 1.67 | D46: 斯达半导 | F46: 352.13999999999999 | G46: 372.44999999999999 | H46: 423.52999999999997 | J46: 403.64999999999998 | N46: =(J46-K46)/K46 -> #DIV/0! | O46: =(L46-J46)/L46 -> #DIV/0! | P46: =(L46-M46)/M46 -> #DIV/0! | AC46: =(L46-Q46)/L46 -> #DIV/0! | AD46: =(R46-S46)/R46 -> #DIV/0! | AE46: =(T46-U46)/T46 -> #DIV/0! | AF46: =(V46-W46)/V46 -> #DIV/0! | AG46: =(X46-Y46)/X46 -> #DIV/0! | AO46: 不宜入场（当前股价小于50日均线） | AP46: 44547
A47: 600745.SH | B47: 闻泰科技 | C47: 1.65 | D47: 消费电子 | F47: 109.16 | G47: 111.23 | H47: 123 | J47: 135.99000000000001 | K47: 77.709999999999994 | L47: 143.88 | M47: 98.780000000000001 | N47: =(J47-K47)/K47 -> 0.74996782910822313 | O47: =(L47-J47)/L47 -> 5.4837364470391899e-02 | P47: =(L47-M47)/M47 -> 0.45657015590200439 | Q47: 131.90000000000001 | AB47: 1w | AC47: =(L47-Q47)/L47 -> 8.3263830970252917e-02 | AD47: =(R47-S47)/R47 -> #DIV/0! | AE47: =(T47-U47)/T47 -> #DIV/0! | AF47: =(V47-W47)/V47 -> #DIV/0! | AG47: =(X47-Y47)/X47 -> #DIV/0! | AI47: 1T | AJ47: 是 | AK47: 是 | AN47: 否 | AO47: 可以 | AP47: 44553
A48: 603897.SH | B48: 长城科技 | C48: 1.64 | D48: 电力设备 | F48: 38.369999999999997 | G48: 42.329999999999998 | H48: 53.990000000000002 | J48: 58.270000000000003 | K48: 14.300000000000001 | L48: 66.030000000000001 | M48: 52.880000000000003 | N48: =(J48-K48)/K48 -> 3.0748251748251745 | O48: =(L48-J48)/L48 -> 0.11752233833106161 | P48: =(L48-M48)/M48 -> 0.24867624810892583 | Q48: 51.740000000000002 | AB48: 3w | AC48: =(L48-Q48)/L48 -> 0.21641678025140088 | AD48: =(R48-S48)/R48 -> #DIV/0! | AE48: =(T48-U48)/T48 -> #DIV/0! | AF48: =(V48-W48)/V48 -> #DIV/0! | AG48: =(X48-Y48)/X48 -> #DIV/0! | AO48: 不宜入场（时间周期太短，应持续观察3w） | AP48: 44547
A49: 000049.SZ | B49: 德赛电池 | C49: 1.64 | D49: 电力设备 | N49: =(J49-K49)/K49 -> #DIV/0! | O49: =(L49-J49)/L49 -> #DIV/0! | P49: =(L49-M49)/M49 -> #DIV/0! | AC49: =(L49-Q49)/L49 -> #DIV/0! | AD49: =(R49-S49)/R49 -> #DIV/0! | AE49: =(T49-U49)/T49 -> #DIV/0! | AF49: =(V49-W49)/V49 -> #DIV/0! | AG49: =(X49-Y49)/X49 -> #DIV/0! | AO49: 不宜入场（200日均线不符合上涨一个月的要求） | AP49: 44547
A50: 603236.SH | B50: 移远通信 | C50: 1.63 | D50: 通信设备 | F50: 172.47 | G50: 173.03999999999999 | H50: 184.15000000000001 | J50: 199.00999999999999 | K50: 119.62 | L50: 210.34 | M50: 149.28 | N50: =(J50-K50)/K50 -> 0.66368500250794171 | O50: =(L50-J50)/L50 -> 5.386517067604836e-02 | P50: =(L50-M50)/M50 -> 0.40903001071811362 | Q50: 119.62 | R50: 182.12 | S50: 125.11 | T50: 174.97 | U50: 147.02000000000001 | V50: 199.5 | W50: 179.63 | X50: 204 | Y50: 185.41999999999999 | Z50: 203.19 | AA50: 188.88999999999999 | AB50: 40w | AC50: =(L50-Q50)/L50 -> 0.43130170200627554 | AD50: =(R50-S50)/R50 -> 0.31303536130024162 | AE50: =(T50-U50)/T50 -> 0.15974167000057146 | AF50: =(V50-W50)/V50 -> 9.9598997493734354e-02 | AG50: =(X50-Y50)/X50 -> 9.1078431372549076e-02 | AH50: =(Z50-AA50)/Z50 -> 7.0377479206653923e-02 | AI50: 4T | AJ50: 是 | AK50: 是 | AL50: 是 | AM50: 是 | AN50: 否 | AO50: 可以入场(交易量不是很明朗) | AP50: 44553
A51: 605399.SH | B51: 晨光新材 | C51: 1.63 | D51: 化学制品 | F51: 32.200000000000003 | G51: 35.060000000000002 | H51: 43.490000000000002 | J51: 48.590000000000003 | K51: 15.31 | L51: 55.899999999999999 | M51: 37.450000000000003 | N51: =(J51-K51)/K51 -> 2.1737426518615286 | O51: =(L51-J51)/L51 -> 0.13076923076923069 | P51: =(L51-M51)/M51 -> 0.49265687583444578 | Q51: 42.380000000000003 | AB51: 3w | AC51: =(L51-Q51)/L51 -> 0.24186046511627901 | AD51: =(R51-S51)/R51 -> #DIV/0! | AE51: =(T51-U51)/T51 -> #DIV/0! | AF51: =(V51-W51)/V51 -> #DIV/0! | AO51: 不宜入场（收缩幅度不符合要求，应再观察2w） | AP51: 44547
A52: 002850.SZ | B52: 科达利 | C52: 1.61 | D52: 电力设备 | F52: 122.28 | G52: 131.75 | H52: 161.46000000000001 | J52: 166.38 | K52: 58.82 | L52: 193.08000000000001 | M52: 113.94 | N52: =(J52-K52)/K52 -> 1.828629717783067 | O52: =(L52-J52)/L52 -> 0.1382846488502176 | P52: =(L52-M52)/M52 -> 0.69457609268035825 | Q52: 160.40000000000001 | R52: 177.38 | S52: 160.18000000000001 | AB52: 4w | AC52: =(L52-Q52)/L52 -> 0.16925626683240111 | AD52: =(R52-S52)/R52 -> 9.696696358101245e-02 | AE52: =(T52-U52)/T52 -> #DIV/0! | AF52: =(V52-W52)/V52 -> #DIV/0! | AJ52: 否 | AK52: 是 | AL52: 仅支撑位上移 | AM52: 否 | AN52: 否 | AO52: 不宜入场（成交量行为和价格行为不符合要求，应持续观察1w） | AP52: 44553
A53: 002876.SZ | B53: 三利谱 | C53: 1.6000000000000001 | D53: 光学光电子 | F53: 53.939999999999998 | G53: 54.740000000000002 | H53: 55.869999999999997 | J53: 59.390000000000001 | K53: 38.439999999999998 | L53: 68.299999999999997 | M53: 53.810000000000002 | N53: =(J53-K53)/K53 -> 0.54500520291363175 | O53: =(L53-J53)/L53 -> 0.13045387994143481 | P53: =(L53-M53)/M53 -> 0.26928080282475364 | AC53: =(L53-Q53)/L53 -> 1 | AD53: =(R53-S53)/R53 -> #DIV/0! | AE53: =(T53-U53)/T53 -> #DIV/0! | AF53: =(V53-W53)/V53 -> #DIV/0! | AO53: 不宜入场（收缩幅度不符合要求，应再观察2w） | AP53: 44547
A54: 600064.SH | B54: 南京高科 | C54: 1.58 | D54: 房地产开发 | F54: 9.2100000000000009 | G54: 9.1699999999999999 | N54: =(J54-K54)/K54 -> #DIV/0! | O54: =(L54-J54)/L54 -> #DIV/0! | P54: =(L54-M54)/M54 -> #DIV/0! | AC54: =(L54-Q54)/L54 -> #DIV/0! | AD54: =(R54-S54)/R54 -> #DIV/0! | AF54: =(V54-W54)/V54 -> #DIV/0! | AO54: 不宜入场（150日均线小于200日均线） | AP54: 44547
A55: 002080.SZ | B55: 中材科技 | C55: 1.58 | D55: 建筑材料 | F55: 30.32 | G55: 31.73 | H55: 35.780000000000001 | J55: 37.700000000000003 | K55: 18.77 | L55: 45.659999999999997 | M55: 27.600000000000001 | N55: =(J55-K55)/K55 -> 1.008524240809803 | O55: =(L55-J55)/L55 -> 0.17433201927288644 | P55: =(L55-M55)/M55 -> 0.6543478260869563 | Q55: 29.280000000000001 | R55: 39.979999999999997 | S55: 31.66 | T55: 39.390000000000001 | U55: 33.5 | AB55: 12w | AC55: =(L55-Q55)/L55 -> 0.35873850197109058 | AD55: =(R55-S55)/R55 -> 0.20810405202601295 | AE55: =(T55-U55)/T55 -> 0.14953033764914955 | AI55: 4T | AJ55: 是 | AK55: 是 | AL55: 是 | AM55: 是(不是很明朗) | AN55: 否 | AO55: 不宜入场（收缩量不够） | AP55: 44553
A56: 603186.SH | B56: 华正新材 | C56: 1.53 | D56: 半导体及元件 | E56: 2 | F56: 39.090000000000003 | G56: 39.25 | H56: 40.100000000000001 | J56: 40.950000000000003 | K56: 28.48 | L56: 48.479999999999997 | M56: 33.270000000000003 | N56: =(J56-K56)/K56 -> 0.43785112359550571 | O56: =(L56-J56)/L56 -> 0.15532178217821771 | P56: =(L56-M56)/M56 -> 0.45716862037871936 | Q56: 34.399999999999999 | R56: 44.659999999999997 | S56: 37.899999999999999 | T56: 43.369999999999997 | U56: 39.409999999999997 | AB56: 16w | AC56: =(L56-Q56)/L56 -> 0.29042904290429039 | AD56: =(R56-S56)/R56 -> 0.15136587550380651 | AE56: =(T56-U56)/T56 -> 9.1307355314733718e-02 | AI56: 4T | AJ56: 是 | AK56: 是 | AL56: 是 | AM56: 是 | AN56: 是 | AO56: 不宜入场（收缩幅度不符合要求） | AP56: 44556
A57: 002179.SZ | B57: 中航光电 | C57: 1.52 | D57: 国防军工 | F57: 85.760000000000005 | G57: 88.189999999999998 | H57: 95.140000000000001 | J57: 99.560000000000002 | K57: 59.100000000000001 | L57: 105.62 | M57: 79.590000000000003 | N57: =(J57-K57)/K57 -> 0.6846023688663283 | O57: =(L57-J57)/L57 -> 5.7375497064949842e-02 | P57: =(L57-M57)/M57 -> 0.32705113707752231 | AB57: 1w | AO57: 不宜入场（时候周期太短，需持续观察2w） | AP57: 44547
A58: 002048.SZ | B58: 宁波华翔 | C58: 1.51 | D58: 汽车零部件 | F58: 17.93 | G58: 18.690000000000001 | H58: 21.129999999999999 | J58: 21.850000000000001 | K58: 9.9600000000000009 | L58: 24.260000000000002 | M58: 18.940000000000001 | N58: =(J58-K58)/K58 -> 1.1937751004016064 | O58: =(L58-J58)/L58 -> 9.9340478153338824e-02 | P58: =(L58-M58)/M58 -> 0.28088701161562829 | Q58: 21.699999999999999 | AB58: 1w | AC58: =(L58-Q58)/L58 -> 0.10552349546578739 | AI58: 1T | AJ58: 不明朗 | AK58: 是 | AL58: 是 | AM58: 是 | AN58: 否 | AO58: 不宜入场(成交量行为和价格行为尚不明朗，应该持续观察几日) | AP58: 44553
A59: 002128.SZ | B59: 电投能源 | C59: 1.5 | D59: 煤炭开采加工 | F59: 12.01 | G59: 12.390000000000001 | H59: 13.449999999999999 | J59: 17.25 | K59: 7.9800000000000004 | L59: 18.48 | M59: 10.32 | N59: =(J59-K59)/K59 -> 1.1616541353383458 | O59: =(L59-J59)/L59 -> 6.6558441558441581e-02 | P59: =(L59-M59)/M59 -> 0.79069767441860461 | Q59: 11 | AB59: 11w | AC59: =(L59-Q59)/L59 -> 0.40476190476190477 | AI59: 1T | AO59: 不宜入场(收缩幅度不够，应该持续观察6个w) | AP59: 44548
A60: 600741.SH | B60: 华域汽车 | C60: 1.49 | D60: 汽车零部件 | F60: 24.93 | G60: 25.059999999999999 | H60: 26.289999999999999 | J60: 27.210000000000001 | K60: 18.850000000000001 | L60: 30.489999999999998 | M60: 23.530000000000001 | N60: =(J60-K60)/K60 -> 0.44350132625994687 | O60: =(L60-J60)/L60 -> 0.10757625450967523 | P60: =(L60-M60)/M60 -> 0.29579260518487027 | Q60: 26.300000000000001 | AB60: 2w | AC60: =(L60-Q60)/L60 -> 0.13742210560839613 | AI60: 1T | AO60: 不宜入场(收缩幅度不够，应该持续观察1个w) | AP60: 44553
A61: 000623.SZ | B61: 吉林敖东 | C61: 1.49 | D61: 化学制药 | F61: 16.239999999999998 | G61: 16.370000000000001 | H61: 16.829999999999998 | J61: 17.530000000000001 | K61: 14.619999999999999 | L61: 19.899999999999999 | M61: 15.19 | N61: =(J61-K61)/K61 -> 0.19904240766073886 | O61: =(L61-J61)/L61 -> 0.11909547738693456 | P61: =(L61-M61)/M61 -> 0.31007241606319941 | Q61: 15.5 | R61: 16.989999999999998 | S61: 16.16 | T61: 17.73 | U61: 17.079999999999998 | AB61: 12w | AC61: =(L61-Q61)/L61 -> 0.22110552763819091 | AD61: =(R61-S61)/R61 -> 4.8852266038846286e-02 | AE61: =(T61-U61)/T61 -> 3.6661026508742367e-02 | AO61: 不宜入场(收缩幅度差异太大，应持续观察6个w) | AP61: 44548
A62: 601225.SH | B62: 陕西煤业 | C62: 1.47 | D62: 煤炭开采加工 | F62: 12.119999999999999 | G62: 12.369999999999999 | H62: 12.82 | J62: 13.06 | K62: 9.7100000000000009 | L62: 16.829999999999998 | M62: 11.140000000000001 | N62: =(J62-K62)/K62 -> 0.34500514933058696 | O62: =(L62-J62)/L62 -> 0.22400475341651802 | P62: =(L62-M62)/M62 -> 0.51077199281867125 | Q62: 11.31 | R62: 12.31 | S62: 11.720000000000001 | T62: 13.68 | U62: 12.380000000000001 | AB62: 12w | AC62: =(L62-Q62)/L62 -> 0.32798573975044554 | AD62: =(R62-S62)/R62 -> 4.7928513403736786e-02 | AE62: =(T62-U62)/T62 -> 9.5029239766081797e-02 | AO62: 不宜入场(收缩幅度间隔太大，应持续观察7个w) | AP62: 44548
A63: 603606.SH | B63: 东方电缆 | C63: 1.47 | D63: 电力设备 | F63: 33.259999999999998 | G63: 35.909999999999997 | H63: 47.210000000000001 | J63: 50.340000000000003 | K63: 18.510000000000002 | L63: 63.75 | M63: 31.57 | N63: =(J63-K63)/K63 -> 1.719611021069692 | O63: =(L63-J63)/L63 -> 0.21035294117647055 | P63: =(L63-M63)/M63 -> 1.0193221412733608 | Q63: 47.740000000000002 | AB63: 4w | AC63: =(L63-Q63)/L63 -> 0.25113725490196076 | AD63: =(R63-S63)/R63 -> #DIV/0! | AE63: =(T63-U63)/T63 -> #DIV/0! | AI63: 1T | AO63: 不宜入场(有强力拉升的潜力，但收缩幅度不够，应该持续观察3个w) | AP63: 44548
A64: 605098.SH | B64: 行动教育 | C64: 1.46 | D64: 教育 | F64: 46.5 | G64: 47.469999999999999 | H64: 50.479999999999997 | J64: 55.369999999999997 | K64: 32.399999999999999 | L64: 63.780000000000001 | M64: 47.789999999999999 | N64: =(J64-K64)/K64 -> 0.70895061728395059 | O64: =(L64-J64)/L64 -> 0.13185951708999691 | P64: =(L64-M64)/M64 -> 0.33458882611424989 | Q64: 40.479999999999997 | R64: 50 | S64: 40.549999999999997 | T64: 54.799999999999997 | U64: 45.710000000000001 | V64: 57.969999999999999 | W64: 51.039999999999999 | AB64: 20w | AC64: =(L64-Q64)/L64 -> 0.36531828159297591 | AD64: =(R64-S64)/R64 -> 0.18900000000000006 | AE64: =(T64-U64)/T64 -> 0.16587591240875907 | AF64: =(V64-W64)/V64 -> 0.11954459203036052 | AO64: 不宜入场(收缩幅度不够，应该持续观察1个w) | AP64: 44553
A65: 603806.SH | B65: 福斯特 | C65: 1.44 | D65: 电力设备 | F65: 113.31999999999999 | G65: 118.98 | H65: 129.63 | J65: 127 | K65: 60.920000000000002 | L65: 167.08000000000001 | M65: 105.13 | N65: =(J65-K65)/K65 -> 1.0847012475377544 | O65: =(L65-J65)/L65 -> 0.23988508498922678 | P65: =(L65-M65)/M65 -> 0.58927042709026933 | Q65: 115.29000000000001 | R65: 148.53999999999999 | S65: 116.88 | T65: 137.94999999999999 | U65: 126.89 | AB65: 14w | AC65: =(L65-Q65)/L65 -> 0.30997127124730667 | AD65: =(R65-S65)/R65 -> 0.21314124141645346 | AE65: =(T65-U65)/T65 -> 8.0173976078289161e-02 | AF65: =(V65-W65)/V65 -> #DIV/0! | AO65: 已分析（见涨幅与最高收益合成表） | AP65: 44548
A66: 600566.SH | B66: 济川药业 | C66: 1.43 | D66: 中药 | F66: 18.02 | G66: 17.940000000000001 | H66: 18.52 | N66: =(J66-K66)/K66 -> #DIV/0! | O66: =(L66-J66)/L66 -> #DIV/0! | P66: =(L66-M66)/M66 -> #DIV/0! | AC66: =(L66-Q66)/L66 -> #DIV/0! | AD66: =(R66-S66)/R66 -> #DIV/0! | AE66: =(T66-U66)/T66 -> #DIV/0! | AF66: =(V66-W66)/V66 -> #DIV/0! | AO66: 不宜入场(各均线不符合要求) | AP66: 44548
A67: 002008.SZ | B67: 大族激光 | C67: 1.43 | D67: 自动化设备 | F67: 42.219999999999999 | G67: 42.469999999999999 | H67: 45.219999999999999 | J67: 51.43 | K67: 33.689999999999998 | L67: 53.369999999999997 | M67: 39.359999999999999 | N67: =(J67-K67)/K67 -> 0.52656574651231824 | O67: =(L67-J67)/L67 -> 3.6350009368559075e-02 | P67: =(L67-M67)/M67 -> 0.35594512195121947 | AB67: 0w | AC67: =(L67-Q67)/L67 -> 1 | AD67: =(R67-S67)/R67 -> #DIV/0! | AE67: =(T67-U67)/T67 -> #DIV/0! | AF67: =(V67-W67)/V67 -> #DIV/0! | AO67: 不宜入场(时间周期太短，应持续观察2w) | AP67: 44548
A68: 600089.SH | B68: 特变电工 | C68: 1.3999999999999999 | D68: 电力设备 | F68: 18.68 | G68: 19.890000000000001 | H68: 22.98 | J68: 23.489999999999998 | K68: 10.300000000000001 | L68: 29.960000000000001 | M68: 12.859999999999999 | N68: =(J68-K68)/K68 -> 1.2805825242718443 | O68: =(L68-J68)/L68 -> 0.21595460614152209 | P68: =(L68-M68)/M68 -> 1.3297045101088649 | Q68: 20.710000000000001 | R68: 27.399999999999999 | S68: 21.34 | AB68: 13w | AC68: =(L68-Q68)/L68 -> 0.30874499332443256 | AD68: =(R68-S68)/R68 -> 0.2211678832116788 | AE68: =(T68-U68)/T68 -> #DIV/0! | AF68: =(V68-W68)/V68 -> #DIV/0! | AO68: 已分析（见涨幅与最高收益合成表） | AP68: 44548
A69: 002756.SZ | B69: 永兴材料 | C69: 1.38 | D69: 钢铁 | N69: =(J69-K69)/K69 -> #DIV/0! | O69: =(L69-J69)/L69 -> #DIV/0! | P69: =(L69-M69)/M69 -> #DIV/0! | AC69: =(L69-Q69)/L69 -> #DIV/0! | AD69: =(R69-S69)/R69 -> #DIV/0! | AE69: =(T69-U69)/T69 -> #DIV/0! | AF69: =(V69-W69)/V69 -> #DIV/0! | AO69: 已分析（见涨幅与最高收益合成表） | AP69: 44548
A70: 603886.SH | B70: 元祖股份 | C70: 1.38 | D70: 食品加工制造 | F70: 18.489999999999998 | G70: 18.989999999999998 | H70: 21 | J70: 22.710000000000001 | K70: 15.220000000000001 | L70: 26.059999999999999 | M70: 19.420000000000002 | N70: =(J70-K70)/K70 -> 0.49211563731931668 | O70: =(L70-J70)/L70 -> 0.12854950115118949 | P70: =(L70-M70)/M70 -> 0.34191555097837262 | Q70: 22.190000000000001 | AB70: 2w | AC70: =(L70-Q70)/L70 -> 0.14850345356868755 | AD70: =(R70-S70)/R70 -> #DIV/0! | AE70: =(T70-U70)/T70 -> #DIV/0! | AF70: =(V70-W70)/V70 -> #DIV/0! | AO70: 不宜入场(收缩幅度不够，应持续观察1w) | AP70: 44556
A71: 002223.SZ | B71: 鱼跃医疗 | C71: 1.36 | D71: 医疗器械 | F71: 33.219999999999999 | G71: 33.850000000000001 | H71: 34.979999999999997 | J71: 35.859999999999999 | K71: 25.120000000000001 | L71: 41.770000000000003 | M71: 30.079999999999998 | N71: =(J71-K71)/K71 -> 0.42754777070063688 | O71: =(L71-J71)/L71 -> 0.14148910701460385 | P71: =(L71-M71)/M71 -> 0.38863031914893637 | Q71: 30.460000000000001 | R71: 38 | S71: 33.210000000000001 | AB71: 21w | AC71: =(L71-Q71)/L71 -> 0.27076849413454634 | AD71: =(R71-S71)/R71 -> 0.12605263157894733 | AE71: =(T71-U71)/T71 -> #DIV/0! | AF71: =(V71-W71)/V71 -> #DIV/0! | AO71: 不宜入场(收缩幅度不够，应该持续观察1w) | AP71: 44556
A72: 603369.SH | B72: 今世缘 | C72: 1.35 | D72: 饮料制造 | F72: 50.909999999999997 | G72: 51.359999999999999 | H72: 54.579999999999998 | J72: 57.43 | K72: 39.380000000000003 | L72: 63.43 | M72: 51.289999999999999 | N72: =(J72-K72)/K72 -> 0.45835449466734374 | O72: =(L72-J72)/L72 -> 9.4592464133690685e-02 | P72: =(L72-M72)/M72 -> 0.23669331253655684 | Q72: 39.380000000000003 | R72: 49.579999999999998 | S72: 43.009999999999998 | T72: 61.700000000000003 | U72: 55.579999999999998 | V72: 63.380000000000003 | W72: 57.299999999999997 | AB72: 21w | AC72: =(L72-Q72)/L72 -> 0.37915812706921009 | AD72: =(R72-S72)/R72 -> 0.13251311012505043 | AE72: =(T72-U72)/T72 -> 9.9189627228525187e-02 | AF72: =(V72-W72)/V72 -> 9.592931524140115e-02 | AO72: 不宜入场(成交量行为和价格行为不明朗，应该持续观察几天) | AP72: 44553
A73: 002371.SZ | B73: 北方华创 | C73: 1.34 | D73: 半导体及元件 | F73: 312.51999999999998 | G73: 332.08999999999997 | H73: 375.41000000000003 | J73: 345.5 | K73: 133.41999999999999 | L73: 452.77999999999997 | M73: 342.47000000000003 | N73: =(J73-K73)/K73 -> 1.5895667815919654 | O73: =(L73-J73)/L73 -> 0.23693626043553156 | P73: =(L73-M73)/M73 -> 0.3221012059450461 | Q73: 342.18000000000001 | AB73: 4w | AC73: =(L73-Q73)/L73 -> 0.24426873978532615 | AD73: =(R73-S73)/R73 -> #DIV/0! | AE73: =(T73-U73)/T73 -> #DIV/0! | AF73: =(V73-W73)/V73 -> #DIV/0! | AO73: 已分析（见涨幅与最高收益合成表） | AP73: 44548
A74: 600887.SH | B74: 伊利股份 | C74: 1.31 | D74: 食品加工制造 | F74: 39.100000000000001 | G74: 38.969999999999999 | H74: 40.140000000000001 | J74: 40.960000000000001 | K74: 30.899999999999999 | L74: 51.030000000000001 | M74: 38.659999999999997 | N74: =(J74-K74)/K74 -> 0.32556634304207127 | O74: =(L74-J74)/L74 -> 0.19733490103860474 | P74: =(L74-M74)/M74 -> 0.31996896016554593 | Q74: 30.899999999999999 | R74: 36.490000000000002 | S74: 32.600000000000001 | T74: 37.68 | U74: 34.350000000000001 | V74: 40.530000000000001 | W74: 37.380000000000003 | X74: 44.25 | Y74: 38.32 | Z74: 43.920000000000002 | AA74: 40.590000000000003 | AB74: 45w | AC74: =(L74-Q74)/L74 -> 0.39447383891828341 | AD74: =(R74-S74)/R74 -> 0.10660454919155934 | AE74: =(T74-U74)/T74 -> 8.8375796178343902e-02 | AF74: =(V74-W74)/V74 -> 7.7720207253885967e-02 | AG74: =(X74-Y74)/X74 -> 0.13401129943502824 | AH74: =(Z74-AA74)/Z74 -> 7.58196721311475e-02 | AO74: 不宜入场(150日均线小于200日均线) | AP74: 44548
A75: 605336.SH | B75: 帅丰电器 | C75: 1.31 | D75: 厨卫电器 | F75: 29.5 | G75: 30.109999999999999 | H75: 32.119999999999997 | J75: 33.600000000000001 | K75: 24.219999999999999 | L75: 37.5 | M75: 29.329999999999998 | N75: =(J75-K75)/K75 -> 0.38728323699421979 | O75: =(L75-J75)/L75 -> 0.10399999999999997 | P75: =(L75-M75)/M75 -> 0.27855438117967957 | Q75: 33 | R75: 35.579999999999998 | S75: 33.359999999999999 | AB75: 1w | AC75: =(L75-Q75)/L75 -> 0.12 | AD75: =(R75-S75)/R75 -> 6.2394603709949384e-02 | AE75: =(T75-U75)/T75 -> #DIV/0! | AF75: =(V75-W75)/V75 -> #DIV/0! | AG75: =(X75-Y75)/X75 -> #DIV/0! | AO75: 不宜入场(成交量和价格行为尚不明朗，应该持续观察1w) | AP75: 44556
A76: 002637.SZ | B76: 赞宇科技 | C76: 1.3 | D76: 化学制品 | F76: 15.6 | G76: 15.869999999999999 | H76: 16.460000000000001 | J76: 16.539999999999999 | K76: 11.050000000000001 | L76: 20.440000000000001 | M76: 15.17 | N76: =(J76-K76)/K76 -> 0.49683257918552021 | O76: =(L76-J76)/L76 -> 0.19080234833659501 | P76: =(L76-M76)/M76 -> 0.34739617666446942 | Q76: 14.220000000000001 | R76: 18.27 | S76: 16.489999999999998 | AB76: 11w | AC76: =(L76-Q76)/L76 -> 0.30430528375733856 | AD76: =(R76-S76)/R76 -> 9.7427476737821636e-02 | AE76: =(T76-U76)/T76 -> #DIV/0! | AF76: =(V76-W76)/V76 -> #DIV/0! | AG76: =(X76-Y76)/X76 -> #DIV/0! | AO76: 不宜入场(收缩幅度不够，应该持续观察3w) | AP76: 44548
A77: 601877.SH | B77: 正泰电器 | C77: 1.29 | D77: 电力设备 | F77: 45.710000000000001 | G77: 47.770000000000003 | H77: 53.020000000000003 | J77: 53.689999999999998 | K77: 28.379999999999999 | L77: 64.120000000000005 | M77: 31 | N77: =(J77-K77)/K77 -> 0.89182522903453132 | O77: =(L77-J77)/L77 -> 0.16266375545851539 | P77: =(L77-M77)/M77 -> 1.0683870967741937 | Q77: 46.299999999999997 | R77: 62.600000000000001 | S77: 49.280000000000001 | AB77: 13w | AC77: =(L77-Q77)/L77 -> 0.27791640673736751 | AD77: =(R77-S77)/R77 -> 0.21277955271565496 | AE77: =(T77-U77)/T77 -> #DIV/0! | AF77: =(V77-W77)/V77 -> #DIV/0! | AG77: =(X77-Y77)/X77 -> #DIV/0! | AO77: 不宜入场(收缩幅度不够，应该持续观察4w) | AP77: 44548
A78: 603010.SH | B78: 万盛股份 | C78: 1.29 | D78: 化工合成材料 | N78: =(J78-K78)/K78 -> #DIV/0! | O78: =(L78-J78)/L78 -> #DIV/0! | P78: =(L78-M78)/M78 -> #DIV/0! | AC78: =(L78-Q78)/L78 -> #DIV/0! | AD78: =(R78-S78)/R78 -> #DIV/0! | AE78: =(T78-U78)/T78 -> #DIV/0! | AF78: =(V78-W78)/V78 -> #DIV/0! | AG78: =(X78-Y78)/X78 -> #DIV/0! | AO78: 已分析（见增长幅度结果表） | AP78: 44548
A79: 603733.SH | B79: 仙鹤股份 | C79: 1.28 | D79: 造纸 | F79: 33.509999999999998 | G79: 34.710000000000001 | H79: 37.109999999999999 | J79: 39.560000000000002 | K79: 23.09 | L79: 44.579999999999998 | M79: 26.989999999999998 | N79: =(J79-K79)/K79 -> 0.71329579904720675 | O79: =(L79-J79)/L79 -> 0.1126065500224315 | P79: =(L79-M79)/M79 -> 0.65172286031863658 | Q79: 30.280000000000001 | R79: 41.399999999999999 | S79: 36.030000000000001 | AB79: 21w | AC79: =(L79-Q79)/L79 -> 0.3207716464782413 | AD79: =(R79-S79)/R79 -> 0.12971014492753619 | AE79: =(T79-U79)/T79 -> #DIV/0! | AF79: =(V79-W79)/V79 -> #DIV/0! | AG79: =(X79-Y79)/X79 -> #DIV/0! | AO79: 不宜入场(收缩幅度不够，应该持续观察1w) | AP79: 44553
A80: 603985.SH | B80: 恒润股份 | C80: 1.27 | D80: 电力设备 | F80: 32.450000000000003 | G80: 35.340000000000003 | H80: 46.530000000000001 | J80: 49.390000000000001 | K80: 15.01 | L80: 57.710000000000001 | M80: 26.449999999999999 | N80: =(J80-K80)/K80 -> 2.2904730179880084 | O80: =(L80-J80)/L80 -> 0.14416912146941605 | P80: =(L80-M80)/M80 -> 1.1818525519848773 | Q80: 44 | R80: 55.5 | S80: 47.5 | AB80: 5w | AC80: =(L80-Q80)/L80 -> 0.23756714607520363 | AD80: =(R80-S80)/R80 -> 0.14414414414414414 | AO80: 不宜入场(有强力拉升形态潜力，但收缩幅度不够，应多观察1w) | AP80: 44556
A81: 002597.SZ | B81: 金禾实业 | C81: 1.27 | D81: 化学制品 | F81: 41.369999999999997 | G81: 42 | H81: 46.770000000000003 | J81: 46.810000000000002 | K81: 28.079999999999998 | L81: 54.189999999999998 | M81: 38.890000000000001 | N81: =(J81-K81)/K81 -> 0.66702279202279224 | O81: =(L81-J81)/L81 -> 0.13618748846650666 | P81: =(L81-M81)/M81 -> 0.39341733093340181 | Q81: 46.009999999999998 | AB81: 1w | AC81: =(L81-Q81)/L81 -> 0.15095035984498986 | AD81: =(R81-S81)/R81 -> #DIV/0! | AE81: =(T81-U81)/T81 -> #DIV/0! | AF81: =(V81-W81)/V81 -> #DIV/0! | AG81: =(X81-Y81)/X81 -> #DIV/0! | AO81: 不宜入场(收缩幅度不够，应该持续观察2w) | AP81: 44553
A82: 002889.SZ | B82: 东方嘉盛 | C82: 1.27 | D82: 物流 | F82: 24.600000000000001 | G82: 24.670000000000002 | H82: 25.030000000000001 | J82: 26 | K82: 20.91 | L82: 32.460000000000001 | M82: 23.16 | N82: =(J82-K82)/K82 -> 0.24342419894787182 | O82: =(L82-J82)/L82 -> 0.19901417128773877 | P82: =(L82-M82)/M82 -> 0.40155440414507776 | Q82: 21.449999999999999 | R82: 26.25 | S82: 22.190000000000001 | T82: 26.27 | U82: 22.600000000000001 | V82: 28.870000000000001 | W82: 25.629999999999999 | AB82: 29w | AC82: =(L82-Q82)/L82 -> 0.33918669131238449 | AD82: =(R82-S82)/R82 -> 0.15466666666666662 | AE82: =(T82-U82)/T82 -> 0.13970308336505513 | AF82: =(V82-W82)/V82 -> 0.11222722549359203 | AG82: =(X82-Y82)/X82 -> #DIV/0! | AI82: 4T | AJ82: 是 | AK82: 是 | AL82: 是 | AM82: 是 | AN82: 否 | AO82: 不宜入场(收缩幅度不够，应该持续观察1w) | AP82: 44556
A83: 002985.SZ | B83: 北摩高科 | C83: 1.27 | D83: 国防军工 | F83: 105.67 | G83: 107.91 | H83: 113.03 | J83: 110.5 | K83: 76.299999999999997 | L83: 135.30000000000001 | M83: 96.239999999999995 | N83: =(J83-K83)/K83 -> 0.44823066841415471 | O83: =(L83-J83)/L83 -> 0.18329637841832971 | P83: =(L83-M83)/M83 -> 0.40586034912718222 | Q83: 98.510000000000005 | R83: 128.5 | S83: 109.58 | AB83: 12w | AC83: =(L83-Q83)/L83 -> 0.27191426459719142 | AD83: =(R83-S83)/R83 -> 0.14723735408560312 | AE83: =(T83-U83)/T83 -> #DIV/0! | AF83: =(V83-W83)/V83 -> #DIV/0! | AG83: =(X83-Y83)/X83 -> #DIV/0! | AI83: 2T | AO83: 不宜入场(收缩幅度不够，应该持续观察2w) | AP83: 44548
A84: 605222.SH | B84: 起帆电缆 | C84: 1.27 | D84: 电力设备 | F84: 22.5 | G84: 23.050000000000001 | H84: 25.25 | J84: 25.32 | K84: 18.920000000000002 | L84: 31.440000000000001 | M84: 22.940000000000001 | N84: =(J84-K84)/K84 -> 0.33826638477801257 | O84: =(L84-J84)/L84 -> 0.19465648854961834 | P84: =(L84-M84)/M84 -> 0.37053182214472535 | Q84: 24.609999999999999 | AB84: 4w | AC84: =(L84-Q84)/L84 -> 0.21723918575063619 | AD84: =(R84-S84)/R84 -> #DIV/0! | AE84: =(T84-U84)/T84 -> #DIV/0! | AF84: =(V84-W84)/V84 -> #DIV/0! | AG84: =(X84-Y84)/X84 -> #DIV/0! | AO84: 不宜入场(收缩幅度不够，应该持续观察3w) | AP84: 44548
A85: 001872.SZ | B85: 招商港口 | C85: 1.27 | D85: 港口航运 | F85: 15.869999999999999 | G85: 16.07 | H85: 16.57 | J85: 17.079999999999998 | K85: 13.67 | L85: 18.879999999999999 | M85: 16.469999999999999 | N85: =(J85-K85)/K85 -> 0.24945135332845636 | O85: =(L85-J85)/L85 -> 9.5338983050847495e-02 | P85: =(L85-M85)/M85 -> 0.14632665452337584 | Q85: 15.27 | R85: 18.440000000000001 | S85: 16.949999999999999 | AB85: 12w | AC85: =(L85-Q85)/L85 -> 0.19120762711864406 | AD85: =(R85-S85)/R85 -> 8.0802603036876461e-02 | AE85: =(T85-U85)/T85 -> #DIV/0! | AF85: =(V85-W85)/V85 -> #DIV/0! | AG85: =(X85-Y85)/X85 -> #DIV/0! | AI85: 2T | AO85: 不宜入场(收缩幅度不够，应该持续观察1w) | AP85: 44548
A86: 600373.SH | B86: 中文传媒 | C86: 1.26 | D86: 传媒 | F86: 10.51 | G86: 10.66 | H86: 11.15 | J86: 12.26 | K86: 8.5299999999999994 | L86: 12.390000000000001 | M86: 10.32 | N86: =(J86-K86)/K86 -> 0.43728018757327092 | O86: =(L86-J86)/L86 -> 1.0492332526230894e-02 | P86: =(L86-M86)/M86 -> 0.20058139534883723 | Q86: 11.69 | AB86: 1w | AC86: =(L86-Q86)/L86 -> 5.6497175141243021e-02 | AD86: =(R86-S86)/R86 -> #DIV/0! | AE86: =(T86-U86)/T86 -> #DIV/0! | AF86: =(V86-W86)/V86 -> #DIV/0! | AG86: =(X86-Y86)/X86 -> #DIV/0! | AI86: 1T | AJ86: 是 | AK86: 是 | AL86: 是 | AM86: 是 | AN86: 是 | AO86: 可以入场 | AP86: 44553
A87: 600328.SH | B87: 中盐化工 | C87: 1.26 | D87: 化学原料 | N87: =(J87-K87)/K87 -> #DIV/0! | O87: =(L87-J87)/L87 -> #DIV/0! | P87: =(L87-M87)/M87 -> #DIV/0! | AC87: =(L87-Q87)/L87 -> #DIV/0! | AD87: =(R87-S87)/R87 -> #DIV/0! | AE87: =(T87-U87)/T87 -> #DIV/0! | AF87: =(V87-W87)/V87 -> #DIV/0! | AG87: =(X87-Y87)/X87 -> #DIV/0! | AO87: 不宜入场(各均线斜率朝下) | AP87: 44548
A88: 001217.SZ | B88: 华尔泰 | C88: 1.25 | D88: 化学原料 | N88: =(J88-K88)/K88 -> #DIV/0! | O88: =(L88-J88)/L88 -> #DIV/0! | P88: =(L88-M88)/M88 -> #DIV/0! | AC88: =(L88-Q88)/L88 -> #DIV/0! | AD88: =(R88-S88)/R88 -> #DIV/0! | AE88: =(T88-U88)/T88 -> #DIV/0! | AF88: =(V88-W88)/V88 -> #DIV/0! | AG88: =(X88-Y88)/X88 -> #DIV/0! | AO88: 不宜入场(各均线斜率朝下) | AP88: 44548
A89: 600298.SH | B89: 安琪酵母 | C89: 1.24 | D89: 食品加工制造 | F89: 52.990000000000002 | G89: 52.850000000000001 | N89: =(J89-K89)/K89 -> #DIV/0! | O89: =(L89-J89)/L89 -> #DIV/0! | P89: =(L89-M89)/M89 -> #DIV/0! | AC89: =(L89-Q89)/L89 -> #DIV/0! | AD89: =(R89-S89)/R89 -> #DIV/0! | AE89: =(T89-U89)/T89 -> #DIV/0! | AF89: =(V89-W89)/V89 -> #DIV/0! | AG89: =(X89-Y89)/X89 -> #DIV/0! | AO89: 不宜入场(150日均线小于200日均线，应观察6w) | AP89: 44548
A90: 600123.SH | B90: 兰花科创 | C90: 1.23 | D90: 煤炭开采加工 | F90: 8.8900000000000006 | G90: 9.3699999999999992 | H90: 10.02 | J90: 9.9600000000000009 | K90: 4.4699999999999998 | L90: 14.67 | M90: 8.9399999999999995 | N90: =(J90-K90)/K90 -> 1.2281879194630876 | O90: =(L90-J90)/L90 -> 0.32106339468302653 | P90: =(L90-M90)/M90 -> 0.64093959731543637 | AC90: =(L90-Q90)/L90 -> 1 | AD90: =(R90-S90)/R90 -> #DIV/0! | AE90: =(T90-U90)/T90 -> #DIV/0! | AF90: =(V90-W90)/V90 -> #DIV/0! | AG90: =(X90-Y90)/X90 -> #DIV/0! | AO90: 不宜入场(当前股价距离最高点距离太远，面临巨大抛压) | AP90: 44548
A91: 603095.SH | B91: 越剑智能 | C91: 1.22 | D91: 专用设备 | F91: 23.609999999999999 | G91: 23.890000000000001 | H91: 24.84 | J91: 24.59 | K91: 20.809999999999999 | L91: 27.07 | M91: 24.77 | N91: =(J91-K91)/K91 -> 0.18164344065353202 | O91: =(L91-J91)/L91 -> 9.1614333210195797e-02 | P91: =(L91-M91)/M91 -> 9.2854259184497412e-02 | Q91: 24.5 | AC91: =(L91-Q91)/L91 -> 9.4939046915404515e-02 | AD91: =(R91-S91)/R91 -> #DIV/0! | AE91: =(T91-U91)/T91 -> #DIV/0! | AF91: =(V91-W91)/V91 -> #DIV/0! | AG91: =(X91-Y91)/X91 -> #DIV/0! | AO91: 不宜入场(当前股价距离最低点距离太近，涨幅不够) | AP91: 44548
A92: 603197.SH | B92: 保隆科技 | C92: 1.2 | D92: 汽车零部件 | F92: 35.310000000000002 | G92: 37.299999999999997 | H92: 46.289999999999999 | J92: 66.129999999999995 | K92: 22.620000000000001 | L92: 60.32 | M92: 26.399999999999999 | N92: =(J92-K92)/K92 -> 1.9235190097259058 | O92: =(L92-J92)/L92 -> -9.6319628647214772e-02 | P92: =(L92-M92)/M92 -> 1.2848484848484849 | Q92: 50.850000000000001 | AB92: 2w | AC92: =(L92-Q92)/L92 -> 0.15699602122015913 | AD92: =(R92-S92)/R92 -> #DIV/0! | AO92: 不宜入场(有强力拉升形态潜力，但收缩幅度不够，应多观察1w) | AP92: 44553
A93: 603198.SH | B93: 迎驾贡酒 | C93: 1.2 | D93: 饮料制造 | N93: =(J93-K93)/K93 -> #DIV/0! | O93: =(L93-J93)/L93 -> #DIV/0! | P93: =(L93-M93)/M93 -> #DIV/0! | AC93: =(L93-Q93)/L93 -> #DIV/0! | AD93: =(R93-S93)/R93 -> #DIV/0! | AE93: =(T93-U93)/T93 -> #DIV/0! | AF93: =(V93-W93)/V93 -> #DIV/0! | AG93: =(X93-Y93)/X93 -> #DIV/0! | AO93: 已分析（见涨幅与最高收益合成表） | AP93: 44548
A94: 603258.SH | B94: 电魂网络 | C94: 1.18 | D94: 传媒 | F94: 25.699999999999999 | G94: 25.600000000000001 | N94: =(J94-K94)/K94 -> #DIV/0! | O94: =(L94-J94)/L94 -> #DIV/0! | P94: =(L94-M94)/M94 -> #DIV/0! | AC94: =(L94-Q94)/L94 -> #DIV/0! | AD94: =(R94-S94)/R94 -> #DIV/0! | AE94: =(T94-U94)/T94 -> #DIV/0! | AF94: =(V94-W94)/V94 -> #DIV/0! | AG94: =(X94-Y94)/X94 -> #DIV/0! | AO94: 不宜入场(150日均线小于200日均线，应观察6w) | AP94: 44548
A95: 000885.SZ | B95: 城发环境 | C95: 1.18 | D95: 公路铁路运输 | F95: 9.9800000000000004 | G95: 10.08 | H95: 10.42 | J95: 10.449999999999999 | K95: 8.4800000000000004 | L95: 11.57 | M95: 9.0299999999999994 | N95: =(J95-K95)/K95 -> 0.23231132075471683 | O95: =(L95-J95)/L95 -> 9.6802074330164301e-02 | P95: =(L95-M95)/M95 -> 0.28128460686600232 | AC95: =(L95-Q95)/L95 -> 1 | AD95: =(R95-S95)/R95 -> #DIV/0! | AE95: =(T95-U95)/T95 -> #DIV/0! | AF95: =(V95-W95)/V95 -> #DIV/0! | AG95: =(X95-Y95)/X95 -> #DIV/0! | AO95: 不宜入场(当前股价距离最低点距离太近，涨幅不够) | AP95: 44548
A96: 002557.SZ | B96: 洽洽食品 | C96: 1.18 | D96: 食品加工制造 | F96: 49.920000000000002 | G96: 50.210000000000001 | H96: 54.329999999999998 | J96: 60.509999999999998 | K96: 35.799999999999997 | L96: 69.099999999999994 | M96: 58.630000000000003 | N96: =(J96-K96)/K96 -> 0.69022346368715093 | O96: =(L96-J96)/L96 -> 0.12431259044862514 | P96: =(L96-M96)/M96 -> 0.17857752004093452 | Q96: 35.799999999999997 | R96: 46.880000000000003 | S96: 36.020000000000003 | T96: 59.530000000000001 | U96: 51.979999999999997 | V96: 59.5 | W96: 54.810000000000002 | X96: 61.700000000000003 | AB96: 41w | AC96: =(L96-Q96)/L96 -> 0.48191027496382055 | AD96: =(R96-S96)/R96 -> 0.23165529010238906 | AE96: =(T96-U96)/T96 -> 0.12682681001175886 | AF96: =(V96-W96)/V96 -> 7.8823529411764667e-02 | AI96: 4T | AJ96: 是 | AK96: 是 | AL96: 是 | AM96: 是 | AN96: 否 | AO96: 可以入场（寻找合适身位进场） | AP96: 44553
A97: 603203.SH | B97: 快克股份 | C97: 1.17 | D97: 自动化设备 | N97: =(J97-K97)/K97 -> #DIV/0! | O97: =(L97-J97)/L97 -> #DIV/0! | P97: =(L97-M97)/M97 -> #DIV/0! | AC97: =(L97-Q97)/L97 -> #DIV/0! | AD97: =(R97-S97)/R97 -> #DIV/0! | AE97: =(T97-U97)/T97 -> #DIV/0! | AO97: 已分析（见增长幅度最大表） | AP97: 44548
A98: 603681.SH | B98: 永冠新材 | C98: 1.17 | D98: 化学制品 | N98: =(J98-K98)/K98 -> #DIV/0! | O98: =(L98-J98)/L98 -> #DIV/0! | P98: =(L98-M98)/M98 -> #DIV/0! | AC98: =(L98-Q98)/L98 -> #DIV/0! | AD98: =(R98-S98)/R98 -> #DIV/0! | AE98: =(T98-U98)/T98 -> #DIV/0! | AO98: 已分析（见涨幅与最高收益合成表） | AP98: 44548
A99: 002258.SZ | B99: 利尔化学 | C99: 1.17 | D99: 化学制品 | F99: 27.469999999999999 | G99: 27.800000000000001 | H99: 28.890000000000001 | J99: 32.439999999999998 | K99: 21.350000000000001 | L99: 35.259999999999998 | M99: 25.82 | N99: =(J99-K99)/K99 -> 0.51943793911007008 | O99: =(L99-J99)/L99 -> 7.9977311401021003e-02 | P99: =(L99-M99)/M99 -> 0.36560805577072025 | Q99: 22.309999999999999 | AB99: 12w | AC99: =(L99-Q99)/L99 -> 0.3672716959727737 | AD99: =(R99-S99)/R99 -> #DIV/0! | AE99: =(T99-U99)/T99 -> #DIV/0! | AO99: 不宜入场(收缩幅度不够，应该持续观察3w) | AP99: 44548
A100: 002929.SZ | B100: 润建股份 | C100: 1.16 | D100: 通信服务 | F100: 30.109999999999999 | G100: 31.18 | H100: 34.920000000000002 | J100: 37.5 | K100: 20 | L100: 39.43 | M100: 31.91 | N100: =(J100-K100)/K100 -> 0.875 | O100: =(L100-J100)/L100 -> 4.8947501902104992e-02 | P100: =(L100-M100)/M100 -> 0.2356628016295832 | Q100: 32.270000000000003 | R100: 38.649999999999999 | S100: 35.759999999999998 | AB100: 2w | AC100: =(L100-Q100)/L100 -> 0.18158762363682468 | AD100: =(R100-S100)/R100 -> 7.4773609314359654e-02 | AE100: =(T100-U100)/T100 -> #DIV/0! | AO100: 可以入场 | AP100: 44553
A101: 002028.SZ | B101: 思源电气 | C101: 1.16 | D101: 电力设备 | N101: =(J101-K101)/K101 -> #DIV/0! | O101: =(L101-J101)/L101 -> #DIV/0! | P101: =(L101-M101)/M101 -> #DIV/0! | AC101: =(L101-Q101)/L101 -> #DIV/0! | AD101: =(R101-S101)/R101 -> #DIV/0! | AE101: =(T101-U101)/T101 -> #DIV/0! | AO101: 已分析（见涨幅与最高收益合成表） | AP101: 44548
A102: 600153.SH | B102: 建发股份 | C102: 1.15 | D102: 物流 | F102: 8.0199999999999996 | G102: 8.0600000000000005 | H102: 8.3200000000000003 | J102: 8.7799999999999994 | K102: 7.0499999999999998 | L102: 9.4600000000000009 | M102: 7.4000000000000004 | N102: =(J102-K102)/K102 -> 0.24539007092198575 | O102: =(L102-J102)/L102 -> 7.1881606765327843e-02 | P102: =(L102-M102)/M102 -> 0.27837837837837842 | Q102: 7.5 | R102: 8.4600000000000009 | S102: 8.0399999999999991 | T102: 9.2200000000000006 | U102: 8.5800000000000001 | AB102: 12w | AC102: =(L102-Q102)/L102 -> 0.20718816067653284 | AD102: =(R102-S102)/R102 -> 4.9645390070922182e-02 | AE102: =(T102-U102)/T102 -> 6.9414316702820014e-02 | AO102: 不宜入场(收缩幅度不够，应该持续观察3w) | AP102: 44548
A103: 600803.SH | B103: 新奥股份 | C103: 1.15 | D103: 燃气 | N103: =(J103-K103)/K103 -> #DIV/0! | O103: =(L103-J103)/L103 -> #DIV/0! | P103: =(L103-M103)/M103 -> #DIV/0! | AC103: =(L103-Q103)/L103 -> #DIV/0! | AD103: =(R103-S103)/R103 -> #DIV/0! | AO103: 已分析（见增长幅度表） | AP103: 44548
A104: 605089.SH | B104: 味知香 | C104: 1.15 | D104: 食品加工制造 | N104: =(J104-K104)/K104 -> #DIV/0! | O104: =(L104-J104)/L104 -> #DIV/0! | P104: =(L104-M104)/M104 -> #DIV/0! | AC104: =(L104-Q104)/L104 -> #DIV/0! | AD104: =(R104-S104)/R104 -> #DIV/0! | AO104: 已分析（见涨幅与最高收益合成表） | AP104: 44548
A105: 003026.SZ | B105: 中晶科技 | C105: 1.14 | D105: 半导体及元件 | N105: =(J105-K105)/K105 -> #DIV/0! | O105: =(L105-J105)/L105 -> #DIV/0! | P105: =(L105-M105)/M105 -> #DIV/0! | AC105: =(L105-Q105)/L105 -> #DIV/0! | AD105: =(R105-S105)/R105 -> #DIV/0! | AO105: 已分析（见涨幅与最高收益合成表） | AP105: 44548
A106: 000776.SZ | B106: 广发证券 | C106: 1.13 | D106: 证券 | F106: 19.260000000000002 | G106: 20.02 | H106: 22.789999999999999 | J106: 24.399999999999999 | K106: 13.98 | L106: 27.219999999999999 | M106: 21.100000000000001 | N106: =(J106-K106)/K106 -> 0.7453505007153074 | O106: =(L106-J106)/L106 -> 0.103600293901543 | P106: =(L106-M106)/M106 -> 0.2900473933649288 | Q106: 23.52 | AB106: 1w | AC106: =(L106-Q106)/L106 -> 0.13592946362968403 | AD106: =(R106-S106)/R106 -> #DIV/0! | AO106: 不宜入场(收缩幅度不够，应该持续观察1w) | AP106: 44553
A107: 003043.SZ | B107: 华亚智能 | C107: 1.13 | D107: 半导体及元件 | N107: =(J107-K107)/K107 -> #DIV/0! | O107: =(L107-J107)/L107 -> #DIV/0! | P107: =(L107-M107)/M107 -> #DIV/0! | AC107: =(L107-Q107)/L107 -> #DIV/0! | AD107: =(R107-S107)/R107 -> #DIV/0! | AO107: 已分析（见涨幅与最高收益合成表） | AP107: 44548
A108: 600048.SH | B108: 保利发展 | C108: 1.13 | D108: 房地产开发 | F108: 13.31 | G108: 13.25 | H108: 13.890000000000001 | N108: =(J108-K108)/K108 -> #DIV/0! | O108: =(L108-J108)/L108 -> #DIV/0! | P108: =(L108-M108)/M108 -> #DIV/0! | AC108: =(L108-Q108)/L108 -> #DIV/0! | AD108: =(R108-S108)/R108 -> #DIV/0! | AO108: 不宜入场(150日均线小于200日均线) | AP108: 44548
A109: 601615.SH | B109: 明阳智能 | C109: 1.13 | D109: 电力设备 | F109: 23.800000000000001 | G109: 24.850000000000001 | H109: 28.870000000000001 | J109: 27.190000000000001 | N109: =(J109-K109)/K109 -> #DIV/0! | O109: =(L109-J109)/L109 -> #DIV/0! | P109: =(L109-M109)/M109 -> #DIV/0! | AC109: =(L109-Q109)/L109 -> #DIV/0! | AD109: =(R109-S109)/R109 -> #DIV/0! | AO109: 不宜入场(各均线斜率向下) | AP109: 44548
A110: 603666.SH | B110: 亿嘉和 | C110: 1.12 | D110: 自动化设备 | F110: 62.43 | G110: 63.329999999999998 | H110: 69.390000000000001 | J110: 80.599999999999994 | K110: 46.350000000000001 | L110: 84 | M110: 48.219999999999999 | N110: =(J110-K110)/K110 -> 0.73894282632146691 | O110: =(L110-J110)/L110 -> 4.0476190476190541e-02 | P110: =(L110-M110)/M110 -> 0.74201576109498135 | AB110: 0w | AC110: =(L110-Q110)/L110 -> 1 | AD110: =(R110-S110)/R110 -> #DIV/0! | AO110: 不宜入场(时间周期太短，应观察2w) | AP110: 44548
A111: 605377.SH | B111: 华旺科技 | C111: 1.12 | D111: 造纸 | F111: 16.149999999999999 | G111: 16.420000000000002 | H111: 16.829999999999998 | J111: 17.199999999999999 | K111: 12.49 | L111: 20.579999999999998 | M111: 16.109999999999999 | N111: =(J111-K111)/K111 -> 0.37710168134507599 | O111: =(L111-J111)/L111 -> 0.16423712342079685 | P111: =(L111-M111)/M111 -> 0.27746741154562377 | Q111: 15.08 | R111: 17.550000000000001 | S111: 16 | AB111: 15w | AC111: =(L111-Q111)/L111 -> 0.26724975704567533 | AD111: =(R111-S111)/R111 -> 8.8319088319088357e-02 | AO111: 不宜入场(收缩幅度不够，应观察3w) | AP111: 44548
A112: 600885.SH | B112: 宏发股份 | C112: 1.1000000000000001 | D112: 电力设备 | F112: 64.549999999999997 | G112: 66.609999999999999 | H112: 72.530000000000001 | J112: 72.329999999999998 | K112: 44.659999999999997 | L112: 81.239999999999995 | M112: 61.130000000000003 | N112: =(J112-K112)/K112 -> 0.61957008508732658 | O112: =(L112-J112)/L112 -> 0.10967503692762183 | P112: =(L112-M112)/M112 -> 0.32897104531326665 | Q112: 69.849999999999994 | R112: 76.989999999999995 | S112: 72.099999999999994 | AB112: 4w | AC112: =(L112-Q112)/L112 -> 0.14020187099950765 | AD112: =(R112-S112)/R112 -> 6.3514742174308358e-02 | AI112: 2T | AJ112: 否 | AK112: 否 | AL112: 否 | AM112: 否 | AN112: 否 | AO112: 不宜入场(成交量行为和价格行为均不符合) | AP112: 44548
A113: 603279.SH | B113: 景津环保 | C113: 1.1000000000000001 | D113: 环保 | N113: =(J113-K113)/K113 -> #DIV/0! | O113: =(L113-J113)/L113 -> #DIV/0! | P113: =(L113-M113)/M113 -> #DIV/0! | AC113: =(L113-Q113)/L113 -> #DIV/0! | AD113: =(R113-S113)/R113 -> #DIV/0! | AO113: 已分析（见涨幅与最高收益合成表） | AP113: 44548
A114: 000960.SZ | B114: 锡业股份 | C114: 1.09 | D114: 小金属 | F114: 17.379999999999999 | G114: 17.73 | H114: 18.170000000000002 | J114: 18.34 | K114: 9.5399999999999991 | L114: 26.300000000000001 | M114: 15.6 | N114: =(J114-K114)/K114 -> 0.92243186582809245 | O114: =(L114-J114)/L114 -> 0.30266159695817491 | P114: =(L114-M114)/M114 -> 0.68589743589743601 | AC114: =(L114-Q114)/L114 -> 1 | AD114: =(R114-S114)/R114 -> #DIV/0! | AO114: 已分析（当前股价距离最高点距离过大，面临较大抛压） | AP114: 44548
A115: 002960.SZ | B115: 青鸟消防 | C115: 1.08 | D115: 专用设备 | F115: 32.18 | G115: 33.219999999999999 | H115: 39.219999999999999 | J115: 44.789999999999999 | K115: 20.260000000000002 | L115: 48.350000000000001 | M115: 26 | N115: =(J115-K115)/K115 -> 1.2107601184600196 | O115: =(L115-J115)/L115 -> 7.3629782833505728e-02 | P115: =(L115-M115)/M115 -> 0.85961538461538467 | Q115: 40.899999999999999 | R115: 47.5 | S115: 42 | T115: 47.210000000000001 | AB115: 3w | AC115: =(L115-Q115)/L115 -> 0.15408479834539821 | AD115: =(R115-S115)/R115 -> 0.11578947368421053 | AO115: 不宜入场(收缩幅度不够，应观察1w) | AP115: 44556
A116: 600587.SH | B116: 新华医疗 | C116: 1.08 | D116: 医疗器械 | N116: =(J116-K116)/K116 -> #DIV/0! | O116: =(L116-J116)/L116 -> #DIV/0! | P116: =(L116-M116)/M116 -> #DIV/0! | AC116: =(L116-Q116)/L116 -> #DIV/0! | AD116: =(R116-S116)/R116 -> #DIV/0! | AO116: 已分析（见涨幅与最高收益合成表） | AP116: 44548
A117: 603908.SH | B117: 牧高笛 | C117: 1.07 | D117: 服装家纺 | F117: 30.309999999999999 | G117: 31.949999999999999 | H117: 36.299999999999997 | J117: 39.289999999999999 | K117: 18.239999999999998 | L117: 45.799999999999997 | M117: 24.579999999999998 | N117: =(J117-K117)/K117 -> 1.1540570175438598 | O117: =(L117-J117)/L117 -> 0.14213973799126634 | P117: =(L117-M117)/M117 -> 0.86330349877949553 | Q117: 28.059999999999999 | R117: 41.75 | S117: 37.390000000000001 | AB117: 13w | AC117: =(L117-Q117)/L117 -> 0.38733624454148469 | AD117: =(R117-S117)/R117 -> 0.10443113772455088 | AO117: 不宜入场（收缩幅度不够） | AP117: 44548
A118: 603380.SH | B118: 易德龙 | C118: 1.06 | D118: 消费电子 | F118: 28.859999999999999 | G118: 30.629999999999999 | H118: 36.049999999999997 | J118: 36.409999999999997 | K118: 15.84 | L118: 42.280000000000001 | M118: 29.620000000000001 | N118: =(J118-K118)/K118 -> 1.2986111111111109 | O118: =(L118-J118)/L118 -> 0.13883632923368033 | P118: =(L118-M118)/M118 -> 0.42741390952059416 | Q118: 36 | AB118: 2w | AC118: =(L118-Q118)/L118 -> 0.14853358561967836 | AD118: =(R118-S118)/R118 -> #DIV/0! | AO118: 不宜入场(收缩幅度不够，应观察1w) | AP118: 44556
A119: 600038.SH | B119: 中直股份 | C119: 1.05 | D119: 国防军工 | F119: 59.890000000000001 | G119: 61.43 | H119: 68.269999999999996 | J119: 71.590000000000003 | K119: 43.619999999999997 | L119: 78.799999999999997 | M119: 55.259999999999998 | N119: =(J119-K119)/K119 -> 0.64121962402567645 | O119: =(L119-J119)/L119 -> 9.1497461928933932e-02 | P119: =(L119-M119)/M119 -> 0.42598624683315239 | AB119: 1w | AC119: =(L119-Q119)/L119 -> 1 | AD119: =(R119-S119)/R119 -> #DIV/0! | AO119: 不宜入场(时间周期太短，应观察2w) | AP119: 44548
A120: 603100.SH | B120: 川仪股份 | C120: 1.05 | D120: 仪器仪表 | F120: 17.550000000000001 | G120: 18.100000000000001 | H120: 19.27 | J120: 19.800000000000001 | K120: 11.6 | L120: 23.550000000000001 | M120: 17.350000000000001 | N120: =(J120-K120)/K120 -> 0.70689655172413801 | O120: =(L120-J120)/L120 -> 0.15923566878980891 | P120: =(L120-M120)/M120 -> 0.35734870317002876 | AB120: 12w | AC120: =(L120-Q120)/L120 -> 1 | AD120: =(R120-S120)/R120 -> #DIV/0! | AE120: 0.1865 | AO120: 不宜入场(收缩幅度不够，应观察3w) | AP120: 44548
A121: 603507.SH | B121: 振江股份 | C121: 1.04 | D121: 电力设备 | N121: =(J121-K121)/K121 -> #DIV/0! | O121: =(L121-J121)/L121 -> #DIV/0! | P121: =(L121-M121)/M121 -> #DIV/0! | AC121: =(L121-Q121)/L121 -> #DIV/0! | AD121: =(R121-S121)/R121 -> #DIV/0! | AO121: 已分析（见涨幅与最高收益合成表） | AP121: 44548
A122: 002039.SZ | B122: 黔源电力 | C122: 1.03 | D122: 电力设备 | F122: 17.149999999999999 | G122: 17.760000000000002 | H122: 19.629999999999999 | J122: 23.18 | K122: 13.039999999999999 | L122: 28.739999999999998 | M122: 13.82 | N122: =(J122-K122)/K122 -> 0.77760736196319025 | O122: =(L122-J122)/L122 -> 0.19345859429366732 | P122: =(L122-M122)/M122 -> 1.0795947901591894 | Q122: 17.059999999999999 | R122: 23.5 | S122: 20.039999999999999 | AB122: 11w | AC122: =(L122-Q122)/L122 -> 0.40640222686151706 | AD122: =(R122-S122)/R122 -> 0.14723404255319153 | AO122: 不宜入场(收缩幅度不够，应观察3w) | AP122: 44548