A1: 股票代码 | B1: 股票简称 | C1: 区间涨跌幅:前复权(%)2020.12.29-2021.12.28 | D1: 基本每股收(元)2021.09.30 | E1: 行业 | F1: 当前基底处于上升趋势的位置(即处于第几个基底) | G1: 趋势 | R1: 波动收缩幅度 | AK1: 成交量行为 | AM1: 价格行为(得分应大于60%) | AP1: 结论 | AQ1: 更新时间 | AR1: 标签
G2: 200日均线 | H2: 150日均线 | I2: 50日均线 | J2: 各均线斜率是否朝上 | K2: 当前股价 | L2: 52周内最低点 | M2: 52周内最高点 | N2: 最高点前8周收盘价 | O2: 当前股价相对于最低点百分比(至少高出25%) | P2: 当前股价相对于最高点百分比(25%内最好) | Q2: 最高点前8周股价相对于最高点百分比 | R2: 技术足迹 | AK2: 不同收盘表现时交易量情况(好的收盘时，交易量是否增大，坏的收盘时，交易量是否萎缩) | AL2: 成交量收缩情况(最后的价格收缩期间的成交量应低于50天的平均水平且有一到两天交易量极低) | AM2: 支撑位和压力位是否同步升高(40%) | AN2: 是否有网球行为出现(40%) | AO2: 上涨天数是否大于下跌天数(20%)
R3: 支撑位1 | S3: 阻力位2 | T3: 支撑位2 | U3: 阻力位3 | V3: 支撑位3 | W3: 阻力位4 | X3: 支撑位4 | Y3: 阻力位5 | Z3: 支撑位5 | AA3: 阻力位6 | AB3: 支撑位6 | AC3: 时间周期 | AD3: 收缩量1 | AE3: 收缩量2 | AF3: 收缩量3 | AG3: 收缩量4 | AH3: 收缩量5 | AI3: 收缩量6 | AJ3: 收缩数量(至少大于3T)
A4: 600071 | B4: 凤凰光学 | D4: 3.6700000000000003e-02 | G4: 30 | H4: 33.530000000000001 | I4: 47.619999999999997 | K4: 55.5 | L4: 12.41 | M4: 61.579999999999998 | N4: 16.940000000000001 | O4: =(K4-L4)/L4 -> 3.4721998388396456 | P4: =(M4-K4)/M4 -> 9.8733354985384839e-02 | Q4: =(M4-N4)/N4 -> 2.6351829988193622 | R4: 47.969999999999999 | S4: 56.5 | T4: 47.979999999999997 | U4: 56.82 | AC4: 5w | AD4: =(M4-R4)/M4 -> 0.22101331601169211 | AE4: =(S4-T4)/S4 -> 0.15079646017699119 | AP4: 暂不宜入场（收缩幅度不够，应继续观察1w） | AQ4: 44560
A5: 603297 | B5: 永新光学 | C5: 201.83 | D5: 1.97 | E5: 光学光电子 | G5: 65.859999999999999 | H5: 70.349999999999994 | I5: 88.370000000000005 | K5: 104.27 | L5: 36.710000000000001 | M5: 116.84 | N5: 56.649999999999999 | O5: =(K5-L5)/L5 -> 1.8403704712612368 | P5: =(M5-K5)/M5 -> 0.10758301951386517 | Q5: =(M5-N5)/N5 -> 1.0624889673433364 | R5: 92.5 | S5: 110.42 | T5: 101.5 | AC5: 2w | AD5: =(M5-R5)/M5 -> 0.2083190688120507 | AE5: =(S5-T5)/S5 -> 8.0782466944394143e-02 | AF5: =(U5-V5)/U5 -> #DIV/0! | AG5: =(W5-X5)/W5 -> #DIV/0! | AH5: =(Y5-Z5)/Y5 -> #DIV/0! | AP5: 暂不宜入场（收缩幅度不够，应继续观察1w） | AQ5: 44560
A6: 603985 | B6: 恒润股份 | C6: 81.5 | D6: 1.27 | E6: 电力设备 | G6: 32.450000000000003 | H6: 35.340000000000003 | I6: 46.530000000000001 | K6: 49.390000000000001 | L6: 15.01 | M6: 57.710000000000001 | N6: 26.449999999999999 | O6: =(K6-L6)/L6 -> 2.2904730179880084 | P6: =(M6-K6)/M6 -> 0.14416912146941605 | Q6: =(M6-N6)/N6 -> 1.1818525519848773 | R6: 44 | S6: 55.5 | T6: 46.259999999999998 | AC6: 5w | AD6: =(M6-R6)/M6 -> 0.23756714607520363 | AE6: =(S6-T6)/S6 -> 0.16648648648648653 | AP6: 暂不宜入场（收缩幅度不够，应继续观察1w） | AQ6: 44560
A7: 603197.SH | B7: 保隆科技 | C7: 109.17 | D7: 1.2 | E7: 汽车零部件 | G7: 35.310000000000002 | H7: 37.299999999999997 | I7: 46.289999999999999 | K7: 66.129999999999995 | L7: 22.620000000000001 | M7: 60.32 | N7: 26.399999999999999 | O7: =(K7-L7)/L7 -> 1.9235190097259058 | P7: =(M7-K7)/M7 -> -9.6319628647214772e-02 | Q7: =(M7-N7)/N7 -> 1.2848484848484849 | R7: 50.850000000000001 | S7: 69.489999999999995 | T7: 57.799999999999997 | AC7: 2w | AD7: =(M7-R7)/M7 -> 0.15699602122015913 | AE7: =(S7-T7)/S7 -> 0.16822564397755072 | AP7: 暂不宜入场（收缩幅度不够，应继续观察1w） | AQ7: 44560
A8: 603192.SH | B8: 汇得科技 | C8: 147.86 | D8: 0.85 | E8: 化学制品 | F8: 1 | G8: 30.940000000000001 | H8: 33 | I8: 43.049999999999997 | K8: 59.460000000000001 | L8: 20.969999999999999 | M8: 60.719999999999999 | N8: 26.559999999999999 | O8: =(K8-L8)/L8 -> 1.8354792560801148 | P8: =(M8-K8)/M8 -> 2.0750988142292457e-02 | Q8: =(M8-N8)/N8 -> 1.286144578313253 | R8: 54.119999999999997 | AC8: 1w | AD8: =(M8-R8)/M8 -> 0.10869565217391307 | AP8: 暂不宜入场（收缩幅度不够，应继续观察1w） | AQ8: 44560
A9: 605123.SH | B9: 派克新材 | C9: 61.78 | D9: 1.77 | E9: 国防军工 | G9: 94.790000000000006 | H9: 100.09999999999999 | I9: 122.19 | K9: 142.47 | L9: 61.549999999999997 | M9: 159 | N9: 83.180000000000007 | O9: =(K9-L9)/L9 -> 1.3147034930950448 | P9: =(M9-K9)/M9 -> 0.10396226415094341 | Q9: =(M9-N9)/N9 -> 0.91151719163260381 | R9: 128.47 | AC9: 2w | AD9: =(M9-R9)/M9 -> 0.19201257861635221 | AE9: =(S9-T9)/S9 -> #DIV/0! | AG9: =(W9-X9)/W9 -> #DIV/0! | AH9: =(Y9-Z9)/Y9 -> #DIV/0! | AP9: 不宜入场（收缩量不够，应再观察1w） | AQ9: 44556
A10: 603606.SH | B10: 东方电缆 | D10: 1.47 | E10: 电力设备 | G10: 33.259999999999998 | H10: 35.909999999999997 | I10: 47.210000000000001 | K10: 50.340000000000003 | L10: 18.510000000000002 | M10: 63.75 | N10: 31.57 | O10: =(K10-L10)/L10 -> 1.719611021069692 | P10: =(M10-K10)/M10 -> 0.21035294117647055 | Q10: =(M10-N10)/N10 -> 1.0193221412733608 | R10: 45.32 | AC10: 4w | AD10: =(M10-R10)/M10 -> 0.28909803921568628 | AE10: =(S10-T10)/S10 -> #DIV/0! | AF10: =(U10-V10)/U10 -> #DIV/0! | AJ10: 1T | AP10: 不宜入场(有强力拉升的潜力，但收缩幅度不够，应该持续观察3个w) | AQ10: 44548