A1: 股票代码 | B1: 股票简称 | C1: 趋势 | M1: 当前股价位置属于趋势的周期（即数基地，1到2的时候进入，3到5应该考虑卖出） | N1: 最近一年最高点是否新高 | O1: 价格波动收缩幅度 | AH1: 价格行为(得分应大于60%) | AK1: 成交量行为 | AM1: 结论 | AN1: 更新时间
O2: 技术足迹 | AH2: 支撑位和压力位是否同步升高(40%) | AI2: 是否有网球行为出现(40%) | AJ2: 上涨天数是否大于下跌天数(20%) | AK2: 不同收盘表现时交易量情况(好的收盘时，交易量是否增大，坏的收盘时，交易量是否萎缩) | AL2: 成交量收缩情况(最后的价格收缩期间的成交量应低于50天的平均水平且有一到两天交易量极低)
C3: 行情收盘价 [1]2022.04.01 | D3: 50日均线 [2]2022.04.01 | E3: 150日均线 [3]2022.04.01 | F3: 200日均线 [4]2022.04.01 | G3: 52周内最低点 | H3: 52周内最高点 | I3: 最高点前8周收盘价 | J3: 当前股价相对于最低点百分比(至少高出25%) | K3: 当前股价相对于最高点百分比(25%内最好) | L3: 最高点前8周股价相对于最高点百分比 | O3: 支撑位1 | P3: 阻力位2 | Q3: 支撑位2 | R3: 阻力位3 | S3: 支撑位3 | T3: 阻力位4 | U3: 支撑位4 | V3: 阻力位5 | W3: 支撑位5 | X3: 阻力位6 | Y3: 支撑位6 | Z3: 时间周期(最小3周) | AA3: 收缩量1 | AB3: 收缩量2 | AC3: 收缩量3 | AD3: 收缩量4 | AE3: 收缩量5 | AF3: 收缩量6 | AG3: 收缩数量(至少大于3T)
A4: 300769.SZ | B4: 德方纳米 | C4: 579 | D4: 575.42 | E4: 535.78 | F4: 459.68
A5: 688298.SH | B5: 东方生物 | C5: 283.03 | D5: 253.81 | E5: 202.41 | F5: 201.44
A6: 300776.SZ | B6: 帝尔激光 | C6: 228 | D6: 227.38 | E6: 197.58 | F6: 188.81
A7: 605369.SH | B7: 拱东医疗 | C7: 138.86 | D7: 138.06 | E7: 119.37 | F7: 117.32
A8: 688330.SH | B8: 宏力达 | C8: 128.59999999999999 | D8: 112.73 | E8: 109.42 | F8: 101.7
A9: 000733.SZ | B9: 振华科技 | C9: 113.48 | D9: 112.43 | E9: 109.25 | F9: 99.73
A10: 002932.SZ | B10: 明德生物 | C10: 98.11 | D10: 85.400000000000006 | E10: 75.71 | F10: 73.59
A11: 002738.SZ | B11: 中矿资源 | C11: 90.19 | D11: 83.84 | E11: 69.24 | F11: 64.99
A12: 002865.SZ | B12: 钧达股份 | C12: 85 | D12: 74.75 | E12: 55.59 | F12: 47.5
A13: 300619.SZ | B13: 金银河 | C13: 82.5 | D13: 74.14 | E13: 70.91 | F13: 60.23
A14: 688123.SH | B14: 聚辰股份 | C14: 82.33 | D14: 75.299999999999997 | E14: 59.53 | F14: 57.34
A15: 688077.SH | B15: 大地熊 | C15: 81.900000000000006 | D15: 75.34 | E15: 67.58 | F15: 62.87
A16: 002432.SZ | B16: 九安医疗 | C16: 75.900000000000006 | D16: 63.299999999999997 | E16: 32.72 | F16: 26.42
A17: 300373.SZ | B17: 扬杰科技 | C17: 75 | D17: 67.95 | E17: 60.61 | F17: 59.12
A18: 688556.SH | B18: 高测股份 | C18: 71.38 | D18: 68.43 | E18: 66.11 | F18: 56.35
A19: 688066.SH | B19: 航天宏图 | C19: 68.95 | D19: 65.89 | E19: 60.08 | F19: 55.899999999999999
A20: 002864.SZ | B20: 盘龙药业 | C20: 68.24 | D20: 33.19 | E20: 27.73 | F20: 26.62
A21: 603826.SH | B21: 坤彩科技 | C21: 61.32 | D21: 48.97 | E21: 42.13 | F21: 40.899999999999999
A22: 603688.SH | B22: 石英股份 | C22: 60.36 | D22: 57.53 | E22: 53.98 | F22: 47.32
A23: 836077.BJ | B23: 吉林碳谷 | C23: 59.64 | D23: 58.04 | E23: 47.96 | F23: 37.46
A24: 603896.SH | B24: 寿仙谷 | C24: 59.53 | D24: 53.46 | E24: 47.88 | F24: 45.89
A25: 601689.SH | B25: 拓普集团 | C25: 58.52 | D25: 56.06 | E25: 50.5 | F25: 46.95
A26: 300518.SZ | B26: 盛讯达 | C26: 57.39 | D26: 52.43 | E26: 45.45 | F26: 44.75
A27: 300666.SZ | B27: 江丰电子 | C27: 57.15 | D27: 56.48 | E27: 49.82 | F27: 49.700000000000003
A28: 300860.SZ | B28: 锋尚文化 | C28: 56.99 | D28: 56.65 | E28: 54.91 | F28: 54.51
A29: 603229.SH | B29: 奥翔药业 | C29: 55.899999999999999 | D29: 48.29 | E29: 37.13 | F29: 35.19
A30: 688513.SH | B30: 苑东生物 | C30: 53.05 | D30: 51.67 | E30: 48.01 | F30: 47.55
A31: 300260.SZ | B31: 新莱应材 | C31: 52.86 | D31: 48.02 | E31: 42.33 | F31: 37.43
A32: 603868.SH | B32: 飞科电器 | C32: 50.54 | D32: 46.22 | E32: 42.899999999999999 | F32: 42.200000000000003
A33: 300438.SZ | B33: 鹏辉能源 | C33: 47 | D33: 44.5 | E33: 41.28 | F33: 37.59
A34: 300596.SZ | B34: 利安隆 | C34: 46.92 | D34: 44.23 | E34: 42.21 | F34: 41.72
A35: 603665.SH | B35: 康隆达 | C35: 46.399999999999999 | D35: 42.19 | E35: 30.07 | F35: 26.02
A36: 605399.SH | B36: 晨光新材 | C36: 45.91 | D36: 45.72 | E36: 43.200000000000003 | F36: 38.07
A37: 600085.SH | B37: 同仁堂 | C37: 45.87 | D37: 43.99 | E37: 38.81 | F37: 38.100000000000001
A38: 000999.SZ | B38: 华润三九 | C38: 44.48 | D38: 36.79 | E38: 30.75 | F38: 29.33
A39: 300818.SZ | B39: 耐普矿机 | C39: 44.05 | D39: 42.27 | E39: 38.26 | F39: 35.77
A40: 603031.SH | B40: 安德利 | C40: 43.96 | D40: 43.89 | E40: 41.18 | F40: 37.399999999999999
A41: 300917.SZ | B41: 特发服务 | C41: 43.600000000000001 | D41: 28.93 | E41: 27.94 | F41: 27.68
A42: 601677.SH | B42: 明泰铝业 | C42: 42.46 | D42: 41.31 | E42: 38.07 | F42: 34.74
A43: 300803.SZ | B43: 指南针 | C43: 42.34 | D43: 40.68 | E43: 37.67 | F43: 37.31
A44: 000818.SZ | B44: 航锦科技 | C44: 39.5 | D44: 34.96 | E44: 34.53 | F44: 33.55
A45: 300546.SZ | B45: 雄帝科技 | C45: 38.65 | D45: 33.29 | E45: 22.399999999999999 | F45: 20.95
A46: 002987.SZ | B46: 京北方 | C46: 38.600000000000001 | D46: 38.21 | E46: 32.299999999999997 | F46: 31.45
A47: 002142.SZ | B47: 宁波银行 | C47: 38.5 | D47: 37.95 | E47: 36.59 | F47: 36.37
A48: 600378.SH | B48: 昊华科技 | C48: 38.399999999999999 | D48: 37.18 | E48: 36.13 | F48: 33.48
A49: 600188.SH | B49: 兖矿能源 | C49: 37.99 | D49: 31.02 | E49: 27.199999999999999 | F49: 24.300000000000001
A50: 002943.SZ | B50: 宇晶股份 | C50: 36.07 | D50: 32.73 | E50: 29.11 | F50: 26.11
A51: 300233.SZ | B51: 金城医药 | C51: 35.299999999999997 | D51: 34.28 | E51: 32.100000000000001 | F51: 31.71
A52: 000893.SZ | B52: 亚钾国际 | C52: 34.43 | D52: 27.27 | E52: 22.52 | F52: 21.600000000000001
A53: 000915.SZ | B53: 华特达因 | C53: 34.33 | D53: 33.74 | E53: 30.5 | F53: 30.15
A54: 002805.SZ | B54: 丰元股份 | C54: 33.57 | D54: 33.39 | E54: 32.74 | F54: 30.52
A55: 002001.SZ | B55: 新和成 | C55: 33.05 | D55: 32.93 | E55: 30.08 | F55: 29.600000000000001
A56: 600056.SH | B56: 中国医药 | C56: 32.72 | D56: 18.29 | E56: 13.67 | F56: 13.199999999999999
A57: 605289.SH | B57: 罗曼股份 | C57: 32.58 | D57: 31.61 | E57: 30.21 | F57: 29.28
A58: 002761.SZ | B58: 浙江建投 | C58: 32.09 | D58: 19.36 | E58: 11.44 | F58: 10.52
A59: 002603.SZ | B59: 以岭药业 | C59: 31.54 | D59: 25.69 | E59: 20.18 | F59: 19.96
A60: 300416.SZ | B60: 苏试试验 | C60: 30.62 | D60: 29.56 | E60: 27.800000000000001 | F60: 26.67
A61: 300649.SZ | B61: 杭州园林 | C61: 29.61 | D61: 26.27 | E61: 19.33 | F61: 18.92
A62: 601088.SH | B62: 中国神华 | C62: 29.53 | D62: 25.71 | E62: 22.66 | F62: 21.45
A63: 300556.SZ | B63: 丝路视觉 | C63: 28.09 | D63: 26.54 | E63: 26.16 | F63: 24.28
A64: 002735.SZ | B64: 王子新材 | C64: 28 | D64: 25.52 | E64: 21.39 | F64: 20.45
A65: 300052.SZ | B65: 中青宝 | C65: 27.98 | D65: 25.88 | E65: 25.04 | F65: 21.01
A66: 603800.SH | B66: 道森股份 | C66: 27.57 | D66: 24.46 | E66: 20.79 | F66: 18.300000000000001
A67: 300823.SZ | B67: 建科机械 | C67: 27.5 | D67: 24.17 | E67: 23.83 | F67: 23.600000000000001
A68: 300612.SZ | B68: 宣亚国际 | C68: 27.35 | D68: 20.47 | E68: 18.28 | F68: 17.81
A69: 300650.SZ | B69: 太龙股份 | C69: 26.83 | D69: 26.19 | E69: 25.51 | F69: 25.16
A70: 603477.SH | B70: 巨星农牧 | C70: 26.77 | D70: 22.04 | E70: 16.399999999999999 | F70: 15.16
A71: 603199.SH | B71: 九华旅游 | C71: 26.600000000000001 | D71: 24.5 | E71: 22.07 | F71: 21.5
A72: 603258.SH | B72: 电魂网络 | C72: 26.25 | D72: 25.79 | E72: 25.73 | F72: 25.41
A73: 603090.SH | B73: 宏盛股份 | C73: 26.199999999999999 | D73: 21.81 | E73: 20.600000000000001 | F73: 19.06
A74: 603949.SH | B74: 雪龙集团 | C74: 25.99 | D74: 25.24 | E74: 22.35 | F74: 20.43
A75: 688377.SH | B75: 迪威尔 | C75: 25.83 | D75: 24.16 | E75: 19.100000000000001 | F75: 18.31
A76: 600566.SH | B76: 济川药业 | C76: 25.71 | D76: 24.63 | E76: 21.17 | F76: 20.04
A77: 603399.SH | B77: 吉翔股份 | C77: 25.600000000000001 | D77: 18.14 | E77: 10.68 | F77: 9.44
A78: 002779.SZ | B78: 中坚科技 | C78: 25.44 | D78: 23.94 | E78: 17.78 | F78: 16.06
A79: 600367.SH | B79: 红星发展 | C79: 25.100000000000001 | D79: 21.02 | E79: 18.88 | F79: 16.899999999999999
A80: 603363.SH | B80: 傲农生物 | C80: 25.100000000000001 | D80: 19.38 | E80: 13.59 | F80: 12.51
A81: 600861.SH | B81: 北京城乡 | C81: 24.96 | D81: 24.42 | E81: 22.699999999999999 | F81: 21.11
A82: 300645.SZ | B82: 正元智慧 | C82: 24.899999999999999 | D82: 24.07 | E82: 22.47 | F82: 21.22
A83: 002555.SZ | B83: 三七互娱 | C83: 24.61 | D83: 23.37 | E83: 23.37 | F83: 22.97
A84: 300636.SZ | B84: 同和药业 | C84: 24.53 | D84: 22.99 | E84: 19.52 | F84: 18.5
A85: 300481.SZ | B85: 濮阳惠成 | C85: 24.5 | D85: 23.56 | E85: 23.199999999999999 | F85: 23.17
A86: 600199.SH | B86: 金种子酒 | C86: 24.5 | D86: 21.35 | E86: 18.21 | F86: 17.58
A87: 603268.SH | B87: 松发股份 | C87: 24.35 | D87: 24.09 | E87: 19.98 | F87: 18.88
A88: 603860.SH | B88: 中公高科 | C88: 24 | D88: 23.72 | E88: 21.66 | F88: 21.36
A89: 600645.SH | B89: 中源协和 | C89: 23.99 | D89: 23.87 | E89: 22.91 | F89: 22.56
A90: 300468.SZ | B90: 四方精创 | C90: 23.64 | D90: 23.07 | E90: 19.46 | F90: 18.94
A91: 300075.SZ | B91: 数字政通 | C91: 23.46 | D91: 23.37 | E91: 16.98 | F91: 15.73
A92: 603398.SH | B92: 沐邦高科 | C92: 23.35 | D92: 20.94 | E92: 16.62 | F92: 14.74
A93: 002393.SZ | B93: 力生制药 | C93: 23.16 | D93: 22.74 | E93: 20.74 | F93: 20.39
A94: 000048.SZ | B94: 京基智农 | C94: 23.13 | D94: 20.89 | E94: 18.74 | F94: 18.74
A95: 300801.SZ | B95: 泰和科技 | C95: 22.82 | D95: 21.86 | E95: 20.75 | F95: 20.199999999999999
A96: 600523.SH | B96: 贵航股份 | C96: 22.61 | D96: 21.95 | E96: 19.63 | F96: 18.36
A97: 002657.SZ | B97: 中科金财 | C97: 22.52 | D97: 14.61 | E97: 12.26 | F97: 11.9
A98: 603136.SH | B98: 天目湖 | C98: 22.5 | D98: 19.47 | E98: 17.62 | F98: 17.07
A99: 300498.SZ | B99: 温氏股份 | C99: 22.12 | D99: 20.51 | E99: 17.66 | F99: 16.63
A100: 603358.SH | B100: 华达科技 | C100: 21.96 | D100: 20.26 | E100: 19.75 | F100: 19.11
A101: 603177.SH | B101: 德创环保 | C101: 21.81 | D101: 19.55 | E101: 16.66 | F101: 15.84
A102: 000672.SZ | B102: 上峰水泥 | C102: 21.77 | D102: 21.19 | E102: 20.05 | F102: 19.43
A103: 300519.SZ | B103: 新光药业 | C103: 21.62 | D103: 20.09 | E103: 18.09 | F103: 18.01
A104: 600547.SH | B104: 山东黄金 | C104: 21.58 | D104: 20.100000000000001 | E104: 19.61 | F104: 19.33
A105: 601166.SH | B105: 兴业银行 | C105: 21.399999999999999 | D105: 21.34 | E105: 19.77 | F105: 19.72
A106: 600647.SH | B106: 同达创业 | C106: 20.78 | D106: 14.67 | E106: 12.92 | F106: 12.58
A107: 601028.SH | B107: 玉龙股份 | C107: 20.52 | D107: 19.35 | E107: 18.12 | F107: 17.98
A108: 600801.SH | B108: 华新水泥 | C108: 20.399999999999999 | D108: 19.91 | E108: 19.75 | F108: 19.21
A109: 002349.SZ | B109: 精华制药 | C109: 20.22 | D109: 16.41 | E109: 9.89 | F109: 8.71
A110: 600262.SH | B110: 北方股份 | C110: 20.18 | D110: 19.51 | E110: 17.56 | F110: 16.59
A111: 600668.SH | B111: 尖峰集团 | C111: 19.800000000000001 | D111: 19.57 | E111: 15.26 | F111: 14.29
A112: 002637.SZ | B112: 赞宇科技 | C112: 19.74 | D112: 19.03 | E112: 17.52 | F112: 17.02
A113: 600860.SH | B113: 京城股份 | C113: 19.49 | D113: 17.17 | E113: 12.99 | F113: 11.28
A114: 600301.SH | B114: *ST南化 | C114: 19.23 | D114: 14.83 | E114: 13.16 | F114: 11.74
A115: 002800.SZ | B115: 天顺股份 | C115: 18.899999999999999 | D115: 17.67 | E115: 15.21 | F115: 14.62
A116: 605018.SH | B116: 长华股份 | C116: 18.600000000000001 | D116: 17.33 | E116: 15.53 | F116: 14.95
A117: 600988.SH | B117: 赤峰黄金 | C117: 18.58 | D117: 16.21 | E117: 16.07 | F117: 15.92
A118: 603222.SH | B118: 济民医疗 | C118: 18.51 | D118: 16.67 | E118: 15.48 | F118: 15.41
A119: 300205.SZ | B119: 天喻信息 | C119: 18.48 | D119: 17.08 | E119: 14.5 | F119: 13.98
A120: 603029.SH | B120: 天鹅股份 | C120: 18.31 | D120: 17.699999999999999 | E120: 14.97 | F120: 14.64
A121: 600048.SH | B121: 保利发展 | C121: 18.21 | D121: 16.23 | E121: 14.57 | F121: 13.699999999999999
A122: 600818.SH | B122: 中路股份 | C122: 18.05 | D122: 14.19 | E122: 10.59 | F122: 10.24
A123: 002840.SZ | B123: 华统股份 | C123: 18.02 | D123: 16.44 | E123: 13.27 | F123: 12.19
A124: 600233.SH | B124: 圆通速递 | C124: 18 | D124: 16.89 | E124: 15.27 | F124: 13.88
A125: 000681.SZ | B125: 视觉中国 | C125: 17.82 | D125: 17 | E125: 16.64 | F125: 15.59
A126: 603165.SH | B126: 荣晟环保 | C126: 17.76 | D126: 16.63 | E126: 16.09 | F126: 15.27
A127: 300138.SZ | B127: 晨光生物 | C127: 17.68 | D127: 16.52 | E127: 15.42 | F127: 15.27
A128: 601020.SH | B128: ST华钰 | C128: 17.600000000000001 | D128: 14.07 | E128: 13.88 | F128: 12.46
A129: 603045.SH | B129: 福达合金 | C129: 17.52 | D129: 17.07 | E129: 16.84 | F129: 15.63
A130: 002015.SZ | B130: 协鑫能科 | C130: 17.46 | D130: 16.95 | E130: 16.05 | F130: 14.4
A131: 603439.SH | B131: 贵州三力 | C131: 17.27 | D131: 15.23 | E131: 14.46 | F131: 14.28
A132: 002128.SZ | B132: 电投能源 | C132: 17.17 | D132: 16.08 | E132: 14.67 | F132: 13.58
A133: 000876.SZ | B133: 新希望 | C133: 17.14 | D133: 16.199999999999999 | E133: 14.91 | F133: 14.45
A134: 000567.SZ | B134: 海德股份 | C134: 17.07 | D134: 16.68 | E134: 16.59 | F134: 15.23
A135: 002234.SZ | B135: 民和股份 | C135: 16.83 | D135: 15.85 | E135: 15.76 | F135: 15.39
A136: 600062.SH | B136: 华润双鹤 | C136: 16.51 | D136: 12.89 | E136: 12.31 | F136: 12.08
A137: 601225.SH | B137: 陕西煤业 | C137: 16.46 | D137: 14.300000000000001 | E137: 13.52 | F137: 12.89
A138: 601699.SH | B138: 潞安环能 | C138: 16.399999999999999 | D138: 14.51 | E138: 13.6 | F138: 13.33
A139: 603506.SH | B139: 南都物业 | C139: 16.399999999999999 | D139: 15.55 | E139: 15.11 | F139: 14.86
A140: 000688.SZ | B140: 国城矿业 | C140: 16.38 | D140: 15.9 | E140: 13.67 | F140: 12.58
A141: 603813.SH | B141: 原尚股份 | C141: 16.300000000000001 | D141: 15.63 | E141: 14.85 | F141: 14.45
A142: 601666.SH | B142: 平煤股份 | C142: 16.25 | D142: 12.38 | E142: 10.300000000000001 | F142: 9.5
A143: 600985.SH | B143: 淮北矿业 | C143: 16.23 | D143: 13.28 | E143: 12.98 | F143: 12.66
A144: 002728.SZ | B144: 特一药业 | C144: 16.21 | D144: 15.75 | E144: 14.49 | F144: 14.18
A145: 002549.SZ | B145: 凯美特气 | C145: 16.03 | D145: 15.76 | E145: 15 | F145: 13.62
A146: 300130.SZ | B146: 新国都 | C146: 16.02 | D146: 14.92 | E146: 12.43 | F146: 12.04
A147: 603056.SH | B147: 德邦股份 | C147: 16 | D147: 12.76 | E147: 11.26 | F147: 11.15
A148: 603955.SH | B148: 大千生态 | C148: 16 | D148: 15.1 | E148: 13.53 | F148: 13.47
A149: 002317.SZ | B149: 众生药业 | C149: 15.800000000000001 | D149: 12.67 | E149: 10.84 | F149: 10.33
A150: 300585.SZ | B150: 奥联电子 | C150: 15.800000000000001 | D150: 15.44 | E150: 14.33 | F150: 14.1
A151: 300535.SZ | B151: 达威股份 | C151: 15.72 | D151: 15.61 | E151: 15.37 | F151: 15.13
A152: 601001.SH | B152: 晋控煤业 | C152: 15.64 | D152: 13.43 | E152: 11.63 | F152: 10.69
A153: 600783.SH | B153: 鲁信创投 | C153: 15.62 | D153: 14.77 | E153: 13.72 | F153: 13.12
A154: 601838.SH | B154: 成都银行 | C154: 15.59 | D154: 14.49 | E154: 12.91 | F154: 12.69
A155: 600706.SH | B155: 曲江文旅 | C155: 15.58 | D155: 11.62 | E155: 8.47 | F155: 8.03
A156: 000736.SZ | B156: 中交地产 | C156: 15.55 | D156: 8.04 | E156: 6.59 | F156: 6.45
A157: 002750.SZ | B157: 龙津药业 | C157: 15.51 | D157: 14.96 | E157: 10.83 | F157: 9.98
A158: 001979.SZ | B158: 招商蛇口 | C158: 15.49 | D158: 14.02 | E158: 12.45 | F158: 11.9
A159: 300081.SZ | B159: 恒信东方 | C159: 15.42 | D159: 12.62 | E159: 12.43 | F159: 11.33
A160: 300732.SZ | B160: 设研院 | C160: 15.31 | D160: 15.29 | E160: 13 | F160: 12.4
A161: 002907.SZ | B161: 华森制药 | C161: 15.27 | D161: 14.77 | E161: 13.49 | F161: 13.31
A162: 002758.SZ | B162: 浙农股份 | C162: 15.25 | D162: 14.16 | E162: 11.58 | F162: 11.03
A163: 000546.SZ | B163: 金圆股份 | C163: 15.01 | D163: 14.82 | E163: 12.49 | F163: 11.01
A164: 603668.SH | B164: 天马科技 | C164: 15.01 | D164: 11.52 | E164: 9.62 | F164: 9.02
A165: 600535.SH | B165: 天士力 | C165: 14.94 | D165: 14.53 | E165: 14.04 | F165: 13.9
A166: 002731.SZ | B166: 萃华珠宝 | C166: 14.91 | D166: 11.24 | E166: 9.12 | F166: 8.38
A167: 300306.SZ | B167: 远方信息 | C167: 14.9 | D167: 13.12 | E167: 11.08 | F167: 10.81
A168: 600926.SH | B168: 杭州银行 | C168: 14.9 | D168: 14.23 | E168: 14.199999999999999 | F168: 14.08
A169: 603112.SH | B169: 华翔股份 | C169: 14.81 | D169: 14.71 | E169: 13.21 | F169: 12.74
A170: 600383.SH | B170: 金地集团 | C170: 14.699999999999999 | D170: 13.31 | E170: 11.86 | F170: 11.31
A171: 603617.SH | B171: 君禾股份 | C171: 14.6 | D171: 13.44 | E171: 12.13 | F171: 11.63
A172: 000810.SZ | B172: 创维数字 | C172: 14.53 | D172: 12.98 | E172: 10.05 | F172: 9.68
A173: 002462.SZ | B173: 嘉事堂 | C173: 14.51 | D173: 14.03 | E173: 13.27 | F173: 13.25
A174: 601069.SH | B174: 西部黄金 | C174: 14.37 | D174: 14.26 | E174: 12.79 | F174: 12.72
A175: 002941.SZ | B175: 新疆交建 | C175: 14.36 | D175: 14.01 | E175: 12.52 | F175: 12
A176: 300249.SZ | B176: 依米康 | C176: 14.33 | D176: 13.42 | E176: 9.07 | F176: 8.67
A177: 002125.SZ | B177: 湘潭电化 | C177: 14.29 | D177: 12.34 | E177: 12.25 | F177: 11.47
A178: 300158.SZ | B178: 振东制药 | C178: 14.26 | D178: 8.47 | E178: 7.63 | F178: 7.5
A179: 000933.SZ | B179: 神火股份 | C179: 14.19 | D179: 12.77 | E179: 11.52 | F179: 11.31
A180: 836826.BJ | B180: 盖世食品 | C180: 14.13 | D180: 13.74 | E180: 11.78 | F180: 10.34
A181: 600184.SH | B181: 光电股份 | C181: 14.11 | D181: 13.83 | E181: 13.26 | F181: 12.73
A182: 603266.SH | B182: 天龙股份 | C182: 14.1 | D182: 12.43 | E182: 11.94 | F182: 11.91
A183: 600449.SH | B183: 宁夏建材 | C183: 14.05 | D183: 12.82 | E183: 11.99 | F183: 11.81
A184: 600749.SH | B184: 西藏旅游 | C184: 14.05 | D184: 12.58 | E184: 11.07 | F184: 10.87
A185: 300446.SZ | B185: *ST乐材 | C185: 13.98 | D185: 11.59 | E185: 9.68 | F185: 9.09
A186: 600371.SH | B186: 万向德农 | C186: 13.96 | D186: 13.17 | E186: 12.27 | F186: 12.05
A187: 000411.SZ | B187: 英特集团 | C187: 13.94 | D187: 13.55 | E187: 13.199999999999999 | F187: 13.13
A188: 600557.SH | B188: 康缘药业 | C188: 13.86 | D188: 12.28 | E188: 11.1 | F188: 11.07
A189: 601717.SH | B189: 郑煤机 | C189: 13.85 | D189: 12.6 | E189: 12.14 | F189: 11.79
A190: 601952.SH | B190: 苏垦农发 | C190: 13.81 | D190: 12.25 | E190: 11.67 | F190: 11.41
A191: 300547.SZ | B191: 川环科技 | C191: 13.800000000000001 | D191: 13.699999999999999 | E191: 12.89 | F191: 12.25
A192: 600571.SH | B192: 信雅达 | C192: 13.800000000000001 | D192: 12.69 | E192: 10.59 | F192: 9.69
A193: 000985.SZ | B193: 大庆华科 | C193: 13.78 | D193: 13.72 | E193: 13.04 | F193: 12.74
A194: 603636.SH | B194: 南威软件 | C194: 13.73 | D194: 11.72 | E194: 9.72 | F194: 9.65
A195: 000815.SZ | B195: 美利云 | C195: 13.68 | D195: 11.6 | E195: 8.04 | F195: 7.33
A196: 600476.SH | B196: 湘邮科技 | C196: 13.49 | D196: 12.91 | E196: 11.74 | F196: 11.47
A197: 300517.SZ | B197: 海波重科 | C197: 13.47 | D197: 13.34 | E197: 13.13 | F197: 13.05
A198: 000014.SZ | B198: 沙河股份 | C198: 13.44 | D198: 8.95 | E198: 7.9000000000000004 | F198: 7.79
A199: 300364.SZ | B199: 中文在线 | C199: 13.35 | D199: 11.199999999999999 | E199: 10.31 | F199: 9.18
A200: 603602.SH | B200: 纵横通信 | C200: 13.32 | D200: 12.6 | E200: 10.9 | F200: 10.85
A201: 600153.SH | B201: 建发股份 | C201: 13.300000000000001 | D201: 10.39 | E201: 9.07 | F201: 8.67
A202: 600546.SH | B202: 山煤国际 | C202: 13.300000000000001 | D202: 11.43 | E202: 10.34 | F202: 9.63
A203: 002053.SZ | B203: 云南能投 | C203: 13.25 | D203: 11.66 | E203: 10.08 | F203: 9.59
A204: 600283.SH | B204: 钱江水利 | C204: 13.17 | D204: 13.14 | E204: 11.87 | F204: 11.67
A205: 600750.SH | B205: 江中药业 | C205: 13.16 | D205: 12.52 | E205: 12.37 | F205: 12.300000000000001
A206: 002910.SZ | B206: 庄园牧场 | C206: 13.1 | D206: 12.12 | E206: 11.32 | F206: 11.11
A207: 002104.SZ | B207: 恒宝股份 | C207: 13.08 | D207: 11.55 | E207: 7.86 | F207: 7.29
A208: 000789.SZ | B208: 万年青 | C208: 13 | D208: 12.73 | E208: 12.52 | F208: 12.24
A209: 002748.SZ | B209: 世龙实业 | C209: 13 | D209: 12.87 | E209: 11.76 | F209: 10.57
A210: 603331.SH | B210: 百达精工 | C210: 13 | D210: 12.68 | E210: 12.32 | F210: 11.82
A211: 600506.SH | B211: *ST香梨 | C211: 12.83 | D211: 11.47 | E211: 11.14 | F211: 10.43
A212: 603818.SH | B212: 曲美家居 | C212: 12.76 | D212: 12.21 | E212: 11.08 | F212: 10.73
A213: 600138.SH | B213: 中青旅 | C213: 12.71 | D213: 11.87 | E213: 10.78 | F213: 10.64
A214: 600123.SH | B214: 兰花科创 | C214: 12.67 | D214: 11.57 | E214: 10.91 | F214: 10.300000000000001
A215: 002166.SZ | B215: 莱茵生物 | C215: 12.55 | D215: 9.06 | E215: 8.8000000000000007 | F215: 8.56
A216: 000524.SZ | B216: 岭南控股 | C216: 12.54 | D216: 9.77 | E216: 7.93 | F216: 7.73
A217: 002100.SZ | B217: 天康生物 | C217: 12.48 | D217: 11.51 | E217: 9.93 | F217: 9.51
A218: 000983.SZ | B218: 山西焦煤 | C218: 12.35 | D218: 10.47 | E218: 10.11 | F218: 9.55
A219: 600097.SH | B219: 开创国际 | C219: 12.31 | D219: 11.6 | E219: 10.96 | F219: 10.49
A220: 002830.SZ | B220: 名雕股份 | C220: 12.13 | D220: 11.82 | E220: 10.65 | F220: 10.38
A221: 603598.SH | B221: 引力传媒 | C221: 12.12 | D221: 11.97 | E221: 10.23 | F221: 10.17
A222: 000628.SZ | B222: 高新发展 | C222: 12.05 | D222: 10.76 | E222: 9.81 | F222: 9.38
A223: 603500.SH | B223: 祥和实业 | C223: 11.99 | D223: 9.53 | E223: 9.36 | F223: 9.36
A224: 002135.SZ | B224: 东南网架 | C224: 11.98 | D224: 11.21 | E224: 10.66 | F224: 9.9000000000000004
A225: 600479.SH | B225: 千金药业 | C225: 11.88 | D225: 11.62 | E225: 10.32 | F225: 9.87
A226: 002809.SZ | B226: 红墙股份 | C226: 11.69 | D226: 10.77 | E226: 10.58 | F226: 10.47
A227: 600481.SH | B227: 双良节能 | C227: 11.66 | D227: 11.46 | E227: 11.23 | F227: 10.28
A228: 600865.SH | B228: 百大集团 | C228: 11.65 | D228: 10.26 | E228: 9.06 | F228: 8.82
A229: 002537.SZ | B229: 海联金汇 | C229: 11.64 | D229: 9.53 | E229: 7.2999999999999998 | F229: 6.86
A230: 600422.SH | B230: 昆药集团 | C230: 11.64 | D230: 10.98 | E230: 9.83 | F230: 9.73
A231: 600373.SH | B231: 中文传媒 | C231: 11.62 | D231: 11.61 | E231: 11.29 | F231: 10.99
A232: 002205.SZ | B232: 国统股份 | C232: 11.5 | D232: 8.87 | E232: 7.95 | F232: 7.77
A233: 603558.SH | B233: 健盛集团 | C233: 11.5 | D233: 11.19 | E233: 10.94 | F233: 10.33
A234: 000707.SZ | B234: 双环科技 | C234: 11.49 | D234: 9.25 | E234: 8.34 | F234: 7.39
A235: 600054.SH | B235: 黄山旅游 | C235: 11.45 | D235: 10.72 | E235: 9.82 | F235: 9.69
A236: 601899.SH | B236: 紫金矿业 | C236: 11.45 | D236: 10.87 | E236: 10.61 | F236: 10.51
A237: 002826.SZ | B237: 易明医药 | C237: 11.37 | D237: 10.73 | E237: 9.88 | F237: 9.62
A238: 002068.SZ | B238: 黑猫股份 | C238: 11.29 | D238: 10.61 | E238: 8.97 | F238: 8.57
A239: 002246.SZ | B239: 北化股份 | C239: 11.19 | D239: 10.25 | E239: 8.54 | F239: 8.21
A240: 300229.SZ | B240: 拓尔思 | C240: 11.18 | D240: 11.11 | E240: 10.300000000000001 | F240: 10.12
A241: 002159.SZ | B241: 三特索道 | C241: 11.15 | D241: 11.13 | E241: 11.03 | F241: 10.97
A242: 002545.SZ | B242: 东方铁塔 | C242: 11.14 | D242: 10.59 | E242: 9.42 | F242: 9.08
A243: 000505.SZ | B243: 京粮控股 | C243: 11.12 | D243: 8.05 | E243: 7.44 | F243: 7.35
A244: 000788.SZ | B244: 北大医药 | C244: 11.1 | D244: 8.66 | E244: 7.32 | F244: 7.22
A245: 600510.SH | B245: 黑牡丹 | C245: 11 | D245: 10.87 | E245: 8.93 | F245: 8.49
A246: 600975.SH | B246: 新五丰 | C246: 10.99 | D246: 8.17 | E246: 7.14 | F246: 6.94
A247: 002134.SZ | B247: 天津普林 | C247: 10.87 | D247: 10.57 | E247: 9.66 | F247: 9.31
A248: 002567.SZ | B248: 唐人神 | C248: 10.79 | D248: 9.0999999999999996 | E248: 7.41 | F248: 7.13
A249: 002871.SZ | B249: 伟隆股份 | C249: 10.79 | D249: 10.6 | E249: 10.23 | F249: 10.07
A250: 600078.SH | B250: *ST澄星 | C250: 10.77 | D250: 8.86 | E250: 8.1999999999999993 | F250: 6.92
A251: 600833.SH | B251: 第一医药 | C251: 10.62 | D251: 10.4 | E251: 9.23 | F251: 9.12
A252: 000796.SZ | B252: 凯撒旅业 | C252: 10.61 | D252: 9.49 | E252: 8.25 | F252: 8.24
A253: 603333.SH | B253: 尚纬股份 | C253: 10.59 | D253: 9.4000000000000004 | E253: 8.47 | F253: 7.92
A254: 300387.SZ | B254: 富邦股份 | C254: 10.58 | D254: 9.01 | E254: 7.37 | F254: 7.19
A255: 600388.SH | B255: 龙净环保 | C255: 10.52 | D255: 9.23 | E255: 8.81 | F255: 8.74
A256: 000666.SZ | B256: 经纬纺机 | C256: 10.49 | D256: 8.98 | E256: 8.68 | F256: 8.52
A257: 002038.SZ | B257: 双鹭药业 | C257: 10.49 | D257: 10.25 | E257: 10.11 | F257: 10.08
A258: 002644.SZ | B258: 佛慈制药 | C258: 10.48 | D258: 10.39 | E258: 8.57 | F258: 8.5
A259: 600064.SH | B259: 南京高科 | C259: 10.48 | D259: 9.58 | E259: 9.31 | F259: 9.1999999999999993
A260: 000665.SZ | B260: 湖北广电 | C260: 10.43 | D260: 8.11 | E260: 5.64 | F260: 5.19
A261: 300086.SZ | B261: 康芝药业 | C261: 10.38 | D261: 8.33 | E261: 6.49 | F261: 6.29
A262: 002208.SZ | B262: 合肥城建 | C262: 10.32 | D262: 8.52 | E262: 8.06 | F262: 7.97
A263: 603676.SH | B263: 卫信康 | C263: 10.31 | D263: 9.83 | E263: 9.05 | F263: 8.76
A264: 002144.SZ | B264: 宏达高科 | C264: 10.300000000000001 | D264: 10.04 | E264: 9.9000000000000004 | F264: 9.78
A265: 002584.SZ | B265: 西陇科学 | C265: 10.23 | D265: 9.95 | E265: 8.27 | F265: 7.75
A266: 600083.SH | B266: *ST博信 | C266: 10.16 | D266: 8.94 | E266: 6.81 | F266: 6.58
A267: 603058.SH | B267: 永吉股份 | C267: 10.01 | D267: 8.19 | E267: 7.96 | F267: 7.64
A268: 300654.SZ | B268: 世纪天鸿 | C268: 10 | D268: 8.79 | E268: 8.28 | F268: 8.25
A269: 603289.SH | B269: 泰瑞机器 | C269: 9.98 | D269: 9.45 | E269: 9.45 | F269: 9.42
A270: 601811.SH | B270: 新华文轩 | C270: 9.88 | D270: 9.13 | E270: 8.9000000000000004 | F270: 8.83
A271: 601098.SH | B271: 中南传媒 | C271: 9.87 | D271: 9.66 | E271: 9.23 | F271: 9.08
A272: 601111.SH | B272: 中国国航 | C272: 9.83 | D272: 9.8000000000000007 | E272: 8.74 | F272: 8.41
A273: 000151.SZ | B273: 中成股份 | C273: 9.8000000000000007 | D273: 8.68 | E273: 8.3000000000000007 | F273: 8.07
A274: 603966.SH | B274: 法兰泰克 | C274: 9.8000000000000007 | D274: 9.02 | E274: 9.02 | F274: 8.8000000000000007
A275: 603168.SH | B275: 莎普爱思 | C275: 9.75 | D275: 9.71 | E275: 9.58 | F275: 9.56
A276: 603963.SH | B276: 大理药业 | C276: 9.6999999999999993 | D276: 9 | E276: 7.91 | F276: 7.82
A277: 002116.SZ | B277: 中国海诚 | C277: 9.67 | D277: 9.04 | E277: 7.45 | F277: 7.11
A278: 002200.SZ | B278: ST云投 | C278: 9.63 | D278: 8.28 | E278: 7.7999999999999998 | F278: 7.19
A279: 603616.SH | B279: 韩建河山 | C279: 9.63 | D279: 9.04 | E279: 7 | F279: 6.63
A280: 600962.SH | B280: 国投中鲁 | C280: 9.61 | D280: 9.4000000000000004 | E280: 9.23 | F280: 8.81
A281: 000590.SZ | B281: 启迪药业 | C281: 9.59 | D281: 9.32 | E281: 8.85 | F281: 8.81
A282: 002746.SZ | B282: 仙坛股份 | C282: 9.57 | D282: 9.41 | E282: 8.04 | F282: 7.72
A283: 600551.SH | B283: 时代出版 | C283: 9.55 | D283: 8.56 | E283: 7.85 | F283: 7.7000000000000002
A284: 600513.SH | B284: 联环药业 | C284: 9.53 | D284: 9.07 | E284: 8.86 | F284: 8.84
A285: 002566.SZ | B285: 益盛药业 | C285: 9.52 | D285: 8.68 | E285: 8.27 | F285: 8.12
A286: 600671.SH | B286: ST目药 | C286: 9.51 | D286: 9.18 | E286: 9 | F286: 8.97
A287: 600605.SH | B287: 汇通能源 | C287: 9.5 | D287: 8.87 | E287: 8.64 | F287: 8.51
A288: 000029.SZ | B288: 深深房A | C288: 9.49 | D288: 7.85 | E288: 7.46 | F288: 7.4000000000000004
A289: 002774.SZ | B289: 快意电梯 | C289: 9.48 | D289: 9.35 | E289: 8.95 | F289: 8.39
A290: 000683.SZ | B290: 远兴能源 | C290: 9.44 | D290: 9.19 | E290: 8.82 | F290: 8.19
A291: 002020.SZ | B291: 京新药业 | C291: 9.4000000000000004 | D291: 8.82 | E291: 8.64 | F291: 8.55
A292: 603863.SH | B292: ST松炀 | C292: 9.38 | D292: 9.02 | E292: 8.67 | F292: 8.53
A293: 002811.SZ | B293: 郑中设计 | C293: 9.37 | D293: 9.25 | E293: 8.68 | F293: 8.49
A294: 600099.SH | B294: 林海股份 | C294: 9.34 | D294: 8.82 | E294: 8.02 | F294: 7.68
A295: 000065.SZ | B295: 北方国际 | C295: 9.32 | D295: 9.07 | E295: 8.44 | F295: 8.26
A296: 002330.SZ | B296: 得利斯 | C296: 9.32 | D296: 8.92 | E296: 7.05 | F296: 6.67
A297: 000838.SZ | B297: 财信发展 | C297: 9.27 | D297: 8.14 | E297: 5.51 | F297: 4.83
A298: 600128.SH | B298: 弘业股份 | C298: 9.23 | D298: 8.15 | E298: 7.38 | F298: 7.22
A299: 000722.SZ | B299: 湖南发展 | C299: 9.22 | D299: 8.31 | E299: 7.92 | F299: 7.65
A300: 600463.SH | B300: 空港股份 | C300: 9.21 | D300: 8.65 | E300: 7.24 | F300: 6.94
A301: 002633.SZ | B301: 申科股份 | C301: 9.1999999999999993 | D301: 9.01 | E301: 8.22 | F301: 8.01
A302: 002014.SZ | B302: 永新股份 | C302: 9.15 | D302: 8.85 | E302: 8.44 | F302: 8.44
A303: 002060.SZ | B303: 粤水电 | C303: 9.0999999999999996 | D303: 5.82 | E303: 5.31 | F303: 4.88
A304: 600873.SH | B304: 梅花生物 | C304: 9.0999999999999996 | D304: 8.13 | E304: 7.2999999999999998 | F304: 6.91
A305: 603648.SH | B305: 畅联股份 | C305: 9.06 | D305: 8.89 | E305: 8.5 | F305: 8.37
A306: 600721.SH | B306: *ST百花 | C306: 9.05 | D306: 7.87 | E306: 7.11 | F306: 6.5
A307: 000965.SZ | B307: 天保基建 | C307: 8.95 | D307: 3.7000000000000002 | E307: 2.87 | F307: 2.78
A308: 600057.SH | B308: 厦门象屿 | C308: 8.93 | D308: 8.4000000000000004 | E308: 8.12 | F308: 7.81
A309: 601858.SH | B309: 中国科传 | C309: 8.92 | D309: 8.76 | E309: 8.55 | F309: 8.54
A310: 603488.SH | B310: 展鹏科技 | C310: 8.91 | D310: 8.76 | E310: 8.33 | F310: 8.04
A311: 300058.SZ | B311: 蓝色光标 | C311: 8.88 | D311: 8.48 | E311: 7.65 | F311: 7.22
A312: 002124.SZ | B312: 天邦股份 | C312: 8.87 | D312: 6.85 | E312: 6.46 | F312: 6.44
A313: 002057.SZ | B313: 中钢天源 | C313: 8.79 | D313: 8.56 | E313: 8.46 | F313: 8.1999999999999993
A314: 000705.SZ | B314: 浙江震元 | C314: 8.77 | D314: 8.44 | E314: 7.91 | F314: 7.74
A315: 601900.SH | B315: 南方传媒 | C315: 8.73 | D315: 8.26 | E315: 7.83 | F315: 7.7000000000000002
A316: 600113.SH | B316: 浙江东日 | C316: 8.71 | D316: 8.1999999999999993 | E316: 6.82 | F316: 6.5999999999999996
A317: 600507.SH | B317: 方大特钢 | C317: 8.69 | D317: 8.25 | E317: 7.97 | F317: 7.77
A318: 002302.SZ | B318: 西部建设 | C318: 8.66 | D318: 8.36 | E318: 8.08 | F318: 8.06
A319: 002788.SZ | B319: 鹭燕医药 | C319: 8.62 | D319: 8.14 | E319: 7.69 | F319: 7.65
A320: 600826.SH | B320: 兰生股份 | C320: 8.5999999999999996 | D320: 8.49 | E320: 8.43 | F320: 8.35
A321: 000719.SZ | B321: 中原传媒 | C321: 8.55 | D321: 8.12 | E321: 7.53 | F321: 7.28
A322: 002187.SZ | B322: 广百股份 | C322: 8.54 | D322: 8.47 | E322: 8.08 | F322: 7.97
A323: 000875.SZ | B323: 吉电股份 | C323: 8.53 | D323: 8.48 | E323: 7.7000000000000002 | F323: 7.11
A324: 600615.SH | B324: *ST丰华 | C324: 8.53 | D324: 8.31 | E324: 7.88 | F324: 7.77
A325: 600769.SH | B325: 祥龙电业 | C325: 8.53 | D325: 7.62 | E325: 6.42 | F325: 6.25
A326: 000498.SZ | B326: 山东路桥 | C326: 8.43 | D326: 8.34 | E326: 7.12 | F326: 6.7999999999999998
A327: 600657.SH | B327: 信达地产 | C327: 8.43 | D327: 4.45 | E327: 3.78 | F327: 3.69
A328: 000056.SZ | B328: 皇庭国际 | C328: 8.42 | D328: 7.86 | E328: 5.41 | F328: 4.81
A329: 600539.SH | B329: 狮头股份 | C329: 8.34 | D329: 8.09 | E329: 7.46 | F329: 7.38
A330: 300039.SZ | B330: 上海凯宝 | C330: 8.33 | D330: 7.63 | E330: 5.88 | F330: 5.66
A331: 600996.SH | B331: 贵广网络 | C331: 8.33 | D331: 8.01 | E331: 5.88 | F331: 5.61
A332: 600335.SH | B332: 国机汽车 | C332: 8.3000000000000007 | D332: 7.85 | E332: 7.24 | F332: 6.77
A333: 600080.SH | B333: 金花股份 | C333: 8.28 | D333: 7.92 | E333: 7.66 | F333: 7.51
A334: 600256.SH | B334: 广汇能源 | C334: 8.26 | D334: 7.05 | E334: 6.89 | F334: 6.11
A335: 601928.SH | B335: 凤凰传媒 | C335: 8.25 | D335: 7.79 | E335: 7.4000000000000004 | F335: 7.23
A336: 603569.SH | B336: 长久物流 | C336: 8.23 | D336: 8.08 | E336: 7.28 | F336: 7.22
A337: 000919.SZ | B337: 金陵药业 | C337: 8.19 | D337: 7.39 | E337: 7.12 | F337: 7.09
A338: 000525.SZ | B338: ST红太阳 | C338: 8.17 | D338: 7.92 | E338: 6.96 | F338: 6.22
A339: 002051.SZ | B339: 中工国际 | C339: 8.17 | D339: 7.83 | E339: 7.25 | F339: 7.03
A340: 600602.SH | B340: 云赛智联 | C340: 8.16 | D340: 7.68 | E340: 6.59 | F340: 6.34
A341: 000905.SZ | B341: 厦门港务 | C341: 8.14 | D341: 7.51 | E341: 7.2000000000000002 | F341: 7.04
A342: 002427.SZ | B342: ST尤夫 | C342: 8.13 | D342: 6.58 | E342: 6 | F342: 5.96
A343: 002548.SZ | B343: 金新农 | C343: 8.12 | D343: 7.0999999999999996 | E343: 6.16 | F343: 6
A344: 600770.SH | B344: 综艺股份 | C344: 8.0999999999999996 | D344: 6.76 | E344: 6.42 | F344: 6.39
A345: 600802.SH | B345: 福建水泥 | C345: 8.07 | D345: 7.49 | E345: 7.45 | F345: 7.33
A346: 000888.SZ | B346: 峨眉山A | C346: 8.03 | D346: 7.49 | E346: 6.71 | F346: 6.58
A347: 600313.SH | B347: 农发种业 | C347: 8 | D347: 5.59 | E347: 5.27 | F347: 5.13
A348: 601128.SH | B348: 常熟银行 | C348: 8 | D348: 7.46 | E348: 6.97 | F348: 6.7999999999999998
A349: 600012.SH | B349: 皖通高速 | C349: 7.99 | D349: 7.64 | E349: 6.91 | F349: 6.71
A350: 601985.SH | B350: 中国核电 | C350: 7.99 | D350: 7.55 | E350: 7.07 | F350: 6.53
A351: 600051.SH | B351: 宁波联合 | C351: 7.96 | D351: 7.91 | E351: 7.17 | F351: 7.03
A352: 600969.SH | B352: 郴电国际 | C352: 7.95 | D352: 7.4000000000000004 | E352: 7.37 | F352: 7.16
A353: 000429.SZ | B353: 粤高速A | C353: 7.91 | D353: 7.61 | E353: 7.32 | F353: 7.21
A354: 600629.SH | B354: 华建集团 | C354: 7.91 | D354: 7.37 | E354: 6.56 | F354: 6.38
A355: 603226.SH | B355: 菲林格尔 | C355: 7.9000000000000004 | D355: 7.14 | E355: 7.11 | F355: 7
A356: 000909.SZ | B356: 数源科技 | C356: 7.79 | D356: 7.64 | E356: 7.31 | F356: 7.23
A357: 600351.SH | B357: 亚宝药业 | C357: 7.79 | D357: 7.59 | E357: 7.43 | F357: 7.01
A358: 600689.SH | B358: 上海三毛 | C358: 7.79 | D358: 7.7000000000000002 | E358: 7.12 | F358: 7
A359: 600814.SH | B359: 杭州解百 | C359: 7.77 | D359: 7.26 | E359: 6.57 | F359: 6.55
A360: 600692.SH | B360: 亚通股份 | C360: 7.72 | D360: 6.65 | E360: 6.08 | F360: 6.04
A361: 601007.SH | B361: 金陵饭店 | C361: 7.68 | D361: 6.84 | E361: 6.08 | F361: 6.05
A362: 600874.SH | B362: 创业环保 | C362: 7.64 | D362: 6.91 | E362: 6.63 | F362: 6.48
A363: 600168.SH | B363: 武汉控股 | C363: 7.62 | D363: 7.08 | E363: 6.82 | F363: 6.76
A364: 002707.SZ | B364: 众信旅游 | C364: 7.61 | D364: 6.91 | E364: 5.7999999999999998 | F364: 5.67
A365: 300026.SZ | B365: 红日药业 | C365: 7.61 | D365: 6.96 | E365: 5.54 | F365: 5.25
A366: 600894.SH | B366: 广日股份 | C366: 7.57 | D366: 7.31 | E366: 7.13 | F366: 7.02
A367: 002561.SZ | B367: 徐家汇 | C367: 7.55 | D367: 7.24 | E367: 7.0999999999999996 | F367: 7.08
A368: 300279.SZ | B368: 和晶科技 | C368: 7.51 | D368: 7.48 | E368: 7.02 | F368: 6.98
A369: 000937.SZ | B369: 冀中能源 | C369: 7.47 | D369: 6.47 | E369: 6.32 | F369: 5.66
A370: 300528.SZ | B370: 幸福蓝海 | C370: 7.47 | D370: 6.7000000000000002 | E370: 6.13 | F370: 6.07
A371: 300299.SZ | B371: 富春股份 | C371: 7.44 | D371: 6.02 | E371: 5.55 | F371: 5.54
A372: 600594.SH | B372: 益佰制药 | C372: 7.44 | D372: 6.89 | E372: 6.52 | F372: 6.29
A373: 600784.SH | B373: 鲁银投资 | C373: 7.39 | D373: 6.09 | E373: 6.06 | F373: 5.81
A374: 603227.SH | B374: 雪峰科技 | C374: 7.37 | D374: 6.5999999999999996 | E374: 6.27 | F374: 6.03
A375: 300289.SZ | B375: 利德曼 | C375: 7.33 | D375: 7.33 | E375: 7.22 | F375: 7.0999999999999996
A376: 603316.SH | B376: 诚邦股份 | C376: 7.32 | D376: 7.2000000000000002 | E376: 5.87 | F376: 5.74
A377: 002613.SZ | B377: 北玻股份 | C377: 7.31 | D377: 4.82 | E377: 4.01 | F377: 3.89
A378: 836263.BJ | B378: 中航泰达 | C378: 7.2999999999999998 | D378: 7.04 | E378: 6.34 | F378: 6.02
A379: 600319.SH | B379: *ST亚星 | C379: 7.24 | D379: 6.43 | E379: 5.89 | F379: 5.77
A380: 600358.SH | B380: 国旅联合 | C380: 7.17 | D380: 6.37 | E380: 4.87 | F380: 4.53
A381: 600829.SH | B381: 人民同泰 | C381: 7.17 | D381: 6.52 | E381: 6.25 | F381: 6.13
A382: 600101.SH | B382: 明星电力 | C382: 7.16 | D382: 7.08 | E382: 6.95 | F382: 6.56
A383: 002033.SZ | B383: 丽江股份 | C383: 7.13 | D383: 6.62 | E383: 6.19 | F383: 6.16
A384: 600838.SH | B384: 上海九百 | C384: 7.13 | D384: 6.59 | E384: 6.21 | F384: 6.16
A385: 002336.SZ | B385: 人人乐 | C385: 7.12 | D385: 6.57 | E385: 5.28 | F385: 5.08
A386: 000953.SZ | B386: 河化股份 | C386: 7.09 | D386: 6.86 | E386: 5.52 | F386: 5.36
A387: 002244.SZ | B387: 滨江集团 | C387: 7.07 | D387: 6.38 | E387: 5.06 | F387: 4.84 | G387: 3.77 | H387: 7.1 | I387: 6.32 | J387: =(C387-G387)/G387 -> 0.87533156498673748 | K387: =(H387-C387)/H387 -> 4.2253521126759666e-03 | L387: =(H387-I387)/I387 -> 0.12341772151898724 | O387: 5.46 | P387: 7.1 | Q387: 6.52 | AA387: =(H387-O387)/H387 -> 0.23098591549295772 | AB387: =(P387-Q387)/P387 -> 8.1690140845070439e-02
A388: 600965.SH | B388: 福成股份 | C388: 7.07 | D388: 6.87 | E388: 6.64 | F388: 6.44
A389: 002098.SZ | B389: 浔兴股份 | C389: 7.06 | D389: 6.74 | E389: 6.61 | F389: 6.5
A390: 002059.SZ | B390: 云南旅游 | C390: 7.03 | D390: 6.84 | E390: 5.78 | F390: 5.63
A391: 002412.SZ | B391: 汉森制药 | C391: 7.02 | D391: 6.75 | E391: 6.0999999999999996 | F391: 6.08
A392: 000529.SZ | B392: 广弘控股 | C392: 7 | D392: 6.16 | E392: 5.94 | F392: 5.78
A393: 600177.SH | B393: 雅戈尔 | C393: 6.91 | D393: 6.74 | E393: 6.66 | F393: 6.64
A394: 600986.SH | B394: 浙文互联 | C394: 6.91 | D394: 6.31 | E394: 5.53 | F394: 5.19
A395: 000514.SZ | B395: 渝开发 | C395: 6.9000000000000004 | D395: 4.16 | E395: 3.62 | F395: 3.53
A396: 002040.SZ | B396: 南京港 | C396: 6.9000000000000004 | D396: 6.38 | E396: 6.16 | F396: 6.09
A397: 601006.SH | B397: 大秦铁路 | C397: 6.88 | D397: 6.77 | E397: 6.44 | F397: 6.33
A398: 000430.SZ | B398: 张家界 | C398: 6.87 | D398: 6.33 | E398: 5.7999999999999998 | F398: 5.66
A399: 002822.SZ | B399: 中装建设 | C399: 6.87 | D399: 6.44 | E399: 5.7999999999999998 | F399: 5.74
A400: 300004.SZ | B400: 南风股份 | C400: 6.87 | D400: 6.58 | E400: 6.56 | F400: 6.38
A401: 002877.SZ | B401: 智能自控 | C401: 6.85 | D401: 6.75 | E401: 6.63 | F401: 6.5999999999999996
A402: 600376.SH | B402: 首开股份 | C402: 6.83 | D402: 5.73 | E402: 5.4000000000000004 | F402: 5.32
A403: 000090.SZ | B403: 天健集团 | C403: 6.81 | D403: 6.32 | E403: 5.75 | F403: 5.65
A404: 600678.SH | B404: 四川金顶 | C404: 6.81 | D404: 6.31 | E404: 6.0999999999999996 | F404: 6
A405: 300094.SZ | B405: 国联水产 | C405: 6.75 | D405: 6.42 | E405: 5.05 | F405: 4.83
A406: 600107.SH | B406: 美尔雅 | C406: 6.73 | D406: 6.19 | E406: 6.05 | F406: 6.05
A407: 601789.SH | B407: 宁波建工 | C407: 6.73 | D407: 6.31 | E407: 4.59 | F407: 4.34
A408: 002215.SZ | B408: 诺普信 | C408: 6.72 | D408: 6.26 | E408: 6.0999999999999996 | F408: 5.92
A409: 600831.SH | B409: 广电网络 | C409: 6.72 | D409: 6.43 | E409: 5.85 | F409: 5.7999999999999998
A410: 000605.SZ | B410: 渤海股份 | C410: 6.7000000000000002 | D410: 5.98 | E410: 5.55 | F410: 5.46
A411: 600804.SH | B411: 鹏博士 | C411: 6.7000000000000002 | D411: 6.37 | E411: 6.29 | F411: 5.92
A412: 000978.SZ | B412: 桂林旅游 | C412: 6.69 | D412: 6.31 | E412: 5.7000000000000002 | F412: 5.64
A413: 603183.SH | B413: 建研院 | C413: 6.69 | D413: 6.39 | E413: 5.88 | F413: 5.7999999999999998
A414: 000510.SZ | B414: 新金路 | C414: 6.68 | D414: 6.67 | E414: 6.34 | F414: 6.09
A415: 600613.SH | B415: 神奇制药 | C415: 6.68 | D415: 6.21 | E415: 5.69 | F415: 5.59
A416: 600836.SH | B416: 上海易连 | C416: 6.65 | D416: 6.45 | E416: 6.4000000000000004 | F416: 6.38
A417: 002061.SZ | B417: 浙江交科 | C417: 6.63 | D417: 6.43 | E417: 5.74 | F417: 5.59
A418: 601199.SH | B418: 江南水务 | C418: 6.59 | D418: 6.36 | E418: 5.37 | F418: 4.95
A419: 600766.SH | B419: *ST园城 | C419: 6.58 | D419: 5.17 | E419: 4.82 | F419: 4.7000000000000002
A420: 600830.SH | B420: 香溢融通 | C420: 6.58 | D420: 5.89 | E420: 5.35 | F420: 5.24
A421: 002588.SZ | B421: 史丹利 | C421: 6.57 | D421: 6.12 | E421: 6.03 | F421: 5.91
A422: 600736.SH | B422: 苏州高新 | C422: 6.57 | D422: 5.23 | E422: 4.67 | F422: 4.63
A423: 601019.SH | B423: 山东出版 | C423: 6.57 | D423: 6.29 | E423: 6.08 | F423: 5.94
A424: 000007.SZ | B424: *ST全新 | C424: 6.56 | D424: 6.44 | E424: 5.49 | F424: 5.16
A425: 600026.SH | B425: 中远海能 | C425: 6.53 | D425: 5.95 | E425: 5.89 | F425: 5.85
A426: 600387.SH | B426: ST海越 | C426: 6.51 | D426: 6.43 | E426: 5.87 | F426: 5.59
A427: 002193.SZ | B427: 如意集团 | C427: 6.5 | D427: 6.0999999999999996 | E427: 6.05 | F427: 5.98
A428: 002839.SZ | B428: 张家港行 | C428: 6.48 | D428: 6.27 | E428: 5.99 | F428: 5.86
A429: 002188.SZ | B429: *ST巴士 | C429: 6.46 | D429: 6.02 | E429: 4.41 | F429: 4.22
A430: 600638.SH | B430: 新黄浦 | C430: 6.45 | D430: 5.5999999999999996 | E430: 5.42 | F430: 5.38
A431: 300032.SZ | B431: 金龙机电 | C431: 6.43 | D431: 6.28 | E431: 6.25 | F431: 5.93
A432: 600866.SH | B432: 星湖科技 | C432: 6.42 | D432: 6.08 | E432: 4.85 | F432: 4.61
A433: 601158.SH | B433: 重庆水务 | C433: 6.42 | D433: 6.0999999999999996 | E433: 6.08 | F433: 5.88
A434: 002370.SZ | B434: 亚太药业 | C434: 6.41 | D434: 6.24 | E434: 5.07 | F434: 4.96
A435: 002492.SZ | B435: 恒基达鑫 | C435: 6.36 | D435: 6.03 | E435: 5.79 | F435: 5.76
A436: 300182.SZ | B436: 捷成股份 | C436: 6.34 | D436: 6.25 | E436: 5.42 | F436: 5.25
A437: 603999.SH | B437: 读者传媒 | C437: 6.33 | D437: 5.7000000000000002 | E437: 5.28 | F437: 5.25
A438: 601700.SH | B438: 风范股份 | C438: 6.2999999999999998 | D438: 5.49 | E438: 5.15 | F438: 4.92
A439: 600576.SH | B439: 祥源文化 | C439: 6.29 | D439: 6.01 | E439: 5.39 | F439: 5.28
A440: 600757.SH | B440: 长江传媒 | C440: 6.29 | D440: 5.74 | E440: 5.46 | F440: 5.41
A441: 002699.SZ | B441: 美盛文化 | C441: 6.23 | D441: 5.52 | E441: 5.24 | F441: 5.06
A442: 600082.SH | B442: 海泰发展 | C442: 6.15 | D442: 3.43 | E442: 3.07 | F442: 3
A443: 002178.SZ | B443: 延华智能 | C443: 6.14 | D443: 5.87 | E443: 4.63 | F443: 4.36
A444: 600550.SH | B444: 保变电气 | C444: 6.12 | D444: 5.38 | E444: 5.19 | F444: 4.95
A445: 000619.SZ | B445: 海螺型材 | C445: 6.08 | D445: 5.72 | E445: 5.34 | F445: 5.29
A446: 600493.SH | B446: 凤竹纺织 | C446: 6.08 | D446: 5.9000000000000004 | E446: 5.69 | F446: 5.46
A447: 002696.SZ | B447: 百洋股份 | C447: 6.07 | D447: 5.89 | E447: 5.47 | F447: 5.35
A448: 300167.SZ | B448: 迪威迅 | C448: 6.04 | D448: 5.88 | E448: 5.71 | F448: 5.69
A449: 600149.SH | B449: 廊坊发展 | C449: 6.03 | D449: 5.44 | E449: 5.11 | F449: 5.09
A450: 600018.SH | B450: 上港集团 | C450: 6.02 | D450: 5.72 | E450: 5.59 | F450: 5.42
A451: 600908.SH | B451: 无锡银行 | C451: 5.99 | D451: 5.9000000000000004 | E451: 5.85 | F451: 5.7999999999999998
A452: 600277.SH | B452: 亿利洁能 | C452: 5.98 | D452: 5.92 | E452: 5.02 | F452: 4.44
A453: 000607.SZ | B453: 华媒控股 | C453: 5.93 | D453: 5.57 | E453: 4.55 | F453: 4.31
A454: 002148.SZ | B454: 北纬科技 | C454: 5.92 | D454: 5.83 | E454: 5.28 | F454: 5.09
A455: 002591.SZ | B455: 恒大高新 | C455: 5.92 | D455: 5.82 | E455: 5.51 | F455: 5.5
A456: 002363.SZ | B456: 隆基机械 | C456: 5.91 | D456: 5.67 | E456: 5.53 | F456: 5.38
A457: 600716.SH | B457: 凤凰股份 | C457: 5.9000000000000004 | D457: 4.74 | E457: 4.26 | F457: 4.2000000000000002
A458: 600232.SH | B458: 金鹰股份 | C458: 5.88 | D458: 5.73 | E458: 5.39 | F458: 5.32
A459: 600249.SH | B459: 两面针 | C459: 5.88 | D459: 5.36 | E459: 5.08 | F459: 5
A460: 300022.SZ | B460: 吉峰科技 | C460: 5.87 | D460: 5.7000000000000002 | E460: 5.0999999999999996 | F460: 5.01
A461: 600250.SH | B461: 南纺股份 | C461: 5.87 | D461: 5.62 | E461: 5.04 | F461: 4.95
A462: 000950.SZ | B462: 重药控股 | C462: 5.79 | D462: 5.31 | E462: 5.05 | F462: 5.03
A463: 600248.SH | B463: 陕西建工 | C463: 5.76 | D463: 5.75 | E463: 5.18 | F463: 5.02
A464: 600382.SH | B464: *ST广珠 | C464: 5.75 | D464: 5.57 | E464: 5.02 | F464: 4.81
A465: 600791.SH | B465: 京能置业 | C465: 5.75 | D465: 4.28 | E465: 3.84 | F465: 3.72
A466: 600561.SH | B466: 江西长运 | C466: 5.74 | D466: 5.72 | E466: 5.14 | F466: 4.9000000000000004
A467: 601002.SH | B467: 晋亿实业 | C467: 5.73 | D467: 5.34 | E467: 5.21 | F467: 5.11
A468: 000702.SZ | B468: 正虹科技 | C468: 5.67 | D468: 5.17 | E468: 4.86 | F468: 4.81
A469: 601368.SH | B469: 绿城水务 | C469: 5.66 | D469: 5.47 | E469: 5.26 | F469: 5.17
A470: 603843.SH | B470: 正平股份 | C470: 5.66 | D470: 5.28 | E470: 4.64 | F470: 4.45
A471: 000958.SZ | B471: 东方能源 | C471: 5.64 | D471: 5.06 | E471: 4.9000000000000004 | F471: 4.72
A472: 601658.SH | B472: 邮储银行 | C472: 5.64 | D472: 5.56 | E472: 5.36 | F472: 5.24
A473: 000638.SZ | B473: *ST万方 | C473: 5.61 | D473: 5.47 | E473: 5.12 | F473: 5.0999999999999996
A474: 600403.SH | B474: ST大有 | C474: 5.59 | D474: 4.81 | E474: 4.31 | F474: 4.12
A475: 600303.SH | B475: 曙光股份 | C475: 5.58 | D475: 4.95 | E475: 4.36 | F475: 4.26
A476: 002354.SZ | B476: 天娱数科 | C476: 5.56 | D476: 4.94 | E476: 4.16 | F476: 4.01
A477: 600982.SH | B477: 宁波能源 | C477: 5.56 | D477: 5.27 | E477: 4.56 | F477: 4.27
A478: 002691.SZ | B478: 冀凯股份 | C478: 5.54 | D478: 5.21 | E478: 4.87 | F478: 4.72
A479: 603323.SH | B479: 苏农银行 | C479: 5.53 | D479: 5.31 | E479: 5.15 | F479: 5
A480: 002671.SZ | B480: 龙泉股份 | C480: 5.51 | D480: 5.15 | E480: 4.48 | F480: 4.31
A481: 601668.SH | B481: 中国建筑 | C481: 5.51 | D481: 5.29 | E481: 5 | F481: 4.91
A482: 603389.SH | B482: 亚振家居 | C482: 5.51 | D482: 5.2999999999999998 | E482: 5.23 | F482: 5.09
A483: 600713.SH | B483: 南京医药 | C483: 5.47 | D483: 4.89 | E483: 4.65 | F483: 4.65
A484: 000782.SZ | B484: 美达股份 | C484: 5.46 | D484: 5.42 | E484: 5.33 | F484: 4.96
A485: 300172.SZ | B485: 中电环保 | C485: 5.45 | D485: 5.41 | E485: 5.35 | F485: 5.17
A486: 603021.SH | B486: 山东华鹏 | C486: 5.42 | D486: 5.28 | E486: 4.99 | F486: 4.98
A487: 000715.SZ | B487: 中兴商业 | C487: 5.38 | D487: 4.98 | E487: 4.7999999999999998 | F487: 4.78
A488: 600302.SH | B488: 标准股份 | C488: 5.34 | D488: 5.05 | E488: 4.7000000000000002 | F488: 4.57
A489: 601801.SH | B489: 皖新传媒 | C489: 5.32 | D489: 5.07 | E489: 4.9000000000000004 | F489: 4.82
A490: 603969.SH | B490: 银龙股份 | C490: 5.32 | D490: 4.97 | E490: 4.53 | F490: 4.39
A491: 002366.SZ | B491: 台海核电 | C491: 5.31 | D491: 5.0999999999999996 | E491: 4.71 | F491: 4.43
A492: 300051.SZ | B492: ST三五 | C492: 5.31 | D492: 5.25 | E492: 4.61 | F492: 4.2999999999999998
A493: 002307.SZ | B493: 北新路桥 | C493: 5.29 | D493: 4.77 | E493: 4.5999999999999996 | F493: 4.58
A494: 002476.SZ | B494: 宝莫股份 | C494: 5.26 | D494: 4.94 | E494: 4.7000000000000002 | F494: 4.51
A495: 600698.SH | B495: 湖南天雁 | C495: 5.25 | D495: 4.74 | E495: 4.16 | F495: 3.92
A496: 600939.SH | B496: 重庆建工 | C496: 5.24 | D496: 5.07 | E496: 4.13 | F496: 3.95
A497: 002587.SZ | B497: 奥拓电子 | C497: 5.2000000000000002 | D497: 4.94 | E497: 4.85 | F497: 4.84
A498: 000926.SZ | B498: 福星股份 | C498: 5.18 | D498: 4.42 | E498: 4.28 | F498: 4.27
A499: 002517.SZ | B499: 恺英网络 | C499: 5.15 | D499: 5.12 | E499: 4.95 | F499: 4.7999999999999998
A500: 300175.SZ | B500: 朗源股份 | C500: 5.13 | D500: 4.84 | E500: 4.7000000000000002 | F500: 4.62
A501: 002565.SZ | B501: 顺灏股份 | C501: 5.12 | D501: 4.83 | E501: 4.7000000000000002 | F501: 4.46
A502: 601328.SH | B502: 交通银行 | C502: 5.12 | D502: 4.87 | E502: 4.66 | F502: 4.61
A503: 002712.SZ | B503: 思美传媒 | C503: 5.11 | D503: 5.0999999999999996 | E503: 4.76 | F503: 4.73
A504: 600156.SH | B504: 华升股份 | C504: 5.08 | D504: 4.42 | E504: 4.12 | F504: 4.02
A505: 600658.SH | B505: 电子城 | C505: 5.08 | D505: 4.42 | E505: 4.25 | F505: 4.17
A506: 000637.SZ | B506: 茂化实华 | C506: 5.07 | D506: 5 | E506: 4.65 | F506: 4.5
A507: 000721.SZ | B507: 西安饮食 | C507: 5.07 | D507: 4.54 | E507: 4.14 | F507: 4.13
A508: 002693.SZ | B508: 双成药业 | C508: 5.06 | D508: 4.74 | E508: 4.46 | F508: 4.39
A509: 600212.SH | B509: 江泉实业 | C509: 5.06 | D509: 4.87 | E509: 4.29 | F509: 4.28
A510: 000778.SZ | B510: 新兴铸管 | C510: 5.05 | D510: 4.98 | E510: 4.43 | F510: 4.28
A511: 600502.SH | B511: 安徽建工 | C511: 4.98 | D511: 4.76 | E511: 4.25 | F511: 4.15
A512: 002682.SZ | B512: 龙洲股份 | C512: 4.97 | D512: 4.96 | E512: 4.53 | F512: 4.25
A513: 600778.SH | B513: 友好集团 | C513: 4.96 | D513: 4.67 | E513: 4.47 | F513: 4.4000000000000004
A514: 000031.SZ | B514: 大悦城 | C514: 4.91 | D514: 3.97 | E514: 3.67 | F514: 3.63
A515: 000632.SZ | B515: 三木集团 | C515: 4.91 | D515: 3.8999999999999999 | E515: 3.58 | F515: 3.56
A516: 600800.SH | B516: 渤海化学 | C516: 4.89 | D516: 4.71 | E516: 4.61 | F516: 4.57
A517: 603778.SH | B517: 乾景园林 | C517: 4.87 | D517: 4.45 | E517: 4.32 | F517: 4.24
A518: 600572.SH | B518: 康恩贝 | C518: 4.86 | D518: 4.64 | E518: 4.44 | F518: 4.43
A519: 002264.SZ | B519: 新华都 | C519: 4.85 | D519: 4.83 | E519: 4.69 | F519: 4.57
A520: 600488.SH | B520: 天药股份 | C520: 4.84 | D520: 4.56 | E520: 4.42 | F520: 4.41
A521: 600807.SH | B521: 济南高新 | C521: 4.84 | D521: 4.46 | E521: 3.78 | F521: 3.59
A522: 000404.SZ | B522: 长虹华意 | C522: 4.83 | D522: 4.53 | E522: 4.37 | F522: 4.23
A523: 000850.SZ | B523: 华茂股份 | C523: 4.82 | D523: 4.65 | E523: 4.35 | F523: 4.15
A524: 002467.SZ | B524: 二六三 | C524: 4.7999999999999998 | D524: 4.56 | E524: 4.33 | F524: 4.2999999999999998
A525: 002314.SZ | B525: 南山控股 | C525: 4.79 | D525: 3.94 | E525: 3.37 | F525: 3.32
A526: 000863.SZ | B526: 三湘印象 | C526: 4.77 | D526: 3.78 | E526: 3.39 | F526: 3.36
A527: 600279.SH | B527: 重庆港 | C527: 4.72 | D527: 4.09 | E527: 3.87 | F527: 3.7999999999999998
A528: 000548.SZ | B528: 湖南投资 | C528: 4.7000000000000002 | D528: 4.27 | E528: 3.99 | F528: 3.95
A529: 600077.SH | B529: 宋都股份 | C529: 4.7000000000000002 | D529: 3.81 | E529: 2.93 | F529: 2.82
A530: 600676.SH | B530: 交运股份 | C530: 4.7000000000000002 | D530: 4.49 | E530: 4.26 | F530: 4.25
A531: 002564.SZ | B531: 天沃科技 | C531: 4.68 | D531: 4.64 | E531: 4.53 | F531: 4.43
A532: 300292.SZ | B532: 吴通控股 | C532: 4.68 | D532: 4.66 | E532: 4.13 | F532: 4.07
A533: 600191.SH | B533: *ST华资 | C533: 4.67 | D533: 3.97 | E533: 3.73 | F533: 3.56
A534: 300276.SZ | B534: 三丰智能 | C534: 4.66 | D534: 4.28 | E534: 4.24 | F534: 4.18
A535: 002344.SZ | B535: 海宁皮城 | C535: 4.58 | D535: 4.55 | E535: 4.49 | F535: 4.36
A536: 600724.SH | B536: 宁波富达 | C536: 4.58 | D536: 4.16 | E536: 3.75 | F536: 3.66
A537: 601008.SH | B537: 连云港 | C537: 4.57 | D537: 4.01 | E537: 3.82 | F537: 3.76
A538: 000533.SZ | B538: 顺钠股份 | C538: 4.55 | D538: 3.7999999999999998 | E538: 3.72 | F538: 3.51
A539: 600530.SH | B539: 交大昂立 | C539: 4.54 | D539: 4.31 | E539: 3.93 | F539: 3.7999999999999998
A540: 600665.SH | B540: 天地源 | C540: 4.54 | D540: 3.54 | E540: 3.18 | F540: 3.1000000000000001
A541: 600717.SH | B541: 天津港 | C541: 4.51 | D541: 4.26 | E541: 4.17 | F541: 4.09
A542: 600300.SH | B542: ST维维 | C542: 4.46 | D542: 4.28 | E542: 3.87 | F542: 3.83
A543: 600533.SH | B543: 栖霞建设 | C543: 4.46 | D543: 3.48 | E543: 3.19 | F543: 3.16
A544: 600622.SH | B544: 光大嘉宝 | C544: 4.45 | D544: 3.28 | E544: 2.94 | F544: 2.94
A545: 000757.SZ | B545: 浩物股份 | C545: 4.44 | D545: 4.34 | E545: 4.31 | F545: 4.2000000000000002
A546: 002133.SZ | B546: 广宇集团 | C546: 4.44 | D546: 3.74 | E546: 3.27 | F546: 3.17
A547: 000679.SZ | B547: 大连友谊 | C547: 4.43 | D547: 4.17 | E547: 4.11 | F547: 4.08
A548: 002546.SZ | B548: 新联电子 | C548: 4.4000000000000004 | D548: 4.31 | E548: 4.07 | F548: 3.96
A549: 600028.SH | B549: 中国石化 | C549: 4.37 | D549: 4.28 | E549: 4.26 | F549: 4.2000000000000002
A550: 600423.SH | B550: 柳化股份 | C550: 4.37 | D550: 4.2000000000000002 | E550: 4 | F550: 3.94
A551: 000692.SZ | B551: 惠天热电 | C551: 4.32 | D551: 4.25 | E551: 3.92 | F551: 3.76
A552: 600368.SH | B552: 五洲交通 | C552: 4.2999999999999998 | D552: 4.03 | E552: 3.94 | F552: 3.85
A553: 000900.SZ | B553: 现代投资 | C553: 4.28 | D553: 4.2000000000000002 | E553: 4.2000000000000002 | F553: 4.16
A554: 000573.SZ | B554: 粤宏远A | C554: 4.26 | D554: 3.86 | E554: 3.37 | F554: 3.29
A555: 600094.SH | B555: 大名城 | C555: 4.25 | D555: 3.79 | E555: 3.68 | F555: 3.67
A556: 600425.SH | B556: 青松建化 | C556: 4.24 | D556: 3.96 | E556: 3.85 | F556: 3.78
A557: 600705.SH | B557: 中航产融 | C557: 4.22 | D557: 3.95 | E557: 3.93 | F557: 3.89
A558: 000428.SZ | B558: 华天酒店 | C558: 4.19 | D558: 3.75 | E558: 3.36 | F558: 3.21
A559: 002586.SZ | B559: *ST围海 | C559: 4.19 | D559: 3.53 | E559: 3.1000000000000001 | F559: 3
A560: 300266.SZ | B560: 兴源环境 | C560: 4.14 | D560: 4.04 | E560: 3.75 | F560: 3.74
A561: 601018.SH | B561: 宁波港 | C561: 4.12 | D561: 4.04 | E561: 3.95 | F561: 3.94
A562: 000552.SZ | B562: 靖远煤电 | C562: 4.0999999999999996 | D562: 3.88 | E562: 3.52 | F562: 3.35
A563: 600828.SH | B563: 茂业商业 | C563: 4.09 | D563: 3.73 | E563: 3.6000000000000001 | F563: 3.6000000000000001
A564: 601086.SH | B564: 国芳集团 | C564: 4.08 | D564: 3.97 | E564: 3.78 | F564: 3.66
A565: 002067.SZ | B565: 景兴纸业 | C565: 4.06 | D565: 3.95 | E565: 3.95 | F565: 3.88
A566: 002069.SZ | B566: 獐子岛 | C566: 4.05 | D566: 3.73 | E566: 3.27 | F566: 3.26
A567: 300247.SZ | B567: 融捷健康 | C567: 4.02 | D567: 3.97 | E567: 3.72 | F567: 3.62
A568: 300163.SZ | B568: 先锋新材 | C568: 4 | D568: 3.89 | E568: 3.82 | F568: 3.82
A569: 002628.SZ | B569: 成都路桥 | C569: 3.99 | D569: 3.88 | E569: 3.54 | F569: 3.49
A570: 600190.SH | B570: 锦州港 | C570: 3.99 | D570: 3.6000000000000001 | E570: 3.05 | F570: 2.98
A571: 600159.SH | B571: 大龙地产 | C571: 3.98 | D571: 3.21 | E571: 2.82 | F571: 2.72
A572: 000816.SZ | B572: 智慧农业 | C572: 3.97 | D572: 3.76 | E572: 3.68 | F572: 3.47
A573: 600512.SH | B573: 腾达建设 | C573: 3.95 | D573: 3.73 | E573: 3.42 | F573: 3.35
A574: 600495.SH | B574: 晋西车轴 | C574: 3.8999999999999999 | D574: 3.76 | E574: 3.7000000000000002 | F574: 3.67
A575: 600397.SH | B575: 安源煤业 | C575: 3.88 | D575: 3.31 | E575: 3.19 | F575: 3.09
A576: 000753.SZ | B576: 漳州发展 | C576: 3.87 | D576: 3.49 | E576: 3.16 | F576: 3.02
A577: 002047.SZ | B577: 宝鹰股份 | C577: 3.85 | D577: 3.63 | E577: 3.42 | F577: 3.37
A578: 600790.SH | B578: 轻纺城 | C578: 3.84 | D578: 3.59 | E578: 3.27 | F578: 3.21
A579: 600108.SH | B579: 亚盛集团 | C579: 3.81 | D579: 3.49 | E579: 3.44 | F579: 3.31
A580: 600853.SH | B580: 龙建股份 | C580: 3.7999999999999998 | D580: 3.39 | E580: 2.84 | F580: 2.74
A581: 000521.SZ | B581: 长虹美菱 | C581: 3.75 | D581: 3.5 | E581: 3.45 | F581: 3.43
A582: 002087.SZ | B582: 新野纺织 | C582: 3.74 | D582: 3.59 | E582: 3.5 | F582: 3.46
A583: 000078.SZ | B583: 海王生物 | C583: 3.69 | D583: 3.44 | E583: 3.2999999999999998 | F583: 3.29
A584: 000861.SZ | B584: 海印股份 | C584: 3.67 | D584: 3.13 | E584: 2.72 | F584: 2.55
A585: 002228.SZ | B585: 合兴包装 | C585: 3.67 | D585: 3.6000000000000001 | E585: 3.58 | F585: 3.57
A586: 002692.SZ | B586: ST远程 | C586: 3.66 | D586: 3.36 | E586: 3.17 | F586: 3.08
A587: 002689.SZ | B587: 远大智能 | C587: 3.64 | D587: 3.38 | E587: 3.22 | F587: 3.18
A588: 600981.SH | B588: 汇鸿集团 | C588: 3.63 | D588: 3.29 | E588: 2.97 | F588: 2.94
A589: 600269.SH | B589: 赣粤高速 | C589: 3.62 | D589: 3.52 | E589: 3.46 | F589: 3.43
A590: 002303.SZ | B590: 美盈森 | C590: 3.61 | D590: 3.58 | E590: 3.51 | F590: 3.48
A591: 600396.SH | B591: 金山股份 | C591: 3.55 | D591: 3.31 | E591: 2.94 | F591: 2.79
A592: 002305.SZ | B592: 南国置业 | C592: 3.53 | D592: 2.23 | E592: 2.04 | F592: 2.02
A593: 600448.SH | B593: 华纺股份 | C593: 3.53 | D593: 3.39 | E593: 3.28 | F593: 3.27
A594: 600355.SH | B594: 精伦电子 | C594: 3.5 | D594: 3.48 | E594: 3.23 | F594: 3.13
A595: 600675.SH | B595: 中华企业 | C595: 3.46 | D595: 3.11 | E595: 2.97 | F595: 2.95
A596: 600936.SH | B596: 广西广电 | C596: 3.46 | D596: 3.33 | E596: 2.96 | F596: 2.92
A597: 601010.SH | B597: 文峰股份 | C597: 3.42 | D597: 3.25 | E597: 3.19 | F597: 3.17
A598: 600035.SH | B598: 楚天高速 | C598: 3.39 | D598: 3.24 | E598: 3.13 | F598: 3.07
A599: 000732.SZ | B599: 泰禾集团 | C599: 3.36 | D599: 2.81 | E599: 2.37 | F599: 2.32
A600: 600575.SH | B600: 淮河能源 | C600: 3.36 | D600: 2.95 | E600: 2.55 | F600: 2.46
A601: 601228.SH | B601: 广州港 | C601: 3.34 | D601: 3.32 | E601: 3.28 | F601: 3.24
A602: 002431.SZ | B602: 棕榈股份 | C602: 3.32 | D602: 3.31 | E602: 3.12 | F602: 3.05
A603: 000897.SZ | B603: 津滨发展 | C603: 3.31 | D603: 2.82 | E603: 2.54 | F603: 2.42
A604: 603555.SH | B604: ST贵人 | C604: 3.31 | D604: 3.23 | E604: 3.01 | F604: 2.92
A605: 600220.SH | B605: 江苏阳光 | C605: 3.2999999999999998 | D605: 2.95 | E605: 2.6000000000000001 | F605: 2.48
A606: 601988.SH | B606: 中国银行 | C606: 3.29 | D606: 3.14 | E606: 3.09 | F606: 3.08
A607: 002118.SZ | B607: 紫鑫药业 | C607: 3.26 | D607: 3.19 | E607: 2.93 | F607: 2.88
A608: 601000.SH | B608: 唐山港 | C608: 3.18 | D608: 2.84 | E608: 2.68 | F608: 2.58
A609: 600708.SH | B609: 光明地产 | C609: 3.16 | D609: 2.61 | E609: 2.3999999999999999 | F609: 2.3999999999999999
A610: 002247.SZ | B610: 聚力文化 | C610: 3.12 | D610: 2.91 | E610: 2.81 | F610: 2.79
A611: 600467.SH | B611: 好当家 | C611: 3.12 | D611: 2.96 | E611: 2.79 | F611: 2.73
A612: 600322.SH | B612: 天房发展 | C612: 3.11 | D612: 2.2000000000000002 | E612: 2.02 | F612: 1.98
A613: 601992.SH | B613: 金隅集团 | C613: 3.11 | D613: 2.8999999999999999 | E613: 2.84 | F613: 2.78
A614: 002542.SZ | B614: 中化岩土 | C614: 3.1000000000000001 | D614: 3.02 | E614: 2.91 | F614: 2.91
A615: 600017.SH | B615: 日照港 | C615: 3 | D615: 2.86 | E615: 2.77 | F615: 2.73
A616: 000793.SZ | B616: 华闻集团 | C616: 2.99 | D616: 2.85 | E616: 2.65 | F616: 2.64
A617: 600033.SH | B617: 福建高速 | C617: 2.95 | D617: 2.8999999999999999 | E617: 2.7999999999999998 | F617: 2.74
A618: 002437.SZ | B618: 誉衡药业 | C618: 2.93 | D618: 2.83 | E618: 2.67 | F618: 2.64
A619: 300135.SZ | B619: 宝利国际 | C619: 2.93 | D619: 2.87 | E619: 2.81 | F619: 2.78
A620: 601588.SH | B620: 北辰实业 | C620: 2.91 | D620: 2.61 | E620: 2.46 | F620: 2.42
A621: 002495.SZ | B621: 佳隆股份 | C621: 2.89 | D621: 2.79 | E621: 2.67 | F621: 2.6000000000000001
A622: 601326.SH | B622: 秦港股份 | C622: 2.86 | D622: 2.78 | E622: 2.75 | F622: 2.7000000000000002
A623: 300071.SZ | B623: *ST嘉信 | C623: 2.84 | D623: 2.54 | E623: 2.46 | F623: 2.36
A624: 601518.SH | B624: 吉林高速 | C624: 2.84 | D624: 2.76 | E624: 2.61 | F624: 2.53
A625: 002770.SZ | B625: *ST科迪 | C625: 2.72 | D625: 2.65 | E625: 2.33 | F625: 2.22
A626: 600589.SH | B626: ST榕泰 | C626: 2.65 | D626: 2.36 | E626: 2.24 | F626: 2.21
A627: 600743.SH | B627: 华远地产 | C627: 2.64 | D627: 2.18 | E627: 2.01 | F627: 1.99
A628: 600162.SH | B628: 香江控股 | C628: 2.6000000000000001 | D628: 2.24 | E628: 2.07 | F628: 2
A629: 000667.SZ | B629: 美好置业 | C629: 2.12 | D629: 1.78 | E629: 1.72 | F629: 1.71
A630: 000882.SZ | B630: 华联股份 | C630: 2.11 | D630: 1.98 | E630: 1.91 | F630: 1.88
A631: 002663.SZ | B631: 普邦股份 | C631: 2.04 | D631: 2.02 | E631: 1.95 | F631: 1.92
A632: 601880.SH | B632: 辽港股份 | C632: 1.78 | D632: 1.74 | E632: 1.74 | F632: 1.73