A1: 股票代码 | B1: 股票简称 | C1: 行情收盘价 [1]2022.10.14 | D1: 50日均线 [2]2022.10.14 | E1: 150日均线 [3]2022.10.14 | F1: 200日均线 [4]2022.10.14 | M1: 当前股价位置属于趋势的周期（即数基地，1到2的时候进入，3到5应该考虑卖出） | N1: 最近一年最高点是否新高 | O1: 价格波动收缩幅度 | AH1: 价格行为(得分应大于60%) | AK1: 成交量行为 | AM1: 结论 | AN1: 更新时间
G2: 52周内最低点 | H2: 52周内最高点 | I2: 最高点前8周收盘价 | J2: 当前股价相对于最低点百分比(至少高出25%) | K2: 当前股价相对于最高点百分比(25%内最好) | L2: 最高点前8周股价相对于最高点百分比 | O2: 技术足迹 | AH2: 支撑位和压力位是否同步升高(40%) | AI2: 是否有网球行为出现(40%) | AJ2: 上涨天数是否大于下跌天数(20%) | AK2: 不同收盘表现时交易量情况(好的收盘时，交易量是否增大，坏的收盘时，交易量是否萎缩) | AL2: 成交量收缩情况(最后的价格收缩期间的成交量应低于50天的平均水平且有一到两天交易量极低)
O3: 支撑位1 | P3: 阻力位2 | Q3: 支撑位2 | R3: 阻力位3 | S3: 支撑位3 | T3: 阻力位4 | U3: 支撑位4 | V3: 阻力位5 | W3: 支撑位5 | X3: 阻力位6 | Y3: 支撑位6 | Z3: 时间周期(最小3周) | AA3: 收缩量1 | AB3: 收缩量2 | AC3: 收缩量3 | AD3: 收缩量4 | AE3: 收缩量5 | AF3: 收缩量6 | AG3: 收缩数量(至少大于3T)
A4: 000622.SZ | B4: 恒立实业 | C4: 5.49 | D4: 4.93 | E4: 4.57 | F4: 4.54
A5: 600212.SH | B5: 绿能慧充 | C5: 8.02 | D5: 7.76 | E5: 6.18 | F5: 5.74
A6: 600766.SH | B6: 园城黄金 | C6: 15.07 | D6: 11.93 | E6: 8.83 | F6: 7.81
A7: 601958.SH | B7: 金钼股份 | C7: 9.57 | D7: 8.34 | E7: 7.93 | F7: 7.63
A8: 831152.BJ | B8: 昆工科技 | C8: 18.67 | D8: 14.81 | E8: 11.22 | F8: 10.29
A9: 000975.SZ | B9: 银泰黄金 | C9: 13.300000000000001 | D9: 12.08 | E9: 10.36 | F9: 9.92
A10: 002155.SZ | B10: 湖南黄金 | C10: 13.62 | D10: 12.75 | E10: 11.35 | F10: 11.23
A11: 002379.SZ | B11: 宏创控股 | C11: 4.71 | D11: 4.58 | E11: 3.79 | F11: 3.66
A12: 600615.SH | B12: 丰华股份 | C12: 9.5 | D12: 9.11 | E12: 8.52 | F12: 8.49
A13: 601702.SH | B13: 华峰铝业 | C13: 18.63 | D13: 18.61 | E13: 13.57 | F13: 13.199999999999999
A14: 603937.SH | B14: 丽岛新材 | C14: 12.85 | D14: 12.27 | E14: 11.37 | F14: 11.300000000000001
A15: 002807.SZ | B15: 江阴银行 | C15: 4.5 | D15: 4.49 | E15: 4.27 | F15: 4.15
A16: 601128.SH | B16: 常熟银行 | C16: 8.16 | D16: 7.74 | E16: 7.56 | F16: 7.43
A17: 603323.SH | B17: 苏农银行 | C17: 5.22 | D17: 5.2000000000000002 | E17: 5.14 | F17: 5.13
A18: 601288.SH | B18: 农业银行 | C18: 2.85 | D18: 2.84 | E18: 2.83 | F18: 2.81
A19: 601988.SH | B19: 中国银行 | C19: 3.06 | D19: 3.05 | E19: 3.02 | F19: 2.99
A20: 601998.SH | B20: 中信银行 | C20: 4.68 | D20: 4.47 | E20: 4.45 | F20: 4.43
A21: 002966.SZ | B21: 苏州银行 | C21: 7.05 | D21: 6.55 | E21: 6.2999999999999998 | F21: 6.24
A22: 600919.SH | B22: 江苏银行 | C22: 7.41 | D22: 7.21 | E22: 6.87 | F22: 6.66
A23: 601838.SH | B23: 成都银行 | C23: 15.67 | D23: 15.43 | E23: 15.35 | F23: 14.75
A24: 002737.SZ | B24: 葵花药业 | C24: 19.5 | D24: 17.72 | E24: 16.13 | F24: 15.74
A25: 600085.SH | B25: 同仁堂 | C25: 49.12 | D25: 46.51 | E25: 45.38 | F25: 45.15
A26: 600129.SH | B26: 太极集团 | C26: 27.36 | D26: 25.72 | E26: 22.46 | F26: 21.93
A27: 600750.SH | B27: 江中药业 | C27: 15.54 | D27: 15.28 | E27: 13.699999999999999 | F27: 13.39
A28: 600713.SH | B28: 南京医药 | C28: 5.13 | D28: 4.89 | E28: 4.85 | F28: 4.79
A29: 300049.SZ | B29: 福瑞股份 | C29: 18.83 | D29: 18.35 | E29: 15.199999999999999 | F29: 14.63
A30: 300633.SZ | B30: 开立医疗 | C30: 58.44 | D30: 40.57 | E30: 32.78 | F30: 32.08
A31: 688212.SH | B31: 澳华内镜 | C31: 75.25 | D31: 53.74 | E31: 48.47 | F31: 46.299999999999997
A32: 688677.SH | B32: 海泰新光 | C32: 128.99 | D32: 97.85 | E32: 86.49 | F32: 85.35
A33: 300653.SZ | B33: 正海生物 | C33: 50.51 | D33: 50.06 | E33: 46.399999999999999 | F33: 45.61
A34: 603309.SH | B34: 维力医疗 | C34: 21.76 | D34: 17.61 | E34: 15.33 | F34: 15.28
A35: 688050.SH | B35: 爱博医疗 | C35: 209.98 | D35: 197.95 | E35: 189.26 | F35: 188.86
A36: 688278.SH | B36: 特宝生物 | C36: 37.82 | D36: 29.96 | E36: 27.77 | F36: 27.73
A37: 000915.SZ | B37: 华特达因 | C37: 44.200000000000003 | D37: 41.100000000000001 | E37: 39.08 | F37: 37.15
A38: 000963.SZ | B38: 华东医药 | C38: 43.899999999999999 | D38: 41.84 | E38: 39.08 | F38: 38.76
A39: 002020.SZ | B39: 京新药业 | C39: 11.29 | D39: 9.24 | E39: 8.92 | F39: 8.84
A40: 002422.SZ | B40: 科伦药业 | C40: 24.61 | D40: 21.76 | E40: 19.05 | F40: 18.82
A41: 603676.SH | B41: 卫信康 | C41: 12.9 | D41: 12.22 | E41: 10.55 | F41: 10.25
A42: 600522.SH | B42: 中天科技 | C42: 23.85 | D42: 23.66 | E42: 20.48 | F42: 19.46
A43: 601869.SH | B43: 长飞光纤 | C43: 41.43 | D43: 39.92 | E43: 31.86 | F43: 31.72
A44: 000729.SZ | B44: 燕京啤酒 | C44: 9.61 | D44: 8.9000000000000004 | E44: 8.12 | F44: 8.09
A45: 000716.SZ | B45: 黑芝麻 | C45: 4.83 | D45: 4.19 | E45: 3.62 | F45: 3.55
A46: 002847.SZ | B46: 盐津铺子 | C46: 93.47 | D46: 90.42 | E46: 78.11 | F46: 77.299999999999997
A47: 002329.SZ | B47: 皇氏集团 | C47: 7.76 | D47: 7.71 | E47: 6.08 | F47: 5.74
A48: 600419.SH | B48: 天润乳业 | C48: 14.9 | D48: 13.19 | E48: 12.93 | F48: 12.87
A49: 002840.SZ | B49: 华统股份 | C49: 22.99 | D49: 21.55 | E49: 18.71 | F49: 18.05
A50: 600256.SH | B50: 广汇能源 | C50: 12.47 | D50: 12.4 | E50: 10.06 | F50: 9.09
A51: 600777.SH | B51: 新潮能源 | C51: 2.7000000000000002 | D51: 2.67 | E51: 2.41 | F51: 2.34
A52: 002207.SZ | B52: 准油股份 | C52: 8.86 | D52: 8.25 | E52: 8.16 | F52: 7.67
A53: 603619.SH | B53: 中曼石油 | C53: 22.100000000000001 | D53: 21.29 | E53: 18.81 | F53: 17.79 | G53: 11.35 | H53: 25.859999999999999 | I53: 16.18 | J53: =(C53-G53)/G53 -> 0.94713656387665213 | K53: =(H53-C53)/H53 -> 0.14539829853054903 | L53: =(H53-I53)/I53 -> 0.59826946847960449 | N53: 否 | O53: 17.670000000000002 | P53: 24.219999999999999 | Q53: 19.4 | AA53: =(H53-O53)/H53 -> 0.31670533642691406 | AB53: =(P53-Q53)/P53 -> 0.19900908340214701
A54: 600028.SH | B54: 中国石化 | C54: 4.33 | D54: 4.13 | E54: 3.96 | F54: 3.92
A55: 601857.SH | B55: 中国石油 | C55: 5.17 | D55: 5.13 | E55: 5.12 | F55: 5.0999999999999996
A56: 300938.SZ | B56: 信测标准 | C56: 37.25 | D56: 35.94 | E56: 30.57 | F56: 29.68
A57: 301073.SZ | B57: 君亭酒店 | C57: 64.75 | D57: 60.92 | E57: 53.62 | F57: 47.57
A58: 605108.SH | B58: 同庆楼 | C58: 26.95 | D58: 23.25 | E58: 19.97 | F58: 19.76
A59: 603136.SH | B59: 天目湖 | C59: 25.63 | D59: 24.33 | E59: 23.95 | F59: 22.5
A60: 601028.SH | B60: 玉龙股份 | C60: 24.18 | D60: 21.47 | E60: 19.75 | F60: 19.53
A61: 002818.SZ | B61: 富森美 | C61: 13.09 | D61: 12.87 | E61: 11.74 | F61: 11.62
A62: 600738.SH | B62: 丽尚国潮 | C62: 6.52 | D62: 6.48 | E62: 6.4000000000000004 | F62: 6.31
A63: 600790.SH | B63: 轻纺城 | C63: 3.84 | D63: 3.64 | E63: 3.61 | F63: 3.53
A64: 002336.SZ | B64: 人人乐 | C64: 7.61 | D64: 7.04 | E64: 6.53 | F64: 6.35
A65: 002356.SZ | B65: 赫美集团 | C65: 6.09 | D65: 5.78 | E65: 5.23 | F65: 5.04
A66: 603613.SH | B66: 国联股份 | C66: 124.2 | D66: 104.52 | E66: 87.55 | F66: 85.04
A67: 002836.SZ | B67: 新宏泽 | C67: 9.19 | D67: 8.65 | E67: 8.15 | F67: 8.09 | N67: 否
A68: 002714.SZ | B68: 牧原股份 | C68: 58.46 | D68: 57.87 | E68: 55.87 | F68: 55.66
A69: 000798.SZ | B69: 中水渔业 | C69: 10.63 | D69: 10.6 | E69: 9.51 | F69: 9
A70: 002868.SZ | B70: 绿康生化 | C70: 26.41 | D70: 23.43 | E70: 15.98 | F70: 14.69
A71: 603668.SH | B71: 天马科技 | C71: 19.26 | D71: 19.21 | E71: 16.69 | F71: 15.28
A72: 300856.SZ | B72: 科思股份 | C72: 67.900000000000006 | D72: 59.75 | E72: 42.53 | F72: 40.87
A73: 603605.SH | B73: 珀莱雅 | C73: 173.27 | D73: 164.91 | E73: 150.94 | F73: 146.69999999999999
A74: 000983.SZ | B74: 山西焦煤 | C74: 13.39 | D74: 13.27 | E74: 12.57 | F74: 11.51 | G74: 6.75 | H74: 16.370000000000001 | I74: 10.73 | J74: =(C74-G74)/G74 -> 0.98370370370370375 | K74: =(H74-C74)/H74 -> 0.18204031765424558 | L74: =(H74-I74)/I74 -> 0.52562907735321529 | N74: 否 | O74: 10.859999999999999 | P74: 15.710000000000001 | Q74: 12.380000000000001 | AA74: =(H74-O74)/H74 -> 0.33659132559560179 | AB74: =(P74-Q74)/P74 -> 0.21196690006365371 | AC74: 、
A75: 600123.SH | B75: 兰花科创 | C75: 15.26 | D75: 15.18 | E75: 14.33 | F75: 13.16
A76: 600188.SH | B76: 兖矿能源 | C76: 47.96 | D76: 47.32 | E76: 39.02 | F76: 35.35 | N76: 是
A77: 600397.SH | B77: 安源煤业 | C77: 3.74 | D77: 3.41 | E77: 3.3999999999999999 | F77: 3.32
A78: 600546.SH | B78: 山煤国际 | C78: 17.300000000000001 | D78: 17.22 | E78: 15.03 | F78: 13.15
A79: 600985.SH | B79: 淮北矿业 | C79: 16.199999999999999 | D79: 14.76 | E79: 14.24 | F79: 13.51
A80: 601088.SH | B80: 中国神华 | C80: 31.54 | D80: 30.52 | E80: 28.98 | F80: 27.03
A81: 601699.SH | B81: 潞安环能 | C81: 15.97 | D81: 15.65 | E81: 15.12 | F81: 14.31
A82: 601898.SH | B82: 中煤能源 | C82: 10.1 | D82: 10.02 | E82: 9.28 | F82: 8.55
A83: 600997.SH | B83: 开滦股份 | C83: 7.63 | D83: 7.58 | E83: 7.41 | F83: 7.28
A84: 600213.SH | B84: 亚星客车 | C84: 9.12 | D84: 9.03 | E84: 8.48 | F84: 8.4000000000000004
A85: 002715.SZ | B85: 登云股份 | C85: 23.02 | D85: 19.79 | E85: 14.97 | F85: 14.54
A86: 002965.SZ | B86: 祥鑫科技 | C86: 57.46 | D86: 57.35 | E86: 38.94 | F86: 35.49 | G86: 16.879999999999999 | H86: 77.810000000000002 | I86: 31.8 | J86: =(C86-G86)/G86 -> 2.4040284360189572 | K86: =(H86-C86)/H86 -> 0.26153450713275928 | L86: =(H86-I86)/I86 -> 1.4468553459119498 | N86: 是 | O86: 44.9 | AA86: =(H86-O86)/H86 -> 0.42295334789872768
A87: 300893.SZ | B87: 松原股份 | C87: 33.200000000000003 | D87: 30.63 | E87: 22.08 | F87: 22.06 | J87: =(C87-G87)/G87 -> #DIV/0! | K87: =(H87-C87)/H87 -> #DIV/0! | L87: =(H87-I87)/I87 -> #DIV/0! | AA87: =(H87-O87)/H87 -> #DIV/0!
A88: 603917.SH | B88: 合力科技 | C88: 36.75 | D88: 36.11 | E88: 24.45 | F88: 23.11 | J88: =(C88-G88)/G88 -> #DIV/0! | K88: =(H88-C88)/H88 -> #DIV/0! | L88: =(H88-I88)/I88 -> #DIV/0! | AA88: =(H88-O88)/H88 -> #DIV/0!
A89: 603922.SH | B89: 金鸿顺 | C89: 26.399999999999999 | D89: 25.32 | E89: 22.93 | F89: 22.36 | J89: =(C89-G89)/G89 -> #DIV/0! | K89: =(H89-C89)/H89 -> #DIV/0! | L89: =(H89-I89)/I89 -> #DIV/0! | AA89: =(H89-O89)/H89 -> #DIV/0!
A90: 003033.SZ | B90: 征和工业 | C90: 42.22 | D90: 37.46 | E90: 29.100000000000001 | F90: 28.600000000000001 | J90: =(C90-G90)/G90 -> #DIV/0! | K90: =(H90-C90)/H90 -> #DIV/0! | L90: =(H90-I90)/I90 -> #DIV/0! | AA90: =(H90-O90)/H90 -> #DIV/0!
A91: 600818.SH | B91: 中路股份 | C91: 27.95 | D91: 26.11 | E91: 20.81 | F91: 18.100000000000001 | J91: =(C91-G91)/G91 -> #DIV/0! | K91: =(H91-C91)/H91 -> #DIV/0! | L91: =(H91-I91)/I91 -> #DIV/0! | AA91: =(H91-O91)/H91 -> #DIV/0!
A92: 603529.SH | B92: 爱玛科技 | C92: 60.45 | D92: 54.899999999999999 | E92: 44.91 | F92: 41.25 | G92: 23.629999999999999 | H92: 67.790000000000006 | I92: 40.619999999999997 | J92: =(C92-G92)/G92 -> 1.5581887431231489 | K92: =(H92-C92)/H92 -> 0.10827555686679455 | L92: =(H92-I92)/I92 -> 0.66888232397833602 | N92: 是 | O92: 48.149999999999999 | AA92: =(H92-O92)/H92 -> 0.28971824752913417
A93: 002468.SZ | B93: 申通快递 | C93: 13.34 | D93: 11.88 | E93: 10.47 | F93: 10.11 | N93: 否
A94: 002800.SZ | B94: 天顺股份 | C94: 19.76 | D94: 19.38 | E94: 17.91 | F94: 17.17
A95: 600057.SH | B95: 厦门象屿 | C95: 9.32 | D95: 8.82 | E95: 8.54 | F95: 8.36
A96: 600153.SH | B96: 建发股份 | C96: 14.46 | D96: 12.72 | E96: 12.29 | F96: 11.43
A97: 600233.SH | B97: 圆通速递 | C97: 21.93 | D97: 20.399999999999999 | E97: 19.04 | F97: 18.47 | N97: 否
A98: 603056.SH | B98: 德邦股份 | C98: 17.32 | D98: 14.91 | E98: 14.27 | F98: 13.31
A99: 603871.SH | B99: 嘉友国际 | C99: 22.12 | D99: 19.64 | E99: 16.56 | F99: 16.100000000000001
A100: 600004.SH | B100: 白云机场 | C100: 13.82 | D100: 13.57 | E100: 12.97 | F100: 12.91
A101: 601111.SH | B101: 中国国航 | C101: 10.28 | D101: 10.15 | E101: 9.85 | F101: 9.79
A102: 601006.SH | B102: 大秦铁路 | C102: 6.69 | D102: 6.46 | E102: 6.28 | F102: 6.25
A103: 600350.SH | B103: 山东高速 | C103: 5.59 | D103: 5.33 | E103: 5.24 | F103: 5.17
A104: 001205.SZ | B104: 盛航股份 | C104: 31.85 | D104: 28.74 | E104: 22.78 | F104: 21.96
A105: 600026.SH | B105: 中远海能 | C105: 17.05 | D105: 15.66 | E105: 10.94 | F105: 9.67
A106: 601872.SH | B106: 招商轮船 | C106: 7.58 | D106: 7.42 | E106: 6.04 | F106: 5.55 | N106: 否
A107: 601975.SH | B107: 招商南油 | C107: 5.21 | D107: 4.16 | E107: 3.27 | F107: 2.96 | N107: 是
A108: 605598.SH | B108: 上海港湾 | C108: 24.46 | D108: 20.53 | E108: 18.48 | F108: 18.07 | G108: 13.16 | H108: 30.8 | I108: 17.719999999999999 | J108: =(C108-G108)/G108 -> 0.85866261398176291 | K108: =(H108-C108)/H108 -> 0.20584415584415583 | L108: =(H108-I108)/I108 -> 0.73814898419864572 | N108: 是 | O108: 23.149999999999999 | AA108: =(H108-O108)/H108 -> 0.24837662337662345
A109: 300093.SZ | B109: 金刚光伏 | C109: 54.08 | D109: 52.34 | E109: 43.03 | F109: 40.69 | AA109: =(H109-O109)/H109 -> #DIV/0!
A110: 002403.SZ | B110: 爱仕达 | C110: 8.18 | D110: 8.03 | E110: 7.68 | F110: 7.51 | AA110: =(H110-O110)/H110 -> #DIV/0!
A111: 603868.SH | B111: 飞科电器 | C111: 78.65 | D111: 78.11 | E111: 67.83 | F111: 61.68 | G111: 36.369999999999997 | H111: 90.2 | I111: 62.1 | J111: =(C111-G111)/G111 -> 1.1624965631014577 | K111: =(H111-C111)/H111 -> 0.12804878048780485 | L111: =(H111-I111)/I111 -> 0.45249597423510468 | N111: 是 | O111: 70.549999999999997 | P111: 84.620000000000005 | Q111: 75 | AA111: =(H111-O111)/H111 -> 0.21784922394678499 | AB111: =(P111-Q111)/P111 -> 0.11368470810683058
A112: 002543.SZ | B112: 万和电气 | C112: 12.33 | D112: 10.94 | E112: 8.26 | F112: 7.99
A113: 603366.SH | B113: 日出东方 | C113: 9.05 | D113: 9.04 | E113: 6 | F113: 5.71
A114: 605117.SH | B114: 德业股份 | C114: 400.58 | D114: 396.17 | E114: 270.03 | F114: 247.05
A115: 000521.SZ | B115: 长虹美菱 | C115: 4.69 | D115: 4.26 | E115: 3.92 | F115: 3.81
A116: 000034.SZ | B116: 神州数码 | C116: 22.35 | D116: 18.53 | E116: 16.19 | F116: 16.18
A117: 002657.SZ | B117: 中科金财 | C117: 15.47 | D117: 15.09 | E117: 15 | F117: 14.57
A118: 300167.SZ | B118: 迪威迅 | C118: 5.67 | D118: 5.65 | E118: 5.43 | F118: 5.39
A119: 600873.SH | B119: 梅花生物 | C119: 10.47 | D119: 10.46 | E119: 9.71 | F119: 9.09 | G119: 5.47 | H119: 13.1 | I119: 8.6 | J119: =(C119-G119)/G119 -> 0.91407678244972601 | K119: =(H119-C119)/H119 -> 0.20076335877862589 | L119: =(H119-I119)/I119 -> 0.52325581395348841 | N119: 否 | O119: 9.2 | AA119: =(H119-O119)/H119 -> 0.29770992366412219
A120: 688639.SH | B120: 华恒生物 | C120: 145.17 | D120: 136.92 | E120: 118.84 | F120: 117.42
A121: 002430.SZ | B121: 杭氧股份 | C121: 37.299999999999997 | D121: 37.28 | E121: 32.32 | F121: 31.43
A122: 300596.SZ | B122: 利安隆 | C122: 56.38 | D122: 52.89 | E122: 47.89 | F122: 46.76
A123: 300575.SZ | B123: 中旗股份 | C123: 20.28 | D123: 18.03 | E123: 17.19 | F123: 16.56
A124: 300796.SZ | B124: 贝斯美 | C124: 18.17 | D124: 17.53 | E124: 15.25 | F124: 14.56
A125: 301035.SZ | B125: 润丰股份 | C125: 99.35 | D125: 91.98 | E125: 78.81 | F125: 75.34
A126: 603086.SH | B126: 先达股份 | C126: 16.55 | D126: 13.74 | E126: 10.82 | F126: 10.11 | N126: 否
A127: 603360.SH | B127: 百傲化学 | C127: 16.19 | D127: 15.800000000000001 | E127: 14.94 | F127: 14.32 | G127: 10.91 | H127: 17.34 | I127: 15.380000000000001 | J127: =(C127-G127)/G127 -> 0.48395967002749779 | K127: =(H127-C127)/H127 -> 6.6320645905420916e-02 | L127: =(H127-I127)/I127 -> 0.12743823146944078 | N127: 否 | O127: 14.7 | AA127: =(H127-O127)/H127 -> 0.15224913494809691
A128: 603599.SH | B128: 广信股份 | C128: 28 | D128: 27.04 | E128: 25.92 | F128: 25.64
A129: 603810.SH | B129: 丰山集团 | C129: 15.57 | D129: 14.72 | E129: 13.6 | F129: 13.57
A130: 603970.SH | B130: 中农立华 | C130: 30.18 | D130: 29.97 | E130: 28.94 | F130: 28.05
A131: 600230.SH | B131: 沧州大化 | C131: 24.89 | D131: 18.24 | E131: 16.65 | F131: 16.62
A132: 603505.SH | B132: 金石资源 | C132: 42.45 | D132: 37.58 | E132: 28.899999999999999 | F132: 28.01
A133: 688722.SH | B133: 同益中 | C133: 19.45 | D133: 18.23 | E133: 15.21 | F133: 14.71
A134: 603688.SH | B134: 石英股份 | C134: 145.16 | D134: 134.44 | E134: 104.24 | F134: 92.62
A135: 603826.SH | B135: 坤彩科技 | C135: 61.48 | D135: 60.79 | E135: 60.59 | F135: 55.89
A136: 688700.SH | B136: 东威科技 | C136: 164.18 | D136: 139.94 | E136: 96.72 | F136: 87.61
A137: 603966.SH | B137: 法兰泰克 | C137: 12.99 | D137: 11.76 | E137: 10.29 | F137: 10.05
A138: 688377.SH | B138: 迪威尔 | C138: 39.85 | D138: 38.82 | E138: 31.94 | F138: 29.26
A139: 605286.SH | B139: 同力日升 | C139: 46.200000000000003 | D139: 44.01 | E139: 35.93 | F139: 33.87
A140: 300718.SZ | B140: 长盛轴承 | C140: 22.81 | D140: 20.89 | E140: 16.84 | F140: 16.64
A141: 002175.SZ | B141: 东方网络 | C141: 3.48 | D141: 3.47 | E141: 3.13 | F141: 2.97
A142: 300370.SZ | B142: *ST安控 | C142: 2.75 | D142: 2.6000000000000001 | E142: 2.18 | F142: 2.17
A143: 300990.SZ | B143: 同飞股份 | C143: 117.27 | D143: 99.25 | E143: 69.34 | F143: 67.12
A144: 600481.SH | B144: 双良节能 | C144: 17.25 | D144: 16.89 | E144: 14.58 | F144: 13.57
A145: 603757.SH | B145: 大元泵业 | C145: 26.73 | D145: 25.29 | E145: 17.98 | F145: 17.800000000000001
A146: 605060.SH | B146: 联德股份 | C146: 25.25 | D146: 23.35 | E146: 20 | F146: 19.64
A147: 300345.SZ | B147: 华民股份 | C147: 9.41 | D147: 8.78 | E147: 6.76 | F147: 6.43
A148: 002514.SZ | B148: 宝馨科技 | C148: 14.34 | D148: 13.04 | E148: 8.57 | F148: 7.63
A149: 002843.SZ | B149: 泰嘉股份 | C149: 19.800000000000001 | D149: 19.19 | E149: 13.97 | F149: 13.16
A150: 002871.SZ | B150: 伟隆股份 | C150: 14.32 | D150: 13.72 | E150: 11.22 | F150: 10.98
A151: 600992.SH | B151: 贵绳股份 | C151: 23.43 | D151: 22.85 | E151: 16.41 | F151: 15.06
A152: 603969.SH | B152: 银龙股份 | C152: 5.41 | D152: 4.99 | E152: 4.83 | F152: 4.77
A153: 000410.SZ | B153: *ST沈机 | C153: 5.7000000000000002 | D153: 5.63 | E153: 4.96 | F153: 4.95
A154: 002685.SZ | B154: 华东重机 | C154: 4.88 | D154: 4.42 | E154: 3.75 | F154: 3.73
A155: 000068.SZ | B155: 华控赛格 | C155: 3.98 | D155: 3.76 | E155: 3.44 | F155: 3.41
A156: 000544.SZ | B156: 中原环保 | C156: 6.58 | D156: 6.49 | E156: 6.21 | F156: 6.19
A157: 603200.SH | B157: 上海洗霸 | C157: 20.68 | D157: 17.06 | E157: 15.89 | F157: 15.88 | N157: 否
A158: 600388.SH | B158: ST龙净 | C158: 12.25 | D158: 11.91 | E158: 11.11 | F158: 10.39
A159: 002549.SZ | B159: 凯美特气 | C159: 19.33 | D159: 19.28 | E159: 16.78 | F159: 16.61
A160: 603878.SH | B160: 武进不锈 | C160: 8.45 | D160: 8.11 | E160: 6.9000000000000004 | F160: 6.84
A161: 002231.SZ | B161: 奥维通信 | C161: 8.4000000000000004 | D161: 7.74 | E161: 6.32 | F161: 6.27
A162: 002446.SZ | B162: 盛路通信 | C162: 8.55 | D162: 7.96 | E162: 6.98 | F162: 6.76
A163: 688776.SH | B163: 国光电气 | C163: 237.68 | D163: 218.66 | E163: 179.12 | F163: 177.35
A164: 688066.SH | B164: 航天宏图 | C164: 79.42 | D164: 75.74 | E164: 70.299999999999997 | F164: 69.200000000000003
A165: 000638.SZ | B165: 万方发展 | C165: 8.01 | D165: 5.69 | E165: 5.62 | F165: 5.5
A166: 688122.SH | B166: 西部超导 | C166: 114.5 | D166: 109.06 | E166: 94.35 | F166: 91.28
A167: 000593.SZ | B167: 德龙汇能 | C167: 10.4 | D167: 8.47 | E167: 6.5999999999999996 | F167: 6.48
A168: 002267.SZ | B168: 陕天然气 | C168: 8.64 | D168: 8.3000000000000007 | E168: 7.31 | F168: 7.17
A169: 002700.SZ | B169: ST浩源 | C169: 5.63 | D169: 5.23 | E169: 4.34 | F169: 4.2999999999999998
A170: 600236.SH | B170: 桂冠电力 | C170: 7.2000000000000002 | D170: 6.23 | E170: 5.94 | F170: 5.91
A171: 600886.SH | B171: 国投电力 | C171: 11.16 | D171: 10.88 | E171: 10.29 | F171: 10.28
A172: 600149.SH | B172: 廊坊发展 | C172: 6.09 | D172: 5.82 | E172: 5.68 | F172: 5.63
A173: 600027.SH | B173: 华电国际 | C173: 6.75 | D173: 5.7000000000000002 | E173: 4.36 | F173: 4.35
A174: 600578.SH | B174: 京能电力 | C174: 3.46 | D174: 3.3999999999999999 | E174: 3.18 | F174: 3.16 | G174: 2.66 | H174: 3.86 | I174: 2.94 | J174: =(C174-G174)/G174 -> 0.30075187969924805 | K174: =(H174-C174)/H174 -> 0.10362694300518133 | L174: =(H174-I174)/I174 -> 0.31292517006802717 | N174: 否 | O174: 2.56
A175: 600780.SH | B175: 通宝能源 | C175: 6.26 | D175: 6.07 | E175: 5.22 | F175: 4.91
A176: 600795.SH | B176: 国电电力 | C176: 4.61 | D176: 4.2000000000000002 | E176: 3.59 | F176: 3.3999999999999999
A177: 601319.SH | B177: 中国人保 | C177: 5.14 | D177: 4.87 | E177: 4.66 | F177: 4.64
A178: 600400.SH | B178: 红豆股份 | C178: 5.82 | D178: 5.44 | E178: 4.41 | F178: 4.17
A179: 603555.SH | B179: 贵人鸟 | C179: 3.73 | D179: 3.68 | E179: 3.61 | F179: 3.47
A180: 600987.SH | B180: 航民股份 | C180: 7.48 | D180: 6.34 | E180: 5.54 | F180: 5.49
A181: 002486.SZ | B181: 嘉麟杰 | C181: 3.43 | D181: 3.24 | E181: 3 | F181: 2.99 | N181: 否
A182: 603889.SH | B182: 新澳股份 | C182: 7.57 | D182: 6.72 | E182: 6.22 | F182: 6.21
A183: 000726.SZ | B183: 鲁泰A | C183: 7.73 | D183: 7.69 | E183: 7.18 | F183: 7.04
A184: 002003.SZ | B184: 伟星股份 | C184: 11.73 | D184: 11.29 | E184: 10.42 | F184: 10.34
A185: 000573.SZ | B185: 粤宏远A | C185: 3.64 | D185: 3.59 | E185: 3.47 | F185: 3.46
A186: 002244.SZ | B186: 滨江集团 | C186: 10.48 | D186: 10 | E186: 8.36 | F186: 7.5999999999999996
A187: 600048.SH | B187: 保利发展 | C187: 17.25 | D187: 16.96 | E187: 16.43 | F187: 16.09
A188: 600325.SH | B188: 华发股份 | C188: 10.62 | D188: 8.98 | E188: 7.57 | F188: 7.13
A189: 600533.SH | B189: 栖霞建设 | C189: 4.12 | D189: 3.71 | E189: 3.65 | F189: 3.53
A190: 001979.SZ | B190: 招商蛇口 | C190: 15.67 | D190: 14.66 | E190: 13.69 | F190: 13.52
A191: 002866.SZ | B191: 传艺科技 | C191: 40.27 | D191: 34.92 | E191: 20.94 | F191: 18.78
A192: 300916.SZ | B192: 朗特智能 | C192: 62.86 | D192: 60.18 | E192: 44.27 | F192: 43.399999999999999
A193: 603629.SH | B193: 利通电子 | C193: 19.47 | D193: 18.92 | E193: 16.51 | F193: 16.399999999999999
A194: 000670.SZ | B194: 盈方微 | C194: 7.33 | D194: 6.7000000000000002 | E194: 3.66 | F194: 3.25
A195: 002388.SZ | B195: 新亚制程 | C195: 7 | D195: 6.4000000000000004 | E195: 5.58 | F195: 5.58
A196: 600601.SH | B196: *ST方科 | C196: 2.54 | D196: 2.53 | E196: 2.46 | F196: 2.46
A197: 688385.SH | B197: 复旦微电 | C197: 81.299999999999997 | D197: 71.28 | E197: 59.48 | F197: 55.48
A198: 600112.SH | B198: ST天成 | C198: 4.82 | D198: 4.23 | E198: 3.47 | F198: 3.44
A199: 002366.SZ | B199: *ST海核 | C199: 5.43 | D199: 5.35 | E199: 4.7999999999999998 | F199: 4.78
A200: 002518.SZ | B200: 科士达 | C200: 49.65 | D200: 41.29 | E200: 28.899999999999999 | F200: 27.66
A201: 002630.SZ | B201: 华西能源 | C201: 3.19 | D201: 3.1000000000000001 | E201: 2.75 | F201: 2.65
A202: 300593.SZ | B202: 新雷能 | C202: 46.77 | D202: 45.34 | E202: 38.69 | F202: 37.74
A203: 300820.SZ | B203: 英杰电气 | C203: 105.82 | D203: 93.08 | E203: 69.48 | F203: 65.36
A204: 002865.SZ | B204: 钧达股份 | C204: 195.19999999999999 | D204: 182.54 | E204: 120.34 | F204: 106.59 | N204: 是
A205: 300751.SZ | B205: 迈为股份 | C205: 522.18 | D205: 497.5 | E205: 419.83 | F205: 401.33
A206: 600537.SH | B206: 亿晶光电 | C206: 6.65 | D206: 6.37 | E206: 5.02 | F206: 4.88 | N206: 否
A207: 600732.SH | B207: 爱旭股份 | C207: 37.91 | D207: 37.54 | E207: 27.95 | F207: 26.01 | G207: 10.49 | H207: 44.6 | I207: 32.009999999999998 | J207: =(C207-G207)/G207 -> 2.6139180171591985 | K207: =(H207-C207)/H207 -> 0.15000000000000011 | L207: =(H207-I207)/I207 -> 0.39331458919087797 | N207: 是 | O207: 32.719999999999999 | P207: 39.579999999999998 | Q207: 33 | AA207: =(H207-O207)/H207 -> 0.26636771300448436 | AB207: =(P207-Q207)/P207 -> 0.16624557857503786
A208: 688556.SH | B208: 高测股份 | C208: 93.47 | D208: 89.36 | E208: 71.73 | F208: 65.54 | AA208: =(H208-O208)/H208 -> #DIV/0!
A209: 002121.SZ | B209: 科陆电子 | C209: 9.05 | D209: 8.61 | E209: 6.75 | F209: 6.37 | G209: 3.46 | H209: 10.75 | I209: 6.64 | J209: =(C209-G209)/G209 -> 1.6156069364161851 | K209: =(H209-C209)/H209 -> 0.15813953488372087 | L209: =(H209-I209)/I209 -> 0.61897590361445787 | N209: 否 | O209: 7.53 | AA209: =(H209-O209)/H209 -> 0.29953488372093023
A210: 300427.SZ | B210: 红相股份 | C210: 17.95 | D210: 17.23 | E210: 15.56 | F210: 14.99 | J210: =(C210-G210)/G210 -> #DIV/0! | K210: =(H210-C210)/H210 -> #DIV/0! | L210: =(H210-I210)/I210 -> #DIV/0! | AA210: =(H210-O210)/H210 -> #DIV/0!
A211: 600152.SH | B211: 维科技术 | C211: 11.75 | D211: 10.51 | E211: 7.65 | F211: 7.5999999999999996 | J211: =(C211-G211)/G211 -> #DIV/0! | K211: =(H211-C211)/H211 -> #DIV/0! | L211: =(H211-I211)/I211 -> #DIV/0! | AA211: =(H211-O211)/H211 -> #DIV/0!
A212: 600996.SH | B212: 贵广网络 | C212: 12.16 | D212: 10.79 | E212: 8.85 | F212: 8.33 | G212: 4.13 | H212: 13.81 | I212: 8.07 | J212: =(C212-G212)/G212 -> 1.9443099273607751 | K212: =(H212-C212)/H212 -> 0.11947863866763217 | L212: =(H212-I212)/I212 -> 0.71127633209417596 | N212: 否 | O212: 9.5 | P212: 13.3 | Q212: 10.869999999999999 | R212: 12.949999999999999 | S212: 11.130000000000001 | AA212: =(H212-O212)/H212 -> 0.31209268645908766 | AB212: =(P212-Q212)/P212 -> 0.18270676691729335 | AC212: =(R212-S212)/R212 -> 0.14054054054054044
A213: 002306.SZ | B213: 中科云网 | C213: 4.0999999999999996 | D213: 4.05 | E213: 3.43 | F213: 3.37 | J213: =(C213-G213)/G213 -> #DIV/0! | K213: =(H213-C213)/H213 -> #DIV/0! | L213: =(H213-I213)/I213 -> #DIV/0! | AA213: =(H213-O213)/H213 -> #DIV/0! | AB213: =(P213-Q213)/P213 -> #DIV/0!
A214: 300654.SZ | B214: 世纪天鸿 | C214: 10.21 | D214: 9.89 | E214: 9 | F214: 8.88 | J214: =(C214-G214)/G214 -> #DIV/0! | K214: =(H214-C214)/H214 -> #DIV/0! | L214: =(H214-I214)/I214 -> #DIV/0! | AA214: =(H214-O214)/H214 -> #DIV/0! | AB214: =(P214-Q214)/P214 -> #DIV/0!
A215: 600757.SH | B215: 长江传媒 | C215: 5.57 | D215: 5.5 | E215: 5.35 | F215: 5.2999999999999998 | G215: 4.4 | H215: 6.25 | I215: 4.87 | J215: =(C215-G215)/G215 -> 0.26590909090909087 | K215: =(H215-C215)/H215 -> 0.10879999999999995 | L215: =(H215-I215)/I215 -> 0.28336755646817247 | N215: 否 | O215: 4.4 | AA215: =(H215-O215)/H215 -> 0.29599999999999993
A216: 601098.SH | B216: 中南传媒 | C216: 10.29 | D216: 9.63 | E216: 9.21 | F216: 9.16
A217: 601811.SH | B217: 新华文轩 | C217: 9.72 | D217: 9.61 | E217: 9.0999999999999996 | F217: 9.07