A1: 股票代码 | B1: 股票简称 | C1: 基本每(元)2021.09.30 | D1: 行业 | E1: 当前基底处于上升趋势的位置(即处于第几个基底) | F1: 趋势 | Q1: 波动收缩幅度 | AJ1: 成交量行为 | AL1: 价格行为(得分应大于60%) | AO1: 结论 | AP1: 更新时间 | AQ1: 标签
F2: 200日均线 | G2: 150日均线 | H2: 50日均线 | I2: 各均线斜率是否朝上 | J2: 当前股价 | K2: 52周内最低点 | L2: 52周内最高点 | M2: 最高点前8周收盘价 | N2: 当前股价相对于最低点百分比(至少高出25%) | O2: 当前股价相对于最高点百分比(25%内最好) | P2: 最高点前8周股价相对于最高点百分比 | Q2: 技术足迹 | AJ2: 不同收盘表现时交易量情况(好的收盘时，交易量是否增大，坏的收盘时，交易量是否萎缩) | AK2: 成交量收缩情况(最后的价格收缩期间的成交量应低于50天的平均水平且有一到两天交易量极低) | AL2: 支撑位和压力位是否同步升高(40%) | AM2: 是否有网球行为出现(40%) | AN2: 上涨天数是否大于下跌天数(20%)
Q3: 支撑位1 | R3: 阻力位2 | S3: 支撑位2 | T3: 阻力位3 | U3: 支撑位3 | V3: 阻力位4 | W3: 支撑位4 | X3: 阻力位5 | Y3: 支撑位5 | Z3: 阻力位6 | AA3: 支撑位6 | AB3: 时间周期 | AC3: 收缩量1 | AD3: 收缩量2 | AE3: 收缩量3 | AF3: 收缩量4 | AG3: 收缩量5 | AH3: 收缩量6 | AI3: 收缩数量(至少大于3T)
A4: 002932.SZ | B4: 明德生物 | C4: 10.68 | D4: 医疗器械 | E4: 5 | F4: 64.599999999999994 | G4: 66.590000000000003 | H4: 70.609999999999999 | J4: 73.400000000000006 | K4: 41.789999999999999 | L4: 90.290000000000006 | M4: 64.659999999999997 | N4: =(J4-K4)/K4 -> 0.75640105288346515 | O4: =(L4-J4)/L4 -> 0.18706390519437369 | P4: =(L4-M4)/M4 -> 0.39638107021342422 | Q4: 60.049999999999997 | R4: 74.75 | S4: 65.5 | T4: 77.980000000000004 | U4: 70.400000000000006 | V4: 77.769999999999996 | W4: 73.269999999999996 | AB4: 18w | AC4: =(L4-Q4)/L4 -> 0.33492081072101015 | AD4: =(R4-S4)/R4 -> 0.12374581939799331 | AE4: =(T4-U4)/T4 -> 9.7204411387535244e-02 | AF4: =(V4-W4)/V4 -> 5.7862929150057869e-02 | AI4: 4T | AJ4: 是 | AK4: 是 | AL4: 是 | AM4: 是 | AN4: 是 | AO4: 不宜入场（股价已处于第6个基底） | AP4: 44571
A5: 600955.SH | B5: 维远股份 | C5: 4.2999999999999998 | D5: 化学原料 | F5: 44.520000000000003 | G5: 44.810000000000002 | H5: 45.060000000000002 | J5: 41.460000000000001 | AB5: 14w | AC5: =(L5-Q5)/L5 -> #DIV/0! | AD5: =(R5-S5)/R5 -> #DIV/0! | AE5: =(T5-U5)/T5 -> #DIV/0! | AO5: 不宜入场（当前股价小于200日均线，应持续观察3w） | AP5: 44586
A6: 000568.SZ | B6: 泸州老窖 | C6: 4.28 | D6: 饮料制造 | F6: 225.25999999999999 | G6: 227.13999999999999 | H6: 240.38999999999999 | J6: 237.19 | AO6: 不宜入场(当前股价低于50日均线，应持续观察2w) | AP6: 44571
A7: 600809.SH | B7: 山西汾酒 | C7: 4.02 | D7: 饮料制造 | F7: 299.14999999999998 | G7: 305.04000000000002 | H7: 311.81 | J7: 288.39999999999998 | AO7: 不宜入场(当前股价低于200日均线，应持续观察3w) | AP7: 44571
A8: 000596.SZ | B8: 古井贡酒 | C8: 3.85 | D8: 饮料制造 | F8: 230.06 | G8: 234.99000000000001 | H8: 248.38999999999999 | J8: 228.25999999999999 | AO8: 不宜入场(当前股价低于200日均线，应持续观察3w) | AP8: 44571
A9: 603489.SH | B9: 八方股份 | C9: 3.61 | D9: 电力设备 | F9: 226.99000000000001 | G9: 231.72 | H9: 235.71000000000001 | J9: 208.69 | AO9: 不宜入场(当前股价低于200日均线，应持续观察3w) | AP9: 44571
A10: 600436.SH | B10: 片仔癀 | C10: 3.33 | D10: 中药 | F10: 390.49000000000001 | G10: 404.23000000000002 | H10: 435.25 | J10: 394.98000000000002 | AO10: 不宜入场(当前股价低于150日均线，应持续观察3w) | AP10: 44571
A11: 600486.SH | B11: 扬农化工 | C11: 3.28 | D11: 化学制品 | F11: 122.45 | G11: 123.16 | H11: 127.68000000000001 | J11: 124.56 | AO11: 不宜入场(当前股价小于50日均线，应持续观察1w) | AP11: 44571
A12: 600702.SH | B12: 舍得酒业 | C12: 2.92 | D12: 饮料制造 | F12: 185.12 | G12: 197.66999999999999 | H12: 222.30000000000001 | J12: 213 | AO12: 不宜入场(当前股价小于50日均线，应持续观察2w) | AP12: 44571
A13: 002821.SZ | B13: 凯莱英 | C13: 2.88 | D13: 医疗服务 | F13: 382.60000000000002 | G13: 396.81 | H13: 424.01999999999998 | J13: 350.60000000000002 | AO13: 不宜入场(当前股价低于200日均线，应持续观察3w) | AP13: 44571
A14: 603267.SH | B14: 鸿远电子 | C14: 2.84 | D14: 国防军工 | F14: 149.47999999999999 | G14: 154.31999999999999 | H14: 167.53 | J14: 153.5 | AO14: 不宜入场(当前股价低于150日均线，应持续观察3w) | AP14: 44571
A15: 600600.SH | B15: 青岛啤酒 | C15: 2.67 | D15: 饮料制造 | F15: 92.980000000000004 | G15: 94.329999999999998 | H15: 98.510000000000005 | J15: 95.140000000000001 | AO15: 不宜入场(当前股价小于50日均线，应持续观察2w) | AP15: 44571
A16: 601799.SH | B16: 星宇股份 | C16: 2.65 | D16: 汽车零部件 | F16: 204.91 | G16: 206.55000000000001 | H16: 209.40000000000001 | J16: 199 | AO16: 不宜入场(当前股价低于200日均线，应持续观察3w) | AP16: 44571
A17: 605117.SH | B17: 德业股份 | C17: 2.64 | D17: 白色家电 | F17: 191.13 | G17: 212.55000000000001 | H17: 257.82999999999998 | J17: 234.63 | AO17: 不宜入场(当前股价小于50日均线，应持续观察2w) | AP17: 44571
A18: 605369.SH | B18: 拱东医疗 | C18: 2.57 | D18: 医疗器械 | F18: 98.519999999999996 | G18: 104.53 | H18: 120.06999999999999 | J18: 147.87 | K18: 38.579999999999998 | L18: 155.28999999999999 | M18: 93.230000000000004 | N18: =(J18-K18)/K18 -> 2.8328149300155525 | O18: =(L18-J18)/L18 -> 4.7781569965870227e-02 | P18: =(L18-M18)/M18 -> 0.6656655582966855 | Q18: 132.16 | AB18: 1w | AC18: =(L18-Q18)/L18 -> 0.14894713117393263 | AD18: =(R18-S18)/R18 -> #DIV/0! | AE18: =(T18-U18)/T18 -> #DIV/0! | AF18: =(V18-W18)/V18 -> #DIV/0! | AG18: =(X18-Y18)/X18 -> #DIV/0! | AO18: 暂不宜入场（收缩幅度不够，应继续观察1w） | AP18: 44586
A19: 603986.SH | B19: 兆易创新 | C19: 2.5 | D19: 半导体及元件 | F19: 155.93000000000001 | G19: 159.74000000000001 | H19: 165.83000000000001 | J19: 156.5 | AO19: 不宜入场(当前股价低于150日均线，应持续观察3w) | AP19: 44571
A20: 600563.SH | B20: 法拉电子 | C20: 2.45 | D20: 半导体及元件 | F20: 177.46000000000001 | G20: 189.47999999999999 | H20: 216.87 | J20: 197.30000000000001 | AO20: 不宜入场(当前股价小于50日均线，应持续观察2w) | AP20: 44571
A21: 002913.SZ | B21: 奥士康 | C21: 2.42 | D21: 半导体及元件 | F21: 76.430000000000007 | G21: 78.370000000000005 | H21: 79.150000000000006 | J21: 75.359999999999999 | AO21: 不宜入场(当前股价低于200日均线，应持续观察3w) | AP21: 44571
A22: 603129.SH | B22: 春风动力 | C22: 2.42 | D22: 非汽车交运 | F22: 150.36000000000001 | G22: 153.88 | H22: 165.59999999999999 | J22: 149.80000000000001 | K22: 101.8 | L22: 193.58000000000001 | M22: 119.17 | N22: =(J22-K22)/K22 -> 0.47151277013752468 | O22: =(L22-J22)/L22 -> 0.22615972724455005 | P22: =(L22-M22)/M22 -> 0.62440211462616435 | Q22: 148.96000000000001 | AB22: 7w | AC22: =(L22-Q22)/L22 -> 0.23049901849364604 | AD22: =(R22-S22)/R22 -> #DIV/0! | AE22: =(T22-U22)/T22 -> #DIV/0! | AF22: =(V22-W22)/V22 -> #DIV/0! | AG22: =(X22-Y22)/X22 -> #DIV/0! | AO22: 不宜入场(当前股价低于200日均线，应持续观察3w) | AP22: 44586
A23: 002049.SZ | B23: 紫光国微 | C23: 2.3999999999999999 | D23: 半导体及元件 | F23: 182.16999999999999 | G23: 192.72999999999999 | H23: 213.34999999999999 | J23: 205 | AO23: 不宜入场(当前股价小于50日均线，应持续观察2w) | AP23: 44571
A24: 600141.SH | B24: 兴发集团 | C24: 2.22 | D24: 化学制品 | F24: 32.07 | G24: 34.590000000000003 | H24: 38.840000000000003 | J24: 33.710000000000001 | AO24: 不宜入场（当前股价小于150日均线，应继续观察3w） | AP24: 44571
A25: 603599.SH | B25: 广信股份 | C25: 2.22 | D25: 化学制品 | F25: 33.659999999999997 | G25: 34.439999999999998 | H25: 37.159999999999997 | J25: 34.5 | AO25: 不宜入场(当前股价小于50日均线，应持续观察1w) | AP25: 44586
A26: 000799.SZ | B26: 酒鬼酒 | C26: 2.22 | D26: 饮料制造 | F26: 213.30000000000001 | G26: 218.81 | H26: 222.31999999999999 | J26: 191.99000000000001 | AO26: 不宜入场(当前股价小于200日均线，应持续观察3w) | AP26: 44571
A27: 605111.SH | B27: 新洁能 | C27: 2.19 | D27: 半导体及元件 | F27: 155.94999999999999 | G27: 162.22 | H27: 179.83000000000001 | J27: 154.08000000000001 | AO27: 不宜入场(当前股价小于200日均线，应持续观察3w) | AP27: 44571
A28: 603217.SH | B28: 元利科技 | C28: 2.16 | D28: 化学制品 | E28: 2 | F28: 38.689999999999998 | G28: 40.520000000000003 | H28: 44.18 | J28: 39.240000000000002 | AO28: 不宜入场(当前股价小于150日均线，应持续观察2w) | AP28: 44586
A29: 601677.SH | B29: 明泰铝业 | C29: 2.12 | D29: 工业金属 | F29: 31.100000000000001 | G29: 32.939999999999998 | H29: 38.399999999999999 | J29: 39.880000000000003 | K29: 13.18 | L29: 45.509999999999998 | M29: 32.5 | N29: =(J29-K29)/K29 -> 2.0257966616084979 | O29: =(L29-J29)/L29 -> 0.12370907492858703 | P29: =(L29-M29)/M29 -> 0.40030769230769225 | Q29: 39.149999999999999 | AB29: 3w | AC29: =(L29-Q29)/L29 -> 0.13974950560316413 | AD29: =(R29-S29)/R29 -> #DIV/0! | AE29: =(T29-U29)/T29 -> #DIV/0! | AF29: =(V29-W29)/V29 -> #DIV/0! | AG29: =(X29-Y29)/X29 -> #DIV/0! | AJ29: 是 | AK29: 是 | AO29: 不宜入场（收缩幅度不够，应继续观察1w） | AP29: 44586
A30: 002916.SZ | B30: 深南电路 | C30: 2.09 | D30: 半导体及元件 | F30: 100.83 | G30: 102.76000000000001 | H30: 109.81 | J30: 113.84999999999999 | K30: 73.930000000000007 | L30: 126.66 | M30: 82.579999999999998 | N30: =(J30-K30)/K30 -> 0.53997024212092493 | O30: =(L30-J30)/L30 -> 0.10113690194220751 | P30: =(L30-M30)/M30 -> 0.53378542019859532 | Q30: 85.5 | R30: 123.73999999999999 | S30: 108 | T30: 120.36 | U30: 113.15000000000001 | AB30: 18w | AC30: =(L30-Q30)/L30 -> 0.32496447181430599 | AD30: =(R30-S30)/R30 -> 0.12720219815742684 | AE30: =(T30-U30)/T30 -> 5.9903622465935474e-02 | AO30: 不宜入场（成交量行为不太明朗，应继续观察1w） | AP30: 44588
A31: 600779.SH | B31: 水井坊 | C31: 2.05 | D31: 饮料制造 | F31: 116.06 | G31: 121.2 | H31: 127.15000000000001 | J31: 114.55 | AO31: 不宜入场（当前股价小于200日均线，应继续观察3w） | AP31: 44571
A32: 601088.SH | B32: 中国神华 | C32: 2.05 | D32: 煤炭开采加工 | E32: 4 | F32: 19.82 | G32: 20.25 | H32: 21.52 | J32: 22.780000000000001 | K32: 14.41 | L32: 24.449999999999999 | M32: 18.079999999999998 | N32: =(J32-K32)/K32 -> 0.58084663428174887 | O32: =(L32-J32)/L32 -> 6.8302658486707496e-02 | P32: =(L32-M32)/M32 -> 0.35232300884955758 | Q32: 18.57 | R32: 23.260000000000002 | S32: 21.079999999999998 | T32: 23.359999999999999 | U32: 21.600000000000001 | V32: 23.27 | W32: 21.91 | X32: 23.449999999999999 | Y32: 22.18 | Z32: 23.510000000000002 | AA32: 22.359999999999999 | AB32: 14w | AC32: =(L32-Q32)/L32 -> 0.24049079754601224 | AD32: =(R32-S32)/R32 -> 9.3723129836629546e-02 | AE32: =(T32-U32)/T32 -> 7.534246575342457e-02 | AF32: =(V32-W32)/V32 -> 5.8444348947142219e-02 | AG32: =(X32-Y32)/X32 -> 5.4157782515991452e-02 | AH32: =(Z32-AA32)/Z32 -> 4.8915355168013701e-02 | AJ32: 是 | AK32: 是 | AL32: 是 | AM32: 是 | AO32: 可以入场 | AP32: 44578
A33: 605080.SH | B33: 浙江自然 | C33: 2.04 | D33: 服装家纺 | F33: 61.469999999999999 | G33: 64.019999999999996 | H33: 70.480000000000004 | J33: 69.099999999999994 | K33: 36.109999999999999 | L33: 80.890000000000001 | M33: 58.5 | N33: =(J33-K33)/K33 -> 0.91359734145666005 | O33: =(L33-J33)/L33 -> 0.14575349239708255 | P33: =(L33-M33)/M33 -> 0.38273504273504272 | AO33: 不宜入场(当前股价小于50日均线，应持续观察2w) | AP33: 44571
A34: 603799.SH | B34: 华友钴业 | C34: 1.98 | D34: 小金属 | F34: 107.09999999999999 | G34: 110.89 | H34: 114.23999999999999 | J34: 98.010000000000005 | AO34: 不宜入场（当前股价小于200日均线，应继续观察3w） | AP34: 44571
A35: 603297.SH | B35: 永新光学 | C35: 1.97 | D35: 光学光电子 | F35: 65.859999999999999 | G35: 70.349999999999994 | H35: 88.370000000000005 | J35: 104.27 | K35: 36.710000000000001 | L35: 116.84 | M35: 56.649999999999999 | N35: =(J35-K35)/K35 -> 1.8403704712612368 | O35: =(L35-J35)/L35 -> 0.10758301951386517 | P35: =(L35-M35)/M35 -> 1.0624889673433364 | Q35: 92.5 | R35: 129.19999999999999 | S35: 108.95999999999999 | AB35: 2w | AC35: =(L35-Q35)/L35 -> 0.2083190688120507 | AD35: =(R35-S35)/R35 -> 0.15665634674922599 | AF35: =(V35-W35)/V35 -> #DIV/0! | AG35: =(X35-Y35)/X35 -> #DIV/0! | AO35: 已分析，见其他表 | AP35: 44557
A36: 603392.SH | B36: 万泰生物 | C36: 1.96 | D36: 医疗器械 | F36: 222.63999999999999 | G36: 226.56999999999999 | H36: 228.09999999999999 | J36: 209 | K36: 144.61000000000001 | L36: 299.76999999999998 | M36: 223.50999999999999 | N36: =(J36-K36)/K36 -> 0.44526657907475264 | O36: =(L36-J36)/L36 -> 0.3027988124228575 | P36: =(L36-M36)/M36 -> 0.3411927877947295 | AO36: 不宜入场（当前股价小于200日均线，应继续观察3w） | AP36: 44571
A37: 603589.SH | B37: 口子窖 | C37: 1.92 | D37: 饮料制造 | F37: 62.719999999999999 | G37: 64.010000000000005 | H37: 70.040000000000006 | J37: 67.390000000000001 | AO37: 不宜入场(当前股价小于50日均线，应持续观察2w) | AP37: 44571
A38: 603995.SH | B38: 甬金股份 | C38: 1.87 | D38: 钢铁 | F38: 42.229999999999997 | G38: 44.049999999999997 | H38: 49.5 | J38: 56.850000000000001 | K38: 27.579999999999998 | L38: 62.869999999999997 | M38: 47.990000000000002 | N38: =(J38-K38)/K38 -> 1.0612762871646122 | O38: =(L38-J38)/L38 -> 9.5753141402894801e-02 | P38: =(L38-M38)/M38 -> 0.31006459679099801 | Q38: 55.799999999999997 | AB38: 3w | AC38: =(L38-Q38)/L38 -> 0.11245427071735328 | AD38: =(R38-S38)/R38 -> #DIV/0! | AE38: =(T38-U38)/T38 -> #DIV/0! | AF38: =(V38-W38)/V38 -> #DIV/0! | AG38: =(X38-Y38)/X38 -> #DIV/0! | AI38: 3T | AJ38: 是 | AK38: 是 | AL38: 是 | AM38: 是 | AN38: 否 | AO38: 不宜入场(收缩量不够，应持续观察1w) | AP38: 44586
A39: 000733.SZ | B39: 振华科技 | C39: 1.86 | D39: 国防军工 | F39: 86.159999999999997 | G39: 91.379999999999995 | H39: 108.56 | J39: 118.52 | K39: 45.359999999999999 | L39: 130.46000000000001 | M39: 107.3 | N39: =(L39-K39)/K39 -> 1.8761022927689597 | O39: =(L39-J39)/L39 -> 9.1522305687567154e-02 | P39: =(L39-M39)/M39 -> 0.21584342963653319 | Q39: 114.97 | AB39: 1w | AC39: =(L39-Q39)/L39 -> 0.11873371148244678 | AD39: =(R39-S39)/R39 -> #DIV/0! | AE39: =(T39-U39)/T39 -> #DIV/0! | AF39: =(V39-W39)/V39 -> #DIV/0! | AO39: 不宜入场(收缩量不够，应持续观察1w) | AP39: 44586
A40: 603605.SH | B40: 珀莱雅 | C40: 1.82 | D40: 美容护理 | F40: 184.31 | G40: 187.72999999999999 | H40: 198.81999999999999 | J40: 188.75 | AO40: 不宜入场(当前股价小于50日均线，应持续观察2w) | AP40: 44571
A41: 605123.SH | B41: 派克新材 | C41: 1.77 | D41: 国防军工 | F41: 99.290000000000006 | G41: 105.43000000000001 | H41: 125.92 | J41: 116 | AO41: 不宜入场(当前股价小于50日均线，应持续观察2w) | AP41: 44571
A42: 603659.SH | B42: 璞泰来 | C42: 1.77 | D42: 电力设备 | F42: 142.18000000000001 | G42: 151.41999999999999 | H42: 164.65000000000001 | J42: 138.55000000000001 | AO42: 不宜入场（当前股价小于200日均线，应继续观察3w） | AP42: 44571
A43: 600104.SH | B43: 上汽集团 | C43: 1.76 | D43: 汽车整车 | F43: 20.25 | G43: 20.359999999999999 | H43: 20.73 | J43: 20.75 | K43: 18.030000000000001 | L43: 23.449999999999999 | M43: 20.850000000000001 | N43: =(J43-K43)/K43 -> 0.15085967831392116 | O43: =(L43-J43)/L43 -> 0.11513859275053302 | P43: =(L43-M43)/M43 -> 0.12470023980815337 | AO43: 不宜入场（股价相对于最低点的距离不够） | AP43: 44571
A44: 603678.SH | B44: 火炬电子 | C44: 1.71 | D44: 国防军工 | F44: 70.689999999999998 | G44: 72.469999999999999 | H44: 74.840000000000003 | J44: 67.760000000000005 | AO44: 不宜入场（当前股价小于200日均线，应继续观察3w） | AP44: 44571
A45: 600976.SH | B45: 健民集团 | C45: 1.69 | D45: 中药 | F45: 44.140000000000001 | G45: 46.619999999999997 | H45: 53.219999999999999 | J45: 64.799999999999997 | K45: 23.91 | L45: 64.989999999999995 | M45: 40.729999999999997 | N45: =(J45-K45)/K45 -> 1.7101631116687579 | O45: =(L45-J45)/L45 -> 2.9235266964147983e-03 | P45: =(L45-M45)/M45 -> 0.59562975693591946 | Q45: 40 | R45: 52.68 | S45: 41.619999999999997 | T45: 58.100000000000001 | U45: 49.460000000000001 | V45: 64.680000000000007 | W45: 59.289999999999999 | AB45: 20w | AC45: =(L45-Q45)/L45 -> 0.38452069549161405 | AD45: =(R45-S45)/R45 -> 0.20994684889901294 | AE45: =(T45-U45)/T45 -> 0.14870912220309812 | AF45: =(V45-W45)/V45 -> 8.333333333333344e-02 | AG45: =(X45-Y45)/X45 -> #DIV/0! | AI45: 4T | AJ45: 是 | AK45: 是 | AL45: 是 | AM45: 是 | AN45: 是 | AO45: 可以入场 | AP45: 44547
A46: 603290.SH | B46: 斯达半导 | C46: 1.67 | D46: 斯达半导 | F46: 346.67000000000002 | G46: 368.38 | H46: 403.49000000000001 | J46: 329.69999999999999 | AO46: 不宜入场（当前股价小于200日均线，应继续观察3w） | AP46: 44571
A47: 600745.SH | B47: 闻泰科技 | C47: 1.65 | D47: 消费电子 | F47: 110.37 | G47: 113.23999999999999 | H47: 125.09999999999999 | J47: 123.28 | AO47: 不宜入场(当前股价小于50日均线，应持续观察2w) | AP47: 44571
A48: 603897.SH | B48: 长城科技 | C48: 1.64 | D48: 电力设备 | F48: 39.659999999999997 | G48: 43.450000000000003 | H48: 52.619999999999997 | J48: 45.039999999999999 | AO48: 不宜入场(当前股价小于50日均线，应持续观察2w) | AP48: 44571
A49: 000049.SZ | B49: 德赛电池 | C49: 1.64 | D49: 电力设备 | F49: 45.329999999999998 | G49: 45.57 | H49: 49.93 | J49: 50.899999999999999 | K49: 31.030000000000001 | L49: 65.390000000000001 | M49: 42.479999999999997 | N49: =(J49-K49)/K49 -> 0.64034805027392838 | O49: =(L49-J49)/L49 -> 0.2215935158281083 | P49: =(L49-M49)/M49 -> 0.53931261770244832 | Q49: 49.030000000000001 | AB49: 2w | AC49: =(L49-Q49)/L49 -> 0.25019116072794007 | AD49: =(R49-S49)/R49 -> #DIV/0! | AE49: =(T49-U49)/T49 -> #DIV/0! | AF49: =(V49-W49)/V49 -> #DIV/0! | AG49: =(X49-Y49)/X49 -> #DIV/0! | AO49: 不宜入场（收缩幅度不够，应持续观察3w） | AP49: 44571
A50: 603236.SH | B50: 移远通信 | C50: 1.63 | D50: 通信设备 | F50: 172.88999999999999 | G50: 175.71000000000001 | H50: 189.12 | J50: 181.80000000000001 | AO50: 不宜入场(当前股价小于50日均线) | AP50: 44571
A51: 605399.SH | B51: 晨光新材 | C51: 1.63 | D51: 化学制品 | F51: 33.670000000000002 | G51: 36.289999999999999 | H51: 42.509999999999998 | J51: 42.530000000000001 | K51: 15.210000000000001 | L51: 55.899999999999999 | M51: 37.450000000000003 | N51: =(J51-K51)/K51 -> 1.7961867192636423 | O51: =(L51-J51)/L51 -> 0.23917710196779959 | P51: =(L51-M51)/M51 -> 0.49265687583444578 | Q51: 38.25 | AB51: 3w | AC51: =(L51-Q51)/L51 -> 0.31574239713774593 | AD51: =(R51-S51)/R51 -> #DIV/0! | AE51: =(T51-U51)/T51 -> #DIV/0! | AF51: =(V51-W51)/V51 -> #DIV/0! | AO51: 不宜入场（收缩幅度不符合要求，应再观察2w） | AP51: 44571
A52: 002850.SZ | B52: 科达利 | C52: 1.61 | D52: 电力设备 | F52: 126.34999999999999 | G52: 135.81999999999999 | H52: 158.59 | J52: 139.99000000000001 | AO52: 不宜入场(当前股价小于50日均线) | AP52: 44571
A53: 002876.SZ | B53: 三利谱 | C53: 1.6000000000000001 | D53: 光学光电子 | F53: 55.140000000000001 | G53: 55.829999999999998 | H53: 57.689999999999998 | J53: 61.899999999999999 | K53: 31.870000000000001 | L53: 68.299999999999997 | M53: 53.810000000000002 | N53: =(J53-K53)/K53 -> 0.94226545340445544 | O53: =(L53-J53)/L53 -> 9.370424597364567e-02 | P53: =(L53-M53)/M53 -> 0.26928080282475364 | Q53: 46.799999999999997 | R53: 64.950000000000003 | S53: 51.07 | AB53: 21w | AC53: =(L53-Q53)/L53 -> 0.314787701317716 | AD53: =(#REF!-#REF!)/#REF! -> #REF! | AE53: =(R53-S53)/R53 -> 0.21370284834488071 | AO53: 不宜入场（收缩幅度不够，应继续持续观察1w） | AP53: 44588
A54: 600064.SH | B54: 南京高科 | C54: 1.58 | D54: 房地产开发 | F54: 9.2100000000000009 | G54: 9.1699999999999999 | N54: =(J54-K54)/K54 -> #DIV/0! | O54: =(L54-J54)/L54 -> #DIV/0! | P54: =(L54-M54)/M54 -> #DIV/0! | AC54: =(L54-Q54)/L54 -> #DIV/0! | AD54: =(R54-S54)/R54 -> #DIV/0! | AF54: =(V54-W54)/V54 -> #DIV/0! | AO54: 不宜入场（150日均线小于200日均线） | AP54: 44547
A55: 002080.SZ | B55: 中材科技 | C55: 1.58 | D55: 建筑材料 | F55: 30.969999999999999 | G55: 32.18 | H55: 34.909999999999997 | J55: 32.590000000000003 | K55: 18.77 | L55: 45.659999999999997 | M55: 27.600000000000001 | N55: =(J55-K55)/K55 -> 0.73628129994672376 | O55: =(L55-J55)/L55 -> 0.28624616732369679 | P55: =(L55-M55)/M55 -> 0.6543478260869563 | AO55: 不宜入场（成交量行为和价格行为不甚明朗） | AP55: 44570
A56: 603186.SH | B56: 华正新材 | C56: 1.53 | D56: 半导体及元件 | E56: 2 | F56: 39.240000000000002 | G56: 39.409999999999997 | H56: 40.18 | J56: 36.899999999999999 | K56: 28.48 | L56: 48.479999999999997 | M56: 33.270000000000003 | N56: =(J56-K56)/K56 -> 0.29564606741573024 | O56: =(L56-J56)/L56 -> 0.23886138613861385 | P56: =(L56-M56)/M56 -> 0.45716862037871936 | AO56: 不宜入场（当前股价小于50日均线） | AP56: 44570
A57: 002179.SZ | B57: 中航光电 | C57: 1.52 | D57: 国防军工 | F57: 85.760000000000005 | G57: 88.189999999999998 | H57: 95.140000000000001 | J57: 97 | K57: 59.100000000000001 | L57: 105.62 | M57: 79.590000000000003 | N57: =(J57-K57)/K57 -> 0.64128595600676819 | O57: =(L57-J57)/L57 -> 8.1613330808559023e-02 | P57: =(L57-M57)/M57 -> 0.32705113707752231 | Q57: 92.739999999999995 | R57: 99.579999999999998 | S57: 94.549999999999997 | T57: 99.780000000000001 | U57: 95.390000000000001 | AB57: 3w | AC57: =(L57-Q57)/L57 -> 0.1219466010225337 | AD57: =(R57-S57)/R57 -> 5.0512151034344255e-02 | AE57: =(T57-U57)/T57 -> 4.3996792944477857e-02 | AI57: 3T | AJ57: 是 | AK57: 是 | AL57: 是 | AM57: 是 | AN57: 是 | AO57: 不宜入场（成交量行为和价格行为不甚明朗） | AP57: 44557
A58: 002048.SZ | B58: 宁波华翔 | C58: 1.51 | D58: 汽车零部件 | F58: 18.559999999999999 | G58: 19.289999999999999 | H58: 21.420000000000002 | J58: 20.940000000000001 | K58: 9.9600000000000009 | L58: 24.260000000000002 | M58: 18.940000000000001 | N58: =(J58-K58)/K58 -> 1.1024096385542168 | O58: =(L58-J58)/L58 -> 0.1368507831821929 | P58: =(L58-M58)/M58 -> 0.28088701161562829 | AO58: 不宜入场(当前股价小于50日均线，应继续观察5w) | AP58: 44570
A59: 002128.SZ | B59: 电投能源 | C59: 1.5 | D59: 煤炭开采加工 | F59: 12.01 | G59: 12.390000000000001 | H59: 13.449999999999999 | J59: 17.25 | K59: 7.9800000000000004 | L59: 18.48 | M59: 10.32 | N59: =(J59-K59)/K59 -> 1.1616541353383458 | O59: =(L59-J59)/L59 -> 6.6558441558441581e-02 | P59: =(L59-M59)/M59 -> 0.79069767441860461 | Q59: 11 | AB59: 11w | AC59: =(L59-Q59)/L59 -> 0.40476190476190477 | AI59: 1T | AO59: 不宜入场(收缩幅度不够，应该持续观察6个w) | AP59: 44548
A60: 600741.SH | B60: 华域汽车 | C60: 1.49 | D60: 汽车零部件 | F60: 25.350000000000001 | G60: 25.550000000000001 | H60: 26.969999999999999 | J60: 27.920000000000002 | K60: 18.850000000000001 | L60: 30.489999999999998 | M60: 23.530000000000001 | N60: =(J60-K60)/K60 -> 0.48116710875331564 | O60: =(L60-J60)/L60 -> 8.4289931124958903e-02 | P60: =(L60-M60)/M60 -> 0.29579260518487027 | Q60: 26.300000000000001 | R60: 29.530000000000001 | S60: 27.120000000000001 | T60: 30.059999999999999 | U60: 27.800000000000001 | AB60: 6w | AC60: =(L60-Q60)/L60 -> 0.13742210560839613 | AD60: =(R60-S60)/R60 -> 8.1611920081273284e-02 | AE60: =(T60-U60)/T60 -> 7.5182967398536193e-02 | AI60: 3T | AJ60: 否 | AK60: 是 | AL60: 是 | AM60: 否 | AO60: 不宜入场(杯型尚未形成，应持续观察1w) | AP60: 44588
A61: 000623.SZ | B61: 吉林敖东 | C61: 1.49 | D61: 化学制药 | F61: 16.239999999999998 | G61: 16.370000000000001 | H61: 16.829999999999998 | J61: 17.530000000000001 | K61: 14.619999999999999 | L61: 19.899999999999999 | M61: 15.19 | N61: =(J61-K61)/K61 -> 0.19904240766073886 | O61: =(L61-J61)/L61 -> 0.11909547738693456 | P61: =(L61-M61)/M61 -> 0.31007241606319941 | Q61: 15.5 | R61: 16.989999999999998 | S61: 16.16 | T61: 17.73 | U61: 17.079999999999998 | AB61: 12w | AC61: =(L61-Q61)/L61 -> 0.22110552763819091 | AD61: =(R61-S61)/R61 -> 4.8852266038846286e-02 | AE61: =(T61-U61)/T61 -> 3.6661026508742367e-02 | AO61: 不宜入场(收缩幅度差异太大，应持续观察6个w) | AP61: 44548
A62: 601225.SH | B62: 陕西煤业 | C62: 1.47 | D62: 煤炭开采加工 | F62: 12.119999999999999 | G62: 12.369999999999999 | H62: 12.82 | J62: 13.06 | K62: 9.7100000000000009 | L62: 16.829999999999998 | M62: 11.140000000000001 | N62: =(J62-K62)/K62 -> 0.34500514933058696 | O62: =(L62-J62)/L62 -> 0.22400475341651802 | P62: =(L62-M62)/M62 -> 0.51077199281867125 | Q62: 11.31 | R62: 12.31 | S62: 11.720000000000001 | T62: 13.68 | U62: 12.380000000000001 | AB62: 12w | AC62: =(L62-Q62)/L62 -> 0.32798573975044554 | AD62: =(R62-S62)/R62 -> 4.7928513403736786e-02 | AE62: =(T62-U62)/T62 -> 9.5029239766081797e-02 | AO62: 不宜入场(收缩幅度间隔太大，应持续观察7个w) | AP62: 44548
A63: 603606.SH | B63: 东方电缆 | C63: 1.47 | D63: 电力设备 | F63: 35.090000000000003 | G63: 37.969999999999999 | H63: 47.770000000000003 | J63: 45.950000000000003 | K63: 18.510000000000002 | L63: 63.75 | M63: 31.57 | N63: =(J63-K63)/K63 -> 1.4824419232847108 | O63: =(L63-J63)/L63 -> 0.27921568627450977 | P63: =(L63-M63)/M63 -> 1.0193221412733608 | AO63: 不宜入场(当前股价小于50日均线，应该持续观察2个w) | AP63: 44548
A64: 605098.SH | B64: 行动教育 | C64: 1.46 | D64: 教育 | F64: 47.700000000000003 | G64: 48.880000000000003 | H64: 52.789999999999999 | J64: 57.869999999999997 | K64: 32.399999999999999 | L64: 63.780000000000001 | M64: 47.789999999999999 | N64: =(J64-K64)/K64 -> 0.78611111111111109 | O64: =(L64-J64)/L64 -> 9.2662276575729119e-02 | P64: =(L64-M64)/M64 -> 0.33458882611424989 | Q64: 40.479999999999997 | R64: 60.5 | S64: 47.509999999999998 | AB64: 20w | AC64: =(L64-Q64)/L64 -> 0.36531828159297591 | AD64: =(R64-S64)/R64 -> 0.21471074380165292 | AE64: =(T64-U64)/T64 -> #DIV/0! | AF64: =(V64-W64)/V64 -> #DIV/0! | AI64: 6T | AO64: 不宜入场（成交行为和价格行为尚不明朗） | AP64: 44588
A65: 603806.SH | B65: 福斯特 | C65: 1.44 | D65: 电力设备 | F65: 113.31999999999999 | G65: 118.98 | H65: 129.63 | J65: 127 | K65: 60.920000000000002 | L65: 167.08000000000001 | M65: 105.13 | N65: =(J65-K65)/K65 -> 1.0847012475377544 | O65: =(L65-J65)/L65 -> 0.23988508498922678 | P65: =(L65-M65)/M65 -> 0.58927042709026933 | Q65: 115.29000000000001 | R65: 148.53999999999999 | S65: 116.88 | T65: 137.94999999999999 | U65: 126.89 | AB65: 14w | AC65: =(L65-Q65)/L65 -> 0.30997127124730667 | AD65: =(R65-S65)/R65 -> 0.21314124141645346 | AE65: =(T65-U65)/T65 -> 8.0173976078289161e-02 | AF65: =(V65-W65)/V65 -> #DIV/0! | AO65: 已分析（见涨幅与最高收益合成表） | AP65: 44548
A66: 600566.SH | B66: 济川药业 | C66: 1.43 | D66: 中药 | F66: 18.02 | G66: 17.940000000000001 | H66: 18.52 | N66: =(J66-K66)/K66 -> #DIV/0! | O66: =(L66-J66)/L66 -> #DIV/0! | P66: =(L66-M66)/M66 -> #DIV/0! | AC66: =(L66-Q66)/L66 -> #DIV/0! | AD66: =(R66-S66)/R66 -> #DIV/0! | AE66: =(T66-U66)/T66 -> #DIV/0! | AF66: =(V66-W66)/V66 -> #DIV/0! | AO66: 不宜入场(各均线不符合要求) | AP66: 44548
A67: 002008.SZ | B67: 大族激光 | C67: 1.43 | D67: 自动化设备 | F67: 42.630000000000003 | G67: 43.140000000000001 | H67: 46.770000000000003 | J67: 53.420000000000002 | K67: 33.689999999999998 | L67: 55.109999999999999 | M67: 39.359999999999999 | N67: =(J67-K67)/K67 -> 0.5856337192045119 | O67: =(L67-J67)/L67 -> 3.0665940845581524e-02 | P67: =(L67-M67)/M67 -> 0.40015243902439024 | Q67: 45.509999999999998 | R67: 49.799999999999997 | S67: 46.460000000000001 | AB67: 2w | AC67: =(L67-Q67)/L67 -> 0.17419706042460537 | AD67: =(R67-S67)/R67 -> 6.7068273092369401e-02 | AE67: =(T67-U67)/T67 -> #DIV/0! | AF67: =(V67-W67)/V67 -> #DIV/0! | AO67: 不宜入场(收缩幅度不够，应持续观察2w) | AP67: 44588
A68: 600089.SH | B68: 特变电工 | C68: 1.3999999999999999 | D68: 电力设备 | F68: 18.68 | G68: 19.890000000000001 | H68: 22.98 | J68: 23.489999999999998 | K68: 10.300000000000001 | L68: 29.960000000000001 | M68: 12.859999999999999 | N68: =(J68-K68)/K68 -> 1.2805825242718443 | O68: =(L68-J68)/L68 -> 0.21595460614152209 | P68: =(L68-M68)/M68 -> 1.3297045101088649 | Q68: 20.710000000000001 | R68: 27.399999999999999 | S68: 21.34 | AB68: 13w | AC68: =(L68-Q68)/L68 -> 0.30874499332443256 | AD68: =(R68-S68)/R68 -> 0.2211678832116788 | AE68: =(T68-U68)/T68 -> #DIV/0! | AF68: =(V68-W68)/V68 -> #DIV/0! | AO68: 已分析（见涨幅与最高收益合成表） | AP68: 44548
A69: 002756.SZ | B69: 永兴材料 | C69: 1.38 | D69: 钢铁 | N69: =(J69-K69)/K69 -> #DIV/0! | O69: =(L69-J69)/L69 -> #DIV/0! | P69: =(L69-M69)/M69 -> #DIV/0! | AC69: =(L69-Q69)/L69 -> #DIV/0! | AD69: =(R69-S69)/R69 -> #DIV/0! | AE69: =(T69-U69)/T69 -> #DIV/0! | AF69: =(V69-W69)/V69 -> #DIV/0! | AO69: 已分析（见涨幅与最高收益合成表） | AP69: 44548
A70: 603886.SH | B70: 元祖股份 | C70: 1.38 | D70: 食品加工制造 | F70: 19.699999999999999 | G70: 20.27 | H70: 22.359999999999999 | J70: 21 | AO70: 不宜入场(当前股价小于50日均线，应该持续观察1个w) | AP70: 44586
A71: 002223.SZ | B71: 鱼跃医疗 | C71: 1.36 | D71: 医疗器械 | F71: 33.219999999999999 | G71: 33.850000000000001 | H71: 34.979999999999997 | J71: 35.859999999999999 | K71: 25.120000000000001 | L71: 41.770000000000003 | M71: 30.079999999999998 | N71: =(J71-K71)/K71 -> 0.42754777070063688 | O71: =(L71-J71)/L71 -> 0.14148910701460385 | P71: =(L71-M71)/M71 -> 0.38863031914893637 | Q71: 29.82 | AB71: 21w | AC71: =(L71-Q71)/L71 -> 0.28609049557098398 | AD71: =(R71-S71)/R71 -> #DIV/0! | AE71: =(T71-U71)/T71 -> #DIV/0! | AF71: =(V71-W71)/V71 -> #DIV/0! | AJ71: 否 | AK71: 否 | AL71: 是 | AM71: 是 | AN71: 否 | AO71: 不宜入场(成交量行为不符合要求，应该持续观察1w) | AP71: 44588
A72: 603369.SH | B72: 今世缘 | C72: 1.35 | D72: 饮料制造 | F72: 50.82 | G72: 51.729999999999997 | H72: 54.93 | J72: 51.5 | K72: 39.380000000000003 | L72: 63.43 | M72: 51.289999999999999 | N72: =(J72-K72)/K72 -> 0.30777044184865404 | O72: =(L72-J72)/L72 -> 0.18808134951915498 | P72: =(L72-M72)/M72 -> 0.23669331253655684 | Q72: 39.380000000000003 | R72: 63.380000000000003 | S72: 51.390000000000001 | AB72: 21w | AC72: =(L72-Q72)/L72 -> 0.37915812706921009 | AD72: =(R72-S72)/R72 -> 0.18917639633953931 | AE72: =(T72-U72)/T72 -> #DIV/0! | AO72: 不宜入场(当前股价小于50日均线，应该持续观察2w) | AP72: 44570
A73: 002371.SZ | B73: 北方华创 | C73: 1.34 | D73: 半导体及元件 | F73: 312.51999999999998 | G73: 332.08999999999997 | H73: 375.41000000000003 | J73: 345.5 | K73: 133.41999999999999 | L73: 452.77999999999997 | M73: 342.47000000000003 | N73: =(J73-K73)/K73 -> 1.5895667815919654 | O73: =(L73-J73)/L73 -> 0.23693626043553156 | P73: =(L73-M73)/M73 -> 0.3221012059450461 | Q73: 342.18000000000001 | AB73: 4w | AC73: =(L73-Q73)/L73 -> 0.24426873978532615 | AD73: =(R73-S73)/R73 -> #DIV/0! | AE73: =(T73-U73)/T73 -> #DIV/0! | AF73: =(V73-W73)/V73 -> #DIV/0! | AO73: 已分析（见涨幅与最高收益合成表） | AP73: 44548
A74: 600887.SH | B74: 伊利股份 | C74: 1.31 | D74: 食品加工制造 | F74: 39.100000000000001 | G74: 38.969999999999999 | H74: 40.140000000000001 | J74: 40.960000000000001 | K74: 30.899999999999999 | L74: 51.030000000000001 | M74: 38.659999999999997 | N74: =(J74-K74)/K74 -> 0.32556634304207127 | O74: =(L74-J74)/L74 -> 0.19733490103860474 | P74: =(L74-M74)/M74 -> 0.31996896016554593 | Q74: 30.899999999999999 | R74: 36.490000000000002 | S74: 32.600000000000001 | T74: 37.68 | U74: 34.350000000000001 | V74: 40.530000000000001 | W74: 37.380000000000003 | X74: 44.25 | Y74: 38.32 | Z74: 43.920000000000002 | AA74: 40.590000000000003 | AB74: 45w | AC74: =(L74-Q74)/L74 -> 0.39447383891828341 | AD74: =(R74-S74)/R74 -> 0.10660454919155934 | AE74: =(T74-U74)/T74 -> 8.8375796178343902e-02 | AF74: =(V74-W74)/V74 -> 7.7720207253885967e-02 | AG74: =(X74-Y74)/X74 -> 0.13401129943502824 | AH74: =(Z74-AA74)/Z74 -> 7.58196721311475e-02 | AO74: 不宜入场(150日均线小于200日均线) | AP74: 44548
A75: 605336.SH | B75: 帅丰电器 | C75: 1.31 | D75: 厨卫电器 | F75: 29.5 | G75: 30.109999999999999 | H75: 32.119999999999997 | J75: 33.600000000000001 | K75: 24.219999999999999 | L75: 37.5 | M75: 29.329999999999998 | N75: =(J75-K75)/K75 -> 0.38728323699421979 | O75: =(L75-J75)/L75 -> 0.10399999999999997 | P75: =(L75-M75)/M75 -> 0.27855438117967957 | Q75: 28.609999999999999 | AB75: 4w | AC75: =(L75-Q75)/L75 -> 0.23706666666666668 | AD75: =(R75-S75)/R75 -> #DIV/0! | AE75: =(T75-U75)/T75 -> #DIV/0! | AF75: =(V75-W75)/V75 -> #DIV/0! | AG75: =(X75-Y75)/X75 -> #DIV/0! | AO75: 不宜入场(收缩量不够，应该持续观察1w) | AP75: 44588
A76: 002637.SZ | B76: 赞宇科技 | C76: 1.3 | D76: 化学制品 | F76: 15.6 | G76: 15.869999999999999 | H76: 16.460000000000001 | J76: 16.539999999999999 | K76: 11.050000000000001 | L76: 20.440000000000001 | M76: 15.17 | N76: =(J76-K76)/K76 -> 0.49683257918552021 | O76: =(L76-J76)/L76 -> 0.19080234833659501 | P76: =(L76-M76)/M76 -> 0.34739617666446942 | Q76: 14.220000000000001 | R76: 18.27 | S76: 16.489999999999998 | AB76: 11w | AC76: =(L76-Q76)/L76 -> 0.30430528375733856 | AD76: =(R76-S76)/R76 -> 9.7427476737821636e-02 | AE76: =(T76-U76)/T76 -> #DIV/0! | AF76: =(V76-W76)/V76 -> #DIV/0! | AG76: =(X76-Y76)/X76 -> #DIV/0! | AO76: 不宜入场(收缩幅度不够，应该持续观察3w) | AP76: 44548
A77: 601877.SH | B77: 正泰电器 | C77: 1.29 | D77: 电力设备 | F77: 45.710000000000001 | G77: 47.770000000000003 | H77: 53.020000000000003 | J77: 53.689999999999998 | K77: 28.379999999999999 | L77: 64.120000000000005 | M77: 31 | N77: =(J77-K77)/K77 -> 0.89182522903453132 | O77: =(L77-J77)/L77 -> 0.16266375545851539 | P77: =(L77-M77)/M77 -> 1.0683870967741937 | Q77: 46.299999999999997 | R77: 62.600000000000001 | S77: 49.280000000000001 | AB77: 13w | AC77: =(L77-Q77)/L77 -> 0.27791640673736751 | AD77: =(R77-S77)/R77 -> 0.21277955271565496 | AE77: =(T77-U77)/T77 -> #DIV/0! | AF77: =(V77-W77)/V77 -> #DIV/0! | AG77: =(X77-Y77)/X77 -> #DIV/0! | AO77: 不宜入场(收缩幅度不够，应该持续观察4w) | AP77: 44548
A78: 603010.SH | B78: 万盛股份 | C78: 1.29 | D78: 化工合成材料 | N78: =(J78-K78)/K78 -> #DIV/0! | O78: =(L78-J78)/L78 -> #DIV/0! | P78: =(L78-M78)/M78 -> #DIV/0! | AC78: =(L78-Q78)/L78 -> #DIV/0! | AD78: =(R78-S78)/R78 -> #DIV/0! | AE78: =(T78-U78)/T78 -> #DIV/0! | AF78: =(V78-W78)/V78 -> #DIV/0! | AG78: =(X78-Y78)/X78 -> #DIV/0! | AO78: 已分析（见增长幅度结果表） | AP78: 44548
A79: 603733.SH | B79: 仙鹤股份 | C79: 1.28 | D79: 造纸 | F79: 33.509999999999998 | G79: 34.710000000000001 | H79: 37.109999999999999 | J79: 38.630000000000003 | K79: 23.09 | L79: 44.579999999999998 | M79: 26.989999999999998 | N79: =(J79-K79)/K79 -> 0.67301862278042457 | O79: =(L79-J79)/L79 -> 0.13346792283535208 | P79: =(L79-M79)/M79 -> 0.65172286031863658 | Q79: 30.280000000000001 | R79: 42.390000000000001 | S79: 34.619999999999997 | AB79: 21w | AC79: =(L79-Q79)/L79 -> 0.3207716464782413 | AD79: =(R79-S79)/R79 -> 0.18329794762915788 | AO79: 不宜入场(成交量行为不符合要求，应该持续观察1w) | AP79: 44588
A80: 603985.SH | B80: 恒润股份 | C80: 1.27 | D80: 电力设备 | F80: 32.450000000000003 | G80: 35.340000000000003 | H80: 46.530000000000001 | J80: 49.390000000000001 | K80: 15.01 | L80: 57.710000000000001 | M80: 26.449999999999999 | N80: =(J80-K80)/K80 -> 2.2904730179880084 | O80: =(L80-J80)/L80 -> 0.14416912146941605 | P80: =(L80-M80)/M80 -> 1.1818525519848773 | Q80: 44 | R80: 55.5 | S80: 47.5 | AB80: 5w | AC80: =(L80-Q80)/L80 -> 0.23756714607520363 | AD80: =(R80-S80)/R80 -> 0.14414414414414414 | AO80: 不宜入场(有强力拉升形态潜力，但收缩幅度不够，应多观察1w) | AP80: 44556
A81: 002597.SZ | B81: 金禾实业 | C81: 1.27 | D81: 化学制品 | F81: 41.600000000000001 | G81: 42.68 | H81: 47.140000000000001 | J81: 43.149999999999999 | K81: 28.079999999999998 | L81: 54.189999999999998 | M81: 38.890000000000001 | N81: =(J81-K81)/K81 -> 0.5366809116809117 | O81: =(L81-J81)/L81 -> 0.20372762502306699 | P81: =(L81-M81)/M81 -> 0.39341733093340181 | AO81: 不宜入场(当前股价小于50日均线，应该持续观察2w) | AP81: 44570
A82: 002889.SZ | B82: 东方嘉盛 | C82: 1.27 | D82: 物流 | F82: 24.600000000000001 | G82: 24.670000000000002 | H82: 25.030000000000001 | J82: 26.09 | K82: 20.91 | L82: 32.460000000000001 | M82: 23.16 | N82: =(J82-K82)/K82 -> 0.24772835963653753 | O82: =(L82-J82)/L82 -> 0.19624152803450404 | P82: =(L82-M82)/M82 -> 0.40155440414507776 | Q82: 21.449999999999999 | R82: 26.25 | S82: 22.190000000000001 | T82: 26.27 | U82: 22.600000000000001 | V82: 28.870000000000001 | W82: 25.629999999999999 | X82: 27.449999999999999 | Y82: 25.699999999999999 | AB82: 29w | AC82: =(L82-Q82)/L82 -> 0.33918669131238449 | AD82: =(R82-S82)/R82 -> 0.15466666666666662 | AE82: =(T82-U82)/T82 -> 0.13970308336505513 | AF82: =(V82-W82)/V82 -> 0.11222722549359203 | AG82: =(X82-Y82)/X82 -> 6.3752276867030971e-02 | AI82: 5T | AJ82: 是 | AK82: 否 | AL82: 是 | AM82: 否 | AN82: 否 | AO82: 不宜入场(杯型形成不太好，处于杯子的中下部，网球行为也不是很明朗，应该持续观察1w) | AP82: 44572
A83: 002985.SZ | B83: 北摩高科 | C83: 1.27 | D83: 国防军工 | F83: 105.67 | G83: 107.91 | H83: 113.03 | J83: 110.5 | K83: 76.299999999999997 | L83: 135.30000000000001 | M83: 96.239999999999995 | N83: =(J83-K83)/K83 -> 0.44823066841415471 | O83: =(L83-J83)/L83 -> 0.18329637841832971 | P83: =(L83-M83)/M83 -> 0.40586034912718222 | Q83: 98.510000000000005 | R83: 128.5 | S83: 109.58 | AB83: 12w | AC83: =(L83-Q83)/L83 -> 0.27191426459719142 | AD83: =(R83-S83)/R83 -> 0.14723735408560312 | AE83: =(T83-U83)/T83 -> #DIV/0! | AF83: =(V83-W83)/V83 -> #DIV/0! | AG83: =(X83-Y83)/X83 -> #DIV/0! | AI83: 2T | AO83: 不宜入场(股价太高，每股收益太低，风险太大) | AP83: 44557
A84: 605222.SH | B84: 起帆电缆 | C84: 1.27 | D84: 电力设备 | F84: 22.5 | G84: 23.050000000000001 | H84: 25.25 | J84: 25.32 | K84: 18.920000000000002 | L84: 31.440000000000001 | M84: 22.940000000000001 | N84: =(J84-K84)/K84 -> 0.33826638477801257 | O84: =(L84-J84)/L84 -> 0.19465648854961834 | P84: =(L84-M84)/M84 -> 0.37053182214472535 | Q84: 24.609999999999999 | AB84: 4w | AC84: =(L84-Q84)/L84 -> 0.21723918575063619 | AD84: =(R84-S84)/R84 -> #DIV/0! | AE84: =(T84-U84)/T84 -> #DIV/0! | AF84: =(V84-W84)/V84 -> #DIV/0! | AG84: =(X84-Y84)/X84 -> #DIV/0! | AO84: 不宜入场(收缩幅度不够，应该持续观察3w) | AP84: 44548
A85: 001872.SZ | B85: 招商港口 | C85: 1.27 | D85: 港口航运 | F85: 16.219999999999999 | G85: 16.43 | H85: 16.98 | J85: 16.219999999999999 | AB85: 15w | AC85: =(L85-Q85)/L85 -> #DIV/0! | AD85: =(R85-S85)/R85 -> #DIV/0! | AE85: =(T85-U85)/T85 -> #DIV/0! | AF85: =(V85-W85)/V85 -> #DIV/0! | AG85: =(X85-Y85)/X85 -> #DIV/0! | AI85: 3T | AJ85: 是 | AK85: 否 | AL85: 是 | AM85: 是 | AN85: 是 | AO85: 不宜入场(当前股价小于150日均线，应该持续观察2w) | AP85: 44586
A86: 600373.SH | B86: 中文传媒 | C86: 1.26 | D86: 传媒 | F86: 10.51 | G86: 10.66 | H86: 11.15 | J86: 12.26 | K86: 8.5299999999999994 | L86: 12.390000000000001 | M86: 10.32 | N86: =(J86-K86)/K86 -> 0.43728018757327092 | O86: =(L86-J86)/L86 -> 1.0492332526230894e-02 | P86: =(L86-M86)/M86 -> 0.20058139534883723 | Q86: 11.69 | R86: 12.56 | S86: 11.800000000000001 | AB86: 1w | AC86: =(L86-Q86)/L86 -> 5.6497175141243021e-02 | AD86: =(R86-S86)/R86 -> 6.0509554140127368e-02 | AE86: =(T86-U86)/T86 -> #DIV/0! | AF86: =(V86-W86)/V86 -> #DIV/0! | AG86: =(X86-Y86)/X86 -> #DIV/0! | AI86: 1T | AJ86: 是 | AK86: 是 | AL86: 是 | AM86: 是 | AN86: 是 | AO86: 可以入场 | AP86: 44553
A87: 600328.SH | B87: 中盐化工 | C87: 1.26 | D87: 化学原料 | N87: =(J87-K87)/K87 -> #DIV/0! | O87: =(L87-J87)/L87 -> #DIV/0! | P87: =(L87-M87)/M87 -> #DIV/0! | AC87: =(L87-Q87)/L87 -> #DIV/0! | AD87: =(R87-S87)/R87 -> #DIV/0! | AE87: =(T87-U87)/T87 -> #DIV/0! | AF87: =(V87-W87)/V87 -> #DIV/0! | AG87: =(X87-Y87)/X87 -> #DIV/0! | AO87: 不宜入场(各均线斜率朝下) | AP87: 44548
A88: 001217.SZ | B88: 华尔泰 | C88: 1.25 | D88: 化学原料 | N88: =(J88-K88)/K88 -> #DIV/0! | O88: =(L88-J88)/L88 -> #DIV/0! | P88: =(L88-M88)/M88 -> #DIV/0! | AC88: =(L88-Q88)/L88 -> #DIV/0! | AD88: =(R88-S88)/R88 -> #DIV/0! | AE88: =(T88-U88)/T88 -> #DIV/0! | AF88: =(V88-W88)/V88 -> #DIV/0! | AG88: =(X88-Y88)/X88 -> #DIV/0! | AO88: 不宜入场(各均线斜率朝下) | AP88: 44548
A89: 600298.SH | B89: 安琪酵母 | C89: 1.24 | D89: 食品加工制造 | F89: 52.990000000000002 | G89: 52.850000000000001 | N89: =(J89-K89)/K89 -> #DIV/0! | O89: =(L89-J89)/L89 -> #DIV/0! | P89: =(L89-M89)/M89 -> #DIV/0! | AC89: =(L89-Q89)/L89 -> #DIV/0! | AD89: =(R89-S89)/R89 -> #DIV/0! | AE89: =(T89-U89)/T89 -> #DIV/0! | AF89: =(V89-W89)/V89 -> #DIV/0! | AG89: =(X89-Y89)/X89 -> #DIV/0! | AO89: 不宜入场(150日均线小于200日均线，应观察6w) | AP89: 44548
A90: 600123.SH | B90: 兰花科创 | C90: 1.23 | D90: 煤炭开采加工 | F90: 8.8900000000000006 | G90: 9.3699999999999992 | H90: 10.02 | J90: 9.9600000000000009 | K90: 4.4699999999999998 | L90: 14.67 | M90: 8.9399999999999995 | N90: =(J90-K90)/K90 -> 1.2281879194630876 | O90: =(L90-J90)/L90 -> 0.32106339468302653 | P90: =(L90-M90)/M90 -> 0.64093959731543637 | AC90: =(L90-Q90)/L90 -> 1 | AD90: =(R90-S90)/R90 -> #DIV/0! | AE90: =(T90-U90)/T90 -> #DIV/0! | AF90: =(V90-W90)/V90 -> #DIV/0! | AG90: =(X90-Y90)/X90 -> #DIV/0! | AO90: 不宜入场(当前股价距离最高点距离太远，面临巨大抛压,应观察2w) | AP90: 44548
A91: 603095.SH | B91: 越剑智能 | C91: 1.22 | D91: 专用设备 | F91: 23.609999999999999 | G91: 23.890000000000001 | H91: 24.84 | J91: 24.59 | K91: 20.809999999999999 | L91: 27.07 | M91: 24.77 | N91: =(J91-K91)/K91 -> 0.18164344065353202 | O91: =(L91-J91)/L91 -> 9.1614333210195797e-02 | P91: =(L91-M91)/M91 -> 9.2854259184497412e-02 | Q91: 24.5 | AC91: =(L91-Q91)/L91 -> 9.4939046915404515e-02 | AD91: =(R91-S91)/R91 -> #DIV/0! | AE91: =(T91-U91)/T91 -> #DIV/0! | AF91: =(V91-W91)/V91 -> #DIV/0! | AG91: =(X91-Y91)/X91 -> #DIV/0! | AO91: 不宜入场(当前股价距离最低点距离太近，涨幅不够,应观察2w) | AP91: 44548
A92: 603197.SH | B92: 保隆科技 | C92: 1.2 | D92: 汽车零部件 | F92: 35.310000000000002 | G92: 37.299999999999997 | H92: 46.289999999999999 | J92: 66.129999999999995 | K92: 22.620000000000001 | L92: 69.489999999999995 | M92: 26.399999999999999 | N92: =(J92-K92)/K92 -> 1.9235190097259058 | O92: =(L92-J92)/L92 -> 4.8352280903727153e-02 | P92: =(L92-M92)/M92 -> 1.6321969696969696 | Q92: 53.149999999999999 | AB92: 2w | AC92: =(L92-Q92)/L92 -> 0.23514174701395882 | AD92: =(R92-S92)/R92 -> #DIV/0! | AO92: 不宜入场(有强力拉升形态潜力，但收缩幅度不够，应多观察1w) | AP92: 44553
A93: 603198.SH | B93: 迎驾贡酒 | C93: 1.2 | D93: 饮料制造 | N93: =(J93-K93)/K93 -> #DIV/0! | O93: =(L93-J93)/L93 -> #DIV/0! | P93: =(L93-M93)/M93 -> #DIV/0! | AC93: =(L93-Q93)/L93 -> #DIV/0! | AD93: =(R93-S93)/R93 -> #DIV/0! | AE93: =(T93-U93)/T93 -> #DIV/0! | AF93: =(V93-W93)/V93 -> #DIV/0! | AG93: =(X93-Y93)/X93 -> #DIV/0! | AO93: 已分析（见涨幅与最高收益合成表） | AP93: 44548
A94: 603258.SH | B94: 电魂网络 | C94: 1.18 | D94: 传媒 | F94: 25.699999999999999 | G94: 25.600000000000001 | N94: =(J94-K94)/K94 -> #DIV/0! | O94: =(L94-J94)/L94 -> #DIV/0! | P94: =(L94-M94)/M94 -> #DIV/0! | AC94: =(L94-Q94)/L94 -> #DIV/0! | AD94: =(R94-S94)/R94 -> #DIV/0! | AE94: =(T94-U94)/T94 -> #DIV/0! | AF94: =(V94-W94)/V94 -> #DIV/0! | AG94: =(X94-Y94)/X94 -> #DIV/0! | AO94: 不宜入场(150日均线小于200日均线，应观察6w) | AP94: 44548
A95: 000885.SZ | B95: 城发环境 | C95: 1.18 | D95: 公路铁路运输 | F95: 9.9800000000000004 | G95: 10.08 | H95: 10.42 | J95: 10.460000000000001 | K95: 8.4800000000000004 | L95: 11.57 | M95: 9.0299999999999994 | N95: =(J95-K95)/K95 -> 0.23349056603773588 | O95: =(L95-J95)/L95 -> 9.5937770095073413e-02 | P95: =(L95-M95)/M95 -> 0.28128460686600232 | AC95: =(L95-Q95)/L95 -> 1 | AD95: =(R95-S95)/R95 -> #DIV/0! | AE95: =(T95-U95)/T95 -> #DIV/0! | AF95: =(V95-W95)/V95 -> #DIV/0! | AG95: =(X95-Y95)/X95 -> #DIV/0! | AO95: 不宜入场(当前股价距离最低点距离太近，涨幅不够) | AP95: 44548
A96: 002557.SZ | B96: 洽洽食品 | C96: 1.18 | D96: 食品加工制造 | F96: 49.920000000000002 | G96: 50.210000000000001 | H96: 54.329999999999998 | J96: 60.509999999999998 | K96: 35.799999999999997 | L96: 69.099999999999994 | M96: 58.630000000000003 | N96: =(J96-K96)/K96 -> 0.69022346368715093 | O96: =(L96-J96)/L96 -> 0.12431259044862514 | P96: =(L96-M96)/M96 -> 0.17857752004093452 | Q96: 35.799999999999997 | R96: 46.880000000000003 | S96: 36.020000000000003 | T96: 59.530000000000001 | U96: 51.979999999999997 | V96: 59.5 | W96: 54.810000000000002 | X96: 61.700000000000003 | AB96: 41w | AC96: =(L96-Q96)/L96 -> 0.48191027496382055 | AD96: =(R96-S96)/R96 -> 0.23165529010238906 | AE96: =(T96-U96)/T96 -> 0.12682681001175886 | AF96: =(V96-W96)/V96 -> 7.8823529411764667e-02 | AI96: 4T | AJ96: 是 | AK96: 是 | AL96: 是 | AM96: 是 | AN96: 否 | AO96: 可以入场（寻找合适身位进场） | AP96: 44553
A97: 603203.SH | B97: 快克股份 | C97: 1.17 | D97: 自动化设备 | N97: =(J97-K97)/K97 -> #DIV/0! | O97: =(L97-J97)/L97 -> #DIV/0! | P97: =(L97-M97)/M97 -> #DIV/0! | AC97: =(L97-Q97)/L97 -> #DIV/0! | AD97: =(R97-S97)/R97 -> #DIV/0! | AE97: =(T97-U97)/T97 -> #DIV/0! | AF97: =(V97-W97)/V97 -> #DIV/0! | AO97: 已分析（见增长幅度最大表） | AP97: 44548
A98: 603681.SH | B98: 永冠新材 | C98: 1.17 | D98: 化学制品 | F98: 31.629999999999999 | G98: 33.149999999999999 | H98: 36.07 | J98: 32.979999999999997 | K98: 18.48 | L98: 41.969999999999999 | M98: 26.260000000000002 | N98: =(J98-K98)/K98 -> 0.78463203463203446 | O98: =(L98-J98)/L98 -> 0.21420061949011204 | P98: =(L98-M98)/M98 -> 0.59824828636709815 | Q98: 29.77 | R98: 41.18 | S98: 32.619999999999997 | AB98: 17w | AC98: =(L98-Q98)/L98 -> 0.29068382177746011 | AD98: =(R98-S98)/R98 -> 0.20786789703739686 | AE98: =(T98-U98)/T98 -> #DIV/0! | AF98: =(V98-W98)/V98 -> #DIV/0! | AO98: 已分析（见涨幅与最高收益合成表） | AP98: 44588
A99: 002258.SZ | B99: 利尔化学 | C99: 1.17 | D99: 化学制品 | F99: 27.469999999999999 | G99: 27.800000000000001 | H99: 28.890000000000001 | J99: 32.439999999999998 | K99: 21.350000000000001 | L99: 35.259999999999998 | M99: 25.82 | N99: =(J99-K99)/K99 -> 0.51943793911007008 | O99: =(L99-J99)/L99 -> 7.9977311401021003e-02 | P99: =(L99-M99)/M99 -> 0.36560805577072025 | Q99: 22.309999999999999 | AB99: 12w | AC99: =(L99-Q99)/L99 -> 0.3672716959727737 | AD99: =(R99-S99)/R99 -> #DIV/0! | AE99: =(T99-U99)/T99 -> #DIV/0! | AF99: =(V99-W99)/V99 -> #DIV/0! | AO99: 不宜入场(收缩幅度不够，应该持续观察3w) | AP99: 44548
A100: 002929.SZ | B100: 润建股份 | C100: 1.16 | D100: 通信服务 | F100: 30.109999999999999 | G100: 31.18 | H100: 34.920000000000002 | J100: 37.5 | K100: 20 | L100: 39.43 | M100: 31.91 | N100: =(J100-K100)/K100 -> 0.875 | O100: =(L100-J100)/L100 -> 4.8947501902104992e-02 | P100: =(L100-M100)/M100 -> 0.2356628016295832 | Q100: 33.170000000000002 | R100: 38.380000000000003 | S100: 33.420000000000002 | AB100: 2w | AC100: =(L100-Q100)/L100 -> 0.15876236368247523 | AD100: =(R100-S100)/R100 -> 0.12923397602918188 | AE100: =(T100-U100)/T100 -> #DIV/0! | AF100: =(V100-W100)/V100 -> #DIV/0! | AO100: 不宜入场(收缩幅度不够，应该持续观察1w) | AP100: 44586
A101: 002028.SZ | B101: 思源电气 | C101: 1.16 | D101: 电力设备 | F101: 39.850000000000001 | G101: 41.810000000000002 | H101: 47.560000000000002 | J101: 45.899999999999999 | AO101: 不宜入场(当前股价低于50日均线，应该持续观察2w) | AP101: 44586
A102: 600153.SH | B102: 建发股份 | C102: 1.15 | D102: 物流 | F102: 8.0199999999999996 | G102: 8.0600000000000005 | H102: 8.3200000000000003 | J102: 8.9100000000000001 | K102: 7.0499999999999998 | L102: 9.4600000000000009 | M102: 7.4000000000000004 | N102: =(J102-K102)/K102 -> 0.2638297872340426 | O102: =(L102-J102)/L102 -> 5.8139534883720999e-02 | P102: =(L102-M102)/M102 -> 0.27837837837837842 | Q102: 7.5 | R102: 8.4600000000000009 | S102: 8.0399999999999991 | T102: 9.2200000000000006 | U102: 8.5800000000000001 | V102: 9.0500000000000007 | W102: 8.6600000000000001 | AB102: 14w | AC102: =(L102-Q102)/L102 -> 0.20718816067653284 | AD102: =(R102-S102)/R102 -> 4.9645390070922182e-02 | AE102: =(T102-U102)/T102 -> 6.9414316702820014e-02 | AF102: =(V102-W102)/V102 -> 4.3093922651933764e-02 | AO102: 不宜入场(收缩幅度不够，应该持续观察3w) | AP102: 44548
A103: 600803.SH | B103: 新奥股份 | C103: 1.15 | D103: 燃气 | N103: =(J103-K103)/K103 -> #DIV/0! | O103: =(L103-J103)/L103 -> #DIV/0! | P103: =(L103-M103)/M103 -> #DIV/0! | AC103: =(L103-Q103)/L103 -> #DIV/0! | AD103: =(R103-S103)/R103 -> #DIV/0! | AO103: 已分析（见增长幅度表） | AP103: 44548
A104: 605089.SH | B104: 味知香 | C104: 1.15 | D104: 食品加工制造 | N104: =(J104-K104)/K104 -> #DIV/0! | O104: =(L104-J104)/L104 -> #DIV/0! | P104: =(L104-M104)/M104 -> #DIV/0! | AC104: =(L104-Q104)/L104 -> #DIV/0! | AD104: =(R104-S104)/R104 -> #DIV/0! | AO104: 已分析（见涨幅与最高收益合成表） | AP104: 44548
A105: 003026.SZ | B105: 中晶科技 | C105: 1.14 | D105: 半导体及元件 | N105: =(J105-K105)/K105 -> #DIV/0! | O105: =(L105-J105)/L105 -> #DIV/0! | P105: =(L105-M105)/M105 -> #DIV/0! | AC105: =(L105-Q105)/L105 -> #DIV/0! | AD105: =(R105-S105)/R105 -> #DIV/0! | AO105: 已分析（见涨幅与最高收益合成表） | AP105: 44548
A106: 000776.SZ | B106: 广发证券 | C106: 1.13 | D106: 证券 | F106: 19.75 | G106: 20.609999999999999 | H106: 23.199999999999999 | J106: 22.780000000000001 | K106: 13.98 | L106: 27.219999999999999 | M106: 21.100000000000001 | N106: =(J106-K106)/K106 -> 0.62947067238912735 | O106: =(L106-J106)/L106 -> 0.1631153563556208 | P106: =(L106-M106)/M106 -> 0.2900473933649288 | AO106: 不宜入场(当前股价低于50日均线，应该持续观察2w) | AP106: 44570
A107: 003043.SZ | B107: 华亚智能 | C107: 1.13 | D107: 半导体及元件 | N107: =(J107-K107)/K107 -> #DIV/0! | O107: =(L107-J107)/L107 -> #DIV/0! | P107: =(L107-M107)/M107 -> #DIV/0! | AC107: =(L107-Q107)/L107 -> #DIV/0! | AD107: =(R107-S107)/R107 -> #DIV/0! | AO107: 已分析（见涨幅与最高收益合成表） | AP107: 44548
A108: 600048.SH | B108: 保利发展 | C108: 1.13 | D108: 房地产开发 | F108: 13.31 | G108: 13.25 | H108: 13.890000000000001 | N108: =(J108-K108)/K108 -> #DIV/0! | O108: =(L108-J108)/L108 -> #DIV/0! | P108: =(L108-M108)/M108 -> #DIV/0! | AC108: =(L108-Q108)/L108 -> #DIV/0! | AD108: =(R108-S108)/R108 -> #DIV/0! | AO108: 不宜入场(150日均线小于200日均线) | AP108: 44548
A109: 601615.SH | B109: 明阳智能 | C109: 1.13 | D109: 电力设备 | F109: 23.800000000000001 | G109: 24.850000000000001 | H109: 28.870000000000001 | J109: 27.190000000000001 | N109: =(J109-K109)/K109 -> #DIV/0! | O109: =(L109-J109)/L109 -> #DIV/0! | P109: =(L109-M109)/M109 -> #DIV/0! | AC109: =(L109-Q109)/L109 -> #DIV/0! | AD109: =(R109-S109)/R109 -> #DIV/0! | AO109: 不宜入场(各均线斜率向下) | AP109: 44548
A110: 603666.SH | B110: 亿嘉和 | C110: 1.12 | D110: 自动化设备 | F110: 62.43 | G110: 63.329999999999998 | H110: 69.390000000000001 | J110: 71.840000000000003 | K110: 46.350000000000001 | L110: 84 | M110: 48.219999999999999 | N110: =(J110-K110)/K110 -> 0.54994606256742185 | O110: =(L110-J110)/L110 -> 0.14476190476190473 | P110: =(L110-M110)/M110 -> 0.74201576109498135 | Q110: 66.989999999999995 | AB110: 4w | AC110: =(L110-Q110)/L110 -> 0.20250000000000007 | AD110: =(R110-S110)/R110 -> #DIV/0! | AO110: 不宜入场(时间周期太短，应观察2w) | AP110: 44574
A111: 605377.SH | B111: 华旺科技 | C111: 1.12 | D111: 造纸 | F111: 16.149999999999999 | G111: 16.420000000000002 | H111: 16.829999999999998 | J111: 17.199999999999999 | K111: 12.49 | L111: 20.579999999999998 | M111: 16.109999999999999 | N111: =(J111-K111)/K111 -> 0.37710168134507599 | O111: =(L111-J111)/L111 -> 0.16423712342079685 | P111: =(L111-M111)/M111 -> 0.27746741154562377 | Q111: 15.08 | R111: 17.550000000000001 | S111: 16 | T111: 17.690000000000001 | U111: 16.399999999999999 | AB111: 15w | AC111: =(L111-Q111)/L111 -> 0.26724975704567533 | AD111: =(R111-S111)/R111 -> 8.8319088319088357e-02 | AO111: 不宜入场(收缩幅度不够，应观察3w) | AP111: 44557
A112: 600885.SH | B112: 宏发股份 | C112: 1.1000000000000001 | D112: 电力设备 | F112: 64.670000000000002 | G112: 66.980000000000004 | H112: 71.760000000000005 | J112: 65.099999999999994 | K112: 44.659999999999997 | L112: 81.239999999999995 | M112: 61.130000000000003 | N112: =(J112-K112)/K112 -> 0.45768025078369906 | O112: =(L112-J112)/L112 -> 0.19867060561299854 | P112: =(L112-M112)/M112 -> 0.32897104531326665 | AO112: 不宜入场(当前股价小于50日均线，应持续观察1w) | AP112: 44570
A113: 603279.SH | B113: 景津环保 | C113: 1.1000000000000001 | D113: 32.829999999999998 | E113: 34.880000000000003 | F113: 33.939999999999998 | G113: 35.96 | H113: 41.100000000000001 | J113: 38.850000000000001 | AO113: 不宜入场(当前股价小于50日均线，应持续观察1w) | AP113: 44586
A114: 000960.SZ | B114: 锡业股份 | C114: 1.09 | D114: 小金属 | F114: 17.379999999999999 | G114: 17.73 | H114: 18.170000000000002 | J114: 18.34 | K114: 9.5399999999999991 | L114: 26.300000000000001 | M114: 15.6 | N114: =(J114-K114)/K114 -> 0.92243186582809245 | O114: =(L114-J114)/L114 -> 0.30266159695817491 | P114: =(L114-M114)/M114 -> 0.68589743589743601 | AC114: =(L114-Q114)/L114 -> 1 | AD114: =(R114-S114)/R114 -> #DIV/0! | AO114: 已分析（当前股价距离最高点距离过大，面临较大抛压） | AP114: 44570
A115: 002960.SZ | B115: 青鸟消防 | C115: 1.08 | D115: 专用设备 | F115: 33.939999999999998 | G115: 35.390000000000001 | H115: 42.240000000000002 | J115: 49.100000000000001 | K115: 20.260000000000002 | L115: 51.670000000000002 | M115: 36.420000000000002 | N115: =(J115-K115)/K115 -> 1.4234945705824282 | O115: =(L115-J115)/L115 -> 4.9738726533772017e-02 | P115: =(L115-M115)/M115 -> 0.41872597473915429 | Q115: 47.140000000000001 | AB115: 1w | AC115: =(L115-Q115)/L115 -> 8.7671763112057308e-02 | AD115: =(R115-S115)/R115 -> #DIV/0! | AO115: 不宜入场(收缩幅度不够，应观察1w) | AP115: 44586
A116: 600587.SH | B116: 新华医疗 | C116: 1.08 | D116: 医疗器械 | N116: =(J116-K116)/K116 -> #DIV/0! | O116: =(L116-J116)/L116 -> #DIV/0! | P116: =(L116-M116)/M116 -> #DIV/0! | AC116: =(L116-Q116)/L116 -> #DIV/0! | AD116: =(R116-S116)/R116 -> #DIV/0! | AO116: 已分析（见涨幅与最高收益合成表） | AP116: 44548
A117: 603908.SH | B117: 牧高笛 | C117: 1.07 | D117: 服装家纺 | F117: 30.309999999999999 | G117: 31.949999999999999 | H117: 36.299999999999997 | J117: 39.289999999999999 | K117: 18.239999999999998 | L117: 45.799999999999997 | M117: 24.579999999999998 | N117: =(J117-K117)/K117 -> 1.1540570175438598 | O117: =(L117-J117)/L117 -> 0.14213973799126634 | P117: =(L117-M117)/M117 -> 0.86330349877949553 | Q117: 28.059999999999999 | R117: 41.75 | S117: 37.390000000000001 | AB117: 13w | AC117: =(L117-Q117)/L117 -> 0.38733624454148469 | AD117: =(R117-S117)/R117 -> 0.10443113772455088 | AO117: 不宜入场（收缩幅度不够） | AP117: 44548
A118: 603380.SH | B118: 易德龙 | C118: 1.06 | D118: 消费电子 | F118: 31.670000000000002 | G118: 33.259999999999998 | H118: 37.859999999999999 | J118: 36.43 | AO118: 不宜入场(当前股价小于50日均线，应观察1w) | AP118: 44586
A119: 600038.SH | B119: 中直股份 | C119: 1.05 | D119: 国防军工 | F119: 59.890000000000001 | G119: 61.43 | H119: 68.269999999999996 | J119: 71.590000000000003 | K119: 43.619999999999997 | L119: 78.799999999999997 | M119: 55.259999999999998 | N119: =(J119-K119)/K119 -> 0.64121962402567645 | O119: =(L119-J119)/L119 -> 9.1497461928933932e-02 | P119: =(L119-M119)/M119 -> 0.42598624683315239 | AB119: 1w | AC119: =(L119-Q119)/L119 -> 1 | AD119: =(R119-S119)/R119 -> #DIV/0! | AO119: 不宜入场(时间周期太短，应观察2w) | AP119: 44548
A120: 603100.SH | B120: 川仪股份 | C120: 1.05 | D120: 仪器仪表 | F120: 17.550000000000001 | G120: 18.100000000000001 | H120: 19.27 | J120: 19.800000000000001 | K120: 11.6 | L120: 23.550000000000001 | M120: 17.350000000000001 | N120: =(J120-K120)/K120 -> 0.70689655172413801 | O120: =(L120-J120)/L120 -> 0.15923566878980891 | P120: =(L120-M120)/M120 -> 0.35734870317002876 | AB120: 12w | AC120: =(L120-Q120)/L120 -> 1 | AD120: =(R120-S120)/R120 -> #DIV/0! | AE120: 0.1865 | AO120: 不宜入场(收缩幅度不够，应观察3w) | AP120: 44548
A121: 603507.SH | B121: 振江股份 | C121: 1.04 | D121: 电力设备 | N121: =(J121-K121)/K121 -> #DIV/0! | O121: =(L121-J121)/L121 -> #DIV/0! | P121: =(L121-M121)/M121 -> #DIV/0! | AC121: =(L121-Q121)/L121 -> #DIV/0! | AD121: =(R121-S121)/R121 -> #DIV/0! | AO121: 已分析（见涨幅与最高收益合成表） | AP121: 44548
A122: 002039.SZ | B122: 黔源电力 | C122: 1.03 | D122: 电力设备 | F122: 17.149999999999999 | G122: 17.760000000000002 | H122: 19.629999999999999 | J122: 23.18 | K122: 13.039999999999999 | L122: 28.739999999999998 | M122: 13.82 | N122: =(J122-K122)/K122 -> 0.77760736196319025 | O122: =(L122-J122)/L122 -> 0.19345859429366732 | P122: =(L122-M122)/M122 -> 1.0795947901591894 | Q122: 17.059999999999999 | R122: 23.5 | S122: 20.039999999999999 | AB122: 11w | AC122: =(L122-Q122)/L122 -> 0.40640222686151706 | AD122: =(R122-S122)/R122 -> 0.14723404255319153 | AO122: 不宜入场(收缩幅度不够，应观察3w) | AP122: 44548