A1: 股票代码 | B1: 股票简称 | C1: 趋势 | M1: 当前股价位置属于趋势的周期（即数基地，1到2的时候进入，3到5应该考虑卖出） | N1: 最近一年最高点是否新高 | O1: 价格波动收缩幅度 | AH1: 价格行为(得分应大于60%) | AK1: 成交量行为 | AM1: 结论 | AN1: 更新时间
C2: 行情收盘价 [1]2022.03.18 | D2: 50日均线 [2]2022.03.18 | E2: 150日均线 [3]2022.03.18 | F2: 200日均线 [4]2022.03.18 | G2: 52周内最低点 | H2: 52周内最高点 | I2: 最高点前8周收盘价 | J2: 当前股价相对于最低点百分比(至少高出25%) | K2: 当前股价相对于最高点百分比(25%内最好) | L2: 最高点前8周股价相对于最高点百分比 | O2: 技术足迹 | AH2: 支撑位和压力位是否同步升高(40%) | AI2: 是否有网球行为出现(40%) | AJ2: 上涨天数是否大于下跌天数(20%) | AK2: 不同收盘表现时交易量情况(好的收盘时，交易量是否增大，坏的收盘时，交易量是否萎缩) | AL2: 成交量收缩情况(最后的价格收缩期间的成交量应低于50天的平均水平且有一到两天交易量极低)
O3: 支撑位1 | P3: 阻力位2 | Q3: 支撑位2 | R3: 阻力位3 | S3: 支撑位3 | T3: 阻力位4 | U3: 支撑位4 | V3: 阻力位5 | W3: 支撑位5 | X3: 阻力位6 | Y3: 支撑位6 | Z3: 时间周期 | AA3: 收缩量1 | AB3: 收缩量2 | AC3: 收缩量3 | AD3: 收缩量4 | AE3: 收缩量5 | AF3: 收缩量6 | AG3: 收缩数量(至少大于3T)
A4: 605117.SH | B4: 德业股份 | C4: 258.62 | D4: 256.29 | E4: 247.71 | F4: 215.09
A5: 605111.SH | B5: 新洁能 | C5: 184.29 | D5: 165.09999999999999 | E5: 163.26 | F5: 160.5
A6: 603236.SH | B6: 移远通信 | C6: 182.65 | D6: 181.78 | E6: 177.18 | F6: 171.63
A7: 002850.SZ | B7: 科达利 | C7: 161.80000000000001 | D7: 148.28 | E7: 146.94 | F7: 133.94
A8: 605123.SH | B8: 派克新材 | C8: 140.5 | D8: 124.74 | E8: 113.98 | F8: 104.54
A9: 603297.SH | B9: 永新光学 | C9: 117 | D9: 113.21 | E9: 87.95 | F9: 81.18 | G9: 39.590000000000003 | H9: 138 | I9: 88.890000000000001 | J9: =(C9-G9)/G9 -> 1.9552917403384691 | K9: =(H9-C9)/H9 -> 0.15217391304347827 | L9: =(H9-I9)/I9 -> 0.5524805939925751 | M9: 2 | N9: 是 | O9: 92.980000000000004 | P9: 126.38 | Q9: 100.3 | R9: 117.98999999999999 | S9: 105 | T9: 126.5 | U9: 113 | AA9: =(H9-O9)/H9 -> 0.32623188405797099 | AB9: =(P9-Q9)/P9 -> 0.20636176610223136 | AC9: =(R9-S9)/R9 -> 0.11009407576913294 | AD9: =(T9-U9)/T9 -> 0.1067193675889328
A10: 003031.SZ | B10: 中瓷电子 | C10: 100.99 | D10: 94.37 | E10: 77.96 | F10: 71.31
A11: 002738.SZ | B11: 中矿资源 | C11: 99.099999999999994 | D11: 77.37 | E11: 66.53 | F11: 62.299999999999997
A12: 002932.SZ | B12: 明德生物 | C12: 91.68 | D12: 83.79 | E12: 74.54 | F12: 72.07
A13: 002865.SZ | B13: 钧达股份 | C13: 84.81 | D13: 69.73 | E13: 51.600000000000001 | F13: 44.09
A14: 603596.SH | B14: 伯特利 | C14: 75.700000000000003 | D14: 74.52 | E14: 62.25 | F14: 55.75
A15: 003038.SZ | B15: 鑫铂股份 | C15: 65.21 | D15: 64.61 | E15: 60.47 | F15: 53.41
A16: 603229.SH | B16: 奥翔药业 | C16: 64.900000000000006 | D16: 42.18 | E16: 34.56 | F16: 33.36
A17: 603688.SH | B17: 石英股份 | C17: 61.200000000000003 | D17: 57.08 | E17: 52.18 | F17: 45.26
A18: 601689.SH | B18: 拓普集团 | C18: 58.31 | D18: 55 | E18: 49.29 | F18: 45.92
A19: 603606.SH | B19: 东方电缆 | C19: 56.69 | D19: 53.08 | E19: 43.64 | F19: 37.99
A20: 600009.SH | B20: 上海机场 | C20: 52.69 | D20: 52.03 | E20: 47.75 | F20: 47.36
A21: 601865.SH | B21: 福莱特 | C21: 50.299999999999997 | D21: 48.69 | E21: 48.62 | F21: 45.71
A22: 603826.SH | B22: 坤彩科技 | C22: 49.899999999999999 | D22: 45.21 | E22: 40.76 | F22: 40.23
A23: 603868.SH | B23: 飞科电器 | C23: 49.76 | D23: 45.21 | E23: 42.11 | F23: 42.09
A24: 600765.SH | B24: 中航重机 | C24: 45.51 | D24: 44.75 | E24: 40.69 | F24: 36.13
A25: 605399.SH | B25: 晨光新材 | C25: 45.38 | D25: 45 | E25: 41.89 | F25: 36.63
A26: 603665.SH | B26: 康隆达 | C26: 45.16 | D26: 40.12 | E26: 27.72 | F26: 24.41
A27: 002353.SZ | B27: 杰瑞股份 | C27: 45.02 | D27: 44.22 | E27: 42.72 | F27: 42.41
A28: 603279.SH | B28: 景津装备 | C28: 42.799999999999997 | D28: 40.96 | E28: 38.600000000000001 | F28: 35.100000000000001
A29: 603881.SH | B29: 数据港 | C29: 39.66 | D29: 38.399999999999999 | E29: 35.200000000000003 | F29: 35.03
A30: 603063.SH | B30: 禾望电气 | C30: 39.399999999999999 | D30: 38.79 | E30: 32.5 | F30: 28.32
A31: 600378.SH | B31: 昊华科技 | C31: 38.19 | D31: 37.47 | E31: 35.64 | F31: 32.57
A32: 002761.SZ | B32: 浙江建投 | C32: 38.07 | D32: 13.97 | E32: 9.62 | F32: 9.17
A33: 002805.SZ | B33: 丰元股份 | C33: 36.32 | D33: 32.48 | E33: 32.13 | F33: 29.79
A34: 002864.SZ | B34: 盘龙药业 | C34: 36.07 | D34: 28.06 | E34: 25.46 | F34: 24.99
A35: 002935.SZ | B35: 天奥电子 | C35: 35.299999999999997 | D35: 34.83 | E35: 30.05 | F35: 27.73
A36: 000915.SZ | B36: 华特达因 | C36: 34.66 | D36: 33.299999999999997 | E36: 30.41 | F36: 29.83
A37: 002001.SZ | B37: 新和成 | C37: 33.37 | D37: 32.35 | E37: 29.69 | F37: 29.58
A38: 600188.SH | B38: 兖矿能源 | C38: 33.29 | D38: 28.17 | E38: 25.85 | F38: 23.06
A39: 600056.SH | B39: 中国医药 | C39: 33.26 | D39: 13.67 | E39: 12.1 | F39: 12.08
A40: 603019.SH | B40: 中科曙光 | C40: 32.39 | D40: 31.36 | E40: 29.45 | F40: 29.31
A41: 603351.SH | B41: 威尔药业 | C41: 32.01 | D41: 31.54 | E41: 28.07 | F41: 26.100000000000001
A42: 605286.SH | B42: 同力日升 | C42: 31.800000000000001 | D42: 27.199999999999999 | E42: 26.89 | F42: 25.59
A43: 600199.SH | B43: 金种子酒 | C43: 31.05 | D43: 19.54 | E43: 17.46 | F43: 17.15
A44: 002190.SZ | B44: 成飞集成 | C44: 29.47 | D44: 29.21 | E44: 29.03 | F44: 28.399999999999999
A45: 000893.SZ | B45: 亚钾国际 | C45: 28.600000000000001 | D45: 25.48 | E45: 21.71 | F45: 20.73
A46: 600055.SH | B46: 万东医疗 | C46: 27.63 | D46: 27.11 | E46: 23.09 | F46: 21.93
A47: 603800.SH | B47: 道森股份 | C47: 26.92 | D47: 23.33 | E47: 19.96 | F47: 17.43
A48: 002393.SZ | B48: 力生制药 | C48: 26.03 | D48: 22.22 | E48: 20.44 | F48: 20.14
A49: 603949.SH | B49: 雪龙集团 | C49: 25.99 | D49: 25.100000000000001 | E49: 21.67 | F49: 19.83
A50: 002965.SZ | B50: 祥鑫科技 | C50: 25.96 | D50: 25.24 | E50: 25.16 | F50: 25.04
A51: 605116.SH | B51: 奥锐特 | C51: 25.86 | D51: 22.72 | E51: 17.43 | F51: 16.62
A52: 603860.SH | B52: 中公高科 | C52: 25.699999999999999 | D52: 23.300000000000001 | E52: 21.35 | F52: 21.23
A53: 002735.SZ | B53: 王子新材 | C53: 25.64 | D53: 24.36 | E53: 20.76 | F53: 20.04
A54: 603199.SH | B54: 九华旅游 | C54: 25.55 | D54: 23.66 | E54: 21.63 | F54: 21.17
A55: 002779.SZ | B55: 中坚科技 | C55: 25.31 | D55: 21.899999999999999 | E55: 16.71 | F55: 15.23
A56: 603315.SH | B56: 福鞍股份 | C56: 25.09 | D56: 25 | E56: 24.59 | F56: 21.61
A57: 601088.SH | B57: 中国神华 | C57: 25.03 | D57: 24.600000000000001 | E57: 21.96 | F57: 20.96
A58: 002484.SZ | B58: 江海股份 | C58: 24.600000000000001 | D58: 23.73 | E58: 22.67 | F58: 20.88
A59: 002885.SZ | B59: 京泉华 | C59: 24.37 | D59: 20.99 | E59: 20.09 | F59: 18.800000000000001
A60: 603268.SH | B60: 松发股份 | C60: 24 | D60: 23.75 | E60: 19.44 | F60: 18.5
A61: 002971.SZ | B61: 和远气体 | C61: 23.78 | D61: 21.51 | E61: 20.43 | F61: 19.87
A62: 603090.SH | B62: 宏盛股份 | C62: 23.37 | D62: 21.5 | E62: 20.06 | F62: 18.49
A63: 002544.SZ | B63: 杰赛科技 | C63: 23.199999999999999 | D63: 23.14 | E63: 20.89 | F63: 18.94
A64: 603477.SH | B64: 巨星农牧 | C64: 23.100000000000001 | D64: 20.28 | E64: 15.43 | F64: 14.57
A65: 605333.SH | B65: 沪光股份 | C65: 22.82 | D65: 20.73 | E65: 18.01 | F65: 16.91
A66: 600523.SH | B66: 贵航股份 | C66: 22.38 | D66: 22.02 | E66: 19.18 | F66: 17.92
A67: 600818.SH | B67: 中路股份 | C67: 21.54 | D67: 12.199999999999999 | E67: 9.84 | F67: 9.77
A68: 603398.SH | B68: 沐邦高科 | C68: 21.54 | D68: 20.92 | E68: 15.75 | F68: 14.12
A69: 600668.SH | B69: 尖峰集团 | C69: 21.47 | D69: 18.92 | E69: 14.59 | F69: 13.83
A70: 603912.SH | B70: 佳力图 | C70: 21 | D70: 18.13 | E70: 16.26 | F70: 16.24
A71: 603363.SH | B71: 傲农生物 | C71: 20.899999999999999 | D71: 17.69 | E71: 12.59 | F71: 11.86
A72: 600367.SH | B72: 红星发展 | C72: 20.88 | D72: 19.94 | E72: 18.32 | F72: 16.25
A73: 603136.SH | B73: 天目湖 | C73: 20.48 | D73: 18.98 | E73: 17.27 | F73: 16.88
A74: 601028.SH | B74: 玉龙股份 | C74: 20.15 | D74: 19.25 | E74: 17.95 | F74: 17.83
A75: 603358.SH | B75: 华达科技 | C75: 20.15 | D75: 19.98 | E75: 19.48 | F75: 18.87
A76: 603399.SH | B76: 吉翔股份 | C76: 19.5 | D76: 14.92 | E76: 9.48 | F76: 8.46
A77: 002637.SZ | B77: 赞宇科技 | C77: 19.199999999999999 | D77: 18.85 | E77: 17.33 | F77: 16.71
A78: 603139.SH | B78: 康惠制药 | C78: 19.17 | D78: 18.79 | E78: 18.58 | F78: 18.18
A79: 002800.SZ | B79: 天顺股份 | C79: 19.09 | D79: 16.94 | E79: 14.79 | F79: 14.35
A80: 603177.SH | B80: 德创环保 | C80: 19.02 | D80: 18.52 | E80: 16.12 | F80: 15.52
A81: 600522.SH | B81: 中天科技 | C81: 18.62 | D81: 16.71 | E81: 13.76 | F81: 12.74
A82: 002349.SZ | B82: 精华制药 | C82: 18.56 | D82: 14.36 | E82: 8.76 | F82: 7.82
A83: 600233.SH | B83: 圆通速递 | C83: 18.199999999999999 | D83: 16.99 | E83: 14.76 | F83: 13.57
A84: 603045.SH | B84: 福达合金 | C84: 18.06 | D84: 16.92 | E84: 16.49 | F84: 15.29
A85: 002053.SZ | B85: 云南能投 | C85: 17.83 | D85: 10.52 | E85: 9.66 | F85: 9.23
A86: 600860.SH | B86: 京城股份 | C86: 17.76 | D86: 17.399999999999999 | E86: 12.13 | F86: 10.51
A87: 000815.SZ | B87: 美利云 | C87: 17.47 | D87: 9.85 | E87: 7.36 | F87: 6.83
A88: 002945.SZ | B88: 华林证券 | C88: 17.42 | D88: 14.38 | E88: 12.9 | F88: 12.82
A89: 603029.SH | B89: 天鹅股份 | C89: 17.36 | D89: 17.02 | E89: 14.77 | F89: 14.37
A90: 002728.SZ | B90: 特一药业 | C90: 17.17 | D90: 15.87 | E90: 14.18 | F90: 14.16
A91: 002015.SZ | B91: 协鑫能科 | C91: 17.13 | D91: 16.75 | E91: 15.58 | F91: 14.04
A92: 000688.SZ | B92: 国城矿业 | C92: 17.07 | D92: 15.1 | E92: 13.19 | F92: 12.18
A93: 600048.SH | B93: 保利发展 | C93: 16.98 | D93: 15.94 | E93: 14.15 | F93: 13.48
A94: 002941.SZ | B94: 新疆交建 | C94: 16.96 | D94: 13.49 | E94: 12.199999999999999 | F94: 11.800000000000001
A95: 002757.SZ | B95: 南兴股份 | C95: 16.76 | D95: 16.399999999999999 | E95: 15.23 | F95: 15.1
A96: 002552.SZ | B96: 宝鼎科技 | C96: 16.47 | D96: 15.69 | E96: 14.33 | F96: 13.699999999999999
A97: 600783.SH | B97: 鲁信创投 | C97: 16.27 | D97: 14.32 | E97: 13.44 | F97: 12.94
A98: 603909.SH | B98: 合诚股份 | C98: 16.12 | D98: 15.71 | E98: 15.51 | F98: 15.32
A99: 601699.SH | B99: 潞安环能 | C99: 16 | D99: 13.53 | E99: 13.4 | F99: 13.05
A100: 603813.SH | B100: 原尚股份 | C100: 15.96 | D100: 15.6 | E100: 14.6 | F100: 14.29
A101: 600647.SH | B101: 同达创业 | C101: 15.82 | D101: 14.06 | E101: 12.54 | F101: 12.31
A102: 002549.SZ | B102: 凯美特气 | C102: 15.77 | D102: 15.71 | E102: 14.73 | F102: 13.24
A103: 603320.SH | B103: 迪贝电气 | C103: 15.66 | D103: 13.76 | E103: 13.27 | F103: 12.82
A104: 603112.SH | B104: 华翔股份 | C104: 15.63 | D104: 14.38 | E104: 13 | F104: 12.6
A105: 600992.SH | B105: 贵绳股份 | C105: 15.28 | D105: 12.39 | E105: 9.77 | F105: 9.34
A106: 600714.SH | B106: 金瑞矿业 | C106: 15.26 | D106: 13.95 | E106: 12.49 | F106: 11.42
A107: 002246.SZ | B107: 北化股份 | C107: 14.91 | D107: 9.74 | E107: 8.1999999999999993 | F107: 7.93
A108: 002317.SZ | B108: 众生药业 | C108: 14.85 | D108: 11.79 | E108: 10.32 | F108: 9.94
A109: 002849.SZ | B109: 威星智能 | C109: 14.82 | D109: 13.59 | E109: 12.800000000000001 | F109: 12.65
A110: 603617.SH | B110: 君禾股份 | C110: 14.66 | D110: 13.07 | E110: 11.84 | F110: 11.39
A111: 600749.SH | B111: 西藏旅游 | C111: 14.64 | D111: 11.9 | E111: 10.77 | F111: 10.67
A112: 601838.SH | B112: 成都银行 | C112: 14.64 | D112: 14.17 | E112: 12.66 | F112: 12.61
A113: 601225.SH | B113: 陕西煤业 | C113: 14.42 | D113: 13.62 | E113: 13.21 | F113: 12.66
A114: 601001.SH | B114: 晋控煤业 | C114: 14.23 | D114: 12.23 | E114: 11.15 | F114: 10.27
A115: 002657.SZ | B115: 中科金财 | C115: 14.16 | D115: 13.69 | E115: 11.81 | F115: 11.62
A116: 000788.SZ | B116: 北大医药 | C116: 14 | D116: 7.56 | E116: 6.96 | F116: 6.95
A117: 001979.SZ | B117: 招商蛇口 | C117: 13.97 | D117: 13.83 | E117: 12.13 | F117: 11.72
A118: 002758.SZ | B118: 浙农股份 | C118: 13.87 | D118: 13.48 | E118: 11.16 | F118: 10.74
A119: 603269.SH | B119: 海鸥股份 | C119: 13.83 | D119: 13.73 | E119: 12.58 | F119: 12.1
A120: 600383.SH | B120: 金地集团 | C120: 13.79 | D120: 13.1 | E120: 11.58 | F120: 11.11
A121: 000810.SZ | B121: 创维数字 | C121: 13.73 | D121: 12.51 | E121: 9.64 | F121: 9.38
A122: 600318.SH | B122: 新力金融 | C122: 13.67 | D122: 11.52 | E122: 9.62 | F122: 9.14
A123: 603331.SH | B123: 百达精工 | C123: 13.67 | D123: 12.57 | E123: 12.19 | F123: 11.65
A124: 002748.SZ | B124: 世龙实业 | C124: 13.65 | D124: 12.46 | E124: 11.43 | F124: 10.21
A125: 002731.SZ | B125: 萃华珠宝 | C125: 13.5 | D125: 10.69 | E125: 8.56 | F125: 7.98
A126: 603266.SH | B126: 天龙股份 | C126: 13.5 | D126: 12.34 | E126: 11.83 | F126: 11.82
A127: 600510.SH | B127: 黑牡丹 | C127: 13.49 | D127: 9.99 | E127: 8.6999999999999993 | F127: 8.21
A128: 600571.SH | B128: 信雅达 | C128: 13.37 | D128: 12.26 | E128: 10.12 | F128: 9.35
A129: 603356.SH | B129: 华菱精工 | C129: 13.19 | D129: 12.55 | E129: 12.45 | F129: 11.85
A130: 601666.SH | B130: 平煤股份 | C130: 13.11 | D130: 11.13 | E130: 9.81 | F130: 9.08
A131: 600476.SH | B131: 湘邮科技 | C131: 13.09 | D131: 12.91 | E131: 11.57 | F131: 11.32
A132: 002104.SZ | B132: 恒宝股份 | C132: 13.07 | D132: 10.48 | E132: 7.4000000000000004 | F132: 7
A133: 002898.SZ | B133: 赛隆药业 | C133: 12.95 | D133: 12.43 | E133: 10.55 | F133: 10.38
A134: 000524.SZ | B134: 岭南控股 | C134: 12.93 | D134: 8.91 | E134: 7.56 | F134: 7.5
A135: 002910.SZ | B135: 庄园牧场 | C135: 12.91 | D135: 11.78 | E135: 11.07 | F135: 10.94
A136: 600706.SH | B136: 曲江文旅 | C136: 12.9 | D136: 10.41 | E136: 7.96 | F136: 7.67
A137: 000933.SZ | B137: 神火股份 | C137: 12.85 | D137: 11.92 | E137: 11.34 | F137: 11.16
A138: 600062.SH | B138: 华润双鹤 | C138: 12.74 | D138: 12.59 | E138: 12.06 | F138: 11.92
A139: 002037.SZ | B139: 保利联合 | C139: 12.699999999999999 | D139: 11.93 | E139: 8.54 | F139: 7.93
A140: 601952.SH | B140: 苏垦农发 | C140: 12.699999999999999 | D140: 11.92 | E140: 11.48 | F140: 11.26
A141: 002830.SZ | B141: 名雕股份 | C141: 12.47 | D141: 11.51 | E141: 10.46 | F141: 10.24
A142: 600546.SH | B142: 山煤国际 | C142: 12.44 | D142: 10.4 | E142: 9.94 | F142: 9.29
A143: 600138.SH | B143: 中青旅 | C143: 12.43 | D143: 11.55 | E143: 10.59 | F143: 10.59
A144: 603668.SH | B144: 天马科技 | C144: 12.21 | D144: 11.14 | E144: 9.16 | F144: 8.69
A145: 002197.SZ | B145: 证通电子 | C145: 12.16 | D145: 11.71 | E145: 8.8000000000000007 | F145: 8.47
A146: 002951.SZ | B146: 金时科技 | C146: 12.11 | D146: 12.09 | E146: 10.4 | F146: 10.39
A147: 002537.SZ | B147: 海联金汇 | C147: 12.06 | D147: 8.68 | E147: 6.88 | F147: 6.57
A148: 600097.SH | B148: 开创国际 | C148: 12.03 | D148: 11.43 | E148: 10.71 | F148: 10.32
A149: 000779.SZ | B149: 甘咨询 | C149: 12 | D149: 10.44 | E149: 9.21 | F149: 9.16
A150: 600272.SH | B150: 开开实业 | C150: 11.98 | D150: 11.56 | E150: 8.48 | F150: 8.15
A151: 600481.SH | B151: 双良节能 | C151: 11.93 | D151: 11.06 | E151: 11.01 | F151: 9.95
A152: 002135.SZ | B152: 东南网架 | C152: 11.9 | D152: 11.17 | E152: 10.37 | F152: 9.61
A153: 002100.SZ | B153: 天康生物 | C153: 11.81 | D153: 11.35 | E153: 9.62 | F153: 9.36
A154: 600123.SH | B154: 兰花科创 | C154: 11.81 | D154: 10.98 | E154: 10.65 | F154: 10.04
A155: 002809.SZ | B155: 红墙股份 | C155: 11.61 | D155: 10.6 | E155: 10.5 | F155: 10.39
A156: 600422.SH | B156: 昆药集团 | C156: 11.52 | D156: 10.94 | E156: 9.65 | F156: 9.62
A157: 002826.SZ | B157: 易明医药 | C157: 11.31 | D157: 10.67 | E157: 9.69 | F157: 9.49
A158: 600153.SH | B158: 建发股份 | C158: 11.25 | D158: 9.83 | E158: 8.75 | F158: 8.44
A159: 600865.SH | B159: 百大集团 | C159: 11.199999999999999 | D159: 9.68 | E159: 8.79 | F159: 8.66
A160: 600054.SH | B160: 黄山旅游 | C160: 11.11 | D160: 10.47 | E160: 9.65 | F160: 9.61
A161: 600833.SH | B161: 第一医药 | C161: 11.04 | D161: 9.97 | E161: 9 | F161: 8.98
A162: 002068.SZ | B162: 黑猫股份 | C162: 11.01 | D162: 10.39 | E162: 8.71 | F162: 8.36
A163: 002584.SZ | B163: 西陇科学 | C163: 10.94 | D163: 10.1 | E163: 8.02 | F163: 7.52
A164: 002774.SZ | B164: 快意电梯 | C164: 10.94 | D164: 9 | E164: 8.75 | F164: 8.18
A165: 000628.SZ | B165: 高新发展 | C165: 10.91 | D165: 10.62 | E165: 9.57 | F165: 9.23
A166: 000856.SZ | B166: 冀东装备 | C166: 10.85 | D166: 9.84 | E166: 8.11 | F166: 7.77
A167: 600552.SH | B167: 凯盛科技 | C167: 10.800000000000001 | D167: 10.71 | E167: 10.35 | F167: 9.58
A168: 002545.SZ | B168: 东方铁塔 | C168: 10.79 | D168: 10.16 | E168: 9.23 | F168: 8.86
A169: 600560.SH | B169: 金自天正 | C169: 10.63 | D169: 9.76 | E169: 9.43 | F169: 9.32
A170: 603333.SH | B170: 尚纬股份 | C170: 10.43 | D170: 9.63 | E170: 8.21 | F170: 7.66
A171: 002836.SZ | B171: 新宏泽 | C171: 10.38 | D171: 9.78 | E171: 8.94 | F171: 8.83
A172: 600520.SH | B172: 文一科技 | C172: 10.31 | D172: 9.62 | E172: 8.8000000000000007 | F172: 8.61
A173: 000925.SZ | B173: 众合科技 | C173: 10.27 | D173: 9.51 | E173: 8.94 | F173: 8.69
A174: 002633.SZ | B174: 申科股份 | C174: 10.199999999999999 | D174: 8.89 | E174: 8.08 | F174: 7.87
A175: 000065.SZ | B175: 北方国际 | C175: 10.18 | D175: 8.84 | E175: 8.28 | F175: 8.16
A176: 603637.SH | B176: 镇海股份 | C176: 10.18 | D176: 9.12 | E176: 8.48 | F176: 8.15
A177: 600962.SH | B177: 国投中鲁 | C177: 9.95 | D177: 9.55 | E177: 9.06 | F177: 8.71
A178: 000838.SZ | B178: 财信发展 | C178: 9.85 | D178: 7.63 | E178: 5.04 | F178: 4.5
A179: 603616.SH | B179: 韩建河山 | C179: 9.83 | D179: 8.61 | E179: 6.71 | F179: 6.41
A180: 600388.SH | B180: 龙净环保 | C180: 9.6999999999999993 | D180: 8.93 | E180: 8.71 | F180: 8.66
A181: 002205.SZ | B181: 国统股份 | C181: 9.57 | D181: 8.64 | E181: 7.79 | F181: 7.64
A182: 000590.SZ | B182: 启迪药业 | C182: 9.56 | D182: 9.36 | E182: 8.78 | F182: 8.74
A183: 002567.SZ | B183: 唐人神 | C183: 9.47 | D183: 8.61 | E183: 7.11 | F183: 6.95
A184: 002811.SZ | B184: 郑中设计 | C184: 9.41 | D184: 9.14 | E184: 8.55 | F184: 8.42
A185: 002116.SZ | B185: 中国海诚 | C185: 9.37 | D185: 8.62 | E185: 7.21 | F185: 6.95
A186: 002566.SZ | B186: 益盛药业 | C186: 9.27 | D186: 8.5 | E186: 8.05 | F186: 8.01
A187: 603918.SH | B187: 金桥信息 | C187: 9.26 | D187: 9.21 | E187: 8.05 | F187: 8.01
A188: 000666.SZ | B188: 经纬纺机 | C188: 9.23 | D188: 8.85 | E188: 8.63 | F188: 8.46
A189: 600099.SH | B189: 林海股份 | C189: 9.19 | D189: 8.71 | E189: 7.87 | F189: 7.53
A190: 000014.SZ | B190: 沙河股份 | C190: 9.15 | D190: 8.54 | E190: 7.67 | F190: 7.66
A191: 002112.SZ | B191: 三变科技 | C191: 9.14 | D191: 8.22 | E191: 7.86 | F191: 7.68
A192: 600551.SH | B192: 时代出版 | C192: 9.11 | D192: 8.35 | E192: 7.71 | F192: 7.61
A193: 000862.SZ | B193: 银星能源 | C193: 9.04 | D193: 8.42 | E193: 7.81 | F193: 7.2999999999999998
A194: 002207.SZ | B194: 准油股份 | C194: 8.95 | D194: 7.24 | E194: 6.36 | F194: 6.26
A195: 600975.SH | B195: 新五丰 | C195: 8.95 | D195: 7.59 | E195: 6.89 | F195: 6.75
A196: 000875.SZ | B196: 吉电股份 | C196: 8.88 | D196: 8.37 | E196: 7.47 | F196: 6.92
A197: 000722.SZ | B197: 湖南发展 | C197: 8.81 | D197: 8.21 | E197: 7.75 | F197: 7.61
A198: 000705.SZ | B198: 浙江震元 | C198: 8.76 | D198: 8.32 | E198: 7.75 | F198: 7.64
A199: 600602.SH | B199: 云赛智联 | C199: 8.72 | D199: 7.22 | E199: 6.36 | F199: 6.18
A200: 600507.SH | B200: 方大特钢 | C200: 8.5999999999999996 | D200: 8.19 | E200: 7.91 | F200: 7.74
A201: 600128.SH | B201: 弘业股份 | C201: 8.59 | D201: 8.01 | E201: 7.26 | F201: 7.12
A202: 600769.SH | B202: 祥龙电业 | C202: 8.44 | D202: 7.26 | E202: 6.26 | F202: 6.09
A203: 601900.SH | B203: 南方传媒 | C203: 8.37 | D203: 8.32 | E203: 7.74 | F203: 7.67
A204: 000719.SZ | B204: 中原传媒 | C204: 8.31 | D204: 8.24 | E204: 7.41 | F204: 7.19
A205: 600113.SH | B205: 浙江东日 | C205: 8.28 | D205: 7.77 | E205: 6.5999999999999996 | F205: 6.46
A206: 002051.SZ | B206: 中工国际 | C206: 8.24 | D206: 7.65 | E206: 7.14 | F206: 6.96
A207: 600996.SH | B207: 贵广网络 | C207: 8.23 | D207: 7.61 | E207: 5.63 | F207: 5.43
A208: 600351.SH | B208: 亚宝药业 | C208: 8.16 | D208: 7.92 | E208: 7.27 | F208: 6.87
A209: 600080.SH | B209: 金花股份 | C209: 8.11 | D209: 7.99 | E209: 7.56 | F209: 7.43
A210: 002474.SZ | B210: 榕基软件 | C210: 8.08 | D210: 7.12 | E210: 6.67 | F210: 6.65
A211: 601985.SH | B211: 中国核电 | C211: 8.03 | D211: 7.5 | E211: 6.89 | F211: 6.39
A212: 600358.SH | B212: 国旅联合 | C212: 7.9000000000000004 | D212: 5.78 | E212: 4.5999999999999996 | F212: 4.34
A213: 600873.SH | B213: 梅花生物 | C213: 7.9000000000000004 | D213: 7.85 | E213: 7.11 | F213: 6.76
A214: 603321.SH | B214: 梅轮电梯 | C214: 7.88 | D214: 7.28 | E214: 6.96 | F214: 6.96
A215: 600969.SH | B215: 郴电国际 | C215: 7.87 | D215: 7.38 | E215: 7.26 | F215: 7.09
A216: 600689.SH | B216: 上海三毛 | C216: 7.82 | D216: 7.52 | E216: 7.02 | F216: 6.93
A217: 600335.SH | B217: 国机汽车 | C217: 7.81 | D217: 7.62 | E217: 6.96 | F217: 6.57
A218: 002660.SZ | B218: 茂硕电源 | C218: 7.79 | D218: 7.75 | E218: 7.72 | F218: 7.68
A219: 600804.SH | B219: 鹏博士 | C219: 7.79 | D219: 6.26 | E219: 6.14 | F219: 5.84
A220: 603316.SH | B220: 诚邦股份 | C220: 7.78 | D220: 6.83 | E220: 5.71 | F220: 5.65
A221: 002548.SZ | B221: 金新农 | C221: 7.61 | D221: 6.7999999999999998 | E221: 5.99 | F221: 5.9000000000000004
A222: 603226.SH | B222: 菲林格尔 | C222: 7.61 | D222: 7.09 | E222: 7.06 | F222: 6.96
A223: 000888.SZ | B223: 峨眉山A | C223: 7.56 | D223: 7.31 | E223: 6.5999999999999996 | F223: 6.51
A224: 600629.SH | B224: 华建集团 | C224: 7.51 | D224: 7.17 | E224: 6.42 | F224: 6.2999999999999998
A225: 000953.SZ | B225: 河化股份 | C225: 7.43 | D225: 6.56 | E225: 5.34 | F225: 5.26
A226: 600613.SH | B226: 神奇制药 | C226: 7.41 | D226: 6.06 | E226: 5.55 | F226: 5.52
A227: 000931.SZ | B227: 中关村 | C227: 7.33 | D227: 7.28 | E227: 7.18 | F227: 7.06
A228: 600168.SH | B228: 武汉控股 | C228: 7.32 | D228: 7.02 | E228: 6.75 | F228: 6.73
A229: 600277.SH | B229: 亿利洁能 | C229: 7.2999999999999998 | D229: 5.73 | E229: 4.7999999999999998 | F229: 4.24
A230: 002093.SZ | B230: 国脉科技 | C230: 7.27 | D230: 6.73 | E230: 6.26 | F230: 6.24
A231: 600256.SH | B231: 广汇能源 | C231: 7.21 | D231: 6.76 | E231: 6.66 | F231: 5.86
A232: 600353.SH | B232: 旭光电子 | C232: 7.21 | D232: 7.16 | E232: 6.12 | F232: 5.92
A233: 002707.SZ | B233: 众信旅游 | C233: 7.2000000000000002 | D233: 6.64 | E233: 5.61 | F233: 5.57
A234: 000510.SZ | B234: 新金路 | C234: 7.19 | D234: 6.33 | E234: 6.24 | F234: 5.96
A235: 600797.SH | B235: 浙大网新 | C235: 7.18 | D235: 7.04 | E235: 6.64 | F235: 6.64
A236: 600594.SH | B236: 益佰制药 | C236: 7.14 | D236: 7.01 | E236: 6.38 | F236: 6.21
A237: 002336.SZ | B237: 人人乐 | C237: 7.06 | D237: 6.22 | E237: 5.08 | F237: 4.95
A238: 600770.SH | B238: 综艺股份 | C238: 7.04 | D238: 6.82 | E238: 6.35 | F238: 6.28
A239: 002098.SZ | B239: 浔兴股份 | C239: 7 | D239: 6.72 | E239: 6.58 | F239: 6.45
A240: 002244.SZ | B240: 滨江集团 | C240: 6.96 | D240: 6.03 | E240: 4.87 | F240: 4.72
A241: 000859.SZ | B241: 国风新材 | C241: 6.94 | D241: 6.9000000000000004 | E241: 6.5999999999999996 | F241: 6.44
A242: 601789.SH | B242: 宁波建工 | C242: 6.94 | D242: 5.57 | E242: 4.32 | F242: 4.15
A243: 002822.SZ | B243: 中装建设 | C243: 6.93 | D243: 6.27 | E243: 5.68 | F243: 5.68
A244: 603335.SH | B244: 迪生力 | C244: 6.85 | D244: 6.26 | E244: 5.58 | F244: 5.29
A245: 600829.SH | B245: 人民同泰 | C245: 6.7999999999999998 | D245: 6.47 | E245: 6.17 | F245: 6.09
A246: 002642.SZ | B246: 荣联科技 | C246: 6.79 | D246: 6.7000000000000002 | E246: 5.51 | F246: 5.33
A247: 601199.SH | B247: 江南水务 | C247: 6.75 | D247: 6.26 | E247: 5.16 | F247: 4.7999999999999998
A248: 000597.SZ | B248: 东北制药 | C248: 6.74 | D248: 6.22 | E248: 5.59 | F248: 5.44
A249: 603183.SH | B249: 建研院 | C249: 6.74 | D249: 6.2000000000000002 | E249: 5.79 | F249: 5.74
A250: 002061.SZ | B250: 浙江交科 | C250: 6.68 | D250: 6.23 | E250: 5.62 | F250: 5.51
A251: 000937.SZ | B251: 冀中能源 | C251: 6.66 | D251: 6.19 | E251: 6.13 | F251: 5.49
A252: 603106.SH | B252: 恒银科技 | C252: 6.64 | D252: 6.61 | E252: 5.68 | F252: 5.64
A253: 600576.SH | B253: 祥源文化 | C253: 6.63 | D253: 5.73 | E253: 5.25 | F253: 5.19
A254: 000430.SZ | B254: 张家界 | C254: 6.58 | D254: 6.17 | E254: 5.69 | F254: 5.59
A255: 002231.SZ | B255: 奥维通信 | C255: 6.57 | D255: 6.27 | E255: 5.84 | F255: 5.74
A256: 600192.SH | B256: 长城电工 | C256: 6.51 | D256: 5.57 | E256: 5.12 | F256: 4.94
A257: 002215.SZ | B257: 诺普信 | C257: 6.45 | D257: 6.2000000000000002 | E257: 6.01 | F257: 5.86
A258: 002787.SZ | B258: 华源控股 | C258: 6.42 | D258: 6.11 | E258: 5.82 | F258: 5.76
A259: 002148.SZ | B259: 北纬科技 | C259: 6.38 | D259: 5.68 | E259: 5.18 | F259: 4.99
A260: 002366.SZ | B260: 台海核电 | C260: 6.38 | D260: 4.96 | E260: 4.58 | F260: 4.34
A261: 002492.SZ | B261: 恒基达鑫 | C261: 6.37 | D261: 5.97 | E261: 5.78 | F261: 5.73
A262: 600830.SH | B262: 香溢融通 | C262: 6.36 | D262: 5.69 | E262: 5.22 | F262: 5.16
A263: 600561.SH | B263: 江西长运 | C263: 6.34 | D263: 5.59 | E263: 5.03 | F263: 4.81
A264: 601019.SH | B264: 山东出版 | C264: 6.33 | D264: 6.2999999999999998 | E264: 6.01 | F264: 5.92
A265: 600757.SH | B265: 长江传媒 | C265: 6.31 | D265: 5.65 | E265: 5.4000000000000004 | F265: 5.38
A266: 002370.SZ | B266: 亚太药业 | C266: 6.29 | D266: 6.12 | E266: 4.9000000000000004 | F266: 4.83
A267: 600678.SH | B267: 四川金顶 | C267: 6.29 | D267: 6.2000000000000002 | E267: 6.06 | F267: 5.96
A268: 000090.SZ | B268: 天健集团 | C268: 6.27 | D268: 6.27 | E268: 5.66 | F268: 5.62
A269: 000619.SZ | B269: 海螺型材 | C269: 6.27 | D269: 5.65 | E269: 5.27 | F269: 5.24
A270: 000605.SZ | B270: 渤海股份 | C270: 6.23 | D270: 5.85 | E270: 5.46 | F270: 5.42
A271: 002178.SZ | B271: 延华智能 | C271: 6.16 | D271: 5.55 | E271: 4.41 | F271: 4.21
A272: 002550.SZ | B272: 千红制药 | C272: 6.15 | D272: 5.78 | E272: 4.84 | F272: 4.66
A273: 002696.SZ | B273: 百洋股份 | C273: 6.14 | D273: 5.9000000000000004 | E273: 5.37 | F273: 5.31
A274: 002588.SZ | B274: 史丹利 | C274: 6.09 | D274: 6.01 | E274: 5.98 | F274: 5.84
A275: 600077.SH | B275: 宋都股份 | C275: 5.96 | D275: 3.34 | E275: 2.71 | F275: 2.68
A276: 002363.SZ | B276: 隆基机械 | C276: 5.91 | D276: 5.65 | E276: 5.47 | F276: 5.32
A277: 600249.SH | B277: 两面针 | C277: 5.91 | D277: 5.25 | E277: 4.98 | F277: 4.94
A278: 002613.SZ | B278: 北玻股份 | C278: 5.84 | D278: 4.11 | E278: 3.72 | F278: 3.68
A279: 600232.SH | B279: 金鹰股份 | C279: 5.83 | D279: 5.62 | E279: 5.35 | F279: 5.27
A280: 600250.SH | B280: 南纺股份 | C280: 5.7999999999999998 | D280: 5.48 | E280: 4.96 | F280: 4.92
A281: 600126.SH | B281: 杭钢股份 | C281: 5.61 | D281: 5.57 | E281: 5.45 | F281: 5.4000000000000004
A282: 600982.SH | B282: 宁波能源 | C282: 5.61 | D282: 4.97 | E282: 4.38 | F282: 4.14
A283: 002103.SZ | B283: 广博股份 | C283: 5.5999999999999996 | D283: 5.12 | E283: 4.66 | F283: 4.59
A284: 603843.SH | B284: 正平股份 | C284: 5.58 | D284: 5.16 | E284: 4.52 | F284: 4.37
A285: 600313.SH | B285: 农发种业 | C285: 5.52 | D285: 5.35 | E285: 5.17 | F285: 5.03
A286: 600302.SH | B286: 标准股份 | C286: 5.48 | D286: 4.99 | E286: 4.61 | F286: 4.51
A287: 603389.SH | B287: 亚振家居 | C287: 5.4000000000000004 | D287: 5.27 | E287: 5.18 | F287: 5.04
A288: 600550.SH | B288: 保变电气 | C288: 5.37 | D288: 5.36 | E288: 5.12 | F288: 4.87
A289: 002694.SZ | B289: 顾地科技 | C289: 5.35 | D289: 5.23 | E289: 3.85 | F289: 3.54
A290: 002671.SZ | B290: 龙泉股份 | C290: 5.32 | D290: 5.09 | E290: 4.37 | F290: 4.25
A291: 000702.SZ | B291: 正虹科技 | C291: 5.2999999999999998 | D291: 5.0999999999999996 | E291: 4.79 | F291: 4.78
A292: 000958.SZ | B292: 东方能源 | C292: 5.28 | D292: 4.95 | E292: 4.82 | F292: 4.66
A293: 002691.SZ | B293: 冀凯股份 | C293: 5.17 | D293: 5.14 | E293: 4.78 | F293: 4.64
A294: 000973.SZ | B294: 佛塑科技 | C294: 5.14 | D294: 4.91 | E294: 4.91 | F294: 4.79
A295: 600778.SH | B295: 友好集团 | C295: 5.14 | D295: 4.5999999999999996 | E295: 4.41 | F295: 4.35
A296: 600800.SH | B296: 渤海化学 | C296: 5.14 | D296: 4.69 | E296: 4.57 | F296: 4.57
A297: 002693.SZ | B297: 双成药业 | C297: 5.12 | D297: 4.7000000000000002 | E297: 4.4000000000000004 | F297: 4.34
A298: 603969.SH | B298: 银龙股份 | C298: 5.12 | D298: 4.82 | E298: 4.43 | F298: 4.33
A299: 600939.SH | B299: 重庆建工 | C299: 5.0999999999999996 | D299: 4.91 | E299: 4.02 | F299: 3.88
A300: 000637.SZ | B300: 茂化实华 | C300: 5.08 | D300: 4.94 | E300: 4.59 | F300: 4.44
A301: 600106.SH | B301: 重庆路桥 | C301: 5.03 | D301: 4.83 | E301: 3.6000000000000001 | F301: 3.33
A302: 600716.SH | B302: 凤凰股份 | C302: 5.02 | D302: 4.52 | E302: 4.17 | F302: 4.16
A303: 600698.SH | B303: 湖南天雁 | C303: 4.92 | D303: 4.73 | E303: 4.02 | F303: 3.81
A304: 601328.SH | B304: 交通银行 | C304: 4.89 | D304: 4.81 | E304: 4.62 | F304: 4.59
A305: 002514.SZ | B305: 宝馨科技 | C305: 4.88 | D305: 4.69 | E305: 4.69 | F305: 4.59
A306: 000557.SZ | B306: 西部创业 | C306: 4.84 | D306: 4.76 | E306: 4.04 | F306: 3.92
A307: 000755.SZ | B307: 山西路桥 | C307: 4.77 | D307: 4.52 | E307: 4.13 | F307: 3.95
A308: 600502.SH | B308: 安徽建工 | C308: 4.77 | D308: 4.67 | E308: 4.18 | F308: 4.11
A309: 002564.SZ | B309: 天沃科技 | C309: 4.72 | D309: 4.65 | E309: 4.54 | F309: 4.38
A310: 000692.SZ | B310: 惠天热电 | C310: 4.71 | D310: 4.14 | E310: 3.82 | F310: 3.7000000000000002
A311: 603778.SH | B311: 乾景园林 | C311: 4.71 | D311: 4.53 | E311: 4.27 | F311: 4.27
A312: 600156.SH | B312: 华升股份 | C312: 4.69 | D312: 4.22 | E312: 4.01 | F312: 3.97
A313: 002546.SZ | B313: 新联电子 | C313: 4.65 | D313: 4.37 | E313: 4.15 | F313: 4.04
A314: 002308.SZ | B314: 威创股份 | C314: 4.63 | D314: 4.57 | E314: 4.25 | F314: 4.24
A315: 600658.SH | B315: 电子城 | C315: 4.51 | D315: 4.32 | E315: 4.18 | F315: 4.13
A316: 600807.SH | B316: 济南高新 | C316: 4.48 | D316: 4.42 | E316: 3.67 | F316: 3.51
A317: 000548.SZ | B317: 湖南投资 | C317: 4.44 | D317: 4.17 | E317: 3.94 | F317: 3.92
A318: 002578.SZ | B318: 闽发铝业 | C318: 4.37 | D318: 4.24 | E318: 3.98 | F318: 3.81
A319: 002659.SZ | B319: 凯文教育 | C319: 4.37 | D319: 4.19 | E319: 3.77 | F319: 3.75
A320: 601086.SH | B320: 国芳集团 | C320: 4.27 | D320: 3.92 | E320: 3.71 | F320: 3.62
A321: 600355.SH | B321: 精伦电子 | C321: 4.26 | D321: 3.3999999999999999 | E321: 3.17 | F321: 3.07
A322: 600657.SH | B322: 信达地产 | C322: 4.26 | D322: 3.97 | E322: 3.58 | F322: 3.56
A323: 600724.SH | B323: 宁波富达 | C323: 4.16 | D323: 4.05 | E323: 3.69 | F323: 3.63
A324: 601008.SH | B324: 连云港 | C324: 4.14 | D324: 3.94 | E324: 3.77 | F324: 3.74
A325: 000514.SZ | B325: 渝开发 | C325: 4.12 | D325: 3.94 | E325: 3.48 | F325: 3.44
A326: 002133.SZ | B326: 广宇集团 | C326: 4.0999999999999996 | D326: 3.57 | E326: 3.19 | F326: 3.12
A327: 600190.SH | B327: 锦州港 | C327: 4.07 | D327: 3.38 | E327: 2.97 | F327: 2.93
A328: 600396.SH | B328: 金山股份 | C328: 4.04 | D328: 3.22 | E328: 2.85 | F328: 2.73
A329: 000552.SZ | B329: 靖远煤电 | C329: 3.99 | D329: 3.79 | E329: 3.43 | F329: 3.28
A330: 000573.SZ | B330: 粤宏远A | C330: 3.97 | D330: 3.69 | E330: 3.28 | F330: 3.24
A331: 600719.SH | B331: 大连热电 | C331: 3.96 | D331: 3.93 | E331: 3.86 | F331: 3.78
A332: 600512.SH | B332: 腾达建设 | C332: 3.95 | D332: 3.6000000000000001 | E332: 3.38 | F332: 3.31
A333: 000965.SZ | B333: 天保基建 | C333: 3.94 | D333: 2.94 | E333: 2.59 | F333: 2.59
A334: 002652.SZ | B334: 扬子新材 | C334: 3.93 | D334: 3.55 | E334: 3.39 | F334: 3.37
A335: 600853.SH | B335: 龙建股份 | C335: 3.91 | D335: 3.23 | E335: 2.75 | F335: 2.68
A336: 000428.SZ | B336: 华天酒店 | C336: 3.86 | D336: 3.6000000000000001 | E336: 3.28 | F336: 3.16
A337: 002628.SZ | B337: 成都路桥 | C337: 3.85 | D337: 3.84 | E337: 3.49 | F337: 3.47
A338: 002505.SZ | B338: 鹏都农牧 | C338: 3.71 | D338: 3.48 | E338: 3.25 | F338: 3.02
A339: 600220.SH | B339: 江苏阳光 | C339: 3.65 | D339: 2.78 | E339: 2.49 | F339: 2.41
A340: 600108.SH | B340: 亚盛集团 | C340: 3.63 | D340: 3.45 | E340: 3.3999999999999999 | F340: 3.26
A341: 600533.SH | B341: 栖霞建设 | C341: 3.63 | D341: 3.34 | E341: 3.13 | F341: 3.13
A342: 600665.SH | B342: 天地源 | C342: 3.63 | D342: 3.39 | E342: 3.09 | F342: 3.04
A343: 002087.SZ | B343: 新野纺织 | C343: 3.62 | D343: 3.57 | E343: 3.47 | F343: 3.44
A344: 600790.SH | B344: 轻纺城 | C344: 3.57 | D344: 3.51 | E344: 3.22 | F344: 3.18
A345: 000809.SZ | B345: 铁岭新城 | C345: 3.53 | D345: 3.45 | E345: 3.02 | F345: 2.76
A346: 600269.SH | B346: 赣粤高速 | C346: 3.51 | D346: 3.5 | E346: 3.44 | F346: 3.42
A347: 600397.SH | B347: 安源煤业 | C347: 3.5 | D347: 3.19 | E347: 3.14 | F347: 3.04
A348: 000861.SZ | B348: 海印股份 | C348: 3.48 | D348: 3.05 | E348: 2.61 | F348: 2.48
A349: 600082.SH | B349: 海泰发展 | C349: 3.3999999999999999 | D349: 3.13 | E349: 2.93 | F349: 2.91
A350: 600664.SH | B350: 哈药股份 | C350: 3.33 | D350: 3.27 | E350: 3.25 | F350: 3.17
A351: 000595.SZ | B351: 宝塔实业 | C351: 3.31 | D351: 3.2000000000000002 | E351: 2.91 | F351: 2.89
A352: 002437.SZ | B352: 誉衡药业 | C352: 3.27 | D352: 2.7999999999999998 | E352: 2.63 | F352: 2.62
A353: 002118.SZ | B353: 紫鑫药业 | C353: 3.26 | D353: 3.23 | E353: 2.88 | F353: 2.86
A354: 600575.SH | B354: 淮河能源 | C354: 3.26 | D354: 2.7999999999999998 | E354: 2.47 | F354: 2.3999999999999999
A355: 600159.SH | B355: 大龙地产 | C355: 3.22 | D355: 3.14 | E355: 2.73 | F355: 2.67
A356: 002247.SZ | B356: 聚力文化 | C356: 3.12 | D356: 2.8999999999999999 | E356: 2.77 | F356: 2.76
A357: 600162.SH | B357: 香江控股 | C357: 2.23 | D357: 2.19 | E357: 2.03 | F357: 1.98
A358: 600322.SH | B358: 天房发展 | C358: 2.11 | D358: 2.1000000000000001 | E358: 1.95 | F358: 1.94