A1: 股票代码 | B1: 股票简称 | C1: 基本每股收益(元)2021.09.30 | D1: 趋势 | O1: 当前股价位置属于趋势的周期（即数基地，1到2的时候进入，3到5应该考虑卖出） | P1: 波动收缩幅度 | AI1: 成交量行为 | AK1: 价格行为(得分应大于60%) | AN1: 结论 | AO1: 更新时间 | AP1: 是否值得分析
D2: 200日均线 | E2: 150日均线 | F2: 50日均线 | G2: 各均线斜率是否朝上 | H2: 当前股价 | I2: 52周内最低点 | J2: 52周内最高点 | K2: 最高点前8周收盘价 | L2: 当前股价相对于最低点百分比(至少高出25%) | M2: 当前股价相对于最高点百分比(25%内最好) | N2: 最高点前8周股价相对于最高点百分比 | P2: 技术足迹 | AI2: 不同收盘表现时交易量情况(好的收盘时，交易量是否增大，坏的收盘时，交易量是否萎缩) | AJ2: 成交量收缩情况(最后的价格收缩期间的成交量应低于50天的平均水平且有一到两天交易量极低) | AK2: 支撑位和压力位是否同步升高(40%) | AL2: 是否有网球行为出现(40%) | AM2: 上涨天数是否大于下跌天数(20%)
P3: 支撑位1 | Q3: 阻力位2 | R3: 支撑位2 | S3: 阻力位3 | T3: 支撑位3 | U3: 阻力位4 | V3: 支撑位4 | W3: 阻力位5 | X3: 支撑位5 | Y3: 阻力位6 | Z3: 支撑位6 | AA3: 时间周期 | AB3: 收缩量1 | AC3: 收缩量2 | AD3: 收缩量3 | AE3: 收缩量4 | AF3: 收缩量5 | AG3: 收缩量6 | AH3: 收缩数量(至少大于3T)
A4: 600519.SH | B4: 贵州茅台 | C4: 29.67 | AP4: 否
A5: 603444.SH | B5: 吉比特 | C5: 16.77 | AP5: 否
A6: 002932.SZ | B6: 明德生物 | C6: 10.68 | D6: 68.959999999999994 | E6: 71.730000000000004 | F6: 80 | H6: 77.5 | AN6: 不宜入场（当前股价小于50日均线,应观察2w） | AO6: 44595 | AP6: 是
A7: 000661.SZ | B7: 长春高新 | C7: 7.78 | AP7: 否
A8: 600309.SH | B8: 万华化学 | C8: 6.22 | AP8: 否
A9: 603185.SH | B9: 上机数控 | C9: 5.25 | AP9: 否
A10: 603260.SH | B10: 合盛硅业 | C10: 5.09 | D10: 122.45999999999999 | E10: 130 | F10: 129 | AN10: 不宜入场（50日均线小于150日均线,应观察4w） | AO10: 44595 | AP10: 是
A11: 002304.SZ | B11: 洋河股份 | C11: 4.82 | AP11: 否
A12: 601318.SH | B12: 中国平安 | C12: 4.63 | AP12: 否
A13: 000858.SZ | B13: 五粮液 | C13: 4.46 | AP13: 否
A14: 601888.SH | B14: 中国中免 | C14: 4.35 | AP14: 否
A15: 600955.SH | B15: 维远股份 | C15: 4.2999999999999998 | D15: 44.520000000000003 | E15: 44.810000000000002 | F15: 45.060000000000002 | H15: 41.460000000000001 | AA15: 14w | AB15: =(J15-P15)/J15 -> #DIV/0! | AC15: =(Q15-R15)/Q15 -> #DIV/0! | AD15: =(S15-T15)/S15 -> #DIV/0! | AN15: 不宜入场（当前股价小于200日均线，应持续观察3w） | AO15: 44586 | AP15: 是
A16: 000568.SZ | B16: 泸州老窖 | C16: 4.28 | D16: 227.58000000000001 | E16: 228.38999999999999 | F16: 235.47999999999999 | H16: 216.31 | AN16: 不宜入场(当前股价低于200日均线，应持续观察4w) | AO16: 44595 | AP16: 是
A17: 600941.SH | B17: 中国移动 | C17: 4.25 | D17: 57.87 | E17: 57.86 | AN17: 不宜入场(150日均线低于200日均线，应持续观察8w) | AO17: 44595 | AP17: 是
A18: 600585.SH | B18: 海螺水泥 | C18: 4.23 | AP18: 否
A19: 601919.SH | B19: 中远海控 | C19: 4.23 | D19: 17.28 | E19: 17.61 | F19: 17.69 | H19: 16.12 | AN19: 不宜入场(当前股价低于200日均线，应持续观察4w) | AO19: 44595 | AP19: 是
A20: 603501.SH | B20: 韦尔股份 | C20: 4.06 | AP20: 否
A21: 600809.SH | B21: 山西汾酒 | C21: 4.02 | AP21: 否
A22: 000596.SZ | B22: 古井贡酒 | C22: 3.85 | AP22: 否
A23: 601336.SH | B23: 新华保险 | C23: 3.83 | AP23: 否
A24: 605168.SH | B24: 三人行 | C24: 3.74 | D24: 142.04 | E24: 144.40000000000001 | F24: 167.07 | H24: 188.45 | I24: 104 | J24: 240 | K24: 120.45 | L24: =(H24-I24)/I24 -> 0.81201923076923066 | M24: =(J24-H24)/J24 -> 0.21479166666666671 | N24: =(J24-K24)/K24 -> 0.99252801992528017 | P24: 169.61 | AA24: 2w | AB24: =(J24-P24)/J24 -> 0.29329166666666662 | AC24: =(Q24-R24)/Q24 -> #DIV/0! | AN24: 不宜入场(收缩幅度不够，应持续观察2w) | AO24: 44599 | AP24: 是
A25: 603195.SH | B25: 公牛集团 | C25: 3.68 | AP25: 否
A26: 603026.SH | B26: 石大胜华 | C26: 3.66 | AP26: 否
A27: 600036.SH | B27: 招商银行 | C27: 3.62 | AP27: 否
A28: 603489.SH | B28: 八方股份 | C28: 3.61 | AP28: 否
A29: 603882.SH | B29: 金域医学 | C29: 3.6000000000000001 | AP29: 否
A30: 603833.SH | B30: 欧派家居 | C30: 3.48 | AP30: 否
A31: 000333.SZ | B31: 美的集团 | C31: 3.41 | AP31: 否
A32: 002382.SZ | B32: 蓝帆医疗 | C32: 3.41 | AP32: 否
A33: 600436.SH | B33: 片仔癀 | C33: 3.33 | D33: 397.10000000000002 | E33: 404.31999999999999 | F33: 411.70999999999998 | H33: 357.24000000000001 | AN33: 不宜入场(当前股价低于200日均线，应持续观察4w) | AO33: 44595 | AP33: 是
A34: 600486.SH | B34: 扬农化工 | C34: 3.28 | D34: 122.36 | E34: 123.16 | F34: 125.16 | H34: 117.16 | AN34: 不宜入场(当前股价低于200日均线，应持续观察4w) | AO34: 44595 | AP34: 是
A35: 002978.SZ | B35: 安宁股份 | C35: 2.97 | AP35: 否
A36: 601166.SH | B36: 兴业银行 | C36: 2.95 | AP36: 否
A37: 600702.SH | B37: 舍得酒业 | C37: 2.92 | D37: 189.47 | E37: 199.12 | F37: 211.91999999999999 | H37: 185.25 | AN37: 不宜入场(当前股价低于200日均线，应持续观察4w) | AO37: 44595 | AP37: 是
A38: 002821.SZ | B38: 凯莱英 | C38: 2.88 | D38: 383.64999999999998 | E38: 391.41000000000003 | F38: 391.43000000000001 | H38: 325.48000000000002 | AN38: 不宜入场(当前股价低于200日均线，应持续观察4w) | AO38: 44595 | AP38: 是
A39: 600612.SH | B39: 老凤祥 | C39: 2.86 | AP39: 否
A40: 605266.SH | B40: 健之佳 | C40: 2.85 | AP40: 否
A41: 603267.SH | B41: 鸿远电子 | C41: 2.84 | D41: 152.28999999999999 | E41: 156.12 | F41: 164.94999999999999 | H41: 162.71000000000001 | AN41: 不宜入场（当前股价小于50日均线,应观察2w） | AO41: 44595 | AP41: 是
A42: 603208.SH | B42: 江山欧派 | C42: 2.77 | AP42: 否
A43: 000651.SZ | B43: 格力电器 | C43: 2.71 | AP43: 否
A44: 601233.SH | B44: 桐昆股份 | C44: 2.71 | AP44: 否
A45: 603661.SH | B45: 恒林股份 | C45: 2.69 | AP45: 否
A46: 600600.SH | B46: 青岛啤酒 | C46: 2.67 | D46: 93.430000000000007 | E46: 94.180000000000007 | F46: 95.579999999999998 | H46: 92.209999999999994 | AN46: 不宜入场(当前股价小于200日均线，应持续观察4w) | AO46: 44595 | AP46: 是
A47: 600426.SH | B47: 华鲁恒升 | C47: 2.66 | AP47: 是
A48: 601799.SH | B48: 星宇股份 | C48: 2.65 | AP48: 否
A49: 605117.SH | B49: 德业股份 | C49: 2.64 | D49: 199.28999999999999 | E49: 219.56 | F49: 256.51999999999998 | H49: 260.67000000000002 | I49: 38.490000000000002 | J49: 345.99000000000001 | K49: 197.47999999999999 | L49: =(H49-I49)/I49 -> 5.7724084177708495 | M49: =(J49-H49)/J49 -> 0.24659672244862565 | N49: =(J49-K49)/K49 -> 0.75202552157180491 | P49: 222.55000000000001 | Q49: 286.98000000000002 | R49: 254.38999999999999 | AA49: 12w | AB49: =(J49-P49)/J49 -> 0.35677331714789445 | AC49: =(Q49-R49)/Q49 -> 0.11356192069133748 | AN49: 暂不宜入场（收缩幅度不够，应继续观察1w） | AO49: 44595 | AP49: 是
A50: 605499.SH | B50: 东鹏饮料 | C50: 2.64 | AP50: 是
A51: 601155.SH | B51: 新城控股 | C51: 2.61 | AP51: 否
A52: 600295.SH | B52: 鄂尔多斯 | C52: 2.6000000000000001 | AP52: 是
A53: 605369.SH | B53: 拱东医疗 | C53: 2.57 | D53: 98.519999999999996 | E53: 104.53 | F53: 120.06999999999999 | H53: 147.87 | I53: 38.579999999999998 | J53: 155.28999999999999 | K53: 93.230000000000004 | L53: =(H53-I53)/I53 -> 2.8328149300155525 | M53: =(J53-H53)/J53 -> 4.7781569965870227e-02 | N53: =(J53-K53)/K53 -> 0.6656655582966855 | P53: 132.16 | AA53: 1w | AB53: =(J53-P53)/J53 -> 0.14894713117393263 | AC53: =(Q53-R53)/Q53 -> #DIV/0! | AD53: =(S53-T53)/S53 -> #DIV/0! | AE53: =(U53-V53)/U53 -> #DIV/0! | AF53: =(W53-X53)/W53 -> #DIV/0! | AN53: 暂不宜入场（收缩幅度不够，应继续观察1w） | AO53: 44586 | AP53: 是
A54: 000028.SZ | B54: 国药一致 | C54: 2.51 | AP54: 否
A55: 603986.SH | B55: 兆易创新 | C55: 2.5 | D55: 157.03999999999999 | E55: 159.40000000000001 | F55: 160.36000000000001 | H55: 139.09999999999999 | AN55: 不宜入场(当前股价低于200日均线，应持续观察4w) | AO55: 44595 | AP55: 是
A56: 002648.SZ | B56: 卫星化学 | C56: 2.48 | AP56: 是
A57: 603102.SH | B57: 百合股份 | C57: 2.46 | AP57: 是
A58: 600563.SH | B58: 法拉电子 | C58: 2.45 | D58: 182.12 | E58: 191.81999999999999 | F58: 208.28999999999999 | H58: 196.30000000000001 | AN58: 不宜入场(当前股价小于50日均线，应持续观察2w) | AO58: 44595 | AP58: 是
A59: 002913.SZ | B59: 奥士康 | C59: 2.42 | D59: 76.930000000000007 | E59: 77.819999999999993 | F59: 75.930000000000007 | AN59: 不宜入场(50日均线小于200日均线，应持续观察6w) | AO59: 44595 | AP59: 是
A60: 603129.SH | B60: 春风动力 | C60: 2.42 | D60: 150.36000000000001 | E60: 153.88 | F60: 165.59999999999999 | H60: 149.80000000000001 | I60: 101.8 | J60: 193.58000000000001 | K60: 119.17 | L60: =(H60-I60)/I60 -> 0.47151277013752468 | M60: =(J60-H60)/J60 -> 0.22615972724455005 | N60: =(J60-K60)/K60 -> 0.62440211462616435 | P60: 148.96000000000001 | AA60: 7w | AB60: =(J60-P60)/J60 -> 0.23049901849364604 | AC60: =(Q60-R60)/Q60 -> #DIV/0! | AD60: =(S60-T60)/S60 -> #DIV/0! | AE60: =(U60-V60)/U60 -> #DIV/0! | AF60: =(W60-X60)/W60 -> #DIV/0! | AN60: 不宜入场(当前股价低于200日均线，应持续观察3w) | AO60: 44586 | AP60: 是
A61: 603393.SH | B61: 新天然气 | C61: 2.41 | AP61: 是
A62: 000039.SZ | B62: 中集集团 | C62: 2.41 | AP62: 否
A63: 002049.SZ | B63: 紫光国微 | C63: 2.3999999999999999 | D63: 187.83000000000001 | E63: 197.53999999999999 | F63: 215.53 | H63: 214.5 | AN63: 不宜入场(当前股价小于50日均线，应持续观察1w) | AO63: 44595 | AP63: 是
A64: 002142.SZ | B64: 宁波银行 | C64: 2.38 | D64: 36.86 | E64: 36.98 | F64: 38.21 | H64: 39.09 | I64: 30.01 | J64: 41.89 | K64: 33.19 | L64: =(H64-I64)/I64 -> 0.30256581139620131 | M64: =(J64-H64)/J64 -> 6.6841728336118331e-02 | N64: =(J64-K64)/K64 -> 0.26212714673094317 | P64: 30.01 | Q64: 40.28 | R64: 35.87 | AA64: 28w | AB64: =(J64-P64)/J64 -> 0.28359990451181666 | AC64: =(Q64-R64)/Q64 -> 0.10948361469712024 | AN64: 暂不宜入场（收缩幅度不够，应继续观察1w） | AO64: 44595 | AP64: 是
A65: 603486.SH | B65: 科沃斯 | C65: 2.38 | AP65: 否
A66: 600188.SH | B66: 兖矿能源 | C66: 2.38 | D66: 21.26 | E66: 22.38 | F66: 24.14 | H66: 23.11 | AN66: 不宜入场(当前股价小于50日均线，应持续观察1w) | AO66: 44595 | AP66: 是
A67: 601601.SH | B67: 中国太保 | C67: 2.36 | AP67: 否
A68: 600694.SH | B68: 大商股份 | C68: 2.25 | AP68: 否
A69: 600141.SH | B69: 兴发集团 | C69: 2.22 | D69: 32.109999999999999 | E69: 34.259999999999998 | F69: 36.159999999999997 | H69: 29.829999999999998 | AN69: 不宜入场（当前股价小于200日均线，应继续观察4w） | AO69: 44595 | AP69: 是
A70: 603599.SH | B70: 广信股份 | C70: 2.22 | D70: 33.659999999999997 | E70: 34.439999999999998 | F70: 37.159999999999997 | H70: 34.5 | AN70: 不宜入场(当前股价小于50日均线，应持续观察1w) | AO70: 44586 | AP70: 是
A71: 000799.SZ | B71: 酒鬼酒 | C71: 2.22 | AP71: 否
A72: 002791.SZ | B72: 坚朗五金 | C72: 2.19 | AP72: 否
A73: 605111.SH | B73: 新洁能 | C73: 2.19 | D73: 159.41 | E73: 163.28 | F73: 171.25999999999999 | H73: 158.72999999999999 | AN73: 不宜入场(当前股价小于200日均线，应持续观察4w) | AO73: 44595 | AP73: 是
A74: 600132.SH | B74: 重庆啤酒 | C74: 2.16 | AP74: 否
A75: 603217.SH | B75: 元利科技 | C75: 2.16 | D75: 38.75 | E75: 40.509999999999998 | F75: 43.670000000000002 | H75: 39 | AN75: 不宜入场(当前股价小于150日均线，应持续观察3w) | AO75: 44595 | AP75: 是
A76: 000581.SZ | B76: 威孚高科 | C76: 2.15 | AP76: 否
A77: 601677.SH | B77: 明泰铝业 | C77: 2.12 | D77: 31.100000000000001 | E77: 32.939999999999998 | F77: 38.399999999999999 | H77: 39.880000000000003 | I77: 13.18 | J77: 45.509999999999998 | K77: 32.5 | L77: =(H77-I77)/I77 -> 2.0257966616084979 | M77: =(J77-H77)/J77 -> 0.12370907492858703 | N77: =(J77-K77)/K77 -> 0.40030769230769225 | P77: 39.149999999999999 | AA77: 3w | AB77: =(J77-P77)/J77 -> 0.13974950560316413 | AC77: =(Q77-R77)/Q77 -> #DIV/0! | AD77: =(S77-T77)/S77 -> #DIV/0! | AE77: =(U77-V77)/U77 -> #DIV/0! | AF77: =(W77-X77)/W77 -> #DIV/0! | AI77: 是 | AJ77: 是 | AN77: 不宜入场（收缩幅度不够，应继续观察1w） | AO77: 44586 | AP77: 是
A78: 603301.SH | B78: 振德医疗 | C78: 2.12 | AP78: 是
A79: 600729.SH | B79: 重庆百货 | C79: 2.11 | AP79: 否
A80: 002916.SZ | B80: 深南电路 | C80: 2.09 | D80: 100.83 | E80: 102.76000000000001 | F80: 109.81 | H80: 113.84999999999999 | I80: 73.930000000000007 | J80: 126.66 | K80: 82.579999999999998 | L80: =(H80-I80)/I80 -> 0.53997024212092493 | M80: =(J80-H80)/J80 -> 0.10113690194220751 | N80: =(J80-K80)/K80 -> 0.53378542019859532 | P80: 85.5 | Q80: 123.73999999999999 | R80: 107.59 | AA80: 18w | AB80: =(J80-P80)/J80 -> 0.32496447181430599 | AC80: =(Q80-R80)/Q80 -> 0.1305155972199773 | AN80: 不宜入场(收缩幅度不够，应持续观察1w) | AO80: 44599 | AP80: 是
A81: 603345.SH | B81: 安井食品 | C81: 2.06 | AP81: 否
A82: 600779.SH | B82: 水井坊 | C82: 2.05 | D82: 116.06 | E82: 119.27 | F82: 117.95 | AN82: 不宜入场（50日均线小于150日均线，应继续观察5w） | AO82: 44595 | AP82: 是
A83: 601088.SH | B83: 中国神华 | C83: 2.05 | D83: 19.82 | E83: 20.25 | F83: 21.52 | H83: 22.780000000000001 | I83: 14.41 | J83: 24.449999999999999 | K83: 18.079999999999998 | L83: =(H83-I83)/I83 -> 0.58084663428174887 | M83: =(J83-H83)/J83 -> 6.8302658486707496e-02 | N83: =(J83-K83)/K83 -> 0.35232300884955758 | P83: 18.57 | Q83: 23.260000000000002 | R83: 21.079999999999998 | S83: 23.359999999999999 | T83: 21.600000000000001 | U83: 23.27 | V83: 21.91 | W83: 23.449999999999999 | X83: 22.18 | Y83: 23.510000000000002 | Z83: 22.359999999999999 | AA83: 14w | AB83: =(J83-P83)/J83 -> 0.24049079754601224 | AC83: =(Q83-R83)/Q83 -> 9.3723129836629546e-02 | AD83: =(S83-T83)/S83 -> 7.534246575342457e-02 | AE83: =(U83-V83)/U83 -> 5.8444348947142219e-02 | AF83: =(W83-X83)/W83 -> 5.4157782515991452e-02 | AG83: =(Y83-Z83)/Y83 -> 4.8915355168013701e-02 | AI83: 是 | AJ83: 是 | AK83: 是 | AL83: 是 | AN83: 可以入场 | AO83: 44578 | AP83: 是
A84: 000923.SZ | B84: 河钢资源 | C84: 2.05 | AP84: 否
A85: 603836.SH | B85: 海程邦达 | C85: 2.04 | AP85: 是
A86: 605080.SH | B86: 浙江自然 | C86: 2.04 | D86: 62.350000000000001 | E86: 64.719999999999999 | F86: 69.430000000000007 | H86: 67.349999999999994 | AN86: 不宜入场(当前股价小于50日均线，应持续观察2w) | AO86: 44595 | AP86: 是
A87: 600332.SH | B87: 白云山 | C87: 2.04 | AP87: 是
A88: 000672.SZ | B88: 上峰水泥 | C88: 1.98 | AP88: 否
A89: 603799.SH | B89: 华友钴业 | C89: 1.98 | D89: 107.09999999999999 | E89: 109.89 | F89: 109.68000000000001 | AN89: 不宜入场（50日均线小于150日均线，应继续观察5w） | AO89: 44595 | AP89: 是
A90: 002812.SZ | B90: 恩捷股份 | C90: 1.97 | AP90: 是
A91: 603297.SH | B91: 永新光学 | C91: 1.97 | D91: 78.939999999999998 | E91: 85.430000000000007 | F91: 109.17 | H91: 116.90000000000001 | I91: 34.899999999999999 | J91: 138 | K91: 88.890000000000001 | L91: =(H91-I91)/I91 -> 2.3495702005730661 | M91: =(J91-H91)/J91 -> 0.15289855072463765 | N91: =(J91-K91)/K91 -> 0.5524805939925751 | P91: 116.90000000000001 | AA91: 2w | AB91: =(J91-P91)/J91 -> 0.15289855072463765 | AN91: 暂不宜入场（收缩幅度不够，应继续观察1w） | AO91: 44595 | AP91: 是
A92: 603816.SH | B92: 顾家家居 | C92: 1.97 | AP92: 否
A93: 603392.SH | B93: 万泰生物 | C93: 1.96 | D93: 227.09999999999999 | E93: 228.52000000000001 | F93: 227.50999999999999 | AN93: 不宜入场（50日均线小于150日均线，应继续观察5w） | AO93: 44595 | AP93: 是
A94: 600596.SH | B94: 新安股份 | C94: 1.96 | D94: 24.23 | E94: 25.33 | F94: 25.27 | AN94: 不宜入场（50日均线小于150日均线，应继续观察5w） | AO94: 44595 | AP94: 是
A95: 601699.SH | B95: 潞安环能 | C95: 1.95 | D95: 11.57 | E95: 12 | F95: 12.21 | H95: 12.09 | AN95: 不宜入场(当前股价小于50日均线，应持续观察2w) | AO95: 44595 | AP95: 是
A96: 600763.SH | B96: 通策医疗 | C96: 1.93 | AP96: 否
A97: 000538.SZ | B97: 云南白药 | C97: 1.92 | AP97: 否
A98: 603589.SH | B98: 口子窖 | C98: 1.92 | D98: 63.710000000000001 | E98: 64.780000000000001 | F98: 69.010000000000005 | H98: 69.659999999999997 | I98: 47.899999999999999 | J98: 86.489999999999995 | K98: 53.780000000000001 | L98: =(H98-I98)/I98 -> 0.45427974947807931 | M98: =(J98-H98)/J98 -> 0.19458896982310092 | N98: =(J98-K98)/K98 -> 0.60821866865005569 | P98: 62.549999999999997 | AA98: 6w | AB98: =(J98-P98)/J98 -> 0.27679500520291361 | AN98: 暂不宜入场（收缩幅度不够，应继续观察2w） | AO98: 44595 | AP98: 是
A99: 001218.SZ | B99: 丽臣实业 | C99: 1.91 | AP99: 否
A100: 600746.SH | B100: 江苏索普 | C100: 1.91 | AP100: 否
A101: 000830.SZ | B101: 鲁西化工 | C101: 1.89 | AP101: 否
A102: 002841.SZ | B102: 视源股份 | C102: 1.87 | AP102: 否
A103: 603713.SH | B103: 密尔克卫 | C103: 1.87 | D103: 116.26 | E103: 117.09999999999999 | F103: 126.56 | H103: 129 | I103: 86.48 | J103: 147.57 | K103: 133.24 | L103: =(H103-I103)/I103 -> 0.49167437557816829 | M103: =(J103-H103)/J103 -> 0.12583858507826789 | N103: =(J103-K103)/K103 -> 0.10755028519963962 | P103: 86.48 | Q103: 111 | R103: 94.69 | S103: 145.22 | T103: 118.18 | U103: 139.42 | V103: 126.5 | AA103: 48w | AB103: =(J103-P103)/J103 -> 0.41397302974859385 | AC103: =(Q103-R103)/Q103 -> 0.14693693693693696 | AD103: =(S103-T103)/S103 -> 0.18620024789973827 | AE103: =(U103-V103)/U103 -> 9.2669631329794777e-02 | AN103: 不宜入场(收缩量不够，应持续观察1w) | AO103: 44595 | AP103: 是
A104: 603995.SH | B104: 甬金股份 | C104: 1.87 | D104: 42.229999999999997 | E104: 44.049999999999997 | F104: 49.5 | H104: 56.850000000000001 | I104: 27.579999999999998 | J104: 62.869999999999997 | K104: 47.990000000000002 | L104: =(H104-I104)/I104 -> 1.0612762871646122 | M104: =(J104-H104)/J104 -> 9.5753141402894801e-02 | N104: =(J104-K104)/K104 -> 0.31006459679099801 | P104: 55.799999999999997 | AA104: 3w | AB104: =(J104-P104)/J104 -> 0.11245427071735328 | AC104: =(Q104-R104)/Q104 -> #DIV/0! | AD104: =(S104-T104)/S104 -> #DIV/0! | AE104: =(U104-V104)/U104 -> #DIV/0! | AF104: =(W104-X104)/W104 -> #DIV/0! | AH104: 3T | AI104: 是 | AJ104: 是 | AK104: 是 | AL104: 是 | AM104: 否 | AN104: 不宜入场(收缩量不够，应持续观察1w) | AO104: 44586 | AP104: 是
A105: 002601.SZ | B105: 龙佰集团 | C105: 1.86 | AP105: 否
A106: 000733.SZ | B106: 振华科技 | C106: 1.86 | D106: 86.159999999999997 | E106: 91.379999999999995 | F106: 108.56 | H106: 118.52 | I106: 45.359999999999999 | J106: 130.46000000000001 | K106: 107.3 | L106: =(J106-I106)/I106 -> 1.8761022927689597 | M106: =(J106-H106)/J106 -> 9.1522305687567154e-02 | N106: =(J106-K106)/K106 -> 0.21584342963653319 | P106: 114.97 | AA106: 1w | AB106: =(J106-P106)/J106 -> 0.11873371148244678 | AC106: =(Q106-R106)/Q106 -> #DIV/0! | AD106: =(S106-T106)/S106 -> #DIV/0! | AE106: =(U106-V106)/U106 -> #DIV/0! | AN106: 不宜入场(收缩量不够，应持续观察1w) | AO106: 44586 | AP106: 是
A107: 605305.SH | B107: 中际联合 | C107: 1.85 | D107: 80.34 | E107: 84.75 | F107: 93.13 | H107: 95 | I107: 38.47 | J107: 129.92 | K107: 72.54 | L107: =(J107-I107)/I107 -> 2.3771770210553678 | M107: =(J107-H107)/J107 -> 0.26878078817733986 | N107: =(J107-K107)/K107 -> 0.79101185552798425 | P107: 79.18 | AN107: 不宜入场(当前股价距离最高点距离过大，应持续观察1w) | AO107: 44595 | AP107: 是
A108: 002768.SZ | B108: 国恩股份 | C108: 1.82 | AP108: 否
A109: 603605.SH | B109: 珀莱雅 | C109: 1.82 | D109: 183.88999999999999 | E109: 186.41 | F109: 190.11000000000001 | H109: 169.05000000000001 | AN109: 不宜入场(当前股价小于200日均线，应持续观察4w) | AO109: 44595 | AP109: 是
A110: 600346.SH | B110: 恒力石化 | C110: 1.81 | AP110: 否
A111: 600810.SH | B111: 神马股份 | C111: 1.8 | D111: 12.03 | E111: 12.13 | F111: 12.14 | H111: 11.29 | AN111: 不宜入场(当前股价小于200日均线，应持续观察4w) | AO111: 44595 | AP111: 是
A112: 002030.SZ | B112: 达安基因 | C112: 1.8 | AP112: 否
A113: 603565.SH | B113: 中谷物流 | C113: 1.79 | AP113: 否
A114: 605287.SH | B114: 德才股份 | C114: 1.79 | AP114: 否
A115: 000999.SZ | B115: 华润三九 | C115: 1.78 | D115: 27.72 | E115: 28.52 | F115: 32.28 | H115: 34.68 | I115: 23.23 | J115: 41.18 | K115: 23.91 | L115: =(J115-I115)/I115 -> 0.77270770555316393 | M115: =(J115-H115)/J115 -> 0.15784361340456532 | N115: =(J115-K115)/K115 -> 0.72229192806357168 | P115: 33.5 | AA115: 4w | AB115: =(J115-P115)/J115 -> 0.18649830014570179 | AN115: 不宜入场(收缩量不够，应持续观察1w) | AO115: 44595 | AP115: 是
A116: 605123.SH | B116: 派克新材 | C116: 1.77 | D116: 101.84999999999999 | E116: 107.79000000000001 | F116: 123.31999999999999 | H116: 123.02 | I116: 61.549999999999997 | J116: 159 | K116: 83.180000000000007 | L116: =(J116-I116)/I116 -> 1.5832656376929326 | M116: =(J116-H116)/J116 -> 0.22628930817610066 | N116: =(J116-K116)/K116 -> 0.91151719163260381 | P116: 109.2 | Q116: 134 | R116: 121.53 | AA116: 8w | AB116: =(J116-P116)/J116 -> 0.31320754716981131 | AN116: 不宜入场(当前股价小于50日均线，应持续观察1w) | AO116: 44595 | AP116: 是
A117: 002460.SZ | B117: 赣锋锂业 | C117: 1.77 | AP117: 否
A118: 603659.SH | B118: 璞泰来 | C118: 1.77 | D118: 143.47 | E118: 150.84 | F118: 156.38 | H118: 142.30000000000001 | AN118: 不宜入场（当前股价小于200日均线，应继续观察4w） | AO118: 44595 | AP118: 是
A119: 605389.SH | B119: 长龄液压 | C119: 1.77 | AP119: 否
A120: 600389.SH | B120: 江山股份 | C120: 1.77 | D120: 37.16 | E120: 38.83 | F120: 40.39 | H120: 38 | AN120: 不宜入场（当前股价小于150日均线，应继续观察3w） | AO120: 44595 | AP120: 是
A121: 600104.SH | B121: 上汽集团 | C121: 1.76 | AP121: 否
A122: 002900.SZ | B122: 哈三联 | C122: 1.74 | AP122: 否
A123: 600511.SH | B123: 国药股份 | C123: 1.73 | AP123: 否
A124: 600801.SH | B124: 华新水泥 | C124: 1.72 | AP124: 否
A125: 601628.SH | B125: 中国人寿 | C125: 1.72 | AP125: 否
A126: 603678.SH | B126: 火炬电子 | C126: 1.71 | D126: 70.25 | E126: 71.340000000000003 | F126: 70.540000000000006 | AN126: 不宜入场（50日均线小于150日均线，应继续观察5w） | AO126: 44595 | AP126: 是
A127: 600884.SH | B127: 杉杉股份 | C127: 1.7 | D127: 29.06 | E127: 30.58 | F127: 31.34 | H127: 26.71 | AN127: 不宜入场（当前股价小于200日均线，应继续观察4w） | AO127: 44595 | AP127: 是
A128: 600211.SH | B128: 西藏药业 | C128: 1.69 | AP128: 否
A129: 600976.SH | B129: 健民集团 | C129: 1.69 | D129: 51.75 | E129: 55.259999999999998 | F129: 66.459999999999994 | H129: 65.370000000000005 | AN129: 不宜入场(当前股价小于50日均线，应持续观察1w) | AO129: 44595 | AP129: 是
A130: 605180.SH | B130: 华生科技 | C130: 1.69 | AP130: 否
A131: 603290.SH | B131: 斯达半导 | C131: 1.67 | D131: 346.67000000000002 | E131: 368.38 | F131: 403.49000000000001 | H131: 329.69999999999999 | AN131: 不宜入场（当前股价小于200日均线，应继续观察4w） | AO131: 44595 | AP131: 是
A132: 002709.SZ | B132: 天赐材料 | C132: 1.66 | D132: 109.61 | E132: 114.76 | F132: 113.55 | AN132: 不宜入场（50日均线小于150日均线，应继续观察5w） | AO132: 44595 | AP132: 是
A133: 002714.SZ | B133: 牧原股份 | C133: 1.66 | AP133: 否
A134: 000422.SZ | B134: 湖北宜化 | C134: 1.66 | D134: 17.260000000000002 | E134: 18.940000000000001 | F134: 21.07 | H134: 16.379999999999999 | AN134: 不宜入场（当前股价小于200日均线,应观察4w） | AO134: 44595 | AP134: 是
A135: 002975.SZ | B135: 博杰股份 | C135: 1.65 | AP135: 否
A136: 600745.SH | B136: 闻泰科技 | C136: 1.65 | D136: 111.22 | E136: 113.86 | F136: 121.44 | H136: 107 | AN136: 不宜入场（当前股价小于200日均线,应观察4w） | AO136: 44595 | AP136: 是
A137: 601156.SH | B137: 东航物流 | C137: 1.64 | AP137: 否
A138: 603416.SH | B138: 信捷电气 | C138: 1.64 | AP138: 否
A139: 603897.SH | B139: 长城科技 | C139: 1.64 | D139: 40.299999999999997 | E139: 43.700000000000003 | F139: 49.340000000000003 | H139: 40.600000000000001 | AN139: 不宜入场（当前股价小于150日均线,应观察2w） | AO139: 44595 | AP139: 是
A140: 000049.SZ | B140: 德赛电池 | C140: 1.64 | D140: 46.100000000000001 | E140: 46.649999999999999 | F140: 50.969999999999999 | H140: 48.210000000000001 | AN140: 不宜入场(当前股价小于50日均线) | AO140: 44595 | AP140: 是
A141: 603236.SH | B141: 移远通信 | C141: 1.63 | D141: 172.88999999999999 | E141: 175.71000000000001 | F141: 189.12 | H141: 181.80000000000001 | AN141: 不宜入场(当前股价小于50日均线,应观察1w) | AO141: 44595 | AP141: 是
A142: 605399.SH | B142: 晨光新材 | C142: 1.63 | D142: 35.020000000000003 | E142: 37.590000000000003 | F142: 43.039999999999999 | H142: 42.990000000000002 | AN142: 不宜入场(当前股价小于50日均线,应观察1w) | AO142: 44595 | AP142: 是
A143: 000786.SZ | B143: 北新建材 | C143: 1.61 | AP143: 否
A144: 002850.SZ | B144: 科达利 | C144: 1.61 | D144: 130.24000000000001 | E144: 139.53 | F144: 158.55000000000001 | H144: 153.75 | AN144: 不宜入场(当前股价小于50日均线,应观察1w) | AO144: 44595 | AP144: 是
A145: 002876.SZ | B145: 三利谱 | C145: 1.6000000000000001 | D145: 55.140000000000001 | E145: 55.829999999999998 | F145: 57.689999999999998 | H145: 61.899999999999999 | I145: 31.870000000000001 | J145: 68.299999999999997 | K145: 53.810000000000002 | L145: =(H145-I145)/I145 -> 0.94226545340445544 | M145: =(J145-H145)/J145 -> 9.370424597364567e-02 | N145: =(J145-K145)/K145 -> 0.26928080282475364 | P145: 46.799999999999997 | Q145: 64.950000000000003 | R145: 51.07 | AA145: 21w | AB145: =(J145-P145)/J145 -> 0.314787701317716 | AC145: =(#REF!-#REF!)/#REF! -> #REF! | AD145: =(Q145-R145)/Q145 -> 0.21370284834488071 | AN145: 不宜入场（收缩幅度不够，应继续持续观察1w） | AO145: 44588 | AP145: 是
A146: 603150.SH | B146: 万朗磁塑 | C146: 1.6000000000000001 | AP146: 否
A147: 603529.SH | B147: 爱玛科技 | C147: 1.6000000000000001 | D147: 43.32 | E147: 43.55 | F147: 44.18 | H147: 39.36 | AN147: 不宜入场（当前股价小于200日均线,应观察4w） | AO147: 44595 | AP147: 是
A148: 600064.SH | B148: 南京高科 | C148: 1.58 | D148: 9.25 | E148: 9.25 | F148: 9.4100000000000001 | H148: 9.1500000000000004 | AN148: 不宜入场（当前股价小于200日均线,应观察4w） | AO148: 44595 | AP148: 是
A149: 600985.SH | B149: 淮北矿业 | C149: 1.58 | D149: 11.92 | E149: 11.99 | F149: 11.699999999999999 | AN149: 不宜入场（50日均线小于200日均线,应观察5w） | AO149: 44595 | AP149: 是
A150: 601607.SH | B150: 上海医药 | C150: 1.58 | AP150: 否
A151: 603517.SH | B151: 绝味食品 | C151: 1.58 | AP151: 否
A152: 002080.SZ | B152: 中材科技 | C152: 1.58 | D152: 30.68 | E152: 31.739999999999998 | F152: 32.789999999999999 | H152: 29.32 | AN152: 不宜入场（当前股价小于200日均线,应观察4w） | AO152: 44595 | AP152: 是
A153: 605555.SH | B153: 德昌股份 | C153: 1.57 | AP153: 否
A154: 002541.SZ | B154: 鸿路钢构 | C154: 1.57 | AP154: 否
A155: 000513.SZ | B155: 丽珠集团 | C155: 1.55 | AP155: 否
A156: 601001.SH | B156: 晋控煤业 | C156: 1.55 | D156: 9.22 | E156: 9.65 | F156: 10.27 | H156: 10.52 | I156: 4.2999999999999998 | J156: 15.800000000000001 | K156: 7.88 | L156: =(H156-I156)/I156 -> 1.4465116279069767 | M156: =(J156-H156)/J156 -> 0.33417721518987348 | N156: =(J156-K156)/K156 -> 1.0050761421319798 | O156: 2 | P156: 8.52 | AA156: 18w | AB156: =(J156-P156)/J156 -> 0.46075949367088614 | AN156: 不宜入场（当前股价距离最高点距离过大，应持续观察2w） | AO156: 44595 | AP156: 是
A157: 603087.SH | B157: 甘李药业 | C157: 1.55 | AP157: 否
A158: 600096.SH | B158: 云天化 | C158: 1.55 | D158: 19.010000000000002 | E158: 20.120000000000001 | F158: 20.489999999999998 | H158: 16.82 | AN158: 不宜入场（当前股价小于200日均线,应观察4w） | AO158: 44595 | AP158: 是
A159: 605259.SH | B159: 绿田机械 | C159: 1.54 | AP159: 否
A160: 603186.SH | B160: 华正新材 | C160: 1.53 | AP160: 否
A161: 605090.SH | B161: 九丰能源 | C161: 1.53 | AP161: 否
A162: 002274.SZ | B162: 华昌化工 | C162: 1.52 | D162: 11.21 | E162: 11.63 | F162: 12.09 | H162: 11.21 | AN162: 不宜入场（当前股价小于200日均线，应持续观察4w） | AO162: 44595 | AP162: 是
A163: 601100.SH | B163: 恒立液压 | C163: 1.52 | AP163: 否
A164: 603071.SH | B164: 物产环能 | C164: 1.52 | D164: 22.82 | E164: 22.96 | F164: 23.399999999999999 | H164: 20.65 | AN164: 不宜入场（当前股价小于200日均线，应持续观察4w） | AO164: 44595 | AP164: 是
A165: 002032.SZ | B165: 苏泊尔 | C165: 1.52 | AP165: 否
A166: 002179.SZ | B166: 中航光电 | C166: 1.52 | D166: 86.640000000000001 | E166: 88.829999999999998 | F166: 91.930000000000007 | H166: 88.579999999999998 | AN166: 不宜入场（当前股价小于150日均线，应持续观察3w） | AO166: 44595 | AP166: 是
A167: 002048.SZ | B167: 宁波华翔 | C167: 1.51 | D167: 18.82 | E167: 19.609999999999999 | F167: 21.41 | H167: 19.68 | AN167: 不宜入场(当前股价小于50日均线，应继续观察1w) | AO167: 44595 | AP167: 是
A168: 605189.SH | B168: 富春染织 | C168: 1.51 | AP168: 否
A169: 001201.SZ | B169: 东瑞股份 | C169: 1.5 | AP169: 否
A170: 002128.SZ | B170: 电投能源 | C170: 1.5 | D170: 12.9 | E170: 13.390000000000001 | F170: 14.789999999999999 | H170: 14.640000000000001 | I170: 7.9800000000000004 | J170: 18.48 | K170: 10.32 | L170: =(H170-I170)/I170 -> 0.83458646616541354 | M170: =(J170-H170)/J170 -> 0.20779220779220778 | N170: =(J170-K170)/K170 -> 0.79069767441860461 | O170: 3 | AN170: 不宜入场(收缩幅度不够，应该持续观察6个w) | AO170: 44595 | AP170: 是
A171: 603338.SH | B171: 浙江鼎力 | C171: 1.5 | AN171: 不宜入场(当前股价小于50日均线，应继续观察1w) | AO171: 44595 | AP171: 是
A172: 600031.SH | B172: 三一重工 | C172: 1.49 | AP172: 否
A173: 600741.SH | B173: 华域汽车 | C173: 1.49 | D173: 25.350000000000001 | E173: 25.550000000000001 | F173: 26.969999999999999 | H173: 27.920000000000002 | I173: 18.850000000000001 | J173: 30.489999999999998 | K173: 23.530000000000001 | L173: =(H173-I173)/I173 -> 0.48116710875331564 | M173: =(J173-H173)/J173 -> 8.4289931124958903e-02 | N173: =(J173-K173)/K173 -> 0.29579260518487027 | P173: 26.300000000000001 | Q173: 29.530000000000001 | R173: 26.75 | AA173: 6w | AB173: =(J173-P173)/J173 -> 0.13742210560839613 | AC173: =(Q173-R173)/Q173 -> 9.4141550965120252e-02 | AD173: =(S173-T173)/S173 -> #DIV/0! | AH173: 3T | AI173: 否 | AJ173: 是 | AK173: 是 | AL173: 否 | AN173: 不宜入场(杯型尚未形成，应持续观察1w) | AO173: 44601 | AP173: 是
A174: 601995.SH | B174: 中金公司 | C174: 1.49 | AP174: 否
A175: 000623.SZ | B175: 吉林敖东 | C175: 1.49 | D175: 16.620000000000001 | E175: 16.82 | F175: 17.399999999999999 | H175: 16.600000000000001 | AN175: 不宜入场（当前股价小于200日均线，应持续观察4w） | AO175: 44595 | AP175: 是
A176: 001212.SZ | B176: 中旗新材 | C176: 1.47 | AP176: 否
A177: 601225.SH | B177: 陕西煤业 | C177: 1.47 | D177: 12.23 | E177: 12.43 | F177: 12.69 | H177: 12.539999999999999 | AN177: 不宜入场(当前股价小于50日均线，应继续观察1w) | AO177: 44595 | AP177: 是
A178: 603155.SH | B178: 新亚强 | C178: 1.47 | D178: 53.11 | E178: 55.05 | F178: 57.12 | H178: 58.29 | I178: 31.33 | J178: 83.599999999999994 | K178: 49.700000000000003 | L178: =(H178-I178)/I178 -> 0.86051707628471119 | M178: =(J178-H178)/J178 -> 0.30275119617224877 | N178: =(J178-K178)/K178 -> 0.68209255533199176 | AN178: 不宜入场（当前股价距离最高点距离过大，应持续观察2w） | AO178: 44595 | AP178: 是
A179: 603606.SH | B179: 东方电缆 | C179: 1.47 | D179: 36.979999999999997 | E179: 39.880000000000003 | F179: 48.240000000000002 | H179: 59.200000000000003 | I179: 18.510000000000002 | J179: 63.75 | K179: 31.57 | L179: =(H179-I179)/I179 -> 2.1982712047541866 | M179: =(J179-H179)/J179 -> 7.1372549019607795e-02 | N179: =(J179-K179)/K179 -> 1.0193221412733608 | O179: 2 | P179: 42.100000000000001 | AA179: 2w | AB179: =(J179-P179)/J179 -> 0.33960784313725489 | AN179: 不宜入场（收缩幅度不够，应继续持续观察2w） | AO179: 44595 | AP179: 是
A180: 605098.SH | B180: 行动教育 | C180: 1.46 | D180: 47.700000000000003 | E180: 48.880000000000003 | F180: 52.789999999999999 | H180: 57.869999999999997 | I180: 32.399999999999999 | J180: 63.780000000000001 | K180: 47.789999999999999 | L180: =(H180-I180)/I180 -> 0.78611111111111109 | M180: =(J180-H180)/J180 -> 9.2662276575729119e-02 | N180: =(J180-K180)/K180 -> 0.33458882611424989 | P180: 40.479999999999997 | Q180: 60.5 | R180: 47.509999999999998 | AA180: 20w | AB180: =(J180-P180)/J180 -> 0.36531828159297591 | AC180: =(Q180-R180)/Q180 -> 0.21471074380165292 | AD180: =(S180-T180)/S180 -> #DIV/0! | AE180: =(U180-V180)/U180 -> #DIV/0! | AH180: 6T | AN180: 不宜入场（成交行为和价格行为尚不明朗） | AO180: 44588 | AP180: 是
A181: 600581.SH | B181: 八一钢铁 | C181: 1.45 | AP181: 否
A182: 600449.SH | B182: 宁夏建材 | C182: 1.45 | AP182: 否
A183: 600966.SH | B183: 博汇纸业 | C183: 1.44 | AP183: 否
A184: 003028.SZ | B184: 振邦智能 | C184: 1.44 | AP184: 否
A185: 603806.SH | B185: 福斯特 | C185: 1.44 | D185: 113.16 | E185: 117.53 | F185: 119.98999999999999 | H185: 114 | AN185: 不宜入场(当前股价小于150日均线，应观察2w) | AO185: 44595 | AP185: 是
A186: 000002.SZ | B186: 万科A | C186: 1.44 | AP186: 否
A187: 600566.SH | B187: 济川药业 | C187: 1.43 | D187: 20.190000000000001 | E187: 20.73 | F187: 24.039999999999999 | H187: 23.82 | AN187: 不宜入场(当前股价小于50日均线，应继续观察1w) | AO187: 44595 | AP187: 是
A188: 002008.SZ | B188: 大族激光 | C188: 1.43 | D188: 42.630000000000003 | E188: 43.140000000000001 | F188: 46.770000000000003 | H188: 53.420000000000002 | I188: 33.689999999999998 | J188: 55.109999999999999 | K188: 39.359999999999999 | L188: =(H188-I188)/I188 -> 0.5856337192045119 | M188: =(J188-H188)/J188 -> 3.0665940845581524e-02 | N188: =(J188-K188)/K188 -> 0.40015243902439024 | P188: 45.509999999999998 | Q188: 49.799999999999997 | R188: 46.460000000000001 | AA188: 2w | AB188: =(J188-P188)/J188 -> 0.17419706042460537 | AC188: =(Q188-R188)/Q188 -> 6.7068273092369401e-02 | AD188: =(S188-T188)/S188 -> #DIV/0! | AE188: =(U188-V188)/U188 -> #DIV/0! | AN188: 不宜入场(收缩幅度不够，应持续观察2w) | AO188: 44588 | AP188: 是
A189: 605009.SH | B189: 豪悦护理 | C189: 1.43 | AP189: 否
A190: 002508.SZ | B190: 老板电器 | C190: 1.42 | AP190: 否
A191: 002833.SZ | B191: 弘亚数控 | C191: 1.42 | AP191: 否
A192: 601838.SH | B192: 成都银行 | C192: 1.42 | D192: 12.08 | E192: 12.26 | F192: 12.94 | H192: 14.02 | I192: 8.51 | J192: 15.06 | K192: 11.66 | L192: =(H192-I192)/I192 -> 0.64747356051703875 | M192: =(J192-H192)/J192 -> 6.9057104913678682e-02 | N192: =(J192-K192)/K192 -> 0.29159519725557465 | O192: 3 | P192: 14 | AA192: 2w | AB192: =(J192-P192)/J192 -> 7.0385126162018627e-02 | AN192: 不宜入场(杯型尚未形成，应继续观察1w) | AO192: 44599 | AP192: 是
A193: 605566.SH | B193: 福莱蒽特 | C193: 1.42 | AP193: 否
A194: 002022.SZ | B194: 科华生物 | C194: 1.42 | AP194: 否
A195: 000789.SZ | B195: 万年青 | C195: 1.42 | AP195: 否
A196: 601012.SH | B196: 隆基股份 | C196: 1.41 | D196: 80.13 | E196: 81.599999999999994 | F196: 81.19 | AN196: 不宜入场(50日均线小于150日均线，应继续观察4w) | AO196: 44595 | AP196: 是
A197: 000001.SZ | B197: 平安银行 | C197: 1.3999999999999999 | AP197: 否
A198: 600089.SH | B198: 特变电工 | C198: 1.3999999999999999 | D198: 18.940000000000001 | E198: 19.899999999999999 | F198: 20.859999999999999 | H198: 18.649999999999999 | AN198: 不宜入场(当前股价小于200日均线，应观察4w) | AO198: 44595 | AP198: 是
A199: 002845.SZ | B199: 同兴达 | C199: 1.39 | AP199: 否
A200: 600196.SH | B200: 复星医药 | C200: 1.39 | AP200: 否
A201: 603579.SH | B201: 荣泰健康 | C201: 1.39 | AP201: 否
A202: 002110.SZ | B202: 三钢闽光 | C202: 1.38 | AP202: 否
A203: 002756.SZ | B203: 永兴材料 | C203: 1.38 | D203: 98.74 | E203: 106.12 | F203: 122.37 | H203: 119.37 | AN203: 不宜入场(当前股价小于50日均线，应持续观察2w) | AO203: 44595 | AP203: 是
A204: 603368.SH | B204: 柳药股份 | C204: 1.38 | AP204: 否
A205: 603886.SH | B205: 元祖股份 | C205: 1.38 | D205: 19.699999999999999 | E205: 20.27 | F205: 22.359999999999999 | H205: 21 | AN205: 不宜入场(当前股价小于50日均线，应该持续观察1个w) | AO205: 44586 | AP205: 是
A206: 603225.SH | B206: 新凤鸣 | C206: 1.37 | AP206: 否
A207: 601636.SH | B207: 旗滨集团 | C207: 1.36 | AP207: 否
A208: 002223.SZ | B208: 鱼跃医疗 | C208: 1.36 | D208: 33.219999999999999 | E208: 33.850000000000001 | F208: 34.979999999999997 | H208: 35.859999999999999 | I208: 25.120000000000001 | J208: 41.770000000000003 | K208: 30.079999999999998 | L208: =(H208-I208)/I208 -> 0.42754777070063688 | M208: =(J208-H208)/J208 -> 0.14148910701460385 | N208: =(J208-K208)/K208 -> 0.38863031914893637 | P208: 29.82 | AA208: 21w | AB208: =(J208-P208)/J208 -> 0.28609049557098398 | AC208: =(Q208-R208)/Q208 -> #DIV/0! | AD208: =(S208-T208)/S208 -> #DIV/0! | AE208: =(U208-V208)/U208 -> #DIV/0! | AI208: 否 | AJ208: 否 | AK208: 是 | AL208: 是 | AM208: 否 | AN208: 不宜入场(成交量行为不符合要求，应该持续观察1w) | AO208: 44588 | AP208: 是
A209: 000915.SZ | B209: 华特达因 | C209: 1.36 | D209: 28.72 | E209: 29.09 | F209: 30.35 | H209: 31.01 | I209: 19.65 | J209: 35.98 | K209: 27.41 | L209: =(H209-I209)/I209 -> 0.57811704834605615 | M209: =(J209-H209)/J209 -> 0.13813229571984423 | N209: =(J209-K209)/K209 -> 0.31265961327982478 | O209: 3 | P209: 23.86 | Q209: 35.63 | R209: 29.24 | AA209: 24w | AB209: =(J209-P209)/J209 -> 0.33685380767092826 | AC209: =(Q209-R209)/Q209 -> 0.17934325007016569 | AN209: 不宜入场(收缩幅度不够，应持续观察1w) | AO209: 44595 | AP209: 是
A210: 600030.SH | B210: 中信证券 | C210: 1.36 | AP210: 是
A211: 603160.SH | B211: 汇顶科技 | C211: 1.36 | AP211: 否
A212: 603369.SH | B212: 今世缘 | C212: 1.35 | D212: 51.439999999999998 | E212: 51.960000000000001 | F212: 53.460000000000001 | H212: 50.920000000000002 | AN212: 不宜入场(当前股价小于200日均线，应观察4w) | AO212: 44595 | AP212: 是
A213: 003020.SZ | B213: 立方制药 | C213: 1.35 | D213: 44.24 | E213: 44.95 | F213: 46.74 | H213: 46.51 | AN213: 不宜入场(当前股价小于50日均线，应继续观察1w) | AO213: 44595 | AP213: 是
A214: 600000.SH | B214: 浦发银行 | C214: 1.34 | AP214: 否
A215: 002371.SZ | B215: 北方华创 | C215: 1.34 | D215: 309.10000000000002 | E215: 323.57999999999998 | F215: 327.93000000000001 | H215: 283 | AN215: 不宜入场(当前股价小于200日均线，应观察4w) | AO215: 44595 | AP215: 是
A216: 603113.SH | B216: 金能科技 | C216: 1.33 | AP216: 否
A217: 600438.SH | B217: 通威股份 | C217: 1.32 | AP217: 否
A218: 002064.SZ | B218: 华峰化学 | C218: 1.32 | AP218: 否
A219: 601577.SH | B219: 长沙银行 | C219: 1.32 | AP219: 否
A220: 002001.SZ | B220: 新和成 | C220: 1.31 | AP220: 否
A221: 600887.SH | B221: 伊利股份 | C221: 1.31 | D221: 39.079999999999998 | E221: 39.219999999999999 | F221: 39.990000000000002 | H221: 38.07 | AN221: 不宜入场(当前股价小于200日均线，应观察4w) | AO221: 44595 | AP221: 是
A222: 605336.SH | B222: 帅丰电器 | C222: 1.31 | D222: 29.5 | E222: 30.109999999999999 | F222: 32.119999999999997 | H222: 33.600000000000001 | I222: 24.219999999999999 | J222: 37.5 | K222: 29.329999999999998 | L222: =(H222-I222)/I222 -> 0.38728323699421979 | M222: =(J222-H222)/J222 -> 0.10399999999999997 | N222: =(J222-K222)/K222 -> 0.27855438117967957 | P222: 28.609999999999999 | AA222: 4w | AB222: =(J222-P222)/J222 -> 0.23706666666666668 | AC222: =(Q222-R222)/Q222 -> #DIV/0! | AD222: =(S222-T222)/S222 -> #DIV/0! | AE222: =(U222-V222)/U222 -> #DIV/0! | AF222: =(W222-X222)/W222 -> #DIV/0! | AN222: 不宜入场(收缩量不够，应该持续观察1w) | AO222: 44588 | AP222: 是
A223: 001296.SZ | B223: 长江材料 | C223: 1.3 | AP223: 是
A224: 002637.SZ | B224: 赞宇科技 | C224: 1.3 | D224: 16.43 | E224: 16.66 | F224: 17.57 | H224: 18 | I224: 11.050000000000001 | J224: 20.440000000000001 | K224: 15.17 | L224: =(H224-I224)/I224 -> 0.62895927601809942 | M224: =(J224-H224)/J224 -> 0.11937377690802353 | N224: =(J224-K224)/K224 -> 0.34739617666446942 | P224: 14.220000000000001 | Q224: 18.27 | R224: 16.030000000000001 | S224: 20.100000000000001 | T224: 17.379999999999999 | AA224: 17w | AB224: =(J224-P224)/J224 -> 0.30430528375733856 | AC224: =(Q224-R224)/Q224 -> 0.12260536398467424 | AD224: =(S224-T224)/S224 -> 0.13532338308457723 | AN224: 不宜入场(收缩幅度不够，应该持续观察3w) | AO224: 44595 | AP224: 是
A225: 600362.SH | B225: 江西铜业 | C225: 1.3 | AP225: 否
A226: 603883.SH | B226: 老百姓 | C226: 1.3 | AP226: 否
A227: 000011.SZ | B227: 深物业A | C227: 1.3 | AP227: 否
A228: 002727.SZ | B228: 一心堂 | C228: 1.29 | AP228: 否
A229: 601211.SH | B229: 国泰君安 | C229: 1.29 | D229: 17.14 | E229: 17.31 | F229: 17.68 | H229: 17.63 | AN229: 不宜入场(当前股价小于50日均线，应继续观察2w) | AO229: 44595 | AP229: 是
A230: 601877.SH | B230: 正泰电器 | C230: 1.29 | D230: 46.649999999999999 | E230: 48.340000000000003 | F230: 50.549999999999997 | H230: 47.5 | AN230: 不宜入场(当前股价小于50日均线，应观察2w) | AO230: 44595 | AP230: 是
A231: 603010.SH | B231: 万盛股份 | C231: 1.29 | D231: 23.149999999999999 | E231: 23.710000000000001 | F231: 24.649999999999999 | H231: 21.800000000000001 | AN231: 不宜入场(当前股价小于200日均线，应观察4w) | AO231: 44595 | AP231: 是
A232: 603156.SH | B232: 养元饮品 | C232: 1.29 | AP232: 否
A233: 600755.SH | B233: 厦门国贸 | C233: 1.28 | AP233: 否
A234: 603733.SH | B234: 仙鹤股份 | C234: 1.28 | D234: 33.509999999999998 | E234: 34.710000000000001 | F234: 37.109999999999999 | H234: 38.630000000000003 | I234: 23.09 | J234: 44.579999999999998 | K234: 26.989999999999998 | L234: =(H234-I234)/I234 -> 0.67301862278042457 | M234: =(J234-H234)/J234 -> 0.13346792283535208 | N234: =(J234-K234)/K234 -> 0.65172286031863658 | P234: 30.280000000000001 | Q234: 42.390000000000001 | R234: 34.619999999999997 | AA234: 21w | AB234: =(J234-P234)/J234 -> 0.3207716464782413 | AC234: =(Q234-R234)/Q234 -> 0.18329794762915788 | AN234: 不宜入场(成交量行为不符合要求，应该持续观察1w) | AO234: 44588 | AP234: 是
A235: 603985.SH | B235: 恒润股份 | C235: 1.27 | D235: 35.310000000000002 | E235: 38.270000000000003 | F235: 45.649999999999999 | H235: 45.509999999999998 | AN235: 不宜入场(当前股价小于50日均线，应观察2w) | AO235: 44595 | AP235: 是
A236: 001206.SZ | B236: 依依股份 | C236: 1.27 | AP236: 否
A237: 002597.SZ | B237: 金禾实业 | C237: 1.27 | D237: 41.43 | E237: 42.490000000000002 | F237: 44.969999999999999 | H237: 40.950000000000003 | AN237: 不宜入场(当前股价小于200日均线，应该持续观察4w) | AO237: 44595 | AP237: 是
A238: 002889.SZ | B238: 东方嘉盛 | C238: 1.27 | D238: 25.190000000000001 | E238: 25.289999999999999 | F238: 25.899999999999999 | H238: 24.940000000000001 | AN238: 不宜入场(当前股价小于200日均线，应该持续观察4w) | AO238: 44595 | AP238: 是
A239: 002985.SZ | B239: 北摩高科 | C239: 1.27 | D239: 105.55 | E239: 107.25 | F239: 106.90000000000001 | AN239: 不宜入场(50日均线小于150日均线，应该持续观察5w) | AO239: 44595 | AP239: 是
A240: 600998.SH | B240: 九州通 | C240: 1.27 | AP240: 否
A241: 605222.SH | B241: 起帆电缆 | C241: 1.27 | D241: 23.32 | E241: 23.77 | F241: 25.030000000000001 | H241: 24.399999999999999 | AN241: 不宜入场(当前股价小于50日均线，应观察2w) | AO241: 44595 | AP241: 是
A242: 001872.SZ | B242: 招商港口 | C242: 1.27 | D242: 16.219999999999999 | E242: 16.43 | F242: 16.98 | H242: 16.219999999999999 | AA242: 15w | AB242: =(J242-P242)/J242 -> #DIV/0! | AC242: =(Q242-R242)/Q242 -> #DIV/0! | AD242: =(S242-T242)/S242 -> #DIV/0! | AE242: =(U242-V242)/U242 -> #DIV/0! | AF242: =(W242-X242)/W242 -> #DIV/0! | AH242: 3T | AI242: 是 | AJ242: 否 | AK242: 是 | AL242: 是 | AM242: 是 | AN242: 不宜入场(当前股价小于150日均线，应该持续观察2w) | AO242: 44586 | AP242: 是
A243: 000063.SZ | B243: 中兴通讯 | C243: 1.26 | AP243: 是
A244: 600373.SH | B244: 中文传媒 | C244: 1.26 | D244: 11.01 | E244: 11.19 | F244: 11.91 | H244: 11.33 | AN244: 不宜入场(当前股价小于50日均线，应观察2w) | AO244: 44595 | AP244: 是
A245: 601997.SH | B245: 贵阳银行 | C245: 1.26 | AP245: 否
A246: 603938.SH | B246: 三孚股份 | C246: 1.26 | AP246: 否
A247: 605288.SH | B247: 凯迪股份 | C247: 1.26 | AP247: 否
A248: 600328.SH | B248: 中盐化工 | C248: 1.26 | D248: 16.09 | E248: 16.789999999999999 | F248: 16.850000000000001 | H248: 14.91 | AN248: 不宜入场(当前股价小于200日均线，应该持续观察4w) | AO248: 44595 | AP248: 是
A249: 000877.SZ | B249: 天山股份 | C249: 1.25 | AP249: 否
A250: 001217.SZ | B250: 华尔泰 | C250: 1.25 | D250: 17.690000000000001 | E250: 18.190000000000001 | F250: 19.329999999999998 | H250: 17.370000000000001 | AN250: 不宜入场(当前股价小于200日均线，应该持续观察4w) | AO250: 44595 | AP250: 是
A251: 002977.SZ | B251: 天箭科技 | C251: 1.24 | AP251: 否
A252: 600298.SH | B252: 安琪酵母 | C252: 1.24 | D252: 54.5 | E252: 54.479999999999997 | AN252: 不宜入场(150日均线小于200日均线，应观察8w) | AO252: 44595 | AP252: 是
A253: 600668.SH | B253: 尖峰集团 | C253: 1.23 | AP253: 是
A254: 600123.SH | B254: 兰花科创 | C254: 1.23 | D254: 9.1699999999999999 | E254: 9.5500000000000007 | F254: 9.9299999999999997 | H254: 9.4600000000000009 | AN254: 不宜入场(当前股价小于150日均线，应该持续观察2w) | AO254: 44595 | AP254: 是
A255: 600584.SH | B255: 长电科技 | C255: 1.23 | AP255: 否
A256: 601688.SH | B256: 华泰证券 | C256: 1.23 | D256: 16.54 | E256: 16.64 | F256: 17.15 | H256: 17.08 | AN256: 不宜入场(当前股价小于50日均线，应该持续观察1w) | AO256: 44595 | AP256: 是
A257: 600720.SH | B257: 祁连山 | C257: 1.23 | AP257: 否
A258: 002287.SZ | B258: 奇正藏药 | C258: 1.22 | D258: 27.23 | E258: 27.55 | F258: 27.79 | H258: 25.26 | AN258: 不宜入场(当前股价小于200日均线，应该持续观察3w) | AO258: 44595 | AP258: 是
A259: 600739.SH | B259: 辽宁成大 | C259: 1.22 | AP259: 否
A260: 603095.SH | B260: 越剑智能 | C260: 1.22 | D260: 24.359999999999999 | E260: 24.489999999999998 | F260: 25.129999999999999 | H260: 26.850000000000001 | I260: 20.030000000000001 | J260: 27.379999999999999 | K260: 25.809999999999999 | L260: =(H260-I260)/I260 -> 0.34048926610084873 | M260: =(J260-H260)/J260 -> 1.935719503287062e-02 | N260: =(J260-K260)/K260 -> 6.0829135993800867e-02 | AN260: 不宜入场(时间周期太短，应观察2w) | AO260: 44595 | AP260: 是
A261: 603259.SH | B261: 药明康德 | C261: 1.22 | AP261: 否
A262: 603658.SH | B262: 安图生物 | C262: 1.22 | AP262: 否
A263: 603899.SH | B263: 晨光文具 | C263: 1.21 | AP263: 否
A264: 000401.SZ | B264: 冀东水泥 | C264: 1.21 | AP264: 否
A265: 000932.SZ | B265: 华菱钢铁 | C265: 1.21 | AP265: 否
A266: 601009.SH | B266: 南京银行 | C266: 1.21 | AP266: 否
A267: 002959.SZ | B267: 小熊电器 | C267: 1.21 | AP267: 否
A268: 000708.SZ | B268: 中信特钢 | C268: 1.2 | AP268: 否
A269: 002353.SZ | B269: 杰瑞股份 | C269: 1.2 | D269: 40.62 | E269: 41.28 | F269: 42.19 | H269: 41.42 | AN269: 不宜入场(当前股价小于50日均线，应该持续观察1w) | AO269: 44595 | AP269: 是
A270: 601963.SH | B270: 重庆银行 | C270: 1.2 | AP270: 否
A271: 603197.SH | B271: 保隆科技 | C271: 1.2 | D271: 40.939999999999998 | E271: 43.960000000000001 | F271: 55.469999999999999 | H271: 55.75 | I271: 22.050000000000001 | J271: 74.450000000000003 | K271: 38.299999999999997 | L271: =(H271-I271)/I271 -> 1.5283446712018141 | M271: =(J271-H271)/J271 -> 0.25117528542646073 | N271: =(J271-K271)/K271 -> 0.94386422976501327 | P271: 54.539999999999999 | AA271: 1w | AB271: =(J271-P271)/J271 -> 0.26742780389523174 | AN271: 不宜入场(收缩幅度不够，应该持续观察2w) | AO271: 44595 | AP271: 是
A272: 603198.SH | B272: 迎驾贡酒 | C272: 1.2 | D272: 54.020000000000003 | E272: 57.140000000000001 | F272: 66.090000000000003 | H272: 67.609999999999999 | I272: 25.829999999999998 | J272: 77.920000000000002 | K272: 51.5 | L272: =(H272-I272)/I272 -> 1.6174990321331786 | M272: =(J272-H272)/J272 -> 0.13231519507186862 | N272: =(J272-K272)/K272 -> 0.51300970873786411 | P272: 59.509999999999998 | Q272: 74.5 | R272: 67.599999999999994 | AA272: 5w | AB272: =(J272-P272)/J272 -> 0.2362679671457906 | AC272: =(Q272-R272)/Q272 -> 9.2617449664429613e-02 | AN272: 不宜入场(收缩幅度不够，应该持续观察1w) | AO272: 44595 | AP272: 是
A273: 000825.SZ | B273: 太钢不锈 | C273: 1.19 | AP273: 否
A274: 600623.SH | B274: 华谊集团 | C274: 1.18 | AP274: 否
A275: 603258.SH | B275: 电魂网络 | C275: 1.18 | D275: 26.41 | E275: 26.609999999999999 | F275: 28.109999999999999 | H275: 25.16 | AN275: 不宜入场(当前股价小于200日均线，应该持续观察3w) | AO275: 44595 | AP275: 是
A276: 603877.SH | B276: 太平鸟 | C276: 1.18 | AP276: 否
A277: 605588.SH | B277: 冠石科技 | C277: 1.18 | AP277: 否
A278: 002415.SZ | B278: 海康威视 | C278: 1.18 | AP278: 否
A279: 000885.SZ | B279: 城发环境 | C279: 1.18 | D279: 10.210000000000001 | E279: 10.32 | F279: 10.66 | H279: 10.27 | AN279: 不宜入场(当前股价小于150日均线，应该持续观察2w) | AO279: 44595 | AP279: 是
A280: 002557.SZ | B280: 洽洽食品 | C280: 1.18 | D280: 51.380000000000003 | E280: 52.289999999999999 | F280: 56.479999999999997 | H280: 54.729999999999997 | AN280: 不宜入场(当前股价小于50日均线，应该持续观察1w) | AO280: 44595 | AP280: 是
A281: 601229.SH | B281: 上海银行 | C281: 1.17 | AP281: 否
A282: 603203.SH | B282: 快克股份 | C282: 1.17 | D282: 32.43 | E282: 33.810000000000002 | F282: 36.170000000000002 | H282: 34.509999999999998 | AN282: 不宜入场(当前股价小于50日均线，应该持续观察1w) | AO282: 44595 | AP282: 是
A283: 603587.SH | B283: 地素时尚 | C283: 1.17 | AP283: 否
A284: 603681.SH | B284: 永冠新材 | C284: 1.17 | D284: 31.629999999999999 | E284: 33.149999999999999 | F284: 36.07 | H284: 32.979999999999997 | I284: 18.48 | J284: 41.969999999999999 | K284: 26.260000000000002 | L284: =(H284-I284)/I284 -> 0.78463203463203446 | M284: =(J284-H284)/J284 -> 0.21420061949011204 | N284: =(J284-K284)/K284 -> 0.59824828636709815 | P284: 29.77 | Q284: 41.18 | R284: 32.619999999999997 | AA284: 17w | AB284: =(J284-P284)/J284 -> 0.29068382177746011 | AC284: =(Q284-R284)/Q284 -> 0.20786789703739686 | AD284: =(S284-T284)/S284 -> #DIV/0! | AE284: =(U284-V284)/U284 -> #DIV/0! | AN284: 不宜入场(收缩幅度不够，应该持续观察2w) | AO284: 44588 | AP284: 是
A285: 605077.SH | B285: 华康股份 | C285: 1.17 | AP285: 否
A286: 002258.SZ | B286: 利尔化学 | C286: 1.17 | D286: 28.32 | E286: 28.989999999999998 | F286: 30.75 | H286: 28.760000000000002 | AN286: 不宜入场(当前股价小于50日均线，应该持续观察1w) | AO286: 44595 | AP286: 是
A287: 002929.SZ | B287: 润建股份 | C287: 1.16 | D287: 30.109999999999999 | E287: 31.18 | F287: 34.920000000000002 | H287: 37.5 | I287: 20 | J287: 39.43 | K287: 31.91 | L287: =(H287-I287)/I287 -> 0.875 | M287: =(J287-H287)/J287 -> 4.8947501902104992e-02 | N287: =(J287-K287)/K287 -> 0.2356628016295832 | P287: 33.170000000000002 | Q287: 38.380000000000003 | R287: 33.420000000000002 | AA287: 2w | AB287: =(J287-P287)/J287 -> 0.15876236368247523 | AC287: =(Q287-R287)/Q287 -> 0.12923397602918188 | AD287: =(S287-T287)/S287 -> #DIV/0! | AE287: =(U287-V287)/U287 -> #DIV/0! | AN287: 不宜入场(收缩幅度不够，应该持续观察1w) | AO287: 44586 | AP287: 是
A288: 002028.SZ | B288: 思源电气 | C288: 1.16 | D288: 39.850000000000001 | E288: 41.810000000000002 | F288: 47.560000000000002 | H288: 45.899999999999999 | AN288: 不宜入场(当前股价小于50日均线，应该持续观察1w) | AO288: 44586 | AP288: 是
A289: 003017.SZ | B289: 大洋生物 | C289: 1.16 | AP289: 否
A290: 603858.SH | B290: 步长制药 | C290: 1.15 | AP290: 否
A291: 002605.SZ | B291: 姚记科技 | C291: 1.15 | D291: 20.87 | E291: 20.99 | F291: 23.399999999999999 | H291: 22.899999999999999 | AN291: 不宜入场(当前股价小于50日均线，应该持续观察1w) | AO291: 44595 | AP291: 是
A292: 600153.SH | B292: 建发股份 | C292: 1.15 | D292: 8.3300000000000001 | E292: 8.4499999999999993 | F292: 9.0099999999999998 | H292: 9.3599999999999994 | I292: 7.0499999999999998 | J292: 9.9000000000000004 | K292: 8.1899999999999995 | L292: =(H292-I292)/I292 -> 0.32765957446808508 | M292: =(J292-H292)/J292 -> 5.454545454545464e-02 | N292: =(J292-K292)/K292 -> 0.20879120879120891 | P292: 9.1300000000000008 | Q292: 9.8800000000000008 | R292: 9.2100000000000009 | AA292: 2w | AB292: =(J292-P292)/J292 -> 7.7777777777777737e-02 | AC292: =(Q292-R292)/Q292 -> 6.7813765182186223e-02 | AN292: 不宜入场(收缩幅度不够，应该持续观察5d) | AO292: 44599 | AP292: 是
A293: 600323.SH | B293: 瀚蓝环境 | C293: 1.15 | AP293: 否
A294: 600803.SH | B294: 新奥股份 | C294: 1.15 | D294: 18.5 | E294: 18.579999999999998 | F294: 18.699999999999999 | H294: 17.260000000000002 | AN294: 不宜入场(当前股价小于200日均线，应该持续观察3w) | AO294: 44595 | AP294: 是
A295: 601186.SH | B295: 中国铁建 | C295: 1.15 | D295: 7.75 | E295: 7.77 | F295: 7.96 | H295: 8.06 | I295: 6.94 | J295: 9.52 | K295: 7.09 | L295: =(H295-I295)/I295 -> 0.16138328530259366 | M295: =(J295-H295)/J295 -> 0.15336134453781503 | N295: =(J295-K295)/K295 -> 0.34273624823695342 | AN295: 不宜入场(当前股价超出最低点的幅度不够，应该持续观察2w) | AO295: 44595 | AP295: 是
A296: 603868.SH | B296: 飞科电器 | C296: 1.15 | D296: 42.28 | E296: 42.23 | AN296: 不宜入场(150日均线小于200日均线，应该持续观察5w) | AO296: 44595 | AP296: 是
A297: 605089.SH | B297: 味知香 | C297: 1.15 | D297: 75.180000000000007 | E297: 77.900000000000006 | F297: 82.030000000000001 | H297: 69.390000000000001 | AN297: 不宜入场(当前股价小于200日均线，应该持续观察3w) | AO297: 44595 | AP297: 是
A298: 002925.SZ | B298: 盈趣科技 | C298: 1.14 | AP298: 否
A299: 003026.SZ | B299: 中晶科技 | C299: 1.14 | AP299: 否
A300: 600926.SH | B300: 杭州银行 | C300: 1.14 | AP300: 否
A301: 002901.SZ | B301: 大博医疗 | C301: 1.13 | AP301: 否
A302: 000776.SZ | B302: 广发证券 | C302: 1.13 | D302: 20.079999999999998 | E302: 20.870000000000001 | F302: 22.629999999999999 | H302: 20.800000000000001 | AN302: 不宜入场(当前股价小于150日均线，应该持续观察2w) | AO302: 44595 | AP302: 是
A303: 002034.SZ | B303: 旺能环境 | C303: 1.13 | D303: 17.64 | E303: 17.699999999999999 | F303: 18.22 | H303: 18.55 | I303: 13.59 | J303: 23.399999999999999 | K303: 16.07 | L303: =(H303-I303)/I303 -> 0.36497424576894782 | M303: =(J303-H303)/J303 -> 0.20726495726495719 | N303: =(J303-K303)/K303 -> 0.4561294337274423 | P303: 15.58 | Q303: 21.56 | R303: 17.76 | AA303: 16w | AB303: =(J303-P303)/J303 -> 0.33418803418803417 | AC303: =(Q303-R303)/Q303 -> 0.17625231910946185 | AN303: 不宜入场(收缩幅度不够，应该持续观察1w) | AO303: 44595 | AP303: 是
A304: 003043.SZ | B304: 华亚智能 | C304: 1.13 | D304: 65.159999999999997 | E304: 68.769999999999996 | F304: 76.040000000000006 | H304: 68.579999999999998 | AN304: 不宜入场(当前股价小于150日均线，应该持续观察2w) | AO304: 44595 | AP304: 是
A305: 600048.SH | B305: 保利发展 | C305: 1.13 | D305: 13.67 | E305: 13.91 | F305: 15.1 | H305: 15.699999999999999 | I305: 9.0299999999999994 | J305: 17.079999999999998 | K305: 14.85 | L305: =(H305-I305)/I305 -> 0.73864894795127356 | M305: =(J305-H305)/J305 -> 8.0796252927400419e-02 | N305: =(J305-K305)/K305 -> 0.15016835016835009 | P305: 14.880000000000001 | Q305: 16.800000000000001 | R305: 15.199999999999999 | AA305: 2w | AB305: =(J305-P305)/J305 -> 0.12880562060889916 | AC305: =(Q305-R305)/Q305 -> 9.5238095238095316e-02 | AN305: 不宜入场(收缩幅度不够，应该持续观察5d) | AO305: 44601 | AP305: 是
A306: 601615.SH | B306: 明阳智能 | C306: 1.13 | D306: 23.52 | E306: 24.489999999999998 | F306: 25.690000000000001 | H306: 25.559999999999999 | AN306: 不宜入场(当前股价小于50日均线，应该持续观察1w) | AO306: 44595 | AP306: 是
A307: 002271.SZ | B307: 东方雨虹 | C307: 1.12 | AP307: 否
A308: 603288.SH | B308: 海天味业 | C308: 1.12 | AP308: 否
A309: 603666.SH | B309: 亿嘉和 | C309: 1.12 | D309: 65.180000000000007 | E309: 66.150000000000006 | F309: 70.400000000000006 | H309: 63.539999999999999 | AN309: 不宜入场(当前股价小于200日均线，应该持续观察3w) | AO309: 44595 | AP309: 是
A310: 605377.SH | B310: 华旺科技 | C310: 1.12 | D310: 17.010000000000002 | E310: 17.300000000000001 | F310: 18.359999999999999 | H310: 18.989999999999998 | I310: 12.49 | J310: 21.98 | K310: 16.48 | L310: =(H310-I310)/I310 -> 0.52041633306645296 | M310: =(J310-H310)/J310 -> 0.13603275705186543 | N310: =(J310-K310)/K310 -> 0.33373786407766992 | P310: 18.239999999999998 | AA310: 2w | AB310: =(J310-P310)/J310 -> 0.17015468607825304 | AN310: 不宜入场(收缩幅度不够，应观察1w) | AO310: 44595 | AP310: 是
A311: 002233.SZ | B311: 塔牌集团 | C311: 1.12 | AP311: 否
A312: 002759.SZ | B312: 天际股份 | C312: 1.11 | AP312: 否
A313: 600885.SH | B313: 宏发股份 | C313: 1.1000000000000001 | D313: 65.060000000000002 | E313: 66.920000000000002 | F313: 69.180000000000007 | H313: 63.880000000000003 | AN313: 不宜入场(当前股价小于200日均线，应持续观察3w) | AO313: 44595 | AP313: 是
A314: 003023.SZ | B314: 彩虹集团 | C314: 1.1000000000000001 | AP314: 否
A315: 600782.SH | B315: 新钢股份 | C315: 1.1000000000000001 | AP315: 否
A316: 603279.SH | B316: 景津装备 | C316: 1.1000000000000001 | D316: 33.939999999999998 | E316: 35.96 | F316: 41.100000000000001 | H316: 38.850000000000001 | AN316: 不宜入场(当前股价小于50日均线，应持续观察1w) | AO316: 44586 | AP316: 是
A317: 002092.SZ | B317: 中泰化学 | C317: 1.1000000000000001 | AP317: 否
A318: 000960.SZ | B318: 锡业股份 | C318: 1.09 | D318: 17.989999999999998 | E318: 18.539999999999999 | F318: 19.98 | H318: 20 | I318: 9.5399999999999991 | J318: 26.300000000000001 | K318: 15.640000000000001 | L318: =(H318-I318)/I318 -> 1.0964360587002098 | M318: =(J318-H318)/J318 -> 0.23954372623574147 | N318: =(J318-K318)/K318 -> 0.68158567774936063 | P318: 15.539999999999999 | Q318: 24.640000000000001 | R318: 19.530000000000001 | AA318: 13w | AB318: =(J318-P318)/J318 -> 0.40912547528517113 | AC318: =(Q318-R318)/Q318 -> 0.20738636363636362 | AN318: 不宜入场(收缩幅度不够，应观察2w) | AO318: 44595 | AP318: 是
A319: 002430.SZ | B319: 杭氧股份 | C319: 1.09 | AP319: 否
A320: 002626.SZ | B320: 金达威 | C320: 1.09 | AP320: 否
A321: 603662.SH | B321: 柯力传感 | C321: 1.09 | D321: 22.15 | E321: 22.59 | F321: 23.23 | H321: 22.68 | AN321: 不宜入场(当前股价小于50日均线，应持续观察1w) | AO321: 44598 | AP321: 是
A322: 000963.SZ | B322: 华东医药 | C322: 1.08 | AP322: 否
A323: 002960.SZ | B323: 青鸟消防 | C323: 1.08 | D323: 33.939999999999998 | E323: 35.390000000000001 | F323: 42.240000000000002 | H323: 49.100000000000001 | I323: 20.260000000000002 | J323: 51.670000000000002 | K323: 36.420000000000002 | L323: =(H323-I323)/I323 -> 1.4234945705824282 | M323: =(J323-H323)/J323 -> 4.9738726533772017e-02 | N323: =(J323-K323)/K323 -> 0.41872597473915429 | P323: 47.140000000000001 | AA323: 1w | AB323: =(J323-P323)/J323 -> 8.7671763112057308e-02 | AC323: =(Q323-R323)/Q323 -> #DIV/0! | AN323: 不宜入场(收缩幅度不够，应观察1w) | AO323: 44586 | AP323: 是
A324: 600587.SH | B324: 新华医疗 | C324: 1.08 | D324: 23.359999999999999 | E324: 24.440000000000001 | F324: 26.109999999999999 | H324: 21.690000000000001 | AN324: 不宜入场(当前股价小于200日均线，应持续观察3w) | AO324: 44598 | AP324: 是
A325: 603180.SH | B325: 金牌厨柜 | C325: 1.08 | AP325: 否
A326: 603612.SH | B326: 索通发展 | C326: 1.08 | AP326: 否
A327: 600176.SH | B327: 中国巨石 | C327: 1.08 | AP327: 否
A328: 600690.SH | B328: 海尔智家 | C328: 1.07 | AP328: 否
A329: 002254.SZ | B329: 泰和新材 | C329: 1.07 | D329: 19.45 | E329: 19.77 | F329: 19.86 | H329: 18.49 | AN329: 不宜入场(当前股价小于200日均线，应持续观察3w) | AO329: 44598 | AP329: 是
A330: 601101.SH | B330: 昊华能源 | C330: 1.07 | D330: 7.54 | E330: 7.93 | F330: 8.16 | H330: 7.37 | AN330: 不宜入场(当前股价小于200日均线，应持续观察3w) | AO330: 44598 | AP330: 是
A331: 603908.SH | B331: 牧高笛 | C331: 1.07 | D331: 33.450000000000003 | E331: 35.409999999999997 | F331: 40.869999999999997 | H331: 41 | I331: 18.239999999999998 | J331: 49.5 | K331: 30.699999999999999 | L331: =(H331-I331)/I331 -> 1.2478070175438598 | M331: =(J331-H331)/J331 -> 0.17171717171717171 | N331: =(J331-K331)/K331 -> 0.6123778501628665 | P331: 39.68 | AA331: 2w | AB331: =(J331-P331)/J331 -> 0.19838383838383838 | AN331: 不宜入场(收缩幅度不够，应观察1w) | AO331: 44598 | AP331: 是
A332: 605100.SH | B332: 华丰股份 | C332: 1.07 | AP332: 否
A333: 002311.SZ | B333: 海大集团 | C333: 1.06 | AP333: 否
A334: 002993.SZ | B334: 奥海科技 | C334: 1.06 | AP334: 否
A335: 603380.SH | B335: 易德龙 | C335: 1.06 | D335: 31.670000000000002 | E335: 33.259999999999998 | F335: 37.859999999999999 | H335: 36.43 | AN335: 不宜入场(当前股价小于50日均线，应观察1w) | AO335: 44586 | AP335: 是
A336: 603535.SH | B336: 嘉诚国际 | C336: 1.06 | AP336: 否
A337: 605507.SH | B337: 国邦医药 | C337: 1.06 | AP337: 否
A338: 002595.SZ | B338: 豪迈科技 | C338: 1.05 | AP338: 否
A339: 600038.SH | B339: 中直股份 | C339: 1.05 | D339: 61.719999999999999 | E339: 63.530000000000001 | F339: 67.329999999999998 | H339: 55.270000000000003 | AN339: 不宜入场(当前股价小于200日均线，应持续观察3w) | AO339: 44598 | AP339: 是
A340: 002078.SZ | B340: 太阳纸业 | C340: 1.05 | AP340: 否
A341: 603100.SH | B341: 川仪股份 | C341: 1.05 | D341: 18.210000000000001 | E341: 18.77 | F341: 19.850000000000001 | H341: 16.989999999999998 | AN341: 不宜入场(当前股价小于200日均线，应持续观察3w) | AO341: 44598 | AP341: 是
A342: 605488.SH | B342: 福莱新材 | C342: 1.05 | AP342: 否
A343: 603233.SH | B343: 大参林 | C343: 1.04 | AP343: 否
A344: 603507.SH | B344: 振江股份 | C344: 1.04 | D344: 33.729999999999997 | E344: 35.789999999999999 | F344: 39.359999999999999 | H344: 39.020000000000003 | AN344: 不宜入场(当前股价小于50日均线，应观察1w) | AO344: 44598 | AP344: 是
A345: 600248.SH | B345: 陕西建工 | C345: 1.03 | D345: 4.74 | E345: 4.78 | F345: 4.88 | H345: 5.24 | I345: 3.55 | J345: 6.56 | K345: 4.64 | L345: =(H345-I345)/I345 -> 0.47605633802816916 | M345: =(J345-H345)/J345 -> 0.20121951219512188 | N345: =(J345-K345)/K345 -> 0.41379310344827586 | P345: 3.93 | Q345: 5.23 | R345: 4.69 | S345: 5.32 | T345: 4.85 | U345: 5.45 | V345: 4.86 | AA345: 11w | AB345: =(J345-P345)/J345 -> 0.40091463414634143 | AC345: =(Q345-R345)/Q345 -> 0.10325047801147227 | AD345: =(S345-T345)/S345 -> 8.8345864661654255e-02 | AE345: =(U345-V345)/U345 -> 0.10825688073394492 | AN345: 不宜入场(收缩幅度不够，应观察2w) | AO345: 44598 | AP345: 是
A346: 000807.SZ | B346: 云铝股份 | C346: 1.03 | AP346: 否
A347: 000933.SZ | B347: 神火股份 | C347: 1.03 | AP347: 否
A348: 002039.SZ | B348: 黔源电力 | C348: 1.03 | D348: 17.84 | E348: 18.27 | F348: 19.050000000000001 | H348: 17.760000000000002 | AN348: 不宜入场(当前股价小于200日均线，应观察3w) | AO348: 44598 | AP348: 是
A349: 002444.SZ | B349: 巨星科技 | C349: 1.02 | AP349: 否
A350: 002918.SZ | B350: 蒙娜丽莎 | C350: 1.02 | AP350: 否
A351: 600183.SH | B351: 生益科技 | C351: 1.02 | AP351: 否
A352: 600660.SH | B352: 福耀玻璃 | C352: 1.02 | AP352: 否
A353: 001203.SZ | B353: 大中矿业 | C353: 1.01 | AP353: 否
A354: 001234.SZ | B354: 泰慕士 | C354: 1.01 | D354: 25.25 | E354: 25.68 | F354: 28.52 | H354: 28.100000000000001 | AN354: 不宜入场(当前股价小于50日均线，应观察1w) | AO354: 44598 | AP354: 是
A355: 002407.SZ | B355: 多氟多 | C355: 1.01 | D355: 42.61 | E355: 44.67 | F355: 44.77 | H355: 42.21 | AN355: 不宜入场(当前股价小于200日均线，应观察3w) | AO355: 44598 | AP355: 是
A356: 600075.SH | B356: 新疆天业 | C356: 1.01 | AP356: 否
A357: 600919.SH | B357: 江苏银行 | C357: 1.01 | AP357: 否
A358: 600997.SH | B358: 开滦股份 | C358: 1.01 | AP358: 否
A359: 603005.SH | B359: 晶方科技 | C359: 1.01 | AP359: 否
A360: 603230.SH | B360: 内蒙新华 | C360: 1.01 | D360: 16.78 | E360: 16.96 | F360: 17.77 | H360: 15.1 | AN360: 不宜入场(当前股价小于200日均线，应观察3w) | AO360: 44598 | AP360: 是
A361: 605358.SH | B361: 立昂微 | C361: 1.01 | D361: 116.04 | E361: 119.29 | F361: 121.15 | H361: 120.21 | AN361: 不宜入场(当前股价小于50日均线，应观察1w) | AO361: 44598 | AP361: 是
A362: 600456.SH | B362: 宝钛股份 | C362: 1.01 | D362: 52.85 | E362: 54.96 | F362: 58.93 | H362: 48.15 | AN362: 不宜入场(当前股价小于200日均线，应观察3w) | AO362: 44598 | AP362: 是
A363: 603109.SH | B363: 神驰机电 | C363: 1.01 | D363: 26.67 | E363: 27.5 | F363: 29.37 | H363: 31.71 | I363: 18.199999999999999 | J363: 35.68 | K363: 28.17 | L363: =(H363-I363)/I363 -> 0.74230769230769245 | M363: =(J363-H363)/J363 -> 0.11126681614349773 | N363: =(J363-K363)/K363 -> 0.26659566915157962 | O363: 3 | P363: 26.33 | Q363: 30.79 | R363: 28.61 | S363: 32.600000000000001 | T363: 28.78 | AA363: 9w | AB363: =(J363-P363)/J363 -> 0.26205156950672648 | AC363: =(Q363-R363)/Q363 -> 7.080220850925624e-02 | AD363: =(S363-T363)/S363 -> 0.11717791411042945 | AN363: 不宜入场(收缩幅度不够，应观察1w) | AO363: 44598 | AP363: 是
A364: 000951.SZ | B364: 中国重汽 | C364: 1 | AP364: 否
A365: 002241.SZ | B365: 歌尔股份 | C365: 1 | D365: 44.33 | E365: 46.34 | F365: 50.42 | H365: 45.65 | AN365: 不宜入场(当前股价小于50日均线，应观察1w) | AO365: 44598 | AP365: 是
A366: 002493.SZ | B366: 荣盛石化 | C366: 1 | AP366: 否
A367: 002732.SZ | B367: 燕塘乳业 | C367: 1 | D367: 25.75 | E367: 26.16 | F367: 26.05 | AN367: 不宜入场(50日均线小于150日均线，应观察4w) | AO367: 44598 | AP367: 是
A368: 000895.SZ | B368: 双汇发展 | C368: 1 | AP368: 否
A369: 600507.SH | B369: 方大特钢 | C369: 0.99 | AP369: 否
A370: 002919.SZ | B370: 名臣健康 | C370: 0.99 | AP370: 否
A371: 600535.SH | B371: 天士力 | C371: 0.99 | D371: 13.800000000000001 | E371: 13.92 | F371: 14.43 | H371: 13.83 | AN371: 不宜入场(当前股价小于150日均线，应观察2w) | AO371: 44598 | AP371: 是
A372: 603613.SH | B372: 国联股份 | C372: 0.99 | D372: 108.42 | E372: 109.85 | F372: 113.39 | H372: 116.5 | I372: 82.67 | J372: 127.8 | K372: 113.25 | L372: =(H372-I372)/I372 -> 0.40921737026732791 | M372: =(J372-H372)/J372 -> 8.8419405320813757e-02 | N372: =(J372-K372)/K372 -> 0.12847682119205295 | P372: 98.51 | Q372: 122.09999999999999 | R372: 113.81 | AA372: 10w | AB372: =(J372-P372)/J372 -> 0.22918622848200307 | AC372: =(Q372-R372)/Q372 -> 6.7895167895167835e-02 | AN372: 不宜入场(收缩幅度不够，应观察2w) | AO372: 44598 | AP372: 是
A373: 603893.SH | B373: 瑞芯微 | C373: 0.99 | D373: 120.40000000000001 | E373: 123.96 | F373: 123.56 | AN373: 不宜入场(50日均线小于150日均线，应观察4w) | AO373: 44598 | AP373: 是
A374: 605003.SH | B374: 众望布艺 | C374: 0.99 | D374: 24.12 | E374: 24.38 | F374: 25.75 | H374: 24.81 | I374: 20.14 | J374: 30 | K374: 22.16 | L374: =(H374-I374)/I374 -> 0.23187686196623625 | M374: =(J374-H374)/J374 -> 0.17300000000000004 | N374: =(J374-K374)/K374 -> 0.35379061371841153 | AN374: 不宜入场(当前股价距离最低点距离过小，应观察1w) | AO374: 44598 | AP374: 是
A375: 605028.SH | B375: 世茂能源 | C375: 0.99 | D375: 23.03 | E375: 23.37 | F375: 23.27 | AN375: 不宜入场(50日均线小于150日均线，应观察4w) | AO375: 44598 | AP375: 是
A376: 600618.SH | B376: 氯碱化工 | C376: 0.99 | D376: 11.59 | E376: 12 | F376: 12.39 | H376: 11.48 | AN376: 不宜入场(当前股价小于200日均线，应观察3w) | AO376: 44598 | AP376: 是
A377: 603822.SH | B377: 嘉澳环保 | C377: 0.98 | D377: 39.469999999999999 | E377: 41.920000000000002 | F377: 46.649999999999999 | H377: 52.960000000000001 | I377: 15.01 | J377: 57 | K377: 41.840000000000003 | L377: =(H377-I377)/I377 -> 2.5283144570286478 | M377: =(J377-H377)/J377 -> 7.0877192982456122e-02 | N377: =(J377-K377)/K377 -> 0.36233269598470352 | O377: 1 | P377: 39 | Q377: 51.82 | R377: 40.109999999999999 | S377: 53.600000000000001 | T377: 46.799999999999997 | AA377: 17w | AB377: =(J377-P377)/J377 -> 0.31578947368421051 | AC377: =(Q377-R377)/Q377 -> 0.22597452720957162 | AD377: =(S377-T377)/S377 -> 0.12686567164179113 | AN377: 不宜入场（收缩幅度不够,应观察1w） | AO377: 44598 | AP377: 是
A378: 000636.SZ | B378: 风华高科 | C378: 0.98 | AP378: 否
A379: 002636.SZ | B379: 金安国纪 | C379: 0.98 | AP379: 否
A380: 002870.SZ | B380: 香山股份 | C380: 0.98 | D380: 32.98 | E380: 34.43 | F380: 37.09 | H380: 33.76 | AN380: 不宜入场(当前股价小于150日均线，应观察2w) | AO380: 44598 | AP380: 是
A381: 002884.SZ | B381: 凌霄泵业 | C381: 0.98 | D381: 22.66 | E381: 23.05 | F381: 24.34 | H381: 24.15 | AN381: 不宜入场(当前股价小于50日均线，应观察1w) | AO381: 44598 | AP381: 是
A382: 002980.SZ | B382: 华盛昌 | C382: 0.98 | AP382: 否
A383: 600019.SH | B383: 宝钢股份 | C383: 0.98 | AP383: 否
A384: 603939.SH | B384: 益丰药房 | C384: 0.98 | AP384: 否
A385: 605277.SH | B385: 新亚电子 | C385: 0.98 | D385: 27.399999999999999 | E385: 28.28 | F385: 30.199999999999999 | H385: 27.21 | AN385: 不宜入场(当前股价小于200日均线，应观察3w) | AO385: 44598 | AP385: 是
A386: 003005.SZ | B386: 竞业达 | C386: 0.97 | AP386: 否
A387: 000949.SZ | B387: 新乡化纤 | C387: 0.97 | AP387: 否
A388: 603508.SH | B388: 思维列控 | C388: 0.97 | D388: 21.71 | E388: 21.92 | F388: 22.64 | H388: 22.61 | AN388: 不宜入场(当前股价小于50日均线，应观察1w) | AO388: 44598 | AP388: 是
A389: 603948.SH | B389: 建业股份 | C389: 0.97 | D389: 25.55 | E389: 26.61 | F389: 28.08 | H389: 26.53 | AN389: 不宜入场(当前股价小于150日均线，应观察2w) | AO389: 44598 | AP389: 是
A390: 600707.SH | B390: 彩虹股份 | C390: 0.97 | AP390: 否
A391: 000959.SZ | B391: 首钢股份 | C391: 0.96 | AP391: 否
A392: 001205.SZ | B392: 盛航股份 | C392: 0.96 | D392: 24.91 | E392: 25.03 | F392: 26.58 | H392: 29.45 | I392: 19.82 | J392: 38.32 | K392: 19.82 | L392: =(H392-I392)/I392 -> 0.48587285570131172 | M392: =(J392-H392)/J392 -> 0.23147181628392488 | N392: =(J392-K392)/K392 -> 0.93340060544904135 | O392: 2 | P392: 19.51 | Q392: 33.899999999999999 | R392: 25.74 | AA392: 33w | AB392: =(J392-P392)/J392 -> 0.490866388308977 | AC392: =(Q392-R392)/Q392 -> 0.24070796460176994 | AN392: 不宜入场(收缩幅度不够，应观察2w) | AO392: 44598 | AP392: 是
A393: 001209.SZ | B393: 洪兴股份 | C393: 0.96 | AP393: 否
A394: 003027.SZ | B394: 同兴环保 | C394: 0.96 | AP394: 否
A395: 603008.SH | B395: 喜临门 | C395: 0.96 | D395: 29.399999999999999 | E395: 30.050000000000001 | F395: 33.450000000000003 | H395: 37.200000000000003 | I395: 6.1799999999999997 | J395: 40.450000000000003 | K395: 27.010000000000002 | L395: =(H395-I395)/I395 -> 5.0194174757281562 | M395: =(J395-H395)/J395 -> 8.034610630407911e-02 | N395: =(J395-K395)/K395 -> 0.49759348389485375 | P395: 33.770000000000003 | Q395: 37.810000000000002 | R395: 33.609999999999999 | AA395: 2w | AB395: =(J395-P395)/J395 -> 0.16514215080346104 | AC395: =(Q395-R395)/Q395 -> 0.11108172441153141 | AI395: 否 | AJ395: 否 | AK395: 否 | AL395: 否 | AN395: 不宜入场(价格行为和成交量行为不符,应观察1w) | AO395: 44600 | AP395: 是
A396: 603738.SH | B396: 泰晶科技 | C396: 0.96 | D396: 46.17 | E396: 49.23 | F396: 54.33 | H396: 51.52 | AN396: 不宜入场(当前股价小于50日均线，应观察1w) | AO396: 44598 | AP396: 是
A397: 605289.SH | B397: 罗曼股份 | C397: 0.96 | D397: 31.98 | E397: 31.899999999999999 | F397: 34.56 | H397: 32.51 | AN397: 不宜入场(当前股价小于50日均线，应观察1w) | AO397: 44599 | AP397: 是
A398: 600845.SH | B398: 宝信软件 | C398: 0.96 | D398: 60.79 | E398: 62.22 | F398: 62.07 | AN398: 不宜入场(50日均线小于150日均线，应观察4w) | AO398: 44598 | AP398: 是
A399: 000338.SZ | B399: 潍柴动力 | C399: 0.95 | AP399: 否
A400: 001210.SZ | B400: 金房节能 | C400: 0.95 | AP400: 否
A401: 600348.SH | B401: 华阳股份 | C401: 0.95 | D401: 9.94 | E401: 10.51 | F401: 11.34 | H401: 10.68 | AN401: 不宜入场(当前股价小于50日均线，应观察1w) | AO401: 44599 | AP401: 是
A402: 601168.SH | B402: 西部矿业 | C402: 0.95 | AP402: 否
A403: 603127.SH | B403: 昭衍新药 | C403: 0.95 | AP403: 否
A404: 603568.SH | B404: 伟明环保 | C404: 0.95 | D404: 28.69 | E404: 29.85 | F404: 32.76 | H404: 31.64 | AN404: 不宜入场(当前股价小于50日均线，应观察1w) | AO404: 44599 | AP404: 是
A405: 603950.SH | B405: 长源东谷 | C405: 0.95 | AP405: 否
A406: 605208.SH | B406: 永茂泰 | C406: 0.95 | AP406: 否
A407: 605500.SH | B407: 森林包装 | C407: 0.95 | AP407: 否
A408: 002738.SZ | B408: 中矿资源 | C408: 0.95 | D408: 53.58 | E408: 56.899999999999999 | F408: 61.75 | H408: 59.71 | AN408: 不宜入场(当前股价小于50日均线，应观察1w) | AO408: 44599 | AP408: 是
A409: 603801.SH | B409: 志邦家居 | C409: 0.95 | AP409: 否
A410: 000893.SZ | B410: 亚钾国际 | C410: 0.95 | D410: 18.699999999999999 | E410: 19.670000000000002 | F410: 22.460000000000001 | H410: 24.300000000000001 | I410: 7.9000000000000004 | J410: 28.670000000000002 | K410: 17.870000000000001 | L410: =(H410-I410)/I410 -> 2.0759493670886071 | M410: =(J410-H410)/J410 -> 0.15242413672828745 | N410: =(J410-K410)/K410 -> 0.60436485730274203 | P410: 22.350000000000001 | AA410: 2w | AB410: =(J410-P410)/J410 -> 0.22043948378095571 | AN410: 不宜入场（收缩幅度不够,应观察2w） | AO410: 44599 | AP410: 是
A411: 603365.SH | B411: 水星家纺 | C411: 0.94 | D411: 15.75 | E411: 15.91 | F411: 16.55 | H411: 16.61 | I411: 11.93 | J411: 18.26 | K411: 15.93 | L411: =(H411-I411)/I411 -> 0.39228834870075441 | M411: =(J411-H411)/J411 -> 9.0361445783132641e-02 | N411: =(J411-K411)/K411 -> 0.14626490897677349 | P411: 15.98 | AA411: 2w | AB411: =(J411-P411)/J411 -> 0.12486308871851046 | AN411: 不宜入场（收缩幅度不够,应观察1w） | AO411: 44599 | AP411: 是
A412: 603926.SH | B412: 铁流股份 | C412: 0.94 | D412: 15.29 | E412: 15.64 | F412: 16.17 | H412: 15.32 | AN412: 不宜入场(当前股价小于150日均线，应观察2w) | AO412: 44599 | AP412: 是
A413: 002572.SZ | B413: 索菲亚 | C413: 0.93 | AP413: 否
A414: 600352.SH | B414: 浙江龙盛 | C414: 0.93 | AP414: 否
A415: 000818.SZ | B415: 航锦科技 | C415: 0.93 | D415: 31.62 | E415: 32.92 | F415: 35.12 | H415: 34.399999999999999 | AN415: 不宜入场(当前股价小于50日均线，应观察1w) | AO415: 44599 | AP415: 是
A416: 002818.SZ | B416: 富森美 | C416: 0.93 | AP416: 否
A417: 601939.SH | B417: 建设银行 | C417: 0.93 | AP417: 否
A418: 603458.SH | B418: 勘设股份 | C418: 0.93 | D418: 12.09 | E418: 12.18 | F418: 12.93 | H418: 14.08 | I418: 9.78 | J418: 14.82 | K418: 12.66 | L418: =(H418-I418)/I418 -> 0.43967280163599193 | M418: =(J418-H418)/J418 -> 4.9932523616734156e-02 | N418: =(J418-K418)/K418 -> 0.17061611374407584 | P418: 12.58 | AA418: 2w | AB418: =(J418-P418)/J418 -> 0.15114709851551958 | AN418: 不宜入场（收缩幅度不够,应观察1w） | AO418: 44599 | AP418: 是
A419: 603466.SH | B419: 风语筑 | C419: 0.93 | D419: 20.15 | E419: 21.32 | F419: 26.27 | H419: 26.97 | I419: 12.77 | J419: 35.03 | K419: 19.54 | L419: =(H419-I419)/I419 -> 1.1119812059514487 | M419: =(J419-H419)/J419 -> 0.23008849557522129 | N419: =(J419-K419)/K419 -> 0.79273285568065521 | P419: 26.5 | AA419: 2w | AB419: =(J419-P419)/J419 -> 0.24350556665715103 | AN419: 不宜入场（收缩幅度不够,应观察2w） | AO419: 44599 | AP419: 是
A420: 605337.SH | B420: 李子园 | C420: 0.93 | D420: 42.97 | E420: 43.79 | F420: 43.84 | H420: 38.200000000000003 | AN420: 不宜入场(当前股价小于200日均线，应观察3w) | AO420: 44599 | AP420: 是
A421: 000977.SZ | B421: 浪潮信息 | C421: 0.93 | D421: 31.16 | E421: 31.93 | F421: 34.12 | H421: 30.82 | AN421: 不宜入场(当前股价小于200日均线，应观察3w) | AO421: 44599 | AP421: 是
A422: 003041.SZ | B422: 真爱美家 | C422: 0.92 | AP422: 否
A423: 000761.SZ | B423: 本钢板材 | C423: 0.92 | AP423: 否
A424: 002867.SZ | B424: 周大生 | C424: 0.92 | AP424: 否
A425: 601668.SH | B425: 中国建筑 | C425: 0.92 | D425: 4.89 | E425: 4.91 | F425: 5.08 | H425: 5.48 | I425: 4.38 | J425: 5.52 | K425: 4.7000000000000002 | L425: =(H425-I425)/I425 -> 0.25114155251141568 | M425: =(J425-H425)/J425 -> 7.2463768115940486e-03 | N425: =(J425-K425)/K425 -> 0.17446808510638284 | P425: 5.2000000000000002 | AA425: 1w | AB425: =(J425-P425)/J425 -> 5.797101449275352e-02 | AN425: 不宜入场（成交量行为和价格行为尚不明朗,应观察1w） | AO425: 44599 | AP425: 是
A426: 603538.SH | B426: 美诺华 | C426: 0.92 | AP426: 否
A427: 603639.SH | B427: 海利尔 | C427: 0.92 | D427: 20.79 | E427: 21.43 | F427: 23.73 | H427: 23.600000000000001 | AN427: 不宜入场(当前股价小于50日均线，应观察1w) | AO427: 44599 | AP427: 是
A428: 002798.SZ | B428: 帝欧家居 | C428: 0.92 | AP428: 否
A429: 002129.SZ | B429: 中环股份 | C429: 0.91 | D429: 40.78 | E429: 41.92 | F429: 42.12 | H429: 43.68 | I429: 22.42 | J429: 56.24 | K429: 36.91 | L429: =(H429-I429)/I429 -> 0.94826048171275634 | M429: =(J429-H429)/J429 -> 0.22332859174964442 | N429: =(J429-K429)/K429 -> 0.52370631265239787 | P429: 37.48 | AA429: 20w | AB429: =(J429-P429)/J429 -> 0.33357041251778102 | AN429: 不宜入场（收缩幅度不够,应观察2w） | AO429: 44599 | AP429: 是
A430: 002023.SZ | B430: 海特高新 | C430: 0.91 | AP430: 否
A431: 002025.SZ | B431: 航天电器 | C431: 0.91 | D431: 65.28 | E431: 67.71 | F431: 72.23 | H431: 65.5 | AN431: 不宜入场(当前股价小于150日均线，应观察2w) | AO431: 44599 | AP431: 是
A432: 002462.SZ | B432: 嘉事堂 | C432: 0.91 | D432: 13.1 | E432: 13.09 | AN432: 不宜入场(150日均线小于200日均线，应观察6w) | AO432: 44599 | AP432: 是
A433: 002853.SZ | B433: 皮阿诺 | C433: 0.91 | AP433: 否
A434: 600835.SH | B434: 上海机电 | C434: 0.91 | AP434: 否
A435: 600837.SH | B435: 海通证券 | C435: 0.91 | D435: 11.86 | E435: 11.98 | F435: 12.11 | H435: 11.6 | AN435: 不宜入场(当前股价小于200日均线，应观察3w) | AO435: 44599 | AP435: 是
A436: 600999.SH | B436: 招商证券 | C436: 0.91 | AP436: 否
A437: 605338.SH | B437: 巴比食品 | C437: 0.91 | AP437: 否
A438: 000990.SZ | B438: 诚志股份 | C438: 0.91 | D438: 14.84 | E438: 14.96 | F438: 14.85 | AN438: 不宜入场(50日均线小于150日均线，应观察4w) | AO438: 44599 | AP438: 是
A439: 601717.SH | B439: 郑煤机 | C439: 0.91 | D439: 11.65 | E439: 11.699999999999999 | F439: 11.89 | H439: 12.02 | I439: 9.17 | J439: 16.33 | K439: 10.11 | L439: =(H439-I439)/I439 -> 0.31079607415485272 | M439: =(J439-H439)/J439 -> 0.26393141457440289 | N439: =(J439-K439)/K439 -> 0.61523244312561809 | AN439: 不宜入场(当前股价距离最高点距离过大，应观察1w) | AO439: 44599 | AP439: 是
A440: 601003.SH | B440: 柳钢股份 | C440: 0.90000000000000002 | AP440: 否
A441: 603520.SH | B441: 司太立 | C441: 0.90000000000000002 | AP441: 否
A442: 603596.SH | B442: 伯特利 | C442: 0.90000000000000002 | D442: 53.87 | E442: 58.07 | F442: 70.74 | H442: 72.89 | I442: 26.48 | J442: 89.63 | K442: 63.69 | L442: =(H442-I442)/I442 -> 1.7526435045317219 | M442: =(J442-H442)/J442 -> 0.18676782327345751 | N442: =(J442-K442)/K442 -> 0.40728528811430365 | P442: 72.21 | AA442: 1w | AB442: =(J442-P442)/J442 -> 0.19435456878277366 | AN442: 不宜入场（收缩幅度不够,应观察1w） | AO442: 44599 | AP442: 是
A443: 603610.SH | B443: 麒盛科技 | C443: 0.90000000000000002 | D443: 23.59 | E443: 24.19 | F443: 24.88 | H443: 24.100000000000001 | AN443: 不宜入场(当前股价小于150日均线，应观察2w) | AO443: 44599 | AP443: 是
A444: 605006.SH | B444: 山东玻纤 | C444: 0.90000000000000002 | AP444: 否
A445: 603989.SH | B445: 艾华集团 | C445: 0.90000000000000002 | D445: 35.25 | E445: 36.03 | F445: 37.32 | H445: 34.35 | AN445: 不宜入场(当前股价小于200日均线，应观察3w) | AO445: 44599 | AP445: 是
A446: 002920.SZ | B446: 德赛西威 | C446: 0.89 | D446: 114.88 | E446: 119.51 | F446: 136.99 | H446: 137.74 | I446: 69.900000000000006 | J446: 165.5 | K446: 97.85 | L446: =(H446-I446)/I446 -> 0.97052932761087263 | M446: =(J446-H446)/J446 -> 0.16773413897280962 | N446: =(J446-K446)/K446 -> 0.69136433316300472 | P446: 125.71 | Q446: 158.99 | R446: 136 | AA446: 1w | AB446: =(J446-P446)/J446 -> 0.24042296072507557 | AC446: =(Q446-R446)/Q446 -> 0.14460028932637278 | AN446: 不宜入场（收缩幅度不够,应观察1w） | AO446: 44599 | AP446: 是
A447: 601066.SH | B447: 中信建投 | C447: 0.89 | AP447: 否
A448: 601898.SH | B448: 中煤能源 | C448: 0.89 | AP448: 否
A449: 603013.SH | B449: 亚普股份 | C449: 0.89 | D449: 15.43 | E449: 15.72 | F449: 16.26 | H449: 14.91 | AN449: 不宜入场(当前股价小于200日均线，应观察3w) | AO449: 44599 | AP449: 是
A450: 603855.SH | B450: 华荣股份 | C450: 0.89 | D450: 22.29 | E450: 22.99 | F450: 25.25 | H450: 26.12 | I450: 13.5 | J450: 28.34 | K450: 24.52 | L450: =(H450-I450)/I450 -> 0.93481481481481488 | M450: =(J450-H450)/J450 -> 7.833450952717004e-02 | N450: =(J450-K450)/K450 -> 0.15579119086460033 | O450: 3 | P450: 25.18 | Q450: 27.66 | R450: 25.26 | AA450: 2w | AB450: =(J450-P450)/J450 -> 0.11150317572335922 | AC450: =(Q450-R450)/Q450 -> 8.6767895878524889e-02 | AI450: 否 | AJ450: 是 | AL450: 否 | AN450: 不宜入场（成交量和成交行为尚不明朗,应观察1w） | AO450: 44601 | AP450: 是
A451: 000906.SZ | B451: 浙商中拓 | C451: 0.88 | D451: 10.58 | E451: 10.84 | F451: 11.28 | H451: 11.62 | I451: 5.5999999999999996 | J451: 13.75 | K451: 8.35 | L451: =(H451-I451)/I451 -> 1.075 | M451: =(J451-H451)/J451 -> 0.15490909090909097 | N451: =(J451-K451)/K451 -> 0.64670658682634741 | P451: 9.43 | Q451: 11.35 | R451: 10.18 | S451: 12.47 | T451: 11.1 | AA451: 1w | AB451: =(J451-P451)/J451 -> 0.31418181818181823 | AC451: =(Q451-R451)/Q451 -> 0.10308370044052863 | AD451: =(S451-T451)/S451 -> 0.10986367281475548 | AN451: 不宜入场（收缩幅度不够,应观察2w） | AO451: 44599 | AP451: 是
A452: 000910.SZ | B452: 大亚圣象 | C452: 0.88 | AP452: 否
A453: 002984.SZ | B453: 森麒麟 | C453: 0.88 | AP453: 否
A454: 003019.SZ | B454: 宸展光电 | C454: 0.88 | D454: 28.01 | E454: 28.08 | F454: 28.73 | H454: 27.84 | AN454: 不宜入场(当前股价小于200日均线，应观察3w) | AO454: 44599 | AP454: 是
A455: 600500.SH | B455: 中化国际 | C455: 0.88 | D455: 7.98 | E455: 8.21 | F455: 8.23 | H455: 7.81 | AN455: 不宜入场(当前股价小于200日均线，应观察3w) | AO455: 44599 | AP455: 是
A456: 600546.SH | B456: 山煤国际 | C456: 0.88 | D456: 8.5999999999999996 | E456: 8.81 | F456: 8.95 | H456: 9.61 | I456: 5.65 | J456: 15.18 | K456: 7.33 | L456: =(H456-I456)/I456 -> 0.70088495575221221 | M456: =(J456-H456)/J456 -> 0.36693017127799737 | N456: =(J456-K456)/K456 -> 1.0709413369713505 | AN456: 不宜入场(当前股价距离最高点距离过大，应观察2w) | AO456: 44599 | AP456: 是
A457: 603611.SH | B457: 诺力股份 | C457: 0.88 | D457: 17.38 | E457: 18.02 | F457: 19.02 | H457: 17.81 | AN457: 不宜入场(当前股价小于150日均线，应观察2w) | AO457: 44599 | AP457: 是
A458: 600586.SH | B458: 金晶科技 | C458: 0.87 | AP458: 否
A459: 600111.SH | B459: 北方稀土 | C459: 0.87 | D459: 40.090000000000003 | E459: 42.409999999999997 | F459: 44.520000000000003 | H459: 40.899999999999999 | AN459: 不宜入场（当前股价小于150日均线,应观察2w） | AO459: 44599 | AP459: 是
A460: 603590.SH | B460: 康辰药业 | C460: 0.87 | AP460: 否
A461: 002242.SZ | B461: 九阳股份 | C461: 0.87 | AP461: 否
A462: 600015.SH | B462: 华夏银行 | C462: 0.87 | AP462: 否
A463: 600325.SH | B463: 华发股份 | C463: 0.87 | D463: 5.92 | E463: 5.93 | F463: 6.0999999999999996 | H463: 6.58 | I463: 5.13 | J463: 7.24 | K463: 6.2999999999999998 | L463: =(H463-I463)/I463 -> 0.28265107212475638 | M463: =(J463-H463)/J463 -> 9.1160220994475155e-02 | N463: =(J463-K463)/K463 -> 0.14920634920634926 | P463: 5.13 | AA463: 19w | AB463: =(J463-P463)/J463 -> 0.29143646408839785 | AN463: 不宜入场（收缩幅度不够,应观察2w） | AO463: 44599 | AP463: 是
A464: 600606.SH | B464: 绿地控股 | C464: 0.87 | AP464: 否
A465: 601825.SH | B465: 沪农商行 | C465: 0.87 | AP465: 否
A466: 603916.SH | B466: 苏博特 | C466: 0.87 | D466: 22.36 | E466: 22.45 | F466: 24.31 | H466: 25.81 | I466: 16.18 | J466: 29.31 | K466: 21.95 | L466: =(H466-I466)/I466 -> 0.59517923362175518 | M466: =(J466-H466)/J466 -> 0.11941316956670078 | N466: =(J466-K466)/K466 -> 0.33530751708428247 | P466: 24.71 | AA466: 1w | AB466: =(J466-P466)/J466 -> 0.1569430228590924 | AN466: 不宜入场（收缩幅度不够,应观察1w） | AO466: 44599 | AP466: 是
A467: 603871.SH | B467: 嘉友国际 | C467: 0.87 | D467: 18.600000000000001 | E467: 19.12 | F467: 20.75 | H467: 20.46 | AN467: 不宜入场（当前股价小于50日均线,应观察1w） | AO467: 44599 | AP467: 是
A468: 600273.SH | B468: 嘉化能源 | C468: 0.86 | D468: 10.19 | E468: 10.34 | F468: 10.69 | H468: 10.68 | AN468: 不宜入场（当前股价小于50日均线,应观察1w） | AO468: 44599 | AP468: 是
A469: 600900.SH | B469: 长江电力 | C469: 0.86 | D469: 20.79 | E469: 20.99 | F469: 21.92 | H469: 22.39 | I469: 17.800000000000001 | J469: 23.52 | K469: 19.99 | L469: =(H469-I469)/I469 -> 0.25786516853932584 | M469: =(J469-H469)/J469 -> 4.8044217687074786e-02 | N469: =(J469-K469)/K469 -> 0.17658829414707361 | P469: 21.899999999999999 | AA469: 1w | AB469: =(J469-P469)/J469 -> 6.8877551020408212e-02 | AN469: 不宜入场（收缩幅度不够,应观察1w） | AO469: 44599 | AP469: 是
A470: 001215.SZ | B470: 千味央厨 | C470: 0.86 | D470: 45.420000000000002 | E470: 49.18 | F470: 56.549999999999997 | H470: 49.920000000000002 | AN470: 不宜入场（当前股价小于50日均线,应观察1w） | AO470: 44599 | AP470: 是
A471: 600177.SH | B471: 雅戈尔 | C471: 0.86 | AP471: 否
A472: 600329.SH | B472: 中新药业 | C472: 0.86 | D472: 25.84 | E472: 26.49 | F472: 27.800000000000001 | H472: 25.71 | AN472: 不宜入场(当前股价小于200日均线，应观察3w) | AO472: 44599 | AP472: 是
A473: 600508.SH | B473: 上海能源 | C473: 0.86 | AP473: 否
A474: 601800.SH | B474: 中国交建 | C474: 0.86 | D474: 7.69 | E474: 7.87 | F474: 8.59 | H474: 9.93 | I474: 6.11 | J474: 10.41 | K474: 6.38 | L474: =(H474-I474)/I474 -> 0.62520458265139101 | M474: =(J474-H474)/J474 -> 4.610951008645537e-02 | N474: =(J474-K474)/K474 -> 0.63166144200626961 | P474: 6.93 | Q474: 9.38 | R474: 8.18 | S474: 10.15 | T474: 8.93 | AA474: 18w | AB474: =(J474-P474)/J474 -> 0.33429394812680119 | AC474: =(Q474-R474)/Q474 -> 0.12793176972281461 | AD474: =(S474-T474)/S474 -> 0.12019704433497543 | AN474: 不宜入场（收缩幅度不够,应观察1w） | AO474: 44599 | AP474: 是
A475: 603283.SH | B475: 赛腾股份 | C475: 0.86 | D475: 26.42 | E475: 26.74 | F475: 27.100000000000001 | H475: 24.24 | AN475: 不宜入场(当前股价小于200日均线，应观察3w) | AO475: 44599 | AP475: 是
A476: 605068.SH | B476: 明新旭腾 | C476: 0.86 | D476: 33.96 | E476: 34.21 | F476: 35.37 | H476: 34.24 | AN476: 不宜入场(当前股价小于50日均线，应观察1w) | AO476: 44599 | AP476: 是
A477: 002208.SZ | B477: 合肥城建 | C477: 0.86 | D477: 7.78 | E477: 7.85 | F477: 8.12 | H477: 8.99 | I477: 6.94 | J477: 10.39 | K477: 8.03 | L477: =(H477-I477)/I477 -> 0.29538904899135443 | M477: =(J477-H477)/J477 -> 0.13474494706448512 | N477: =(J477-K477)/K477 -> 0.293897882938979 | P477: 6.94 | Q477: 10.01 | R477: 7.85 | AA477: 19w | AB477: =(J477-P477)/J477 -> 0.33205004812319538 | AC477: =(Q477-R477)/Q477 -> 0.2157842157842158 | AN477: 不宜入场（收缩幅度不够,应观察2w） | AO477: 44599 | AP477: 是
A478: 002864.SZ | B478: 盘龙药业 | C478: 0.85 | D478: 25.12 | E478: 25.58 | F478: 27.62 | H478: 25.35 | AN478: 不宜入场(当前股价小于150日均线，应观察2w) | AO478: 44599 | AP478: 是
A479: 600062.SH | B479: 华润双鹤 | C479: 0.85 | D479: 11.95 | E479: 12.08 | F479: 12.54 | H479: 12.05 | AN479: 不宜入场(当前股价小于150日均线，应观察2w) | AO479: 44599 | AP479: 是
A480: 000935.SZ | B480: 四川双马 | C480: 0.85 | D480: 20.07 | E480: 21.03 | F480: 23.37 | H480: 23.45 | I480: 12.199999999999999 | J480: 29.800000000000001 | K480: 16.34 | L480: =(H480-I480)/I480 -> 0.92213114754098369 | M480: =(J480-H480)/J480 -> 0.2130872483221477 | N480: =(J480-K480)/K480 -> 0.82374541003671975 | P480: 17.35 | Q480: 23.49 | R480: 19.31 | S480: 26.59 | T480: 21.699999999999999 | AA480: 19w | AB480: =(J480-P480)/J480 -> 0.41778523489932884 | AC480: =(Q480-R480)/Q480 -> 0.17794806300553426 | AD480: =(S480-T480)/S480 -> 0.18390372320421214 | AN480: 不宜入场（收缩幅度不够,应观察1w） | AO480: 44599 | AP480: 是
A481: 002594.SZ | B481: 比亚迪 | C481: 0.85 | D481: 252.55 | E481: 261.45 | F481: 266.19999999999999 | H481: 244.40000000000001 | AN481: 不宜入场(当前股价小于200日均线，应观察3w) | AO481: 44599 | AP481: 是
A482: 002832.SZ | B482: 比音勒芬 | C482: 0.85 | D482: 23.88 | E482: 24.300000000000001 | F482: 24.58 | H482: 24.46 | AN482: 不宜入场(当前股价小于50日均线，应观察1w) | AO482: 44599 | AP482: 是
A483: 600993.SH | B483: 马应龙 | C483: 0.85 | D483: 24.5 | E483: 25.07 | F483: 25.35 | H483: 22.25 | AN483: 不宜入场(当前股价小于200日均线，应观察3w) | AO483: 44599 | AP483: 是
A484: 603192.SH | B484: 汇得科技 | C484: 0.85 | D484: 34.34 | E484: 36.74 | F484: 44.91 | H484: 39.600000000000001 | AN484: 不宜入场(当前股价小于50日均线，应观察1w) | AO484: 44599 | AP484: 是
A485: 603298.SH | B485: 杭叉集团 | C485: 0.85 | AP485: 否
A486: 600808.SH | B486: 马钢股份 | C486: 0.85 | AP486: 否
A487: 002585.SZ | B487: 双星新材 | C487: 0.84 | D487: 22.69 | E487: 23.97 | F487: 25.97 | H487: 24.5 | I487: 8.43 | J487: 30.37 | K487: 25.04 | L487: =(H487-I487)/I487 -> 1.9062870699881378 | M487: =(J487-H487)/J487 -> 0.19328284491274286 | N487: =(J487-K487)/K487 -> 0.21285942492012788 | P487: 23.21 | AA487: 1w | AB487: =(J487-P487)/J487 -> 0.23575897267039841 | AN487: 不宜入场（收缩幅度不够,应观察1w） | AO487: 44599 | AP487: 是
A488: 002169.SZ | B488: 智光电气 | C488: 0.84 | D488: 11.02 | E488: 11.31 | F488: 11.32 | H488: 9.93 | AN488: 不宜入场(当前股价小于200日均线，应观察3w) | AO488: 44599 | AP488: 是
A489: 000703.SZ | B489: 恒逸石化 | C489: 0.84 | AP489: 否
A490: 000902.SZ | B490: 新洋丰 | C490: 0.84 | AP490: 否
A491: 002986.SZ | B491: 宇新股份 | C491: 0.84 | D491: 34.87 | E491: 36.13 | F491: 37.52 | H491: 36.17 | AN491: 不宜入场(当前股价小于50日均线，应观察1w) | AO491: 44599 | AP491: 是
A492: 601169.SH | B492: 北京银行 | C492: 0.84 | D492: 4.46 | E492: 4.46 | F492: 4.49 | H492: 4.57 | I492: 4.25 | J492: 4.69 | K492: 4.47 | L492: =(H492-I492)/I492 -> 7.5294117647058886e-02 | M492: =(J492-H492)/J492 -> 2.558635394456292e-02 | N492: =(J492-K492)/K492 -> 4.9217002237136612e-02 | P492: 4.25 | AN492: 不宜入场(当前股价距离最低点距离太小，应观察4w) | AO492: 44599 | AP492: 是
A493: 603228.SH | B493: 景旺电子 | C493: 0.84 | D493: 28.76 | E493: 29.27 | F493: 31.800000000000001 | H493: 34.32 | I493: 23.11 | J493: 35.63 | K493: 29.300000000000001 | L493: =(H493-I493)/I493 -> 0.48507139766334922 | M493: =(J493-H493)/J493 -> 3.6766769576199891e-02 | N493: =(J493-K493)/K493 -> 0.21604095563139938 | P493: 32.899999999999999 | AA493: 1w | AB493: =(J493-P493)/J493 -> 7.6620825147347846e-02 | AN493: 不宜入场（收缩幅度不够,应观察1w） | AO493: 44599 | AP493: 是
A494: 000498.SZ | B494: 山东路桥 | C494: 0.83 | D494: 6.41 | E494: 6.52 | F494: 7.03 | H494: 9.22 | I494: 4.48 | J494: 9.22 | K494: 6.19 | L494: =(H494-I494)/I494 -> 1.0580357142857142 | M494: =(J494-H494)/J494 -> 0 | N494: =(J494-K494)/K494 -> 0.48949919224555738 | AN494: 不宜入场（收缩幅度不够,应观察2w） | AO494: 44599 | AP494: 是
A495: 002459.SZ | B495: 晶澳科技 | C495: 0.83 | D495: 68.900000000000006 | E495: 74.799999999999997 | F495: 88.299999999999997 | H495: 89.47 | I495: 24.31 | J495: 103 | K495: 56.799999999999997 | L495: =(H495-I495)/I495 -> 2.6803784450843273 | M495: =(J495-H495)/J495 -> 0.13135922330097088 | N495: =(J495-K495)/K495 -> 0.81338028169014098 | P495: 79.299999999999997 | Q495: 98.700000000000003 | R495: 85.75 | AA495: 9w | AB495: =(J495-P495)/J495 -> 0.23009708737864079 | AC495: =(Q495-R495)/Q495 -> 0.13120567375886527 | AN495: 不宜入场（收缩幅度不够,应观察1w） | AO495: 44599 | AP495: 是
A496: 002961.SZ | B496: 瑞达期货 | C496: 0.83 | D496: 23.16 | E496: 23.38 | F496: 23.32 | AN496: 不宜入场(50日均线小于150日均线，应观察4w) | AO496: 44599 | AP496: 是
A497: 002987.SZ | B497: 京北方 | C497: 0.83 | D497: 32.37 | E497: 32.37 | F497: 35.71 | H497: 39.25 | I497: 23.899999999999999 | J497: 48.69 | K497: 28.89 | L497: =(H497-I497)/I497 -> 0.64225941422594157 | M497: =(J497-H497)/J497 -> 0.19387964674471139 | N497: =(J497-K497)/K497 -> 0.68535825545171325 | P497: 38 | AA497: 1w | AB497: =(J497-P497)/J497 -> 0.21955226945984799 | AN497: 不宜入场（收缩幅度不够,应观察2w） | AO497: 44599 | AP497: 是
A498: 002991.SZ | B498: 甘源食品 | C498: 0.83 | D498: 64.75 | E498: 63.55 | AN498: 不宜入场(150日均线小于200日均线，应观察6w) | AO498: 44599 | AP498: 是
A499: 601998.SH | B499: 中信银行 | C499: 0.83 | AP499: 否
A500: 603187.SH | B500: 海容冷链 | C500: 0.83 | D500: 40.95 | E500: 41.45 | F500: 41.700000000000003 | H500: 37.92 | AN500: 不宜入场(当前股价小于200日均线，应观察3w) | AO500: 44599 | AP500: 是
A501: 603355.SH | B501: 莱克电气 | C501: 0.83 | D501: 28.55 | E501: 28.67 | F501: 28.38 | AN501: 不宜入场(50日均线小于200日均线，应观察5w) | AO501: 44600 | AP501: 否
A502: 603515.SH | B502: 欧普照明 | C502: 0.83 | D502: 22.74 | E502: 22 | AN502: 不宜入场(150日均线小于200日均线，应观察6w) | AO502: 44600 | AP502: 否
A503: 605058.SH | B503: 澳弘电子 | C503: 0.83 | D503: 24.34 | E503: 24.41 | F503: 24.68 | H503: 23.68 | AN503: 不宜入场(当前股价小于200日均线，应观察3w) | AO503: 44600 | AP503: 是
A504: 002757.SZ | B504: 南兴股份 | C504: 0.83 | D504: 14.56 | E504: 14.63 | F504: 14.77 | H504: 14.48 | AN504: 不宜入场(当前股价小于200日均线，应观察3w) | AO504: 44600 | AP504: 是
A505: 002396.SZ | B505: 星网锐捷 | C505: 0.83 | D505: 23.49 | E505: 23.84 | F505: 24.06 | H505: 23.23 | AN505: 不宜入场(当前股价小于200日均线，应观察3w) | AO505: 44600 | AP505: 是
A506: 001219.SZ | B506: 青岛食品 | C506: 0.82 | D506: 28.21 | E506: 28.88 | F506: 30.800000000000001 | H506: 27.38 | AN506: 不宜入场(当前股价小于200日均线，应观察3w) | AO506: 44600 | AP506: 是
A507: 003013.SZ | B507: 地铁设计 | C507: 0.82 | AP507: 否
A508: 600548.SH | B508: 深高速 | C508: 0.82 | D508: 9.6999999999999993 | E508: 9.72 | F508: 9.88 | H508: 10.56 | I508: 7.55 | J508: 11.98 | K508: 8.5999999999999996 | L508: =(H508-I508)/I508 -> 0.3986754966887418 | M508: =(J508-H508)/J508 -> 0.11853088480801334 | N508: =(J508-K508)/K508 -> 0.39302325581395359 | P508: 9.35 | Q508: 10.9 | R508: 9.38 | S508: 10.25 | T508: 9.56 | AA508: 17w | AB508: =(J508-P508)/J508 -> 0.21953255425709522 | AC508: =(Q508-R508)/Q508 -> 0.13944954128440362 | AD508: =(S508-T508)/S508 -> 6.7317073170731656e-02 | AN508: 不宜入场(已错过最佳入场点，应观察1w寻找新的入场点) | AO508: 44601 | AP508: 是
A509: 603319.SH | B509: 湘油泵 | C509: 0.82 | D509: 23.41 | E509: 23.72 | F509: 24.73 | H509: 21.899999999999999 | AN509: 不宜入场(当前股价小于200日均线，应观察3w) | AO509: 44600 | AP509: 是
A510: 002409.SZ | B510: 雅克科技 | C510: 0.82 | AP510: 否
A511: 002810.SZ | B511: 山东赫达 | C511: 0.82 | D511: 49.51 | E511: 51.05 | F511: 54.5 | H511: 48.46 | AN511: 不宜入场(当前股价小于200日均线，应观察3w) | AO511: 44600 | AP511: 是
A512: 002236.SZ | B512: 大华股份 | C512: 0.81 | AP512: 否
A513: 002408.SZ | B513: 齐翔腾达 | C513: 0.81 | D513: 9.47 | E513: 9.8000000000000007 | F513: 10.16 | H513: 9.61 | AN513: 不宜入场(当前股价小于150日均线，应观察2w) | AO513: 44600 | AP513: 是
A514: 002859.SZ | B514: 洁美科技 | C514: 0.81 | D514: 32.11 | E514: 32.55 | F514: 34.09 | H514: 31.94 | AN514: 不宜入场(当前股价小于200日均线，应观察3w) | AO514: 44600 | AP514: 是
A515: 003038.SZ | B515: 鑫铂股份 | C515: 0.81 | D515: 52.850000000000001 | E515: 56.710000000000001 | F515: 69.120000000000005 | H515: 64.5 | AN515: 不宜入场（当前股价小于50日均线,应观察2w） | AO515: 44579 | AP515: 是
A516: 600097.SH | B516: 开创国际 | C516: 0.81 | D516: 10.26 | E516: 10.44 | F516: 10.97 | H516: 11.34 | I516: 8.22 | J516: 12.73 | K516: 10.46 | L516: =(H516-I516)/I516 -> 0.37956204379562031 | M516: =(J516-H516)/J516 -> 0.10919088766692855 | N516: =(J516-K516)/K516 -> 0.21701720841300184 | P516: 10.199999999999999 | AA516: 2w | AB516: =(J516-P516)/J516 -> 0.19874312647289874 | AN516: 不宜入场（收缩幅度不够,应观察2w） | AO516: 44600 | AP516: 是
A517: 603096.SH | B517: 新经典 | C517: 0.81 | AP517: 否
A518: 603359.SH | B518: 东珠生态 | C518: 0.81 | D518: 12.65 | E518: 12.93 | F518: 13.92 | H518: 13.42 | AN518: 不宜入场（当前股价小于50日均线,应观察1w） | AO518: 44600 | AP518: 是
A519: 603700.SH | B519: 宁水集团 | C519: 0.81 | AP519: 否
A520: 000656.SZ | B520: 金科股份 | C520: 0.80000000000000004 | AP520: 否
A521: 000685.SZ | B521: 中山公用 | C521: 0.80000000000000004 | D521: 8.52 | E521: 8.59 | F521: 8.67 | H521: 8.49 | AN521: 不宜入场（当前股价小于200日均线,应观察3w） | AO521: 44600 | AP521: 是
A522: 000988.SZ | B522: 华工科技 | C522: 0.80000000000000004 | D522: 26.06 | E522: 26.63 | F522: 26.75 | H522: 24.18 | AN522: 不宜入场（当前股价小于200日均线,应观察3w） | AO522: 44600 | AP522: 是
A523: 002088.SZ | B523: 鲁阳节能 | C523: 0.80000000000000004 | D523: 19.940000000000001 | E523: 20.960000000000001 | F523: 22.559999999999999 | H523: 20.739999999999998 | AN523: 不宜入场（当前股价小于150日均线,应观察2w） | AO523: 44600 | AP523: 是
A524: 002555.SZ | B524: 三七互娱 | C524: 0.80000000000000004 | D524: 23.55 | E524: 24.03 | F524: 25.85 | H524: 24.57 | AN524: 不宜入场（当前股价小于50日均线,应观察1w） | AO524: 44600 | AP524: 是
A525: 002758.SZ | B525: 浙农股份 | C525: 0.80000000000000004 | D525: 10.37 | E525: 10.48 | F525: 11.08 | H525: 11.58 | I525: 8.76 | J525: 12.9 | K525: 10.17 | L525: =(H525-I525)/I525 -> 0.32191780821917815 | M525: =(J525-H525)/J525 -> 0.10232558139534885 | N525: =(J525-K525)/K525 -> 0.26843657817109151 | P525: 10.5 | AA525: 3w | AB525: =(J525-P525)/J525 -> 0.186046511627907 | AN525: 不宜入场（收缩幅度不够,应观察1w） | AO525: 44600 | AP525: 是
A526: 002761.SZ | B526: 浙江建投 | C526: 0.80000000000000004 | AP526: 否
A527: 601328.SH | B527: 交通银行 | C527: 0.80000000000000004 | D527: 4.59 | E527: 4.5999999999999996 | F527: 4.69 | H527: 4.94 | I527: 4.11 | J527: 4.95 | K527: 4.61 | L527: =(H527-I527)/I527 -> 0.20194647201946472 | M527: =(J527-H527)/J527 -> 2.0202020202019773e-03 | N527: =(J527-K527)/K527 -> 7.3752711496746171e-02 | AN527: 不宜入场（当前股价距离最低点距离过小,应观察1w） | AO527: 44600 | AP527: 是
A528: 601865.SH | B528: 福莱特 | C528: 0.80000000000000004 | D528: 43.43 | E528: 43.53 | F528: 49.15 | H528: 46.95 | AN528: 不宜入场（当前股价小于50日均线,应观察1w） | AO528: 44600 | AP528: 是
A529: 603048.SH | B529: 浙江黎明 | C529: 0.80000000000000004 | D529: 26.38 | E529: 26.62 | F529: 26.73 | H529: 23.27 | AN529: 不宜入场（当前股价小于200日均线,应观察3w） | AO529: 44600 | AP529: 是
A530: 605099.SH | B530: 共创草坪 | C530: 0.80000000000000004 | AP530: 否
A531: 000026.SZ | B531: 飞亚达 | C531: 0.80000000000000004 | AP531: 否
A532: 000898.SZ | B532: 鞍钢股份 | C532: 0.80000000000000004 | AP532: 否
A533: 003025.SZ | B533: 思进智能 | C533: 0.79 | D533: 30.52 | E533: 30.89 | F533: 32.15 | H533: 31.78 | AN533: 不宜入场（当前股价小于50日均线,应观察1w） | AO533: 44600 | AP533: 是
A534: 003033.SZ | B534: 征和工业 | C534: 0.79 | AP534: 否
A535: 603035.SH | B535: 常熟汽饰 | C535: 0.79 | D535: 15 | E535: 15.55 | F535: 17.78 | H535: 17.67 | AN535: 不宜入场（当前股价小于50日均线,应观察1w） | AO535: 44600 | AP535: 是
A536: 603386.SH | B536: 广东骏亚 | C536: 0.79 | D536: 19.84 | E536: 20.22 | F536: 20.600000000000001 | AN536: 不宜入场（50日均线小于150日均线,应观察4w） | AO536: 44600 | AP536: 是
A537: 603719.SH | B537: 良品铺子 | C537: 0.79 | AP537: 否
A538: 605007.SH | B538: 五洲特纸 | C538: 0.79 | D538: 20.28 | E538: 20.13 | AN538: 不宜入场（150日均线小于200日均线,应观察5w） | AO538: 44600 | AP538: 是
A539: 605020.SH | B539: 永和股份 | C539: 0.79 | D539: 27.010000000000002 | E539: 28.789999999999999 | F539: 29.66 | H539: 26.489999999999998 | AN539: 不宜入场（当前股价小于200日均线,应观察3w） | AO539: 44600 | AP539: 是
A540: 600529.SH | B540: 山东药玻 | C540: 0.79 | D540: 37.21 | E540: 37.34 | F540: 38.02 | H540: 33.52 | AN540: 不宜入场（当前股价小于200日均线,应观察3w） | AO540: 44600 | AP540: 是
A541: 002774.SZ | B541: 快意电梯 | C541: 0.79 | D541: 7.98 | E541: 8.13 | F541: 8.34 | H541: 8.55 | I541: 5.36 | J541: 12.98 | K541: 6.28 | L541: =(H541-I541)/I541 -> 0.59514925373134331 | M541: =(J541-H541)/J541 -> 0.34129429892141755 | N541: =(J541-K541)/K541 -> 1.0668789808917198 | AN541: 不宜入场（当前股价距离最高点距离过大,应观察2w） | AO541: 44600 | AP541: 是
A542: 603043.SH | B542: 广州酒家 | C542: 0.78 | AP542: 否
A543: 600056.SH | B543: 中国医药 | C543: 0.78 | AP543: 否
A544: 001207.SZ | B544: 联科科技 | C544: 0.78 | AP544: 否
A545: 002539.SZ | B545: 云图控股 | C545: 0.78 | D545: 12.44 | E545: 12.88 | F545: 13.31 | H545: 12.93 | AN545: 不宜入场（当前股价小于50日均线,应观察1w） | AO545: 44600 | AP545: 是
A546: 002940.SZ | B546: 昂利康 | C546: 0.78 | D546: 34.07 | E546: 34.27 | F546: 36.35 | H546: 37.65 | I546: 28.52 | J546: 43.25 | K546: 37.15 | L546: =(H546-I546)/I546 -> 0.3201262272089761 | M546: =(J546-H546)/J546 -> 0.12947976878612721 | N546: =(J546-K546)/K546 -> 0.16419919246298792 | P546: 28.56 | Q546: 42.49 | R546: 35.66 | AA546: 30w | AB546: =(J546-P546)/J546 -> 0.3396531791907515 | AC546: =(Q546-R546)/Q546 -> 0.16074370440103566 | AN546: 不宜入场（收缩幅度不够,应观察1w） | AO546: 44600 | AP546: 是
A547: 600216.SH | B547: 浙江医药 | C547: 0.78 | D547: 15.96 | E547: 16.16 | F547: 16.23 | H547: 15.35 | AN547: 不宜入场（当前股价小于200日均线,应观察3w） | AO547: 44600 | AP547: 是
A548: 601678.SH | B548: 滨化股份 | C548: 0.78 | D548: 8.05 | E548: 8.19 | F548: 7.82 | AN548: 不宜入场（50日均线小于200日均线,应观察4w） | AO548: 44600 | AP548: 否
A549: 601900.SH | B549: 南方传媒 | C549: 0.78 | D549: 7.69 | E549: 7.76 | F549: 8.12 | H549: 8.35 | I549: 6.7999999999999998 | J549: 9.17 | K549: 7.39 | L549: =(H549-I549)/I549 -> 0.2279411764705882 | M549: =(J549-H549)/J549 -> 8.9422028353326091e-02 | N549: =(J549-K549)/K549 -> 0.24086603518267935 | AN549: 不宜入场（当前股价距离最低点距离过小,应观察1w） | AO549: 44600 | AP549: 是
A550: 603277.SH | B550: 银都股份 | C550: 0.78 | AP550: 否
A551: 603324.SH | B551: 盛剑环境 | C551: 0.78 | D551: 54.51 | E551: 55.78 | F551: 54.35 | AN551: 不宜入场（50日均线小于200日均线,应观察5w） | AO551: 44600 | AP551: 是
A552: 603722.SH | B552: 阿科力 | C552: 0.78 | D552: 47.02 | E552: 49.05 | F552: 53.92 | H552: 54.08 | I552: 23.84 | J552: 60.100000000000001 | K552: 49.63 | L552: =(H552-I552)/I552 -> 1.268456375838926 | M552: =(J552-H552)/J552 -> 0.10016638935108158 | N552: =(J552-K552)/K552 -> 0.2109611122305057 | P552: 52.799999999999997 | AA552: 2w | AB552: =(J552-P552)/J552 -> 0.12146422628951754 | AN552: 不宜入场（收缩幅度不够,应观察1w） | AO552: 44600 | AP552: 是
A553: 603867.SH | B553: 新化股份 | C553: 0.78 | D553: 31.04 | E553: 32 | F553: 33.96 | H553: 33.84 | AN553: 不宜入场（当前股价小于50日均线,应观察1w） | AO553: 44600 | AP553: 是
A554: 002487.SZ | B554: 大金重工 | C554: 0.78 | D554: 26.07 | E554: 29.260000000000002 | F554: 37.229999999999997 | H554: 44.289999999999999 | I554: 6.6500000000000004 | J554: 53.770000000000003 | K554: 21.850000000000001 | L554: =(H554-I554)/I554 -> 5.6601503759398497 | M554: =(J554-H554)/J554 -> 0.17630649060814588 | N554: =(J554-K554)/K554 -> 1.4608695652173913 | P554: 31.16 | AA554: 12w | AB554: =(J554-P554)/J554 -> 0.42049469964664316 | AN554: 不宜入场（收缩幅度不够,应观察2w） | AO554: 44600 | AP554: 是
A555: 600742.SH | B555: 一汽富维 | C555: 0.78 | D555: 10.98 | E555: 11.28 | F555: 11.89 | H555: 11.43 | AN555: 不宜入场（当前股价小于50日均线,应观察2w） | AO555: 44600 | AP555: 是
A556: 000983.SZ | B556: 山西焦煤 | C556: 0.77 | D556: 8.4000000000000004 | E556: 8.6999999999999993 | F556: 8.78 | H556: 8.9000000000000004 | I556: 4.42 | J556: 16.71 | K556: 7.39 | L556: =(H556-I556)/I556 -> 1.0135746606334843 | M556: =(J556-H556)/J556 -> 0.46738479952124479 | N556: =(J556-K556)/K556 -> 1.2611637347767255 | AN556: 不宜入场（当前股价距离最高点距离过大,应观察3w） | AO556: 44600 | AP556: 是
A557: 002873.SZ | B557: 新天药业 | C557: 0.77 | D557: 14.87 | E557: 15.61 | F557: 18.78 | H557: 20.65 | I557: 9.74 | J557: 28.17 | K557: 13.05 | L557: =(H557-I557)/I557 -> 1.1201232032854207 | M557: =(J557-H557)/J557 -> 0.26695065672701462 | N557: =(J557-K557)/K557 -> 1.1586206896551725 | AN557: 不宜入场（当前股价距离最高点距离过大,应观察1w） | AO557: 44600 | AP557: 是
A558: 601666.SH | B558: 平煤股份 | C558: 0.77 | D558: 8.25 | E558: 8.59 | F558: 9.21 | H558: 10.19 | I558: 4.12 | J558: 13.65 | K558: 7.26 | L558: =(H558-I558)/I558 -> 1.4733009708737863 | M558: =(J558-H558)/J558 -> 0.25347985347985352 | N558: =(J558-K558)/K558 -> 0.88016528925619841 | P558: 7.27 | Q558: 10.800000000000001 | R558: 8.81 | AA558: 15w | AB558: =(J558-P558)/J558 -> 0.46739926739926746 | AC558: =(Q558-R558)/Q558 -> 0.18425925925925926 | AN558: 不宜入场（收缩幅度不够,应观察1w） | AO558: 44600 | AP558: 是
A559: 001317.SZ | B559: 三羊马 | C559: 0.77 | D559: 34.890000000000001 | E559: 38.289999999999999 | F559: 58 | H559: 85.030000000000001 | I559: 19.199999999999999 | J559: 108.63 | K559: 19.199999999999999 | L559: =(H559-I559)/I559 -> 3.4286458333333334 | M559: =(J559-H559)/J559 -> 0.21725121973672093 | N559: =(J559-K559)/K559 -> 4.6578124999999995 | P559: 72.680000000000007 | AA559: 2w | AB559: =(J559-P559)/J559 -> 0.33093988769216598 | AN559: 不宜入场（收缩幅度不够,应观察2w） | AO559: 44579 | AP559: 是
A560: 002989.SZ | B560: 中天精装 | C560: 0.77 | AP560: 否
A561: 003009.SZ | B561: 中天火箭 | C561: 0.77 | AP561: 否
A562: 600007.SH | B562: 中国国贸 | C562: 0.77 | AP562: 否
A563: 600804.SH | B563: 鹏博士 | C563: 0.77 | D563: 5.95 | E563: 6.01 | F563: 6.17 | H563: 5.44 | AN563: 不宜入场（当前股价小于200日均线,应观察3w） | AO563: 44600 | AP563: 是
A564: 601077.SH | B564: 渝农商行 | C564: 0.77 | AP564: 否
A565: 603585.SH | B565: 苏利股份 | C565: 0.77 | D565: 16.98 | E565: 17.28 | F565: 18.67 | H565: 20 | I565: 13.72 | J565: 21.36 | K565: 16.899999999999999 | L565: =(H565-I565)/I565 -> 0.45772594752186579 | M565: =(J565-H565)/J565 -> 6.3670411985018702e-02 | N565: =(J565-K565)/K565 -> 0.26390532544378703 | P565: 18.100000000000001 | AA565: 2w | AB565: =(J565-P565)/J565 -> 0.15262172284644185 | AN565: 不宜入场（收缩幅度不够,应观察1w） | AO565: 44600 | AP565: 是
A566: 603727.SH | B566: 博迈科 | C566: 0.77 | AP566: 否
A567: 000800.SZ | B567: 一汽解放 | C567: 0.77 | AP567: 否
A568: 002760.SZ | B568: 凤形股份 | C568: 0.76 | D568: 23.85 | E568: 24.43 | F568: 24.83 | H568: 24.56 | AN568: 不宜入场（当前股价小于50日均线,应观察1w） | AO568: 44600 | AP568: 是
A569: 002896.SZ | B569: 中大力德 | C569: 0.76 | D569: 21.78 | E569: 22.22 | F569: 22.98 | H569: 22.23 | AN569: 不宜入场（当前股价小于50日均线,应观察1w） | AO569: 44600 | AP569: 是
A570: 003021.SZ | B570: 兆威机电 | C570: 0.76 | D570: 65.21 | E570: 67.21 | F570: 69.200000000000003 | H570: 60.600000000000001 | AN570: 不宜入场（当前股价小于200日均线,应观察3w） | AO570: 44600 | AP570: 是
A571: 600727.SH | B571: 鲁北化工 | C571: 0.76 | D571: 9.86 | E571: 10.17 | F571: 10.25 | H571: 10 | AN571: 不宜入场（当前股价小于150日均线,应观察2w） | AO571: 44600 | AP571: 是
A572: 603115.SH | B572: 海星股份 | C572: 0.76 | D572: 21.300000000000001 | E572: 22.41 | F572: 24.41 | H572: 22.65 | AN572: 不宜入场（当前股价小于50日均线,应观察1w） | AO572: 44600 | AP572: 是
A573: 603337.SH | B573: 杰克股份 | C573: 0.76 | AP573: 否
A574: 600859.SH | B574: 王府井 | C574: 0.76 | AP574: 否
A575: 000828.SZ | B575: 东莞控股 | C575: 0.76 | AP575: 否
A576: 002995.SZ | B576: 天地在线 | C576: 0.76 | AP576: 否
A577: 002942.SZ | B577: 新农股份 | C577: 0.76 | AP577: 否
A578: 600377.SH | B578: 宁沪高速 | C578: 0.75 | AP578: 否
A579: 002138.SZ | B579: 顺络电子 | C579: 0.75 | AP579: 否
A580: 002568.SZ | B580: 百润股份 | C580: 0.75 | AP580: 否
A581: 002736.SZ | B581: 国信证券 | C581: 0.75 | AP581: 否
A582: 003011.SZ | B582: 海象新材 | C582: 0.75 | D582: 33.55 | E582: 33.27 | AN582: 不宜入场（150日均线小于200日均线,应观察5w） | AO582: 44600 | AP582: 是
A583: 600016.SH | B583: 民生银行 | C583: 0.75 | AP583: 否
A584: 601869.SH | B584: 长飞光纤 | C584: 0.75 | D584: 29.07 | E584: 29.89 | F584: 31.42 | H584: 29.41 | AN584: 不宜入场（当前股价小于150日均线,应观察2w） | AO584: 44600 | AP584: 是
A585: 603898.SH | B585: 好莱客 | C585: 0.75 | AP585: 否
A586: 605155.SH | B586: 西大门 | C586: 0.75 | AP586: 否
A587: 605286.SH | B587: 同力日升 | C587: 0.75 | D587: 28.22 | E587: 28.14 | AN587: 不宜入场（150日均线小于200日均线,应观察5w） | AO587: 44600 | AP587: 是
A588: 605589.SH | B588: 圣泉集团 | C588: 0.75 | D588: 35.01 | E588: 35.13 | F588: 35.31 | H588: 33.12 | AN588: 不宜入场（当前股价小于200日均线,应观察3w） | AO588: 44600 | AP588: 是
A589: 002801.SZ | B589: 微光股份 | C589: 0.74 | AP589: 否
A590: 002966.SZ | B590: 苏州银行 | C590: 0.74 | AP590: 否
A591: 600760.SH | B591: 中航沈飞 | C591: 0.74 | AP591: 否
A592: 601512.SH | B592: 中新集团 | C592: 0.74 | AP592: 否
A593: 603305.SH | B593: 旭升股份 | C593: 0.74 | D593: 40.27 | E593: 41.83 | F593: 45.75 | H593: 44.02 | AN593: 不宜入场（当前股价小于50日均线,应观察1w） | AO593: 44600 | AP593: 是
A594: 603686.SH | B594: 福龙马 | C594: 0.74 | AP594: 否
A595: 603915.SH | B595: 国茂股份 | C595: 0.74 | AP595: 否
A596: 605081.SH | B596: 太和水 | C596: 0.74 | AP596: 否
A597: 600409.SH | B597: 三友化工 | C597: 0.74 | AP597: 否
A598: 000090.SZ | B598: 天健集团 | C598: 0.73 | D598: 5.63 | E598: 5.64 | F598: 5.9000000000000004 | H598: 6.5 | I598: 4.73 | J598: 6.58 | K598: 5.43 | L598: =(H598-I598)/I598 -> 0.37420718816067639 | M598: =(J598-H598)/J598 -> 1.2158054711246211e-02 | N598: =(J598-K598)/K598 -> 0.21178637200736655 | P598: 6.46 | AN598: 不宜入场（收缩幅度不够,应观察1w） | AO598: 44600 | AP598: 是
A599: 002603.SZ | B599: 以岭药业 | C599: 0.73 | D599: 18.57 | E599: 18.78 | F599: 20.36 | H599: 23.05 | I599: 14.18 | J599: 27.92 | K599: 16.44 | L599: =(H599-I599)/I599 -> 0.62552891396332877 | M599: =(J599-H599)/J599 -> 0.17442693409742122 | N599: =(J599-K599)/K599 -> 0.69829683698296829 | P599: 20.17 | AA599: 2w | AB599: =(J599-P599)/J599 -> 0.27757879656160456 | AN599: 不宜入场（收缩幅度不够,应观察2w） | AO599: 44600 | AP599: 是
A600: 603626.SH | B600: 科森科技 | C600: 0.73 | D600: 10.99 | E600: 11.27 | F600: 11.89 | H600: 10.64 | AN600: 不宜入场（当前股价小于200日均线,应观察3w） | AO600: 44600 | AP600: 是
A601: 601390.SH | B601: 中国中铁 | C601: 0.73 | D601: 5.62 | E601: 5.69 | F601: 6.01 | H601: 6.57 | I601: 4.92 | J601: 6.82 | K601: 5.06 | L601: =(H601-I601)/I601 -> 0.33536585365853666 | M601: =(J601-H601)/J601 -> 3.6656891495601168e-02 | N601: =(J601-K601)/K601 -> 0.3478260869565219 | P601: 5.0999999999999996 | Q601: 6.41 | R601: 5.85 | S601: 6.62 | T601: 6.07 | AA601: 15w | AB601: =(J601-P601)/J601 -> 0.25219941348973618 | AC601: =(Q601-R601)/Q601 -> 8.7363494539781664e-02 | AD601: =(S601-T601)/S601 -> 8.3081570996978826e-02 | AN601: 不宜入场（收缩幅度不够,应观察2w） | AO601: 44600 | AP601: 是
A602: 002346.SZ | B602: 柘中股份 | C602: 0.73 | D602: 17.71 | E602: 18.42 | F602: 19.09 | H602: 18.399999999999999 | AN602: 不宜入场（当前股价小于150日均线,应观察2w） | AO602: 44601 | AP602: 是
A603: 600383.SH | B603: 金地集团 | C603: 0.73 | D603: 11.19 | E603: 11.35 | F603: 12.25 | H603: 12.78 | I603: 8.17 | J603: 14.22 | K603: 9.69 | L603: =(H603-I603)/I603 -> 0.56425948592411257 | M603: =(J603-H603)/J603 -> 0.10126582278481021 | N603: =(J603-K603)/K603 -> 0.46749226006191963 | P603: 12.24 | Q603: 14.07 | R603: 12.4 | AA603: 3w | AB603: =(J603-P603)/J603 -> 0.13924050632911394 | AC603: =(Q603-R603)/Q603 -> 0.11869225302061122 | AN603: 不宜入场（收缩幅度不够,应观察1w） | AO603: 44601 | AP603: 是
A604: 600989.SH | B604: 宝丰能源 | C604: 0.73 | D604: 16.04 | E604: 16.17 | F604: 16.62 | H604: 17.01 | I604: 13.05 | J604: 19.69 | K604: 14.699999999999999 | L604: =(H604-I604)/I604 -> 0.30344827586206902 | M604: =(J604-H604)/J604 -> 0.1361097003555104 | N604: =(J604-K604)/K604 -> 0.33945578231292534 | P604: 13.72 | Q604: 18.82 | R604: 15.62 | AA604: 3w | AB604: =(J604-P604)/J604 -> 0.30319959370238703 | AC604: =(Q604-R604)/Q604 -> 0.17003188097768338 | AN604: 不宜入场（收缩幅度不够,应观察1w） | AO604: 44601 | AP604: 是
A605: 603040.SH | B605: 新坐标 | C605: 0.73 | AP605: 否
A606: 603566.SH | B606: 普莱柯 | C606: 0.73 | D606: 20.899999999999999 | E606: 21.15 | F606: 22.73 | H606: 25.51 | I606: 17.16 | J606: 27.99 | K606: 18.699999999999999 | L606: =(H606-I606)/I606 -> 0.48659673659673669 | M606: =(J606-H606)/J606 -> 8.8603072525902007e-02 | N606: =(J606-K606)/K606 -> 0.49679144385026736 | P606: 22.87 | AA606: 2w | AB606: =(J606-P606)/J606 -> 0.18292247231153974 | AN606: 不宜入场（收缩幅度不够,应观察1w） | AO606: 44601 | AP606: 是
A607: 605069.SH | B607: 正和生态 | C607: 0.73 | AP607: 否
A608: 600039.SH | B608: 四川路桥 | C608: 0.73 | D608: 9.14 | E608: 9.68 | F608: 11.09 | H608: 11.16 | I608: 4.15 | J608: 13.42 | K608: 9.28 | L608: =(H608-I608)/I608 -> 1.6891566265060238 | M608: =(J608-H608)/J608 -> 0.16840536512667659 | N608: =(J608-K608)/K608 -> 0.44612068965517249 | P608: 10.41 | AA608: 4w | AB608: =(J608-P608)/J608 -> 0.22429210134128166 | AN608: 不宜入场（收缩幅度不够,应观察2w） | AO608: 44601 | AP608: 是
A609: 002968.SZ | B609: 新大正 | C609: 0.72 | AP609: 否
A610: 000961.SZ | B610: 中南建设 | C610: 0.72 | AP610: 否
A611: 600740.SH | B611: 山西焦化 | C611: 0.72 | AP611: 否
A612: 002043.SZ | B612: 兔宝宝 | C612: 0.72 | D612: 10.54 | E612: 10.6 | F612: 11.300000000000001 | H612: 12.47 | I612: 8.37 | J612: 13.31 | K612: 8.47 | L612: =(H612-I612)/I612 -> 0.48984468339307069 | M612: =(J612-H612)/J612 -> 6.3110443275732522e-02 | N612: =(J612-K612)/K612 -> 0.5714285714285714 | P612: 11.25 | AA612: 3w | AB612: =(J612-P612)/J612 -> 0.15477084898572505 | AN612: 不宜入场（收缩幅度不够,应观察1w） | AO612: 44601 | AP612: 是
A613: 002433.SZ | B613: 太安堂 | C613: 0.72 | D613: 5.59 | E613: 5.84 | F613: 6.32 | H613: 5.2000000000000002 | AN613: 不宜入场（当前股价小于200日均线,应观察3w） | AO613: 44601 | AP613: 是
A614: 002734.SZ | B614: 利民股份 | C614: 0.72 | D614: 12.21 | E614: 12.26 | F614: 12.87 | H614: 13.62 | I614: 9.55 | J614: 13.88 | K614: 11.82 | L614: =(H614-I614)/I614 -> 0.42617801047120402 | M614: =(J614-H614)/J614 -> 1.8731988472622588e-02 | N614: =(J614-K614)/K614 -> 0.17428087986463625 | P614: 12.54 | AA614: 2w | AB614: =(J614-P614)/J614 -> 9.6541786743515962e-02 | AN614: 不宜入场（收缩幅度不够,应观察1w） | AO614: 44601 | AP614: 是
A615: 002938.SZ | B615: 鹏鼎控股 | C615: 0.72 | D615: 36.29 | E615: 37.100000000000001 | F615: 39.14 | H615: 35.77 | AN615: 不宜入场（当前股价小于200日均线,应观察3w） | AO615: 44601 | AP615: 是
A616: 600171.SH | B616: 上海贝岭 | C616: 0.72 | AP616: 否
A617: 600750.SH | B617: 江中药业 | C617: 0.72 | D617: 12 | E617: 12.25 | F617: 12.87 | H617: 12.74 | AN617: 不宜入场（当前股价小于50日均线,应观察1w） | AO617: 44601 | AP617: 是
A618: 603396.SH | B618: 金辰股份 | C618: 0.72 | D618: 99.08 | E618: 106.03 | F618: 104.78 | AN618: 不宜入场（50日均线小于150日均线,应观察4w） | AO618: 44601 | AP618: 是
A619: 603506.SH | B619: 南都物业 | C619: 0.72 | D619: 12.31 | E619: 12.52 | F619: 12.67 | H619: 11.54 | AN619: 不宜入场（当前股价小于200日均线,应观察3w） | AO619: 44601 | AP619: 是
A620: 603808.SH | B620: 歌力思 | C620: 0.72 | AP620: 否
A621: 002705.SZ | B621: 新宝股份 | C621: 0.72 | AP621: 否
A622: 000048.SZ | B622: 京基智农 | C622: 0.72 | AP622: 否
A623: 002949.SZ | B623: 华阳国际 | C623: 0.72 | AP623: 否
A624: 002753.SZ | B624: 永东股份 | C624: 0.71 | AP624: 否
A625: 600643.SH | B625: 爱建集团 | C625: 0.71 | AP625: 否
A626: 603970.SH | B626: 中农立华 | C626: 0.71 | D626: 22.09 | E626: 22.58 | F626: 24.41 | H626: 24.35 | AN626: 不宜入场（当前股价小于50日均线,应观察1w） | AO626: 44601 | AP626: 是
A627: 000501.SZ | B627: 鄂武商A | C627: 0.71 | AP627: 否
A628: 002146.SZ | B628: 荣盛发展 | C628: 0.71 | AP628: 否
A629: 002543.SZ | B629: 万和电气 | C629: 0.71 | AP629: 否
A630: 002722.SZ | B630: 金轮股份 | C630: 0.71 | D630: 14.1 | E630: 14.64 | F630: 15.85 | H630: 15.94 | I630: 8.6999999999999993 | J630: 18.26 | K630: 14.99 | L630: =(H630-I630)/I630 -> 0.83218390804597708 | M630: =(J630-H630)/J630 -> 0.12705366922234401 | N630: =(J630-K630)/K630 -> 0.21814543028685798 | P630: 14.51 | AA630: 6w | AB630: =(J630-P630)/J630 -> 0.20536692223439221 | AN630: 不宜入场（收缩幅度不够,应观察2w） | AO630: 44601 | AP630: 是
A631: 002773.SZ | B631: 康弘药业 | C631: 0.71 | AP631: 否
A632: 600057.SH | B632: 厦门象屿 | C632: 0.71 | D632: 7.56 | E632: 7.75 | F632: 8.21 | H632: 8.64 | I632: 4.7000000000000002 | J632: 9.66 | K632: 6.64 | L632: =(H632-I632)/I632 -> 0.83829787234042563 | M632: =(J632-H632)/J632 -> 0.10559006211180119 | N632: =(J632-K632)/K632 -> 0.45481927710843384 | P632: 7.11 | Q632: 9.01 | R632: 7.81 | AA632: 15w | AB632: =(J632-P632)/J632 -> 0.2639751552795031 | AC632: =(Q632-R632)/Q632 -> 0.13318534961154274 | AN632: 不宜入场（收缩幅度不够,应观察1w） | AO632: 44601 | AP632: 是
A633: 601015.SH | B633: 陕西黑猫 | C633: 0.71 | AP633: 否
A634: 603329.SH | B634: 上海雅仕 | C634: 0.71 | D634: 13.34 | E634: 13.59 | F634: 14.38 | H634: 15.12 | I634: 11.03 | J634: 16 | K634: 12.84 | L634: =(H634-I634)/I634 -> 0.37080689029918407 | M634: =(J634-H634)/J634 -> 5.5000000000000049e-02 | N634: =(J634-K634)/K634 -> 0.24610591900311529 | P634: 13.61 | AA634: 3w | AB634: =(J634-P634)/J634 -> 0.14937500000000004 | AN634: 不宜入场（收缩幅度不够,应观察1w） | AO634: 44601 | AP634: 是
A635: 603859.SH | B635: 能科科技 | C635: 0.71 | AP635: 否
A636: 603931.SH | B636: 格林达 | C636: 0.71 | AP636: 否
A637: 600549.SH | B637: 厦门钨业 | C637: 0.71 | AP637: 否
A638: 600378.SH | B638: 昊华科技 | C638: 0.71 | D638: 32.14 | E638: 33.92 | F638: 38.200000000000003 | H638: 37.68 | AN638: 不宜入场（当前股价小于50日均线,应观察1w） | AO638: 44601 | AP638: 是
A639: 002831.SZ | B639: 裕同科技 | C639: 0.69999999999999996 | D639: 30.600000000000001 | E639: 31.01 | F639: 32.28 | H639: 31.51 | AN639: 不宜入场（当前股价小于50日均线,应观察1w） | AO639: 44601 | AP639: 是
A640: 000157.SZ | B640: 中联重科 | C640: 0.69999999999999996 | AP640: 否
A641: 002384.SZ | B641: 东山精密 | C641: 0.69999999999999996 | D641: 22.17 | E641: 22.88 | F641: 24.78 | H641: 24.33 | AN641: 不宜入场（当前股价小于50日均线,应观察1w） | AO641: 44601 | AP641: 是
A642: 002677.SZ | B642: 浙江美大 | C642: 0.69999999999999996 | AP642: 否
A643: 601918.SH | B643: 新集能源 | C643: 0.69999999999999996 | AP643: 否
A644: 603165.SH | B644: 荣晟环保 | C644: 0.69999999999999996 | D644: 15.31 | E644: 15.85 | F644: 17.34 | H644: 16.17 | AN644: 不宜入场（当前股价小于50日均线,应观察1w） | AO644: 44601 | AP644: 是
A645: 603387.SH | B645: 基蛋生物 | C645: 0.69999999999999996 | AP645: 否
A646: 603823.SH | B646: 百合花 | C646: 0.69999999999999996 | AP646: 否
A647: 605339.SH | B647: 南侨食品 | C647: 0.69999999999999996 | D647: 32.79 | E647: 33.23 | F647: 33.27 | H647: 31.38 | AN647: 不宜入场（当前股价小于200日均线,应观察3w） | AO647: 44601 | AP647: 是
A648: 600475.SH | B648: 华光环能 | C648: 0.69999999999999996 | D648: 10.88 | E648: 11.03 | F648: 11.199999999999999 | H648: 10.86 | AN648: 不宜入场（当前股价小于200日均线,应观察3w） | AO648: 44601 | AP648: 是
A649: 601928.SH | B649: 凤凰传媒 | C649: 0.69999999999999996 | D649: 7.07 | E649: 7.2000000000000002 | F649: 7.58 | H649: 8.09 | I649: 5.58 | J649: 8.5999999999999996 | K649: 6.68 | L649: =(H649-I649)/I649 -> 0.44982078853046592 | M649: =(J649-H649)/J649 -> 5.9302325581395324e-02 | N649: =(J649-K649)/K649 -> 0.28742514970059879 | P649: 7.29 | AA649: 3w | AB649: =(J649-P649)/J649 -> 0.1523255813953488 | AN649: 不宜入场（收缩幅度不够,应观察1w） | AO649: 44601 | AP649: 是
A650: 002240.SZ | B650: 盛新锂能 | C650: 0.69999999999999996 | D650: 46.84 | E650: 49.64 | F650: 51.600000000000001 | H650: 46.98 | AN650: 不宜入场（当前股价小于150日均线,应观察3w） | AO650: 44601 | AP650: 是
A651: 605258.SH | B651: 协和电子 | C651: 0.69999999999999996 | AP651: 否
A652: 001979.SZ | B652: 招商蛇口 | C652: 0.69 | D652: 11.79 | E652: 12 | F652: 13.05 | H652: 14.18 | I652: 9.02 | J652: 15.03 | K652: 10.87 | L652: =(H652-I652)/I652 -> 0.57206208425720628 | M652: =(J652-H652)/J652 -> 5.6553559547571505e-02 | N652: =(J652-K652)/K652 -> 0.38270469181232752 | P652: 12.63 | Q652: 14.42 | R652: 13.17 | AA652: 3w | AB652: =(J652-P652)/J652 -> 0.15968063872255481 | AC652: =(Q652-R652)/Q652 -> 8.6685159500693484e-02 | AI652: 是 | AJ652: 是 | AK652: 是 | AL652: 是 | AM652: 是 | AN652: 可以入场 | AO652: 44601 | AP652: 是
A653: 002532.SZ | B653: 天山铝业 | C653: 0.69 | AP653: 否
A654: 002737.SZ | B654: 葵花药业 | C654: 0.69 | D654: 14.69 | E654: 14.87 | F654: 15.22 | H654: 14.61 | AN654: 不宜入场（当前股价小于200日均线,应观察3w） | AO654: 44601 | AP654: 是
A655: 002824.SZ | B655: 和胜股份 | C655: 0.69 | D655: 34.899999999999999 | E655: 37 | F655: 41.439999999999998 | H655: 44.350000000000001 | I655: 12.77 | J655: 50.990000000000002 | K655: 32.18 | L655: =(H655-I655)/I655 -> 2.4729835552075179 | M655: =(J655-H655)/J655 -> 0.13022161208080016 | N655: =(J655-K655)/K655 -> 0.58452454940957121 | P655: 37.57 | Q655: 47 | R655: 39.020000000000003 | AA655: 10w | AB655: =(J655-P655)/J655 -> 0.2631888605608943 | AC655: =(Q655-R655)/Q655 -> 0.16978723404255314 | AD655: =(S655-T655)/S655 -> #DIV/0! | AN655: 不宜入场（收缩幅度不够,应观察1w） | AO655: 44585 | AP655: 是
A656: 600079.SH | B656: 人福医药 | C656: 0.69 | AP656: 否
A657: 600761.SH | B657: 安徽合力 | C657: 0.69 | D657: 11.699999999999999 | E657: 11.74 | F657: 12.06 | H657: 11.56 | AN657: 不宜入场（当前股价小于50日均线,应观察1w） | AO657: 44601 | AP657: 是
A658: 601006.SH | B658: 大秦铁路 | C658: 0.69 | D658: 6.33 | E658: 6.34 | F658: 6.48 | H658: 6.98 | I658: 5.7999999999999998 | J658: 7.13 | K658: 6.35 | L658: =(H658-I658)/I658 -> 0.20344827586206907 | M658: =(J658-H658)/J658 -> 2.1037868162692774e-02 | N658: =(J658-K658)/K658 -> 0.12283464566929138 | AN658: 不宜入场（当前股价距离最低点距离过小,应观察1w） | AO658: 44601 | AP658: 是
A659: 601398.SH | B659: 工商银行 | C659: 0.69 | AP659: 否
A660: 601689.SH | B660: 拓普集团 | C660: 0.69 | D660: 45.21 | E660: 47.5 | F660: 53.73 | H660: 55.37 | I660: 26.71 | J660: 68.06 | K660: 36.44 | L660: =(H660-I660)/I660 -> 1.0730063646574315 | M660: =(J660-H660)/J660 -> 0.18645312959153695 | N660: =(J660-K660)/K660 -> 0.86772777167947324 | P660: 46.74 | Q660: 58.799999999999997 | R660: 48.73 | S660: 60.74 | T660: 51.36 | AA660: 8w | AB660: =(J660-P660)/J660 -> 0.31325301204819278 | AC660: =(Q660-R660)/Q660 -> 0.17125850340136056 | AD660: =(S660-T660)/S660 -> 0.15442871254527499 | AN660: 不宜入场（收缩幅度不够,应观察1w） | AO660: 44601 | AP660: 是
A661: 601881.SH | B661: 中国银河 | C661: 0.69 | D661: 10.48 | E661: 10.58 | F661: 10.800000000000001 | H661: 11 | I661: 9.14 | J661: 11.76 | K661: 9.92 | L661: =(H661-I661)/I661 -> 0.20350109409190364 | M661: =(J661-H661)/J661 -> 6.4625850340136043e-02 | N661: =(J661-K661)/K661 -> 0.18548387096774191 | AN661: 不宜入场（当前股价距离最低点距离过小,应观察1w） | AO661: 44601 | AP661: 是
A662: 603076.SH | B662: 乐惠国际 | C662: 0.69 | AP662: 否
A663: 603213.SH | B663: 镇洋发展 | C663: 0.69 | D663: 13.86 | E663: 15.04 | F663: 19.09 | H663: 17.99 | AN663: 不宜入场（当前股价小于50日均线,应观察1w） | AO663: 44601 | AP663: 是
A664: 603357.SH | B664: 设计总院 | C664: 0.69 | D664: 9.19 | E664: 9.32 | F664: 10.09 | H664: 12.11 | I664: 7.98 | J664: 12.6 | K664: 8.59 | L664: =(H664-I664)/I664 -> 0.51754385964912264 | M664: =(J664-H664)/J664 -> 3.888888888888891e-02 | N664: =(J664-K664)/K664 -> 0.46682188591385332 | P664: 10.21 | AA664: 2w | AB664: =(J664-P664)/J664 -> 0.18968253968253959 | AN664: 不宜入场（收缩幅度不够,应观察1w） | AO664: 44601 | AP664: 是
A665: 603511.SH | B665: 爱慕股份 | C665: 0.69 | AP665: 否
A666: 603707.SH | B666: 健友股份 | C666: 0.69 | D666: 35.11 | E666: 36.07 | F666: 38.09 | H666: 36.22 | AN666: 不宜入场（当前股价小于50日均线,应观察1w） | AO666: 44601 | AP666: 是
A667: 603757.SH | B667: 大元泵业 | C667: 0.69 | AP667: 否
A668: 002202.SZ | B668: 金风科技 | C668: 0.69 | D668: 15.35 | E668: 15.72 | F668: 15.99 | H668: 15.24 | AN668: 不宜入场（当前股价小于200日均线,应观察3w） | AO668: 44601 | AP668: 是
A669: 000717.SZ | B669: 韶钢松山 | C669: 0.69 | AP669: 否
A670: 000792.SZ | B670: 盐湖股份 | C670: 0.68 | D670: 23.899999999999999 | E670: 26.170000000000002 | F670: 30.940000000000001 | H670: 26.949999999999999 | I670: 7.6600000000000001 | J670: 45.649999999999999 | K670: 8.7599999999999998 | L670: =(H670-I670)/I670 -> 2.5182767624020888 | M670: =(J670-H670)/J670 -> 0.40963855421686746 | N670: =(J670-K670)/K670 -> 4.2111872146118721 | AN670: 不宜入场（当前股价相对于最高点距离太大,应观察3w） | AO670: 44582 | AP670: 是
A671: 002158.SZ | B671: 汉钟精机 | C671: 0.68 | AP671: 否
A672: 605169.SH | B672: 洪通燃气 | C672: 0.68 | AP672: 否
A673: 000921.SZ | B673: 海信家电 | C673: 0.68 | AP673: 否
A674: 002281.SZ | B674: 光迅科技 | C674: 0.68 | AP674: 否
A675: 600461.SH | B675: 洪城环境 | C675: 0.68 | D675: 7.74 | E675: 7.9000000000000004 | F675: 8.13 | H675: 8.1999999999999993 | I675: 5.35 | J675: 9.52 | K675: 7.35 | L675: =(H675-I675)/I675 -> 0.53271028037383172 | M675: =(J675-H675)/J675 -> 0.13865546218487398 | N675: =(J675-K675)/K675 -> 0.29523809523809524 | P675: 7.52 | AA675: 17w | AB675: =(J675-P675)/J675 -> 0.21008403361344538 | AN675: 不宜入场（收缩幅度不够,应观察1w） | AO675: 44601 | AP675: 是
A676: 601788.SH | B676: 光大证券 | C676: 0.68 | AP676: 否
A677: 601966.SH | B677: 玲珑轮胎 | C677: 0.68 | AP677: 否
A678: 603786.SH | B678: 科博达 | C678: 0.68 | D678: 72.82 | E678: 74.37 | F678: 80.18 | H678: 73.24 | AN678: 不宜入场（当前股价小于150日均线,应观察2w） | AO678: 44601 | AP678: 是
A679: 605376.SH | B679: 博迁新材 | C679: 0.68 | D679: 73.03 | E679: 75.24 | F679: 76.58 | H679: 70 | AN679: 不宜入场（当前股价小于200日均线,应观察3w） | AO679: 44601 | AP679: 是
A680: 000062.SZ | B680: 深圳华强 | C680: 0.68 | D680: 15.56 | E680: 15.87 | F680: 16.45 | H680: 15.45 | AN680: 不宜入场（当前股价小于200日均线,应观察3w） | AO680: 44601 | AP680: 是
A681: 600971.SH | B681: 恒源煤电 | C681: 0.68 | AP681: 否
A682: 600338.SH | B682: 西藏珠峰 | C682: 0.68 | D682: 28.149999999999999 | E682: 30.07 | F682: 32.020000000000003 | H682: 29.52 | AN682: 不宜入场（当前股价小于150日均线,应观察2w） | AO682: 44601 | AP682: 是
A683: 000100.SZ | B683: TCL科技 | C683: 0.68 | AP683: 否
A684: 600143.SH | B684: 金发科技 | C684: 0.67 | AP684: 否
A685: 002645.SZ | B685: 华宏科技 | C685: 0.67 | D685: 19.41 | E685: 20.460000000000001 | F685: 23.170000000000002 | H685: 23.510000000000002 | I685: 8.2200000000000006 | J685: 28.600000000000001 | K685: 19.219999999999999 | L685: =(H685-I685)/I685 -> 1.8600973236009732 | M685: =(J685-H685)/J685 -> 0.17797202797202796 | N685: =(J685-K685)/K685 -> 0.4880332986472426 | P685: 21.800000000000001 | AA685: 7w | AB685: =(J685-P685)/J685 -> 0.23776223776223779 | AC685: =(Q685-R685)/Q685 -> #DIV/0! | AN685: 不宜入场（收缩幅度不够,应持续观察1w） | AO685: 44585 | AP685: 是
A686: 600085.SH | B686: 同仁堂 | C686: 0.67 | D686: 36.82 | E686: 38.08 | F686: 42.91 | H686: 45.43 | I686: 23.23 | J686: 55.45 | K686: 32.27 | L686: =(H686-I686)/I686 -> 0.95566078346965122 | M686: =(J686-H686)/J686 -> 0.18070333633904423 | N686: =(J686-K686)/K686 -> 0.71831422373721721 | P686: 41.15 | AA686: 3w | AB686: =(J686-P686)/J686 -> 0.25788999098286752 | AN686: 不宜入场（收缩幅度不够,应持续观察2w） | AO686: 44601 | AP686: 是
A687: 000429.SZ | B687: 粤高速A | C687: 0.67 | D687: 7.12 | E687: 7.17 | F687: 7.35 | H687: 7.85 | I687: 5.48 | J687: 7.95 | K687: 7.18 | L687: =(H687-I687)/I687 -> 0.43248175182481735 | M687: =(J687-H687)/J687 -> 1.2578616352201324e-02 | N687: =(J687-K687)/K687 -> 0.10724233983286915 | AN687: 不宜入场（收缩幅度不够,应观察2w） | AO687: 44601 | AP687: 是
A688: 000887.SZ | B688: 中鼎股份 | C688: 0.67 | D688: 16.94 | E688: 18.07 | F688: 21.04 | H688: 19.22 | AN688: 不宜入场（当前股价小于50日均线,应观察1w） | AO688: 44601 | AP688: 是
A689: 002026.SZ | B689: 山东威达 | C689: 0.67 | D689: 15.67 | E689: 16.38 | F689: 18.18 | H689: 17.07 | AN689: 不宜入场（当前股价小于50日均线,应观察1w） | AO689: 44601 | AP689: 是
A690: 002262.SZ | B690: 恩华药业 | C690: 0.67 | D690: 14.82 | E690: 14.87 | F690: 15 | H690: 14.37 | AN690: 不宜入场（当前股价小于200日均线,应观察3w） | AO690: 44601 | AP690: 是
A691: 002475.SZ | B691: 立讯精密 | C691: 0.67 | D691: 40.95 | E691: 41.98 | F691: 45.5 | H691: 43.83 | AN691: 不宜入场（当前股价小于50日均线,应观察1w） | AO691: 44601 | AP691: 是
A692: 002860.SZ | B692: 星帅尔 | C692: 0.67 | D692: 20.17 | E692: 20.93 | F692: 22.59 | H692: 20 | AN692: 不宜入场（当前股价小于200日均线,应观察3w） | AO692: 44601 | AP692: 是
A693: 003031.SZ | B693: 中瓷电子 | C693: 0.67 | D693: 67.69 | E693: 71.5 | F693: 82.71 | H693: 104.97 | I693: 35.53 | J693: 104.97 | K693: 95.63 | L693: =(H693-I693)/I693 -> 1.9544047283985364 | M693: =(J693-H693)/J693 -> 0 | N693: =(J693-K693)/K693 -> 9.7668095785841305e-02 | AN693: 不宜入场（收缩幅度不够,应持续观察2w） | AO693: 44601 | AP693: 是
A694: 600452.SH | B694: 涪陵电力 | C694: 0.67 | D694: 16.89 | E694: 17.43 | F694: 18.43 | H694: 16.56 | AN694: 不宜入场（当前股价小于200日均线,应观察3w） | AO694: 44601 | AP694: 是
A695: 600927.SH | B695: 永安期货 | C695: 0.67 | D695: 27.06 | E695: 27.37 | F695: 28.67 | H695: 26.899999999999999 | AN695: 不宜入场（当前股价小于200日均线,应观察3w） | AO695: 44601 | AP695: 是
A696: 603408.SH | B696: 建霖家居 | C696: 0.67 | AP696: 否
A697: 603657.SH | B697: 春光科技 | C697: 0.67 | D697: 23.09 | E697: 23.44 | F697: 24.21 | H697: 23.83 | AN697: 不宜入场（当前股价小于50日均线,应观察1w） | AO697: 44601 | AP697: 是
A698: 603726.SH | B698: 朗迪集团 | C698: 0.67 | D698: 13.84 | E698: 14.03 | F698: 14.21 | H698: 13.85 | AN698: 不宜入场（当前股价小于150日均线,应观察2w） | AO698: 44601 | AP698: 是
A699: 605016.SH | B699: 百龙创园 | C699: 0.67 | D699: 29.11 | E699: 29.62 | F699: 29.87 | H699: 27.81 | AN699: 不宜入场（当前股价小于200日均线,应观察3w） | AO699: 44601 | AP699: 是
A700: 000671.SZ | B700: 阳光城 | C700: 0.66 | AP700: 否
A701: 000869.SZ | B701: 张裕A | C701: 0.66 | AP701: 否
A702: 002803.SZ | B702: 吉宏股份 | C702: 0.66 | AP702: 否
A703: 600276.SH | B703: 恒瑞医药 | C703: 0.66 | AP703: 否
A704: 600390.SH | B704: 五矿资本 | C704: 0.66 | AP704: 否
A705: 600682.SH | B705: 南京新百 | C705: 0.66 | D705: 10.56 | E705: 10.74 | F705: 11.08 | H705: 10.96 | AN705: 不宜入场（当前股价小于50日均线,应观察1w） | AO705: 44601 | AP705: 是
A706: 603578.SH | B706: 三星新材 | C706: 0.66 | D706: 15.96 | E706: 16.26 | F706: 16.72 | H706: 15.57 | AN706: 不宜入场（当前股价小于200日均线,应观察3w） | AO706: 44601 | AP706: 是
A707: 605368.SH | B707: 蓝天燃气 | C707: 0.66 | AP707: 否
A708: 605398.SH | B708: 新炬网络 | C708: 0.66 | AP708: 否
A709: 002915.SZ | B709: 中欣氟材 | C709: 0.66 | D709: 24.899999999999999 | E709: 25.87 | F709: 27.42 | H709: 24.54 | AN709: 不宜入场（当前股价小于200日均线,应观察3w） | AO709: 44601 | AP709: 是
A710: 600012.SH | B710: 皖通高速 | C710: 0.66 | D710: 6.74 | E710: 6.76 | F710: 7.13 | H710: 8.47 | I710: 5.52 | J710: 8.6999999999999993 | K710: 6.87 | L710: =(H710-I710)/I710 -> 0.53442028985507273 | M710: =(J710-H710)/J710 -> 2.6436781609195249e-02 | N710: =(J710-K710)/K710 -> 0.26637554585152828 | AN710: 不宜入场（收缩幅度不够,应持续观察2w） | AO710: 44601 | AP710: 是
A711: 605136.SH | B711: 丽人丽妆 | C711: 0.65 | AP711: 否
A712: 600308.SH | B712: 华泰股份 | C712: 0.65 | AP712: 否
A713: 002763.SZ | B713: 汇洁股份 | C713: 0.65 | D713: 9.03 | E713: 9.28 | F713: 9.58 | H713: 9.47 | AN713: 不宜入场（当前股价小于50日均线,应观察1w） | AO713: 44601 | AP713: 是
A714: 600388.SH | B714: 龙净环保 | C714: 0.65 | AP714: 否
A715: 601658.SH | B715: 邮储银行 | C715: 0.65 | D715: 5.2999999999999998 | E715: 5.32 | F715: 5.48 | H715: 5.88 | I715: 4.49 | J715: 5.99 | K715: 5.35 | L715: =(H715-I715)/I715 -> 0.30957683741648101 | M715: =(J715-H715)/J715 -> 1.8363939899833107e-02 | N715: =(J715-K715)/K715 -> 0.11962616822429918 | AN715: 不宜入场（收缩幅度不够,应持续观察2w） | AO715: 44601 | AP715: 是
A716: 601827.SH | B716: 三峰环境 | C716: 0.65 | AP716: 否
A717: 603039.SH | B717: 泛微网络 | C717: 0.65 | AP717: 否
A718: 605122.SH | B718: 四方新材 | C718: 0.65 | AP718: 否
A719: 000739.SZ | B719: 普洛药业 | C719: 0.65 | D719: 32.52 | E719: 33.16 | F719: 32.85 | AN719: 不宜入场（50日均线小于150日均线,应观察4w） | AO719: 44601 | AP719: 是
A720: 605577.SH | B720: 龙版传媒 | C720: 0.64 | D720: 11.800000000000001 | E720: 12.33 | F720: 13.62 | H720: 14.01 | I720: 7.19 | J720: 18.32 | K720: 12.36 | L720: =(H720-I720)/I720 -> 0.94853963838664801 | M720: =(J720-H720)/J720 -> 0.23526200873362449 | N720: =(J720-K720)/K720 -> 0.48220064724919104 | P720: 12.06 | AA720: 5w | AB720: =(J720-P720)/J720 -> 0.34170305676855894 | AN720: 不宜入场（收缩幅度不够,应持续观察2w） | AO720: 44601 | AP720: 是
A721: 600663.SH | B721: 陆家嘴 | C721: 0.64 | AP721: 否
A722: 600817.SH | B722: 宇通重工 | C722: 0.64 | AP722: 否
A723: 002851.SZ | B723: 麦格米特 | C723: 0.64 | AP723: 否
A724: 000065.SZ | B724: 北方国际 | C724: 0.64 | AP724: 否
A725: 002318.SZ | B725: 久立特材 | C725: 0.64 | D725: 14.77 | E725: 15.16 | F725: 16.67 | H725: 17.85 | I725: 10.18 | J725: 19.100000000000001 | K725: 14.87 | L725: =(H725-I725)/I725 -> 0.75343811394891969 | M725: =(J725-H725)/J725 -> 6.5445026178010471e-02 | N725: =(J725-K725)/K725 -> 0.28446536650975135 | P725: 16.58 | AA725: 2w | AB725: =(J725-P725)/J725 -> 0.13193717277486927 | AN725: 不宜入场（收缩幅度不够,应持续观察1w） | AO725: 44601 | AP725: 是
A726: 002990.SZ | B726: 盛视科技 | C726: 0.64 | AP726: 否
A727: 600846.SH | B727: 同济科技 | C727: 0.64 | AP727: 否
A728: 600908.SH | B728: 无锡银行 | C728: 0.64 | AP728: 否
A729: 600970.SH | B729: 中材国际 | C729: 0.64 | D729: 10.63 | E729: 10.83 | F729: 10.92 | H729: 10.58 | AN729: 不宜入场（当前股价小于200日均线,应观察3w） | AO729: 44601 | AP729: 是
A730: 603216.SH | B730: 梦天家居 | C730: 0.64 | AP730: 否
A731: 603351.SH | B731: 威尔药业 | C731: 0.64 | D731: 26.76 | E731: 27.98 | F731: 32.02 | H731: 29.79 | AN731: 不宜入场（当前股价小于50日均线,应观察1w） | AO731: 44601 | AP731: 是
A732: 002690.SZ | B732: 美亚光电 | C732: 0.63 | AP732: 否
A733: 600764.SH | B733: 中国海防 | C733: 0.63 | D733: 31.08 | E733: 31.91 | F733: 34.32 | H733: 32.99 | AN733: 不宜入场（当前股价小于50日均线,应观察1w） | AO733: 44601 | AP733: 是
A734: 600674.SH | B734: 川投能源 | C734: 0.63 | AP734: 否
A735: 002315.SZ | B735: 焦点科技 | C735: 0.63 | AP735: 否
A736: 002745.SZ | B736: 木林森 | C736: 0.63 | AP736: 否
A737: 002879.SZ | B737: 长缆科技 | C737: 0.63 | D737: 20.21 | E737: 21.11 | F737: 23.67 | H737: 22 | AN737: 不宜入场（当前股价小于50日均线,应观察1w） | AO737: 44601 | AP737: 是
A738: 002897.SZ | B738: 意华股份 | C738: 0.63 | D738: 37.16 | E738: 39.56 | F738: 44.32 | H738: 36.71 | AN738: 不宜入场（当前股价小于200日均线,应观察3w） | AO738: 44601 | AP738: 是
A739: 601528.SH | B739: 瑞丰银行 | C739: 0.63 | AP739: 否
A740: 603367.SH | B740: 辰欣药业 | C740: 0.63 | AP740: 否
A741: 603693.SH | B741: 江苏新能 | C741: 0.63 | D741: 21.74 | E741: 22.94 | F741: 25.07 | H741: 25.100000000000001 | I741: 9.71 | J741: 34.5 | K741: 26.72 | L741: =(H741-I741)/I741 -> 1.5849639546858907 | M741: =(J741-H741)/J741 -> 0.27246376811594197 | N741: =(J741-K741)/K741 -> 0.29116766467065874 | AN741: 不宜入场（当前股价距离最高点距离过大,应观察1w） | AO741: 44601 | AP741: 是
A742: 605033.SH | B742: 美邦股份 | C742: 0.63 | D742: 17.79 | E742: 17.77 | F742: 18.09 | H742: 17.91 | AN742: 不宜入场（当前股价小于50日均线,应观察1w） | AO742: 44601 | AP742: 是
A743: 605166.SH | B743: 聚合顺 | C743: 0.63 | D743: 12.35 | E743: 12.85 | F743: 14.46 | H743: 13.85 | AN743: 不宜入场（当前股价小于50日均线,应观察1w） | AO743: 44601 | AP743: 是
A744: 605365.SH | B744: 立达信 | C744: 0.63 | AP744: 否
A745: 002068.SZ | B745: 黑猫股份 | C745: 0.63 | D745: 8.15 | E745: 8.43 | F745: 9.54 | H745: 9.92 | I745: 5.74 | J745: 11.96 | K745: 6.55 | L745: =(H745-I745)/I745 -> 0.72822299651567934 | M745: =(J745-H745)/J745 -> 0.17056856187290975 | N745: =(J745-K745)/K745 -> 0.82595419847328266 | P745: 9.24 | AA745: 2w | AB745: =(J745-P745)/J745 -> 0.22742474916387964 | AN745: 不宜入场（收缩幅度不够,应持续观察2w） | AO745: 44601 | AP745: 是
A746: 002180.SZ | B746: 纳思达 | C746: 0.63 | D746: 38.51 | E746: 40.74 | F746: 47.29 | H746: 50.07 | I746: 22.96 | J746: 54.45 | K746: 38.19 | L746: =(H746-I746)/I746 -> 1.1807491289198606 | M746: =(J746-H746)/J746 -> 8.04407713498623e-02 | N746: =(J746-K746)/K746 -> 0.42576590730557756 | P746: 46.200000000000003 | AA746: 2w | AB746: =(J746-P746)/J746 -> 0.15151515151515152 | AN746: 不宜入场（收缩幅度不够,应持续观察1w） | AO746: 44601 | AP746: 是
A747: 002386.SZ | B747: 天原股份 | C747: 0.63 | D747: 11.03 | E747: 11.48 | F747: 11.72 | H747: 11.22 | AN747: 不宜入场（当前股价小于150日均线,应观察2w） | AO747: 44601 | AP747: 是
A748: 000655.SZ | B748: 金岭矿业 | C748: 0.63 | AP748: 否
A749: 000731.SZ | B749: 四川美丰 | C749: 0.62 | D749: 8.01 | E749: 8.42 | F749: 9.15 | H749: 9.52 | I749: 4.12 | J749: 14.68 | K749: 6.65 | L749: =(H749-I749)/I749 -> 1.3106796116504853 | M749: =(J749-H749)/J749 -> 0.35149863760217986 | N749: =(J749-K749)/K749 -> 1.207518796992481 | AN749: 不宜入场（当前股价距离最高点距离过大,应观察2w） | AO749: 44601 | AP749: 是
A750: 001965.SZ | B750: 招商公路 | C750: 0.62 | D750: 7.53 | E750: 7.57 | F750: 7.87 | H750: 8.93 | I750: 6.63 | J750: 9.32 | K750: 7.7000000000000002 | L750: =(H750-I750)/I750 -> 0.34690799396681749 | M750: =(J750-H750)/J750 -> 4.1845493562231821e-02 | N750: =(J750-K750)/K750 -> 0.2103896103896104 | AN750: 不宜入场（收缩幅度不够,应持续观察2w） | AO750: 44601 | AP750: 是
A751: 600894.SH | B751: 广日股份 | C751: 0.62 | AP751: 否
A752: 000719.SZ | B752: 中原传媒 | C752: 0.62 | D752: 7.2999999999999998 | E752: 7.42 | F752: 8 | H752: 8.27 | I752: 6.32 | J752: 10.199999999999999 | K752: 6.97 | L752: =(H752-I752)/I752 -> 0.30854430379746822 | M752: =(J752-H752)/J752 -> 0.1892156862745098 | N752: =(J752-K752)/K752 -> 0.46341463414634143 | P752: 7.59 | AA752: 4w | AB752: =(J752-P752)/J752 -> 0.25588235294117645 | AN752: 不宜入场（收缩幅度不够,应持续观察2w） | AO752: 44601 | AP752: 是
A753: 002335.SZ | B753: 科华数据 | C753: 0.62 | D753: 31.81 | E753: 33.52 | F753: 34.97 | H753: 29.95 | AN753: 不宜入场（当前股价小于200日均线,应观察3w） | AO753: 44601 | AP753: 是
A754: 002847.SZ | B754: 盐津铺子 | C754: 0.62 | AP754: 否
A755: 002922.SZ | B755: 伊戈尔 | C755: 0.62 | D755: 16.89 | E755: 17.99 | F755: 19.36 | H755: 16.399999999999999 | AN755: 不宜入场（当前股价小于200日均线,应观察3w） | AO755: 44601 | AP755: 是
A756: 002979.SZ | B756: 雷赛智能 | C756: 0.62 | AP756: 否
A757: 003022.SZ | B757: 联泓新科 | C757: 0.62 | AP757: 否
A758: 600315.SH | B758: 上海家化 | C758: 0.62 | AP758: 否
A759: 600510.SH | B759: 黑牡丹 | C759: 0.62 | D759: 7.48 | E759: 7.59 | F759: 7.68 | H759: 7.96 | I759: 5.95 | J759: 10.19 | K759: 6.7999999999999998 | L759: =(H759-I759)/I759 -> 0.33781512605042013 | M759: =(J759-H759)/J759 -> 0.2188420019627085 | N759: =(J759-K759)/K759 -> 0.49852941176470583 | P759: 6.77 | AA759: 22w | AB759: =(J759-P759)/J759 -> 0.33562315996074582 | AN759: 不宜入场（收缩幅度不够,应持续观察2w） | AO759: 44601 | AP759: 是
A760: 600765.SH | B760: 中航重机 | C760: 0.62 | D760: 35.42 | E760: 38.19 | F760: 44.61 | H760: 41.74 | AN760: 不宜入场（当前股价小于50日均线,应观察1w） | AO760: 44601 | AP760: 是
A761: 603037.SH | B761: 凯众股份 | C761: 0.62 | D761: 18.34 | E761: 18.800000000000001 | F761: 19.72 | H761: 18.37 | AN761: 不宜入场（当前股价小于150日均线,应观察2w） | AO761: 44601 | AP761: 是
A762: 603181.SH | B762: 皇马科技 | C762: 0.62 | D762: 15.13 | E762: 15.64 | F762: 17.13 | H762: 16.26 | AN762: 不宜入场（当前股价小于50日均线,应观察1w） | AO762: 44601 | AP762: 是
A763: 605088.SH | B763: 冠盛股份 | C763: 0.62 | AP763: 否
A764: 600420.SH | B764: 国药现代 | C764: 0.61 | AP764: 否
A765: 000488.SZ | B765: 晨鸣纸业 | C765: 0.61 | AP765: 否
A766: 600850.SH | B766: 电科数字 | C766: 0.61 | D766: 31.55 | E766: 32.27 | F766: 34.01 | H766: 31.03 | AN766: 不宜入场（当前股价小于200日均线,应观察3w） | AO766: 44601 | AP766: 是
A767: 000913.SZ | B767: 钱江摩托 | C767: 0.61 | AP767: 否
A768: 003008.SZ | B768: 开普检测 | C768: 0.61 | AP768: 否
A769: 600528.SH | B769: 中铁工业 | C769: 0.61 | AP769: 否
A770: 601128.SH | B770: 常熟银行 | C770: 0.61 | D770: 6.84 | E770: 6.87 | F770: 7.12 | H770: 7.63 | I770: 5.68 | J770: 7.89 | K770: 6.32 | L770: =(H770-I770)/I770 -> 0.34330985915492962 | M770: =(J770-H770)/J770 -> 3.2953105196451178e-02 | N770: =(J770-K770)/K770 -> 0.24841772151898722 | P770: 6.52 | Q770: 7.61 | R770: 7.13 | S770: 7.65 | T770: 7.28 | U770: 7.75 | V770: 7.51 | AA770: 13w | AB770: =(J770-P770)/J770 -> 0.17363751584283907 | AC770: =(Q770-R770)/Q770 -> 6.3074901445466541e-02 | AD770: =(S770-T770)/S770 -> 4.8366013071895433e-02 | AJ770: 否 | AN770: 不宜入场（收缩幅度不够,应持续观察1w） | AO770: 44601 | AP770: 是
A771: 601163.SH | B771: 三角轮胎 | C771: 0.61 | AP771: 否
A772: 603112.SH | B772: 华翔股份 | C772: 0.61 | AP772: 否
A773: 603360.SH | B773: 百傲化学 | C773: 0.61 | AP773: 否
A774: 603967.SH | B774: 中创物流 | C774: 0.61 | D774: 12.68 | E774: 12.79 | F774: 13.199999999999999 | H774: 12.699999999999999 | AN774: 不宜入场（当前股价小于150日均线,应观察2w） | AO774: 44601 | AP774: 是
A775: 605086.SH | B775: 龙高股份 | C775: 0.61 | AP775: 否
A776: 605296.SH | B776: 神农集团 | C776: 0.61 | AP776: 否
A777: 600704.SH | B777: 物产中大 | C777: 0.61 | AP777: 否
A778: 605128.SH | B778: 上海沿浦 | C778: 0.61 | D778: 35.39 | E778: 35.99 | F778: 37.86 | H778: 35.78 | AN778: 不宜入场（当前股价小于150日均线,应观察2w） | AO778: 44601 | AP778: 是
A779: 002221.SZ | B779: 东华能源 | C779: 0.61 | AP779: 否
A780: 002674.SZ | B780: 兴业科技 | C780: 0.61 | AP780: 否
A781: 002880.SZ | B781: 卫光生物 | C781: 0.61 | AP781: 否
A782: 002507.SZ | B782: 涪陵榨菜 | C782: 0.61 | AP782: 否
A783: 601038.SH | B783: 一拖股份 | C783: 0.59999999999999998 | AP783: 否
A784: 002416.SZ | B784: 爱施德 | C784: 0.59999999999999998 | D784: 10.42 | E784: 10.68 | F784: 10.95 | H784: 10.53 | AN784: 不宜入场（当前股价小于150日均线,应观察2w） | AO784: 44601 | AP784: 是
A785: 000528.SZ | B785: 柳工 | C785: 0.59999999999999998 | AP785: 否
A786: 002422.SZ | B786: 科伦药业 | C786: 0.59999999999999998 | AP786: 否
A787: 002972.SZ | B787: 科安达 | C787: 0.59999999999999998 | D787: 18.08 | E787: 18.24 | F787: 18.72 | H787: 18.300000000000001 | AN787: 不宜入场（当前股价小于50日均线,应观察1w） | AO787: 44601 | AP787: 是
A788: 600061.SH | B788: 国投资本 | C788: 0.59999999999999998 | AP788: 否
A789: 600459.SH | B789: 贵研铂业 | C789: 0.59999999999999998 | D789: 23.76 | E789: 24.35 | F789: 24.699999999999999 | H789: 24.91 | I789: 15.88 | J789: 31.800000000000001 | K789: 21.74 | L789: =(H789-I789)/I789 -> 0.56863979848866497 | M789: =(J789-H789)/J789 -> 0.21666666666666667 | N789: =(J789-K789)/K789 -> 0.46274149034038653 | P789: 21.199999999999999 | Q789: 28.300000000000001 | R789: 22.86 | S789: 25.27 | T789: 22.600000000000001 | AA789: 13w | AB789: =(J789-P789)/J789 -> 0.33333333333333337 | AC789: =(Q789-R789)/Q789 -> 0.19222614840989402 | AD789: =(S789-T789)/S789 -> 0.10565888405223578 | AI789: 是 | AJ789: 是 | AN789: 可以入场 | AO789: 44601 | AP789: 是
A790: 600875.SH | B790: 东方电气 | C790: 0.59999999999999998 | D790: 16.5 | E790: 17.29 | F790: 19.05 | H790: 17.58 | AN790: 不宜入场（当前股价小于50日均线,应观察1w） | AO790: 44601 | AP790: 是
A791: 601311.SH | B791: 骆驼股份 | C791: 0.59999999999999998 | D791: 13.69 | E791: 14.07 | F791: 14.75 | H791: 14.22 | AN791: 不宜入场（当前股价小于50日均线,应观察1w） | AO791: 44601 | AP791: 是
A792: 603081.SH | B792: 大丰实业 | C792: 0.59999999999999998 | D792: 11.97 | E792: 12.09 | F792: 12.63 | H792: 12.67 | I792: 10.16 | J792: 15.01 | K792: 10.41 | L792: =(H792-I792)/I792 -> 0.24704724409448817 | M792: =(J792-H792)/J792 -> 0.15589606928714189 | N792: =(J792-K792)/K792 -> 0.44188280499519689 | AN792: 不宜入场（当前股价距离最低点距离过小,应观察1w） | AO792: 44601 | AP792: 是
A793: 603179.SH | B793: 新泉股份 | C793: 0.59999999999999998 | D793: 36.79 | E793: 37.99 | F793: 41.299999999999997 | H793: 37.62 | AN793: 不宜入场（当前股价小于150日均线,应观察2w） | AO793: 44601 | AP793: 是
A794: 603730.SH | B794: 岱美股份 | C794: 0.59999999999999998 | D794: 19.64 | E794: 20.09 | F794: 21.22 | H794: 18.41 | AN794: 不宜入场（当前股价小于200日均线,应观察3w） | AO794: 44601 | AP794: 是
A795: 605151.SH | B795: 西上海 | C795: 0.59999999999999998 | D795: 18.95 | E795: 18.89 | AN795: 不宜入场（150日均线小于200日均线,应观察6w） | AO795: 44601 | AP795: 是
A796: 002136.SZ | B796: 安纳达 | C796: 0.59999999999999998 | AP796: 否
A797: 600173.SH | B797: 卧龙地产 | C797: 0.59999999999999998 | D797: 5.68 | E797: 5.79 | F797: 6.0999999999999996 | H797: 6.03 | AN797: 不宜入场（当前股价小于50日均线,应观察1w） | AO797: 44601 | AP797: 是
A798: 600571.SH | B798: 信雅达 | C798: 0.59999999999999998 | D798: 9.16 | E798: 9.56 | F798: 10.89 | H798: 12.73 | I798: 6.34 | J798: 12.88 | K798: 8.97 | L798: =(H798-I798)/I798 -> 1.0078864353312305 | M798: =(J798-H798)/J798 -> 1.1645962732919282e-02 | N798: =(J798-K798)/K798 -> 0.4358974358974359 | P798: 9.61 | AA798: 4w | AB798: =(J798-P798)/J798 -> 0.25388198757763986 | AN798: 不宜入场（收缩幅度不够,应观察2w） | AO798: 44601 | AP798: 是
A799: 600661.SH | B799: 昂立教育 | C799: 0.59999999999999998 | AP799: 否
A800: 603866.SH | B800: 桃李面包 | C800: 0.59999999999999998 | AP800: 否
A801: 603690.SH | B801: 至纯科技 | C801: 0.59999999999999998 | D801: 46.100000000000001 | E801: 47.36 | F801: 47.03 | AN801: 不宜入场（50日均线小于150日均线,应观察4w） | AO801: 44602 | AP801: 是
A802: 002015.SZ | B802: 协鑫能科 | C802: 0.59999999999999998 | D802: 13.83 | E802: 14.710000000000001 | F802: 16.82 | H802: 16.890000000000001 | I802: 6.5599999999999996 | J802: 21.07 | K802: 13 | L802: =(H802-I802)/I802 -> 1.57469512195122 | M802: =(J802-H802)/J802 -> 0.19838633127669672 | N802: =(J802-K802)/K802 -> 0.62076923076923074 | P802: 15.390000000000001 | Q802: 19.489999999999998 | R802: 15.69 | AA802: 8w | AB802: =(J802-P802)/J802 -> 0.26957759848125296 | AC802: =(Q802-R802)/Q802 -> 0.19497178040020519 | AN802: 不宜入场（收缩幅度不够,应观察1w） | AO802: 44602 | AP802: 是
A803: 603303.SH | B803: 得邦照明 | C803: 0.59999999999999998 | D803: 15.87 | E803: 16.300000000000001 | F803: 16.899999999999999 | H803: 16.19 | AN803: 不宜入场（当前股价小于150日均线,应观察2w） | AO803: 44602 | AP803: 是
A804: 600551.SH | B804: 时代出版 | C804: 0.59 | D804: 7.44 | E804: 7.52 | F804: 7.7999999999999998 | H804: 8.21 | I804: 6.58 | J804: 8.58 | K804: 6.87 | L804: =(H804-I804)/I804 -> 0.24772036474164144 | M804: =(J804-H804)/J804 -> 4.312354312354303e-02 | N804: =(J804-K804)/K804 -> 0.24890829694323144 | AN804: 不宜入场（当前股价距离最低点的距离过小,应观察1w） | AO804: 44602 | AP804: 是
A805: 002293.SZ | B805: 罗莱生活 | C805: 0.59 | D805: 13.05 | E805: 13.199999999999999 | F805: 14.07 | H805: 15 | I805: 10.25 | J805: 16.15 | K805: 13.07 | L805: =(H805-I805)/I805 -> 0.46341463414634149 | M805: =(J805-H805)/J805 -> 7.1207430340557196e-02 | N805: =(J805-K805)/K805 -> 0.23565416985462878 | P805: 13.84 | AA805: 2w | AB805: =(J805-P805)/J805 -> 0.14303405572755412 | AN805: 不宜入场（收缩幅度不够,应观察1w） | AO805: 44602 | AP805: 是
A806: 002921.SZ | B806: 联诚精密 | C806: 0.59 | D806: 16.27 | E806: 16.52 | F806: 17.67 | H806: 19.15 | I806: 13.54 | J806: 20.600000000000001 | K806: 14.53 | L806: =(H806-I806)/I806 -> 0.41432791728212703 | M806: =(J806-H806)/J806 -> 7.0388349514563242e-02 | N806: =(J806-K806)/K806 -> 0.41775636613902289 | P806: 17.100000000000001 | AA806: 3w | AB806: =(J806-P806)/J806 -> 0.1699029126213592 | AN806: 不宜入场（收缩幅度不够,应观察1w） | AO806: 44602 | AP806: 是
A807: 603385.SH | B807: 惠达卫浴 | C807: 0.59 | AP807: 否
A808: 002440.SZ | B808: 闰土股份 | C808: 0.59 | AP808: 否
A809: 002441.SZ | B809: 众业达 | C809: 0.59 | D809: 8.65 | E809: 8.86 | F809: 9.4000000000000004 | H809: 9.39 | AN809: 不宜入场（当前股价小于50日均线,应观察1w） | AO809: 44602 | AP809: 是
A810: 002788.SZ | B810: 鹭燕医药 | C810: 0.59 | D810: 7.55 | E810: 7.57 | F810: 7.73 | H810: 7.74 | I810: 6.57 | J810: 9.18 | K810: 7.04 | L810: =(H810-I810)/I810 -> 0.17808219178082191 | M810: =(J810-H810)/J810 -> 0.15686274509803916 | N810: =(J810-K810)/K810 -> 0.30397727272727271 | AN810: 不宜入场（当前股价距离最低点距离过小,应观察2w） | AO810: 44602 | AP810: 是
A811: 002955.SZ | B811: 鸿合科技 | C811: 0.59 | D811: 20.02 | E811: 20.09 | F811: 21.02 | H811: 22.22 | I811: 16.18 | J811: 24.11 | K811: 18.77 | L811: =(H811-I811)/I811 -> 0.3733003708281829 | M811: =(J811-H811)/J811 -> 7.8390709249274187e-02 | N811: =(J811-K811)/K811 -> 0.28449653702717104 | P811: 19 | AA811: 4w | AB811: =(J811-P811)/J811 -> 0.21194525093322272 | AN811: 不宜入场（收缩幅度不够,应观察2w） | AO811: 44602 | AP811: 是
A812: 600958.SH | B812: 东方证券 | C812: 0.59 | D812: 12.98 | E812: 13.47 | F812: 13.87 | H812: 13.05 | AN812: 不宜入场（当前股价小于150日均线,应观察2w） | AO812: 44602 | AP812: 是
A813: 601828.SH | B813: 美凯龙 | C813: 0.59 | AP813: 否
A814: 603218.SH | B814: 日月股份 | C814: 0.59 | AP814: 否
A815: 603697.SH | B815: 有友食品 | C815: 0.59 | AP815: 否
A816: 603825.SH | B816: 华扬联众 | C816: 0.59 | D816: 19.36 | E816: 20.03 | F816: 22.93 | H816: 26.76 | I816: 13.47 | J816: 31.65 | K816: 16.72 | L816: =(H816-I816)/I816 -> 0.98663697104677062 | M816: =(J816-H816)/J816 -> 0.15450236966824635 | N816: =(J816-K816)/K816 -> 0.89294258373205748 | P816: 19.899999999999999 | AA816: 3w | AB816: =(J816-P816)/J816 -> 0.37124802527646134 | AN816: 不宜入场（收缩幅度不够,应观察2w） | AO816: 44602 | AP816: 是
A817: 603876.SH | B817: 鼎胜新材 | C817: 0.59 | D817: 33.289999999999999 | E817: 35.590000000000003 | F817: 37.869999999999997 | H817: 34.5 | AN817: 不宜入场（当前股价小于50日均线,应观察1w） | AO817: 44602 | AP817: 是
A818: 603979.SH | B818: 金诚信 | C818: 0.59 | D818: 19.83 | E818: 20.38 | F818: 21.26 | H818: 23.399999999999999 | I818: 11.51 | J818: 29.66 | K818: 20.22 | L818: =(H818-I818)/I818 -> 1.0330147697654213 | M818: =(J818-H818)/J818 -> 0.21105866486850983 | N818: =(J818-K818)/K818 -> 0.4668644906033631 | P818: 17.68 | Q818: 23.09 | R818: 19.33 | AA818: 19w | AB818: =(J818-P818)/J818 -> 0.40391099123398516 | AN818: 不宜入场（收缩幅度不够,应观察2w） | AO818: 44602 | AP818: 是
A819: 000779.SZ | B819: 甘咨询 | C819: 0.59 | D819: 9 | E819: 9.02 | F819: 9.39 | H819: 10.54 | I819: 7.87 | J819: 11.58 | K819: 8.45 | L819: =(H819-I819)/I819 -> 0.33926302414231246 | M819: =(J819-H819)/J819 -> 8.9810017271157241e-02 | N819: =(J819-K819)/K819 -> 0.3704142011834321 | P819: 9.02 | AA819: 2w | AB819: =(J819-P819)/J819 -> 0.22107081174438692 | AN819: 不宜入场（收缩幅度不够,应观察2w） | AO819: 44602 | AP819: 是
A820: 600285.SH | B820: 羚锐制药 | C820: 0.59 | D820: 11.699999999999999 | E820: 12.21 | F820: 13.84 | H820: 14.48 | I820: 7.84 | J820: 17.97 | K820: 10.74 | L820: =(H820-I820)/I820 -> 0.84693877551020413 | M820: =(J820-H820)/J820 -> 0.19421257651641619 | N820: =(J820-K820)/K820 -> 0.67318435754189931 | P820: 12.66 | AA820: 2w | AB820: =(J820-P820)/J820 -> 0.29549248747913182 | AN820: 不宜入场（收缩幅度不够,应观察2w） | AO820: 44602 | AP820: 是
A821: 600876.SH | B821: 洛阳玻璃 | C821: 0.58 | D821: 24.77 | E821: 26.01 | F821: 29.22 | H821: 26.36 | AN821: 不宜入场（当前股价小于50日均线,应观察1w） | AO821: 44602 | AP821: 是
A822: 002007.SZ | B822: 华兰生物 | C822: 0.58 | AP822: 否
A823: 002111.SZ | B823: 威海广泰 | C823: 0.58 | AP823: 否
A824: 003001.SZ | B824: 中岩大地 | C824: 0.58 | AP824: 否
A825: 600483.SH | B825: 福能股份 | C825: 0.58 | D825: 13.58 | E825: 14.1 | F825: 14.6 | H825: 13.92 | AN825: 不宜入场（当前股价小于150日均线,应观察2w） | AO825: 44602 | AP825: 是
A826: 603323.SH | B826: 苏农银行 | C826: 0.58 | D826: 4.93 | E826: 5 | F826: 5.19 | H826: 5.69 | I826: 4.28 | J826: 5.84 | K826: 4.95 | L826: =(H826-I826)/I826 -> 0.32943925233644861 | M826: =(J826-H826)/J826 -> 2.5684931506849223e-02 | N826: =(J826-K826)/K826 -> 0.17979797979797973 | AN826: 不宜入场（收缩幅度不够,应观察2w） | AO826: 44602 | AP826: 是
A827: 603583.SH | B827: 捷昌驱动 | C827: 0.58 | AP827: 否
A828: 603788.SH | B828: 宁波高发 | C828: 0.58 | D828: 13.43 | E828: 13.53 | F828: 13.73 | H828: 12.95 | AN828: 不宜入场（当前股价小于200日均线,应观察3w） | AO828: 44602 | AP828: 是
A829: 603890.SH | B829: 春秋电子 | C829: 0.58 | D829: 12.81 | E829: 12.77 | AN829: 不宜入场（150日均线小于200日均线,应观察6w） | AO829: 44602 | AP829: 是
A830: 603896.SH | B830: 寿仙谷 | C830: 0.58 | D830: 44.67 | E830: 46.29 | F830: 51.97 | H830: 55.61 | I830: 33.24 | J830: 63.33 | K830: 43.46 | L830: =(H830-I830)/I830 -> 0.67298435619735242 | M830: =(J830-H830)/J830 -> 0.12190115269224694 | N830: =(J830-K830)/K830 -> 0.45720202485043709 | P830: 50 | AA830: 3w | AB830: =(J830-P830)/J830 -> 0.21048476235591346 | AN830: 不宜入场（收缩幅度不够,应观察2w） | AO830: 44602 | AP830: 是
A831: 605050.SH | B831: 福然德 | C831: 0.58 | D831: 12.31 | E831: 12.45 | F831: 13.28 | H831: 13.01 | AN831: 不宜入场（当前股价小于50日均线,应观察1w） | AO831: 44602 | AP831: 是
A832: 605580.SH | B832: 恒盛能源 | C832: 0.58 | D832: 15.28 | E832: 15.67 | F832: 15.77 | H832: 14.37 | AN832: 不宜入场（当前股价小于200日均线,应观察3w） | AO832: 44602 | AP832: 是
A833: 603809.SH | B833: 豪能股份 | C833: 0.58 | D833: 17.81 | E833: 18.5 | F833: 20.15 | H833: 21.98 | I833: 11.99 | J833: 24.600000000000001 | K833: 16.02 | L833: =(H833-I833)/I833 -> 0.83319432860717269 | M833: =(J833-H833)/J833 -> 0.10650406504065044 | N833: =(J833-K833)/K833 -> 0.53558052434456938 | P833: 18.68 | Q833: 22 | R833: 18.88 | AA833: 8w | AB833: =(J833-P833)/J833 -> 0.24065040650406511 | AC833: =(Q833-R833)/Q833 -> 0.14181818181818187 | AN833: 不宜入场（收缩幅度不够,应观察1w） | AO833: 44602 | AP833: 是
A834: 000425.SZ | B834: 徐工机械 | C834: 0.58 | AP834: 否
A835: 002531.SZ | B835: 天顺风能 | C835: 0.58 | D835: 15.21 | E835: 16.28 | F835: 18.47 | H835: 19.42 | I835: 7.05 | J835: 23.67 | K835: 14.43 | L835: =(H835-I835)/I835 -> 1.7546099290780144 | M835: =(J835-H835)/J835 -> 0.17955217574989438 | N835: =(J835-K835)/K835 -> 0.64033264033264048 | P835: 16.05 | AA835: 12w | AB835: =(J835-P835)/J835 -> 0.32192648922686945 | AN835: 不宜入场（收缩幅度不够,应观察2w） | AO835: 44602 | AP835: 是
A836: 003016.SZ | B836: 欣贺股份 | C836: 0.58 | AP836: 否
A837: 000400.SZ | B837: 许继电气 | C837: 0.57 | D837: 20.600000000000001 | E837: 21.74 | F837: 25 | H837: 23.21 | AN837: 不宜入场（当前股价小于50日均线,应观察1w） | AO837: 44602 | AP837: 是
A838: 002106.SZ | B838: 莱宝高科 | C838: 0.57 | D838: 11.08 | E838: 11.03 | AN838: 不宜入场（150日均线小于200日均线,应观察6w） | AO838: 44602 | AP838: 是
A839: 600197.SH | B839: 伊力特 | C839: 0.57 | D839: 25.63 | E839: 25.84 | F839: 25.36 | AN839: 不宜入场（50日均线小于200日均线,应观察5w） | AO839: 44602 | AP839: 是
A840: 000050.SZ | B840: 深天马A | C840: 0.57 | AP840: 否
A841: 600422.SH | B841: 昆药集团 | C841: 0.57 | D841: 9.37 | E841: 9.49 | F841: 10.05 | H841: 10.52 | I841: 7.41 | J841: 13.199999999999999 | K841: 8.39 | L841: =(H841-I841)/I841 -> 0.41970310391363014 | M841: =(J841-H841)/J841 -> 0.20303030303030303 | N841: =(J841-K841)/K841 -> 0.57330154946364698 | P841: 9.41 | AA841: 3w | AB841: =(J841-P841)/J841 -> 0.28712121212121205 | AN841: 不宜入场（收缩幅度不够,应观察2w） | AO841: 44602 | AP841: 是
A842: 000683.SZ | B842: 远兴能源 | C842: 0.57 | D842: 7.1299999999999999 | E842: 7.5899999999999999 | F842: 8.3699999999999992 | H842: 10.24 | I842: 2.0099999999999998 | J842: 13.539999999999999 | K842: 6.9000000000000004 | L842: =(H842-I842)/I842 -> 4.0945273631840804 | M842: =(J842-H842)/J842 -> 0.24372230428360409 | N842: =(J842-K842)/K842 -> 0.96231884057970996 | P842: 6.4100000000000001 | Q842: 8.2899999999999991 | R842: 6.7400000000000002 | S842: 9.5700000000000003 | T842: 8.1999999999999993 | AA842: 13w | AB842: =(J842-P842)/J842 -> 0.52658788774002951 | AC842: =(Q842-R842)/Q842 -> 0.18697225572979481 | AD842: =(S842-T842)/S842 -> 0.1431556948798329 | AN842: 不宜入场（收缩幅度不够,应观察1w） | AO842: 44602 | AP842: 是
A843: 600406.SH | B843: 国电南瑞 | C843: 0.57 | D843: 34.32 | E843: 35.71 | F843: 38.43 | H843: 33.600000000000001 | AN843: 不宜入场（当前股价小于200日均线,应观察3w） | AO843: 44602 | AP843: 是
A844: 601187.SH | B844: 厦门银行 | C844: 0.57 | AP844: 否
A845: 601811.SH | B845: 新华文轩 | C845: 0.57 | AP845: 否
A846: 603456.SH | B846: 九洲药业 | C846: 0.57 | D846: 48.299999999999997 | E846: 49.299999999999997 | F846: 49.73 | H846: 40.200000000000003 | AN846: 不宜入场（当前股价小于200日均线,应观察3w） | AO846: 44602 | AP846: 是
A847: 603755.SH | B847: 日辰股份 | C847: 0.57 | AP847: 否
A848: 603810.SH | B848: 丰山集团 | C848: 0.57 | AP848: 否
A849: 605186.SH | B849: 健麾信息 | C849: 0.57 | D849: 34.83 | E849: 35.97 | F849: 36.92 | H849: 32.88 | AN849: 不宜入场（当前股价小于200日均线,应观察3w） | AO849: 44602 | AP849: 是
A850: 600282.SH | B850: 南钢股份 | C850: 0.57 | AP850: 否
A851: 000666.SZ | B851: 经纬纺机 | C851: 0.56 | D851: 8.37 | E851: 8.42 | F851: 8.57 | H851: 8.92 | I851: 6.64 | J851: 9.65 | K851: 7.82 | L851: =(H851-I851)/I851 -> 0.34337349397590367 | M851: =(J851-H851)/J851 -> 7.5647668393782425e-02 | N851: =(J851-K851)/K851 -> 0.2340153452685422 | P851: 7.67 | Q851: 9.12 | R851: 8.01 | S851: 9.13 | T851: 8.8000000000000007 | AA851: 13w | AB851: =(J851-P851)/J851 -> 0.2051813471502591 | AC851: =(Q851-R851)/Q851 -> 0.12171052631578942 | AD851: =(S851-T851)/S851 -> 3.6144578313253017e-02 | AJ851: 否 | AN851: 不宜入场（成交量行为不符合,应观察1w） | AO851: 44602 | AP851: 是
A852: 000725.SZ | B852: 京东方A | C852: 0.56 | AP852: 否
A853: 000938.SZ | B853: 紫光股份 | C853: 0.56 | AP853: 否
A854: 002191.SZ | B854: 劲嘉股份 | C854: 0.56 | D854: 12.78 | E854: 13.42 | F854: 15.77 | H854: 17.71 | I854: 8.95 | J854: 18.87 | K854: 13.75 | L854: =(H854-I854)/I854 -> 0.97877094972067069 | M854: =(J854-H854)/J854 -> 6.1473237943826184e-02 | N854: =(J854-K854)/K854 -> 0.37236363636363645 | P854: 16.48 | Q854: 18.16 | R854: 16.78 | AA854: 2w | AB854: =(J854-P854)/J854 -> 0.12665606783253844 | AC854: =(Q854-R854)/Q854 -> 7.5991189427312714e-02 | AI854: 是 | AJ854: 是 | AK854: 是 | AL854: 否 | AN854: 不宜入场（成交量行为不符合,应观察1w） | AO854: 44602 | AP854: 是
A855: 002312.SZ | B855: 川发龙蟒 | C855: 0.56 | D855: 12.25 | E855: 12.72 | F855: 12.79 | H855: 11.39 | AN855: 不宜入场（当前股价小于200日均线,应观察3w） | AO855: 44602 | AP855: 是
A856: 002973.SZ | B856: 侨银股份 | C856: 0.56 | AP856: 否
A857: 600757.SH | B857: 长江传媒 | C857: 0.56 | D857: 5.31 | E857: 5.34 | F857: 5.45 | H857: 5.77 | I857: 4.56 | J857: 6.06 | K857: 5.28 | L857: =(H857-I857)/I857 -> 0.26535087719298245 | M857: =(J857-H857)/J857 -> 4.7854785478547865e-02 | N857: =(J857-K857)/K857 -> 0.1477272727272726 | P857: 5.08 | AA857: 2w | AB857: =(J857-P857)/J857 -> 0.16171617161716165 | AN857: 不宜入场（收缩幅度不够,应观察1w） | AO857: 44602 | AP857: 是
A858: 600895.SH | B858: 张江高科 | C858: 0.56 | AP858: 否
A859: 601098.SH | B859: 中南传媒 | C859: 0.56 | D859: 9.26 | E859: 9.24 | AN859: 不宜入场（150日均线小于200日均线,应观察5w） | AO859: 44602 | AP859: 是
A860: 601818.SH | B860: 光大银行 | C860: 0.56 | AP860: 否
A861: 603080.SH | B861: 新疆火炬 | C861: 0.56 | D861: 15.32 | E861: 15.64 | F861: 16.33 | H861: 16.5 | I861: 9.41 | J861: 20.82 | K861: 13.23 | L861: =(H861-I861)/I861 -> 0.75345377258235913 | M861: =(J861-H861)/J861 -> 0.207492795389049 | N861: =(J861-K861)/K861 -> 0.57369614512471656 | P861: 14.35 | Q861: 18.37 | R861: 14.63 | AA861: 2w | AB861: =(J861-P861)/J861 -> 0.31075888568683963 | AC861: =(Q861-R861)/Q861 -> 0.20359281437125748 | AN861: 不宜入场（收缩幅度不够,应观察2w） | AO861: 44602 | AP861: 是
A862: 603108.SH | B862: 润达医疗 | C862: 0.56 | D862: 11.73 | E862: 11.84 | F862: 12.49 | H862: 11.41 | AN862: 不宜入场（当前股价小于200日均线,应观察3w） | AO862: 44602 | AP862: 是
A863: 605060.SH | B863: 联德股份 | C863: 0.56 | D863: 17.22 | E863: 17.29 | F863: 18.27 | H863: 20.44 | I863: 13.78 | J863: 22.12 | K863: 22.12 | L863: =(H863-I863)/I863 -> 0.48330914368650235 | M863: =(J863-H863)/J863 -> 7.5949367088607583e-02 | N863: =(J863-K863)/K863 -> 0 | P863: 13.78 | Q863: 18.25 | R863: 15.83 | S863: 18.600000000000001 | T863: 16.16 | U863: 20.82 | V863: 18.57 | AA863: 2w | AB863: =(J863-P863)/J863 -> 0.37703435804701635 | AC863: =(Q863-R863)/Q863 -> 0.1326027397260274 | AD863: =(S863-T863)/S863 -> 0.1311827956989248 | AE863: =(U863-V863)/U863 -> 0.10806916426512968 | AN863: 不宜入场（收缩幅度不够,应观察2w） | AO863: 44602 | AP863: 是
A864: 605298.SH | B864: 必得科技 | C864: 0.56 | AP864: 否
A865: 601200.SH | B865: 上海环境 | C865: 0.56 | D865: 11.91 | E865: 12.01 | F865: 12.19 | H865: 12.12 | AN865: 不宜入场（当前股价小于50日均线,应观察1w） | AO865: 44602 | AP865: 是
A866: 600487.SH | B866: 亨通光电 | C866: 0.56 | D866: 13.92 | E866: 14.23 | F866: 14.78 | H866: 14.18 | AN866: 不宜入场（当前股价小于150日均线,应观察2w） | AO866: 44602 | AP866: 是
A867: 002105.SZ | B867: 信隆健康 | C867: 0.56 | D867: 9.09 | E867: 9.24 | F867: 9.71 | H867: 10.13 | I867: 6.41 | J867: 11.28 | K867: 9.14 | L867: =(H867-I867)/I867 -> 0.58034321372854925 | M867: =(J867-H867)/J867 -> 0.10195035460992896 | N867: =(J867-K867)/K867 -> 0.23413566739606112 | P867: 8.89 | AA867: 3w | AB867: =(J867-P867)/J867 -> 0.21187943262411338 | AN867: 不宜入场（收缩幅度不够,应观察2w） | AO867: 44602 | AP867: 是
A868: 600711.SH | B868: 盛屯矿业 | C868: 0.56 | D868: 9.71 | E868: 10.05 | F868: 10.36 | H868: 9.88 | AN868: 不宜入场（当前股价小于150日均线,应观察2w） | AO868: 44602 | AP868: 是
A869: 603982.SH | B869: 泉峰汽车 | C869: 0.55 | D869: 28.81 | E869: 31.09 | F869: 37.200000000000003 | H869: 30.600000000000001 | AN869: 不宜入场（当前股价小于150日均线,应观察2w） | AO869: 44602 | AP869: 是
A870: 002649.SZ | B870: 博彦科技 | C870: 0.55 | D870: 11.37 | E870: 11.61 | F870: 12.51 | H870: 13.84 | I870: 8.22 | J870: 14.9 | K870: 11.99 | L870: =(H870-I870)/I870 -> 0.6836982968369828 | M870: =(J870-H870)/J870 -> 7.1140939597315461e-02 | N870: =(J870-K870)/K870 -> 0.2427022518765638 | P870: 11.55 | AA870: 3w | AB870: =(J870-P870)/J870 -> 0.22483221476510065 | AN870: 不宜入场（收缩幅度不够,应观察2w） | AO870: 44602 | AP870: 是
A871: 603588.SH | B871: 高能环境 | C871: 0.55 | D871: 16.09 | E871: 16.23 | F871: 16.58 | H871: 17.14 | I871: 9.45 | J871: 20 | K871: 15.25 | L871: =(H871-I871)/I871 -> 0.8137566137566139 | M871: =(J871-H871)/J871 -> 0.14299999999999996 | N871: =(J871-K871)/K871 -> 0.31147540983606559 | P871: 14.33 | Q871: 18.03 | R871: 15.61 | AA871: 2w | AB871: =(J871-P871)/J871 -> 0.28349999999999997 | AC871: =(Q871-R871)/Q871 -> 0.13422074320576824 | AN871: 不宜入场（收缩幅度不够,应观察1w） | AO871: 44602 | AP871: 是
A872: 002576.SZ | B872: 通达动力 | C872: 0.55 | D872: 14.76 | E872: 15.29 | F872: 15.99 | H872: 14.53 | AN872: 不宜入场（当前股价小于200日均线,应观察3w） | AO872: 44602 | AP872: 是
A873: 002497.SZ | B873: 雅化集团 | C873: 0.55 | AP873: 否
A874: 600460.SH | B874: 士兰微 | C874: 0.55 | D874: 51.88 | E874: 53.97 | F874: 54.28 | H874: 52.94 | AN874: 不宜入场（当前股价小于150日均线,应观察2w） | AO874: 44602 | AP874: 是
A875: 000823.SZ | B875: 超声电子 | C875: 0.55 | D875: 11.95 | E875: 12.19 | F875: 12.72 | H875: 12.13 | AN875: 不宜入场（当前股价小于150日均线,应观察2w） | AO875: 44602 | AP875: 是
A876: 603327.SH | B876: 福蓉科技 | C876: 0.55 | AP876: 否
A877: 000550.SZ | B877: 江铃汽车 | C877: 0.55 | AP877: 否
A878: 000635.SZ | B878: 英力特 | C878: 0.55 | AP878: 否
A879: 002144.SZ | B879: 宏达高科 | C879: 0.55 | D879: 9.59 | E879: 9.68 | F879: 9.89 | H879: 9.9000000000000004 | I879: 8.4000000000000004 | J879: 10.93 | K879: 9.54 | L879: =(H879-I879)/I879 -> 0.17857142857142858 | M879: =(J879-H879)/J879 -> 9.4236047575480278e-02 | N879: =(J879-K879)/K879 -> 0.14570230607966464 | AN879: 不宜入场（当前股价距离最低点距离过小,应观察2w） | AO879: 44602 | AP879: 是
A880: 002443.SZ | B880: 金洲管道 | C880: 0.55 | D880: 6.79 | E880: 6.92 | F880: 7.76 | H880: 8.58 | I880: 5.42 | J880: 10.14 | K880: 5.73 | L880: =(H880-I880)/I880 -> 0.58302583025830257 | M880: =(J880-H880)/J880 -> 0.15384615384615388 | N880: =(J880-K880)/K880 -> 0.76963350785340312 | P880: 7.38 | AA880: 3w | AB880: =(J880-P880)/J880 -> 0.27218934911242609 | AN880: 不宜入场（收缩幅度不够,应观察2w） | AO880: 44602 | AP880: 是
A881: 600363.SH | B881: 联创光电 | C881: 0.55 | D881: 28.87 | E881: 29.37 | F881: 29.03 | AN881: 不宜入场（50日均线小于150日均线,应观察4w） | AO881: 44602 | AP881: 是
A882: 601117.SH | B882: 中国化学 | C882: 0.55 | D882: 10.06 | E882: 10.51 | F882: 11.16 | H882: 10.85 | AN882: 不宜入场（当前股价小于50日均线,应观察1w） | AO882: 44602 | AP882: 是
A883: 601138.SH | B883: 工业富联 | C883: 0.55 | AP883: 否
A884: 603219.SH | B884: 富佳股份 | C884: 0.55 | D884: 16.31 | E884: 16.86 | F884: 18.51 | H884: 17.27 | AN884: 不宜入场（当前股价小于50日均线,应观察1w） | AO884: 44602 | AP884: 是
A885: 603238.SH | B885: 诺邦股份 | C885: 0.55 | AP885: 否
A886: 603505.SH | B886: 金石资源 | C886: 0.55 | D886: 33.68 | E886: 35.33 | F886: 36.14 | H886: 35.100000000000001 | AN886: 不宜入场（当前股价小于150日均线,应观察2w） | AO886: 44602 | AP886: 是
A887: 603856.SH | B887: 东宏股份 | C887: 0.55 | D887: 12.89 | E887: 13.04 | F887: 14.16 | H887: 15.95 | I887: 10.72 | J887: 17.5 | K887: 12.22 | L887: =(H887-I887)/I887 -> 0.48787313432835805 | M887: =(J887-H887)/J887 -> 8.8571428571428606e-02 | N887: =(J887-K887)/K887 -> 0.43207855973813414 | AN887: 不宜入场（收缩幅度不够,应观察2w） | AO887: 44602 | AP887: 是
A888: 605133.SH | B888: 嵘泰股份 | C888: 0.55 | D888: 24.19 | E888: 24.47 | F888: 26.54 | H888: 23.98 | AN888: 不宜入场（当前股价小于200日均线,应观察3w） | AO888: 44602 | AP888: 是
A889: 605378.SH | B889: 野马电池 | C889: 0.55 | AP889: 否
A890: 600897.SH | B890: 厦门空港 | C890: 0.55 | AP890: 否
A891: 600180.SH | B891: 瑞茂通 | C891: 0.55 | D891: 6.24 | E891: 6.41 | F891: 6.95 | H891: 7.72 | I891: 4.72 | J891: 8.27 | K891: 6.28 | L891: =(H891-I891)/I891 -> 0.63559322033898313 | M891: =(J891-H891)/J891 -> 6.6505441354292608e-02 | N891: =(J891-K891)/K891 -> 0.31687898089171962 | P891: 6.39 | AA891: 1w | AB891: =(J891-P891)/J891 -> 0.22732769044740023 | AN891: 不宜入场（收缩幅度不够,应观察2w） | AO891: 44602 | AP891: 是
A892: 000411.SZ | B892: 英特集团 | C892: 0.55 | D892: 13.31 | E892: 13.37 | F892: 13.76 | H892: 13.21 | AN892: 不宜入场（当前股价小于200日均线,应观察3w） | AO892: 44602 | AP892: 是
A893: 002056.SZ | B893: 横店东磁 | C893: 0.54 | D893: 15.91 | E893: 16.27 | F893: 17.21 | H893: 16.61 | AN893: 不宜入场（当前股价小于50日均线,应观察1w） | AO893: 44602 | AP893: 是
A894: 000987.SZ | B894: 越秀金控 | C894: 0.54 | AP894: 否
A895: 002020.SZ | B895: 京新药业 | C895: 0.54 | D895: 8.78 | E895: 8.75 | AN895: 不宜入场（150日均线小于200日均线,应观察6w） | AO895: 44602 | AP895: 是
A896: 002393.SZ | B896: 力生制药 | C896: 0.54 | D896: 19.82 | E896: 19.94 | F896: 20.55 | H896: 21.75 | I896: 16.36 | J896: 22.38 | K896: 18.27 | L896: =(H896-I896)/I896 -> 0.32946210268948661 | M896: =(J896-H896)/J896 -> 2.8150134048257329e-02 | N896: =(J896-K896)/K896 -> 0.22495894909688011 | P896: 19.62 | AA896: 3w | AB896: =(J896-P896)/J896 -> 0.12332439678284174 | AN896: 不宜入场（收缩幅度不够,应观察1w） | AO896: 44602 | AP896: 是
A897: 002643.SZ | B897: 万润股份 | C897: 0.54 | D897: 20.39 | E897: 20.99 | F897: 22.26 | H897: 21.19 | AN897: 不宜入场（当前股价小于150日均线,应观察2w） | AO897: 44602 | AP897: 是
A898: 002802.SZ | B898: 洪汇新材 | C898: 0.54 | AP898: 否
A899: 002829.SZ | B899: 星网宇达 | C899: 0.54 | D899: 35.59 | E899: 36.16 | F899: 38.53 | H899: 40.71 | I899: 28.81 | J899: 42.799999999999997 | K899: 36.24 | L899: =(H899-I899)/I899 -> 0.41305102395001747 | M899: =(J899-H899)/J899 -> 4.8831775700934499e-02 | N899: =(J899-K899)/K899 -> 0.18101545253863122 | P899: 37.98 | AA899: 2w | AB899: =(J899-P899)/J899 -> 0.11261682242990656 | AN899: 不宜入场（收缩幅度不够,应观察1w） | AO899: 44602 | AP899: 是
A900: 002839.SZ | B900: 张家港行 | C900: 0.54 | D900: 5.78 | E900: 5.85 | F900: 6.0999999999999996 | H900: 6.57 | I900: 5.19 | J900: 6.75 | K900: 5.77 | L900: =(H900-I900)/I900 -> 0.26589595375722541 | M900: =(J900-H900)/J900 -> 2.6666666666666623e-02 | N900: =(J900-K900)/K900 -> 0.16984402079722713 | P900: 6.17 | AA900: 2w | AB900: =(J900-P900)/J900 -> 8.5925925925925933e-02 | AN900: 不宜入场（收缩幅度不够,应观察1w） | AO900: 44602 | AP900: 是
A901: 002926.SZ | B901: 华西证券 | C901: 0.54 | AP901: 否
A902: 600848.SH | B902: 上海临港 | C902: 0.54 | AP902: 否
A903: 601339.SH | B903: 百隆东方 | C903: 0.54 | AP903: 是
A904: 601633.SH | B904: 长城汽车 | C904: 0.54 | AP904: 否
A905: 603358.SH | B905: 华达科技 | C905: 0.54 | AP905: 是
A906: 603848.SH | B906: 好太太 | C906: 0.54 | AP906: 是
A907: 600639.SH | B907: 浦东金桥 | C907: 0.54 | AP907: 是
A908: 002156.SZ | B908: 通富微电 | C908: 0.53 | AP908: 否
A909: 600901.SH | B909: 江苏租赁 | C909: 0.53 | AP909: 否
A910: 601019.SH | B910: 山东出版 | C910: 0.53 | AP910: 是
A911: 601988.SH | B911: 中国银行 | C911: 0.53 | AP911: 否
A912: 603600.SH | B912: 永艺股份 | C912: 0.53 | AP912: 是
A913: 603685.SH | B913: 晨丰科技 | C913: 0.53 | AP913: 否
A914: 002081.SZ | B914: 金螳螂 | C914: 0.53 | AP914: 否
A915: 002581.SZ | B915: 未名医药 | C915: 0.53 | AP915: 是
A916: 002394.SZ | B916: 联发股份 | C916: 0.53 | AP916: 否
A917: 601377.SH | B917: 兴业证券 | C917: 0.53 | AP917: 否
A918: 002815.SZ | B918: 崇达技术 | C918: 0.52 | AP918: 是
A919: 600368.SH | B919: 五洲交通 | C919: 0.52 | AP919: 是
A920: 000686.SZ | B920: 东北证券 | C920: 0.52 | AP920: 是
A921: 002003.SZ | B921: 伟星股份 | C921: 0.52 | AP921: 是
A922: 002996.SZ | B922: 顺博合金 | C922: 0.52 | AP922: 否
A923: 600802.SH | B923: 福建水泥 | C923: 0.52 | AP923: 否
A924: 600867.SH | B924: 通化东宝 | C924: 0.52 | AP924: 否
A925: 603128.SH | B925: 华贸物流 | C925: 0.52 | AP925: 否
A926: 603278.SH | B926: 大业股份 | C926: 0.52 | AP926: 是
A927: 603518.SH | B927: 锦泓集团 | C927: 0.52 | AP927: 否
A928: 603992.SH | B928: 松霖科技 | C928: 0.52 | AP928: 否
A929: 605598.SH | B929: 上海港湾 | C929: 0.52 | AP929: 否
A930: 002950.SZ | B930: 奥美医疗 | C930: 0.52 | AP930: 否
A931: 603966.SH | B931: 法兰泰克 | C931: 0.52 | AP931: 否
A932: 600590.SH | B932: 泰豪科技 | C932: 0.52 | AP932: 是
A933: 600380.SH | B933: 健康元 | C933: 0.52 | AP933: 否
A934: 600580.SH | B934: 卧龙电驱 | C934: 0.51 | AP934: 是
A935: 002135.SZ | B935: 东南网架 | C935: 0.51 | AP935: 是
A936: 002234.SZ | B936: 民和股份 | C936: 0.51 | AP936: 是
A937: 002275.SZ | B937: 桂林三金 | C937: 0.51 | AP937: 是
A938: 002728.SZ | B938: 特一药业 | C938: 0.51 | AP938: 是
A939: 601231.SH | B939: 环旭电子 | C939: 0.51 | AP939: 否
A940: 601238.SH | B940: 广汽集团 | C940: 0.51 | AP940: 是
A941: 601965.SH | B941: 中国汽研 | C941: 0.51 | AP941: 是
A942: 603811.SH | B942: 诚意药业 | C942: 0.51 | AP942: 否
A943: 605011.SH | B943: 杭州热电 | C943: 0.51 | AP943: 是
A944: 605183.SH | B944: 确成股份 | C944: 0.51 | AP944: 是
A945: 600109.SH | B945: 国金证券 | C945: 0.51 | AP945: 否
A946: 000930.SZ | B946: 中粮科技 | C946: 0.51 | AP946: 是
A947: 600018.SH | B947: 上港集团 | C947: 0.51 | AP947: 是
A948: 002270.SZ | B948: 华明装备 | C948: 0.51 | AP948: 是
A949: 601882.SH | B949: 海天精工 | C949: 0.5 | AP949: 是
A950: 603020.SH | B950: 爱普股份 | C950: 0.5 | AP950: 否
A951: 000860.SZ | B951: 顺鑫农业 | C951: 0.5 | AP951: 否
A952: 000042.SZ | B952: 中洲控股 | C952: 0.5 | AP952: 否