A1: 股票代码 | B1: 股票简称 | C1: 区间涨跌幅:前复权(%)2020.12.29-2021.12.28 | D1: 基本每股收(元)2021.09.30 | E1: 行业 | F1: 当前基底处于上升趋势的位置(即处于第几个基底) | G1: 趋势 | R1: 波动收缩幅度 | AK1: 成交量行为 | AM1: 价格行为(得分应大于60%) | AP1: 结论 | AQ1: 更新时间 | AR1: 标签
G2: 200日均线 | H2: 150日均线 | I2: 50日均线 | J2: 各均线斜率是否朝上 | K2: 当前股价 | L2: 52周内最低点 | M2: 52周内最高点 | N2: 最高点前8周收盘价 | O2: 当前股价相对于最低点百分比(至少高出25%) | P2: 当前股价相对于最高点百分比(25%内最好) | Q2: 最高点前8周股价相对于最高点百分比 | R2: 技术足迹 | AK2: 不同收盘表现时交易量情况(好的收盘时，交易量是否增大，坏的收盘时，交易量是否萎缩) | AL2: 成交量收缩情况(最后的价格收缩期间的成交量应低于50天的平均水平且有一到两天交易量极低) | AM2: 支撑位和压力位是否同步升高(40%) | AN2: 是否有网球行为出现(40%) | AO2: 上涨天数是否大于下跌天数(20%)
R3: 支撑位1 | S3: 阻力位2 | T3: 支撑位2 | U3: 阻力位3 | V3: 支撑位3 | W3: 阻力位4 | X3: 支撑位4 | Y3: 阻力位5 | Z3: 支撑位5 | AA3: 阻力位6 | AB3: 支撑位6 | AC3: 时间周期 | AD3: 收缩量1 | AE3: 收缩量2 | AF3: 收缩量3 | AG3: 收缩量4 | AH3: 收缩量5 | AI3: 收缩量6 | AJ3: 收缩数量(至少大于3T)
A4: 600071 | B4: 凤凰光学 | D4: 3.6700000000000003e-02 | E4: 光学光电子 | G4: 30 | H4: 33.530000000000001 | I4: 47.619999999999997 | K4: 55.5 | L4: 12.41 | M4: 61.579999999999998 | N4: 16.940000000000001 | O4: =(K4-L4)/L4 -> 3.4721998388396456 | P4: =(M4-K4)/M4 -> 9.8733354985384839e-02 | Q4: =(M4-N4)/N4 -> 2.6351829988193622 | R4: 47.969999999999999 | S4: 56.5 | T4: 47.979999999999997 | U4: 56.82 | V4: 50.799999999999997 | AC4: 5w | AD4: =(M4-R4)/M4 -> 0.22101331601169211 | AE4: =(S4-T4)/S4 -> 0.15079646017699119 | AF4: =(U4-V4)/U4 -> 0.10594860964449143 | AP4: 暂不宜入场（收缩幅度不够，应继续观察1w） | AQ4: 44560
A5: 603297 | B5: 永新光学 | C5: 201.83 | D5: 1.97 | E5: 光学光电子 | G5: 65.859999999999999 | H5: 70.349999999999994 | I5: 88.370000000000005 | K5: 104.27 | L5: 36.710000000000001 | M5: 116.84 | N5: 56.649999999999999 | O5: =(K5-L5)/L5 -> 1.8403704712612368 | P5: =(M5-K5)/M5 -> 0.10758301951386517 | Q5: =(M5-N5)/N5 -> 1.0624889673433364 | R5: 92.5 | S5: 110.42 | T5: 101.5 | U5: 129.19999999999999 | V5: 120.2 | AC5: 2w | AD5: =(M5-R5)/M5 -> 0.2083190688120507 | AE5: =(S5-T5)/S5 -> 8.0782466944394143e-02 | AF5: =(U5-V5)/U5 -> 6.9659442724458107e-02 | AG5: =(W5-X5)/W5 -> #DIV/0! | AH5: =(Y5-Z5)/Y5 -> #DIV/0! | AP5: 暂不宜入场（收缩幅度不够，应继续观察1w） | AQ5: 44560
A6: 603985 | B6: 恒润股份 | C6: 81.5 | D6: 1.27 | E6: 电力设备 | G6: 32.450000000000003 | H6: 35.340000000000003 | I6: 46.530000000000001 | K6: 49.390000000000001 | L6: 15.01 | M6: 57.710000000000001 | N6: 26.449999999999999 | O6: =(K6-L6)/L6 -> 2.2904730179880084 | P6: =(M6-K6)/M6 -> 0.14416912146941605 | Q6: =(M6-N6)/N6 -> 1.1818525519848773 | R6: 44 | S6: 55.5 | T6: 46.259999999999998 | U6: 55.299999999999997 | V6: 48.149999999999999 | AC6: 5w | AD6: =(M6-R6)/M6 -> 0.23756714607520363 | AE6: =(S6-T6)/S6 -> 0.16648648648648653 | AF6: =(U6-V6)/U6 -> 0.12929475587703435 | AP6: 暂不宜入场（收缩幅度不够，应继续观察1w） | AQ6: 44560
A7: 603197.SH | B7: 保隆科技 | C7: 109.17 | D7: 1.2 | E7: 汽车零部件 | G7: 35.310000000000002 | H7: 37.299999999999997 | I7: 46.289999999999999 | K7: 66.129999999999995 | L7: 22.620000000000001 | M7: 60.32 | N7: 26.399999999999999 | O7: =(K7-L7)/L7 -> 1.9235190097259058 | P7: =(M7-K7)/M7 -> -9.6319628647214772e-02 | Q7: =(M7-N7)/N7 -> 1.2848484848484849 | R7: 50.850000000000001 | S7: 69.489999999999995 | T7: 56.609999999999999 | AC7: 2w | AD7: =(M7-R7)/M7 -> 0.15699602122015913 | AE7: =(S7-T7)/S7 -> 0.18535041013095405 | AP7: 暂不宜入场（收缩幅度不够，应继续观察1w） | AQ7: 44560
A8: 603192.SH | B8: 汇得科技 | C8: 147.86 | D8: 0.85 | E8: 化学制品 | F8: 1 | G8: 30.940000000000001 | H8: 33 | I8: 43.049999999999997 | K8: 59.460000000000001 | L8: 20.969999999999999 | M8: 60.719999999999999 | N8: 26.559999999999999 | O8: =(K8-L8)/L8 -> 1.8354792560801148 | P8: =(M8-K8)/M8 -> 2.0750988142292457e-02 | Q8: =(M8-N8)/N8 -> 1.286144578313253 | R8: 53.560000000000002 | AC8: 1w | AD8: =(M8-R8)/M8 -> 0.11791831357048743 | AP8: 暂不宜入场（收缩幅度不够，应继续观察1w） | AQ8: 44560
A9: 605123.SH | B9: 派克新材 | C9: 61.78 | D9: 1.77 | E9: 国防军工 | G9: 94.790000000000006 | H9: 100.09999999999999 | I9: 122.19 | K9: 142.47 | L9: 61.549999999999997 | M9: 159 | N9: 83.180000000000007 | O9: =(K9-L9)/L9 -> 1.3147034930950448 | P9: =(M9-K9)/M9 -> 0.10396226415094341 | Q9: =(M9-N9)/N9 -> 0.91151719163260381 | R9: 128.47 | AC9: 2w | AD9: =(M9-R9)/M9 -> 0.19201257861635221 | AE9: =(S9-T9)/S9 -> #DIV/0! | AG9: =(W9-X9)/W9 -> #DIV/0! | AH9: =(Y9-Z9)/Y9 -> #DIV/0! | AP9: 不宜入场（收缩量不够，应再观察1w） | AQ9: 44556
A10: 603606.SH | B10: 东方电缆 | C10: 87.88 | D10: 1.47 | E10: 电力设备 | G10: 33.259999999999998 | H10: 35.909999999999997 | I10: 47.210000000000001 | K10: 50.340000000000003 | L10: 18.510000000000002 | M10: 63.75 | N10: 31.57 | O10: =(K10-L10)/L10 -> 1.719611021069692 | P10: =(M10-K10)/M10 -> 0.21035294117647055 | Q10: =(M10-N10)/N10 -> 1.0193221412733608 | R10: 45.32 | AC10: 4w | AD10: =(M10-R10)/M10 -> 0.28909803921568628 | AE10: =(S10-T10)/S10 -> #DIV/0! | AF10: =(U10-V10)/U10 -> #DIV/0! | AJ10: 1T | AP10: 不宜入场(有强力拉升的潜力，但收缩幅度不够，应该持续观察2个w) | AQ10: 44560
A11: 603982.SH | B11: 泉峰汽车 | C11: 131.19 | D11: 0.55 | G11: 26.489999999999998 | H11: 28.890000000000001 | I11: 39.18 | K11: 44.399999999999999 | L11: 14.699999999999999 | M11: 51.810000000000002 | N11: 27.460000000000001 | O11: =(K11-L11)/L11 -> 2.0204081632653064 | P11: =(M11-K11)/M11 -> 0.14302258251302843 | Q11: =(M11-N11)/N11 -> 0.88674435542607433 | R11: 43.390000000000001 | AC11: 1w | AD11: =(M11-R11)/M11 -> 0.16251688863153835
A12: 002118 | B12: 紫鑫药业 | G12: 2.8599999999999999 | H12: 2.8399999999999999 | I12: 2.96 | AQ12: 44570
A13: 600262 | B13: 北方股份 | G13: 16.129999999999999 | H13: 16.530000000000001 | I13: 19.329999999999998 | K13: 25.539999999999999 | L13: 12.42 | M13: 28.379999999999999 | N13: 13.880000000000001 | O13: =(K13-L13)/L13 -> 1.0563607085346216 | P13: =(M13-K13)/M13 -> 0.10007047216349542 | Q13: =(M13-N13)/N13 -> 1.0446685878962534 | R13: 25.539999999999999 | AC13: 1w | AD13: =(M13-R13)/M13 -> 0.10007047216349542 | AQ13: 44570
A14: 600479 | B14: 千金药业 | G14: 9.1799999999999997 | H14: 9.4600000000000009 | I14: 10.82 | K14: 13.859999999999999 | L14: 7.3899999999999997 | M14: 16 | N14: 8.3399999999999999 | O14: =(K14-L14)/L14 -> 0.87550744248985113 | P14: =(M14-K14)/M14 -> 0.13375000000000004 | Q14: =(M14-N14)/N14 -> 0.91846522781774587 | AD14: =(M14-R14)/M14 -> 1 | AQ14: 44570
A15: 002354 | B15: 天神娱乐 | G15: 3.5699999999999998 | H15: 3.7200000000000002 | I15: 4.4299999999999997 | K15: 6.0700000000000003 | L15: 2.3300000000000001 | M15: 7.1699999999999999 | N15: 3.5299999999999998 | O15: =(K15-L15)/L15 -> 1.6051502145922747 | P15: =(M15-K15)/M15 -> 0.15341701534170149 | Q15: =(M15-N15)/N15 -> 1.0311614730878187 | R15: 5.9900000000000002 | AC15: 1w | AD15: =(M15-R15)/M15 -> 0.1645746164574616 | AQ15: 44570
A16: 603311 | B16: 金海高科 | G16: 10.93 | H16: 10.93 | I16: 11.550000000000001 | K16: 14.34 | L16: 9.2200000000000006 | M16: 16.670000000000002 | N16: 9.6600000000000001 | O16: =(K16-L16)/L16 -> 0.55531453362255956 | P16: =(M16-K16)/M16 -> 0.13977204559088191 | Q16: =(M16-N16)/N16 -> 0.72567287784679102 | AQ16: 44570
A17: 002486 | B17: 嘉麟杰 | G17: 2.7799999999999998 | H17: 2.7599999999999998 | AQ17: 44570
A18: 603363 | B18: 傲农生物 | G18: 11.07 | H18: 10.949999999999999 | AQ18: 44570
A19: 600986 | B19: 浙文互联 | G19: 4.7999999999999998 | H19: 4.9800000000000004 | I19: 5.9199999999999999 | K19: 8.3699999999999992 | L19: 3.6699999999999999 | M19: 9.7200000000000006 | N19: 4.6600000000000001 | O19: =(K19-L19)/L19 -> 1.2806539509536783 | P19: =(M19-K19)/M19 -> 0.13888888888888903 | Q19: =(M19-N19)/N19 -> 1.0858369098712448 | R19: 7.9699999999999998 | AC19: 1w | AD19: =(M19-R19)/M19 -> 0.18004115226337455 | AQ19: 44570
A20: 000607 | B20: 华媒控股 | G20: 3.9300000000000002 | H20: 3.9900000000000002 | I20: 4.3899999999999997 | K20: 5.7800000000000002 | L20: 3.2799999999999998 | M20: 6.5999999999999996 | N20: 3.96 | O20: =(K20-L20)/L20 -> 0.76219512195121975 | P20: =(M20-K20)/M20 -> 0.12424242424242415 | Q20: =(M20-N20)/N20 -> 0.66666666666666663 | AQ20: 44570
A21: 002059 | B21: 云南旅游 | G21: 5.2999999999999998 | H21: 5.2599999999999998 | AQ21: 44570
A22: 002840 | B22: 华统股份 | G22: 11.1 | H22: 11.43 | I22: 13.52 | K22: 18.07 | L22: 8.1199999999999992 | M22: 20.149999999999999 | N22: 10.130000000000001 | O22: =(K22-L22)/L22 -> 1.225369458128079 | P22: =(M22-K22)/M22 -> 0.10322580645161282 | Q22: =(M22-N22)/N22 -> 0.98914116485686054 | AQ22: 44570
A23: 002873 | B23: 新天药业 | G23: 13.56 | H23: 13.98 | I23: 16.02 | K23: 22.18 | L23: 10.59 | M23: 24.199999999999999 | N23: 13.390000000000001 | O23: =(K23-L23)/L23 -> 1.0944287063267233 | P23: =(M23-K23)/M23 -> 8.347107438016528e-02 | Q23: =(M23-N23)/N23 -> 0.80731889469753537 | AQ23: 44570
A24: 600129 | B24: 太极集团 | G24: 16.460000000000001 | H24: 16.780000000000001 | I24: 18.210000000000001 | K24: 24.289999999999999 | L24: 12.98 | M24: 27.18 | N24: 15.390000000000001 | O24: =(K24-L24)/L24 -> 0.87134052388289662 | P24: =(M24-K24)/M24 -> 0.1063281824871229 | Q24: =(M24-N24)/N24 -> 0.76608187134502914 | AQ24: 44570
A25: 000819 | B25: 岳阳兴长 | G25: 8.6300000000000008 | H25: 9.2300000000000004 | I25: 12.470000000000001 | K25: 18.800000000000001 | L25: 5.8700000000000001 | M25: 24.530000000000001 | N25: 7.1200000000000001 | O25: =(K25-L25)/L25 -> 2.2027257240204428 | P25: =(M25-K25)/M25 -> 0.23359152058703628 | Q25: =(M25-N25)/N25 -> 2.4452247191011236 | R25: 18.800000000000001 | AC25: 1w | AD25: =(M25-R25)/M25 -> 0.23359152058703628 | AQ25: 44570
A26: 000558 | B26: 莱茵体育 | G26: 3.3100000000000001 | H26: 3.3500000000000001 | I26: 3.6299999999999999 | K26: 4.7599999999999998 | L26: 2.48 | M26: 5.6399999999999997 | N26: 3.5099999999999998 | O26: =(K26-L26)/L26 -> 0.91935483870967738 | P26: =(M26-K26)/M26 -> 0.15602836879432624 | Q26: =(M26-N26)/N26 -> 0.60683760683760679 | AQ26: 44570
A27: 000999 | B27: 华润三九 | G27: 26.48 | H27: 26.82 | I27: 28.77 | K27: 37.950000000000003 | L27: 23.23 | M27: 41.18 | N27: 23.91 | O27: =(K27-L27)/L27 -> 0.63366336633663378 | P27: =(M27-K27)/M27 -> 7.8436134045653153e-02 | Q27: =(M27-N27)/N27 -> 0.72229192806357168 | AQ27: 44570
A28: 601107 | B28: 四川成渝 | G28: 3.5299999999999998 | H28: 3.6299999999999999 | I28: 4.1699999999999999 | K28: 5.4800000000000004 | L28: 2.7000000000000002 | M28: 5.96 | N28: 3.6099999999999999 | O28: =(K28-L28)/L28 -> 1.0296296296296297 | P28: =(M28-K28)/M28 -> 8.0536912751677778e-02 | Q28: =(M28-N28)/N28 -> 0.65096952908587258 | AQ28: 44570
A29: 000719 | B29: 中原传媒 | G29: 7.0499999999999998 | H29: 7.1100000000000003 | I29: 7.4900000000000002 | K29: 10.140000000000001 | L29: 6.1699999999999999 | M29: 10.199999999999999 | N29: 6.9699999999999998 | O29: =(K29-L29)/L29 -> 0.64343598055105355 | P29: =(M29-K29)/M29 -> 5.8823529411763456e-03 | Q29: =(M29-N29)/N29 -> 0.46341463414634143 | AQ29: 44570
A30: 000503 | B30: 国新健康 | G30: 8.5800000000000001 | H30: 8.9900000000000002 | I30: 11.73 | K30: 19.34 | L30: 5.9000000000000004 | M30: 21.559999999999999 | N30: 5.9900000000000002 | O30: =(K30-L30)/L30 -> 2.2779661016949149 | P30: =(M30-K30)/M30 -> 0.1029684601113172 | Q30: =(M30-N30)/N30 -> 2.5993322203672786 | R30: 19.34 | AC30: 1w | AD30: =(M30-R30)/M30 -> 0.1029684601113172 | AQ30: 44570
A31: 002432 | B31: 九安医疗 | G31: 14.220000000000001 | H31: 16.059999999999999 | I31: 27.48 | K31: 50.5 | L31: 5.7999999999999998 | M31: 59 | N31: 6.0300000000000002 | O31: =(K31-L31)/L31 -> 7.7068965517241388 | P31: =(M31-K31)/M31 -> 0.1440677966101695 | Q31: =(M31-N31)/N31 -> 8.7844112769485907 | R31: 44.82 | AC31: 1w | AD31: =(M31-R31)/M31 -> 0.24033898305084744 | AQ31: 44570
A32: 603123 | B32: 翠微股份 | G32: 7.1799999999999997 | H32: 7.25 | I32: 7.8200000000000003 | K32: 11.949999999999999 | L32: 5.9199999999999999 | M32: 11.949999999999999 | N32: 6.7999999999999998 | O32: =(K32-L32)/L32 -> 1.0185810810810809 | P32: =(M32-K32)/M32 -> 0 | Q32: =(M32-N32)/N32 -> 0.75735294117647056 | AQ32: 44570
B33: 博瑞传播 | G33: 4.1100000000000003 | H33: 4.1900000000000004 | I33: 4.9400000000000004 | K33: 7.1699999999999999 | L33: 3.21 | M33: 9.0899999999999999 | N33: 3.6899999999999999 | O33: =(K33-L33)/L33 -> 1.233644859813084 | P33: =(M33-K33)/M33 -> 0.21122112211221122 | Q33: =(M33-N33)/N33 -> 1.4634146341463417 | R33: 7.1699999999999999 | AC33: 1w | AD33: =(M33-R33)/M33 -> 0.21122112211221122 | AQ33: 44570
B34: 西陇科学 | G34: 6.8099999999999996 | H34: 7.04 | I34: 8.0899999999999999 | K34: 9.6199999999999992 | L34: 4.9500000000000002 | M34: 12.449999999999999 | N34: 5.7999999999999998 | O34: =(K34-L34)/L34 -> 0.94343434343434318 | P34: =(M34-K34)/M34 -> 0.22730923694779118 | Q34: =(M34-N34)/N34 -> 1.146551724137931 | R34: 9.5099999999999998 | AC34: 1w | AD34: =(M34-R34)/M34 -> 0.23614457831325297 | AQ34: 44570
B35: 雪人股份 | G35: 8.2400000000000002 | H35: 8.6099999999999994 | I35: 10.390000000000001 | K35: 16.27 | L35: 5.3200000000000003 | M35: 18.449999999999999 | N35: 7.8799999999999999 | O35: =(K35-L35)/L35 -> 2.0582706766917291 | P35: =(M35-K35)/M35 -> 0.11815718157181571 | Q35: =(M35-N35)/N35 -> 1.3413705583756346 | AQ35: 44570
B36: 冰山冷热 | G36: 4.0499999999999998 | H36: 4.0999999999999996 | I36: 4.5300000000000002 | K36: 7.2400000000000002 | L36: 3.3500000000000001 | M36: 8.3100000000000005 | N36: 3.5600000000000001 | O36: =(K36-L36)/L36 -> 1.1611940298507464 | P36: =(M36-K36)/M36 -> 0.12876052948255118 | Q36: =(M36-N36)/N36 -> 1.3342696629213482 | AQ36: 44570
B37: 精华制药 | G37: 5.8600000000000003 | H37: 6.1299999999999999 | I37: 7.3799999999999999 | K37: 11.220000000000001 | L37: 3.9199999999999999 | M37: 13.65 | N37: 5.6100000000000003 | O37: =(K37-L37)/L37 -> 1.8622448979591839 | P37: =(M37-K37)/M37 -> 0.178021978021978 | Q37: =(M37-N37)/N37 -> 1.4331550802139035 | R37: 11.220000000000001 | AC37: 1w | AD37: =(M37-R37)/M37 -> 0.178021978021978 | AQ37: 44570
B38: 皇庭国际 | G38: 3.7400000000000002 | H38: 3.9199999999999999 | I38: 4.6799999999999997 | K38: 7.5800000000000001 | L38: 2.5800000000000001 | M38: 7.7999999999999998 | N38: 4.3300000000000001 | O38: =(K38-L38)/L38 -> 1.9379844961240309 | P38: =(M38-K38)/M38 -> 2.8205128205128174e-02 | Q38: =(M38-N38)/N38 -> 0.80138568129330245 | AQ38: 44570
B39: 龙津药业 | G39: 8.2200000000000006 | H39: 8.4000000000000004 | I39: 10.06 | K39: 17.620000000000001 | L39: 6.79 | M39: 21.199999999999999 | N39: 7.0899999999999999 | O39: =(K39-L39)/L39 -> 1.59499263622975 | P39: =(M39-K39)/M39 -> 0.16886792452830182 | Q39: =(M39-N39)/N39 -> 1.9901269393511989 | R39: 17.620000000000001 | AC39: 1w | AD39: =(M39-R39)/M39 -> 0.16886792452830182 | AQ39: 44570
B40: 顾地科技 | G40: 3.0600000000000001 | H40: 3.1899999999999999 | I40: 3.7400000000000002 | K40: 6.5599999999999996 | L40: 1.9299999999999999 | M40: 6.5599999999999996 | N40: 2.8999999999999999 | O40: =(K40-L40)/L40 -> 2.3989637305699483 | P40: =(M40-K40)/M40 -> 0 | Q40: =(M40-N40)/N40 -> 1.2620689655172412 | AQ40: 44570
B41: 新力金融 | G41: 8.9199999999999999 | H41: 9.2599999999999998 | I41: 11.359999999999999 | K41: 11.5 | L41: 6.4000000000000004 | M41: 17.460000000000001 | N41: 6.6500000000000004 | O41: =(K41-L41)/L41 -> 0.79687499999999989 | P41: =(M41-K41)/M41 -> 0.34135166093928981 | Q41: =(M41-N41)/N41 -> 1.6255639097744361 | AQ41: 44570