A1: 分析结果编码 | B1: 股票代码 | C1: 股票简称 | D1: 行业 | E1: 资产负债率 | F1: 每股收益(元)(越高越好) | G1: 利润增长 | AO1: 催化剂（是否是新公司，是否有新产品、新管理层、股价新高） | AS1: 股票的供给与需求 | BI1: 股本回报率(至少大于17%) | BL1: 更新时间
G2: 过去五年的历史记录(最近3个季度增速稳步提高，但不超过25%或没有盈利为净利润的增大阶段;最近连续3个季度净利润增速超过25%且已经开始盈利为净利润明显增大阶段；最近3个季度净利润环比增大为净利润增速加快阶段) | AA2: 3年的平均增速(最近季度增速打破平均增速，则为突破或复苏阶段，其中复苏阶段增速应该是之前最近低迷阶段增速的两到三倍) | AB2: 5年的平均增速(最近季度增速打破平均增速，则为突破或复苏阶段，其中复苏阶段增速应该是之前最近低迷阶段增速的两到三倍) | AC2: 每两个季度的增长平均值(确认趋势) | AJ2: 波动性(越小越好) | AK2: 销售额增长（最近3个季度加速增长最好） | AS2: 总股本(以亿为单位，宜小为好) | AT2: 流通股数量 | AU2: 浮动供给量 | AV2: 过去三个月成交量的平均每日成交量及其近期的占比(突破日，其需求量应该大于40%以上，甚至100%) | BB2: 机构认同度 | BK2: 总结
G3: Q1 | H3: Q2 | I3: Q3 | J3: Q4 | K3: Q1 | L3: Q2 | M3: Q3 | N3: Q4 | O3: Q1 | P3: Q2 | Q3: Q3 | R3: Q4 | S3: Q1 | T3: Q2 | U3: Q3 | V3: Q4 | W3: Q1 | X3: Q2 | Y3: Q3 | Z3: Q4 | AC3: AVG7 | AD3: AVG6 | AE3: AVG5 | AF3: AVG4 | AG3: AVG3 | AH3: AVG2 | AI3: AVG1 | AK3: Q1 | AL3: Q2 | AM3: Q3 | AN3: Q4 | AO3: 上市日期(10年以内,即2011年以内) | AP3: 股价新高 | AQ3: 新产品 | AR3: 新管理层 | AV3: 最近三 | AW3: 最近二 | AX3: 最近一 | AY3: 平均单日成交量 | AZ3: 近期最低点成交量 | BA3: 占比 | BB3: 持有的机构投资者数量（大于20，小于1000） | BC3: 持有的机构投资者数量变化(最近3个季度是否持续增加，最近一个季度是否极大增长) | BD3: 持有机构的持有股份变化(最近三个季度) | BE3: 投资机构最近3年业绩评级(基金业绩榜单前10) | BF3: 投资经理最近12个月的业绩评级 | BG3: 投资经理最近3年业绩评级 | BH3: 投资经理最近12个月的业绩评级 | BI3: 净收益 | BJ3: 回报率
B4: 002432.SZ | C4: 九安医疗
B5: 603098.SH | C5: 森特股份
B6: 002326.SZ | C6: 永太科技
B7: 002006.SZ | C7: 精功科技
B8: 003039.SZ | C8: 顺控发展
B9: 000408.SZ | C9: 藏格矿业
B10: 603026.SH | C10: 石大胜华
B11: 002349.SZ | C11: 精华制药
B12: 002176.SZ | C12: 江特电机
B13: 002534.SZ | C13: 杭锅股份
B14: 002011.SZ | C14: 盾安环境
B15: 603055.SH | C15: 台华新材
B16: 001208.SZ | C16: 华菱线缆
B17: 601126.SH | C17: 四方股份
B18: 605005.SH | C18: 合兴股份
B19: 002472.SZ | C19: 双环传动 | E19: 0.47869999999999996 | F19: 0.32000000000000001 | G19: 0.40000000000000002 | H19: 0.30769999999999997 | I19: 0.34999999999999998 | J19: 0.28570000000000001 | K19: 0.1429 | L19: 0.1176 | M19: 3.7000000000000005e-02 | N19: -0.19440000000000002 | O19: -0.25 | P19: -0.42109999999999997 | Q19: -0.46429999999999999 | R19: -0.58619999999999994 | S19: -1.5 | T19: -0.98450000000000004 | U19: -0.86670000000000003 | V19: -0.33329999999999999 | W19: 3.6667000000000001 | X19: 110.76469999999999 | Y19: 15 | AA19: =(N19+O19+P19+Q19+R19+S19+T19+U19+V19+W19+X19+Y19)/12 -> 10.319241666666665 | AB19: =(G19+H19+I19+J19+K19+L19+M19+N19+O19+P19+Q19+R19+S19+T19+U19+V19+W19+X19+Y19)/19 -> 6.6037789473684203 | AC19: =(R19+S19)/2 -> -1.0430999999999999 | AD19: =(S19+T19)/2 -> -1.2422500000000001 | AE19: =(T19+U19)/2 -> -0.92559999999999998 | AF19: =(U19+V19)/2 -> -0.59999999999999998 | AG19: =(V19+W19)/2 -> 1.6667000000000001 | AH19: =(W19+X19)/2 -> 57.215699999999998 | AI19: =(X19+Y19)/2 -> 62.882349999999995 | AJ19: =STDEV(G19:Y19) -> 25.477755184268723 | AK19: 0.38929999999999998 | AL19: 0.69469999999999998 | AM19: 0.59030000000000005
B20: 600032.SH | C20: 浙江新能
B21: 600773.SH | C21: 西藏城投 | E21: 1.4550999999999998 | F21: 0.105 | G21: 0 | H21: 0 | I21: 8.199999999999999e-02 | J21: 0.10000000000000001 | K21: 0.625 | L21: 0.20000000000000001 | M21: 0.30299999999999999 | N21: 0.18179999999999999 | O21: 0.1923 | P21: 3.3300000000000003e-02 | Q21: 1.1599999999999999e-02 | R21: 0 | S21: -9.6799999999999997e-02 | T21: 0 | U21: 0 | V21: 7.690000000000001e-02 | W21: 0.10710000000000001 | X21: 9.6799999999999997e-02 | Y21: 0.2069 | AA21: =(N21+O21+P21+Q21+R21+S21+T21+U21+V21+W21+X21+Y21)/12 -> 6.7491666666666658e-02 | AB21: =(G21+H21+I21+J21+K21+L21+M21+N21+O21+P21+Q21+R21+S21+T21+U21+V21+W21+X21+Y21)/19 -> 0.11157368421052631 | AC21: =(R21+S21)/2 -> -4.8399999999999999e-02 | AD21: =(S21+T21)/2 -> -4.8399999999999999e-02 | AE21: =(T21+U21)/2 -> 0 | AF21: =(U21+V21)/2 -> 3.8450000000000005e-02 | AG21: =(V21+W21)/2 -> 9.2000000000000012e-02 | AH21: =(W21+X21)/2 -> 0.10195000000000001 | AI21: =(X21+Y21)/2 -> 0.15184999999999998 | AJ21: =STDEV(G21:Y21) -> 0.15861186673450967 | AK21: 1.0054000000000001 | AL21: 2.7200000000000002e-02 | AM21: -0.2278
B22: 000762.SZ | C22: 西藏矿业
B23: 603176.SH | C23: 汇通集团
B24: 600714.SH | C24: 金瑞矿业
B25: 600481.SH | C25: 双良节能
B26: 002455.SZ | C26: 百川股份
B27: 603688.SH | C27: 石英股份
B28: 603077.SH | C28: 和邦生物 | E28: 0.18460000000000001 | F28: 0.23899999999999999 | G28: 0 | H28: 0.5 | I28: 0.33329999999999999 | J28: 0.5 | K28: -0.5 | L28: 0 | M28: 0.25 | N28: -0.33329999999999999 | O28: 0 | P28: 0 | Q28: 0 | R28: 0.49249999999999999 | S28: -1.3999999999999999 | T28: -0.82669999999999999 | U28: -1.464 | V28: -0.91959999999999997 | W28: 8.5 | X28: 19.807700000000001 | Y28: 11.293099999999999 | AA28: =(N28+O28+P28+Q28+R28+S28+T28+U28+V28+W28+X28+Y28)/12 -> 2.9291416666666663 | AB28: =(G28+H28+I28+J28+K28+L28+M28+N28+O28+P28+Q28+R28+S28+T28+U28+V28+W28+X28+Y28)/19 -> 1.9070000000000003 | AC28: =(R28+S28)/2 -> -0.45374999999999999 | AD28: =(S28+T28)/2 -> -1.1133500000000001 | AE28: =(T28+U28)/2 -> -1.1453500000000001 | AF28: =(U28+V28)/2 -> -1.1918 | AG28: =(V28+W28)/2 -> 3.7902 | AH28: =(W28+X28)/2 -> 14.15385 | AI28: =(X28+Y28)/2 -> 15.5504 | AJ28: =STDEV(G28:Y28) -> 5.4259785752331249
B29: 600696.SH | C29: 岩石股份
B30: 603348.SH | C30: 文灿股份
B31: 600055.SH | C31: 万东医疗
B32: 600906.SH | C32: 财达证券
B33: 600577.SH | C33: 精达股份
B34: 600277.SH | C34: 亿利洁能
B35: 600367.SH | C35: 红星发展
B36: 600746.SH | C36: 江苏索普
B37: 000723.SZ | C37: 美锦能源
B38: 002192.SZ | C38: 融捷股份
B39: 002895.SZ | C39: 川恒股份
B40: 002484.SZ | C40: 江海股份
B41: 002245.SZ | C41: 蔚蓝锂芯
B42: 600499.SH | C42: 科达制造
B43: 600995.SH | C43: 文山电力
B44: 603518.SH | C44: 锦泓集团
B45: 002655.SZ | C45: 共达电声 | E45: 0.4803 | F45: 0.16 | G45: 0 | H45: -0.5 | I45: -0.5 | J45: -10.800000000000001 | K45: -5 | L45: -4 | M45: -0.5 | N45: 1.1223999999999998 | O45: 1.0900000000000001 | P45: 1.6666999999999998 | Q45: 4 | R45: 0.5 | S45: -3.7777999999999996 | T45: -0.5 | U45: 0.40000000000000002 | V45: 0.44439999999999996 | W45: 8 | X45: 13 | Y45: 1.2856999999999998 | AA45: =(N45+O45+P45+Q45+R45+S45+T45+U45+V45+W45+X45+Y45)/12 -> 2.2692833333333335 | AB45: =(G45+H45+I45+J45+K45+L45+M45+N45+O45+P45+Q45+R45+S45+T45+U45+V45+W45+X45+Y45)/19 -> 0.31217894736842094 | AC45: =(R45+S45)/2 -> -1.6388999999999998 | AD45: =(S45+T45)/2 -> -2.1388999999999996 | AE45: =(T45+U45)/2 -> -4.9999999999999989e-02 | AF45: =(U45+V45)/2 -> 0.42220000000000002 | AG45: =(V45+W45)/2 -> 4.2222 | AH45: =(W45+X45)/2 -> 10.5 | AI45: =(X45+Y45)/2 -> 7.1428500000000001 | AJ45: =STDEV(G45:Y45) -> 4.8736616460976521
B46: 000819.SZ | C46: 岳阳兴长 | E46: 0.14400000000000002 | F46: 0.10299999999999999 | G46: -0.15380000000000002 | H46: -1.3167 | I46: -0.79610000000000003 | J46: -1.3213999999999999 | K46: 2.1818 | L46: 5.8421000000000003 | M46: 5.9523999999999999 | N46: 6.0833000000000004 | O46: -0.31430000000000002 | P46: -3.2599999999999997e-02 | Q46: 0.1027 | R46: 0.1038 | S46: -4.7082999999999995 | T46: -1.4494 | U46: -0.88819999999999988 | V46: -0.54949999999999999 | W46: 0.78650000000000009 | X46: 2 | Y46: 4.7222 | AA46: =(N46+O46+P46+Q46+R46+S46+T46+U46+V46+W46+X46+Y46)/12 -> 0.4880166666666666 | AB46: =(G46+H46+I46+J46+K46+L46+M46+N46+O46+P46+Q46+R46+S46+T46+U46+V46+W46+X46+Y46)/19 -> 0.85497368421052644 | AC46: =(R46+S46)/2 -> -2.3022499999999999 | AD46: =(S46+T46)/2 -> -3.0788499999999996 | AE46: =(T46+U46)/2 -> -1.1688000000000001 | AF46: =(U46+V46)/2 -> -0.71884999999999999 | AG46: =(V46+W46)/2 -> 0.11850000000000005 | AH46: =(W46+X46)/2 -> 1.3932500000000001 | AI46: =(X46+Y46)/2 -> 3.3611 | AJ46: =STDEV(G46:Y46) -> 2.9247527682489873 | AK46: 3.5400000000000001e-02 | AL46: 4.3799999999999999e-02 | AM46: 0.1769
B47: 603938.SH | C47: 三孚股份
B48: 002906.SZ | C48: 华阳集团
B49: 600256.SH | C49: 广汇能源
B50: 603665.SH | C50: 康隆达
B51: 002101.SZ | C51: 广东鸿图
B52: 000825.SZ | C52: 太钢不锈
B53: 000831.SZ | C53: 五矿稀土
B54: 002881.SZ | C54: 美格智能
B55: 600916.SH | C55: 中国黄金
B56: 603997.SH | C56: 继峰股份
B57: 601567.SH | C57: 三星医疗 | E57: 0.36969999999999997 | F57: 0.47599999999999998 | G57: 0.16670000000000001 | H57: -5.8799999999999998e-02 | I57: 7.1399999999999991e-02 | J57: 5.0000000000000003e-02 | K57: 0 | L57: -6.25e-02 | M57: -3.3300000000000003e-02 | N57: -0.42859999999999998 | O57: 1.2856999999999998 | P57: 1.6000000000000001 | Q57: 0.89659999999999995 | R57: 1 | S57: -6.25e-02 | T57: -7.690000000000001e-02 | U57: -3.6400000000000002e-02 | V57: -4.1700000000000001e-02 | W57: -0.20000000000000001 | X57: 0 | Y57: -9.4299999999999995e-02 | AA57: =(N57+O57+P57+Q57+R57+S57+T57+U57+V57+W57+X57+Y57)/12 -> 0.32015833333333327 | AB57: =(G57+H57+I57+J57+K57+L57+M57+N57+O57+P57+Q57+R57+S57+T57+U57+V57+W57+X57+Y57)/19 -> 0.20923157894736838 | AC57: =(R57+S57)/2 -> 0.46875 | AD57: =(S57+T57)/2 -> -6.9700000000000012e-02 | AE57: =(T57+U57)/2 -> -5.6650000000000006e-02 | AF57: =(U57+V57)/2 -> -3.9050000000000001e-02 | AG57: =(V57+W57)/2 -> -0.12085000000000001 | AH57: =(W57+X57)/2 -> -0.10000000000000001 | AI57: =(X57+Y57)/2 -> -4.7149999999999997e-02 | AJ57: =STDEV(G57:Y57) -> 0.55148639658112608
B58: 002724.SZ | C58: 海洋王
B59: 002549.SZ | C59: 凯美特气
B60: 000657.SZ | C60: 中钨高新
B61: 002140.SZ | C61: 东华科技 | E61: 0.69420000000000004 | F61: 0.36199999999999999 | G61: 0.19789999999999999 | H61: 0.1426 | I61: 0.19440000000000002 | J61: -1.7778 | K61: 0.25540000000000002 | L61: -8.43e-02 | M61: 1.0500000000000001e-02 | N61: 3 | O61: -2.0499999999999997e-02 | P61: 0.19070000000000001 | Q61: 7.5600000000000001e-02 | R61: 0.1807 | S61: 3.32e-02 | T61: 0.10539999999999999 | U61: 0.21870000000000001 | V61: 0.1195 | W61: 0.73819999999999997 | X61: 0.37359999999999999 | Y61: 0.2666 | AA61: =(N61+O61+P61+Q61+R61+S61+T61+U61+V61+W61+X61+Y61)/12 -> 0.44014166666666665 | AB61: =(G61+H61+I61+J61+K61+L61+M61+N61+O61+P61+Q61+R61+S61+T61+U61+V61+W61+X61+Y61)/19 -> 0.22212631578947367 | AC61: =(R61+S61)/2 -> 0.10695 | AD61: =(S61+T61)/2 -> 6.93e-02 | AE61: =(T61+U61)/2 -> 0.16205 | AF61: =(U61+V61)/2 -> 0.1691 | AG61: =(V61+W61)/2 -> 0.42884999999999995 | AH61: =(W61+X61)/2 -> 0.55589999999999995 | AI61: =(X61+Y61)/2 -> 0.3201 | AJ61: =STDEV(G61:Y61) -> 0.826569720687792
B62: 002584.SZ | C62: 西陇科学
B63: 002139.SZ | C63: 拓邦股份
B64: 603917.SH | C64: 合力科技
B65: 603123.SH | C65: 翠微股份
B66: 603300.SH | C66: 华铁应急 | E66: 0.57979999999999998 | F66: 0.36699999999999999 | G66: 0.5 | H66: 0.16670000000000001 | I66: 0 | J66: -0.3846 | K66: -0.33329999999999999 | L66: 0.28570000000000001 | M66: 1 | N66: -1.625 | O66: 1.5 | P66: 1.5556000000000001 | Q66: 1 | R66: 9.5999999999999996 | S66: -0.5 | T66: -0.4783 | U66: -0.36109999999999998 | V66: 4.6500000000000007e-02 | W66: 0.80000000000000004 | X66: 0.83329999999999993 | Y66: 0.6522 | AA66: =(N66+O66+P66+Q66+R66+S66+T66+U66+V66+W66+X66+Y66)/12 -> 1.0852666666666666 | AB66: =(G66+H66+I66+J66+K66+L66+M66+N66+O66+P66+Q66+R66+S66+T66+U66+V66+W66+X66+Y66)/19 -> 0.75040526315789469 | AC66: =(R66+S66)/2 -> 4.5499999999999998 | AD66: =(S66+T66)/2 -> -0.48914999999999997 | AE66: =(T66+U66)/2 -> -0.41969999999999996 | AF66: =(U66+V66)/2 -> -0.1573 | AG66: =(V66+W66)/2 -> 0.42325000000000002 | AH66: =(W66+X66)/2 -> 0.81664999999999999 | AI66: =(X66+Y66)/2 -> 0.74275000000000002 | AJ66: =STDEV(G66:Y66) -> 2.2823107533749125
B67: 000829.SZ | C67: 天音控股
B68: 002748.SZ | C68: 世龙实业
B69: 603171.SH | C69: 税友股份 | V69: 6.4100000000000004e-02 | W69: 0.42859999999999998 | X69: 8.3299999999999999e-02 | Y69: -0.31109999999999999 | AA69: =(N69+O69+P69+Q69+R69+S69+T69+U69+V69+W69+X69+Y69)/12 -> 2.2074999999999997e-02 | AB69: =(G69+H69+I69+J69+K69+L69+M69+N69+O69+P69+Q69+R69+S69+T69+U69+V69+W69+X69+Y69)/19 -> 1.3942105263157893e-02 | AC69: =(R69+S69)/2 -> 0 | AD69: =(S69+T69)/2 -> 0 | AE69: =(T69+U69)/2 -> 0 | AF69: =(U69+V69)/2 -> 3.2050000000000002e-02 | AG69: =(V69+W69)/2 -> 0.24634999999999999 | AH69: =(W69+X69)/2 -> 0.25595000000000001 | AI69: =(X69+Y69)/2 -> -0.1139 | AJ69: =STDEV(G69:Y69) -> 0.30220625820786701
B70: 603667.SH | C70: 五洲新春 | E70: 47.100000000000001 | F70: 0.38800000000000001 | G70: -9.0899999999999995e-02 | H70: -0.31030000000000002 | I70: -0.11359999999999999 | J70: -0.30909999999999999 | K70: -0.20000000000000001 | L70: 0.10000000000000001 | M70: -5.1299999999999998e-02 | N70: 0 | O70: 0.125 | P70: -4.5499999999999999e-02 | Q70: -0.1351 | R70: -5.2600000000000001e-02 | S70: -0.55559999999999998 | T70: -0.52380000000000004 | U70: -0.5 | V70: -0.41670000000000001 | W70: 1.75 | X70: 1.8999999999999999 | Y70: 1.5 | AA70: =(N70+O70+P70+Q70+R70+S70+T70+U70+V70+W70+X70+Y70)/12 -> 0.25380833333333336 | AB70: =(G70+H70+I70+J70+K70+L70+M70+N70+O70+P70+Q70+R70+S70+T70+U70+V70+W70+X70+Y70)/19 -> 0.10897368421052629 | AC70: =(R70+S70)/2 -> -0.30409999999999998 | AD70: =(S70+T70)/2 -> -0.53970000000000007 | AE70: =(T70+U70)/2 -> -0.51190000000000002 | AF70: =(U70+V70)/2 -> -0.45835000000000004 | AG70: =(V70+W70)/2 -> 0.66664999999999996 | AH70: =(W70+X70)/2 -> 1.825 | AI70: =(X70+Y70)/2 -> 1.7 | AJ70: =STDEV(G70:Y70) -> 0.74565068738809548
B71: 600905.SH | C71: 三峡能源 | U71: 0.2923 | V71: 0.27110000000000001 | W71: 0.5121 | X71: 0.50429999999999997 | Y71: 0.2084 | AA71: =(N71+O71+P71+Q71+R71+S71+T71+U71+V71+W71+X71+Y71)/12 -> 0.14901666666666666 | AB71: =(G71+H71+I71+J71+K71+L71+M71+N71+O71+P71+Q71+R71+S71+T71+U71+V71+W71+X71+Y71)/19 -> 9.4115789473684194e-02 | AC71: =(R71+S71)/2 -> 0 | AD71: =(S71+T71)/2 -> 0 | AE71: =(T71+U71)/2 -> 0.14615 | AF71: =(U71+V71)/2 -> 0.28170000000000001 | AG71: =(V71+W71)/2 -> 0.3916 | AH71: =(W71+X71)/2 -> 0.50819999999999999 | AI71: =(X71+Y71)/2 -> 0.35635 | AJ71: =STDEV(G71:Y71) -> 0.14088835296077529
B72: 002900.SZ | C72: 哈三联
B73: 000567.SZ | C73: 海德股份
B74: 000663.SZ | C74: 永安林业
B75: 603315.SH | C75: 福鞍股份 | E75: 0.41909999999999997 | F75: 0.16400000000000001 | G75: -0.90170000000000006 | H75: -0.63460000000000005 | I75: -0.30159999999999998 | J75: -0.74590000000000001 | K75: 5.9299999999999999e-02 | L75: -0.64540000000000008 | M75: -5.7999999999999996e-03 | N75: 5.7413999999999996 | O75: 2.8239999999999998 | P75: 6.9212999999999996 | Q75: 1.1337000000000002 | R75: 0.26069999999999999 | S75: 0.38280000000000003 | T75: 0.16449999999999998 | U75: -7.1300000000000002e-02 | V75: -0.1333 | W75: -0.26929999999999998 | X75: -0.21859999999999999 | Y75: -0.30859999999999999 | AA75: =(N75+O75+P75+Q75+R75+S75+T75+U75+V75+W75+X75+Y75)/12 -> 1.3689416666666669 | AB75: =(G75+H75+I75+J75+K75+L75+M75+N75+O75+P75+Q75+R75+S75+T75+U75+V75+W75+X75+Y75)/19 -> 0.69745263157894732 | AC75: =(R75+S75)/2 -> 0.32174999999999998 | AD75: =(S75+T75)/2 -> 0.27365 | AE75: =(T75+U75)/2 -> 4.6599999999999989e-02 | AF75: =(U75+V75)/2 -> -0.1023 | AG75: =(V75+W75)/2 -> -0.20129999999999998 | AH75: =(W75+X75)/2 -> -0.24395 | AI75: =(X75+Y75)/2 -> -0.2636 | AJ75: =STDEV(G75:Y75) -> 2.1557302491443644
B76: 600351.SH | C76: 亚宝药业 | E76: 0.29289999999999999 | F76: 0.189 | G76: -0.42670000000000002 | H76: 0.20019999999999999 | I76: 1.1556 | J76: 7.8951000000000002 | K76: 0.47869999999999996 | L76: 0.35489999999999999 | M76: 0.4395 | N76: 0.36909999999999998 | O76: 0.2792 | P76: 0.12640000000000001 | Q76: 8.48e-02 | R76: -0.9486 | S76: -0.46820000000000001 | T76: -0.61819999999999997 | U76: -0.59450000000000003 | V76: 6.8212000000000002 | W76: 0.62039999999999995 | X76: 0.62670000000000003 | Y76: 0.58169999999999999 | AA76: =(N76+O76+P76+Q76+R76+S76+T76+U76+V76+W76+X76+Y76)/12 -> 0.57333333333333325 | AB76: =(G76+H76+I76+J76+K76+L76+M76+N76+O76+P76+Q76+R76+S76+T76+U76+V76+W76+X76+Y76)/19 -> 0.89354210526315792 | AC76: =(R76+S76)/2 -> -0.70840000000000003 | AD76: =(S76+T76)/2 -> -0.54320000000000002 | AE76: =(T76+U76)/2 -> -0.60634999999999994 | AF76: =(U76+V76)/2 -> 3.1133500000000001 | AG76: =(V76+W76)/2 -> 3.7208000000000001 | AH76: =(W76+X76)/2 -> 0.62355000000000005 | AI76: =(X76+Y76)/2 -> 0.60420000000000007 | AJ76: =STDEV(G76:Y76) -> 2.3452707423227963
B77: 002206.SZ | C77: 海利得
B78: 603222.SH | C78: 济民医疗
B79: 600366.SH | C79: 宁波韵升 | E79: 0.32329999999999998 | F79: 0.378 | G79: -0.87919999999999998 | H79: -0.88060000000000005 | I79: -0.61539999999999995 | J79: -0.71620000000000006 | K79: -0.86180000000000012 | L79: -0.66239999999999999 | M79: -0.88060000000000005 | N79: -0.78469999999999995 | O79: 4.2488000000000001 | P79: -2.8799999999999999e-02 | Q79: -0.27690000000000003 | R79: -0.70279999999999998 | S79: -1.2545999999999999 | T79: 0.40560000000000002 | U79: 1.8243 | V79: 5.8103999999999996 | W79: 3.3868999999999998 | X79: 2.2344999999999997 | Y79: 1.8015000000000001 | AA79: =(N79+O79+P79+Q79+R79+S79+T79+U79+V79+W79+X79+Y79)/12 -> 1.3886833333333335 | AB79: =(G79+H79+I79+J79+K79+L79+M79+N79+O79+P79+Q79+R79+S79+T79+U79+V79+W79+X79+Y79)/19 -> 0.58778947368421053 | AC79: =(R79+S79)/2 -> -0.9786999999999999 | AD79: =(S79+T79)/2 -> -0.42449999999999999 | AE79: =(T79+U79)/2 -> 1.1149500000000001 | AF79: =(U79+V79)/2 -> 3.8173499999999998 | AG79: =(V79+W79)/2 -> 4.5986499999999992 | AH79: =(W79+X79)/2 -> 2.8106999999999998 | AI79: =(X79+Y79)/2 -> 2.0179999999999998 | AJ79: =STDEV(G79:Y79) -> 2.0495111452069454
B80: 603088.SH | C80: 宁波精达 | E80: 0.47840000000000005 | F80: 0.20000000000000001 | G80: 3.5 | H80: -0.1333 | I80: 3.85e-02 | J80: 3.7000000000000005e-02 | K80: -0.11109999999999999 | L80: -0.30769999999999997 | M80: -0.25929999999999997 | N80: -7.1399999999999991e-02 | O80: 0 | P80: 0 | Q80: -0.14999999999999999 | R80: 0.11539999999999999 | S80: 0 | T80: 0.11109999999999999 | U80: -0.17649999999999999 | V80: 6.9000000000000006e-02 | W80: 0.125 | X80: 0.10000000000000001 | Y80: 0.42859999999999998 | AA80: =(N80+O80+P80+Q80+R80+S80+T80+U80+V80+W80+X80+Y80)/12 -> 4.5933333333333333e-02 | AB80: =(G80+H80+I80+J80+K80+L80+M80+N80+O80+P80+Q80+R80+S80+T80+U80+V80+W80+X80+Y80)/19 -> 0.1744894736842105 | AC80: =(R80+S80)/2 -> 5.7699999999999994e-02 | AD80: =(S80+T80)/2 -> 5.5549999999999995e-02 | AE80: =(T80+U80)/2 -> -3.27e-02 | AF80: =(U80+V80)/2 -> -5.3749999999999992e-02 | AG80: =(V80+W80)/2 -> 9.7000000000000003e-02 | AH80: =(W80+X80)/2 -> 0.1125 | AI80: =(X80+Y80)/2 -> 0.26429999999999998 | AJ80: =STDEV(G80:Y80) -> 0.82208707020251348 | AK80: 3.7699999999999997e-02 | AL80: 0.34710000000000002 | AM80: 0.34289999999999998
B81: 000519.SZ | C81: 中兵红箭
B82: 000546.SZ | C82: 金圆股份
B83: 601969.SH | C83: 海南矿业
B84: 002091.SZ | C84: 江苏国泰
B85: 601137.SH | C85: 博威合金
B86: 603633.SH | C86: 徕木股份
B87: 000811.SZ | C87: 冰轮环境 | E87: 0.46060000000000001 | F87: 0.31 | G87: 13 | H87: -0.4103 | I87: -0.10529999999999999 | J87: 2.1299999999999999e-02 | K87: -1.2143000000000002 | L87: -0.26090000000000002 | M87: -0.1176 | N87: -0.1042 | O87: 9.6666999999999987 | P87: 0.94120000000000004 | Q87: 0.5 | R87: 0.58140000000000003 | S87: -1.0769 | T87: -0.60609999999999997 | U87: -0.4889 | V87: -0.55880000000000007 | W87: 4.5 | X87: 0.3846 | Y87: 0.3478 | AA87: =(N87+O87+P87+Q87+R87+S87+T87+U87+V87+W87+X87+Y87)/12 -> 1.1738999999999999 | AB87: =(G87+H87+I87+J87+K87+L87+M87+N87+O87+P87+Q87+R87+S87+T87+U87+V87+W87+X87+Y87)/19 -> 1.3157736842105259 | AC87: =(R87+S87)/2 -> -0.24774999999999997 | AD87: =(S87+T87)/2 -> -0.84149999999999991 | AE87: =(T87+U87)/2 -> -0.54749999999999999 | AF87: =(U87+V87)/2 -> -0.52385000000000004 | AG87: =(V87+W87)/2 -> 1.9705999999999999 | AH87: =(W87+X87)/2 -> 2.4422999999999999 | AI87: =(X87+Y87)/2 -> 0.36619999999999997 | AJ87: =STDEV(G87:Y87) -> 3.7665886935649375
B88: 002420.SZ | C88: 毅昌科技 | E88: 0.74019999999999997 | F88: 0.152 | G88: -1.3977999999999999 | H88: 0.30809999999999998 | I88: -2.8895999999999997 | J88: -24.800000000000001 | K88: 1.0639000000000001 | L88: 0.37229999999999996 | M88: -1.3163 | N88: -0.70590000000000008 | O88: 3.3810000000000002 | P88: 1.2732999999999999 | Q88: 1.0298 | R88: 1.1626000000000001 | S88: 0.63039999999999996 | T88: 3.0448000000000004 | U88: 2.5446 | V88: -0.51519999999999999 | W88: 1 | X88: 0.29600000000000004 | Y88: 0.36659999999999998 | AA88: =(N88+O88+P88+Q88+R88+S88+T88+U88+V88+W88+X88+Y88)/12 -> 1.1256666666666668 | AB88: =(G88+H88+I88+J88+K88+L88+M88+N88+O88+P88+Q88+R88+S88+T88+U88+V88+W88+X88+Y88)/19 -> -0.79744210526315773 | AC88: =(R88+S88)/2 -> 0.89650000000000007 | AD88: =(S88+T88)/2 -> 1.8376000000000001 | AE88: =(T88+U88)/2 -> 2.7947000000000002 | AF88: =(U88+V88)/2 -> 1.0146999999999999 | AG88: =(V88+W88)/2 -> 0.2424 | AH88: =(W88+X88)/2 -> 0.64800000000000002 | AI88: =(X88+Y88)/2 -> 0.33130000000000004 | AJ88: =STDEV(G88:Y88) -> 6.0090341659977815
B89: 002036.SZ | C89: 联创电子 | E89: 0.65590000000000004 | F89: 0.17699999999999999 | G89: 0 | H89: 0.22699999999999998 | I89: 0.16320000000000001 | J89: 0.38890000000000002 | K89: 1 | L89: -6.4500000000000002e-02 | M89: -2.6800000000000001e-02 | N89: -0.32000000000000001 | O89: 0.75 | P89: 0.28239999999999998 | Q89: -5.1100000000000007e-02 | R89: 5.8799999999999998e-02 | S89: -0.57140000000000002 | T89: -0.4521 | U89: -6.5799999999999997e-02 | V89: -0.52780000000000005 | W89: 0 | X89: -1.3899999999999999e-02 | Y89: -0.21050000000000002 | AA89: =(N89+O89+P89+Q89+R89+S89+T89+U89+V89+W89+X89+Y89)/12 -> -9.3450000000000033e-02 | AB89: =(G89+H89+I89+J89+K89+L89+M89+N89+O89+P89+Q89+R89+S89+T89+U89+V89+W89+X89+Y89)/19 -> 2.9810526315789468e-02 | AC89: =(R89+S89)/2 -> -0.25630000000000003 | AD89: =(S89+T89)/2 -> -0.51175000000000004 | AE89: =(T89+U89)/2 -> -0.25895000000000001 | AF89: =(U89+V89)/2 -> -0.29680000000000001 | AG89: =(V89+W89)/2 -> -0.26390000000000002 | AH89: =(W89+X89)/2 -> -6.9499999999999996e-03 | AI89: =(X89+Y89)/2 -> -0.11220000000000001 | AJ89: =STDEV(G89:Y89) -> 0.39626148619137402
B90: 002886.SZ | C90: 沃特股份 | E90: 0.39939999999999998 | F90: 0.222 | H90: -0.14810000000000001 | I90: -0.18600000000000003 | J90: -0.58179999999999998 | K90: -0.1333 | L90: -0.34350000000000003 | M90: -0.43369999999999997 | N90: -0.2349 | O90: -0.61539999999999995 | P90: -6.6199999999999995e-02 | Q90: -3.4799999999999998e-02 | R90: 0.4667 | S90: -0.40000000000000002 | T90: 1.2199 | U90: 1.0779000000000001 | V90: 0.20230000000000001 | W90: 4.0667 | X90: -0.4249 | Y90: -0.44179999999999997 | AA90: =(N90+O90+P90+Q90+R90+S90+T90+U90+V90+W90+X90+Y90)/12 -> 0.40129166666666666 | AB90: =(G90+H90+I90+J90+K90+L90+M90+N90+O90+P90+Q90+R90+S90+T90+U90+V90+W90+X90+Y90)/19 -> 0.15732105263157892 | AC90: =(R90+S90)/2 -> 3.3349999999999991e-02 | AD90: =(S90+T90)/2 -> 0.40994999999999998 | AE90: =(T90+U90)/2 -> 1.1489 | AF90: =(U90+V90)/2 -> 0.6401 | AG90: =(V90+W90)/2 -> 2.1345000000000001 | AH90: =(W90+X90)/2 -> 1.8209 | AI90: =(X90+Y90)/2 -> -0.43335000000000001 | AJ90: =STDEV(G90:Y90) -> 1.1019909202886804
B91: 600986.SH | C91: 浙文互联
B92: 002145.SZ | C92: 中核钛白
B93: 002805.SZ | C93: 丰元股份 | E93: 0.31620000000000004 | F93: 0.217 | G93: -0.11109999999999999 | H93: -0.25 | I93: 0.26090000000000002 | J93: 0.44439999999999996 | K93: -0.10000000000000001 | L93: -0.40000000000000002 | M93: -0.44829999999999998 | N93: -0.56409999999999993 | O93: 8.3299999999999999e-02 | P93: 0.11109999999999999 | Q93: -0.25 | R93: -0.52939999999999998 | S93: -0.87180000000000002 | T93: -0.80000000000000004 | U93: -0.75 | V93: -3.5 | W93: 6 | X93: 6.5 | Y93: 7 | AA93: =(N93+O93+P93+Q93+R93+S93+T93+U93+V93+W93+X93+Y93)/12 -> 1.0357583333333333 | AB93: =(G93+H93+I93+J93+K93+L93+M93+N93+O93+P93+Q93+R93+S93+T93+U93+V93+W93+X93+Y93)/19 -> 0.62236842105263157 | AC93: =(R93+S93)/2 -> -0.7006 | AD93: =(S93+T93)/2 -> -0.83590000000000009 | AE93: =(T93+U93)/2 -> -0.77500000000000002 | AF93: =(U93+V93)/2 -> -2.125 | AG93: =(V93+W93)/2 -> 1.25 | AH93: =(W93+X93)/2 -> 6.25 | AI93: =(X93+Y93)/2 -> 6.75 | AJ93: =STDEV(G93:Y93) -> 2.7436255433788155 | AK93: 54.850000000000001 | AL93: 98.120000000000005 | AM93: 72.040000000000006
B94: 600163.SH | C94: 中闽能源
B95: 000862.SZ | C95: 银星能源
B96: 002009.SZ | C96: 天奇股份
B97: 000822.SZ | C97: 山东海化
B98: 003022.SZ | C98: 联泓新科
B99: 002550.SZ | C99: 千红制药
B100: 601669.SH | C100: 中国电建 | E100: 0.76470000000000005 | F100: 0.407 | G100: 5.4399999999999997e-02 | H100: 3.6600000000000001e-02 | I100: 8.9999999999999993e-03 | J100: 2.2700000000000001e-02 | K100: 1.1299999999999999e-02 | L100: 1.7999999999999999e-02 | M100: 1.32e-02 | N100: 4.4000000000000003e-03 | O100: 1.9900000000000001e-02 | P100: -2.41e-02 | Q100: -3.7199999999999997e-02 | R100: -5.6800000000000003e-02 | S100: -0.1353 | T100: -1.e-02 | U100: 1.49e-02 | V100: 1.4200000000000001e-02 | W100: 0.4123 | X100: 0.14560000000000001 | Y100: 0.1046 | AA100: =(N100+O100+P100+Q100+R100+S100+T100+U100+V100+W100+X100+Y100)/12 -> 3.7708333333333337e-02 | AB100: =(G100+H100+I100+J100+K100+L100+M100+N100+O100+P100+Q100+R100+S100+T100+U100+V100+W100+X100+Y100)/19 -> 3.2510526315789469e-02 | AC100: =(R100+S100)/2 -> -9.6049999999999996e-02 | AD100: =(S100+T100)/2 -> -7.2650000000000006e-02 | AE100: =(T100+U100)/2 -> 2.4499999999999999e-03 | AF100: =(U100+V100)/2 -> 1.455e-02 | AG100: =(V100+W100)/2 -> 0.21325 | AH100: =(W100+X100)/2 -> 0.27895000000000003 | AI100: =(X100+Y100)/2 -> 0.12509999999999999 | AJ100: =STDEV(G100:Y100) -> 0.10852731297152211
B101: 600691.SH | C101: 阳煤化工
B102: 002518.SZ | C102: 科士达
B103: 600210.SH | C103: 紫江企业
B104: 000009.SZ | C104: 中国宝安
B105: 603895.SH | C105: 天永智能
B106: 002182.SZ | C106: 云海金属
B107: 002840.SZ | C107: 华统股份
B108: 000155.SZ | C108: 川能动力
B109: 002249.SZ | C109: 大洋电机
B110: 600956.SH | C110: 新天绿能
B111: 000993.SZ | C111: 闽东电力
B112: 603196.SH | C112: 日播时尚
B113: 002002.SZ | C113: 鸿达兴业
B114: 002765.SZ | C114: 蓝黛科技 | E114: 0.51229999999999998 | F114: 0.30399999999999999 | G114: -0.46149999999999997 | H114: 7.1399999999999991e-02 | I114: -5.2600000000000001e-02 | J114: 3.2300000000000002e-02 | K114: -0.1429 | L114: -0.33329999999999999 | M114: -0.66670000000000007 | N114: -0.9667 | O114: -2 | P114: -2.3999999999999999 | Q114: -3.5 | R114: -34 | S114: 0.33329999999999999 | T114: 1.0214000000000001 | U114: 1.3999999999999999 | V114: 1.0297000000000001 | W114: 2.75 | X114: 68.666700000000006 | Y114: 4.1667000000000005 | AA114: =(N114+O114+P114+Q114+R114+S114+T114+U114+V114+W114+X114+Y114)/12 -> 3.0417583333333336 | AB114: =(G114+H114+I114+J114+K114+L114+M114+N114+O114+P114+Q114+R114+S114+T114+U114+V114+W114+X114+Y114)/19 -> 1.8393578947368421 | AC114: =(R114+S114)/2 -> -16.833349999999999 | AD114: =(S114+T114)/2 -> 0.67735000000000001 | AE114: =(T114+U114)/2 -> 1.2107000000000001 | AF114: =(U114+V114)/2 -> 1.21485 | AG114: =(V114+W114)/2 -> 1.88985 | AH114: =(W114+X114)/2 -> 35.708350000000003 | AI114: =(X114+Y114)/2 -> 36.416700000000006 | AJ114: =STDEV(G114:Y114) -> 18.04265792846731 | AK114: 0.80840000000000001 | AL114: 0.91610000000000003 | AM114: 0.75569999999999993
B115: 605196.SH | C115: 华通线缆
B116: 600230.SH | C116: 沧州大化
B117: 603949.SH | C117: 雪龙集团 | Q117: 3.3300000000000003e-02 | R117: -9.8800000000000013e-02 | S117: -0.29999999999999999 | T117: -0.20449999999999999 | U117: -0.1452 | V117: 4.1100000000000005e-02 | W117: 0.42859999999999998 | X117: 8.5699999999999998e-02 | Y117: -7.5499999999999998e-02 | AA117: =(N117+O117+P117+Q117+R117+S117+T117+U117+V117+W117+X117+Y117)/12 -> -1.9608333333333328e-02 | AB117: =(G117+H117+I117+J117+K117+L117+M117+N117+O117+P117+Q117+R117+S117+T117+U117+V117+W117+X117+Y117)/19 -> -1.2384210526315787e-02 | AC117: =(R117+S117)/2 -> -0.19939999999999999 | AD117: =(S117+T117)/2 -> -0.25224999999999997 | AE117: =(T117+U117)/2 -> -0.17485000000000001 | AF117: =(U117+V117)/2 -> -5.2049999999999999e-02 | AG117: =(V117+W117)/2 -> 0.23485 | AH117: =(W117+X117)/2 -> 0.25714999999999999 | AI117: =(X117+Y117)/2 -> 5.1000000000000004e-03 | AJ117: =STDEV(G117:Y117) -> 0.21096615315679854
B118: 000681.SZ | C118: 视觉中国
B119: 000875.SZ | C119: 吉电股份
B120: 601199.SH | C120: 江南水务 | E120: 0.49060000000000004 | F120: 0.22 | G120: -0.5 | H120: -0.11109999999999999 | I120: -0.15380000000000002 | J120: -0.2571 | K120: -0.20000000000000001 | L120: -0.375 | M120: -0.31819999999999998 | N120: -0.1923 | O120: 0 | P120: 0.20000000000000001 | Q120: 0.26669999999999999 | R120: 0.1905 | S120: 0 | T120: -0.16670000000000001 | U120: -0.10529999999999999 | V120: 4.0000000000000001e-02 | W120: 0.25 | X120: 0.20000000000000001 | Y120: 0.29410000000000003 | AA120: =(N120+O120+P120+Q120+R120+S120+T120+U120+V120+W120+X120+Y120)/12 -> 8.1416666666666679e-02 | AB120: =(G120+H120+I120+J120+K120+L120+M120+N120+O120+P120+Q120+R120+S120+T120+U120+V120+W120+X120+Y120)/19 -> -4.937894736842105e-02 | AC120: =(R120+S120)/2 -> 9.5250000000000001e-02 | AD120: =(S120+T120)/2 -> -8.3350000000000007e-02 | AE120: =(T120+U120)/2 -> -0.13600000000000001 | AF120: =(U120+V120)/2 -> -3.2649999999999998e-02 | AG120: =(V120+W120)/2 -> 0.14499999999999999 | AH120: =(W120+X120)/2 -> 0.22500000000000001 | AI120: =(X120+Y120)/2 -> 0.24705000000000002 | AJ120: =STDEV(G120:Y120) -> 0.23588099536971646 | AK120: 0.1759 | AL120: 0.1421 | AM120: 1.61e-02
B121: 002283.SZ | C121: 天润工业
B122: 003036.SZ | C122: 泰坦股份
B123: 000949.SZ | C123: 新乡化纤
B124: 600869.SH | C124: 远东股份
B125: 600335.SH | C125: 国机汽车 | E125: 0.65010000000000001 | F125: 0.13 | G125: -0.19699999999999998 | H125: 8.48e-02 | I125: 0.13220000000000001 | J125: 3.6299999999999999e-02 | K125: 0.2364 | L125: -0.38030000000000003 | M125: -0.32979999999999998 | N125: -0.12230000000000001 | O125: -6.1200000000000004e-02 | P125: -7.4299999999999991e-02 | Q125: -0.15629999999999999 | R125: -0.3543 | S125: -0.96629999999999994 | T125: -0.4501 | U125: -0.53420000000000001 | V125: -0.21410000000000001 | W125: 1.2258 | X125: -0.50130000000000008 | Y125: -0.2286 | AA125: =(N125+O125+P125+Q125+R125+S125+T125+U125+V125+W125+X125+Y125)/12 -> -0.20310000000000006 | AB125: =(G125+H125+I125+J125+K125+L125+M125+N125+O125+P125+Q125+R125+S125+T125+U125+V125+W125+X125+Y125)/19 -> -0.15024210526315793 | AC125: =(R125+S125)/2 -> -0.6603 | AD125: =(S125+T125)/2 -> -0.70819999999999994 | AE125: =(T125+U125)/2 -> -0.49214999999999998 | AF125: =(U125+V125)/2 -> -0.37414999999999998 | AG125: =(V125+W125)/2 -> 0.50585000000000002 | AH125: =(W125+X125)/2 -> 0.36224999999999996 | AI125: =(X125+Y125)/2 -> -0.36495000000000005 | AJ125: =STDEV(G125:Y125) -> 0.43416941050417623
B126: 601702.SH | C126: 华峰铝业 | E126: 0.4864 | F126: 0.35999999999999999 | T126: 0.5 | U126: 0.35710000000000003 | V126: 0.23999999999999999 | W126: 1 | X126: 1 | Y126: 0.89469999999999994 | AA126: =(N126+O126+P126+Q126+R126+S126+T126+U126+V126+W126+X126+Y126)/12 -> 0.33265 | AB126: =(G126+H126+I126+J126+K126+L126+M126+N126+O126+P126+Q126+R126+S126+T126+U126+V126+W126+X126+Y126)/19 -> 0.21009473684210525 | AC126: =(R126+S126)/2 -> 0 | AD126: =(S126+T126)/2 -> 0.25 | AE126: =(T126+U126)/2 -> 0.42854999999999999 | AF126: =(U126+V126)/2 -> 0.29854999999999998 | AG126: =(V126+W126)/2 -> 0.62 | AH126: =(W126+X126)/2 -> 1 | AI126: =(X126+Y126)/2 -> 0.94734999999999991 | AJ126: =STDEV(G126:Y126) -> 0.34054778225676346
B127: 601208.SH | C127: 东材科技 | E127: 0.39729999999999999 | F127: 0.30199999999999999 | G127: 2.5 | H127: 1.75 | I127: 1 | J127: 1.2856999999999998 | K127: -0.84290000000000009 | L127: -0.87180000000000002 | M127: -0.71430000000000005 | N127: -0.6875 | O127: -0.63639999999999997 | P127: 2.0992999999999999 | Q127: 0.62749999999999995 | R127: 1.3999999999999999 | S127: 9 | T127: 1.0595000000000001 | U127: 1.4578 | V127: 1.4166999999999998 | W127: 2.5 | X127: 1.4443999999999999 | Y127: 1 | AA127: =(N127+O127+P127+Q127+R127+S127+T127+U127+V127+W127+X127+Y127)/12 -> 1.7234416666666668 | AB127: =(G127+H127+I127+J127+K127+L127+M127+N127+O127+P127+Q127+R127+S127+T127+U127+V127+W127+X127+Y127)/19 -> 1.3046315789473681 | AC127: =(R127+S127)/2 -> 5.2000000000000002 | AD127: =(S127+T127)/2 -> 5.0297499999999999 | AE127: =(T127+U127)/2 -> 1.25865 | AF127: =(U127+V127)/2 -> 1.4372499999999999 | AG127: =(V127+W127)/2 -> 1.9583499999999998 | AH127: =(W127+X127)/2 -> 1.9722 | AI127: =(X127+Y127)/2 -> 1.2222 | AJ127: =STDEV(G127:Y127) -> 2.1709775875430024
B128: 603063.SH | C128: 禾望电气
B129: 605167.SH | C129: 利柏特 | E129: 0.37040000000000001 | F129: 0.19 | V129: 3.3300000000000003e-02 | W129: 0 | X129: 0.11109999999999999 | Y129: 0.1176 | AA129: =(N129+O129+P129+Q129+R129+S129+T129+U129+V129+W129+X129+Y129)/12 -> 2.1833333333333333e-02 | AB129: =(G129+H129+I129+J129+K129+L129+M129+N129+O129+P129+Q129+R129+S129+T129+U129+V129+W129+X129+Y129)/19 -> 1.3789473684210527e-02 | AC129: =(R129+S129)/2 -> 0 | AD129: =(S129+T129)/2 -> 0 | AE129: =(T129+U129)/2 -> 0 | AF129: =(U129+V129)/2 -> 1.6650000000000002e-02 | AG129: =(V129+W129)/2 -> 1.6650000000000002e-02 | AH129: =(W129+X129)/2 -> 5.5549999999999995e-02 | AI129: =(X129+Y129)/2 -> 0.11434999999999999 | AJ129: =STDEV(G129:Y129) -> 5.8082871829826042e-02 | AK129: 0.15560000000000002 | AL129: 0.18770000000000001 | AM129: 0.1857
B130: 000810.SZ | C130: 创维数字
B131: 600021.SH | C131: 上海电力
B132: 600581.SH | C132: 八一钢铁
B133: 600965.SH | C133: 福成股份
B134: 000966.SZ | C134: 长源电力
B135: 002599.SZ | C135: 盛通股份
B136: 600821.SH | C136: 金开新能 | E136: 0.79220000000000002 | F136: 0.26400000000000001 | G136: -20 | H136: -32 | I136: 1.0832999999999999 | J136: -0.28570000000000001 | K136: 5.2600000000000001e-02 | L136: 0.1613 | M136: -34 | N136: -0.22219999999999998 | O136: -5.5599999999999997e-02 | P136: -0.5 | Q136: 0.39390000000000003 | R136: 0.90910000000000002 | S136: 0.89469999999999994 | T136: 1.1026 | U136: 1.175 | V136: 7 | W136: 9.5 | X136: 5 | Y136: 3.1429 | AA136: =(N136+O136+P136+Q136+R136+S136+T136+U136+V136+W136+X136+Y136)/12 -> 2.3616999999999999 | AB136: =(G136+H136+I136+J136+K136+L136+M136+N136+O136+P136+Q136+R136+S136+T136+U136+V136+W136+X136+Y136)/19 -> -2.9814789473684216 | AC136: =(R136+S136)/2 -> 0.90189999999999992 | AD136: =(S136+T136)/2 -> 0.99865000000000004 | AE136: =(T136+U136)/2 -> 1.1388 | AF136: =(U136+V136)/2 -> 4.0875000000000004 | AG136: =(V136+W136)/2 -> 8.25 | AH136: =(W136+X136)/2 -> 7.25 | AI136: =(X136+Y136)/2 -> 4.0714500000000005 | AJ136: =STDEV(G136:Y136) -> 11.998142390367441
B137: 002154.SZ | C137: 报喜鸟
B138: 600327.SH | C138: 大东方 | E138: 0.53820000000000001 | F138: 0.45400000000000001 | G138: 6.0199999999999997e-02 | H138: 0.1394 | I138: 0.1242 | J138: -6.8400000000000002e-02 | K138: -4.5499999999999999e-02 | L138: -0.24460000000000001 | M138: -0.26679999999999998 | N138: -5.9299999999999999e-02 | O138: -0.13100000000000001 | P138: -6.480000000000001e-02 | Q138: 1.1000000000000001e-02 | R138: -0.2432 | S138: -0.65069999999999995 | T138: -0.4199 | U138: -0.40000000000000002 | V138: 0.41270000000000001 | W138: 1.3921999999999999 | X138: 0.27610000000000001 | Y138: 1.7515000000000001 | AA138: =(N138+O138+P138+Q138+R138+S138+T138+U138+V138+W138+X138+Y138)/12 -> 0.15621666666666667 | AB138: =(G138+H138+I138+J138+K138+L138+M138+N138+O138+P138+Q138+R138+S138+T138+U138+V138+W138+X138+Y138)/19 -> 8.2794736842105268e-02 | AC138: =(R138+S138)/2 -> -0.44694999999999996 | AD138: =(S138+T138)/2 -> -0.5353 | AE138: =(T138+U138)/2 -> -0.40995000000000004 | AF138: =(U138+V138)/2 -> 6.3499999999999945e-03 | AG138: =(V138+W138)/2 -> 0.90244999999999997 | AH138: =(W138+X138)/2 -> 0.83414999999999995 | AI138: =(X138+Y138)/2 -> 1.0138 | AJ138: =STDEV(G138:Y138) -> 0.58416101801708764 | AK138: 0.75180000000000002 | AL138: 0.45219999999999999 | AM138: 0.20600000000000002
B139: 600106.SH | C139: 重庆路桥 | E139: 0.36549999999999999 | F139: 0.17 | G139: 0 | H139: -3.3799999999999997e-02 | I139: -0.125 | J139: -0.1333 | K139: 0 | L139: -0.125 | M139: -0.1429 | N139: -0.26919999999999999 | O139: 0.20000000000000001 | P139: -7.1400000000000005e-02 | Q139: -5.5599999999999997e-02 | R139: 0 | S139: -0.66669999999999996 | T139: -0.30769999999999997 | U139: -0.1176 | V139: -0.1053 | W139: 1.5 | X139: 0.22220000000000001 | Y139: 0.1333 | AA139: =(N139+O139+P139+Q139+R139+S139+T139+U139+V139+W139+X139+Y139)/12 -> 3.8500000000000027e-02 | AB139: =(G139+H139+I139+J139+K139+L139+M139+N139+O139+P139+Q139+R139+S139+T139+U139+V139+W139+X139+Y139)/19 -> -5.157894736842094e-03 | AC139: =(R139+S139)/2 -> -0.33334999999999998 | AD139: =(S139+T139)/2 -> -0.48719999999999997 | AE139: =(T139+U139)/2 -> -0.21264999999999998 | AF139: =(U139+V139)/2 -> -0.11144999999999999 | AG139: =(V139+W139)/2 -> 0.69735000000000003 | AH139: =(W139+X139)/2 -> 0.86109999999999998 | AI139: =(X139+Y139)/2 -> 0.17775000000000002 | AJ139: =STDEV(G139:Y139) -> 0.41311566757425411 | AK139: -47.42 | AL139: -41.42 | AM139: -32.14
B140: 600479.SH | C140: 千金药业
B141: 603090.SH | C141: 宏盛股份 | E141: 0.32490000000000002 | F141: 0.14999999999999999 | G141: -0.40000000000000002 | H141: -0.36799999999999999 | I141: -0.40539999999999998 | J141: -0.47700000000000004 | K141: -0.39390000000000003 | L141: -5.0599999999999999e-02 | M141: 0.13639999999999999 | N141: 0.32000000000000001 | O141: 0 | P141: 6.6699999999999995e-02 | Q141: 4.0000000000000001e-02 | R141: -6.0599999999999994e-02 | S141: -0.5 | T141: -0.1875 | U141: -0.34619999999999995 | V141: -0.7742 | W141: 0.5 | X141: -0.3846 | Y141: -5.8799999999999998e-02 | AA141: =(N141+O141+P141+Q141+R141+S141+T141+U141+V141+W141+X141+Y141)/12 -> -0.11543333333333333 | AB141: =(G141+H141+I141+J141+K141+L141+M141+N141+O141+P141+Q141+R141+S141+T141+U141+V141+W141+X141+Y141)/19 -> -0.17598421052631583 | AC141: =(R141+S141)/2 -> -0.28029999999999999 | AD141: =(S141+T141)/2 -> -0.34375 | AE141: =(T141+U141)/2 -> -0.26684999999999998 | AF141: =(U141+V141)/2 -> -0.56020000000000003 | AG141: =(V141+W141)/2 -> -0.1371 | AH141: =(W141+X141)/2 -> 5.7700000000000001e-02 | AI141: =(X141+Y141)/2 -> -0.22170000000000001 | AJ141: =STDEV(G141:Y141) -> 0.31561918555816226
B142: 002411.SZ | C142: 延安必康
B143: 000928.SZ | C143: 中钢国际
B144: 002731.SZ | C144: 萃华珠宝
B145: 002538.SZ | C145: 司尔特
B146: 002937.SZ | C146: 兴瑞科技 | E146: 0.22750000000000001 | F146: 0.29899999999999999 | M146: -0.25 | N146: -0.24590000000000001 | O146: 0.308 | P146: 9.0899999999999995e-02 | Q146: -9.3999999999999986e-03 | R146: 2.1700000000000001e-02 | S146: -0.38840000000000002 | T146: -0.16670000000000001 | U146: -0.1026 | V146: -8.5099999999999995e-02 | W146: 0.625 | X146: 5.0000000000000003e-02 | Y146: -6.25e-02 | AA146: =(N146+O146+P146+Q146+R146+S146+T146+U146+V146+W146+X146+Y146)/12 -> 2.9166666666666659e-03 | AB146: =(G146+H146+I146+J146+K146+L146+M146+N146+O146+P146+Q146+R146+S146+T146+U146+V146+W146+X146+Y146)/19 -> -1.1315789473684218e-02 | AC146: =(R146+S146)/2 -> -0.18335000000000001 | AD146: =(S146+T146)/2 -> -0.27755000000000002 | AE146: =(T146+U146)/2 -> -0.13464999999999999 | AF146: =(U146+V146)/2 -> -9.3849999999999989e-02 | AG146: =(V146+W146)/2 -> 0.26995000000000002 | AH146: =(W146+X146)/2 -> 0.33750000000000002 | AI146: =(X146+Y146)/2 -> -6.2499999999999986e-03 | AJ146: =STDEV(G146:Y146) -> 0.26085445666904478
B147: 002136.SZ | C147: 安纳达
B148: 600215.SH | C148: 派斯林 | E148: 0.62329999999999997 | F148: 0.252 | G148: 0.86430000000000007 | H148: -0.45740000000000003 | I148: -0.44310000000000005 | J148: -5.0000000000000003e-02 | K148: 8.3299999999999999e-02 | L148: 5 | M148: 7.9612999999999996 | N148: 10.0579 | O148: 20 | P148: -0.29699999999999999 | Q148: -0.111 | R148: -0.21179999999999999 | S148: -0.8488 | T148: -0.70209999999999995 | U148: 0.42719999999999997 | V148: 0.1069 | W148: 4.3608000000000002 | X148: 2.2397999999999998 | Y148: 0.22399999999999998 | AA148: =(N148+O148+P148+Q148+R148+S148+T148+U148+V148+W148+X148+Y148)/12 -> 2.9371583333333326 | AB148: =(G148+H148+I148+J148+K148+L148+M148+N148+O148+P148+Q148+R148+S148+T148+U148+V148+W148+X148+Y148)/19 -> 2.537068421052632 | AC148: =(R148+S148)/2 -> -0.53029999999999999 | AD148: =(S148+T148)/2 -> -0.77544999999999997 | AE148: =(T148+U148)/2 -> -0.13744999999999999 | AF148: =(U148+V148)/2 -> 0.26705000000000001 | AG148: =(V148+W148)/2 -> 2.2338500000000003 | AH148: =(W148+X148)/2 -> 3.3003 | AI148: =(X148+Y148)/2 -> 1.2319 | AJ148: =STDEV(G148:Y148) -> 5.2389790554450411
B149: 600470.SH | C149: 六国化工 | E149: 0.69879999999999998 | F149: 0.46000000000000002 | G149: 0.42859999999999998 | H149: 0.7258 | I149: 1.2521 | J149: 1.5833000000000002 | K149: 0 | L149: 2.7647000000000004 | M149: 1.3333000000000002 | N149: -9.2857000000000003 | O149: -1.5 | P149: 1.8333000000000002 | Q149: -0.71430000000000005 | R149: 0.56899999999999995 | S149: 0.90000000000000002 | T149: 0.52939999999999998 | U149: 13 | V149: 1.6399999999999999 | W149: 12 | X149: 1.2307999999999999 | Y149: 0.64290000000000003 | AA149: =(N149+O149+P149+Q149+R149+S149+T149+U149+V149+W149+X149+Y149)/12 -> 1.7371166666666664 | AB149: =(G149+H149+I149+J149+K149+L149+M149+N149+O149+P149+Q149+R149+S149+T149+U149+V149+W149+X149+Y149)/19 -> 1.5227999999999999 | AC149: =(R149+S149)/2 -> 0.73449999999999993 | AD149: =(S149+T149)/2 -> 0.7147 | AE149: =(T149+U149)/2 -> 6.7647000000000004 | AF149: =(U149+V149)/2 -> 7.3200000000000003 | AG149: =(V149+W149)/2 -> 6.8200000000000003 | AH149: =(W149+X149)/2 -> 6.6154000000000002 | AI149: =(X149+Y149)/2 -> 0.93684999999999996 | AJ149: =STDEV(G149:Y149) -> 4.6038878932195271
B150: 002540.SZ | C150: 亚太科技
B151: 600129.SH | C151: 太极集团
B152: 002892.SZ | C152: 科力尔
B153: 605006.SH | C153: 山东玻纤
B154: 000807.SZ | C154: 云铝股份
B155: 002452.SZ | C155: 长高集团 | E155: 0.41880000000000001 | F155: 0.309 | G155: -0.20000000000000001 | H155: 0.125 | I155: 6.1100000000000002e-02 | J155: -0.49780000000000002 | K155: -1.8333000000000002 | L155: -1.4040000000000001 | M155: -1.4317 | N155: -5.0434999999999999 | O155: 1.2333000000000001 | P155: 3.7000000000000002 | Q155: 4 | R155: 1.5505000000000002 | S155: 5.2857000000000003 | T155: 1.0463 | U155: 0.78890000000000005 | V155: 0.57069999999999999 | W155: 0.43180000000000002 | X155: 1.8100000000000002e-02 | Y155: 9.6300000000000011e-02 | AA155: =(N155+O155+P155+Q155+R155+S155+T155+U155+V155+W155+X155+Y155)/12 -> 1.1398416666666669 | AB155: =(G155+H155+I155+J155+K155+L155+M155+N155+O155+P155+Q155+R155+S155+T155+U155+V155+W155+X155+Y155)/19 -> 0.44723157894736854 | AC155: =(R155+S155)/2 -> 3.4181000000000004 | AD155: =(S155+T155)/2 -> 3.1660000000000004 | AE155: =(T155+U155)/2 -> 0.91759999999999997 | AF155: =(U155+V155)/2 -> 0.67979999999999996 | AG155: =(V155+W155)/2 -> 0.50124999999999997 | AH155: =(W155+X155)/2 -> 0.22495000000000001 | AI155: =(X155+Y155)/2 -> 5.7200000000000008e-02 | AJ155: =STDEV(G155:Y155) -> 2.2744752877318595
B156: 002108.SZ | C156: 沧州明珠
B157: 600392.SH | C157: 盛和资源
B158: 600641.SH | C158: 万业企业
B159: 603223.SH | C159: 恒通股份
B160: 002434.SZ | C160: 万里扬 | E160: 0.41119999999999995 | F160: 0.38100000000000001 | G160: 2.6000000000000001 | H160: 2.1000000000000001 | I160: 1.625 | J160: 0.59999999999999998 | K160: -0.44439999999999996 | L160: -0.3226 | M160: -0.35710000000000003 | N160: -0.45829999999999999 | O160: -0.10000000000000001 | P160: -0.1429 | Q160: 0 | R160: 0.15380000000000002 | S160: 0 | T160: 0.16670000000000001 | U160: 0.44439999999999996 | V160: 0.56669999999999998 | W160: 0.44439999999999996 | X160: 0.1429 | Y160: 0 | AA160: =(N160+O160+P160+Q160+R160+S160+T160+U160+V160+W160+X160+Y160)/12 -> 0.101475 | AB160: =(G160+H160+I160+J160+K160+L160+M160+N160+O160+P160+Q160+R160+S160+T160+U160+V160+W160+X160+Y160)/19 -> 0.36939999999999995 | AC160: =(R160+S160)/2 -> 7.690000000000001e-02 | AD160: =(S160+T160)/2 -> 8.3350000000000007e-02 | AE160: =(T160+U160)/2 -> 0.30554999999999999 | AF160: =(U160+V160)/2 -> 0.50554999999999994 | AG160: =(V160+W160)/2 -> 0.50554999999999994 | AH160: =(W160+X160)/2 -> 0.29364999999999997 | AI160: =(X160+Y160)/2 -> 7.145e-02 | AJ160: =STDEV(G160:Y160) -> 0.85099586563821417
B161: 600114.SH | C161: 东睦股份 | E161: 0.50529999999999997 | F161: 0.14000000000000001 | G161: 0 | H161: 0.20000000000000001 | I161: 0.1724 | J161: 4.3499999999999997e-02 | K161: 0.33329999999999999 | L161: 0.33329999999999999 | M161: 0.14710000000000001 | N161: 6.25e-02 | O161: -0.66670000000000007 | P161: -0.71879999999999999 | Q161: -0.66670000000000007 | R161: -3.9199999999999999e-02 | S161: 0 | T161: 0 | U161: -0.3846 | V161: -0.71430000000000005 | W161: 0.75 | X161: 0.11109999999999999 | Y161: 0.75 | AA161: =(N161+O161+P161+Q161+R161+S161+T161+U161+V161+W161+X161+Y161)/12 -> -0.12639166666666668 | AB161: =(G161+H161+I161+J161+K161+L161+M161+N161+O161+P161+Q161+R161+S161+T161+U161+V161+W161+X161+Y161)/19 -> -1.511052631578948e-02 | AC161: =(R161+S161)/2 -> -1.9599999999999999e-02 | AD161: =(S161+T161)/2 -> 0 | AE161: =(T161+U161)/2 -> -0.1923 | AF161: =(U161+V161)/2 -> -0.54944999999999999 | AG161: =(V161+W161)/2 -> 1.7849999999999977e-02 | AH161: =(W161+X161)/2 -> 0.43054999999999999 | AI161: =(X161+Y161)/2 -> 0.43054999999999999 | AJ161: =STDEV(G161:Y161) -> 0.44207031478756215 | AK161: 0.60089999999999999 | AL161: 0.46380000000000005 | AM161: 0.2742
B162: 002109.SZ | C162: 兴化股份
B163: 603663.SH | C163: 三祥新材 | E163: 0.26050000000000001 | F163: 0.35999999999999999 | G163: 0 | H163: 5.8799999999999998e-02 | I163: 6.9000000000000006e-02 | J163: 0.17649999999999999 | K163: 1 | L163: 0.27779999999999999 | M163: 0.129 | N163: -2.5000000000000001e-02 | O163: -0.375 | P163: 0 | Q163: 0 | R163: 0.12820000000000001 | S163: 0.10000000000000001 | T163: -0.1739 | U163: -0.34289999999999998 | V163: -0.2273 | W163: 9.0899999999999995e-02 | X163: 0.31579999999999997 | Y163: 0.56520000000000004 | AA163: =(N163+O163+P163+Q163+R163+S163+T163+U163+V163+W163+X163+Y163)/12 -> 4.6666666666666705e-03 | AB163: =(G163+H163+I163+J163+K163+L163+M163+N163+O163+P163+Q163+R163+S163+T163+U163+V163+W163+X163+Y163)/19 -> 9.3005263157894744e-02 | AC163: =(R163+S163)/2 -> 0.11410000000000001 | AD163: =(S163+T163)/2 -> -3.6949999999999997e-02 | AE163: =(T163+U163)/2 -> -0.25839999999999996 | AF163: =(U163+V163)/2 -> -0.28510000000000002 | AG163: =(V163+W163)/2 -> -6.8200000000000011e-02 | AH163: =(W163+X163)/2 -> 0.20334999999999998 | AI163: =(X163+Y163)/2 -> 0.4405 | AJ163: =STDEV(G163:Y163) -> 0.3130007605132476 | AK163: 0.1981 | AL163: 0.19800000000000001 | AM163: 0.19980000000000001
B164: 002837.SZ | C164: 英维克 | E164: 0.4647 | F164: 0.45300000000000001 | G164: -0.63159999999999994 | H164: -0.6825 | I164: -0.68480000000000008 | J164: -0.12240000000000001 | K164: -0.85709999999999997 | L164: 0.10000000000000001 | M164: 0.44829999999999998 | N164: 0.20929999999999999 | O164: 2 | P164: -0.2273 | Q164: -0.23809999999999998 | R164: -3.85e-02 | S164: 0 | T164: 0.4118 | U164: 0.19059999999999999 | V164: 0.14000000000000001 | W164: 2.3332999999999999 | X164: 0.375 | Y164: 0.2336 | AA164: =(N164+O164+P164+Q164+R164+S164+T164+U164+V164+W164+X164+Y164)/12 -> 0.44914166666666672 | AB164: =(G164+H164+I164+J164+K164+L164+M164+N164+O164+P164+Q164+R164+S164+T164+U164+V164+W164+X164+Y164)/19 -> 0.15576842105263161 | AC164: =(R164+S164)/2 -> -1.925e-02 | AD164: =(S164+T164)/2 -> 0.2059 | AE164: =(T164+U164)/2 -> 0.30120000000000002 | AF164: =(U164+V164)/2 -> 0.1653 | AG164: =(V164+W164)/2 -> 1.23665 | AH164: =(W164+X164)/2 -> 1.35415 | AI164: =(X164+Y164)/2 -> 0.30430000000000001 | AJ164: =STDEV(G164:Y164) -> 0.81144161086073063
B165: 603477.SH | C165: 巨星农牧
B166: 002533.SZ | C166: 金杯电工 | E166: 0.54420000000000002 | F166: 0.35899999999999999 | G166: -8.6999999999999994e-02 | H166: -8.5900000000000004e-02 | I166: -0.16170000000000001 | J166: -0.26860000000000001 | K166: 9.5199999999999993e-02 | L166: 0.1197 | M166: 1.52e-02 | N166: 6.1900000000000004e-02 | O166: 0.4783 | P166: 0.20610000000000001 | Q166: 0.26500000000000001 | R166: 0.47499999999999998 | S166: -1.2793999999999999 | T166: -0.29109999999999997 | U166: -1.9799999999999998e-02 | V166: 8.5000000000000006e-03 | W166: 5.2632000000000003 | X166: 1.0268000000000002 | Y166: 0.4476 | AA166: =(N166+O166+P166+Q166+R166+S166+T166+U166+V166+W166+X166+Y166)/12 -> 0.55350833333333338 | AB166: =(G166+H166+I166+J166+K166+L166+M166+N166+O166+P166+Q166+R166+S166+T166+U166+V166+W166+X166+Y166)/19 -> 0.32994736842105266 | AC166: =(R166+S166)/2 -> -0.40219999999999995 | AD166: =(S166+T166)/2 -> -0.78524999999999989 | AE166: =(T166+U166)/2 -> -0.15544999999999998 | AF166: =(U166+V166)/2 -> -5.6499999999999988e-03 | AG166: =(V166+W166)/2 -> 2.63585 | AH166: =(W166+X166)/2 -> 3.1450000000000005 | AI166: =(X166+Y166)/2 -> 0.73720000000000008 | AJ166: =STDEV(G166:Y166) -> 1.2762218238780789
B167: 603901.SH | C167: 永创智能
B168: 002445.SZ | C168: 中南文化 | E168: 0.2737 | F168: 0.14999999999999999 | G168: 1 | H168: 1.6666999999999998 | I168: 0.16670000000000001 | J168: 0.20000000000000001 | K168: 0.25 | L168: -0.625 | M168: -1.0952 | N168: -5.1666999999999996 | O168: -1.8 | P168: -2.6667000000000001 | Q168: -9 | R168: 0.48670000000000002 | S168: -0.5 | T168: -2 | U168: -0.84999999999999998 | V168: 1.0779000000000001 | W168: 3 | X168: 1.5667 | Y168: 1.4054 | AA168: =(N168+O168+P168+Q168+R168+S168+T168+U168+V168+W168+X168+Y168)/12 -> -1.203891666666667 | AB168: =(G168+H168+I168+J168+K168+L168+M168+N168+O168+P168+Q168+R168+S168+T168+U168+V168+W168+X168+Y168)/19 -> -0.67807894736842111 | AC168: =(R168+S168)/2 -> -6.6499999999999893e-03 | AD168: =(S168+T168)/2 -> -1.25 | AE168: =(T168+U168)/2 -> -1.425 | AF168: =(U168+V168)/2 -> 0.11395000000000005 | AG168: =(V168+W168)/2 -> 2.0389499999999998 | AH168: =(W168+X168)/2 -> 2.28335 | AI168: =(X168+Y168)/2 -> 1.4860500000000001 | AJ168: =STDEV(G168:Y168) -> 2.7346466035301216
B169: 603067.SH | C169: 振华股份
B170: 603277.SH | C170: 银都股份 | E170: 0.28289999999999998 | F170: 0.77600000000000002 | H170: -5.4100000000000002e-02 | I170: 0 | J170: -0.22219999999999998 | K170: -0.33329999999999999 | L170: -0.1714 | M170: -9.2600000000000002e-02 | N170: 0.10710000000000001 | O170: 0.75 | P170: 0.27589999999999998 | Q170: 0.1429 | R170: 0.19350000000000001 | S170: -0.1429 | T170: -0.2162 | U170: 3.5699999999999996e-02 | V170: 4.0500000000000001e-02 | W170: 0.75 | X170: 0.6552 | Y170: 0.3448 | AA170: =(N170+O170+P170+Q170+R170+S170+T170+U170+V170+W170+X170+Y170)/12 -> 0.24470833333333339 | AB170: =(G170+H170+I170+J170+K170+L170+M170+N170+O170+P170+Q170+R170+S170+T170+U170+V170+W170+X170+Y170)/19 -> 0.10857368421052631 | AC170: =(R170+S170)/2 -> 2.5300000000000003e-02 | AD170: =(S170+T170)/2 -> -0.17954999999999999 | AE170: =(T170+U170)/2 -> -9.0249999999999997e-02 | AF170: =(U170+V170)/2 -> 3.8099999999999995e-02 | AG170: =(V170+W170)/2 -> 0.39524999999999999 | AH170: =(W170+X170)/2 -> 0.7026 | AI170: =(X170+Y170)/2 -> 0.5 | AJ170: =STDEV(G170:Y170) -> 0.33020733321429541
B171: 601015.SH | C171: 陕西黑猫
B172: 601388.SH | C172: 怡球资源
B173: 002658.SZ | C173: 雪迪龙
B174: 601918.SH | C174: 新集能源 | E174: 0.69790000000000008 | F174: 0.93700000000000006 | G174: 9.75 | H174: 5 | I174: -0.34999999999999998 | J174: -0.90319999999999989 | K174: 0.95709999999999995 | L174: 4 | M174: 4.3845999999999998 | N174: 10.222200000000001 | O174: 0.14599999999999999 | P174: -3.3300000000000003e-02 | Q174: 1.1429 | R174: 1.198 | S174: -0.91720000000000002 | T174: -0.86209999999999998 | U174: -0.80000000000000004 | V174: 0.47299999999999998 | W174: 13.384600000000001 | X174: 10.25 | Y174: 3.6667000000000001 | AA174: =(N174+O174+P174+Q174+R174+S174+T174+U174+V174+W174+X174+Y174)/12 -> 3.1559000000000004 | AB174: =(G174+H174+I174+J174+K174+L174+M174+N174+O174+P174+Q174+R174+S174+T174+U174+V174+W174+X174+Y174)/19 -> 3.1952263157894736 | AC174: =(R174+S174)/2 -> 0.14039999999999997 | AD174: =(S174+T174)/2 -> -0.88965000000000005 | AE174: =(T174+U174)/2 -> -0.83105000000000007 | AF174: =(U174+V174)/2 -> -0.16350000000000003 | AG174: =(V174+W174)/2 -> 6.9288000000000007 | AH174: =(W174+X174)/2 -> 11.817299999999999 | AI174: =(X174+Y174)/2 -> 6.9583500000000003 | AJ174: =STDEV(G174:Y174) -> 4.5370187487480393
B175: 600444.SH | C175: 国机通用 | E175: 0.42710000000000004 | F175: 0.17000000000000001 | G175: 2.6000000000000001 | H175: 1.8140000000000001 | I175: 5 | J175: 9.8789999999999996 | K175: -1.25 | L175: 0.71430000000000005 | M175: 0.27779999999999999 | N175: -0.71779999999999999 | O175: 4.5 | P175: -0.16670000000000001 | Q175: -0.21739999999999998 | R175: 2.8900000000000002e-02 | S175: -0.47139999999999999 | T175: 0.20000000000000001 | U175: 0.38890000000000002 | V175: -6.1500000000000006e-02 | W175: 0.40539999999999998 | X175: 0.5 | Y175: -0.32000000000000001 | AA175: =(N175+O175+P175+Q175+R175+S175+T175+U175+V175+W175+X175+Y175)/12 -> 0.3390333333333333 | AB175: =(G175+H175+I175+J175+K175+L175+M175+N175+O175+P175+Q175+R175+S175+T175+U175+V175+W175+X175+Y175)/19 -> 1.2159736842105264 | AC175: =(R175+S175)/2 -> -0.22125 | AD175: =(S175+T175)/2 -> -0.13569999999999999 | AE175: =(T175+U175)/2 -> 0.29444999999999999 | AF175: =(U175+V175)/2 -> 0.16370000000000001 | AG175: =(V175+W175)/2 -> 0.17194999999999999 | AH175: =(W175+X175)/2 -> 0.45269999999999999 | AI175: =(X175+Y175)/2 -> 8.9999999999999997e-02 | AJ175: =STDEV(G175:Y175) -> 2.6716308231827459
B176: 002885.SZ | C176: 京泉华
B177: 600961.SH | C177: 株冶集团
B178: 603105.SH | C178: 芯能科技
B179: 002636.SZ | C179: 金安国纪
B180: 000682.SZ | C180: 东方电子
B181: 605300.SH | C181: 佳禾食品 | E181: 0.20440000000000003 | F181: 0.28999999999999998 | V181: -0.20000000000000001 | W181: 0.45450000000000002 | X181: -0.13639999999999999 | Y181: -0.27500000000000002 | AA181: =(N181+O181+P181+Q181+R181+S181+T181+U181+V181+W181+X181+Y181)/12 -> -1.3075000000000002e-02 | AB181: =(G181+H181+I181+J181+K181+L181+M181+N181+O181+P181+Q181+R181+S181+T181+U181+V181+W181+X181+Y181)/19 -> -8.2578947368421064e-03 | AC181: =(R181+S181)/2 -> 0 | AD181: =(S181+T181)/2 -> 0 | AE181: =(T181+U181)/2 -> 0 | AF181: =(U181+V181)/2 -> -0.10000000000000001 | AG181: =(V181+W181)/2 -> 0.12725 | AH181: =(W181+X181)/2 -> 0.15905000000000002 | AI181: =(X181+Y181)/2 -> -0.20569999999999999 | AJ181: =STDEV(G181:Y181) -> 0.33398892571461108
B182: 600963.SH | C182: 岳阳林纸
B183: 600505.SH | C183: 西昌电力
B184: 603178.SH | C184: 圣龙股份
B185: 000301.SZ | C185: 东方盛虹
B186: 603818.SH | C186: 曲美家居 | E186: 0.72049999999999992 | F186: 0.31 | G186: 0.66670000000000007 | H186: 0.4667 | I186: 0.28570000000000001 | J186: 0.34210000000000002 | K186: 0.20000000000000001 | L186: -0.31819999999999998 | M186: -0.44439999999999996 | N186: -1.2353000000000001 | O186: -0.66670000000000007 | P186: 0 | Q186: -0.20000000000000001 | R186: 2.4167000000000001 | S186: -4.5 | T186: -1.5333000000000001 | U186: -0.625 | V186: 0.17649999999999999 | W186: 2.5713999999999997 | X186: 3.75 | Y186: 4.1667000000000005 | AA186: =(N186+O186+P186+Q186+R186+S186+T186+U186+V186+W186+X186+Y186)/12 -> 0.36008333333333331 | AB186: =(G186+H186+I186+J186+K186+L186+M186+N186+O186+P186+Q186+R186+S186+T186+U186+V186+W186+X186+Y186)/19 -> 0.29050526315789477 | AC186: =(R186+S186)/2 -> -1.04165 | AD186: =(S186+T186)/2 -> -3.0166500000000003 | AE186: =(T186+U186)/2 -> -1.0791500000000001 | AF186: =(U186+V186)/2 -> -0.22425 | AG186: =(V186+W186)/2 -> 1.3739499999999998 | AH186: =(W186+X186)/2 -> 3.1606999999999998 | AI186: =(X186+Y186)/2 -> 3.9583500000000003 | AJ186: =STDEV(G186:Y186) -> 1.9508672044542665 | AK186: 0.47249999999999998 | AL186: 0.36820000000000003 | AM186: 0.2369
B187: 002378.SZ | C187: 章源钨业
B188: 600458.SH | C188: 时代新材 | E188: 0.69909999999999994 | F188: 0.19 | G188: -0.625 | H188: -0.82609999999999995 | I188: -0.71999999999999997 | J188: -0.69999999999999996 | K188: 0.33329999999999999 | L188: 1.5 | M188: 0.57140000000000002 | N188: -6.8888999999999996 | O188: 0 | P188: -0.90000000000000002 | Q188: -0.81819999999999993 | R188: 1.2075 | S188: -0.75 | T188: 1 | U188: 8.5 | V188: 2.7273000000000001 | W188: 9 | X188: 7.5 | Y188: 0 | AA188: =(N188+O188+P188+Q188+R188+S188+T188+U188+V188+W188+X188+Y188)/12 -> 1.7148083333333333 | AB188: =(G188+H188+I188+J188+K188+L188+M188+N188+O188+P188+Q188+R188+S188+T188+U188+V188+W188+X188+Y188)/19 -> 1.0584894736842105 | AC188: =(R188+S188)/2 -> 0.22875000000000001 | AD188: =(S188+T188)/2 -> 0.125 | AE188: =(T188+U188)/2 -> 4.75 | AF188: =(U188+V188)/2 -> 5.6136499999999998 | AG188: =(V188+W188)/2 -> 5.8636499999999998 | AH188: =(W188+X188)/2 -> 8.25 | AI188: =(X188+Y188)/2 -> 3.75 | AJ188: =STDEV(G188:Y188) -> 3.7444519677480081
B189: 600888.SH | C189: 新疆众和
B190: 601028.SH | C190: 玉龙股份 | E190: 0.17699999999999999 | F190: 0.39600000000000002 | G190: -0.9667 | H190: -1.0075000000000001 | I190: 1.2368000000000001 | J190: 1.1240999999999999 | K190: 4 | L190: 339.33330000000001 | M190: 0.22219999999999998 | N190: -0.72589999999999999 | O190: -3.02 | P190: -1.1044 | Q190: -1.1473 | R190: -6.4500000000000002e-02 | S190: 3.6633999999999998 | T190: 7.8867999999999991 | U190: 8.4074000000000009 | V190: 4.7355999999999998 | W190: 3.9739999999999998 | X190: 2.5630000000000002 | Y190: 2.3332999999999999 | AA190: =(N190+O190+P190+Q190+R190+S190+T190+U190+V190+W190+X190+Y190)/12 -> 2.2917833333333335 | AB190: =(G190+H190+I190+J190+K190+L190+M190+N190+O190+P190+Q190+R190+S190+T190+U190+V190+W190+X190+Y190)/19 -> 19.549663157894738 | AC190: =(R190+S190)/2 -> 1.7994499999999998 | AD190: =(S190+T190)/2 -> 5.7750999999999992 | AE190: =(T190+U190)/2 -> 8.1471 | AF190: =(U190+V190)/2 -> 6.5715000000000003 | AG190: =(V190+W190)/2 -> 4.3548 | AH190: =(W190+X190)/2 -> 3.2685 | AI190: =(X190+Y190)/2 -> 2.44815 | AJ190: =STDEV(G190:Y190) -> 77.500899370152212
B191: 605567.SH | C191: 春雪食品
B192: 603766.SH | C192: 隆鑫通用 | E192: 0.39399999999999996 | F192: 0.34599999999999997 | G192: -0.53390000000000004 | H192: 0.16329999999999997 | I192: 4.8399999999999999e-02 | J192: 9.5199999999999993e-02 | K192: -8.7799999999999989e-02 | L192: -0.16739999999999999 | M192: -9.1199999999999989e-02 | N192: -4.3499999999999997e-02 | O192: -1.3999999999999999e-02 | P192: -6.13e-02 | Q192: 7.7000000000000002e-03 | R192: -0.31819999999999998 | S192: -0.47409999999999997 | T192: -0.16020000000000001 | U192: -0.19750000000000001 | V192: -0.23329999999999998 | W192: 0.60350000000000004 | X192: 0.61399999999999999 | Y192: 0.44209999999999999 | AA192: =(N192+O192+P192+Q192+R192+S192+T192+U192+V192+W192+X192+Y192)/12 -> 1.3766666666666654e-02 | AB192: =(G192+H192+I192+J192+K192+L192+M192+N192+O192+P192+Q192+R192+S192+T192+U192+V192+W192+X192+Y192)/19 -> -2.14842105263158e-02 | AC192: =(R192+S192)/2 -> -0.39615 | AD192: =(S192+T192)/2 -> -0.31714999999999999 | AE192: =(T192+U192)/2 -> -0.17885000000000001 | AF192: =(U192+V192)/2 -> -0.21539999999999998 | AG192: =(V192+W192)/2 -> 0.18510000000000004 | AH192: =(W192+X192)/2 -> 0.60875000000000001 | AI192: =(X192+Y192)/2 -> 0.52805000000000002 | AJ192: =STDEV(G192:Y192) -> 0.31145607905656064 | AK192: 0.31950000000000001 | AL192: 0.34869999999999995 | AM192: 0.30959999999999999
B193: 600623.SH | C193: 华谊集团
B194: 000937.SZ | C194: 冀中能源
B195: 603906.SH | C195: 龙蟠科技
B196: 603527.SH | C196: 众源新材
B197: 002010.SZ | C197: 传化智联
B198: 000761.SZ | C198: 本钢板材
B199: 002246.SZ | C199: 北化股份
B200: 002741.SZ | C200: 光华科技
B201: 603595.SH | C201: 东尼电子
B202: 603978.SH | C202: 深圳新星
B203: 601600.SH | C203: 中国铝业
B204: 002598.SZ | C204: 山东章鼓 | E204: 3.3e-03 | F204: 45.240000000000002 | G204: 0.19390000000000002 | H204: 0.23379999999999998 | I204: 0.21390000000000001 | J204: 0.2447 | K204: 6.8499999999999991e-02 | L204: 0.22219999999999998 | M204: 0.21870000000000001 | N204: 0.2087 | O204: 0.19949999999999998 | P204: 0.12740000000000001 | Q204: 0.11119999999999999 | R204: -0.10550000000000001 | S204: -0.24160000000000001 | T204: 0.2009 | U204: 0.1288 | V204: 8.5099999999999995e-02 | W204: 0.53259999999999996 | X204: 0.20199999999999999 | Y204: 0.24440000000000001 | AA204: =(N204+O204+P204+Q204+R204+S204+T204+U204+V204+W204+X204+Y204)/12 -> 0.14112499999999997 | AB204: =(G204+H204+I204+J204+K204+L204+M204+N204+O204+P204+Q204+R204+S204+T204+U204+V204+W204+X204+Y204)/19 -> 0.16258947368421053 | AC204: =(R204+S204)/2 -> -0.17355000000000001 | AD204: =(S204+T204)/2 -> -2.0350000000000007e-02 | AE204: =(T204+U204)/2 -> 0.16485 | AF204: =(U204+V204)/2 -> 0.10694999999999999 | AG204: =(V204+W204)/2 -> 0.30884999999999996 | AH204: =(W204+X204)/2 -> 0.36729999999999996 | AI204: =(X204+Y204)/2 -> 0.22320000000000001 | AJ204: =STDEV(G204:Y204) -> 0.15408469133974068
B205: 600673.SH | C205: 东阳光
B206: 002988.SZ | C206: 豪美新材
B207: 002559.SZ | C207: 亚威股份
B208: 603612.SH | C208: 索通发展
B209: 002203.SZ | C209: 海亮股份 | E209: 0.63859999999999995 | F209: 0.46899999999999997 | G209: 0.50749999999999995 | H209: 0.36349999999999999 | I209: 0.44950000000000001 | J209: 0.2787 | K209: 0.24109999999999998 | L209: 0.36340000000000006 | M209: 0.1973 | N209: 0.2364 | O209: 3.5499999999999997e-02 | P209: 9.7000000000000003e-03 | Q209: 2.6000000000000002e-02 | R209: 6.7699999999999996e-02 | S209: -0.42820000000000003 | T209: -0.4244 | U209: -0.32650000000000001 | V209: -0.37630000000000002 | W209: 0.60289999999999999 | X209: 0.69969999999999999 | Y209: 0.68559999999999999 | AA209: =(N209+O209+P209+Q209+R209+S209+T209+U209+V209+W209+X209+Y209)/12 -> 6.7341666666666647e-02 | AB209: =(G209+H209+I209+J209+K209+L209+M209+N209+O209+P209+Q209+R209+S209+T209+U209+V209+W209+X209+Y209)/19 -> 0.16889999999999997 | AC209: =(R209+S209)/2 -> -0.18025000000000002 | AD209: =(S209+T209)/2 -> -0.42630000000000001 | AE209: =(T209+U209)/2 -> -0.37545000000000001 | AF209: =(U209+V209)/2 -> -0.35140000000000005 | AG209: =(V209+W209)/2 -> 0.11329999999999998 | AH209: =(W209+X209)/2 -> 0.65129999999999999 | AI209: =(X209+Y209)/2 -> 0.69264999999999999 | AJ209: =STDEV(G209:Y209) -> 0.36161677843325307 | AK209: 0.59040000000000004 | AL209: 0.28589999999999999 | AM209: 0.60319999999999996
B210: 601107.SH | C210: 四川成渝
B211: 000635.SZ | C211: 英力特
B212: 605162.SH | C212: 新中港
B213: 600873.SH | C213: 梅花生物
B214: 601515.SH | C214: 东风股份
B215: 002923.SZ | C215: 润都股份
B216: 002232.SZ | C216: 启明信息 | E216: 0.36219999999999997 | F216: 0.109 | G216: 0.8234999999999999 | H216: 3.8999999999999999 | I216: 41.727299999999993 | J216: 0.16350000000000001 | K216: -6.4500000000000002e-02 | L216: 2.7414999999999998 | M216: 1.0915000000000001 | N216: 0.35639999999999999 | O216: 4.3102999999999998 | P216: -8.900000000000001e-02 | Q216: 4.4800000000000006e-02 | R216: 0.25879999999999997 | S216: -0.31170000000000003 | T216: 2.1276999999999999 | U216: 1.1081000000000001 | V216: 0.39500000000000002 | W216: 0.29249999999999998 | X216: -0.40909999999999996 | Y216: -0.49700000000000005 | AA216: =(N216+O216+P216+Q216+R216+S216+T216+U216+V216+W216+X216+Y216)/12 -> 0.63223333333333331 | AB216: =(G216+H216+I216+J216+K216+L216+M216+N216+O216+P216+Q216+R216+S216+T216+U216+V216+W216+X216+Y216)/19 -> 3.0510315789473679 | AC216: =(R216+S216)/2 -> -2.6450000000000029e-02 | AD216: =(S216+T216)/2 -> 0.90799999999999992 | AE216: =(T216+U216)/2 -> 1.6179000000000001 | AF216: =(U216+V216)/2 -> 0.75155000000000005 | AG216: =(V216+W216)/2 -> 0.34375 | AH216: =(W216+X216)/2 -> -5.8299999999999991e-02 | AI216: =(X216+Y216)/2 -> -0.45305000000000001 | AJ216: =STDEV(G216:Y216) -> 9.4698863060787843
B217: 002060.SZ | C217: 粤水电 | E217: 0.87069999999999992 | F217: 0.26600000000000001 | G217: -0.47369999999999995 | H217: -0.49880000000000002 | I217: -0.47909999999999997 | J217: 0.1741 | K217: 0.10589999999999999 | L217: 0.21960000000000002 | M217: 0.26579999999999998 | N217: 0.27000000000000002 | O217: 0.37229999999999996 | P217: 0.33140000000000003 | Q217: 0.32170000000000004 | R217: 0.1653 | S217: 0.1628 | T217: 0.28920000000000001 | U217: 0.48170000000000002 | V217: 0.12640000000000001 | W217: 0.36670000000000003 | X217: 0.47659999999999997 | Y217: 0.32650000000000001 | AA217: =(N217+O217+P217+Q217+R217+S217+T217+U217+V217+W217+X217+Y217)/12 -> 0.30754999999999999 | AB217: =(G217+H217+I217+J217+K217+L217+M217+N217+O217+P217+Q217+R217+S217+T217+U217+V217+W217+X217+Y217)/19 -> 0.1581263157894737 | AC217: =(R217+S217)/2 -> 0.16405 | AD217: =(S217+T217)/2 -> 0.22600000000000001 | AE217: =(T217+U217)/2 -> 0.38545000000000001 | AF217: =(U217+V217)/2 -> 0.30405000000000004 | AG217: =(V217+W217)/2 -> 0.24655000000000002 | AH217: =(W217+X217)/2 -> 0.42164999999999997 | AI217: =(X217+Y217)/2 -> 0.40154999999999996 | AJ217: =STDEV(G217:Y217) -> 0.30428184274544123
B218: 603033.SH | C218: 三维股份
B219: 600854.SH | C219: 春兰股份 | E219: 0.21329999999999999 | F219: 0.188 | G219: -1.1207 | H219: 0.5131 | I219: 0.46880000000000005 | J219: 0.4592 | K219: 4.4354000000000005 | L219: 0.3931 | M219: 0.9294 | N219: 1.3118000000000001 | O219: -1.1841999999999999 | P219: -0.49609999999999999 | Q219: -0.58350000000000002 | R219: -0.3397 | S219: -5.3800000000000001e-02 | T219: -0.20949999999999999 | U219: 0.25390000000000001 | V219: 0.4778 | W219: 2.0102000000000002 | X219: -0.92130000000000001 | Y219: 0.80519999999999992 | AA219: =(N219+O219+P219+Q219+R219+S219+T219+U219+V219+W219+X219+Y219)/12 -> 8.9233333333333345e-02 | AB219: =(G219+H219+I219+J219+K219+L219+M219+N219+O219+P219+Q219+R219+S219+T219+U219+V219+W219+X219+Y219)/19 -> 0.37626842105263164 | AC219: =(R219+S219)/2 -> -0.19675000000000001 | AD219: =(S219+T219)/2 -> -0.13164999999999999 | AE219: =(T219+U219)/2 -> 2.2200000000000011e-02 | AF219: =(U219+V219)/2 -> 0.36585000000000001 | AG219: =(V219+W219)/2 -> 1.2440000000000002 | AH219: =(W219+X219)/2 -> 0.5444500000000001 | AI219: =(X219+Y219)/2 -> -5.8050000000000046e-02 | AJ219: =STDEV(G219:Y219) -> 1.2835216892305117
B220: 000626.SZ | C220: 远大控股 | E220: 0.63190000000000002 | F220: 0.41999999999999998 | G220: -0.6079 | H220: -0.42579999999999996 | I220: -0.46929999999999999 | J220: -1.4266999999999999 | K220: -1.3125 | L220: -1.1453 | M220: -0.89939999999999998 | N220: 1.25 | O220: 2 | P220: 2.3332999999999999 | Q220: 2.0318000000000001 | R220: 2.875 | S220: -7 | T220: -3.25 | U220: -1.8065 | V220: -1.6774 | W220: 1.3999999999999999 | X220: 2.3889 | Y220: 5.0999999999999996 | AA220: =(N220+O220+P220+Q220+R220+S220+T220+U220+V220+W220+X220+Y220)/12 -> 0.47042499999999993 | AB220: =(G220+H220+I220+J220+K220+L220+M220+N220+O220+P220+Q220+R220+S220+T220+U220+V220+W220+X220+Y220)/19 -> -3.3778947368421047e-02 | AC220: =(R220+S220)/2 -> -2.0625 | AD220: =(S220+T220)/2 -> -5.125 | AE220: =(T220+U220)/2 -> -2.5282499999999999 | AF220: =(U220+V220)/2 -> -1.7419500000000001 | AG220: =(V220+W220)/2 -> -0.13870000000000005 | AH220: =(W220+X220)/2 -> 1.89445 | AI220: =(X220+Y220)/2 -> 3.7444499999999996 | AJ220: =STDEV(G220:Y220) -> 2.6806431043437127 | AK220: 0.74360000000000004 | AL220: 0.65799999999999992 | AM220: 0.47670000000000001
B221: 603889.SH | C221: 新澳股份 | E221: 0.29920000000000002 | F221: 0.5 | G221: 0.10000000000000001 | H221: 0.16670000000000001 | I221: 6.8199999999999997e-02 | J221: 0.17999999999999999 | K221: -0.18179999999999999 | L221: -0.34289999999999998 | M221: -0.2979 | N221: -0.33899999999999997 | O221: 0.11109999999999999 | P221: 0.13039999999999999 | Q221: -0.1515 | R221: -0.28210000000000002 | S221: 0.29999999999999999 | T221: -0.30769999999999997 | U221: -0.28570000000000001 | V221: 7.1399999999999991e-02 | W221: -0.23079999999999998 | X221: 0.88890000000000002 | Y221: 1.5 | AA221: =(N221+O221+P221+Q221+R221+S221+T221+U221+V221+W221+X221+Y221)/12 -> 0.11708333333333333 | AB221: =(G221+H221+I221+J221+K221+L221+M221+N221+O221+P221+Q221+R221+S221+T221+U221+V221+W221+X221+Y221)/19 -> 5.7752631578947375e-02 | AC221: =(R221+S221)/2 -> 8.9499999999999857e-03 | AD221: =(S221+T221)/2 -> -3.8499999999999923e-03 | AE221: =(T221+U221)/2 -> -0.29669999999999996 | AF221: =(U221+V221)/2 -> -0.10715000000000001 | AG221: =(V221+W221)/2 -> -7.9699999999999993e-02 | AH221: =(W221+X221)/2 -> 0.32905000000000001 | AI221: =(X221+Y221)/2 -> 1.19445 | AJ221: =STDEV(G221:Y221) -> 0.46322893592264225 | AK221: 0.2114 | AL221: 0.57989999999999997 | AM221: 0.55189999999999995
B222: 603028.SH | C222: 赛福天 | E222: 0.33509999999999995 | F222: 0.13 | G222: -0.20000000000000001 | H222: -0.18179999999999999 | I222: -0.26669999999999999 | J222: -0.26669999999999999 | K222: -0.5 | L222: -0.55559999999999998 | M222: -0.54549999999999998 | N222: -0.2727 | O222: 0 | P222: -0.5 | Q222: -0.40000000000000002 | R222: -0.125 | S222: -0.5 | T222: 2 | U222: 3 | V222: 2.4286000000000003 | W222: 3 | X222: 0.33329999999999999 | Y222: 8.3299999999999999e-02 | AA222: =(N222+O222+P222+Q222+R222+S222+T222+U222+V222+W222+X222+Y222)/12 -> 0.75395833333333329 | AB222: =(G222+H222+I222+J222+K222+L222+M222+N222+O222+P222+Q222+R222+S222+T222+U222+V222+W222+X222+Y222)/19 -> 0.34374736842105269 | AC222: =(R222+S222)/2 -> -0.3125 | AD222: =(S222+T222)/2 -> 0.75 | AE222: =(T222+U222)/2 -> 2.5 | AF222: =(U222+V222)/2 -> 2.7143000000000002 | AG222: =(V222+W222)/2 -> 2.7143000000000002 | AH222: =(W222+X222)/2 -> 1.66665 | AI222: =(X222+Y222)/2 -> 0.20829999999999999 | AJ222: =STDEV(G222:Y222) -> 1.2381124488369029
B223: 000650.SZ | C223: 仁和药业
B224: 002790.SZ | C224: 瑞尔特 | E224: 0.20710000000000001 | F224: 0.33500000000000002 | G224: 8.1199999999999994e-02 | H224: -0.34689999999999999 | I224: -0.37719999999999998 | J224: -0.46149999999999997 | K224: -0.66920000000000002 | L224: -0.3125 | M224: -7.0800000000000002e-02 | N224: -0.38100000000000001 | O224: 0.1429 | P224: -9.0899999999999995e-02 | Q224: -0.29630000000000001 | R224: 0.12820000000000001 | S224: -0.375 | T224: -0.45000000000000001 | U224: -0.4108 | V224: -0.36359999999999998 | W224: 0.40000000000000002 | X224: 0.2727 | Y224: 0.4587 | AA224: =(N224+O224+P224+Q224+R224+S224+T224+U224+V224+W224+X224+Y224)/12 -> -8.0425000000000038e-02 | AB224: =(G224+H224+I224+J224+K224+L224+M224+N224+O224+P224+Q224+R224+S224+T224+U224+V224+W224+X224+Y224)/19 -> -0.16431578947368428 | AC224: =(R224+S224)/2 -> -0.1234 | AD224: =(S224+T224)/2 -> -0.41249999999999998 | AE224: =(T224+U224)/2 -> -0.4304 | AF224: =(U224+V224)/2 -> -0.38719999999999999 | AG224: =(V224+W224)/2 -> 1.8200000000000022e-02 | AH224: =(W224+X224)/2 -> 0.33635000000000004 | AI224: =(X224+Y224)/2 -> 0.36570000000000003 | AJ224: =STDEV(G224:Y224) -> 0.32374797341820943 | AK224: 0.5171 | AL224: 0.46759999999999996 | AM224: 0.52039999999999997
B225: 601890.SH | C225: 亚星锚链
B226: 605333.SH | C226: 沪光股份
B227: 603168.SH | C227: 莎普爱思
B228: 603002.SH | C228: 宏昌电子
B229: 600171.SH | C229: 上海贝岭
B230: 603020.SH | C230: 爱普股份
B231: 600594.SH | C231: 益佰制药
B232: 002442.SZ | C232: 龙星化工
B233: 002317.SZ | C233: 众生药业 | E233: 0.21170000000000003 | F233: 0.39000000000000001 | G233: 7.690000000000001e-02 | H233: 0 | I233: -4.8799999999999996e-02 | J233: -5.45e-02 | K233: 7.1399999999999991e-02 | L233: 9.6799999999999997e-02 | M233: 0.1026 | N233: 3.85e-02 | O233: 0 | P233: 8.8200000000000001e-02 | Q233: 4.6500000000000007e-02 | R233: -0.27779999999999999 | S233: -0.5333 | T233: -0.35139999999999999 | U233: -0.15560000000000002 | V233: -2.359 | W233: 0 | X233: 0.5 | Y233: 2.63e-02 | AA233: =(N233+O233+P233+Q233+R233+S233+T233+U233+V233+W233+X233+Y233)/12 -> -0.24813333333333332 | AB233: =(G233+H233+I233+J233+K233+L233+M233+N233+O233+P233+Q233+R233+S233+T233+U233+V233+W233+X233+Y233)/19 -> -0.14385263157894737 | AC233: =(R233+S233)/2 -> -0.40554999999999997 | AD233: =(S233+T233)/2 -> -0.44235000000000002 | AE233: =(T233+U233)/2 -> -0.2535 | AF233: =(U233+V233)/2 -> -1.2573000000000001 | AG233: =(V233+W233)/2 -> -1.1795 | AH233: =(W233+X233)/2 -> 0.25 | AI233: =(X233+Y233)/2 -> 0.26315 | AJ233: =STDEV(G233:Y233) -> 0.57635606892539482
B234: 000959.SZ | C234: 首钢股份
B235: 603166.SH | C235: 福达股份
B236: 600105.SH | C236: 永鼎股份
B237: 001216.SZ | C237: 华瓷股份
B238: 600063.SH | C238: 皖维高新
B239: 605086.SH | C239: 龙高股份
B240: 002345.SZ | C240: 潮宏基 | E240: 0.35259999999999997 | F240: 0.32000000000000001 | G240: 0.10000000000000001 | H240: 0.1176 | I240: 0.1739 | J240: 0.43479999999999996 | K240: -9.0899999999999995e-02 | L240: -5.2600000000000001e-02 | M240: -7.4099999999999999e-02 | N240: -0.75760000000000005 | O240: 0 | P240: -0.16670000000000001 | Q240: -0.12 | R240: 0.125 | S240: -1.3 | T240: -0.93330000000000002 | U240: -0.59089999999999998 | V240: 0.77780000000000005 | W240: 5 | X240: 22 | Y240: 2.5556000000000001 | AA240: =(N240+O240+P240+Q240+R240+S240+T240+U240+V240+W240+X240+Y240)/12 -> 2.2158250000000002 | AB240: =(G240+H240+I240+J240+K240+L240+M240+N240+O240+P240+Q240+R240+S240+T240+U240+V240+W240+X240+Y240)/19 -> 1.4315052631578946 | AC240: =(R240+S240)/2 -> -0.58750000000000002 | AD240: =(S240+T240)/2 -> -1.1166499999999999 | AE240: =(T240+U240)/2 -> -0.7621 | AF240: =(U240+V240)/2 -> 9.3450000000000033e-02 | AG240: =(V240+W240)/2 -> 2.8889 | AH240: =(W240+X240)/2 -> 13.5 | AI240: =(X240+Y240)/2 -> 12.277799999999999 | AJ240: =STDEV(G240:Y240) -> 5.1693689217751917
B241: 603159.SH | C241: 上海亚虹
B242: 605116.SH | C242: 奥锐特
B243: 000688.SZ | C243: 国城矿业 | E243: 0.433 | F243: 0.13600000000000001 | G243: 7.5842999999999998 | H243: 2.9388000000000001 | I243: 1.3341000000000001 | J243: 0.76019999999999999 | K243: 0.27229999999999999 | L243: 6.08e-02 | M243: -0.1351 | N243: -1.7899999999999999e-02 | O243: 4.3200000000000002e-02 | P243: -0.39520000000000005 | Q243: -0.37689999999999996 | R243: -0.56810000000000005 | S243: -0.76329999999999998 | T243: -0.67110000000000003 | U243: -0.52579999999999993 | V243: -0.1268 | W243: 0.88749999999999996 | X243: 1.4687999999999999 | Y243: 0.76819999999999988 | AA243: =(N243+O243+P243+Q243+R243+S243+T243+U243+V243+W243+X243+Y243)/12 -> -2.3116666666666702e-02 | AB243: =(G243+H243+I243+J243+K243+L243+M243+N243+O243+P243+Q243+R243+S243+T243+U243+V243+W243+X243+Y243)/19 -> 0.65989473684210542 | AC243: =(R243+S243)/2 -> -0.66569999999999996 | AD243: =(S243+T243)/2 -> -0.71720000000000006 | AE243: =(T243+U243)/2 -> -0.59844999999999993 | AF243: =(U243+V243)/2 -> -0.32629999999999998 | AG243: =(V243+W243)/2 -> 0.38034999999999997 | AH243: =(W243+X243)/2 -> 1.17815 | AI243: =(X243+Y243)/2 -> 1.1184999999999998 | AJ243: =STDEV(G243:Y243) -> 1.9122715161915234
B244: 601058.SH | C244: 赛轮轮胎
B245: 603045.SH | C245: 福达合金
B246: 002125.SZ | C246: 湘潭电化
B247: 603776.SH | C247: 永安行
B248: 600552.SH | C248: 凯盛科技
B249: 600889.SH | C249: 南京化纤
B250: 603987.SH | C250: 康德莱
B251: 600808.SH | C251: 马钢股份
B252: 003037.SZ | C252: 三和管桩
B253: 002566.SZ | C253: 益盛药业 | E253: 0.2208 | F253: 0.19700000000000001 | G253: 0.26479999999999998 | H253: 0.10869999999999999 | I253: 0.41340000000000005 | J253: 3.5488999999999997 | K253: 0.1101 | L253: 0.3382 | M253: 0.20679999999999998 | N253: 0.14990000000000001 | O253: -0.17069999999999999 | P253: 1.9400000000000001e-02 | Q253: 4.1100000000000005e-02 | R253: 0.10880000000000001 | S253: 0.27250000000000002 | T253: -0.1802 | U253: -2.0299999999999999e-02 | V253: 4.5400000000000003e-02 | W253: 0.2928 | X253: 0.2601 | Y253: 0.2046 | AA253: =(N253+O253+P253+Q253+R253+S253+T253+U253+V253+W253+X253+Y253)/12 -> 8.5283333333333336e-02 | AB253: =(G253+H253+I253+J253+K253+L253+M253+N253+O253+P253+Q253+R253+S253+T253+U253+V253+W253+X253+Y253)/19 -> 0.31654210526315785 | AC253: =(R253+S253)/2 -> 0.19065000000000001 | AD253: =(S253+T253)/2 -> 4.615000000000001e-02 | AE253: =(T253+U253)/2 -> -0.10025000000000001 | AF253: =(U253+V253)/2 -> 1.2550000000000002e-02 | AG253: =(V253+W253)/2 -> 0.1691 | AH253: =(W253+X253)/2 -> 0.27644999999999997 | AI253: =(X253+Y253)/2 -> 0.23235 | AJ253: =STDEV(G253:Y253) -> 0.79871326611117965
B254: 002527.SZ | C254: 新时达
B255: 603011.SH | C255: 合锻智能
B256: 000153.SZ | C256: 丰原药业
B257: 000848.SZ | C257: 承德露露
B258: 000676.SZ | C258: 智度股份
B259: 600645.SH | C259: 中源协和
B260: 603977.SH | C260: 国泰集团
B261: 002255.SZ | C261: 海陆重工 | E261: 0.44020000000000004 | F261: 0.32300000000000001 | G261: 0.43479999999999996 | H261: 0.62170000000000003 | I261: 0.40960000000000002 | J261: 0.29749999999999999 | K261: 0.30299999999999999 | L261: 0.69569999999999999 | M261: 0.3427 | N261: -2.2751999999999999 | O261: 0.79769999999999996 | P261: 0.36049999999999999 | Q261: -0.46850000000000003 | R261: -9.938600000000001 | S261: -0.46179999999999999 | T261: 2.8483000000000001 | U261: 8.4802 | V261: 1.4283000000000001 | W261: 1.1466000000000001 | X261: -0.75980000000000003 | Y261: -0.59219999999999995 | AA261: =(N261+O261+P261+Q261+R261+S261+T261+U261+V261+W261+X261+Y261)/12 -> 4.7124999999999945e-02 | AB261: =(G261+H261+I261+J261+K261+L261+M261+N261+O261+P261+Q261+R261+S261+T261+U261+V261+W261+X261+Y261)/19 -> 0.19318421052631568 | AC261: =(R261+S261)/2 -> -5.2002000000000006 | AD261: =(S261+T261)/2 -> 1.1932499999999999 | AE261: =(T261+U261)/2 -> 5.66425 | AF261: =(U261+V261)/2 -> 4.95425 | AG261: =(V261+W261)/2 -> 1.2874500000000002 | AH261: =(W261+X261)/2 -> 0.19340000000000002 | AI261: =(X261+Y261)/2 -> -0.67599999999999993 | AJ261: =STDEV(G261:Y261) -> 3.2512961925059227
B262: 603933.SH | C262: 睿能科技
B263: 000630.SZ | C263: 铜陵有色
B264: 600288.SH | C264: 大恒科技 | E264: 41.21 | F264: 0.20599999999999999 | G264: 0.46750000000000003 | H264: 0.46619999999999995 | I264: 2.1441999999999997 | J264: 0.1875 | K264: 1.8386000000000002 | L264: 5.9113999999999995 | M264: 5.0755999999999997 | N264: 0.45240000000000002 | O264: -1.7981 | P264: -0.96389999999999998 | Q264: 5.5000000000000005e-03 | R264: 0.44350000000000001 | S264: -5.6528999999999998 | T264: -37 | U264: -0.52680000000000005 | V264: -0.217 | W264: 0.51280000000000003 | X264: 2.8193999999999999 | Y264: 2.0813999999999999 | AA264: =(N264+O264+P264+Q264+R264+S264+T264+U264+V264+W264+X264+Y264)/12 -> -3.3203083333333332 | AB264: =(G264+H264+I264+J264+K264+L264+M264+N264+O264+P264+Q264+R264+S264+T264+U264+V264+W264+X264+Y264)/19 -> -1.2501421052631578 | AC264: =(R264+S264)/2 -> -2.6046999999999998 | AD264: =(S264+T264)/2 -> -21.326450000000001 | AE264: =(T264+U264)/2 -> -18.763400000000001 | AF264: =(U264+V264)/2 -> -0.37190000000000001 | AG264: =(V264+W264)/2 -> 0.14790000000000003 | AH264: =(W264+X264)/2 -> 1.6660999999999999 | AI264: =(X264+Y264)/2 -> 2.4504000000000001 | AJ264: =STDEV(G264:Y264) -> 8.9995338162173582 | AK264: 13.38 | AL264: 16.08 | AM264: 3.93
B265: 002046.SZ | C265: 国机精工
B266: 002520.SZ | C266: 日发精机
B267: 002556.SZ | C267: 辉隆股份 | E267: 0.60750000000000004 | F267: 0.46800000000000003 | G267: 0.5 | H267: 5.2199999999999996e-02 | I267: 0.21429999999999999 | J267: 0.32869999999999999 | K267: 0.16670000000000001 | L267: 0.1479 | M267: 0.1176 | N267: 0.26319999999999999 | O267: 0 | P267: 0.16519999999999999 | Q267: 0.10529999999999999 | R267: -4.1700000000000001e-02 | S267: 0.1429 | T267: 0.23530000000000001 | U267: 0.28570000000000001 | V267: 0.13039999999999999 | W267: 1.5 | X267: 0.85709999999999997 | Y267: 0.81480000000000008 | AA267: =(N267+O267+P267+Q267+R267+S267+T267+U267+V267+W267+X267+Y267)/12 -> 0.37151666666666666 | AB267: =(G267+H267+I267+J267+K267+L267+M267+N267+O267+P267+Q267+R267+S267+T267+U267+V267+W267+X267+Y267)/19 -> 0.31503157894736838 | AC267: =(R267+S267)/2 -> 5.0599999999999999e-02 | AD267: =(S267+T267)/2 -> 0.18909999999999999 | AE267: =(T267+U267)/2 -> 0.26050000000000001 | AF267: =(U267+V267)/2 -> 0.20805000000000001 | AG267: =(V267+W267)/2 -> 0.81520000000000004 | AH267: =(W267+X267)/2 -> 1.17855 | AI267: =(X267+Y267)/2 -> 0.83594999999999997 | AJ267: =STDEV(G267:Y267) -> 0.373932548957149
B268: 605299.SH | C268: 舒华体育
B269: 000933.SZ | C269: 神火股份
B270: 605108.SH | C270: 同庆楼
B271: 000917.SZ | C271: 电广传媒
B272: 000821.SZ | C272: 京山轻机 | E272: 0.59719999999999995 | F272: 0.23200000000000001 | G272: 14 | H272: 1.5 | I272: 1.4443999999999999 | J272: 0.55559999999999998 | K272: 1.6666999999999998 | L272: 1.7333000000000001 | M272: 1.2726999999999999 | N272: -0.1429 | O272: 1.25 | P272: -0.39020000000000005 | Q272: -0.46000000000000002 | R272: -5.0832999999999995 | S272: -0.83329999999999993 | T272: -0.56000000000000005 | U272: -0.37040000000000001 | V272: 1.1020000000000001 | W272: 3 | X272: 0.90910000000000002 | Y272: 0.52939999999999998 | AA272: =(N272+O272+P272+Q272+R272+S272+T272+U272+V272+W272+X272+Y272)/12 -> -8.7466666666666623e-02 | AB272: =(G272+H272+I272+J272+K272+L272+M272+N272+O272+P272+Q272+R272+S272+T272+U272+V272+W272+X272+Y272)/19 -> 1.1117421052631575 | AC272: =(R272+S272)/2 -> -2.9582999999999995 | AD272: =(S272+T272)/2 -> -0.69664999999999999 | AE272: =(T272+U272)/2 -> -0.46520000000000006 | AF272: =(U272+V272)/2 -> 0.36580000000000001 | AG272: =(V272+W272)/2 -> 2.0510000000000002 | AH272: =(W272+X272)/2 -> 1.95455 | AI272: =(X272+Y272)/2 -> 0.71924999999999994 | AJ272: =STDEV(G272:Y272) -> 3.5340923531157018
B273: 601226.SH | C273: 华电重工 | E273: 0.5988 | F273: 0.127 | G273: -4.6013999999999999 | H273: -4.0264999999999995 | I273: -0.94999999999999996 | J273: 1.4095 | K273: 0.37219999999999998 | L273: 1.2251000000000001 | M273: 56.142899999999997 | N273: 0.51529999999999998 | O273: 0.23079999999999998 | P273: 2.0390000000000001 | Q273: 0.25 | R273: 0.44130000000000003 | S273: -1.4583000000000002 | T273: -1.9059999999999999 | U273: -0.46000000000000002 | V273: 0.17559999999999998 | W273: 0.79659999999999997 | X273: 3.9292000000000002 | Y273: 3.7037 | AA273: =(N273+O273+P273+Q273+R273+S273+T273+U273+V273+W273+X273+Y273)/12 -> 0.68809999999999993 | AB273: =(G273+H273+I273+J273+K273+L273+M273+N273+O273+P273+Q273+R273+S273+T273+U273+V273+W273+X273+Y273)/19 -> 3.0436315789473682 | AC273: =(R273+S273)/2 -> -0.50850000000000006 | AD273: =(S273+T273)/2 -> -1.68215 | AE273: =(T273+U273)/2 -> -1.1830000000000001 | AF273: =(U273+V273)/2 -> -0.14220000000000002 | AG273: =(V273+W273)/2 -> 0.48609999999999998 | AH273: =(W273+X273)/2 -> 2.3629000000000002 | AI273: =(X273+Y273)/2 -> 3.8164500000000001 | AJ273: =STDEV(G273:Y273) -> 13.035113443441595 | AK273: 7.6200000000000004e-02 | AL273: 5.7300000000000004e-02 | AM273: 0.15439999999999998
B274: 002483.SZ | C274: 润邦股份
B275: 600620.SH | C275: 天宸股份 | E275: 0.15429999999999999 | F275: 0.248 | G275: 0.2407 | H275: 0.16370000000000001 | I275: 0.2253 | J275: 0 | K275: 0.24390000000000001 | L275: -1.66e-02 | M275: -5.0499999999999996e-02 | N275: 0.11109999999999999 | O275: 1.5968 | P275: 0.45610000000000001 | Q275: 0.3624 | R275: 0 | S275: -3.4054000000000002 | T275: 0.17010000000000003 | U275: 0.29260000000000003 | V275: 0.5 | W275: 0.48310000000000003 | X275: 0.70790000000000008 | Y275: 0.59160000000000001 | AA275: =(N275+O275+P275+Q275+R275+S275+T275+U275+V275+W275+X275+Y275)/12 -> 0.15552500000000002 | AB275: =(G275+H275+I275+J275+K275+L275+M275+N275+O275+P275+Q275+R275+S275+T275+U275+V275+W275+X275+Y275)/19 -> 0.14067368421052634 | AC275: =(R275+S275)/2 -> -1.7027000000000001 | AD275: =(S275+T275)/2 -> -1.61765 | AE275: =(T275+U275)/2 -> 0.23135000000000003 | AF275: =(U275+V275)/2 -> 0.39629999999999999 | AG275: =(V275+W275)/2 -> 0.49155000000000004 | AH275: =(W275+X275)/2 -> 0.59550000000000003 | AI275: =(X275+Y275)/2 -> 0.64975000000000005 | AJ275: =STDEV(G275:Y275) -> 0.93598093513472413 | AK275: 0.155 | AL275: 7.0000000000000007e-02 | AM275: -3.2400000000000005e-02
B276: 603668.SH | C276: 天马科技 | E276: 0.54409999999999992 | F276: 0.192 | G276: 0 | H276: 0 | I276: -0.1429 | J276: -0.1389 | K276: 0 | L276: 6.25e-02 | M276: 0 | N276: -0.1613 | O276: -0.16670000000000001 | P276: 0 | Q276: -8.3299999999999999e-02 | R276: -0.30769999999999997 | S276: 0 | T276: 0 | U276: 9.0899999999999995e-02 | V276: 0.11109999999999999 | W276: 0 | X276: 5.8799999999999998e-02 | Y276: -4.1700000000000001e-02 | AA276: =(N276+O276+P276+Q276+R276+S276+T276+U276+V276+W276+X276+Y276)/12 -> -4.1658333333333332e-02 | AB276: =(G276+H276+I276+J276+K276+L276+M276+N276+O276+P276+Q276+R276+S276+T276+U276+V276+W276+X276+Y276)/19 -> -3.7852631578947374e-02 | AC276: =(R276+S276)/2 -> -0.15384999999999999 | AD276: =(S276+T276)/2 -> 0 | AE276: =(T276+U276)/2 -> 4.5449999999999997e-02 | AF276: =(U276+V276)/2 -> 0.10099999999999999 | AG276: =(V276+W276)/2 -> 5.5549999999999995e-02 | AH276: =(W276+X276)/2 -> 2.9399999999999999e-02 | AI276: =(X276+Y276)/2 -> 8.5499999999999986e-03 | AJ276: =STDEV(G276:Y276) -> 0.10478108591206849
B277: 002701.SZ | C277: 奥瑞金
B278: 000912.SZ | C278: 泸天化
B279: 600116.SH | C279: 三峡水利
B280: 000791.SZ | C280: 甘肃电投 | E280: 0.54380000000000006 | F280: 0.22700000000000001 | G280: 0.34429999999999999 | H280: 0.93440000000000001 | I280: 31.959499999999998 | J280: 3.3808999999999996 | K280: 0.51590000000000003 | L280: 8.9499999999999993 | M280: 0.51659999999999995 | N280: 0.32780000000000004 | O280: 0.68610000000000004 | P280: 0.51259999999999994 | Q280: -2.92e-02 | R280: -0.12920000000000001 | S280: -0.31159999999999999 | T280: -1.32e-02 | U280: -1.23e-02 | V280: 4.6300000000000001e-02 | W280: 0.6099 | X280: -0.2402 | Y280: -0.35950000000000004 | AA280: =(N280+O280+P280+Q280+R280+S280+T280+U280+V280+W280+X280+Y280)/12 -> 9.0625000000000025e-02 | AB280: =(G280+H280+I280+J280+K280+L280+M280+N280+O280+P280+Q280+R280+S280+T280+U280+V280+W280+X280+Y280)/19 -> 2.5099526315789475 | AC280: =(R280+S280)/2 -> -0.22039999999999998 | AD280: =(S280+T280)/2 -> -0.16239999999999999 | AE280: =(T280+U280)/2 -> -1.2750000000000001e-02 | AF280: =(U280+V280)/2 -> 1.7000000000000001e-02 | AG280: =(V280+W280)/2 -> 0.3281 | AH280: =(W280+X280)/2 -> 0.18485000000000001 | AI280: =(X280+Y280)/2 -> -0.29985000000000001 | AJ280: =STDEV(G280:Y280) -> 7.43970909454936
B281: 601678.SH | C281: 滨化股份
B282: 600516.SH | C282: 方大炭素
B283: 601016.SH | C283: 节能风电
B284: 600131.SH | C284: 国网信通 | E284: 0.55249999999999999 | F284: 0.56999999999999995 | G284: -0.9425 | H284: -0.69389999999999996 | I284: -0.63800000000000001 | J284: -0.51519999999999999 | K284: 13.6 | L284: 1.2 | M284: 0.84750000000000003 | N284: 1.3125 | O284: -0.35619999999999996 | P284: 3.0299999999999997e-02 | Q284: 0.33030000000000004 | R284: 0.18920000000000001 | S284: -0.1489 | T284: -0.1176 | U284: -0.13789999999999999 | V284: 0.18179999999999999 | W284: 0 | X284: 0.20000000000000001 | Y284: 0.23999999999999999 | AA284: =(N284+O284+P284+Q284+R284+S284+T284+U284+V284+W284+X284+Y284)/12 -> 0.143625 | AB284: =(G284+H284+I284+J284+K284+L284+M284+N284+O284+P284+Q284+R284+S284+T284+U284+V284+W284+X284+Y284)/19 -> 0.76744210526315793 | AC284: =(R284+S284)/2 -> 2.0150000000000001e-02 | AD284: =(S284+T284)/2 -> -0.13325000000000001 | AE284: =(T284+U284)/2 -> -0.12775 | AF284: =(U284+V284)/2 -> 2.1949999999999997e-02 | AG284: =(V284+W284)/2 -> 9.0899999999999995e-02 | AH284: =(W284+X284)/2 -> 0.10000000000000001 | AI284: =(X284+Y284)/2 -> 0.22 | AJ284: =STDEV(G284:Y284) -> 3.1636052795497926 | AK284: 0.77329999999999999 | AL284: 0.29980000000000001 | AM284: 0.19879999999999998
B285: 601619.SH | C285: 嘉泽新能
B286: 603616.SH | C286: 韩建河山
B287: 000962.SZ | C287: 东方钽业 | E287: 0.17879999999999999 | F287: 0.21099999999999999 | G287: 0.27360000000000001 | H287: 0.3085 | I287: 7.6100000000000001e-02 | J287: -14.101800000000001 | K287: 0.44880000000000003 | L287: 0.79610000000000003 | M287: 1.0234999999999999 | N287: 1.0786 | O287: 1.1034999999999999 | P287: 1.1496999999999999 | Q287: 4.0266999999999999 | R287: 0.37759999999999999 | S287: -2.75 | T287: 4.5455000000000005 | U287: 0.374 | V287: 0.1981 | W287: 3.9832000000000001 | X287: 3.0710000000000002 | Y287: 3.0713999999999997 | AA287: =(N287+O287+P287+Q287+R287+S287+T287+U287+V287+W287+X287+Y287)/12 -> 1.6857750000000002 | AB287: =(G287+H287+I287+J287+K287+L287+M287+N287+O287+P287+Q287+R287+S287+T287+U287+V287+W287+X287+Y287)/19 -> 0.47653157894736853 | AC287: =(R287+S287)/2 -> -1.1861999999999999 | AD287: =(S287+T287)/2 -> 0.89775000000000027 | AE287: =(T287+U287)/2 -> 2.4597500000000001 | AF287: =(U287+V287)/2 -> 0.28605000000000003 | AG287: =(V287+W287)/2 -> 2.0906500000000001 | AH287: =(W287+X287)/2 -> 3.5270999999999999 | AI287: =(X287+Y287)/2 -> 3.0712000000000002 | AJ287: =STDEV(G287:Y287) -> 3.9426314816450296
B288: 600259.SH | C288: 广晟有色
B289: 600331.SH | C289: 宏达股份
B290: 002779.SZ | C290: 中坚科技 | E290: 0.2823 | F290: 0.11 | G290: -0.1429 | H290: -0.45829999999999999 | I290: -0.13139999999999999 | J290: -0.33329999999999999 | K290: -0.5 | L290: -0.69230000000000003 | M290: -0.63549999999999995 | N290: -0.5 | O290: -0.66669999999999996 | P290: 0.5 | Q290: 4.87e-02 | R290: -0.33329999999999999 | S290: -4.7400000000000002 | T290: -1.8332999999999999 | U290: -1.478 | V290: -4 | W290: 0.80479999999999996 | X290: 1.6000000000000001 | Y290: 3.5680000000000001 | AA290: =(N290+O290+P290+Q290+R290+S290+T290+U290+V290+W290+X290+Y290)/12 -> -0.58581666666666665 | AB290: =(G290+H290+I290+J290+K290+L290+M290+N290+O290+P290+Q290+R290+S290+T290+U290+V290+W290+X290+Y290)/19 -> -0.52228947368421041 | AC290: =(R290+S290)/2 -> -2.5366500000000003 | AD290: =(S290+T290)/2 -> -3.2866499999999998 | AE290: =(T290+U290)/2 -> -1.6556500000000001 | AF290: =(U290+V290)/2 -> -2.7389999999999999 | AG290: =(V290+W290)/2 -> -1.5975999999999999 | AH290: =(W290+X290)/2 -> 1.2023999999999999 | AI290: =(X290+Y290)/2 -> 2.5840000000000001 | AJ290: =STDEV(G290:Y290) -> 1.7844757010564247 | AK290: 0.2014 | AL290: 7.7100000000000002e-02 | AM290: 0.26000000000000001
B291: 600246.SH | C291: 万通发展
B292: 002300.SZ | C292: 太阳电缆
B293: 000795.SZ | C293: 英洛华
B294: 002878.SZ | C294: 元隆雅图 | E294: 0.37030000000000002 | F294: 0.36499999999999999 | H294: -0.38890000000000002 | I294: -0.38030000000000003 | J294: -0.3034 | K294: -0.15789999999999998 | L294: 0.1515 | M294: 0.20449999999999999 | N294: 0.17739999999999997 | O294: 0.25 | P294: -0.28949999999999998 | Q294: -0.3019 | R294: -0.27399999999999997 | S294: -0.55000000000000004 | T294: 0.14810000000000001 | U294: 0.45950000000000002 | V294: 0.41509999999999997 | W294: 0.44439999999999996 | X294: -0.1613 | Y294: -0.31480000000000002 | AA294: =(N294+O294+P294+Q294+R294+S294+T294+U294+V294+W294+X294+Y294)/12 -> 2.4999999999999561e-04 | AB294: =(G294+H294+I294+J294+K294+L294+M294+N294+O294+P294+Q294+R294+S294+T294+U294+V294+W294+X294+Y294)/19 -> -4.5868421052631579e-02 | AC294: =(R294+S294)/2 -> -0.41200000000000003 | AD294: =(S294+T294)/2 -> -0.20095000000000002 | AE294: =(T294+U294)/2 -> 0.30380000000000001 | AF294: =(U294+V294)/2 -> 0.43730000000000002 | AG294: =(V294+W294)/2 -> 0.42974999999999997 | AH294: =(W294+X294)/2 -> 0.14154999999999998 | AI294: =(X294+Y294)/2 -> -0.23805000000000001 | AJ294: =STDEV(G294:Y294) -> 0.32629139133422375
B295: 603286.SH | C295: 日盈电子
B296: 000565.SZ | C296: 渝三峡A
B297: 002119.SZ | C297: 康强电子
B298: 600933.SH | C298: 爱柯迪
B299: 600523.SH | C299: 贵航股份 | E299: 0.16190000000000002 | F299: 0.32000000000000001 | G299: 0.83329999999999993 | H299: -7.690000000000001e-02 | I299: -0.20000000000000001 | J299: -0.20000000000000001 | K299: -0.72730000000000006 | L299: -0.20829999999999999 | M299: -0.1429 | N299: -0.39579999999999999 | O299: -0.66670000000000007 | P299: -0.36840000000000006 | Q299: -0.29170000000000001 | R299: 0.13789999999999999 | S299: -0.81000000000000005 | T299: 8.3299999999999999e-02 | U299: 0.47060000000000002 | V299: 0.12119999999999999 | W299: 41.1053 | X299: 0.61539999999999995 | Y299: 0.28000000000000003 | AA299: =(N299+O299+P299+Q299+R299+S299+T299+U299+V299+W299+X299+Y299)/12 -> 3.3567583333333335 | AB299: =(G299+H299+I299+J299+K299+L299+M299+N299+O299+P299+Q299+R299+S299+T299+U299+V299+W299+X299+Y299)/19 -> 2.0820526315789478 | AC299: =(R299+S299)/2 -> -0.33605000000000002 | AD299: =(S299+T299)/2 -> -0.36335000000000001 | AE299: =(T299+U299)/2 -> 0.27695000000000003 | AF299: =(U299+V299)/2 -> 0.2959 | AG299: =(V299+W299)/2 -> 20.613250000000001 | AH299: =(W299+X299)/2 -> 20.86035 | AI299: =(X299+Y299)/2 -> 0.44769999999999999 | AJ299: =STDEV(G299:Y299) -> 9.4600097644046635
B300: 002184.SZ | C300: 海得控制
B301: 600233.SH | C301: 圆通速递 | E301: 0.37759999999999999 | F301: 0.65700000000000003 | G301: -0.19769999999999999 | H301: -0.2036 | I301: -0.12890000000000001 | J301: -0.10349999999999999 | K301: 0.1283 | L301: 0.15509999999999999 | M301: 0.1845 | N301: 0.31940000000000002 | O301: 0.1585 | P301: 7.6799999999999993e-02 | Q301: 9.820000000000001e-02 | R301: -0.12590000000000001 | S301: -0.26579999999999998 | T301: 5.7000000000000002e-02 | U301: -7.22e-02 | V301: -2.9500000000000002e-02 | W301: 0.23469999999999999 | X301: -0.36670000000000003 | Y301: -0.33270000000000005 | AA301: =(N301+O301+P301+Q301+R301+S301+T301+U301+V301+W301+X301+Y301)/12 -> -2.0683333333333335e-02 | AB301: =(G301+H301+I301+J301+K301+L301+M301+N301+O301+P301+Q301+R301+S301+T301+U301+V301+W301+X301+Y301)/19 -> -2.1789473684210536e-02 | AC301: =(R301+S301)/2 -> -0.19585 | AD301: =(S301+T301)/2 -> -0.10439999999999999 | AE301: =(T301+U301)/2 -> -7.5999999999999991e-03 | AF301: =(U301+V301)/2 -> -5.0849999999999999e-02 | AG301: =(V301+W301)/2 -> 0.1026 | AH301: =(W301+X301)/2 -> -6.6000000000000017e-02 | AI301: =(X301+Y301)/2 -> -0.34970000000000001 | AJ301: =STDEV(G301:Y301) -> 0.19890770024404353
B302: 002454.SZ | C302: 松芝股份
B303: 600935.SH | C303: 华塑股份 | E303: 0.41720000000000002 | F303: 0.16700000000000001 | W303: 0 | X303: 0.71430000000000005 | Y303: 0.58329999999999993 | AA303: =(N303+O303+P303+Q303+R303+S303+T303+U303+V303+W303+X303+Y303)/12 -> 0.10813333333333335 | AB303: =(G303+H303+I303+J303+K303+L303+M303+N303+O303+P303+Q303+R303+S303+T303+U303+V303+W303+X303+Y303)/19 -> 6.8294736842105269e-02 | AC303: =(R303+S303)/2 -> 0 | AD303: =(S303+T303)/2 -> 0 | AE303: =(T303+U303)/2 -> 0 | AF303: =(U303+V303)/2 -> 0 | AG303: =(V303+W303)/2 -> 0 | AH303: =(W303+X303)/2 -> 0.35715000000000002 | AI303: =(X303+Y303)/2 -> 0.64880000000000004 | AJ303: =STDEV(G303:Y303) -> 0.38026840959161112 | AK303: 0.46039999999999998 | AL303: 0.11749999999999999 | AM303: 0.32520000000000004
B304: 002536.SZ | C304: 飞龙股份
B305: 002612.SZ | C305: 朗姿股份
B306: 603683.SH | C306: 晶华新材 | E306: 0.42810000000000004 | F306: 0.17000000000000001 | I306: -0.17499999999999999 | J306: -0.2407 | K306: -0.59560000000000002 | L306: -0.42810000000000004 | M306: -0.57579999999999998 | N306: -0.56100000000000005 | O306: -0.87360000000000004 | P306: -0.78569999999999995 | Q306: -0.85709999999999997 | R306: -0.83329999999999993 | S306: -3.4564999999999997 | T306: 2.6667000000000001 | U306: 8.5 | V306: 40 | W306: 11.6195 | X306: 0.18179999999999999 | Y306: -0.10529999999999999 | AA306: =(N306+O306+P306+Q306+R306+S306+T306+U306+V306+W306+X306+Y306)/12 -> 4.6246250000000009 | AB306: =(G306+H306+I306+J306+K306+L306+M306+N306+O306+P306+Q306+R306+S306+T306+U306+V306+W306+X306+Y306)/19 -> 2.8147526315789477 | AC306: =(R306+S306)/2 -> -2.1448999999999998 | AD306: =(S306+T306)/2 -> -0.39489999999999981 | AE306: =(T306+U306)/2 -> 5.5833500000000003 | AF306: =(U306+V306)/2 -> 24.25 | AG306: =(V306+W306)/2 -> 25.809750000000001 | AH306: =(W306+X306)/2 -> 5.9006500000000006 | AI306: =(X306+Y306)/2 -> 3.8249999999999999e-02 | AJ306: =STDEV(G306:Y306) -> 10.192534868716418
B307: 603050.SH | C307: 科林电气
B308: 002729.SZ | C308: 好利科技 | E308: 0.13300000000000001 | F308: 0.17799999999999999 | G308: 2 | H308: 1.2 | I308: 0.4783 | J308: 6.25e-02 | K308: 0 | L308: -0.13639999999999999 | M308: -0.26469999999999999 | N308: -8.8200000000000001e-02 | O308: 0.16670000000000001 | P308: -0.15789999999999998 | Q308: -8.0000000000000002e-02 | R308: 3.2300000000000002e-02 | S308: -0.71430000000000005 | T308: -0.25 | U308: -0.21739999999999998 | V308: -0.5 | W308: 3 | X308: 0.33329999999999999 | Y308: 0.38890000000000002 | AA308: =(N308+O308+P308+Q308+R308+S308+T308+U308+V308+W308+X308+Y308)/12 -> 0.15944999999999998 | AB308: =(G308+H308+I308+J308+K308+L308+M308+N308+O308+P308+Q308+R308+S308+T308+U308+V308+W308+X308+Y308)/19 -> 0.27647894736842105 | AC308: =(R308+S308)/2 -> -0.34100000000000003 | AD308: =(S308+T308)/2 -> -0.48215000000000002 | AE308: =(T308+U308)/2 -> -0.23369999999999999 | AF308: =(U308+V308)/2 -> -0.35870000000000002 | AG308: =(V308+W308)/2 -> 1.25 | AH308: =(W308+X308)/2 -> 1.66665 | AI308: =(X308+Y308)/2 -> 0.36109999999999998 | AJ308: =STDEV(G308:Y308) -> 0.89781338730331517
B309: 002517.SZ | C309: 恺英网络 | E309: 0.14000000000000001 | F309: 0.23300000000000001 | G309: -6.6699999999999995e-02 | H309: -0.47220000000000001 | I309: 0.53120000000000001 | J309: 0.5 | K309: -0.21429999999999999 | L309: -0.10529999999999999 | M309: -0.53060000000000007 | N309: -0.89329999999999998 | O309: -0.63639999999999997 | P309: -0.88239999999999996 | Q309: -0.86959999999999993 | R309: -12 | S309: -0.75 | T309: 0.17999999999999999 | U309: 1.6666999999999998 | V309: 1.1023000000000001 | W309: 6 | X309: 4.5085000000000006 | Y309: 2 | AA309: =(N309+O309+P309+Q309+R309+S309+T309+U309+V309+W309+X309+Y309)/12 -> -4.7850000000000024e-02 | AB309: =(G309+H309+I309+J309+K309+L309+M309+N309+O309+P309+Q309+R309+S309+T309+U309+V309+W309+X309+Y309)/19 -> -4.9057894736842161e-02 | AC309: =(R309+S309)/2 -> -6.375 | AD309: =(S309+T309)/2 -> -0.28500000000000003 | AE309: =(T309+U309)/2 -> 0.92334999999999989 | AF309: =(U309+V309)/2 -> 1.3845000000000001 | AG309: =(V309+W309)/2 -> 3.5511499999999998 | AH309: =(W309+X309)/2 -> 5.2542500000000008 | AI309: =(X309+Y309)/2 -> 3.2542500000000003 | AJ309: =STDEV(G309:Y309) -> 3.4375755946945761
B310: 600218.SH | C310: 全柴动力
B311: 000922.SZ | C311: 佳电股份 | E311: 0.49390000000000001 | F311: 0.309 | G311: 0.77329999999999999 | H311: 1.0232999999999999 | I311: 1.1904000000000001 | J311: 1.2759 | K311: 8 | L311: 30 | M311: 4.4283999999999999 | N311: 1.5671999999999999 | O311: 1.0746 | P311: 0.27739999999999998 | Q311: 5.9400000000000001e-02 | R311: 3.0899999999999997e-02 | S311: -0.4299 | T311: -0.10000000000000001 | U311: 0.28870000000000001 | V311: 0.16200000000000001 | W311: 0.1137 | X311: -0.36049999999999999 | Y311: -0.57030000000000003 | AA311: =(N311+O311+P311+Q311+R311+S311+T311+U311+V311+W311+X311+Y311)/12 -> 0.17610000000000001 | AB311: =(G311+H311+I311+J311+K311+L311+M311+N311+O311+P311+Q311+R311+S311+T311+U311+V311+W311+X311+Y311)/19 -> 2.568657894736841 | AC311: =(R311+S311)/2 -> -0.19950000000000001 | AD311: =(S311+T311)/2 -> -0.26495000000000002 | AE311: =(T311+U311)/2 -> 9.4350000000000003e-02 | AF311: =(U311+V311)/2 -> 0.22534999999999999 | AG311: =(V311+W311)/2 -> 0.13785 | AH311: =(W311+X311)/2 -> -0.1234 | AI311: =(X311+Y311)/2 -> -0.46540000000000004 | AJ311: =STDEV(G311:Y311) -> 6.9418362194031582
B312: 600735.SH | C312: 新华锦 | E312: 0.27140000000000003 | F312: 0.13 | G312: 0.44979999999999998 | H312: 0.3705 | I312: 0.17230000000000001 | J312: 0.32640000000000002 | K312: -6.08e-02 | L312: -1.1899999999999999e-02 | M312: 0.1462 | N312: 3.5699999999999996e-02 | O312: 0.18079999999999999 | P312: 0.20879999999999999 | Q312: 0.14050000000000001 | R312: -4.87e-02 | S312: -0.45939999999999998 | T312: -0.45909999999999995 | U312: -0.47509999999999997 | V312: -0.38469999999999999 | W312: 2.7999999999999997e-02 | X312: 0.41340000000000005 | Y312: 0.40039999999999998 | AA312: =(N312+O312+P312+Q312+R312+S312+T312+U312+V312+W312+X312+Y312)/12 -> -3.4949999999999988e-02 | AB312: =(G312+H312+I312+J312+K312+L312+M312+N312+O312+P312+Q312+R312+S312+T312+U312+V312+W312+X312+Y312)/19 -> 5.1215789473684228e-02 | AC312: =(R312+S312)/2 -> -0.25405 | AD312: =(S312+T312)/2 -> -0.45924999999999994 | AE312: =(T312+U312)/2 -> -0.46709999999999996 | AF312: =(U312+V312)/2 -> -0.42989999999999995 | AG312: =(V312+W312)/2 -> -0.17835000000000001 | AH312: =(W312+X312)/2 -> 0.22070000000000001 | AI312: =(X312+Y312)/2 -> 0.40690000000000004 | AJ312: =STDEV(G312:Y312) -> 0.30535959178057215 | AK312: -4.2099999999999999e-02 | AL312: 1.3500000000000002e-02 | AM312: 0.1328
B313: 002537.SZ | C313: 海联金汇 | E313: 0.45049999999999996 | F313: 0.19 | G313: 0.45450000000000002 | H313: -0.26319999999999999 | I313: -0.2069 | J313: -0.45000000000000001 | K313: -0.5 | L313: 0.1429 | M313: 0 | N313: -0.66670000000000007 | O313: 0.25 | P313: -0.5 | Q313: -1.087 | R313: -19.090899999999998 | S313: -1.3 | T313: -0.75 | U313: 5 | V313: 1.0854000000000001 | W313: 1.3333000000000002 | X313: 5.5 | Y313: 1.375 | AA313: =(N313+O313+P313+Q313+R313+S313+T313+U313+V313+W313+X313+Y313)/12 -> -0.73757500000000009 | AB313: =(G313+H313+I313+J313+K313+L313+M313+N313+O313+P313+Q313+R313+S313+T313+U313+V313+W313+X313+Y313)/19 -> -0.509136842105263 | AC313: =(R313+S313)/2 -> -10.195449999999999 | AD313: =(S313+T313)/2 -> -1.0249999999999999 | AE313: =(T313+U313)/2 -> 2.125 | AF313: =(U313+V313)/2 -> 3.0427 | AG313: =(V313+W313)/2 -> 1.2093500000000001 | AH313: =(W313+X313)/2 -> 3.4166500000000002 | AI313: =(X313+Y313)/2 -> 3.4375 | AJ313: =STDEV(G313:Y313) -> 4.8569326974966085 | AK313: 0.1956 | AL313: -0.105 | AM313: 0.17460000000000001
B314: 603309.SH | C314: 维力医疗 | E314: 0.27329999999999999 | F314: 0.27900000000000003 | G314: 0 | H314: 0.11109999999999999 | I314: -0.1333 | J314: -0.20000000000000001 | K314: -0.57140000000000002 | L314: -0.34999999999999998 | M314: -0.1923 | N314: 3.1300000000000001e-02 | O314: 2.3332999999999999 | P314: 1.1537999999999999 | Q314: 0.90480000000000005 | R314: 0.42420000000000002 | S314: -0.69999999999999996 | T314: 0.32140000000000002 | U314: 0.34999999999999998 | V314: 0.25530000000000003 | W314: 2 | X314: -0.51350000000000007 | Y314: -0.42590000000000006 | AA314: =(N314+O314+P314+Q314+R314+S314+T314+U314+V314+W314+X314+Y314)/12 -> 0.51122499999999993 | AB314: =(G314+H314+I314+J314+K314+L314+M314+N314+O314+P314+Q314+R314+S314+T314+U314+V314+W314+X314+Y314)/19 -> 0.25256842105263155 | AC314: =(R314+S314)/2 -> -0.13789999999999997 | AD314: =(S314+T314)/2 -> -0.18929999999999997 | AE314: =(T314+U314)/2 -> 0.3357 | AF314: =(U314+V314)/2 -> 0.30264999999999997 | AG314: =(V314+W314)/2 -> 1.12765 | AH314: =(W314+X314)/2 -> 0.74324999999999997 | AI314: =(X314+Y314)/2 -> -0.46970000000000006 | AJ314: =STDEV(G314:Y314) -> 0.82815876165317726
B315: 002825.SZ | C315: 纳尔股份 | E315: 0.3009 | F315: 0.41399999999999998 | G315: -0.30820000000000003 | H315: -0.54759999999999998 | I315: -0.72310000000000008 | J315: -0.6905 | K315: -0.6139 | L315: 5.2600000000000001e-02 | M315: 0.94440000000000002 | N315: 0.69230000000000003 | O315: 0.79489999999999994 | P315: 5.0000000000000003e-02 | Q315: -0.20000000000000001 | R315: -0.31819999999999998 | S315: -0.28570000000000001 | T315: 0.42859999999999998 | U315: 0.78569999999999995 | V315: 1.1667000000000001 | W315: 1.6000000000000001 | X315: -0.1333 | Y315: -0.16 | AA315: =(N315+O315+P315+Q315+R315+S315+T315+U315+V315+W315+X315+Y315)/12 -> 0.36841666666666661 | AB315: =(G315+H315+I315+J315+K315+L315+M315+N315+O315+P315+Q315+R315+S315+T315+U315+V315+W315+X315+Y315)/19 -> 0.13340526315789469 | AC315: =(R315+S315)/2 -> -0.30195 | AD315: =(S315+T315)/2 -> 7.1449999999999986e-02 | AE315: =(T315+U315)/2 -> 0.60714999999999997 | AF315: =(U315+V315)/2 -> 0.97619999999999996 | AG315: =(V315+W315)/2 -> 1.3833500000000001 | AH315: =(W315+X315)/2 -> 0.73335000000000006 | AI315: =(X315+Y315)/2 -> -0.14665 | AJ315: =STDEV(G315:Y315) -> 0.68434912830747785
B316: 002466.SZ | C316: 天齐锂业 | E316: 0.60589999999999999 | F316: 0.35999999999999999 | G316: 0.27589999999999998 | H316: 9.2100000000000015e-02 | I316: 0.12300000000000001 | J316: 0.40579999999999999 | K316: 0.56759999999999999 | L316: 0.38549999999999995 | M316: 8.0299999999999996e-02 | N316: -5.1999999999999998e-03 | O316: -0.86209999999999998 | P316: -0.87829999999999997 | Q316: -0.9323999999999999 | R316: -3.7149999999999999 | S316: -5.25 | T316: -4.3571 | U316: -8.5 | V316: 0.76340000000000008 | W316: 0.5 | X316: 1.1276999999999999 | Y316: 1.48 | AA316: =(N316+O316+P316+Q316+R316+S316+T316+U316+V316+W316+X316+Y316)/12 -> -1.7190833333333331 | AB316: =(G316+H316+I316+J316+K316+L316+M316+N316+O316+P316+Q316+R316+S316+T316+U316+V316+W316+X316+Y316)/19 -> -0.98414736842105255 | AC316: =(R316+S316)/2 -> -4.4824999999999999 | AD316: =(S316+T316)/2 -> -4.8035499999999995 | AE316: =(T316+U316)/2 -> -6.4285499999999995 | AF316: =(U316+V316)/2 -> -3.8683000000000001 | AG316: =(V316+W316)/2 -> 0.63170000000000004 | AH316: =(W316+X316)/2 -> 0.81384999999999996 | AI316: =(X316+Y316)/2 -> 1.30385 | AJ316: =STDEV(G316:Y316) -> 2.5993184524170991 | AK316: -0.1777 | AL316: -8.1900000000000001e-02 | AM316: 0.20120000000000002
B317: 600293.SH | C317: 三峡新材 | E317: 0.54890000000000005 | F317: 0.11 | G317: 27.199999999999999 | H317: 16.6098 | I317: 4.0195999999999996 | J317: -5.5199999999999999e-02 | K317: 8.1600000000000006e-02 | L317: -0.16899999999999998 | M317: -0.22820000000000001 | N317: -0.40439999999999998 | O317: -0.64260000000000006 | P317: -0.77780000000000005 | Q317: -0.78879999999999995 | R317: -0.95510000000000006 | S317: -6.5045999999999999 | T317: -14.75 | U317: -11.199999999999999 | V317: -192.39779999999999 | W317: 1.2778 | X317: 0.83640000000000003 | Y317: 1.2157 | AA317: =(N317+O317+P317+Q317+R317+S317+T317+U317+V317+W317+X317+Y317)/12 -> -18.7576 | AB317: =(G317+H317+I317+J317+K317+L317+M317+N317+O317+P317+Q317+R317+S317+T317+U317+V317+W317+X317+Y317)/19 -> -9.3490842105263159 | AC317: =(R317+S317)/2 -> -3.7298499999999999 | AD317: =(S317+T317)/2 -> -10.6273 | AE317: =(T317+U317)/2 -> -12.975 | AF317: =(U317+V317)/2 -> -101.79889999999999 | AG317: =(V317+W317)/2 -> -95.559999999999988 | AH317: =(W317+X317)/2 -> 1.0571000000000002 | AI317: =(X317+Y317)/2 -> 1.0260500000000001 | AJ317: =STDEV(G317:Y317) -> 45.203258698169371
B318: 000963.SZ | C318: 华东医药
B319: 603058.SH | C319: 永吉股份 | E319: 0.26739999999999997 | F319: 0.32000000000000001 | G319: 0 | H319: -0.22870000000000001 | I319: -0.22219999999999998 | J319: 8.9999999999999998e-04 | K319: 0.5 | L319: 0.56090000000000007 | M319: 0.52280000000000004 | N319: 0.16800000000000001 | O319: -0.33329999999999999 | P319: -0.40000000000000002 | Q319: 0 | R319: 0.30769999999999997 | S319: 0.83329999999999993 | T319: 1.1111 | U319: 0.23809999999999998 | V319: 0.1176 | W319: -0.90910000000000002 | X319: 0.10529999999999999 | Y319: 0.23079999999999998 | AA319: =(N319+O319+P319+Q319+R319+S319+T319+U319+V319+W319+X319+Y319)/12 -> 0.12245833333333332 | AB319: =(G319+H319+I319+J319+K319+L319+M319+N319+O319+P319+Q319+R319+S319+T319+U319+V319+W319+X319+Y319)/19 -> 0.13701052631578947 | AC319: =(R319+S319)/2 -> 0.57050000000000001 | AD319: =(S319+T319)/2 -> 0.97219999999999995 | AE319: =(T319+U319)/2 -> 0.67459999999999998 | AF319: =(U319+V319)/2 -> 0.17784999999999998 | AG319: =(V319+W319)/2 -> -0.39574999999999999 | AH319: =(W319+X319)/2 -> -0.40190000000000003 | AI319: =(X319+Y319)/2 -> 0.16804999999999998 | AJ319: =STDEV(G319:Y319) -> 0.46351347684438937
B320: 603565.SH | C320: 中谷物流
B321: 002438.SZ | C321: 江苏神通 | E321: 0.42920000000000003 | F321: 0.41999999999999998 | G321: -0.57140000000000002 | H321: 6.4000000000000001e-02 | I321: 0.1186 | J321: 0.19820000000000002 | K321: 0.54669999999999996 | L321: 0.55640000000000001 | M321: 0.6169 | N321: 0.62519999999999998 | O321: 1.2435 | P321: 1.2813999999999999 | Q321: 1.1327 | R321: 0.65359999999999996 | S321: -0.18729999999999999 | T321: 2.5399999999999999e-02 | U321: 0.22219999999999998 | V321: 0.2555 | W321: 0.60870000000000002 | X321: 0.3201 | Y321: 0.33329999999999999 | AA321: =(N321+O321+P321+Q321+R321+S321+T321+U321+V321+W321+X321+Y321)/12 -> 0.54285833333333333 | AB321: =(G321+H321+I321+J321+K321+L321+M321+N321+O321+P321+Q321+R321+S321+T321+U321+V321+W321+X321+Y321)/19 -> 0.42335263157894731 | AC321: =(R321+S321)/2 -> 0.23314999999999997 | AD321: =(S321+T321)/2 -> -8.0949999999999994e-02 | AE321: =(T321+U321)/2 -> 0.12379999999999999 | AF321: =(U321+V321)/2 -> 0.23885000000000001 | AG321: =(V321+W321)/2 -> 0.43210000000000004 | AH321: =(W321+X321)/2 -> 0.46440000000000003 | AI321: =(X321+Y321)/2 -> 0.32669999999999999 | AJ321: =STDEV(G321:Y321) -> 0.47090059622012348
B322: 000833.SZ | C322: 粤桂股份
B323: 002171.SZ | C323: 楚江新材 | E323: 0.49950000000000006 | F323: 0.30499999999999999 | G323: 2.0196000000000001 | H323: 0.78890000000000005 | I323: -0.2545 | J323: -0.19949999999999998 | K323: -0.3831 | L323: -0.37579999999999997 | M323: 0.19920000000000002 | N323: 0.1454 | O323: -0.36840000000000006 | P323: -8.4600000000000009e-02 | Q323: -2.7099999999999999e-02 | R323: -6.7400000000000002e-02 | S323: -2.1667000000000001 | T323: -0.75 | U323: -0.47939999999999999 | V323: -0.41670000000000001 | W323: 2.2856999999999998 | X323: 3.2174 | Y323: 1.0454999999999999 | AA323: =(N323+O323+P323+Q323+R323+S323+T323+U323+V323+W323+X323+Y323)/12 -> 0.19447499999999995 | AB323: =(G323+H323+I323+J323+K323+L323+M323+N323+O323+P323+Q323+R323+S323+T323+U323+V323+W323+X323+Y323)/19 -> 0.2172894736842105 | AC323: =(R323+S323)/2 -> -1.1170500000000001 | AD323: =(S323+T323)/2 -> -1.45835 | AE323: =(T323+U323)/2 -> -0.61470000000000002 | AF323: =(U323+V323)/2 -> -0.44805 | AG323: =(V323+W323)/2 -> 0.93449999999999989 | AH323: =(W323+X323)/2 -> 2.7515499999999999 | AI323: =(X323+Y323)/2 -> 2.1314500000000001 | AJ323: =STDEV(G323:Y323) -> 1.2187268825817725
B324: 601985.SH | C324: 中国核电
B325: 002082.SZ | C325: 万邦德 | E325: 0.32719999999999999 | F325: 0.25 | G325: -0.25 | H325: -0.25 | I325: 4.1700000000000001e-02 | J325: 0.4138 | K325: 0.33329999999999999 | L325: 0.16670000000000001 | M325: -0.12 | N325: -0.14630000000000001 | O325: 0.75 | P325: 0.5 | Q325: 0.36359999999999998 | R325: 0.68569999999999998 | S325: 0.1429 | T325: -4.7599999999999996e-02 | U325: -0.33329999999999999 | V325: -0.2034 | W325: -0.5 | X325: -0.10000000000000001 | Y325: 0.25 | AA325: =(N325+O325+P325+Q325+R325+S325+T325+U325+V325+W325+X325+Y325)/12 -> 0.11346666666666662 | AB325: =(G325+H325+I325+J325+K325+L325+M325+N325+O325+P325+Q325+R325+S325+T325+U325+V325+W325+X325+Y325)/19 -> 8.9321052631578968e-02 | AC325: =(R325+S325)/2 -> 0.4143 | AD325: =(S325+T325)/2 -> 4.7649999999999998e-02 | AE325: =(T325+U325)/2 -> -0.19044999999999998 | AF325: =(U325+V325)/2 -> -0.26834999999999998 | AG325: =(V325+W325)/2 -> -0.35170000000000001 | AH325: =(W325+X325)/2 -> -0.29999999999999999 | AI325: =(X325+Y325)/2 -> 7.4999999999999997e-02 | AJ325: =STDEV(G325:Y325) -> 0.35226253716187206 | AK325: -0.76749999999999996 | AL325: -0.87319999999999998 | AM325: -0.90329999999999999
B326: 603101.SH | C326: 汇嘉时代
B327: 603306.SH | C327: 华懋科技
B328: 002158.SZ | C328: 汉钟精机
B329: 001203.SZ | C329: 大中矿业
B330: 000059.SZ | C330: 华锦股份 | E330: 0.52670000000000006 | F330: 0.32600000000000001 | G330: -2.6099999999999998e-02 | H330: -8.3900000000000002e-02 | I330: 4.8000000000000001e-02 | J330: 1.77e-02 | K330: -0.30740000000000001 | L330: -8.0100000000000005e-02 | M330: -0.13880000000000001 | N330: -0.37390000000000001 | O330: 0.2147 | P330: -0.21429999999999999 | Q330: -0.13140000000000002 | R330: -0.1389 | S330: -3.3523000000000001 | T330: -2.1164000000000001 | U330: -1.1815 | V330: -0.6774 | W330: 1.6006 | X330: 2.0449000000000002 | Y330: 4.1235999999999997 | AA330: =(N330+O330+P330+Q330+R330+S330+T330+U330+V330+W330+X330+Y330)/12 -> -1.685833333333342e-02 | AB330: =(G330+H330+I330+J330+K330+L330+M330+N330+O330+P330+Q330+R330+S330+T330+U330+V330+W330+X330+Y330)/19 -> -4.0678947368421051e-02 | AC330: =(R330+S330)/2 -> -1.7456 | AD330: =(S330+T330)/2 -> -2.7343500000000001 | AE330: =(T330+U330)/2 -> -1.6489500000000001 | AF330: =(U330+V330)/2 -> -0.92945 | AG330: =(V330+W330)/2 -> 0.46160000000000001 | AH330: =(W330+X330)/2 -> 1.8227500000000001 | AI330: =(X330+Y330)/2 -> 3.0842499999999999 | AJ330: =STDEV(G330:Y330) -> 1.5218217283458326 | AK330: 0.4849 | AL330: 0.42369999999999997 | AM330: 0.21579999999999999
B331: 002615.SZ | C331: 哈尔斯 | E331: 0.59279999999999999 | F331: 0.222 | G331: 1.6000000000000001 | H331: 0.58329999999999993 | I331: 0.23809999999999998 | J331: -6.9000000000000006e-02 | K331: -0.76919999999999999 | L331: -0.36840000000000006 | M331: -0.23079999999999998 | N331: -0.11109999999999999 | O331: 0 | P331: 8.3299999999999999e-02 | Q331: 0.10000000000000001 | R331: -0.45829999999999999 | S331: -3 | T331: -1.6153999999999999 | U331: -1.1364000000000001 | V331: -1.5385 | W331: 2 | X331: 2.75 | Y331: 8.3333000000000013 | AA331: =(N331+O331+P331+Q331+R331+S331+T331+U331+V331+W331+X331+Y331)/12 -> 0.45057500000000011 | AB331: =(G331+H331+I331+J331+K331+L331+M331+N331+O331+P331+Q331+R331+S331+T331+U331+V331+W331+X331+Y331)/19 -> 0.33636315789473692 | AC331: =(R331+S331)/2 -> -1.72915 | AD331: =(S331+T331)/2 -> -2.3077000000000001 | AE331: =(T331+U331)/2 -> -1.3759000000000001 | AF331: =(U331+V331)/2 -> -1.33745 | AG331: =(V331+W331)/2 -> 0.23075000000000001 | AH331: =(W331+X331)/2 -> 2.375 | AI331: =(X331+Y331)/2 -> 5.5416500000000006 | AJ331: =STDEV(G331:Y331) -> 2.3345984461312321 | AK331: 0.49020000000000002 | AL331: 0.63300000000000001 | AM331: 0.53200000000000003
B332: 601369.SH | C332: 陕鼓动力
B333: 002606.SZ | C333: 大连电瓷
B334: 002664.SZ | C334: 长鹰信质
B335: 603630.SH | C335: 拉芳家化
B336: 605018.SH | C336: 长华股份
B337: 600386.SH | C337: 北巴传媒 | E337: 0.52869999999999995 | F337: 0.16 | G337: -0.66670000000000007 | H337: 0 | I337: -9.0899999999999995e-02 | J337: -0.1333 | K337: 0 | L337: -0.16670000000000001 | M337: -0.20000000000000001 | N337: 0 | O337: 0 | P337: 0.40000000000000002 | Q337: 0.125 | R337: -0.15380000000000002 | S337: -3.5 | T337: -1.1429 | U337: -0.66670000000000007 | V337: -0.18179999999999999 | W337: 1.3999999999999999 | X337: 7 | Y337: 3.3332999999999999 | AA337: =(N337+O337+P337+Q337+R337+S337+T337+U337+V337+W337+X337+Y337)/12 -> 0.55109166666666665 | AB337: =(G337+H337+I337+J337+K337+L337+M337+N337+O337+P337+Q337+R337+S337+T337+U337+V337+W337+X337+Y337)/19 -> 0.28186842105263155 | AC337: =(R337+S337)/2 -> -1.8269 | AD337: =(S337+T337)/2 -> -2.32145 | AE337: =(T337+U337)/2 -> -0.90480000000000005 | AF337: =(U337+V337)/2 -> -0.42425000000000002 | AG337: =(V337+W337)/2 -> 0.60909999999999997 | AH337: =(W337+X337)/2 -> 4.2000000000000002 | AI337: =(X337+Y337)/2 -> 5.1666499999999997 | AJ337: =STDEV(G337:Y337) -> 2.045763807658437 | AK337: 0.29699999999999999 | AL337: 0.15410000000000001 | AM337: 1.1200000000000002e-02
B338: 600025.SH | C338: 华能水电
B339: 002544.SZ | C339: 杰赛科技 | E339: 0.58360000000000001 | F339: 0.192 | G339: 1.2886000000000002 | H339: 2.1166999999999998 | I339: 1.6680000000000001 | J339: 6.0599999999999994e-02 | K339: 3.0200000000000001e-02 | L339: -0.31579999999999997 | M339: -0.4531 | N339: -0.94290000000000007 | O339: -0.2293 | P339: 4.8799999999999996e-02 | Q339: 0.2888 | R339: 2 | S339: -2.7562000000000002 | T339: -0.1636 | U339: 0.35310000000000002 | V339: 1.8333000000000002 | W339: 1.3438999999999999 | X339: 0.65939999999999999 | Y339: 0.49770000000000003 | AA339: =(N339+O339+P339+Q339+R339+S339+T339+U339+V339+W339+X339+Y339)/12 -> 0.24441666666666664 | AB339: =(G339+H339+I339+J339+K339+L339+M339+N339+O339+P339+Q339+R339+S339+T339+U339+V339+W339+X339+Y339)/19 -> 0.38569473684210515 | AC339: =(R339+S339)/2 -> -0.3781000000000001 | AD339: =(S339+T339)/2 -> -1.4599000000000002 | AE339: =(T339+U339)/2 -> 9.4750000000000015e-02 | AF339: =(U339+V339)/2 -> 1.0932000000000002 | AG339: =(V339+W339)/2 -> 1.5886 | AH339: =(W339+X339)/2 -> 1.0016499999999999 | AI339: =(X339+Y339)/2 -> 0.57855000000000001 | AJ339: =STDEV(G339:Y339) -> 1.1792506299782477
B340: 600283.SH | C340: 钱江水利 | E340: 0.57420000000000004 | F340: 0.41999999999999998 | G340: 1 | H340: 10 | I340: 1.3333000000000002 | J340: 0.23530000000000001 | K340: 3 | L340: 0.88890000000000002 | M340: 0.47060000000000002 | N340: -0.23809999999999998 | O340: -0.5 | P340: -1.2353000000000001 | Q340: -0.80000000000000004 | R340: -0.25 | S340: -0.25 | T340: 4.25 | U340: 4 | V340: 2.25 | W340: 2.6667000000000001 | X340: 1 | Y340: 0.68000000000000005 | AA340: =(N340+O340+P340+Q340+R340+S340+T340+U340+V340+W340+X340+Y340)/12 -> 0.96444166666666664 | AB340: =(G340+H340+I340+J340+K340+L340+M340+N340+O340+P340+Q340+R340+S340+T340+U340+V340+W340+X340+Y340)/19 -> 1.5000736842105262 | AC340: =(R340+S340)/2 -> -0.25 | AD340: =(S340+T340)/2 -> 2 | AE340: =(T340+U340)/2 -> 4.125 | AF340: =(U340+V340)/2 -> 3.125 | AG340: =(V340+W340)/2 -> 2.4583500000000003 | AH340: =(W340+X340)/2 -> 1.83335 | AI340: =(X340+Y340)/2 -> 0.84000000000000008 | AJ340: =STDEV(G340:Y340) -> 2.5861469520509348
B341: 002138.SZ | C341: 顺络电子
B342: 002328.SZ | C342: 新朋股份 | E342: 0.35979999999999995 | F342: 0.29999999999999999 | G342: 7.0900000000000005e-02 | H342: -8.3299999999999999e-02 | I342: 0 | J342: 0 | K342: 1.9599999999999999e-02 | L342: -0.36359999999999998 | M342: -0.375 | N342: -0.38100000000000001 | O342: -0.32929999999999998 | P342: -0.1429 | Q342: 0 | R342: 7.690000000000001e-02 | S342: -0.2366 | T342: -0.33329999999999999 | U342: 0.10000000000000001 | V342: 0.35710000000000003 | W342: 0.83099999999999996 | X342: 1.75 | Y342: 1.7272999999999998 | AA342: =(N342+O342+P342+Q342+R342+S342+T342+U342+V342+W342+X342+Y342)/12 -> 0.28493333333333332 | AB342: =(G342+H342+I342+J342+K342+L342+M342+N342+O342+P342+Q342+R342+S342+T342+U342+V342+W342+X342+Y342)/19 -> 0.14146315789473685 | AC342: =(R342+S342)/2 -> -7.9850000000000004e-02 | AD342: =(S342+T342)/2 -> -0.28494999999999998 | AE342: =(T342+U342)/2 -> -0.11664999999999999 | AF342: =(U342+V342)/2 -> 0.22855000000000003 | AG342: =(V342+W342)/2 -> 0.59404999999999997 | AH342: =(W342+X342)/2 -> 1.2905 | AI342: =(X342+Y342)/2 -> 1.7386499999999998 | AJ342: =STDEV(G342:Y342) -> 0.63360098748741644 | AK342: 0.72370000000000001 | AL342: 0.54400000000000004 | AM342: 0.43590000000000001
B343: 002045.SZ | C343: 国光电器
B344: 000801.SZ | C344: 四川九洲 | E344: 0.45340000000000003 | F344: 0.105 | G344: -0.91500000000000004 | H344: -1.3159000000000001 | I344: -1.2339 | J344: -0.96189999999999998 | K344: 2.1537999999999999 | L344: 1.754 | M344: 2.4062000000000001 | N344: 11.2254 | O344: 0.70730000000000004 | P344: -0.73760000000000003 | Q344: -1.2578 | R344: -0.55880000000000007 | S344: 0.2429 | T344: 3.5405000000000002 | U344: 9.6207000000000011 | V344: 0.96079999999999999 | W344: 2.0805000000000002 | X344: 3.2917000000000001 | Y344: 1.1040000000000001 | AA344: =(N344+O344+P344+Q344+R344+S344+T344+U344+V344+W344+X344+Y344)/12 -> 2.5183 | AB344: =(G344+H344+I344+J344+K344+L344+M344+N344+O344+P344+Q344+R344+S344+T344+U344+V344+W344+X344+Y344)/19 -> 1.6898368421052634 | AC344: =(R344+S344)/2 -> -0.15795000000000003 | AD344: =(S344+T344)/2 -> 1.8917000000000002 | AE344: =(T344+U344)/2 -> 6.5806000000000004 | AF344: =(U344+V344)/2 -> 5.290750000000001 | AG344: =(V344+W344)/2 -> 1.5206500000000001 | AH344: =(W344+X344)/2 -> 2.6861000000000002 | AI344: =(X344+Y344)/2 -> 2.1978499999999999 | AJ344: =STDEV(G344:Y344) -> 3.461472923676427
B345: 000920.SZ | C345: 沃顿科技 | E345: 0.42380000000000001 | F345: 0.24399999999999999 | G345: 0.10730000000000001 | H345: 0.23139999999999999 | I345: 0.125 | J345: 0.1739 | K345: -0.66959999999999997 | L345: -0.37579999999999997 | M345: -0.26850000000000002 | N345: -0.22219999999999998 | O345: 1.3784000000000001 | P345: 0.34409999999999996 | Q345: 4.4299999999999999e-02 | R345: 4.7599999999999996e-02 | S345: -1.0973999999999999 | T345: -0.47200000000000003 | U345: -7.8799999999999995e-02 | V345: 0.13639999999999999 | W345: 5 | X345: 1.1364000000000001 | Y345: 0.60530000000000006 | AA345: =(N345+O345+P345+Q345+R345+S345+T345+U345+V345+W345+X345+Y345)/12 -> 0.56850833333333328 | AB345: =(G345+H345+I345+J345+K345+L345+M345+N345+O345+P345+Q345+R345+S345+T345+U345+V345+W345+X345+Y345)/19 -> 0.32346315789473684 | AC345: =(R345+S345)/2 -> -0.52489999999999992 | AD345: =(S345+T345)/2 -> -0.78469999999999995 | AE345: =(T345+U345)/2 -> -0.27540000000000003 | AF345: =(U345+V345)/2 -> 2.8799999999999999e-02 | AG345: =(V345+W345)/2 -> 2.5682 | AH345: =(W345+X345)/2 -> 3.0682 | AI345: =(X345+Y345)/2 -> 0.87085000000000012 | AJ345: =STDEV(G345:Y345) -> 1.2685586375491615
B346: 601005.SH | C346: 重庆钢铁
B347: 605055.SH | C347: 迎丰股份
B348: 601038.SH | C348: 一拖股份
B349: 002907.SZ | C349: 华森制药
B350: 603229.SH | C350: 奥翔药业
B351: 601218.SH | C351: 吉鑫科技
B352: 000545.SZ | C352: 金浦钛业
B353: 000035.SZ | C353: 中国天楹 | E353: 0.76300000000000001 | F353: 0.221 | G353: -0.38670000000000004 | H353: 1.7000000000000001e-03 | I353: 1.7399999999999999e-02 | J353: 1.1699999999999999e-02 | K353: -7.0699999999999999e-02 | L353: 0.11 | M353: 0.1108 | N353: -7.3499999999999996e-02 | O353: 1.2515000000000001 | P353: 0.45200000000000001 | Q353: 0.36659999999999998 | R353: 0.87269999999999992 | S353: 0.1143 | T353: 0.2495 | U353: 0.16739999999999999 | V353: -0.1333 | W353: 0.1305 | X353: 0.14510000000000001 | Y353: 0.1235 | AA353: =(N353+O353+P353+Q353+R353+S353+T353+U353+V353+W353+X353+Y353)/12 -> 0.30552499999999999 | AB353: =(G353+H353+I353+J353+K353+L353+M353+N353+O353+P353+Q353+R353+S353+T353+U353+V353+W353+X353+Y353)/19 -> 0.18213157894736839 | AC353: =(R353+S353)/2 -> 0.49349999999999994 | AD353: =(S353+T353)/2 -> 0.18190000000000001 | AE353: =(T353+U353)/2 -> 0.20845 | AF353: =(U353+V353)/2 -> 1.7049999999999996e-02 | AG353: =(V353+W353)/2 -> -1.3999999999999985e-03 | AH353: =(W353+X353)/2 -> 0.13780000000000001 | AI353: =(X353+Y353)/2 -> 0.1343 | AJ353: =STDEV(G353:Y353) -> 0.36480515964405436
B354: 603936.SH | C354: 博敏电子
B355: 600268.SH | C355: 国电南自
B356: 600075.SH | C356: 新疆天业
B357: 600549.SH | C357: 厦门钨业
B358: 001227.SZ | C358: 兰州银行
B359: 603617.SH | C359: 君禾股份
B360: 600202.SH | C360: 哈空调
B361: 000970.SZ | C361: 中科三环 | E361: 0.32700000000000001 | F361: 0.16900000000000001 | G361: 0.15839999999999999 | H361: 2.7099999999999999e-02 | I361: -0.129 | J361: -0.10769999999999999 | K361: -0.41759999999999997 | L361: -0.26979999999999998 | M361: -6.88e-02 | N361: -0.1321 | O361: 4.8000000000000001e-02 | P361: -0.1048 | Q361: -0.1648 | R361: -0.17960000000000001 | S361: -0.7229000000000001 | T361: -0.74890000000000001 | U361: -0.59999999999999998 | V361: -0.35670000000000002 | W361: 3.0869999999999997 | X361: 3.5931999999999999 | Y361: 2.2806000000000002 | AA361: =(N361+O361+P361+Q361+R361+S361+T361+U361+V361+W361+X361+Y361)/12 -> 0.49991666666666662 | AB361: =(G361+H361+I361+J361+K361+L361+M361+N361+O361+P361+Q361+R361+S361+T361+U361+V361+W361+X361+Y361)/19 -> 0.27324210526315784 | AC361: =(R361+S361)/2 -> -0.45125000000000004 | AD361: =(S361+T361)/2 -> -0.7359 | AE361: =(T361+U361)/2 -> -0.67444999999999999 | AF361: =(U361+V361)/2 -> -0.47835 | AG361: =(V361+W361)/2 -> 1.3651499999999999 | AH361: =(W361+X361)/2 -> 3.3400999999999996 | AI361: =(X361+Y361)/2 -> 2.9369000000000001 | AJ361: =STDEV(G361:Y361) -> 1.2514443110599089
B362: 603558.SH | C362: 健盛集团 | E362: 0.40240000000000004 | F362: 0.47999999999999998 | G362: -0.40000000000000002 | H362: -0.21739999999999998 | I362: -6.6699999999999995e-02 | J362: 0.1724 | K362: 0.22219999999999998 | L362: 0.5 | M362: 0.5 | N362: 0.47060000000000002 | O362: 0.54549999999999998 | P362: 0.33329999999999999 | Q362: 0.33329999999999999 | R362: 0.35999999999999999 | S362: -0.17649999999999999 | T362: -0.61109999999999998 | U362: -0.75 | V362: -2.9264999999999999 | W362: -0.1429 | X362: 1 | Y362: 2.4286000000000003 | AA362: =(N362+O362+P362+Q362+R362+S362+T362+U362+V362+W362+X362+Y362)/12 -> 7.2025000000000047e-02 | AB362: =(G362+H362+I362+J362+K362+L362+M362+N362+O362+P362+Q362+R362+S362+T362+U362+V362+W362+X362+Y362)/19 -> 8.2884210526315796e-02 | AC362: =(R362+S362)/2 -> 9.1749999999999998e-02 | AD362: =(S362+T362)/2 -> -0.39379999999999998 | AE362: =(T362+U362)/2 -> -0.68054999999999999 | AF362: =(U362+V362)/2 -> -1.8382499999999999 | AG362: =(V362+W362)/2 -> -1.5347 | AH362: =(W362+X362)/2 -> 0.42854999999999999 | AI362: =(X362+Y362)/2 -> 1.7143000000000002 | AJ362: =STDEV(G362:Y362) -> 0.99947510294329434 | AK362: -3.1e-02 | AL362: 0.2366 | AM362: 0.15920000000000001
B363: 000925.SZ | C363: 众合科技 | E363: 0.6139 | F363: 0.192 | G363: 0.16670000000000001 | H363: -0.66760000000000008 | I363: 1.7172999999999998 | J363: 1.3529 | K363: 1.04 | L363: 1.5119999999999998 | M363: 0.20530000000000001 | N363: -0.58329999999999993 | O363: 8.5 | P363: 0.51340000000000008 | Q363: 1.0676000000000001 | R363: 3.7999999999999998 | S363: -15.631600000000001 | T363: -4.1042000000000005 | U363: -0.98040000000000005 | V363: -0.58329999999999993 | W363: 1.2121999999999999 | X363: 1.8571 | Y363: 65.666700000000006 | AA363: =(N363+O363+P363+Q363+R363+S363+T363+U363+V363+W363+X363+Y363)/12 -> 5.061183333333334 | AB363: =(G363+H363+I363+J363+K363+L363+M363+N363+O363+P363+Q363+R363+S363+T363+U363+V363+W363+X363+Y363)/19 -> 3.476884210526316 | AC363: =(R363+S363)/2 -> -5.9158000000000008 | AD363: =(S363+T363)/2 -> -9.8679000000000006 | AE363: =(T363+U363)/2 -> -2.5423000000000004 | AF363: =(U363+V363)/2 -> -0.78184999999999993 | AG363: =(V363+W363)/2 -> 0.31445000000000001 | AH363: =(W363+X363)/2 -> 1.5346500000000001 | AI363: =(X363+Y363)/2 -> 33.761900000000004 | AJ363: =STDEV(G363:Y363) -> 15.717890022351503 | AK363: -0.22850000000000001 | AL363: -0.18379999999999999 | AM363: -0.1883
B364: 002402.SZ | C364: 和而泰
B365: 002817.SZ | C365: 黄山胶囊 | E365: 0.1867 | F365: 0.20000000000000001 | G365: -0.3478 | H365: -0.35999999999999999 | I365: -0.34329999999999999 | J365: -0.28949999999999998 | K365: -0.20000000000000001 | L365: -0.25 | M365: -0.25 | N365: -0.2407 | O365: -0.16670000000000001 | P365: -0.5 | Q365: -0.36359999999999998 | R365: -0.34149999999999997 | S365: -0.40000000000000002 | T365: -0.25 | U365: -0.23809999999999998 | V365: 0.14810000000000001 | W365: 0.16670000000000001 | X365: 0.33329999999999999 | Y365: 0.25 | AA365: =(N365+O365+P365+Q365+R365+S365+T365+U365+V365+W365+X365+Y365)/12 -> -0.13354166666666664 | AB365: =(G365+H365+I365+J365+K365+L365+M365+N365+O365+P365+Q365+R365+S365+T365+U365+V365+W365+X365+Y365)/19 -> -0.19174210526315791 | AC365: =(R365+S365)/2 -> -0.37075000000000002 | AD365: =(S365+T365)/2 -> -0.32500000000000001 | AE365: =(T365+U365)/2 -> -0.24404999999999999 | AF365: =(U365+V365)/2 -> -4.4999999999999984e-02 | AG365: =(V365+W365)/2 -> 0.15740000000000001 | AH365: =(W365+X365)/2 -> 0.25 | AI365: =(X365+Y365)/2 -> 0.29164999999999996 | AJ365: =STDEV(G365:Y365) -> 0.23637892206227193 | AK365: 0.2777 | AL365: 0.34000000000000002 | AM365: 0.35880000000000001
B366: 600997.SH | C366: 开滦股份
B367: 002004.SZ | C367: 华邦健康
B368: 603687.SH | C368: 大胜达
B369: 600740.SH | C369: 山西焦化
B370: 600557.SH | C370: 康缘药业
B371: 600110.SH | C371: 诺德股份
B372: 000969.SZ | C372: 安泰科技
B373: 002334.SZ | C373: 英威腾
B374: 002917.SZ | C374: 金奥博
B375: 600307.SH | C375: 酒钢宏兴
B376: 603289.SH | C376: 泰瑞机器
B377: 600982.SH | C377: 宁波能源 | E377: 0.52049999999999996 | F377: 0.14199999999999999 | G377: 1.8304 | H377: 0.67059999999999997 | I377: 0.79220000000000002 | J377: 0.14319999999999999 | K377: -0.46279999999999999 | L377: 0.34240000000000004 | M377: 0.2802 | N377: 0.6794 | O377: 0.6038 | P377: -0.44329999999999997 | Q377: -0.37799999999999995 | R377: -0.48700000000000004 | S377: -0.44600000000000001 | T377: 0.20379999999999998 | U377: 0.36399999999999999 | V377: 1.1328 | W377: 0.76190000000000002 | X377: 0.1234 | Y377: 5.5599999999999997e-02 | AA377: =(N377+O377+P377+Q377+R377+S377+T377+U377+V377+W377+X377+Y377)/12 -> 0.18086666666666665 | AB377: =(G377+H377+I377+J377+K377+L377+M377+N377+O377+P377+Q377+R377+S377+T377+U377+V377+W377+X377+Y377)/19 -> 0.30350526315789472 | AC377: =(R377+S377)/2 -> -0.46650000000000003 | AD377: =(S377+T377)/2 -> -0.12110000000000001 | AE377: =(T377+U377)/2 -> 0.28389999999999999 | AF377: =(U377+V377)/2 -> 0.74839999999999995 | AG377: =(V377+W377)/2 -> 0.94735000000000003 | AH377: =(W377+X377)/2 -> 0.44264999999999999 | AI377: =(X377+Y377)/2 -> 8.9499999999999996e-02 | AJ377: =STDEV(G377:Y377) -> 0.61308035042877651
B378: 603567.SH | C378: 珍宝岛
B379: 600251.SH | C379: 冠农股份
B380: 002266.SZ | C380: 浙富控股
B381: 002273.SZ | C381: 水晶光电 | E381: 0.13189999999999999 | F381: 0.254 | G381: 0.11109999999999999 | H381: 0.125 | I381: 0.23079999999999998 | J381: 7.690000000000001e-02 | K381: -0.29999999999999999 | L381: 0.27779999999999999 | M381: 0.125 | N381: 0 | O381: -0.28570000000000001 | P381: 0.39130000000000004 | Q381: -0.11109999999999999 | R381: 4.7599999999999996e-02 | S381: 0.40000000000000002 | T381: 7.1399999999999991e-02 | U381: -0.1875 | V381: -0.15909999999999999 | W381: 0.1429 | X381: -6.6699999999999995e-02 | Y381: 7.690000000000001e-02 | AA381: =(N381+O381+P381+Q381+R381+S381+T381+U381+V381+W381+X381+Y381)/12 -> 2.6666666666666675e-02 | AB381: =(G381+H381+I381+J381+K381+L381+M381+N381+O381+P381+Q381+R381+S381+T381+U381+V381+W381+X381+Y381)/19 -> 5.0873684210526314e-02 | AC381: =(R381+S381)/2 -> 0.2238 | AD381: =(S381+T381)/2 -> 0.23570000000000002 | AE381: =(T381+U381)/2 -> -5.8050000000000004e-02 | AF381: =(U381+V381)/2 -> -0.17330000000000001 | AG381: =(V381+W381)/2 -> -8.0999999999999961e-03 | AH381: =(W381+X381)/2 -> 3.8100000000000002e-02 | AI381: =(X381+Y381)/2 -> 5.1000000000000073e-03 | AJ381: =STDEV(G381:Y381) -> 0.20089699915380976
B382: 603829.SH | C382: 洛凯股份
B383: 603355.SH | C383: 莱克电气
B384: 600330.SH | C384: 天通股份 | E384: 0.36700000000000005 | F384: 0.34999999999999998 | G384: 1.5600000000000001e-02 | H384: -9.820000000000001e-02 | I384: 0.1527 | J384: 0.18049999999999999 | K384: 0.26150000000000001 | L384: 0.6139 | M384: 0.54969999999999997 | N384: 0.81530000000000002 | O384: 1.2199999999999999e-02 | P384: -0.2883 | Q384: -0.37180000000000002 | R384: -0.42109999999999997 | S384: 0.1928 | T384: 0.85340000000000005 | U384: 1.3061 | V384: 1.3636000000000001 | W384: 8.0799999999999997e-02 | X384: 6.0499999999999998e-02 | Y384: 3.2400000000000005e-02 | AA384: =(N384+O384+P384+Q384+R384+S384+T384+U384+V384+W384+X384+Y384)/12 -> 0.30299166666666671 | AB384: =(G384+H384+I384+J384+K384+L384+M384+N384+O384+P384+Q384+R384+S384+T384+U384+V384+W384+X384+Y384)/19 -> 0.27955789473684212 | AC384: =(R384+S384)/2 -> -0.11414999999999999 | AD384: =(S384+T384)/2 -> 0.52310000000000001 | AE384: =(T384+U384)/2 -> 1.07975 | AF384: =(U384+V384)/2 -> 1.3348500000000001 | AG384: =(V384+W384)/2 -> 0.72220000000000006 | AH384: =(W384+X384)/2 -> 7.0649999999999991e-02 | AI384: =(X384+Y384)/2 -> 4.6450000000000005e-02 | AJ384: =STDEV(G384:Y384) -> 0.51282737328980554
B385: 002952.SZ | C385: 亚世光电
B386: 002042.SZ | C386: 华孚时尚
B387: 002183.SZ | C387: 怡亚通
B388: 603628.SH | C388: 清源股份
B389: 600509.SH | C389: 天富能源
B390: 600493.SH | C390: 凤竹纺织 | E390: 0.57650000000000001 | F390: 0.27100000000000002 | G390: 0.40570000000000001 | H390: 0.9516 | I390: 0.161 | J390: -0.55979999999999996 | K390: 0.45640000000000003 | L390: 1.4738 | M390: 1.8400999999999998 | N390: 0.23219999999999999 | O390: 0.17050000000000001 | P390: -0.2762 | Q390: -0.33429999999999999 | R390: -0.152 | S390: -0.77560000000000007 | T390: -0.48920000000000002 | U390: -0.46939999999999998 | V390: 0.14150000000000001 | W390: 2.1404000000000001 | X390: 2.5030000000000001 | Y390: 3.3983999999999996 | AA390: =(N390+O390+P390+Q390+R390+S390+T390+U390+V390+W390+X390+Y390)/12 -> 0.50744166666666668 | AB390: =(G390+H390+I390+J390+K390+L390+M390+N390+O390+P390+Q390+R390+S390+T390+U390+V390+W390+X390+Y390)/19 -> 0.56937368421052625 | AC390: =(R390+S390)/2 -> -0.46380000000000005 | AD390: =(S390+T390)/2 -> -0.63240000000000007 | AE390: =(T390+U390)/2 -> -0.4793 | AF390: =(U390+V390)/2 -> -0.16394999999999998 | AG390: =(V390+W390)/2 -> 1.1409500000000001 | AH390: =(W390+X390)/2 -> 2.3216999999999999 | AI390: =(X390+Y390)/2 -> 2.9506999999999999 | AJ390: =STDEV(G390:Y390) -> 1.1734813920988858 | AK390: 1.165 | AL390: 0.31109999999999999 | AM390: 0.4536
B391: 000586.SZ | C391: 汇源通信
B392: 600060.SH | C392: 海信视像
B393: 002166.SZ | C393: 莱茵生物
B394: 000837.SZ | C394: 秦川机床
B395: 002971.SZ | C395: 和远气体
B396: 002573.SZ | C396: 清新环境 | E396: 0.66599999999999993 | F396: 0.26800000000000002 | G396: 0.1075 | H396: 0.16 | I396: 0.2311 | J396: -0.13059999999999999 | K396: 0.20199999999999999 | L396: 0.13789999999999999 | M396: -0.20440000000000003 | N396: -0.20039999999999999 | O396: -0.14649999999999999 | P396: -0.38819999999999999 | Q396: -0.34840000000000004 | R396: -0.27639999999999998 | S396: -0.30579999999999996 | T396: -0.37840000000000001 | U396: -9.4499999999999987e-02 | V396: -0.44719999999999999 | W396: 0.15210000000000001 | X396: 5.3399999999999996e-02 | Y396: -7.8000000000000005e-03 | AA396: =(N396+O396+P396+Q396+R396+S396+T396+U396+V396+W396+X396+Y396)/12 -> -0.19900833333333334 | AB396: =(G396+H396+I396+J396+K396+L396+M396+N396+O396+P396+Q396+R396+S396+T396+U396+V396+W396+X396+Y396)/19 -> -9.9189473684210536e-02 | AC396: =(R396+S396)/2 -> -0.29109999999999997 | AD396: =(S396+T396)/2 -> -0.34209999999999996 | AE396: =(T396+U396)/2 -> -0.23644999999999999 | AF396: =(U396+V396)/2 -> -0.27084999999999998 | AG396: =(V396+W396)/2 -> -0.14754999999999999 | AH396: =(W396+X396)/2 -> 0.10275000000000001 | AI396: =(X396+Y396)/2 -> 2.2799999999999997e-02 | AJ396: =STDEV(G396:Y396) -> 0.22410976699113028
B397: 603139.SH | C397: 康惠制药
B398: 000850.SZ | C398: 华茂股份 | E398: 0.34909999999999997 | F398: 0.36399999999999999 | G398: -0.22149999999999997 | H398: -0.82930000000000004 | I398: -0.62119999999999997 | J398: 0.10000000000000001 | K398: 7.4223999999999997 | L398: 9 | M398: 4.6799999999999997 | N398: 0.18179999999999999 | O398: 3.5926 | P398: 1.3213999999999999 | Q398: 1.0634000000000001 | R398: 0.61539999999999995 | S398: -1.4012 | T398: -0.64000000000000001 | U398: -8.1900000000000001e-02 | V398: 0.1429 | W398: 0.83329999999999993 | X398: 0.32479999999999998 | Y398: 0.35320000000000001 | AA398: =(N398+O398+P398+Q398+R398+S398+T398+U398+V398+W398+X398+Y398)/12 -> 0.52547500000000003 | AB398: =(G398+H398+I398+J398+K398+L398+M398+N398+O398+P398+Q398+R398+S398+T398+U398+V398+W398+X398+Y398)/19 -> 1.3597947368421055 | AC398: =(R398+S398)/2 -> -0.39290000000000003 | AD398: =(S398+T398)/2 -> -1.0206 | AE398: =(T398+U398)/2 -> -0.36094999999999999 | AF398: =(U398+V398)/2 -> 3.0499999999999999e-02 | AG398: =(V398+W398)/2 -> 0.48809999999999998 | AH398: =(W398+X398)/2 -> 0.57904999999999995 | AI398: =(X398+Y398)/2 -> 0.33899999999999997 | AJ398: =STDEV(G398:Y398) -> 2.82366491017804
B399: 002777.SZ | C399: 久远银海
B400: 603320.SH | C400: 迪贝电气 | E400: 0.37009999999999998 | F400: 0.48899999999999999 | G400: 0.53849999999999998 | H400: 0.27589999999999998 | I400: 0.14630000000000001 | J400: -8.199999999999999e-02 | K400: -0.5 | L400: -0.37840000000000001 | M400: -0.23399999999999999 | N400: -0.2321 | O400: 0.20000000000000001 | P400: -4.3499999999999997e-02 | Q400: -5.5599999999999997e-02 | R400: -4.6500000000000007e-02 | S400: 0.16670000000000001 | T400: -0.2273 | U400: -0.29410000000000003 | V400: -0.2195 | W400: 0 | X400: 1.2353000000000001 | Y400: 1.0417000000000001 | AA400: =(N400+O400+P400+Q400+R400+S400+T400+U400+V400+W400+X400+Y400)/12 -> 0.12709166666666669 | AB400: =(G400+H400+I400+J400+K400+L400+M400+N400+O400+P400+Q400+R400+S400+T400+U400+V400+W400+X400+Y400)/19 -> 6.7968421052631581e-02 | AC400: =(R400+S400)/2 -> 6.0100000000000001e-02 | AD400: =(S400+T400)/2 -> -3.0299999999999994e-02 | AE400: =(T400+U400)/2 -> -0.26070000000000004 | AF400: =(U400+V400)/2 -> -0.25680000000000003 | AG400: =(V400+W400)/2 -> -0.10975 | AH400: =(W400+X400)/2 -> 0.61765000000000003 | AI400: =(X400+Y400)/2 -> 1.1385000000000001 | AJ400: =STDEV(G400:Y400) -> 0.45219522462050687 | AK400: 0.42700000000000005 | AL400: 0.35139999999999999 | AM400: 0.36670000000000003
B401: 002908.SZ | C401: 德生科技
B402: 002130.SZ | C402: 沃尔核材
B403: 605319.SH | C403: 无锡振华
B404: 603001.SH | C404: 奥康国际
B405: 600704.SH | C405: 物产中大
B406: 002412.SZ | C406: 汉森制药
B407: 603126.SH | C407: 中材节能
B408: 002931.SZ | C408: 锋龙股份 | E408: 0.38500000000000001 | F408: 0.34599999999999997 | J408: 0 | K408: -6.3099999999999989e-02 | L408: -0.2571 | M408: -0.1961 | N408: -0.2361 | O408: -0.24079999999999999 | P408: 0.30769999999999997 | Q408: 0.24390000000000001 | R408: -0.2545 | S408: -0.29699999999999999 | T408: -0.55880000000000007 | U408: -0.47060000000000002 | V408: 0.31709999999999999 | W408: 1.375 | X408: 0.66670000000000007 | Y408: 0.29630000000000001 | AA408: =(N408+O408+P408+Q408+R408+S408+T408+U408+V408+W408+X408+Y408)/12 -> 9.5741666666666655e-02 | AB408: =(G408+H408+I408+J408+K408+L408+M408+N408+O408+P408+Q408+R408+S408+T408+U408+V408+W408+X408+Y408)/19 -> 3.3294736842105266e-02 | AC408: =(R408+S408)/2 -> -0.27575 | AD408: =(S408+T408)/2 -> -0.42790000000000006 | AE408: =(T408+U408)/2 -> -0.51470000000000005 | AF408: =(U408+V408)/2 -> -7.6750000000000013e-02 | AG408: =(V408+W408)/2 -> 0.84604999999999997 | AH408: =(W408+X408)/2 -> 1.02085 | AI408: =(X408+Y408)/2 -> 0.48150000000000004 | AJ408: =STDEV(G408:Y408) -> 0.4872768684228711
B409: 600072.SH | C409: 中船科技