A1: 股票代码 | B1: 股票简称 | C1: 区间涨跌幅:前复权(%)2021.01.18-2022.01.17 | D1: 基本每股收益(元)2021.09.30 | E1: 趋势 | P1: 波动收缩幅度 | AI1: 成交量行为 | AK1: 价格行为(得分应大于60%) | AN1: 结论 | AO1: 更新时间
E2: 200日均线 | F2: 150日均线 | G2: 50日均线 | H2: 各均线斜率是否朝上 | I2: 当前股价 | J2: 52周内最低点 | K2: 52周内最高点 | L2: 最高点前8周收盘价 | M2: 当前股价相对于最低点百分比(至少高出25%) | N2: 当前股价相对于最高点百分比(25%内最好) | O2: 最高点前8周股价相对于最高点百分比 | P2: 技术足迹 | AI2: 不同收盘表现时交易量情况(好的收盘时，交易量是否增大，坏的收盘时，交易量是否萎缩) | AJ2: 成交量收缩情况(最后的价格收缩期间的成交量应低于50天的平均水平且有一到两天交易量极低) | AK2: 支撑位和压力位是否同步升高(40%) | AL2: 是否有网球行为出现(40%) | AM2: 上涨天数是否大于下跌天数(20%)
P3: 支撑位1 | Q3: 阻力位2 | R3: 支撑位2 | S3: 阻力位3 | T3: 支撑位3 | U3: 阻力位4 | V3: 支撑位4 | W3: 阻力位5 | X3: 支撑位5 | Y3: 阻力位6 | Z3: 支撑位6 | AA3: 时间周期 | AB3: 收缩量1 | AC3: 收缩量2 | AD3: 收缩量3 | AE3: 收缩量4 | AF3: 收缩量5 | AG3: 收缩量6 | AH3: 收缩数量(当前股价距离前8周价格涨幅超过100%的，不用在意收缩数量；其他的情况需要收缩数量大于2T)
A4: 002432.SZ | B4: 九安医疗 | C4: 819.09 | D4: 0.11 | E4: 17.780000000000001 | F4: 20.629999999999999 | G4: 37.399999999999999 | I4: 77.659999999999997 | J4: 5.7999999999999998 | K4: 88.879999999999995 | L4: 9.9600000000000009 | M4: =(I4-J4)/J4 -> 12.389655172413793 | N4: =(K4-I4)/K4 -> 0.12623762376237624 | O4: =(K4-L4)/L4 -> 7.923694779116464 | P4: 62.899999999999999 | AA4: 1w | AB4: =(K4-P4)/K4 -> 0.29230423042304227 | AC4: =(Q4-R4)/Q4 -> #DIV/0! | AN4: 不宜入场（收缩幅度不够，应观察2w） | AO4: 44585
A5: 000422.SZ | B5: 湖北宜化 | C5: 582.29 | D5: 1.66 | E5: 17.109999999999999 | F5: 19.010000000000002 | G5: 22.289999999999999 | I5: 19.469999999999999 | AN5: 不宜入场（当前股价小于50日均线,应观察2w） | AO5: 44579
A6: 605117.SH | B6: 德业股份 | C6: 553.13 | D6: 2.64 | E6: 194.31999999999999 | F6: 215.12 | G6: 255.34999999999999 | I6: 254.71000000000001 | AN6: 不宜入场（当前股价小于50日均线,应观察2w） | AO6: 44579
A7: 603098.SH | B7: 森特股份 | C7: 427.18 | D7: 0.17 | E7: 37.890000000000001 | F7: 40.399999999999999 | G7: 43.850000000000001 | I7: 41.439999999999998 | AN7: 不宜入场（当前股价小于50日均线,应观察2w） | AO7: 44579
A8: 002326.SZ | B8: 永太科技 | C8: 395.74 | D8: 0.43 | E8: 41.57 | F8: 46.049999999999997 | G8: 52.710000000000001 | I8: 43.75 | AN8: 不宜入场（当前股价小于50日均线,应观察2w） | AO8: 44579
A9: 002006.SZ | B9: 精功科技 | C9: 338.36 | D9: 0.18 | E9: 18.050000000000001 | F9: 20.050000000000001 | G9: 25.469999999999999 | I9: 22.460000000000001 | AN9: 不宜入场（当前股价小于50日均线,应观察2w） | AO9: 44579
A10: 003039.SZ | B10: 顺控发展 | C10: 337.74 | D10: 0.33 | E10: 32.350000000000001 | F10: 32.68 | G10: 31.449999999999999 | AN10: 不宜入场（50日均线小于150日均线,应观察5w） | AO10: 44579
A11: 000683.SZ | B11: 远兴能源 | C11: 318.54 | D11: 0.57 | E11: 6.8600000000000003 | F11: 7.3200000000000003 | G11: 7.8700000000000001 | I11: 9.0399999999999991 | J11: 1.99 | K11: 13.539999999999999 | L11: 6.9000000000000004 | M11: =(I11-J11)/J11 -> 3.5427135678391957 | N11: =(K11-I11)/K11 -> 0.33234859675036932 | O11: =(K11-L11)/L11 -> 0.96231884057970996 | AN11: 不宜入场（当前股价相对于最高点距离太大,应观察1w） | AO11: 44582
A12: 002487.SZ | B12: 大金重工 | C12: 314.08 | D12: 0.78 | E12: 25.059999999999999 | F12: 28.199999999999999 | G12: 37.289999999999999 | I12: 33.369999999999997 | AN12: 不宜入场（当前股价小于50日均线,应观察2w） | AO12: 44579
A13: 000408.SZ | B13: 藏格矿业 | C13: 303.21 | D13: 0.41 | E13: 25.850000000000001 | F13: 27.899999999999999 | G13: 32.450000000000003 | I13: 30.5 | AN13: 不宜入场（当前股价相对于最高点距离太大,应观察3w） | AO13: 44579
A14: 001317.SZ | B14: 三羊马 | C14: 302.60000000000002 | D14: 0.77 | E14: 34.890000000000001 | F14: 38.289999999999999 | G14: 58 | I14: 85.030000000000001 | J14: 19.199999999999999 | K14: 108.63 | L14: 19.199999999999999 | M14: =(I14-J14)/J14 -> 3.4286458333333334 | N14: =(K14-I14)/K14 -> 0.21725121973672093 | O14: =(K14-L14)/L14 -> 4.6578124999999995 | P14: 72.680000000000007 | AA14: 2w | AB14: =(K14-P14)/K14 -> 0.33093988769216598 | AN14: 不宜入场（收缩幅度不够,应观察2w） | AO14: 44579
A15: 603026.SH | B15: 石大胜华 | C15: 281.19999999999999 | D15: 3.66 | E15: 186.53 | F15: 197.87 | G15: 199.08000000000001 | I15: 181 | AN15: 不宜入场（当前股价相对于最高点距离太大,应观察3w） | AO15: 44579
A16: 002349.SZ | B16: 精华制药 | C16: 258.43 | D16: 0.16 | E16: 6.4000000000000004 | F16: 6.8200000000000003 | G16: 9 | I16: 20 | J16: 3.9199999999999999 | K16: 22.449999999999999 | L16: 5.6900000000000004 | M16: =(I16-J16)/J16 -> 4.1020408163265305 | N16: =(K16-I16)/K16 -> 0.10913140311804007 | O16: =(K16-L16)/L16 -> 2.9455184534270646 | P16: 16.199999999999999 | AA16: 0w | AB16: =(K16-P16)/K16 -> 0.27839643652561247 | AN16: 不宜入场（收缩幅度不够,应观察2w） | AO16: 44585
A17: 000792.SZ | B17: 盐湖股份 | C17: 250.34 | D17: 0.68 | E17: 23.899999999999999 | F17: 26.170000000000002 | G17: 30.940000000000001 | I17: 26.949999999999999 | J17: 7.6600000000000001 | K17: 45.649999999999999 | L17: 8.7599999999999998 | M17: =(I17-J17)/J17 -> 2.5182767624020888 | N17: =(K17-I17)/K17 -> 0.40963855421686746 | O17: =(K17-L17)/L17 -> 4.2111872146118721 | AN17: 不宜入场（当前股价相对于最高点距离太大,应观察1w） | AO17: 44582
A18: 605369.SH | B18: 拱东医疗 | C18: 249.75 | D18: 2.57 | E18: 101.52 | F18: 107.8 | G18: 125.41 | I18: 139.11000000000001 | J18: 42.140000000000001 | K18: 155.28999999999999 | L18: 108.8 | M18: =(I18-J18)/J18 -> 2.3011390602752733 | N18: =(K18-I18)/K18 -> 0.10419215661021301 | O18: =(K18-L18)/L18 -> 0.42729779411764701 | P18: 132.16 | AA18: 1w | AB18: =(K18-P18)/K18 -> 0.14894713117393263 | AN18: 不宜入场（收缩幅度不够,应观察1w） | AO18: 44585
A19: 002176.SZ | B19: 江特电机 | C19: 248.69999999999999 | D19: 0.15 | E19: 17.629999999999999 | F19: 19 | G19: 20.460000000000001 | I19: 17.5 | AN19: 不宜入场（当前股价小于200日均线,应观察5w） | AO19: 44579
A20: 600338.SH | B20: 西藏珠峰 | C20: 247.64 | D20: 0.68 | E20: 28.02 | F20: 30.18 | G20: 33.450000000000003 | I20: 31.52 | AN20: 不宜入场（当前股价小于50日均线,应观察2w） | AO20: 44579
A21: 002534.SZ | B21: 杭锅股份 | C21: 244.96 | D21: 0.48 | E21: 22.010000000000002 | F21: 23.34 | G21: 28.390000000000001 | I21: 29.98 | J21: 7.7000000000000002 | K21: 35 | L21: 20.57 | M21: =(I21-J21)/J21 -> 2.8935064935064938 | N21: =(K21-I21)/K21 -> 0.14342857142857141 | O21: =(K21-L21)/L21 -> 0.701507049100632 | P21: 28.059999999999999 | AA21: 3w | AB21: =(K21-P21)/K21 -> 0.19828571428571432 | AN21: 不宜入场（收缩幅度不够,应观察1w） | AO21: 44585
A22: 002015.SZ | B22: 协鑫能科 | C22: 244.26 | D22: 0.59999999999999998 | E22: 13.57 | F22: 14.4 | G22: 16.82 | I22: 18.280000000000001 | J22: 5.6299999999999999 | K22: 21.07 | L22: 13 | M22: =(I22-J22)/J22 -> 2.2468916518650093 | N22: =(K22-I22)/K22 -> 0.13241575700047456 | O22: =(K22-L22)/L22 -> 0.62076923076923074 | P22: 15.390000000000001 | AA22: 5w | AB22: =(K22-P22)/K22 -> 0.26957759848125296 | AN22: 不宜入场（收缩幅度不够,应观察2w） | AO22: 44579
A23: 002824.SZ | B23: 和胜股份 | C23: 241.25 | D23: 0.69 | E23: 34.899999999999999 | F23: 37 | G23: 41.439999999999998 | I23: 44.350000000000001 | J23: 12.77 | K23: 50.990000000000002 | L23: 32.18 | M23: =(I23-J23)/J23 -> 2.4729835552075179 | N23: =(K23-I23)/K23 -> 0.13022161208080016 | O23: =(K23-L23)/L23 -> 0.58452454940957121 | P23: 37.57 | Q23: 47 | R23: 39.020000000000003 | AA23: 10w | AB23: =(K23-P23)/K23 -> 0.2631888605608943 | AC23: =(Q23-R23)/Q23 -> 0.16978723404255314 | AD23: =(S23-T23)/S23 -> #DIV/0! | AN23: 不宜入场（收缩幅度不够,应观察1w） | AO23: 44585
A24: 603897.SH | B24: 长城科技 | C24: 238.17 | D24: 1.64 | E24: 40.100000000000001 | F24: 43.759999999999998 | G24: 51.530000000000001 | I24: 50.200000000000003 | AN24: 不宜入场（当前股价小于50日均线,应观察2w） | AO24: 44579
A25: 002011.SZ | B25: 盾安环境 | C25: 237.66 | D25: 0.37 | E25: 8.3699999999999992 | F25: 9.1999999999999993 | G25: 12.19 | I25: 14.1 | J25: 3.6699999999999999 | K25: 16.32 | L25: 6.5599999999999996 | M25: =(I25-J25)/J25 -> 2.8419618528610355 | N25: =(K25-I25)/K25 -> 0.13602941176470593 | O25: =(K25-L25)/L25 -> 1.4878048780487809 | P25: 11.82 | AA25: 5w | AB25: =(K25-P25)/K25 -> 0.27573529411764708 | AN25: 不宜入场（收缩幅度不够,应观察2w） | AO25: 44579
A26: 603297.SH | B26: 永新光学 | C26: 236.44 | D26: 1.97 | E26: 75.159999999999997 | F26: 80.989999999999995 | G26: 103.12 | I26: 132.02000000000001 | J26: 36.710000000000001 | K26: 138 | L26: 88.890000000000001 | M26: =(I26-J26)/J26 -> 2.5962952873876328 | N26: =(K26-I26)/K26 -> 4.3333333333333258e-02 | O26: =(K26-L26)/L26 -> 0.5524805939925751 | P26: 119.45 | AA26: 1w | AB26: =(K26-P26)/K26 -> 0.13442028985507246 | AN26: 不宜入场（时间周期太短，应多观察1w） | AO26: 44585
A27: 603055.SH | B27: 台华新材 | C27: 236.18 | D27: 0.46 | E27: 12.970000000000001 | F27: 14.08 | G27: 16.52 | I27: 17.899999999999999 | J27: 4.7000000000000002 | K27: 21.09 | L27: 17.329999999999998 | M27: =(I27-J27)/J27 -> 2.808510638297872 | N27: =(K27-I27)/K27 -> 0.15125651967757237 | O27: =(K27-L27)/L27 -> 0.2169648009232546 | P27: 14.91 | Q27: 18.41 | R27: 15.699999999999999 | AA27: 4w | AB27: =(K27-P27)/K27 -> 0.2930298719772404 | AC27: =(Q27-R27)/Q27 -> 0.14720260727865295 | AN27: 不宜入场（收缩幅度不够,应观察1w） | AO27: 44585
A28: 605020.SH | B28: 永和股份 | C28: 233.53 | D28: 0.79 | E28: 27.079999999999998 | F28: 29.140000000000001 | G28: 31.309999999999999 | I28: 27.960000000000001 | AN28: 不宜入场（当前股价小于150日均线,应观察3w） | AO28: 44579
A29: 001208.SZ | B29: 华菱线缆 | C29: 232.56 | D29: 0.24 | E29: 12.960000000000001 | F29: 13.949999999999999 | G29: 15.359999999999999 | I29: 14.57 | AN29: 不宜入场（当前股价小于50日均线,应观察2w） | AO29: 44579
A30: 601126.SH | B30: 四方股份 | C30: 232.30000000000001 | D30: 0.47 | E30: 15.43 | F30: 16.829999999999998 | G30: 20.23 | I30: 18.699999999999999 | AN30: 不宜入场（当前股价小于50日均线,应观察2w） | AO30: 44579
A31: 600096.SH | B31: 云天化 | C31: 228.11 | D31: 1.55 | E31: 18.84 | F31: 20.23 | G31: 21.510000000000002 | I31: 18.98 | AN31: 不宜入场（当前股价小于150日均线,应观察3w） | AO31: 44579
A32: 605005.SH | B32: 合兴股份 | C32: 228.09999999999999 | D32: 0.39 | E32: 20.68 | F32: 21.399999999999999 | G32: 23.59 | I32: 23.350000000000001 | AN32: 不宜入场（当前股价小于50日均线,应观察2w） | AO32: 44579
A33: 002472.SZ | B33: 双环传动 | C33: 226.42 | D33: 0.32 | E33: 21.510000000000002 | F33: 23.350000000000001 | G33: 27.350000000000001 | I33: 27.280000000000001 | AN33: 不宜入场（当前股价小于50日均线,应观察1w） | AO33: 44579
A34: 600032.SH | B34: 浙江新能 | C34: 224.47 | D34: 0.21 | E34: 12.59 | F34: 13.550000000000001 | G34: 15.23 | I34: 13.9 | AN34: 不宜入场（当前股价小于50日均线,应观察2w） | AO34: 44579
A35: 000893.SZ | B35: 亚钾国际 | C35: 224.35 | D35: 0.95 | E35: 18.699999999999999 | F35: 19.670000000000002 | G35: 22.460000000000001 | I35: 24.300000000000001 | J35: 7.9000000000000004 | K35: 28.670000000000002 | L35: 17.870000000000001 | M35: =(I35-J35)/J35 -> 2.0759493670886071 | N35: =(K35-I35)/K35 -> 0.15242413672828745 | O35: =(K35-L35)/L35 -> 0.60436485730274203 | P35: 22.350000000000001 | AA35: 2w | AB35: =(K35-P35)/K35 -> 0.22043948378095571 | AN35: 不宜入场（收缩幅度不够,应观察2w） | AO35: 44585
A36: 003043.SZ | B36: 华亚智能 | C36: 223.64 | D36: 1.13 | E36: 63.909999999999997 | F36: 68.200000000000003 | G36: 78.430000000000007 | I36: 74.700000000000003 | AN36: 不宜入场（当前股价小于50日均线,应观察2w） | AO36: 44579
A37: 600773.SH | B37: 西藏城投 | C37: 217.82 | D37: 0.11 | E37: 21.600000000000001 | F37: 23.109999999999999 | G37: 25.890000000000001 | I37: 23.390000000000001 | J37: 7.0300000000000002 | K37: 37.700000000000003 | L37: 17.449999999999999 | M37: =(I37-J37)/J37 -> 2.3271692745376953 | N37: =(K37-I37)/K37 -> 0.37957559681697617 | O37: =(K37-L37)/L37 -> 1.1604584527220634 | AN37: 不宜入场（当前股价距离最高点距离上方距离过大,应观察1w） | AO37: 44582
A38: 000762.SZ | B38: 西藏矿业 | C38: 217.55 | D38: 0.25 | E38: 44.369999999999997 | F38: 47.859999999999999 | G38: 52.119999999999997 | I38: 47.289999999999999 | AN38: 不宜入场（当前股价小于150日均线,应观察3w） | AO38: 44579
A39: 603176.SH | B39: 汇通集团 | C39: 213.24 | D39: 0.21 | E39: 2.6699999999999999 | F39: 2.75 | G39: 3.2599999999999998 | I39: 9.1699999999999999 | J39: 2.04 | K39: 14.640000000000001 | L39: 2.04 | M39: =(I39-J39)/J39 -> 3.4950980392156863 | N39: =(K39-I39)/K39 -> 0.37363387978142082 | O39: =(K39-L39)/L39 -> 6.1764705882352944 | AA39: 0w | AB39: =(K39-P39)/K39 -> 1 | AN39: 不宜入场（时间周期太短） | AO39: 44603
A40: 600714.SH | B40: 金瑞矿业 | C40: 209.02 | D40: 0.18 | E40: 10.470000000000001 | F40: 11.09 | G40: 12.75 | I40: 13.300000000000001 | J40: 4.4900000000000002 | K40: 16.780000000000001 | L40: 9.8100000000000005 | M40: =(I40-J40)/J40 -> 1.9621380846325167 | N40: =(K40-I40)/K40 -> 0.20738974970202623 | O40: =(K40-L40)/L40 -> 0.71049949031600412 | P40: 13.17 | AA40: 1w | AB40: =(K40-P40)/K40 -> 0.21513706793802151 | AN40: 不宜入场（收缩幅度不够,应观察2w） | AO40: 44585
A41: 600111.SH | B41: 北方稀土 | C41: 207.99 | D41: 0.87 | E41: 39.880000000000003 | F41: 42.609999999999999 | G41: 46.520000000000003 | I41: 42.329999999999998 | AN41: 不宜入场（当前股价小于150日均线,应观察3w） | AO41: 44579
A42: 002088.SZ | B42: 鲁阳节能 | C42: 205.57 | D42: 0.80000000000000004 | E42: 19.91 | F42: 21.030000000000001 | G42: 23.489999999999998 | I42: 21.920000000000002 | AN42: 不宜入场（当前股价小于50日均线,应观察2w） | AO42: 44579
A43: 603260.SH | B43: 合盛硅业 | C43: 204.16 | D43: 5.09 | E43: 123.26000000000001 | F43: 132.13999999999999 | G43: 136.28999999999999 | I43: 116.98999999999999 | AN43: 不宜入场（当前股价小于200日均线,应观察5w） | AO43: 44579
A44: 600481.SH | B44: 双良节能 | C44: 202.38 | D44: 0.11 | E44: 9.2400000000000002 | F44: 9.8000000000000007 | G44: 10.609999999999999 | I44: 10.75 | J44: 3.52 | K44: 14.279999999999999 | L44: 10.960000000000001 | M44: =(I44-J44)/J44 -> 2.0539772727272729 | N44: =(K44-I44)/K44 -> 0.24719887955182068 | O44: =(K44-L44)/L44 -> 0.30291970802919693 | P44: 9.3599999999999994 | AA44: 10w | AB44: =(K44-P44)/K44 -> 0.34453781512605042 | AN44: 不宜入场（收缩幅度不够,应观察2w） | AO44: 44579
A45: 003038.SZ | B45: 鑫铂股份 | C45: 197.09999999999999 | D45: 0.81 | E45: 52.850000000000001 | F45: 56.710000000000001 | G45: 69.120000000000005 | I45: 64.5 | AN45: 不宜入场（当前股价小于50日均线,应观察2w） | AO45: 44579
A46: 603822.SH | B46: 嘉澳环保 | C46: 194.86 | D46: 0.98 | E46: 38.43 | F46: 40.789999999999999 | G46: 44.789999999999999 | I46: 51.369999999999997 | J46: 15.01 | K46: 57 | L46: 41.840000000000003 | M46: =(I46-J46)/J46 -> 2.4223850766155897 | N46: =(K46-I46)/K46 -> 9.8771929824561455e-02 | O46: =(K46-L46)/L46 -> 0.36233269598470352 | P46: 39 | Q46: 51.82 | R46: 40.109999999999999 | AA46: 11w | AB46: =(K46-P46)/K46 -> 0.31578947368421051 | AC46: =(Q46-R46)/Q46 -> 0.22597452720957162 | AN46: 不宜入场（收缩幅度不够,应观察3w） | AO46: 44579
A47: 002645.SZ | B47: 华宏科技 | C47: 194.38 | D47: 0.67 | E47: 19.41 | F47: 20.460000000000001 | G47: 23.170000000000002 | I47: 23.510000000000002 | J47: 8.2200000000000006 | K47: 28.600000000000001 | L47: 19.219999999999999 | M47: =(I47-J47)/J47 -> 1.8600973236009732 | N47: =(K47-I47)/K47 -> 0.17797202797202796 | O47: =(K47-L47)/L47 -> 0.4880332986472426 | P47: 21.800000000000001 | AA47: 7w | AB47: =(K47-P47)/K47 -> 0.23776223776223779 | AC47: =(Q47-R47)/Q47 -> #DIV/0! | AN47: 不宜入场（收缩幅度不够,应持续观察1w） | AO47: 44585
A48: 603876.SH | B48: 鼎胜新材 | C48: 193.5 | D48: 0.59 | E48: 32.979999999999997 | F48: 35.530000000000001 | G48: 38.960000000000001 | I48: 36.399999999999999 | J48: 10.720000000000001 | K48: 50.789999999999999 | L48: 27.25 | M48: =(I48-J48)/J48 -> 2.3955223880597014 | N48: =(K48-I48)/K48 -> 0.28332348887576297 | O48: =(K48-L48)/L48 -> 0.86385321100917423 | AN48: 不宜入场（当前股价距离最高价差距过大，面临巨大抛压,应持续观察1w） | AO48: 44580
A49: 605399.SH | B49: 晨光新材 | C49: 192.43 | D49: 1.63 | E49: 34.399999999999999 | F49: 37.090000000000003 | G49: 43.280000000000001 | I49: 44.719999999999999 | J49: 14.58 | K49: 55.899999999999999 | L49: 37.450000000000003 | M49: =(I49-J49)/J49 -> 2.0672153635116599 | N49: =(K49-I49)/K49 -> 0.20000000000000001 | O49: =(K49-L49)/L49 -> 0.49265687583444578 | P49: 38.25 | AA49: 7w | AB49: =(K49-P49)/K49 -> 0.31574239713774593 | AN49: 不宜入场（收缩幅度不够,应观察3w） | AO49: 44580
A50: 001215.SZ | B50: 千味央厨 | C50: 192.15 | D50: 0.86 | E50: 45.079999999999998 | F50: 49.149999999999999 | G50: 59.240000000000002 | I50: 52.75 | AN50: 不宜入场（当前股价小于50日均线,应观察2w） | AO50: 44580
A51: 605499.SH | B51: 东鹏饮料 | C51: 189.71 | D51: 2.64 | E51: 163.58000000000001 | F51: 172.53999999999999 | G51: 178.58000000000001 | I51: 172.66999999999999 | AN51: 不宜入场（当前股价小于50日均线,应观察3w） | AO51: 44580
A52: 002585.SZ | B52: 双星新材 | C52: 188.28 | D52: 0.84 | E52: 22.539999999999999 | F52: 23.920000000000002 | G52: 26.489999999999998 | I52: 26.52 | J52: 8.4299999999999997 | K52: 30.370000000000001 | L52: 24.530000000000001 | M52: =(I52-J52)/J52 -> 2.1459074733096086 | N52: =(K52-I52)/K52 -> 0.12676983865656902 | O52: =(K52-L52)/L52 -> 0.23807582551977169 | P52: 23.710000000000001 | AA52: 4w | AB52: =(K52-P52)/K52 -> 0.2192953572604544 | AN52: 不宜入场（收缩幅度不够,应观察2w） | AO52: 44580
A53: 002455.SZ | B53: 百川股份 | C53: 184.88 | D53: 0.24 | E53: 13.25 | F53: 14.09 | G53: 14.539999999999999 | I53: 12.77 | AN53: 不宜入场（当前股价小于200日均线,应观察6w） | AO53: 44580
A54: 603688.SH | B54: 石英股份 | C54: 184.16 | D54: 0.5 | E54: 42.920000000000002 | F54: 47.090000000000003 | G54: 58.039999999999999 | I54: 56.719999999999999 | AN54: 不宜入场（当前股价小于50日均线,应观察2w） | AO54: 44580
A55: 600141.SH | B55: 兴发集团 | C55: 182.30000000000001 | D55: 2.22 | E55: 32.060000000000002 | F55: 34.490000000000002 | G55: 37.740000000000002 | I55: 32.969999999999999 | AN55: 不宜入场（当前股价小于150日均线,应观察5w） | AO55: 44580
A56: 603213.SH | B56: 镇洋发展 | C56: 181.78 | D56: 0.69 | E56: 13.48 | F56: 14.69 | G56: 19.879999999999999 | I56: 18.850000000000001 | AN56: 不宜入场（当前股价小于50日均线,应观察2w） | AO56: 44580
A57: 603077.SH | B57: 和邦生物 | C57: 180 | D57: 0.24 | E57: 2.9500000000000002 | F57: 3.1400000000000001 | G57: 3.5099999999999998 | I57: 3.6499999999999999 | J57: 1.28 | K57: 5.1100000000000003 | L57: 2.3799999999999999 | M57: =(I57-J57)/J57 -> 1.8515625 | N57: =(K57-I57)/K57 -> 0.28571428571428575 | O57: =(K57-L57)/L57 -> 1.1470588235294119 | P57: 3.1099999999999999 | Q57: 3.8100000000000001 | R57: 3.2599999999999998 | S57: 4 | T57: 3.5499999999999998 | AA57: 16w | AB57: =(K57-P57)/K57 -> 0.39138943248532299 | AC57: =(Q57-R57)/Q57 -> 0.1443569553805775 | AD57: =(S57-T57)/S57 -> 0.11250000000000004 | AN57: 不宜入场（当前股价距离最高点距离过大,应观察1w） | AO57: 44585
A58: 603197.SH | B58: 保隆科技 | C58: 178.98 | D58: 1.2 | E58: 39.380000000000003 | F58: 42.369999999999997 | G58: 54.409999999999997 | I58: 59.210000000000001 | J58: 22.050000000000001 | K58: 74.450000000000003 | L58: 38.299999999999997 | M58: =(I58-J58)/J58 -> 1.6852607709750564 | N58: =(K58-I58)/K58 -> 0.20470114170584286 | O58: =(K58-L58)/L58 -> 0.94386422976501327 | P58: 56.990000000000002 | AA58: 0w | AB58: =(K58-P58)/K58 -> 0.23451981195433177 | AN58: 不宜入场（收缩幅度不够,应观察1w） | AO58: 44585
A59: 603738.SH | B59: 泰晶科技 | C59: 178.16 | D59: 0.96 | E59: 45.68 | F59: 49.049999999999997 | G59: 55.909999999999997 | I59: 50.859999999999999 | AN59: 不宜入场（当前股价小于50日均线,应观察2w） | AO59: 44580
A60: 601677.SH | B60: 明泰铝业 | C60: 175.82 | D60: 2.12 | AO60: 44578
A61: 002274.SZ | B61: 华昌化工 | C61: 175.22 | D61: 1.52 | AO61: 44578
A62: 600696.SH | B62: 岩石股份 | C62: 174.63 | D62: 0.25 | E62: 30.850000000000001 | F62: 31.98 | G62: 33.640000000000001 | I62: 32.509999999999998 | AN62: 不宜入场（当前股价小于50日均线,应观察2w） | AO62: 44580
A63: 605011.SH | B63: 杭州热电 | C63: 173.41 | D63: 0.51 | E63: 19.050000000000001 | F63: 20.379999999999999 | G63: 21.989999999999998 | I63: 19.190000000000001 | AN63: 不宜入场（当前股价小于150日均线,应观察5w） | AO63: 44580
A64: 600328.SH | B64: 中盐化工 | C64: 170.92 | D64: 1.26 | AO64: 44578
A65: 605337.SH | B65: 李子园 | C65: 166.39 | D65: 0.93 | E65: 42.810000000000002 | F65: 44.039999999999999 | G65: 45.539999999999999 | I65: 42.170000000000002 | AN65: 不宜入场（当前股价小于200日均线,应观察6w） | AO65: 44580
A66: 603348.SH | B66: 文灿股份 | C66: 165.61 | D66: 0.27 | E66: 39.659999999999997 | F66: 42.670000000000002 | G66: 53.380000000000003 | I66: 61.979999999999997 | J66: 19.93 | K66: 71 | L66: 44.899999999999999 | M66: =(I66-J66)/J66 -> 2.1098845960863017 | N66: =(K66-I66)/K66 -> 0.1270422535211268 | O66: =(K66-L66)/L66 -> 0.58129175946547884 | P66: 52.899999999999999 | AA66: 1w | AB66: =(K66-P66)/K66 -> 0.25492957746478873 | AN66: 不宜入场（收缩幅度不够,应观察2w） | AO66: 44585
A67: 600055.SH | B67: 万东医疗 | C67: 165.5 | D67: 0.22 | E67: 19.870000000000001 | F67: 20.77 | G67: 23.219999999999999 | I67: 24.350000000000001 | J67: 9.0399999999999991 | K67: 29.43 | L67: 12.99 | M67: =(I67-J67)/J67 -> 1.6935840707964607 | N67: =(K67-I67)/K67 -> 0.17261297995242944 | O67: =(K67-L67)/L67 -> 1.2655889145496533 | P67: 17.079999999999998 | Q67: 26.34 | R67: 22.550000000000001 | AA67: 23w | AB67: =(K67-P67)/K67 -> 0.41963982330954813 | AC67: =(Q67-R67)/Q67 -> 0.14388762338648439 | AN67: 不宜入场（收缩幅度不够,应观察1w） | AO67: 44582
A68: 600906.SH | B68: 财达证券 | C68: 162.98 | D68: 0.18 | E68: 11.66 | F68: 12.140000000000001 | G68: 12.390000000000001 | I68: 11.83 | AN68: 不宜入场（当前股价小于150日均线,应观察5w） | AO68: 44580
A69: 600577.SH | B69: 精达股份 | C69: 162.79 | D69: 0.22 | E69: 7.0999999999999996 | F69: 7.46 | G69: 7.8099999999999996 | I69: 7.3600000000000003 | AN69: 不宜入场（当前股价小于150日均线,应观察5w） | AO69: 44580
A70: 600702.SH | B70: 舍得酒业 | C70: 160.41 | D70: 2.92 | AO70: 44578
A71: 600976.SH | B71: 健民集团 | C71: 159.61 | D71: 1.69 | AO71: 44578
A72: 002922.SZ | B72: 伊戈尔 | C72: 159.01 | D72: 0.62 | E72: 16.760000000000002 | F72: 18.129999999999999 | G72: 20.879999999999999 | I72: 17.52 | AN72: 不宜入场（当前股价小于150日均线,应观察5w） | AO72: 44580
A73: 600277.SH | B73: 亿利洁能 | C73: 155.37 | D73: 0.18 | E73: 3.9700000000000002 | F73: 4.2599999999999998 | G73: 5.1200000000000001 | I73: 5.4000000000000004 | J73: 1.8600000000000001 | K73: 6.2999999999999998 | L73: 3.7000000000000002 | M73: =(I73-J73)/J73 -> 1.9032258064516128 | N73: =(K73-I73)/K73 -> 0.14285714285714277 | O73: =(K73-L73)/L73 -> 0.70270270270270252 | P73: 4.7300000000000004 | AA73: 5w | AB73: =(K73-P73)/K73 -> 0.24920634920634913 | AN73: 不宜入场（收缩幅度不够,应观察2w） | AO73: 44585
A74: 600367.SH | B74: 红星发展 | C74: 153.71 | D74: 0.47 | E74: 14.75 | F74: 15.73 | G74: 17.699999999999999 | I74: 15.789999999999999 | AN74: 不宜入场（当前股价小于50日均线,应观察2w） | AO74: 44580
A75: 600746.SH | B75: 江苏索普 | C75: 153.17 | D75: 1.91 | AO75: 44578
A76: 000723.SZ | B76: 美锦能源 | C76: 152.08 | D76: 0.47 | E76: 11.890000000000001 | F76: 12.67 | G76: 15.15 | I76: 14.42 | AN76: 不宜入场（当前股价小于50日均线,应观察2w） | AO76: 44580
A77: 002192.SZ | B77: 融捷股份 | C77: 151.16 | D77: 0.10000000000000001 | E77: 110.34 | F77: 116.31 | G77: 120.58 | I77: 97.980000000000004 | AN77: 不宜入场（当前股价小于50日均线,应观察2w） | AO77: 44580
A78: 600188.SH | B78: 兖矿能源 | C78: 150.89 | D78: 2.38 | AO78: 44578
A79: 603279.SH | B79: 景津环保 | C79: 150.24 | D79: 1.1000000000000001 | AO79: 44578
A80: 002895.SZ | B80: 川恒股份 | C80: 150.14 | D80: 0.44 | E80: 24.879999999999999 | F80: 26.559999999999999 | G80: 27.670000000000002 | I80: 24.59 | AN80: 不宜入场（当前股价小于200日均线,应观察6w） | AO80: 44580
A81: 002484.SZ | B81: 江海股份 | C81: 149.24 | D81: 0.40000000000000002 | E81: 20.460000000000001 | F81: 21.510000000000002 | G81: 24.379999999999999 | I81: 24.260000000000002 | AN81: 不宜入场（当前股价小于50日均线,应观察2w） | AO81: 44580
A82: 603982.SH | B82: 泉峰汽车 | C82: 148.27 | D82: 0.55 | E82: 28.109999999999999 | F82: 30.670000000000002 | G82: 39.530000000000001 | I82: 33.649999999999999 | AN82: 不宜入场（当前股价小于50日均线,应观察2w） | AO82: 44580
A83: 002245.SZ | B83: 蔚蓝锂芯 | C83: 146.19 | D83: 0.49 | E83: 21.82 | F83: 23.239999999999998 | G83: 26.140000000000001 | I83: 24.5 | AN83: 不宜入场（当前股价小于50日均线,应观察2w） | AO83: 44580
A84: 600499.SH | B84: 科达制造 | C84: 144.49 | D84: 0.40000000000000002 | E84: 18.420000000000002 | F84: 19.449999999999999 | G84: 21.579999999999998 | I84: 18.609999999999999 | AN84: 不宜入场（当前股价小于150日均线,应观察5w） | AO84: 44580
A85: 600995.SH | B85: 文山电力 | C85: 144.17 | D85: 0.32 | E85: 12.44 | F85: 13.56 | G85: 17.550000000000001 | I85: 17.719999999999999 | J85: 5.9000000000000004 | K85: 22.190000000000001 | L85: 17.07 | M85: =(I85-J85)/J85 -> 2.0033898305084743 | N85: =(K85-I85)/K85 -> 0.20144209103199648 | O85: =(K85-L85)/L85 -> 0.29994141769185712 | P85: 16.579999999999998 | AA85: 3w | AB85: =(K85-P85)/K85 -> 0.25281658404686808 | AN85: 不宜入场（收缩幅度不够,应观察2w） | AO85: 44580
A86: 603518.SH | B86: 锦泓集团 | C86: 143.68 | D86: 0.52 | E86: 12.94 | F86: 13.279999999999999 | G86: 12.58 | AN86: 不宜入场（50日均线小于150日均线,应观察5w） | AO86: 44580
A87: 002655.SZ | B87: 共达电声 | C87: 143.05 | D87: 0.16 | E87: 12.08 | F87: 13.039999999999999 | G87: 16.09 | I87: 16.059999999999999 | AN87: 不宜入场（当前股价小于50日均线,应观察1w） | AO87: 44580
A88: 000819.SZ | B88: 岳阳兴长 | C88: 141.72 | D88: 0.10000000000000001 | E88: 9.1400000000000006 | F88: 9.8499999999999996 | G88: 13.24 | I88: 12.949999999999999 | J88: 5.8700000000000001 | K88: 24.530000000000001 | L88: 7.1200000000000001 | M88: =(I88-J88)/J88 -> 1.2061328790459964 | N88: =(K88-I88)/K88 -> 0.4720750101916022 | O88: =(K88-L88)/L88 -> 2.4452247191011236 | AN88: 不宜入场（当前股价距离最高点距离过大，面临巨大抛压,应观察2w） | AO88: 44581
A89: 603938.SH | B89: 三孚股份 | C89: 141.66 | D89: 1.26 | E89: 40.149999999999999 | F89: 41.68 | G89: 39.630000000000003 | AN89: 不宜入场（50日均线小于150日均线,应观察5w） | AO89: 44580
A90: 002906.SZ | B90: 华阳集团 | C90: 141.29 | D90: 0.44 | E90: 43.229999999999997 | F90: 45.990000000000002 | G90: 53.969999999999999 | I90: 59.649999999999999 | J90: 24.239999999999998 | K90: 65.620000000000005 | L90: 36.200000000000003 | M90: =(I90-J90)/J90 -> 1.4608085808580857 | N90: =(K90-I90)/K90 -> 9.0978360256019589e-02 | O90: =(K90-L90)/L90 -> 0.81270718232044192 | P90: 49.240000000000002 | Q90: 62.960000000000001 | R90: 49.200000000000003 | AA90: 6w | AB90: =(K90-P90)/K90 -> 0.24961901859189273 | AC90: =(Q90-R90)/Q90 -> 0.21855146124523503 | AN90: 不宜入场（收缩幅度不够,应观察2w） | AO90: 44580
A91: 600596.SH | B91: 新安股份 | C91: 140.55 | D91: 1.96 | E91: 24.329999999999998 | F91: 25.59 | G91: 26.170000000000002 | I91: 23.68 | AN91: 不宜入场（当前股价小于200日均线,应观察6w） | AO91: 44580
A92: 002003.SZ | B92: 伟星股份 | C92: 139.90000000000001 | D92: 0.52 | E92: 9.5899999999999999 | F92: 10.210000000000001 | G92: 12.51 | I92: 14 | J92: 6.0300000000000002 | K92: 14.789999999999999 | L92: 10.09 | M92: =(I92-J92)/J92 -> 1.3217247097844111 | N92: =(K92-I92)/K92 -> 5.3414469235970194e-02 | O92: =(K92-L92)/L92 -> 0.46580773042616447 | P92: 12.92 | AA92: 2w | AB92: =(K92-P92)/K92 -> 0.12643678160919536 | AN92: 不宜入场（收缩周期太短,应观察1w） | AO92: 44585
A93: 600256.SH | B93: 广汇能源 | C93: 139.41 | D93: 0.41 | E93: 5.5499999999999998 | F93: 5.9100000000000001 | G93: 6.5999999999999996 | I93: 6.3399999999999999 | AN93: 不宜入场（当前股价小于50日均线,应观察2w） | AO93: 44580
A94: 600039.SH | B94: 四川路桥 | C94: 138.03 | D94: 0.73 | E94: 8.9100000000000001 | F94: 9.4900000000000002 | G94: 11.16 | I94: 11.109999999999999 | AN94: 不宜入场（当前股价小于50日均线,应观察2w） | AO94: 44580
A95: 603665.SH | B95: 康隆达 | C95: 137.22 | D95: 0.23 | E95: 22.600000000000001 | F95: 24.27 | G95: 31.59 | I95: 37.090000000000003 | J95: 11 | K95: 40 | L95: 26.559999999999999 | M95: =(I95-J95)/J95 -> 2.371818181818182 | N95: =(K95-I95)/K95 -> 7.2749999999999912e-02 | O95: =(K95-L95)/L95 -> 0.50602409638554224 | P95: 35.75 | AA95: 2w | AB95: =(K95-P95)/K95 -> 0.10625 | AC95: =(Q95-R95)/Q95 -> #DIV/0! | AI95: 是 | AJ95: 是 | AK95: 是 | AL95: 否 | AN95: 不宜入场（收缩幅度不够,应观察1w） | AO95: 44599
A96: 002101.SZ | B96: 广东鸿图 | C96: 136.63 | D96: 0.36 | E96: 8.8800000000000008 | F96: 9.3300000000000001 | G96: 11.35 | I96: 14.039999999999999 | J96: 5.5499999999999998 | K96: 16.84 | L96: 8.0800000000000001 | M96: =(I96-J96)/J96 -> 1.5297297297297294 | N96: =(K96-I96)/K96 -> 0.16627078384798105 | O96: =(K96-L96)/L96 -> 1.0841584158415842 | P96: 11.93 | AA96: 2w | AB96: =(K96-P96)/K96 -> 0.29156769596199528 | AN96: 不宜入场（收缩幅度不够,应观察2w） | AO96: 44600
A97: 603908.SH | B97: 牧高笛 | C97: 136.51 | D97: 1.07 | E97: 32.960000000000001 | F97: 34.770000000000003 | G97: 40.229999999999997 | I97: 43.710000000000001 | J97: 18.239999999999998 | K97: 49.5 | L97: 30.699999999999999 | M97: =(I97-J97)/J97 -> 1.3963815789473686 | N97: =(K97-I97)/K97 -> 0.11696969696969695 | O97: =(K97-L97)/L97 -> 0.6123778501628665 | P97: 42.560000000000002 | AA97: 1w | AB97: =(K97-P97)/K97 -> 0.14020202020202016 | AN97: 不宜入场（收缩幅度不够,应观察1w） | AO97: 44585
A98: 600348.SH | B98: 华阳股份 | C98: 136.22 | D98: 0.95 | E98: 9.8499999999999996 | F98: 10.470000000000001 | G98: 11.56 | I98: 11.199999999999999 | J98: 4.2300000000000004 | K98: 16.300000000000001 | L98: 8.4800000000000004 | M98: =(I98-J98)/J98 -> 1.6477541371158388 | N98: =(K98-I98)/K98 -> 0.31288343558282217 | O98: =(K98-L98)/L98 -> 0.92216981132075471 | AN98: 不宜入场（当前股价距离最高点差距太大，面临巨大抛压,应观察1w） | AO98: 44582
A99: 603596.SH | B99: 伯特利 | C99: 136.15 | D99: 0.90000000000000002 | E99: 51.840000000000003 | F99: 55.909999999999997 | G99: 68.560000000000002 | I99: 84.060000000000002 | J99: 26.48 | K99: 89.629999999999995 | L99: 63.689999999999998 | M99: =(I99-J99)/J99 -> 2.1744712990936557 | N99: =(K99-I99)/K99 -> 6.2144371304250733e-02 | O99: =(K99-L99)/L99 -> 0.40728528811430365 | P99: 72.859999999999999 | AA99: 1w | AB99: =(K99-P99)/K99 -> 0.18710253263416263 | AN99: 不宜入场（收缩幅度不够,应观察1w） | AO99: 44585
A100: 000825.SZ | B100: 太钢不锈 | C100: 136.13 | D100: 1.19 | AO100: 44578
A101: 000831.SZ | B101: 五矿稀土 | C101: 135.92 | D101: 0.20000000000000001 | E101: 34.880000000000003 | F101: 37.109999999999999 | G101: 40.009999999999998 | I101: 33.469999999999999 | AN101: 不宜入场（当前股价小于150日均线,应观察5w） | AO101: 44580
A102: 002459.SZ | B102: 晶澳科技 | C102: 135.81 | D102: 0.83 | E102: 66.849999999999994 | F102: 72.859999999999999 | G102: 87.200000000000003 | I102: 88.299999999999997 | J102: 24.309999999999999 | K102: 103 | L102: 56.799999999999997 | M102: =(I102-J102)/J102 -> 2.6322501028383383 | N102: =(K102-I102)/K102 -> 0.14271844660194177 | O102: =(K102-L102)/L102 -> 0.81338028169014098 | P102: 79.299999999999997 | AA102: 7w | AB102: =(K102-P102)/K102 -> 0.23009708737864079 | AN102: 不宜入场（收缩幅度不够,应观察2w） | AO102: 44580
A103: 002881.SZ | B103: 美格智能 | C103: 135.02 | D103: 0.44 | E103: 34.149999999999999 | F103: 36.57 | G103: 42.200000000000003 | I103: 40.200000000000003 | AN103: 不宜入场（当前股价小于50日均线,应观察2w） | AO103: 44580
A104: 000960.SZ | B104: 锡业股份 | C104: 134.96 | D104: 1.09 | AO104: 44578
A105: 601882.SH | B105: 海天精工 | C105: 134.40000000000001 | D105: 0.5 | E105: 22.199999999999999 | F105: 23.170000000000002 | G105: 24.370000000000001 | I105: 22.780000000000001 | AN105: 不宜入场（当前股价小于150日均线,应观察5w） | AO105: 44580
A106: 600916.SH | B106: 中国黄金 | C106: 133.96 | D106: 0.34 | AN106: 不宜入场（各均线均不符,应观察52w） | AO106: 44580
A107: 603997.SH | B107: 继峰股份 | C107: 133.19999999999999 | D107: 0.16 | E107: 11.65 | F107: 12.369999999999999 | G107: 15.1 | I107: 16.5 | J107: 6.7800000000000002 | K107: 19.399999999999999 | L107: 14.4 | M107: =(I107-J107)/J107 -> 1.4336283185840706 | N107: =(K107-I107)/K107 -> 0.14948453608247417 | O107: =(K107-L107)/L107 -> 0.3472222222222221 | P107: 14.66 | AA107: 1w | AB107: =(K107-P107)/K107 -> 0.24432989690721643 | AN107: 不宜入场（收缩幅度不够,应观察2w） | AO107: 44585
A108: 603192.SH | B108: 汇得科技 | C108: 132.83 | D108: 0.85 | E108: 33.640000000000001 | F108: 36.18 | G108: 46.340000000000003 | I108: 48.090000000000003 | J108: 19.829999999999998 | K108: 60.719999999999999 | L108: 26.559999999999999 | M108: =(I108-J108)/J108 -> 1.4251134644478067 | N108: =(K108-I108)/K108 -> 0.2080039525691699 | O108: =(K108-L108)/L108 -> 1.286144578313253 | P108: 43.149999999999999 | AA108: 3w | AB108: =(K108-P108)/K108 -> 0.28936100131752307 | AN108: 不宜入场（收缩幅度不够,应观察2w） | AO108: 44580
A109: 601567.SH | B109: 三星医疗 | C109: 131.83 | D109: 0.48 | E109: 13.869999999999999 | F109: 14.539999999999999 | G109: 15.460000000000001 | I109: 13.6 | J109: 5.6299999999999999 | K109: 22.289999999999999 | L109: 6.9900000000000002 | M109: =(I109-J109)/J109 -> 1.4156305506216695 | N109: =(K109-I109)/K109 -> 0.38986092418124718 | O109: =(K109-L109)/L109 -> 2.188841201716738 | AN109: 不宜入场（当前股价距离最高点差距太大，面临巨大抛压,应观察2w） | AO109: 44581
A110: 002724.SZ | B110: 海洋王 | C110: 131.63 | D110: 0.28 | E110: 14.869999999999999 | F110: 15.59 | G110: 16.469999999999999 | I110: 15.029999999999999 | AN110: 不宜入场（当前股价小于150日均线,应观察3w） | AO110: 44580
A111: 002549.SZ | B111: 凯美特气 | C111: 131.13 | D111: 0.16 | E111: 12.9 | F111: 13.640000000000001 | G111: 15.789999999999999 | I111: 15.609999999999999 | AN111: 不宜入场（当前股价小于50日均线,应观察2w） | AO111: 44580
A112: 000657.SZ | B112: 中钨高新 | C112: 130.77 | D112: 0.37 | E112: 13.09 | F112: 13.85 | G112: 15.59 | I112: 15.08 | AN112: 不宜入场（当前股价小于50日均线,应观察2w） | AO112: 44580
A113: 002140.SZ | B113: 东华科技 | C113: 130.76 | D113: 0.37 | E113: 11.33 | F113: 11.970000000000001 | G113: 13.6 | I113: 14.699999999999999 | J113: 5.9800000000000004 | K113: 16.690000000000001 | L113: 6.7699999999999996 | M113: =(I113-J113)/J113 -> 1.4581939799331101 | N113: =(K113-I113)/K113 -> 0.11923307369682455 | O113: =(K113-L113)/L113 -> 1.4652880354505173 | P113: 10.609999999999999 | Q113: 15.800000000000001 | R113: 10.880000000000001 | S113: 14.08 | T113: 10.880000000000001 | U113: 16.199999999999999 | V113: 12.970000000000001 | AA113: 40w | AB113: =(K113-P113)/K113 -> 0.36428999400838835 | AC113: =(Q113-R113)/Q113 -> 0.31139240506329113 | AD113: =(S113-T113)/S113 -> 0.22727272727272721 | AE113: =(U113-V113)/U113 -> 0.19938271604938265 | AN113: 不宜入场（当前收缩幅度不够,应观察1w） | AO113: 44585
A114: 002584.SZ | B114: 西陇科学 | C114: 130.35 | D114: 0.27 | E114: 7.2300000000000004 | F114: 7.5599999999999996 | G114: 9.1999999999999993 | I114: 11.66 | J114: 4.9500000000000002 | K114: 13.74 | L114: 6.1600000000000001 | M114: =(I114-J114)/J114 -> 1.3555555555555554 | N114: =(K114-I114)/K114 -> 0.15138282387190685 | O114: =(K114-L114)/L114 -> 1.2305194805194806 | P114: 8.4000000000000004 | AA114: 2w | AB114: =(K114-P114)/K114 -> 0.38864628820960695 | AC114: =(Q114-R114)/Q114 -> #DIV/0! | AN114: 不宜入场（当前收缩幅度不够,应观察2w） | AO114: 44585
A115: 002139.SZ | B115: 拓邦股份 | C115: 129.92 | D115: 0.48 | E115: 16.010000000000002 | F115: 16.539999999999999 | G115: 17.670000000000002 | I115: 16.02 | AN115: 不宜入场（当前股价小于150日均线,应观察5w） | AO115: 44580
A116: 605089.SH | B116: 味知香 | C116: 129.33 | D116: 1.15 | AO116: 44578
A117: 603917.SH | B117: 合力科技 | C117: 129.16 | D117: 0.34 | E117: 14.65 | F117: 15.81 | G117: 19.879999999999999 | I117: 19.5 | AN117: 不宜入场（当前股价小于50日均线,应观察2w） | AO117: 44580
A118: 600765.SH | B118: 中航重机 | C118: 128.52 | D118: 0.62 | E118: 34.719999999999999 | F118: 37.509999999999998 | G118: 45.490000000000002 | I118: 49 | J118: 15.050000000000001 | K118: 53.990000000000002 | L118: 30.41 | M118: =(I118-J118)/J118 -> 2.2558139534883721 | N118: =(K118-I118)/K118 -> 9.242452305982593e-02 | O118: =(K118-L118)/L118 -> 0.7754028280170997 | P118: 41.530000000000001 | AA118: 6w | AB118: =(K118-P118)/K118 -> 0.23078347842193001 | AN118: 不宜入场（当前收缩幅度不够,应观察2w） | AO118: 44580
A119: 000887.SZ | B119: 中鼎股份 | C119: 128.43 | D119: 0.67 | E119: 16.579999999999998 | F119: 17.68 | G119: 21.079999999999998 | I119: 24.82 | J119: 9.2599999999999998 | K119: 26.289999999999999 | L119: 18.260000000000002 | M119: =(I119-J119)/J119 -> 1.6803455723542118 | N119: =(K119-I119)/K119 -> 5.5914796500570518e-02 | O119: =(K119-L119)/L119 -> 0.43975903614457812 | P119: 21.809999999999999 | AA119: 1w | AB119: =(K119-P119)/K119 -> 0.17040699885888172 | AN119: 不宜入场（当前收缩幅度不够,应观察1w） | AO119: 44585
A120: 002850.SZ | B120: 科达利 | C120: 127.25 | D120: 1.61 | AO120: 44578
A121: 603722.SH | B121: 阿科力 | C121: 127.02 | D121: 0.78 | E121: 45.740000000000002 | F121: 47.869999999999997 | G121: 52.890000000000001 | I121: 57.359999999999999 | J121: 23.84 | K121: 60.100000000000001 | L121: 49.630000000000003 | M121: =(I121-J121)/J121 -> 1.4060402684563758 | N121: =(K121-I121)/K121 -> 4.5590682196339466e-02 | O121: =(K121-L121)/L121 -> 0.2109611122305057 | P121: 54.5 | Q121: 59.890000000000001 | R121: 55.659999999999997 | AA121: 1w | AB121: =(K121-P121)/K121 -> 9.3178036605657266e-02 | AC121: =(Q121-R121)/Q121 -> 7.0629487393554916e-02 | AI121: 否 | AJ121: 否 | AL121: 否 | AN121: 不宜入场（成交量行为和价格行为不好,应观察1w） | AO121: 44588
A122: 603466.SH | B122: 风语筑 | C122: 125.3 | D122: 0.93 | E122: 19.27 | F122: 20.300000000000001 | G122: 24.82 | I122: 31.940000000000001 | J122: 12.77 | K122: 35.030000000000001 | L122: 19.539999999999999 | M122: =(I122-J122)/J122 -> 1.501174628034456 | N122: =(K122-I122)/K122 -> 8.8210105623751062e-02 | O122: =(K122-L122)/L122 -> 0.79273285568065521 | P122: 29.149999999999999 | AA122: 1w | AB122: =(K122-P122)/K122 -> 0.16785612332286617 | AN122: 不宜入场（当前收缩幅度不够,应观察1w） | AO122: 44585
A123: 603396.SH | B123: 金辰股份 | C123: 123.86 | D123: 0.72 | E123: 101.64 | F123: 110.31999999999999 | G123: 118.56999999999999 | I123: 80.159999999999997 | AN123: 不宜入场（当前股价小于50日均线,应观察3w） | AO123: 44580
A124: 603123.SH | B124: 翠微股份 | C124: 123.84 | D124: 0.14 | E124: 7.7199999999999998 | F124: 7.9699999999999998 | G124: 9.6600000000000001 | I124: 28.510000000000002 | J124: 5.9199999999999999 | K124: 29.59 | L124: 7.1399999999999997 | M124: =(I124-J124)/J124 -> 3.815878378378379 | N124: =(K124-I124)/K124 -> 3.6498817167962092e-02 | O124: =(K124-L124)/L124 -> 3.1442577030812324 | P124: 26.5 | AA124: 0w | AB124: =(K124-P124)/K124 -> 0.10442717134166948 | AN124: 不宜入场（收缩幅度不够,应观察1w） | AO124: 44603
A125: 600295.SH | B125: 鄂尔多斯 | C125: 123.57 | D125: 2.6000000000000001 | E125: 24.52 | F125: 25.399999999999999 | G125: 25.280000000000001 | AN125: 不宜入场（50日均线小于150日均线,应观察5w） | AO125: 44580
A126: 603324.SH | B126: 盛剑环境 | C126: 123.40000000000001 | D126: 0.78 | E126: 53.399999999999999 | F126: 56.090000000000003 | G126: 58.359999999999999 | I126: 51.560000000000002 | AN126: 不宜入场（当前股价小于200日均线,应观察6w） | AO126: 44580
A127: 603300.SH | B127: 华铁应急 | C127: 122.22 | D127: 0.38 | E127: 10.789999999999999 | F127: 11.15 | G127: 12.619999999999999 | I127: 13.35 | J127: 5.79 | K127: 14.619999999999999 | L127: 9.3100000000000005 | M127: =(I127-J127)/J127 -> 1.3056994818652849 | N127: =(K127-I127)/K127 -> 8.6867305061559486e-02 | O127: =(K127-L127)/L127 -> 0.57035445757250247 | P127: 12.630000000000001 | AA127: 2w | AB127: =(K127-P127)/K127 -> 0.13611491108071125 | AN127: 不宜入场（当前收缩幅度不够,应观察1w） | AO127: 44585
A128: 000829.SZ | B128: 天音控股 | C128: 121.38 | D128: 0.11 | E128: 15.550000000000001 | F128: 16.879999999999999 | G128: 18.690000000000001 | I128: 14.77 | AN128: 不宜入场（当前股价小于200日均线,应观察6w） | AO128: 44580
A129: 002028.SZ | B129: 思源电气 | C129: 121.18 | D129: 1.16 | E129: 39.420000000000002 | F129: 41.460000000000001 | G129: 47.710000000000001 | I129: 48 | J129: 18.59 | K129: 59.979999999999997 | L129: 36.799999999999997 | M129: =(I129-J129)/J129 -> 1.5820333512641205 | N129: =(K129-I129)/K129 -> 0.19973324441480489 | O129: =(K129-L129)/L129 -> 0.62989130434782614 | P129: 43.899999999999999 | AA129: 4w | AB129: =(K129-P129)/K129 -> 0.26808936312104031 | AN129: 不宜入场（当前收缩幅度不够,应观察3w） | AO129: 44580
A130: 002748.SZ | B130: 世龙实业 | C130: 121.13 | D130: 0.39 | E130: 9.6300000000000008 | F130: 10.279999999999999 | G130: 11.76 | I130: 11.49 | J130: 4.7000000000000002 | K130: 16.350000000000001 | L130: 10.359999999999999 | M130: =(I130-J130)/J130 -> 1.4446808510638298 | N130: =(K130-I130)/K130 -> 0.29724770642201842 | O130: =(K130-L130)/L130 -> 0.57818532818532842 | AN130: 不宜入场（当前股价相对于最高点距离过大，面临巨大抛压,应观察3w） | AO130: 44580
A131: 603171.SH | B131: 税友股份 | C131: 121.06 | D131: 0.31 | E131: 31.109999999999999 | F131: 32.399999999999999 | G131: 34.200000000000003 | I131: 39.590000000000003 | J131: 16 | K131: 60.259999999999998 | L131: 16 | M131: =(I131-J131)/J131 -> 1.4743750000000002 | N131: =(K131-I131)/K131 -> 0.34301360769996675 | O131: =(K131-L131)/L131 -> 2.7662499999999999 | AN131: 不宜入场（当前股价相对于最高点距离过大，面临巨大抛压,应观察2w） | AO131: 44581
A132: 002312.SZ | B132: 川发龙蟒 | C132: 120.42 | D132: 0.56 | E132: 12.24 | F132: 12.859999999999999 | G132: 13.470000000000001 | I132: 12.210000000000001 | AN132: 不宜入场（当前股价小于200日均线,应观察6w） | AO132: 44580
A133: 603667.SH | B133: 五洲新春 | C133: 120.14 | D133: 0.40000000000000002 | E133: 13.92 | F133: 14.81 | G133: 16.460000000000001 | I133: 15.09 | AN133: 不宜入场（当前股价小于50日均线,应观察3w） | AO133: 44580
A134: 002386.SZ | B134: 天原股份 | C134: 119.92 | D134: 0.63 | E134: 11.029999999999999 | F134: 11.550000000000001 | G134: 12.1 | I134: 10.93 | AN134: 不宜入场（当前股价小于200日均线,应观察6w） | AO134: 44580
A135: 600905.SH | B135: 三峡能源 | C135: 119.92 | D135: 0.17 | E135: 6.0999999999999996 | F135: 6.4100000000000001 | G135: 7.04 | I135: 7.0300000000000002 | AN135: 不宜入场（当前股价小于50日均线,应观察1w） | AO135: 44580
A136: 000733.SZ | B136: 振华科技 | C136: 119.66 | D136: 1.86 | AO136: 44578
A137: 002900.SZ | B137: 哈三联 | C137: 119.53 | D137: 1.74 | AO137: 44578
A138: 002240.SZ | B138: 盛新锂能 | C138: 118.55 | D138: 0.69999999999999996 | E138: 47.030000000000001 | F138: 50.159999999999997 | G138: 54.030000000000001 | I138: 45.130000000000003 | AN138: 不宜入场（当前股价小于200日均线,应观察6w） | AO138: 44580
A139: 000567.SZ | B139: 海德股份 | C139: 118.48 | D139: 0.36 | E139: 14.539999999999999 | F139: 15.48 | G139: 17.84 | I139: 18.199999999999999 | J139: 7.7999999999999998 | K139: 20.98 | L139: 15.050000000000001 | M139: =(I139-J139)/J139 -> 1.3333333333333333 | N139: =(K139-I139)/K139 -> 0.13250714966634897 | O139: =(K139-L139)/L139 -> 0.39401993355481724 | P139: 16.890000000000001 | Q139: 18.57 | R139: 17.16 | S139: 19.440000000000001 | T139: 18 | AA139: 2w | AB139: =(K139-P139)/K139 -> 0.19494756911344135 | AC139: =(Q139-R139)/Q139 -> 7.5928917609046853e-02 | AD139: =(S139-T139)/S139 -> 7.4074074074074139e-02 | AN139: 不宜入场（当前收缩幅度不够,应观察2w） | AO139: 44580
A140: 002407.SZ | B140: 多氟多 | C140: 118.48 | D140: 1.01 | AO140: 44578
A141: 000663.SZ | B141: 永安林业 | C141: 118.42 | D141: 0.27 | E141: 9.0999999999999996 | F141: 9.3900000000000006 | G141: 9.2799999999999994 | AN141: 不宜入场（50日均线小于150日均线,应观察5w） | AO141: 44580
A142: 603315.SH | B142: 福鞍股份 | C142: 118.31 | D142: 0.16 | E142: 21.140000000000001 | F142: 22.52 | G142: 25.600000000000001 | I142: 23.800000000000001 | AN142: 不宜入场（当前股价小于50日均线,应观察1w） | AO142: 44580
A143: 600351.SH | B143: 亚宝药业 | C143: 115.17 | D143: 0.19 | E143: 6.8099999999999996 | F143: 7.1399999999999997 | G143: 8.3200000000000003 | I143: 8.2899999999999991 | AN143: 不宜入场（当前股价小于50日均线,应观察1w） | AO143: 44580
A144: 002206.SZ | B144: 海利得 | C144: 114.81 | D144: 0.38 | E144: 7.5800000000000001 | F144: 7.8899999999999997 | G144: 8.5 | I144: 7.8700000000000001 | AN144: 不宜入场（当前股价小于150日均线,应观察3w） | AO144: 44580
A145: 002756.SZ | B145: 永兴材料 | C145: 114.36 | D145: 1.38 | AO145: 44578
A146: 002960.SZ | B146: 青鸟消防 | C146: 113.78 | D146: 1.08 | AO146: 44578
A147: 603222.SH | B147: 济民医疗 | C147: 113.63 | D147: 0.43 | E147: 15.289999999999999 | F147: 15.48 | G147: 16.710000000000001 | I147: 18.98 | J147: 8.6099999999999994 | K147: 22.98 | L147: 8.6099999999999994 | M147: =(I147-J147)/J147 -> 1.2044134727061557 | N147: =(K147-I147)/K147 -> 0.17406440382941687 | O147: =(K147-L147)/L147 -> 1.6689895470383278 | P147: 12.65 | Q147: 22.789999999999999 | R147: 14.15 | AA147: 2w | AB147: =(K147-P147)/K147 -> 0.44952132288946911 | AC147: =(Q147-R147)/Q147 -> 0.37911364633611228 | AN147: 不宜入场（当前收缩幅度不够,应观察3w） | AO147: 44602
A148: 600366.SH | B148: 宁波韵升 | C148: 113.19 | D148: 0.38 | E148: 10.58 | F148: 11.17 | G148: 12.5 | I148: 11.800000000000001 | AN148: 不宜入场（当前股价小于50日均线,应观察1w） | AO148: 44580
A149: 603380.SH | B149: 易德龙 | C149: 112.94 | D149: 1.06 | AO149: 44578
A150: 603088.SH | B150: 宁波精达 | C150: 112.75 | D150: 0.20000000000000001 | E150: 8.6999999999999993 | F150: 9.3699999999999992 | G150: 10.99 | I150: 9.6999999999999993 | AN150: 不宜入场（当前股价小于50日均线,应观察1w） | AO150: 44580
A151: 002531.SZ | B151: 天顺风能 | C151: 112.56 | D151: 0.58 | E151: 14.970000000000001 | F151: 15.98 | G151: 18.199999999999999 | I151: 16.710000000000001 | AN151: 不宜入场（当前股价小于50日均线,应观察2w） | AO151: 44580
A152: 000519.SZ | B152: 中兵红箭 | C152: 112.25 | D152: 0.44 | E152: 19.699999999999999 | F152: 21.329999999999998 | G152: 24.609999999999999 | I152: 20.390000000000001 | AN152: 不宜入场（当前股价小于150日均线,应观察3w） | AO152: 44580
A153: 002346.SZ | B153: 柘中股份 | C153: 111.54 | D153: 0.73 | E153: 17.640000000000001 | F153: 18.43 | G153: 19.48 | I153: 19.010000000000002 | AN153: 不宜入场（当前股价小于150日均线,应观察3w） | AO153: 44580
A154: 000546.SZ | B154: 金圆股份 | C154: 111.31 | D154: 0.49 | E154: 10.289999999999999 | F154: 10.960000000000001 | G154: 13.289999999999999 | I154: 13.880000000000001 | J154: 5.9400000000000004 | K154: 16.710000000000001 | L154: 10.970000000000001 | M154: =(I154-J154)/J154 -> 1.3367003367003367 | N154: =(K154-I154)/K154 -> 0.16935966487133453 | O154: =(K154-L154)/L154 -> 0.52324521422060166 | P154: 11.67 | Q154: 15.74 | R154: 13.140000000000001 | S154: 15.539999999999999 | T154: 14.390000000000001 | AA154: 2w | AB154: =(K154-P154)/K154 -> 0.30161579892280077 | AC154: =(Q154-R154)/Q154 -> 0.16518424396442183 | AD154: =(S154-T154)/S154 -> 7.4002574002573915e-02 | AN154: 不宜入场（当前收缩幅度不够,应观察1w） | AO154: 44585
A155: 002873.SZ | B155: 新天药业 | C155: 110.93 | D155: 0.77 | E155: 14.6 | F155: 15.19 | G155: 18.420000000000002 | I155: 22.039999999999999 | J155: 9.7400000000000002 | K155: 28.170000000000002 | L155: 13.050000000000001 | M155: =(I155-J155)/J155 -> 1.2628336755646816 | N155: =(K155-I155)/K155 -> 0.21760738374156913 | O155: =(K155-L155)/L155 -> 1.1586206896551725 | P155: 20.379999999999999 | AA155: 1w | AB155: =(K155-P155)/K155 -> 0.27653532126375585 | AN155: 不宜入场（当前收缩幅度不够,应观察2w） | AO155: 44582
A156: 601969.SH | B156: 海南矿业 | C156: 110.37 | D156: 0.5 | E156: 12.5 | F156: 13.02 | G156: 12.630000000000001 | AN156: 不宜入场（50日均线小于150日均线,应观察5w） | AO156: 44581
A157: 002091.SZ | B157: 江苏国泰 | C157: 109.63 | D157: 0.48 | E157: 11.390000000000001 | F157: 11.98 | G157: 12.949999999999999 | I157: 12.01 | AN157: 不宜入场（当前股价小于50日均线,应观察2w） | AO157: 44581
A158: 601137.SH | B158: 博威合金 | C158: 108.76 | D158: 0.33 | E158: 16.609999999999999 | F158: 17.739999999999998 | G158: 21.5 | I158: 20.920000000000002 | AN158: 不宜入场（当前股价小于50日均线,应观察2w） | AO158: 44581
A159: 603633.SH | B159: 徕木股份 | C159: 108.59999999999999 | D159: 0.15 | E159: 13.09 | F159: 13.69 | G159: 15.640000000000001 | I159: 16.07 | J159: 7.96 | K159: 18.440000000000001 | L159: 11.51 | M159: =(I159-J159)/J159 -> 1.0188442211055275 | N159: =(K159-I159)/K159 -> 0.12852494577006512 | O159: =(K159-L159)/L159 -> 0.60208514335360575 | P159: 14.699999999999999 | Q159: 18.23 | R159: 16.010000000000002 | S159: 15.08 | AA159: 7w | AB159: =(K159-P159)/K159 -> 0.20281995661605215 | AC159: =(Q159-R159)/Q159 -> 0.12177729018102024 | AN159: 不宜入场（当前收缩幅度不够,应观察1w） | AO159: 44585
A160: 601101.SH | B160: 昊华能源 | C160: 108.02 | D160: 1.07 | E160: 7.4900000000000002 | F160: 7.9199999999999999 | G160: 8.2200000000000006 | I160: 7.8099999999999996 | AN160: 不宜入场（当前股价小于150日均线,应观察3w） | AO160: 44581
A161: 000811.SZ | B161: 冰轮环境 | C161: 107.7 | D161: 0.31 | E161: 11.9 | F161: 12.56 | G161: 14.359999999999999 | I161: 13.699999999999999 | AN161: 不宜入场（当前股价小于50日均线,应观察1w） | AO161: 44581
A162: 002420.SZ | B162: 毅昌科技 | C162: 107.54 | D162: 0.15 | E162: 6.4199999999999999 | F162: 6.7999999999999998 | G162: 7.9699999999999998 | I162: 7.9500000000000002 | AN162: 不宜入场（当前股价小于50日均线,应观察1w） | AO162: 44581
A163: 002036.SZ | B163: 联创电子 | C163: 107.41 | D163: 0.18 | E163: 17.739999999999998 | F163: 18.920000000000002 | G163: 21.969999999999999 | I163: 21.82 | AN163: 不宜入场（当前股价小于50日均线,应观察1w） | AO163: 44581
A164: 601699.SH | B164: 潞安环能 | C164: 106.93 | D164: 1.95 | E164: 11.48 | F164: 11.92 | G164: 12.029999999999999 | I164: 13.31 | J164: 5.0899999999999999 | K164: 19.670000000000002 | L164: 12.119999999999999 | M164: =(I164-J164)/J164 -> 1.6149312377210219 | N164: =(K164-I164)/K164 -> 0.32333502796136249 | O164: =(K164-L164)/L164 -> 0.62293729372937323 | AN164: 不宜入场（当前股价距离最高点距离太大，面临巨大抛压,应观察3w） | AO164: 44581
A165: 002886.SZ | B165: 沃特股份 | C165: 106.7 | D165: 0.22 | E165: 22.420000000000002 | F165: 23.960000000000001 | G165: 29.219999999999999 | I165: 28.300000000000001 | AN165: 不宜入场（当前股价小于50日均线,应观察1w） | AO165: 44581
A166: 600986.SH | B166: 浙文互联 | C166: 106.47 | D166: 0.16 | E166: 5.1399999999999997 | F166: 5.3799999999999999 | G166: 6.7000000000000002 | I166: 7.3499999999999996 | J166: 3.6400000000000001 | K166: 9.8300000000000001 | L166: 4.6799999999999997 | M166: =(I166-J166)/J166 -> 1.0192307692307692 | N166: =(K166-I166)/K166 -> 0.25228891149542221 | O166: =(K166-L166)/L166 -> 1.1004273504273505 | P166: 5.5999999999999996 | AA166: 0w | AB166: =(K166-P166)/K166 -> 0.4303153611393693 | AN166: 不宜入场（当前收缩幅度不够,应观察2w） | AO166: 44603
A167: 002145.SZ | B167: 中核钛白 | C167: 106.19 | D167: 0.49 | E167: 13.44 | F167: 13.66 | G167: 13.039999999999999 | AN167: 不宜入场（50日均线小于150日均线,应观察5w） | AO167: 44581
A168: 002026.SZ | B168: 山东威达 | C168: 105.8 | D168: 0.67 | E168: 15.369999999999999 | F168: 16.120000000000001 | G168: 18.25 | I168: 19.52 | J168: 7.75 | K168: 23.350000000000001 | L168: 13.92 | M168: =(I168-J168)/J168 -> 1.5187096774193547 | N168: =(K168-I168)/K168 -> 0.16402569593147759 | O168: =(K168-L168)/L168 -> 0.67744252873563227 | P168: 16.68 | Q168: 21.969999999999999 | R168: 18.899999999999999 | AA168: 6w | AB168: =(K168-P168)/K168 -> 0.28565310492505358 | AC168: =(Q168-R168)/Q168 -> 0.1397360036413291 | AN168: 不宜入场（当前收缩幅度不够,应观察1w） | AO168: 44585
A169: 002805.SZ | B169: 丰元股份 | C169: 105.71 | D169: 0.24 | E169: 29.140000000000001 | F169: 30.52 | G169: 33.5 | I169: 30.59 | AN169: 不宜入场（当前股价小于50日均线,应观察3w） | AO169: 44581
A170: 002648.SZ | B170: 卫星化学 | C170: 105.45 | D170: 2.48 | AO170: 44578
A171: 600563.SH | B171: 法拉电子 | C171: 105.08 | D171: 2.45 | AO171: 44578
A172: 600163.SH | B172: 中闽能源 | C172: 104.55 | D172: 0.23 | E172: 7.1900000000000004 | F172: 7.5700000000000003 | G172: 8.4900000000000002 | I172: 7.9199999999999999 | AN172: 不宜入场（当前股价小于50日均线,应观察2w） | AO172: 44581
A173: 002915.SZ | B173: 中欣氟材 | C173: 104.54 | D173: 0.66 | E173: 24.940000000000001 | F173: 26 | G173: 28.449999999999999 | I173: 27.34 | AN173: 不宜入场（当前股价小于50日均线,应观察2w） | AO173: 44581
A174: 605577.SH | B174: 龙版传媒 | C174: 104.03 | D174: 0.64 | E174: 11.69 | F174: 12.25 | G174: 13.9 | I174: 13.84 | AN174: 不宜入场（当前股价小于50日均线,应观察1w） | AO174: 44581
A175: 002048.SZ | B175: 宁波华翔 | C175: 103.97 | D175: 1.51 | E175: 19.129999999999999 | F175: 19.780000000000001 | G175: 21.77 | I175: 20.789999999999999 | AN175: 不宜入场（当前股价小于50日均线,应观察2w） | AO175: 44581
A176: 000862.SZ | B176: 银星能源 | C176: 102.57 | D176: 0.20000000000000001 | E176: 7.0099999999999998 | F176: 7.3200000000000003 | G176: 8.0899999999999999 | I176: 8.9100000000000001 | J176: 3.75 | K176: 10.68 | L176: 8.6199999999999992 | M176: =(I176-J176)/J176 -> 1.3760000000000001 | N176: =(K176-I176)/K176 -> 0.16573033707865165 | O176: =(K176-L176)/L176 -> 0.23897911832946644 | P176: 7.6799999999999997 | AA176: 7w | AB176: =(K176-P176)/K176 -> 0.2808988764044944 | AN176: 不宜入场（当前收缩幅度不够,应观察3w） | AO176: 44581
A177: 600389.SH | B177: 江山股份 | C177: 102.37 | D177: 1.77 | AO177: 44578
A178: 603659.SH | B178: 璞泰来 | C178: 102.31 | D178: 1.77 | AO178: 44578
A179: 603008.SH | B179: 喜临门 | C179: 102.03 | D179: 0.96 | E179: 29.399999999999999 | F179: 30.050000000000001 | G179: 33.450000000000003 | I179: 37.200000000000003 | J179: 6.1799999999999997 | K179: 40.450000000000003 | L179: 27.010000000000002 | M179: =(I179-J179)/J179 -> 5.0194174757281562 | N179: =(K179-I179)/K179 -> 8.034610630407911e-02 | O179: =(K179-L179)/L179 -> 0.49759348389485375 | P179: 33.770000000000003 | AA179: 2w | AB179: =(K179-P179)/K179 -> 0.16514215080346104 | AN179: 不宜入场(当前收缩幅度不够,应观察1w) | AO179: 44585
A180: 002009.SZ | B180: 天奇股份 | C180: 101.92 | D180: 0.40000000000000002 | E180: 16.850000000000001 | F180: 18.030000000000001 | G180: 20.969999999999999 | I180: 18.09 | AN180: 不宜入场(当前股价小于50日均线,应观察2w) | AO180: 44581
A181: 002738.SZ | B181: 中矿资源 | C181: 101.81 | D181: 0.95 | E181: 53.159999999999997 | F181: 56.590000000000003 | G181: 62.170000000000002 | I181: 55.619999999999997 | AN181: 不宜入场(当前股价小于50日均线,应观察2w) | AO181: 44581
A182: 000822.SZ | B182: 山东海化 | C182: 101.68 | D182: 0.47 | E182: 7.9699999999999998 | F182: 8.1400000000000006 | G182: 7.6100000000000003 | AN182: 不宜入场（50日均线小于150日均线,应观察5w） | AO182: 44581
A183: 003022.SZ | B183: 联泓新科 | C183: 101.09999999999999 | D183: 0.62 | E183: 38.780000000000001 | F183: 40.109999999999999 | G183: 38.219999999999999 | AN183: 不宜入场（50日均线小于200日均线,应观察5w） | AO183: 44581
A184: 002550.SZ | B184: 千红制药 | C184: 101.03 | D184: 0.15 | E184: 4.46 | F184: 4.5800000000000001 | G184: 5.1600000000000001 | I184: 7.5800000000000001 | J184: 3.6600000000000001 | K184: 8.6199999999999992 | L184: 4.3499999999999996 | M184: =(I184-J184)/J184 -> 1.0710382513661201 | N184: =(K184-I184)/K184 -> 0.12064965197215768 | O184: =(K184-L184)/L184 -> 0.98160919540229885 | P184: 5.2599999999999998 | AA184: 1w | AB184: =(K184-P184)/K184 -> 0.38979118329466356 | AN184: 不宜入场(当前收缩幅度不够,应观察1w) | AO184: 44599
A185: 601669.SH | B185: 中国电建 | C185: 100.89 | D185: 0.41 | E185: 6.3899999999999997 | F185: 6.7999999999999998 | G185: 7.9000000000000004 | I185: 9.4000000000000004 | J185: 3.48 | K185: 9.9600000000000009 | L185: 4.5599999999999996 | M185: =(I185-J185)/J185 -> 1.7011494252873562 | N185: =(K185-I185)/K185 -> 5.6224899598393621e-02 | O185: =(K185-L185)/L185 -> 1.1842105263157898 | P185: 5.9900000000000002 | Q185: 8.9800000000000004 | R185: 7.5300000000000002 | S185: 9.0600000000000005 | T185: 7.79 | U185: 9.5500000000000007 | V185: 8.3599999999999994 | AA185: 15w | AB185: =(K185-P185)/K185 -> 0.39859437751004018 | AC185: =(Q185-R185)/Q185 -> 0.16146993318485525 | AD185: =(S185-T185)/S185 -> 0.14017660044150115 | AE185: =(U185-V185)/U185 -> 0.12460732984293206 | AI185: 是 | AJ185: 否 | AK185: 是 | AL185: 是 | AM185: 是 | AN185: 不宜入场（成交量行为尚不明朗，应观察1w） | AO185: 44599
A186: 600691.SH | B186: 阳煤化工 | C186: 100.44 | D186: 0.18 | E186: 4.3799999999999999 | F186: 4.5999999999999996 | G186: 4.9299999999999997 | I186: 4.3499999999999996 | AN186: 不宜入场（当前股价小于200日均线,应观察5w） | AO186: 44581
A187: 600587.SH | B187: 新华医疗 | C187: 100 | D187: 1.08 | AO187: 44578
A188: 600085.SH | B188: 同仁堂 | C188: 99.79 | D188: 0.67 | E188: 36.200000000000003 | F188: 37.340000000000003 | G188: 42.390000000000001 | I188: 45.5 | J188: 22.98 | K188: 55.450000000000003 | L188: 32.270000000000003 | M188: =(I188-J188)/J188 -> 0.97998259355961703 | N188: =(K188-I188)/K188 -> 0.17944093778178544 | O188: =(K188-L188)/L188 -> 0.71831422373721721 | P188: 44.960000000000001 | AA188: 2w | AB188: =(K188-P188)/K188 -> 0.1891794409377818 | AN188: 不宜入场(当前收缩幅度不够,应观察1w) | AO188: 44585
A189: 002518.SZ | B189: 科士达 | C189: 99.35 | D189: 0.48 | E189: 24.100000000000001 | F189: 25.41 | G189: 26.43 | I189: 24.02 | AN189: 不宜入场（当前股价小于200日均线,应观察3w） | AO189: 44581
A190: 002879.SZ | B190: 长缆科技 | C190: 99.31 | D190: 0.63 | E190: 19.780000000000001 | F190: 20.75 | G190: 23.829999999999998 | I190: 24.84 | J190: 12.369999999999999 | K190: 28.800000000000001 | L190: 22.129999999999999 | M190: =(I190-J190)/J190 -> 1.0080840743734845 | N190: =(K190-I190)/K190 -> 0.13750000000000004 | O190: =(K190-L190)/L190 -> 0.30140081337550845 | P190: 23.75 | AA190: 1w | AB190: =(K190-P190)/K190 -> 0.17534722222222224 | AN190: 不宜入场(当前收缩幅度不够,应观察1w) | AO190: 44585
A191: 600210.SH | B191: 紫江企业 | C191: 99.26 | D191: 0.28 | E191: 7.6699999999999999 | F191: 8.0700000000000003 | G191: 8.6199999999999992 | I191: 8 | AN191: 不宜入场（当前股价小于150日均线,应观察3w） | AO191: 44581
A192: 002812.SZ | B192: 恩捷股份 | C192: 98.81 | D192: 1.97 | AO192: 44578
A193: 002932.SZ | B193: 明德生物 | C193: 98.06 | D193: 10.68 | AO193: 44578
A194: 000009.SZ | B194: 中国宝安 | C194: 97.69 | D194: 0.35 | E194: 16.350000000000001 | F194: 16.84 | G194: 15.83 | I194: 14 | AN194: 不宜入场（当前股价小于200日均线,应观察3w） | AO194: 44581
A195: 603895.SH | B195: 天永智能 | C195: 97.25 | D195: 0.16 | E195: 19.210000000000001 | F195: 19.879999999999999 | G195: 22.969999999999999 | I195: 28.890000000000001 | J195: 13.640000000000001 | K195: 32 | L195: 18.859999999999999 | M195: =(I195-J195)/J195 -> 1.1180351906158357 | N195: =(K195-I195)/K195 -> 9.7187499999999982e-02 | O195: =(K195-L195)/L195 -> 0.69671261930010608 | P195: 27.489999999999998 | AA195: 1w | AB195: =(K195-P195)/K195 -> 0.14093750000000005 | AC195: =(Q195-R195)/Q195 -> #DIV/0! | AI195: 否 | AL195: 否 | AN195: 不宜入场(成交量行为和价格行为不符合,应观察1w) | AO195: 44588
A196: 002182.SZ | B196: 云海金属 | C196: 97.06 | D196: 0.41 | E196: 17.68 | F196: 18.879999999999999 | G196: 21.969999999999999 | I196: 20.559999999999999 | AN196: 不宜入场（当前股价小于50日均线,应观察2w） | AO196: 44581
A197: 601001.SH | B197: 晋控煤业 | C197: 97.03 | D197: 1.55 | AO197: 44578
A198: 002840.SZ | B198: 华统股份 | C198: 96.92 | D198: 0.11 | E198: 11.84 | F198: 12.26 | G198: 14.9 | I198: 18.199999999999999 | J198: 8.1199999999999992 | K198: 20.149999999999999 | L198: 10.130000000000001 | M198: =(I198-J198)/J198 -> 1.2413793103448276 | N198: =(K198-I198)/K198 -> 9.6774193548387066e-02 | O198: =(K198-L198)/L198 -> 0.98914116485686054 | P198: 14.56 | AA198: 15w | AB198: =(K198-P198)/K198 -> 0.27741935483870961 | AC198: =(Q198-R198)/Q198 -> #DIV/0! | AN198: 不宜入场(当前收缩幅度不够,应观察1w) | AO198: 44586
A199: 000155.SZ | B199: 川能动力 | C199: 96.55 | D199: 0.18 | E199: 22.960000000000001 | F199: 24.199999999999999 | G199: 25.25 | I199: 20.449999999999999 | AN199: 不宜入场（当前股价小于200日均线,应观察3w） | AO199: 44581
A200: 002810.SZ | B200: 山东赫达 | C200: 96.23 | D200: 0.82 | E200: 49.210000000000001 | F200: 50.920000000000002 | G200: 55.579999999999998 | I200: 53.119999999999997 | AN200: 不宜入场（当前股价小于50日均线,应观察1w） | AO200: 44581
A201: 002249.SZ | B201: 大洋电机 | C201: 95.84 | D201: 0.16 | E201: 6.9100000000000001 | F201: 7.25 | G201: 7.9400000000000004 | I201: 7.1699999999999999 | AN201: 不宜入场（当前股价小于150日均线,应观察3w） | AO201: 44582
A202: 600956.SH | B202: 新天绿能 | C202: 95.27 | D202: 0.38 | E202: 15.76 | F202: 16.02 | G202: 16.620000000000001 | I202: 15.550000000000001 | AN202: 不宜入场（当前股价小于200日均线,应观察5w） | AO202: 44582
A203: 002180.SZ | B203: 纳思达 | C203: 95.11 | D203: 0.63 | E203: 37.700000000000003 | F203: 39.780000000000001 | G203: 46.310000000000002 | I203: 52.549999999999997 | J203: 22.960000000000001 | K203: 54.450000000000003 | L203: 38.189999999999998 | M203: =(I203-J203)/J203 -> 1.2887630662020904 | N203: =(K203-I203)/K203 -> 3.4894398530762268e-02 | O203: =(K203-L203)/L203 -> 0.42576590730557756 | P203: 49.299999999999997 | AA203: 1w | AB203: =(K203-P203)/K203 -> 9.4582185491276505e-02 | AN203: 不宜入场（时间周期太短,应观察1w） | AO203: 44588
A204: 002539.SZ | B204: 云图控股 | C204: 95.02 | D204: 0.78 | E204: 12.470000000000001 | F204: 12.92 | G204: 13.49 | I204: 13.539999999999999 | J204: 6.4000000000000004 | K204: 23.5 | L204: 11.74 | M204: =(I204-J204)/J204 -> 1.1156249999999996 | N204: =(K204-I204)/K204 -> 0.42382978723404258 | O204: =(K204-L204)/L204 -> 1.0017035775127767 | AN204: 不宜入场（当前股价距离最高点距离过大,应观察2w） | AO204: 44582
A205: 000993.SZ | B205: 闽东电力 | C205: 94.94 | D205: 0.28 | E205: 12 | F205: 12.630000000000001 | G205: 13.550000000000001 | I205: 11.369999999999999 | AN205: 不宜入场（当前股价小于200日均线,应观察5w） | AO205: 44582
A206: 603196.SH | B206: 日播时尚 | C206: 94.84 | D206: 0.25 | E206: 7.7599999999999998 | F206: 7.8700000000000001 | G206: 8.3699999999999992 | I206: 9.1300000000000008 | J206: 4.4400000000000004 | K206: 12.199999999999999 | L206: 6.5599999999999996 | M206: =(I206-J206)/J206 -> 1.0563063063063063 | N206: =(K206-I206)/K206 -> 0.25163934426229495 | O206: =(K206-L206)/L206 -> 0.8597560975609756 | AN206: 不宜入场(当前收缩幅度不够,应观察1w) | AO206: 44585
A207: 000906.SZ | B207: 浙商中拓 | C207: 94.45 | D207: 0.88 | E207: 10.460000000000001 | F207: 10.76 | G207: 11.24 | I207: 11.82 | J207: 5.5999999999999996 | K207: 13.75 | L207: 8.3499999999999996 | M207: =(I207-J207)/J207 -> 1.110714285714286 | N207: =(K207-I207)/K207 -> 0.14036363636363633 | O207: =(K207-L207)/L207 -> 0.64670658682634741 | P207: 9.4299999999999997 | Q207: 11.35 | R207: 10.18 | S207: 12.220000000000001 | T207: 11.06 | U207: 12.470000000000001 | V207: 11.68 | W207: 12.43 | X207: 11.710000000000001 | AA207: 25w | AB207: =(K207-P207)/K207 -> 0.31418181818181823 | AC207: =(Q207-R207)/Q207 -> 0.10308370044052863 | AD207: =(S207-T207)/S207 -> 9.4926350245499183e-02 | AN207: 不宜入场(当前收缩幅度不够,应观察2w) | AO207: 44585
A208: 002002.SZ | B208: 鸿达兴业 | C208: 94.299999999999997 | D208: 0.47 | E208: 5.1600000000000001 | F208: 5.3799999999999999 | G208: 5.8200000000000003 | I208: 5.3700000000000001 | AN208: 不宜入场（当前股价小于150日均线,应观察2w） | AO208: 44582
A209: 600089.SH | B209: 特变电工 | C209: 93.95 | D209: 1.3999999999999999 | AO209: 44578
A210: 000731.SZ | B210: 四川美丰 | C210: 93.57 | D210: 0.62 | E210: 7.8899999999999997 | F210: 8.3300000000000001 | G210: 9.2300000000000004 | I210: 8.6400000000000006 | AN210: 不宜入场（当前股价小于50日均线,应观察1w） | AO210: 44582
A211: 605376.SH | B211: 博迁新材 | C211: 93.21 | D211: 0.68 | E211: 73.5 | F211: 75.920000000000002 | G211: 78.900000000000006 | I211: 74.900000000000006 | AN211: 不宜入场（当前股价小于150日均线,应观察2w） | AO211: 44582
A212: 600123.SH | B212: 兰花科创 | C212: 93.099999999999994 | D212: 1.23 | E212: 9.1099999999999994 | F212: 9.5 | G212: 9.9100000000000001 | I212: 11.09 | J212: 4.4699999999999998 | K212: 14.67 | L212: 8.9399999999999995 | M212: =(I212-J212)/J212 -> 1.4809843400447429 | N212: =(K212-I212)/K212 -> 0.24403544648943423 | O212: =(K212-L212)/L212 -> 0.64093959731543637 | P212: 8.7400000000000002 | Q212: 10.58 | R212: 9.2699999999999996 | AA212: 25w | AB212: =(K212-P212)/K212 -> 0.4042263122017723 | AC212: =(Q212-R212)/Q212 -> 0.12381852551984882 | AN212: 不宜入场(当前收缩幅度不够,应观察2w) | AO212: 44582
A213: 002433.SZ | B213: 太安堂 | C213: 92.84 | D213: 0.72 | E213: 5.5899999999999999 | F213: 5.8799999999999999 | G213: 6.6500000000000004 | I213: 6.21 | AN213: 不宜入场（当前股价小于50日均线,应观察1w） | AO213: 44582
A214: 002765.SZ | B214: 蓝黛科技 | C214: 92.79 | D214: 0.31 | E214: 7.3499999999999996 | F214: 7.6799999999999997 | G214: 8.3699999999999992 | I214: 7.8799999999999999 | AN214: 不宜入场（当前股价小于50日均线,应观察1w） | AO214: 44582
A215: 605196.SH | B215: 华通线缆 | C215: 92.74 | D215: 0.13 | E215: 10.68 | F215: 10.960000000000001 | G215: 11.42 | I215: 11.859999999999999 | J215: 6.0599999999999996 | K215: 18.469999999999999 | L215: 6.0599999999999996 | M215: =(I215-J215)/J215 -> 0.95709570957095713 | N215: =(K215-I215)/K215 -> 0.35787763941526801 | O215: =(K215-L215)/L215 -> 2.047854785478548 | AN215: 不宜入场（当前股价距离最高点距离过大，面临巨大抛压,应观察3w） | AO215: 44582
A216: 600230.SH | B216: 沧州大化 | C216: 92.55 | D216: 0.46 | E216: 14.720000000000001 | F216: 15.07 | G216: 15.210000000000001 | I216: 15.359999999999999 | J216: 7.8499999999999996 | K216: 23.449999999999999 | L216: 19.219999999999999 | M216: =(I216-J216)/J216 -> 0.95668789808917198 | N216: =(K216-I216)/K216 -> 0.34498933901918977 | O216: =(K216-L216)/L216 -> 0.22008324661810619 | AN216: 不宜入场（当前股价距离最高点距离过大，面临巨大抛压,应观察3w） | AO216: 44582
A217: 603217.SH | B217: 元利科技 | C217: 92.42 | D217: 2.16 | AO217: 44578
A218: 603949.SH | B218: 雪龙集团 | C218: 92.24 | D218: 0.49 | E218: 19.469999999999999 | F218: 20.32 | G218: 23.41 | I218: 24.010000000000002 | J218: 12.57 | K218: 27.280000000000001 | L218: 18.809999999999999 | M218: =(I218-J218)/J218 -> 0.91010342084327778 | N218: =(K218-I218)/K218 -> 0.11986803519061581 | O218: =(K218-L218)/L218 -> 0.45029239766081885 | P218: 23 | AA218: 1w | AB218: =(K218-P218)/K218 -> 0.15689149560117305 | AN218: 不宜入场(当前收缩幅度不够,应观察1w) | AO218: 44585
A219: 600285.SH | B219: 羚锐制药 | C219: 92.21 | D219: 0.59 | E219: 11.51 | F219: 12.029999999999999 | G219: 13.949999999999999 | I219: 13.880000000000001 | AN219: 不宜入场（当前股价小于50日均线,应观察1w） | AO219: 44582
A220: 603855.SH | B220: 华荣股份 | C220: 92.09 | D220: 0.89 | E220: 22.059999999999999 | F220: 22.73 | G220: 24.960000000000001 | I220: 26.719999999999999 | J220: 13.18 | K220: 28.34 | L220: 24.52 | M220: =(I220-J220)/J220 -> 1.0273141122913505 | N220: =(K220-I220)/K220 -> 5.7163020465772797e-02 | O220: =(K220-L220)/L220 -> 0.15579119086460033 | P220: 25.18 | AA220: 1w | AB220: =(K220-P220)/K220 -> 0.11150317572335922 | AN220: 不宜入场(当前收缩幅度不够,应观察1w) | AO220: 44585
A221: 000681.SZ | B221: 视觉中国 | C221: 92.05 | D221: 0.22 | E221: 16.41 | F221: 17.109999999999999 | G221: 20.800000000000001 | I221: 21 | J221: 10.630000000000001 | K221: 27.600000000000001 | L221: 14.539999999999999 | M221: =(I221-J221)/J221 -> 0.9755409219190968 | N221: =(K221-I221)/K221 -> 0.23913043478260873 | O221: =(K221-L221)/L221 -> 0.89821182943603872 | P221: 20.780000000000001 | AA221: 2w | AB221: =(K221-P221)/K221 -> 0.24710144927536232 | AN221: 不宜入场(当前收缩幅度不够,应观察2w) | AO221: 44582
A222: 000875.SZ | B222: 吉电股份 | C222: 91.59 | D222: 0.26 | E222: 6.71 | F222: 7.0499999999999998 | G222: 8.1300000000000008 | I222: 8.2899999999999991 | J222: 3.6600000000000001 | K222: 10.460000000000001 | L222: 6.2800000000000002 | M222: =(I222-J222)/J222 -> 1.2650273224043713 | N222: =(K222-I222)/K222 -> 0.20745697896749538 | O222: =(K222-L222)/L222 -> 0.66560509554140135 | P222: 7.8099999999999996 | AA222: 3w | AB222: =(K222-P222)/K222 -> 0.25334608030592742 | AN222: 不宜入场(当前收缩幅度不够,应观察2w) | AO222: 44582
A223: 605305.SH | B223: 中际联合 | C223: 91.23 | D223: 1.85 | E223: 79.790000000000006 | F223: 84.310000000000002 | G223: 93.549999999999997 | I223: 84.689999999999998 | AN223: 不宜入场（当前股价小于50日均线,应观察1w） | AO223: 44582
A224: 600460.SH | B224: 士兰微 | C224: 91.22 | D224: 0.55 | E224: 51.439999999999998 | F224: 53.979999999999997 | G224: 55.200000000000003 | I224: 49.649999999999999 | AN224: 不宜入场（当前股价小于200日均线,应观察3w） | AO224: 44582
A225: 002191.SZ | B225: 劲嘉股份 | C225: 91.11 | D225: 0.56 | E225: 12.380000000000001 | F225: 12.94 | G225: 15.119999999999999 | I225: 17.350000000000001 | J225: 8.5800000000000001 | K225: 18.870000000000001 | L225: 13.75 | M225: =(I225-J225)/J225 -> 1.0221445221445222 | N225: =(K225-I225)/K225 -> 8.0551139374668762e-02 | O225: =(K225-L225)/L225 -> 0.37236363636363645 | P225: 16.48 | AA225: 1w | AB225: =(K225-P225)/K225 -> 0.12665606783253844 | AN225: 不宜入场(当前收缩幅度不够,应观察1w) | AO225: 44585
A226: 601199.SH | B226: 江南水务 | C226: 90.44 | D226: 0.22 | E226: 4.75 | F226: 4.9400000000000004 | G226: 5.8300000000000001 | I226: 5.8099999999999996 | AN226: 不宜入场（当前股价小于50日均线,应观察1w） | AO226: 44582
A227: 603681.SH | B227: 永冠新材 | C227: 89.37 | D227: 1.17 | AO227: 44578
A228: 002283.SZ | B228: 天润工业 | C228: 89.33 | D228: 0.39 | E228: 8.3200000000000003 | F228: 8.6600000000000001 | G228: 9.4499999999999993 | I228: 9.6899999999999995 | J228: 4.9299999999999997 | K228: 12.029999999999999 | L228: 8.2799999999999994 | M228: =(I228-J228)/J228 -> 0.96551724137931039 | N228: =(K228-I228)/K228 -> 0.19451371571072318 | O228: =(K228-L228)/L228 -> 0.45289855072463769 | P228: 8.4000000000000004 | Q228: 9.5099999999999998 | R228: 8.5600000000000005 | S228: 10.300000000000001 | T228: 9.3599999999999994 | AA228: 25w | AB228: =(K228-P228)/K228 -> 0.30174563591022435 | AC228: =(Q228-R228)/Q228 -> 9.9894847528916864e-02 | AD228: =(S228-T228)/S228 -> 9.126213592233022e-02 | AN228: 不宜入场（收缩幅度不够,应观察1w） | AO228: 44585
A229: 003036.SZ | B229: 泰坦股份 | C229: 88.94 | D229: 0.21 | E229: 13.51 | F229: 13.210000000000001 | AN229: 不宜入场（150日均线小于200日均线,应观察8w） | AO229: 44582
A230: 603198.SH | B230: 迎驾贡酒 | C230: 88.84 | D230: 1.2 | AO230: 44578
A231: 000949.SZ | B231: 新乡化纤 | C231: 88.52 | D231: 0.97 | E231: 6.0099999999999998 | F231: 6.1200000000000001 | G231: 5.9000000000000004 | AN231: 不宜入场（50日均线小于200日均线,应观察4w） | AO231: 44582
A232: 600869.SH | B232: 远东股份 | C232: 88.5 | D232: 0.19 | E232: 5.7599999999999998 | F232: 6.04 | G232: 6.6399999999999997 | I232: 5.8600000000000003 | AN232: 不宜入场（当前股价小于150日均线,应观察3w） | AO232: 44582
A233: 600335.SH | B233: 国机汽车 | C233: 88.05 | D233: 0.13 | E233: 6.6500000000000004 | F233: 6.9699999999999998 | G233: 8.1799999999999997 | I233: 8.0899999999999999 | AN233: 不宜入场（当前股价小于50日均线,应观察1w） | AO233: 44582
A234: 000935.SZ | B234: 四川双马 | C234: 87.5 | D234: 0.85 | E234: 19.969999999999999 | F234: 20.920000000000002 | G234: 23.52 | I234: 23.260000000000002 | AN234: 不宜入场（当前股价小于50日均线,应观察1w） | AO234: 44582
A235: 603693.SH | B235: 江苏新能 | C235: 87.33 | D235: 0.63 | E235: 21.32 | F235: 22.739999999999998 | G235: 25.68 | I235: 21.800000000000001 | AN235: 不宜入场（当前股价小于150日均线,应观察2w） | AO235: 44582
A236: 601702.SH | B236: 华峰铝业 | C236: 87.09 | D236: 0.36 | E236: 10.81 | F236: 11.380000000000001 | G236: 12.609999999999999 | I236: 12.26 | AN236: 不宜入场（当前股价小于50日均线,应观察1w） | AO236: 44582
A237: 601208.SH | B237: 东材科技 | C237: 87.07 | D237: 0.32 | E237: 15.029999999999999 | F237: 15.640000000000001 | G237: 16.760000000000002 | I237: 15.880000000000001 | AN237: 不宜入场（当前股价小于50日均线,应观察1w） | AO237: 44582
A238: 605080.SH | B238: 浙江自然 | C238: 87 | D238: 2.04 | AO238: 44578
A239: 603035.SH | B239: 常熟汽饰 | C239: 86.99 | D239: 0.79 | E239: 14.65 | F239: 15.18 | G239: 17.370000000000001 | I239: 20.449999999999999 | J239: 10.119999999999999 | K239: 22.550000000000001 | L239: 13.789999999999999 | M239: =(I239-J239)/J239 -> 1.0207509881422925 | N239: =(K239-I239)/K239 -> 9.3126385809312692e-02 | O239: =(K239-L239)/L239 -> 0.63524292965917351 | P239: 19.210000000000001 | AA239: 1w | AB239: =(K239-P239)/K239 -> 0.14811529933481152 | AN239: 不宜入场(当前收缩幅度不够,应观察1w) | AO239: 44585
A240: 002270.SZ | B240: 华明装备 | C240: 85.92 | D240: 0.51 | E240: 7.6699999999999999 | F240: 8.1799999999999997 | G240: 9.4600000000000009 | I240: 8.3100000000000005 | AN240: 不宜入场（当前股价小于50日均线,应观察1w） | AO240: 44582
A241: 603063.SH | B241: 禾望电气 | C241: 85.83 | D241: 0.41 | E241: 26.300000000000001 | F241: 28.390000000000001 | G241: 34.270000000000003 | I241: 35.350000000000001 | J241: 11.35 | K241: 42.149999999999999 | L241: 26.899999999999999 | M241: =(I241-J241)/J241 -> 2.1145374449339207 | N241: =(K241-I241)/K241 -> 0.16132858837485164 | O241: =(K241-L241)/L241 -> 0.56691449814126393 | P241: 30.399999999999999 | Q241: 36.979999999999997 | R241: 33.939999999999998 | AA241: 3w | AB241: =(K241-P241)/K241 -> 0.27876631079478054 | AC241: =(Q241-R241)/Q241 -> 8.2206598161168182e-02 | AN241: 不宜入场(当前收缩幅度不够,应观察2w) | AO241: 44582
A242: 002135.SZ | B242: 东南网架 | C242: 85.81 | D242: 0.51 | E242: 9.3699999999999992 | F242: 9.7300000000000004 | G242: 10.73 | I242: 10.359999999999999 | AN242: 不宜入场（当前股价小于50日均线,应观察1w） | AO242: 44582
A243: 603351.SH | B243: 威尔药业 | C243: 85.78 | D243: 0.64 | E243: 26.66 | F243: 27.870000000000001 | G243: 32.899999999999999 | I243: 30.899999999999999 | AN243: 不宜入场（当前股价小于50日均线,应观察1w） | AO243: 44582
A244: 603115.SH | B244: 海星股份 | C244: 85.700000000000003 | D244: 0.76 | E244: 21.309999999999999 | F244: 22.469999999999999 | G244: 25.23 | I244: 23.149999999999999 | AN244: 不宜入场（当前股价小于50日均线,应观察1w） | AO244: 44582
A245: 605167.SH | B245: 利柏特 | C245: 85.68 | D245: 0.19 | E245: 8.8200000000000003 | F245: 9.0999999999999996 | G245: 9.8499999999999996 | I245: 9.75 | AN245: 不宜入场（当前股价小于50日均线,应观察1w） | AO245: 44582
A246: 000810.SZ | B246: 创维数字 | C246: 85.63 | D246: 0.25 | E246: 8.8699999999999992 | F246: 9.1400000000000006 | G246: 10.630000000000001 | I246: 12.75 | J246: 6.5599999999999996 | K246: 15.720000000000001 | L246: 8.2899999999999991 | M246: =(I246-J246)/J246 -> 0.94359756097560987 | N246: =(K246-I246)/K246 -> 0.1889312977099237 | O246: =(K246-L246)/L246 -> 0.89626055488540435 | P246: 12.220000000000001 | AA246: 1w | AB246: =(K246-P246)/K246 -> 0.22264631043256997 | AN246: 不宜入场(当前收缩幅度不够,应观察1w) | AO246: 44585
A247: 603358.SH | B247: 华达科技 | C247: 85.58 | D247: 0.54 | E247: 18.739999999999998 | F247: 19.210000000000001 | G247: 20.440000000000001 | I247: 20.850000000000001 | J247: 9.5899999999999999 | K247: 25.100000000000001 | L247: 17.620000000000001 | M247: =(I247-J247)/J247 -> 1.1741397288842546 | N247: =(K247-I247)/K247 -> 0.1693227091633466 | O247: =(K247-L247)/L247 -> 0.42451759364358682 | P247: 19.010000000000002 | AA247: 6w | AB247: =(K247-P247)/K247 -> 0.24262948207171312 | AN247: 不宜入场(当前收缩幅度不够,应观察2w) | AO247: 44582
A248: 002728.SZ | B248: 特一药业 | C248: 85.49 | D248: 0.51 | E248: 13.710000000000001 | F248: 14.140000000000001 | G248: 15.789999999999999 | I248: 16.129999999999999 | J248: 9.1699999999999999 | K248: 19.579999999999998 | L248: 13.73 | M248: =(I248-J248)/J248 -> 0.7589967284623772 | N248: =(K248-I248)/K248 -> 0.17620020429009192 | O248: =(K248-L248)/L248 -> 0.4260742898761834 | P248: 14.98 | AA248: 1w | AB248: =(K248-P248)/K248 -> 0.23493360572012248 | AN248: 不宜入场(当前收缩幅度不够,应观察2w) | AO248: 44586
A249: 600021.SH | B249: 上海电力 | C249: 84.69 | D249: 0.11 | E249: 9.9100000000000001 | F249: 10.43 | G249: 12.44 | I249: 12.890000000000001 | J249: 6.4199999999999999 | K249: 16.68 | L249: 9.9100000000000001 | M249: =(I249-J249)/J249 -> 1.0077881619937696 | N249: =(K249-I249)/K249 -> 0.22721822541966422 | O249: =(K249-L249)/L249 -> 0.68314833501513617 | P249: 11.5 | Q249: 15.220000000000001 | R249: 12.26 | AA249: 3w | AB249: =(K249-P249)/K249 -> 0.31055155875299761 | AC249: =(Q249-R249)/Q249 -> 0.19448094612352174 | AN249: 不宜入场(当前收缩幅度不够,应观察1w) | AO249: 44586
A250: 601666.SH | B250: 平煤股份 | C250: 84.31 | D250: 0.77 | E250: 8.0899999999999999 | F250: 8.4299999999999997 | G250: 8.9600000000000009 | I250: 10.699999999999999 | J250: 4.1200000000000001 | K250: 13.65 | L250: 7.2599999999999998 | M250: =(I250-J250)/J250 -> 1.5970873786407764 | N250: =(K250-I250)/K250 -> 0.21611721611721618 | O250: =(K250-L250)/L250 -> 0.88016528925619841 | P250: 7.2699999999999996 | Q250: 9.1899999999999995 | R250: 8.0999999999999996 | S250: 9.6799999999999997 | T250: 8.9600000000000009 | AA250: 3w | AB250: =(K250-P250)/K250 -> 0.46739926739926746 | AC250: =(Q250-R250)/Q250 -> 0.11860718171926006 | AN250: 不宜入场(当前收缩幅度不够,应观察2w) | AO250: 44582
A251: 002408.SZ | B251: 齐翔腾达 | C251: 84.200000000000003 | D251: 0.81 | E251: 9.4399999999999995 | F251: 9.8100000000000005 | G251: 10.359999999999999 | I251: 9.5099999999999998 | AN251: 不宜入场（当前股价小于150日均线,应观察1w） | AO251: 44582
A252: 600581.SH | B252: 八一钢铁 | C252: 84.15 | D252: 1.45 | AO252: 44578
A253: 600618.SH | B253: 氯碱化工 | C253: 83.85 | D253: 0.99 | E253: 11.56 | F253: 12.029999999999999 | G253: 12.68 | I253: 12.31 | AN253: 不宜入场（当前股价小于50日均线,应观察1w） | AO253: 44582
A254: 600965.SH | B254: 福成股份 | C254: 83.62 | D254: 0.18 | E254: 6.3700000000000001 | F254: 6.5199999999999996 | G254: 7.0700000000000003 | I254: 7.8499999999999996 | J254: 4.5800000000000001 | K254: 9.9000000000000004 | L254: 6.7199999999999998 | M254: =(I254-J254)/J254 -> 0.7139737991266375 | N254: =(K254-I254)/K254 -> 0.20707070707070713 | O254: =(K254-L254)/L254 -> 0.47321428571428581 | P254: 7.8499999999999996 | AA254: 1w | AB254: =(K254-P254)/K254 -> 0.20707070707070713 | AN254: 不宜入场(当前收缩幅度不够,应观察2w) | AO254: 44582
A255: 000966.SZ | B255: 长源电力 | C255: 83.599999999999994 | D255: 0.11 | E255: 8.5299999999999994 | F255: 8.3499999999999996 | AN255: 不宜入场（150日均线小于200日均线,应观察8w） | AO255: 44582
A256: 002599.SZ | B256: 盛通股份 | C256: 83.56 | D256: 0.13 | E256: 5.8300000000000001 | F256: 6.1100000000000003 | G256: 6.6500000000000004 | I256: 6.0700000000000003 | AN256: 不宜入场（当前股价小于150日均线,应观察1w） | AO256: 44582
A257: 605016.SH | B257: 百龙创园 | C257: 83.52 | D257: 0.67 | E257: 29.309999999999999 | F257: 29.960000000000001 | G257: 31.07 | I257: 27.579999999999998 | AN257: 不宜入场（当前股价小于200日均线,应观察3w） | AO257: 44582
A258: 600821.SH | B258: 金开新能 | C258: 82.38 | D258: 0.24 | E258: 7.9299999999999997 | F258: 8.4299999999999997 | G258: 9.4399999999999995 | I258: 8.4800000000000004 | AN258: 不宜入场（当前股价小于50日均线,应观察1w） | AO258: 44582
A259: 002154.SZ | B259: 报喜鸟 | C259: 82.31 | D259: 0.29999999999999999 | E259: 4.9000000000000004 | F259: 5.0300000000000002 | G259: 5.1299999999999999 | I259: 4.8399999999999999 | AN259: 不宜入场（当前股价小于200日均线,应观察3w） | AO259: 44582
A260: 600327.SH | B260: 大东方 | C260: 82.04 | D260: 0.45 | E260: 5.6500000000000004 | F260: 5.8099999999999996 | G260: 5.96 | I260: 5.79 | AN260: 不宜入场（当前股价小于50日均线,应观察1w） | AO260: 44582
A261: 600106.SH | B261: 重庆路桥 | C261: 81.92 | D261: 0.17 | E261: 3.2000000000000002 | F261: 3.3500000000000001 | G261: 4.1200000000000001 | I261: 4.6100000000000003 | J261: 2.3999999999999999 | K261: 5.1600000000000001 | L261: 2.5899999999999999 | M261: =(I261-J261)/J261 -> 0.9208333333333335 | N261: =(K261-I261)/K261 -> 0.10658914728682167 | O261: =(K261-L261)/L261 -> 0.9922779922779924 | P261: 4.2999999999999998 | Q261: 4.9500000000000002 | R261: 4.6500000000000004 | AA261: 1w | AB261: =(K261-P261)/K261 -> 0.16666666666666671 | AC261: =(Q261-R261)/Q261 -> 6.0606060606060566e-02 | AN261: 不宜入场(当前收缩幅度不够,应观察1w) | AO261: 44599
A262: 600479.SH | B262: 千金药业 | C262: 81.89 | D262: 0.45 | E262: 9.5600000000000005 | F262: 9.9199999999999999 | G262: 11.539999999999999 | I262: 11.539999999999999 | J262: 7.1500000000000004 | K262: 16 | L262: 8.3399999999999999 | M262: =(I262-J262)/J262 -> 0.61398601398601382 | N262: =(K262-I262)/K262 -> 0.27875000000000005 | O262: =(K262-L262)/L262 -> 0.91846522781774587 | P262: 11.49 | AA262: 1w | AB262: =(K262-P262)/K262 -> 0.28187499999999999 | AN262: 不宜入场(当前收缩幅度不够,应观察2w) | AO262: 44582
A263: 603090.SH | B263: 宏盛股份 | C263: 81.87 | D263: 0.16 | E263: 18.239999999999998 | F263: 19.280000000000001 | G263: 22.239999999999998 | I263: 20.5 | AN263: 不宜入场（当前股价小于50日均线,应观察1w） | AO263: 44582
A264: 603606.SH | B264: 东方电缆 | C264: 81.700000000000003 | D264: 1.47 | AO264: 44578
A265: 603825.SH | B265: 华扬联众 | C265: 81.36 | D265: 0.59 | E265: 18.699999999999999 | F265: 19.52 | G265: 23.059999999999999 | I265: 23.27 | J265: 12.42 | K265: 31.649999999999999 | L265: 16.719999999999999 | M265: =(I265-J265)/J265 -> 0.87359098228663445 | N265: =(K265-I265)/K265 -> 0.26477093206951025 | O265: =(K265-L265)/L265 -> 0.89294258373205748 | AN265: 不宜入场（当前股价距离最高点距离过大，面临巨大抛压,应观察1w） | AO265: 44582
A266: 002411.SZ | B266: 延安必康 | C266: 81.25 | D266: 0.40000000000000002 | E266: 10.1 | F266: 10.82 | G266: 11.48 | I266: 7.9800000000000004 | AN266: 不宜入场（当前股价小于200日均线,应观察3w） | AO266: 44582
A267: 000400.SZ | B267: 许继电气 | C267: 80.65 | D267: 0.57 | E267: 20.289999999999999 | F267: 21.420000000000002 | G267: 25.280000000000001 | I267: 26.210000000000001 | J267: 12.31 | K267: 33.100000000000001 | L267: 18.600000000000001 | M267: =(I267-J267)/J267 -> 1.1291632818846467 | N267: =(K267-I267)/K267 -> 0.20815709969788521 | O267: =(K267-L267)/L267 -> 0.77956989247311825 | P267: 23.52 | AA267: 1w | AB267: =(K267-P267)/K267 -> 0.2894259818731118 | AN267: 不宜入场(当前收缩幅度不够,应观察2w) | AO267: 44582
A268: 000928.SZ | B268: 中钢国际 | C268: 80.45 | D268: 0.41 | E268: 8.5399999999999991 | F268: 8.6199999999999992 | G268: 8.4700000000000006 | AN268: 不宜入场（50日均线小于200日均线,应观察1w） | AO268: 44582
A269: 002731.SZ | B269: 萃华珠宝 | C269: 80.44 | D269: 0.18 | E269: 7.8300000000000001 | F269: 8.2300000000000004 | G269: 9.9100000000000001 | I269: 10.6 | J269: 5.4199999999999999 | K269: 12.19 | L269: 6.1900000000000004 | M269: =(I269-J269)/J269 -> 0.95571955719557189 | N269: =(K269-I269)/K269 -> 0.13043478260869565 | O269: =(K269-L269)/L269 -> 0.96930533117932127 | P269: 8.3100000000000005 | Q269: 11.140000000000001 | R269: 9.0600000000000005 | S269: 12.16 | T269: 9.9800000000000004 | AA269: 7w | AB269: =(K269-P269)/K269 -> 0.3182936833470057 | AC269: =(Q269-R269)/Q269 -> 0.1867145421903052 | AD269: =(S269-T269)/S269 -> 0.17927631578947367 | AN269: 不宜入场(当前收缩幅度不够,应观察1w) | AO269: 44586
A270: 002538.SZ | B270: 司尔特 | C270: 80.42 | D270: 0.46 | E270: 9.0999999999999996 | F270: 9.5399999999999991 | G270: 10 | I270: 8.7100000000000009 | AN270: 不宜入场（当前股价小于200日均线,应观察3w） | AO270: 44582
A271: 002937.SZ | B271: 兴瑞科技 | C271: 80.11 | D271: 0.29999999999999999 | E271: 15.99 | F271: 16.629999999999999 | G271: 19.329999999999998 | I271: 21.719999999999999 | J271: 11.220000000000001 | K271: 23.530000000000001 | L271: 19.850000000000001 | M271: =(I271-J271)/J271 -> 0.93582887700534734 | N271: =(K271-I271)/K271 -> 7.6923076923077011e-02 | O271: =(K271-L271)/L271 -> 0.18539042821158688 | P271: 21.079999999999998 | AA271: 1w | AB271: =(K271-P271)/K271 -> 0.10412239694007662 | AN271: 不宜入场(当前收缩幅度不够,应观察1w) | AO271: 44582
A272: 600483.SH | B272: 福能股份 | C272: 79.95 | D272: 0.58 | E272: 13.65 | F272: 14.23 | G272: 15.140000000000001 | I272: 13.77 | AN272: 不宜入场（当前股价小于150日均线,应观察2w） | AO272: 44582
A273: 002136.SZ | B273: 安纳达 | C273: 79.599999999999994 | D273: 0.59999999999999998 | E273: 16.239999999999998 | F273: 16.829999999999998 | G273: 16.800000000000001 | AN273: 不宜入场（50日均线小于150日均线,应观察5w） | AO273: 44582
A274: 600215.SH | B274: 派斯林 | C274: 79.5 | D274: 0.25 | E274: 7.8099999999999996 | F274: 8.1199999999999992 | G274: 8.7899999999999991 | I274: 8.1799999999999997 | AN274: 不宜入场（当前股价小于50日均线,应观察1w） | AO274: 44582
A275: 600470.SH | B275: 六国化工 | C275: 79.45 | D275: 0.46 | E275: 6.6100000000000003 | F275: 6.8600000000000003 | G275: 7.25 | I275: 6.75 | AN275: 不宜入场（当前股价小于50日均线,应观察1w） | AO275: 44582
A276: 002540.SZ | B276: 亚太科技 | C276: 79.32 | D276: 0.22 | E276: 6.1299999999999999 | F276: 6.4100000000000001 | G276: 7.4100000000000001 | I276: 7.6299999999999999 | J276: 4.1399999999999997 | K276: 8.6699999999999999 | L276: 7.9299999999999997 | M276: =(I276-J276)/J276 -> 0.84299516908212568 | N276: =(K276-I276)/K276 -> 0.11995386389850059 | O276: =(K276-L276)/L276 -> 9.3316519546027779e-02 | P276: 7.5700000000000003 | AA276: 1w | AB276: =(K276-P276)/K276 -> 0.12687427912341404 | AN276: 不宜入场(当前收缩幅度不够,应观察1w) | AO276: 44582
A277: 600129.SH | B277: 太极集团 | C277: 78.75 | D277: 0.45 | E277: 17.09 | F277: 17.530000000000001 | G277: 19.640000000000001 | I277: 21.989999999999998 | J277: 11.9 | K277: 27.18 | L277: 15.390000000000001 | M277: =(I277-J277)/J277 -> 0.84789915966386531 | N277: =(K277-I277)/K277 -> 0.19094922737306849 | O277: =(K277-L277)/L277 -> 0.76608187134502914 | P277: 21.219999999999999 | AA277: 2w | AB277: =(K277-P277)/K277 -> 0.21927888153053721 | AN277: 不宜入场(当前收缩幅度不够,应观察2w) | AO277: 44582
A278: 600884.SH | B278: 杉杉股份 | C278: 78.200000000000003 | D278: 1.7 | AO278: 44578
A279: 002892.SZ | B279: 科力尔 | C279: 78.04 | D279: 0.40000000000000002 | E279: 23.98 | F279: 25.079999999999998 | G279: 27.18 | I279: 24.440000000000001 | AN279: 不宜入场（当前股价小于150日均线,应观察2w） | AO279: 44582
A280: 605006.SH | B280: 山东玻纤 | C280: 77.89 | D280: 0.90000000000000002 | E280: 13.74 | F280: 13.970000000000001 | G280: 13.949999999999999 | AN280: 不宜入场（50日均线小于150日均线,应观察5w） | AO280: 44582
A281: 000807.SZ | B281: 云铝股份 | C281: 77.58 | D281: 1.03 | E281: 12.44 | F281: 12.529999999999999 | G281: 11.970000000000001 | AN281: 不宜入场（50日均线小于150日均线,应观察5w） | AO281: 44582
A282: 002452.SZ | B282: 长高集团 | C282: 77.52 | D282: 0.35 | E282: 7.6299999999999999 | F282: 8.0399999999999991 | G282: 9.3300000000000001 | I282: 8.7799999999999994 | AN282: 不宜入场（当前股价小于50日均线,应观察1w） | AO282: 44582
A283: 603995.SH | B283: 甬金股份 | C283: 77.35 | D283: 1.87 | AO283: 44578
A284: 002108.SZ | B284: 沧州明珠 | C284: 77.07 | D284: 0.24 | E284: 7.3200000000000003 | F284: 7.6799999999999997 | G284: 8.0099999999999998 | I284: 6.8099999999999996 | AN284: 不宜入场（当前股价小于200日均线,应观察3w） | AO284: 44582
A285: 600329.SH | B285: 中新药业 | C285: 76.06 | D285: 0.86 | E285: 26.09 | F285: 26.66 | G285: 28.239999999999998 | I285: 27.59 | AN285: 不宜入场（当前股价小于50日均线,应观察1w） | AO285: 44582
A286: 603985.SH | B286: 恒润股份 | C286: 75.75 | D286: 1.27 | AO286: 44578
A287: 600392.SH | B287: 盛和资源 | C287: 75.71 | D287: 0.47 | E287: 20.16 | F287: 20.34 | G287: 19.699999999999999 | AN287: 不宜入场（50日均线小于150日均线,应观察3w） | AO287: 44582
A288: 001234.SZ | B288: 泰慕士 | C288: 75.66 | D288: 1.01 | E288: 24.899999999999999 | F288: 25.25 | G288: 27.77 | I288: 37.579999999999998 | J288: 19.84 | K288: 51.030000000000001 | L288: 19.84 | M288: =(I288-J288)/J288 -> 0.89415322580645151 | N288: =(K288-I288)/K288 -> 0.26357044875563401 | O288: =(K288-L288)/L288 -> 1.572076612903226 | P288: 37.579999999999998 | AA288: 1w | AB288: =(K288-P288)/K288 -> 0.26357044875563401 | AN288: 不宜入场(当前收缩幅度不够,应观察2w) | AO288: 44585
A289: 600641.SH | B289: 万业企业 | C289: 75.61 | D289: 0.34 | E289: 25.690000000000001 | F289: 27.48 | G289: 30.760000000000002 | I289: 26.550000000000001 | AN289: 不宜入场（当前股价小于150日均线,应观察2w） | AO289: 44582
A290: 603223.SH | B290: 恒通股份 | C290: 75.38 | D290: 0.26 | E290: 31.289999999999999 | F290: 32.200000000000003 | G290: 33.32 | I290: 31.050000000000001 | AN290: 不宜入场（当前股价小于200日均线,应观察3w） | AO290: 44582
A291: 002434.SZ | B291: 万里扬 | C291: 75.29 | D291: 0.39 | E291: 11.34 | F291: 12.029999999999999 | G291: 13.699999999999999 | I291: 12.44 | AN291: 不宜入场（当前股价小于50日均线,应观察1w） | AO291: 44582
A292: 603507.SH | B292: 振江股份 | C292: 75.25 | D292: 1.04 | AO292: 44578
A293: 603203.SH | B293: 快克股份 | C293: 74.74 | D293: 1.17 | AO293: 44578
A294: 600114.SH | B294: 东睦股份 | C294: 74.52 | D294: 0.14 | E294: 10.09 | F294: 10.56 | G294: 11.960000000000001 | I294: 11.75 | AN294: 不宜入场（当前股价小于50日均线,应观察1w） | AO294: 44582
A295: 000818.SZ | B295: 航锦科技 | C295: 74.44 | D295: 0.93 | E295: 31.289999999999999 | F295: 32.740000000000002 | G295: 35.460000000000001 | I295: 32.469999999999999 | AN295: 不宜入场（当前股价小于150日均线,应观察2w） | AO295: 44582
A296: 605339.SH | B296: 南侨食品 | C296: 74.25 | D296: 0.69999999999999996 | E296: 32.890000000000001 | F296: 33.420000000000002 | G296: 33.939999999999998 | I296: 34.060000000000002 | J296: 20.120000000000001 | K296: 76.5 | L296: 20.120000000000001 | M296: =(I296-J296)/J296 -> 0.69284294234592447 | N296: =(K296-I296)/K296 -> 0.55477124183006532 | O296: =(K296-L296)/L296 -> 2.8021868787276336 | AN296: 不宜入场（当前股价距离最高点距离过大,应观察3w） | AO296: 44582
A297: 002109.SZ | B297: 兴化股份 | C297: 74.24 | D297: 0.46 | E297: 5.6200000000000001 | F297: 5.6799999999999997 | G297: 5.7300000000000004 | I297: 5.4500000000000002 | AN297: 不宜入场（当前股价小于200日均线,应观察3w） | AO297: 44582
A298: 605166.SH | B298: 聚合顺 | C298: 73.93 | D298: 0.63 | E298: 12.27 | F298: 12.76 | G298: 14.710000000000001 | I298: 14.49 | AN298: 不宜入场（当前股价小于50日均线,应观察1w） | AO298: 44582
A299: 603893.SH | B299: 瑞芯微 | C299: 73.799999999999997 | D299: 0.99 | E299: 119.55 | F299: 124.43000000000001 | G299: 127.67 | I299: 112.09999999999999 | AN299: 不宜入场（当前股价小于200日均线,应观察3w） | AO299: 44582
A300: 603639.SH | B300: 海利尔 | C300: 73.74 | D300: 0.92 | E300: 20.629999999999999 | F300: 21.25 | G300: 23.73 | I300: 22.98 | AN300: 不宜入场（当前股价小于50日均线,应观察1w） | AO300: 44582
A301: 603663.SH | B301: 三祥新材 | C301: 73.41 | D301: 0.36 | E301: 20.390000000000001 | F301: 21.260000000000002 | G301: 23.559999999999999 | I301: 21.399999999999999 | AN301: 不宜入场（当前股价小于50日均线,应观察1w） | AO301: 44582
A302: 002837.SZ | B302: 英维克 | C302: 73.29 | D302: 0.47 | E302: 32.530000000000001 | F302: 34.93 | G302: 40.039999999999999 | I302: 36.030000000000001 | AN302: 不宜入场（当前股价小于50日均线,应观察1w） | AO302: 44582
A303: 603477.SH | B303: 巨星农牧 | C303: 73.29 | D303: 0.42 | E303: 14.19 | F303: 14.210000000000001 | G303: 15.44 | I303: 18.280000000000001 | J303: 9.5399999999999991 | K303: 19.199999999999999 | L303: 12.91 | M303: =(I303-J303)/J303 -> 0.91614255765199193 | N303: =(K303-I303)/K303 -> 4.7916666666666573e-02 | O303: =(K303-L303)/L303 -> 0.48721920991479467 | P303: 17.609999999999999 | AA303: 2w | AB303: =(K303-P303)/K303 -> 8.2812499999999997e-02 | AN303: 不宜入场(当前收缩幅度不够,应观察1w) | AO303: 44582
A304: 605186.SH | B304: 健麾信息 | C304: 72.900000000000006 | D304: 0.57 | E304: 34.5 | F304: 35.990000000000002 | G304: 38.119999999999997 | I304: 35.979999999999997 | AN304: 不宜入场（当前股价小于150日均线,应观察1w） | AO304: 44582
A305: 002533.SZ | B305: 金杯电工 | C305: 72.799999999999997 | D305: 0.36 | E305: 7.7599999999999998 | F305: 8.0999999999999996 | G305: 8.6799999999999997 | I305: 8.1099999999999994 | AN305: 不宜入场（当前股价小于50日均线,应观察1w） | AO305: 44582
A306: 603901.SH | B306: 永创智能 | C306: 72.72 | D306: 0.5 | E306: 14.720000000000001 | F306: 15.06 | G306: 15.529999999999999 | I306: 14.5 | AN306: 不宜入场（当前股价小于200日均线,应观察3w） | AO306: 44582
A307: 002049.SZ | B307: 紫光国微 | C307: 72.65 | D307: 2.3999999999999999 | AO307: 44578
A308: 002445.SZ | B308: 中南文化 | C308: 72.63 | D308: 0.15 | E308: 2.6499999999999999 | F308: 2.7400000000000002 | G308: 3 | I308: 2.7799999999999998 | AN308: 不宜入场（当前股价小于50日均线,应观察1w） | AO308: 44582
A309: 603067.SH | B309: 振华股份 | C309: 72.56 | D309: 0.5 | E309: 10.81 | F309: 11.23 | G309: 11.74 | I309: 10.82 | AN309: 不宜入场（当前股价小于150日均线,应观察2w） | AO309: 44582
A310: 605123.SH | B310: 派克新材 | C310: 72.54 | D310: 1.77 | AO310: 44578
A311: 002870.SZ | B311: 香山股份 | C311: 72.52 | D311: 0.98 | E311: 32.950000000000003 | F311: 34.469999999999999 | G311: 37.890000000000001 | I311: 33.979999999999997 | AN311: 不宜入场（当前股价小于150日均线,应观察2w） | AO311: 44582
A312: 603277.SH | B312: 银都股份 | C312: 72.43 | D312: 0.78 | E312: 18.600000000000001 | F312: 18.859999999999999 | G312: 18.890000000000001 | I312: 18.879999999999999 | AN312: 不宜入场（当前股价小于50日均线,应观察1w） | AO312: 44582
A313: 601015.SH | B313: 陕西黑猫 | C313: 72.35 | D313: 0.71 | E313: 7.3799999999999999 | F313: 7.4000000000000004 | G313: 6.96 | AN313: 不宜入场（50日均线小于200日均线,应观察3w） | AO313: 44582
A314: 601388.SH | B314: 怡球资源 | C314: 72.15 | D314: 0.29999999999999999 | E314: 4.4000000000000004 | F314: 4.5 | G314: 4.5700000000000003 | I314: 4.2599999999999998 | AN314: 不宜入场（当前股价小于200日均线,应观察3w） | AO314: 44582
A315: 603155.SH | B315: 新亚强 | C315: 72.01 | D315: 1.47 | E315: 52.740000000000002 | F315: 54.840000000000003 | G315: 57.189999999999998 | I315: 56.109999999999999 | AN315: 不宜入场（当前股价小于50日均线,应观察1w） | AO315: 44582
A316: 002658.SZ | B316: 雪迪龙 | C316: 72 | D316: 0.26 | E316: 9.6099999999999994 | F316: 9.2599999999999998 | AN316: 不宜入场（150日均线小于200日均线,应观察8w） | AO316: 44582
A317: 601918.SH | B317: 新集能源 | C317: 71.85 | D317: 0.69999999999999996 | E317: 4.6100000000000003 | F317: 4.7199999999999998 | G317: 4.71 | AN317: 不宜入场（当前股价小于50日均线,应观察1w） | AO317: 44582
A318: 600444.SH | B318: 国机通用 | C318: 71.82 | D318: 0.17 | E318: 12.119999999999999 | F318: 12.630000000000001 | G318: 14.300000000000001 | I318: 13.76 | AN318: 不宜入场（当前股价小于50日均线,应观察1w） | AO318: 44582
A319: 002885.SZ | B319: 京泉华 | C319: 71.78 | D319: 0.11 | E319: 19.239999999999998 | F319: 20.489999999999998 | G319: 24.440000000000001 | I319: 19.899999999999999 | AN319: 不宜入场（当前股价小于150日均线,应观察2w） | AO319: 44582
A320: 603278.SH | B320: 大业股份 | C320: 71.65 | D320: 0.52 | E320: 9.8100000000000005 | F320: 10.130000000000001 | G320: 11.210000000000001 | I320: 11.81 | J320: 6.9900000000000002 | K320: 13 | L320: 8.3399999999999999 | M320: =(I320-J320)/J320 -> 0.68955650929899859 | N320: =(K320-I320)/K320 -> 9.1538461538461499e-02 | O320: =(K320-L320)/L320 -> 0.55875299760191854 | P320: 10.699999999999999 | AA320: 7w | AB320: =(K320-P320)/K320 -> 0.17692307692307699 | AC320: =(Q320-R320)/Q320 -> #DIV/0! | AH320: 2T | AI320: 否 | AJ320: 否 | AL320: 否 | AN320: 不宜入场（当前收缩幅度不够,应观察2w） | AO320: 44586
A321: 600961.SH | B321: 株冶集团 | C321: 71.5 | D321: 0.18 | E321: 8.6999999999999993 | F321: 9.0299999999999994 | G321: 9.7100000000000009 | I321: 11.140000000000001 | J321: 5.46 | K321: 14.779999999999999 | L321: 6.0599999999999996 | M321: =(I321-J321)/J321 -> 1.0402930402930404 | N321: =(K321-I321)/K321 -> 0.24627875507442482 | O321: =(K321-L321)/L321 -> 1.4389438943894388 | P321: 7.8399999999999999 | Q321: 11.08 | R321: 9.0199999999999996 | S321: 10.779999999999999 | T321: 10.09 | AA321: 7w | AB321: =(K321-P321)/K321 -> 0.469553450608931 | AC321: =(Q321-R321)/Q321 -> 0.18592057761732855 | AD321: =(S321-T321)/S321 -> 6.4007421150278257e-02 | AN321: 不宜入场(当前收缩幅度不够,应观察2w) | AO321: 44582
A322: 600378.SH | B322: 昊华科技 | C322: 71.39 | D322: 0.71 | E322: 31.960000000000001 | F322: 33.659999999999997 | G322: 38.520000000000003 | I322: 36.439999999999998 | AN322: 44582 | AO322: 44582
A323: 603105.SH | B323: 芯能科技 | C323: 71.34 | D323: 0.19 | E323: 13.19 | F323: 13.98 | G323: 15.42 | I323: 13.41 | AN323: 不宜入场（当前股价小于150日均线,应观察2w） | AO323: 44582
A324: 002636.SZ | B324: 金安国纪 | C324: 71.099999999999994 | D324: 0.98 | E324: 14.279999999999999 | F324: 14.449999999999999 | G324: 14.24 | AN324: 不宜入场（50日均线小于200日均线,应观察4w） | AO324: 44582
A325: 000682.SZ | B325: 东方电子 | C325: 71.06 | D325: 0.16 | E325: 6.3799999999999999 | F325: 6.71 | G325: 7.8399999999999999 | I325: 7.9900000000000002 | J325: 4.1200000000000001 | K325: 9.7599999999999998 | L325: 6.8099999999999996 | M325: =(I325-J325)/J325 -> 0.93932038834951459 | N325: =(K325-I325)/K325 -> 0.18135245901639341 | O325: =(K325-L325)/L325 -> 0.43318649045521296 | P325: 7.4800000000000004 | Q325: 8.5600000000000005 | R325: 7.96 | AA325: 7w | AB325: =(K325-P325)/K325 -> 0.23360655737704911 | AC325: =(Q325-R325)/Q325 -> 7.0093457943925297e-02 | AN325: 不宜入场(当前收缩幅度不够,应观察2w) | AO325: 44582
A326: 600406.SH | B326: 国电南瑞 | C326: 70.53 | D326: 0.57 | E326: 34.200000000000003 | F326: 35.710000000000001 | G326: 39.609999999999999 | I326: 38.189999999999998 | AN326: 不宜入场（当前股价小于50日均线,应观察1w） | AO326: 44582
A327: 605300.SH | B327: 佳禾食品 | C327: 70.37 | D327: 0.29 | E327: 20.690000000000001 | F327: 20.920000000000002 | G327: 21.390000000000001 | I327: 21.050000000000001 | AN327: 不宜入场（当前股价小于50日均线,应观察1w） | AO327: 44582
A328: 600963.SH | B328: 岳阳林纸 | C328: 70.15 | D328: 0.20000000000000001 | E328: 7.75 | F328: 7.8499999999999996 | G328: 7.7199999999999998 | AN328: 不宜入场（50日均线小于200日均线,应观察4w） | AO328: 44582
A329: 603100.SH | B329: 川仪股份 | C329: 69.900000000000006 | D329: 1.05 | AO329: 44578
A330: 600505.SH | B330: 西昌电力 | C330: 69.85 | D330: 0.11 | E330: 8.2400000000000002 | F330: 8.5 | G330: 9.6600000000000001 | I330: 11.26 | J330: 5.0199999999999996 | K330: 12 | L330: 8.2300000000000004 | M330: =(I330-J330)/J330 -> 1.2430278884462154 | N330: =(K330-I330)/K330 -> 6.1666666666666682e-02 | O330: =(K330-L330)/L330 -> 0.45808019441069253 | P330: 10.23 | AA330: 1w | AB330: =(K330-P330)/K330 -> 0.14749999999999996 | AN330: 不宜入场（时间周期太短） | AO330: 44585
A331: 603568.SH | B331: 伟明环保 | C331: 69.67 | D331: 0.95 | E331: 28.600000000000001 | F331: 29.739999999999998 | G331: 33.049999999999997 | I331: 32.170000000000002 | AN331: 不宜入场（当前股价小于50日均线,应观察1w） | AO331: 44582
A332: 603806.SH | B332: 福斯特 | C332: 69.54 | D332: 1.44 | AO332: 44578
A333: 600876.SH | B333: 洛阳玻璃 | C333: 69.31 | D333: 0.58 | E333: 24.68 | F333: 25.960000000000001 | G333: 30.300000000000001 | I333: 27.899999999999999 | AN333: 不宜入场（当前股价小于50日均线,应观察1w） | AO333: 44582
A334: 603178.SH | B334: 圣龙股份 | C334: 69.21 | D334: 0.40000000000000002 | E334: 12.23 | F334: 12.859999999999999 | G334: 14.470000000000001 | I334: 12.859999999999999 | AN334: 不宜入场（当前股价小于150日均线,应观察2w） | AO334: 44582
A335: 000301.SZ | B335: 东方盛虹 | C335: 69.13 | D335: 0.29999999999999999 | E335: 21.859999999999999 | F335: 22.579999999999998 | G335: 21.66 | AN335: 不宜入场（50日均线小于200日均线,应观察4w） | AO335: 44582
A336: 603818.SH | B336: 曲美家居 | C336: 69.13 | D336: 0.31 | E336: 10.52 | F336: 10.81 | G336: 12.27 | I336: 12.18 | AN336: 不宜入场（当前股价小于50日均线,应观察1w） | AO336: 44582
A337: 002378.SZ | B337: 章源钨业 | C337: 68.85 | D337: 0.10000000000000001 | E337: 9.2699999999999996 | F337: 9.1899999999999995 | AN337: 不宜入场（150日均线小于200日均线,应观察8w） | AO337: 44582
A338: 600458.SH | B338: 时代新材 | C338: 68.53 | D338: 0.19 | E338: 10.619999999999999 | F338: 11.039999999999999 | G338: 12.44 | I338: 12.17 | AN338: 不宜入场（当前股价小于50日均线,应观察1w） | AO338: 44582
A339: 600888.SH | B339: 新疆众和 | C339: 68.26 | D339: 0.5 | E339: 8.0899999999999999 | F339: 8.3699999999999992 | G339: 8.6500000000000004 | I339: 7.8200000000000003 | AN339: 不宜入场（当前股价小于200日均线,应观察3w） | AO339: 44582
A340: 001219.SZ | B340: 青岛食品 | C340: 68.12 | D340: 0.82 | E340: 28.239999999999998 | F340: 29 | G340: 31.800000000000001 | I340: 30.199999999999999 | AN340: 不宜入场（当前股价小于50日均线,应观察1w） | AO340: 44582
A341: 601028.SH | B341: 玉龙股份 | C341: 68.099999999999994 | D341: 0.40000000000000002 | E341: 17.66 | F341: 17.719999999999999 | G341: 18.25 | I341: 19.059999999999999 | J341: 11.23 | K341: 20.600000000000001 | L341: 16.949999999999999 | M341: =(I341-J341)/J341 -> 0.69723953695458574 | N341: =(K341-I341)/K341 -> 7.4757281553398183e-02 | O341: =(K341-L341)/L341 -> 0.2153392330383482 | P341: 18.800000000000001 | AA341: 2w | AB341: =(K341-P341)/K341 -> 8.737864077669906e-02 | AN341: 不宜入场(当前收缩幅度不够,应观察1w) | AO341: 44582
A342: 605567.SH | B342: 春雪食品 | C342: 68.08 | D342: 0.45 | E342: 17.32 | F342: 17.460000000000001 | G342: 18.640000000000001 | I342: 18.98 | J342: 14.16 | K342: 25.77 | L342: 16 | M342: =(I342-J342)/J342 -> 0.3403954802259887 | N342: =(K342-I342)/K342 -> 0.26348467209934029 | O342: =(K342-L342)/L342 -> 0.61062499999999997 | P342: 18.620000000000001 | Q342: 25.41 | R342: 18.670000000000002 | AA342: 2w | AB342: =(K342-P342)/K342 -> 0.27745440434613888 | AC342: =(Q342-R342)/Q342 -> 0.2652499016135379 | AN342: 不宜入场(当前收缩幅度不够,应观察2w) | AO342: 44582
A343: 603766.SH | B343: 隆鑫通用 | C343: 68.01 | D343: 0.35 | E343: 4.4400000000000004 | F343: 4.6500000000000004 | G343: 5.2699999999999996 | I343: 5.0499999999999998 | AN343: 不宜入场（当前股价小于50日均线,应观察1w） | AO343: 44582
A344: 600623.SH | B344: 华谊集团 | C344: 67.82 | D344: 1.18 | AO344: 44578
A345: 600875.SH | B345: 东方电气 | C345: 67.62 | D345: 0.59999999999999998 | E345: 16.449999999999999 | F345: 17.260000000000002 | G345: 19.59 | I345: 18.32 | AN345: 不宜入场（当前股价小于50日均线,应观察1w） | AO345: 44582
A346: 000937.SZ | B346: 冀中能源 | C346: 67.58 | D346: 0.39 | E346: 5.2199999999999998 | F346: 5.4699999999999998 | G346: 5.8099999999999996 | I346: 5.9100000000000001 | J346: 2.6699999999999999 | K346: 10.6 | L346: 3.6000000000000001 | M346: =(I346-J346)/J346 -> 1.2134831460674158 | N346: =(K346-I346)/K346 -> 0.4424528301886792 | O346: =(K346-L346)/L346 -> 1.9444444444444444 | AN346: 不宜入场（当前股价距离最高点距离过大，面临巨大抛压,应观察2w） | AO346: 44582
A347: 603906.SH | B347: 龙蟠科技 | C347: 67.44 | D347: 0.40000000000000002 | E347: 39.229999999999997 | F347: 41.039999999999999 | G347: 40.689999999999998 | AN347: 不宜入场（50日均线小于150日均线,应观察3w） | AO347: 44582
A348: 603527.SH | B348: 众源新材 | C348: 67.18 | D348: 0.44 | E348: 10.16 | F348: 10.619999999999999 | G348: 11.81 | I348: 10.609999999999999 | AN348: 不宜入场（当前股价小于150日均线,应观察2w） | AO348: 44582
A349: 002010.SZ | B349: 传化智联 | C349: 67 | D349: 0.29 | E349: 8.1600000000000001 | F349: 8.3200000000000003 | G349: 8.5899999999999999 | I349: 8.1400000000000006 | AN349: 不宜入场（当前股价小于200日均线,应观察3w） | AO349: 44582
A350: 000761.SZ | B350: 本钢板材 | C350: 66.98 | D350: 0.92 | E350: 4.2300000000000004 | F350: 4.3499999999999996 | G350: 4.3899999999999997 | I350: 4.3899999999999997 | J350: 2.2799999999999998 | K350: 7.0099999999999998 | L350: 3.8799999999999999 | M350: =(I350-J350)/J350 -> 0.92543859649122806 | N350: =(K350-I350)/K350 -> 0.37375178316690444 | O350: =(K350-L350)/L350 -> 0.80670103092783507 | AN350: 不宜入场（当前股价距离最高点距离过大，面临巨大抛压,应观察2w） | AO350: 44582
A351: 002897.SZ | B351: 意华股份 | C351: 66.52 | D351: 0.63 | E351: 37.060000000000002 | F351: 39.609999999999999 | G351: 46.100000000000001 | I351: 42 | AN351: 不宜入场（当前股价小于150日均线,应观察2w） | AO351: 44582
A352: 002246.SZ | B352: 北化股份 | C352: 66.52 | D352: 0.14 | E352: 7.5999999999999996 | F352: 7.7999999999999998 | G352: 8.6999999999999993 | I352: 8.9000000000000004 | J352: 5.9199999999999999 | K352: 12.68 | L352: 6.9500000000000002 | M352: =(I352-J352)/J352 -> 0.50337837837837851 | N352: =(K352-I352)/K352 -> 0.29810725552050471 | O352: =(K352-L352)/L352 -> 0.8244604316546762 | AN352: 不宜入场（当前股价距离最高点距离过大，面临巨大抛压,应观察2w） | AO352: 44582
A353: 600571.SH | B353: 信雅达 | C353: 66.25 | D353: 0.59999999999999998 | E353: 9.0199999999999996 | F353: 9.3800000000000008 | G353: 10.779999999999999 | I353: 12.07 | J353: 6.3399999999999999 | K353: 12.880000000000001 | L353: 8.9700000000000006 | M353: =(I353-J353)/J353 -> 0.90378548895899058 | N353: =(K353-I353)/K353 -> 6.2888198757764011e-02 | O353: =(K353-L353)/L353 -> 0.4358974358974359 | P353: 10.859999999999999 | Q353: 12.81 | R353: 11.1 | AA353: 3w | AB353: =(K353-P353)/K353 -> 0.15683229813664606 | AC353: =(Q353-R353)/Q353 -> 0.13348946135831388 | AI353: 是 | AL353: 否 | AN353: 不宜入场(当前收缩幅度不够,应观察1w) | AO353: 44586
A354: 002741.SZ | B354: 光华科技 | C354: 66.21 | D354: 0.13 | E354: 19.989999999999998 | F354: 20.710000000000001 | G354: 21.52 | I354: 20.190000000000001 | AN354: 不宜入场（当前股价小于150日均线,应观察2w） | AO354: 44582
A355: 601117.SH | B355: 中国化学 | C355: 65.95 | D355: 0.55 | E355: 10.07 | F355: 10.529999999999999 | G355: 11.4 | I355: 10.890000000000001 | AN355: 不宜入场（当前股价小于50日均线,应观察1w） | AO355: 44582
A356: 003021.SZ | B356: 兆威机电 | C356: 65.74 | D356: 0.76 | E356: 66.219999999999999 | F356: 68.200000000000003 | G356: 72.099999999999994 | I356: 68.900000000000006 | AN356: 不宜入场（当前股价小于50日均线,应观察1w） | AO356: 44582
A357: 603595.SH | B357: 东尼电子 | C357: 65.48 | D357: 0.13 | E357: 30.41 | F357: 32.200000000000003 | G357: 35.93 | I357: 30.109999999999999 | AN357: 不宜入场（当前股价小于200日均线,应观察3w） | AO357: 44582
A358: 603978.SH | B358: 深圳新星 | C358: 65.200000000000003 | D358: 0.19 | E358: 24.82 | F358: 25.91 | G358: 28.190000000000001 | I358: 24.43 | AN358: 不宜入场（当前股价小于200日均线,应观察3w） | AO358: 44582
A359: 601600.SH | B359: 中国铝业 | C359: 65.07 | D359: 0.29999999999999999 | E359: 5.8399999999999999 | F359: 6.0199999999999996 | G359: 6.0800000000000001 | I359: 5.8399999999999999 | AN359: 不宜入场（当前股价小于200日均线,应观察3w） | AO359: 44582
A360: 002169.SZ | B360: 智光电气 | C360: 64.92 | D360: 0.84 | E360: 11.06 | F360: 11.4 | G360: 11.67 | I360: 10.41 | AN360: 不宜入场（当前股价小于200日均线,应观察3w） | AO360: 44582
A361: 002598.SZ | B361: 山东章鼓 | C361: 64.81 | D361: 0.31 | E361: 10.01 | F361: 10.43 | G361: 10.76 | I361: 9.4000000000000004 | AN361: 不宜入场（当前股价小于50日均线,应观察1w） | AO361: 44585
A362: 600673.SH | B362: 东阳光 | C362: 64.799999999999997 | D362: 0.11 | E362: 7.75 | F362: 8.1799999999999997 | G362: 8.8399999999999999 | I362: 7.6699999999999999 | AN362: 不宜入场（当前股价小于200日均线,应观察3w） | AO362: 44585
A363: 002988.SZ | B363: 豪美新材 | C363: 64.79 | D363: 0.45 | E363: 18.039999999999999 | F363: 18.690000000000001 | G363: 20.420000000000002 | I363: 18.600000000000001 | AN363: 不宜入场（当前股价小于150日均线,应观察3w） | AO363: 44585
A364: 601339.SH | B364: 百隆东方 | C364: 64.68 | D364: 0.54 | E364: 5.4900000000000002 | F364: 5.6100000000000003 | G364: 5.9299999999999997 | I364: 6.8499999999999996 | J364: 3.4300000000000002 | K364: 7.5800000000000001 | L364: 5.1600000000000001 | M364: =(I364-J364)/J364 -> 0.99708454810495606 | N364: =(K364-I364)/K364 -> 9.6306068601583167e-02 | O364: =(K364-L364)/L364 -> 0.4689922480620155 | P364: 6.7000000000000002 | AA364: 1w | AB364: =(K364-P364)/K364 -> 0.11609498680738785 | AN364: 不宜入场(当前收缩幅度不够,应观察1w) | AO364: 44585
A365: 002559.SZ | B365: 亚威股份 | C365: 64.39 | D365: 0.25 | E365: 7.71 | F365: 7.96 | G365: 8.3200000000000003 | I365: 7.6600000000000001 | AN365: 不宜入场（当前股价小于200日均线,应观察3w） | AO365: 44585
A366: 603612.SH | B366: 索通发展 | C366: 64.32 | D366: 1.08 | AO366: 44578
A367: 002203.SZ | B367: 海亮股份 | C367: 64.23 | D367: 0.48 | E367: 11.27 | F367: 11.56 | G367: 12.199999999999999 | I367: 12 | AN367: 不宜入场（当前股价小于50日均线,应观察1w） | AO367: 44585
A368: 603588.SH | B368: 高能环境 | C368: 64.12 | D368: 0.55 | E368: 15.81 | F368: 16.07 | G368: 16.600000000000001 | I368: 16.780000000000001 | J368: 9.4399999999999995 | K368: 20 | L368: 15.25 | M368: =(I368-J368)/J368 -> 0.77754237288135619 | N368: =(K368-I368)/K368 -> 0.16099999999999995 | O368: =(K368-L368)/L368 -> 0.31147540983606559 | P368: 14.33 | Q368: 18.030000000000001 | R368: 16.07 | AA368: 16w | AB368: =(K368-P368)/K368 -> 0.28349999999999997 | AC368: =(Q368-R368)/Q368 -> 0.10870770937326682 | AI368: 是 | AJ368: 是 | AN368: 不宜入场(当前收缩幅度不够,应观察1w) | AO368: 44586
A369: 605098.SH | B369: 行动教育 | C369: 64.04 | D369: 1.46 | AO369: 44578
A370: 601107.SH | B370: 四川成渝 | C370: 64 | D370: 0.31 | E370: 3.7000000000000002 | F370: 3.8199999999999998 | G370: 4.4100000000000001 | I370: 4.6600000000000001 | J370: 2.7000000000000002 | K370: 5.96 | L370: 3.6099999999999999 | M370: =(I370-J370)/J370 -> 0.72592592592592586 | N370: =(K370-I370)/K370 -> 0.21812080536912748 | O370: =(K370-L370)/L370 -> 0.65096952908587258 | P370: 4.5300000000000002 | AA370: 3w | AB370: =(K370-P370)/K370 -> 0.23993288590604023 | AO370: 44585
A371: 000635.SZ | B371: 英力特 | C371: 63.85 | D371: 0.55 | E371: 11.539999999999999 | F371: 11.789999999999999 | G371: 11.779999999999999 | AN371: 不宜入场（50日均线小于150日均线,应观察4w） | AO371: 44585
A372: 002763.SZ | B372: 汇洁股份 | C372: 63.76 | D372: 0.65 | E372: 9.0199999999999996 | F372: 9.2799999999999994 | G372: 9.6899999999999995 | I372: 9.25 | AN372: 不宜入场（当前股价小于150日均线,应观察2w） | AO372: 44585
A373: 605128.SH | B373: 上海沿浦 | C373: 63.73 | D373: 0.61 | E373: 35.390000000000001 | F373: 35.969999999999999 | G373: 38.359999999999999 | I373: 38.799999999999997 | J373: 24.780000000000001 | K373: 50.670000000000002 | L373: 28.789999999999999 | M373: =(I373-J373)/J373 -> 0.56577885391444693 | N373: =(K373-I373)/K373 -> 0.23426090388790219 | O373: =(K373-L373)/L373 -> 0.75998610628690533 | P373: 37.979999999999997 | Q373: 44.18 | R373: 38.350000000000001 | AA373: 4w | AB373: =(K373-P373)/K373 -> 0.25044404973357026 | AC373: =(Q373-R373)/Q373 -> 0.1319601629696695 | AN373: 不宜入场(当前收缩幅度不够,应观察1w) | AO373: 44585
A374: 605162.SH | B374: 新中港 | C374: 63.46 | D374: 0.23 | E374: 11.869999999999999 | F374: 12.279999999999999 | G374: 12.75 | I374: 11.19 | AN374: 不宜入场（当前股价小于200日均线,应观察3w） | AO374: 44585
A375: 600873.SH | B375: 梅花生物 | C375: 63.12 | D375: 0.43 | E375: 6.5499999999999998 | F375: 6.7300000000000004 | G375: 7.2800000000000002 | I375: 7.5099999999999998 | J375: 4.5 | K375: 8.1300000000000008 | L375: 6.7400000000000002 | M375: =(I375-J375)/J375 -> 0.66888888888888887 | N375: =(K375-I375)/K375 -> 7.6260762607626195e-02 | O375: =(K375-L375)/L375 -> 0.20623145400593479 | P375: 7.4500000000000002 | AA375: 1w | AB375: =(K375-P375)/K375 -> 8.3640836408364144e-02 | AN375: 不宜入场(当前收缩幅度不够,应观察1w) | AO375: 44585
A376: 002068.SZ | B376: 黑猫股份 | C376: 63.09 | D376: 0.63 | E376: 8.0500000000000007 | F376: 8.3000000000000007 | G376: 9.4499999999999993 | I376: 10.26 | J376: 5.7400000000000002 | K376: 11.960000000000001 | L376: 6.5499999999999998 | M376: =(I376-J376)/J376 -> 0.78745644599303122 | N376: =(K376-I376)/K376 -> 0.14214046822742482 | O376: =(K376-L376)/L376 -> 0.82595419847328266 | P376: 9.8900000000000006 | AA376: 1w | AB376: =(K376-P376)/K376 -> 0.1730769230769231 | AN376: 不宜入场(当前收缩幅度不够,应观察1w) | AO376: 44585
A377: 601515.SH | B377: 东风股份 | C377: 63.09 | D377: 0.44 | E377: 6.9699999999999998 | F377: 7.2000000000000002 | G377: 7.8200000000000003 | I377: 7.1500000000000004 | AN377: 不宜入场（当前股价小于150日均线,应观察2w） | AO377: 44585
A378: 002649.SZ | B378: 博彦科技 | C378: 63.05 | D378: 0.55 | E378: 11.18 | F378: 11.43 | G378: 12.390000000000001 | I378: 14.09 | J378: 7.9100000000000001 | K378: 14.9 | L378: 11.99 | M378: =(I378-J378)/J378 -> 0.78128950695322374 | N378: =(K378-I378)/K378 -> 5.4362416107382586e-02 | O378: =(K378-L378)/L378 -> 0.2427022518765638 | P378: 13.56 | AA378: 1w | AB378: =(K378-P378)/K378 -> 8.9932885906040261e-02 | AN378: 不宜入场(当前收缩幅度不够,应观察1w) | AO378: 44585
A379: 002709.SZ | B379: 天赐材料 | C379: 63 | D379: 1.66 | AO379: 44585
A380: 002923.SZ | B380: 润都股份 | C380: 62.83 | D380: 0.47 | E380: 25.25 | F380: 26.09 | G380: 26.079999999999998 | AN380: 不宜入场（50日均线小于150日均线,应观察4w） | AO380: 44585
A381: 002232.SZ | B381: 启明信息 | C381: 62.77 | D381: 0.11 | E381: 14.65 | F381: 15.57 | G381: 19.710000000000001 | I381: 18.960000000000001 | AN381: 不宜入场（当前股价小于50日均线,应观察1w） | AO381: 44585
A382: 002060.SZ | B382: 粤水电 | C382: 62.77 | D382: 0.19 | E382: 4.6900000000000004 | F382: 4.8600000000000003 | G382: 5.2800000000000002 | I382: 4.8700000000000001 | AN382: 不宜入场（当前股价小于50日均线,应观察1w） | AO382: 44585
A383: 002832.SZ | B383: 比音勒芬 | C383: 62.72 | D383: 0.85 | E383: 23.989999999999998 | F383: 24.390000000000001 | G383: 24.73 | I383: 23.550000000000001 | AN383: 不宜入场（当前股价小于200日均线,应观察3w） | AO383: 44585
A384: 603219.SH | B384: 富佳股份 | C384: 62.600000000000001 | D384: 0.55 | E384: 16.260000000000002 | F384: 16.850000000000001 | G384: 19.109999999999999 | I384: 17.140000000000001 | AN384: 不宜入场（当前股价小于50日均线,应观察1w） | AO384: 44585
A385: 603033.SH | B385: 三维股份 | C385: 62.56 | D385: 0.21 | E385: 23.190000000000001 | F385: 24.329999999999998 | G385: 25.91 | I385: 23.129999999999999 | AN385: 不宜入场（当前股价小于200日均线,应观察3w） | AO385: 44585
A386: 600854.SH | B386: 春兰股份 | C386: 62.48 | D386: 0.19 | E386: 4.5300000000000002 | F386: 4.7699999999999996 | G386: 5.71 | I386: 5.1600000000000001 | AN386: 不宜入场（当前股价小于50日均线,应观察1w） | AO386: 44585
A387: 002581.SZ | B387: 未名医药 | C387: 62.43 | D387: 0.53 | E387: 16.780000000000001 | F387: 17.559999999999999 | G387: 19.640000000000001 | I387: 18.609999999999999 | AN387: 不宜入场（当前股价小于50日均线,应观察1w） | AO387: 44585
A388: 000626.SZ | B388: 远大控股 | C388: 62.22 | D388: 0.41 | E388: 20.93 | F388: 21.449999999999999 | G388: 22.510000000000002 | I388: 22.120000000000001 | AN388: 不宜入场（当前股价小于50日均线,应观察1w） | AO388: 44585
A389: 603889.SH | B389: 新澳股份 | C389: 62.07 | D389: 0.5 | E389: 6.1900000000000004 | F389: 6.3300000000000001 | G389: 6.4900000000000002 | I389: 6.6100000000000003 | J389: 4.1699999999999999 | K389: 8.3300000000000001 | L389: 5.5599999999999996 | M389: =(I389-J389)/J389 -> 0.58513189448441261 | N389: =(K389-I389)/K389 -> 0.20648259303721486 | O389: =(K389-L389)/L389 -> 0.49820143884892099 | P389: 5.7300000000000004 | Q389: 7.5899999999999999 | R389: 6.5599999999999996 | AA389: 17w | AB389: =(K389-P389)/K389 -> 0.31212484993997597 | AC389: =(Q389-R389)/Q389 -> 0.13570487483530966 | AN389: 不宜入场(当前收缩幅度不够,应观察1w) | AO389: 44585
A390: 603028.SH | B390: 赛福天 | C390: 62.04 | D390: 0.13 | E390: 11.039999999999999 | F390: 11.49 | G390: 13.18 | I390: 12.92 | AN390: 不宜入场（当前股价小于50日均线,应观察1w） | AO390: 44585
A391: 000650.SZ | B391: 仁和药业 | C391: 61.96 | D391: 0.37 | E391: 8.6999999999999993 | F391: 8.8499999999999996 | G391: 8.9700000000000006 | I391: 8.3100000000000005 | AN391: 不宜入场（当前股价小于200日均线,应观察3w） | AO391: 44585
A392: 003020.SZ | B392: 立方制药 | C392: 61.93 | D392: 1.35 | AO392: 44578
A393: 600727.SH | B393: 鲁北化工 | C393: 61.68 | D393: 0.76 | E393: 9.9100000000000001 | F393: 10.24 | G393: 10.460000000000001 | I393: 9.6899999999999995 | AN393: 不宜入场（当前股价小于200日均线,应观察3w） | AO393: 44585
A394: 002790.SZ | B394: 瑞尔特 | C394: 61.63 | D394: 0.27 | E394: 7.1799999999999997 | F394: 7.5599999999999996 | G394: 8.7799999999999994 | I394: 8.2599999999999998 | AN394: 不宜入场（当前股价小于50日均线,应观察1w） | AO394: 44585
A395: 601890.SH | B395: 亚星锚链 | C395: 61.63 | D395: 0.10000000000000001 | E395: 7.4699999999999998 | F395: 7.8499999999999996 | G395: 9.0700000000000003 | I395: 10.07 | J395: 4.8300000000000001 | K395: 10.5 | L395: 9.1899999999999995 | M395: =(I395-J395)/J395 -> 1.0848861283643894 | N395: =(K395-I395)/K395 -> 4.0952380952380928e-02 | O395: =(K395-L395)/L395 -> 0.14254624591947776 | P395: 9.25 | AA395: 1w | AB395: =(K395-P395)/K395 -> 0.11904761904761904 | AN395: 不宜入场(当前收缩幅度不够,应观察1w) | AO395: 44585
A396: 605333.SH | B396: 沪光股份 | C396: 61.39 | D396: 0.11 | E396: 17.23 | F396: 17.940000000000001 | G396: 20.920000000000002 | I396: 23.539999999999999 | J396: 11.6 | K396: 27.670000000000002 | L396: 12.84 | M396: =(I396-J396)/J396 -> 1.0293103448275862 | N396: =(K396-I396)/K396 -> 0.1492591254065776 | O396: =(K396-L396)/L396 -> 1.1549844236760127 | P396: 18.789999999999999 | Q396: 27 | R396: 22.260000000000002 | AA396: 8w | AB396: =(K396-P396)/K396 -> 0.32092518973617645 | AC396: =(Q396-R396)/Q396 -> 0.17555555555555549 | AN396: 不宜入场(当前收缩幅度不够,应观察1w) | AO396: 44585
A397: 603168.SH | B397: 莎普爱思 | C397: 61.31 | D397: 0.11 | E397: 9.0199999999999996 | F397: 9.2599999999999998 | G397: 9.6799999999999997 | I397: 9.6799999999999997 | J397: 5.5499999999999998 | K397: 12.76 | L397: 6.2999999999999998 | M397: =(I397-J397)/J397 -> 0.7441441441441442 | N397: =(K397-I397)/K397 -> 0.2413793103448276 | O397: =(K397-L397)/L397 -> 1.0253968253968255 | P397: 8.3000000000000007 | Q397: 10.99 | R397: 8.4399999999999995 | S397: 12.17 | T397: 9.5299999999999994 | AA397: 44w | AB397: =(K397-P397)/K397 -> 0.34952978056426326 | AC397: =(Q397-R397)/Q397 -> 0.23202911737943591 | AD397: =(S397-T397)/S397 -> 0.21692686935086283 | AN397: 不宜入场(当前收缩幅度不够,应观察2w) | AO397: 44585
A398: 002876.SZ | B398: 三利谱 | C398: 61.25 | D398: 1.6000000000000001 | E398: 56.579999999999998 | F398: 56.630000000000003 | G398: 57.469999999999999 | I398: 55.899999999999999 | AN398: 不宜入场（当前股价小于200日均线,应观察3w） | AO398: 44585
A399: 603002.SH | B399: 宏昌电子 | C399: 60.91 | D399: 0.33 | E399: 7.1900000000000004 | F399: 7.29 | G399: 7.4000000000000004 | I399: 6.7999999999999998 | AN399: 不宜入场（当前股价小于200日均线,应观察3w） | AO399: 44585
A400: 600171.SH | B400: 上海贝岭 | C400: 60.83 | D400: 0.72 | E400: 26.02 | F400: 26.800000000000001 | G400: 25.899999999999999 | AN400: 不宜入场（50日均线小于200日均线,应观察4w） | AO400: 44585
A401: 603020.SH | B401: 爱普股份 | C401: 60.73 | D401: 0.5 | E401: 14.06 | F401: 14.369999999999999 | G401: 14.449999999999999 | I401: 13.66 | AN401: 不宜入场（当前股价小于200日均线,应观察3w） | AO401: 44585
A402: 600594.SH | B402: 益佰制药 | C402: 60.65 | D402: 0.38 | E402: 6.21 | F402: 6.4000000000000004 | G402: 7.1100000000000003 | I402: 6.3200000000000003 | AN402: 不宜入场（当前股价小于150日均线,应观察2w） | AO402: 44586
A403: 002442.SZ | B403: 龙星化工 | C403: 60.55 | D403: 0.29999999999999999 | E403: 6.5 | F403: 6.6100000000000003 | G403: 6.4299999999999997 | AN403: 不宜入场（50日均线小于200日均线,应观察4w） | AO403: 44586
A404: 002317.SZ | B404: 众生药业 | C404: 60.54 | D404: 0.39 | E404: 9.7899999999999991 | F404: 10.109999999999999 | G404: 11.42 | I404: 10.34 | AN404: 不宜入场（当前股价小于50日均线,应观察1w） | AO404: 44586
A405: 002986.SZ | B405: 宇新股份 | C405: 60.48 | D405: 0.84 | E405: 34.840000000000003 | F405: 36.149999999999999 | G405: 37.829999999999998 | I405: 36.270000000000003 | AN405: 不宜入场（当前股价小于50日均线,应观察1w） | AO405: 44586
A406: 600057.SH | B406: 厦门象屿 | C406: 60.34 | D406: 0.71 | E406: 7.4900000000000002 | F406: 7.7000000000000002 | G406: 8.1999999999999993 | I406: 8.0700000000000003 | AN406: 不宜入场（当前股价小于50日均线,应观察1w） | AO406: 44586
A407: 000959.SZ | B407: 首钢股份 | C407: 60.23 | D407: 0.96 | E407: 5.8899999999999997 | F407: 6.0300000000000002 | G407: 6.0599999999999996 | I407: 5.71 | AN407: 不宜入场（当前股价小于200日均线,应观察3w） | AO407: 44586
A408: 603166.SH | B408: 福达股份 | C408: 60.15 | D408: 0.26 | E408: 8.0500000000000007 | F408: 8.2899999999999991 | G408: 8.5999999999999996 | I408: 7.4299999999999997 | AN408: 不宜入场（当前股价小于200日均线,应观察3w） | AO408: 44586
A409: 002128.SZ | B409: 电投能源 | C409: 60.02 | D409: 1.5 | AO409: 44578
A410: 603733.SH | B410: 仙鹤股份 | C410: 59.96 | D410: 1.28 | AO410: 44578
A411: 600105.SH | B411: 永鼎股份 | C411: 59.81 | D411: 0.10000000000000001 | E411: 4.3600000000000003 | F411: 4.5599999999999996 | G411: 5.0999999999999996 | I411: 4.3399999999999999 | AN411: 不宜入场（当前股价小于200日均线,应观察3w） | AO411: 44586
A412: 001216.SZ | B412: 华瓷股份 | C412: 59.79 | D412: 0.5 | E412: 15.33 | F412: 15.720000000000001 | G412: 17.059999999999999 | I412: 14.91 | AN412: 不宜入场（当前股价小于200日均线,应观察3w） | AO412: 44586
A413: 001217.SZ | B413: 华尔泰 | C413: 59.76 | D413: 1.25 | E413: 17.690000000000001 | F413: 18.210000000000001 | G413: 19.559999999999999 | I413: 18.030000000000001 | AN413: 不宜入场（当前股价小于150日均线,应观察2w） | AO413: 44586
A414: 600063.SH | B414: 皖维高新 | C414: 59.74 | D414: 0.37 | E414: 5.8899999999999997 | F414: 6.0800000000000001 | G414: 6.1900000000000004 | I414: 5.4100000000000001 | AN414: 不宜入场（当前股价小于200日均线,应观察3w） | AO414: 44586
A415: 605086.SH | B415: 龙高股份 | C415: 59.69 | D415: 0.61 | E415: 23.68 | F415: 23.93 | G415: 23.879999999999999 | AN415: 不宜入场（50日均线小于150日均线,应观察4w） | AO415: 44586
A416: 002345.SZ | B416: 潮宏基 | C416: 59.61 | D416: 0.32 | E416: 5.1799999999999997 | F416: 5.25 | G416: 5.4000000000000004 | I416: 5.2699999999999996 | AN416: 不宜入场（当前股价小于50日均线,应观察1w） | AO416: 44586
A417: 603159.SH | B417: 上海亚虹 | C417: 59.600000000000001 | D417: 0.20000000000000001 | E417: 15.720000000000001 | F417: 16.039999999999999 | G417: 16.129999999999999 | I417: 14.69 | AN417: 不宜入场（当前股价小于200日均线,应观察3w） | AO417: 44586
A418: 600500.SH | B418: 中化国际 | C418: 59.53 | D418: 0.88 | E418: 8.0399999999999991 | F418: 8.2599999999999998 | G418: 8.3300000000000001 | I418: 7.4900000000000002 | AN418: 不宜入场（当前股价小于200日均线,应观察3w） | AO418: 44586
A419: 000983.SZ | B419: 山西焦煤 | C419: 59.46 | D419: 0.77 | E419: 8.4199999999999999 | F419: 8.7300000000000004 | G419: 8.8800000000000008 | I419: 8.6999999999999993 | AN419: 不宜入场（当前股价小于150日均线,应观察2w） | AO419: 44586
A420: 605116.SH | B420: 奥锐特 | C420: 59.399999999999999 | D420: 0.33 | E420: 16.23 | F420: 16.670000000000002 | G420: 19.41 | I420: 20.260000000000002 | J420: 12.140000000000001 | K420: 27.5 | L420: 13.84 | M420: =(I420-J420)/J420 -> 0.66886326194398682 | N420: =(K420-I420)/K420 -> 0.26327272727272721 | O420: =(K420-L420)/L420 -> 0.98699421965317924 | AN420: 不宜入场（当前股价距离最高点距离过大,应观察2w） | AO420: 44586
A421: 000688.SZ | B421: 国城矿业 | C421: 59.21 | D421: 0.14 | E421: 11.57 | F421: 12.01 | G421: 13.27 | I421: 13.1 | AN421: 不宜入场（当前股价小于50日均线,应观察1w） | AO421: 44586
A422: 601058.SH | B422: 赛轮轮胎 | C422: 59.12 | D422: 0.35 | E422: 11.81 | F422: 12.27 | G422: 13.41 | I422: 11.6 | AN422: 不宜入场（当前股价小于200日均线,应观察3w） | AO422: 44586
A423: 603045.SH | B423: 福达合金 | C423: 58.86 | D423: 0.31 | E423: 15.19 | F423: 15.81 | G423: 17.25 | I423: 15.51 | AN423: 不宜入场（当前股价小于150日均线,应观察2w） | AO423: 44586
A424: 002125.SZ | B424: 湘潭电化 | C424: 58.53 | D424: 0.17 | E424: 10.609999999999999 | F424: 11 | G424: 11.32 | I424: 10.76 | AN424: 不宜入场（当前股价小于150日均线,应观察2w） | AO424: 44586
A425: 600668.SH | B425: 尖峰集团 | C425: 58.49 | D425: 1.23 | AO425: 44578
A426: 603776.SH | B426: 永安行 | C426: 58.49 | D426: 0.5 | E426: 18.149999999999999 | F426: 18.32 | G426: 19.030000000000001 | I426: 16.469999999999999 | AN426: 不宜入场（当前股价小于200日均线,应观察3w） | AO426: 44586
A427: 600552.SH | B427: 凯盛科技 | C427: 58.42 | D427: 0.19 | E427: 9.6699999999999999 | F427: 9.9800000000000004 | G427: 10.960000000000001 | I427: 9.9299999999999997 | AN427: 不宜入场（当前股价小于150日均线,应观察2w） | AO427: 44586
A428: 600889.SH | B428: 南京化纤 | C428: 58.35 | D428: 0.33 | E428: 6 | F428: 6.0999999999999996 | G428: 6.1799999999999997 | I428: 5.5599999999999996 | AN428: 不宜入场（当前股价小于200日均线,应观察3w） | AO428: 44586
A429: 603987.SH | B429: 康德莱 | C429: 58.34 | D429: 0.48 | E429: 20.940000000000001 | F429: 20.879999999999999 | AN429: 不宜入场（150日均线小于200日均线,应观察8w） | AO429: 44586
A430: 600808.SH | B430: 马钢股份 | C430: 58.33 | D430: 0.85 | E430: 4.1100000000000003 | F430: 4.1699999999999999 | G430: 4.0800000000000001 | AN430: 不宜入场（50日均线小于200日均线,应观察4w） | AO430: 44586
A431: 003037.SZ | B431: 三和管桩 | C431: 58.32 | D431: 0.13 | E431: 12.92 | F431: 12.359999999999999 | AN431: 不宜入场（150日均线小于200日均线,应观察8w） | AO431: 44586
A432: 002566.SZ | B432: 益盛药业 | C432: 57.69 | D432: 0.20000000000000001 | E432: 7.9400000000000004 | F432: 8.0800000000000001 | G432: 8.5800000000000001 | I432: 8.0800000000000001 | AN432: 不宜入场（当前股价小于50日均线,应观察1w） | AO432: 44586
A433: 002527.SZ | B433: 新时达 | C433: 57.43 | D433: 0.21 | E433: 7.8700000000000001 | F433: 8.0500000000000007 | G433: 8.25 | I433: 7.8499999999999996 | AN433: 不宜入场（当前股价小于200日均线,应观察3w） | AO433: 44586
A434: 603011.SH | B434: 合锻智能 | C434: 57.43 | D434: 0.11 | E434: 5.9199999999999999 | F434: 6.1699999999999999 | G434: 7.1600000000000001 | I434: 7.21 | J434: 3.96 | K434: 9.8800000000000008 | L434: 5.2400000000000002 | M434: =(I434-J434)/J434 -> 0.82070707070707072 | N434: =(K434-I434)/K434 -> 0.27024291497975717 | O434: =(K434-L434)/L434 -> 0.8854961832061069 | P434: 7.21 | AN434: 不宜入场（当前股价距离最高点距离过大,应观察2w） | AO434: 44586
A435: 000153.SZ | B435: 丰原药业 | C435: 57.37 | D435: 0.29 | E435: 10.27 | F435: 10.67 | G435: 11.41 | I435: 9.6099999999999994 | AN435: 不宜入场（当前股价小于200日均线,应观察3w） | AO435: 44586
A436: 601919.SH | B436: 中远海控 | C436: 57.34 | D436: 4.23 | AO436: 44578
A437: 000848.SZ | B437: 承德露露 | C437: 57.29 | D437: 0.38 | E437: 10.01 | F437: 10.369999999999999 | G437: 10.68 | I437: 9.3800000000000008 | J437: 5.8300000000000001 | K437: 14.25 | L437: 10.92 | M437: =(I437-J437)/J437 -> 0.60891938250428823 | N437: =(K437-I437)/K437 -> 0.3417543859649122 | O437: =(K437-L437)/L437 -> 0.30494505494505497 | AN437: 不宜入场（当前股价距离最高点距离过大,应观察3w） | AO437: 44586
A438: 002860.SZ | B438: 星帅尔 | C438: 57.02 | D438: 0.67 | E438: 20.199999999999999 | F438: 21.010000000000002 | G438: 23.239999999999998 | I438: 21.870000000000001 | AN438: 不宜入场（当前股价小于50日均线,应观察1w） | AO438: 44586
A439: 002576.SZ | B439: 通达动力 | C439: 57 | D439: 0.55 | E439: 14.83 | F439: 15.390000000000001 | G439: 16.48 | I439: 13.68 | AN439: 不宜入场（当前股价小于200日均线,应观察3w） | AO439: 44586
A440: 603707.SH | B440: 健友股份 | C440: 56.899999999999999 | D440: 0.69 | E440: 35.229999999999997 | F440: 36.159999999999997 | G440: 38.640000000000001 | I440: 36.600000000000001 | AN440: 不宜入场（当前股价小于50日均线,应观察1w） | AO440: 44586
A441: 000676.SZ | B441: 智度股份 | C441: 56.83 | D441: 0.18 | E441: 6.8700000000000001 | F441: 7.04 | G441: 7.5999999999999996 | I441: 6.9299999999999997 | AN441: 不宜入场（当前股价小于150日均线,应观察2w） | AO441: 44586
A442: 600645.SH | B442: 中源协和 | C442: 56.67 | D442: 0.41 | E442: 22.100000000000001 | F442: 22.48 | G442: 23.710000000000001 | I442: 22.260000000000002 | AN442: 不宜入场（当前股价小于150日均线,应观察2w） | AO442: 44586
A443: 603657.SH | B443: 春光科技 | C443: 56.58 | D443: 0.67 | E443: 23.109999999999999 | F443: 23.43 | G443: 24.289999999999999 | I443: 23.699999999999999 | AN443: 不宜入场（当前股价小于50日均线,应观察1w） | AO443: 44586
A444: 603977.SH | B444: 国泰集团 | C444: 56.56 | D444: 0.28 | E444: 9.4000000000000004 | F444: 9.6500000000000004 | G444: 10.130000000000001 | I444: 8.9800000000000004 | AN444: 不宜入场（当前股价小于200日均线,应观察3w） | AO444: 44586
A445: 603926.SH | B445: 铁流股份 | C445: 56.36 | D445: 0.94 | E445: 15.15 | F445: 15.6 | G445: 16.370000000000001 | I445: 14.99 | AN445: 不宜入场（当前股价小于200日均线,应观察3w） | AO445: 44586
A446: 002255.SZ | B446: 海陆重工 | C446: 56.19 | D446: 0.32 | E446: 5.6299999999999999 | F446: 5.8200000000000003 | G446: 6.4100000000000001 | I446: 5.8700000000000001 | AN446: 不宜入场（当前股价小于50日均线,应观察1w） | AO446: 44586
A447: 605580.SH | B447: 恒盛能源 | C447: 55.96 | D447: 0.58 | E447: 15.369999999999999 | F447: 15.84 | G447: 16.329999999999998 | I447: 13.800000000000001 | AN447: 不宜入场（当前股价小于200日均线,应观察3w） | AO447: 44586
A448: 603867.SH | B448: 新化股份 | C448: 55.71 | D448: 0.78 | E448: 30.73 | F448: 31.82 | G448: 34.200000000000003 | I448: 32.170000000000002 | AN448: 不宜入场（当前股价小于50日均线,应观察1w） | AO448: 44586
A449: 603933.SH | B449: 睿能科技 | C449: 55.66 | D449: 0.42 | E449: 13.51 | F449: 13.83 | G449: 14.25 | I449: 12.58 | AN449: 不宜入场（当前股价小于200日均线,应观察3w） | AO449: 44586
A450: 603896.SH | B450: 寿仙谷 | C450: 55.45 | D450: 0.58 | E450: 44.039999999999999 | F450: 45.619999999999997 | G450: 51.600000000000001 | I450: 51.170000000000002 | AN450: 不宜入场（当前股价小于50日均线,应观察1w） | AO450: 44586
A451: 002258.SZ | B451: 利尔化学 | C451: 55.399999999999999 | D451: 1.17 | AO451: 44578
A452: 603165.SH | B452: 荣晟环保 | C452: 55.31 | D452: 0.69999999999999996 | E452: 15.369999999999999 | F452: 15.880000000000001 | G452: 17.68 | I452: 16.379999999999999 | AN452: 不宜入场（当前股价小于50日均线,应观察1w） | AO452: 44586
A453: 000630.SZ | B453: 铜陵有色 | C453: 55.23 | D453: 0.23 | E453: 3.46 | F453: 3.5499999999999998 | G453: 3.6299999999999999 | I453: 3.3999999999999999 | AN453: 不宜入场（当前股价小于200日均线,应观察3w） | AO453: 44586
A454: 600288.SH | B454: 大恒科技 | C454: 55.11 | D454: 0.11 | E454: 12.529999999999999 | F454: 12.73 | G454: 13.630000000000001 | I454: 14.970000000000001 | J454: 9.0099999999999998 | K454: 15.960000000000001 | L454: 12.859999999999999 | M454: =(I454-J454)/J454 -> 0.66148723640399565 | N454: =(K454-I454)/K454 -> 6.2030075187969935e-02 | O454: =(K454-L454)/L454 -> 0.24105754276827385 | P454: 14.949999999999999 | AA454: 0w | AB454: =(K454-P454)/K454 -> 6.3283208020050219e-02 | AN454: 不宜入场(当前收缩幅度不够,应观察1w) | AO454: 44586
A455: 002046.SZ | B455: 国机精工 | C455: 54.83 | D455: 0.33 | E455: 12.69 | F455: 13.42 | G455: 14.630000000000001 | I455: 12.52 | AN455: 不宜入场（当前股价小于200日均线,应观察3w） | AO455: 44586
A456: 002520.SZ | B456: 日发精机 | C456: 54.56 | D456: 0.17 | E456: 9.0399999999999991 | F456: 9.3599999999999994 | G456: 9.8000000000000007 | I456: 8.0999999999999996 | AN456: 不宜入场（当前股价小于200日均线,应观察3w） | AO456: 44586
A457: 002929.SZ | B457: 润建股份 | C457: 54.37 | D457: 1.16 | AO457: 44578
A458: 002556.SZ | B458: 辉隆股份 | C458: 54.09 | D458: 0.49 | E458: 10.65 | F458: 10.82 | G458: 11.609999999999999 | I458: 11.65 | J458: 7.5300000000000002 | K458: 13 | L458: 10.029999999999999 | M458: =(I458-J458)/J458 -> 0.54714475431606902 | N458: =(K458-I458)/K458 -> 0.10384615384615382 | O458: =(K458-L458)/L458 -> 0.29611166500498515 | P458: 11.6 | AA458: 2w | AB458: =(K458-P458)/K458 -> 0.10769230769230773 | AN458: 不宜入场(当前收缩幅度不够,应观察1w) | AO458: 44586
A459: 605299.SH | B459: 舒华体育 | C459: 54.08 | D459: 0.19 | E459: 17.789999999999999 | F459: 18.260000000000002 | G459: 18.280000000000001 | I459: 15.300000000000001 | AN459: 不宜入场（当前股价小于200日均线,应观察3w） | AO459: 44586
A460: 002637.SZ | B460: 赞宇科技 | C460: 53.93 | D460: 1.3 | AO460: 44578
A461: 002722.SZ | B461: 金轮股份 | C461: 53.91 | D461: 0.71 | E461: 13.99 | F461: 14.56 | G461: 15.960000000000001 | I461: 14.93 | AN461: 不宜入场（当前股价小于50日均线,应观察1w） | AO461: 44586
A462: 000933.SZ | B462: 神火股份 | C462: 53.89 | D462: 1.03 | AO462: 44578
A463: 605108.SH | B463: 同庆楼 | C463: 53.81 | D463: 0.31 | E463: 18.829999999999998 | F463: 18.809999999999999 | AN463: 不宜入场（150日均线小于200日均线,应观察4w） | AO463: 44586
A464: 000917.SZ | B464: 电广传媒 | C464: 53.76 | D464: 0.33 | E464: 5.8600000000000003 | F464: 6.0199999999999996 | G464: 6.3700000000000001 | I464: 5.8499999999999996 | AN464: 不宜入场（当前股价小于200日均线,应观察4w） | AO464: 44586
A465: 000739.SZ | B465: 普洛药业 | C465: 53.65 | D465: 0.65 | E465: 33.159999999999997 | F465: 33.780000000000001 | G465: 34.200000000000003 | I465: 29.5 | AN465: 不宜入场（当前股价小于200日均线,应观察4w） | AO465: 44586
A466: 000821.SZ | B466: 京山轻机 | C466: 53.44 | D466: 0.26 | E466: 9.75 | F466: 9.8200000000000003 | G466: 11.75 | I466: 11.27 | AN466: 不宜入场（当前股价小于50日均线,应观察1w） | AO466: 44586
A467: 603456.SH | B467: 九洲药业 | C467: 53.38 | D467: 0.57 | E467: 48.770000000000003 | F467: 49.969999999999999 | G467: 51.960000000000001 | I467: 46.159999999999997 | AN467: 不宜入场（当前股价小于200日均线,应观察4w） | AO467: 44586
A468: 601226.SH | B468: 华电重工 | C468: 53.03 | D468: 0.13 | E468: 5.1600000000000001 | F468: 5.3700000000000001 | G468: 6.0499999999999998 | I468: 5.4400000000000004 | AN468: 不宜入场（当前股价小于50日均线,应观察1w） | AO468: 44586
A469: 603886.SH | B469: 元祖股份 | C469: 52.99 | D469: 1.38 | AO469: 44578
A470: 002483.SZ | B470: 润邦股份 | C470: 52.93 | D470: 0.28 | E470: 6.4100000000000001 | F470: 6.71 | G470: 7.6200000000000001 | I470: 7.6399999999999997 | J470: 4.0499999999999998 | K470: 9.1500000000000004 | L470: 6.9699999999999998 | M470: =(I470-J470)/J470 -> 0.88641975308641974 | N470: =(K470-I470)/K470 -> 0.16502732240437165 | O470: =(K470-L470)/L470 -> 0.3127690100430417 | P470: 6.9900000000000002 | AA470: 8w | AB470: =(K470-P470)/K470 -> 0.23606557377049181 | AN470: 不宜入场(当前收缩幅度不够,应观察2w) | AO470: 44586
A471: 600620.SH | B471: 天宸股份 | C471: 52.91 | D471: 0.25 | E471: 8.4399999999999995 | F471: 8.7200000000000006 | G471: 9.3000000000000007 | I471: 9.2200000000000006 | AN471: 不宜入场（当前股价小于50日均线,应观察1w） | AO471: 44586
A472: 603668.SH | B472: 天马科技 | C472: 52.77 | D472: 0.23 | E472: 8.5999999999999996 | F472: 8.9299999999999997 | G472: 10.449999999999999 | I472: 10.130000000000001 | AN472: 不宜入场（当前股价小于50日均线,应观察1w） | AO472: 44586
A473: 002701.SZ | B473: 奥瑞金 | C473: 52.68 | D473: 0.34 | E473: 6.1900000000000004 | F473: 6.3399999999999999 | G473: 6.6500000000000004 | I473: 5.9800000000000004 | AN473: 不宜入场（当前股价小于200日均线,应观察4w） | AO473: 44586
A474: 603871.SH | B474: 嘉友国际 | C474: 52.67 | D474: 0.87 | E474: 18.609999999999999 | F474: 19.109999999999999 | G474: 20.920000000000002 | I474: 19.620000000000001 | AN474: 不宜入场（当前股价小于50日均线,应观察1w） | AO474: 44586
A475: 603303.SH | B475: 得邦照明 | C475: 52.48 | D475: 0.59999999999999998 | E475: 15.92 | F475: 16.350000000000001 | G475: 17.140000000000001 | I475: 16.059999999999999 | AN475: 不宜入场（当前股价小于150日均线,应观察2w） | AO475: 44586
A476: 000912.SZ | B476: 泸天化 | C476: 52.37 | D476: 0.29 | E476: 5.2800000000000002 | F476: 5.4400000000000004 | G476: 5.7599999999999998 | I476: 5.2699999999999996 | AN476: 不宜入场（当前股价小于200日均线,应观察4w） | AO476: 44586
A477: 600116.SH | B477: 三峡水利 | C477: 52.33 | D477: 0.42 | E477: 10.039999999999999 | F477: 10.27 | G477: 11.19 | I477: 11.539999999999999 | J477: 7.8899999999999997 | K477: 12.960000000000001 | L477: 9.2400000000000002 | M477: =(I477-J477)/J477 -> 0.46261089987325726 | N477: =(K477-I477)/K477 -> 0.10956790123456803 | O477: =(K477-L477)/L477 -> 0.40259740259740268 | P477: 11.539999999999999 | AA477: 2w | AB477: =(K477-P477)/K477 -> 0.10956790123456803 | AN477: 不宜入场(当前收缩幅度不够,应观察2w) | AO477: 44586
A478: 000791.SZ | B478: 甘肃电投 | C478: 52.26 | D478: 0.23 | E478: 5.6600000000000001 | F478: 5.8300000000000001 | G478: 6.4000000000000004 | I478: 5.8700000000000001 | AN478: 不宜入场（当前股价小于50日均线,应观察1w） | AO478: 44586
A479: 601678.SH | B479: 滨化股份 | C479: 52.19 | D479: 0.78 | E479: 8.0600000000000005 | F479: 8.2699999999999996 | G479: 8.0800000000000001 | AN479: 不宜入场（50日均线小于150日均线,应观察4w） | AO479: 44586
A480: 600516.SH | B480: 方大炭素 | C480: 52.19 | D480: 0.23 | E480: 9.9800000000000004 | F480: 10.279999999999999 | G480: 10.69 | I480: 9.3800000000000008 | AN480: 不宜入场（当前股价小于200日均线,应观察3w） | AO480: 44586
A481: 600970.SH | B481: 中材国际 | C481: 52.11 | D481: 0.64 | E481: 10.74 | F481: 10.92 | G481: 11.07 | I481: 10.15 | AN481: 不宜入场（当前股价小于200日均线,应观察3w） | AO481: 44586
A482: 601016.SH | B482: 节能风电 | C482: 52.01 | D482: 0.15 | E482: 5.5 | F482: 5.7300000000000004 | G482: 6.0999999999999996 | I482: 5.0499999999999998 | AN482: 不宜入场（当前股价小于200日均线,应观察3w） | AO482: 44586
A483: 600131.SH | B483: 国网信通 | C483: 51.88 | D483: 0.31 | E483: 16.940000000000001 | F483: 17.579999999999998 | G483: 20.379999999999999 | I483: 20.32 | AN483: 不宜入场（当前股价小于50日均线,应观察1w） | AO483: 44586
A484: 601619.SH | B484: 嘉泽新能 | C484: 51.88 | D484: 0.19 | E484: 4.71 | F484: 4.8499999999999996 | G484: 5.0300000000000002 | I484: 4.3200000000000003 | AN484: 不宜入场（当前股价小于200日均线,应观察3w） | AO484: 44586
A485: 002774.SZ | B485: 快意电梯 | C485: 51.700000000000003 | D485: 0.79 | E485: 7.8499999999999996 | F485: 8.0600000000000005 | G485: 8.3499999999999996 | I485: 7.7199999999999998 | AN485: 不宜入场（当前股价小于200日均线,应观察3w） | AO485: 44586
A486: 603616.SH | B486: 韩建河山 | C486: 51.08 | D486: 0.13 | E486: 6.1299999999999999 | F486: 6.2300000000000004 | G486: 6.9699999999999998 | I486: 7.5800000000000001 | J486: 4.6399999999999997 | K486: 10.24 | L486: 5.4000000000000004 | M486: =(I486-J486)/J486 -> 0.63362068965517249 | N486: =(K486-I486)/K486 -> 0.259765625 | O486: =(K486-L486)/L486 -> 0.89629629629629626 | P486: 7.4299999999999997 | AA486: 1w | AB486: =(K486-P486)/K486 -> 0.27441406250000006 | AN486: 不宜入场（当前股价距离最高点距离过大,应观察2w） | AO486: 44586
A487: 000962.SZ | B487: 东方钽业 | C487: 51 | D487: 0.21 | E487: 11.33 | F487: 11.6 | G487: 11.6 | I487: 10.24 | AN487: 不宜入场（当前股价小于50日均线,应观察1w） | AO487: 44586
A488: 600259.SH | B488: 广晟有色 | C488: 50.95 | D488: 0.42 | E488: 46.43 | F488: 47.649999999999999 | G488: 48.829999999999998 | I488: 44.079999999999998 | AN488: 不宜入场（当前股价小于200日均线,应观察3w） | AO488: 44586
A489: 600331.SH | B489: 宏达股份 | C489: 50.94 | D489: 0.14 | E489: 3.1600000000000001 | F489: 3.29 | G489: 3.3500000000000001 | I489: 2.8900000000000001 | AN489: 不宜入场（当前股价小于200日均线,应观察3w） | AO489: 44586
A490: 002779.SZ | B490: 中坚科技 | C490: 50.89 | D490: 0.11 | E490: 13.84 | F490: 14.460000000000001 | G490: 16.41 | I490: 16.649999999999999 | J490: 9.0399999999999991 | K490: 18.59 | L490: 12.98 | M490: =(I490-J490)/J490 -> 0.8418141592920354 | N490: =(K490-I490)/K490 -> 0.10435718128025827 | O490: =(K490-L490)/L490 -> 0.43220338983050843 | P490: 15 | Q490: 17.649999999999999 | R490: 16.329999999999998 | S490: 17.84 | T490: 16.609999999999999 | AA490: 7w | AB490: =(K490-P490)/K490 -> 0.19311457772996235 | AC490: =(Q490-R490)/Q490 -> 7.4787535410764897e-02 | AD490: =(S490-T490)/S490 -> 6.8946188340807193e-02 | AI490: 是 | AJ490: 是 | AK490: 是 | AL490: 是 | AN490: 可以入场 | AO490: 44599
A491: 600246.SH | B491: 万通发展 | C491: 50.84 | D491: 0.14 | E491: 9.6899999999999995 | F491: 10.050000000000001 | G491: 10.66 | I491: 9.6799999999999997 | AN491: 不宜入场（当前股价小于200日均线,应观察3w） | AO491: 44586
A492: 002300.SZ | B492: 太阳电缆 | C492: 50.83 | D492: 0.17 | E492: 7.0499999999999998 | F492: 7.3099999999999996 | G492: 8.2200000000000006 | I492: 8.75 | J492: 5.0599999999999996 | K492: 9.8100000000000005 | L492: 6.54 | M492: =(I492-J492)/J492 -> 0.72924901185770763 | N492: =(K492-I492)/K492 -> 0.10805300713557599 | O492: =(K492-L492)/L492 -> 0.50000000000000011 | P492: 7.5499999999999998 | Q492: 8.7300000000000004 | R492: 7.9900000000000002 | S492: 9.5 | T492: 8.5899999999999999 | AA492: 7w | AB492: =(K492-P492)/K492 -> 0.23037716615698273 | AC492: =(Q492-R492)/Q492 -> 8.4765177548682721e-02 | AD492: =(S492-T492)/S492 -> 9.5789473684210535e-02 | AN492: 不宜入场(收缩幅度不够,应观察1w) | AO492: 44586
A493: 000795.SZ | B493: 英洛华 | C493: 50.77 | D493: 0.13 | E493: 6.5499999999999998 | F493: 6.8300000000000001 | G493: 7.7699999999999996 | I493: 6.7400000000000002 | AN493: 不宜入场（当前股价小于150日均线,应观察2w） | AO493: 44586
A494: 002878.SZ | B494: 元隆雅图 | C494: 50.67 | D494: 0.37 | E494: 18.66 | F494: 18.739999999999998 | G494: 20.489999999999998 | I494: 19.379999999999999 | AN494: 不宜入场（当前股价小于50日均线,应观察1w） | AO494: 44586
A495: 603305.SH | B495: 旭升股份 | C495: 50.63 | D495: 0.74 | E495: 40.119999999999997 | F495: 41.689999999999998 | G495: 46.189999999999998 | I495: 45.799999999999997 | AN495: 不宜入场（当前股价小于50日均线,应观察1w） | AO495: 44586
A496: 001205.SZ | B496: 盛航股份 | C496: 50.61 | D496: 0.96 | E496: 24.739999999999998 | F496: 24.809999999999999 | G496: 26.129999999999999 | I496: 29.73 | J496: 19.510000000000002 | K496: 38.32 | L496: 23.789999999999999 | M496: =(I496-J496)/J496 -> 0.52383393131727307 | N496: =(K496-I496)/K496 -> 0.22416492693110646 | O496: =(K496-L496)/L496 -> 0.61076082387557806 | P496: 19.510000000000002 | Q496: 26.84 | R496: 22.940000000000001 | S496: 32.640000000000001 | T496: 27.690000000000001 | U496: 33.899999999999999 | V496: 29.510000000000002 | AA496: 7w | AB496: =(K496-P496)/K496 -> 0.490866388308977 | AC496: =(Q496-R496)/Q496 -> 0.14530551415797313 | AD496: =(S496-T496)/S496 -> 0.15165441176470587 | AE496: =(U496-V496)/U496 -> 0.12949852507374623 | AN496: 不宜入场(收缩幅度不够,应观察1w) | AO496: 44586
A497: 603230.SH | B497: 内蒙新华 | C497: 50.600000000000001 | D497: 1.01 | AO497: 44578
A498: 603286.SH | B498: 日盈电子 | C498: 50.56 | D498: 0.18 | E498: 17.100000000000001 | F498: 17.649999999999999 | G498: 19.140000000000001 | I498: 17.100000000000001 | AN498: 不宜入场（当前股价小于150日均线,应观察2w） | AO498: 44586
A499: 000565.SZ | B499: 渝三峡A | C499: 50.41 | D499: 0.17 | E499: 6.0700000000000003 | F499: 6.1399999999999997 | G499: 6.3399999999999999 | I499: 5.75 | AN499: 不宜入场（当前股价小于200日均线,应观察3w） | AO499: 44586
A500: 002119.SZ | B500: 康强电子 | C500: 50.15 | D500: 0.33 | E500: 14.380000000000001 | F500: 14.67 | G500: 14.44 | AN500: 不宜入场（50日均线小于150日均线,应观察4w） | AO500: 44586
A501: 600933.SH | B501: 爱柯迪 | C501: 49.97 | D501: 0.32 | E501: 15.880000000000001 | F501: 16.129999999999999 | G501: 18.09 | I501: 18.52 | J501: 11.4 | K501: 23.219999999999999 | L501: 16.600000000000001 | M501: =(I501-J501)/J501 -> 0.62456140350877187 | N501: =(K501-I501)/K501 -> 0.20241171403962099 | O501: =(K501-L501)/L501 -> 0.39879518072289138 | P501: 18.510000000000002 | AA501: 1w | AB501: =(K501-P501)/K501 -> 0.20284237726098181 | AN501: 不宜入场(收缩幅度不够,应观察2w) | AO501: 44586
A502: 600523.SH | B502: 贵航股份 | C502: 49.91 | D502: 0.32 | E502: 17.789999999999999 | F502: 18.579999999999998 | G502: 21.609999999999999 | I502: 19.52 | AN502: 不宜入场（当前股价小于50日均线,应观察1w） | AO502: 44586
A503: 601311.SH | B503: 骆驼股份 | C503: 49.899999999999999 | D503: 0.59999999999999998 | E503: 13.529999999999999 | F503: 14.01 | G503: 14.99 | I503: 13.9 | AN503: 不宜入场（当前股价小于150日均线,应观察2w） | AO503: 44586
A504: 002184.SZ | B504: 海得控制 | C504: 49.88 | D504: 0.24 | E504: 14.31 | F504: 14.43 | G504: 14.460000000000001 | I504: 12.93 | AN504: 不宜入场（当前股价小于200日均线,应观察3w） | AO504: 44586
A505: 603599.SH | B505: 广信股份 | C505: 49.68 | D505: 2.22 | AO505: 44578
A506: 002335.SZ | B506: 科华数据 | C506: 49.66 | D506: 0.62 | E506: 32.030000000000001 | F506: 33.869999999999997 | G506: 36.359999999999999 | I506: 32.600000000000001 | AN506: 不宜入场（当前股价小于150日均线,应观察2w） | AO506: 44586
A507: 600233.SH | B507: 圆通速递 | C507: 49.58 | D507: 0.29999999999999999 | E507: 13.619999999999999 | F507: 14.24 | G507: 16.420000000000002 | I507: 15.76 | AN507: 不宜入场（当前股价小于50日均线,应观察1w） | AO507: 44586
A508: 601838.SH | B508: 成都银行 | C508: 49.57 | D508: 1.42 | AO508: 44578
A509: 002454.SZ | B509: 松芝股份 | C509: 49.35 | D509: 0.16 | E509: 7.6100000000000003 | F509: 7.9199999999999999 | G509: 8.3499999999999996 | I509: 7.0499999999999998 | AN509: 不宜入场（当前股价小于200日均线,应观察3w） | AO509: 44586
A510: 600810.SH | B510: 神马股份 | C510: 49.11 | D510: 1.8 | AO510: 44578
A511: 600935.SH | B511: 华塑股份 | C511: 49.05 | D511: 0.19 | E511: 6.3399999999999999 | F511: 6.5099999999999998 | G511: 7.1699999999999999 | I511: 6.5599999999999996 | AN511: 不宜入场(当前股价小于50日均线,应观察1w) | AO511: 44585
A512: 000062.SZ | B512: 深圳华强 | C512: 49.01 | D512: 0.68 | E512: 15.49 | F512: 15.890000000000001 | G512: 16.82 | I512: 17.050000000000001 | J512: 10.640000000000001 | K512: 20.460000000000001 | L512: 16.059999999999999 | M512: =(I512-J512)/J512 -> 0.60244360902255634 | N512: =(K512-I512)/K512 -> 0.16666666666666666 | O512: =(K512-L512)/L512 -> 0.27397260273972618 | P512: 13.73 | AA512: 3w | AB512: =(K512-P512)/K512 -> 0.32893450635386118 | AC512: =(Q512-R512)/Q512 -> #DIV/0! | AD512: =(S512-T512)/S512 -> #DIV/0! | AN512: 不宜入场(当前收缩幅度不够,应观察2w) | AO512: 44585
A513: 002536.SZ | B513: 飞龙股份 | C513: 48.99 | D513: 0.34 | E513: 7.7999999999999998 | F513: 8.0500000000000007 | G513: 8.3200000000000003 | I513: 7.6200000000000001 | AN513: 不宜入场(当前股价小于200日均线,应观察3w) | AO513: 44585
A514: 002612.SZ | B514: 朗姿股份 | C514: 48.899999999999999 | D514: 0.36 | E514: 37.020000000000003 | F514: 35.979999999999997 | G514: 32.009999999999998 | AN514: 不宜入场(50日均线小于150日均线,应观察4w) | AO514: 44585
A515: 603683.SH | B515: 晶华新材 | C515: 48.85 | D515: 0.17 | E515: 12.82 | F515: 13.08 | G515: 13.69 | I515: 13.42 | AN515: 不宜入场(当前股价小于50日均线,应观察1w) | AO515: 44585
A516: 603050.SH | B516: 科林电气 | C516: 48.81 | D516: 0.5 | E516: 16.59 | F516: 17.25 | G516: 18.27 | I516: 16.100000000000001 | AN516: 不宜入场(当前股价小于200日均线,应观察3w) | AO516: 44585
A517: 002729.SZ | B517: 好利科技 | C517: 48.73 | D517: 0.25 | E517: 41.25 | F517: 43.109999999999999 | G517: 48.240000000000002 | I517: 47.689999999999998 | AN517: 不宜入场(当前股价小于50日均线,应观察1w) | AO517: 44585
A518: 002517.SZ | B518: 恺英网络 | C518: 48.61 | D518: 0.24 | E518: 4.8799999999999999 | F518: 4.96 | G518: 5.4199999999999999 | I518: 5.4100000000000001 | AN518: 不宜入场(当前股价小于50日均线,应观察1w) | AO518: 44585
A519: 002760.SZ | B519: 凤形股份 | C519: 48.39 | D519: 0.76 | E519: 23.960000000000001 | F519: 24.600000000000001 | G519: 25.440000000000001 | I519: 23.149999999999999 | AN519: 不宜入场(当前股价小于200日均线,应观察3w) | AO519: 44585
A520: 600218.SH | B520: 全柴动力 | C520: 48.38 | D520: 0.31 | E520: 12.300000000000001 | F520: 12.81 | G520: 13.710000000000001 | I520: 12.09 | AN520: 不宜入场(当前股价小于200日均线,应观察3w) | AO520: 44585
A521: 000922.SZ | B521: 佳电股份 | C521: 48.26 | D521: 0.31 | E521: 10.08 | F521: 10.43 | G521: 11.699999999999999 | I521: 10.99 | AN521: 不宜入场(当前股价小于50日均线,应观察1w) | AO521: 44585
A522: 600735.SH | B522: 新华锦 | C522: 48.25 | D522: 0.13 | E522: 6.4400000000000004 | F522: 6.5999999999999996 | G522: 7.04 | I522: 7.3700000000000001 | J522: 4.4100000000000001 | K522: 9.2300000000000004 | L522: 4.9299999999999997 | M522: =(I522-J522)/J522 -> 0.67120181405895685 | N522: =(K522-I522)/K522 -> 0.20151679306608886 | O522: =(K522-L522)/L522 -> 0.87221095334685617 | P522: 5.0999999999999996 | Q522: 6.9800000000000004 | R522: 5.9100000000000001 | AA522: 4w | AB522: =(K522-P522)/K522 -> 0.44745395449620806 | AC522: =(Q522-R522)/Q522 -> 0.15329512893982811 | AN522: 不宜入场(当前收缩幅度不够,应观察1w) | AO522: 44585
A523: 002537.SZ | B523: 海联金汇 | C523: 48.12 | D523: 0.19 | E523: 6.3399999999999999 | F523: 6.46 | G523: 7.25 | I523: 8.6199999999999992 | J523: 4.9900000000000002 | K523: 9.4399999999999995 | L523: 5.9100000000000001 | M523: =(I523-J523)/J523 -> 0.72745490981963901 | N523: =(K523-I523)/K523 -> 8.6864406779661049e-02 | O523: =(K523-L523)/L523 -> 0.59729272419627732 | P523: 8.1899999999999995 | AA523: 1w | AB523: =(K523-P523)/K523 -> 0.13241525423728814 | AN523: 不宜入场(当前收缩幅度不够,应观察1w) | AO523: 44585
A524: 603309.SH | B524: 维力医疗 | C524: 48.100000000000001 | D524: 0.31 | E524: 13.75 | F524: 13.98 | G524: 15.08 | I524: 14.710000000000001 | AN524: 不宜入场(当前股价小于50日均线,应观察1w) | AO524: 44585
A525: 603080.SH | B525: 新疆火炬 | C525: 47.97 | D525: 0.56 | E525: 15.699999999999999 | F525: 15.83 | G525: 16.43 | I525: 15.25 | AN525: 不宜入场(当前股价小于200日均线,应观察3w) | AO525: 44585
A526: 002825.SZ | B526: 纳尔股份 | C526: 47.95 | D526: 0.42 | E526: 17.57 | F526: 18.109999999999999 | G526: 20.460000000000001 | I526: 18.690000000000001 | AN526: 不宜入场(当前股价小于50日均线,应观察1w) | AO526: 44585
A527: 002466.SZ | B527: 天齐锂业 | C527: 47.86 | D527: 0.36 | E527: 87.359999999999999 | F527: 92.840000000000003 | G527: 98.480000000000004 | I527: 88.079999999999998 | AN527: 不宜入场(当前股价小于50日均线,应观察1w) | AO527: 44585
A528: 600927.SH | B528: 永安期货 | C528: 47.73 | D528: 0.67 | E528: 27.109999999999999 | F528: 27.449999999999999 | G528: 29.370000000000001 | I528: 27.02 | AN528: 不宜入场(当前股价小于200日均线,应观察3w) | AO528: 44585
A529: 600293.SH | B529: 三峡新材 | C529: 47.71 | D529: 0.11 | E529: 3.52 | F529: 3.6400000000000001 | G529: 3.7799999999999998 | I529: 3.6400000000000001 | AN529: 不宜入场(当前股价小于50日均线,应观察1w) | AO529: 44585
A530: 000963.SZ | B530: 华东医药 | C530: 47.68 | D530: 1.08 | AO530: 44578
A531: 605377.SH | B531: 华旺科技 | C531: 47.57 | D531: 1.12 | AO531: 44578
A532: 603058.SH | B532: 永吉股份 | C532: 47.54 | D532: 0.32 | E532: 7.7300000000000004 | F532: 7.8600000000000003 | G532: 8.5199999999999996 | I532: 8.4900000000000002 | AN532: 不宜入场(当前股价小于50日均线,应观察1w) | AO532: 44585
A533: 603565.SH | B533: 中谷物流 | C533: 47.51 | D533: 1.79 | AO533: 44578
A534: 002438.SZ | B534: 江苏神通 | C534: 47.49 | D534: 0.44 | E534: 15.16 | F534: 15.74 | G534: 17.800000000000001 | I534: 16.789999999999999 | AN534: 不宜入场(当前股价小于50日均线,应观察1w) | AO534: 44585
A535: 000833.SZ | B535: 粤桂股份 | C535: 47.38 | D535: 0.42 | E535: 6.2300000000000004 | F535: 6.4400000000000004 | G535: 6.6399999999999997 | I535: 5.9000000000000004 | AN535: 不宜入场(当前股价小于200日均线,应观察3w) | AO535: 44585
A536: 002171.SZ | B536: 楚江新材 | C536: 47.34 | D536: 0.31 | E536: 10.390000000000001 | F536: 10.82 | G536: 11.720000000000001 | I536: 10.98 | AN536: 不宜入场(当前股价小于50日均线,应观察1w) | AO536: 44585
A537: 603611.SH | B537: 诺力股份 | C537: 47.18 | D537: 0.88 | E537: 17.34 | F537: 18.030000000000001 | G537: 19.34 | I537: 18.02 | AN537: 不宜入场(当前股价小于150日均线,应观察3w) | AO537: 44585
A538: 601985.SH | B538: 中国核电 | C538: 47.14 | D538: 0.36 | E538: 6.3700000000000001 | F538: 6.5899999999999999 | G538: 7.3300000000000001 | I538: 7.54 | J538: 4.46 | K538: 8.9199999999999999 | L538: 7.0999999999999996 | M538: =(I538-J538)/J538 -> 0.6905829596412556 | N538: =(K538-I538)/K538 -> 0.1547085201793722 | O538: =(K538-L538)/L538 -> 0.25633802816901413 | P538: 7.0300000000000002 | AA538: 3w | AB538: =(K538-P538)/K538 -> 0.21188340807174885 | AN538: 不宜入场(当前收缩幅度不够,应观察2w) | AO538: 44585
A539: 002082.SZ | B539: 万邦德 | C539: 46.95 | D539: 0.25 | E539: 11.69 | F539: 11.73 | G539: 12.57 | I539: 12.539999999999999 | AN539: 不宜入场(当前股价小于50日均线,应观察1w) | AO539: 44585
A540: 002920.SZ | B540: 德赛西威 | C540: 46.700000000000003 | D540: 0.89 | E540: 113.55 | F540: 118.08 | G540: 136.28 | I540: 148.31999999999999 | J540: 71.959999999999994 | K540: 165.5 | L540: 97.849999999999994 | M540: =(I540-J540)/J540 -> 1.0611450806003335 | N540: =(K540-I540)/K540 -> 0.10380664652567979 | O540: =(K540-L540)/L540 -> 0.69136433316300472 | P540: 125.70999999999999 | Q540: 158.99000000000001 | R540: 142.05000000000001 | AA540: 4w | AB540: =(K540-P540)/K540 -> 0.24042296072507557 | AC540: =(Q540-R540)/Q540 -> 0.10654758160890621 | AN540: 不宜入场(当前收缩幅度不够,应观察1w) | AO540: 44585
A541: 603101.SH | B541: 汇嘉时代 | C541: 46.700000000000003 | D541: 0.14 | E541: 5.6100000000000003 | F541: 5.7199999999999998 | G541: 6.0800000000000001 | I541: 6.8099999999999996 | J541: 4.0800000000000001 | K541: 7.9500000000000002 | L541: 5.75 | M541: =(I541-J541)/J541 -> 0.66911764705882337 | N541: =(K541-I541)/K541 -> 0.14339622641509442 | O541: =(K541-L541)/L541 -> 0.38260869565217392 | AN541: 不宜入场(时间周期太短,应观察1w) | AO541: 44585
A542: 603306.SH | B542: 华懋科技 | C542: 46.66 | D542: 0.44 | E542: 34.32 | F542: 35.189999999999998 | G542: 34.719999999999999 | AN542: 不宜入场(50日均线小于150日均线,应观察1w) | AO542: 44585
A543: 002158.SZ | B543: 汉钟精机 | C543: 46.63 | D543: 0.68 | E543: 25.170000000000002 | F543: 25.27 | G543: 25.25 | AN543: 不宜入场(50日均线小于150日均线,应观察1w) | AO543: 44585
A544: 001203.SZ | B544: 大中矿业 | C544: 46.63 | D544: 1.01 | AO544: 44578
A545: 000059.SZ | B545: 华锦股份 | C545: 46.53 | D545: 0.33 | E545: 6.9800000000000004 | F545: 7.0700000000000003 | G545: 7.29 | I545: 7.2199999999999998 | AN545: 不宜入场(当前股价小于50日均线,应观察1w) | AO545: 44585
A546: 002615.SZ | B546: 哈尔斯 | C546: 46.52 | D546: 0.22 | E546: 5.2199999999999998 | F546: 5.3799999999999999 | G546: 5.6900000000000004 | I546: 5.54 | AN546: 不宜入场(当前股价小于50日均线,应观察1w) | AO546: 44585
A547: 601369.SH | B547: 陕鼓动力 | C547: 46.51 | D547: 0.44 | E547: 11.19 | F547: 11.59 | G547: 12.32 | I547: 10.85 | AN547: 不宜入场(当前股价小于200日均线,应观察3w) | AO547: 44585
A548: 002606.SZ | B548: 大连电瓷 | C548: 46.47 | D548: 0.35 | E548: 8.8900000000000006 | F548: 9.2300000000000004 | G548: 10.210000000000001 | I548: 11.24 | J548: 5.8700000000000001 | K548: 13.199999999999999 | L548: 6.7599999999999998 | M548: =(I548-J548)/J548 -> 0.91482112436115848 | N548: =(K548-I548)/K548 -> 0.14848484848484841 | O548: =(K548-L548)/L548 -> 0.9526627218934911 | P548: 8.1699999999999999 | Q548: 11.99 | R548: 8.9499999999999993 | AA548: 16w | AB548: =(K548-P548)/K548 -> 0.38106060606060604 | AC548: =(Q548-R548)/Q548 -> 0.25354462051709764 | AN548: 不宜入场(当前收缩幅度不够,应观察2w) | AO548: 44585
A549: 002664.SZ | B549: 长鹰信质 | C549: 46.45 | D549: 0.43 | E549: 17.75 | F549: 18.48 | G549: 19.77 | I549: 17.300000000000001 | AN549: 不宜入场(当前股价小于200日均线,应观察3w) | AO549: 44585
A550: 000498.SZ | B550: 山东路桥 | C550: 46.41 | D550: 0.83 | E550: 6.3099999999999996 | F550: 6.3899999999999997 | G550: 6.71 | I550: 7.3099999999999996 | J550: 4.4800000000000004 | K550: 8.0600000000000005 | L550: 6.1200000000000001 | M550: =(I550-J550)/J550 -> 0.63169642857142838 | N550: =(K550-I550)/K550 -> 9.305210918114154e-02 | O550: =(K550-L550)/L550 -> 0.31699346405228762 | P550: 7.2599999999999998 | AA550: 1w | AB550: =(K550-P550)/K550 -> 9.9255583126550945e-02 | AN550: 不宜入场(当前收缩幅度不够,应观察1w) | AO550: 44582
A551: 603630.SH | B551: 拉芳家化 | C551: 46.399999999999999 | D551: 0.27 | E551: 20.129999999999999 | F551: 20.460000000000001 | G551: 20.789999999999999 | I551: 18.760000000000002 | J551: 13.32 | K551: 32.170000000000002 | L551: 15.609999999999999 | M551: =(I551-J551)/J551 -> 0.40840840840840847 | N551: =(K551-I551)/K551 -> 0.41684799502642211 | O551: =(K551-L551)/L551 -> 1.0608584240871237 | AN551: 不宜入场(当前股价距离最高点距离过大,应观察2w) | AO551: 44582
A552: 605018.SH | B552: 长华股份 | C552: 46.37 | D552: 0.27 | E552: 14.960000000000001 | F552: 15.06 | G552: 16.300000000000001 | I552: 16.579999999999998 | J552: 11.31 | K552: 24.039999999999999 | L552: 16.010000000000002 | M552: =(I552-J552)/J552 -> 0.46595932802829332 | N552: =(K552-I552)/K552 -> 0.31031613976705497 | O552: =(K552-L552)/L552 -> 0.50156152404747012 | AN552: 不宜入场(当前股价距离最高点距离过大,应观察2w) | AO552: 44582
A553: 600386.SH | B553: 北巴传媒 | C553: 46.36 | D553: 0.13 | E553: 3.8999999999999999 | F553: 4 | G553: 4.3899999999999997 | I553: 4.5599999999999996 | J553: 2.9300000000000002 | K553: 5.1799999999999997 | L553: 4.2800000000000002 | M553: =(I553-J553)/J553 -> 0.55631399317406116 | N553: =(K553-I553)/K553 -> 0.11969111969111972 | O553: =(K553-L553)/L553 -> 0.21028037383177556 | P553: 4.54 | AA553: 1w | AB553: =(K553-P553)/K553 -> 0.1235521235521235 | AN553: 不宜入场(当前收缩幅度不够,应观察1w) | AO553: 44582
A554: 600025.SH | B554: 华能水电 | C554: 46.299999999999997 | D554: 0.27 | E554: 6.1299999999999999 | F554: 6.21 | G554: 6.3399999999999999 | I554: 6.1600000000000001 | AN554: 不宜入场(当前股价小于150日均线,应观察2w) | AO554: 44582
A555: 002544.SZ | B555: 杰赛科技 | C555: 46.22 | D555: 0.19 | E555: 18.780000000000001 | F555: 19.91 | G555: 23.149999999999999 | I555: 21.93 | AN555: 不宜入场(当前股价小于50日均线,应观察1w) | AO555: 44582
A556: 603505.SH | B556: 金石资源 | C556: 46.200000000000003 | D556: 0.55 | E556: 33.799999999999997 | F556: 35.659999999999997 | G556: 37.509999999999998 | I556: 30.989999999999998 | AN556: 不宜入场(当前股价小于200日均线,应观察4w) | AO556: 44582
A557: 600283.SH | B557: 钱江水利 | C557: 46.18 | D557: 0.42 | E557: 11.449999999999999 | F557: 11.539999999999999 | G557: 12.34 | I557: 13.23 | J557: 9.3699999999999992 | K557: 15.31 | L557: 10.43 | M557: =(I557-J557)/J557 -> 0.41195304162219865 | N557: =(K557-I557)/K557 -> 0.13585891574134554 | O557: =(K557-L557)/L557 -> 0.46788111217641426 | P557: 13.1 | AA557: 2w | AB557: =(K557-P557)/K557 -> 0.14435009797517967 | AN557: 不宜入场(当前收缩幅度不够,应观察1w) | AO557: 44582
A558: 002138.SZ | B558: 顺络电子 | C558: 46.18 | D558: 0.75 | E558: 35.810000000000002 | F558: 36.090000000000003 | G558: 36.649999999999999 | I558: 35.700000000000003 | AN558: 不宜入场(当前股价小于200日均线,应观察3w) | AO558: 44582
A559: 002328.SZ | B559: 新朋股份 | C559: 46.05 | D559: 0.29999999999999999 | E559: 5.4800000000000004 | F559: 5.6399999999999997 | G559: 6.0599999999999996 | I559: 5.8700000000000001 | AN559: 不宜入场(当前股价小于50日均线,应观察1w) | AO559: 44582
A560: 002045.SZ | B560: 国光电器 | C560: 46.04 | D560: 0.26 | E560: 12.359999999999999 | F560: 12.75 | G560: 13.59 | I560: 11.91 | AN560: 不宜入场(当前股价小于200日均线,应观察3w) | AO560: 44582
A561: 000801.SZ | B561: 四川九洲 | C561: 46 | D561: 0.11 | E561: 7.46 | F561: 7.7400000000000002 | G561: 8.5999999999999996 | I561: 8.5099999999999998 | AN561: 不宜入场(当前股价小于50日均线,应观察1w) | AO561: 44582
A562: 000920.SZ | B562: 沃顿科技 | C562: 46 | D562: 0.24 | E562: 9.1699999999999999 | F562: 9.5199999999999996 | G562: 10.470000000000001 | I562: 9.9700000000000006 | AN562: 不宜入场(当前股价小于50日均线,应观察1w) | AO562: 44582
A563: 601005.SH | B563: 重庆钢铁 | C563: 45.83 | D563: 0.32 | E563: 2.2400000000000002 | F563: 2.2599999999999998 | G563: 2.1600000000000001 | AN563: 不宜入场(50日均线小于200日均线,应观察4w) | AO563: 44582
A564: 605055.SH | B564: 迎丰股份 | C564: 45.67 | D564: 0.14 | E564: 9.0600000000000005 | F564: 8.6400000000000006 | AN564: 不宜入场(150日均线小于200日均线,应观察6w) | AO564: 44582
A565: 601038.SH | B565: 一拖股份 | C565: 45.65 | D565: 0.59999999999999998 | E565: 13.449999999999999 | F565: 13.6 | G565: 13.83 | I565: 13.41 | AN565: 不宜入场(当前股价小于200日均线,应观察3w) | AO565: 44582
A566: 002907.SZ | B566: 华森制药 | C566: 45.37 | D566: 0.22 | E566: 13.199999999999999 | F566: 13.42 | G566: 14.94 | I566: 15.5 | J566: 10.27 | K566: 21.850000000000001 | L566: 11.27 | M566: =(I566-J566)/J566 -> 0.50925024342745873 | N566: =(K566-I566)/K566 -> 0.29061784897025178 | O566: =(K566-L566)/L566 -> 0.93877551020408179 | AN566: 不宜入场(当前股价距离最高点距离过大，面临巨大抛压,应观察2w) | AO566: 44582
A567: 603229.SH | B567: 奥翔药业 | C567: 45.34 | D567: 0.38 | E567: 32.039999999999999 | F567: 32.659999999999997 | G567: 35.810000000000002 | I567: 36.5 | J567: 23.98 | K567: 46.439999999999998 | L567: 39.450000000000003 | M567: =(I567-J567)/J567 -> 0.52210175145954962 | N567: =(K567-I567)/K567 -> 0.21403962101636517 | O567: =(K567-L567)/L567 -> 0.17718631178707209 | P567: 36.5 | AA567: 0w | AB567: =(K567-P567)/K567 -> 0.21403962101636517 | AN567: 不宜入场(当前收缩幅度不够,应观察2w) | AO567: 44582
A568: 603948.SH | B568: 建业股份 | C568: 45.200000000000003 | D568: 0.97 | E568: 25.48 | F568: 26.640000000000001 | G568: 28.649999999999999 | I568: 27.379999999999999 | AN568: 不宜入场(当前股价小于50日均线,应观察1w) | AO568: 44582
A569: 603989.SH | B569: 艾华集团 | C569: 45.18 | D569: 0.90000000000000002 | E569: 35.149999999999999 | F569: 36.090000000000003 | G569: 38.140000000000001 | I569: 35.859999999999999 | AN569: 不宜入场(当前股价小于150日均线,应观察2w) | AO569: 44582
A570: 601218.SH | B570: 吉鑫科技 | C570: 45.15 | D570: 0.14 | E570: 5.0199999999999996 | F570: 5.1900000000000004 | G570: 5.6399999999999997 | I570: 4.9900000000000002 | AN570: 不宜入场(当前股价小于200日均线,应观察3w) | AO570: 44582
A571: 000545.SZ | B571: 金浦钛业 | C571: 45.04 | D571: 0.16 | E571: 3.9900000000000002 | F571: 4.0800000000000001 | G571: 4.0800000000000001 | I571: 3.8700000000000001 | AN571: 不宜入场(当前股价小于200日均线,应观察3w) | AO571: 44582
A572: 000035.SZ | B572: 中国天楹 | C572: 44.96 | D572: 0.22 | E572: 5.0800000000000001 | F572: 5.2000000000000002 | G572: 5.6500000000000004 | I572: 5.54 | AN572: 不宜入场(当前股价小于50日均线,应观察1w) | AO572: 44582
A573: 603979.SH | B573: 金诚信 | C573: 44.96 | D573: 0.59 | E573: 19.670000000000002 | F573: 20.239999999999998 | G573: 21.120000000000001 | I573: 21.969999999999999 | J573: 10.93 | K573: 29.66 | L573: 20.219999999999999 | M573: =(I573-J573)/J573 -> 1.0100640439158279 | N573: =(K573-I573)/K573 -> 0.25927174645987866 | O573: =(K573-L573)/L573 -> 0.4668644906033631 | P573: 17.68 | Q573: 22.52 | R573: 19.870000000000001 | S573: 23.09 | T573: 20.670000000000002 | AA573: 17w | AB573: =(K573-P573)/K573 -> 0.40391099123398516 | AC573: =(Q573-R573)/Q573 -> 0.1176731793960923 | AD573: =(S573-T573)/S573 -> 0.10480727587700295 | AN573: 不宜入场(当前收缩幅度不够,应观察1w) | AO573: 44585
A574: 603936.SH | B574: 博敏电子 | C574: 44.89 | D574: 0.40000000000000002 | E574: 13.460000000000001 | F574: 13.84 | G574: 15.15 | I574: 15.85 | J574: 10.039999999999999 | K574: 17.890000000000001 | L574: 13.26 | M574: =(I574-J574)/J574 -> 0.57868525896414358 | N574: =(K574-I574)/K574 -> 0.11403018446059256 | O574: =(K574-L574)/L574 -> 0.34917043740573162 | P574: 14.34 | AA574: 3w | AB574: =(K574-P574)/K574 -> 0.19843487982112915 | AC574: =(Q574-R574)/Q574 -> #DIV/0! | AD574: =(S574-T574)/S574 -> #DIV/0! | AN574: 不宜入场(当前收缩幅度不够,应观察1w) | AO574: 44586
A575: 600452.SH | B575: 涪陵电力 | C575: 44.59 | D575: 0.67 | E575: 16.949999999999999 | F575: 17.559999999999999 | G575: 19.18 | I575: 17.289999999999999 | AN575: 不宜入场(当前股价小于150日均线,应观察2w) | AO575: 44582
A576: 000999.SZ | B576: 华润三九 | C576: 44.56 | D576: 1.78 | AO576: 44578
A577: 600268.SH | B577: 国电南自 | C577: 44.27 | D577: 0.13 | E577: 8.9800000000000004 | F577: 9.3399999999999999 | G577: 10.16 | I577: 9.1899999999999995 | AN577: 不宜入场(当前股价小于150日均线,应观察2w) | AO577: 44582
A578: 600075.SH | B578: 新疆天业 | C578: 44.24 | D578: 1.01 | AO578: 44578
A579: 600549.SH | B579: 厦门钨业 | C579: 44.12 | D579: 0.71 | E579: 23.079999999999998 | F579: 23.43 | G579: 22.949999999999999 | AN579: 不宜入场(50日均线小于200日均线,应观察4w) | AO579: 44582
A580: 600590.SH | B580: 泰豪科技 | C580: 44.08 | D580: 0.52 | E580: 7.2999999999999998 | F580: 7.5499999999999998 | G580: 7.9800000000000004 | I580: 7.3399999999999999 | AN580: 不宜入场(当前股价小于150日均线,应观察2w) | AO580: 44582
A581: 001227.SZ | B581: 兰州银行 | C581: 43.98 | D581: 0.21 | E581: 5.21 | F581: 5.2300000000000004 | G581: 5.3899999999999997 | I581: 6.4800000000000004 | J581: 4.2800000000000002 | K581: 7.5199999999999996 | L581: 4.2800000000000002 | M581: =(I581-J581)/J581 -> 0.5140186915887851 | N581: =(K581-I581)/K581 -> 0.13829787234042543 | O581: =(K581-L581)/L581 -> 0.75700934579439227 | P581: 6.4800000000000004 | AA581: 1w | AB581: =(K581-P581)/K581 -> 0.13829787234042543 | AN581: 不宜入场(当前收缩幅度不够,应观察1w) | AO581: 44585
A582: 603617.SH | B582: 君禾股份 | C582: 43.94 | D582: 0.41 | E582: 0.20999999999999999 | F582: 11.57 | G582: 12.609999999999999 | I582: 13.27 | AN582: 不宜入场(当前股价小于200日均线,应观察3w) | AO582: 44582
A583: 600202.SH | B583: 哈空调 | C583: 43.85 | D583: 0.14 | E583: 4.4699999999999998 | F583: 4.5700000000000003 | G583: 4.9400000000000004 | I583: 5.0800000000000001 | J583: 3.1000000000000001 | K583: 6.3300000000000001 | L583: 4.1500000000000004 | M583: =(I583-J583)/J583 -> 0.6387096774193548 | N583: =(K583-I583)/K583 -> 0.19747235387045814 | O583: =(K583-L583)/L583 -> 0.525301204819277 | P583: 4.9400000000000004 | AA583: 1w | AB583: =(K583-P583)/K583 -> 0.21958925750394939 | AN583: 不宜入场(当前收缩幅度不够,应观察2w) | AO583: 44582
A584: 000970.SZ | B584: 中科三环 | C584: 43.799999999999997 | D584: 0.19 | E584: 12.029999999999999 | F584: 12.48 | G584: 13.81 | I584: 13.300000000000001 | AN584: 不宜入场(当前股价小于50日均线,应观察1w) | AO584: 44582
A585: 000915.SZ | B585: 华特达因 | C585: 43.73 | D585: 1.36 | AO585: 44578
A586: 603558.SH | B586: 健盛集团 | C586: 43.68 | D586: 0.48 | E586: 10.17 | F586: 10.470000000000001 | G586: 11.33 | I586: 10.890000000000001 | AN586: 不宜入场(当前股价小于50日均线,应观察1w) | AO586: 44582
A587: 002371.SZ | B587: 北方华创 | C587: 43.24 | D587: 1.34 | AO587: 44578
A588: 000925.SZ | B588: 众合科技 | C588: 43.06 | D588: 0.20000000000000001 | E588: 8.2200000000000006 | F588: 8.4100000000000001 | G588: 8.8100000000000005 | I588: 8.6199999999999992 | AN588: 不宜入场(当前股价小于50日均线,应观察1w) | AO588: 44582
A589: 002402.SZ | B589: 和而泰 | C589: 42.98 | D589: 0.48 | E589: 23.98 | F589: 24.469999999999999 | G589: 25.899999999999999 | I589: 25.149999999999999 | AN589: 不宜入场(当前股价小于150日均线,应观察3w) | AO589: 44582
A590: 002817.SZ | B590: 黄山胶囊 | C590: 42.96 | D590: 0.20000000000000001 | E590: 10.1 | F590: 10.25 | G590: 10.779999999999999 | I590: 10.789999999999999 | J590: 7.3399999999999999 | K590: 12.41 | L590: 8.6899999999999995 | M590: =(I590-J590)/J590 -> 0.47002724795640316 | N590: =(K590-I590)/K590 -> 0.13053988718775189 | O590: =(K590-L590)/L590 -> 0.42807825086306106 | P590: 10.33 | AA590: 3w | AB590: =(K590-P590)/K590 -> 0.16760676873489122 | AN590: 不宜入场(当前收缩幅度不够,应观察1w) | AO590: 44582
A591: 603393.SH | B591: 新天然气 | C591: 42.71 | D591: 2.41 | E591: 24.210000000000001 | F591: 24.989999999999998 | G591: 25.559999999999999 | I591: 22.52 | AN591: 不宜入场(当前股价小于200日均线,应观察3w) | AO591: 44582
A592: 600997.SH | B592: 开滦股份 | C592: 42.69 | D592: 1.01 | AO592: 44578
A593: 002004.SZ | B593: 华邦健康 | C593: 42.69 | D593: 0.26 | E593: 6.5499999999999998 | F593: 6.7000000000000002 | G593: 7.0199999999999996 | I593: 6.6500000000000004 | AN593: 不宜入场(当前股价小于150日均线,应观察3w) | AO593: 44582
A594: 603687.SH | B594: 大胜达 | C594: 42.56 | D594: 0.11 | E594: 9.7799999999999994 | F594: 10.08 | G594: 11.23 | I594: 12.43 | J594: 7.1600000000000001 | K594: 13.42 | L594: 11.09 | M594: =(I594-J594)/J594 -> 0.7360335195530725 | N594: =(K594-I594)/K594 -> 7.3770491803278701e-02 | O594: =(K594-L594)/L594 -> 0.21009918845807035 | P594: 12.06 | AA594: 1w | AB594: =(K594-P594)/K594 -> 0.10134128166915048 | AN594: 不宜入场(当前收缩幅度不够,应观察1w) | AO594: 44582
A595: 600740.SH | B595: 山西焦化 | C595: 42.41 | D595: 0.72 | E595: 6.2599999999999998 | F595: 6.4400000000000004 | G595: 6.5199999999999996 | I595: 6.5499999999999998 | J595: 4.0599999999999996 | K595: 12.220000000000001 | L595: 5.0199999999999996 | M595: =(I595-J595)/J595 -> 0.61330049261083752 | N595: =(K595-I595)/K595 -> 0.46399345335515552 | O595: =(K595-L595)/L595 -> 1.4342629482071716 | AN595: 不宜入场(当前股价距离最高点距离过大，面临巨大抛压,应观察2w) | AO595: 44582
A596: 600557.SH | B596: 康缘药业 | C596: 42.38 | D596: 0.36 | E596: 10.82 | F596: 10.93 | G596: 11.75 | I596: 12 | J596: 8.4000000000000004 | K596: 14.65 | L596: 10.09 | M596: =(I596-J596)/J596 -> 0.42857142857142849 | N596: =(K596-I596)/K596 -> 0.1808873720136519 | O596: =(K596-L596)/L596 -> 0.45193260654112988 | P596: 11.9 | AA596: 1w | AB596: =(K596-P596)/K596 -> 0.18771331058020477 | AN596: 不宜入场(当前收缩幅度不够,应观察1w) | AO596: 44582
A597: 600110.SH | B597: 诺德股份 | C597: 42.32 | D597: 0.23 | E597: 15.82 | F597: 16.75 | G597: 17.100000000000001 | I597: 13.66 | AN597: 不宜入场(当前股价小于200日均线,应观察5w) | AO597: 44582
A598: 000969.SZ | B598: 安泰科技 | C598: 42.28 | D598: 0.15 | E598: 9.2699999999999996 | F598: 9.5600000000000005 | G598: 10.15 | I598: 9.2599999999999998 | AN598: 不宜入场(当前股价小于200日均线,应观察5w) | AO598: 44582
A599: 002334.SZ | B599: 英威腾 | C599: 42.27 | D599: 0.22 | E599: 6.8399999999999999 | F599: 7.0599999999999996 | G599: 7.46 | I599: 7.0499999999999998 | AN599: 不宜入场(当前股价小于150日均线,应观察3w) | AO599: 44582
A600: 002917.SZ | B600: 金奥博 | C600: 42.16 | D600: 0.17 | E600: 9.0800000000000001 | F600: 9.2699999999999996 | G600: 10.42 | I600: 13.949999999999999 | J600: 7.3799999999999999 | K600: 15.23 | L600: 8.3599999999999994 | M600: =(I600-J600)/J600 -> 0.89024390243902429 | N600: =(K600-I600)/K600 -> 8.4044648719632381e-02 | O600: =(K600-L600)/L600 -> 0.82177033492822982 | AA600: 0w | AN600: 不宜入场(当前时间周期太短,应观察1w) | AO600: 44582
A601: 603037.SH | B601: 凯众股份 | C601: 42.09 | D601: 0.62 | E601: 18.32 | F601: 18.859999999999999 | G601: 20.379999999999999 | I601: 19.18 | AN601: 不宜入场(当前股价小于50日均线,应观察1w) | AO601: 44582
A602: 600307.SH | B602: 酒钢宏兴 | C602: 42.04 | D602: 0.40000000000000002 | E602: 2.3300000000000001 | F602: 2.3599999999999999 | G602: 2.29 | AN602: 不宜入场(50日均线小于200日均线,应观察6w) | AO602: 44582
A603: 603289.SH | B603: 泰瑞机器 | C603: 42.02 | D603: 0.47 | E603: 9.1099999999999994 | F603: 9.2699999999999996 | G603: 9.5899999999999999 | I603: 9.0999999999999996 | AN603: 不宜入场(当前股价小于200日均线,应观察3w) | AO603: 44582
A604: 600566.SH | B604: 济川药业 | C604: 41.899999999999999 | D604: 1.43 | AO604: 44578
A605: 600982.SH | B605: 宁波能源 | C605: 41.87 | D605: 0.14 | E605: 3.9900000000000002 | F605: 4.0800000000000001 | G605: 4.3799999999999999 | I605: 4.3700000000000001 | AN605: 不宜入场(当前股价小于50日均线,应观察1w) | AO605: 44582
A606: 603567.SH | B606: 珍宝岛 | C606: 41.82 | D606: 0.29 | E606: 15.460000000000001 | F606: 15.52 | G606: 15.08 | AN606: 不宜入场(50日均线小于200日均线,应观察6w) | AO606: 44582
A607: 600251.SH | B607: 冠农股份 | C607: 41.78 | D607: 0.29 | E607: 8.8300000000000001 | F607: 9 | G607: 9.0500000000000007 | I607: 8.3499999999999996 | AN607: 不宜入场(当前股价小于200日均线,应观察3w) | AO607: 44582
A608: 002266.SZ | B608: 浙富控股 | C608: 41.69 | D608: 0.35 | E608: 6.3200000000000003 | F608: 6.4500000000000002 | G608: 6.7400000000000002 | I608: 6.2800000000000002 | AN608: 不宜入场(当前股价小于200日均线,应观察3w) | AO608: 44582
A609: 600475.SH | B609: 华光环能 | C609: 41.63 | D609: 0.69999999999999996 | E609: 11.08 | F609: 11.17 | G609: 11.44 | I609: 10.800000000000001 | AN609: 不宜入场(当前股价小于200日均线,应观察3w) | AO609: 44582
A610: 002273.SZ | B610: 水晶光电 | C610: 41.58 | D610: 0.28 | E610: 14.83 | F610: 15.369999999999999 | G610: 16.530000000000001 | I610: 15.789999999999999 | AN610: 不宜入场(当前股价小于50日均线,应观察1w) | AO610: 44582
A611: 603829.SH | B611: 洛凯股份 | C611: 41.32 | D611: 0.32 | E611: 11.390000000000001 | F611: 11.550000000000001 | G611: 12.31 | I611: 12.57 | J611: 9.2599999999999998 | K611: 16.149999999999999 | L611: 11.5 | M611: =(I611-J611)/J611 -> 0.35745140388768903 | N611: =(K611-I611)/K611 -> 0.2216718266253869 | O611: =(K611-L611)/L611 -> 0.40434782608695641 | P611: 12.32 | AA611: 0w | AB611: =(K611-P611)/K611 -> 0.23715170278637762 | AN611: 不宜入场(当前收缩幅度不够,应观察2w) | AO611: 44582
A612: 603355.SH | B612: 莱克电气 | C612: 41.32 | D612: 0.83 | E612: 28.620000000000001 | F612: 28.879999999999999 | G612: 29.23 | I612: 27.149999999999999 | AN612: 不宜入场(当前股价小于200日均线,应观察3w) | AO612: 44582
A613: 600330.SH | B613: 天通股份 | C613: 41.27 | D613: 0.35 | E613: 12.51 | F613: 13.18 | G613: 14.84 | I613: 13.42 | AN613: 不宜入场(当前股价小于50日均线,应观察1w) | AO613: 44582
A614: 002952.SZ | B614: 亚世光电 | C614: 41.27 | D614: 0.23 | E614: 13.82 | F614: 13.869999999999999 | G614: 14.949999999999999 | I614: 17.100000000000001 | J614: 11.640000000000001 | K614: 21.850000000000001 | L614: 12.85 | M614: =(I614-J614)/J614 -> 0.46907216494845366 | N614: =(K614-I614)/K614 -> 0.21739130434782608 | O614: =(K614-L614)/L614 -> 0.70038910505836594 | P614: 17.100000000000001 | AA614: 0w | AB614: =(K614-P614)/K614 -> 0.21739130434782608 | AN614: 不宜入场(当前收缩幅度不够,应观察2w) | AO614: 44582
A615: 002042.SZ | B615: 华孚时尚 | C615: 41.16 | D615: 0.25 | E615: 4.6799999999999997 | F615: 4.6699999999999999 | AN615: 不宜入场(150日均线小于200日均线,应观察8w) | AO615: 44582
A616: 000719.SZ | B616: 中原传媒 | C616: 41.08 | D616: 0.62 | E616: 7.2599999999999998 | F616: 7.3600000000000003 | G616: 8 | I616: 8.3499999999999996 | J616: 6.1699999999999999 | K616: 10.199999999999999 | L616: 6.9699999999999998 | M616: =(I616-J616)/J616 -> 0.35332252836304695 | N616: =(K616-I616)/K616 -> 0.18137254901960781 | O616: =(K616-L616)/L616 -> 0.46341463414634143 | P616: 8.3300000000000001 | AA616: 0w | AB616: =(K616-P616)/K616 -> 0.18333333333333326 | AN616: 不宜入场(当前收缩幅度不够,应观察1w) | AO616: 44582
A617: 002183.SZ | B617: 怡亚通 | C617: 41.05 | D617: 0.19 | E617: 5.96 | F617: 6.0999999999999996 | G617: 6.2400000000000002 | I617: 5.7199999999999998 | AN617: 不宜入场(当前股价小于200日均线,应观察3w) | AO617: 44582
A618: 003025.SZ | B618: 思进智能 | C618: 41.03 | D618: 0.79 | E618: 29.809999999999999 | F618: 30.539999999999999 | G618: 32.549999999999997 | I618: 30.600000000000001 | AN618: 不宜入场(当前股价小于50日均线,应观察1w) | AO618: 44582
A619: 603365.SH | B619: 水星家纺 | C619: 41.01 | D619: 0.94 | E619: 15.57 | F619: 15.800000000000001 | G619: 16.59 | I619: 16.899999999999999 | AN619: 不宜入场(当前股价小于50日均线,应观察1w) | AO619: 44582
A620: 603628.SH | B620: 清源股份 | C620: 41.01 | D620: 0.17 | E620: 11.859999999999999 | F620: 12.32 | G620: 13.130000000000001 | I620: 11.59 | AN620: 不宜入场(当前股价小于200日均线,应观察3w) | AO620: 44582
A621: 600509.SH | B621: 天富能源 | C621: 40.87 | D621: 0.10000000000000001 | E621: 6.7599999999999998 | F621: 6.7000000000000002 | AN621: 不宜入场(150日均线小于200日均线,应观察8w) | AO621: 44582
A622: 605028.SH | B622: 世茂能源 | C622: 40.86 | D622: 0.99 | E622: 23.16 | F622: 23.57 | G622: 23.920000000000002 | I622: 21.899999999999999 | AN622: 不宜入场(当前股价小于200日均线,应观察3w) | AO622: 44582
A623: 600493.SH | B623: 凤竹纺织 | C623: 40.74 | D623: 0.27 | E623: 5.4199999999999999 | F623: 5.5499999999999998 | G623: 6.0499999999999998 | I623: 5.9199999999999999 | AN623: 不宜入场(当前股价小于50日均线,应观察1w) | AO623: 44582
A624: 002318.SZ | B624: 久立特材 | C624: 40.700000000000003 | D624: 0.64 | E624: 14.44 | F624: 14.84 | G624: 16.350000000000001 | I624: 17.899999999999999 | J624: 10.18 | K624: 19.100000000000001 | L624: 14.869999999999999 | M624: =(I624-J624)/J624 -> 0.75834970530451862 | N624: =(K624-I624)/K624 -> 6.2827225130890202e-02 | O624: =(K624-L624)/L624 -> 0.28446536650975135 | P624: 17.059999999999999 | AA624: 0w | AB624: =(K624-P624)/K624 -> 0.10680628272251322 | AN624: 不宜入场(当前收缩幅度不够,应观察1w) | AO624: 44582
A625: 600803.SH | B625: 新奥股份 | C625: 40.55 | D625: 1.15 | AO625: 44578
A626: 000586.SZ | B626: 汇源通信 | C626: 40.51 | D626: 0.12 | E626: 8.4000000000000004 | F626: 8.5899999999999999 | G626: 9 | I626: 9.0399999999999991 | J626: 5.9699999999999998 | K626: 11.029999999999999 | L626: 8.5600000000000005 | M626: =(I626-J626)/J626 -> 0.51423785594639859 | N626: =(K626-I626)/K626 -> 0.1804170444242974 | O626: =(K626-L626)/L626 -> 0.28855140186915873 | P626: 8.0199999999999996 | AA626: 13w | AB626: =(K626-P626)/K626 -> 0.27289211242067091 | AC626: =(Q626-R626)/Q626 -> #DIV/0! | AD626: =(S626-T626)/S626 -> #DIV/0! | AN626: 不宜入场(当前收缩幅度不够,应观察2w) | AO626: 44586
A627: 603809.SH | B627: 豪能股份 | C627: 40.43 | D627: 0.58 | E627: 17.66 | F627: 18.289999999999999 | G627: 19.960000000000001 | I627: 21.190000000000001 | J627: 11.99 | K627: 24.600000000000001 | L627: 16.07 | M627: =(I627-J627)/J627 -> 0.76730608840700587 | N627: =(K627-I627)/K627 -> 0.13861788617886178 | O627: =(K627-L627)/L627 -> 0.53080273802115752 | P627: 18.68 | AA627: 6w | AB627: =(K627-P627)/K627 -> 0.24065040650406511 | AN627: 不宜入场(当前收缩幅度不够,应观察2w) | AO627: 44582
A628: 600060.SH | B628: 海信视像 | C628: 40.43 | D628: 0.48 | E628: 13 | F628: 13.220000000000001 | G628: 13.949999999999999 | I628: 14.34 | J628: 10.609999999999999 | K628: 17.629999999999999 | L628: 10.99 | M628: =(I628-J628)/J628 -> 0.35155513666352506 | N628: =(K628-I628)/K628 -> 0.18661372660238226 | O628: =(K628-L628)/L628 -> 0.60418562329390346 | P628: 10.92 | Q628: 14.4 | R628: 12.699999999999999 | S628: 14.27 | T628: 13.1 | AA628: 25w | AB628: =(K628-P628)/K628 -> 0.3806012478729438 | AC628: =(Q628-R628)/Q628 -> 0.11805555555555562 | AD628: =(S628-T628)/S628 -> 8.1990189208128936e-02 | AN628: 不宜入场(当前收缩幅度不够,应观察2w) | AO628: 44582
A629: 002129.SZ | B629: 中环股份 | C629: 40.399999999999999 | D629: 0.91 | E629: 40.619999999999997 | F629: 41.829999999999998 | G629: 41.960000000000001 | I629: 40.909999999999997 | AN629: 不宜入场(当前股价小于150日均线,应观察2w) | AO629: 44582
A630: 002166.SZ | B630: 莱茵生物 | C630: 40.25 | D630: 0.15 | E630: 8.5500000000000007 | F630: 8.6699999999999999 | G630: 9.1899999999999995 | I630: 9.1899999999999995 | J630: 6.9000000000000004 | K630: 10.640000000000001 | L630: 8.6500000000000004 | M630: =(I630-J630)/J630 -> 0.33188405797101433 | N630: =(K630-I630)/K630 -> 0.13627819548872189 | O630: =(K630-L630)/L630 -> 0.23005780346820812 | P630: 9 | AA630: 1w | AB630: =(K630-P630)/K630 -> 0.15413533834586471 | AN630: 不宜入场(当前收缩幅度不够,应观察1w) | AO630: 44582
A631: 603585.SH | B631: 苏利股份 | C631: 40.21 | D631: 0.77 | E631: 16.649999999999999 | F631: 17 | G631: 18.530000000000001 | I631: 19.800000000000001 | J631: 13.720000000000001 | K631: 21.359999999999999 | L631: 16.899999999999999 | M631: =(I631-J631)/J631 -> 0.4431486880466472 | N631: =(K631-I631)/K631 -> 7.3033707865168482e-02 | O631: =(K631-L631)/L631 -> 0.26390532544378703 | P631: 19.670000000000002 | AA631: 1w | AB631: =(K631-P631)/K631 -> 7.9119850187265819e-02 | AN631: 不宜入场(当前收缩幅度不够,应观察1w) | AO631: 44582
A632: 002105.SZ | B632: 信隆健康 | C632: 40.19 | D632: 0.56 | E632: 8.9900000000000002 | F632: 9.1699999999999999 | G632: 9.7699999999999996 | I632: 9.6400000000000006
A633: 000837.SZ | B633: 秦川机床 | C633: 40.14 | D633: 0.36 | E633: 9.6199999999999992 | F633: 9.9100000000000001 | G633: 10.16 | I633: 9.1600000000000001 | AN633: 不宜入场(当前股价小于200日均线,应观察2w) | AO633: 44582
A634: 002971.SZ | B634: 和远气体 | C634: 40.11 | D634: 0.36 | E634: 19.93 | F634: 20.300000000000001 | G634: 21.890000000000001 | I634: 20.699999999999999 | AN634: 不宜入场(当前股价小于150日均线,应观察2w) | AO634: 44582
A635: 603848.SH | B635: 好太太 | C635: 40.11 | D635: 0.54 | E635: 13.109999999999999 | F635: 13.26 | G635: 13.960000000000001 | I635: 14.42 | J635: 10.73 | K635: 16.140000000000001 | L635: 14.94 | M635: =(I635-J635)/J635 -> 0.34389561975768868 | N635: =(K635-I635)/K635 -> 0.1065675340768278 | O635: =(K635-L635)/L635 -> 8.0321285140562318e-02 | P635: 14.390000000000001 | AA635: 1w | AB635: =(K635-P635)/K635 -> 0.1084262701363073 | AN635: 不宜入场(当前收缩幅度不够,应观察1w) | AO635: 44582
A636: 002573.SZ | B636: 清新环境 | C636: 40.04 | D636: 0.27 | E636: 6.1399999999999997 | F636: 6.29 | G636: 6.8600000000000003 | I636: 6.7800000000000002 | AN636: 不宜入场(当前股价小于50日均线,应观察1w) | AO636: 44582
A637: 603139.SH | B637: 康惠制药 | C637: 39.97 | D637: 0.22 | E637: 18.440000000000001 | F637: 18.850000000000001 | G637: 20.300000000000001 | I637: 18.329999999999998 | AN637: 不宜入场(当前股价小于200日均线,应观察3w) | AO637: 44582
A638: 002443.SZ | B638: 金洲管道 | C638: 39.899999999999999 | D638: 0.55 | E638: 6.6900000000000004 | F638: 6.7699999999999996 | G638: 7.5999999999999996 | I638: 8.1099999999999994 | J638: 5.4199999999999999 | K638: 10.140000000000001 | L638: 5.7300000000000004 | M638: =(I638-J638)/J638 -> 0.49630996309963094 | N638: =(K638-I638)/K638 -> 0.20019723865877723 | O638: =(K638-L638)/L638 -> 0.76963350785340312 | P638: 7.7000000000000002 | AA638: 2w | AB638: =(K638-P638)/K638 -> 0.24063116370808682 | AN638: 不宜入场(当前收缩幅度不够,应观察2w) | AO638: 44582
A639: 000850.SZ | B639: 华茂股份 | C639: 39.83 | D639: 0.36 | E639: 4.0999999999999996 | F639: 4.1900000000000004 | G639: 4.5599999999999996 | I639: 4.7599999999999998 | J639: 3.29 | K639: 5.1200000000000001 | L639: 4.3099999999999996 | M639: =(I639-J639)/J639 -> 0.4468085106382978 | N639: =(K639-I639)/K639 -> 7.0312500000000056e-02 | O639: =(K639-L639)/L639 -> 0.18793503480278437 | P639: 4.75 | AA639: 1w | AB639: =(K639-P639)/K639 -> 7.2265625000000014e-02 | AN639: 不宜入场(当前收缩幅度不够,应观察1w) | AO639: 44582
A640: 002777.SZ | B640: 久远银海 | C640: 39.78 | D640: 0.39 | E640: 20.649999999999999 | F640: 21.170000000000002 | G640: 23.350000000000001 | I640: 23.879999999999999 | J640: 15.91 | K640: 28.949999999999999 | L640: 18.300000000000001 | M640: =(I640-J640)/J640 -> 0.50094280326838458 | N640: =(K640-I640)/K640 -> 0.1751295336787565 | O640: =(K640-L640)/L640 -> 0.58196721311475397 | P640: 23.52 | AA640: 2w | AB640: =(K640-P640)/K640 -> 0.18756476683937823 | AN640: 不宜入场(当前收缩幅度不够,应观察1w) | AO640: 44582
A641: 603320.SH | B641: 迪贝电气 | C641: 39.72 | D641: 0.49 | E641: 12.42 | F641: 12.69 | G641: 13.24 | I641: 12.960000000000001 | AN641: 不宜入场(当前股价小于50日均线,应观察1w) | AO641: 44582
A642: 603109.SH | B642: 神驰机电 | C642: 39.67 | D642: 1.01 | AO642: 44578
A643: 002908.SZ | B643: 德生科技 | C643: 39.57 | D643: 0.19 | E643: 15.619999999999999 | F643: 15.890000000000001 | G643: 17 | I643: 20.140000000000001 | J643: 12.5 | K643: 23.489999999999998 | L643: 14.529999999999999 | M643: =(I643-J643)/J643 -> 0.61120000000000008 | N643: =(K643-I643)/K643 -> 0.14261387824606206 | O643: =(K643-L643)/L643 -> 0.61665519614590503 | P643: 18.600000000000001 | AA643: 1w | AB643: =(K643-P643)/K643 -> 0.2081736909323115 | AN643: 不宜入场(当前收缩幅度不够,应观察2w) | AO643: 44582
A644: 002130.SZ | B644: 沃尔核材 | C644: 39.54 | D644: 0.35 | E644: 7.5999999999999996 | F644: 7.7599999999999998 | G644: 7.9800000000000004 | I644: 7.4299999999999997 | AN644: 不宜入场(当前股价小于200日均线,应观察3w) | AO644: 44582
A645: 605319.SH | B645: 无锡振华 | C645: 39.52 | D645: 0.38 | E645: 16.399999999999999 | F645: 16.449999999999999 | G645: 17.02 | I645: 18.73 | J645: 13.460000000000001 | K645: 26.039999999999999 | L645: 13.460000000000001 | M645: =(I645-J645)/J645 -> 0.39153046062407126 | N645: =(K645-I645)/K645 -> 0.28072196620583711 | O645: =(K645-L645)/L645 -> 0.93462109955423456 | AN645: 不宜入场(当前股价距离最高点距离过大，面临巨大抛压,应观察2w) | AO645: 44582
A646: 603001.SH | B646: 奥康国际 | C646: 39.52 | D646: 0.12 | E646: 8.2599999999999998 | F646: 8.4100000000000001 | G646: 8.7599999999999998 | I646: 8.7899999999999991 | J646: 6.0700000000000003 | K646: 10.800000000000001 | L646: 7.4100000000000001 | M646: =(I646-J646)/J646 -> 0.44810543657331114 | N646: =(K646-I646)/K646 -> 0.18611111111111125 | O646: =(K646-L646)/L646 -> 0.45748987854251016 | P646: 7.0199999999999996 | Q646: 9.4199999999999999 | R646: 8.4100000000000001 | S646: 9.8599999999999994 | T646: 8.7599999999999998 | AA646: 21w | AB646: =(K646-P646)/K646 -> 0.35000000000000009 | AC646: =(Q646-R646)/Q646 -> 0.10721868365180465 | AD646: =(S646-T646)/S646 -> 0.11156186612576062
A647: 600422.SH | B647: 昆药集团 | C647: 39.44 | D647: 0.57 | E647: 9.2599999999999998 | F647: 9.4100000000000001 | G647: 10.09 | I647: 10.300000000000001 | J647: 7.4100000000000001 | K647: 13.199999999999999 | L647: 8.3900000000000006 | M647: =(I647-J647)/J647 -> 0.39001349527665324 | N647: =(K647-I647)/K647 -> 0.21969696969696961 | O647: =(K647-L647)/L647 -> 0.57330154946364698 | P647: 10.27 | AA647: 1w | AB647: =(K647-P647)/K647 -> 0.22196969696969696 | AN647: 不宜入场(当前收缩幅度不够,应观察2w) | AO647: 44582
A648: 600704.SH | B648: 物产中大 | C648: 39.34 | D648: 0.61 | E648: 6.0499999999999998 | F648: 6.1399999999999997 | G648: 6.0800000000000001 | AN648: 不宜入场(50日均线小于150日均线,应观察3w) | AO648: 44582
A649: 002412.SZ | B649: 汉森制药 | C649: 39.34 | D649: 0.23 | E649: 5.9500000000000002 | F649: 5.9900000000000002 | G649: 6.4199999999999999 | I649: 6.6799999999999997 | J649: 4.8600000000000003 | K649: 9.5800000000000001 | L649: 5.21 | M649: =(I649-J649)/J649 -> 0.37448559670781878 | N649: =(K649-I649)/K649 -> 0.30271398747390399 | O649: =(K649-L649)/L649 -> 0.83877159309021121 | P649: 6.6399999999999997 | AN649: 不宜入场(当前股价距离最高点距离过大，面临巨大抛压,应观察2w) | AO649: 44582
A650: 002603.SZ | B650: 以岭药业 | C650: 39.29 | D650: 0.73 | E650: 18.25 | F650: 18.449999999999999 | G650: 20 | I650: 22.640000000000001 | J650: 14.18 | K650: 27.920000000000002 | L650: 16.440000000000001 | M650: =(I650-J650)/J650 -> 0.59661495063469683 | N650: =(K650-I650)/K650 -> 0.1891117478510029 | O650: =(K650-L650)/L650 -> 0.69829683698296829 | P650: 22.510000000000002 | AA650: 1w | AB650: =(K650-P650)/K650 -> 0.19376790830945559 | AN650: 不宜入场(当前收缩幅度不够,应观察1w) | AO650: 44582
A651: 603126.SH | B651: 中材节能 | C651: 39.16 | D651: 0.17 | E651: 9.0199999999999996 | F651: 8.8499999999999996 | AN651: 不宜入场(150日均线小于200日均线,应观察8w) | AO651: 44582
A652: 002931.SZ | B652: 锋龙股份 | C652: 39.14 | D652: 0.35 | E652: 13.4 | F652: 13.720000000000001 | G652: 14.31 | I652: 14.039999999999999 | AN652: 不宜入场(当前股价小于50日均线,应观察1w) | AO652: 44582
A653: 600072.SH | B653: 中船科技 | C653: 39.05 | D653: 0.12 | E653: 13.300000000000001 | F653: 13.68 | G653: 15.050000000000001 | I653: 15.550000000000001 | J653: 10.44 | K653: 19.5 | L653: 14.449999999999999 | M653: =(I653-J653)/J653 -> 0.48946360153256718 | N653: =(K653-I653)/K653 -> 0.20256410256410254 | O653: =(K653-L653)/L653 -> 0.34948096885813157 | P653: 15.52 | AA653: 1w | AB653: =(K653-P653)/K653 -> 0.20410256410256414 | AN653: 不宜入场(当前收缩幅度不够,应观察2w) | AO653: 44582